epNum,airDate,extra_info,round_name,coord,category,order,value,daily_double,question,answer,correctAttempts,wrongAttempts
1060,1989-03-24,,Jeopardy,"(1, 1)",FAMOUS WOMEN,13,"(100,)",False,This American Indian was only about 22 when she died in England in 1617,Pocahontas,1,0
1060,1989-03-24,,Jeopardy,"(2, 1)",SONG LYRICS,1,"(100,)",False,"""Evita"" told this city, ""Stand back, you oughta know whatcha gonna get in me""",Buenos Aires,1,0
1060,1989-03-24,,Jeopardy,"(3, 1)",U.S. CITIES,3,"(100,)",False,"Covering 3,108 square miles, this Alaskan capital is the nation's largest in area",Juneau,1,1
1060,1989-03-24,,Jeopardy,"(4, 1)",SPORTS,5,"(100,)",False,"In soccer, it's nudging the ball forward with your feet; in basketball, it's bouncing it with your hands",dribbling,1,0
1060,1989-03-24,,Jeopardy,"(5, 1)",SEWING,19,"(100,)",False,"The tension control on your machine regulates the tension of this, not your nerves",thread,1,0
1060,1989-03-24,,Jeopardy,"(6, 1)","""LING"" O",20,"(100,)",False,You can use one of these to hold up a broken arm or knock down Goliath,sling,1,0
1060,1989-03-24,,Jeopardy,"(1, 2)",FAMOUS WOMEN,14,"(200,)",False,"This author, the wife of an aviator, published 5 volumes of her diaries & letters",Anne Lindbergh,1,0
1060,1989-03-24,,Jeopardy,"(2, 2)",SONG LYRICS,2,"(200,)",False,"Pecos Bill was ""the toughest critter west of"" this San Antonio site",the Alamo,1,0
1060,1989-03-24,,Jeopardy,"(3, 2)",U.S. CITIES,4,"(500,)",True,"""Energy Turns the World"" was the theme of the 1982 World's Fair held in this Tennessee city",Knoxville,1,0
1060,1989-03-24,,Jeopardy,"(4, 2)",SPORTS,9,"(200,)",False,1st recorded shooting match took place in 1472 in this country known for avoiding wars,Switzerland,1,0
1060,1989-03-24,,Jeopardy,"(5, 2)",SEWING,27,"(200,)",False,A skirt marker is usually used to measure this,hem,1,0
1060,1989-03-24,,Jeopardy,"(6, 2)","""LING"" O",21,"(200,)",False,"Circus siblings Albert, Otto, Alfred, Charles & John",the Ringling Brothers,1,0
1060,1989-03-24,,Jeopardy,"(1, 3)",FAMOUS WOMEN,15,"(300,)",False,"Take our advice; these famous twins were born on the 4th of July in 1918 in Sioux City, Iowa","""Dear Abby"" & ""Ann Landers""",1,0
1060,1989-03-24,,Jeopardy,"(2, 3)",SONG LYRICS,18,"(300,)",False,"""Buffalo gals, won't you come out tonight, and dance by"" this",the light of the moon,1,0
1060,1989-03-24,,Jeopardy,"(3, 3)",U.S. CITIES,6,"(300,)",False,"The New York State Museum, the nation's oldest state museum, is located in this city",Albany,0,3
1060,1989-03-24,,Jeopardy,"(4, 3)",SPORTS,10,"(300,)",False,"Of hurling, curling or purling, the one that uses a stick similar to a hockey stick",hurling,1,0
1060,1989-03-24,,Jeopardy,"(5, 3)",SEWING,28,"(300,)",False,The zigzag stitch is commonly used to keep some fabrics from doing this,fraying (unraveling),1,0
1060,1989-03-24,,Jeopardy,"(6, 3)","""LING"" O",22,"(300,)",False,"Phonology, syntax & semantics are all part of this science",linguistics,1,0
1060,1989-03-24,,Jeopardy,"(1, 4)",FAMOUS WOMEN,16,"(400,)",False,"Gary Morton, who's married to her, says, ""Show business is my wife""",Lucille Ball,1,0
1060,1989-03-24,,Jeopardy,"(2, 4)",SONG LYRICS,25,"(400,)",False,"Broadway song in which Sally sings, ""I made my mind up, back in Chelsea, when I go I'm going like Elsie""","""Cabaret""",1,0
1060,1989-03-24,,Jeopardy,"(3, 4)",U.S. CITIES,7,"(400,)",False,"North Dakota's largest city, it was named for one of the founders of a famous frontier stage line",Fargo,1,1
1060,1989-03-24,,Jeopardy,"(4, 4)",SPORTS,11,"(400,)",False,"He won the title of ""Prom King"" in high school, & in 1980 won 5 gold medals for speed skating",Eric Heiden,1,0
1060,1989-03-24,,Jeopardy,"(5, 4)",SEWING,29,"(400,)",False,A tailor's ham is not his lunch but a stuffed cushion used for this purpose,to help him out when he\'s pressing,0,3
1060,1989-03-24,,Jeopardy,"(6, 4)","""LING"" O",23,"(400,)",False,First name of actors Hayden & Holloway,Sterling,1,0
1060,1989-03-24,,Jeopardy,"(1, 5)",FAMOUS WOMEN,17,"(500,)",False,"She made her 1st appearance on ""The Tonight Show"" in 1971 with an elephant who painted Johnny's pants",Joan Embry (of the San Diego Zoo),1,0
1060,1989-03-24,,Jeopardy,"(2, 5)",SONG LYRICS,26,"(500,)",False,"Marlene Dietrich sang, ""Go see what"" these title guys ""will have and tell them I'm having the same""","""The Boys in the Back Room""",1,0
1060,1989-03-24,,Jeopardy,"(3, 5)",U.S. CITIES,8,"(500,)",False,"This Arizona university town has been called the ""Astronomy Capital of the World""",Tucson,1,0
1060,1989-03-24,,Jeopardy,"(4, 5)",SPORTS,12,"(500,)",False,Hit the telltale board on the bottom of the front wall in this sport's court & you'll lose a point,squash,1,1
1060,1989-03-24,,Jeopardy,"(5, 5)",SEWING,30,"(500,)",False,"Often decorative, it's one or more lines of stitching on the outside of the fabric",top stitching,1,0
1060,1989-03-24,,Jeopardy,"(6, 5)","""LING"" O",24,"(500,)",False,Only person to have won both the Nobel Prize for Chemistry & the Nobel Peace Prize,Linus Pauling,1,0
1060,1989-03-24,,Double Jeopardy,"(1, 1)","STARTS WITH ""P""",6,"(200,)",False,"French for ""miscellaneous mixture"", it's a favorite Jeopardy! category",potpourri,1,0
1060,1989-03-24,,Double Jeopardy,"(2, 1)",FICTION,15,"(200,)",False,"Dostoyevsky's last novel was the story of these ""Brothers""",Karamazov,1,0
1060,1989-03-24,,Double Jeopardy,"(3, 1)",FOOD,7,"(200,)",False,The hulled kernels of corn from which grits are made are called this,hominy,1,0
1060,1989-03-24,,Double Jeopardy,"(4, 1)",BEACHES,8,"(200,)",False,Largest national seashore entirely in 1 state is this state's Padre Island,Texas,1,0
1060,1989-03-24,,Double Jeopardy,"(5, 1)",BIOLOGY,13,"(200,)",False,Type 1 diabetes results when the body can't produce enough of this to process nutrients,insulin,1,0
1060,1989-03-24,,Double Jeopardy,"(6, 1)",KINGS NAMED LOUIS,1,"(200,)",False,This great king of the Franks was succeeded in 814 by his son Louis the Debonair a.k.a. The Pious,Charlemagne,0,3
1060,1989-03-24,,Double Jeopardy,"(1, 2)","STARTS WITH ""P""",14,"(400,)",False,"A conspiracy, a small piece of ground or the main story line in a novel",plot,1,0
1060,1989-03-24,,Double Jeopardy,"(2, 2)",FICTION,16,"(400,)",False,"She may have been a ""dame"", but you'd never say that about her famous character Miss Jane Marple",Agatha Christie,1,0
1060,1989-03-24,,Double Jeopardy,"(3, 2)",FOOD,17,"(400,)",False,"The feline on the box says, ""They're Gr-r-reat!""",Frosted Flakes,1,0
1060,1989-03-24,,Double Jeopardy,"(4, 2)",BEACHES,9,"(400,)",False,You can swim at Mauna Kea Beach miles from the volcano on the Kihola Coast of this island,Hawaii (the big island),1,0
1060,1989-03-24,,Double Jeopardy,"(5, 2)",BIOLOGY,22,"(400,)",False,"Since it came to the U.S. in the '30s, this disease has killed almost half the elms in the U.S.",Dutch elm disease,1,0
1060,1989-03-24,,Double Jeopardy,"(6, 2)",KINGS NAMED LOUIS,2,"(400,)",False,In 1137 the future Louis VII married this 15-year-old heiress of Aquitaine,Eleanor of Aquitaine,1,0
1060,1989-03-24,,Double Jeopardy,"(1, 3)","STARTS WITH ""P""",23,"(600,)",False,Lana Turner starred as Constance in the film version of this novel by Grace Metalious,Peyton Place,1,0
1060,1989-03-24,,Double Jeopardy,"(2, 3)",FICTION,21,"(600,)",False,"This Anita Loos novel was subtitled ""The Illuminating Diary of a Professional Lady""",Gentlemen Prefer Blondes,0,3
1060,1989-03-24,,Double Jeopardy,"(3, 3)",FOOD,18,"(600,)",False,This savory jelly was so named because its color resembled a snake's,aspic,0,3
1060,1989-03-24,,Double Jeopardy,"(4, 3)",BEACHES,10,"(600,)",False,"Island where millions swim every summer at Jones Beach, a 2,413-acre state park",Long Island,1,1
1060,1989-03-24,,Double Jeopardy,"(5, 3)",BIOLOGY,26,"(600,)",False,They're the tissues that connect bones to bones,ligaments,1,1
1060,1989-03-24,,Double Jeopardy,"(6, 3)",KINGS NAMED LOUIS,3,"(600,)",False,"Louis XIV was nicknamed ""Le Roi Soleil"", which means this","the ""Sun King""",1,0
1060,1989-03-24,,Double Jeopardy,"(1, 4)","STARTS WITH ""P""",24,"(800,)",False,U.S. architectural movement based on Midwestern homes built by Frank Lloyd Wright,Prairie Style (Prairie School),1,0
1060,1989-03-24,,Double Jeopardy,"(2, 4)",FICTION,27,"(800,)",False,"He was seeking the Democratic nomination when his novel ""The Strategies of Zeus"" was published in 1987",Gary Hart,1,0
1060,1989-03-24,,Double Jeopardy,"(3, 4)",FOOD,19,"(1200,)",True,"Under normal conditions, this fat found in chocolate will keep for years without going rancid",cocoa butter,1,0
1060,1989-03-24,,Double Jeopardy,"(4, 4)",BEACHES,11,"(1000,)",True,Panama City Beach isn't in Panama but on the Panhandle of this state,Florida,1,0
1060,1989-03-24,,Double Jeopardy,"(6, 4)",KINGS NAMED LOUIS,4,"(800,)",False,"Louis IX, who led crusades to the Holy Land, was the only king of France to receive this honor",sainthood,1,0
1060,1989-03-24,,Double Jeopardy,"(1, 5)","STARTS WITH ""P""",25,"(1000,)",False,A guitar pick,plectrum,1,0
1060,1989-03-24,,Double Jeopardy,"(3, 5)",FOOD,20,"(1000,)",False,This thick meat stew from the south of France traditionally includes white beans,cassoulet,1,0
1060,1989-03-24,,Double Jeopardy,"(4, 5)",BEACHES,12,"(1000,)",False,Beaches on this New England state's 17 3/4 miles of coastline include Hampton Beach & Rye Beach,New Hampshire,1,0
1060,1989-03-24,,Double Jeopardy,"(6, 5)",KINGS NAMED LOUIS,5,"(1000,)",False,"Louis II of Bavaria, the notorious ""Mad King Ludwig"", was a fanatic admirer of this composer",Wagner,0,3
1060,1989-03-24,,Final Jeopardy,"(1, 1)",WESTERN HEMISPHERE,0,"(2399, 7000, 7001)",False,"When it broke away from France in 1804, it became the 2nd independent country in the New World",Haiti,0,3
