epNum,airDate,extra_info,round_name,coord,category,order,value,daily_double,question,answer,correctAttempts,wrongAttempts
1281,1990-03-12,,Jeopardy,"(1, 1)","IT'S ""MAGIC""",14,"(100,)",False,This trademarked felt-tip pen was the 1st of its kind when introduced in the 1920s,Magic Marker,1,0
1281,1990-03-12,,Jeopardy,"(2, 1)",VOCABULARY,12,"(100,)",False,"From ""casa"", it once meant ""little house"", but now refers mostly to a gambling house",Casino,1,0
1281,1990-03-12,,Jeopardy,"(3, 1)",MONEY,9,"(100,)",False,West African country in whose mountains you could spend leones,Sierra Leone,1,0
1281,1990-03-12,,Jeopardy,"(4, 1)",THE CONSTITUTION,1,"(100,)",False,The 1st Amendment gives people the right to do this peacefully,Assemble,1,0
1281,1990-03-12,,Jeopardy,"(5, 1)",GAMES,6,"(100,)",False,"""Chicken Out"" is a board game based on the riddle ""Why did the chicken"" do this",Cross the road,1,0
1281,1990-03-12,,Jeopardy,"(6, 1)",SHOW BIZ BIOGRAPHIES,23,"(100,)",False,"""Finch, Bloody Finch"" is the life story of this ""Sunday, Bloody Sunday"" star",Peter Finch,1,0
1281,1990-03-12,,Jeopardy,"(1, 2)","IT'S ""MAGIC""",20,"(200,)",False,"A Lansing, Mich. sportswriter gave this future superstar his nickname when he was in high school","Earvin ""Magic"" Johnson",1,0
1281,1990-03-12,,Jeopardy,"(2, 2)",VOCABULARY,13,"(200,)",False,"Once used as a formal title, it means ""my lady"" in Italian",Madonna,0,3
1281,1990-03-12,,Jeopardy,"(3, 2)",MONEY,10,"(200,)",False,"Besides the Balboa, this currency is also legal tender in Panama",U.S. Dollar,1,0
1281,1990-03-12,,Jeopardy,"(4, 2)",THE CONSTITUTION,2,"(200,)",False,The final wording of the Constitution is due mostly to the literary skill of this Gouverneur,Gouverneur Morris,1,0
1281,1990-03-12,,Jeopardy,"(5, 2)",GAMES,7,"(200,)",False,"In ""The Batman Game"", you join Batman to fight crime in this city on a glow-in-the-dark board",Gotham City,1,0
1281,1990-03-12,,Jeopardy,"(6, 2)",SHOW BIZ BIOGRAPHIES,27,"(200,)",False,"She's the subject of ""Billie's Blues""",Billie Holiday,1,0
1281,1990-03-12,,Jeopardy,"(1, 3)","IT'S ""MAGIC""",24,"(300,)",False,"Invented in the 17th C., it was a predecessor of the modern slide projector",Magic Lantern,1,0
1281,1990-03-12,,Jeopardy,"(2, 3)",VOCABULARY,17,"(300,)",False,"To surrender, to give up all resistance, from the Latin word for ""small head""",Capitulate,0,3
1281,1990-03-12,,Jeopardy,"(3, 3)",MONEY,11,"(300,)",False,"In 1967 Marie Curie was honored on a 10 zlotych piece by this, her native country",Poland,1,0
1281,1990-03-12,,Jeopardy,"(4, 3)",THE CONSTITUTION,3,"(300,)",False,John Dickinson of Delaware had George Read do this for him,Sign the Constitution,1,0
1281,1990-03-12,,Jeopardy,"(5, 3)",GAMES,8,"(300,)",False,"Milton Bradley calls its game of ""Chutes &"" these ""an exciting up and down game for little people""",Ladders,1,0
1281,1990-03-12,,Jeopardy,"(1, 4)","IT'S ""MAGIC""",25,"(400,)",False,This song was a Top 10 hit for the Police in the fall of 1981,"""Every Little Thing She Does Is Magic""",0,3
1281,1990-03-12,,Jeopardy,"(2, 4)",VOCABULARY,18,"(400,)",False,"Annuity plan in which the last survivor inherits all, named for Lorenzo Tonti, a Neopolitan banker",Tontine,1,0
1281,1990-03-12,,Jeopardy,"(3, 4)",MONEY,15,"(400,)",False,"In 1926 he became the only living president to appear on a U.S. coin, a sesquicentennial half dollar",Calvin Coolidge,0,3
1281,1990-03-12,,Jeopardy,"(4, 4)",THE CONSTITUTION,4,"(600,)",True,Title given the president in Article II Section 2 of the Constitution,Commander-In-Chief of the Army & the Navy,0,1
1281,1990-03-12,,Jeopardy,"(5, 4)",GAMES,21,"(400,)",False,"The ""apologetic"" name of Parker Brothers' ""Slide Pursuit Game""",Sorry!,1,0
1281,1990-03-12,,Jeopardy,"(1, 5)","IT'S ""MAGIC""",26,"(500,)",False,Thomas Mann's classic story of a young man's 7-year stay at a sanitarium,"""The Magic Mountain""",1,0
1281,1990-03-12,,Jeopardy,"(2, 5)",VOCABULARY,19,"(500,)",False,"A word used for any lighthouse, from the island where a famous ancient one was located",Pharos,1,0
1281,1990-03-12,,Jeopardy,"(3, 5)",MONEY,16,"(500,)",False,Term for paper currency issued for temporary use in an emergency,Scrip,1,0
1281,1990-03-12,,Jeopardy,"(4, 5)",THE CONSTITUTION,5,"(500,)",False,The 7th Amendment preserves a right to this in lawsuits with more than $20 in question,A Jury,1,0
1281,1990-03-12,,Jeopardy,"(5, 5)",GAMES,22,"(500,)",False,"To win this game named for an avuncular rabbit, you have to be 1st to reach Dr. Possum's house",Uncle Wiggily,1,1
1281,1990-03-12,,Double Jeopardy,"(1, 1)",19TH CENTURY AMERICANS,17,"(200,)",False,"This educator's ""Compendious Dictionary of the English Language"" was 1st published in 1806",Noah Webster,1,0
1281,1990-03-12,,Double Jeopardy,"(2, 1)",THE BODY HUMAN,19,"(200,)",False,The endocardium is a thin membrane that lines the interior of this organ,Heart,1,0
1281,1990-03-12,,Double Jeopardy,"(3, 1)",RELIGION,8,"(200,)",False,"The most conservative of the 3 major branches of Judaism is not conservative, but this",Orthodox,1,0
1281,1990-03-12,,Double Jeopardy,"(4, 1)",PLAYWRIGHTS,11,"(200,)",False,In 1899 he reinterpreted the story of Caesar & Cleopatra using modern allusions,George Bernard Shaw,1,0
1281,1990-03-12,,Double Jeopardy,"(5, 1)",POTPOURRI,1,"(200,)",False,"Students who don't want to dissect a real one of these can order a cloth one named ""Ribbit""",Frog,1,0
1281,1990-03-12,,Double Jeopardy,"(6, 1)",NEW YORK CITY,5,"(200,)",False,"If you want to know who's buried in this president's tomb, you can find out in Riverside Park",Grant\'s Tomb,1,0
1281,1990-03-12,,Double Jeopardy,"(1, 2)",19TH CENTURY AMERICANS,18,"(400,)",False,In 1850 this showman began promoting U.S. tours for opera singer Jenny Lind,P.T. Barnum,1,0
1281,1990-03-12,,Double Jeopardy,"(2, 2)",THE BODY HUMAN,20,"(400,)",False,The parathyroid glands regulate the blood level of phosphates & this mineral necessary for bone growth,Calcium,1,0
1281,1990-03-12,,Double Jeopardy,"(3, 2)",RELIGION,13,"(400,)",False,Members of this religion commonly  touch their foreheads to the ground to acknowledge God's majesty,Islam,1,0
1281,1990-03-12,,Double Jeopardy,"(4, 2)",PLAYWRIGHTS,12,"(400,)",False,"The 1961 comedy ""Come Blow Your Horn"" was his 1st Broadway play",Neil Simon,1,0
1281,1990-03-12,,Double Jeopardy,"(5, 2)",POTPOURRI,2,"(400,)",False,"In flowers, the anther is part of the stamen in which this is produced",Pollen,1,0
1281,1990-03-12,,Double Jeopardy,"(6, 2)",NEW YORK CITY,6,"(400,)",False,Luxury cruise lines depart from docks along this river on Manhattan's west side,Hudson River,1,0
1281,1990-03-12,,Double Jeopardy,"(1, 3)",19TH CENTURY AMERICANS,22,"(600,)",False,"Nicknamed ""Gentleman Jim"", this bank teller won the heavyweight boxing title from John L. Sullivan in 1892",Jim Corbett,0,3
1281,1990-03-12,,Double Jeopardy,"(2, 3)",THE BODY HUMAN,21,"(600,)",False,The rectus femoris & the biceps femoris muscles are located in this part of the body,Thigh,1,1
1281,1990-03-12,,Double Jeopardy,"(3, 3)",RELIGION,14,"(600,)",False,The Deseret News is the daily paper published by this church,Church of Jesus Christ of Latter Day Saints (Mormons),1,0
1281,1990-03-12,,Double Jeopardy,"(4, 3)",PLAYWRIGHTS,24,"(600,)",False,She married fellow playwright Arthur Kober but never tied the knot with Dashiell Hammett,Lillian Hellman,1,0
1281,1990-03-12,,Double Jeopardy,"(5, 3)",POTPOURRI,3,"(600,)",False,"The 12 divisions of a horoscope are known by this ""homey"" name",Houses,1,0
1281,1990-03-12,,Double Jeopardy,"(6, 3)",NEW YORK CITY,7,"(600,)",False,"The Promenade, The Sullivan Street Theatre & The Cherry Lane Theatre, among others",Off-Broadway,1,0
1281,1990-03-12,,Double Jeopardy,"(1, 4)",19TH CENTURY AMERICANS,23,"(800,)",False,"He was in command of the U.S.S. Fulton, an early naval steamship, when he opened U.S. trade with Japan",Matthew Perry,0,3
1281,1990-03-12,,Double Jeopardy,"(2, 4)",THE BODY HUMAN,25,"(800,)",False,This purplish lymphatic organ is a major filtering element for the blood,Spleen,0,3
1281,1990-03-12,,Double Jeopardy,"(3, 4)",RELIGION,15,"(2500,)",True,The 3 great traditional religions of China,"Buddhism, Confucianism & Taoism",1,0
1281,1990-03-12,,Double Jeopardy,"(4, 4)",PLAYWRIGHTS,27,"(800,)",False,"His play ""Winterset"" is based on the case of Sacco & Vanzetti",Maxwell Anderson,0,3
1281,1990-03-12,,Double Jeopardy,"(5, 4)",POTPOURRI,4,"(800,)",False,The Havana brown cat is so named because its coat resembles the color of these,Cigar,1,0
1281,1990-03-12,,Double Jeopardy,"(6, 4)",NEW YORK CITY,9,"(800,)",False,"It parallels 5th & 7th Avenues, & long-time New Yorkers still call it 6th Avenue",The Avenue of the Americas,1,0
1281,1990-03-12,,Double Jeopardy,"(2, 5)",THE BODY HUMAN,26,"(1000,)",False,This carbohydrate is stored in the liver & provides the body with a reserve of energy,Glycogen,1,0
1281,1990-03-12,,Double Jeopardy,"(3, 5)",RELIGION,16,"(1000,)",False,Brown & the University of Chicago were both established by members of this Protestant denomination,Baptists,0,3
1281,1990-03-12,,Double Jeopardy,"(4, 5)",PLAYWRIGHTS,28,"(1000,)",False,"Centenarian playwright known for the musicals ""The Pajama Game"" & ""Fiorello!""",George Abbott,0,3
1281,1990-03-12,,Double Jeopardy,"(5, 5)",POTPOURRI,29,"(1000,)",False,It's the largest state entirely east of the Mississippi,Georgia,0,3
1281,1990-03-12,,Double Jeopardy,"(6, 5)",NEW YORK CITY,10,"(2100,)",True,"(VIDEO DAILY DOUBLE):Travel writer Stephen Birnbaum calls the building ""The Princess of the Skyline""",The Chrysler Building,1,0
1281,1990-03-12,,Final Jeopardy,"(1, 1)",THE NOBEL PRIZE,0,"(3600, 2001)",False,The only peace prize awarded posthumously went to this man in 1961,Dag Hammarskjold (the secretary-general of the UN who was killed in the plane crash in Africa),0,2
