epNum,airDate,extra_info,round_name,coord,category,order,value,daily_double,question,answer,correctAttempts,wrongAttempts
1286,1990-03-19,,Jeopardy,"(1, 1)","FILE UNDER ""E""",20,"(100,)",False,"The motto on the Great Seal of the U.S.:  ""Out of many, one""","""E Pluribus Unum""",1,0
1286,1990-03-19,,Jeopardy,"(2, 1)",LIBRARIES,26,"(100,)",False,"The T. Jefferson Building, John Adams Building & James Madison Memorial Bldg. house this",Library of Congress,1,0
1286,1990-03-19,,Jeopardy,"(3, 1)",THE PLANETS,1,"(100,)",False,"Because it's closest to the sun, this planet is best seen near the horizon just before sunset or sunrise",Mercury,1,0
1286,1990-03-19,,Jeopardy,"(4, 1)",MIDDLE NAMES,13,"(100,)",False,It was the middle name of John Astor the hotel builder and his great-grandfather the fur trader,Jacob,1,0
1286,1990-03-19,,Jeopardy,"(5, 1)",WORLD LEADERS,6,"(100,)",False,"2 Sikh bodyguards assassinated this Indian prime minister on Oct. 31, 1984",Indira Gandhi,1,0
1286,1990-03-19,,Jeopardy,"(6, 1)",MEDALS & DECORATIONS,11,"(100,)",False,"The highest award to a hero of the Soviet Union, or the top award a teacher gives a young pupil",Gold Star,1,0
1286,1990-03-19,,Jeopardy,"(1, 2)","FILE UNDER ""E""",21,"(200,)",False,"Eritrea, now the northernmost province of this country, was an Italian colony from 1890-1941",Ethiopia,1,0
1286,1990-03-19,,Jeopardy,"(2, 2)",LIBRARIES,27,"(200,)",False,"His presidential library was opened in Hyde Park, N.Y. while he was still in office",Franklin Delano Roosevelt,1,0
1286,1990-03-19,,Jeopardy,"(3, 2)",THE PLANETS,2,"(200,)",False,"This ""colorful"" 20,000 mile-wide storm on Jupiter has been raging for centuries",The Red Spot,1,0
1286,1990-03-19,,Jeopardy,"(4, 2)",MIDDLE NAMES,14,"(200,)",False,"This cowboy humorist had 2 middle names, Penn & Adair",Will Rogers,1,0
1286,1990-03-19,,Jeopardy,"(5, 2)",WORLD LEADERS,7,"(200,)",False,The only presidents this nation has had are Sukarno & Suharto,Indonesia,1,0
1286,1990-03-19,,Jeopardy,"(6, 2)",MEDALS & DECORATIONS,12,"(200,)",False,In U.S. decorations this adjective precedes service medal & flying cross,distinguished,1,0
1286,1990-03-19,,Jeopardy,"(1, 3)","FILE UNDER ""E""",22,"(300,)",False,3-sided sword that's a familiar word to fencers & crossword puzzle enthusiasts,epee,1,0
1286,1990-03-19,,Jeopardy,"(2, 3)",LIBRARIES,28,"(300,)",False,The largest library in the Soviet Union is named for this revolutionary,Lenin,1,0
1286,1990-03-19,,Jeopardy,"(3, 3)",THE PLANETS,3,"(300,)",False,A thick cloud cover is one reason temperatures at its equator & poles are about the same,Venus,1,0
1286,1990-03-19,,Jeopardy,"(4, 3)",MIDDLE NAMES,15,"(300,)",False,This poet's first name was James; Langston was one of his middle names,Langston Hughes,1,0
1286,1990-03-19,,Jeopardy,"(5, 3)",WORLD LEADERS,8,"(300,)",False,In 1970 Prince Norodom Sihanouk was deposed in a bloodless coup as head of state of this country,Cambodia,1,0
1286,1990-03-19,,Jeopardy,"(6, 3)",MEDALS & DECORATIONS,18,"(300,)",False,Animal depicted on the Victoria Cross,lion,0,3
1286,1990-03-19,,Jeopardy,"(1, 4)","FILE UNDER ""E""",23,"(400,)",False,"A candidate for knighthood in medieval times, or an English country gentleman",Esquire,1,1
1286,1990-03-19,,Jeopardy,"(2, 4)",LIBRARIES,29,"(1000,)",True,"In 1889 a Braddock, PA library became the first in the U.S. constructed by this businessman",Andrew Carnegie,1,0
1286,1990-03-19,,Jeopardy,"(3, 4)",THE PLANETS,4,"(400,)",False,This icy planet takes 248 years to complete an orbit of the sun,Pluto,1,0
1286,1990-03-19,,Jeopardy,"(4, 4)",MIDDLE NAMES,16,"(400,)",False,Aristotle Onassis' middle name; it was also the name of a Greek philosopher,Socrates,1,0
1286,1990-03-19,,Jeopardy,"(5, 4)",WORLD LEADERS,9,"(400,)",False,In 1847 Virginia-born Joseph Jenkins Roberts became the first president of this black African nation,Liberia,1,0
1286,1990-03-19,,Jeopardy,"(6, 4)",MEDALS & DECORATIONS,19,"(400,)",False,"Juha Tiainen, Joaquim Cruz & Rowdy Gaines all won these in the summer of 1984",Olympic gold medals,1,0
1286,1990-03-19,,Jeopardy,"(1, 5)","FILE UNDER ""E""",24,"(500,)",False,This ancient Greek city in Asia Minor was the site of the temple of Artemis,Ephesus,1,0
1286,1990-03-19,,Jeopardy,"(2, 5)",LIBRARIES,30,"(500,)",False,"The library at this Waco, Texas school houses the largest collection of works about Robert Browning",Baylor,1,0
1286,1990-03-19,,Jeopardy,"(3, 5)",THE PLANETS,5,"(500,)",False,"Based on the calculations of a French mathematician, Johann Galle discovered this planet in 1846",Neptune,1,0
1286,1990-03-19,,Jeopardy,"(4, 5)",MIDDLE NAMES,17,"(500,)",False,"Of Hollywood's Warner Brothers, the one whose middle name was Leonard",Jack Leonard Warner,1,0
1286,1990-03-19,,Jeopardy,"(5, 5)",WORLD LEADERS,10,"(500,)",False,"At 49, Margrethe II of this Scandinavian country is the world's youngest queen regnant",Denmark,1,0
1286,1990-03-19,,Jeopardy,"(6, 5)",MEDALS & DECORATIONS,25,"(500,)",False,Bolivia awards a national order named after this bird of the Andes,condor,1,0
1286,1990-03-19,,Double Jeopardy,"(1, 1)",THE QUEEN'S ENGLISH,5,"(200,)",False,"Ye Olde Trip To Jerusalem claims to be the oldest of these in Britain, so bottoms up to it",pub,1,0
1286,1990-03-19,,Double Jeopardy,"(2, 1)",U.S. LANDMARKS,22,"(200,)",False,"Built in the 19th century, the Flying Horse Carousel & Newport Casino are landmarks in this state",Rhode Island,1,0
1286,1990-03-19,,Double Jeopardy,"(3, 1)",MYTHOLOGY,16,"(200,)",False,"This goddess of wisdom was said to have sprung forth fully grown from the brain of her father, Zeus",Athena,1,0
1286,1990-03-19,,Double Jeopardy,"(4, 1)",SCIENTISTS,2,"(200,)",False,"Her second Nobel Prize, awarded in 1911, was for her work in chemistry",Marie Curie,1,0
1286,1990-03-19,,Double Jeopardy,"(5, 1)",FRUITS & VEGETABLES,11,"(200,)",False,Currants & sultanas are produced by drying this fruit,grapes,1,0
1286,1990-03-19,,Double Jeopardy,"(6, 1)",PLAYWRIGHTS,1,"(200,)",False,"First name shared by playwrights Fry, Durang & Marlowe",Christopher,1,0
1286,1990-03-19,,Double Jeopardy,"(1, 2)",THE QUEEN'S ENGLISH,6,"(400,)",False,The British turned this brand name into a verb meaning to vacuum,Hoover,1,0
1286,1990-03-19,,Double Jeopardy,"(2, 2)",U.S. LANDMARKS,23,"(400,)",False,NYC department store on 34th Street that's listed in the Catalog of Nat'l. Historic Landmarks,Macy\'s,1,0
1286,1990-03-19,,Double Jeopardy,"(3, 2)",MYTHOLOGY,17,"(400,)",False,"Hera took the eyes of Argus & set them in the tail of this, her favorite bird",peacock,1,0
1286,1990-03-19,,Double Jeopardy,"(4, 2)",SCIENTISTS,8,"(400,)",False,"This inventor supposedly offered G.W. Carver over $100,000 a year to work for him, but he declined",Thomas Edison,1,0
1286,1990-03-19,,Double Jeopardy,"(5, 2)",FRUITS & VEGETABLES,12,"(400,)",False,"The South American Indians called them ""papas"", a name that's still used today",potatoes,1,0
1286,1990-03-19,,Double Jeopardy,"(6, 2)",PLAYWRIGHTS,3,"(400,)",False,"Brecht served in a German army hospital during this war, but never as a surgeon as he claimed",World War I,1,0
1286,1990-03-19,,Double Jeopardy,"(1, 3)",THE QUEEN'S ENGLISH,7,"(600,)",False,Numerical phrase referring to the P.M.'s office,10 Downing Street/No. 10,1,0
1286,1990-03-19,,Double Jeopardy,"(2, 3)",U.S. LANDMARKS,24,"(600,)",False,It's the oldest continuously operated automobile race course anywhere,Indianapolis Motor Speedway,1,0
1286,1990-03-19,,Double Jeopardy,"(3, 3)",MYTHOLOGY,18,"(600,)",False,"The last Greek god to be deified, the Romans called him Bacchus",Dionysus,1,0
1286,1990-03-19,,Double Jeopardy,"(4, 3)",SCIENTISTS,13,"(1000,)",True,In 1705 he became the first Englishman knighted for scientific achievement,Sir Isaac Newton,1,0
1286,1990-03-19,,Double Jeopardy,"(5, 3)",FRUITS & VEGETABLES,21,"(600,)",False,"The nopal cactus, part of this national symbol of Mexico, produces this fruit",prickly pear,1,0
1286,1990-03-19,,Double Jeopardy,"(6, 3)",PLAYWRIGHTS,4,"(600,)",False,"In the 1950s he was the first of the British playwrights known as ""Angry Young Men""","John Osborne (""Look Back In Anger"")",0,3
1286,1990-03-19,,Double Jeopardy,"(1, 4)",THE QUEEN'S ENGLISH,29,"(800,)",False,"If you pinch a kipper you've stolen a fish; if you take a kip, you've done this",taking a nap,0,3
1286,1990-03-19,,Double Jeopardy,"(2, 4)",U.S. LANDMARKS,25,"(1000,)",True,Florida city in which you can explore the historic fortress Castillo de San Marcos,St. Augustine,0,1
1286,1990-03-19,,Double Jeopardy,"(3, 4)",MYTHOLOGY,19,"(800,)",False,The Valkyries were maidens who attended this god,Odin,0,3
1286,1990-03-19,,Double Jeopardy,"(4, 4)",SCIENTISTS,14,"(800,)",False,He proved being inoculated with cowpox matter would prevent people from catching smallpox,Edward Jenner,1,0
1286,1990-03-19,,Double Jeopardy,"(5, 4)",FRUITS & VEGETABLES,27,"(800,)",False,"As its label indicates, Southern Comfort contains the juice of this fruit",peach,0,3
1286,1990-03-19,,Double Jeopardy,"(6, 4)",PLAYWRIGHTS,9,"(800,)",False,"This ""Endgame"" author was a friend of James Joyce but, contrary to rumor, was not his secretary",Samuel Beckett,1,0
1286,1990-03-19,,Double Jeopardy,"(1, 5)",THE QUEEN'S ENGLISH,30,"(1000,)",False,"If you've grassed on your mates, you haven't mowed them down but did this to them",tattle/inform on them,1,0
1286,1990-03-19,,Double Jeopardy,"(2, 5)",U.S. LANDMARKS,26,"(1000,)",False,The historic First & Second Banks of the U.S. are one block apart in this city,Philadelphia,1,1
1286,1990-03-19,,Double Jeopardy,"(3, 5)",MYTHOLOGY,20,"(1000,)",False,"This god was the trumpeter of the sea, & his trumpet was a large shell",Triton,0,3
1286,1990-03-19,,Double Jeopardy,"(4, 5)",SCIENTISTS,15,"(1000,)",False,An Air Force base in Virginia is named for this astronomer  & aeronautical pioneer,Samuel Pierpoint Langley,0,3
1286,1990-03-19,,Double Jeopardy,"(5, 5)",FRUITS & VEGETABLES,28,"(1000,)",False,The names of these 2 onion relatives are from the name of the Mideast city Ashkelon,shallots & scallions,0,3
1286,1990-03-19,,Double Jeopardy,"(6, 5)",PLAYWRIGHTS,10,"(1000,)",False,"His last play, ""What The Butler Saw"", was produced in 1969, 2 years after he was killed",Joe Orton,0,3
1286,1990-03-19,,Final Jeopardy,"(1, 1)",THE CALENDAR,0,"(1399, 1400, 3000)",False,Civilization that produced the first known calendar with 365 days,Ancient Egypt,1,2
