epNum,airDate,extra_info,round_name,coord,category,order,value,daily_double,question,answer,correctAttempts,wrongAttempts
1291,1990-03-26,Andrew Bernknopf game 2.,Jeopardy,"(1, 1)",THE UNIVERSE,16,"(100,)",False,This planet's atmosphere is 99% nitrogen & oxygen,Earth,1,2
1291,1990-03-26,Andrew Bernknopf game 2.,Jeopardy,"(2, 1)",11-LETTER WORDS,1,"(100,)",False,"Diaphanous or sheer, as in clothing, or flimsy & obvious, as in a lie",Transparent,1,0
1291,1990-03-26,Andrew Bernknopf game 2.,Jeopardy,"(3, 1)",FOOD FACTS,24,"(100,)",False,"The name of this meat is from the Latin ""venatus"", hunt",Venison,1,0
1291,1990-03-26,Andrew Bernknopf game 2.,Jeopardy,"(4, 1)",BASEBALL,2,"(100,)",False,"Though he's had 5 no-hitters & the most career strikeouts of any pitcher, he's never won the Cy Young Award",Nolan Ryan,1,0
1291,1990-03-26,Andrew Bernknopf game 2.,Jeopardy,"(5, 1)",MOVIE MUSICALS,9,"(100,)",False,"As the master of ceremonies, this actor was the only one to reprise his stage role in 1972's ""Cabaret""",Joel Grey,1,0
1291,1990-03-26,Andrew Bernknopf game 2.,Jeopardy,"(6, 1)",DON'T TRY THIS AT HOME,17,"(100,)",False,"Elizabeth I reportedly whitened this with a mixture of eggshell, poppy seeds, borax & lead",Her Complexion,1,0
1291,1990-03-26,Andrew Bernknopf game 2.,Jeopardy,"(1, 2)",THE UNIVERSE,19,"(200,)",False,"It wasn't until 1959 that the ""far side"" of this body was seen",The Moon,1,0
1291,1990-03-26,Andrew Bernknopf game 2.,Jeopardy,"(2, 2)",11-LETTER WORDS,7,"(200,)",False,Breathing in & out,Respiration,1,0
1291,1990-03-26,Andrew Bernknopf game 2.,Jeopardy,"(3, 2)",FOOD FACTS,25,"(200,)",False,"Known botanically as ""citrullus lanatus"", this huge fruit grows on vines as long as 15 ft.",Watermelon,0,3
1291,1990-03-26,Andrew Bernknopf game 2.,Jeopardy,"(4, 2)",BASEBALL,3,"(200,)",False,"The ""Black Sox"" team that threw the 1919 World Series lost to this Ohio team",Cincinnati Reds,1,0
1291,1990-03-26,Andrew Bernknopf game 2.,Jeopardy,"(5, 2)",MOVIE MUSICALS,10,"(200,)",False,"Actor who sang ""If I Only Had The Nerve"" & ""If I Were King Of The Forest"" in ""The Wizard Of Oz""",Bert Lahr,1,0
1291,1990-03-26,Andrew Bernknopf game 2.,Jeopardy,"(6, 2)",DON'T TRY THIS AT HOME,18,"(200,)",False,Houdini was famous for hanging upside-down wearing one of these restrictive overgarments,Straitjacket,1,0
1291,1990-03-26,Andrew Bernknopf game 2.,Jeopardy,"(1, 3)",THE UNIVERSE,21,"(300,)",False,William Herschel thought he saw these around Uranus in 1787; in 1977 they were really seen,Rings,1,0
1291,1990-03-26,Andrew Bernknopf game 2.,Jeopardy,"(2, 3)",11-LETTER WORDS,8,"(300,)",False,The scientific study of birds,Ornithology,1,0
1291,1990-03-26,Andrew Bernknopf game 2.,Jeopardy,"(3, 3)",FOOD FACTS,26,"(300,)",False,"Veal cutlets dipped in bread crumbs & cheese, then fried & covered with tomato sauce",Veal Parmigiana,1,1
1291,1990-03-26,Andrew Bernknopf game 2.,Jeopardy,"(4, 3)",BASEBALL,4,"(300,)",False,"In Los Angeles, the Dodgers have had only these 2 managers",Walter Alston & Tommy Lasorda,1,0
1291,1990-03-26,Andrew Bernknopf game 2.,Jeopardy,"(5, 3)",MOVIE MUSICALS,11,"(500,)",True,"The only Ginger Rogers-Fred Astaire film for which these 2 brothers wrote songs was 1937's ""Shall We Dance""",George & Ira Gershwin,1,0
1291,1990-03-26,Andrew Bernknopf game 2.,Jeopardy,"(6, 3)",DON'T TRY THIS AT HOME,20,"(300,)",False,You have to have permission to do this in a barrel since someone died doing it in 1951,Going over Niagara Falls,1,0
1291,1990-03-26,Andrew Bernknopf game 2.,Jeopardy,"(1, 4)",THE UNIVERSE,27,"(400,)",False,"It's known for its prominences which are clouds, tubes & tongues of gasses",The Sun,1,0
1291,1990-03-26,Andrew Bernknopf game 2.,Jeopardy,"(2, 4)",11-LETTER WORDS,14,"(400,)",False,A fashion or fad maker,Trendsetter,0,3
1291,1990-03-26,Andrew Bernknopf game 2.,Jeopardy,"(3, 4)",FOOD FACTS,28,"(400,)",False,German sausage named for the crackling sound the skin of the sausage makes when bitten into,Knockwurst,0,3
1291,1990-03-26,Andrew Bernknopf game 2.,Jeopardy,"(4, 4)",BASEBALL,5,"(400,)",False,In 1961 owner Calvin Griffith moved this team to Minneapolis where it became the Minnesota Twins,Washington Senators,1,0
1291,1990-03-26,Andrew Bernknopf game 2.,Jeopardy,"(5, 4)",MOVIE MUSICALS,12,"(400,)",False,"This actress who played Mary Stone on ""The Donna Reed Show"" was the only 1 to co-star in 3 Elvis films",Shelley Fabares,1,0
1291,1990-03-26,Andrew Bernknopf game 2.,Jeopardy,"(6, 4)",DON'T TRY THIS AT HOME,22,"(400,)",False,Icarus could have told you it's not a good idea to fly if your wings are held together with this,Wax,1,0
1291,1990-03-26,Andrew Bernknopf game 2.,Jeopardy,"(2, 5)",11-LETTER WORDS,15,"(500,)",False,British weight system based on a pound equal to 453.59 grams or 16 ounces,Avoirdupois,1,1
1291,1990-03-26,Andrew Bernknopf game 2.,Jeopardy,"(3, 5)",FOOD FACTS,29,"(500,)",False,The Atlantic variety of this popular fish is the largest of all flatfish,Halibut,1,1
1291,1990-03-26,Andrew Bernknopf game 2.,Jeopardy,"(4, 5)",BASEBALL,6,"(500,)",False,"In 1972 owner Bob Short moved this team to Arlington, TX . where it became the Texas Rangers",Washington Senators,1,0
1291,1990-03-26,Andrew Bernknopf game 2.,Jeopardy,"(5, 5)",MOVIE MUSICALS,13,"(500,)",False,"This Russian composer was portrayed by Jean-Pierre Aumont in 1947's ""Song Of Scheherazade""",Rimsky-Korsakov,1,0
1291,1990-03-26,Andrew Bernknopf game 2.,Jeopardy,"(6, 5)",DON'T TRY THIS AT HOME,23,"(500,)",False,"This late, great circus star once performed an act with 40 -- count 'em, 40 -- lions & tigers",Clyde Beatty,0,3
1291,1990-03-26,Andrew Bernknopf game 2.,Double Jeopardy,"(1, 1)",THE RENAISSANCE,6,"(200,)",False,"The name of this musical form probably came from the Latin ""matricale"", meaning in the mother tongue",Madrigal,1,0
1291,1990-03-26,Andrew Bernknopf game 2.,Double Jeopardy,"(2, 1)",PEOPLE,1,"(200,)",False,"She got into the advice business before her twin sister, Dear Abby",Ann Landers,1,0
1291,1990-03-26,Andrew Bernknopf game 2.,Double Jeopardy,"(3, 1)",PLANTS,22,"(200,)",False,"Britannica defines it as ""any plant growing where it is not wanted""",Weed,1,0
1291,1990-03-26,Andrew Bernknopf game 2.,Double Jeopardy,"(4, 1)",ORGANIZATIONS,17,"(200,)",False,In 1987 Molly Yard replaced Eleanor Smeal as president of this organization,National Organization for Women (NOW),1,0
1291,1990-03-26,Andrew Bernknopf game 2.,Double Jeopardy,"(5, 1)",U.S. GEOGRAPHY,11,"(200,)",False,The U.S. borders these 3 oceans,"Arctic, Atlantic & Pacific",1,0
1291,1990-03-26,Andrew Bernknopf game 2.,Double Jeopardy,"(6, 1)",LITERARY QUOTES,14,"(200,)",False,"Terence, a Roman poet-playwright who lived in the second century B.C., said, ""Charity begins"" here",At Home,1,0
1291,1990-03-26,Andrew Bernknopf game 2.,Double Jeopardy,"(1, 2)",THE RENAISSANCE,7,"(400,)",False,The ruthless Cesare Borgia was the model for this book by Machiavelli,"""The Prince""",1,0
1291,1990-03-26,Andrew Bernknopf game 2.,Double Jeopardy,"(2, 2)",PEOPLE,2,"(400,)",False,"Evicted from his Oregon ashram, he now lives in Bombay & is called ""Zorba The Buddha""",Bhagwan Shree Rajneesh,1,0
1291,1990-03-26,Andrew Bernknopf game 2.,Double Jeopardy,"(3, 2)",PLANTS,23,"(400,)",False,"A member of the sundew family, it requires about 10 days to fully digest an insect",Venus Flytrap,1,0
1291,1990-03-26,Andrew Bernknopf game 2.,Double Jeopardy,"(4, 2)",ORGANIZATIONS,18,"(400,)",False,"Int'l club that ""promotes putting off until later those things that needn't be done today""",Procrastinator\'s Club,1,1
1291,1990-03-26,Andrew Bernknopf game 2.,Double Jeopardy,"(5, 2)",U.S. GEOGRAPHY,12,"(400,)",False,There's a national park on the island of St. John in this U.S. possession,U.S. Virgin Islands,1,0
1291,1990-03-26,Andrew Bernknopf game 2.,Double Jeopardy,"(6, 2)",LITERARY QUOTES,27,"(400,)",False,"Robert Louis Stevenson said, ""Marriage is ..... a field of battle, and not a bed of"" these",Roses,1,0
1291,1990-03-26,Andrew Bernknopf game 2.,Double Jeopardy,"(1, 3)",THE RENAISSANCE,8,"(600,)",False,"In his notebooks this Renaissance artist claimed, ""The Medici created and destroyed me""",Leonardo Da Vinci,1,1
1291,1990-03-26,Andrew Bernknopf game 2.,Double Jeopardy,"(2, 3)",PEOPLE,3,"(600,)",False,"Herbert Ross, who directed the film ""Steel Magnolias"", is married to this sister of Jackie Onassis",Lee Radziwill,1,0
1291,1990-03-26,Andrew Bernknopf game 2.,Double Jeopardy,"(3, 3)",PLANTS,24,"(600,)",False,Plant whose twigs are used for dowsing & whose leaves & bark are used to make an astringent,Witch Hazel,1,0
1291,1990-03-26,Andrew Bernknopf game 2.,Double Jeopardy,"(4, 3)",ORGANIZATIONS,19,"(600,)",False,One must be a member of this fraternal group in order to belong to the Shriners,Masons,1,0
1291,1990-03-26,Andrew Bernknopf game 2.,Double Jeopardy,"(5, 3)",U.S. GEOGRAPHY,13,"(600,)",False,North Dakota has its Devils Lake & Wyoming its Devils one of these,Devils Tower,1,0
1291,1990-03-26,Andrew Bernknopf game 2.,Double Jeopardy,"(6, 3)",LITERARY QUOTES,28,"(600,)",False,"In ""A Study in Scarlet"" this author called London ""that great cesspool""",Arthur Conan Doyle,1,0
1291,1990-03-26,Andrew Bernknopf game 2.,Double Jeopardy,"(1, 4)",THE RENAISSANCE,9,"(800,)",False,"Plays were either comedies, tragedies or these love tales about woodland goddesses & shepherds",Pastorals,1,0
1291,1990-03-26,Andrew Bernknopf game 2.,Double Jeopardy,"(2, 4)",PEOPLE,4,"(800,)",False,William J. McCarthy is president of this union,Teamsters,0,3
1291,1990-03-26,Andrew Bernknopf game 2.,Double Jeopardy,"(3, 4)",PLANTS,25,"(800,)",False,"Name for a low, enclosed bed covered with glass or plastic for starting plants before the season",Cold Frame,0,3
1291,1990-03-26,Andrew Bernknopf game 2.,Double Jeopardy,"(4, 4)",ORGANIZATIONS,20,"(800,)",False,Arm of Al-Anon that's specifically for young people between the ages of 12 & 20,Al-Ateen,1,0
1291,1990-03-26,Andrew Bernknopf game 2.,Double Jeopardy,"(5, 4)",U.S. GEOGRAPHY,15,"(1200,)",True,The Raritan is the longest river wholly within this state,New Jersey,0,1
1291,1990-03-26,Andrew Bernknopf game 2.,Double Jeopardy,"(6, 4)",LITERARY QUOTES,29,"(800,)",False,"Poet who wrote, ""The woods are lovely, dark & deep, but I have promises to keep...""",Robert Frost,1,0
1291,1990-03-26,Andrew Bernknopf game 2.,Double Jeopardy,"(1, 5)",THE RENAISSANCE,10,"(1000,)",False,Boccaccio work narrated by 3 men & 7 women fleeing the plague in Florence,The Decameron,1,0
1291,1990-03-26,Andrew Bernknopf game 2.,Double Jeopardy,"(2, 5)",PEOPLE,5,"(1000,)",False,This historian & former Librarian of Congress was teaching history at Harvard while studying law at Yale,Daniel Boorstein,1,0
1291,1990-03-26,Andrew Bernknopf game 2.,Double Jeopardy,"(3, 5)",PLANTS,26,"(1000,)",False,This climbing tropical shrub was named for a French South Seas explorer,Bougainvillea,0,3
1291,1990-03-26,Andrew Bernknopf game 2.,Double Jeopardy,"(4, 5)",ORGANIZATIONS,21,"(1000,)",False,"Social welfare organization founded in the 19th century, whose bimonthly publication is ""The War Cry""",The Salvation Army,1,0
1291,1990-03-26,Andrew Bernknopf game 2.,Double Jeopardy,"(5, 5)",U.S. GEOGRAPHY,16,"(1000,)",False,One of the largest of these shallow channels in the U.S. is the Bartholomew in N. Louisiana,Bayou,1,0
1291,1990-03-26,Andrew Bernknopf game 2.,Double Jeopardy,"(6, 5)",LITERARY QUOTES,30,"(1000,)",True,"""Always do right."" he wrote; ""This will gratify some people and astonish the rest""",Mark Twain,1,0
1291,1990-03-26,Andrew Bernknopf game 2.,Final Jeopardy,"(1, 1)",COUNTRIES OF THE WORLD,0,"(4000, 1500, 1001)",False,The world's most populous democracy,India,3,0
