epNum,airDate,extra_info,round_name,coord,category,order,value,daily_double,question,answer,correctAttempts,wrongAttempts
1327,1990-05-15,1990 College Championship semifinal game 2.,Jeopardy,"(1, 1)",1983,1,"(100,)",False,At Christmas time parents shelled out a lot of lettuce for these one-of-a-kind dolls,Cabbage Patch Kids,1,0
1327,1990-05-15,1990 College Championship semifinal game 2.,Jeopardy,"(2, 1)",COLORS,18,"(100,)",False,"Whether you spell it with an ""A"" or an ""E"", it describes any achromatic color between white & black",Gray/grey,1,0
1327,1990-05-15,1990 College Championship semifinal game 2.,Jeopardy,"(3, 1)",4-LETTER WORDS,6,"(100,)",False,You can do this from grace or on your face,Fall,1,0
1327,1990-05-15,1990 College Championship semifinal game 2.,Jeopardy,"(4, 1)",MATHEMATICS,11,"(100,)",False,Statisticians make predictions based on the theory & laws of this,Probability,1,0
1327,1990-05-15,1990 College Championship semifinal game 2.,Jeopardy,"(5, 1)",ODDS & ENDS,16,"(100,)",False,"From the Latin ""to sleep"", it's a building where collegians sleep",Dormitory,1,0
1327,1990-05-15,1990 College Championship semifinal game 2.,Jeopardy,"(6, 1)",ADAM & EVE,22,"(100,)",False,"When called on the carpet, Adam blamed Eve, & Eve blamed him",The Serpent,1,1
1327,1990-05-15,1990 College Championship semifinal game 2.,Jeopardy,"(1, 2)",1983,2,"(200,)",False,"Anne Burford resigned as head of the EPA, & he resigned as Secretary of the Interior",James Watt,1,0
1327,1990-05-15,1990 College Championship semifinal game 2.,Jeopardy,"(2, 2)",COLORS,27,"(200,)",False,Shade of green that Princess Grace might have worn since it's named for an Irish family,Kelly,1,1
1327,1990-05-15,1990 College Championship semifinal game 2.,Jeopardy,"(3, 2)",4-LETTER WORDS,7,"(200,)",False,"A witch's concoction, whether or not it contains coffee, tea or beer",Brew,1,0
1327,1990-05-15,1990 College Championship semifinal game 2.,Jeopardy,"(4, 2)",MATHEMATICS,12,"(200,)",False,The semicircular instrument used to measure & construct angles is called this,Protractor,1,0
1327,1990-05-15,1990 College Championship semifinal game 2.,Jeopardy,"(5, 2)",ODDS & ENDS,17,"(200,)",False,"In ""Paul Revere's Ride"", the number of lamps that burn in the belfry of the Old North Church",2,1,1
1327,1990-05-15,1990 College Championship semifinal game 2.,Jeopardy,"(6, 2)",ADAM & EVE,23,"(200,)",False,"God reminded Adam that this ""Thou art, unto"" it ""shalt thou return""",Dust,1,0
1327,1990-05-15,1990 College Championship semifinal game 2.,Jeopardy,"(1, 3)",1983,3,"(300,)",False,The Disneyland near this capital city opened in April,Tokyo,1,0
1327,1990-05-15,1990 College Championship semifinal game 2.,Jeopardy,"(2, 3)",COLORS,30,"(300,)",False,"A person in a rage is said to ""see"" this color",Red,1,0
1327,1990-05-15,1990 College Championship semifinal game 2.,Jeopardy,"(3, 3)",4-LETTER WORDS,9,"(300,)",False,A walking stick that probably isn't made of candy,Cane,1,0
1327,1990-05-15,1990 College Championship semifinal game 2.,Jeopardy,"(4, 3)",MATHEMATICS,14,"(300,)",False,Degrees of latitude are further broken down into these divisions,Minutes & seconds,1,0
1327,1990-05-15,1990 College Championship semifinal game 2.,Jeopardy,"(5, 3)",ODDS & ENDS,19,"(300,)",False,"He wrote a biography of his grandfather, the artist Ford Madox Brown",Ford Madox Ford,0,3
1327,1990-05-15,1990 College Championship semifinal game 2.,Jeopardy,"(6, 3)",ADAM & EVE,24,"(500,)",True,"They could eat of the Tree of Life, but the Tree of the Knowledge of this was off limits",Good and evil,0,1
1327,1990-05-15,1990 College Championship semifinal game 2.,Jeopardy,"(1, 4)",1983,4,"(400,)",False,In October U.S. forces invaded this Caribbean island,Grenada,1,0
1327,1990-05-15,1990 College Championship semifinal game 2.,Jeopardy,"(2, 4)",COLORS,29,"(400,)",False,Maize is a shade of this color,Yellow,1,0
1327,1990-05-15,1990 College Championship semifinal game 2.,Jeopardy,"(3, 4)",4-LETTER WORDS,10,"(400,)",False,"A repast, or the ground-up seeds of a grain",Meal,1,0
1327,1990-05-15,1990 College Championship semifinal game 2.,Jeopardy,"(4, 4)",MATHEMATICS,15,"(400,)",False,Number of zeros to the right of the decimal point in the number one ten-thousandth,3,1,1
1327,1990-05-15,1990 College Championship semifinal game 2.,Jeopardy,"(5, 4)",ODDS & ENDS,20,"(400,)",False,In 1778 Capt. George Vancouver named Prince William Sound in honor of one of this king's sons,George III,1,0
1327,1990-05-15,1990 College Championship semifinal game 2.,Jeopardy,"(6, 4)",ADAM & EVE,25,"(400,)",False,"According to Genesis, Adam gave these to the animals & later gave one to his wife",Names,1,0
1327,1990-05-15,1990 College Championship semifinal game 2.,Jeopardy,"(1, 5)",1983,5,"(500,)",False,NASA verified that the meteorite found under the ice in Antarctica came from this celestial body,Moon,1,0
1327,1990-05-15,1990 College Championship semifinal game 2.,Jeopardy,"(2, 5)",COLORS,28,"(500,)",False,The shortest wavelength of the visible color spectrum is this color,Violet,1,0
1327,1990-05-15,1990 College Championship semifinal game 2.,Jeopardy,"(3, 5)",4-LETTER WORDS,8,"(500,)",False,"To meditate upon something -- Terpsichore, for example",Muse,1,0
1327,1990-05-15,1990 College Championship semifinal game 2.,Jeopardy,"(4, 5)",MATHEMATICS,13,"(500,)",False,A set with no elements is described as this,Null/empty,1,0
1327,1990-05-15,1990 College Championship semifinal game 2.,Jeopardy,"(5, 5)",ODDS & ENDS,21,"(500,)",False,"The Treaty of Vereeniging signed in Pretoria on May 31, 1902 officially ended this war",The Boer War,1,0
1327,1990-05-15,1990 College Championship semifinal game 2.,Jeopardy,"(6, 5)",ADAM & EVE,26,"(500,)",False,"Adam was a young 130 when he begat him, his third son",Seth,1,0
1327,1990-05-15,1990 College Championship semifinal game 2.,Double Jeopardy,"(1, 1)",SCIENTISTS,7,"(200,)",False,He worked in the Dept. of Internal Medicine at Vienna's General Hospital before moving to the psychiatric clinic,Sigmund Freud,1,0
1327,1990-05-15,1990 College Championship semifinal game 2.,Double Jeopardy,"(2, 1)",CLASSICAL MUSIC,4,"(200,)",False,"He also composed oratorios & operas, & felt the operettas he wrote with Gilbert were frivolous",Sir Arthur Sullivan,1,0
1327,1990-05-15,1990 College Championship semifinal game 2.,Double Jeopardy,"(3, 1)",FOOD,26,"(200,)",False,"Described as an unsweetened doughnut with rigor mortis, it's often served with lox & cream cheese",Bagel,1,0
1327,1990-05-15,1990 College Championship semifinal game 2.,Double Jeopardy,"(4, 1)",WORLD CITIES,5,"(200,)",False,The silver baron Jose de la Borda laid out the famous Borda Gardens in Cuernavaca in this country,Mexico,0,3
1327,1990-05-15,1990 College Championship semifinal game 2.,Double Jeopardy,"(5, 1)",ANTHROPOLOGY,13,"(200,)",False,"Last name of famous anthropologist family Louis, Mary & their son Richard",Leakey,1,0
1327,1990-05-15,1990 College Championship semifinal game 2.,Double Jeopardy,"(6, 1)",BOOKS ON TAPE,12,"(200,)",False,"Not that you asked, this ""60 Minutes"" curmudgeon reads his own book ""Not That You Asked...""",Andy Rooney,1,0
1327,1990-05-15,1990 College Championship semifinal game 2.,Double Jeopardy,"(1, 2)",SCIENTISTS,8,"(400,)",False,Dmitri Mendeleyev developed this chemical classification system in Russia in the 1860s,Periodic Table of Elements,1,0
1327,1990-05-15,1990 College Championship semifinal game 2.,Double Jeopardy,"(2, 2)",CLASSICAL MUSIC,11,"(1000,)",True,"The music of this country's national anthem is attributed to a native son, Mozart",Austria,0,1
1327,1990-05-15,1990 College Championship semifinal game 2.,Double Jeopardy,"(3, 2)",FOOD,27,"(400,)",False,"From the old French word for ""ham"", it makes a nice sandwich combined with lettuce & tomato",Bacon,1,0
1327,1990-05-15,1990 College Championship semifinal game 2.,Double Jeopardy,"(4, 2)",WORLD CITIES,6,"(400,)",False,The Gaelic name for this capital city is Baile Atha Cliath,Dublin,1,0
1327,1990-05-15,1990 College Championship semifinal game 2.,Double Jeopardy,"(5, 2)",ANTHROPOLOGY,16,"(400,)",False,"Margaret Mead studied teenagers in Samoa, & this woman studied ""Gorillas In The Mist""",Dian Fossey,1,0
1327,1990-05-15,1990 College Championship semifinal game 2.,Double Jeopardy,"(6, 2)",BOOKS ON TAPE,22,"(400,)",False,"This ""Lou Grant"" star recorded Margaret Truman's ""Murder At the Kennedy Center""",Ed Asner,1,0
1327,1990-05-15,1990 College Championship semifinal game 2.,Double Jeopardy,"(1, 3)",SCIENTISTS,9,"(600,)",False,"1st U.S. woman astronomer, M. Mitchell, found these solar phenomena are whirling cavities, not clouds",Sunspots,1,0
1327,1990-05-15,1990 College Championship semifinal game 2.,Double Jeopardy,"(2, 3)",CLASSICAL MUSIC,14,"(600,)",False,"He burned the score of his 5-act opera ""Ivan IV"" before ""Carmen"" made him a success",Georges Bizet,1,1
1327,1990-05-15,1990 College Championship semifinal game 2.,Double Jeopardy,"(3, 3)",FOOD,28,"(600,)",False,"As its signs indicate, a Baskin-Robbins ice cream store offers at least this many flavors",31,1,0
1327,1990-05-15,1990 College Championship semifinal game 2.,Double Jeopardy,"(4, 3)",WORLD CITIES,3,"(600,)",False,"Named for one of the colleges at Oxford, this major New Zealand city has a religious name",Christchurch,1,0
1327,1990-05-15,1990 College Championship semifinal game 2.,Double Jeopardy,"(5, 3)",ANTHROPOLOGY,17,"(600,)",False,Excavations in Newfoundland show evidence of a visit by these people around 1000 A.D.,Vikings,1,0
1327,1990-05-15,1990 College Championship semifinal game 2.,Double Jeopardy,"(6, 3)",BOOKS ON TAPE,23,"(600,)",False,"This columnist taped her own book ""Family - The Ties That Bind...And Gag!""",Erma Bombeck,1,0
1327,1990-05-15,1990 College Championship semifinal game 2.,Double Jeopardy,"(1, 4)",SCIENTISTS,10,"(800,)",False,"It's said he 1st saw a published copy of his ""On the Revolutions of the Celestial Spheres"" the day he died",Nicolaus Copernicus,1,0
1327,1990-05-15,1990 College Championship semifinal game 2.,Double Jeopardy,"(2, 4)",CLASSICAL MUSIC,20,"(800,)",False,"Ibsen asked this Norwegian to compose the music for the stage version of ""Peer Gynt""",Edvard Grieg,0,3
1327,1990-05-15,1990 College Championship semifinal game 2.,Double Jeopardy,"(3, 4)",FOOD,29,"(800,)",False,"Saffron-flavored Spanish rice stew with meat, vegetables & seafood",Paella,0,3
1327,1990-05-15,1990 College Championship semifinal game 2.,Double Jeopardy,"(4, 4)",WORLD CITIES,2,"(800,)",False,"Antananarivo is the largest city on this, the world's fourth largest island",Madagascar,1,0
1327,1990-05-15,1990 College Championship semifinal game 2.,Double Jeopardy,"(5, 4)",ANTHROPOLOGY,18,"(800,)",False,"The 2 major fields of anthropology are ""physical"" & this",Cultural,1,0
1327,1990-05-15,1990 College Championship semifinal game 2.,Double Jeopardy,"(6, 4)",BOOKS ON TAPE,24,"(800,)",False,"""Polar Star"", Martin Cruz Smith's sequel to this novel is now available on tape","""Gorky Park""",1,0
1327,1990-05-15,1990 College Championship semifinal game 2.,Double Jeopardy,"(1, 5)",SCIENTISTS,15,"(1000,)",False,"17th C. Dutchman noted for his work with the microscope & called the ""Father of Microbiology""",Anton van Leeuwenhoek,1,0
1327,1990-05-15,1990 College Championship semifinal game 2.,Double Jeopardy,"(2, 5)",CLASSICAL MUSIC,21,"(1000,)",False,"In 1886 he completed his third symphony & ""Carnival of the Animals""",Camille Saint-Saens,0,3
1327,1990-05-15,1990 College Championship semifinal game 2.,Double Jeopardy,"(3, 5)",FOOD,30,"(1000,)",False,This type of cucumber is only grown under artificial conditions in hothouses,English/burpless/seedless,0,3
1327,1990-05-15,1990 College Championship semifinal game 2.,Double Jeopardy,"(4, 5)",WORLD CITIES,1,"(1000,)",False,"Mombasa, which lies on an island in the Indian Ocean, is the main port of this E. African country",Kenya,0,3
1327,1990-05-15,1990 College Championship semifinal game 2.,Double Jeopardy,"(5, 5)",ANTHROPOLOGY,19,"(500,)",True,Eugene Dubois thought there'd be fossils of Homo Erectus in the East Indies & found them on this island,Java,1,0
1327,1990-05-15,1990 College Championship semifinal game 2.,Double Jeopardy,"(6, 5)",BOOKS ON TAPE,25,"(1000,)",False,"If you want to know what this ""Rage Of Angels"" novelist sounds like, catch him reading ""The Sands Of Time""",Sidney Sheldon,1,0
1327,1990-05-15,1990 College Championship semifinal game 2.,Final Jeopardy,"(1, 1)",THE NOBEL PRIZE,0,"(0, 4700, 6601)",False,This winner of the 1970 Nobel Literature Prize was born in 1918 into a family of Cossack intellectuals,Aleksandr Solzhenitsyn,1,2
