epNum,airDate,extra_info,round_name,coord,category,order,value,daily_double,question,answer,correctAttempts,wrongAttempts
1498,1991-02-20,1991 Teen Tournament semifinal game 3.,Jeopardy,"(1, 1)",LANDMARKS,18,"(100,)",False,"Passages from the Koran decorate the outside of this marble tomb at Agra, India",the Taj Mahal,1,0
1498,1991-02-20,1991 Teen Tournament semifinal game 3.,Jeopardy,"(2, 1)",CELEBRITIES,2,"(100,)",False,"Tracy Pollan played his girlfriend on ""Family Ties"" before marrying him in real life",Michael J. Fox,1,0
1498,1991-02-20,1991 Teen Tournament semifinal game 3.,Jeopardy,"(3, 1)",FRUITS & VEGETABLES,15,"(100,)",False,It's believed that this red berry grown in bogs was served at the first Thanksgiving,a cranberry,1,0
1498,1991-02-20,1991 Teen Tournament semifinal game 3.,Jeopardy,"(4, 1)",NURSERY RHYMES,8,"(100,)",False,"""There was a farmer had a dog"", and this ""was his name""",Bingo,1,0
1498,1991-02-20,1991 Teen Tournament semifinal game 3.,Jeopardy,"(5, 1)",LAW,1,"(100,)",False,"Except in Louisiana, American law is based on this country's common law",Britain (or England),1,0
1498,1991-02-20,1991 Teen Tournament semifinal game 3.,Jeopardy,"(6, 1)",DEM BUGS,26,"(100,)",False,"This insect, whose name is Spanish for ""little fly"", carries malaria, encephalitis & yellow fever",the mosquito,1,0
1498,1991-02-20,1991 Teen Tournament semifinal game 3.,Jeopardy,"(1, 2)",LANDMARKS,19,"(200,)",False,"By flooding the arena, this largest Roman amphitheater could be used for mock naval battles",the Colosseum,1,0
1498,1991-02-20,1991 Teen Tournament semifinal game 3.,Jeopardy,"(2, 2)",CELEBRITIES,3,"(200,)",False,"Her ""Rhythm Nation 1814"" album helped her dance away with eight of the 1990 Billboard Music Awards",Janet Jackson,1,1
1498,1991-02-20,1991 Teen Tournament semifinal game 3.,Jeopardy,"(3, 2)",FRUITS & VEGETABLES,17,"(200,)",False,"Mangel-wurzel, used for cattle feed, is a variety of this red root vegetable",a beet,1,0
1498,1991-02-20,1991 Teen Tournament semifinal game 3.,Jeopardy,"(4, 2)",NURSERY RHYMES,11,"(200,)",False,"""Cock a doodle doo!  My dame has lost"" one of these",her shoe,1,0
1498,1991-02-20,1991 Teen Tournament semifinal game 3.,Jeopardy,"(5, 2)",LAW,7,"(200,)",False,Brown v. Board of Education was the Supreme Court decision that called for an end to this practice,segregation,1,0
1498,1991-02-20,1991 Teen Tournament semifinal game 3.,Jeopardy,"(6, 2)",DEM BUGS,27,"(200,)",False,"Among bees, workers do all the work while their sole function is to mate with the queen",the drones,1,0
1498,1991-02-20,1991 Teen Tournament semifinal game 3.,Jeopardy,"(1, 3)",LANDMARKS,20,"(300,)",False,"Some believe this megalithic monument near Salisbury, Eng. was an astronomical observatory",Stonehenge,1,0
1498,1991-02-20,1991 Teen Tournament semifinal game 3.,Jeopardy,"(2, 3)",CELEBRITIES,4,"(300,)",False,"Her latest exercise video is called her ""Lean Routine""--we don't know if Ted Turner uses it",Jane Fonda,1,0
1498,1991-02-20,1991 Teen Tournament semifinal game 3.,Jeopardy,"(3, 3)",FRUITS & VEGETABLES,23,"(300,)",False,"The name of this fruit group comes from the Greek word for cedar, ""kedros""",citrus,1,1
1498,1991-02-20,1991 Teen Tournament semifinal game 3.,Jeopardy,"(4, 3)",NURSERY RHYMES,12,"(300,)",False,"""A-tisket, a-tasket"", they're the colors of my basket",green & yellow,1,0
1498,1991-02-20,1991 Teen Tournament semifinal game 3.,Jeopardy,"(5, 3)",LAW,9,"(300,)",False,"Term for an indirect veto by the president, who holds a bill until Congress adjourns",a pocket veto,1,0
1498,1991-02-20,1991 Teen Tournament semifinal game 3.,Jeopardy,"(6, 3)",DEM BUGS,28,"(300,)",False,"Of a beetle, a spider or a grasshopper, the one that is not an insect",a spider,1,0
1498,1991-02-20,1991 Teen Tournament semifinal game 3.,Jeopardy,"(1, 4)",LANDMARKS,21,"(400,)",False,Industrial pollution threatens the remains of this temple built on the Acropolis to honor Athena,the Parthenon,1,0
1498,1991-02-20,1991 Teen Tournament semifinal game 3.,Jeopardy,"(2, 4)",CELEBRITIES,5,"(400,)",False,"This ""Peanuts"" creator describes Linus as ""the most well-rounded individual in the group""",Charles Schulz,1,0
1498,1991-02-20,1991 Teen Tournament semifinal game 3.,Jeopardy,"(3, 4)",FRUITS & VEGETABLES,24,"(400,)",False,"Burpee ran a 1990 contest for the largest ""prizewinner"" variety of this; the deadline for entry was Oct. 31",the pumpkin,1,0
1498,1991-02-20,1991 Teen Tournament semifinal game 3.,Jeopardy,"(4, 4)",NURSERY RHYMES,13,"(1000,)",True,The only 1 of the 3 men in a tub who didn't work with food,the candlestick maker,1,0
1498,1991-02-20,1991 Teen Tournament semifinal game 3.,Jeopardy,"(5, 4)",LAW,10,"(400,)",False,Laws regarding prisoners of war were established by conventions held in this city in 1929 & 1949,Geneva,1,0
1498,1991-02-20,1991 Teen Tournament semifinal game 3.,Jeopardy,"(6, 4)",DEM BUGS,29,"(400,)",False,An insect uses this appendage to smell & feel & in some instances to taste & hear,antennae,1,0
1498,1991-02-20,1991 Teen Tournament semifinal game 3.,Jeopardy,"(1, 5)",LANDMARKS,22,"(500,)",False,Stronghold in Baltimore Harbor named for a man who was Secretary of War while it was being built,Fort McHenry,1,0
1498,1991-02-20,1991 Teen Tournament semifinal game 3.,Jeopardy,"(2, 5)",CELEBRITIES,6,"(500,)",False,"Rumer, the daughter of Bruce Willis & this actress, is named for British author Rumer Godden",Demi Moore,1,0
1498,1991-02-20,1991 Teen Tournament semifinal game 3.,Jeopardy,"(3, 5)",FRUITS & VEGETABLES,25,"(500,)",False,"Except for grains, this tuber is the most widely consumed human food",the potato,1,0
1498,1991-02-20,1991 Teen Tournament semifinal game 3.,Jeopardy,"(4, 5)",NURSERY RHYMES,14,"(500,)",False,"""A Child's Garden of Verses"" grew out of the fertile imagination of this ""Treasure Island"" author",Robert Louis Stevenson,1,0
1498,1991-02-20,1991 Teen Tournament semifinal game 3.,Jeopardy,"(5, 5)",LAW,16,"(500,)",False,He was New York's first chief justice before he became the first Chief Justice of the U.S.,John Jay,1,0
1498,1991-02-20,1991 Teen Tournament semifinal game 3.,Jeopardy,"(6, 5)",DEM BUGS,30,"(500,)",False,These large bugs named for a monster are probably the fastest flying insects,dragonflies,0,3
1498,1991-02-20,1991 Teen Tournament semifinal game 3.,Double Jeopardy,"(1, 1)",LITERARY ANIMALS,6,"(200,)",False,"In ""The Wizard of Oz"" books, this dog has been depicted as a terrier",Toto,1,0
1498,1991-02-20,1991 Teen Tournament semifinal game 3.,Double Jeopardy,"(2, 1)",AMERICAN HISTORY,13,"(200,)",False,"14 years before coming to America, this Quaker was imprisoned in the Tower of London for his beliefs",William Penn,1,0
1498,1991-02-20,1991 Teen Tournament semifinal game 3.,Double Jeopardy,"(3, 1)",COLLEGES & UNIVERSITIES,20,"(200,)",False,"In 1257, Robert de Sorbon opened a college of theology in this European city",Paris,1,0
1498,1991-02-20,1991 Teen Tournament semifinal game 3.,Double Jeopardy,"(4, 1)",THE BODY HUMAN,30,"(200,)",False,"When cardiac muscle cells contract, they push blood out of this organ & into the arteries",the heart,1,1
1498,1991-02-20,1991 Teen Tournament semifinal game 3.,Double Jeopardy,"(5, 1)",ISLANDS,5,"(200,)",False,"In 1954, after 63 years, the immigrant station on this island in New York Harbor was closed",Ellis Island,1,0
1498,1991-02-20,1991 Teen Tournament semifinal game 3.,Double Jeopardy,"(6, 1)","PLANES, TRAINS & AUTOMOBILES",21,"(200,)",False,The Columbia was the first of these that could lift off like a rocket & land like a plane,Space Shuttle,1,0
1498,1991-02-20,1991 Teen Tournament semifinal game 3.,Double Jeopardy,"(1, 2)",LITERARY ANIMALS,7,"(400,)",False,"In the ""Uncle Remus"" stories, Brer Fox is constantly being outfoxed by this character",Brer Rabbit,1,0
1498,1991-02-20,1991 Teen Tournament semifinal game 3.,Double Jeopardy,"(2, 2)",AMERICAN HISTORY,15,"(400,)",False,"In 1949 the U.S. joined this Western defense pact, our first ever peacetime alliance",NATO,1,0
1498,1991-02-20,1991 Teen Tournament semifinal game 3.,Double Jeopardy,"(3, 2)",COLLEGES & UNIVERSITIES,19,"(400,)",False,"Harvard's sister college was named for Lady A. Mowlson, whose maiden name was this",Radcliffe,1,0
1498,1991-02-20,1991 Teen Tournament semifinal game 3.,Double Jeopardy,"(4, 2)",THE BODY HUMAN,29,"(400,)",False,"From constantly using a pencil, you can develop this hardening of the skin",a callus,1,0
1498,1991-02-20,1991 Teen Tournament semifinal game 3.,Double Jeopardy,"(5, 2)",ISLANDS,4,"(400,)",False,Over 500 bison live in the Bison Refuge on Antelope Island in this Utah lake,the Great Salt Lake,1,0
1498,1991-02-20,1991 Teen Tournament semifinal game 3.,Double Jeopardy,"(6, 2)","PLANES, TRAINS & AUTOMOBILES",22,"(400,)",False,The Japanese automaker that introduced the popular MX-5 Miata,Mazda,1,0
1498,1991-02-20,1991 Teen Tournament semifinal game 3.,Double Jeopardy,"(1, 3)",LITERARY ANIMALS,8,"(600,)",False,"In George Orwell's ""Animal Farm"" this boar becomes dictator of all the animals",Napoleon,1,0
1498,1991-02-20,1991 Teen Tournament semifinal game 3.,Double Jeopardy,"(2, 3)",AMERICAN HISTORY,14,"(600,)",False,"It's now thought that an internal explosion, not a mine, caused this ship to sink in Havana Harbor in 1898",the U.S. Maine,1,0
1498,1991-02-20,1991 Teen Tournament semifinal game 3.,Double Jeopardy,"(3, 3)",COLLEGES & UNIVERSITIES,18,"(600,)",False,Rev. John Witherspoon was president of this N.J. university when he signed the Declaration of Independence,Princeton,1,0
1498,1991-02-20,1991 Teen Tournament semifinal game 3.,Double Jeopardy,"(4, 3)",THE BODY HUMAN,28,"(600,)",False,Skin grafts often involve the replacement of these two layers of skin,the epidermis & the dermis,1,0
1498,1991-02-20,1991 Teen Tournament semifinal game 3.,Double Jeopardy,"(5, 3)",ISLANDS,3,"(600,)",False,Qeshm & Bahrain are the largest inhabited islands in this gulf,the Persian Gulf,1,0
1498,1991-02-20,1991 Teen Tournament semifinal game 3.,Double Jeopardy,"(6, 3)","PLANES, TRAINS & AUTOMOBILES",23,"(600,)",False,This huge wooden plane was flown only 1 time -- for less than a mile by Howard Hughes,the Spruce Goose,1,0
1498,1991-02-20,1991 Teen Tournament semifinal game 3.,Double Jeopardy,"(1, 4)",LITERARY ANIMALS,9,"(3000,)",True,This wild horse from Arabia made its first appearance in a 1941 book by Walter Farley,the Black Stallion,0,1
1498,1991-02-20,1991 Teen Tournament semifinal game 3.,Double Jeopardy,"(2, 4)",AMERICAN HISTORY,11,"(800,)",False,This settlement's economy grew after John Rolfe found that tobacco could be successfully grown there,Jamestown,1,0
1498,1991-02-20,1991 Teen Tournament semifinal game 3.,Double Jeopardy,"(3, 4)",COLLEGES & UNIVERSITIES,17,"(1500,)",True,You'll find both campuses of Northwestern University on this Great Lake,Lake Michigan,1,0
1498,1991-02-20,1991 Teen Tournament semifinal game 3.,Double Jeopardy,"(4, 4)",THE BODY HUMAN,27,"(800,)",False,The first part of the small intestine loops around this organ which produces insulin,the pancreas,1,0
1498,1991-02-20,1991 Teen Tournament semifinal game 3.,Double Jeopardy,"(5, 4)",ISLANDS,2,"(800,)",False,"Royale, Joseph & Devil's Islands make up the Safety Islands owned by this country",France,1,0
1498,1991-02-20,1991 Teen Tournament semifinal game 3.,Double Jeopardy,"(6, 4)","PLANES, TRAINS & AUTOMOBILES",25,"(800,)",False,The term for jets like the Concorde that travel faster than the speed of sound,SSTs (or supersonic [transport]),1,0
1498,1991-02-20,1991 Teen Tournament semifinal game 3.,Double Jeopardy,"(1, 5)",LITERARY ANIMALS,10,"(1000,)",False,"Owned by black sharecroppers, this Wm. H. Armstrong title dog was named for his loud, clear bark",Sounder,1,2
1498,1991-02-20,1991 Teen Tournament semifinal game 3.,Double Jeopardy,"(2, 5)",AMERICAN HISTORY,12,"(1000,)",False,19th century term for the belief that U.S. expansion across North America was destined by God,Manifest Destiny,1,0
1498,1991-02-20,1991 Teen Tournament semifinal game 3.,Double Jeopardy,"(3, 5)",COLLEGES & UNIVERSITIES,16,"(1000,)",False,This town with a religious-sounding name is home to the main campus of the University of North Carolina,Chapel Hill,1,0
1498,1991-02-20,1991 Teen Tournament semifinal game 3.,Double Jeopardy,"(4, 5)",THE BODY HUMAN,24,"(1000,)",False,Air enters the lungs through these two tubes which are extensions of the trachea,bronchial tubes,1,1
1498,1991-02-20,1991 Teen Tournament semifinal game 3.,Double Jeopardy,"(5, 5)",ISLANDS,1,"(1000,)",False,"Stewart Island, south of South Island, is this island country's third largest",New Zealand,1,0
1498,1991-02-20,1991 Teen Tournament semifinal game 3.,Double Jeopardy,"(6, 5)","PLANES, TRAINS & AUTOMOBILES",26,"(1000,)",False,"A golden spike was driven into the ground at Promontory Point, Utah when this was completed",the (first) Transcontinental Railroad,1,0
1498,1991-02-20,1991 Teen Tournament semifinal game 3.,Final Jeopardy,"(1, 1)",U.S. CITIES,0,"(800, 5799, 1200)",False,"Tho not founded until 1791, this city has the most historic places listed in the National Register","Washington, D.C.",3,0
