epNum,airDate,extra_info,round_name,coord,category,order,value,daily_double,question,answer,correctAttempts,wrongAttempts
1553,1991-05-08,1991 College Championship quarterfinal game 3.,Jeopardy,"(1, 1)",WORD ORIGINS,7,"(100,)",False,This word for an obnoxious person or a troublesome animal is a variation of vermin,a varmint,0,0
1553,1991-05-08,1991 College Championship quarterfinal game 3.,Jeopardy,"(2, 1)",BIBLICAL CITIES,1,"(100,)",False,The city of Gath was home to this Philistine giant,Goliath,0,0
1553,1991-05-08,1991 College Championship quarterfinal game 3.,Jeopardy,"(3, 1)",1949,18,"(100,)",False,This camera which produced a print in 60 seconds went on sale May 11,a Polaroid,0,0
1553,1991-05-08,1991 College Championship quarterfinal game 3.,Jeopardy,"(4, 1)",ANATOMY,2,"(100,)",False,"This organ has occipital, parietal, temporal & frontal lobes",the brain,0,0
1553,1991-05-08,1991 College Championship quarterfinal game 3.,Jeopardy,"(5, 1)",SINGERS,14,"(100,)",False,This bald rock star topped Mr. Blackwell's 1991 list of the worst-dressed women,Sinead O'Connor,0,0
1553,1991-05-08,1991 College Championship quarterfinal game 3.,Jeopardy,"(6, 1)",ROOMS,15,"(100,)",False,"Your rec room may look like a wreck, but ""rec"" is short for this",recreation,0,0
1553,1991-05-08,1991 College Championship quarterfinal game 3.,Jeopardy,"(1, 2)",WORD ORIGINS,8,"(200,)",False,"This Catholic celebration of the eucharist comes from the Latin for ""to send""",the mass,0,0
1553,1991-05-08,1991 College Championship quarterfinal game 3.,Jeopardy,"(2, 2)",BIBLICAL CITIES,10,"(200,)",False,Paul had his sight restored in this Syrian city at the hands of Ananias,Damascus,0,0
1553,1991-05-08,1991 College Championship quarterfinal game 3.,Jeopardy,"(3, 2)",1949,19,"(200,)",False,"No longer prime minister, he published ""Their Finest Hour"", vol. 2 of his WWII history",Churchill,0,0
1553,1991-05-08,1991 College Championship quarterfinal game 3.,Jeopardy,"(4, 2)",ANATOMY,3,"(200,)",False,The pollex is the medical name for this part of the body; just ask Siskel or Ebert,the thumb,0,0
1553,1991-05-08,1991 College Championship quarterfinal game 3.,Jeopardy,"(5, 2)",SINGERS,27,"(200,)",False,"In 1991 his 15-year-old son, Sean, wrote some timely new lyrics for his song ""Give Peace A Chance""",John Lennon,0,0
1553,1991-05-08,1991 College Championship quarterfinal game 3.,Jeopardy,"(6, 2)",ROOMS,16,"(200,)",False,This euphemism for bathroom has a cosmetic in its name,a powder room,0,0
1553,1991-05-08,1991 College Championship quarterfinal game 3.,Jeopardy,"(1, 3)",WORD ORIGINS,9,"(300,)",False,"Type of toll road that comes from Middle English for ""spiked barrier""",a turnpike,0,0
1553,1991-05-08,1991 College Championship quarterfinal game 3.,Jeopardy,"(2, 3)",BIBLICAL CITIES,11,"(300,)",False,The tower in the 11th chapter of Genesis was built near this city in the land of Shinar,Babel,0,0
1553,1991-05-08,1991 College Championship quarterfinal game 3.,Jeopardy,"(3, 3)",1949,20,"(300,)",False,In December the nationalist government of China fled from Chengtu to this island,Formosa,0,0
1553,1991-05-08,1991 College Championship quarterfinal game 3.,Jeopardy,"(4, 3)",ANATOMY,4,"(300,)",False,"They're a pair of passageways divided by a bony septum, leading to to the vestibule",the nostrils,0,0
1553,1991-05-08,1991 College Championship quarterfinal game 3.,Jeopardy,"(5, 3)",SINGERS,30,"(300,)",False,"This former Miss America sang ""Some Wings"", the theme of Paul Hogan's film ""Almost An Angel""",Vanessa Williams,0,0
1553,1991-05-08,1991 College Championship quarterfinal game 3.,Jeopardy,"(6, 3)",ROOMS,17,"(300,)",False,You probably don't have one of these rooms named for a royal seat unless you're a monarch,a throne room,0,0
1553,1991-05-08,1991 College Championship quarterfinal game 3.,Jeopardy,"(1, 4)",WORD ORIGINS,23,"(400,)",False,"Number of points for each team in a contest, it comes from Old Norse for 20 & also means 20",the score,0,0
1553,1991-05-08,1991 College Championship quarterfinal game 3.,Jeopardy,"(2, 4)",BIBLICAL CITIES,12,"(400,)",False,"When the scriptures mention Zion, they refer to this city",Jerusalem,0,0
1553,1991-05-08,1991 College Championship quarterfinal game 3.,Jeopardy,"(3, 4)",1949,21,"(400,)",False,"After delivering over 2 mil. tons of supplies, the Allied airlift to this city ended Sept. 30",Berlin,0,0
1553,1991-05-08,1991 College Championship quarterfinal game 3.,Jeopardy,"(4, 4)",ANATOMY,5,"(400,)",False,Dimension in which the large intestine is larger than the small intestine,width (diameter),0,0
1553,1991-05-08,1991 College Championship quarterfinal game 3.,Jeopardy,"(5, 4)",SINGERS,29,"(400,)",False,"""Smooth Operator"" Helen Folasade Adu is known professionally by this name",Sade,0,0
1553,1991-05-08,1991 College Championship quarterfinal game 3.,Jeopardy,"(6, 4)",ROOMS,25,"(400,)",False,"A large room used for dancing or an adjective that describes dances done in it, like the waltz or tango",a ballroom,0,0
1553,1991-05-08,1991 College Championship quarterfinal game 3.,Jeopardy,"(1, 5)",WORD ORIGINS,24,"(500,)",False,Breed of chicken named for a famous American landing site,Plymouth Rock,0,0
1553,1991-05-08,1991 College Championship quarterfinal game 3.,Jeopardy,"(2, 5)",BIBLICAL CITIES,13,"(500,)",False,"""And in the 6th month the angel Gabriel was sent from God unto a city of Galilee, named"" this",Nazareth,0,0
1553,1991-05-08,1991 College Championship quarterfinal game 3.,Jeopardy,"(3, 5)",1949,22,"(500,)",False,"Mr. D. L. Colvin, president of the WCTU, blamed this for American concessions at Yalta","alcohol (drinking, booze)",0,0
1553,1991-05-08,1991 College Championship quarterfinal game 3.,Jeopardy,"(4, 5)",ANATOMY,6,"(500,)",True,"The humerus, radius & ulna meet at this joint",the elbow,0,0
1553,1991-05-08,1991 College Championship quarterfinal game 3.,Jeopardy,"(5, 5)",SINGERS,28,"(500,)",False,"This vocalist heard in ""When Harry Met Sally"" starred in a PBS special called ""Swinging Out with Harry""",Harry Connick Jr.,0,0
1553,1991-05-08,1991 College Championship quarterfinal game 3.,Jeopardy,"(6, 5)",ROOMS,26,"(500,)",False,"A lounge used by actors, probably named for the color it was painted originally",the green room,0,0
1553,1991-05-08,1991 College Championship quarterfinal game 3.,Double Jeopardy,"(1, 1)",EXPLORERS,13,"(200,)",False,"On his 3rd voyage to the New World in 1498, he became the 1st European to reach South America",Columbus,0,0
1553,1991-05-08,1991 College Championship quarterfinal game 3.,Double Jeopardy,"(2, 1)",OPERA,30,"(200,)",False,"Monteverdi wrote one of the first of these extended vocal solos for his 1608 opera ""Arianna""",an aria,0,0
1553,1991-05-08,1991 College Championship quarterfinal game 3.,Double Jeopardy,"(3, 1)",ENGLISH LITERATURE,20,"(200,)",False,"Henry James wrote one ""of a Lady""; James Joyce wrote one ""of the Artist as a Young Man""",a Portrait,0,0
1553,1991-05-08,1991 College Championship quarterfinal game 3.,Double Jeopardy,"(4, 1)",ARCHITECTURE,1,"(200,)",False,"In China, most of these sacred towers have 8 sides & 3 to 15 stories",pagodas,0,0
1553,1991-05-08,1991 College Championship quarterfinal game 3.,Double Jeopardy,"(5, 1)",U.S. STATES,4,"(200,)",False,It's the official state beverage of Mississippi & its source is the official domestic animal of Wisconsin,milk,0,0
1553,1991-05-08,1991 College Championship quarterfinal game 3.,Double Jeopardy,"(6, 1)",TELEVISION,25,"(200,)",False,First name shared by employees of Mel Sharples & Mike Brady,Alice,0,0
1553,1991-05-08,1991 College Championship quarterfinal game 3.,Double Jeopardy,"(1, 2)",EXPLORERS,14,"(400,)",False,"Tasman discovered New Zealand in 1642, but the 1st European to set foot on it was this Briton in 1769",(Captain) Cook,0,0
1553,1991-05-08,1991 College Championship quarterfinal game 3.,Double Jeopardy,"(2, 2)",OPERA,11,"(400,)",False,"Originally, this famed opera house stood on Broadway between 39th & 40th Streets",the Metropolitan,0,0
1553,1991-05-08,1991 College Championship quarterfinal game 3.,Double Jeopardy,"(3, 2)",ENGLISH LITERATURE,21,"(400,)",False,"In title of books by Trollope & Tolkien, this word follows ""Barchester"" & ""The Two""",Towers,0,0
1553,1991-05-08,1991 College Championship quarterfinal game 3.,Double Jeopardy,"(4, 2)",ARCHITECTURE,2,"(400,)",False,"Deposed by his son, Shah Jahan was unable to complete plans to build a replica of this, his wife's tomb",the Taj Mahal,0,0
1553,1991-05-08,1991 College Championship quarterfinal game 3.,Double Jeopardy,"(5, 2)",U.S. STATES,5,"(400,)",False,"Famous flyers from this state include Eddie Rickenbacker, John Glenn & Orville Wright",Ohio,0,0
1553,1991-05-08,1991 College Championship quarterfinal game 3.,Double Jeopardy,"(6, 2)",TELEVISION,26,"(400,)",False,"This ABC western features The Kid, William Cody & James Hickok",The Young Riders,0,0
1553,1991-05-08,1991 College Championship quarterfinal game 3.,Double Jeopardy,"(1, 3)",EXPLORERS,15,"(600,)",False,One of Magellan's ships was first to circumnavigate the Earth; this Englishman's was second,(Sir Francis)  Drake,0,0
1553,1991-05-08,1991 College Championship quarterfinal game 3.,Double Jeopardy,"(2, 3)",OPERA,12,"(600,)",False,The part of Iago is sung by a baritone in this Verdi opera,Otello,0,0
1553,1991-05-08,1991 College Championship quarterfinal game 3.,Double Jeopardy,"(3, 3)",ENGLISH LITERATURE,22,"(600,)",False,"In the epic poem ""Beowulf"", the monster devours Hondscio, one of Beowulf's men",Grendel,0,0
1553,1991-05-08,1991 College Championship quarterfinal game 3.,Double Jeopardy,"(4, 3)",ARCHITECTURE,3,"(600,)",False,St. Patrick's Cathedral in New York City was built during a revival of this architectural style,Gothic,0,0
1553,1991-05-08,1991 College Championship quarterfinal game 3.,Double Jeopardy,"(5, 3)",U.S. STATES,6,"(600,)",False,"These words in the nicknames of California & New Jersey both end with ""D-E-N""",garden & golden,0,0
1553,1991-05-08,1991 College Championship quarterfinal game 3.,Double Jeopardy,"(6, 3)",TELEVISION,27,"(1000,)",True,"In this sitcom's 1991 wedding of the couple seen here, the bride wore the dress from her real wedding in 1989:",Full House,0,0
1553,1991-05-08,1991 College Championship quarterfinal game 3.,Double Jeopardy,"(1, 4)",EXPLORERS,16,"(800,)",False,"In 1499 King Manuel of Portugal gave this navigator the title ""Admiral of the Sea of India""",(Vasco) da Gama,0,0
1553,1991-05-08,1991 College Championship quarterfinal game 3.,Double Jeopardy,"(2, 4)",OPERA,18,"(800,)",True,E. Humperdinck's sister Adelheid wrote the libretto for this 1893 opera about a brother & sister,Hansel and Gretel,0,0
1553,1991-05-08,1991 College Championship quarterfinal game 3.,Double Jeopardy,"(3, 4)",ENGLISH LITERATURE,23,"(800,)",False,Jane Austen title heroine whose last name is Woodhouse,Emma,0,0
1553,1991-05-08,1991 College Championship quarterfinal game 3.,Double Jeopardy,"(4, 4)",ARCHITECTURE,9,"(800,)",False,The largest dome of ancient architecture covers this Roman temple dedicated to all gods,the Pantheon,0,0
1553,1991-05-08,1991 College Championship quarterfinal game 3.,Double Jeopardy,"(5, 4)",U.S. STATES,7,"(800,)",False,This state was named for the man who was King of England in 1732,Georgia,0,0
1553,1991-05-08,1991 College Championship quarterfinal game 3.,Double Jeopardy,"(6, 4)",TELEVISION,28,"(800,)",False,"Dr. Harry Weston on ""Empty Nest"" practices in this state",Florida,0,0
1553,1991-05-08,1991 College Championship quarterfinal game 3.,Double Jeopardy,"(1, 5)",EXPLORERS,19,"(1000,)",False,"In 1889 this former N.Y. Herald reporter discovered the ""Mountains of the Moon"" in E. Central Africa",(Henry) Stanley,0,0
1553,1991-05-08,1991 College Championship quarterfinal game 3.,Double Jeopardy,"(2, 5)",OPERA,17,"(1000,)",False,"If you saw ""The Godfather, Part III"" you know ""Cavalleria rusticana"" is set on this Italian island",Sicily,0,0
1553,1991-05-08,1991 College Championship quarterfinal game 3.,Double Jeopardy,"(3, 5)",ENGLISH LITERATURE,24,"(1000,)",False,"This Scotsman was working on his novel ""Weir of Hermiston"" when he died suddenly on Samoa",Robert Louis Stevenson,0,0
1553,1991-05-08,1991 College Championship quarterfinal game 3.,Double Jeopardy,"(4, 5)",ARCHITECTURE,10,"(1000,)",False,"Flanked by aisles, this chief area within a church extends from the main entrance to the sanctuary",the nave,0,0
1553,1991-05-08,1991 College Championship quarterfinal game 3.,Double Jeopardy,"(5, 5)",U.S. STATES,8,"(1000,)",False,It borders 4 of the 5 Great Lakes,Michigan,0,0
1553,1991-05-08,1991 College Championship quarterfinal game 3.,Double Jeopardy,"(6, 5)",TELEVISION,29,"(1000,)",False,This David Hasselhoff series has been given mouth-to-mouth & will return '91 in syndication,Baywatch,0,0
1553,1991-05-08,1991 College Championship quarterfinal game 3.,Final Jeopardy,"(1, 1)",GOVERNMENT & POLITICS,0,(),False,"1 of 2 federal positions that by law pay the same salary as the vice presidency, $160,600 a year",(1 of) Speaker of the House or Chief Justice (of the United States),0,0
