epNum,airDate,extra_info,round_name,coord,category,order,value,daily_double,question,answer,correctAttempts,wrongAttempts
158,1985-04-17,,Jeopardy,"(1, 1)",ANATOMY,15,"(100,)",False,"Common name of the patella, often knocked against the coffee table",the kneecap,0,0
158,1985-04-17,,Jeopardy,"(2, 1)",TOYS & GAMES,10,"(100,)",False,"In a standard deck, the number of red face cards",6,0,0
158,1985-04-17,,Jeopardy,"(3, 1)",COLORS,18,"(100,)",False,A well-intentioned untruth,a white lie,0,0
158,1985-04-17,,Jeopardy,"(4, 1)",TRIVIA,1,"(100,)",False,Nickname sea Capt. William Driver gave to the U.S. flag,Old Glory,0,0
158,1985-04-17,,Jeopardy,"(5, 1)",U.S. STATES,2,"(100,)",False,"For over 150 years, this state ranked 1st in population",New York,0,0
158,1985-04-17,,Jeopardy,"(6, 1)",WINTER SPORTS,4,"(100,)",False,Motorized sledding,snowmobiling,0,0
158,1985-04-17,,Jeopardy,"(1, 2)",ANATOMY,16,"(200,)",False,A man walking places pressure of up to 2000 lbs. per sq. inch on the bones in this,feet,0,0
158,1985-04-17,,Jeopardy,"(2, 2)",TOYS & GAMES,11,"(200,)",False,"According to The Who, that deaf, dumb & blind kid, Tommy, plays a mean game of this",pinball,0,0
158,1985-04-17,,Jeopardy,"(3, 2)",COLORS,19,"(200,)",False,Streetwalkers' turf named for the lanterns that once beckoned from their windows,the red light district,0,0
158,1985-04-17,,Jeopardy,"(4, 2)",TRIVIA,3,"(200,)",False,"Until 1600s, diners brought these weapons to the table to use as utensils",knives,0,0
158,1985-04-17,,Jeopardy,"(5, 2)",U.S. STATES,22,"(200,)",False,"Greatest single source of water power in U.S., the Grand Coulee Dam, is in this state",Washington,0,0
158,1985-04-17,,Jeopardy,"(6, 2)",WINTER SPORTS,5,"(200,)",False,"To do this, you put 2 ""baskets"" on your feet & take three giant steps",snowshoe,0,0
158,1985-04-17,,Jeopardy,"(1, 3)",ANATOMY,17,"(300,)",False,"Covered with mucous membrane, this muscle lies on the floor of the mouth",the tongue,0,0
158,1985-04-17,,Jeopardy,"(2, 3)",TOYS & GAMES,12,"(1900,)",True,"Toy title of the following: ""I should have known / You'd bid me farewell / There's a lesson to be learned from this / And I learned it very well / Now I know you're not the only starfish in the sea /If I never hear your name again...""","a ""Red Rubber Ball""",0,0
158,1985-04-17,,Jeopardy,"(3, 3)",COLORS,20,"(300,)",False,"French for ""Turkish stone"", this gem came to  name the color it represents",turquoise,0,0
158,1985-04-17,,Jeopardy,"(4, 3)",TRIVIA,7,"(300,)",False,"Due to falling cosmic dust, this ""mother"" gains up to 30,000 metric tons a day",Mother Earth,0,0
158,1985-04-17,,Jeopardy,"(6, 3)",WINTER SPORTS,6,"(300,)",False,The diagonal stride is the basic move in this popular form of Nordic skiing,cross country,0,0
158,1985-04-17,,Jeopardy,"(2, 4)",TOYS & GAMES,13,"(400,)",False,"Stunts in this game include downs & ups, eggs in a basket, sweeps, scatters & over & back",jacks,0,0
158,1985-04-17,,Jeopardy,"(3, 4)",COLORS,21,"(400,)",False,Metaphoric tongue color of an eloquent orator,silver,0,0
158,1985-04-17,,Jeopardy,"(4, 4)",TRIVIA,8,"(400,)",False,"As a cartoonist he created the clown Weary Willie, then went on to play him in the circus",Emmett Kelly,0,0
158,1985-04-17,,Jeopardy,"(5, 4)",U.S. STATES,25,"(400,)",False,"This number of nations have flown ""flags over Texas""",6,0,0
158,1985-04-17,,Jeopardy,"(2, 5)",TOYS & GAMES,14,"(500,)",False,Number of dice thrown in a 1st roll of Yahtzee,5,0,0
158,1985-04-17,,Jeopardy,"(3, 5)",COLORS,23,"(500,)",False,"Name for cowboys on their 1st cattle drive, it's come to mean any inexperienced person",a greenhorn,0,0
158,1985-04-17,,Jeopardy,"(4, 5)",TRIVIA,9,"(500,)",False,It falls on the 1st Sunday after the 1st full moon after March 21,Easter,0,0
158,1985-04-17,,Jeopardy,"(5, 5)",U.S. STATES,24,"(500,)",False,2 of 4 states named after kings,"(2 of) Georgia, Louisiana, North & South Carolina",0,0
158,1985-04-17,,Double Jeopardy,"(1, 1)",MYTHS & LEGENDS,11,"(200,)",False,"Controversy has raged since 6th century over this unknown creature in a Scottish ""lake""",the Loch Ness Monster,0,0
158,1985-04-17,,Double Jeopardy,"(2, 1)",A.K.A.,1,"(200,)",False,The naked truth about this calendar girl is that her given name was Norma Jean Baker,Marilyn Monroe,0,0
158,1985-04-17,,Double Jeopardy,"(3, 1)",EUROPE,10,"(200,)",False,It's the largest Russian city in Europe,Moscow,0,0
158,1985-04-17,,Double Jeopardy,"(4, 1)",PROVERBS,13,"(200,)",False,An idle mind is said to be his workshop,the devil,0,0
158,1985-04-17,,Double Jeopardy,"(5, 1)",BUSINESS & INDUSTRY,6,"(200,)",False,"In 1984, he filed a $225 million lawsuit against MGM/UA for breaking their ""Bond"" with him",Sean Connery,0,0
158,1985-04-17,,Double Jeopardy,"(6, 1)",14-LETTER WORDS,3,"(200,)",False,Getting stuck in an elevator might trigger this fear of closed places,claustrophobia,0,0
158,1985-04-17,,Double Jeopardy,"(1, 2)",MYTHS & LEGENDS,12,"(400,)",False,"Day of the week named for the chief Teutonic god, called Odin or Woden",Wednesday,0,0
158,1985-04-17,,Double Jeopardy,"(2, 2)",A.K.A.,2,"(400,)",False,I just called to say his real name is Stevland Morris,Stevie Wonder,0,0
158,1985-04-17,,Double Jeopardy,"(3, 2)",EUROPE,19,"(400,)",False,The smaller half of Berlin in both population and area,East Berlin,0,0
158,1985-04-17,,Double Jeopardy,"(4, 2)",PROVERBS,14,"(400,)",False,"What ""He that troubles his own house will inherit""",the wind,0,0
158,1985-04-17,,Double Jeopardy,"(5, 2)",BUSINESS & INDUSTRY,22,"(400,)",False,Coleco infuriated parents all over the country by sending out late birthday cards for these,Cabbage Patch Kids,0,0
158,1985-04-17,,Double Jeopardy,"(6, 2)",14-LETTER WORDS,4,"(400,)",False,Rich Little's specialties,impersonations,0,0
158,1985-04-17,,Double Jeopardy,"(1, 3)",MYTHS & LEGENDS,18,"(600,)",False,Legendary cowboy who used a rattlesnake as a whip & taught broncos how to buck,Pecos Bill,0,0
158,1985-04-17,,Double Jeopardy,"(2, 3)",A.K.A.,7,"(600,)",False,"Born Anna Maria Italiano, she's now sometimes known as Mrs. Mel Brooks",Anne Bancroft,0,0
158,1985-04-17,,Double Jeopardy,"(3, 3)",EUROPE,20,"(2000,)",True,"This pair of daily astronomical events never occurs in Hammerfest, Norway between May 14th & July 28th",sunrise & sunset,0,0
158,1985-04-17,,Double Jeopardy,"(4, 3)",PROVERBS,16,"(600,)",False,"According to many, ""The only place where success comes before work"" is in this book",the dictionary,0,0
158,1985-04-17,,Double Jeopardy,"(6, 3)",14-LETTER WORDS,5,"(600,)",False,These kinds of differences can be grounds for divorce,irreconcilable,0,0
158,1985-04-17,,Double Jeopardy,"(1, 4)",MYTHS & LEGENDS,25,"(800,)",False,"According to Hebrew legend, dark & mysterious Lilith was his 1st wife",Adam,0,0
158,1985-04-17,,Double Jeopardy,"(2, 4)",A.K.A.,8,"(1000,)",True,"For Ethel Zimmerman & Ermes Effron Borgnino, their marriage was a very brief encounter",Ethel Merman & Ernest Borgnine,0,0
158,1985-04-17,,Double Jeopardy,"(4, 4)",PROVERBS,17,"(800,)",False,"Columnist Walter Morrow's ""Economics in Eight Words"" says, ""There's no such thing as"" this",a free lunch,0,0
158,1985-04-17,,Double Jeopardy,"(6, 4)",14-LETTER WORDS,15,"(800,)",False,Duddy Kravitz went through his in 1974,the apprenticeship,0,0
158,1985-04-17,,Double Jeopardy,"(1, 5)",MYTHS & LEGENDS,24,"(1000,)",False,"At Venus's order, Cupid made this hard-to-please queen of Carthage fall in love with Aeneas",Dido,0,0
158,1985-04-17,,Double Jeopardy,"(2, 5)",A.K.A.,9,"(1000,)",False,"Once Arnold Dorsey, he took the name of an opera composer",Engelbert Humperdinck,0,0
158,1985-04-17,,Double Jeopardy,"(4, 5)",PROVERBS,21,"(1000,)",False,"It's ""how the tree inclines""",the twig is bent,0,0
158,1985-04-17,,Double Jeopardy,"(6, 5)",14-LETTER WORDS,23,"(1000,)",False,"Representing the purest essence, or most typical example of something",quintessential,0,0
158,1985-04-17,,Final Jeopardy,"(1, 1)",SOAP OPERAS,0,(),False,CBS soap opera which is the only soap left on the air which began on radio,The Guiding Light,0,0
