epNum,airDate,extra_info,round_name,coord,category,order,value,daily_double,question,answer,correctAttempts,wrongAttempts
1654,1991-11-07,1991 Tournament of Champions quarterfinal game 4.,Jeopardy,"(1, 1)",BODIES OF WATER,25,"(100,)",False,"This ocean's deepest point, about 28,000 feet, is in the Puerto Rico Trench",Atlantic,1,0
1654,1991-11-07,1991 Tournament of Champions quarterfinal game 4.,Jeopardy,"(2, 1)",NEWS 1991,18,"(100,)",False,In April 1991 The Washington Post pointed out that this chief of staff seemed to fly free a lot,John Sununu,1,0
1654,1991-11-07,1991 Tournament of Champions quarterfinal game 4.,Jeopardy,"(3, 1)",FILM BIOGRAPHIES,16,"(100,)",False,In 1953 Tony Curtis portrayed this magician in a highly fictionalized account of his life,Harry Houdini,1,0
1654,1991-11-07,1991 Tournament of Champions quarterfinal game 4.,Jeopardy,"(4, 1)",FICTIONAL CHARACTERS,10,"(100,)",False,Her married name was Hedda Tesman,Hedda Gabler,1,0
1654,1991-11-07,1991 Tournament of Champions quarterfinal game 4.,Jeopardy,"(5, 1)",NAME BRANDS,1,"(100,)",False,"Eagle, Tiempo & Arriva are three tire brands from this rubber company",Goodyear,1,0
1654,1991-11-07,1991 Tournament of Champions quarterfinal game 4.,Jeopardy,"(6, 1)",FOREIGN WORDS & PHRASES,4,"(100,)",False,"This Hebrew drinking toast literally means ""To Life!""",L\'chaim,1,0
1654,1991-11-07,1991 Tournament of Champions quarterfinal game 4.,Jeopardy,"(1, 2)",BODIES OF WATER,26,"(200,)",False,The Navy shipyard at Bremerton in Washington state is on this inlet of the Pacific,Puget Sound,1,0
1654,1991-11-07,1991 Tournament of Champions quarterfinal game 4.,Jeopardy,"(2, 2)",NEWS 1991,22,"(200,)",False,In August 1991 Shannon Lucid became the first U.S. woman to spend more than 430 hours here,Space,1,0
1654,1991-11-07,1991 Tournament of Champions quarterfinal game 4.,Jeopardy,"(3, 2)",FILM BIOGRAPHIES,17,"(200,)",False,"This composer was portrayed by Don Ameche in ""Swanee River"" & Bill Shirley in ""I Dream of Jeannie""",Stephen Foster,1,0
1654,1991-11-07,1991 Tournament of Champions quarterfinal game 4.,Jeopardy,"(4, 2)",FICTIONAL CHARACTERS,11,"(200,)",False,A 1962 Solzhenitsyn work describes one day in the life of this prisoner,Ivan Denisovich,1,0
1654,1991-11-07,1991 Tournament of Champions quarterfinal game 4.,Jeopardy,"(5, 2)",NAME BRANDS,2,"(200,)",False,This Kansas City-based greeting card company also produces Springbok jigsaw puzzles,Hallmark,1,0
1654,1991-11-07,1991 Tournament of Champions quarterfinal game 4.,Jeopardy,"(6, 2)",FOREIGN WORDS & PHRASES,5,"(200,)",False,"For bravery in action a French soldier might receive this decoration meaning ""cross of war""",the Croix de Guerre,1,0
1654,1991-11-07,1991 Tournament of Champions quarterfinal game 4.,Jeopardy,"(1, 3)",BODIES OF WATER,27,"(300,)",False,"Quesham, the largest island in the Persian Gulf, is located in this strait",Strait of Hormuz,1,0
1654,1991-11-07,1991 Tournament of Champions quarterfinal game 4.,Jeopardy,"(2, 3)",NEWS 1991,23,"(300,)",False,"A 6,000-pound segment of this was put on display at the Reagan Library",Berlin Wall,1,0
1654,1991-11-07,1991 Tournament of Champions quarterfinal game 4.,Jeopardy,"(3, 3)",FILM BIOGRAPHIES,19,"(300,)",False,"""I Aim at the Stars"" told the story of this German rocket scientist & his adjustments to life in the U.S.",Wernher von Braun,1,0
1654,1991-11-07,1991 Tournament of Champions quarterfinal game 4.,Jeopardy,"(4, 3)",FICTIONAL CHARACTERS,12,"(300,)",False,"According to the title of a D.H. Lawrence novel, it's who Mellors is","""Lady Chatterley\'s Lover""",0,3
1654,1991-11-07,1991 Tournament of Champions quarterfinal game 4.,Jeopardy,"(5, 3)",NAME BRANDS,3,"(300,)",False,Western Forge makes this brand of hand tools for Sears,Craftsman,1,0
1654,1991-11-07,1991 Tournament of Champions quarterfinal game 4.,Jeopardy,"(6, 3)",FOREIGN WORDS & PHRASES,6,"(300,)",False,"This French term can describe a chicken, ham & cheese dish or the master chef who prepared it",Cordon bleu,0,3
1654,1991-11-07,1991 Tournament of Champions quarterfinal game 4.,Jeopardy,"(1, 4)",BODIES OF WATER,28,"(400,)",False,"Divided between Switzerland & France, it's the largest Alpine lake in Europe",Lake Geneva,1,0
1654,1991-11-07,1991 Tournament of Champions quarterfinal game 4.,Jeopardy,"(2, 4)",NEWS 1991,24,"(400,)",False,"On August 9, 1991, General Joseph Hoar replaced this man as chief of the U.S. Central Command",Norman Schwarzkopf,1,0
1654,1991-11-07,1991 Tournament of Champions quarterfinal game 4.,Jeopardy,"(3, 4)",FILM BIOGRAPHIES,20,"(400,)",False,"Herbert Marshall portrayed this writer in ""The Moon and Sixpence"" & ""The Razor's Edge""",Somerset Maugham,1,0
1654,1991-11-07,1991 Tournament of Champions quarterfinal game 4.,Jeopardy,"(4, 4)",FICTIONAL CHARACTERS,13,"(400,)",False,"In this Ray Bradbury novel, fireman Guy Montague has the job of burning books","""Fahrenheit 451""",1,0
1654,1991-11-07,1991 Tournament of Champions quarterfinal game 4.,Jeopardy,"(5, 4)",NAME BRANDS,7,"(400,)",False,This company introduced Bartles & Jaymes wine coolers in 1985,Gallo,1,0
1654,1991-11-07,1991 Tournament of Champions quarterfinal game 4.,Jeopardy,"(6, 4)",FOREIGN WORDS & PHRASES,8,"(400,)",False,"Negus, Amharic for king, was the title formerly given to emperors of this African country",Ethiopia,1,0
1654,1991-11-07,1991 Tournament of Champions quarterfinal game 4.,Jeopardy,"(1, 5)",BODIES OF WATER,29,"(500,)",False,An underwater cable in this sea provides communication between Australia & New Zealand,Tasman Sea,1,0
1654,1991-11-07,1991 Tournament of Champions quarterfinal game 4.,Jeopardy,"(2, 5)",NEWS 1991,30,"(500,)",False,"""60 Minutes"" spent 14 of its minutes in a tribute to this newsman, August 11, 1991",Harry Reasoner,1,0
1654,1991-11-07,1991 Tournament of Champions quarterfinal game 4.,Jeopardy,"(3, 5)",FILM BIOGRAPHIES,21,"(500,)",False,In 1929 George Arliss played this prime minister & won an Oscar,Benjamin Disraeli,1,0
1654,1991-11-07,1991 Tournament of Champions quarterfinal game 4.,Jeopardy,"(4, 5)",FICTIONAL CHARACTERS,14,"(500,)",False,The murder of this perfumery girl occured about 2 years after the atrocity in the Rue Morgue,Marie Roget,1,0
1654,1991-11-07,1991 Tournament of Champions quarterfinal game 4.,Jeopardy,"(5, 5)",NAME BRANDS,9,"(800,)",True,This chemical company makes Saran Wrap & Handi-Wrap,Dow,1,0
1654,1991-11-07,1991 Tournament of Champions quarterfinal game 4.,Jeopardy,"(6, 5)",FOREIGN WORDS & PHRASES,15,"(500,)",False,"""Locos y ninos dicen la verdad"" is the Spanish way of saying ""Fools and children"" do this",Speak the truth,1,0
1654,1991-11-07,1991 Tournament of Champions quarterfinal game 4.,Double Jeopardy,"(1, 1)",OHIO,11,"(200,)",False,"Ohio's state beverage is this, the juice that looks like V-8",Tomato juice,1,0
1654,1991-11-07,1991 Tournament of Champions quarterfinal game 4.,Double Jeopardy,"(2, 1)",MILITARY LEADERS,16,"(200,)",False,Robert E. Lee's truce flag was delivered to this general in 1865; in 1876 he was killed at Little Big Horn,George Custer,1,0
1654,1991-11-07,1991 Tournament of Champions quarterfinal game 4.,Double Jeopardy,"(3, 1)",MUSIC,17,"(200,)",False,"Usually, a prelude is an introduction to a fugue & this is one to an opera",Overture,1,0
1654,1991-11-07,1991 Tournament of Champions quarterfinal game 4.,Double Jeopardy,"(4, 1)",UNDER THE MICROSCOPE,26,"(200,)",False,"With some helpful & some harmful to humans, they come in 3 shapes: rod-shaped, round & spiral",Bacteria,1,1
1654,1991-11-07,1991 Tournament of Champions quarterfinal game 4.,Double Jeopardy,"(5, 1)",HENRY VIII'S WIVES,1,"(200,)",False,"Henry's 2nd wife, she was the sister of one of his former mistresses",Anne Boleyn,1,0
1654,1991-11-07,1991 Tournament of Champions quarterfinal game 4.,Double Jeopardy,"(6, 1)",POETS,3,"(200,)",False,"In 1838, she moved with her family to 50 Wimpole Street in London",Elizabeth Barrett Browning,1,0
1654,1991-11-07,1991 Tournament of Champions quarterfinal game 4.,Double Jeopardy,"(1, 2)",OHIO,12,"(400,)",False,The white-tailed species of this animal is the only large game mammal in the state today,Deer,1,0
1654,1991-11-07,1991 Tournament of Champions quarterfinal game 4.,Double Jeopardy,"(2, 2)",MILITARY LEADERS,19,"(400,)",False,"This U.S. tank commander's diary ""War As I Knew It"" was published posthumously in 1947",George S. Patton,1,0
1654,1991-11-07,1991 Tournament of Champions quarterfinal game 4.,Double Jeopardy,"(3, 2)",MUSIC,18,"(400,)",False,"Detache, richochet & tremolo are ways to use this on a violin",Bow,1,0
1654,1991-11-07,1991 Tournament of Champions quarterfinal game 4.,Double Jeopardy,"(4, 2)",UNDER THE MICROSCOPE,27,"(400,)",False,To reproduce asexually a paramecium just does this,Divides,1,0
1654,1991-11-07,1991 Tournament of Champions quarterfinal game 4.,Double Jeopardy,"(5, 2)",HENRY VIII'S WIVES,2,"(400,)",False,"She was the younger sister of the tragic Spanish queen known as ""Joan the Mad""",Catherine of Aragon,1,0
1654,1991-11-07,1991 Tournament of Champions quarterfinal game 4.,Double Jeopardy,"(6, 2)",POETS,7,"(400,)",False,"British poet who wrote, ""If you can keep your head when all about you are losing theirs and blaming it on you""",Rudyard Kipling,1,0
1654,1991-11-07,1991 Tournament of Champions quarterfinal game 4.,Double Jeopardy,"(1, 3)",OHIO,13,"(600,)",False,This U.S. Senator is chairman of the Senate Governmental Affairs Committee,John Glenn,1,1
1654,1991-11-07,1991 Tournament of Champions quarterfinal game 4.,Double Jeopardy,"(2, 3)",MILITARY LEADERS,20,"(600,)",False,"Nicknamed ""Hap"", he's the only man to hold the rank of General of the Army & General of the Air Force",Henry H. Arnold,1,0
1654,1991-11-07,1991 Tournament of Champions quarterfinal game 4.,Double Jeopardy,"(3, 3)",MUSIC,23,"(600,)",False,"From the Italian for ""broad"", it's a direction indicating play at a slow speed",Largo,1,1
1654,1991-11-07,1991 Tournament of Champions quarterfinal game 4.,Double Jeopardy,"(4, 3)",UNDER THE MICROSCOPE,28,"(600,)",False,"The Latin for ""poison"", it needs to be in a living cell to reproduce",Virus,1,0
1654,1991-11-07,1991 Tournament of Champions quarterfinal game 4.,Double Jeopardy,"(5, 3)",HENRY VIII'S WIVES,4,"(600,)",False,"She was the 3rd Catherine who married Henry, I kid you not",Catherine Parr,1,0
1654,1991-11-07,1991 Tournament of Champions quarterfinal game 4.,Double Jeopardy,"(6, 3)",POETS,8,"(600,)",False,"In his 30s, he supplemented his income by teaching at the Pinkerton Academy in Derry, New Hampshire",Robert Frost,1,0
1654,1991-11-07,1991 Tournament of Champions quarterfinal game 4.,Double Jeopardy,"(1, 4)",OHIO,14,"(800,)",False,"A presidential library in Fremont houses the papers of this 19th president, & Lucy's, too",Rutherford B. Hayes,1,0
1654,1991-11-07,1991 Tournament of Champions quarterfinal game 4.,Double Jeopardy,"(2, 4)",MILITARY LEADERS,21,"(800,)",False,In May 1918 this French marshal became Supreme Commander of the Allied Forces in World War I,Ferdinand Foch,1,1
1654,1991-11-07,1991 Tournament of Champions quarterfinal game 4.,Double Jeopardy,"(3, 4)",MUSIC,24,"(800,)",False,This symbol is usually used to mark the end of a composition,Double bar lines,1,0
1654,1991-11-07,1991 Tournament of Champions quarterfinal game 4.,Double Jeopardy,"(4, 4)",UNDER THE MICROSCOPE,29,"(800,)",False,Observations by this deft storekeeper in Delft began the science of microbiology,Anton van Leeuwenhoek,1,0
1654,1991-11-07,1991 Tournament of Champions quarterfinal game 4.,Double Jeopardy,"(5, 4)",HENRY VIII'S WIVES,5,"(800,)",False,She was probably Henry's favorite wife because he was buried beside her at Windsor,Jane Seymour,1,0
1654,1991-11-07,1991 Tournament of Champions quarterfinal game 4.,Double Jeopardy,"(6, 4)",POETS,9,"(800,)",False,"As a wedding gift, this poet's father-in-law gave him Craigie House in Cambridge, Massachusetts",Henry Wadsworth Longfellow,1,0
1654,1991-11-07,1991 Tournament of Champions quarterfinal game 4.,Double Jeopardy,"(1, 5)",OHIO,15,"(1000,)",False,The largest single employer of this city associated with aviation is Wright-Patterson Air Force Base,Dayton,1,0
1654,1991-11-07,1991 Tournament of Champions quarterfinal game 4.,Double Jeopardy,"(2, 5)",MILITARY LEADERS,22,"(1000,)",False,"Hannibal was defeated at Zama in north Africa by this Roman general, who was then called Africanus",Scipio,1,0
1654,1991-11-07,1991 Tournament of Champions quarterfinal game 4.,Double Jeopardy,"(3, 5)",MUSIC,25,"(1000,)",False,Term for the distance in pitch between two tones; C to E is a major third,Interval,1,0
1654,1991-11-07,1991 Tournament of Champions quarterfinal game 4.,Double Jeopardy,"(4, 5)",UNDER THE MICROSCOPE,30,"(1000,)",False,"If an amoeba wanted to trip a passing protozoan, it would stick this out","Pseudopod (the false pod, false foot)",1,1
1654,1991-11-07,1991 Tournament of Champions quarterfinal game 4.,Double Jeopardy,"(5, 5)",HENRY VIII'S WIVES,6,"(2000,)",True,"Henry's rude nickname for her was ""The Flanders Mare""",Anne of Cleves,1,0
1654,1991-11-07,1991 Tournament of Champions quarterfinal game 4.,Double Jeopardy,"(6, 5)",POETS,10,"(2000,)",True,"This black poetess won a Pulitzer for ""Annie Allen"" & became Illinois' poet laureate in 1969",Gwendolyn Brooks,0,1
1654,1991-11-07,1991 Tournament of Champions quarterfinal game 4.,Final Jeopardy,"(1, 1)",THE BIBLE,0,"(1400, 2000, 1600)",False,"The English title of this book is a translation of the Greek word ""arithmoi""",Numbers,3,0
