epNum,airDate,extra_info,round_name,coord,category,order,value,daily_double,question,answer,correctAttempts,wrongAttempts
1707,1992-01-21,,Jeopardy,"(1, 1)",HISTORIC SITES,7,"(100,)",False,This territory was formally transferred to the U.S. at Castle Hill in Sitka,Alaska,1,0
1707,1992-01-21,,Jeopardy,"(2, 1)",ODD JOBS,26,"(100,)",False,The person in charge of the performances at a circus,ringmaster,1,0
1707,1992-01-21,,Jeopardy,"(3, 1)",SPORTS,2,"(100,)",False,In 1989 Paul Tagliabue was elected to succeed Pete Rozelle as this pro sport's commissioner,football,1,1
1707,1992-01-21,,Jeopardy,"(4, 1)",THE SEAS,14,"(100,)",False,Their complex behavior is caused by the gravitational forces of the sun & the moon on the earth,tides,1,0
1707,1992-01-21,,Jeopardy,"(5, 1)",INTERNATIONAL CUISINE,1,"(100,)",False,"To make the Irish dish colcannon, mash these & add cooked onions & cabbage",potatoes,1,0
1707,1992-01-21,,Jeopardy,"(6, 1)","STARTS WITH ""K""",18,"(100,)",False,"Here's a ""purl"" of wisdom: socks, scarves & sweaters can all be made by this method",knitting,1,0
1707,1992-01-21,,Jeopardy,"(1, 2)",HISTORIC SITES,8,"(200,)",False,The Israeli army uses this ancient fortress on the west shore of the Dead Sea for ceremonial purposes,Masada,1,0
1707,1992-01-21,,Jeopardy,"(2, 2)",ODD JOBS,27,"(200,)",False,Term for the person who yells out the figures in square dancing,caller,1,0
1707,1992-01-21,,Jeopardy,"(3, 2)",SPORTS,3,"(200,)",False,"Already a world champion bicycle sprinter, in 1976 Sheila Young won a gold in this fast winter sport",speed skating,1,0
1707,1992-01-21,,Jeopardy,"(4, 2)",THE SEAS,15,"(200,)",False,"Like green plants, some tiny organisms called flagellates contain this food-producing substance",chlorophyll,1,0
1707,1992-01-21,,Jeopardy,"(5, 2)",INTERNATIONAL CUISINE,10,"(200,)",False,Panocha is a Mexican-Spanish word for a raw or brown type of this & for a fudgelike candy made with it,sugar,1,1
1707,1992-01-21,,Jeopardy,"(6, 2)","STARTS WITH ""K""",22,"(200,)",False,"A county in eastern Ireland, or a TV & movie doctor",Kildaire,1,0
1707,1992-01-21,,Jeopardy,"(1, 3)",HISTORIC SITES,9,"(300,)",False,This fortress-city overlooking the Urubamba River may have been the last Inca stronghold,Machu Picchu,1,1
1707,1992-01-21,,Jeopardy,"(2, 3)",ODD JOBS,28,"(300,)",False,A fuller is someone who treats or shrinks this,fabric,1,0
1707,1992-01-21,,Jeopardy,"(3, 3)",SPORTS,4,"(300,)",False,In 1965 this 75-year-old manager of the New York Mets retired & was succeeded by Wes Westrum,Casey Stengel,1,0
1707,1992-01-21,,Jeopardy,"(4, 3)",THE SEAS,19,"(300,)",False,"Cyclones over the North Atlantic are called hurricanes, those over the China Sea are called these",typhoons,1,0
1707,1992-01-21,,Jeopardy,"(5, 3)",INTERNATIONAL CUISINE,11,"(300,)",False,"This grain is one of the main ingredients in kedgeree, an Anglo-Indian dish",rice,1,0
1707,1992-01-21,,Jeopardy,"(6, 3)","STARTS WITH ""K""",23,"(300,)",False,This organization is known as the K. of C. for short,Knights of Columbus,1,0
1707,1992-01-21,,Jeopardy,"(1, 4)",HISTORIC SITES,16,"(400,)",False,The first oil well in the United States was at Titusville in this state,Pennsylvania,1,0
1707,1992-01-21,,Jeopardy,"(2, 4)",ODD JOBS,29,"(400,)",False,The soldier who carries the flag or colors of a military unit,color bearer (standard bearer),1,0
1707,1992-01-21,,Jeopardy,"(3, 4)",SPORTS,5,"(400,)",False,"Other than the U.S., 1 of 2 countries to win Olympic gold medals in men's basketball",(1 of) Soviet Union (or Yugoslavia),1,0
1707,1992-01-21,,Jeopardy,"(4, 4)",THE SEAS,20,"(400,)",False,The first attempt to map this was made in 1850 by the U.S. Navy officer Matthew Fontaine Maury,the bottom on the sea,0,3
1707,1992-01-21,,Jeopardy,"(5, 4)",INTERNATIONAL CUISINE,12,"(400,)",False,"Chines markets sell ""hundred-year-old"" ones of these that have been preserved with lime & ashes",eggs,1,0
1707,1992-01-21,,Jeopardy,"(6, 4)","STARTS WITH ""K""",24,"(400,)",False,This adjective often describes a rousing speech that's the highlight of a political convention,keynote address,1,0
1707,1992-01-21,,Jeopardy,"(1, 5)",HISTORIC SITES,17,"(500,)",False,For the first time in history 5 U.S. presidents met for the opening of this in November 1991,Ronald Reagan Library,1,0
1707,1992-01-21,,Jeopardy,"(2, 5)",ODD JOBS,30,"(500,)",False,"A costermonger, now any street peddler, came from costard, a type of this fruit",apple,1,0
1707,1992-01-21,,Jeopardy,"(3, 5)",SPORTS,6,"(800,)",True,This sport combines cross-country skiing with rifle-shooting skills,biathlon,1,0
1707,1992-01-21,,Jeopardy,"(4, 5)",THE SEAS,21,"(500,)",False,Electrical resistance is used to measure this in sea water,salinity,1,0
1707,1992-01-21,,Jeopardy,"(5, 5)",INTERNATIONAL CUISINE,13,"(500,)",False,"A dish made or garnished with this green vegetable or its puree is described as ""St. Germain""",(green) peas,1,0
1707,1992-01-21,,Jeopardy,"(6, 5)","STARTS WITH ""K""",25,"(500,)",False,"Moscow-born abstract artist who wrote ""Concerning the Spiritual in Art"" in 1912",Kandinsky,1,1
1707,1992-01-21,,Double Jeopardy,"(1, 1)",FAMOUS NAMES,22,"(200,)",False,Former U.N. Secretary-Genaral Kurt Waldheim has been pres. of this country since 1986,Austria,1,0
1707,1992-01-21,,Double Jeopardy,"(2, 1)",WORLD GEOGRAPHY,2,"(200,)",False,The African kingdom of Buganda was located in what's now this country,Uganda,1,0
1707,1992-01-21,,Double Jeopardy,"(3, 1)",FICTIONAL CHARACTERS,19,"(200,)",False,"At the end of Edmond Rostand's play, Roxane professes her love for this hero",Cyrano de Bergerac,1,0
1707,1992-01-21,,Double Jeopardy,"(4, 1)",COLLEGES & UNIVERSITIES,8,"(200,)",False,The Illini go to Illinois & the Elis to this school,Yale,1,0
1707,1992-01-21,,Double Jeopardy,"(5, 1)",CHEMISTRY,1,"(200,)",False,About 1869 Julius Lothar Meyer & Dmitry Mendeleyev came up with this chart separately,periodic table,1,0
1707,1992-01-21,,Double Jeopardy,"(6, 1)",THE FRENCH REVOLUTION,16,"(200,)",False,"The Committee of Public Safety held power by using this, which gave their reign its name",terror,1,0
1707,1992-01-21,,Double Jeopardy,"(1, 2)",FAMOUS NAMES,24,"(400,)",False,Brig. General Theodore Roosevelt Jr. led the 4th Division ashore at Utah Beach in this invasion,D-Day,1,0
1707,1992-01-21,,Double Jeopardy,"(2, 2)",WORLD GEOGRAPHY,3,"(400,)",False,A separate Turkish state was proclaimed on this Mediterranean island in 1975,Cyprus,1,0
1707,1992-01-21,,Double Jeopardy,"(3, 2)",FICTIONAL CHARACTERS,23,"(400,)",False,Scarlett O'Hara married Charles Hamilton after losing this man to Melanie,Ashley Wilkes,1,0
1707,1992-01-21,,Double Jeopardy,"(4, 2)",COLLEGES & UNIVERSITIES,10,"(400,)",False,"He entered Princeton at age 13, graduated at 16 & went on to be Jefferson's vice president",Aaron Burr,1,1
1707,1992-01-21,,Double Jeopardy,"(5, 2)",CHEMISTRY,4,"(400,)",False,Putting a little sodium into a Bunsen burner flame will turn the flame this color,yellow,1,0
1707,1992-01-21,,Double Jeopardy,"(6, 2)",THE FRENCH REVOLUTION,17,"(400,)",False,The mob that stormed the Bastille was looking for these,weapons,0,3
1707,1992-01-21,,Double Jeopardy,"(1, 3)",FAMOUS NAMES,25,"(600,)",False,He participated in the 1st mechanized trip to the South Pole as well as the 1st expedition to climb Everest,(Sir Edmund) Hillary,1,0
1707,1992-01-21,,Double Jeopardy,"(2, 3)",WORLD GEOGRAPHY,9,"(600,)",False,The largest island surrounded by fresh water is Ilha de Marajo in this South American river,Amazon,1,0
1707,1992-01-21,,Double Jeopardy,"(3, 3)",FICTIONAL CHARACTERS,26,"(600,)",False,"25 years after ""The Hustler"", this Walter Tevis character was revived for ""The Color of Money""","""Fast Eddie"" Felson",0,3
1707,1992-01-21,,Double Jeopardy,"(4, 3)",COLLEGES & UNIVERSITIES,13,"(600,)",False,This future president of El Salvador was a member of Notre  Dame's class of 1948,Napoleón Duarte,1,0
1707,1992-01-21,,Double Jeopardy,"(5, 3)",CHEMISTRY,5,"(600,)",False,"In the atmosphere, this common gas exists mainly as a molecule of 2 atoms",oxygen,0,3
1707,1992-01-21,,Double Jeopardy,"(6, 3)",THE FRENCH REVOLUTION,18,"(600,)",False,"This king decided to join the emigres, nobles who fled the country, but was arrested at Varennes",Louis XVI,1,0
1707,1992-01-21,,Double Jeopardy,"(1, 4)",FAMOUS NAMES,27,"(800,)",False,"Ho Chi Minh's nickname was Bac Ho, bac meaning this relative in Vietnamese",uncle,1,0
1707,1992-01-21,,Double Jeopardy,"(2, 4)",WORLD GEOGRAPHY,11,"(800,)",False,A statue of Roger Williams stands in a park overlooking this city Williams founded in 1636,Providence,1,0
1707,1992-01-21,,Double Jeopardy,"(4, 4)",COLLEGES & UNIVERSITIES,14,"(800,)",False,This Midwest University is home to the Kinsey Institute,Indiana,0,3
1707,1992-01-21,,Double Jeopardy,"(5, 4)",CHEMISTRY,6,"(800,)",False,It's created when the molecules on the top of a liquid are attracted to each other,surface film (surface tension),1,0
1707,1992-01-21,,Double Jeopardy,"(6, 4)",THE FRENCH REVOLUTION,20,"(800,)",False,"This leader was arrested , tried & guillotined within 48 hours at the end of July 1794",Robespierre,1,0
1707,1992-01-21,,Double Jeopardy,"(1, 5)",FAMOUS NAMES,28,"(8000,)",True,Familial relationship of Madame Sun Yat-sen to Madame Chiang Kai-shek,sisters,1,0
1707,1992-01-21,,Double Jeopardy,"(2, 5)",WORLD GEOGRAPHY,12,"(2000,)",True,Gatun Lake & Miraflores Lake are part of this waterway,Panama Canal,1,0
1707,1992-01-21,,Double Jeopardy,"(4, 5)",COLLEGES & UNIVERSITIES,15,"(1000,)",False,"West Point's colors are black, grey & gold, the colors of the ingredients in this",gunpowder,1,0
1707,1992-01-21,,Double Jeopardy,"(5, 5)",CHEMISTRY,7,"(1000,)",False,"1 amu, or atomic mass unit is 1/12 of the mass of an atom of this element",carbon,0,3
1707,1992-01-21,,Double Jeopardy,"(6, 5)",THE FRENCH REVOLUTION,21,"(1000,)",False,"The 1791 constitution divided France into these, which still exist today",departments,1,1
1707,1992-01-21,,Final Jeopardy,"(1, 1)",U.S.A.,0,"(700, 0, 5000)",False,"This community outside Washington, D.C. is named after a Presbyterian church built there in 1820","Bethesda, Maryland",0,3
