epNum,airDate,extra_info,round_name,coord,category,order,value,daily_double,question,answer,correctAttempts,wrongAttempts
1770,1992-04-17,Bruce Simmons game 5.,Jeopardy,"(1, 1)",WILD BILL HICKOK,2,"(100,)",False,"Like Annie Oakley, he performed this type of act in Buffalo Bill's Wild West show",sharpshooter,1,0
1770,1992-04-17,Bruce Simmons game 5.,Jeopardy,"(2, 1)",FOUNTAINS,16,"(100,)",False,The object of Ponce de Leon's famous quest,Fountain of Youth,1,0
1770,1992-04-17,Bruce Simmons game 5.,Jeopardy,"(3, 1)",FILMS OF THE '60s,17,"(100,)",False,Richard Pryor had a small part in this 1968 John Wayne film about the Vietnam War,The Green Berets,1,0
1770,1992-04-17,Bruce Simmons game 5.,Jeopardy,"(4, 1)",BOTANY,26,"(100,)",False,"Of peonies, hyacinths or tulips, the one not grown from bulbs",peonies,1,0
1770,1992-04-17,Bruce Simmons game 5.,Jeopardy,"(5, 1)",ODDS & ENDS,1,"(100,)",False,In 1991 he rejoined the Heartbreakers for a new album,Tom Petty,1,0
1770,1992-04-17,Bruce Simmons game 5.,Jeopardy,"(6, 1)",PREFIXES,10,"(100,)",False,"From the Greek word for ""life"", it can precede -logical, -graphical or -degradable",bio,1,0
1770,1992-04-17,Bruce Simmons game 5.,Jeopardy,"(1, 2)",WILD BILL HICKOK,3,"(200,)",False,For a while Hickok drove one of these on the Santa Fe & Oregon Trails,stagecoach,0,3
1770,1992-04-17,Bruce Simmons game 5.,Jeopardy,"(2, 2)",FOUNTAINS,18,"(200,)",False,"On January 1, 1968 he jumped the Caesar's Palace fountains on a motorcycle",Evel Knievel,1,0
1770,1992-04-17,Bruce Simmons game 5.,Jeopardy,"(3, 2)",FILMS OF THE '60s,19,"(200,)",False,"His role as lawyer George Hanson in ""Easy Rider"" helped make him a star",Jack Nicholson,1,0
1770,1992-04-17,Bruce Simmons game 5.,Jeopardy,"(4, 2)",BOTANY,28,"(200,)",False,"A member of the violet family, its name is a corruption of pensee, the French word for ""thought""",pansy,1,0
1770,1992-04-17,Bruce Simmons game 5.,Jeopardy,"(5, 2)",ODDS & ENDS,6,"(200,)",False,"On ""C.P.O. Sharkey"", Don Rickles played a chief officer of this noncommissioned rank",chief petty officer,1,0
1770,1992-04-17,Bruce Simmons game 5.,Jeopardy,"(6, 2)",PREFIXES,11,"(200,)",False,"Meaning half or partly, it can precede -god, -tasse or -monde",demi,1,0
1770,1992-04-17,Bruce Simmons game 5.,Jeopardy,"(1, 3)",WILD BILL HICKOK,4,"(300,)",False,Atter the Civil War Hickok acted as a scout for this ill-fated lieutenant colonel,Custer,1,0
1770,1992-04-17,Bruce Simmons game 5.,Jeopardy,"(2, 3)",FOUNTAINS,23,"(300,)",False,"Architect Nicola Salvi designed this, often called the last great baroque monument in Rome",Trevi Fountain,1,0
1770,1992-04-17,Bruce Simmons game 5.,Jeopardy,"(3, 3)",FILMS OF THE '60s,20,"(300,)",False,"Mel Brooks film in which Gene Wilder & Zero Mostel put on a musical called ""Springtime for Hitler""",The Producers,1,0
1770,1992-04-17,Bruce Simmons game 5.,Jeopardy,"(4, 3)",BOTANY,29,"(300,)",False,The flowers of this member of the water lily family are sacred to Buddhists,lotus,1,0
1770,1992-04-17,Bruce Simmons game 5.,Jeopardy,"(5, 3)",ODDS & ENDS,7,"(300,)",False,"As opposed to financiers, shopkeepers are described as this type of ""bourgeoisie""",petty,1,0
1770,1992-04-17,Bruce Simmons game 5.,Jeopardy,"(6, 3)",PREFIXES,12,"(300,)",False,"When it precedes -adjusted or -nutrition, it means ill or poorly",mal,1,0
1770,1992-04-17,Bruce Simmons game 5.,Jeopardy,"(1, 4)",WILD BILL HICKOK,5,"(400,)",False,"In 1871 he held this post in Abilene, Kansas",marshal,0,3
1770,1992-04-17,Bruce Simmons game 5.,Jeopardy,"(2, 4)",FOUNTAINS,24,"(400,)",False,A fountain in front of this kids' cable network's studios in Orlando spurts out green slime,Nickelodeon,1,0
1770,1992-04-17,Bruce Simmons game 5.,Jeopardy,"(3, 4)",FILMS OF THE '60s,21,"(400,)",False,Woodhouse is the last name of the character Mia Farrow played in this Roman Polanski film,Rosemary\'s Baby,1,0
1770,1992-04-17,Bruce Simmons game 5.,Jeopardy,"(4, 4)",BOTANY,27,"(400,)",False,Gardeners use this spongy & absorbent moss to keep young plants from drying out,peat moss,0,3
1770,1992-04-17,Bruce Simmons game 5.,Jeopardy,"(5, 4)",ODDS & ENDS,8,"(400,)",False,During the 1970s he won the Daytona 500 4 times,Richard Petty,0,3
1770,1992-04-17,Bruce Simmons game 5.,Jeopardy,"(6, 4)",PREFIXES,13,"(400,)",False,"This prefix which can precede -harmonic or -anthropic means ""a love for""",phil,1,0
1770,1992-04-17,Bruce Simmons game 5.,Jeopardy,"(1, 5)",WILD BILL HICKOK,15,"(500,)",False,"His real first name was neither Wild nor Bill, but this",James,0,3
1770,1992-04-17,Bruce Simmons game 5.,Jeopardy,"(2, 5)",FOUNTAINS,25,"(500,)",False,This statue in the Louvre once stood in a fountain on the Greek isle of Samothrace,Winged Victory,1,0
1770,1992-04-17,Bruce Simmons game 5.,Jeopardy,"(3, 5)",FILMS OF THE '60s,22,"(500,)",False,"In this Antonioni film, David Hemmings thinks he spots a murder in a photo he's developing",Blowup,1,0
1770,1992-04-17,Bruce Simmons game 5.,Jeopardy,"(4, 5)",BOTANY,30,"(1500,)",True,"Members of this plant family include peas, clover & lentils",legume,1,0
1770,1992-04-17,Bruce Simmons game 5.,Jeopardy,"(5, 5)",ODDS & ENDS,9,"(500,)",False,"From the French for ""small"", in needlepoint a small stitch is this type of point",petit,1,0
1770,1992-04-17,Bruce Simmons game 5.,Jeopardy,"(6, 5)",PREFIXES,14,"(500,)",False,"Latin for ""as if"", this prefix preceding -stellar or -judicial means seemingly",quasi,1,0
1770,1992-04-17,Bruce Simmons game 5.,Double Jeopardy,"(1, 1)",ANCIENT TIMES,1,"(200,)",False,"No one is sure where Ophir was located, but it was famous in ancient times for this precious metal",gold,1,0
1770,1992-04-17,Bruce Simmons game 5.,Double Jeopardy,"(2, 1)",FASHION DESIGNERS,21,"(200,)",False,"Like Adolfo, Luis Estevez was born in this island country better known for cigars than fashion",Cuba,1,0
1770,1992-04-17,Bruce Simmons game 5.,Double Jeopardy,"(3, 1)",LITERATURE,11,"(200,)",False,Title character whose parents were the former Elizabeth Mollineaux & Walter Shandy,Tristram,1,0
1770,1992-04-17,Bruce Simmons game 5.,Double Jeopardy,"(4, 1)",NEW JERSEY CITIES,6,"(200,)",False,"On May 26, 1978 Resorts International Casino opened its door for the 1st time in this city",Atlantic City,1,0
1770,1992-04-17,Bruce Simmons game 5.,Double Jeopardy,"(5, 1)",MUSIC,16,"(200,)",False,The guitar & mandolin are members of this ancient family of stringed instruments,lute,1,0
1770,1992-04-17,Bruce Simmons game 5.,Double Jeopardy,"(6, 1)",WORLD WAR II,22,"(200,)",False,"He downed 5 Japanese planes on February 20, 1942 & Chicago named an airport after him",O\'Hare,1,0
1770,1992-04-17,Bruce Simmons game 5.,Double Jeopardy,"(1, 2)",ANCIENT TIMES,2,"(400,)",False,The ancient astronomer Anaximander concluded that this planet was the center of the universe,earth,1,0
1770,1992-04-17,Bruce Simmons game 5.,Double Jeopardy,"(2, 2)",FASHION DESIGNERS,30,"(400,)",False,"Hugo's last name, or an office's head honcho",Boss,1,0
1770,1992-04-17,Bruce Simmons game 5.,Double Jeopardy,"(3, 2)",LITERATURE,12,"(400,)",False,"His novel ""You Can't Go Home Again"" was published after his death",Thomas Wolfe,1,0
1770,1992-04-17,Bruce Simmons game 5.,Double Jeopardy,"(4, 2)",NEW JERSEY CITIES,7,"(400,)",False,It was founded in 1666; the international airport came later,Newark,1,0
1770,1992-04-17,Bruce Simmons game 5.,Double Jeopardy,"(5, 2)",MUSIC,17,"(400,)",False,This symbol is placed next to a note to extend it by half its original length,a dot,1,0
1770,1992-04-17,Bruce Simmons game 5.,Double Jeopardy,"(6, 2)",WORLD WAR II,23,"(400,)",False,Over 1500 kamikaze flyers lost their lives trying to defend this largest of the Ryukyu Islands,Okinawa,1,1
1770,1992-04-17,Bruce Simmons game 5.,Double Jeopardy,"(1, 3)",ANCIENT TIMES,3,"(600,)",False,"We don't know if this Babylonian had a ""code"" name for his chief rival, Rim-Sin of Larsa",Hammurabi,1,0
1770,1992-04-17,Bruce Simmons game 5.,Double Jeopardy,"(2, 3)",FASHION DESIGNERS,29,"(600,)",False,"Verri, Venturi & Versace are all based in this city which rivals Paris as a fashion center",Milan,1,1
1770,1992-04-17,Bruce Simmons game 5.,Double Jeopardy,"(3, 3)",LITERATURE,13,"(600,)",False,"This prime minister may have based the title character in his novel ""Vivian Grey"" on himself",Disraeli,1,0
1770,1992-04-17,Bruce Simmons game 5.,Double Jeopardy,"(4, 3)",NEW JERSEY CITIES,8,"(600,)",False,The old barracks in this city were home to British troops during the Revolution,Trenton,1,0
1770,1992-04-17,Bruce Simmons game 5.,Double Jeopardy,"(5, 3)",MUSIC,18,"(600,)",False,"According to the title, it's where Dvorak's Symphony No. 9 is ""From""",The New World,1,0
1770,1992-04-17,Bruce Simmons game 5.,Double Jeopardy,"(6, 3)",WORLD WAR II,24,"(600,)",False,"It was the alias of Nguyen Tat Thanh, who led & organized the Viet Minh",Ho Chi Minh,1,0
1770,1992-04-17,Bruce Simmons game 5.,Double Jeopardy,"(1, 4)",ANCIENT TIMES,4,"(1300,)",True,"The Bible calls these ancient seagoers ""Sidonians""; Sidon was one of their cities",Phoenecians,1,0
1770,1992-04-17,Bruce Simmons game 5.,Double Jeopardy,"(2, 4)",FASHION DESIGNERS,28,"(800,)",False,"Salvatore Ferragamo was most famous for designing these, not dresses",shoes,0,3
1770,1992-04-17,Bruce Simmons game 5.,Double Jeopardy,"(3, 4)",LITERATURE,14,"(4300,)",True,"""Tanglewood Tales"" was his 1853 sequel to ""A Wonder Book for Girls and Boys""",Hawthorne,1,0
1770,1992-04-17,Bruce Simmons game 5.,Double Jeopardy,"(4, 4)",NEW JERSEY CITIES,9,"(800,)",False,The last leaves of grass Walt Whitman saw were in this town known for its soup,Camden,0,3
1770,1992-04-17,Bruce Simmons game 5.,Double Jeopardy,"(5, 4)",MUSIC,19,"(800,)",False,"An 1858 Jacques Offenbach number, or a 1953 Cole Porter musical","""Can Can""",1,0
1770,1992-04-17,Bruce Simmons game 5.,Double Jeopardy,"(6, 4)",WORLD WAR II,25,"(800,)",False,This former SS officer died in France in September 1991,Klaus Barbie,0,3
1770,1992-04-17,Bruce Simmons game 5.,Double Jeopardy,"(1, 5)",ANCIENT TIMES,5,"(1000,)",False,"Egyptian women favored this dark eye make-up made from soot, antimony or Galena, a form of lead ore",kohl,1,1
1770,1992-04-17,Bruce Simmons game 5.,Double Jeopardy,"(2, 5)",FASHION DESIGNERS,27,"(1000,)",False,"Born Donna Faske, she uses this name professionally",Donna Karan,0,3
1770,1992-04-17,Bruce Simmons game 5.,Double Jeopardy,"(3, 5)",LITERATURE,15,"(1000,)",False,"He's a lifelong resident of Albany, New York & ""Ironweed"" was the 3rd novel in his Albany Cycle",William Kennedy,1,0
1770,1992-04-17,Bruce Simmons game 5.,Double Jeopardy,"(4, 5)",NEW JERSEY CITIES,10,"(1000,)",False,"This ""Cape"" is famous for its Victorian houses & lighthouse",Cape May,1,0
1770,1992-04-17,Bruce Simmons game 5.,Double Jeopardy,"(5, 5)",MUSIC,20,"(1000,)",False,"This city's 1st school centered around Beethoven, Haydn & Mozart, the 2nd around Berg, Webern & Schoenberg",Vienna,1,0
1770,1992-04-17,Bruce Simmons game 5.,Double Jeopardy,"(6, 5)",WORLD WAR II,26,"(1000,)",False,"Under Eisenhower, this British commander led the ground forces at Normandy",(Bernard) Montgomery,1,0
1770,1992-04-17,Bruce Simmons game 5.,Final Jeopardy,"(1, 1)",INTERNATIONAL ORGANIZATIONS,0,"(1300, 4800, 8000)",False,"It was founded in Baghdad, Iraq in September 1960",OPEC,2,1
