epNum,airDate,extra_info,round_name,coord,category,order,value,daily_double,question,answer,correctAttempts,wrongAttempts
183,1985-05-22,,Jeopardy,"(1, 1)",PRESIDENTIAL FIRSTS,6,"(100,)",False,"First president to address congress in a radio broadcast, though we remember him as ""silent""",Coolidge,0,0
183,1985-05-22,,Jeopardy,"(2, 1)",BABY CARE,3,"(100,)",False,"For kids like Linus, it provides social ""security""",his blanket,0,0
183,1985-05-22,,Jeopardy,"(3, 1)",NICKNAMES,16,"(100,)",False,The Leathernecks,the Marines,0,0
183,1985-05-22,,Jeopardy,"(4, 1)",TEXAS,1,"(100,)",False,"Where in Texas ""The stars at night are big & bright (clap, clap, clap, clap)...""","""Deep In The Heart Of Texas""",0,0
183,1985-05-22,,Jeopardy,"(5, 1)",FICTIONAL ANIMALS,17,"(100,)",False,"Mr. Moose, Bunny Rabbit & Dancing Bear all visited his TV Treasure House",Captain Kangaroo,0,0
183,1985-05-22,,Jeopardy,"(6, 1)","""NOSE""s",18,"(100,)",False,A photo finish generally means this is how the horserace was won,by a nose,0,0
183,1985-05-22,,Jeopardy,"(1, 2)",PRESIDENTIAL FIRSTS,12,"(200,)",False,First president to serve more than 8 years,Franklin Delano Roosevelt,0,0
183,1985-05-22,,Jeopardy,"(2, 2)",BABY CARE,5,"(200,)",False,"By law, paint on new baby cribs must be free of this element",lead,0,0
183,1985-05-22,,Jeopardy,"(3, 2)",NICKNAMES,27,"(200,)",False,"Since 11 of her 12 husbands met untimely deaths, Martha Jane Canary earned this ""disastrous"" nickname",Calamity Jane,0,0
183,1985-05-22,,Jeopardy,"(4, 2)",TEXAS,2,"(200,)",False,This city is largest in Texas & 5th largest in the U.S.,Houston,0,0
183,1985-05-22,,Jeopardy,"(5, 2)",FICTIONAL ANIMALS,19,"(200,)",False,Appropriate Sonny & Cher song Paul Bunyan might have sung to his ox,"""I Got You Babe""",0,0
183,1985-05-22,,Jeopardy,"(6, 2)","""NOSE""s",21,"(200,)",False,How some pay for expensive rhinoplasty,they pay through the nose,0,0
183,1985-05-22,,Jeopardy,"(1, 3)",PRESIDENTIAL FIRSTS,13,"(300,)",False,The first Republican to win the presidency,Abraham Lincoln,0,0
183,1985-05-22,,Jeopardy,"(2, 3)",BABY CARE,7,"(300,)",False,"With diphtheria & pertussis, the ""T"" in DPT",tetanus,0,0
183,1985-05-22,,Jeopardy,"(3, 3)",NICKNAMES,28,"(1000,)",True,"Before ""nipping it"" off in later life, Burt Reynolds & Marlon Brando shared this childhood nickname",Bud,0,0
183,1985-05-22,,Jeopardy,"(4, 3)",TEXAS,4,"(300,)",False,"You can get a $65,000 desk shaped like your favorite cow at this Texas-based dept. store",Neiman Marcus,0,0
183,1985-05-22,,Jeopardy,"(5, 3)",FICTIONAL ANIMALS,20,"(300,)",False,The 1st animal Alice saw in Wonderland,the White Rabbit,0,0
183,1985-05-22,,Jeopardy,"(6, 3)","""NOSE""s",22,"(300,)",False,It protects a spaceship from heat when re-entering the Earth's atmosphere,the nose cone,0,0
183,1985-05-22,,Jeopardy,"(1, 4)",PRESIDENTIAL FIRSTS,14,"(400,)",False,First president to visit Communist China,Richard Nixon,0,0
183,1985-05-22,,Jeopardy,"(2, 4)",BABY CARE,8,"(400,)",False,"Doctor Spock says that until he's old enough to put his lost teeth under it, he's better off without it",a pillow,0,0
183,1985-05-22,,Jeopardy,"(4, 4)",TEXAS,10,"(400,)",False,"In 1978, William P. Clements became the 1st Republican since 1869 to be elected this",governor,0,0
183,1985-05-22,,Jeopardy,"(5, 4)",FICTIONAL ANIMALS,25,"(400,)",False,Famous animal Sears uses on its line of children's clothing,Winnie the Pooh,0,0
183,1985-05-22,,Jeopardy,"(6, 4)","""NOSE""s",23,"(400,)",False,Rest & ice & pressure relieve it; polyps or a fight could provoke it,a nose bleed,0,0
183,1985-05-22,,Jeopardy,"(1, 5)",PRESIDENTIAL FIRSTS,15,"(500,)",False,George Washington's practice of regularly consulting dept. heads gave rise to this concept,cabinet,0,0
183,1985-05-22,,Jeopardy,"(2, 5)",BABY CARE,9,"(500,)",False,Most experts agree that nursing mothers should drink at least this much milk a day,a quart,0,0
183,1985-05-22,,Jeopardy,"(4, 5)",TEXAS,11,"(500,)",False,"As big as Rhode Island, this ""royal"" ranch is Texas' largest",the King Ranch,0,0
183,1985-05-22,,Jeopardy,"(5, 5)",FICTIONAL ANIMALS,26,"(500,)",False,"Nurse Nana was one in James Barrie's ""Peter Pan""",dog,0,0
183,1985-05-22,,Jeopardy,"(6, 5)","""NOSE""s",24,"(500,)",False,"A hand-held bouquet in Victorian Eng. which signified ""He loves me"" or ""Not"" by type of flowers",a nosegay,0,0
183,1985-05-22,,Double Jeopardy,"(1, 1)",CLASSICAL MUSIC,9,"(200,)",False,Common name of the instrument known as the pianoforte,the piano,0,0
183,1985-05-22,,Double Jeopardy,"(2, 1)",GOVERNMENT,1,"(200,)",False,"British P.M. who said ""Democracy is the worst system devised by man, except for the others""",Winston Churchill,0,0
183,1985-05-22,,Double Jeopardy,"(3, 1)",20TH CENTURY,19,"(200,)",False,"As a result of this 1912 disaster, all steamships must have enough lifeboats for all passengers",the Titanic disaster,0,0
183,1985-05-22,,Double Jeopardy,"(4, 1)",GREEK MYTHOLOGY,14,"(200,)",False,She was the patron goddess & guardian of what is now Greece's capital city,Athena,0,0
183,1985-05-22,,Double Jeopardy,"(5, 1)",TOUGH TRIVIA,6,"(200,)",False,None of the members of this Herb Alpert band are Hispanics,the Tijuana Brass,0,0
183,1985-05-22,,Double Jeopardy,"(6, 1)","STARTS WITH ""G""",16,"(200,)",False,Francisco Franco's superlative title,generalissimo,0,0
183,1985-05-22,,Double Jeopardy,"(1, 2)",CLASSICAL MUSIC,5,"(400,)",False,The instrumental prelude to an opera,the overture,0,0
183,1985-05-22,,Double Jeopardy,"(2, 2)",GOVERNMENT,7,"(400,)",False,"A representative government, or what Plato called his ideal state",the republic,0,0
183,1985-05-22,,Double Jeopardy,"(3, 2)",20TH CENTURY,20,"(400,)",False,"In December '84, the Pentagon announced it would put a spy satellite over this country",the Soviet Union,0,0
183,1985-05-22,,Double Jeopardy,"(4, 2)",GREEK MYTHOLOGY,13,"(400,)",False,"To Greeks a race of mighty women; to South Americans, their mighty river",Amazon,0,0
183,1985-05-22,,Double Jeopardy,"(5, 2)",TOUGH TRIVIA,15,"(400,)",False,Words with which Betty Furness assured appliance buyers,You can be sure if it's Westinghouse,0,0
183,1985-05-22,,Double Jeopardy,"(6, 2)","STARTS WITH ""G""",24,"(400,)",False,The study of aging,gerontology,0,0
183,1985-05-22,,Double Jeopardy,"(1, 3)",CLASSICAL MUSIC,2,"(600,)",False,"Known in his time as a plagiarist, he composed the ""Messiah""",George Frideric Handel,0,0
183,1985-05-22,,Double Jeopardy,"(2, 3)",GOVERNMENT,8,"(600,)",False,"Chief executive of a Canadian province, or the French equivalent of prime minister",a premier,0,0
183,1985-05-22,,Double Jeopardy,"(3, 3)",20TH CENTURY,21,"(600,)",False,"This world group dissolved in 1946, the same year the first U.N. General Assembly met",the League of Nations,0,0
183,1985-05-22,,Double Jeopardy,"(4, 3)",GREEK MYTHOLOGY,10,"(600,)",False,"Though known as Helen of Troy, she was actually queen of this warlike city-state",Sparta,0,0
183,1985-05-22,,Double Jeopardy,"(5, 3)",TOUGH TRIVIA,26,"(600,)",False,"In 1907, he became a bank robber to raise funds for fledgling Bolshevik Party",Stalin,0,0
183,1985-05-22,,Double Jeopardy,"(6, 3)","STARTS WITH ""G""",25,"(600,)",False,"Condition caused by too many cars in one area, prohibiting movement in any direction",gridlock,0,0
183,1985-05-22,,Double Jeopardy,"(1, 4)",CLASSICAL MUSIC,3,"(2500,)",True,Prokofiev's folk fable with title characters played by a string quartet & 3 horns,Peter and the Wolf,0,0
183,1985-05-22,,Double Jeopardy,"(2, 4)",GOVERNMENT,17,"(800,)",False,He is the U.S. government's chief law enforcement officer,the attorney general,0,0
183,1985-05-22,,Double Jeopardy,"(3, 4)",20TH CENTURY,22,"(800,)",False,"He was famous for leaving Roosevelt Field, N.Y., May 20, 1927, alone",Lindbergh,0,0
183,1985-05-22,,Double Jeopardy,"(4, 4)",GREEK MYTHOLOGY,11,"(800,)",False,"Like Lot's wife, this fabled musician should never have looked back",Orpheus,0,0
183,1985-05-22,,Double Jeopardy,"(5, 4)",TOUGH TRIVIA,27,"(800,)",False,"Title character's favorite baseball player in ""The Old Man & the Sea""",Joe DiMaggio,0,0
183,1985-05-22,,Double Jeopardy,"(1, 5)",CLASSICAL MUSIC,4,"(1000,)",False,An Offenbach opera is based on his Tales,(E.T.A.) Hoffmann,0,0
183,1985-05-22,,Double Jeopardy,"(2, 5)",GOVERNMENT,18,"(1000,)",False,It's West Germany's lower house of parliament,Bundestag,0,0
183,1985-05-22,,Double Jeopardy,"(3, 5)",20TH CENTURY,23,"(1500,)",True,"In March 1979, this mediator signed the Camp David peace treaty as the witness",President Carter,0,0
183,1985-05-22,,Double Jeopardy,"(4, 5)",GREEK MYTHOLOGY,12,"(1000,)",False,"With snakes for hair & eyes that weep blood, the ""Eumenides"" pursued & tormented sinners",the Furies (or the Erinyes),0,0
183,1985-05-22,,Double Jeopardy,"(5, 5)",TOUGH TRIVIA,28,"(1000,)",False,"""Unusual"" middle name of former Defense Secretary Robert S. McNamara",Strange,0,0
183,1985-05-22,,Final Jeopardy,"(1, 1)",THE OSCARS,0,(),False,"From 1978-81, all Oscar winners for Best Supporting Actress had these same initials",M.S.,0,0
