epNum,airDate,extra_info,round_name,coord,category,order,value,daily_double,question,answer,correctAttempts,wrongAttempts
1937,1993-01-26,Diane Siegel game 2.,Jeopardy,"(1, 1)",ARIZONA,29,"(100,)",False,More than half of Arizonans live in this capital's metro area,Phoenix,0,0
1937,1993-01-26,Diane Siegel game 2.,Jeopardy,"(2, 1)",MARLENE DIETRICH,7,"(100,)",False,"Though she was born in Germany, Marlene toured the world entertaining Allied troops during this war",WWII,0,0
1937,1993-01-26,Diane Siegel game 2.,Jeopardy,"(3, 1)",MASCOTS,11,"(100,)",False,Qantas Airways has used this animal as its corporate mascot since 1967,a koala bear,0,0
1937,1993-01-26,Diane Siegel game 2.,Jeopardy,"(4, 1)",KNIGHTS & KNIGHTHOOD,1,"(100,)",False,"In addition to his helmet, body armor & steel shoes, a knight wore these metal gloves",gauntlets,0,0
1937,1993-01-26,Diane Siegel game 2.,Jeopardy,"(5, 1)",ZONES,12,"(100,)",False,"Rod Serling called it ""a fifth dimension beyond that which is known to man""",the Twilight Zone,0,0
1937,1993-01-26,Diane Siegel game 2.,Jeopardy,"(6, 1)",IN OTHER WORDS...,27,"(100,)",False,Attired for murder,dressed to kill,0,0
1937,1993-01-26,Diane Siegel game 2.,Jeopardy,"(1, 2)",ARIZONA,28,"(200,)",False,From 1952 to 1988 Arizona went for this party's nominee in each presidential election,Republicans,0,0
1937,1993-01-26,Diane Siegel game 2.,Jeopardy,"(2, 2)",MARLENE DIETRICH,8,"(200,)",False,"Marlene monkeyed around in ""Blonde Venus"" dressed as one of these big apes",a gorilla,0,0
1937,1993-01-26,Diane Siegel game 2.,Jeopardy,"(3, 2)",MASCOTS,23,"(200,)",False,A real cow named Elsie has been the mascot of this firm's Dairy Division since the 1939 World's Fair,Borden,0,0
1937,1993-01-26,Diane Siegel game 2.,Jeopardy,"(4, 2)",KNIGHTS & KNIGHTHOOD,2,"(200,)",False,"Knights followed this code of behavior which comes from a French word for ""horseman""",chivalry,0,0
1937,1993-01-26,Diane Siegel game 2.,Jeopardy,"(5, 2)",ZONES,13,"(200,)",False,Catch the ball here in football & you get 6 points,the end zone,0,0
1937,1993-01-26,Diane Siegel game 2.,Jeopardy,"(6, 2)",IN OTHER WORDS...,21,"(200,)",False,Stay a single hop in the lead,keep one step ahead,0,0
1937,1993-01-26,Diane Siegel game 2.,Jeopardy,"(1, 3)",ARIZONA,6,"(300,)",False,"The state motto, Ditat Deus, means he ""enriches""",God,0,0
1937,1993-01-26,Diane Siegel game 2.,Jeopardy,"(2, 3)",MARLENE DIETRICH,19,"(300,)",False,A portrait of Marlene was the symbol of this French film festival in 1992; she died 1 day before it opened,the Cannes Film Festival,0,0
1937,1993-01-26,Diane Siegel game 2.,Jeopardy,"(3, 3)",MASCOTS,25,"(300,)",False,This type of dog serves as the symbol & mascot of Mack Trucks,a bulldog,0,0
1937,1993-01-26,Diane Siegel game 2.,Jeopardy,"(4, 3)",KNIGHTS & KNIGHTHOOD,3,"(300,)",False,This heavy club with a spiked or flanged head was used to crush an opponent's armor,a mace,0,0
1937,1993-01-26,Diane Siegel game 2.,Jeopardy,"(5, 3)",ZONES,14,"(300,)",False,In October 1979 the U.S. government gave back about 65% of this zone to its home country,the Panama Canal zone,0,0
1937,1993-01-26,Diane Siegel game 2.,Jeopardy,"(6, 3)",IN OTHER WORDS...,5,"(300,)",False,Weightless like one plume,light as a feather,0,0
1937,1993-01-26,Diane Siegel game 2.,Jeopardy,"(1, 4)",ARIZONA,22,"(400,)",False,This is the largest Indian tribe in Arizona,the Navajo,0,0
1937,1993-01-26,Diane Siegel game 2.,Jeopardy,"(2, 4)",MARLENE DIETRICH,20,"(400,)",False,"Rumors said Marlene & this ""Morocco"" co-star became lovers; perhaps they met at ""High Noon""",Gary Cooper,0,0
1937,1993-01-26,Diane Siegel game 2.,Jeopardy,"(3, 4)",MASCOTS,24,"(400,)",False,"Misha, the mascot for the 1980 Summer Olympics in Moscow, was this type of animal",bear,0,0
1937,1993-01-26,Diane Siegel game 2.,Jeopardy,"(4, 4)",KNIGHTS & KNIGHTHOOD,4,"(400,)",False,Knights are addressed as sir; the wives of knights are addressed in this way,ladies,0,0
1937,1993-01-26,Diane Siegel game 2.,Jeopardy,"(5, 4)",ZONES,17,"(400,)",False,"Apples are grown in this zone, not subtropical or tropical",the temperate Zone,0,0
1937,1993-01-26,Diane Siegel game 2.,Jeopardy,"(6, 4)",IN OTHER WORDS...,9,"(400,)",False,A pair of people is required for the performance of a ballroom dance with a lot of posing,it takes two to tango,0,0
1937,1993-01-26,Diane Siegel game 2.,Jeopardy,"(1, 5)",ARIZONA,16,"(500,)",False,Arizona State University in this city has one of the world's largest meteorite collections,Tempe,0,0
1937,1993-01-26,Diane Siegel game 2.,Jeopardy,"(2, 5)",MARLENE DIETRICH,30,"(500,)",False,"Film fans fell in love with Marlene when she sang ""Falling In Love Again"" in this ""colorful"" film",The Blue Angel,0,0
1937,1993-01-26,Diane Siegel game 2.,Jeopardy,"(3, 5)",MASCOTS,26,"(500,)",False,In 1955 Mach 1 became the first Falcon mascot of this U.S. service academy,the Air Force,0,0
1937,1993-01-26,Diane Siegel game 2.,Jeopardy,"(4, 5)",KNIGHTS & KNIGHTHOOD,10,"(500,)",False,At 14 a page moved up to this position to look after a knight's arms & care for his horses,squire,0,0
1937,1993-01-26,Diane Siegel game 2.,Jeopardy,"(5, 5)",ZONES,18,"(600,)",True,They're about 15 degrees of longitude wide,time zones,0,0
1937,1993-01-26,Diane Siegel game 2.,Jeopardy,"(6, 5)",IN OTHER WORDS...,15,"(500,)",False,Clench one's cloche,hold on to your hat,0,0
1937,1993-01-26,Diane Siegel game 2.,Double Jeopardy,"(1, 1)",THE CIVIL WAR,1,"(200,)",False,Stephen Sears names Lincoln as the most written-about Civil War figure & this Southerner second,Lee,0,0
1937,1993-01-26,Diane Siegel game 2.,Double Jeopardy,"(2, 1)",ART,7,"(200,)",False,"The ""Flowers of the Four Seasons"" was a popular theme in this country during its Sung Dynasty",China,0,0
1937,1993-01-26,Diane Siegel game 2.,Double Jeopardy,"(3, 1)",ANCIENT CITIES,21,"(200,)",False,"Now Egypt's second- largest city, over 2,000 years ago it was the capital",Alexandria,0,0
1937,1993-01-26,Diane Siegel game 2.,Double Jeopardy,"(5, 1)",FICTIONAL CHARACTERS,15,"(200,)",False,"In 1893 Arthur Conan Doyle killed this sleuth, only to bring him back in another story",Sherlock Holmes,0,0
1937,1993-01-26,Diane Siegel game 2.,Double Jeopardy,"(1, 2)",THE CIVIL WAR,4,"(400,)",False,In March 1862 he was appointed military governor of Tennessee,Andrew Johnson,0,0
1937,1993-01-26,Diane Siegel game 2.,Double Jeopardy,"(2, 2)",ART,8,"(400,)",False,Thomas Gainsborough sometimes exhibited his paintings at his home in Pall Mall in this city,London,0,0
1937,1993-01-26,Diane Siegel game 2.,Double Jeopardy,"(3, 2)",ANCIENT CITIES,24,"(400,)",False,"When it was ruled by the Egyptians & Romans, this Jordanian capital was called Philadelphia",Amman,0,0
1937,1993-01-26,Diane Siegel game 2.,Double Jeopardy,"(4, 2)",BIRTHSTONES,28,"(400,)",False,"The largest one of these april gems, the Cullinan, was found in 1905 in South Africa",diamond,0,0
1937,1993-01-26,Diane Siegel game 2.,Double Jeopardy,"(5, 2)",FICTIONAL CHARACTERS,3,"(400,)",False,"He's the aging one-eyed marshal in the novel & movie ""True Grit""",Rooster Cogburn,0,0
1937,1993-01-26,Diane Siegel game 2.,Double Jeopardy,"(6, 2)",NOBEL PHYSICISTS,27,"(400,)",False,"In recognition of their work in wireless telegraphy, the 1909 prize went to Karl Braun & this Italian",Marconi,0,0
1937,1993-01-26,Diane Siegel game 2.,Double Jeopardy,"(1, 3)",THE CIVIL WAR,9,"(600,)",False,"War order number 3 of March 11, 1862 removed him from his command as the Union Army's general-in-chief",McClellan,0,0
1937,1993-01-26,Diane Siegel game 2.,Double Jeopardy,"(2, 3)",ART,23,"(600,)",False,"This Dutchman painted his self-portrait with Saskia, his new bride, around 1635",Rembrandt,0,0
1937,1993-01-26,Diane Siegel game 2.,Double Jeopardy,"(3, 3)",ANCIENT CITIES,6,"(600,)",False,Ancient Sumerian sources say that Kish was the site of the first dynasty after this catastrophe,the flood,0,0
1937,1993-01-26,Diane Siegel game 2.,Double Jeopardy,"(4, 3)",BIRTHSTONES,26,"(600,)",False,"This January gem takes its name from the pomegranate, whose seeds it resembles",garnet,0,0
1937,1993-01-26,Diane Siegel game 2.,Double Jeopardy,"(5, 3)",FICTIONAL CHARACTERS,16,"(600,)",False,This Tolstoy heroine almost dies after giving birth to Count Vronsky's baby,Anna Karenina,0,0
1937,1993-01-26,Diane Siegel game 2.,Double Jeopardy,"(6, 3)",NOBEL PHYSICISTS,2,"(600,)",False,"Because they furthered his work, this pair shared the 1903 prize with Antoine-Henri Becquerel",the Curies,0,0
1937,1993-01-26,Diane Siegel game 2.,Double Jeopardy,"(1, 4)",THE CIVIL WAR,19,"(800,)",False,"The campaign that ended with a second battle here began at Cedar Mountain August 9, 1862",the Battle of Bull Run,0,0
1937,1993-01-26,Diane Siegel game 2.,Double Jeopardy,"(2, 4)",ART,20,"(800,)",False,"Pop artist Roy's last name, it sounds like a tiny country in Europe",Lichtenstein,0,0
1937,1993-01-26,Diane Siegel game 2.,Double Jeopardy,"(3, 4)",ANCIENT CITIES,22,"(800,)",False,These ancient mariners founded Cadiz & Carthage,the Phoenicians,0,0
1937,1993-01-26,Diane Siegel game 2.,Double Jeopardy,"(4, 4)",BIRTHSTONES,25,"(800,)",False,This light bluish gem for March was once a talisman for sailors,aquamarine,0,0
1937,1993-01-26,Diane Siegel game 2.,Double Jeopardy,"(5, 4)",FICTIONAL CHARACTERS,10,"(3000,)",True,"In an 1896 novel by H.G. Wells, this doctor attempts to turn animals into men",Dr. Moreau,0,0
1937,1993-01-26,Diane Siegel game 2.,Double Jeopardy,"(6, 4)",NOBEL PHYSICISTS,5,"(800,)",False,"1991's prize went to Pierre-Gilles de Gennes, who figured out how these are arranged in Super Glue",molecules,0,0
1937,1993-01-26,Diane Siegel game 2.,Double Jeopardy,"(1, 5)",THE CIVIL WAR,17,"(1000,)",False,"The formal date of surrender for this Mississippi city was July 4, 1863",Vicksburg,0,0
1937,1993-01-26,Diane Siegel game 2.,Double Jeopardy,"(2, 5)",ART,13,"(1000,)",False,"This surrealist included the view from his Spanish home in ""The Sacrament of the Last Supper""",Dalí,0,0
1937,1993-01-26,Diane Siegel game 2.,Double Jeopardy,"(3, 5)",ANCIENT CITIES,12,"(1000,)",False,"He began his diggings in 1870 & went on to find the ancient cities of Troy, Mycenae & Tiryns",Heinrich Schliemann,0,0
1937,1993-01-26,Diane Siegel game 2.,Double Jeopardy,"(4, 5)",BIRTHSTONES,18,"(100,)",True,Cleopatra is said to have been fond of this November stone because it reminded her of honey,topaz,0,0
1937,1993-01-26,Diane Siegel game 2.,Double Jeopardy,"(5, 5)",FICTIONAL CHARACTERS,14,"(1000,)",False,At 18 she leaves the Lowood School to become a governess at Thornfield Manor,Jane Eyre,0,0
1937,1993-01-26,Diane Siegel game 2.,Double Jeopardy,"(6, 5)",NOBEL PHYSICISTS,11,"(1000,)",False,Antony Hewish co-won in 1974 for his work in the discovery of these radio signal-emitting stars,pulsars,0,0
1937,1993-01-26,Diane Siegel game 2.,Final Jeopardy,"(1, 1)",ODD JOBS,0,(),False,"It was the profession of Lou Jacobs, the model for a 1966 postage stamp, who died in Sarasota in 1992",a clown,0,0
