epNum,airDate,extra_info,round_name,coord,category,order,value,daily_double,question,answer,correctAttempts,wrongAttempts
1978,1993-03-24,,Jeopardy,"(1, 1)",POETS,5,"(100,)",False,"Her ""Last Poems"" were compiled by her husband Robert & published the year after her death",Elizabeth Barrett Browning,0,0
1978,1993-03-24,,Jeopardy,"(2, 1)",CELEBRITY JEOPARDY!,2,"(100,)",False,"I'm the one-time child actor who directed ""Far and Away"", one of the best Tom Cruise movies of 1992",Ron Howard,0,0
1978,1993-03-24,,Jeopardy,"(3, 1)",COMMUNICATIONS,7,"(100,)",False,In 1858 it took about 25 days to get a message from New York to San Francisco; in 1861 this cut it down to seconds,the telegraph,0,0
1978,1993-03-24,,Jeopardy,"(4, 1)",THE CIVIL WAR,1,"(100,)",False,Jeb Stuart made a fashion statement by wearing an ostrich plume or a peacock feather in this,his hat,0,0
1978,1993-03-24,,Jeopardy,"(5, 1)",LEGAL LINGO,21,"(100,)",False,"It's the malicious burning of a property, perhaps to collect the insurance",arson,0,0
1978,1993-03-24,,Jeopardy,"(6, 1)","""O"" NO!",16,"(100,)",False,It's a great shape for an egg or for the U.S. president's office,oval,0,0
1978,1993-03-24,,Jeopardy,"(1, 2)",POETS,8,"(200,)",False,In 1982 this Welsh poet was honored posthumously with a plaque in Westminster Abbey,Dylan Thomas,0,0
1978,1993-03-24,,Jeopardy,"(2, 2)",CELEBRITY JEOPARDY!,14,"(200,)",False,"I'm someone who always goes ""Out on a Limb""",Shirley MacLaine,0,0
1978,1993-03-24,,Jeopardy,"(3, 2)",COMMUNICATIONS,10,"(200,)",False,2-word term for the gestures & facial expressions a person uses in nonverbal communication,body language,0,0
1978,1993-03-24,,Jeopardy,"(4, 2)",THE CIVIL WAR,3,"(200,)",False,Some people claim Union colonel Ulric Dahlgren plotted to kill this Confederate president,Jefferson Davis,0,0
1978,1993-03-24,,Jeopardy,"(5, 2)",LEGAL LINGO,22,"(200,)",False,It's a false written statement that defames a person's character or reputation,libel,0,0
1978,1993-03-24,,Jeopardy,"(6, 2)","""O"" NO!",17,"(200,)",False,It describes a sandwich using just 1 slice of bread without a covering slice,open-faced,0,0
1978,1993-03-24,,Jeopardy,"(1, 3)",POETS,11,"(300,)",False,"This poet won his fourth Pulitzer Prize in 1943 for ""A Witness Tree""",Robert Frost,0,0
1978,1993-03-24,,Jeopardy,"(2, 3)",CELEBRITY JEOPARDY!,15,"(300,)",False,"Harry Greenberg in ""Bugsy"", at the 1976 Oscars I gave the NCAA final score while presenting",Elliott Gould,0,0
1978,1993-03-24,,Jeopardy,"(3, 3)",COMMUNICATIONS,23,"(300,)",False,"Hey good buddy, CB is short for this",citizen band (or citizen's band),0,0
1978,1993-03-24,,Jeopardy,"(4, 3)",THE CIVIL WAR,4,"(300,)",False,Union general John Basil Turchin was born in this country; his real name was Ivan Vasilovitch Turchinoff,Russia,0,0
1978,1993-03-24,,Jeopardy,"(5, 3)",LEGAL LINGO,26,"(300,)",False,"The name of this official who certifies legal documents is from the Latin for ""stenographer""",notary,0,0
1978,1993-03-24,,Jeopardy,"(6, 3)","""O"" NO!",18,"(300,)",False,"Binoculars for ""The Barber of Seville""",opera glasses,0,0
1978,1993-03-24,,Jeopardy,"(1, 4)",POETS,12,"(400,)",False,"Nicknamed ""Old Possum"", he wrote ""Old Possum's Book of Practical Cats""",T.S. Eliot,0,0
1978,1993-03-24,,Jeopardy,"(2, 4)",CELEBRITY JEOPARDY!,29,"(400,)",False,"I taught the Karate Kid to ""Wax on, wax off""",Pat Morita,0,0
1978,1993-03-24,,Jeopardy,"(3, 4)",COMMUNICATIONS,24,"(400,)",False,2 of the earliest radio stations were WWJ in Detroit & KDKA in this city,"Pittsburgh, Pennsylvania",0,0
1978,1993-03-24,,Jeopardy,"(4, 4)",THE CIVIL WAR,6,"(400,)",False,"This general's soldiers called him ""Old Tecumseh""—Tecumseh was his middle name",William Tecumseh Sherman,0,0
1978,1993-03-24,,Jeopardy,"(5, 4)",LEGAL LINGO,27,"(1700,)",True,This is the unlawful killing of a human being without malice or premeditation,manslaughter,0,0
1978,1993-03-24,,Jeopardy,"(6, 4)","""O"" NO!",19,"(400,)",False,"This ""fruity"" wooden object is a must for manicures",an orange stick,0,0
1978,1993-03-24,,Jeopardy,"(1, 5)",POETS,13,"(500,)",False,"His first major work, ""The New Life"", written circa 1292, describes his love for Beatrice",Dante,0,0
1978,1993-03-24,,Jeopardy,"(2, 5)",CELEBRITY JEOPARDY!,30,"(500,)",False,"Before I was ""Lost in Space"", I was the first American actor to kiss Brigitte Bardot",Billy Mumy,0,0
1978,1993-03-24,,Jeopardy,"(3, 5)",COMMUNICATIONS,25,"(500,)",False,System of communication commonly abbreviated ASL,American Sign Language,0,0
1978,1993-03-24,,Jeopardy,"(4, 5)",THE CIVIL WAR,9,"(500,)",False,"West Woods, Dunker Church & Bloody Lane are landmarks of this extremely bloody Maryland battle",Antietam,0,0
1978,1993-03-24,,Jeopardy,"(5, 5)",LEGAL LINGO,28,"(500,)",False,"This ""friend of the court"" may advise a court on a matter to which he's not a party",amicus curiae,0,0
1978,1993-03-24,,Jeopardy,"(6, 5)","""O"" NO!",20,"(500,)",False,Budapest-born conductor whose name was once almost synonymous with the Philadelphia Orchestra,Eugene Ormandy,0,0
1978,1993-03-24,,Double Jeopardy,"(1, 1)",GREAT RULERS,13,"(200,)",False,By 1810 Kamehameha the Great had united all of these islands under his control,the Hawaiian Islands,0,0
1978,1993-03-24,,Double Jeopardy,"(2, 1)",THE HUMAN BODY,4,"(200,)",False,This part of the eye has about 135 million light-sensitive cells,the retina,0,0
1978,1993-03-24,,Double Jeopardy,"(3, 1)",WORLD FACTS,3,"(200,)",False,"With an area of 64 million square miles, this ocean could hold all the world's land with room to spare",the Pacific Ocean,0,0
1978,1993-03-24,,Double Jeopardy,"(4, 1)",ARCHITECTURE,2,"(200,)",False,"From plans by Louis le Vau, Jules Hardouin-Mansart built the hall of mirrors at this royal residence",Versailles,0,0
1978,1993-03-24,,Double Jeopardy,"(6, 1)",LITERARY CHARACTERS,1,"(200,)",False,"In a novel by John le Carre, Alec Leamas is ""The Spy Who Came In from"" here",the cold,0,0
1978,1993-03-24,,Double Jeopardy,"(1, 2)",GREAT RULERS,16,"(400,)",False,"This 18th century Prussian king was known as ""the Great"" during his lifetime",Frederick,0,0
1978,1993-03-24,,Double Jeopardy,"(2, 2)",THE HUMAN BODY,5,"(400,)",False,"If this gland at the base of the brain fails to function early in life, short stature may result",the pituitary,0,0
1978,1993-03-24,,Double Jeopardy,"(3, 2)",WORLD FACTS,11,"(400,)",False,"During the Persian Gulf war, nearly 70% of this country's oil wells were destroyed or damaged",Kuwait,0,0
1978,1993-03-24,,Double Jeopardy,"(4, 2)",ARCHITECTURE,19,"(400,)",False,Antonio Gaudi's greatest project was the church of the Sagrada Familia in this Spanish city,Barcelona,0,0
1978,1993-03-24,,Double Jeopardy,"(6, 2)",LITERARY CHARACTERS,7,"(400,)",False,"This detective introduced in ""The Maltese Falcon"" later appeared in several short stories",Sam Spade,0,0
1978,1993-03-24,,Double Jeopardy,"(1, 3)",GREAT RULERS,22,"(600,)",False,In 1282 Peter the Great of Aragon became king of this largest Mediterranean island,Sicily,0,0
1978,1993-03-24,,Double Jeopardy,"(2, 3)",THE HUMAN BODY,6,"(600,)",False,2 of the 4 kinds of taste buds in the tongue,"(2 of) salt, sweet, bitter, & sour",0,0
1978,1993-03-24,,Double Jeopardy,"(3, 3)",WORLD FACTS,12,"(600,)",False,Much of this tiny nation's economy is based on contributions known as Peter's Pence,the Vatican,0,0
1978,1993-03-24,,Double Jeopardy,"(4, 3)",ARCHITECTURE,20,"(600,)",False,James Renwick is best remembered as the designer of this NYC cathedral at Fifth Ave. & 50th St.,St. Patrick's Cathedral,0,0
1978,1993-03-24,,Double Jeopardy,"(5, 3)",FAMOUS ANIMALS,28,"(600,)",False,This trademark lion was the symbol of Goldwyn Pictures before MGM,Leo,0,0
1978,1993-03-24,,Double Jeopardy,"(6, 3)",LITERARY CHARACTERS,10,"(600,)",False,"Before he dies, Don Quixote begs this squire's forgiveness for drawing him into delusions",Sancho Panza,0,0
1978,1993-03-24,,Double Jeopardy,"(1, 4)",GREAT RULERS,23,"(800,)",False,This ancient king of Judea was president of the Olympic Games & rebuilt the Temple in Jerusalem,Herod the Great,0,0
1978,1993-03-24,,Double Jeopardy,"(2, 4)",THE HUMAN BODY,8,"(800,)",False,It's the smaller of the 2 bones between the knee & the ankle,the fibula,0,0
1978,1993-03-24,,Double Jeopardy,"(3, 4)",WORLD FACTS,14,"(800,)",False,"Part of Thailand lies on this, the southernmost mainland peninsula in Asia",the Malay Peninsula,0,0
1978,1993-03-24,,Double Jeopardy,"(4, 4)",ARCHITECTURE,21,"(1900,)",True,William Van Alen designed this NYC skyscraper whose gargoyles resemble auto radiator caps,the Chrysler Building,0,0
1978,1993-03-24,,Double Jeopardy,"(5, 4)",FAMOUS ANIMALS,26,"(800,)",False,"This Scottish terrier was with FDR in Warm Springs, Georgia when the president died",Fala,0,0
1978,1993-03-24,,Double Jeopardy,"(6, 4)",LITERARY CHARACTERS,17,"(800,)",False,"In ""A Christmas Carol"", Ebenezer Scrooge is haunted by the ghost of this late business partner",(Jacob) Marley,0,0
1978,1993-03-24,,Double Jeopardy,"(1, 5)",GREAT RULERS,24,"(1000,)",False,"This ""Great"" king of Wessex kept England from falling to the Danes in the 9th century",Alfred,0,0
1978,1993-03-24,,Double Jeopardy,"(2, 5)",THE HUMAN BODY,9,"(1000,)",False,"Each molecule of this contains thymine, adenine, guanine, cytosine, phosphate & deoxyribose",DNA,0,0
1978,1993-03-24,,Double Jeopardy,"(3, 5)",WORLD FACTS,15,"(1200,)",True,A 3 1/2-year-long underwater eruption created this country's Surtsey Island,Iceland,0,0
1978,1993-03-24,,Double Jeopardy,"(4, 5)",ARCHITECTURE,25,"(1000,)",False,Anthemius of Tralles & Isidorus of Miletus designed this large Constantinople church,St. Sophia's,0,0
1978,1993-03-24,,Double Jeopardy,"(5, 5)",FAMOUS ANIMALS,27,"(1000,)",False,"Balto, a black Malamute, led the team that brought diphtheria serum to this Alaskan city in 1925",Nome,0,0
1978,1993-03-24,,Double Jeopardy,"(6, 5)",LITERARY CHARACTERS,18,"(1000,)",False,"Daisy Buchanan's cousin, he's the narrator of ""The Great Gatsby""",Nick Carraway,0,0
1978,1993-03-24,,Final Jeopardy,"(1, 1)",GOVERNORS,0,(),False,The first President after Franklin Roosevelt who had also been a state governor,Jimmy Carter,0,0
