epNum,airDate,extra_info,round_name,coord,category,order,value,daily_double,question,answer,correctAttempts,wrongAttempts
1983,1993-03-31,,Jeopardy,"(1, 1)",RELIGION,1,"(100,)",False,Each person elected to this highest Catholic office gets a new ring designed just for him,pope,1,0
1983,1993-03-31,,Jeopardy,"(2, 1)",SPORTS,3,"(100,)",False,"On September 19, 1992 Sergei Bubka broke the world record in this event   for the 32nd time",the pole vault,1,0
1983,1993-03-31,,Jeopardy,"(3, 1)",FASHION,9,"(100,)",False,Colorful patches called p'u-fang used to indicate the rank of officials in this country,China,1,0
1983,1993-03-31,,Jeopardy,"(4, 1)",-OLOGIES,15,"(100,)",False,"Nephology is the branch of meteorology that studies these, nimbus or otherwise",clouds,1,0
1983,1993-03-31,,Jeopardy,"(5, 1)",GIANTS,17,"(100,)",False,"One legend says it was his ox' footprints that formed the 10,000 lakes in Minnesota",Paul Bunyan,1,0
1983,1993-03-31,,Jeopardy,"(6, 1)","""C"" HERE",26,"(100,)",False,"Fear, Horn & Cod are 3 of these",capes,1,0
1983,1993-03-31,,Jeopardy,"(1, 2)",RELIGION,2,"(200,)",False,A hajji is a Muslim who's made a pilgrimage to this city,Mecca,1,0
1983,1993-03-31,,Jeopardy,"(2, 2)",SPORTS,4,"(200,)",False,"Known as the ""Golden Bear"", he was the 1st golfer to win all 4 major titles at least twice",Jack Nicklaus,1,0
1983,1993-03-31,,Jeopardy,"(3, 2)",FASHION,10,"(200,)",False,"In the late 1800s, gowns named for this hot beverage were worn at afternoon gatherings",tea,1,0
1983,1993-03-31,,Jeopardy,"(4, 2)",-OLOGIES,22,"(200,)",False,It's a fact that olfactology is the study of this sense,smell,1,0
1983,1993-03-31,,Jeopardy,"(5, 2)",GIANTS,18,"(200,)",False,"In the heavens Betelgeuse & Bellatrix are this giant's ""shoulder"" stars",Orion,1,0
1983,1993-03-31,,Jeopardy,"(6, 2)","""C"" HERE",27,"(200,)",False,"In Mexico the 9 days before this holiday are called posadas, meaning ""inns""",Christmas,1,0
1983,1993-03-31,,Jeopardy,"(1, 3)",RELIGION,6,"(300,)",False,"Artists often depict Durga, a goddess of this Indian religion, riding a lion or a tiger",Hinduism,1,0
1983,1993-03-31,,Jeopardy,"(2, 3)",SPORTS,5,"(300,)",False,Greco-Roman & freestyle are the 2 styles featured in this Olympic sport,wrestling,1,0
1983,1993-03-31,,Jeopardy,"(3, 3)",FASHION,12,"(300,)",False,19th century beauties wore tight-waisted dresses that made them resemble these timepieces,hourglasses,1,0
1983,1993-03-31,,Jeopardy,"(4, 3)",-OLOGIES,23,"(300,)",False,"Once called psychical research, the study of psychic phenomena is now called this",parapsychology,1,0
1983,1993-03-31,,Jeopardy,"(5, 3)",GIANTS,19,"(300,)",False,"A man-eating giant, or any cruel, brutal or hideous person",an ogre,0,3
1983,1993-03-31,,Jeopardy,"(6, 3)","""C"" HERE",28,"(300,)",False,Some fabrics do this to your body; some people do it to old-fashioned ideas,cling,1,0
1983,1993-03-31,,Jeopardy,"(1, 4)",RELIGION,7,"(400,)",False,Members of this ancient Celtic order served as judges as well as priests,Druids,1,0
1983,1993-03-31,,Jeopardy,"(2, 4)",SPORTS,11,"(400,)",False,In 1975 this college football bowl game moved from Tulane Stadium to the Louisiana Superdome,the Sugar Bowl,1,0
1983,1993-03-31,,Jeopardy,"(3, 4)",FASHION,13,"(400,)",False,This once-fashionable shade of pale grayish-blue was named for Teddy Roosevelt's daughter,Alice blue,1,0
1983,1993-03-31,,Jeopardy,"(4, 4)",-OLOGIES,24,"(400,)",False,"Often associated with archaeology, it's the study of fossils",paleontology,1,0
1983,1993-03-31,,Jeopardy,"(5, 4)",GIANTS,20,"(400,)",False,"Cormoran, a Cornish giant, was felled by this famous giant killer",Jack,1,0
1983,1993-03-31,,Jeopardy,"(6, 4)","""C"" HERE",29,"(400,)",False,The spoon-back style of this piece of furniture was popular during the Queen Anne period,chairs,1,0
1983,1993-03-31,,Jeopardy,"(1, 5)",RELIGION,8,"(500,)",False,The archbishop of Uppsala is the presiding bishop of the church of this country,Sweden,0,3
1983,1993-03-31,,Jeopardy,"(2, 5)",SPORTS,16,"(500,)",False,It's the only NBA team in Ohio,the Cleveland Cavaliers,1,0
1983,1993-03-31,,Jeopardy,"(3, 5)",FASHION,14,"(500,)",True,Some brides wear a decorative skullcap named for this Shakespearean heroine,Juliet,1,0
1983,1993-03-31,,Jeopardy,"(4, 5)",-OLOGIES,25,"(500,)",False,"Although it sounds like it deals with oil, it's the study of rocks",petrology,0,3
1983,1993-03-31,,Jeopardy,"(5, 5)",GIANTS,21,"(500,)",False,His home was a mountain chain in Africa that supported the heavens,Atlas,1,0
1983,1993-03-31,,Jeopardy,"(6, 5)","""C"" HERE",30,"(500,)",False,This title character sings a Spanish song called the seguidilla in Act I of a Bizet opera,Carmen,1,0
1983,1993-03-31,,Double Jeopardy,"(1, 1)",WORLD HISTORY,6,"(200,)",False,"This building that opened May 1, 1931 remained the world's tallest until 1971",the Empire State Building,1,0
1983,1993-03-31,,Double Jeopardy,"(2, 1)",MUSIC,1,"(200,)",False,"He wrote ""Rhapsody In Blue"" for jazz conductor Paul Whiteman's orchestra",George Gershwin,1,0
1983,1993-03-31,,Double Jeopardy,"(3, 1)",TOUGH TV TRIVIA,16,"(200,)",False,Hannibal Dobbs was the bugler at Fort Courage on this series,F Troop,1,0
1983,1993-03-31,,Double Jeopardy,"(4, 1)",ISLANDS,9,"(200,)",False,"Principal islands of this chain include Andros, the Biminis & New Providence",the Bahamas,0,3
1983,1993-03-31,,Double Jeopardy,"(5, 1)",POTENT POTABLES,3,"(200,)",False,The name of this spirit comes from the Russian word for water,vodka,1,0
1983,1993-03-31,,Double Jeopardy,"(6, 1)",LITERATURE,2,"(200,)",False,"The book-of-the-month club calls this Dostoyevsky work ""the greatest crime novel ever written""",Crime and Punishment,1,0
1983,1993-03-31,,Double Jeopardy,"(1, 2)",WORLD HISTORY,7,"(400,)",False,This Macedonian conqueror campaigned along the Indus River in 327-326 B.C.,Alexander the Great,1,0
1983,1993-03-31,,Double Jeopardy,"(2, 2)",MUSIC,8,"(400,)",False,The D'Oyly Carte Opera Company was founded to perform the works of this British duo,Gilbert & Sullivan,1,0
1983,1993-03-31,,Double Jeopardy,"(3, 2)",TOUGH TV TRIVIA,18,"(400,)",False,"Joe Regalbuto, who played Harry Fisher on ""Knots Landing"", is now a regular on this series",Murphy Brown,1,0
1983,1993-03-31,,Double Jeopardy,"(4, 2)",ISLANDS,17,"(400,)",False,"John Adams, the last Bounty mutineer on this island, died in 1829",Pitcairn Island,1,0
1983,1993-03-31,,Double Jeopardy,"(5, 2)",POTENT POTABLES,4,"(400,)",False,This American liquor is named for a Kentucky county,bourbon,1,0
1983,1993-03-31,,Double Jeopardy,"(6, 2)",LITERATURE,11,"(400,)",False,"In an 1896 sequel, this Mark Twain title character turned ""Detective""",Tom Sawyer,1,0
1983,1993-03-31,,Double Jeopardy,"(1, 3)",WORLD HISTORY,10,"(600,)",False,This German noble family traced its descent from the counts of Zollern,the Hohenzollerns,1,0
1983,1993-03-31,,Double Jeopardy,"(2, 3)",MUSIC,15,"(600,)",False,"Also called colophony, this yellowish resin is rubbed on violin bows to produce friction",rosin,1,1
1983,1993-03-31,,Double Jeopardy,"(3, 3)",TOUGH TV TRIVIA,19,"(600,)",False,"""Northern Exposure"" is set in this Alaskan town",Cicely,1,0
1983,1993-03-31,,Double Jeopardy,"(4, 3)",ISLANDS,28,"(600,)",False,Chileans call it Isla de Pascua,Easter Island,1,0
1983,1993-03-31,,Double Jeopardy,"(5, 3)",POTENT POTABLES,5,"(600,)",False,Legend assigns the invention of this to Dom Perignon in the late 1600s,champagne,1,0
1983,1993-03-31,,Double Jeopardy,"(6, 3)",LITERATURE,12,"(600,)",False,"In 1846 these sisters published a collection of poems under the pen names Currer, Ellis & Acton Bell",the Brontë sisters,1,0
1983,1993-03-31,,Double Jeopardy,"(1, 4)",WORLD HISTORY,22,"(500,)",True,In 1954 an agreement between these 2 countries ended the Trieste dispute,Italy & Yugoslavia,0,1
1983,1993-03-31,,Double Jeopardy,"(2, 4)",MUSIC,25,"(800,)",False,Wanda Landowska initiated the revival of this plucked keyboard instrument in the 20th century,the harpsichord,1,0
1983,1993-03-31,,Double Jeopardy,"(3, 4)",TOUGH TV TRIVIA,20,"(800,)",False,"Lori Beth Allen married this ""Happy Days"" character",Richie Cunningham,1,0
1983,1993-03-31,,Double Jeopardy,"(4, 4)",ISLANDS,29,"(800,)",False,"Named for a surgeon-explorer, the Bass Strait separates Victoria, Australia from this island",Tasmania,1,0
1983,1993-03-31,,Double Jeopardy,"(5, 4)",POTENT POTABLES,23,"(800,)",False,"The name of this German white wine can be translated as ""blessed mother's milk""",Liebfraumilch,1,0
1983,1993-03-31,,Double Jeopardy,"(6, 4)",LITERATURE,13,"(800,)",False,"One of his last collections of tales, ""Uncle Remus and the Little Boy"", was published posthumously in 1910",Joel Chandler Harris,1,0
1983,1993-03-31,,Double Jeopardy,"(1, 5)",WORLD HISTORY,27,"(1000,)",False,Jerusalem was captured by this king of Babylon in 597 & 586 B.C.,Nebuchadnezzar,1,0
1983,1993-03-31,,Double Jeopardy,"(2, 5)",MUSIC,26,"(1000,)",False,"This ""Billy the Kid"" composer won an Oscar for the score of ""The Heiress""",(Aaron) Copland,1,0
1983,1993-03-31,,Double Jeopardy,"(3, 5)",TOUGH TV TRIVIA,21,"(1000,)",False,"One of the prime time series whose theme was sung by its star, Greg Evigan",B.J. and the Bear (or My Two Dads or P.S. I Luv U),1,0
1983,1993-03-31,,Double Jeopardy,"(4, 5)",ISLANDS,30,"(1000,)",False,This island group makes up 2 provinces of Spain: Santa Cruz de Tenerife & Las Palmas,the Canary Islands,1,0
1983,1993-03-31,,Double Jeopardy,"(5, 5)",POTENT POTABLES,24,"(1000,)",False,"Though they may have little significance, the letters VO on a brandy label stand for this",very old,1,0
1983,1993-03-31,,Double Jeopardy,"(6, 5)",LITERATURE,14,"(1200,)",True,"This Hemingway novel about the ""Lost Generation"" is told from the viewpoint of Jake Barnes",The Sun Also Rises,0,1
1983,1993-03-31,,Final Jeopardy,"(1, 1)",MONARCHS,0,"(3700, 7700, 7901)",False,In 1942 she become the first reigning queen to address the U.S. Congress,Wilhelmina,1,2
