epNum,airDate,extra_info,round_name,coord,category,order,value,daily_double,question,answer,correctAttempts,wrongAttempts
2037,1993-06-15,Al Lin game 4.,Jeopardy,"(1, 1)",MUSIC CLASS,1,"(100,)",False,The clarinet uses one of these made of cane; the harmonica uses a series of metal ones,a reed,0,0
2037,1993-06-15,Al Lin game 4.,Jeopardy,"(2, 1)",THE FUNNIES,26,"(100,)",False,"In the title of a comic strip, these 2 letters follow ""Rex Morgan...""",M.D.,0,0
2037,1993-06-15,Al Lin game 4.,Jeopardy,"(3, 1)",PERFECT PLACES,22,"(100,)",False,"If you're idyllically happy, you're on this cloud",cloud nine,0,0
2037,1993-06-15,Al Lin game 4.,Jeopardy,"(4, 1)",FOREIGN WORDS & PHRASES,16,"(100,)",False,"If a Spaniard asks you, ""Que hora es?"" he wants to know this",What time is it?,0,0
2037,1993-06-15,Al Lin game 4.,Jeopardy,"(5, 1)",HISTORY,6,"(100,)",False,"When he attended Eton in the 1790s, this fashion plate was known as ""Buck"" Brummell",Beau Brummell,0,0
2037,1993-06-15,Al Lin game 4.,Jeopardy,"(6, 1)","""GREAT"" THINGS",11,"(100,)",False,"Herodotus estimated it took 100,000 men 20 years to complete this structure of Giza",the Great Pyramid,0,0
2037,1993-06-15,Al Lin game 4.,Jeopardy,"(1, 2)",MUSIC CLASS,2,"(200,)",False,"This letter once means loud, twice, very loud & 3 times, extremely loud",F,0,0
2037,1993-06-15,Al Lin game 4.,Jeopardy,"(2, 2)",THE FUNNIES,27,"(200,)",False,An orphaned circus performer named Dick Grayson was this millionaire's ward,Bruce Wayne,0,0
2037,1993-06-15,Al Lin game 4.,Jeopardy,"(3, 2)",PERFECT PLACES,24,"(200,)",False,This legendary perfect society ran into a big problem when it sank beneath the sea,Atlantis,0,0
2037,1993-06-15,Al Lin game 4.,Jeopardy,"(4, 2)",FOREIGN WORDS & PHRASES,20,"(200,)",False,"This word popular with magicians is Italian for ""quick"" or ""nimble""",presto,0,0
2037,1993-06-15,Al Lin game 4.,Jeopardy,"(5, 2)",HISTORY,7,"(200,)",False,"Benito Juarez, who had once studied for the priesthood, was elected president of this country in 1861",Mexico,0,0
2037,1993-06-15,Al Lin game 4.,Jeopardy,"(6, 2)","""GREAT"" THINGS",15,"(200,)",False,The 1929 stock market crash is blamed for starting this economic slump that lasted over a decade,the Great Depression,0,0
2037,1993-06-15,Al Lin game 4.,Jeopardy,"(1, 3)",MUSIC CLASS,3,"(300,)",False,A modern one is made of pernambuco wood & has the hair attached to a tension knob called a frog,a bow,0,0
2037,1993-06-15,Al Lin game 4.,Jeopardy,"(2, 3)",THE FUNNIES,28,"(300,)",False,Li'l Abner & his family lived in this rural community,Dogpatch,0,0
2037,1993-06-15,Al Lin game 4.,Jeopardy,"(3, 3)",PERFECT PLACES,25,"(300,)",False,The name of this imaginary island created by Sir Thomas More is synonymous with a perfect place,Utopia,0,0
2037,1993-06-15,Al Lin game 4.,Jeopardy,"(4, 3)",FOREIGN WORDS & PHRASES,19,"(300,)",False,"Square dancers use this anglicized form of the French for ""back to back""",do-si-do,0,0
2037,1993-06-15,Al Lin game 4.,Jeopardy,"(5, 3)",HISTORY,8,"(300,)",False,"Charles VI's brother was the duke of this place before Joan of Arc was ""The Maid of"" it",Orleans,0,0
2037,1993-06-15,Al Lin game 4.,Jeopardy,"(6, 3)","""GREAT"" THINGS",14,"(300,)",False,Tiny Tim's 1968 version of this song wasn't quite as big as Jerry Lee Lewis',"""Great Balls Of Fire""",0,0
2037,1993-06-15,Al Lin game 4.,Jeopardy,"(1, 4)",MUSIC CLASS,4,"(400,)",False,It's the improvisational passage that immediately precedes a cadence,a cadenza,0,0
2037,1993-06-15,Al Lin game 4.,Jeopardy,"(2, 4)",THE FUNNIES,29,"(400,)",False,Herb & Tootsie Woodley have been neighbors of this couple for several decades,Dagwood & Blondie,0,0
2037,1993-06-15,Al Lin game 4.,Jeopardy,"(3, 4)",PERFECT PLACES,23,"(400,)",False,Region of China in which you'd find Shangri-La... if it's where it's supposed to be,Tibet,0,0
2037,1993-06-15,Al Lin game 4.,Jeopardy,"(4, 4)",FOREIGN WORDS & PHRASES,18,"(400,)",False,It's Yiddish for a light snack,a nosh,0,0
2037,1993-06-15,Al Lin game 4.,Jeopardy,"(5, 4)",HISTORY,9,"(400,)",False,"Before he was president, he was elected governor of Virginia in 1779, succeeding Patrick Henry",Thomas Jefferson,0,0
2037,1993-06-15,Al Lin game 4.,Jeopardy,"(6, 4)","""GREAT"" THINGS",13,"(400,)",False,They form the boundary between North Carolina & Tennessee,the Great Smoky Mountains,0,0
2037,1993-06-15,Al Lin game 4.,Jeopardy,"(1, 5)",MUSIC CLASS,5,"(500,)",False,It's the forcing of more air into an oboe to produce a tone an octave higher than normal,overblowing,0,0
2037,1993-06-15,Al Lin game 4.,Jeopardy,"(2, 5)",THE FUNNIES,30,"(500,)",False,"This freckle-faced little girl calls Charlie Brown ""Chuck""",Peppermint Patty,0,0
2037,1993-06-15,Al Lin game 4.,Jeopardy,"(3, 5)",PERFECT PLACES,21,"(500,)",False,"There were not one, not two, but this many cities of Cibola",7,0,0
2037,1993-06-15,Al Lin game 4.,Jeopardy,"(4, 5)",FOREIGN WORDS & PHRASES,17,"(500,)",False,"The ancient battle cry ""Erin go bragh"" translates to this",Ireland forever,0,0
2037,1993-06-15,Al Lin game 4.,Jeopardy,"(5, 5)",HISTORY,10,"(500,)",True,"Albert Gallatin, the U.S.' fourth secretary of this department, was born in Geneva, Switzerland in 1761",the Treasury,0,0
2037,1993-06-15,Al Lin game 4.,Jeopardy,"(6, 5)","""GREAT"" THINGS",12,"(500,)",False,it became the name for LBJ's domestic programs and Americans were told they could move upward to it,the Great Society,0,0
2037,1993-06-15,Al Lin game 4.,Double Jeopardy,"(1, 1)",WORLD WAR II,30,"(200,)",False,It's the popular name for a German submarine,a U-boat,0,0
2037,1993-06-15,Al Lin game 4.,Double Jeopardy,"(2, 1)",THE HUMAN BODY,25,"(200,)",False,Dandruff is made up of dead cells of this,the skin,0,0
2037,1993-06-15,Al Lin game 4.,Double Jeopardy,"(3, 1)",PEOPLE,6,"(200,)",False,"A memorial statue of him in Claremore, Oklahoma is inscribed, ""I never met a man I didn't like""",Will Rogers,0,0
2037,1993-06-15,Al Lin game 4.,Double Jeopardy,"(4, 1)",FOOD FACTS,27,"(200,)",False,Pompion is an old name for this yellow-orange pie ingredient that's grown on vines,pumpkin,0,0
2037,1993-06-15,Al Lin game 4.,Double Jeopardy,"(5, 1)",NEW COUNTRIES,16,"(200,)",False,"On January 1, 1993 Bratislava became the capital of this new European republic",Slovakia,0,0
2037,1993-06-15,Al Lin game 4.,Double Jeopardy,"(6, 1)",BOOKS & AUTHORS,1,"(200,)",False,"Ernest Hemingway's ""A Moveable Feast"" is a memoir of his years in this European capital",Paris,0,0
2037,1993-06-15,Al Lin game 4.,Double Jeopardy,"(1, 2)",WORLD WAR II,29,"(400,)",False,This British Field Marshal accepted the surrender of all German forces in northern Europe,Montgomery,0,0
2037,1993-06-15,Al Lin game 4.,Double Jeopardy,"(2, 2)",THE HUMAN BODY,24,"(400,)",False,The pons is part of this organ's stem,the brain,0,0
2037,1993-06-15,Al Lin game 4.,Double Jeopardy,"(3, 2)",PEOPLE,7,"(400,)",False,"On March 16, 1992 an int'l group claimed it had found metal from the fuselage of this aviatrix' plane",Amelia Earhart,0,0
2037,1993-06-15,Al Lin game 4.,Double Jeopardy,"(4, 2)",FOOD FACTS,26,"(400,)",False,"Stollen is a sweet, fruit-filled loaf served in Germany during this holiday season",Christmas,0,0
2037,1993-06-15,Al Lin game 4.,Double Jeopardy,"(5, 2)",NEW COUNTRIES,17,"(400,)",False,In June 1992 this country & Russia settled a dispute over control of the Black Sea fleet,the Ukraine,0,0
2037,1993-06-15,Al Lin game 4.,Double Jeopardy,"(6, 2)",BOOKS & AUTHORS,2,"(400,)",False,This author of the Mike Hammer novels began his career as a comic book writer,(Mickey) Spillane,0,0
2037,1993-06-15,Al Lin game 4.,Double Jeopardy,"(1, 3)",WORLD WAR II,28,"(600,)",False,Col. Paul Tibbets named this plane after his mother,the Enola Gay,0,0
2037,1993-06-15,Al Lin game 4.,Double Jeopardy,"(2, 3)",THE HUMAN BODY,13,"(1700,)",True,The ducts between the gall bladder & the liver are called these,the bile ducts (or the hepatic ducts or cystic ducts),0,0
2037,1993-06-15,Al Lin game 4.,Double Jeopardy,"(3, 3)",PEOPLE,8,"(600,)",False,"This actor's role as the voice of Darth Vader in the ""Star Wars"" films was uncredited",James Earl Jones,0,0
2037,1993-06-15,Al Lin game 4.,Double Jeopardy,"(4, 3)",FOOD FACTS,23,"(600,)",False,"Before it's broiled, grilled or baked, a wahoo, one of these, often weighs over 40 pounds",a fish (a mackerel),0,0
2037,1993-06-15,Al Lin game 4.,Double Jeopardy,"(5, 3)",NEW COUNTRIES,18,"(600,)",False,Zagreb is the capital & largest city of this former Yugoslav republic,Croatia,0,0
2037,1993-06-15,Al Lin game 4.,Double Jeopardy,"(6, 3)",BOOKS & AUTHORS,3,"(600,)",False,"""Polar Star"", published in 1989, was Martin Cruz Smith's long-awaited sequel to this novel",Gorky Park,0,0
2037,1993-06-15,Al Lin game 4.,Double Jeopardy,"(1, 4)",WORLD WAR II,15,"(800,)",False,His cartoons & sketches of the war won him a Pulitzer Prize in 1945,Bill Mauldin,0,0
2037,1993-06-15,Al Lin game 4.,Double Jeopardy,"(2, 4)",THE HUMAN BODY,12,"(800,)",False,This part of the large intestine is especially subject to diverticulitis,the colon,0,0
2037,1993-06-15,Al Lin game 4.,Double Jeopardy,"(3, 4)",PEOPLE,9,"(800,)",False,"This ""New Look"" designer began as a fashion illustrator for ""Le Figaro Illustre""",Christian Dior,0,0
2037,1993-06-15,Al Lin game 4.,Double Jeopardy,"(4, 4)",FOOD FACTS,22,"(800,)",False,In England the name of this watery porridge is a synonym for punishment,gruel,0,0
2037,1993-06-15,Al Lin game 4.,Double Jeopardy,"(5, 4)",NEW COUNTRIES,19,"(800,)",False,"On March 11, 1990 it became the first Baltic country to declare its independence",Lithuania,0,0
2037,1993-06-15,Al Lin game 4.,Double Jeopardy,"(6, 4)",BOOKS & AUTHORS,4,"(800,)",False,"This author of ""Alice Adams"" was named for his uncle Newton Booth, a California governor",Booth Tarkington,0,0
2037,1993-06-15,Al Lin game 4.,Double Jeopardy,"(1, 5)",WORLD WAR II,14,"(1000,)",False,She was Germany's equivalent of Tokyo Rose,Axis Sally,0,0
2037,1993-06-15,Al Lin game 4.,Double Jeopardy,"(2, 5)",THE HUMAN BODY,11,"(1000,)",False,1 of the 2 pairs of bones that make up the pectoral girdle,the clavicle (collar bone or shoulder bone),0,0
2037,1993-06-15,Al Lin game 4.,Double Jeopardy,"(3, 5)",PEOPLE,10,"(1000,)",False,"A U.S. senator from Kentucky before becoming vice president, he returned to the Senate in 1955",Alben Barkley,0,0
2037,1993-06-15,Al Lin game 4.,Double Jeopardy,"(4, 5)",FOOD FACTS,21,"(2000,)",True,"What American Indians once called ""sweet water"" came from these trees",maples,0,0
2037,1993-06-15,Al Lin game 4.,Double Jeopardy,"(5, 5)",NEW COUNTRIES,20,"(1000,)",False,"1 of 2 former U.S. trust territories to join the U.N. on September 17, 1991",the Marshall Islands (or Micronesia),0,0
2037,1993-06-15,Al Lin game 4.,Double Jeopardy,"(6, 5)",BOOKS & AUTHORS,5,"(1000,)",False,"She wrote the recent bestseller ""Possessing the Secret of Joy""",Alice Walker,0,0
2037,1993-06-15,Al Lin game 4.,Final Jeopardy,"(1, 1)",CORPORATE AMERICA,0,(),False,"Using letters from their names, Harold Matson & Elliot Handler named their toy company this",Mattel,0,0
