epNum,airDate,extra_info,round_name,coord,category,order,value,daily_double,question,answer,correctAttempts,wrongAttempts
2064,1993-07-22,1993 Seniors Tournament final game 1.,Jeopardy,"(1, 1)",HISTORY,3,"(100,)",False,In the 1390s King John I of Castile & King John I of Aragon both died by falling from these animals,horses,1,0
2064,1993-07-22,1993 Seniors Tournament final game 1.,Jeopardy,"(2, 1)",REPUBLICANS,11,"(100,)",False,This daughter of Ronald Reagan ran fifth in the 1982 California primary for the U.S. Senate,Maureen Reagan,1,0
2064,1993-07-22,1993 Seniors Tournament final game 1.,Jeopardy,"(3, 1)",BRITISH WORDS,2,"(100,)",False,These rubber boots are called wellies for short,wellingtons,1,0
2064,1993-07-22,1993 Seniors Tournament final game 1.,Jeopardy,"(4, 1)",BRAINS,12,"(100,)",False,"His writings include the 1920 publication ""Relativity: The Special and General Theory""",Albert Einstein,1,0
2064,1993-07-22,1993 Seniors Tournament final game 1.,Jeopardy,"(5, 1)",BRAWN,23,"(100,)",False,"He's a lumberjack & he's okay, his footprints became the Great Lakes",Paul Bunyan,1,0
2064,1993-07-22,1993 Seniors Tournament final game 1.,Jeopardy,"(6, 1)",REAL NAMES ON THE MARQUEE,1,"(100,)",False,"Ruth Elizabeth Davis & Lucille Le Sueur in ""Whatever Happened to Baby Jane?""",Bette Davis & Joan Crawford,1,0
2064,1993-07-22,1993 Seniors Tournament final game 1.,Jeopardy,"(1, 2)",HISTORY,6,"(200,)",False,"Joachim of Fiore divided history into 3 ages: the ages of the Father, the Son & this entity",Holy Ghost,1,0
2064,1993-07-22,1993 Seniors Tournament final game 1.,Jeopardy,"(2, 2)",REPUBLICANS,10,"(200,)",False,"On Dec. 19, 1974 this former New York governor became vice president under the 25th Amendment",Nelson Rockefeller,1,0
2064,1993-07-22,1993 Seniors Tournament final game 1.,Jeopardy,"(3, 2)",BRITISH WORDS,4,"(200,)",False,British theatregoers call it the interval,intermission (*entr\'acte),2,0
2064,1993-07-22,1993 Seniors Tournament final game 1.,Jeopardy,"(4, 2)",BRAINS,13,"(200,)",False,Past winners of this annual event include Bob Verini & Bob Blake,Tournament of Champions on Jeopardy!,1,0
2064,1993-07-22,1993 Seniors Tournament final game 1.,Jeopardy,"(5, 2)",BRAWN,24,"(200,)",False,"You might say that the source of this biblical hero's strength was hair today, gone tomorrow",Samson,1,0
2064,1993-07-22,1993 Seniors Tournament final game 1.,Jeopardy,"(6, 2)",REAL NAMES ON THE MARQUEE,8,"(200,)",False,"Maria Farrow & Ruth Jones in ""Rosemary's Baby""",Mia Farrow & Ruth Gordon,1,1
2064,1993-07-22,1993 Seniors Tournament final game 1.,Jeopardy,"(1, 3)",HISTORY,7,"(300,)",False,"Ancus Marcius, the legendary fourth king of this city, may have been the grandson of Numa Pompilus",Rome,1,0
2064,1993-07-22,1993 Seniors Tournament final game 1.,Jeopardy,"(2, 3)",REPUBLICANS,15,"(300,)",False,"In 1960s this senator from Arizona published ""The Conscience of a Conservative""",Barry Goldwater,1,0
2064,1993-07-22,1993 Seniors Tournament final game 1.,Jeopardy,"(3, 3)",BRITISH WORDS,5,"(300,)",False,Order candy floss at an amusement park & you'll get this fluffy confection,cotton candy,1,0
2064,1993-07-22,1993 Seniors Tournament final game 1.,Jeopardy,"(4, 3)",BRAINS,14,"(300,)",False,"""A Gardener Touched with Genius"" is Peter Dreyer's book on this American hoticulturist",Luther Burbank,1,0
2064,1993-07-22,1993 Seniors Tournament final game 1.,Jeopardy,"(5, 3)",BRAWN,25,"(300,)",False,"A Big Bad one in song saved miners, a Little one in Sherwood Forest was a Merry Man",John,1,0
2064,1993-07-22,1993 Seniors Tournament final game 1.,Jeopardy,"(6, 3)",REAL NAMES ON THE MARQUEE,9,"(300,)",False,"Frederick Auserlitz & Virginia McMath in ""Flying Down to Rio""",Fred Astaire & Ginger Rodgers,1,1
2064,1993-07-22,1993 Seniors Tournament final game 1.,Jeopardy,"(1, 4)",HISTORY,17,"(400,)",False,"In 1616 this Native American created a sensation in London, where she was known as Lady Rebecca",Pocahontas,1,0
2064,1993-07-22,1993 Seniors Tournament final game 1.,Jeopardy,"(2, 4)",REPUBLICANS,16,"(600,)",True,"Son of a U.S. president, he served as a senator from Ohio from 1939 until his death in 1953",Robert Taft,1,0
2064,1993-07-22,1993 Seniors Tournament final game 1.,Jeopardy,"(3, 4)",BRITISH WORDS,22,"(400,)",False,Brits call this part of a car the silencer,muffler,1,0
2064,1993-07-22,1993 Seniors Tournament final game 1.,Jeopardy,"(4, 4)",BRAINS,29,"(400,)",False,"Blaise Pascal is said to have mastered this Greek mathematician's ""Elements"" by age 12",Euclid,1,2
2064,1993-07-22,1993 Seniors Tournament final game 1.,Jeopardy,"(5, 4)",BRAWN,26,"(400,)",False,Name shared by a Titan & a former 97-pound runt,Atlas,1,0
2064,1993-07-22,1993 Seniors Tournament final game 1.,Jeopardy,"(6, 4)",REAL NAMES ON THE MARQUEE,19,"(400,)",False,"Greta Gustafsson & Melvin Hesselberg in ""Ninotchka""",Greta Garbo & Melvyn Douglas,1,0
2064,1993-07-22,1993 Seniors Tournament final game 1.,Jeopardy,"(1, 5)",HISTORY,18,"(500,)",False,"2-word ""seasonal"" term given to the time of reform in Czechoslovakia after March 22, 1968",Prague Spring,1,0
2064,1993-07-22,1993 Seniors Tournament final game 1.,Jeopardy,"(2, 5)",REPUBLICANS,21,"(500,)",False,This state's Mark Hatfield is the ranking Republican on the Senate Appropriations Committee,Oregon,1,0
2064,1993-07-22,1993 Seniors Tournament final game 1.,Jeopardy,"(3, 5)",BRITISH WORDS,28,"(500,)",False,The ancient name for this city was Mancunium & a person from it is still called a Mancunian,Manchester,1,0
2064,1993-07-22,1993 Seniors Tournament final game 1.,Jeopardy,"(4, 5)",BRAINS,30,"(500,)",False,"After this coil inventor moved to America, he worked briefly with another genius⁠—Thomas Edison",Nikola Tesla,0,3
2064,1993-07-22,1993 Seniors Tournament final game 1.,Jeopardy,"(5, 5)",BRAWN,27,"(500,)",False,"This ""Mania""-creating wrestler was born Terry Gene Bollea in 1953",Hulk Hogan,1,0
2064,1993-07-22,1993 Seniors Tournament final game 1.,Jeopardy,"(6, 5)",REAL NAMES ON THE MARQUEE,20,"(500,)",False,"Bernard Schwartz & Jeanette Morrison in ""Houdini""",Tony Curtis & Janet Leigh,1,0
2064,1993-07-22,1993 Seniors Tournament final game 1.,Double Jeopardy,"(1, 1)",WORLD WAR II,7,"(200,)",False,"On May 27, 1941 torpedoes from the cruiser Dorsetshire finished off this German battleship",Bismarck,1,0
2064,1993-07-22,1993 Seniors Tournament final game 1.,Double Jeopardy,"(2, 1)",CLASSICAL MUSIC,1,"(200,)",False,"The ""van"" in his name was from the Dutch, not the German",Beethoven,1,0
2064,1993-07-22,1993 Seniors Tournament final game 1.,Double Jeopardy,"(3, 1)",MOUNTAINS,15,"(200,)",False,"A 1954 survey by the Indian government set its official height at 29,028 feet",Mount Everest,1,0
2064,1993-07-22,1993 Seniors Tournament final game 1.,Double Jeopardy,"(4, 1)",BUSINESS & INDUSTRY,6,"(200,)",False,"Despite filing for bankruptcy, this retailer's 1992 Thanksgiving Day Parade went off without a hitch",Macy\'s,1,0
2064,1993-07-22,1993 Seniors Tournament final game 1.,Double Jeopardy,"(5, 1)",TELEVISION NOSTALGIA,21,"(200,)",False,"Earl Hamner Jr., later creator of ""The Waltons"", wrote 8 scripts for this Rod Serling series",The Twilight Zone,1,0
2064,1993-07-22,1993 Seniors Tournament final game 1.,Double Jeopardy,"(6, 1)",LITERATURE,22,"(200,)",False,His was the first voice Robinson Crusoe heard in 25 years on the island,Friday,1,0
2064,1993-07-22,1993 Seniors Tournament final game 1.,Double Jeopardy,"(1, 2)",WORLD WAR II,8,"(400,)",False,In late May 1943 U.S. forces recaptured Attu in this island chain from the Japanese,Aleutian Islands,1,0
2064,1993-07-22,1993 Seniors Tournament final game 1.,Double Jeopardy,"(2, 2)",CLASSICAL MUSIC,2,"(400,)",False,"His 1st opera, ""La Finta Semplice"", was composed for Vienna, but was 1st performed in Salzburg",Mozart,1,0
2064,1993-07-22,1993 Seniors Tournament final game 1.,Double Jeopardy,"(3, 2)",MOUNTAINS,16,"(400,)",False,Its eruption in 1980 was the first in the 48 contiguous states since Lassen Peak in 1921,Mount St. Helens,1,0
2064,1993-07-22,1993 Seniors Tournament final game 1.,Double Jeopardy,"(4, 2)",BUSINESS & INDUSTRY,12,"(400,)",False,In 1900 this company lit up New York City with an electric sign--a 40' pickle,Heniz,1,0
2064,1993-07-22,1993 Seniors Tournament final game 1.,Double Jeopardy,"(5, 2)",TELEVISION NOSTALGIA,26,"(400,)",False,"This con man was staff sergeant of the motor pool at Fort Baxter, Kansas",Sgt. Bilko,1,0
2064,1993-07-22,1993 Seniors Tournament final game 1.,Double Jeopardy,"(6, 2)",LITERATURE,23,"(400,)",False,"Horace Walpole's 1764 ""The Castle of Otranto"" was the 1st of these novels with violence & gloomy settings",gothic,1,0
2064,1993-07-22,1993 Seniors Tournament final game 1.,Double Jeopardy,"(1, 3)",WORLD WAR II,9,"(600,)",False,"This French general entered Paris Aug. 25, 1944 & marched in a parade despite snipers",Charle de Gaulle,1,0
2064,1993-07-22,1993 Seniors Tournament final game 1.,Double Jeopardy,"(2, 3)",CLASSICAL MUSIC,3,"(600,)",False,"Most of Haydn's works were written while he was a court composer in Eisenstadt, now in this country",Austria,1,1
2064,1993-07-22,1993 Seniors Tournament final game 1.,Double Jeopardy,"(3, 3)",MOUNTAINS,17,"(600,)",False,One of the most thickly populated areas in Sicily surrounds this volcano,Mount Etna,1,0
2064,1993-07-22,1993 Seniors Tournament final game 1.,Double Jeopardy,"(4, 3)",BUSINESS & INDUSTRY,13,"(600,)",False,"Nicknamed ""Manny Hanny"", it merged with Chemical Bank in 1992 to create the 3rd-largest bank in the U.S.",Manufacturers Hanover,1,1
2064,1993-07-22,1993 Seniors Tournament final game 1.,Double Jeopardy,"(6, 3)",LITERATURE,24,"(600,)",False,"Henry Fielding's first wife, Charlotte, was the model for Sophia in this 1749 novel",Tom Jones,1,0
2064,1993-07-22,1993 Seniors Tournament final game 1.,Double Jeopardy,"(1, 4)",WORLD WAR II,10,"(800,)",False,"Operation Barbarossa, Germany's attack on this country, began June 22, 1941",USSR,1,0
2064,1993-07-22,1993 Seniors Tournament final game 1.,Double Jeopardy,"(2, 4)",CLASSICAL MUSIC,4,"(800,)",False,"This lieder composer gave his first public concert March 26, 1828, it was a success",Schubert,1,0
2064,1993-07-22,1993 Seniors Tournament final game 1.,Double Jeopardy,"(3, 4)",MOUNTAINS,18,"(800,)",False,It's the highest mountain in the world named for a U.S. president,Mount McKinley,1,0
2064,1993-07-22,1993 Seniors Tournament final game 1.,Double Jeopardy,"(4, 4)",BUSINESS & INDUSTRY,14,"(800,)",False,"In Japan Bridgestone not only ranks no. 1 in tires, but in these vehicles as well",bicycles,0,3
2064,1993-07-22,1993 Seniors Tournament final game 1.,Double Jeopardy,"(6, 4)",LITERATURE,25,"(800,)",False,"In this Jane Austen novel, Mrs. Bennet tries to find a husband for each of her 5 daughters",Pride and Prejudice,1,0
2064,1993-07-22,1993 Seniors Tournament final game 1.,Double Jeopardy,"(1, 5)",WORLD WAR II,11,"(1000,)",False,"After the attack on Pearl Harbor, he was named Commander in Chief of the U.S Pacific Fleet",(Chester) Nimitz,1,1
2064,1993-07-22,1993 Seniors Tournament final game 1.,Double Jeopardy,"(2, 5)",CLASSICAL MUSIC,5,"(1000,)",False,"Russian composer of ""Rhapsody on a Theme by Pagnini"" who became a U.S. cit. just before his death in 1943",Rachmaninoff,0,3
2064,1993-07-22,1993 Seniors Tournament final game 1.,Double Jeopardy,"(3, 5)",MOUNTAINS,19,"(1100,)",True,"State in which you'd find 3,290-foot Mount Oglethorpe",Georgia,1,0
2064,1993-07-22,1993 Seniors Tournament final game 1.,Double Jeopardy,"(4, 5)",BUSINESS & INDUSTRY,20,"(1200,)",True,"General Telephone added ""Electronics"" to its name after acquiring this light bulb company in 1959",Sylvania,0,1
2064,1993-07-22,1993 Seniors Tournament final game 1.,Final Jeopardy,"(1, 1)",QUOTES OF THE 1960s,0,"(1500, 2200, 1600)",False,"He once told Newsweek, ""I have no country. For me a country is just a place to dance""",Nureyev,1,2
