epNum,airDate,extra_info,round_name,coord,category,order,value,daily_double,question,answer,correctAttempts,wrongAttempts
2165,1994-01-21,,Jeopardy,"(1, 1)",MODERN HISTORY,19,"(100,)",False,The Cultural Revolution launched by this Chinese leader didn't officially end until 1976,Mao Tse-tung,1,0
2165,1994-01-21,,Jeopardy,"(2, 1)",SONGS OF THE '60s,1,"(100,)",False,"""Tall and tan and young and lovely"", she ""goes walking and when she passes, each one she passes goes 'Aah'""",The Girl from Ipanema,1,0
2165,1994-01-21,,Jeopardy,"(3, 1)",NEWSPAPERS,11,"(100,)",False,"The Rocky Mountain News, not the Post, is this capital city's largest newspaper",Denver,1,0
2165,1994-01-21,,Jeopardy,"(4, 1)",AROUND THE WORLD,15,"(100,)",False,Nepal's odd-shaped flag displays symbols for these 2 heavenly bodies,the sun & moon,1,0
2165,1994-01-21,,Jeopardy,"(5, 1)",FLUIDS,26,"(100,)",False,It's the poisonous liquid secreted by scorpions & bees as well as snakes,venom,1,0
2165,1994-01-21,,Jeopardy,"(6, 1)",ODDS & ENDS,6,"(100,)",False,"St. Jerome wrote ""Never look"" one of these horses ""in the mouth""",a gift horse,1,0
2165,1994-01-21,,Jeopardy,"(1, 2)",MODERN HISTORY,20,"(200,)",False,As a result of this war the Suez Canal was closed in 1967 & didn't reopen for 8 years,Six-Day War,1,0
2165,1994-01-21,,Jeopardy,"(2, 2)",SONGS OF THE '60s,2,"(200,)",False,"A hit from this 1969 film begins ""Everybody's talkin' at me, I don't hear a word they're sayin'""",Midnight Cowboy,1,0
2165,1994-01-21,,Jeopardy,"(3, 2)",NEWSPAPERS,12,"(200,)",False,"This NYC newspaper has almost 1,000 reporters & editors",The New York Times,1,0
2165,1994-01-21,,Jeopardy,"(4, 2)",AROUND THE WORLD,16,"(200,)",False,The Tour de France ends in this city,Pars,1,0
2165,1994-01-21,,Jeopardy,"(5, 2)",FLUIDS,27,"(200,)",False,"In a car, the tank contains gas & the crankcase contains this",oil,1,0
2165,1994-01-21,,Jeopardy,"(6, 2)",ODDS & ENDS,7,"(200,)",False,The name of this 3-letter month is synonymous with the prime of one's life,May,1,0
2165,1994-01-21,,Jeopardy,"(1, 3)",MODERN HISTORY,21,"(300,)",False,In 1923 it became Italy's only legal political party,the Fascist Party,1,1
2165,1994-01-21,,Jeopardy,"(2, 3)",SONGS OF THE '60s,3,"(300,)",False,"In 1966 Bobby Darin sang, ""If I were"" this ""and you were a lady, would you marry me anyway?""",a carpenter,1,0
2165,1994-01-21,,Jeopardy,"(3, 3)",NEWSPAPERS,13,"(300,)",False,"This newspaper chain publishes USA Weekend, a Sunday supplement carried by over 300 newspapers",Gannett,1,0
2165,1994-01-21,,Jeopardy,"(4, 3)",AROUND THE WORLD,17,"(300,)",False,"This country with official names in French, German & Italian isn't a member of the U.N.",Switzerland,1,0
2165,1994-01-21,,Jeopardy,"(5, 3)",FLUIDS,28,"(300,)",False,The prefix hydro- refers to water & this prefix refers to milk,lacto-,1,0
2165,1994-01-21,,Jeopardy,"(6, 3)",ODDS & ENDS,8,"(300,)",False,"Miss Manners says of eating grapefruit, ""If you are not armed with a pointed"" one of these ""give up""",a spoon,1,0
2165,1994-01-21,,Jeopardy,"(1, 4)",MODERN HISTORY,22,"(400,)",False,Japan's Heisei reign began in 1989 with the accession of this emperor,Akihito,1,1
2165,1994-01-21,,Jeopardy,"(2, 4)",SONGS OF THE '60s,4,"(400,)",False,"This Elvis chart topper  begins ""We're caught in a trap, I can't walk out because I love you too much baby""",Suspicious Minds,1,0
2165,1994-01-21,,Jeopardy,"(3, 4)",NEWSPAPERS,14,"(400,)",False,In 1986 this Baltimore paper was bought by Times Mirror,the (Baltimore) Sun,1,0
2165,1994-01-21,,Jeopardy,"(4, 4)",AROUND THE WORLD,24,"(400,)",False,In Turkey this famous pair of rivers is called the Dicle & Firat,the Tigris & the Euphrates,0,3
2165,1994-01-21,,Jeopardy,"(5, 4)",FLUIDS,29,"(400,)",False,"Beneath the earth's surface, it cools into igneous rock",magma,1,0
2165,1994-01-21,,Jeopardy,"(6, 4)",ODDS & ENDS,9,"(400,)",False,"In names of fragrances, it precedes lavender & leather",English,1,0
2165,1994-01-21,,Jeopardy,"(1, 5)",MODERN HISTORY,23,"(500,)",False,In 1954 the Geneva Conference separated this country at the 17th parallel,Vietnam,1,0
2165,1994-01-21,,Jeopardy,"(2, 5)",SONGS OF THE '60s,5,"(500,)",False,"""Why does the sun go on shinning? Why does the sea rush to shore? Don't they know it's"" this",The End of the World,1,0
2165,1994-01-21,,Jeopardy,"(3, 5)",NEWSPAPERS,18,"(1000,)",True,"In 1878 he bought the St. Louis Dispatch for $2500, then merged it with the Post",Pulitzer,1,0
2165,1994-01-21,,Jeopardy,"(4, 5)",AROUND THE WORLD,25,"(500,)",False,In 1999 this country will return Macao to China,Portugal,1,0
2165,1994-01-21,,Jeopardy,"(5, 5)",FLUIDS,30,"(500,)",False,The first fluorocarbons used as refrigerants were sold under this trade name,Freon,0,3
2165,1994-01-21,,Jeopardy,"(6, 5)",ODDS & ENDS,10,"(500,)",False,"The indigo bunting isn't a flag, it's one of these animals",a bird,1,0
2165,1994-01-21,,Double Jeopardy,"(1, 1)",SCOTTISH RULERS,1,"(200,)",False,"He probably wasn't killed at Dunsinane as Shakespeare wrote, but at the Battle of Lumphanan",Macbeth,1,0
2165,1994-01-21,,Double Jeopardy,"(2, 1)",ARCHEOLOGY,14,"(200,)",False,"This British monument stands at the center of Salisbury Plain near Amesbury, Wiltshire",Stonehenge,1,0
2165,1994-01-21,,Double Jeopardy,"(3, 1)",CITY NAME ORIGINS,16,"(200,)",False,"This Dutch city's name means ""dam on the Rotte River""",Rotterdam,1,0
2165,1994-01-21,,Double Jeopardy,"(4, 1)",PREGNANCY & CHILDBIRTH,26,"(200,)",False,"At birth, this cord, which acts as a lifeline for the fetus, may reach 2 feet",the umbilical cord,1,0
2165,1994-01-21,,Double Jeopardy,"(5, 1)",AMERICAN AUTHORS,3,"(200,)",False,"In 1957 this author of ""Horton Hatches the Egg"" founded Beginner Books, Inc., now a div. of Random House",Dr. Seuss,1,0
2165,1994-01-21,,Double Jeopardy,"(6, 1)",7-LETTER WORDS,9,"(200,)",False,"On an automatic gear shift, you'll find it between reverse & drive",neutral,1,0
2165,1994-01-21,,Double Jeopardy,"(1, 2)",SCOTTISH RULERS,2,"(400,)",False,"Of Mickey, Pluto, Donald or Goofy, the one who was a King of Scotland",Donald,1,0
2165,1994-01-21,,Double Jeopardy,"(2, 2)",ARCHEOLOGY,15,"(400,)",False,A Paleolithic flint industry has been discovered at Grimaldi just east of this principality,Monaco,1,0
2165,1994-01-21,,Double Jeopardy,"(3, 2)",CITY NAME ORIGINS,17,"(400,)",False,"German city whose name is derived from the Latin for ""colony""; it was once the colony of Agrippina",Cologne,1,0
2165,1994-01-21,,Double Jeopardy,"(4, 2)",PREGNANCY & CHILDBIRTH,27,"(400,)",False,This natural childbirth method was introduced at a maternity hospital in France in the 1950s,Lamaze,1,0
2165,1994-01-21,,Double Jeopardy,"(5, 2)",AMERICAN AUTHORS,4,"(400,)",False,While stationed in Alabama in 1918. he met Zelda Sayre; 2 years later they were married,(F. Scott) Fitzgerald,1,0
2165,1994-01-21,,Double Jeopardy,"(6, 2)",7-LETTER WORDS,10,"(400,)",False,This greasy substance obtained from wool is widely used in cosmetics,Lanolin,1,1
2165,1994-01-21,,Double Jeopardy,"(1, 3)",SCOTTISH RULERS,8,"(600,)",False,"Born in 1566, James VI became king a year later, when this woman, his mother, abdicated",Mary (Queen of Scots),1,0
2165,1994-01-21,,Double Jeopardy,"(2, 3)",ARCHEOLOGY,23,"(600,)",False,"Before a body was turned into one of these in Egypt, some organs were removed to canopic jars",a mummy,1,0
2165,1994-01-21,,Double Jeopardy,"(3, 3)",CITY NAME ORIGINS,18,"(600,)",False,"This Italian city's name comes from the Greek Neapolis, which means ""new city""",Naples,1,0
2165,1994-01-21,,Double Jeopardy,"(4, 3)",PREGNANCY & CHILDBIRTH,28,"(600,)",False,"Pregnancy is divided into 3 parts, each lasting about 3 months & called this",a trimester,1,0
2165,1994-01-21,,Double Jeopardy,"(5, 3)",AMERICAN AUTHORS,5,"(600,)",False,"This ""Deerslayer"" author's first book, ""Precaution"", was written on a dare from his wife",(James Fenimore) Cooper,1,0
2165,1994-01-21,,Double Jeopardy,"(6, 3)",7-LETTER WORDS,11,"(600,)",False,"In music it's a loud flourish of trumpets; in general, it's any loud, public display",a fanfare,1,0
2165,1994-01-21,,Double Jeopardy,"(1, 4)",SCOTTISH RULERS,12,"(800,)",False,This House only provided 2 rulers: Robert I & David II,the House of Bruce,0,3
2165,1994-01-21,,Double Jeopardy,"(2, 4)",ARCHEOLOGY,24,"(800,)",False,Famous cave art sites include Lascaux in France & Altamira in this country,Spain,1,1
2165,1994-01-21,,Double Jeopardy,"(3, 4)",CITY NAME ORIGINS,19,"(800,)",False,This Indonesian capital's name dates back to 1527 & signifies victory,Jakarta,1,0
2165,1994-01-21,,Double Jeopardy,"(4, 4)",PREGNANCY & CHILDBIRTH,29,"(800,)",False,"Done after the 15th week, it's the most common test for detecting chromosome abnormalities",amniocentesis,1,1
2165,1994-01-21,,Double Jeopardy,"(5, 4)",AMERICAN AUTHORS,6,"(800,)",False,"Her only Pulitzer Prize for fiction was for ""One of Ours"", not ""My Antonia""",Willa Cather,1,0
2165,1994-01-21,,Double Jeopardy,"(6, 4)",7-LETTER WORDS,21,"(800,)",False,It's the support under which a lever pivots,a fulcrum,1,0
2165,1994-01-21,,Double Jeopardy,"(1, 5)",SCOTTISH RULERS,13,"(1000,)",False,In 1292 John was the last Scottish ruler to be crowned on this stone before it was moved out of Scotland,the Stone of Scone,0,3
2165,1994-01-21,,Double Jeopardy,"(2, 5)",ARCHEOLOGY,25,"(1000,)",False,The Ishtar Gate & Procession Street is the best surviving monument in this ancient city,Babylon,0,3
2165,1994-01-21,,Double Jeopardy,"(3, 5)",CITY NAME ORIGINS,20,"(1000,)",True,"One explanation for the name of this Belgian port city is that it means ""at the wharf""",Antwerp,0,1
2165,1994-01-21,,Double Jeopardy,"(4, 5)",PREGNANCY & CHILDBIRTH,30,"(1000,)",False,"An obstruction can cause an ectopic pregnancy, where, in most cases, the egg develops here",ghe Fallopian tubes,1,0
2165,1994-01-21,,Double Jeopardy,"(5, 5)",AMERICAN AUTHORS,7,"(1500,)",True,From 1922-1924 he was Postmaster of the University of Mississippi,William Faulkner,1,0
2165,1994-01-21,,Double Jeopardy,"(6, 5)",7-LETTER WORDS,22,"(1000,)",False,It's the wide mouth of a river where its current meets the sea's tide,an estuary,1,0
2165,1994-01-21,,Final Jeopardy,"(1, 1)",THE KENNEDY CENTER HONORS,0,"(1800, 1000, 5201)",False,"The first ballet company founder honored by the Kennedy Center, he was born in St. Petersburg in 1904",George Balanchine,3,0
