epNum,airDate,extra_info,round_name,coord,category,order,value,daily_double,question,answer,correctAttempts,wrongAttempts
2199,1994-03-10,,Jeopardy,"(1, 1)",WORLD CITIES,6,"(100,)",False,The bell tower of Ivan the Great was once the tallest structure in this capital,Moscow,0,0
2199,1994-03-10,,Jeopardy,"(2, 1)",TOYS & GAMES,2,"(100,)",False,"It's the game in which you'd hear a kid call out, ""Ready or not, here I come!""",hide-and-seek,0,0
2199,1994-03-10,,Jeopardy,"(3, 1)",HOLIDAYS & OBSERVANCES,11,"(100,)",False,Between 1644 & 1660 this May Day object was banned in Britain,the May Pole,0,0
2199,1994-03-10,,Jeopardy,"(4, 1)",INSECTS,13,"(100,)",False,This wingless insect that preys on cats & dogs is a carrier of bubonic plague,the flea,0,0
2199,1994-03-10,,Jeopardy,"(5, 1)",BUSINESS & INDUSTRY,24,"(100,)",False,"The first Sunbeam home appliance, it's just the thing for pressing engagements",an iron,0,0
2199,1994-03-10,,Jeopardy,"(6, 1)","STARTS WITH ""L""",20,"(100,)",False,"Lickety-brindle is a variation of this more common synonym for ""rapidly""",lickety-split,0,0
2199,1994-03-10,,Jeopardy,"(1, 2)",WORLD CITIES,8,"(200,)",False,A replica of the Wright Brothers' plane is exhibited at the Aviodome Museum near this largest Dutch city,Amsterdam,0,0
2199,1994-03-10,,Jeopardy,"(2, 2)",TOYS & GAMES,3,"(200,)",False,"When introduced in 1955, this modeling compound came in 1 color, off-white, & was sold only to schools",Play-Doh,0,0
2199,1994-03-10,,Jeopardy,"(3, 2)",HOLIDAYS & OBSERVANCES,12,"(200,)",False,"Simhat Torah, Succot & Yom Kippur all fall in this Number Month on the Jewish calendar",the first,0,0
2199,1994-03-10,,Jeopardy,"(4, 2)",INSECTS,16,"(200,)",False,"Species of this insect include Rajah Brooke's birdwing, tiger swallowtail & red admiral",the butterfly,0,0
2199,1994-03-10,,Jeopardy,"(5, 2)",BUSINESS & INDUSTRY,27,"(200,)",False,"Of all the cities in all Africa, McDonald's walked into this one in 1992 & opened a restaurant",Casablanca,0,0
2199,1994-03-10,,Jeopardy,"(6, 2)","STARTS WITH ""L""",19,"(200,)",False,"This term for a satire comes from lampons, which means ""let's guzzle"" in an Old French drinking song",lampoon,0,0
2199,1994-03-10,,Jeopardy,"(1, 3)",WORLD CITIES,1,"(300,)",False,This city's Tivoli Pleasure Garden was laid out in 1843,Copenhagen,0,0
2199,1994-03-10,,Jeopardy,"(2, 3)",TOYS & GAMES,4,"(300,)",False,Big hits of the 1992 Christmas season were toys associated with this purple PBS dinosaur,Barney,0,0
2199,1994-03-10,,Jeopardy,"(3, 3)",HOLIDAYS & OBSERVANCES,14,"(300,)",False,"According to tradition, these fly in Germany on Walpurgis Night, April 30",witches,0,0
2199,1994-03-10,,Jeopardy,"(4, 3)",INSECTS,17,"(300,)",False,The katydid is a long-horned type of this leaping insect,a grasshopper,0,0
2199,1994-03-10,,Jeopardy,"(5, 3)",BUSINESS & INDUSTRY,28,"(300,)",False,In 1904 Francois Coty founded a firm to make this,perfume,0,0
2199,1994-03-10,,Jeopardy,"(6, 3)","STARTS WITH ""L""",21,"(300,)",False,"This old slang word whose origin is unknown means to dawdle, not to choke on a lollipop",lollygag,0,0
2199,1994-03-10,,Jeopardy,"(1, 4)",WORLD CITIES,9,"(400,)",False,Avenida Paulista is a main thoroughfare in this Brazilian city,São Paulo,0,0
2199,1994-03-10,,Jeopardy,"(2, 4)",TOYS & GAMES,5,"(400,)",False,"This role-playing fantasy game is popularly called ""D&D""",Dungeons and Dragons,0,0
2199,1994-03-10,,Jeopardy,"(3, 4)",HOLIDAYS & OBSERVANCES,15,"(1000,)",True,"Earth Day falls in this, also National Cable Month",April,0,0
2199,1994-03-10,,Jeopardy,"(4, 4)",INSECTS,18,"(400,)",False,Parasol ants bite off pieces of these plant parts & carry them back to their nests to fertilize fungi,leaves,0,0
2199,1994-03-10,,Jeopardy,"(5, 4)",BUSINESS & INDUSTRY,25,"(400,)",False,Kids who belong to this drink's club can shop from its Wacky Warehouse,Kool-Aid,0,0
2199,1994-03-10,,Jeopardy,"(6, 4)","STARTS WITH ""L""",22,"(400,)",False,"A Scouse is a native of this city, as Paul McCartney could tell you",Liverpool,0,0
2199,1994-03-10,,Jeopardy,"(1, 5)",WORLD CITIES,10,"(500,)",False,"Covering about 260 square miles, this Alberta city is Canada's largest capital",Edmonton,0,0
2199,1994-03-10,,Jeopardy,"(2, 5)",TOYS & GAMES,7,"(500,)",False,A 25th anniversary edition of this Ohio Art toy featured walnut & silver trim & jeweled drawing knobs,the Etch-a-Sketch,0,0
2199,1994-03-10,,Jeopardy,"(3, 5)",HOLIDAYS & OBSERVANCES,30,"(500,)",False,"Feb. 14, Valentine's Day, is a day for women's hearts; Feb. 15, her birthday, for women's rights",Susan B. Anthony,0,0
2199,1994-03-10,,Jeopardy,"(4, 5)",INSECTS,29,"(500,)",False,Glowworms are the larvae or wingless females of this soft-bodied beetle,the firefly,0,0
2199,1994-03-10,,Jeopardy,"(5, 5)",BUSINESS & INDUSTRY,26,"(500,)",False,This first brand of instant coffee was made in Switzerland,Nescafé,0,0
2199,1994-03-10,,Jeopardy,"(6, 5)","STARTS WITH ""L""",23,"(500,)",False,"It's been called a ""poor substitute for the truth but the only one discovered up to date""",a lie,0,0
2199,1994-03-10,,Double Jeopardy,"(1, 1)",HISTORIC NAMES,1,"(200,)",False,"After finding this man, Henry Morton Stanley wrote, ""It seemed to me as if I had met an old, old friend""",Livingstone,0,0
2199,1994-03-10,,Double Jeopardy,"(2, 1)",WEIGHTS & MEASURES,15,"(200,)",False,"One of these measures of land is equal to 43,560 square feet",An acre,0,0
2199,1994-03-10,,Double Jeopardy,"(3, 1)",MOVIE SONGS,11,"(200,)",False,"Songs from this 1964 Walt Disney film include ""I Love To Laugh"" & ""A Spoonful of Sugar""",Mary Poppins,0,0
2199,1994-03-10,,Double Jeopardy,"(4, 1)",THE BIBLE,26,"(200,)",False,"Pharaoh's daughter made him her son & called him this ""because I drew him out of the water""",Moses,0,0
2199,1994-03-10,,Double Jeopardy,"(5, 1)",AUTHORS' BIRTHPLACES,20,"(200,)",False,"When he was born in Jamestown, North Dakota in 1908, his family spelled their last name LaMoore",Louis L'Amour,0,0
2199,1994-03-10,,Double Jeopardy,"(6, 1)",THE PANAMA CANAL,6,"(200,)",False,This 1898 war underscored the U.S. Navy's need for a canal,the Spanish-American war,0,0
2199,1994-03-10,,Double Jeopardy,"(1, 2)",HISTORIC NAMES,2,"(400,)",False,Fewer than 10 people were present to hear Friedrich Engels' oration at this man's funeral in 1883,(Karl) Marx,0,0
2199,1994-03-10,,Double Jeopardy,"(2, 2)",WEIGHTS & MEASURES,16,"(400,)",False,A rod is equal to 16 1/2 feet or 5 1/2 of these,yards,0,0
2199,1994-03-10,,Double Jeopardy,"(3, 2)",MOVIE SONGS,12,"(400,)",False,"""It Goes Like It Goes"", from this Sally Field film about a Southern textile worker, won a 1979 Oscar",Norma Rae,0,0
2199,1994-03-10,,Double Jeopardy,"(4, 2)",THE BIBLE,27,"(400,)",False,"""A man hath no better thing under the sun, than to eat, and to drink, and to be"" this",merry,0,0
2199,1994-03-10,,Double Jeopardy,"(5, 2)",AUTHORS' BIRTHPLACES,22,"(400,)",False,"This author of ""Silent Spring"" was born in the springtime in Springdale, Penn. & died in Silver Spring, Maryland",Rachel Carson,0,0
2199,1994-03-10,,Double Jeopardy,"(6, 2)",THE PANAMA CANAL,7,"(400,)",False,"De Lesseps, who'd previously directed the construction of this canal 1859-1869, failed to build one in Panama",the Suez Canal,0,0
2199,1994-03-10,,Double Jeopardy,"(1, 3)",HISTORIC NAMES,3,"(600,)",False,In 1721 he was acclaimed father of the fatherland & emperor of all Russia,Peter the Great,0,0
2199,1994-03-10,,Double Jeopardy,"(2, 3)",WEIGHTS & MEASURES,17,"(600,)",False,"A ""gross"" or ""long"" one of these is equal to 2,240 pounds",a ton,0,0
2199,1994-03-10,,Double Jeopardy,"(3, 3)",MOVIE SONGS,13,"(600,)",False,"This song from ""Willy Wonka and the Chocolate Factory"" was Sammy Davis' only No. 1 pop hit","""The Candy Man""",0,0
2199,1994-03-10,,Double Jeopardy,"(4, 3)",THE BIBLE,28,"(600,)",False,"While preaching in the wilderness, he said, ""Repent ye: for the kingdom of heaven is at hand""",John the Baptist,0,0
2199,1994-03-10,,Double Jeopardy,"(5, 3)",AUTHORS' BIRTHPLACES,23,"(600,)",False,John Hersey was born in this Asian country while his parents were missionaries there,China,0,0
2199,1994-03-10,,Double Jeopardy,"(6, 3)",THE PANAMA CANAL,8,"(600,)",False,"The canal's headquarters is in this port named for the ""discoverer"" of the Pacific Ocean",Balboa,0,0
2199,1994-03-10,,Double Jeopardy,"(1, 4)",HISTORIC NAMES,4,"(800,)",False,The Duke of Wellington was a distant relative of this founder of Methodism,John Wesley,0,0
2199,1994-03-10,,Double Jeopardy,"(2, 4)",WEIGHTS & MEASURES,18,"(800,)",False,1 hand is equal to 4 of these,inches,0,0
2199,1994-03-10,,Double Jeopardy,"(3, 4)",MOVIE SONGS,14,"(800,)",False,"In 1969 Henry Mancini reached No. 1 with ""A Time for Us"", the love theme from this film",Romeo and Juliet,0,0
2199,1994-03-10,,Double Jeopardy,"(4, 4)",THE BIBLE,29,"(800,)",False,"Although this Roman official acknowledged Jesus' innocence, he had him crucified anyway",Pontius Pilate,0,0
2199,1994-03-10,,Double Jeopardy,"(5, 4)",AUTHORS' BIRTHPLACES,24,"(800,)",False,"This beloved author of the ""Uncle Remus"" stories was born in Eatonton, Ga. on Dec. 9, 1848",Joel Chandler Harris,0,0
2199,1994-03-10,,Double Jeopardy,"(6, 4)",THE PANAMA CANAL,9,"(400,)",True,"Hoping for a better canal treaty, the U.S. supported Panama's 1903 revolt against this country",Colombia,0,0
2199,1994-03-10,,Double Jeopardy,"(1, 5)",HISTORIC NAMES,5,"(1000,)",False,"Because none of her children survived her, this British queen was succeeded by George I in 1714",Queen Anne,0,0
2199,1994-03-10,,Double Jeopardy,"(2, 5)",WEIGHTS & MEASURES,19,"(1000,)",False,An object spinning at 3 RPS is going at this many RPM,180 RPM,0,0
2199,1994-03-10,,Double Jeopardy,"(3, 5)",MOVIE SONGS,21,"(1000,)",False,"In this 1936 film based on an operetta, Nelson Eddy & Jeannette MacDonald sang ""Indian Love Call""",Rose Marie,0,0
2199,1994-03-10,,Double Jeopardy,"(4, 5)",THE BIBLE,30,"(100,)",True,His wife Rachel died while giving birth to Benjamin,Jacob,0,0
2199,1994-03-10,,Double Jeopardy,"(5, 5)",AUTHORS' BIRTHPLACES,25,"(1000,)",False,"This Frenchman was born in Algeria, the setting for his famous 1942 novel ""The Stranger""",Albert Camus,0,0
2199,1994-03-10,,Double Jeopardy,"(6, 5)",THE PANAMA CANAL,10,"(1000,)",False,"The canal has 3 sets of these: the Gatun, Pedro Miguel & Miraflores",locks,0,0
2199,1994-03-10,,Final Jeopardy,"(1, 1)",THE CONSTITUTION,0,(),False,Name given the plan proposed by William Paterson at the Constitutional Convention,the New Jersey plan,0,0
