epNum,airDate,extra_info,round_name,coord,category,order,value,daily_double,question,answer,correctAttempts,wrongAttempts
2221,1994-04-11,,Jeopardy,"(1, 1)",1961,17,"(100,)",False,In the U.S. this was raised to $1.25 an hour,the minimum wage,0,0
2221,1994-04-11,,Jeopardy,"(2, 1)",TV TRIVIA,26,"(100,)",False,"On ""The Honeymooners"", Ed Norton was a city sewer worker & Ralph Kramden worked as this",a bus driver,0,0
2221,1994-04-11,,Jeopardy,"(3, 1)",TEXTILES,7,"(100,)",False,"The ""raw"" type of this fiber is reeled from the cocoons still containing the gum or sericin",silk,0,0
2221,1994-04-11,,Jeopardy,"(4, 1)",U.S.A.,4,"(100,)",False,The Highland Rim area of this state completely surrounds the Nashville Basin,Tennessee,0,0
2221,1994-04-11,,Jeopardy,"(5, 1)",POTPOURRI,11,"(100,)",False,"Without consulting Congress, Nixon ordered an invasion of this Vietnam neighbor in April 1970",Cambodia,0,0
2221,1994-04-11,,Jeopardy,"(6, 1)","""BLACK"" & ""WHITE""",1,"(100,)",False,"It can be a pirate flag or a card game where players try to get ""21""",blackjack,0,0
2221,1994-04-11,,Jeopardy,"(1, 2)",1961,18,"(200,)",False,"When the Navy decommissioned its fleet of these, they were deflated & packed away",lighter-than-air ships (blimps),0,0
2221,1994-04-11,,Jeopardy,"(2, 2)",TV TRIVIA,27,"(200,)",False,"Diane Ladd, who played Flo in the film version, turned up as waitress Belle on this sitcom",Alice,0,0
2221,1994-04-11,,Jeopardy,"(3, 2)",TEXTILES,22,"(200,)",False,The Chantilly type of this fabric was first made in the 18th century,Lace,0,0
2221,1994-04-11,,Jeopardy,"(4, 2)",U.S.A.,5,"(200,)",False,"In terms of population, Erie is the third-largest city in this state",Pennsylvania,0,0
2221,1994-04-11,,Jeopardy,"(5, 2)",POTPOURRI,13,"(200,)",False,Black Hills State University is located in Spearfish in this state,South Dakota,0,0
2221,1994-04-11,,Jeopardy,"(6, 2)","""BLACK"" & ""WHITE""",2,"(200,)",False,"From the color of polish, it's an old name for a shiner of shoes",a bootblack,0,0
2221,1994-04-11,,Jeopardy,"(1, 3)",1961,19,"(300,)",False,"Newton Minow, chairman of this group, complained about many things, including game shows",the F.C.C. (Federal Communications Commission),0,0
2221,1994-04-11,,Jeopardy,"(2, 3)",TV TRIVIA,28,"(300,)",False,"On ""Sesame Street"", this Muppet makes his home in a garbage can",Oscar (the Grouch),0,0
2221,1994-04-11,,Jeopardy,"(3, 3)",TEXTILES,23,"(300,)",False,"The name of this man-made fiber may come from French meaning ""ray of light""",rayon,0,0
2221,1994-04-11,,Jeopardy,"(4, 3)",U.S.A.,6,"(300,)",False,"This capital of Mississippi is the ""Crossroads of the South""","Jackson, Mississippi",0,0
2221,1994-04-11,,Jeopardy,"(5, 3)",POTPOURRI,14,"(300,)",False,Over 90% of Poles are followers of this church,the Catholic church,0,0
2221,1994-04-11,,Jeopardy,"(6, 3)","""BLACK"" & ""WHITE""",3,"(300,)",False,Huey Newton was one of the founders of this party,the Black Panther party,0,0
2221,1994-04-11,,Jeopardy,"(1, 4)",1961,20,"(400,)",False,In March he was named director of the Peace Corps,Sargent Shriver,0,0
2221,1994-04-11,,Jeopardy,"(2, 4)",TV TRIVIA,29,"(400,)",False,"It was the nickname of Kim Fields' character Dorothy Ramsey on ""The Facts of Life""",Tootie,0,0
2221,1994-04-11,,Jeopardy,"(3, 4)",TEXTILES,24,"(400,)",False,"Lycra, used in swimsuits, is a trademark of this chemical company",Du Pont,0,0
2221,1994-04-11,,Jeopardy,"(4, 4)",U.S.A.,8,"(400,)",False,The extreme western part of Alaska's Aleutian Islands is in the same time zone as this other state,Hawaii,0,0
2221,1994-04-11,,Jeopardy,"(5, 4)",POTPOURRI,15,"(400,)",False,"This spice that comes in ""quills"" is essential to make Cafe Brulot & Bananas Foster",cinnamon,0,0
2221,1994-04-11,,Jeopardy,"(6, 4)","""BLACK"" & ""WHITE""",10,"(400,)",False,"This chess piece tells Alice, ""The great art of riding is to keep--"" & promptly falls over",the White Knight,0,0
2221,1994-04-11,,Jeopardy,"(1, 5)",1961,21,"(500,)",False,"This Kenyan leader, imprisoned since 1952, was released on August 21",(Jomo) Kenyatta,0,0
2221,1994-04-11,,Jeopardy,"(2, 5)",TV TRIVIA,30,"(500,)",False,"In a 1977 TV special, he turned up married to Zelda Gilroy",Dobie Gillis,0,0
2221,1994-04-11,,Jeopardy,"(3, 5)",TEXTILES,25,"(500,)",False,The Sea Island type of this fiber was originally brought to the U.S. from the West Indies,cotton,0,0
2221,1994-04-11,,Jeopardy,"(4, 5)",U.S.A.,9,"(1000,)",True,"On an alphabetical list of the New England states, this one comes first",Connecticut,0,0
2221,1994-04-11,,Jeopardy,"(5, 5)",POTPOURRI,16,"(500,)",False,"In this John Steinbeck novelette Kino, a fisherman, finds a large gem but it brings only tragedy",The Pearl,0,0
2221,1994-04-11,,Jeopardy,"(6, 5)","""BLACK"" & ""WHITE""",12,"(500,)",False,This New York City architect was shot & killed in 1906 by a jealous husband,Stanford White,0,0
2221,1994-04-11,,Double Jeopardy,"(1, 1)",HISTORIC NAMES,6,"(200,)",False,He was the first U.S. president who had a father named John & a son named John,John Adams,0,0
2221,1994-04-11,,Double Jeopardy,"(2, 1)",FRUITS & VEGETABLES,21,"(200,)",False,"The curly-leafed variety of this herb is used as a garnish; the flat Italian, for flavoring",parsley,0,0
2221,1994-04-11,,Double Jeopardy,"(3, 1)",FIRST AID,26,"(200,)",False,"If a dog bites you, first do this to the wound, then cover it with a sterile dressing",wash it,0,0
2221,1994-04-11,,Double Jeopardy,"(4, 1)",OBSERVATORIES,11,"(200,)",False,"One of the oldest known structures used as an observatory is this one in Wiltshire, England",Stonehenge,0,0
2221,1994-04-11,,Double Jeopardy,"(5, 1)",CLASSICAL COMPOSERS,1,"(200,)",False,"By the time he completed his ninth symphony in 1824, this composer was totally deaf",Beethoven,0,0
2221,1994-04-11,,Double Jeopardy,"(6, 1)",ORIGINAL LANGUAGES,16,"(200,)",False,"""The Little Red Book"" of the Red Guards",Chinese,0,0
2221,1994-04-11,,Double Jeopardy,"(1, 2)",HISTORIC NAMES,7,"(400,)",False,William Bradford lived in Leyden in this country for several years before he set sail for Plymouth,the Netherlands,0,0
2221,1994-04-11,,Double Jeopardy,"(2, 2)",FRUITS & VEGETABLES,22,"(400,)",False,"In 1893 the justices of the Supreme Court declared that this was a vegetable, not a fruit",a tomato,0,0
2221,1994-04-11,,Double Jeopardy,"(3, 2)",FIRST AID,27,"(400,)",False,"A choking victim may be saved with this ""maneuver"" whether he's sitting, standing or lying down",The Heimlich maneuver,0,0
2221,1994-04-11,,Double Jeopardy,"(4, 2)",OBSERVATORIES,12,"(400,)",False,An observatory at Jaipur in this country has a sundial built in the 1720s with a column height of almost 90 feet,India,0,0
2221,1994-04-11,,Double Jeopardy,"(5, 2)",CLASSICAL COMPOSERS,2,"(400,)",False,"Although Mozart is not buried at St. Sebastian's Church in this city, his wife & father are",Salzburg,0,0
2221,1994-04-11,,Double Jeopardy,"(6, 2)",ORIGINAL LANGUAGES,17,"(400,)",False,"""The Declaration of the Rights of Man and of the Citizen"", adopted in 1789",French,0,0
2221,1994-04-11,,Double Jeopardy,"(1, 3)",HISTORIC NAMES,8,"(600,)",False,"Lord Cornbury, who held this political office in N.Y. & N.J. 1702-08, enjoyed dressing up like a woman",the governor,0,0
2221,1994-04-11,,Double Jeopardy,"(2, 3)",FRUITS & VEGETABLES,23,"(600,)",False,"Also called aubergine, this is often salted & drained before cooking",eggplant,0,0
2221,1994-04-11,,Double Jeopardy,"(3, 3)",FIRST AID,28,"(600,)",False,A victim of severe sunburn may develop these; do not break them open,Blisters,0,0
2221,1994-04-11,,Double Jeopardy,"(4, 3)",OBSERVATORIES,13,"(1700,)",True,The first coronagraph was used in 1930 at the Pic Du Midi Observatory in these mountains in France,the Pyrenees,0,0
2221,1994-04-11,,Double Jeopardy,"(5, 3)",CLASSICAL COMPOSERS,3,"(600,)",False,"After a less than enthusiastic opening night, he revised ""Madama Butterfly""",Puccini,0,0
2221,1994-04-11,,Double Jeopardy,"(6, 3)",ORIGINAL LANGUAGES,18,"(600,)",False,"""The Bear"" & ""The Sea Gull""",Russian,0,0
2221,1994-04-11,,Double Jeopardy,"(1, 4)",HISTORIC NAMES,9,"(800,)",False,Peyton Randolph represented this college in the House of Burgesses 1752-1761,William and Mary,0,0
2221,1994-04-11,,Double Jeopardy,"(2, 4)",FRUITS & VEGETABLES,24,"(800,)",False,"Montmorency is the sour or ""pie"" type of this fruit cultivated most often in the U.S.",the cherry,0,0
2221,1994-04-11,,Double Jeopardy,"(3, 4)",FIRST AID,29,"(800,)",False,It's what the CP stands for in CPR,cardiopulmonary,0,0
2221,1994-04-11,,Double Jeopardy,"(4, 4)",OBSERVATORIES,14,"(800,)",False,Until 1976 the Hale Telescope on this California mountain was the world's largest reflector at 200 inches,Mount Palomar,0,0
2221,1994-04-11,,Double Jeopardy,"(5, 4)",CLASSICAL COMPOSERS,4,"(800,)",False,"Selections in his ""Peer Gynt"" suite include ""Anitra's Dance"", ""Morning"" & ""In the Hall of the Mountain King""",(Edvard) Grieg,0,0
2221,1994-04-11,,Double Jeopardy,"(6, 4)",ORIGINAL LANGUAGES,19,"(800,)",False,"1532's ""The Prince""",Italian,0,0
2221,1994-04-11,,Double Jeopardy,"(1, 5)",HISTORIC NAMES,10,"(1000,)",False,She was the second wife of Napoleon I & the mother of Napoleon II,Marie-Louise,0,0
2221,1994-04-11,,Double Jeopardy,"(2, 5)",FRUITS & VEGETABLES,25,"(1000,)",False,"""The Joy of Cooking"" suggests cooking the Savoy type of this longer than the regular type",cabbage,0,0
2221,1994-04-11,,Double Jeopardy,"(3, 5)",FIRST AID,30,"(200,)",True,Pressure on this artery found just below the groin may help control bleeding from a leg wound,the femoral artery,0,0
2221,1994-04-11,,Double Jeopardy,"(4, 5)",OBSERVATORIES,15,"(1000,)",False,In 1675 England's King Charles II founded this observatory located on what became the Prime Meridian,Greenwich,0,0
2221,1994-04-11,,Double Jeopardy,"(5, 5)",CLASSICAL COMPOSERS,5,"(1000,)",False,In 1907 he was appointed professor of piano at the Royal Hungarian Academy of Music,Béla Bartók,0,0
2221,1994-04-11,,Double Jeopardy,"(6, 5)",ORIGINAL LANGUAGES,20,"(1000,)",False,"The 18-book Mahabharata, an epic attributed to Vyasa",Sanskrit,0,0
2221,1994-04-11,,Final Jeopardy,"(1, 1)",U.S. PRESIDENTS,0,(),False,1 of 2 presidents who became widowers & remarried while in office,John Tyler or Woodrow Wilson,0,0
