epNum,airDate,extra_info,round_name,coord,category,order,value,daily_double,question,answer,correctAttempts,wrongAttempts
2245,1994-05-13,1994 College Championship final game 2.,Jeopardy,"(1, 1)",HISTORIC DOCUMENTS,26,"(100,)",False,"The Berne Convention of 1886 was about these, symbolized by a C in a circle",copyrights,0,0
2245,1994-05-13,1994 College Championship final game 2.,Jeopardy,"(2, 1)",COMIC BOOKS,5,"(100,)",False,"After Bruce Wayne's back was broken by Bane, Jean Paul Valley took over as this hero",Batman,0,0
2245,1994-05-13,1994 College Championship final game 2.,Jeopardy,"(3, 1)",BALLET,1,"(100,)",False,"Used during exercises, it's the horizontal wooden support that runs along the wall of a ballet studio",the barre,0,0
2245,1994-05-13,1994 College Championship final game 2.,Jeopardy,"(4, 1)",STATE ANIMALS,12,"(100,)",False,"Crazy as it seems, it's Minnesota's state bird",the loon,0,0
2245,1994-05-13,1994 College Championship final game 2.,Jeopardy,"(5, 1)",FIRST NAMES,28,"(100,)",False,"Becky often used independently, is also a pet form of this name",Rebecca,0,0
2245,1994-05-13,1994 College Championship final game 2.,Jeopardy,"(6, 1)","ENDS ""IN""",9,"(100,)",False,Take the lady from her dance partner,cut in,0,0
2245,1994-05-13,1994 College Championship final game 2.,Jeopardy,"(1, 2)",HISTORIC DOCUMENTS,30,"(200,)",False,"Around 621 B.C. Draco, a chief magistrate, first codified the laws for this Greek city-state's people",Athens,0,0
2245,1994-05-13,1994 College Championship final game 2.,Jeopardy,"(2, 2)",COMIC BOOKS,6,"(200,)",False,"The Marvel comic featuring this MTV pair is ""suggested for immature readers""",Beavis & Butthead,0,0
2245,1994-05-13,1994 College Championship final game 2.,Jeopardy,"(3, 2)",BALLET,2,"(200,)",False,"Traditionally, the ballerinas in ""La Sylphide"" & ""Les Sylphides"" wear diaphanous tutus of this color",white,0,0
2245,1994-05-13,1994 College Championship final game 2.,Jeopardy,"(4, 2)",STATE ANIMALS,27,"(200,)",False,The white-tailed type of this is Nebraska's state mammal,a deer,0,0
2245,1994-05-13,1994 College Championship final game 2.,Jeopardy,"(5, 2)",FIRST NAMES,29,"(200,)",False,"Meaning ""youthful"", it's' the perfect name for a ""pretty woman""",Julia,0,0
2245,1994-05-13,1994 College Championship final game 2.,Jeopardy,"(6, 2)","ENDS ""IN""",13,"(200,)",False,A vote for a candidate who is not on the ballot,write-in,0,0
2245,1994-05-13,1994 College Championship final game 2.,Jeopardy,"(1, 3)",HISTORIC DOCUMENTS,19,"(300,)",False,Only 1 volume of this Karl Marx 4-volume work was published before his death,Das Kapital,0,0
2245,1994-05-13,1994 College Championship final game 2.,Jeopardy,"(2, 3)",COMIC BOOKS,11,"(300,)",False,"""The Witching Hour"" is among her novels that have been adapted into comics",Anne Rice,0,0
2245,1994-05-13,1994 College Championship final game 2.,Jeopardy,"(3, 3)",BALLET,3,"(300,)",False,"Sir Kenneth MacMillan's ballet ""Winter Dreams"" was inspired by this playwright's ""The Three Sisters""",Chekhov,0,0
2245,1994-05-13,1994 College Championship final game 2.,Jeopardy,"(4, 3)",STATE ANIMALS,25,"(300,)",False,"Resembling a small lobster, it's Louisiana's state crustacean",a crayfish,0,0
2245,1994-05-13,1994 College Championship final game 2.,Jeopardy,"(5, 3)",FIRST NAMES,18,"(300,)",False,"This name that means ""blessed"" may have lost favor in the U.S. after its association with a famous traitor",Benedict,0,0
2245,1994-05-13,1994 College Championship final game 2.,Jeopardy,"(6, 3)","ENDS ""IN""",23,"(300,)",False,Give someone an oath of office,swear in,0,0
2245,1994-05-13,1994 College Championship final game 2.,Jeopardy,"(1, 4)",HISTORIC DOCUMENTS,10,"(400,)",False,The ABC treaty of 1915 was signed by these 3 South American countries,"Argentina, Brazil & Chile",0,0
2245,1994-05-13,1994 College Championship final game 2.,Jeopardy,"(2, 4)",COMIC BOOKS,22,"(400,)",False,Jellybean is the baby sister of this Archie Comics character,Jughead,0,0
2245,1994-05-13,1994 College Championship final game 2.,Jeopardy,"(3, 4)",BALLET,8,"(400,)",False,"""Symphony in C"" is performed to music written by this ""Carmen"" composer when he was just 17",Bizet,0,0
2245,1994-05-13,1994 College Championship final game 2.,Jeopardy,"(4, 4)",STATE ANIMALS,4,"(400,)",False,South Dakota's state animal is this howling canine,a coyote,0,0
2245,1994-05-13,1994 College Championship final game 2.,Jeopardy,"(5, 4)",FIRST NAMES,17,"(1000,)",True,"Once referring to a boy training for knighthood, it's now a popular name for girls",Paige,0,0
2245,1994-05-13,1994 College Championship final game 2.,Jeopardy,"(6, 4)","ENDS ""IN""",24,"(400,)",False,Eavesdrop,listen in,0,0
2245,1994-05-13,1994 College Championship final game 2.,Jeopardy,"(1, 5)",HISTORIC DOCUMENTS,15,"(500,)",False,"After this 1215: document was declared void by Innocent III, it was reissued with changes in 1216, 1217 & 1225",the Magna Carta,0,0
2245,1994-05-13,1994 College Championship final game 2.,Jeopardy,"(2, 5)",COMIC BOOKS,21,"(500,)",False,"Now Comics is presenting the ""New Adventures"" of this driver of the Mach Five",Speed Racer,0,0
2245,1994-05-13,1994 College Championship final game 2.,Jeopardy,"(3, 5)",BALLET,7,"(500,)",False,"When this Tchaikovsky ballet premiered in 1890, a male dancer played Carabosse the evil fairy",Sleeping Beauty,0,0
2245,1994-05-13,1994 College Championship final game 2.,Jeopardy,"(4, 5)",STATE ANIMALS,14,"(500,)",False,"It's the state insect of New Jersey, Maine & Utah",the honeybee,0,0
2245,1994-05-13,1994 College Championship final game 2.,Jeopardy,"(5, 5)",FIRST NAMES,16,"(500,)",False,Jed is short for this biblical name,Jedediah,0,0
2245,1994-05-13,1994 College Championship final game 2.,Jeopardy,"(6, 5)","ENDS ""IN""",20,"(500,)",False,Lend a hand to stop litter,pitch-in,0,0
2245,1994-05-13,1994 College Championship final game 2.,Double Jeopardy,"(1, 1)",BIOLOGY,1,"(200,)",False,It's the large organ suspended from a cow's body that holds milk,the udder,0,0
2245,1994-05-13,1994 College Championship final game 2.,Double Jeopardy,"(2, 1)",WORLD CAPITALS,4,"(200,)",False,The U.S. embassy in this capital overlooks the Avenue des Champs-Elysees from the north,Paris,0,0
2245,1994-05-13,1994 College Championship final game 2.,Double Jeopardy,"(3, 1)",THE NEW TESTAMENT,19,"(200,)",False,"This disciple, ""one of the twelve, went unto the chief priests"" to betray Jesus",Judas,0,0
2245,1994-05-13,1994 College Championship final game 2.,Double Jeopardy,"(4, 1)",BLACK AMERICA,10,"(200,)",False,"In the race for the 1988 Dem. presidential nomination, he finished second to Michael Dukakis",(Jesse) Jackson,0,0
2245,1994-05-13,1994 College Championship final game 2.,Double Jeopardy,"(5, 1)",THE 1990s,30,"(200,)",False,"This Jan. 17, 1994 event caused the cancellation of Jeopardy!'s Jan. 18 & 19 tapings",an (Northridge or Reseda) earthquake,0,0
2245,1994-05-13,1994 College Championship final game 2.,Double Jeopardy,"(6, 1)",LITERARY POTPOURRI,28,"(200,)",False,"Near the end of this novel, Passepartout discovers that the trip could have been made in just 78 days",Around the World in Eighty Days,0,0
2245,1994-05-13,1994 College Championship final game 2.,Double Jeopardy,"(1, 2)",BIOLOGY,17,"(400,)",False,It's the part of a living cell that contains the chromosomes,the nucleus,0,0
2245,1994-05-13,1994 College Championship final game 2.,Double Jeopardy,"(2, 2)",WORLD CAPITALS,7,"(400,)",False,This Indian capital was designed by architects Sir Herbert Baker & Sir Edwin Lutyens,New Delhi,0,0
2245,1994-05-13,1994 College Championship final game 2.,Double Jeopardy,"(3, 2)",THE NEW TESTAMENT,24,"(400,)",False,"He was the son of Zacharias & Elisabeth & the cousin of Jesus' mother, Mary",John the Baptist,0,0
2245,1994-05-13,1994 College Championship final game 2.,Double Jeopardy,"(4, 2)",BLACK AMERICA,27,"(400,)",False,"This actor earned an Oscar nomination for playing the title role in the 1992 film ""Malcolm X""",Denzel Washington,0,0
2245,1994-05-13,1994 College Championship final game 2.,Double Jeopardy,"(5, 2)",THE 1990s,29,"(400,)",False,This New York governor put Bill Clinton's name into nomination at the 1992 Democratic convention,(Mario) Cuomo,0,0
2245,1994-05-13,1994 College Championship final game 2.,Double Jeopardy,"(6, 2)",LITERARY POTPOURRI,22,"(400,)",False,"""Life is made up of marble and mud', wrote this author in ""The House of the Seven Gables""",Hawthorne,0,0
2245,1994-05-13,1994 College Championship final game 2.,Double Jeopardy,"(1, 3)",BIOLOGY,18,"(600,)",False,"In the liver & spleen, a protein called ferritin stores this mineral",iron,0,0
2245,1994-05-13,1994 College Championship final game 2.,Double Jeopardy,"(2, 3)",WORLD CAPITALS,3,"(600,)",False,Thoroughfares in this capital include Adelaide Avenue & Melbourne Avenue,Canberra (Australia),0,0
2245,1994-05-13,1994 College Championship final game 2.,Double Jeopardy,"(3, 3)",THE NEW TESTAMENT,21,"(600,)",False,"In Romans this apostle wrote ""The gift of God is eternal life through Jesus Christ our Lord""",Paul,0,0
2245,1994-05-13,1994 College Championship final game 2.,Double Jeopardy,"(4, 3)",BLACK AMERICA,26,"(600,)",False,In 1894 this agricultural scientist became the first black graduate of what's now Iowa State University,George Washington Carver,0,0
2245,1994-05-13,1994 College Championship final game 2.,Double Jeopardy,"(5, 3)",THE 1990s,20,"(600,)",False,Former Duke Univ. President Terry Sanford lost his Senate reelection bid from this state in 1992,North Carolina,0,0
2245,1994-05-13,1994 College Championship final game 2.,Double Jeopardy,"(6, 3)",LITERARY POTPOURRI,23,"(600,)",False,"This author of ""Kim"" set his children's book ""Rewards and Fairies"" in Sussex, where he lived",(Rudyard) Kipling,0,0
2245,1994-05-13,1994 College Championship final game 2.,Double Jeopardy,"(1, 4)",BIOLOGY,2,"(2800,)",True,"Though ""inferior"" in name, it's the largest vein in the human body",the (inferior) vena cava,0,0
2245,1994-05-13,1994 College Championship final game 2.,Double Jeopardy,"(2, 4)",WORLD CAPITALS,5,"(800,)",False,In 1809 this Ecuadoran capital staged one of the first uprisings for independence in Latin America,Quito,0,0
2245,1994-05-13,1994 College Championship final game 2.,Double Jeopardy,"(3, 4)",THE NEW TESTAMENT,8,"(800,)",False,"This last book ends with ""The Grace of our Lord Jesus Christ be with you all. Amen""",Revelation,0,0
2245,1994-05-13,1994 College Championship final game 2.,Double Jeopardy,"(4, 4)",BLACK AMERICA,9,"(800,)",False,"This Supreme Court justice began practicing law in 1933, after graduating from Howard University",Thurgood Marshall,0,0
2245,1994-05-13,1994 College Championship final game 2.,Double Jeopardy,"(5, 4)",THE 1990s,25,"(800,)",False,"On Nov 1, 1993 Alexander Trotman replaced Harold A. Poling as CEO of this auto company",Ford,0,0
2245,1994-05-13,1994 College Championship final game 2.,Double Jeopardy,"(6, 4)",LITERARY POTPOURRI,11,"(800,)",False,"This Sir Thomas Malory work is based in part on French sources such as the ""Suite du Merlin""",Le Morte d'Arthur,0,0
2245,1994-05-13,1994 College Championship final game 2.,Double Jeopardy,"(1, 5)",BIOLOGY,16,"(1000,)",False,Nerve impulses in the body are transmitted from cell to cell by dendrites & these fibers,axons,0,0
2245,1994-05-13,1994 College Championship final game 2.,Double Jeopardy,"(2, 5)",WORLD CAPITALS,6,"(1000,)",False,"The metropolitan area of this European capital is officially bilingual, with French & Dutch spoken","Brussels, Belgium",0,0
2245,1994-05-13,1994 College Championship final game 2.,Double Jeopardy,"(3, 5)",THE NEW TESTAMENT,13,"(1000,)",False,Tradition says that the Horns of Hattin was the peak where Jesus delivered this message,the Sermon on the Mount,0,0
2245,1994-05-13,1994 College Championship final game 2.,Double Jeopardy,"(4, 5)",BLACK AMERICA,15,"(1000,)",False,"This abolitionist & editor of the North Star once served as recorder of deeds in Washington, D.C.",(Frederick) Douglass,0,0
2245,1994-05-13,1994 College Championship final game 2.,Double Jeopardy,"(5, 5)",THE 1990s,12,"(1000,)",False,"In Sept. 1991 this writer emerged from hiding to accept an award for ""Haroun and the Sea of Stories""",(Salman) Rushdie,0,0
2245,1994-05-13,1994 College Championship final game 2.,Double Jeopardy,"(6, 5)",LITERARY POTPOURRI,14,"(2900,)",True,"At the beginning of this 1897 H.G. Wells novel, the title character is ""wrapped up from head to foot""",The Invisible Man,0,0
2245,1994-05-13,1994 College Championship final game 2.,Final Jeopardy,"(1, 1)",MYTHOLOGICAL WOMEN,0,(),False,"The name of this woman in mythology is Greek for ""weaver"" or ""bobbin worker""",Penelope,0,0
