epNum,airDate,extra_info,round_name,coord,category,order,value,daily_double,question,answer,correctAttempts,wrongAttempts
2259,1994-06-02,,Jeopardy,"(1, 1)",NEW YORK CITY,3,"(100,)",False,Herald & Times Squares were named after 2 of these publications,newspapers,0,0
2259,1994-06-02,,Jeopardy,"(2, 1)",BIBLICAL NAMES,2,"(100,)",False,Golly! This TV Marine has the same first name as Hosea's harlot wife,Gomer (Pyle),0,0
2259,1994-06-02,,Jeopardy,"(3, 1)",HISTORIC DOCUMENTS,10,"(100,)",False,This French emperor decreed the dissolution of the Holy Roman Empire in 1806,Napoleon,0,0
2259,1994-06-02,,Jeopardy,"(4, 1)",TRIOS,1,"(100,)",False,"Among the first things learned at school are the 3 R's, which are these","reading, writing & arithmetic",0,0
2259,1994-06-02,,Jeopardy,"(5, 1)","REALLY ""BIG""",4,"(100,)",False,The press often used this phrase when referring to Teddy Roosevelt's foreign policy,the big stick,0,0
2259,1994-06-02,,Jeopardy,"(6, 1)",SHOES,20,"(100,)",False,"At midnight ""at the foot of the staircase, she stumbled a little and her left slipper slipped off""",Cinderella,0,0
2259,1994-06-02,,Jeopardy,"(1, 2)",NEW YORK CITY,15,"(200,)",False,It's the home park of Shakespeare in the Park,Central Park,0,0
2259,1994-06-02,,Jeopardy,"(2, 2)",BIBLICAL NAMES,5,"(200,)",False,"His father, James Broderick, played the father on the TV series ""Family""—that's the gospel truth",Matthew Broderick,0,0
2259,1994-06-02,,Jeopardy,"(3, 2)",HISTORIC DOCUMENTS,11,"(200,)",False,The British North America Act of 1867 formed this dominion & divided it into 4 provinces,Canada,0,0
2259,1994-06-02,,Jeopardy,"(4, 2)",TRIOS,6,"(200,)",False,"In ""Julius Caesar"", Mark Antony asks them to ""lend me your ears""","friends, Romans & countrymen",0,0
2259,1994-06-02,,Jeopardy,"(5, 2)","REALLY ""BIG""",25,"(200,)",False,"Role played by Burl Ives in the 1958 film ""Cat on a Hot Tin Roof""",Big Daddy,0,0
2259,1994-06-02,,Jeopardy,"(6, 2)",SHOES,21,"(500,)",True,Show on Nick at Nite for which the following was sold as a promotional item:,Get Smart,0,0
2259,1994-06-02,,Jeopardy,"(1, 3)",NEW YORK CITY,17,"(300,)",False,The origin of this famous line of dancers goes back to 1925 St. Louis,the Rockettes,0,0
2259,1994-06-02,,Jeopardy,"(2, 3)",BIBLICAL NAMES,7,"(300,)",False,"Her career was on a ""roll"" when she played Jimmie Walker's mother on the TV series ""Good Times""",Esther Rolle,0,0
2259,1994-06-02,,Jeopardy,"(3, 3)",HISTORIC DOCUMENTS,12,"(300,)",False,"Pope Paul VI's encyclical ""Humanae Vitae"" reaffirmed Cath. opposition to artificial forms of this",birth control,0,0
2259,1994-06-02,,Jeopardy,"(4, 3)",TRIOS,16,"(300,)",False,"The 3 events that usually make up a triathlon are running, bicycling & this",swimming,0,0
2259,1994-06-02,,Jeopardy,"(5, 3)","REALLY ""BIG""",26,"(300,)",False,The Missouri River is often referred to by this nickname,the Big Muddy,0,0
2259,1994-06-02,,Jeopardy,"(6, 3)",SHOES,22,"(300,)",False,"This shoe company caused a revolution when it used the Beatles' ""Revolution"" in its ads",Nike,0,0
2259,1994-06-02,,Jeopardy,"(1, 4)",NEW YORK CITY,18,"(400,)",False,"The Intrepid, one of these ships, has been turned into a sea, air & space museum",an aircraft carrier,0,0
2259,1994-06-02,,Jeopardy,"(2, 4)",BIBLICAL NAMES,8,"(400,)",False,"This poet's first name was a book of the Old Testament; his last name meant ""sixteen ounces""",Ezra Pound,0,0
2259,1994-06-02,,Jeopardy,"(3, 4)",HISTORIC DOCUMENTS,13,"(400,)",False,The Swedish Conventicle Act of 1726 banned meetings of all religious denominations but this one,Lutheran,0,0
2259,1994-06-02,,Jeopardy,"(4, 4)",TRIOS,29,"(400,)",False,"They're the ""Big Three"" of U.S. automaking","Ford, Chrysler & General Motors",0,0
2259,1994-06-02,,Jeopardy,"(5, 4)","REALLY ""BIG""",27,"(400,)",False,"It was the only ""Big"" song by the Four Seasons to top the Billboard pop charts","""Big Girls Don't Cry""",0,0
2259,1994-06-02,,Jeopardy,"(6, 4)",SHOES,23,"(400,)",False,"Among the U.S. presidents of the last 70 years, he has the biggest shoe size, a 13C",Bill Clinton,0,0
2259,1994-06-02,,Jeopardy,"(1, 5)",NEW YORK CITY,19,"(500,)",False,Avery Fisher Hall is part of this theatre complex,the Lincoln Center,0,0
2259,1994-06-02,,Jeopardy,"(2, 5)",BIBLICAL NAMES,9,"(500,)",False,"Of Queen Elizabeth II's 3 sons, the one who shares his name with a New Testament fisherman",Andrew,0,0
2259,1994-06-02,,Jeopardy,"(3, 5)",HISTORIC DOCUMENTS,14,"(500,)",False,John Graham Chambers drafted the 12 boxing rules published under the patronage of this marquess in 1867,the Marquess of Queensbury,0,0
2259,1994-06-02,,Jeopardy,"(4, 5)",TRIOS,30,"(500,)",False,"In the Dumas novel, the 3 Musketeers are Athos, Porthos & this man",Aramis,0,0
2259,1994-06-02,,Jeopardy,"(5, 5)","REALLY ""BIG""",28,"(500,)",False,Santa Elena Canyon in this Texas national park reaches a depth of more than 1500 feet,Big Bend Park,0,0
2259,1994-06-02,,Jeopardy,"(6, 5)",SHOES,24,"(500,)",False,"In the early 20th century, George Warren Brown's shoe company hired several little people to play him",Buster Brown,0,0
2259,1994-06-02,,Double Jeopardy,"(1, 1)",EXPLORERS,13,"(200,)",False,"7 years after serving as Captain Cook's sailing master, he took command of the Bounty",Capt. Bligh,0,0
2259,1994-06-02,,Double Jeopardy,"(2, 1)",COLLEGES & UNIVERSITIES,4,"(200,)",False,Stanford's original art museum was severely damaged by this 1906 event,the San Francisco earthquake,0,0
2259,1994-06-02,,Double Jeopardy,"(3, 1)",SCIENTIFIC CYCLES,1,"(200,)",False,"Its cycle includes crescent, full, new & quarter phases",the Moon,0,0
2259,1994-06-02,,Double Jeopardy,"(4, 1)",BALLET,3,"(200,)",False,"""La Esmeralda"" was based on this Victor Hugo work",The Hunchback of Notre Dame,0,0
2259,1994-06-02,,Double Jeopardy,"(5, 1)",BRIDGES,18,"(200,)",False,It's the type of bridge you'd most likely see lying across a castle moat,A drawbridge,0,0
2259,1994-06-02,,Double Jeopardy,"(6, 1)",NONFICTION,26,"(200,)",False,"""Official and Confidential"" is a controversial book about ""The Secret Life of"" this FBI director",J. Edgar Hoover,0,0
2259,1994-06-02,,Double Jeopardy,"(1, 2)",EXPLORERS,14,"(400,)",False,"Banished from Iceland around 980, he became an early explorer of Greenland",Erik the Red,0,0
2259,1994-06-02,,Double Jeopardy,"(2, 2)",COLLEGES & UNIVERSITIES,8,"(400,)",False,The National College of Juvenile Justice is part of this university in Reno,the University of Nevada,0,0
2259,1994-06-02,,Double Jeopardy,"(3, 2)",SCIENTIFIC CYCLES,2,"(400,)",False,"In the water cycle, this force is responsible for precipitation & moving the water to the oceans",gravity,0,0
2259,1994-06-02,,Double Jeopardy,"(4, 2)",BALLET,5,"(400,)",False,"While this alleged axe wielder was acquitted in real life, she's hanged in ""Fall River Legend""",Lizzie Borden,0,0
2259,1994-06-02,,Double Jeopardy,"(5, 2)",BRIDGES,22,"(400,)",False,"From its opening in 1937 to 1964, this California bridge was the world's longest suspension bridge",the Golden Gate Bridge,0,0
2259,1994-06-02,,Double Jeopardy,"(6, 2)",NONFICTION,27,"(400,)",False,"""Ladies of the Court"" is a recent book about women in this sport",Tennis,0,0
2259,1994-06-02,,Double Jeopardy,"(1, 3)",EXPLORERS,15,"(600,)",False,In October 1522 this conquistador was named Captain General of New Spain,Cortes,0,0
2259,1994-06-02,,Double Jeopardy,"(2, 3)",COLLEGES & UNIVERSITIES,10,"(600,)",False,Schools in this city include American University & George Washington University,"Washington, D.C.",0,0
2259,1994-06-02,,Double Jeopardy,"(3, 3)",SCIENTIFIC CYCLES,19,"(600,)",False,Sleepwalking occurs primarily in the period of sleep known as non-this,non-REM sleep,0,0
2259,1994-06-02,,Double Jeopardy,"(4, 3)",BALLET,6,"(600,)",False,"""Fancy Free"", a Bernstein-Robbins ballet about 3 sailors, inspired this Broadway musical",On the Town,0,0
2259,1994-06-02,,Double Jeopardy,"(5, 3)",BRIDGES,23,"(600,)",False,The Quebec Railway Bridge over this river is said to be the only major bridge to have collapsed twice,the St. Lawrence River,0,0
2259,1994-06-02,,Double Jeopardy,"(6, 3)",NONFICTION,28,"(600,)",False,"""Attorney for the Damned"" is a collection of 13 speeches by this defender of John Scopes",Clarence Darrow,0,0
2259,1994-06-02,,Double Jeopardy,"(1, 4)",EXPLORERS,16,"(800,)",False,In January 1912 this Englishman became the first to reach the South Pole on foot without sled dogs,Captain Scott,0,0
2259,1994-06-02,,Double Jeopardy,"(2, 4)",COLLEGES & UNIVERSITIES,11,"(800,)",False,"Maize & blue are the official colors of the Wolverines, this school's athletic teams",the University of Michigan,0,0
2259,1994-06-02,,Double Jeopardy,"(3, 4)",SCIENTIFIC CYCLES,20,"(1200,)",True,"Observed for centuries, they seem to have an 11-year cycle & are seats of magnetic fields",sunspots,0,0
2259,1994-06-02,,Double Jeopardy,"(4, 4)",BALLET,7,"(800,)",False,"She danced in the premiere of her own ballet ""Rodeo""",Agnes de Mille,0,0
2259,1994-06-02,,Double Jeopardy,"(5, 4)",BRIDGES,24,"(800,)",False,The Sunshine Skyway Bridge spans this Florida bay,Tampa Bay,0,0
2259,1994-06-02,,Double Jeopardy,"(6, 4)",NONFICTION,29,"(800,)",False,"Completes the title of Dr. Dean Ornish's bestselling diet book, ""Eat More, ...""",Weigh Less,0,0
2259,1994-06-02,,Double Jeopardy,"(1, 5)",EXPLORERS,17,"(1000,)",False,"In 1861 this discoverer of Lake Tanganyika wrote a book about Salt Lake City titled ""City of the Saints""",Sir Richard Burton,0,0
2259,1994-06-02,,Double Jeopardy,"(2, 5)",COLLEGES & UNIVERSITIES,12,"(1000,)",False,"The Amos Tuck School of Business Admin. was founded in 1900 at this Hanover, N.H. university",Dartmouth,0,0
2259,1994-06-02,,Double Jeopardy,"(3, 5)",SCIENTIFIC CYCLES,21,"(1000,)",False,"Since they're not exactly 24 hours long, your daily rhythms are named this, from Latin for ""about daily""",circadian cycles,0,0
2259,1994-06-02,,Double Jeopardy,"(4, 5)",BALLET,9,"(1000,)",False,"The Ballets Russes disintegrated soon after the August 19, 1929 death of this impresario",Sergei Diaghilev,0,0
2259,1994-06-02,,Double Jeopardy,"(5, 5)",BRIDGES,25,"(1000,)",False,A suspension bridge over the Tagus River in this country is one of the world's longest,Portugal,0,0
2259,1994-06-02,,Double Jeopardy,"(6, 5)",NONFICTION,30,"(1000,)",True,"The No. 1 bestseller ""Healing and the Mind"" is a companion book to his 1993 PBS series",Bill Moyers,0,0
2259,1994-06-02,,Final Jeopardy,"(1, 1)",BUSINESS & INDUSTRY,0,(),False,In 1912 he organized the Keystone Company,Mack Sennett,0,0
