epNum,airDate,extra_info,round_name,coord,category,order,value,daily_double,question,answer,correctAttempts,wrongAttempts
2305,1994-09-16,,Jeopardy,"(1, 1)",FAMOUS SOUTHPAWS,1,"(100,)",False,He's the left-handed bass player of The Beatles,Paul McCartney,0,0
2305,1994-09-16,,Jeopardy,"(2, 1)",EXPLORERS,24,"(100,)",False,"This Scot's ""Missionary Travels and Researches in South Africa"" was a bestseller",Livingstone,0,0
2305,1994-09-16,,Jeopardy,"(3, 1)",FOOD,19,"(100,)",False,A Biblical dish was locust & this sweetener,honey,0,0
2305,1994-09-16,,Jeopardy,"(4, 1)",SOUTH AMERICAN GEOGRAPHY,6,"(100,)",False,On the average only the Himalayas are taller than this range that stretches down South America,the Andes,0,0
2305,1994-09-16,,Jeopardy,"(5, 1)",SHADES OF BLUE,9,"(100,)",False,It should be a sailor's favorite shade of blue as well as his favorite branch of the Service,Navy,0,0
2305,1994-09-16,,Jeopardy,"(6, 1)","""GOOD"" STUFF",10,"(100,)",False,"Proverbially speaking, one of these ""deserves another""",a good turn,0,0
2305,1994-09-16,,Jeopardy,"(1, 2)",FAMOUS SOUTHPAWS,2,"(200,)",False,"Left-handed New York Yankees have included the Iron Horse, Lou Gehrig, & the Bambino, this man",Babe Ruth,0,0
2305,1994-09-16,,Jeopardy,"(2, 2)",EXPLORERS,25,"(200,)",False,In 1725 this Dane was asked to determine if there was a land connection between Russia & North America,Vitus Bering,0,0
2305,1994-09-16,,Jeopardy,"(3, 2)",FOOD,20,"(200,)",False,The Greek dish soupa avgolemono features eggs & this citrus fruit,lemon,0,0
2305,1994-09-16,,Jeopardy,"(4, 2)",SOUTH AMERICAN GEOGRAPHY,7,"(200,)",False,The Atacama & Patagonia are the 2 largest examples of this type of region in South America,deserts,0,0
2305,1994-09-16,,Jeopardy,"(5, 2)",SHADES OF BLUE,15,"(200,)",False,The body parts most often described as baby blues,eyes,0,0
2305,1994-09-16,,Jeopardy,"(6, 2)","""GOOD"" STUFF",11,"(200,)",False,Charlie says in 1994 these pink & white licorice-flavored candies celebrated their 100th birthday,Good and Plenty,0,0
2305,1994-09-16,,Jeopardy,"(1, 3)",FAMOUS SOUTHPAWS,3,"(300,)",False,"On film she left her mark as a ""Harvey Girl"", a ""Ziegfeld Girl"" & a farm girl from Kansas",Judy Garland,0,0
2305,1994-09-16,,Jeopardy,"(2, 3)",EXPLORERS,26,"(300,)",False,In the mid-1470s he joined his brother Bartholomew as a map dealer in Portugal,Christopher Columbus,0,0
2305,1994-09-16,,Jeopardy,"(3, 3)",FOOD,21,"(300,)",False,"Kate & Sydney is this kind of pie that a cockney might have for Lilley & Skinner, dinner",steak & kidney pie,0,0
2305,1994-09-16,,Jeopardy,"(4, 3)",SOUTH AMERICAN GEOGRAPHY,8,"(300,)",False,"The continent's lowest point, Valdes Peninsula, lies in this country that also contains the highest point",Argentina,0,0
2305,1994-09-16,,Jeopardy,"(5, 3)",SHADES OF BLUE,16,"(300,)",False,It would be most appropriate to wear this shade of blue one minute after 11:59 p.m.,midnight blue,0,0
2305,1994-09-16,,Jeopardy,"(6, 3)","""GOOD"" STUFF",12,"(300,)",False,"Originating in the Bible, it's a compassionate person who unselfishly helps others",a Good Samaritan,0,0
2305,1994-09-16,,Jeopardy,"(1, 4)",FAMOUS SOUTHPAWS,4,"(400,)",False,"He must have worked ""Night and Day"" to ""Begin The Beguine"" with his left hand",Cole Porter,0,0
2305,1994-09-16,,Jeopardy,"(2, 4)",EXPLORERS,27,"(400,)",False,"Before exploring the South Pacific, this British captain charted the St. Lawrence River in 1759",(Captain) Cook,0,0
2305,1994-09-16,,Jeopardy,"(3, 4)",FOOD,22,"(400,)",False,"Careful! If you drink alcohol after eating ink caps, a type of these, you'll become very sick",mushrooms,0,0
2305,1994-09-16,,Jeopardy,"(4, 4)",SOUTH AMERICAN GEOGRAPHY,29,"(800,)",True,This is the only South American country that touches Central America,Colombia,0,0
2305,1994-09-16,,Jeopardy,"(5, 4)",SHADES OF BLUE,17,"(400,)",False,"This dazzling shade of greenish blue resembles the tail feathers of a ""proud"" bird",peacock blue,0,0
2305,1994-09-16,,Jeopardy,"(6, 4)","""GOOD"" STUFF",13,"(400,)",False,You'll find this rocky promontory about 100 miles northwest of Africa's southern tip,the Cape of Good Hope,0,0
2305,1994-09-16,,Jeopardy,"(1, 5)",FAMOUS SOUTHPAWS,5,"(500,)",False,Hannibal lecturer,Mark Twain,0,0
2305,1994-09-16,,Jeopardy,"(2, 5)",EXPLORERS,28,"(500,)",False,In November 1806 this U.S. Army officer & his men first sighted the front range of the Rockies,Zebulon Pike,0,0
2305,1994-09-16,,Jeopardy,"(3, 5)",FOOD,23,"(500,)",False,These fish are caught by hand & deep fried after they run onto West Coast beaches to spawn,grunion,0,0
2305,1994-09-16,,Jeopardy,"(4, 5)",SOUTH AMERICAN GEOGRAPHY,30,"(500,)",False,"This, the waterfall with the world's longest drop, drains into the Churun River",Angel Falls,0,0
2305,1994-09-16,,Jeopardy,"(5, 5)",SHADES OF BLUE,18,"(500,)",False,"Cerulean is the color of this, & its name may come from caelum, the Latin word for it",the sky,0,0
2305,1994-09-16,,Jeopardy,"(6, 5)","""GOOD"" STUFF",14,"(500,)",False,It was the name given to FDR's plan to improve relations with Latin America,the Good Neighbor Policy,0,0
2305,1994-09-16,,Double Jeopardy,"(1, 1)",ART,6,"(200,)",False,Ku K'ai-Chih of this country was the first portrait artist said to capture the spirit of his subjects,China,0,0
2305,1994-09-16,,Double Jeopardy,"(2, 1)",EUROPEAN ROYALTY,7,"(200,)",False,"5-year-old David II succeeded his father, Robert the Bruce, as king of this country in 1329",Scotland,0,0
2305,1994-09-16,,Double Jeopardy,"(3, 1)",COLLEGES & UNIVERSITIES,1,"(200,)",False,In 1910 this state's first junior college was founded in Fresno,California,0,0
2305,1994-09-16,,Double Jeopardy,"(4, 1)",PLANTS & TREES,13,"(200,)",False,"Kangaroo vine, which can be grown indoors or out, is native to this country",Australia,0,0
2305,1994-09-16,,Double Jeopardy,"(5, 1)",ABOLITIONISM,14,"(200,)",False,"Between 1830 & 1860, this system transported many runaway slaves to southern Ontario",the Underground Railroad,0,0
2305,1994-09-16,,Double Jeopardy,"(6, 1)",WORLD LITERATURE,22,"(200,)",False,"Michael Shaara's Pulitzer Prize-winning novel ""The Killer Angels"" is an account of this July 1863 battle",the Battle of Gettysburg,0,0
2305,1994-09-16,,Double Jeopardy,"(1, 2)",ART,8,"(400,)",False,"This period sometimes divided into early, high & late ended around 1600",the Renaissance,0,0
2305,1994-09-16,,Double Jeopardy,"(2, 2)",EUROPEAN ROYALTY,9,"(400,)",False,"In 1386 Jagiello, Grand Duke of Lithuania, married Queen Jadwiga & became King Wladyslaw II of this country",Poland,0,0
2305,1994-09-16,,Double Jeopardy,"(3, 2)",COLLEGES & UNIVERSITIES,2,"(400,)",False,Benjamin Franklin helped found this Ivy League school in 1740,Penn (the University of Pennsylvania),0,0
2305,1994-09-16,,Double Jeopardy,"(4, 2)",PLANTS & TREES,27,"(400,)",False,Varying leaf shapes make it hard to identify this poisonous plant sometimes classed as Toxicodendron,poison oak (poison ivy),0,0
2305,1994-09-16,,Double Jeopardy,"(5, 2)",ABOLITIONISM,15,"(400,)",False,"Before the Harpers Ferry attack, he & his men killed 5 proslavers in Pottawatomie, Kansas",John Brown,0,0
2305,1994-09-16,,Double Jeopardy,"(6, 2)",WORLD LITERATURE,23,"(400,)",False,"In an epic work by Sir Thomas Malory, he & Mordred slay each other",King Arthur,0,0
2305,1994-09-16,,Double Jeopardy,"(1, 3)",ART,10,"(600,)",False,"Leonardo da Vinci & Albrecht Durer were among many artists who painted ""The Adoration of"" this trio",the Magi,0,0
2305,1994-09-16,,Double Jeopardy,"(2, 3)",EUROPEAN ROYALTY,19,"(600,)",False,"This country's ruler, Prince Hans Adam, lives in a castle on a cliff that overlooks the city of Vaduz",Liechtenstein,0,0
2305,1994-09-16,,Double Jeopardy,"(3, 3)",COLLEGES & UNIVERSITIES,3,"(600,)",False,"Founded in Atlanta in 1885, this university has one of the finest engineering schools in the country",Georgia Tech,0,0
2305,1994-09-16,,Double Jeopardy,"(4, 3)",PLANTS & TREES,28,"(600,)",False,The essential ones of these give aromatic plants their taste or odor,oils,0,0
2305,1994-09-16,,Double Jeopardy,"(5, 3)",ABOLITIONISM,16,"(600,)",False,This 1787 ordinance included a fugitive slave clause,the Northwest Ordinance,0,0
2305,1994-09-16,,Double Jeopardy,"(6, 3)",WORLD LITERATURE,24,"(600,)",False,Oldest son Dmitri stands trial for his father's murder in this novel by Dostoyevsky,The Brothers Karamazov,0,0
2305,1994-09-16,,Double Jeopardy,"(1, 4)",ART,11,"(800,)",False,His most ambitious mural covering Mexico's history was left unfinished at his death,Diego Rivera,0,0
2305,1994-09-16,,Double Jeopardy,"(2, 4)",EUROPEAN ROYALTY,20,"(800,)",False,"She was only 10 when she became queen of the Netherlands in 1890, so her mother, Emma, served as regent",Queen Wilhelmina,0,0
2305,1994-09-16,,Double Jeopardy,"(3, 4)",COLLEGES & UNIVERSITIES,4,"(800,)",False,The Catholics & the Ramblers were early names for this university's football team,Notre Dame,0,0
2305,1994-09-16,,Double Jeopardy,"(4, 4)",PLANTS & TREES,29,"(800,)",False,"Used in polishes, carnauba wax is derived from the leaves of this type of tropical tree",a palm,0,0
2305,1994-09-16,,Double Jeopardy,"(5, 4)",ABOLITIONISM,17,"(800,)",False,"The first issue of this William Lloyd Garrison abolitionist paper was published January 1, 1831",The Liberator,0,0
2305,1994-09-16,,Double Jeopardy,"(6, 4)",WORLD LITERATURE,25,"(800,)",False,A governess finds her 2 young charges under the influence of ghosts in this Henry James tale,Turn of the Screw,0,0
2305,1994-09-16,,Double Jeopardy,"(1, 5)",ART,12,"(1000,)",True,"His painting ""The Scream"", stolen just before the '94 Winter Olympics, was recovered 3 months later",Edvard Munch,0,0
2305,1994-09-16,,Double Jeopardy,"(2, 5)",EUROPEAN ROYALTY,21,"(1000,)",False,First name shared by Prince Andrew's older daughter & Queen Victoria's youngest daughter,Beatrice,0,0
2305,1994-09-16,,Double Jeopardy,"(3, 5)",COLLEGES & UNIVERSITIES,5,"(1000,)",False,"Founded as a seminary in South Hadley, Massachusetts, it was the 1st U.S. college for women",Mount Holyoke,0,0
2305,1994-09-16,,Double Jeopardy,"(4, 5)",PLANTS & TREES,30,"(1000,)",True,"Named for a biblical person & found in the desert, this tree is the largest species of yucca",the Joshua tree,0,0
2305,1994-09-16,,Double Jeopardy,"(5, 5)",ABOLITIONISM,18,"(1000,)",False,"By means of the Missouri Compromise, this New England state was admitted as a free state",Maine,0,0
2305,1994-09-16,,Double Jeopardy,"(6, 5)",WORLD LITERATURE,26,"(1000,)",False,Some critics consider this 1912 Zane Grey novel the best Western ever written,The Riders of the Purple Sage,0,0
2305,1994-09-16,,Final Jeopardy,"(1, 1)",BODIES OF WATER,0,(),False,"In the time of the Roman Republic, this river separated Cisalpine Gaul from Italy",the Rubicon,0,0
