epNum,airDate,extra_info,round_name,coord,category,order,value,daily_double,question,answer,correctAttempts,wrongAttempts
2350,1994-11-18,1994 Tournament of Champions quarterfinal game 5.,Jeopardy,"(1, 1)",THE 1920S,10,"(100,)",False,The Belgians received Rwanda-Urundi as a mandate from this international organization in 1923,League of Nations,1,0
2350,1994-11-18,1994 Tournament of Champions quarterfinal game 5.,Jeopardy,"(2, 1)",POP MUSIC,4,"(100,)",False,"Prior to The Beatles, he was the drummer for Rory Storm and the Hurricanes",Ringo Starr,1,0
2350,1994-11-18,1994 Tournament of Champions quarterfinal game 5.,Jeopardy,"(3, 1)",FASHION,26,"(100,)",False,"As its name implies, this lightweight nylon jacket is perfect in a breeze",Windbreaker,1,0
2350,1994-11-18,1994 Tournament of Champions quarterfinal game 5.,Jeopardy,"(4, 1)",MAMMALS,1,"(100,)",False,Evidence suggests that these humped mammals no longer found here originated in North America,Camels,1,0
2350,1994-11-18,1994 Tournament of Champions quarterfinal game 5.,Jeopardy,"(5, 1)",BUSINESS & INDUSTRY,16,"(100,)",False,"Phillip Morris is the largest customer of Universal Corporation, the world's largest dealer in this commodity",Tobacco,1,0
2350,1994-11-18,1994 Tournament of Champions quarterfinal game 5.,Jeopardy,"(6, 1)",HOMOPHONES,18,"(100,)",False,A tree having single flattened needles or the pelt of an animal,Fir/Fur,1,0
2350,1994-11-18,1994 Tournament of Champions quarterfinal game 5.,Jeopardy,"(1, 2)",THE 1920S,12,"(200,)",False,"Now a national park, this arid region of South Dakota was authorized as a national monument in 1929",The Badlands,1,0
2350,1994-11-18,1994 Tournament of Champions quarterfinal game 5.,Jeopardy,"(2, 2)",POP MUSIC,6,"(200,)",False,"This American rocker's 1st Top Ten hit in the United Kingdom was ""Dancing in the Dark"" in 1985",Bruce Springsteen,1,0
2350,1994-11-18,1994 Tournament of Champions quarterfinal game 5.,Jeopardy,"(3, 2)",FASHION,27,"(200,)",False,"From the French, it's a sheer, often lacy dressing gown similar to a pegnoir",Negligee,1,0
2350,1994-11-18,1994 Tournament of Champions quarterfinal game 5.,Jeopardy,"(4, 2)",MAMMALS,2,"(200,)",False,Mammals that are currently endangered include the wild yak & this fastest cat of Africa,Cheetah,1,0
2350,1994-11-18,1994 Tournament of Champions quarterfinal game 5.,Jeopardy,"(5, 2)",BUSINESS & INDUSTRY,17,"(200,)",False,This founder of Wal-Mart began his retail career as a J.C. Penney management trainee,Sam Walton,1,0
2350,1994-11-18,1994 Tournament of Champions quarterfinal game 5.,Jeopardy,"(6, 2)",HOMOPHONES,19,"(200,)",False,Free from illness or precipitation falling in the form of large ice pellets,Hale/Hail,1,0
2350,1994-11-18,1994 Tournament of Champions quarterfinal game 5.,Jeopardy,"(1, 3)",THE 1920S,13,"(300,)",False,"This Mexican revolutionary was assassinated at his ranch near Parral, Chihuahua",Pancho Villa,1,0
2350,1994-11-18,1994 Tournament of Champions quarterfinal game 5.,Jeopardy,"(2, 3)",POP MUSIC,8,"(300,)",False,"Prince's #1 hit, ""Let's Go Crazy"", was from this 1984 film","""Purple Rain""",1,0
2350,1994-11-18,1994 Tournament of Champions quarterfinal game 5.,Jeopardy,"(3, 3)",FASHION,28,"(300,)",False,This waist sash often worn with a mens' formal suit was adopted from a cloth band worn in Eastern countries,a cummerbund,1,0
2350,1994-11-18,1994 Tournament of Champions quarterfinal game 5.,Jeopardy,"(4, 3)",MAMMALS,3,"(300,)",False,"The gray wolf is also called this, probably for the forests & wooded regions that it inhabits",Timberwolf,1,0
2350,1994-11-18,1994 Tournament of Champions quarterfinal game 5.,Jeopardy,"(5, 3)",BUSINESS & INDUSTRY,23,"(300,)",False,"The parent company of this railroad also operates U.P. Resources, a gas & oil exploration business",Union Pacific,1,0
2350,1994-11-18,1994 Tournament of Champions quarterfinal game 5.,Jeopardy,"(6, 3)",HOMOPHONES,20,"(300,)",False,The actors in a play or one of the hereditary groups that make up Hindu society,Cast/Caste,1,0
2350,1994-11-18,1994 Tournament of Champions quarterfinal game 5.,Jeopardy,"(1, 4)",THE 1920S,14,"(400,)",False,"During the decade, he discovered lysisine, an antibiotic enzyme, as well as penicillin",Alexander Fleming,1,0
2350,1994-11-18,1994 Tournament of Champions quarterfinal game 5.,Jeopardy,"(2, 4)",POP MUSIC,9,"(400,)",False,In 1967 Cindy Birdsong replaced Florence Ballard in this trio,The Supremes,1,0
2350,1994-11-18,1994 Tournament of Champions quarterfinal game 5.,Jeopardy,"(3, 4)",FASHION,29,"(400,)",False,"In the 1930s & '40s, this boned & rigid garment  for women gave way to the girdle",Corset,1,0
2350,1994-11-18,1994 Tournament of Champions quarterfinal game 5.,Jeopardy,"(4, 4)",MAMMALS,5,"(400,)",False,"The scientific name of this egg-laying mammal, ornithorincus, means ""bird-snout""",Duck-Billed Platypus,1,0
2350,1994-11-18,1994 Tournament of Champions quarterfinal game 5.,Jeopardy,"(5, 4)",BUSINESS & INDUSTRY,24,"(400,)",False,In 1988 this Swedish company acquired Britain's Leyland Bus Company,Volvo,1,0
2350,1994-11-18,1994 Tournament of Champions quarterfinal game 5.,Jeopardy,"(6, 4)",HOMOPHONES,21,"(400,)",False,A wharf where ships are unloaded or a metal implement used to open a lock,Quay/Key,1,0
2350,1994-11-18,1994 Tournament of Champions quarterfinal game 5.,Jeopardy,"(1, 5)",THE 1920S,15,"(1700,)",True,"In 1926, this Kuomintang leader launched the Northern Expedition against the warlords of Northern China",Chiang Kai-shek,1,0
2350,1994-11-18,1994 Tournament of Champions quarterfinal game 5.,Jeopardy,"(2, 5)",POP MUSIC,11,"(500,)",False,"This Elton John hit is subtitled ""I Think It's Gonna Be A Long, Long Time""","""Rocket Man""",1,0
2350,1994-11-18,1994 Tournament of Champions quarterfinal game 5.,Jeopardy,"(3, 5)",FASHION,30,"(500,)",False,He designed the beige pillbox hat that Jackie Kennedy wore to JFK's inauguration,Halston,1,0
2350,1994-11-18,1994 Tournament of Champions quarterfinal game 5.,Jeopardy,"(4, 5)",MAMMALS,7,"(500,)",False,The hamadryas species of this large monkey was revered by the Egyptians as a companion of Ptah,Baboon,0,3
2350,1994-11-18,1994 Tournament of Champions quarterfinal game 5.,Jeopardy,"(5, 5)",BUSINESS & INDUSTRY,25,"(500,)",False,Holly Farms & Tasty Bird are brand names of this Arkansas-based poultry producer,Tyson Foods,1,0
2350,1994-11-18,1994 Tournament of Champions quarterfinal game 5.,Jeopardy,"(6, 5)",HOMOPHONES,22,"(500,)",False,A river that empties into the Adriatic or an author of macabre verses,Po/Poe,1,0
2350,1994-11-18,1994 Tournament of Champions quarterfinal game 5.,Double Jeopardy,"(1, 1)",THE CIVIL WAR,9,"(200,)",False,George Custer's brother Thomas was the only person in the U.S. Army to win 2 of these medals during the war,Congressional Medal of Honor,1,1
2350,1994-11-18,1994 Tournament of Champions quarterfinal game 5.,Double Jeopardy,"(2, 1)",ART & ARTISTS,1,"(200,)",False,He commissioned Jacques-Louis David to paint his 1804 imperial coronation,Napoleon Bonaparte,1,0
2350,1994-11-18,1994 Tournament of Champions quarterfinal game 5.,Double Jeopardy,"(4, 1)",NOVEL CHARACTERS,19,"(200,)",False,"It's the color of Scarlett O'Hara's eyes -- we're ""envious""",green,1,0
2350,1994-11-18,1994 Tournament of Champions quarterfinal game 5.,Double Jeopardy,"(5, 1)",HISTORIC NAMES,24,"(200,)",False,"While an actor, this president served six terms as president of the Screen Actors Guild",Ronald Reagan,1,0
2350,1994-11-18,1994 Tournament of Champions quarterfinal game 5.,Double Jeopardy,"(6, 1)","THE ""M""EDITERRANEAN",2,"(200,)",False,"Founded around 600 B.C. by Greek adventurers, it's one of the oldest cities in France",Marseilles,1,0
2350,1994-11-18,1994 Tournament of Champions quarterfinal game 5.,Double Jeopardy,"(1, 2)",THE CIVIL WAR,10,"(400,)",False,"Edmund Ruffin, credited with doing this at the war's start, shot himself after hearing of the surrender",Firing the First Shot from the South,1,0
2350,1994-11-18,1994 Tournament of Champions quarterfinal game 5.,Double Jeopardy,"(2, 2)",ART & ARTISTS,5,"(400,)",False,Honore Daumier created several works portraying Don Quixote & this squire,Sancho Panza,1,0
2350,1994-11-18,1994 Tournament of Champions quarterfinal game 5.,Double Jeopardy,"(4, 2)",NOVEL CHARACTERS,20,"(400,)",False,"In ""Little Women"", Margaret is better-known by this nickname",Meg,1,0
2350,1994-11-18,1994 Tournament of Champions quarterfinal game 5.,Double Jeopardy,"(5, 2)",HISTORIC NAMES,25,"(400,)",False,This Israeli stateswoman's maiden name was Mabovitz,Golda Meir,1,0
2350,1994-11-18,1994 Tournament of Champions quarterfinal game 5.,Double Jeopardy,"(6, 2)","THE ""M""EDITERRANEAN",3,"(400,)",False,It's the westernmost African country on the Mediterranean,Morocco,1,0
2350,1994-11-18,1994 Tournament of Champions quarterfinal game 5.,Double Jeopardy,"(1, 3)",THE CIVIL WAR,11,"(600,)",False,"The 39th New York Infantry, or ""Garibaldi Guard"", wore these distinctive items also worn by Garibaldi's men",Red Shirts,1,1
2350,1994-11-18,1994 Tournament of Champions quarterfinal game 5.,Double Jeopardy,"(2, 3)",ART & ARTISTS,8,"(600,)",False,"He painted ""Vampire"" in 1893, the same year he painted ""The Scream""",Edvard Munch,1,0
2350,1994-11-18,1994 Tournament of Champions quarterfinal game 5.,Double Jeopardy,"(3, 3)",EDUCATION,16,"(600,)",False,"In 1836 he became president of Cincinnati College & published his 1st ""Eclectic Reader""",William McGuffey,1,0
2350,1994-11-18,1994 Tournament of Champions quarterfinal game 5.,Double Jeopardy,"(4, 3)",NOVEL CHARACTERS,21,"(600,)",False,Snowball is an idealistic pig in this George Orwell classic,"""Animal Farm""",1,0
2350,1994-11-18,1994 Tournament of Champions quarterfinal game 5.,Double Jeopardy,"(5, 3)",HISTORIC NAMES,26,"(3000,)",True,This Jamestown settler was the first to make English maps of Virginia & New England,John Smith,1,0
2350,1994-11-18,1994 Tournament of Champions quarterfinal game 5.,Double Jeopardy,"(6, 3)","THE ""M""EDITERRANEAN",4,"(600,)",False,The language of this island country whose capital is Valletta is a west Arabic dialect with some Italian,Malta,1,0
2350,1994-11-18,1994 Tournament of Champions quarterfinal game 5.,Double Jeopardy,"(1, 4)",THE CIVIL WAR,12,"(800,)",False,"At its greatest enrollment, the CSMC, which stood for this, had fewer than 600 men & officers",Confederate States Marine Corps,1,1
2350,1994-11-18,1994 Tournament of Champions quarterfinal game 5.,Double Jeopardy,"(2, 4)",ART & ARTISTS,14,"(3000,)",True,"""Unpleasant Surprise"" by this primitive painter of ""The Hungry Lion"" shows a woman menaced by a bear",Henri Rousseau,0,1
2350,1994-11-18,1994 Tournament of Champions quarterfinal game 5.,Double Jeopardy,"(3, 4)",EDUCATION,17,"(800,)",False,U.S. kindergarten founder Elizabeth Peabody was the first to publish this Thoreau essay,"""Civil Disobedience""",1,0
2350,1994-11-18,1994 Tournament of Champions quarterfinal game 5.,Double Jeopardy,"(4, 4)",NOVEL CHARACTERS,22,"(800,)",False,This Booth Tarkington title character's last name is Scofield,Penrod,0,3
2350,1994-11-18,1994 Tournament of Champions quarterfinal game 5.,Double Jeopardy,"(5, 4)",HISTORIC NAMES,27,"(800,)",False,In 1718 this British astronomer became the first to state that stars had individual motions,Edmond Halley,1,0
2350,1994-11-18,1994 Tournament of Champions quarterfinal game 5.,Double Jeopardy,"(6, 4)","THE ""M""EDITERRANEAN",6,"(800,)",False,This barren isle made famous in an Alexandre Dumas novel was known in ancient times as Oglassa,Monte Cristo,1,0
2350,1994-11-18,1994 Tournament of Champions quarterfinal game 5.,Double Jeopardy,"(1, 5)",THE CIVIL WAR,13,"(1000,)",False,Clement Valandingham was the leader of this group of Northerners opposed to the war,Copperheads,0,3
2350,1994-11-18,1994 Tournament of Champions quarterfinal game 5.,Double Jeopardy,"(2, 5)",ART & ARTISTS,15,"(1000,)",False,"This American woman impressionist posed for several of Degas' works, including ""At The Milliner's""",Mary Cassatt,1,0
2350,1994-11-18,1994 Tournament of Champions quarterfinal game 5.,Double Jeopardy,"(3, 5)",EDUCATION,18,"(1000,)",False,"In 1889 this ""The Life Of Reason"" author began teaching philosophy at Harvard",George Santayana,0,3
2350,1994-11-18,1994 Tournament of Champions quarterfinal game 5.,Double Jeopardy,"(4, 5)",NOVEL CHARACTERS,23,"(1000,)",False,"Dr. Tertius Lydgate marries the beautiful, but shallow Rosamund Vinci in her novel ""Middlemarch""",George Eliot,1,0
2350,1994-11-18,1994 Tournament of Champions quarterfinal game 5.,Double Jeopardy,"(6, 5)","THE ""M""EDITERRANEAN",7,"(1000,)",False,"The scirocco is the hot, dry wind that blows from Africa;  this is the opposite cold, dry northern wind",Mistral,0,3
2350,1994-11-18,1994 Tournament of Champions quarterfinal game 5.,Final Jeopardy,"(1, 1)",OPERA,0,"(499, 5400, 1001)",False,"One-word title of the Verdi opera set in Windsor, England in the 15th century","\""Falstaff\""",2,1
