epNum,airDate,extra_info,round_name,coord,category,order,value,daily_double,question,answer,correctAttempts,wrongAttempts
2501,1995-06-19,Jim Vercolen game 5.,Jeopardy,"(1, 1)",ANIMALS,21,"(100,)",False,Popular food types of this mollusk include jacknife & steamer,clam,1,0
2501,1995-06-19,Jim Vercolen game 5.,Jeopardy,"(2, 1)",ACTORS & ACTRESSES,11,"(100,)",False,"Her father, John, was directing ""The African Queen"" when she was born in 1951",Anjelica Huston,1,0
2501,1995-06-19,Jim Vercolen game 5.,Jeopardy,"(3, 1)",EXOTIC FRUITS & VEGETABLES,26,"(100,)",False,"When sliced crosswise, a carambola resembles a 5-pointed one of these",star,1,0
2501,1995-06-19,Jim Vercolen game 5.,Jeopardy,"(4, 1)",AMERICAN HISTORY,6,"(100,)",False,In March 1837 Congress expanded the Supreme Court from 7 to this many judges,9,1,0
2501,1995-06-19,Jim Vercolen game 5.,Jeopardy,"(5, 1)",EXPLOSIVES,1,"(100,)",False,"Also called trotyl & tolite, trinitrotoluene is best known by these initials",TNT,1,0
2501,1995-06-19,Jim Vercolen game 5.,Jeopardy,"(6, 1)",EUROPEAN POTPOURRI,16,"(100,)",False,Basilicata is a rural region in the ankle & instep of this country's boot,Italy,1,0
2501,1995-06-19,Jim Vercolen game 5.,Jeopardy,"(1, 2)",ANIMALS,22,"(200,)",False,The African species of this is the largest animal in the order Proboscidea,elephant,1,0
2501,1995-06-19,Jim Vercolen game 5.,Jeopardy,"(2, 2)",ACTORS & ACTRESSES,12,"(200,)",False,"Before breaking into show biz, this actress who played Rebecca on ""Cheers"" was an interior decorator",Kirstie Alley,1,1
2501,1995-06-19,Jim Vercolen game 5.,Jeopardy,"(3, 2)",EXOTIC FRUITS & VEGETABLES,27,"(200,)",False,Feijoa fruit resembles this New Zealand product but has no fuzz,kiwi,1,0
2501,1995-06-19,Jim Vercolen game 5.,Jeopardy,"(4, 2)",AMERICAN HISTORY,7,"(200,)",False,Gen. Lewis Hershey presided over this U.S. draft agency 1941-1946 & 1948-1970,Selective Service,1,0
2501,1995-06-19,Jim Vercolen game 5.,Jeopardy,"(5, 2)",EXPLOSIVES,2,"(200,)",False,The first commercial use of this type of explosive was in a gas field in 1967; it yielded 26 kilotons,nuclear weapon,1,0
2501,1995-06-19,Jim Vercolen game 5.,Jeopardy,"(6, 2)",EUROPEAN POTPOURRI,17,"(200,)",False,"The Keeshond, which often lives on barges is considered the national dog of this low country",Netherlands,1,0
2501,1995-06-19,Jim Vercolen game 5.,Jeopardy,"(1, 3)",ANIMALS,23,"(300,)",False,This animal native to China serves as the symbol of the World Wildlife Fund,giant panda,1,0
2501,1995-06-19,Jim Vercolen game 5.,Jeopardy,"(2, 3)",ACTORS & ACTRESSES,13,"(300,)",False,"This handsome actor whom Leslie Caron fell for in ""Gigi"" appeared in the 1982 movie ""Swamp Thing""",Louis Jourdan,0,3
2501,1995-06-19,Jim Vercolen game 5.,Jeopardy,"(3, 3)",EXOTIC FRUITS & VEGETABLES,28,"(300,)",False,"Laver, a type of seaweed eaten in Ireland & Wales, is called nori in this country",Japan,1,0
2501,1995-06-19,Jim Vercolen game 5.,Jeopardy,"(4, 3)",AMERICAN HISTORY,8,"(300,)",False,"McKinley campaigned for president promising ""a full"" one of these",dinner pail,1,0
2501,1995-06-19,Jim Vercolen game 5.,Jeopardy,"(5, 3)",EXPLOSIVES,3,"(300,)",False,"This was first prepared in 1846 by Ascanio Sobrero, who added glycerol to nitric & sulfuric acids",nitroglycerine,1,0
2501,1995-06-19,Jim Vercolen game 5.,Jeopardy,"(6, 3)",EUROPEAN POTPOURRI,18,"(300,)",False,"Rousillonnais, a dialect of Catalan, is spoken in Rousillon in this country",France,1,1
2501,1995-06-19,Jim Vercolen game 5.,Jeopardy,"(1, 4)",ANIMALS,24,"(400,)",False,"The family of Pongidae, or great apes, includes the bonobo, gorilla, orangutan & this ape",chimpanzee,1,0
2501,1995-06-19,Jim Vercolen game 5.,Jeopardy,"(2, 4)",ACTORS & ACTRESSES,14,"(400,)",False,"In 1991 these 2 British sisters starred in a TV remake of ""Whatever Happened to Baby Jane?""",(Vanessa & Lynn) Redgrave,1,0
2501,1995-06-19,Jim Vercolen game 5.,Jeopardy,"(3, 4)",EXOTIC FRUITS & VEGETABLES,29,"(400,)",False,"In this Middle East country, the prickly pear is called sabra, like the country's native-born citizens",Israel,1,0
2501,1995-06-19,Jim Vercolen game 5.,Jeopardy,"(4, 4)",AMERICAN HISTORY,9,"(600,)",True,"On a 1923 trip to Alaska, this president was presented with a moose-hide collar for his dog Laddie Boy",Harding,1,0
2501,1995-06-19,Jim Vercolen game 5.,Jeopardy,"(5, 4)",EXPLOSIVES,4,"(400,)",False,"Besides inventing dynamite, he perfected a detonator for it",Alfred Nobel,1,0
2501,1995-06-19,Jim Vercolen game 5.,Jeopardy,"(6, 4)",EUROPEAN POTPOURRI,19,"(400,)",False,You can see remains of a palace built by Vlad the Impaler in this Romanian capital,Bucharest,1,1
2501,1995-06-19,Jim Vercolen game 5.,Jeopardy,"(1, 5)",ANIMALS,25,"(500,)",False,"In the 1970s the long-haired Somali cat was recognized as a distinct breed, not a version of this one",Abyssinian,0,3
2501,1995-06-19,Jim Vercolen game 5.,Jeopardy,"(2, 5)",ACTORS & ACTRESSES,15,"(500,)",False,"In the 1930s he played the title roles of ""Louis Pasteur"", ""Emile Zola"" & ""Scarface""",Paul Muni,1,0
2501,1995-06-19,Jim Vercolen game 5.,Jeopardy,"(3, 5)",EXOTIC FRUITS & VEGETABLES,30,"(500,)",False,"This Chinese fruit, sometimes called a ""nut"" is related to the longan",litchi,0,3
2501,1995-06-19,Jim Vercolen game 5.,Jeopardy,"(4, 5)",AMERICAN HISTORY,10,"(500,)",False,"In 1630 the village of Shawmut, Massachusetts changed its name to this",Boston,1,0
2501,1995-06-19,Jim Vercolen game 5.,Jeopardy,"(5, 5)",EXPLOSIVES,5,"(500,)",False,C-4 & A-3 are types of this moldable military explosive,plastic explosive,1,0
2501,1995-06-19,Jim Vercolen game 5.,Jeopardy,"(6, 5)",EUROPEAN POTPOURRI,20,"(500,)",False,Jurmala is a popular seaside resort near this capital of Latvia,Riga,1,0
2501,1995-06-19,Jim Vercolen game 5.,Double Jeopardy,"(1, 1)",THE 17th CENTURY,2,"(200,)",False,"On Nov. 24, 1632 Baruch Spinoza was born to Jewish parents in this Dutch capital",Amsterdam,1,0
2501,1995-06-19,Jim Vercolen game 5.,Double Jeopardy,"(2, 1)",POLITICIANS,14,"(200,)",False,In 1978 Newt Gingrich was first elected to the House from this state's 6th district,Georgia,1,0
2501,1995-06-19,Jim Vercolen game 5.,Double Jeopardy,"(3, 1)",RIVERS,21,"(200,)",False,"This, England's most important river, rises in 4 headstreams: the Isis, Churn, Coln & Leach",Thames,1,0
2501,1995-06-19,Jim Vercolen game 5.,Double Jeopardy,"(4, 1)",MUSIC,1,"(200,)",False,"The ""outlaw"" type of this music developed as a contrast to the traditional Nashville sound",country & western (country music),1,0
2501,1995-06-19,Jim Vercolen game 5.,Double Jeopardy,"(5, 1)",WEIGHTS & MEASURES,26,"(200,)",False,"At the equator 1 degree of this is equivalent to 69.17 miles; at the pole, 0 miles",longitude,1,0
2501,1995-06-19,Jim Vercolen game 5.,Double Jeopardy,"(6, 1)",PLAYS & PLAYWRIGHTS,7,"(200,)",False,"Of all his plays, ""A Streetcar Named Desire"" had the longest run on Broadway",Tennessee Williams,1,0
2501,1995-06-19,Jim Vercolen game 5.,Double Jeopardy,"(1, 2)",THE 17th CENTURY,3,"(400,)",False,At age 15 this future Queen of England married Prince William of Orange,Mary,1,0
2501,1995-06-19,Jim Vercolen game 5.,Double Jeopardy,"(2, 2)",POLITICIANS,15,"(400,)",False,"In 1979 this Arizona Republican published the book ""With No Apologies""",Barry Goldwater,1,0
2501,1995-06-19,Jim Vercolen game 5.,Double Jeopardy,"(3, 2)",RIVERS,22,"(400,)",False,The Han Jiang is one of the chief tributaries of this longest river in Asia,Yangtze,1,0
2501,1995-06-19,Jim Vercolen game 5.,Double Jeopardy,"(4, 2)",MUSIC,10,"(400,)",False,"Stravinsky wrote his 1962 opera ""The Flood"" for this medium",television,0,3
2501,1995-06-19,Jim Vercolen game 5.,Double Jeopardy,"(5, 2)",WEIGHTS & MEASURES,27,"(400,)",False,Number of teaspoons in a  tablespoon,3,1,0
2501,1995-06-19,Jim Vercolen game 5.,Double Jeopardy,"(6, 2)",PLAYS & PLAYWRIGHTS,8,"(400,)",False,"""Come Blow Your Horn"" was inspired by his & his brother's experiences sharing a bachelor pad",Neil Simon,1,0
2501,1995-06-19,Jim Vercolen game 5.,Double Jeopardy,"(1, 3)",THE 17th CENTURY,4,"(600,)",False,"In 1668 Jacques Marquette founded a mission at Sault Sainte Marie, now in this state",Michigan,1,0
2501,1995-06-19,Jim Vercolen game 5.,Double Jeopardy,"(2, 3)",POLITICIANS,18,"(600,)",False,"On June 7, 1966 he won the Calif. GOP gubernatorial primary over ex-San Francisco mayor George Christopher",Ronald Reagan,1,0
2501,1995-06-19,Jim Vercolen game 5.,Double Jeopardy,"(3, 3)",RIVERS,23,"(600,)",False,"The Genesee River empties into this Great Lake near Rochester, N.Y.",Ontario,1,0
2501,1995-06-19,Jim Vercolen game 5.,Double Jeopardy,"(4, 3)",MUSIC,11,"(600,)",False,"The vihuela, a guitar-shaped instrument from this country, was played during the Renaissance",Spain,1,0
2501,1995-06-19,Jim Vercolen game 5.,Double Jeopardy,"(5, 3)",WEIGHTS & MEASURES,28,"(600,)",False,This linear unit of 16 1/2 feet can also be called a pole,rod,1,0
2501,1995-06-19,Jim Vercolen game 5.,Double Jeopardy,"(6, 3)",PLAYS & PLAYWRIGHTS,9,"(600,)",False,"His comedy ""Blithe Spirit"" was adapted as the musical ""High Spirits""",Noel Coward,1,0
2501,1995-06-19,Jim Vercolen game 5.,Double Jeopardy,"(1, 4)",THE 17th CENTURY,5,"(800,)",False,"This author of the ""Pilgrim's Progress"" was confined to Bedford County Jail from 1660 to 1672",(John) Bunyan,1,0
2501,1995-06-19,Jim Vercolen game 5.,Double Jeopardy,"(2, 4)",POLITICIANS,19,"(800,)",False,"Only 3 current U.S. Senators are over 75: Strom Thurmond, Claiborne Pell & this West Virginian",Robert Byrd,1,0
2501,1995-06-19,Jim Vercolen game 5.,Double Jeopardy,"(3, 4)",RIVERS,24,"(800,)",False,"Taddeo Gaddi designed the Ponte Vecchio over this river in Florence, Italy",Arno,1,0
2501,1995-06-19,Jim Vercolen game 5.,Double Jeopardy,"(4, 4)",MUSIC,12,"(800,)",False,"The ""clavier-ubung"" is an extensive 4-part collection of this composer's keyboard music",(Johann Sebastian) Bach,1,0
2501,1995-06-19,Jim Vercolen game 5.,Double Jeopardy,"(5, 4)",WEIGHTS & MEASURES,29,"(1000,)",True,"The name of this weight system comes from a French term meaning ""goods of weight""",avoirdupois,1,0
2501,1995-06-19,Jim Vercolen game 5.,Double Jeopardy,"(6, 4)",PLAYS & PLAYWRIGHTS,16,"(800,)",False,"This ""Cyrano de Bergerac"" playwright wrote ""La Princesse Lointaine"" for Sarah Bernhardt",Rostand,1,0
2501,1995-06-19,Jim Vercolen game 5.,Double Jeopardy,"(1, 5)",THE 17th CENTURY,6,"(1000,)",False,In 1658 this builder of the Taj Mahal was deposed by his son Aurangzeb & imprisoned,Shah Jihan,0,3
2501,1995-06-19,Jim Vercolen game 5.,Double Jeopardy,"(2, 5)",POLITICIANS,20,"(2200,)",True,This Texan was Majority Leader of the Senate from 1955 to 1961,Lyndon Johnson,1,0
2501,1995-06-19,Jim Vercolen game 5.,Double Jeopardy,"(3, 5)",RIVERS,25,"(1000,)",False,"Mount Hermon, the highest peak in the Anti-Lebanon Mountain Range, is the source of this river",Jordan,1,0
2501,1995-06-19,Jim Vercolen game 5.,Double Jeopardy,"(4, 5)",MUSIC,13,"(1000,)",False,"He's considered the inventor of the English Biblical oratorio; his first was ""Esther"", in 1732",Handel,1,0
2501,1995-06-19,Jim Vercolen game 5.,Double Jeopardy,"(5, 5)",WEIGHTS & MEASURES,30,"(1000,)",False,In ancient Greece this measurement was equal to 2 spans or 6 palms,cubit,1,0
2501,1995-06-19,Jim Vercolen game 5.,Double Jeopardy,"(6, 5)",PLAYS & PLAYWRIGHTS,17,"(1000,)",False,"Halvard Solness, a self-trained architect, is the central character of this Isben drama",The Master Builder,1,1
2501,1995-06-19,Jim Vercolen game 5.,Final Jeopardy,"(1, 1)",ARTISTS,0,"(2500, 8300, 4100)",False,"He painted a ""Crouching Marquesan Woman Seen from the Back"" circa 1902",Paul Gauguin,2,1
