epNum,airDate,extra_info,round_name,coord,category,order,value,daily_double,question,answer,correctAttempts,wrongAttempts
2520,1995-07-14,1995-A Seniors Tournament quarterfinal game 5.,Jeopardy,"(1, 1)",HISTORIC NAMES,1,"(100,)",False,In 1919 this former newspaper editor formed the Fascist Party in Italy,Mussolini,0,0
2520,1995-07-14,1995-A Seniors Tournament quarterfinal game 5.,Jeopardy,"(2, 1)",SPORTS GREATS,8,"(100,)",False,He was hockey's leading scorer in 1984 & 1994,Wayne Gretzky,0,0
2520,1995-07-14,1995-A Seniors Tournament quarterfinal game 5.,Jeopardy,"(3, 1)",COLLEGES & UNIVERSITIES,7,"(100,)",False,Al-Azhar University in this Egyptian capital was established around the Al-Azhar Mosque,Cairo,0,0
2520,1995-07-14,1995-A Seniors Tournament quarterfinal game 5.,Jeopardy,"(4, 1)",STATE EMBLEMS,6,"(100,)",False,It sounds like you'd find this state flower of Massachusetts on Plymouth Rock,the mayflower,0,0
2520,1995-07-14,1995-A Seniors Tournament quarterfinal game 5.,Jeopardy,"(5, 1)",CLASSIC TELEVISION,13,"(100,)",False,"Its opening narration began, ""There is a fifth dimension beyond that which is known to man...""",The Twilight Zone,0,0
2520,1995-07-14,1995-A Seniors Tournament quarterfinal game 5.,Jeopardy,"(6, 1)",POTPOURRI,22,"(100,)",False,This purported nursery rhyme author is sometimes known as Ma'am Goose,Mother Goose,0,0
2520,1995-07-14,1995-A Seniors Tournament quarterfinal game 5.,Jeopardy,"(1, 2)",HISTORIC NAMES,2,"(200,)",False,"Ivan the Terrible had this many wives, one more than a famous oft-married English king",7,0,0
2520,1995-07-14,1995-A Seniors Tournament quarterfinal game 5.,Jeopardy,"(2, 2)",SPORTS GREATS,9,"(200,)",False,This Seattle Mariner had 40 home runs when the 1994 season abruptly ended,Ken Griffey Jr.,0,0
2520,1995-07-14,1995-A Seniors Tournament quarterfinal game 5.,Jeopardy,"(3, 2)",COLLEGES & UNIVERSITIES,27,"(200,)",False,The University of Antioquia is located in Medellin in this country,Colombia,0,0
2520,1995-07-14,1995-A Seniors Tournament quarterfinal game 5.,Jeopardy,"(4, 2)",STATE EMBLEMS,18,"(200,)",False,"Its state motto is ""North to the Future""; its tree, the Sitka spruce",Alaska,0,0
2520,1995-07-14,1995-A Seniors Tournament quarterfinal game 5.,Jeopardy,"(5, 2)",CLASSIC TELEVISION,14,"(200,)",False,"Van Heflin was offered this role in ""The Untouchables""; Robert Stack took the part",Eliot Ness,0,0
2520,1995-07-14,1995-A Seniors Tournament quarterfinal game 5.,Jeopardy,"(6, 2)",POTPOURRI,23,"(200,)",False,"The popularity of these white accessories, once the mark of a lady, declined in the 1960s",gloves,0,0
2520,1995-07-14,1995-A Seniors Tournament quarterfinal game 5.,Jeopardy,"(1, 3)",HISTORIC NAMES,3,"(300,)",False,This British explorer left on his third & final voyage in July 1776,(Captain) Cook,0,0
2520,1995-07-14,1995-A Seniors Tournament quarterfinal game 5.,Jeopardy,"(2, 3)",SPORTS GREATS,10,"(300,)",False,In 1994 Pete Sampras became the 1st man to win back-to-back Wimbledon singles since this German in 1986,Boris Becker,0,0
2520,1995-07-14,1995-A Seniors Tournament quarterfinal game 5.,Jeopardy,"(3, 3)",COLLEGES & UNIVERSITIES,28,"(300,)",False,This school in Tempe didn't become a university until 1958,Arizona State University,0,0
2520,1995-07-14,1995-A Seniors Tournament quarterfinal game 5.,Jeopardy,"(4, 3)",STATE EMBLEMS,19,"(300,)",False,"Its state flower is the Rocky Mountain columbine; its state song, ""Where The Columbines Grow""",Colorado,0,0
2520,1995-07-14,1995-A Seniors Tournament quarterfinal game 5.,Jeopardy,"(5, 3)",CLASSIC TELEVISION,15,"(300,)",False,"This Norman Lear sitcom starred Bea Arthur as Edith Bunker's liberal cousin from Tuckahoe, New York",Maude,0,0
2520,1995-07-14,1995-A Seniors Tournament quarterfinal game 5.,Jeopardy,"(6, 3)",POTPOURRI,24,"(300,)",False,This plump little quail is named for its characteristic call,a bobwhite,0,0
2520,1995-07-14,1995-A Seniors Tournament quarterfinal game 5.,Jeopardy,"(1, 4)",HISTORIC NAMES,4,"(400,)",False,"This British soldier was 5'5 1/2""; Peter O'Toole, who played him on film, is 6'3""",Lawrence of Arabia,0,0
2520,1995-07-14,1995-A Seniors Tournament quarterfinal game 5.,Jeopardy,"(2, 4)",SPORTS GREATS,11,"(400,)",False,Event in which Bob Seagren made his name,pole vault,0,0
2520,1995-07-14,1995-A Seniors Tournament quarterfinal game 5.,Jeopardy,"(3, 4)",COLLEGES & UNIVERSITIES,29,"(400,)",False,This college is the sole constituent college of the University of Dublin,Trinity College,0,0
2520,1995-07-14,1995-A Seniors Tournament quarterfinal game 5.,Jeopardy,"(4, 4)",STATE EMBLEMS,20,"(800,)",True,Its folk dance is the square dance; one of its songs is a waltz,Tennessee,0,0
2520,1995-07-14,1995-A Seniors Tournament quarterfinal game 5.,Jeopardy,"(5, 4)",CLASSIC TELEVISION,16,"(400,)",False,"Sitcom town where you'd find Emmett's Fix-It Shop, Walker's Drugstore & Floyd's Barbershop",Mayberry,0,0
2520,1995-07-14,1995-A Seniors Tournament quarterfinal game 5.,Jeopardy,"(6, 4)",POTPOURRI,25,"(400,)",False,"In the Christian hierarchy of angels, the 2 groups whose names end with ""im""",seraphim & cherubim,0,0
2520,1995-07-14,1995-A Seniors Tournament quarterfinal game 5.,Jeopardy,"(1, 5)",HISTORIC NAMES,5,"(500,)",False,"Since the death of this N. Korean president, Fidel Castro is the current longest-serving Communist leader",Kim Il-sung,0,0
2520,1995-07-14,1995-A Seniors Tournament quarterfinal game 5.,Jeopardy,"(2, 5)",SPORTS GREATS,12,"(500,)",False,Sportswriter Damon Runyon dubbed this fighter the Manassa Mauler,Jack Dempsey,0,0
2520,1995-07-14,1995-A Seniors Tournament quarterfinal game 5.,Jeopardy,"(3, 5)",COLLEGES & UNIVERSITIES,30,"(500,)",False,"Now nonsectarian, Pennsylvania's Bryn Mawr was originally affiliated with this religious group",the Quakers,0,0
2520,1995-07-14,1995-A Seniors Tournament quarterfinal game 5.,Jeopardy,"(4, 5)",STATE EMBLEMS,21,"(500,)",False,"The star garnet is the gem of this ""Gem State""",Idaho,0,0
2520,1995-07-14,1995-A Seniors Tournament quarterfinal game 5.,Jeopardy,"(5, 5)",CLASSIC TELEVISION,17,"(500,)",False,E.G. Marshall won an Emmy for his role as attorney Lawrence Preston in this courtroom drama,The Defenders,0,0
2520,1995-07-14,1995-A Seniors Tournament quarterfinal game 5.,Jeopardy,"(6, 5)",POTPOURRI,26,"(500,)",False,The Drug Enforcement Administration is part of this cabinet department,the Justice Department,0,0
2520,1995-07-14,1995-A Seniors Tournament quarterfinal game 5.,Double Jeopardy,"(1, 1)",WORLD CITIES,1,"(200,)",False,Swedes call this Finnish city Helsingfors,Helsinki,0,0
2520,1995-07-14,1995-A Seniors Tournament quarterfinal game 5.,Double Jeopardy,"(2, 1)",QUOTABLE WOMEN,26,"(200,)",False,"The poet who wrote, ""I love thee to the depth and breadth and height my soul can reach""",Elizabeth Barrett Browning,0,0
2520,1995-07-14,1995-A Seniors Tournament quarterfinal game 5.,Double Jeopardy,"(3, 1)",THE ROARING '20s,13,"(200,)",False,"In 1926 the ""bee-stung"" look was in for this part of a woman's body",the lips,0,0
2520,1995-07-14,1995-A Seniors Tournament quarterfinal game 5.,Double Jeopardy,"(4, 1)",DEM BONES,6,"(200,)",False,The tympanic bone is located in this organ,the ear,0,0
2520,1995-07-14,1995-A Seniors Tournament quarterfinal game 5.,Double Jeopardy,"(5, 1)",LAW,20,"(200,)",False,A capital offense is defined as a crime punishable by life imprisonment or this,death,0,0
2520,1995-07-14,1995-A Seniors Tournament quarterfinal game 5.,Double Jeopardy,"(6, 1)",COMPOSERS,11,"(200,)",False,"One of Rossini's early works was a comic adaptation of this fairy tale called ""La Cenerentola""",Cinderella,0,0
2520,1995-07-14,1995-A Seniors Tournament quarterfinal game 5.,Double Jeopardy,"(1, 2)",WORLD CITIES,2,"(400,)",False,"This city's Dutch name, 's-Gravenhage, means ""the count's hedge""",The Hague,0,0
2520,1995-07-14,1995-A Seniors Tournament quarterfinal game 5.,Double Jeopardy,"(2, 2)",QUOTABLE WOMEN,27,"(400,)",False,"""The truest expression of a people is in its dances and its music"", said this ""Oklahoma!"" choreographer",Agnes de Mille,0,0
2520,1995-07-14,1995-A Seniors Tournament quarterfinal game 5.,Double Jeopardy,"(3, 2)",THE ROARING '20s,14,"(400,)",False,In 1924 Howard Carter uncovered this man's now-famous funerary mask,King Tut,0,0
2520,1995-07-14,1995-A Seniors Tournament quarterfinal game 5.,Double Jeopardy,"(4, 2)",DEM BONES,7,"(400,)",False,"The Ilium, pubis & ischium make up this ""girdle""",the pelvic girdle,0,0
2520,1995-07-14,1995-A Seniors Tournament quarterfinal game 5.,Double Jeopardy,"(5, 2)",LAW,21,"(400,)",False,"Defamation includes these 2 offenses, one written, the other oral",slander & libel,0,0
2520,1995-07-14,1995-A Seniors Tournament quarterfinal game 5.,Double Jeopardy,"(6, 2)",COMPOSERS,12,"(400,)",False,He first realized he was going deaf in 1798; he was only 27,Beethoven,0,0
2520,1995-07-14,1995-A Seniors Tournament quarterfinal game 5.,Double Jeopardy,"(1, 3)",WORLD CITIES,3,"(600,)",False,"This Alberta city is nicknamed the ""Foothill City"", but you could call it the ""Stampede City""",Calgary,0,0
2520,1995-07-14,1995-A Seniors Tournament quarterfinal game 5.,Double Jeopardy,"(2, 3)",QUOTABLE WOMEN,28,"(600,)",False,"In 1923 this M.P. wrote, ""The first time Adam had a chance, he laid the blame on woman""",Lady Astor,0,0
2520,1995-07-14,1995-A Seniors Tournament quarterfinal game 5.,Double Jeopardy,"(3, 3)",THE ROARING '20s,15,"(600,)",False,A flapper was a girl & a flivver was one of these,a car,0,0
2520,1995-07-14,1995-A Seniors Tournament quarterfinal game 5.,Double Jeopardy,"(4, 3)",DEM BONES,8,"(600,)",False,It runs down the center of the chest & your true ribs branch off of it,the sternum,0,0
2520,1995-07-14,1995-A Seniors Tournament quarterfinal game 5.,Double Jeopardy,"(5, 3)",LAW,22,"(600,)",False,"Under former laws, it was a person who settled on public land to acquire its title",a squatter,0,0
2520,1995-07-14,1995-A Seniors Tournament quarterfinal game 5.,Double Jeopardy,"(6, 3)",COMPOSERS,17,"(600,)",False,"His ""Suite Bergamasque"", in several movements, includes the celebrated ""Clair De Lune""",Debussy,0,0
2520,1995-07-14,1995-A Seniors Tournament quarterfinal game 5.,Double Jeopardy,"(1, 4)",WORLD CITIES,4,"(800,)",False,"Legend says Ulysses founded this Portuguese city, hence its ancient name, Olisipo",Lisbon,0,0
2520,1995-07-14,1995-A Seniors Tournament quarterfinal game 5.,Double Jeopardy,"(2, 4)",QUOTABLE WOMEN,29,"(800,)",False,"""Honor wears different coats to different eyes"", she wrote in ""The Guns of August""",Barbara Tuchman,0,0
2520,1995-07-14,1995-A Seniors Tournament quarterfinal game 5.,Double Jeopardy,"(3, 4)",THE ROARING '20s,16,"(700,)",True,6-syllable word for the U.S. anniversary celebrated in 1926,the sesquicentennial,0,0
2520,1995-07-14,1995-A Seniors Tournament quarterfinal game 5.,Double Jeopardy,"(4, 4)",DEM BONES,9,"(800,)",False,It runs from the elbow to the wrist on the side opposite the thumb,the ulna,0,0
2520,1995-07-14,1995-A Seniors Tournament quarterfinal game 5.,Double Jeopardy,"(5, 4)",LAW,23,"(800,)",False,"In this type of marriage, legal appointees substitute for the absent couple at the ceremony",proxy,0,0
2520,1995-07-14,1995-A Seniors Tournament quarterfinal game 5.,Double Jeopardy,"(6, 4)",COMPOSERS,18,"(800,)",False,"""Armida"", an opera by this Czech composer, premiered in Prague in March 1904, 5 weeks before his death",Dvořák,0,0
2520,1995-07-14,1995-A Seniors Tournament quarterfinal game 5.,Double Jeopardy,"(1, 5)",WORLD CITIES,5,"(1000,)",False,There's a park named for John F. Kennedy in this Costa Rican capital,San José,0,0
2520,1995-07-14,1995-A Seniors Tournament quarterfinal game 5.,Double Jeopardy,"(2, 5)",QUOTABLE WOMEN,30,"(1000,)",False,"Her novel ""So Big"" tells us, ""Housework's the hardest work in the world. That's why men won't do it""",Edna Ferber,0,0
2520,1995-07-14,1995-A Seniors Tournament quarterfinal game 5.,Double Jeopardy,"(3, 5)",THE ROARING '20s,25,"(1000,)",False,His well-publicized 1925 trial was really between the modernists & the fundamentalists,(John) Scopes,0,0
2520,1995-07-14,1995-A Seniors Tournament quarterfinal game 5.,Double Jeopardy,"(4, 5)",DEM BONES,10,"(1000,)",False,"Common name for the calcaneus, the quadrangular bone at the back of the tarsus",the heel bone,0,0
2520,1995-07-14,1995-A Seniors Tournament quarterfinal game 5.,Double Jeopardy,"(5, 5)",LAW,24,"(1000,)",False,It's the legal term for a supplement or addition to a will,a codicil,0,0
2520,1995-07-14,1995-A Seniors Tournament quarterfinal game 5.,Double Jeopardy,"(6, 5)",COMPOSERS,19,"(500,)",True,Organ master & composer of the canon heard here: [Instrumental music plays],(Johann) Pachelbel,0,0
2520,1995-07-14,1995-A Seniors Tournament quarterfinal game 5.,Final Jeopardy,"(1, 1)",NOVEL CHARACTERS,0,(),False,"The next-to-last line spoken by this man is ""I wish I could care what you do or where you go, but I can't""",Rhett Butler,0,0
