epNum,airDate,extra_info,round_name,coord,category,order,value,daily_double,question,answer,correctAttempts,wrongAttempts
2604,1995-12-21,1995-B Seniors Tournament quarterfinal game 4.,Jeopardy,"(1, 1)",U.S. CITIES,1,"(100,)",False,This home of Disney World was probably named for a soldier killed in the Second Seminole War,Orlando,0,0
2604,1995-12-21,1995-B Seniors Tournament quarterfinal game 4.,Jeopardy,"(2, 1)",THE MOVIES,26,"(100,)",False,"One-third of the dialogue in this Kevin Costner film is in the Lakota language, with English subtitles",Dances with Wolves,0,0
2604,1995-12-21,1995-B Seniors Tournament quarterfinal game 4.,Jeopardy,"(3, 1)",EDIBLE QUOTES,6,"(100,)",False,"Clifton Fadiman described cheese as this liquid's ""leap toward immortality""",milk,0,0
2604,1995-12-21,1995-B Seniors Tournament quarterfinal game 4.,Jeopardy,"(4, 1)",PEOPLE IN HISTORY,7,"(100,)",False,This Egyptian queen married 2 of her brothers: Ptolemy XII & Ptolemy XIII,Cleopatra,0,0
2604,1995-12-21,1995-B Seniors Tournament quarterfinal game 4.,Jeopardy,"(5, 1)",SPORTSWOMEN,21,"(100,)",False,"This woman nicknamed ""Babe"" was an All-American high school basketball player at age 16",Babe Didrikson Zaharias,0,0
2604,1995-12-21,1995-B Seniors Tournament quarterfinal game 4.,Jeopardy,"(6, 1)",DOOHICKEYS,16,"(100,)",False,It's a small swiveling wheel attached to the bottom of pieces of furniture,a caster,0,0
2604,1995-12-21,1995-B Seniors Tournament quarterfinal game 4.,Jeopardy,"(1, 2)",U.S. CITIES,2,"(200,)",False,This capital's largest public employer is the state of South Dakota,Pierre,0,0
2604,1995-12-21,1995-B Seniors Tournament quarterfinal game 4.,Jeopardy,"(2, 2)",THE MOVIES,27,"(200,)",False,Sebastian Cabot provided the voice of Bagheera the panther for this 1967 animated Disney film,The Jungle Book,0,0
2604,1995-12-21,1995-B Seniors Tournament quarterfinal game 4.,Jeopardy,"(3, 2)",EDIBLE QUOTES,8,"(200,)",False,"According to a nursery rhyme, ""Oranges"" and these fruits, ""say the bells of St. Clement's""",lemons,0,0
2604,1995-12-21,1995-B Seniors Tournament quarterfinal game 4.,Jeopardy,"(4, 2)",PEOPLE IN HISTORY,12,"(200,)",False,"As a tribute to this late admiral, his brother William was created Earl of Trafalgar",Lord Nelson,0,0
2604,1995-12-21,1995-B Seniors Tournament quarterfinal game 4.,Jeopardy,"(5, 2)",SPORTSWOMEN,22,"(200,)",False,Maria Bueno won 12 grand slam doubles crowns in this sport in spite of a long bout with hepatitis,tennis,0,0
2604,1995-12-21,1995-B Seniors Tournament quarterfinal game 4.,Jeopardy,"(6, 2)",DOOHICKEYS,17,"(200,)",False,It's the penpoint you insert into the tip of a fountain pen,a nib,0,0
2604,1995-12-21,1995-B Seniors Tournament quarterfinal game 4.,Jeopardy,"(1, 3)",U.S. CITIES,3,"(300,)",False,"Camden, New Jersey is in the metropolitan area of this Pennsylvania city",Philadelphia,0,0
2604,1995-12-21,1995-B Seniors Tournament quarterfinal game 4.,Jeopardy,"(2, 3)",THE MOVIES,28,"(300,)",False,"This Barrymore was nominated for a Best Director Oscar for the 1929 tearjerker ""Madame X""",Lionel Barrymore,0,0
2604,1995-12-21,1995-B Seniors Tournament quarterfinal game 4.,Jeopardy,"(3, 3)",EDIBLE QUOTES,9,"(300,)",False,"In ""The Taming of the Shrew"", Shakespeare wrote, ""There's small choice in"" these ""rotten"" fruits",apples,0,0
2604,1995-12-21,1995-B Seniors Tournament quarterfinal game 4.,Jeopardy,"(4, 3)",PEOPLE IN HISTORY,13,"(300,)",False,"It's believed William Clark, fond of this Indian guide, later raised & educated her son",Sacajawea,0,0
2604,1995-12-21,1995-B Seniors Tournament quarterfinal game 4.,Jeopardy,"(5, 3)",SPORTSWOMEN,23,"(300,)",False,"In September 1995 this American figure skater married her agent, Jerry Solomon",Nancy Kerrigan,0,0
2604,1995-12-21,1995-B Seniors Tournament quarterfinal game 4.,Jeopardy,"(6, 3)",DOOHICKEYS,18,"(300,)",False,They're the raised bars on the neck of a guitar,a fret,0,0
2604,1995-12-21,1995-B Seniors Tournament quarterfinal game 4.,Jeopardy,"(1, 4)",U.S. CITIES,4,"(400,)",False,Harry Truman's summer White House was in this city,"Independence, Missouri",0,0
2604,1995-12-21,1995-B Seniors Tournament quarterfinal game 4.,Jeopardy,"(2, 4)",THE MOVIES,29,"(400,)",False,Sidney Poitier helps a group of nuns build a chapel in this 1963 film that won him an Oscar,Lilies of the Field,0,0
2604,1995-12-21,1995-B Seniors Tournament quarterfinal game 4.,Jeopardy,"(3, 4)",EDIBLE QUOTES,10,"(400,)",False,"British PM who said, we ""have not journeyed all this way...because we are made of sugar candy""",Churchill,0,0
2604,1995-12-21,1995-B Seniors Tournament quarterfinal game 4.,Jeopardy,"(4, 4)",PEOPLE IN HISTORY,14,"(400,)",False,"Muhammad Reza Pahlavi, who died in 1980, was the last person to hold this title",the Shah of Iran,0,0
2604,1995-12-21,1995-B Seniors Tournament quarterfinal game 4.,Jeopardy,"(5, 4)",SPORTSWOMEN,24,"(400,)",False,In 1992 she became the first winner of back-to-back Olympic gold medals in the heptathlon,Jackie Joyner-Kersee,0,0
2604,1995-12-21,1995-B Seniors Tournament quarterfinal game 4.,Jeopardy,"(6, 4)",DOOHICKEYS,19,"(400,)",False,It hangs inside a bell & strikes the sides to produce ringing,a clapper,0,0
2604,1995-12-21,1995-B Seniors Tournament quarterfinal game 4.,Jeopardy,"(1, 5)",U.S. CITIES,5,"(500,)",False,This Tennessee city was built during World War II as part of the Manhattan Project,Oak Ridge,0,0
2604,1995-12-21,1995-B Seniors Tournament quarterfinal game 4.,Jeopardy,"(2, 5)",THE MOVIES,30,"(500,)",False,This 1947 film that made Richard Widmark a star inspired a 1995 remake starring David Caruso,Kiss of Death,0,0
2604,1995-12-21,1995-B Seniors Tournament quarterfinal game 4.,Jeopardy,"(3, 5)",EDIBLE QUOTES,11,"(500,)",False,"Thackeray wrote a ballad about this Provencal seafood stew, calling it ""a sort of soup, or broth, or brew""",bouillabaisse,0,0
2604,1995-12-21,1995-B Seniors Tournament quarterfinal game 4.,Jeopardy,"(4, 5)",PEOPLE IN HISTORY,15,"(500,)",True,Lev Davidovich Bronstein was the real name of this Communist leader banished from Russia in 1929,Leon Trotsky,0,0
2604,1995-12-21,1995-B Seniors Tournament quarterfinal game 4.,Jeopardy,"(5, 5)",SPORTSWOMEN,25,"(500,)",False,In 1984 Joan Benoit became the first female Olympic gold medalist in this race,the marathon,0,0
2604,1995-12-21,1995-B Seniors Tournament quarterfinal game 4.,Jeopardy,"(6, 5)",DOOHICKEYS,20,"(500,)",False,Proper term for the roller on a typewriter,a platen,0,0
2604,1995-12-21,1995-B Seniors Tournament quarterfinal game 4.,Double Jeopardy,"(1, 1)",THE CIVIL WAR,21,"(200,)",False,"This ironclad sunk December 31, 1862 was mistaken for a sub during WWII & hit by depth charges",the Monitor,0,0
2604,1995-12-21,1995-B Seniors Tournament quarterfinal game 4.,Double Jeopardy,"(2, 1)",SCULPTORS,1,"(200,)",False,"Pierre Puget's Milo of Crotona, sculpted for Versailles, is now in this Paris museum",le Louvre,0,0
2604,1995-12-21,1995-B Seniors Tournament quarterfinal game 4.,Double Jeopardy,"(3, 1)",ARCHAEOLOGY,16,"(200,)",False,Fossils of this early man were first discovered in a German valley in 1856,the Neanderthal,0,0
2604,1995-12-21,1995-B Seniors Tournament quarterfinal game 4.,Double Jeopardy,"(4, 1)",FASHION HISTORY,6,"(200,)",False,"This ancient Roman garment developed from the tebenna, a cloak worn by those darn Etruscans",a toga,0,0
2604,1995-12-21,1995-B Seniors Tournament quarterfinal game 4.,Double Jeopardy,"(6, 1)",PLAYS & PLAYWRIGHTS,11,"(200,)",False,"The Provincetown Players staged the premieres of several of his plays, including ""Desire Under the Elms""",(Eugene) O'Neill,0,0
2604,1995-12-21,1995-B Seniors Tournament quarterfinal game 4.,Double Jeopardy,"(1, 2)",THE CIVIL WAR,22,"(400,)",False,"Of the 1,200 men awarded this for Civil War service, about 3/4 were later found ineligible under new rules",the Congressional Medal of Honor,0,0
2604,1995-12-21,1995-B Seniors Tournament quarterfinal game 4.,Double Jeopardy,"(2, 2)",SCULPTORS,2,"(400,)",False,Bartolommeo Ammannati was responsible for the grandiose courtyard of this Italian city's Pitti Palace,Florence,0,0
2604,1995-12-21,1995-B Seniors Tournament quarterfinal game 4.,Double Jeopardy,"(3, 2)",ARCHAEOLOGY,17,"(400,)",False,Scientists learn about ancient plant life by studying fossilized grains of this from flowers,pollen,0,0
2604,1995-12-21,1995-B Seniors Tournament quarterfinal game 4.,Double Jeopardy,"(4, 2)",FASHION HISTORY,7,"(400,)",False,"The couturier Balenciaga moved to Paris in 1937 after Civil War broke out in this, his native country",Spain,0,0
2604,1995-12-21,1995-B Seniors Tournament quarterfinal game 4.,Double Jeopardy,"(5, 2)",KINGS & QUEENS,29,"(400,)",False,"King John II Casimir Vasa, crowned in Krakow in 1648, abdicated this country's throne in 1668",Poland,0,0
2604,1995-12-21,1995-B Seniors Tournament quarterfinal game 4.,Double Jeopardy,"(6, 2)",PLAYS & PLAYWRIGHTS,12,"(400,)",False,"In 1643 this French playwright incorporated an acting troupe, the Illustre-Theatre, with the Bejart family",Molière,0,0
2604,1995-12-21,1995-B Seniors Tournament quarterfinal game 4.,Double Jeopardy,"(1, 3)",THE CIVIL WAR,23,"(600,)",False,"Though Farragut took this city's bay in 1864, the Union didn't control the city until 3 days after Lee's surrender",Mobile,0,0
2604,1995-12-21,1995-B Seniors Tournament quarterfinal game 4.,Double Jeopardy,"(2, 3)",SCULPTORS,3,"(600,)",False,"This mobile sculptor's ""Circus"" is in the Whitney Museum",Calder,0,0
2604,1995-12-21,1995-B Seniors Tournament quarterfinal game 4.,Double Jeopardy,"(3, 3)",ARCHAEOLOGY,18,"(1000,)",True,They were uncovered by a Bedouin boy exploring a cave at Qumran in 1947,the Dead Sea Scrolls,0,0
2604,1995-12-21,1995-B Seniors Tournament quarterfinal game 4.,Double Jeopardy,"(4, 3)",FASHION HISTORY,8,"(600,)",False,The Ramillies style of this 18th c. men's accessory featured a long braid tied with ribbons,a wig,0,0
2604,1995-12-21,1995-B Seniors Tournament quarterfinal game 4.,Double Jeopardy,"(5, 3)",KINGS & QUEENS,28,"(600,)",False,"When this country's King Baudouin died in 1993, he was succeeded by his brother, Albert II",Belgium,0,0
2604,1995-12-21,1995-B Seniors Tournament quarterfinal game 4.,Double Jeopardy,"(6, 3)",PLAYS & PLAYWRIGHTS,13,"(800,)",True,"In this Chekhov play, Irina, Masha & Olga fail in their desire to return to Moscow from the provinces",the Three Sisters,0,0
2604,1995-12-21,1995-B Seniors Tournament quarterfinal game 4.,Double Jeopardy,"(1, 4)",THE CIVIL WAR,24,"(800,)",False,"On May 30,1863 the Confederate Congress officially nicknamed Gen. Jackson's troops this ""Brigade""",the Stonewall Brigade,0,0
2604,1995-12-21,1995-B Seniors Tournament quarterfinal game 4.,Double Jeopardy,"(2, 4)",SCULPTORS,4,"(800,)",False,"He was inspired to create such works as ""Bronco Buster"" by watching sculptor Frederic Ruckstull work",Remington,0,0
2604,1995-12-21,1995-B Seniors Tournament quarterfinal game 4.,Double Jeopardy,"(3, 4)",ARCHAEOLOGY,19,"(800,)",False,In 1995 it was announced that a tomb believed to contain 50 of this pharaoh's sons was found in Egypt,Ramses II (Ramses the Great),0,0
2604,1995-12-21,1995-B Seniors Tournament quarterfinal game 4.,Double Jeopardy,"(4, 4)",FASHION HISTORY,9,"(800,)",False,"Born in 1778, this ultimate English dandy wore elegantly tailored clothes with elaborate cravats",Beau Brummell,0,0
2604,1995-12-21,1995-B Seniors Tournament quarterfinal game 4.,Double Jeopardy,"(5, 4)",KINGS & QUEENS,26,"(800,)",False,King Edward III led England into this lengthy war in 1337; he didn't live to see it end,the Hundred Years' War,0,0
2604,1995-12-21,1995-B Seniors Tournament quarterfinal game 4.,Double Jeopardy,"(6, 4)",PLAYS & PLAYWRIGHTS,14,"(800,)",False,"He played test pilot Chuck Yeager in the film ""The Right Stuff"" the same year his ""Fool for Love"" debuted",(Sam) Shepard,0,0
2604,1995-12-21,1995-B Seniors Tournament quarterfinal game 4.,Double Jeopardy,"(1, 5)",THE CIVIL WAR,25,"(1000,)",False,The Atlantic Monthly paid $5 for this Julia Ward Howe poem & published it in February 1862,"""The Battle Hymn of the Republic""",0,0
2604,1995-12-21,1995-B Seniors Tournament quarterfinal game 4.,Double Jeopardy,"(2, 5)",SCULPTORS,5,"(1000,)",False,"In the 1920s Isamu Noguchi worked as an assistant to this Romanian-born ""Bird in Space"" sculptor",Constantin Brâncuși,0,0
2604,1995-12-21,1995-B Seniors Tournament quarterfinal game 4.,Double Jeopardy,"(3, 5)",ARCHAEOLOGY,20,"(1000,)",False,"In the 1870s he published some of his findings in ""Trojan Antiquities"" & ""Troy and its Ruins""",(Heinrich) Schliemann,0,0
2604,1995-12-21,1995-B Seniors Tournament quarterfinal game 4.,Double Jeopardy,"(4, 5)",FASHION HISTORY,10,"(1000,)",False,"This fashionable empress, the wife of Napoleon III, was nicknamed the ""Queen of the Crinoline""",Eugénie,0,0
2604,1995-12-21,1995-B Seniors Tournament quarterfinal game 4.,Double Jeopardy,"(5, 5)",KINGS & QUEENS,27,"(1000,)",False,Rene Descartes taught philosophy to this Scandinavian country's Queen Christina,Sweden,0,0
2604,1995-12-21,1995-B Seniors Tournament quarterfinal game 4.,Double Jeopardy,"(6, 5)",PLAYS & PLAYWRIGHTS,15,"(1000,)",False,Robert Anderson is best known for this 1953 play about an insecure prep school boy & a kindly faculty wife,Tea and Sympathy,0,0
2604,1995-12-21,1995-B Seniors Tournament quarterfinal game 4.,Final Jeopardy,"(1, 1)",ENGINEERING,0,(),False,"Opened in 1994, it links the SNCB, SNCF & BR",the Chunnel (the English Channel Tunnel),0,0
