epNum,airDate,extra_info,round_name,coord,category,order,value,daily_double,question,answer,correctAttempts,wrongAttempts
2624,1996-01-18,Bill Dickenson game 3.,Jeopardy,"(1, 1)",AROUND THE WORLD,8,"(100,)",False,"The name of these South American mountains may be derived from anti, a Quechuan word for ""east""",Andes,1,0
2624,1996-01-18,Bill Dickenson game 3.,Jeopardy,"(2, 1)",TELEVISION,6,"(100,)",False,"On the November 16, 1968 episode of ""Get Smart"", Maxwell Smart married her",Agent 99,1,0
2624,1996-01-18,Bill Dickenson game 3.,Jeopardy,"(3, 1)",DINING OUT,16,"(100,)",False,"This kind of bar may have iceberg or romaine, cold veggies & dressings on it",a salad bar,1,0
2624,1996-01-18,Bill Dickenson game 3.,Jeopardy,"(4, 1)",SCIENCE,25,"(100,)",False,"Among alkaloids found in plants, this stimulant is found in coffee or tea",caffeine,1,0
2624,1996-01-18,Bill Dickenson game 3.,Jeopardy,"(5, 1)",POTPOURRI,21,"(100,)",False,One of this country's shekels can be broken down into 100 agorot,Israel,1,0
2624,1996-01-18,Bill Dickenson game 3.,Jeopardy,"(6, 1)",HISTORY,1,"(100,)",False,It became a U.S. territory in 1900 & was attacked 18 years before becoming a state,Hawaii,1,0
2624,1996-01-18,Bill Dickenson game 3.,Jeopardy,"(1, 2)",AROUND THE WORLD,9,"(200,)",False,Women of India often drape the end of this wrapped garment over their heads,sari,1,0
2624,1996-01-18,Bill Dickenson game 3.,Jeopardy,"(2, 2)",TELEVISION,7,"(200,)",False,In 1990 Jimmy Smits won a Best Supporting Actor Emmy for his work on this NBC drama,L.A. Law,1,1
2624,1996-01-18,Bill Dickenson game 3.,Jeopardy,"(3, 2)",DINING OUT,17,"(200,)",False,At this type of restaurant you really dine out -- out in your automobile where you are served,drive-in,1,0
2624,1996-01-18,Bill Dickenson game 3.,Jeopardy,"(4, 2)",SCIENCE,26,"(200,)",False,You may not need a high IQ to know IQ stands for this,intelligence quotient,1,0
2624,1996-01-18,Bill Dickenson game 3.,Jeopardy,"(5, 2)",POTPOURRI,22,"(200,)",False,"In the basic form of this game, each player gets a card with 5 horizontal rows of numbers from 1 to 75",bingo,1,1
2624,1996-01-18,Bill Dickenson game 3.,Jeopardy,"(6, 2)",HISTORY,2,"(200,)",False,From 1954 to 1969 he was president of North Vietnam,Ho Chi Minh,1,0
2624,1996-01-18,Bill Dickenson game 3.,Jeopardy,"(1, 3)",AROUND THE WORLD,10,"(300,)",False,Almost all Bedouins in the Middle East speak this language,Arabic,1,0
2624,1996-01-18,Bill Dickenson game 3.,Jeopardy,"(2, 3)",TELEVISION,13,"(300,)",False,This series' Flub-A-Dub had the head of a duck & the body of a dachshund,Howdy Doody,0,3
2624,1996-01-18,Bill Dickenson game 3.,Jeopardy,"(3, 3)",DINING OUT,18,"(300,)",False,"You may be shown a tray for this course whose name is from the old French for ""to clear the table""",dessert,0,3
2624,1996-01-18,Bill Dickenson game 3.,Jeopardy,"(4, 3)",SCIENCE,27,"(300,)",False,Name for the process a caterpillar goes through to become a moth,metamorphosis,1,0
2624,1996-01-18,Bill Dickenson game 3.,Jeopardy,"(5, 3)",POTPOURRI,23,"(300,)",False,"Peau de soie, a textile with good drapability & body, is woven from this fiber",silk,1,0
2624,1996-01-18,Bill Dickenson game 3.,Jeopardy,"(6, 3)",HISTORY,3,"(300,)",False,"The U.S. arsenal at this Shenandoah Valley location was raided October 16, 1859",Harper\'s Ferry,1,0
2624,1996-01-18,Bill Dickenson game 3.,Jeopardy,"(1, 4)",AROUND THE WORLD,11,"(400,)",False,This grain is Laos' chief agricultural product,Rice,1,0
2624,1996-01-18,Bill Dickenson game 3.,Jeopardy,"(2, 4)",TELEVISION,14,"(400,)",False,This Jane Wyman series was set in the fictitious Tuscany Valley in California,Falcon Crest,1,1
2624,1996-01-18,Bill Dickenson game 3.,Jeopardy,"(3, 4)",DINING OUT,19,"(400,)",False,A trattoria usually specializes in this country's cuisine,Italy,1,0
2624,1996-01-18,Bill Dickenson game 3.,Jeopardy,"(4, 4)",SCIENCE,28,"(400,)",False,"When cocci live in pairs, they're called diplococci; in clusters, staphylococci; in chains, this",streptococci,1,0
2624,1996-01-18,Bill Dickenson game 3.,Jeopardy,"(5, 4)",POTPOURRI,24,"(400,)",False,Lydia & Xenia are women's names derived from this language,Greek,1,0
2624,1996-01-18,Bill Dickenson game 3.,Jeopardy,"(6, 4)",HISTORY,4,"(400,)",False,"Roman emperor, 117-138, he built walls in Germany as well as in Britain",Hadrian,1,0
2624,1996-01-18,Bill Dickenson game 3.,Jeopardy,"(1, 5)",AROUND THE WORLD,12,"(500,)",False,"Queen's University, 1 of the 2 universities in Northern Ireland, is in this capital city",Belfast,1,0
2624,1996-01-18,Bill Dickenson game 3.,Jeopardy,"(2, 5)",TELEVISION,15,"(500,)",False,In 1966 Alice Pearce won a posthumous Emmy for her role as neighbor Gladys Kravitz on this ABC sitcom,Bewitched,0,3
2624,1996-01-18,Bill Dickenson game 3.,Jeopardy,"(3, 5)",DINING OUT,20,"(500,)",False,Rhyming name given to a lobster & steak combo,surf and turf,1,0
2624,1996-01-18,Bill Dickenson game 3.,Jeopardy,"(4, 5)",SCIENCE,29,"(700,)",True,"Next in length on the scale of geological time: age, epoch, period, era...",eon,0,1
2624,1996-01-18,Bill Dickenson game 3.,Jeopardy,"(5, 5)",POTPOURRI,30,"(500,)",False,The fad involving this type of radio followed the oil embargo of 1973-74,CB (citizens\' band) radio,0,3
2624,1996-01-18,Bill Dickenson game 3.,Jeopardy,"(6, 5)",HISTORY,5,"(500,)",False,Mode of protest used by Emmeline Pankhurst & Mohandas Gandhi while in jail,hunger strike,1,0
2624,1996-01-18,Bill Dickenson game 3.,Double Jeopardy,"(1, 1)",20th CENTURY AMERICA,1,"(200,)",False,"In April 1964, Ford introduced this new sporty car with a $2,368 sticker price",the Mustang,1,0
2624,1996-01-18,Bill Dickenson game 3.,Double Jeopardy,"(2, 1)",GARDENING,7,"(200,)",False,Hybrid perpetuals like the American Beauty were the main type of these in American gardens 1840-1880,roses,1,0
2624,1996-01-18,Bill Dickenson game 3.,Double Jeopardy,"(3, 1)",AUTHORS,17,"(200,)",False,"During the Russo-Japanese War, this ""Call of the Wild"" author served as a reporter for Hearst",Jack London,1,0
2624,1996-01-18,Bill Dickenson game 3.,Double Jeopardy,"(4, 1)",GOVERNMENT & POLITICS,4,"(200,)",False,"In July 1995 Ohio raised these; a passenger car traversing the state now pays $5.40, up from $4.80",turnpike tolls,1,0
2624,1996-01-18,Bill Dickenson game 3.,Double Jeopardy,"(5, 1)",SEAS,22,"(200,)",False,2 island nations lie within this sea: Cyprus & Malta,the Mediterranean Sea,1,0
2624,1996-01-18,Bill Dickenson game 3.,Double Jeopardy,"(6, 1)",ON BROADWAY 1968,8,"(200,)",False,"He played Jimmy Shine on Broadway in 1968, the year after he played ""The Graduate"" on film",Dustin Hoffman,1,0
2624,1996-01-18,Bill Dickenson game 3.,Double Jeopardy,"(1, 2)",20th CENTURY AMERICA,2,"(400,)",False,"On July 5, 1975 this Hawaiian volcano erupted for the first time in over 26 years",Mauna Loa,1,0
2624,1996-01-18,Bill Dickenson game 3.,Double Jeopardy,"(2, 2)",GARDENING,18,"(400,)",False,This type of moss is most useful for growing acid-loving plants,peat moss,1,0
2624,1996-01-18,Bill Dickenson game 3.,Double Jeopardy,"(3, 2)",AUTHORS,27,"(400,)",False,"As a youngster this ""Billy Budd"" author worked in his brother's fur store in Albany",Herman Melville,1,0
2624,1996-01-18,Bill Dickenson game 3.,Double Jeopardy,"(4, 2)",GOVERNMENT & POLITICS,9,"(400,)",False,In March 1995 she was removed from her South African cabinet post by her estranged husband,Winnie Mandela,1,0
2624,1996-01-18,Bill Dickenson game 3.,Double Jeopardy,"(5, 2)",SEAS,23,"(400,)",False,This sea was named for a warlike tribe of Indians that inhabited the Lesser Antilles,the Caribbean Sea,1,0
2624,1996-01-18,Bill Dickenson game 3.,Double Jeopardy,"(6, 2)",ON BROADWAY 1968,10,"(400,)",False,Herschel Bernardi played this title Greek in a musical based on a Nikos Kazantzakis book,Zorba the Greek,1,0
2624,1996-01-18,Bill Dickenson game 3.,Double Jeopardy,"(1, 3)",20th CENTURY AMERICA,3,"(600,)",False,"On April 6, 1917 America entered World War I & this composer wrote ""Over There""",George M. Cohan,1,1
2624,1996-01-18,Bill Dickenson game 3.,Double Jeopardy,"(2, 3)",GARDENING,19,"(600,)",False,The oscillating type of this irrigation device sprays back & forth in a rectangular pattern,a sprinkler,1,0
2624,1996-01-18,Bill Dickenson game 3.,Double Jeopardy,"(3, 3)",AUTHORS,28,"(600,)",False,In 1971 this novelist was named Dame Commander in the Order of the British Empire,Agatha Christie,1,0
2624,1996-01-18,Bill Dickenson game 3.,Double Jeopardy,"(4, 3)",GOVERNMENT & POLITICS,14,"(600,)",False,In January 1995 this country's government knocked 4 zeroes off its zloty,Poland,0,3
2624,1996-01-18,Bill Dickenson game 3.,Double Jeopardy,"(5, 3)",SEAS,24,"(600,)",False,The Scheldt River flows through Antwerp before emptying into this sea,the North Sea,1,0
2624,1996-01-18,Bill Dickenson game 3.,Double Jeopardy,"(6, 3)",ON BROADWAY 1968,11,"(600,)",False,"On Broadway since 1964, this musical starred Pearl Bailey in the title role in 1968","Hello, Dolly!",0,3
2624,1996-01-18,Bill Dickenson game 3.,Double Jeopardy,"(1, 4)",20th CENTURY AMERICA,5,"(800,)",False,In March 1925 this state passed a law banning the teaching of evolution in public schools,Tennessee,1,0
2624,1996-01-18,Bill Dickenson game 3.,Double Jeopardy,"(2, 4)",GARDENING,20,"(800,)",False,Scarification is a technique where hard-shelled ones of these are scratched to help them sprout,seeds,1,0
2624,1996-01-18,Bill Dickenson game 3.,Double Jeopardy,"(3, 4)",AUTHORS,29,"(800,)",False,"From 1846 to 1849, he was surveyor of the port of Salem, Mass.",Nathaniel Hawthorne,0,3
2624,1996-01-18,Bill Dickenson game 3.,Double Jeopardy,"(4, 4)",GOVERNMENT & POLITICS,15,"(1000,)",True,"Heard here, it's the anthem of the European Union:","""Ode To Joy""",1,0
2624,1996-01-18,Bill Dickenson game 3.,Double Jeopardy,"(5, 4)",SEAS,25,"(800,)",False,Vladivostok is the most important port on this north Pacific sea,the Sea of Japan,1,0
2624,1996-01-18,Bill Dickenson game 3.,Double Jeopardy,"(6, 4)",ON BROADWAY 1968,12,"(800,)",False,James Earl Jones starred on the Great White Way in this drama set in the world of boxing,The Great White Hope,1,0
2624,1996-01-18,Bill Dickenson game 3.,Double Jeopardy,"(1, 5)",20th CENTURY AMERICA,6,"(1000,)",False,He served in the House for 30 years before becoming FDR's first vice president in 1933,John Nance Garner,1,0
2624,1996-01-18,Bill Dickenson game 3.,Double Jeopardy,"(2, 5)",GARDENING,21,"(1000,)",False,"Compared to a tree, this type of plant produces its branches near, at or below the soil surface",a shrub,1,0
2624,1996-01-18,Bill Dickenson game 3.,Double Jeopardy,"(3, 5)",AUTHORS,30,"(1000,)",False,"Sherwood Anderson helped this Mississippi author publish his first novel, ""Soldiers' Pay""",William Faulkner,1,0
2624,1996-01-18,Bill Dickenson game 3.,Double Jeopardy,"(4, 5)",GOVERNMENT & POLITICS,16,"(1000,)",False,"Ex-Soviet republic ruled by Saparmurad Niyazov, who calls himself ""Chief of the Turkmen""",Turkmenistan,1,0
2624,1996-01-18,Bill Dickenson game 3.,Double Jeopardy,"(5, 5)",SEAS,26,"(1000,)",True,"The world's largest inland body of water, its surface lies about 90 feet below sea level",the Caspian Sea,1,0
2624,1996-01-18,Bill Dickenson game 3.,Double Jeopardy,"(6, 5)",ON BROADWAY 1968,13,"(1000,)",False,"Based on the film ""The Apartment"", this Burt Bacharach-Hal David musical opened in December","Promises, Promises",0,3
2624,1996-01-18,Bill Dickenson game 3.,Final Jeopardy,"(1, 1)",MEDICAL FIRSTS,0,"(3999, 1799, 4001)",False,"The death of Denise Darvall in a traffic accident permitted this historic December 3, 1967 event",the first heart transplant,2,1
