epNum,airDate,extra_info,round_name,coord,category,order,value,daily_double,question,answer,correctAttempts,wrongAttempts
2650,1996-02-23,1996 College Championship final game 2.,Jeopardy,"(1, 1)",THE CIVIL WAR,14,"(100,)",False,General George B. McClellan's favorite one of these animals was named after Daniel Webster,horse,1,0
2650,1996-02-23,1996 College Championship final game 2.,Jeopardy,"(2, 1)",TELEVISION,11,"(100,)",False,People with new shows of this type in 1995 included Danny Bonaduce & Tempestt Bledsoe,talk show,1,0
2650,1996-02-23,1996 College Championship final game 2.,Jeopardy,"(3, 1)",BRIDGES,21,"(100,)",False,This French engineer best known for his tower designed a 525-foot bridge over the Douro River,Eiffel,1,0
2650,1996-02-23,1996 College Championship final game 2.,Jeopardy,"(4, 1)",ETIQUETTE,26,"(100,)",False,"As its name implies, this decoration should be placed in the middle of the table",centerpiece,1,0
2650,1996-02-23,1996 College Championship final game 2.,Jeopardy,"(5, 1)",BIBLICAL GEOGRAPHY,1,"(100,)",False,"The land of Goshen was in this country, from which the Jews were led in Exodus",Egypt,1,0
2650,1996-02-23,1996 College Championship final game 2.,Jeopardy,"(6, 1)","COLLEGE CROSSWORD CLUES ""C""",3,"(100,)",False,Holiday yule have off             (9),Christmas,1,0
2650,1996-02-23,1996 College Championship final game 2.,Jeopardy,"(1, 2)",THE CIVIL WAR,15,"(200,)",False,"At the war's end, a reward of $100,000 was offered for the capture of this Confederate president",Jefferson Davis,1,0
2650,1996-02-23,1996 College Championship final game 2.,Jeopardy,"(2, 2)",TELEVISION,12,"(1000,)",True,(AUDIO DAILY DOUBLE) He played the title role in the series with the following theme:,Scott Baio,1,0
2650,1996-02-23,1996 College Championship final game 2.,Jeopardy,"(3, 2)",BRIDGES,22,"(200,)",False,"As of July 1995 more than 1,000 people had jumped from this San Francisco span",Golden Gate Bridge,1,0
2650,1996-02-23,1996 College Championship final game 2.,Jeopardy,"(4, 2)",ETIQUETTE,27,"(200,)",False,In the past proper tennis attire was this color,white,1,0
2650,1996-02-23,1996 College Championship final game 2.,Jeopardy,"(5, 2)",BIBLICAL GEOGRAPHY,2,"(200,)",False,Nehemiah 12 covers the celebration on dedicating the wall of this central city of Israel,Jerusalem,1,0
2650,1996-02-23,1996 College Championship final game 2.,Jeopardy,"(6, 2)","COLLEGE CROSSWORD CLUES ""C""",4,"(200,)",False,Grounds for a college            (6),campus,1,0
2650,1996-02-23,1996 College Championship final game 2.,Jeopardy,"(1, 3)",THE CIVIL WAR,18,"(300,)",False,"Many soldiers wore a havelock, with a flap hanging down the back, over this item of apparel",cap,0,3
2650,1996-02-23,1996 College Championship final game 2.,Jeopardy,"(2, 3)",TELEVISION,13,"(300,)",False,"Last name of the 3 real brothers who star on ""Brotherly Love""",Lawrence,1,0
2650,1996-02-23,1996 College Championship final game 2.,Jeopardy,"(3, 3)",BRIDGES,23,"(300,)",False,"Before a permanent bridge was built across this river in the 1840s, ice sometimes cut off Buda from Pest",Danube,1,0
2650,1996-02-23,1996 College Championship final game 2.,Jeopardy,"(4, 3)",ETIQUETTE,28,"(300,)",False,Never fly this national symbol upside-down except as a distress signal,the flag,1,0
2650,1996-02-23,1996 College Championship final game 2.,Jeopardy,"(5, 3)",BIBLICAL GEOGRAPHY,5,"(300,)",False,"This patriarch bought Machpelah in Canaan & he & his family, including his wife Sarah, are buried there",Abraham,1,0
2650,1996-02-23,1996 College Championship final game 2.,Jeopardy,"(6, 3)","COLLEGE CROSSWORD CLUES ""C""",7,"(300,)",False,Element-ary subject            (9),chemistry,1,0
2650,1996-02-23,1996 College Championship final game 2.,Jeopardy,"(1, 4)",THE CIVIL WAR,19,"(400,)",False,Belle Boyd worked as a spy for Stonewall Jackson during his 1862 campaign in this Virginia valley,Shenandoah,1,0
2650,1996-02-23,1996 College Championship final game 2.,Jeopardy,"(2, 4)",TELEVISION,16,"(400,)",False,"On this series Tea Leoni stars as Nora Wilde, tabloid photographer",The Naked Truth,1,0
2650,1996-02-23,1996 College Championship final game 2.,Jeopardy,"(3, 4)",BRIDGES,24,"(400,)",False,"O.H. Ammann designed this bridge that connects Manhattan with Fort Lee, N.J.",the George Washington Bridge,0,3
2650,1996-02-23,1996 College Championship final game 2.,Jeopardy,"(4, 4)",ETIQUETTE,29,"(400,)",False,A letter to Prince Charles should be addressed to H.R.H. The Prince of Wales; H.R.H. stands for this,His Royal Highness,1,0
2650,1996-02-23,1996 College Championship final game 2.,Jeopardy,"(5, 4)",BIBLICAL GEOGRAPHY,6,"(400,)",False,"The modern term for this area on the east coast of the Mediterranean is from the ancient ""Land of the Philistines""",Palestine,1,0
2650,1996-02-23,1996 College Championship final game 2.,Jeopardy,"(6, 4)","COLLEGE CROSSWORD CLUES ""C""",8,"(400,)",False,2-year college          (9),community,1,0
2650,1996-02-23,1996 College Championship final game 2.,Jeopardy,"(1, 5)",THE CIVIL WAR,20,"(500,)",False,"This prison camp was designed to hold 10,000, but at one time 33,000 soldiers were incarcerated there",Andersonville,1,0
2650,1996-02-23,1996 College Championship final game 2.,Jeopardy,"(2, 5)",TELEVISION,17,"(500,)",False,"On Tuesday nights ABC advises ""viewer discretion"" before this Steven Bochco cop show",NYPD Blue,1,0
2650,1996-02-23,1996 College Championship final game 2.,Jeopardy,"(3, 5)",BRIDGES,25,"(500,)",False,Bruges in this country derives its name from a bridge built there by the Romans,Belgium,1,1
2650,1996-02-23,1996 College Championship final game 2.,Jeopardy,"(4, 5)",ETIQUETTE,30,"(500,)",False,Serve this expensive sturgeon roe treat in a small bowl inside a larger bowl lined with ice,caviar,1,0
2650,1996-02-23,1996 College Championship final game 2.,Jeopardy,"(5, 5)",BIBLICAL GEOGRAPHY,9,"(500,)",False,"Jesus taught in a synagogue in Capernaum, a city on this ""sea""",Sea of Galilee,1,0
2650,1996-02-23,1996 College Championship final game 2.,Jeopardy,"(6, 5)","COLLEGE CROSSWORD CLUES ""C""",10,"(500,)",False,Degree ceremony           (12),commencement,1,0
2650,1996-02-23,1996 College Championship final game 2.,Double Jeopardy,"(1, 1)",BIOLOGY,1,"(200,)",False,These paired openings of the nasal cavity are also called nares,nostrils,1,0
2650,1996-02-23,1996 College Championship final game 2.,Double Jeopardy,"(2, 1)",ISLANDS,4,"(200,)",False,"The ice cap that covers this largest island has an average thickness of about 5,000 feet",Greenland,1,0
2650,1996-02-23,1996 College Championship final game 2.,Double Jeopardy,"(3, 1)",ART & ARTISTS,13,"(200,)",False,"Riemenschneider sculpted this first biblical couple for a chapel in Wurzburg, Germany",Adam & Eve,1,0
2650,1996-02-23,1996 College Championship final game 2.,Double Jeopardy,"(4, 1)",ORGANIZATIONS,19,"(200,)",False,"This group headquartered in Washington, D.C. was founded in 1888 by 33 explorers & scientists",National Geographic Society,1,0
2650,1996-02-23,1996 College Championship final game 2.,Double Jeopardy,"(5, 1)",WORLD HISTORY,9,"(200,)",False,"Grolier says this great king of Macedonia was the first monarch to be called ""Great""",Alexander the Great,1,0
2650,1996-02-23,1996 College Championship final game 2.,Double Jeopardy,"(6, 1)",PHILOSOPHY,26,"(200,)",False,Moritz Schlick led the group in this Austrian capital that founded the logical positivist school,Vienna,1,0
2650,1996-02-23,1996 College Championship final game 2.,Double Jeopardy,"(1, 2)",BIOLOGY,2,"(400,)",False,"Tetracycline is a broad-spectrum type of this drug, since it's effective against a wide variety of bacteria",antibiotic,1,0
2650,1996-02-23,1996 College Championship final game 2.,Double Jeopardy,"(2, 2)",ISLANDS,5,"(400,)",False,"This largest Japanese island is connected to Hokkaido, Kyushu & Shikoku by bridges & tunnels",Honshu,1,0
2650,1996-02-23,1996 College Championship final game 2.,Double Jeopardy,"(3, 2)",ART & ARTISTS,17,"(400,)",False,He once said he ate the same soup lunch every day for 20 years; that's why he painted soup cans,Andy Warhol,1,0
2650,1996-02-23,1996 College Championship final game 2.,Double Jeopardy,"(4, 2)",ORGANIZATIONS,22,"(400,)",False,The International Red Cross is headquartered in this city,Geneva,1,0
2650,1996-02-23,1996 College Championship final game 2.,Double Jeopardy,"(5, 2)",WORLD HISTORY,10,"(400,)",False,"Searching for wealth & the Fountain of Youth, he landed in what's now Florida April 2, 1513",Ponce de Leon,1,0
2650,1996-02-23,1996 College Championship final game 2.,Double Jeopardy,"(6, 2)",PHILOSOPHY,27,"(400,)",False,"At times this, the study & existence of God, has been considered part of metaphysics",theology,1,1
2650,1996-02-23,1996 College Championship final game 2.,Double Jeopardy,"(1, 3)",BIOLOGY,3,"(600,)",False,This partially decomposed plant material that forms in bogs is the first step in coal formation,peat,1,0
2650,1996-02-23,1996 College Championship final game 2.,Double Jeopardy,"(2, 3)",ISLANDS,6,"(600,)",False,"This Chilean dependency in the Pacific has many statues, but no rivers or streams",Easter Island,1,0
2650,1996-02-23,1996 College Championship final game 2.,Double Jeopardy,"(3, 3)",ART & ARTISTS,18,"(600,)",False,This Dutchman painted landscapes of olive trees & cypresses while at the asylum of St.-Remy,Vincent Van Gogh,1,0
2650,1996-02-23,1996 College Championship final game 2.,Double Jeopardy,"(4, 3)",ORGANIZATIONS,23,"(600,)",False,Volunteers in this U.S. agency established in 1961 live & work in other countries to improve living conditions,the Peace Corps,1,0
2650,1996-02-23,1996 College Championship final game 2.,Double Jeopardy,"(5, 3)",WORLD HISTORY,14,"(600,)",False,This Babylonian is said to have received his code from the sun god Shumash,Hammurabi,1,0
2650,1996-02-23,1996 College Championship final game 2.,Double Jeopardy,"(6, 3)",PHILOSOPHY,28,"(1500,)",True,This branch of philosophy concerned with conduct & character is also called moral philosophy,ethics,1,0
2650,1996-02-23,1996 College Championship final game 2.,Double Jeopardy,"(1, 4)",BIOLOGY,11,"(800,)",False,Parthenogenesis is the development of an individual from an egg that has not undergone this process,fertilization,1,0
2650,1996-02-23,1996 College Championship final game 2.,Double Jeopardy,"(2, 4)",ISLANDS,7,"(800,)",False,This island off Africa's east coast is said to be home to half the world's species of chameleons,Madagascar,1,0
2650,1996-02-23,1996 College Championship final game 2.,Double Jeopardy,"(3, 4)",ART & ARTISTS,20,"(800,)",False,"In 1902 this artist painted ""The Path"" in his own ""Garden of Giverny""",Monet,1,0
2650,1996-02-23,1996 College Championship final game 2.,Double Jeopardy,"(4, 4)",ORGANIZATIONS,24,"(800,)",False,"""Hypertension"" & ""Stroke"" are monthly publications of this association",American Heart Association,1,0
2650,1996-02-23,1996 College Championship final game 2.,Double Jeopardy,"(5, 4)",WORLD HISTORY,15,"(1000,)",True,This Mexican army officer & dictator lost a leg while fighting the French at Veracruz in 1838,Santa Anna,1,0
2650,1996-02-23,1996 College Championship final game 2.,Double Jeopardy,"(6, 4)",PHILOSOPHY,29,"(800,)",False,"The name of this, the belief that pleasure is the highest good of life, comes from Greek for ""pleasure""",hedonism,1,1
2650,1996-02-23,1996 College Championship final game 2.,Double Jeopardy,"(1, 5)",BIOLOGY,12,"(1000,)",False,"Pelagic animals & plants are divided into 2 groups: nekton, which are free swimming, & these, which drift",plankton,1,0
2650,1996-02-23,1996 College Championship final game 2.,Double Jeopardy,"(2, 5)",ISLANDS,8,"(1000,)",False,In 1733 Denmark acquired St. Croix in this island group from France,Virgin Islands,1,0
2650,1996-02-23,1996 College Championship final game 2.,Double Jeopardy,"(3, 5)",ART & ARTISTS,21,"(1000,)",False,"David Siqueiros, Jose Clemente Orozco & most famously this artist led the Mexican muralist movement",Diego Rivera,1,0
2650,1996-02-23,1996 College Championship final game 2.,Double Jeopardy,"(4, 5)",ORGANIZATIONS,25,"(1000,)",False,"This NYC dance company's directors have included Lucia Chase, Kevin McKenzie & Mikhail Baryshnikov",American Ballet Theatre,1,0
2650,1996-02-23,1996 College Championship final game 2.,Double Jeopardy,"(5, 5)",WORLD HISTORY,16,"(1000,)",False,"On April 7, 1831 5-year-old Pedro II became emperor of this South American country",Brazil,1,0
2650,1996-02-23,1996 College Championship final game 2.,Double Jeopardy,"(6, 5)",PHILOSOPHY,30,"(1000,)",False,"The study of beauty is a central concern of this branch of philosophy, the newest branch with its own name",aesthetics,1,0
2650,1996-02-23,1996 College Championship final game 2.,Final Jeopardy,"(1, 1)",20th CENTURY AMERICANS,0,"(5600, 3100, 1400)",False,In 1941 & 1942 he served as a photo-muralist for the Department of the Interior,Ansel Adams,3,0
