epNum,airDate,extra_info,round_name,coord,category,order,value,daily_double,question,answer,correctAttempts,wrongAttempts
2651,1996-02-26,Bob Scarpone game 3.,Jeopardy,"(1, 1)",CONGRESS,1,"(100,)",False,"On April 25, 1789 the Senate elected its first of these officials who open the sessions with prayer",chaplains,0,0
2651,1996-02-26,Bob Scarpone game 3.,Jeopardy,"(2, 1)",WOMEN IN SPORTS,26,"(100,)",False,From 1982 to 1993 only 2 women won the singles at Wimbledon: Martina Navratilova & this German,Steffi Graf,0,0
2651,1996-02-26,Bob Scarpone game 3.,Jeopardy,"(3, 1)",BAVARIA,2,"(100,)",False,"Germany's highest mountain, the 9,720-foot Zugspitze, is in this range",The Alps,0,0
2651,1996-02-26,Bob Scarpone game 3.,Jeopardy,"(4, 1)",AWARDS,9,"(100,)",False,In 1985 this greeting card company won the National Medal of Arts for its contribution to American culture,Hallmark,0,0
2651,1996-02-26,Bob Scarpone game 3.,Jeopardy,"(5, 1)",NATURE,16,"(100,)",False,These members of a pride do most of the hunting & killing,the females (the lionesses),0,0
2651,1996-02-26,Bob Scarpone game 3.,Jeopardy,"(6, 1)","""A"" PLUS",21,"(100,)",False,Some biologists classify the blue-green types of these simple organisms as bacteria,algae,0,0
2651,1996-02-26,Bob Scarpone game 3.,Jeopardy,"(1, 2)",CONGRESS,4,"(200,)",False,Section 7 of the Constitution requires a yea-and-nay vote on the question of overriding one of these,a veto,0,0
2651,1996-02-26,Bob Scarpone game 3.,Jeopardy,"(2, 2)",WOMEN IN SPORTS,27,"(200,)",False,"In the 1976 Olympics, this Romanian received a perfect 10 on the uneven bars",Nadia Comaneci,0,0
2651,1996-02-26,Bob Scarpone game 3.,Jeopardy,"(3, 2)",BAVARIA,3,"(200,)",False,A museum in Schrobenhausen is devoted to this spear vegetable,asparagus,0,0
2651,1996-02-26,Bob Scarpone game 3.,Jeopardy,"(4, 2)",AWARDS,10,"(200,)",False,This Tibetan received the Franklin Delano Roosevelt Freedom Medal in 1994,the Dalai Lama,0,0
2651,1996-02-26,Bob Scarpone game 3.,Jeopardy,"(5, 2)",NATURE,17,"(200,)",False,"On summer nights in Austin, Texas swarms of these mammals emerge from under the Congress Ave. Bridge to feed",bats,0,0
2651,1996-02-26,Bob Scarpone game 3.,Jeopardy,"(6, 2)","""A"" PLUS",22,"(200,)",False,"It precedes mail, sick & mattress",air,0,0
2651,1996-02-26,Bob Scarpone game 3.,Jeopardy,"(1, 3)",CONGRESS,6,"(300,)",False,"From 1836 to 1844 a ""gag rule"" forbade house debate on any bill dealing with the abolition of this",slavery,0,0
2651,1996-02-26,Bob Scarpone game 3.,Jeopardy,"(2, 3)",WOMEN IN SPORTS,28,"(300,)",False,This American runner holds the world record in both the 100-meter & 200-meter sprints,Flo-Jo,0,0
2651,1996-02-26,Bob Scarpone game 3.,Jeopardy,"(3, 3)",BAVARIA,5,"(300,)",False,"It starts in late September & lasts for 2 weeks, during which a few million liters of beer are consumed",Oktoberfest,0,0
2651,1996-02-26,Bob Scarpone game 3.,Jeopardy,"(4, 3)",AWARDS,11,"(300,)",False,"This ""Mood Indigo"" composer was the NAACP's Spingarn Medal winner in 1959",Duke Ellington,0,0
2651,1996-02-26,Bob Scarpone game 3.,Jeopardy,"(5, 3)",NATURE,18,"(300,)",False,"It can pinch, bite & sting its prey anytime, not just between October 23 & November 21",a scorpion,0,0
2651,1996-02-26,Bob Scarpone game 3.,Jeopardy,"(6, 3)","""A"" PLUS",23,"(300,)",False,"A city in southeast Texas, or a famous chipmunk",Alvin,0,0
2651,1996-02-26,Bob Scarpone game 3.,Jeopardy,"(1, 4)",CONGRESS,7,"(400,)",False,In 1970 Congress repealed this resolution authorizing military action in Vietnam,The Gulf of Tonkin Resolution,0,0
2651,1996-02-26,Bob Scarpone game 3.,Jeopardy,"(2, 4)",WOMEN IN SPORTS,29,"(400,)",False,"In 1992 & 1994, she won an Olympic gold medal in the 1,000-meter speed skating event",(Bonnie) Blair,0,0
2651,1996-02-26,Bob Scarpone game 3.,Jeopardy,"(3, 4)",BAVARIA,14,"(400,)",False,This Bavarian city hosted the 1972 Olympics,Munich,0,0
2651,1996-02-26,Bob Scarpone game 3.,Jeopardy,"(4, 4)",AWARDS,12,"(400,)",False,"In 1954 he won an Edgar Allan Poe award for his novel ""The Long Goodbye""",Raymond Chandler,0,0
2651,1996-02-26,Bob Scarpone game 3.,Jeopardy,"(5, 4)",NATURE,19,"(400,)",False,These bivalves stay under the mud by extending their siphons into the water,clams,0,0
2651,1996-02-26,Bob Scarpone game 3.,Jeopardy,"(6, 4)","""A"" PLUS",24,"(400,)",False,It's an automaton that resembles a human being,an android,0,0
2651,1996-02-26,Bob Scarpone game 3.,Jeopardy,"(1, 5)",CONGRESS,8,"(800,)",True,"Dennis Chavez & Octaviano Larrazolo, the first 2 Hispanic senators, represented this state",New Mexico,0,0
2651,1996-02-26,Bob Scarpone game 3.,Jeopardy,"(2, 5)",WOMEN IN SPORTS,30,"(500,)",False,"Women in this sport who won the Sullivan Award include Debbie Meyer, Tracy Caulkins & Janet Evans",Swimming,0,0
2651,1996-02-26,Bob Scarpone game 3.,Jeopardy,"(3, 5)",BAVARIA,15,"(500,)",False,Famous painters born in Bavaria include this elder & younger pair with the same name,(Hans) Holbein,0,0
2651,1996-02-26,Bob Scarpone game 3.,Jeopardy,"(4, 5)",AWARDS,13,"(500,)",False,In 1965 this oral polio vaccine developer was given an Albert Lasker Medical Research Award,(Albert) Sabin,0,0
2651,1996-02-26,Bob Scarpone game 3.,Jeopardy,"(5, 5)",NATURE,20,"(500,)",False,"The Greeks called licorice glykyrrhiza, ""sweet"" this, the part of the plant it came from",sweet root,0,0
2651,1996-02-26,Bob Scarpone game 3.,Jeopardy,"(6, 5)","""A"" PLUS",25,"(500,)",False,"It's been said this California city stands for ""everything from A to Z in the USA""",Azusa,0,0
2651,1996-02-26,Bob Scarpone game 3.,Double Jeopardy,"(1, 1)",HISTORIC NAMES,1,"(200,)",False,In 1914 this future Italian dictator was expelled from the Socialist Party,Mussolini,0,0
2651,1996-02-26,Bob Scarpone game 3.,Double Jeopardy,"(2, 1)",SHAKESPEARE,11,"(200,)",False,"Dying at the hands of Romeo, Paris asks to be put in this woman's tomb",Juliet,0,0
2651,1996-02-26,Bob Scarpone game 3.,Double Jeopardy,"(3, 1)",INTERNATIONAL CHEESE,26,"(200,)",False,This country's Manchego cheese is made from the milk of manchego sheep in La Mancha,Spain,0,0
2651,1996-02-26,Bob Scarpone game 3.,Double Jeopardy,"(4, 1)",COMPOSERS,6,"(200,)",False,"Sadly, he died of a brain tumor less than 2 years after the premiere of his opera ""Porgy and Bess""",George Gershwin,0,0
2651,1996-02-26,Bob Scarpone game 3.,Double Jeopardy,"(5, 1)",MOVIES,12,"(200,)",False,"""Conan the Destroyer"" was a 1984 sequel to this adventure film full of muscle & mayhem",Conan the Barbarian,0,0
2651,1996-02-26,Bob Scarpone game 3.,Double Jeopardy,"(6, 1)",AMERICAN HODGEPODGE,21,"(200,)",False,In the 1700s the poets known as the Hartford Wits were also known as this state's Wits,Connecticut,0,0
2651,1996-02-26,Bob Scarpone game 3.,Double Jeopardy,"(1, 2)",HISTORIC NAMES,2,"(400,)",False,This second king of Egypt's fourth dynasty built one of the 7 Wonders of the Ancient World,Cheops,0,0
2651,1996-02-26,Bob Scarpone game 3.,Double Jeopardy,"(2, 2)",SHAKESPEARE,17,"(400,)",False,After Caesar's murder he shakes the bloody hands of all the conspirators,Mark Antony,0,0
2651,1996-02-26,Bob Scarpone game 3.,Double Jeopardy,"(3, 2)",INTERNATIONAL CHEESE,27,"(400,)",False,This country's Coulommiers Cheese is quite similar to its Brie de Meaux,France,0,0
2651,1996-02-26,Bob Scarpone game 3.,Double Jeopardy,"(4, 2)",COMPOSERS,7,"(400,)",False,"""The American Maid"" is a 1913 operetta by this ""March King""",(John Philip) Sousa,0,0
2651,1996-02-26,Bob Scarpone game 3.,Double Jeopardy,"(5, 2)",MOVIES,13,"(400,)",False,"Robert Evans was originally set to co-star with Jack Nicholson in ""The Two Jakes"", a sequel to this 1974 film",Chinatown,0,0
2651,1996-02-26,Bob Scarpone game 3.,Double Jeopardy,"(6, 2)",AMERICAN HODGEPODGE,22,"(400,)",False,The first successful U.S. car powered by this was built by the Duryea Brothers in 1893,Gasoline,0,0
2651,1996-02-26,Bob Scarpone game 3.,Double Jeopardy,"(1, 3)",HISTORIC NAMES,3,"(1000,)",True,He was the last Dutch governor of New Netherland,Peter Stuyvesant,0,0
2651,1996-02-26,Bob Scarpone game 3.,Double Jeopardy,"(2, 3)",SHAKESPEARE,18,"(600,)",False,"1st line of the soliloquy that ends, ""The fair Ophelia--nymph, in thy orisons be all my sins remembered""","""To be or not to be""",0,0
2651,1996-02-26,Bob Scarpone game 3.,Double Jeopardy,"(3, 3)",INTERNATIONAL CHEESE,28,"(600,)",False,"Sapsago, which is flavored with clover, has been made in this Alpine country for hundreds of years",Switzerland,0,0
2651,1996-02-26,Bob Scarpone game 3.,Double Jeopardy,"(4, 3)",COMPOSERS,8,"(600,)",False,This great German composer had 20 children; 4 of them became prominent composers,Bach,0,0
2651,1996-02-26,Bob Scarpone game 3.,Double Jeopardy,"(5, 3)",MOVIES,14,"(600,)",False,"Lesley Ann Warren starred in ""Clue"" & Alicia Silverstone was in this comedy whose title is 4 letters longer",Clueless,0,0
2651,1996-02-26,Bob Scarpone game 3.,Double Jeopardy,"(6, 3)",AMERICAN HODGEPODGE,23,"(600,)",False,A story says this keelboatman scared Davy Crockett's wife by dressing up in an alligator skin,Mike Fink,0,0
2651,1996-02-26,Bob Scarpone game 3.,Double Jeopardy,"(1, 4)",HISTORIC NAMES,4,"(800,)",False,"Elected president of Mexico in 1861, he had earlier presided over the Supreme Court",Benito Juarez,0,0
2651,1996-02-26,Bob Scarpone game 3.,Double Jeopardy,"(2, 4)",SHAKESPEARE,19,"(1000,)",True,"Gremio asks him, ""Will you woo this wild-cat?""",Petruchio,0,0
2651,1996-02-26,Bob Scarpone game 3.,Double Jeopardy,"(3, 4)",INTERNATIONAL CHEESE,29,"(800,)",False,"Gjetost, a brown cheese from this Scandinavian country, is made from the whey of cow's milk & goat's milk",Norway,0,0
2651,1996-02-26,Bob Scarpone game 3.,Double Jeopardy,"(4, 4)",COMPOSERS,9,"(800,)",False,"This ""Firebird"" composer's ballet score ""Pulcinella"" was based on music by an 18th century composer",Stravinsky,0,0
2651,1996-02-26,Bob Scarpone game 3.,Double Jeopardy,"(5, 4)",MOVIES,15,"(800,)",False,"Film in which Bogie said, ""You'll excuse me, gentlemen. Your business is politics. Mine is running a saloon""",Casablanca,0,0
2651,1996-02-26,Bob Scarpone game 3.,Double Jeopardy,"(6, 4)",AMERICAN HODGEPODGE,24,"(800,)",False,"The name of these Native American people may mean ""true Ute"" or ""water Ute""",Paiute,0,0
2651,1996-02-26,Bob Scarpone game 3.,Double Jeopardy,"(1, 5)",HISTORIC NAMES,5,"(1000,)",False,"This deranged Roman was known as ""The Horse Emperor""",Caligula,0,0
2651,1996-02-26,Bob Scarpone game 3.,Double Jeopardy,"(2, 5)",SHAKESPEARE,20,"(1000,)",False,"Macbeth tells 2 murderers ""to leave no rubs nor botches"" in killing this man who returns as a ghost",Banquo,0,0
2651,1996-02-26,Bob Scarpone game 3.,Double Jeopardy,"(3, 5)",INTERNATIONAL CHEESE,30,"(1000,)",False,The celebrated pungent odor of this Belgian cheese becomes even stronger as it ripens,Limburger,0,0
2651,1996-02-26,Bob Scarpone game 3.,Double Jeopardy,"(4, 5)",COMPOSERS,10,"(1000,)",False,"It was the native country of composer Zoltan Kodaly who wrote the 1926 opera ""Hary Janos""",Hungary,0,0
2651,1996-02-26,Bob Scarpone game 3.,Double Jeopardy,"(5, 5)",MOVIES,16,"(1000,)",False,Tommy Lee Jones played Loretta Lynn's husband Mooney in this movie bio that won Sissy Spacek an Oscar,Coal Miner's Daughter,0,0
2651,1996-02-26,Bob Scarpone game 3.,Double Jeopardy,"(6, 5)",AMERICAN HODGEPODGE,25,"(1000,)",False,"The International Peace Garden lies on this ""Peace Garden State""'s border with Manitoba",North Dakota,0,0
2651,1996-02-26,Bob Scarpone game 3.,Final Jeopardy,"(1, 1)",FICTIONAL CHARACTERS,0,(),False,"Olga Ivinskaya, who passed away in Moscow in 1995, was the inspiration for this character",Lara,0,0
