epNum,airDate,extra_info,round_name,coord,category,order,value,daily_double,question,answer,correctAttempts,wrongAttempts
2727,1996-06-11,,Jeopardy,"(1, 1)",THE 1910s,1,"(100,)",False,"On Jan. 5, 1914 this automaker announced a $5 per day minimum wage & an 8-hour day",(Henry) Ford,1,0
2727,1996-06-11,,Jeopardy,"(2, 1)",SIMIAN CINEMA,2,"(100,)",False,"The last line in this 1933 film is ""Oh, no.  It wasn't the airplanes.  It was beauty killed the beast.""",King Kong,1,0
2727,1996-06-11,,Jeopardy,"(3, 1)",INVENTORS,16,"(100,)",False,By 1877 Otto Lilienthal had invented one of these engineless airplanes with birdlike wings,glider,1,0
2727,1996-06-11,,Jeopardy,"(4, 1)",GEMS,7,"(100,)",False,Morganite is a pink or rose-colored gem named for this American financier,J.P. Morgan,1,0
2727,1996-06-11,,Jeopardy,"(5, 1)",STATE MOTTOES,26,"(100,)",False,"The shortest mottoes are Washington's ""Alki"", meaning ""By and By"" & this smallest state's ""Hope""",Rhode Island,1,0
2727,1996-06-11,,Jeopardy,"(6, 1)",SEA____,21,"(100,)",False,Seashell tongue twister business site,by the seashore,1,0
2727,1996-06-11,,Jeopardy,"(1, 2)",THE 1910s,8,"(200,)",False,In 1913 King Constantine declared the union of Crete with this country,Greece,1,0
2727,1996-06-11,,Jeopardy,"(2, 2)",SIMIAN CINEMA,3,"(200,)",False,"A gorilla named Amy is featured in this 1995 movie, filmed in part near our ""Jeopardy!"" sound stage",Congo,1,0
2727,1996-06-11,,Jeopardy,"(3, 2)",INVENTORS,17,"(200,)",False,"This man, a goldsmith by trade, invented printing from movable type in Europe",(Johannes)  Gutenberg,1,0
2727,1996-06-11,,Jeopardy,"(4, 2)",GEMS,12,"(200,)",False,"The Hope, a famous Baroque one of these mollusk gems, is 2 inches long & weighs several ounces",pearl,1,0
2727,1996-06-11,,Jeopardy,"(5, 2)",STATE MOTTOES,27,"(200,)",False,"""Regnat Populus"", ""The People Rule"", in this land of opportunity",Arkansas,1,0
2727,1996-06-11,,Jeopardy,"(6, 2)",SEA____,22,"(200,)",False,Altitude is measured from it,sea level,1,0
2727,1996-06-11,,Jeopardy,"(1, 3)",THE 1910s,9,"(300,)",False,"On March 1, 1919 a coalition of leaders declared Korea independent of this nation",Japan,1,0
2727,1996-06-11,,Jeopardy,"(2, 3)",SIMIAN CINEMA,4,"(300,)",False,"Some of the flying monkeys in this 1939 classic were actors in costumes & some were 6"" rubber miniatures",The Wizard of Oz,1,0
2727,1996-06-11,,Jeopardy,"(3, 3)",INVENTORS,18,"(300,)",False,Herman Hollerith invented a system of encoding data on cards by means of these,holes,1,0
2727,1996-06-11,,Jeopardy,"(4, 3)",GEMS,13,"(300,)",False,"The ""blazing"" name of these opals is misleading; many do not give off brilliant flashes of color",fire opals,1,0
2727,1996-06-11,,Jeopardy,"(5, 3)",STATE MOTTOES,28,"(300,)",False,"Complete's Ohio's motto, ""With God, All Things are...""",possible,1,0
2727,1996-06-11,,Jeopardy,"(6, 3)",SEA____,23,"(300,)",False,Cecil,the seasick sea serpent,1,1
2727,1996-06-11,,Jeopardy,"(1, 4)",THE 1910s,10,"(400,)",False,Some Serbian officials provided support for Gavrilo Princip's June 1914 assassination of this archduke,(Franz) Ferdinand,1,0
2727,1996-06-11,,Jeopardy,"(2, 4)",SIMIAN CINEMA,5,"(400,)",False,"Sigourney Weaver was nominated for a 1988 Oscar for playing this primatologist in ""Gorillas in the Mist""",Dian Fossey,1,0
2727,1996-06-11,,Jeopardy,"(3, 4)",INVENTORS,19,"(400,)",False,"As a Harvard freshman, this photographic inventor became fascinated by polarized light",(Edwin) Land,1,1
2727,1996-06-11,,Jeopardy,"(4, 4)",GEMS,14,"(400,)",False,In 1830 these green gems were discovered in mica schists in Russia's Ural Mountains,emeralds,1,0
2727,1996-06-11,,Jeopardy,"(5, 4)",STATE MOTTOES,29,"(400,)",False,Heavenly body mentioned in the mottoes of Kansas & Minnesota,star,0,3
2727,1996-06-11,,Jeopardy,"(6, 4)",SEA____,24,"(400,)",False,Some marine types of algae,seaweed,1,0
2727,1996-06-11,,Jeopardy,"(1, 5)",THE 1910s,11,"(500,)",True,The United States took over this island group from Denmark in 1917,the Virgin Islands,1,0
2727,1996-06-11,,Jeopardy,"(2, 5)",SIMIAN CINEMA,6,"(500,)",False,"In a 1949 film Terry Moore played the piano while this ""mighty"" ape held her over his head",Mighty Joe Young,1,0
2727,1996-06-11,,Jeopardy,"(3, 5)",INVENTORS,20,"(500,)",False,His most important invention kept an elevator car from falling even if its cable broke,(Elisha) Otis,1,0
2727,1996-06-11,,Jeopardy,"(4, 5)",GEMS,15,"(500,)",False,"Often a shade of orange, spessartite is a variety of this reddish-brown gem",garnet,0,3
2727,1996-06-11,,Jeopardy,"(5, 5)",STATE MOTTOES,30,"(500,)",False,"South Carolina's ""Dum Spiro Spero"" translates to ""While I"" do this ""I Hope""",breathe,1,0
2727,1996-06-11,,Jeopardy,"(6, 5)",SEA____,25,"(500,)",False,Nereids,sea nymphs,1,0
2727,1996-06-11,,Double Jeopardy,"(2, 1)",WOMEN AUTHORS,1,"(200,)",False,"Of Joyce Cary, Joyce Kilmer or Joyce Carol Oates, the one that fits the category",Joyce Carol Oates,1,0
2727,1996-06-11,,Double Jeopardy,"(3, 1)",WORLD GEOGRAPHY,21,"(200,)",False,"It's the most modern city in Peru, as well as the largest",Lima,1,0
2727,1996-06-11,,Double Jeopardy,"(4, 1)",GANGSTERS,12,"(200,)",False,"Gangster Louis Amberg was just ""Pretty"" while Charles Floyd was nicknamed this","""Pretty Boy""",1,0
2727,1996-06-11,,Double Jeopardy,"(5, 1)",RUSSIAN HISTORY,6,"(200,)",False,Osip Bovet redesigned this square near the Kremlin after most of it was destroyed in an 1812 fire,Red Square,1,0
2727,1996-06-11,,Double Jeopardy,"(6, 1)",BROADWAY LYRICS,7,"(200,)",False,"In ""Oh, What a Beautiful Mornin'"", this ""is as high as an elephant's eye""",the corn,1,0
2727,1996-06-11,,Double Jeopardy,"(2, 2)",WOMEN AUTHORS,2,"(400,)",False,"Nora Ephron wrote the searing novel ""Heartburn"" after her divorce from this Washington Post reporter",Carl Bernstein,1,0
2727,1996-06-11,,Double Jeopardy,"(3, 2)",WORLD GEOGRAPHY,22,"(400,)",False,"Astrakhan is situated on several islands in the delta of this river, 60 miles from the Caspian Sea",the Volga,0,3
2727,1996-06-11,,Double Jeopardy,"(4, 2)",GANGSTERS,13,"(400,)",False,This showman got a plaster cast of condemned murderer Albert Hicks for his American museum,P.T. Barnum,1,0
2727,1996-06-11,,Double Jeopardy,"(5, 2)",RUSSIAN HISTORY,8,"(400,)",False,"In 1799 Alexsandr Baranov, first governor of this territory, founded Sitka",Alaska,1,0
2727,1996-06-11,,Double Jeopardy,"(6, 2)",BROADWAY LYRICS,16,"(400,)",False,"According to a song from ""Annie"", ""You're Never Fully Dressed Without"" one of these",a Smile,1,0
2727,1996-06-11,,Double Jeopardy,"(1, 3)",DISASTERS,26,"(600,)",False,The 1986 disaster at this plant released over 100 million curies of radionuclides into the atmosphere,Chernobyl,1,1
2727,1996-06-11,,Double Jeopardy,"(2, 3)",WOMEN AUTHORS,3,"(600,)",False,"Queen of British romance novelists who wrote ""The Wicked Marquis"" & ""The Impetuous Duchess""",Barbara Cartland,1,0
2727,1996-06-11,,Double Jeopardy,"(3, 3)",WORLD GEOGRAPHY,23,"(600,)",False,This sea forms Pakistan's southern border,Arabian Sea,1,1
2727,1996-06-11,,Double Jeopardy,"(4, 3)",GANGSTERS,14,"(600,)",False,One of the two gangsters who led what was known as the Bug & Meyer Gang,Bugsy Siegel,1,0
2727,1996-06-11,,Double Jeopardy,"(5, 3)",RUSSIAN HISTORY,9,"(600,)",False,A 1649 code forbade owners to kill these peasants generally treated as chattel,serfs,1,0
2727,1996-06-11,,Double Jeopardy,"(6, 3)",BROADWAY LYRICS,17,"(600,)",False,"A song from ""Finian's Rainbow"" asks, ""How are Things in"" this place? Is that little brook still leaping there?""",Glocca Morra,1,0
2727,1996-06-11,,Double Jeopardy,"(1, 4)",DISASTERS,27,"(800,)",False,This federal disaster agency was created by an executive reorganization plan in 1978,FEMA,1,0
2727,1996-06-11,,Double Jeopardy,"(2, 4)",WOMEN AUTHORS,4,"(800,)",False,"After writing a book about Marilyn Monroe, this feminist established the Marilyn Monroe Children's Fund",Gloria Steinem,1,0
2727,1996-06-11,,Double Jeopardy,"(3, 4)",WORLD GEOGRAPHY,24,"(800,)",False,Bissau is this west African country's chief port as well as its capital,Guinea-Bissau,1,0
2727,1996-06-11,,Double Jeopardy,"(4, 4)",GANGSTERS,15,"(800,)",False,"""Trigger"" Burke was hired to silence ""Specs"" O'Keefe, one of the gang involved in this 1950 Boston heist",the Brinks Robbery,1,1
2727,1996-06-11,,Double Jeopardy,"(5, 4)",RUSSIAN HISTORY,10,"(800,)",False,Vladimir Nemirovich-Danchenko & this actor/producer founded the Moscow Art Theatre in 1898,(Constantin) Stanislavski,1,0
2727,1996-06-11,,Double Jeopardy,"(6, 4)",BROADWAY LYRICS,19,"(800,)",False,"Flower referred to in the lyric ""Blossom of snow, may you bloom and grow, bloom and grow forever""",edelweiss,1,0
2727,1996-06-11,,Double Jeopardy,"(1, 5)",DISASTERS,28,"(1000,)",False,A 1988 disaster killed all 259 people aboard Pan Am 103 & 11 in this Scottish town,Lockerbie,1,0
2727,1996-06-11,,Double Jeopardy,"(2, 5)",WOMEN AUTHORS,5,"(1000,)",False,"This playwright called her first book of memoirs ""An Unfinished Woman"" & her last ""Maybe""",Lillian Hellman,1,0
2727,1996-06-11,,Double Jeopardy,"(3, 5)",WORLD GEOGRAPHY,25,"(2000,)",True,The Tonle Sap & Bassac Rivers join this major river at Phnom Penh,the Mekong,1,0
2727,1996-06-11,,Double Jeopardy,"(4, 5)",GANGSTERS,18,"(1000,)",False,"Deported to Italy, Lucky Luciano slipped back to this Caribbean island to run his U.S. operations",Cuba,1,0
2727,1996-06-11,,Double Jeopardy,"(5, 5)",RUSSIAN HISTORY,11,"(1500,)",True,Lithuania passed to Russia at the third partition of this country in 1795,Poland,1,0
2727,1996-06-11,,Double Jeopardy,"(6, 5)",BROADWAY LYRICS,20,"(1000,)",False,"In an Anthony Newley-Leslie Bricusse song, this title question precedes ""who never fell in love""","""What Kind of Fool Am I?""",1,0
2727,1996-06-11,,Final Jeopardy,"(1, 1)",ADVENTURERS,0,"(5100, 8200, 7601)",False,This American adventurer & aviator discovered the world's highest waterfall in 1935,Jim Angel,0,3
