epNum,airDate,extra_info,round_name,coord,category,order,value,daily_double,question,answer,correctAttempts,wrongAttempts
2843,1997-01-01,Claudia Perry game 1.,Jeopardy,"(1, 1)",NOTABLE WOMEN,12,"(100,)",False,This first lady & her husband were distant cousins; her father was Teddy Roosevelt's younger brother,Eleanor Roosevelt,1,0
2843,1997-01-01,Claudia Perry game 1.,Jeopardy,"(2, 1)",MYTHOLOGY,10,"(100,)",False,"The name of these creatures means ""Round-Eyed""; they each had only one round eye",Cyclops,1,0
2843,1997-01-01,Claudia Perry game 1.,Jeopardy,"(3, 1)",BANDS OF THE '80S,2,"(100,)",False,Icicle Works formed in this city more than 20 years after The Beatles,Liverpool,1,0
2843,1997-01-01,Claudia Perry game 1.,Jeopardy,"(4, 1)",THE KOREAN WAR,26,"(100,)",False,"8,170 Americans who served in the Korean War are still listed as MIA, which stands for this",Missing in Action,1,0
2843,1997-01-01,Claudia Perry game 1.,Jeopardy,"(5, 1)",GUINNESS RECORDS,21,"(100,)",False,"We cannot tell a lie:  this president made the shortest inaugural speech, only 90 seconds",George Washington,1,0
2843,1997-01-01,Claudia Perry game 1.,Jeopardy,"(6, 1)",COMMON BONDS,1,"(100,)",False,"Joy,broom,pogo",sticks,1,0
2843,1997-01-01,Claudia Perry game 1.,Jeopardy,"(1, 2)",NOTABLE WOMEN,13,"(200,)",False,"Ding Ling, who wrote about independent, brave women, was one of this country's most popular authors",China,1,0
2843,1997-01-01,Claudia Perry game 1.,Jeopardy,"(2, 2)",MYTHOLOGY,15,"(200,)",False,"In Slavic myth, Svarozic, the god of fire, is the brother of Dazhbog, god of this heavenly body",sun,1,0
2843,1997-01-01,Claudia Perry game 1.,Jeopardy,"(3, 2)",BANDS OF THE '80S,5,"(200,)",False,This group got its name by combining the names of 2 bands:  Hollywood Rose & L.A. Guns,Guns N\' Roses,1,0
2843,1997-01-01,Claudia Perry game 1.,Jeopardy,"(4, 2)",THE KOREAN WAR,27,"(200,)",False,One of the war's innovations was the use of these aircraft for observation & for evacuation of the wounded,helicopters,1,0
2843,1997-01-01,Claudia Perry game 1.,Jeopardy,"(5, 2)",GUINNESS RECORDS,22,"(200,)",False,"Rosie the Ribiter, one of these amimals, leaped 21' 5 3/4"" at the Calaveras County Jumping Jubilee in 1986",frog,1,0
2843,1997-01-01,Claudia Perry game 1.,Jeopardy,"(6, 2)",COMMON BONDS,3,"(200,)",False,"Pink,cow,Freudian",slips,1,0
2843,1997-01-01,Claudia Perry game 1.,Jeopardy,"(1, 3)",NOTABLE WOMEN,14,"(300,)",False,Eva Crane became interested in apiculture when she received a swarm of these as a wedding present,bees,1,0
2843,1997-01-01,Claudia Perry game 1.,Jeopardy,"(2, 3)",MYTHOLOGY,16,"(300,)",False,"During the twilight of the gods, Odin is destined to be eaten by Fenris, one of these lupine animals",wolf,1,0
2843,1997-01-01,Claudia Perry game 1.,Jeopardy,"(3, 3)",BANDS OF THE '80S,6,"(300,)",False,This Wham! singer's original name was Georgios Kyriacos Panayiotou,George Michael,1,0
2843,1997-01-01,Claudia Perry game 1.,Jeopardy,"(4, 3)",THE KOREAN WAR,28,"(300,)",False,These medical units located near the front lines were immortalized in a movie & a TV series,M*A*S*H units,1,0
2843,1997-01-01,Claudia Perry game 1.,Jeopardy,"(5, 3)",GUINNESS RECORDS,23,"(300,)",False,"Harry Drake can say, ""I shot"" one of these ""Into the air; it fell to Earth 2,047 yards & 2 inches away""",arrow,1,0
2843,1997-01-01,Claudia Perry game 1.,Jeopardy,"(6, 3)",COMMON BONDS,4,"(300,)",False,"Blossom,Free State,pekoe tea",orange,1,0
2843,1997-01-01,Claudia Perry game 1.,Jeopardy,"(1, 4)",NOTABLE WOMEN,19,"(400,)",False,"Grace Darling & her father, the keeper of one of these, saved 9 people from drowning in an 1838 shipwreck",lighthouse,1,0
2843,1997-01-01,Claudia Perry game 1.,Jeopardy,"(2, 4)",MYTHOLOGY,17,"(400,)",False,A July 7 festival honoring this supreme Roman goddess featured a sham fight by maidservants,Juno,1,0
2843,1997-01-01,Claudia Perry game 1.,Jeopardy,"(3, 4)",BANDS OF THE '80S,7,"(400,)",False,"The Proclaimers hit the U.S. charts when ""I'm Gonna Be (500 Miles)"" was featured in this Johnny Depp film",Benny and Joon,1,0
2843,1997-01-01,Claudia Perry game 1.,Jeopardy,"(4, 4)",THE KOREAN WAR,29,"(400,)",False,131 of these highest U.S. military awards for battlefield bravery were awarded in the Korean War,Congressional Medal of Honor,1,0
2843,1997-01-01,Claudia Perry game 1.,Jeopardy,"(5, 4)",GUINNESS RECORDS,24,"(400,)",False,"Barber Denny Rowe did this to 1,994 men in 60 minutes, drawing blood only 4 times",shaved them,1,0
2843,1997-01-01,Claudia Perry game 1.,Jeopardy,"(6, 4)",COMMON BONDS,9,"(400,)",False,"Book,inch,glow",worms,1,0
2843,1997-01-01,Claudia Perry game 1.,Jeopardy,"(1, 5)",NOTABLE WOMEN,20,"(500,)",False,"It was the profession of Mrs. Siddons, the subject of one of Sir Joshua Reynolds' finest portraits",actress (Sarah Siddons),1,0
2843,1997-01-01,Claudia Perry game 1.,Jeopardy,"(2, 5)",MYTHOLOGY,18,"(500,)",False,"Fearing their vengeful wrath, the Greeks called them Eumenides, which means ""The Kindly Ones""",Furies,1,0
2843,1997-01-01,Claudia Perry game 1.,Jeopardy,"(3, 5)",BANDS OF THE '80S,8,"(500,)",False,Bobby Brown left this group in 1986 & was replaced by Johnny Gill,New Edition,1,0
2843,1997-01-01,Claudia Perry game 1.,Jeopardy,"(4, 5)",THE KOREAN WAR,30,"(1000,)",True,The amphibious invasion of this port was officially designated Operation Chromite,Inchon,1,0
2843,1997-01-01,Claudia Perry game 1.,Jeopardy,"(5, 5)",GUINNESS RECORDS,25,"(500,)",False,"Bill McDaniel accumulated 10,453 of these accessories; he probably got a lot of them on Father's Day",ties,1,0
2843,1997-01-01,Claudia Perry game 1.,Jeopardy,"(6, 5)",COMMON BONDS,11,"(500,)",False,"Spoon,dollar,Buffalo",bills,1,0
2843,1997-01-01,Claudia Perry game 1.,Double Jeopardy,"(1, 1)",THEY ALSO RAN,2,"(200,)",False,James G. Birney's 1844 Liberty Party was against this practice,slavery,1,0
2843,1997-01-01,Claudia Perry game 1.,Double Jeopardy,"(2, 1)",PLAYS & PLAYWRIGHTS,1,"(200,)",False,"The 1991 Tony Award for best play went to Neil Simon's ""Lost In"" this city",Yonkers,1,0
2843,1997-01-01,Claudia Perry game 1.,Double Jeopardy,"(3, 1)",COUNTRIES OF THE WORLD,3,"(200,)",False,This country forms the northernmost part of the United Kingdom,Scotland,1,0
2843,1997-01-01,Claudia Perry game 1.,Double Jeopardy,"(4, 1)",FOREST PRODUCTS,21,"(200,)",False,"Ecuador is the largest producer of this light wood whose name is Spanish for ""raft""",balsa,1,0
2843,1997-01-01,Claudia Perry game 1.,Double Jeopardy,"(5, 1)",PEOPLE,16,"(200,)",False,"This actor's brother-in-law Robert Shriver co-executive-produced his 1994 film ""True Lies""",Arnold Schwarzenegger,1,0
2843,1997-01-01,Claudia Perry game 1.,Double Jeopardy,"(6, 1)",SPEAKING HINDI,26,"(200,)",False,It's the Hindu prince next up in rank from a rajah,maharajah,0,3
2843,1997-01-01,Claudia Perry game 1.,Double Jeopardy,"(1, 2)",THEY ALSO RAN,12,"(400,)",False,This anti-liquor party that goes back to 1869 ran Earl Dodge for president in 1992,Prohibition Party,0,3
2843,1997-01-01,Claudia Perry game 1.,Double Jeopardy,"(2, 2)",PLAYS & PLAYWRIGHTS,4,"(400,)",False,"It was Edward Albee's first full-length play, & his most famous",Who\'s Afraid of Virginia Woolf?,1,0
2843,1997-01-01,Claudia Perry game 1.,Double Jeopardy,"(3, 2)",COUNTRIES OF THE WORLD,8,"(400,)",False,The Suez Canal divides the Asian & African portions of this country,Egypt,1,0
2843,1997-01-01,Claudia Perry game 1.,Double Jeopardy,"(4, 2)",FOREST PRODUCTS,22,"(400,)",False,This wood used for baseball bats & umbrella handles shares its name with the residue left from burning it,ash,1,0
2843,1997-01-01,Claudia Perry game 1.,Double Jeopardy,"(5, 2)",PEOPLE,17,"(400,)",False,"Elected governor of Arkansas in 1978, he was defeated for reelection but later won 4 consecutive terms",Bill Clinton,1,0
2843,1997-01-01,Claudia Perry game 1.,Double Jeopardy,"(6, 2)",SPEAKING HINDI,27,"(400,)",False,Physical & mental exercise system promoted by Lilias Folan on PBS,yoga,1,0
2843,1997-01-01,Claudia Perry game 1.,Double Jeopardy,"(1, 3)",THEY ALSO RAN,13,"(600,)",False,He was the 1968 presidential candidate of the American Independent Party,George Wallace,1,1
2843,1997-01-01,Claudia Perry game 1.,Double Jeopardy,"(2, 3)",PLAYS & PLAYWRIGHTS,5,"(600,)",False,"In an absurdist play by Ionesco, the inhabitants of a small town are transformed into these animals",rhinoceroses,1,0
2843,1997-01-01,Claudia Perry game 1.,Double Jeopardy,"(3, 3)",COUNTRIES OF THE WORLD,9,"(600,)",False,"The name of this country means ""Bengal Nation""",Bangladesh,1,0
2843,1997-01-01,Claudia Perry game 1.,Double Jeopardy,"(4, 3)",FOREST PRODUCTS,23,"(1000,)",True,Pulp made from the Sitka variety of this tree makes good newsprint because of its whiteness,spruce,0,1
2843,1997-01-01,Claudia Perry game 1.,Double Jeopardy,"(5, 3)",PEOPLE,18,"(600,)",False,"He skated a victory lap at the '94 Olympics holding his baby daughter Jane, named for his late sister",Dan Jansen,1,2
2843,1997-01-01,Claudia Perry game 1.,Double Jeopardy,"(6, 3)",SPEAKING HINDI,28,"(600,)",False,This bluish-black bird with a yellow beak is known for its mimicry of human speech,mynah bird,0,3
2843,1997-01-01,Claudia Perry game 1.,Double Jeopardy,"(1, 4)",THEY ALSO RAN,14,"(800,)",False,The Progressive Party ran this former FDR vice president in 1948,Henry Wallace,1,0
2843,1997-01-01,Claudia Perry game 1.,Double Jeopardy,"(2, 4)",PLAYS & PLAYWRIGHTS,6,"(800,)",False,"His play ""Bus Stop"" was revived on Broadway in 1996",William Inge,1,0
2843,1997-01-01,Claudia Perry game 1.,Double Jeopardy,"(3, 4)",COUNTRIES OF THE WORLD,10,"(800,)",False,"In area & population, Bremen is this country's smallest state",Germany,1,0
2843,1997-01-01,Claudia Perry game 1.,Double Jeopardy,"(4, 4)",FOREST PRODUCTS,24,"(800,)",False,The bark of the paper species of this tree was once used for canoes; its wood is now used for toothpicks,birch,1,0
2843,1997-01-01,Claudia Perry game 1.,Double Jeopardy,"(5, 4)",PEOPLE,19,"(800,)",False,"This novelist made a music video of his own song ""The Madison County Waltz""; his wife played Francesca in it",Robert James Waller,1,0
2843,1997-01-01,Claudia Perry game 1.,Double Jeopardy,"(6, 4)",SPEAKING HINDI,29,"(800,)",False,It's a cylindrical clay oven used for baking bread & roasting meat,tandoor,1,0
2843,1997-01-01,Claudia Perry game 1.,Double Jeopardy,"(1, 5)",THEY ALSO RAN,15,"(1000,)",False,"While governor of South Carolina in 1948, he ran for president as a Dixiecrat",Strom Thurmond,1,0
2843,1997-01-01,Claudia Perry game 1.,Double Jeopardy,"(2, 5)",PLAYS & PLAYWRIGHTS,7,"(1000,)",False,"He described his ""Miss Julie"" as the first naturalistic play in Scandinavian literature",August Strindberg,1,1
2843,1997-01-01,Claudia Perry game 1.,Double Jeopardy,"(3, 5)",COUNTRIES OF THE WORLD,11,"(1800,)",True,Skanderbeg Square in Tirane is named for this country's national hero,Albania,0,1
2843,1997-01-01,Claudia Perry game 1.,Double Jeopardy,"(4, 5)",FOREST PRODUCTS,25,"(1000,)",False,Brandy & sherry are traditionally stored in barrels made of this wood,oak,1,0
2843,1997-01-01,Claudia Perry game 1.,Double Jeopardy,"(5, 5)",PEOPLE,20,"(1000,)",False,"This little girl born March 23, 1990 is the younger sister of Princess Beatrice of York",Eugenie,1,0
2843,1997-01-01,Claudia Perry game 1.,Double Jeopardy,"(6, 5)",SPEAKING HINDI,30,"(1000,)",False,It's clarified butter used in Indian cooking,ghee,1,0
2843,1997-01-01,Claudia Perry game 1.,Final Jeopardy,"(1, 1)",AUTHORS,0,"(1000, 5000, 801)",False,"In 1996, 7 years after giving up law, he returned to a Mississippi courtroom & won a case for an old client",John Grisham,2,1
