epNum,airDate,extra_info,round_name,coord,category,order,value,daily_double,question,answer,correctAttempts,wrongAttempts
2851,1997-01-13,Paul Gutowski game 2.,Jeopardy,"(1, 1)",THE CONTINENTS,1,"(100,)",False,The Central Shield of this continent is a plateau that sinks toward Hudson Bay at its center,North America,1,0
2851,1997-01-13,Paul Gutowski game 2.,Jeopardy,"(2, 1)",THE MOVIES,6,"(100,)",False,Mel Gibson sang 2 songs as Captain John Smith in this animated Disney film,"""Pocahontas""",1,1
2851,1997-01-13,Paul Gutowski game 2.,Jeopardy,"(3, 1)",JAPANESE FOOD,16,"(100,)",False,Tonyu is the liquid left over when this bland substance is made from soybeans,Tofu,1,0
2851,1997-01-13,Paul Gutowski game 2.,Jeopardy,"(4, 1)",EARLY AMERICA,11,"(100,)",False,"Members of Coronado's expedition were amazed at these native fowl ""With Great Hanging Chins""",Turkeys,1,0
2851,1997-01-13,Paul Gutowski game 2.,Jeopardy,"(5, 1)",PEOPLE,17,"(100,)",False,This vice president quipped that he's so boring his Secret Service code name is Al Gore,Al Gore,1,0
2851,1997-01-13,Paul Gutowski game 2.,Jeopardy,"(6, 1)","""HOUSE"" & ""HOME""",22,"(100,)",False,It's the part of a racetrack from the last turn to the finish line,Homestretch,1,0
2851,1997-01-13,Paul Gutowski game 2.,Jeopardy,"(1, 2)",THE CONTINENTS,2,"(200,)",False,"From west to east, this continent's major language groups are Romance, Germanic & Slavic",Europe,1,0
2851,1997-01-13,Paul Gutowski game 2.,Jeopardy,"(2, 2)",THE MOVIES,7,"(200,)",False,"In the title of a 1995 film, this actress' name follows ""To Wong Foo, Thanks For Everything....""",Julie Newmar,1,0
2851,1997-01-13,Paul Gutowski game 2.,Jeopardy,"(3, 2)",JAPANESE FOOD,27,"(200,)",False,It's traditional for the host to serve a meal called kaiseki before this ceremony,The Tea Ceremony,1,1
2851,1997-01-13,Paul Gutowski game 2.,Jeopardy,"(4, 2)",EARLY AMERICA,12,"(200,)",False,"In 1606 England chartered 2 companies, the London Company for south Virginia & this for the north",The Plymouth Company (The Virginia Company of Plymouth),0,3
2851,1997-01-13,Paul Gutowski game 2.,Jeopardy,"(5, 2)",PEOPLE,18,"(200,)",False,"On Dec. 12, 1995, his 80th birthday, the top of the Empire State Building was lit with blue lights to match his eyes",Frank Sinatra,1,0
2851,1997-01-13,Paul Gutowski game 2.,Jeopardy,"(6, 2)","""HOUSE"" & ""HOME""",23,"(200,)",False,"On Nov. 8, 1972 this subscription cable TV service began transmitting",Home Box Office,1,1
2851,1997-01-13,Paul Gutowski game 2.,Jeopardy,"(1, 3)",THE CONTINENTS,3,"(300,)",False,The world's largest desert fills nearly all of this continent's northern part,Africa,1,0
2851,1997-01-13,Paul Gutowski game 2.,Jeopardy,"(2, 3)",THE MOVIES,8,"(300,)",False,"In this 1996 film, Sean Connery played the only known escapee from Alcatraz","""The Rock""",1,0
2851,1997-01-13,Paul Gutowski game 2.,Jeopardy,"(3, 3)",JAPANESE FOOD,28,"(300,)",False,Tendon is a one-dish meal of rice topped with this mix of battered & fried seafood & vegetables,tempura,1,0
2851,1997-01-13,Paul Gutowski game 2.,Jeopardy,"(4, 3)",EARLY AMERICA,13,"(300,)",False,The land granted to Sir George Calvert's son Cecilius was named this after Queen Henrietta Maria,Maryland,1,0
2851,1997-01-13,Paul Gutowski game 2.,Jeopardy,"(5, 3)",PEOPLE,19,"(300,)",False,"The 1st Canadian journalist to arrive at the scene of JFK's assassination, he's now an anchorman",Peter Jennings,1,0
2851,1997-01-13,Paul Gutowski game 2.,Jeopardy,"(6, 3)","""HOUSE"" & ""HOME""",24,"(300,)",False,This 1862 act gave ownership of 160 acres to anyone who lived & worked on them for 5 years,The Homestead Act,1,0
2851,1997-01-13,Paul Gutowski game 2.,Jeopardy,"(1, 4)",THE CONTINENTS,4,"(400,)",False,"This continent is the world's largest wool producer, accounting for about 30% of the total",Australia,1,0
2851,1997-01-13,Paul Gutowski game 2.,Jeopardy,"(2, 4)",THE MOVIES,9,"(400,)",False,"Billy Zane played the title role of this Lee Falk comic strip character, ""The Ghost Who Walks""",The Phantom,1,0
2851,1997-01-13,Paul Gutowski game 2.,Jeopardy,"(4, 4)",EARLY AMERICA,14,"(400,)",False,"This colony of James Oglethorpe banned the importation of rum & brandy, & forbade slavery",Georgia,1,0
2851,1997-01-13,Paul Gutowski game 2.,Jeopardy,"(5, 4)",PEOPLE,20,"(400,)",False,Patty Hearst had a good laugh when this lawyer began serving a jail term in March 1996,F. Lee Bailey,1,0
2851,1997-01-13,Paul Gutowski game 2.,Jeopardy,"(6, 4)","""HOUSE"" & ""HOME""",25,"(400,)",False,It's an insubstantial plan subject to imminent collapse,House of Cards,0,3
2851,1997-01-13,Paul Gutowski game 2.,Jeopardy,"(1, 5)",THE CONTINENTS,5,"(500,)",False,Birds found only on this continent include hoatzins & rheas,South America,1,1
2851,1997-01-13,Paul Gutowski game 2.,Jeopardy,"(2, 5)",THE MOVIES,10,"(500,)",False,"This 1996 remake of ""La Cage Aux Folles"" was the first film on which Mike Nichols & Elaine May worked together","""The Birdcage""",1,0
2851,1997-01-13,Paul Gutowski game 2.,Jeopardy,"(4, 5)",EARLY AMERICA,15,"(500,)",True,"The words spook, cruller, boss & crib were introduced to America from this language",Dutch,1,0
2851,1997-01-13,Paul Gutowski game 2.,Jeopardy,"(5, 5)",PEOPLE,21,"(500,)",False,"After dropping out of the 1996 presidential race, this wealthy Republican guest-hosted ""Saturday Night Live""",Steve Forbes,1,0
2851,1997-01-13,Paul Gutowski game 2.,Jeopardy,"(6, 5)","""HOUSE"" & ""HOME""",26,"(500,)",False,"In 1960 James Agee's book ""A Death In The Family"" was dramatized into this Pulitzer-winning play","""All The Way Home""",0,3
2851,1997-01-13,Paul Gutowski game 2.,Double Jeopardy,"(1, 1)",CITY FOUNDERS,1,"(200,)",False,"Founded by Sweden's Gustav I Vasa in 1550, this city, Finland's largest, moved to its present site in 1640",Helsinki,1,0
2851,1997-01-13,Paul Gutowski game 2.,Double Jeopardy,"(2, 1)",1996,6,"(200,)",False,Many major auto racing stars bypassed this race to drive in CART's new U.S. 500 the same day,Indianapolis 500,1,0
2851,1997-01-13,Paul Gutowski game 2.,Double Jeopardy,"(3, 1)",SCIENTISTS,21,"(200,)",False,"He originally wrote his equation as L=mc(squared), before he crossed out the L & replaced it with an E",Albert Einstein,1,0
2851,1997-01-13,Paul Gutowski game 2.,Double Jeopardy,"(4, 1)",BALLET,24,"(200,)",False,Igor Youskevitch was noted for playing Stanley in the ballet version of this Tennessee Williams play,"""A Streetcar Named Desire""",1,0
2851,1997-01-13,Paul Gutowski game 2.,Double Jeopardy,"(5, 1)",ISRAEL,11,"(200,)",False,"The Tayelet, or Promenade, runs along the shores of this sea, beginning at Gordon Street in Tel Aviv",The Mediterranean Sea,1,2
2851,1997-01-13,Paul Gutowski game 2.,Double Jeopardy,"(6, 1)",LITERARY ALLUSIONS,16,"(200,)",False,A person who always looks busy for no apparent reason is compared to this Lewis Carroll rabbit,The White Rabbit,0,3
2851,1997-01-13,Paul Gutowski game 2.,Double Jeopardy,"(1, 2)",CITY FOUNDERS,2,"(400,)",False,"Tradition says Dido founded this north African city that suffered ""Punic""tive damages from Rome",Carthage,1,0
2851,1997-01-13,Paul Gutowski game 2.,Double Jeopardy,"(2, 2)",1996,7,"(400,)",False,The world learned of a dinosaur larger than this one usually thought the biggest carnivore,Tyrannosaurus Rex,1,0
2851,1997-01-13,Paul Gutowski game 2.,Double Jeopardy,"(3, 2)",SCIENTISTS,22,"(400,)",False,"He crossed the oxeye, European & Japanese daisies to produce his famous Shasta daisy",Luther Burbank,0,3
2851,1997-01-13,Paul Gutowski game 2.,Double Jeopardy,"(5, 2)",ISRAEL,12,"(400,)",False,These fried chickpea balls served with salad in a pita are popular Israeli fast food,Falafel,0,3
2851,1997-01-13,Paul Gutowski game 2.,Double Jeopardy,"(6, 2)",LITERARY ALLUSIONS,17,"(400,)",False,A glamorized overestimation of oneself is called Bovarism in honor of this fictional heroine,Madame Bovary,1,0
2851,1997-01-13,Paul Gutowski game 2.,Double Jeopardy,"(1, 3)",CITY FOUNDERS,3,"(1000,)",True,The American Colonization Society founded this African city in 1822,"Monrovia, Liberia",0,1
2851,1997-01-13,Paul Gutowski game 2.,Double Jeopardy,"(2, 3)",1996,8,"(600,)",False,"He resigned from the Senate June 11, 1996 to devote himself to running for a higher office",Bob Dole,1,0
2851,1997-01-13,Paul Gutowski game 2.,Double Jeopardy,"(3, 3)",SCIENTISTS,23,"(600,)",False,"At his death in 1727, he became the first scientist buried in Westminster Abbey",Sir Isaac Newton,1,0
2851,1997-01-13,Paul Gutowski game 2.,Double Jeopardy,"(5, 3)",ISRAEL,13,"(600,)",False,Degonia Alef was the first of these communities based on equality & subservience to community needs,Kibbutz,1,0
2851,1997-01-13,Paul Gutowski game 2.,Double Jeopardy,"(6, 3)",LITERARY ALLUSIONS,18,"(600,)",False,A broken-down old nag is called a Rosinante in honor of this Spanish character's scrawny horse,Don Quixote,1,0
2851,1997-01-13,Paul Gutowski game 2.,Double Jeopardy,"(1, 4)",CITY FOUNDERS,4,"(800,)",False,French explorer Pierre Savorgnon de Brazza founded this current republic's city of Brazzaville in 1880,The Congo,1,0
2851,1997-01-13,Paul Gutowski game 2.,Double Jeopardy,"(2, 4)",1996,9,"(800,)",False,"His 2-week sabbatical as mayor of Washington, D.C. made headlines",Marion Barry,1,0
2851,1997-01-13,Paul Gutowski game 2.,Double Jeopardy,"(3, 4)",SCIENTISTS,25,"(800,)",False,In 1600 this German astronomer became an assistant to Tycho Brahe,Johannes Kepler,1,0
2851,1997-01-13,Paul Gutowski game 2.,Double Jeopardy,"(4, 4)",BALLET,28,"(800,)",False,"When Robert Helpmann's ""Hamlet"" ballet premiered in 1942, Margot Fonteyn danced this ingenue role",Ophelia,1,0
2851,1997-01-13,Paul Gutowski game 2.,Double Jeopardy,"(5, 4)",ISRAEL,14,"(800,)",False,"Tiberius is the largest town on the shore of this ""sea"" the Israelis call Yam Kinneret",Sea of Galilee,1,2
2851,1997-01-13,Paul Gutowski game 2.,Double Jeopardy,"(6, 4)",LITERARY ALLUSIONS,19,"(800,)",False,A state of depression is called a Slough of Despond after a deep bog in this John Bunyan classic,"""Pilgrim\'s Progress""",1,0
2851,1997-01-13,Paul Gutowski game 2.,Double Jeopardy,"(1, 5)",CITY FOUNDERS,5,"(1000,)",False,Historians believe the Roman gen. Pompey founded this Spanish city known for the running of the bulls,Pamplona,1,0
2851,1997-01-13,Paul Gutowski game 2.,Double Jeopardy,"(2, 5)",1996,10,"(1000,)",False,An ecclesiastical court of this U.S. denomination found Bishop Walter Righter not guilty of heresy,Episcopal Church,1,0
2851,1997-01-13,Paul Gutowski game 2.,Double Jeopardy,"(3, 5)",SCIENTISTS,26,"(1000,)",False,This Hungarian-American physicist was the principal architect of the hydrogen bomb,Edward Teller,0,3
2851,1997-01-13,Paul Gutowski game 2.,Double Jeopardy,"(4, 5)",BALLET,27,"(1000,)",False,"In 1991 ballerina Darci Kistler married this U.S. ballet company's director, Peter Martins",New York City Ballet,1,1
2851,1997-01-13,Paul Gutowski game 2.,Double Jeopardy,"(5, 5)",ISRAEL,15,"(1000,)",False,"In Sde Boker, you can visit this first PM's desert house where he drank tea with Dag Hammarskjold",David Ben-Gurion,1,0
2851,1997-01-13,Paul Gutowski game 2.,Double Jeopardy,"(6, 5)",LITERARY ALLUSIONS,20,"(1100,)",True,"The title of the novel ""Brave New World"" comes from a line spoken by Miranda in this Shakespeare play","""The Tempest""",1,0
2851,1997-01-13,Paul Gutowski game 2.,Final Jeopardy,"(1, 1)",U.S. GOVERNMENT,0,"(2699, 2401, 800)",False,Full & correct title of the post held by the person seen here:,Chief Justice of the United States,1,2
