epNum,airDate,extra_info,round_name,coord,category,order,value,daily_double,question,answer,correctAttempts,wrongAttempts
2913,1997-04-09,,Jeopardy,"(1, 1)",AMERICAN HISTORY,1,"(100,)",False,"On July 9, 1776 this state's legislature met in White Plains & ratified the Declaration of Independence",New York,1,0
2913,1997-04-09,,Jeopardy,"(2, 1)",HIGH SCHOOLS,15,"(100,)",False,"Led by Lew Alcindor, Power Memorial in NYC won 71 straight games in this sport 1962-65",Basketball,1,0
2913,1997-04-09,,Jeopardy,"(3, 1)",NAMES OF THE '60s,6,"(100,)",False,"In 1965 he called the Chevrolet Corvair ""Unsafe at any speed""",Ralph Nader,1,0
2913,1997-04-09,,Jeopardy,"(4, 1)",PENNSYLVANIA CITIES,8,"(100,)",False,You can take a 45-minute cruise on the paddle-wheeler Pride of the Susquehanna in this capital city,Harrisburg,1,0
2913,1997-04-09,,Jeopardy,"(5, 1)",OCCUPATIONS,26,"(100,)",False,"At a health club, this person will rub you the right way",Masseuse,1,0
2913,1997-04-09,,Jeopardy,"(6, 1)",QUOTATIONS,7,"(100,)",False,"Some credit college coach Red Sanders with saying this ""Isn't everything, it's the only thing""",Winning,1,0
2913,1997-04-09,,Jeopardy,"(1, 2)",AMERICAN HISTORY,2,"(200,)",False,"On April 4, 1949, the U.S., Canada, Great Britain, France & 8 other nations signed this mutual defense pact",NATO (North Atlantic Treaty Organisation),1,0
2913,1997-04-09,,Jeopardy,"(2, 2)",HIGH SCHOOLS,16,"(200,)",False,This L.A. high school attended by Lana Turner & other stars stands on famous Sunset Boulevard,Hollywood High,1,0
2913,1997-04-09,,Jeopardy,"(3, 2)",NAMES OF THE '60s,22,"(200,)",False,"In September 1967 Mattel introduced a doll of this famous model whose friends called her ""Sticks"" as a kid",Twiggy,1,0
2913,1997-04-09,,Jeopardy,"(4, 2)",PENNSYLVANIA CITIES,11,"(200,)",False,Its old city hall housed the U.S. Supreme Court from 1791 to 1800,Philadelphia,1,0
2913,1997-04-09,,Jeopardy,"(5, 2)",OCCUPATIONS,27,"(200,)",False,"From the Greek for ""adorned"", it's a professional applier of blush & other makeup",Cosmetologist,1,0
2913,1997-04-09,,Jeopardy,"(6, 2)",QUOTATIONS,9,"(200,)",False,"William Cowper wrote this is ""The very spice of life, that gives it all its flavor""",Variety,1,0
2913,1997-04-09,,Jeopardy,"(1, 3)",AMERICAN HISTORY,3,"(300,)",False,"8 Americans were killed April 24, 1980 in a failed attempt to rescue American hostages held in this city",Tehran,1,0
2913,1997-04-09,,Jeopardy,"(2, 3)",HIGH SCHOOLS,19,"(300,)",False,"Sidwell Friends School, attended by Chelsea Clinton, was founded by members of this religious group",Quakers (Society of Friends),1,0
2913,1997-04-09,,Jeopardy,"(3, 3)",NAMES OF THE '60s,23,"(300,)",False,"Daughter of the president-elect & grandson of a former president who wed December 22, 1968",Julie Nixon & David Eisenhower,0,3
2913,1997-04-09,,Jeopardy,"(4, 3)",PENNSYLVANIA CITIES,12,"(300,)",False,Scranton's iron industry used nearby deposits of this hard coal to fuel its blast furnaces,Anthracite,1,1
2913,1997-04-09,,Jeopardy,"(5, 3)",OCCUPATIONS,28,"(300,)",False,"Like a pharmacist, this person who dispenses eyeglasses can't write prescriptions",Optician,1,0
2913,1997-04-09,,Jeopardy,"(6, 3)",QUOTATIONS,10,"(300,)",False,"First name of the girl who asked the Sun newspaper in 1897, ""Please tell me the truth; is there a Santa Claus?""",Virginia,1,0
2913,1997-04-09,,Jeopardy,"(1, 4)",AMERICAN HISTORY,4,"(400,)",False,"After answering a NASA newspaper notice in the '70s, she became America's first woman in space",Sally Ride,1,0
2913,1997-04-09,,Jeopardy,"(2, 4)",HIGH SCHOOLS,20,"(400,)",False,"A baseball bat was one of Joe Clark's unusual tools in this post at Eastside High in Paterson, New Jersey",Principal,1,0
2913,1997-04-09,,Jeopardy,"(3, 4)",NAMES OF THE '60s,24,"(400,)",False,"A 1966 book was entitled this person ""Teaches Chess""",Bobby Fischer,1,0
2913,1997-04-09,,Jeopardy,"(4, 4)",PENNSYLVANIA CITIES,13,"(400,)",False,Zion's Church in Allentown houses a replica of this patriotic item temporarily hidden there in 1777,Liberty Bell,1,0
2913,1997-04-09,,Jeopardy,"(5, 4)",OCCUPATIONS,29,"(400,)",False,"A glazier doesn't work on donuts, but installs these",Windows,1,0
2913,1997-04-09,,Jeopardy,"(6, 4)",QUOTATIONS,17,"(400,)",False,"On July 21, 1969 newspapers quoted his ""The Eagle Has Landed""",Neil Armstrong,1,0
2913,1997-04-09,,Jeopardy,"(1, 5)",AMERICAN HISTORY,5,"(500,)",False,In 1919 this future pres. mobilized the Mass. Militia to restore order in the Boston police strike,Calvin Coolidge,1,0
2913,1997-04-09,,Jeopardy,"(2, 5)",HIGH SCHOOLS,21,"(500,)",False,"New England's Deerfield Academy, Phillips Academy & Groton are noted schools of this type",Preparatory schools,1,0
2913,1997-04-09,,Jeopardy,"(3, 5)",NAMES OF THE '60s,25,"(500,)",False,"He donated his 1964 Nobel Prize money, over $54,000, to the civil rights movement","Martin Luther King, Jr.",1,0
2913,1997-04-09,,Jeopardy,"(4, 5)",PENNSYLVANIA CITIES,14,"(500,)",False,You can get a panoramic view of this city's Golden Triangle from the top of Mount Washington,Pittsburgh,1,0
2913,1997-04-09,,Jeopardy,"(5, 5)",OCCUPATIONS,30,"(500,)",False,A chandler may wax philosophic about making these items,Candles,1,0
2913,1997-04-09,,Jeopardy,"(6, 5)",QUOTATIONS,18,"(1000,)",True,"She's usually credited with the 18th century quote, ""Qu'ils mangent de la brioche""","Marie Antoinette (""Let them eat cake"")",1,0
2913,1997-04-09,,Double Jeopardy,"(1, 1)",SCOTTISH RULERS,1,"(200,)",False,King Edgar was famous for giving King Murcertach of Ireland a gift of one of these ships of the desert,Camel,1,0
2913,1997-04-09,,Double Jeopardy,"(2, 1)",ART & ARTISTS,2,"(200,)",False,"You may remember there are 3 melting watches in his ""The Persistence of Memory""",Salvador Dali,1,0
2913,1997-04-09,,Double Jeopardy,"(3, 1)",BUSINESS & INDUSTRY,30,"(200,)",False,"S.C. Johnson & Son, Inc. is also known as this, for its popular floor-care products",Johnson Wax,1,0
2913,1997-04-09,,Double Jeopardy,"(4, 1)",MOVIE MUSIC,5,"(200,)",False,"This head Heartbreaker provided the songs & score for the 1996 movie ""She's The One""",Tom Petty,1,0
2913,1997-04-09,,Double Jeopardy,"(5, 1)",AUTHORS & THEIR WORKS,16,"(200,)",False,"His 1904 horror novel ""The Jewel of Seven Stars"" is much less famous than his ""Dracula""",Bram Stoker,1,0
2913,1997-04-09,,Double Jeopardy,"(6, 1)","THE ""U""SUAL PLACES",15,"(200,)",False,"Kings Peak is this state's highest point, Beaverdam Creek its lowest",Utah,1,0
2913,1997-04-09,,Double Jeopardy,"(1, 2)",SCOTTISH RULERS,12,"(400,)",False,"Malcolm III, also called Canmore, or Big Head, promised loyalty to this conqueror in 1072",William the Conqueror,1,0
2913,1997-04-09,,Double Jeopardy,"(2, 2)",ART & ARTISTS,3,"(400,)",False,"On October 4, 1669 he died in poverty in Amsterdam",Rembrandt,1,0
2913,1997-04-09,,Double Jeopardy,"(3, 2)",BUSINESS & INDUSTRY,29,"(400,)",False,The Brown Shoe Company debuted this comic strip spokesman in 1904,Buster Brown,1,0
2913,1997-04-09,,Double Jeopardy,"(4, 2)",MOVIE MUSIC,6,"(400,)",False,"Max Steiner wrote the score for this 1942 film, but it was Herman Hupfeld who gave us ""As Time Goes By""",Casablanca,1,0
2913,1997-04-09,,Double Jeopardy,"(5, 2)",AUTHORS & THEIR WORKS,19,"(400,)",False,"""Invitation to a Beheading"" is an anti-utopian novel by this author of ""Lolita""",Vladimir Nabokov,1,0
2913,1997-04-09,,Double Jeopardy,"(6, 2)","THE ""U""SUAL PLACES",17,"(400,)",False,A crested crane is the national bird of this country whose capital is Kampala,Uganda,1,0
2913,1997-04-09,,Double Jeopardy,"(1, 3)",SCOTTISH RULERS,13,"(600,)",False,James VI granted the charter for this city's university in 1582,Edinburgh,1,0
2913,1997-04-09,,Double Jeopardy,"(2, 3)",ART & ARTISTS,4,"(600,)",False,"Famous for his mobiles, he painted a DC-8 in 1973 & a 727 in 1975",Alexander Calder,1,0
2913,1997-04-09,,Double Jeopardy,"(3, 3)",BUSINESS & INDUSTRY,26,"(600,)",False,This company's washers and dryers come with an ol' lonely warranty,Maytag,1,0
2913,1997-04-09,,Double Jeopardy,"(4, 3)",MOVIE MUSIC,7,"(600,)",False,"Love themes from ""St. Elmo's Fire"", ""A Star Is Born"" & this 1972 Coppola classic have been Top 40 hits",The Godfather,1,0
2913,1997-04-09,,Double Jeopardy,"(5, 3)",AUTHORS & THEIR WORKS,21,"(600,)",False,"This author of ""My Antonia"" set her last novel, ""Sapphira And The Slave Girl"", in Virginia, her home state",Willa Cather,1,0
2913,1997-04-09,,Double Jeopardy,"(6, 3)","THE ""U""SUAL PLACES",20,"(600,)",False,Thermometer scale inventor Anders Celsius was a professor of astronomy at this Swedish city's university,Uppsala,1,0
2913,1997-04-09,,Double Jeopardy,"(1, 4)",SCOTTISH RULERS,14,"(800,)",False,"Believed to be Jacob's Pillow, the ""Lia Fail"" is called the Stone of this; Kenneth I took it to that village",Stone of Scone,1,0
2913,1997-04-09,,Double Jeopardy,"(2, 4)",ART & ARTISTS,10,"(800,)",False,Berenice Abbott made her name in this field; she began as Man Ray's assistant,Photography,1,0
2913,1997-04-09,,Double Jeopardy,"(3, 4)",BUSINESS & INDUSTRY,27,"(800,)",False,"In August 1996 this chain, the world's largest retailer, opened its first outlets in China",Wal-Mart,0,3
2913,1997-04-09,,Double Jeopardy,"(4, 4)",MOVIE MUSIC,8,"(800,)",False,Director John Carpenter wrote music for this Jamie Lee Curtis horror film & its 4 sequels,Halloween,1,0
2913,1997-04-09,,Double Jeopardy,"(5, 4)",AUTHORS & THEIR WORKS,23,"(2000,)",True,"Sinclair Lewis could have called this 1925 novel ""Martin"": that's the title physician's first name",Arrowsmith,0,1
2913,1997-04-09,,Double Jeopardy,"(6, 4)","THE ""U""SUAL PLACES",22,"(800,)",False,"It has 7 states, including 'Ajman & Abu Dhabi, & you have to hum its anthem -- it has no words",United Arab Emirates,1,0
2913,1997-04-09,,Double Jeopardy,"(1, 5)",SCOTTISH RULERS,18,"(1000,)",False,"In 1306 this house had its first of only 2 kings, Robert I",Bruce,1,0
2913,1997-04-09,,Double Jeopardy,"(2, 5)",ART & ARTISTS,11,"(1000,)",False,"For the White House, Jackie Kennedy chose ""Houses of Squam Light"" by this ""Nighthawks"" artist",Edward Hopper,0,3
2913,1997-04-09,,Double Jeopardy,"(3, 5)",BUSINESS & INDUSTRY,28,"(1000,)",False,Brothers Tom & David Gardner started this America Online investment guide in 1994,The Motley Fool,1,0
2913,1997-04-09,,Double Jeopardy,"(4, 5)",MOVIE MUSIC,9,"(1000,)",True,1968 Oscar winner for special visual effects that includes the piece heard here:[audio clue],"2001: A Space Odyssey (""The Blue Danube"")",0,1
2913,1997-04-09,,Double Jeopardy,"(5, 5)",AUTHORS & THEIR WORKS,24,"(1000,)",False,"After moving to Europe, this New Yorker wrote his 1890 novel ""The Tragic Muse"" about the art world of Europe",Henry James,1,0
2913,1997-04-09,,Double Jeopardy,"(6, 5)","THE ""U""SUAL PLACES",25,"(1000,)",False,"Now the second-largest country in Europe, it hosted the Yalta Conference in 1945",Ukraine,1,0
2913,1997-04-09,,Final Jeopardy,"(1, 1)",WORD HISTORY,0,"(4000, 3801, 1899)",False,"Before this word came to mean an extraterrestrial, it was used as an adjective meaning ""warlike""",Martian,1,2
