epNum,airDate,extra_info,round_name,coord,category,order,value,daily_double,question,answer,correctAttempts,wrongAttempts
2918,1997-04-16,,Jeopardy,"(1, 1)",ACTS OF THE APOSTLES,21,"(100,)",False,He went to Damascus to arrest Christians but became one instead,Paul,1,0
2918,1997-04-16,,Jeopardy,"(2, 1)",POP MUSIC,1,"(100,)",False,"This Chubby Checker hit charted twice, both times reaching No. 1","""The Twist""",1,0
2918,1997-04-16,,Jeopardy,"(3, 1)",SHOPPING U.S.A.,7,"(100,)",False,In 1996 Graceland Gifts in this city sold a limited edition Elvis Cabbage Patch Kid in a gold lame suit,Memphis,1,0
2918,1997-04-16,,Jeopardy,"(4, 1)",LITERATURE,6,"(100,)",False,"2 old Quakers, Captain Peleg & Captain Bildad, are part-owners of the Pequod in this 1851 novel",Moby-Dick,1,0
2918,1997-04-16,,Jeopardy,"(5, 1)",APPLES,26,"(100,)",False,"In Altdorf, Switzerland a statue marks the spot where he shot an apple off his son's head",William Tell,1,0
2918,1997-04-16,,Jeopardy,"(6, 1)","CROSSWORD CLUES ""I""",13,"(100,)",False,It may be indelible or invisible(3),ink,1,0
2918,1997-04-16,,Jeopardy,"(1, 2)",ACTS OF THE APOSTLES,22,"(200,)",False,"At Cornelius' house in Caesarea, this leader of the apostles preached to the first Gentile converts",Simon Peter,0,3
2918,1997-04-16,,Jeopardy,"(2, 2)",POP MUSIC,2,"(200,)",False,"""Beefy"" singer whose first No. 1 hit was ""I'd Do Anything For Love"" from his 1993 CD ""Bat Out Of Hell II""",Meat Loaf,1,0
2918,1997-04-16,,Jeopardy,"(3, 2)",SHOPPING U.S.A.,8,"(200,)",False,Rumors on Royal Street in this city specializes in hand-crafted Mardi Gras masks,New Orleans,1,0
2918,1997-04-16,,Jeopardy,"(4, 2)",LITERATURE,9,"(200,)",False,"In this novel, d'Artagnan, a native of Gascony, is described as ""Don Quixote at 18""",The Three Musketeers,1,0
2918,1997-04-16,,Jeopardy,"(5, 2)",APPLES,27,"(200,)",False,"In 1952 Nina Ricci introduced ""Fille D'Eve"", one of these that came in an apple-shaped bottle",perfume,1,0
2918,1997-04-16,,Jeopardy,"(6, 2)","CROSSWORD CLUES ""I""",14,"(200,)",False,Mesopotamia today(4),Iraq,1,0
2918,1997-04-16,,Jeopardy,"(1, 3)",ACTS OF THE APOSTLES,23,"(300,)",False,The apostles believed Judas' act of betrayal was predicted by this king's psalms,David,1,0
2918,1997-04-16,,Jeopardy,"(2, 3)",POP MUSIC,3,"(300,)",False,"This group's 1995 album ""Pulse"" includes a live performance of all the songs from ""Dark Side of the Moon""",Pink Floyd,1,0
2918,1997-04-16,,Jeopardy,"(3, 3)",SHOPPING U.S.A.,18,"(300,)",False,"Browsing for baubles?  Tiffany, Cartier & Van Cleef & Arpels all have shops on this chic Beverly Hills street",Rodeo Drive,1,0
2918,1997-04-16,,Jeopardy,"(4, 3)",LITERATURE,10,"(300,)",False,"In ""Good Wives"", the second part of this novel, Aunt March dies & leaves her home, Plumfield, to Jo",Little Women,1,0
2918,1997-04-16,,Jeopardy,"(5, 3)",APPLES,28,"(300,)",False,Voltaire first spread the story about this scientist & the falling apple,Isaac Newton,1,0
2918,1997-04-16,,Jeopardy,"(6, 3)","CROSSWORD CLUES ""I""",15,"(300,)",False,Dante's Hell(7),Inferno,1,0
2918,1997-04-16,,Jeopardy,"(1, 4)",ACTS OF THE APOSTLES,24,"(400,)",False,"Philip preached in this area known for the ""good"" neighbor in Jesus' parable",Samaria,1,0
2918,1997-04-16,,Jeopardy,"(2, 4)",POP MUSIC,4,"(400,)",False,"Her 1991 hit ""Coming Out of the Dark"" was about her tour bus accident of the preceding year",Gloria Estefan,1,0
2918,1997-04-16,,Jeopardy,"(3, 4)",SHOPPING U.S.A.,19,"(400,)",False,"J. Crew picked this city's South Street Seaport as the site for its first retail store, opened in 1989",New York City,1,0
2918,1997-04-16,,Jeopardy,"(4, 4)",LITERATURE,11,"(700,)",True,"William Makepeace Thackeray wrote that ""Some of the love passages"" of this Charlotte Bronte work ""made me cry""",Jane Eyre,1,0
2918,1997-04-16,,Jeopardy,"(5, 4)",APPLES,29,"(400,)",False,In a Grimm fairy tale a bit of poisoned apple lodged in her throat,Snow White,1,0
2918,1997-04-16,,Jeopardy,"(6, 4)","CROSSWORD CLUES ""I""",16,"(400,)",False,Claude Monet or Rich Little(13),Impressionist,1,0
2918,1997-04-16,,Jeopardy,"(1, 5)",ACTS OF THE APOSTLES,25,"(500,)",False,"On Pentecost the apostles received this ability, as witnessed by Jews from ""every nation""",speaking in tongues,0,3
2918,1997-04-16,,Jeopardy,"(2, 5)",POP MUSIC,5,"(500,)",False,"R&B quartet consisting of ""Squirt"", ""Bass"", ""Slim"" & ""Alex Vanderpool""",Boyz II Men,0,3
2918,1997-04-16,,Jeopardy,"(3, 5)",SHOPPING U.S.A.,20,"(500,)",False,The Mall of America in this state gets more tourists than the Grand Canyon & Disney World combined,Minnesota,1,0
2918,1997-04-16,,Jeopardy,"(4, 5)",LITERATURE,12,"(500,)",False,"In a Thomas Hardy novel, grain merchant Michael Henchard serves in this title political office",The Mayor of Casterbridge,1,0
2918,1997-04-16,,Jeopardy,"(5, 5)",APPLES,30,"(500,)",False,"In the third quarter of 1995, Apple passed this company as the No. 2 maker of PCs in the U.S.",IBM,1,0
2918,1997-04-16,,Jeopardy,"(6, 5)","CROSSWORD CLUES ""I""",17,"(500,)",False,Give the third degree(11),interrogate,1,0
2918,1997-04-16,,Double Jeopardy,"(1, 1)",PLACES OF INCARCERATION,15,"(200,)",False,"The name of this French site was a corruption of Bastide, meaning ""fortification""",the Bastille,1,0
2918,1997-04-16,,Double Jeopardy,"(2, 1)",19th CENTURY AMERICA,6,"(200,)",False,In 1835 the N.Y. Sun reported there were bat-winged creatures living on this heavenly body; it was a hoax,the moon,1,2
2918,1997-04-16,,Double Jeopardy,"(3, 1)",GEOLOGY,26,"(200,)",False,It's a circular hollow often formed by volcanic action or by a meteor strike,a crater,1,0
2918,1997-04-16,,Double Jeopardy,"(4, 1)",MOVIE DEBUTS,1,"(200,)",False,"This ""Caroline In The City"" star made her screen debut in 3-D, in ""Jaws 3-D""",Lea Thompson,1,0
2918,1997-04-16,,Double Jeopardy,"(5, 1)",COLLEGES & UNIVERSITIES,21,"(200,)",False,"The university of this state has 9 campuses, including those in Davis, Irvine & Berkeley",California,1,0
2918,1997-04-16,,Double Jeopardy,"(6, 1)",TENNESSEE WILLIAMS,9,"(200,)",False,"Tennessee broke onto the Broadway scene in 1945 with this play with a ""breakable"" title",The Glass Menagerie,1,0
2918,1997-04-16,,Double Jeopardy,"(1, 2)",PLACES OF INCARCERATION,17,"(400,)",False,"One of the buildings at this British site is named for Robert Devereux, held there before his 1601 execution",Tower of London,1,0
2918,1997-04-16,,Double Jeopardy,"(2, 2)",19th CENTURY AMERICA,7,"(400,)",False,Originally this novel was published as a serial from 1851-52 in an anti-slavery paper,Uncle Tom\'s Cabin,1,0
2918,1997-04-16,,Double Jeopardy,"(3, 2)",GEOLOGY,27,"(400,)",False,"It's a valley formed between 2 parallel faults; there's a ""Great"" one in the Eastern Hemisphere",a rift valley,1,0
2918,1997-04-16,,Double Jeopardy,"(4, 2)",MOVIE DEBUTS,2,"(400,)",False,"This older brother of Charlie Sheen was just 20 when he made his feature film debut in ""Tex"" in 1982",Emilio Estevez,1,0
2918,1997-04-16,,Double Jeopardy,"(5, 2)",COLLEGES & UNIVERSITIES,22,"(400,)",False,"In 1892 this New Haven, Connecticut university first admitted women to its graduate school",Yale,1,0
2918,1997-04-16,,Double Jeopardy,"(6, 2)",TENNESSEE WILLIAMS,11,"(400,)",False,"A Time magazine piece on Kathleen Turner in this play was titled ""Once More, With Feline""",Cat on a Hot Tin Roof,1,0
2918,1997-04-16,,Double Jeopardy,"(1, 3)",PLACES OF INCARCERATION,18,"(600,)",False,"""Shark Island"" Prison is part of Dry Tortugas National Park in the extreme southwest of this state",Florida,1,0
2918,1997-04-16,,Double Jeopardy,"(2, 3)",19th CENTURY AMERICA,8,"(600,)",False,"When farmers of the 1800s learned this color absorbed sunlight well, it became quite popular for barns",red,1,0
2918,1997-04-16,,Double Jeopardy,"(3, 3)",GEOLOGY,28,"(900,)",True,Name of the type of formation seen here:[video clue - in Alex's hand],a geode,1,0
2918,1997-04-16,,Double Jeopardy,"(4, 3)",MOVIE DEBUTS,3,"(600,)",False,Ned Beatty made a memorable debut in this 1972 film about a nightmarish canoe trip,Deliverance,1,0
2918,1997-04-16,,Double Jeopardy,"(5, 3)",COLLEGES & UNIVERSITIES,23,"(600,)",False,City in which you'd find Marmara University & the University of the Bosporus,Istanbul,1,0
2918,1997-04-16,,Double Jeopardy,"(6, 3)",TENNESSEE WILLIAMS,12,"(600,)",False,"One of Tennessee's last plays, ""Clothes for A Summer Hotel"", was about this Jazz Age author & his wife",F. Scott Fitzgerald,1,0
2918,1997-04-16,,Double Jeopardy,"(1, 4)",PLACES OF INCARCERATION,19,"(800,)",False,According to British accounts 123 perished in 1756 in this dungeon in India; later studies say just 43,the Black Hole of Calcutta,1,0
2918,1997-04-16,,Double Jeopardy,"(2, 4)",19th CENTURY AMERICA,10,"(800,)",False,"""The Education of Mr. Pipp"" is a book of satirical drawings of high society by this artist known for his ""girl""",Charles Gibson,1,0
2918,1997-04-16,,Double Jeopardy,"(3, 4)",GEOLOGY,29,"(800,)",False,A moraine is the rocky material left behind by one of these,a glacier,1,0
2918,1997-04-16,,Double Jeopardy,"(4, 4)",MOVIE DEBUTS,4,"(800,)",False,Amy Irving & Betty Buckley debuted in this 1976 Brian De Palma film about horror at a high school prom,Carrie,1,0
2918,1997-04-16,,Double Jeopardy,"(5, 4)",COLLEGES & UNIVERSITIES,24,"(800,)",True,Manitoba's Catherine Booth Bible College is affiliated with this charitable organization,The Salvation Army,1,0
2918,1997-04-16,,Double Jeopardy,"(6, 4)",TENNESSEE WILLIAMS,13,"(800,)",False,"Williams' ""The Notebook of Trigorin"", based on this ""soaring"" Chekhov play, opened in 1996 in Cincinnati",The Seagull,1,0
2918,1997-04-16,,Double Jeopardy,"(1, 5)",PLACES OF INCARCERATION,20,"(1000,)",False,This rocky islet is the smallest of French Guiana's 3 Iles du Salut,Devil\'s Island,1,0
2918,1997-04-16,,Double Jeopardy,"(2, 5)",19th CENTURY AMERICA,16,"(1000,)",False,In 1861 this ex-president from Virginia was chairman of a peace convention that tried to avert civil war,John Tyler,0,3
2918,1997-04-16,,Double Jeopardy,"(3, 5)",GEOLOGY,30,"(1000,)",False,"When discussing sedimentary rock, this term means formed of layers or beds",stratified,0,3
2918,1997-04-16,,Double Jeopardy,"(4, 5)",MOVIE DEBUTS,5,"(1000,)",False,Kathy Baker's career blasted off when she played the wife of Alan Shepard in this 1983 film bio,The Right Stuff,1,0
2918,1997-04-16,,Double Jeopardy,"(5, 5)",COLLEGES & UNIVERSITIES,25,"(1000,)",False,"This Washington, D.C. school was once the Columbia Inst. for the Instruction of the Deaf & Dumb & the Blind",Gallaudet University,1,0
2918,1997-04-16,,Double Jeopardy,"(6, 5)",TENNESSEE WILLIAMS,14,"(1000,)",False,Williams worked with Jule Styne on a musical version of this play whose title mentions skin art,The Rose Tattoo,1,0
2918,1997-04-16,,Final Jeopardy,"(1, 1)",AIRPORTS,0,"(801, 5001, 2200)",False,It's the site of a presidential swearing-in & the headquarters of Southwest Airlines,Love Field (in Dallas),2,1
