epNum,airDate,extra_info,round_name,coord,category,order,value,daily_double,question,answer,correctAttempts,wrongAttempts
2926,1997-04-28,1997 Celebrity Jeopardy! game 1.,Jeopardy,"(1, 1)",SINGLE-NAMED SINGERS,1,"(100,)",False,"Don't cry for her: she won a Golden Globe for ""Evita""",Madonna,1,0
2926,1997-04-28,1997 Celebrity Jeopardy! game 1.,Jeopardy,"(2, 1)",RIVERS,2,"(100,)",False,"Ancient Greek historian Herodotus said, ""Egypt is the gift of"" this river",the Nile,1,0
2926,1997-04-28,1997 Celebrity Jeopardy! game 1.,Jeopardy,"(3, 1)",AMERICAN REVOLUTION,15,"(100,)",False,Ben Franklin was 70 years old when he signed this document in 1776,Declaration of Independence,1,0
2926,1997-04-28,1997 Celebrity Jeopardy! game 1.,Jeopardy,"(4, 1)",TRAVEL BASICS,7,"(100,)",False,"This U.S. travel document usually has 24 pages, but a 48-page one is available for frequent travelers",passport,1,0
2926,1997-04-28,1997 Celebrity Jeopardy! game 1.,Jeopardy,"(5, 1)",YOU GOT NERVE,13,"(100,)",False,"When you ""hit"" this ""bone"", the ulnar nerve creates the ""unamusing"" sensation in your elbow",humerus,1,0
2926,1997-04-28,1997 Celebrity Jeopardy! game 1.,Jeopardy,"(6, 1)","""M.D.""s",18,"(100,)",False,"In most states, this holiday is observed on the last Monday in May",Memorial Day,1,0
2926,1997-04-28,1997 Celebrity Jeopardy! game 1.,Jeopardy,"(1, 2)",SINGLE-NAMED SINGERS,3,"(500,)",True,"This singer, seen here in concert, is the subject of a 1997 film:",Selena,1,0
2926,1997-04-28,1997 Celebrity Jeopardy! game 1.,Jeopardy,"(2, 2)",RIVERS,10,"(200,)",False,The section of this river near London Bridge is called the Pool,the Thames,1,0
2926,1997-04-28,1997 Celebrity Jeopardy! game 1.,Jeopardy,"(4, 2)",TRAVEL BASICS,8,"(200,)",False,"These establishments nicknamed B&B's don't always have private baths, so inquire in advance",bed & breakfasts,1,0
2926,1997-04-28,1997 Celebrity Jeopardy! game 1.,Jeopardy,"(5, 2)",YOU GOT NERVE,16,"(200,)",False,"Term for a group of nerves; among the most famous is the ""solar"" one",plexus,1,0
2926,1997-04-28,1997 Celebrity Jeopardy! game 1.,Jeopardy,"(6, 2)","""M.D.""s",21,"(200,)",False,"Named for its surveyors, this ""line"" was once considered the boundary between slave & free states",Mason-Dixon Line,1,0
2926,1997-04-28,1997 Celebrity Jeopardy! game 1.,Jeopardy,"(1, 3)",SINGLE-NAMED SINGERS,4,"(300,)",False,"Her mother & former partner, Naomi Judd, has sung harmony on some of her solo albums",Wynonna,1,0
2926,1997-04-28,1997 Celebrity Jeopardy! game 1.,Jeopardy,"(2, 3)",RIVERS,11,"(300,)",False,"This river has hundreds of tributaries, including more than 200 in Brazil alone",the Amazon,1,0
2926,1997-04-28,1997 Celebrity Jeopardy! game 1.,Jeopardy,"(4, 3)",TRAVEL BASICS,9,"(300,)",False,"If you travel by train in this country, you can save money with a Canrailpass",Canada,1,0
2926,1997-04-28,1997 Celebrity Jeopardy! game 1.,Jeopardy,"(5, 3)",YOU GOT NERVE,17,"(300,)",False,"As part of his ""drill"", this doctor often anesthetizes the mandibular & lingual nerves",dentist,1,0
2926,1997-04-28,1997 Celebrity Jeopardy! game 1.,Jeopardy,"(6, 3)","""M.D.""s",24,"(300,)",False,He's Kirk's kid,Michael Douglas,1,0
2926,1997-04-28,1997 Celebrity Jeopardy! game 1.,Jeopardy,"(1, 4)",SINGLE-NAMED SINGERS,5,"(400,)",False,"This star of ""Moesha"" shares her name with a potent potable she's too young to drink",Brandy,1,0
2926,1997-04-28,1997 Celebrity Jeopardy! game 1.,Jeopardy,"(2, 4)",RIVERS,12,"(400,)",False,The basin of this sacred river in India lies between the Himalayas & the Vindhya range,the Ganges,1,0
2926,1997-04-28,1997 Celebrity Jeopardy! game 1.,Jeopardy,"(4, 4)",TRAVEL BASICS,22,"(400,)",False,Fodor's suggests carrying this common seasoning if you think you'll encounter leeches,salt,1,0
2926,1997-04-28,1997 Celebrity Jeopardy! game 1.,Jeopardy,"(5, 4)",YOU GOT NERVE,19,"(400,)",False,The olfactory nerve is the nerve of this sense,smell,1,0
2926,1997-04-28,1997 Celebrity Jeopardy! game 1.,Jeopardy,"(6, 4)","""M.D.""s",25,"(400,)",False,"He monkeed around with Davy Jones, Peter Tork & Mike Nesmith",Micky Dolenz,1,0
2926,1997-04-28,1997 Celebrity Jeopardy! game 1.,Jeopardy,"(1, 5)",SINGLE-NAMED SINGERS,6,"(500,)",False,"""Gypsies, Tramps and Thieves"" was her first solo No. 1 hit",Cher,1,0
2926,1997-04-28,1997 Celebrity Jeopardy! game 1.,Jeopardy,"(2, 5)",RIVERS,14,"(500,)",False,"The longest river west of the Rockies, it enters Mexico near Yuma, Arizona",the Colorado,1,0
2926,1997-04-28,1997 Celebrity Jeopardy! game 1.,Jeopardy,"(4, 5)",TRAVEL BASICS,23,"(500,)",False,This company was the first to offer travelers cheques for two,American Express,1,0
2926,1997-04-28,1997 Celebrity Jeopardy! game 1.,Jeopardy,"(5, 5)",YOU GOT NERVE,20,"(500,)",False,"Running from the lower back down the leg, the sciatic nerve holds this distinction among the body's nerves",the longest nerve,1,0
2926,1997-04-28,1997 Celebrity Jeopardy! game 1.,Double Jeopardy,"(1, 1)",ANCIENT NEWS BULLETINS,8,"(200,)",False,This 18-year-old boy king of Egypt to be buried in a 220-pound solid gold coffin; hieroglyphics at 11,King Tut,1,0
2926,1997-04-28,1997 Celebrity Jeopardy! game 1.,Double Jeopardy,"(2, 1)",ENTERTAINMENT AWARDS,3,"(200,)",False,"Husband & wife Oscar winners, he won for ""The Color of Money"", she for ""The Three Faces of Eve""",Paul Newman & Joanne Woodward,1,0
2926,1997-04-28,1997 Celebrity Jeopardy! game 1.,Double Jeopardy,"(3, 1)",THE MAIN COURSE,2,"(200,)",False,Baked ham may be topped with rings of this tropical fruit for which Hawaii is famous,pineapple,1,0
2926,1997-04-28,1997 Celebrity Jeopardy! game 1.,Double Jeopardy,"(4, 1)",ART,19,"(200,)",False,The part of the Sistine Chapel on which Michelangelo painted Adam's fall,ceiling,1,0
2926,1997-04-28,1997 Celebrity Jeopardy! game 1.,Double Jeopardy,"(5, 1)",POLITICS,9,"(200,)",False,National elections in the U.S. are held on the first Tuesday after the first Monday of this month,November,1,0
2926,1997-04-28,1997 Celebrity Jeopardy! game 1.,Double Jeopardy,"(6, 1)",CLASSIC BOOKS & AUTHORS,1,"(200,)",False,"He wrote ""The Adventures of Huckleberry Finn"" as a sequel to ""Tom Sawyer""",Mark Twain,1,0
2926,1997-04-28,1997 Celebrity Jeopardy! game 1.,Double Jeopardy,"(2, 2)",ENTERTAINMENT AWARDS,4,"(400,)",False,"With 10, he's won more Emmys as Best Game Show Host than anyone else -- 8 more than you-know-who",Bob Barker,1,1
2926,1997-04-28,1997 Celebrity Jeopardy! game 1.,Double Jeopardy,"(3, 2)",THE MAIN COURSE,15,"(400,)",False,Tuna-noodle is a common variety of this dish named for the dish it's baked in,casserole,1,0
2926,1997-04-28,1997 Celebrity Jeopardy! game 1.,Double Jeopardy,"(4, 2)",ART,23,"(400,)",False,"In this Italian's ""Virgin & Child with Saint Anne"", both women wear smiles rather like his Mona Lisa's",Leonardo da Vinci,1,0
2926,1997-04-28,1997 Celebrity Jeopardy! game 1.,Double Jeopardy,"(5, 2)",POLITICS,10,"(400,)",False,This California city was the site of the 1996 Republican Convention,San Diego,1,1
2926,1997-04-28,1997 Celebrity Jeopardy! game 1.,Double Jeopardy,"(6, 2)",CLASSIC BOOKS & AUTHORS,11,"(400,)",False,"In George Orwell's ""1984"", Big Brother represents this Soviet dictator",Joseph Stalin,1,0
2926,1997-04-28,1997 Celebrity Jeopardy! game 1.,Double Jeopardy,"(2, 3)",ENTERTAINMENT AWARDS,5,"(600,)",False,Patricia Wettig won Emmys for Best Actress & Supporting Actress for the same role in this series,thirtysomething,1,0
2926,1997-04-28,1997 Celebrity Jeopardy! game 1.,Double Jeopardy,"(3, 3)",THE MAIN COURSE,16,"(600,)",False,This device with a rotating spit gives its name to a style of chicken roasted in it,rotisserie,1,0
2926,1997-04-28,1997 Celebrity Jeopardy! game 1.,Double Jeopardy,"(4, 3)",ART,24,"(300,)",True,"Dutch artist Anton Mauve was a relative & counselor of this ""Sunflowers"" painter",Vincent Van Gogh,1,0
2926,1997-04-28,1997 Celebrity Jeopardy! game 1.,Double Jeopardy,"(5, 3)",POLITICS,12,"(600,)",False,In 1996 Sam Brownback won the Kansas Senate seat vacated by this presidential candidate,Bob Dole,1,0
2926,1997-04-28,1997 Celebrity Jeopardy! game 1.,Double Jeopardy,"(6, 3)",CLASSIC BOOKS & AUTHORS,20,"(1000,)",True,"In this Charlotte Bronte novel, Edward Rochester is the moody master of Thornfield Hall","""Jane Eyre""",0,1
2926,1997-04-28,1997 Celebrity Jeopardy! game 1.,Double Jeopardy,"(2, 4)",ENTERTAINMENT AWARDS,6,"(800,)",False,"He won an Obie for his role in ""Driving Miss Daisy"" & received an Oscar nomination for the film version",Morgan Freeman,1,0
2926,1997-04-28,1997 Celebrity Jeopardy! game 1.,Double Jeopardy,"(3, 4)",THE MAIN COURSE,17,"(800,)",False,"This slowly braised beef dish is called ""Yankee"" when it's cooked with vegetables",pot roast,1,0
2926,1997-04-28,1997 Celebrity Jeopardy! game 1.,Double Jeopardy,"(4, 4)",ART,25,"(800,)",False,Beds & couches are common props in the paintings of this psychoanalyst's grandson Lucian,Sigmund Freud,1,0
2926,1997-04-28,1997 Celebrity Jeopardy! game 1.,Double Jeopardy,"(5, 4)",POLITICS,13,"(800,)",False,"Don Young, the congressman from this state, once operated a tugboat on the Yukon River",Alaska,1,0
2926,1997-04-28,1997 Celebrity Jeopardy! game 1.,Double Jeopardy,"(6, 4)",CLASSIC BOOKS & AUTHORS,21,"(800,)",False,"In 1949 she adapted her novel ""The Fountainhead"" for the big screen",Ayn Rand,1,0
2926,1997-04-28,1997 Celebrity Jeopardy! game 1.,Double Jeopardy,"(2, 5)",ENTERTAINMENT AWARDS,7,"(1000,)",False,"From 1991-93 this country star won 3 straight CMA Songwriting Awards, the last for ""I Still Believe in You""",Vince Gill,1,0
2926,1997-04-28,1997 Celebrity Jeopardy! game 1.,Double Jeopardy,"(3, 5)",THE MAIN COURSE,18,"(1000,)",False,"Served over fettuccine, this sauce combines butter, cream, Parmesan cheese & plenty of pepper",Alfredo sauce,1,0
2926,1997-04-28,1997 Celebrity Jeopardy! game 1.,Double Jeopardy,"(4, 5)",ART,26,"(1000,)",False,"In a 1996 movie Jeffrey Wright played this Haitian-American, a star of the 1980s art world",Jean-Michel Basquiat,1,0
2926,1997-04-28,1997 Celebrity Jeopardy! game 1.,Double Jeopardy,"(5, 5)",POLITICS,14,"(1000,)",False,This current Chief Justice of the United States is the 16th man to serve in that post,William Rehnquist,1,1
2926,1997-04-28,1997 Celebrity Jeopardy! game 1.,Double Jeopardy,"(6, 5)",CLASSIC BOOKS & AUTHORS,22,"(1000,)",False,"His 1925 novel ""An American Tragedy"" was based on a real life murder case",Theodore Dreiser,1,0
2926,1997-04-28,1997 Celebrity Jeopardy! game 1.,Final Jeopardy,"(1, 1)",MOUNTAINS,0,"(700, 6500, 10000)",False,"Range of mountains where Danny Kaye, Alan King & Rip Van Winkle gained fame",the Catskills,1,2
