epNum,airDate,extra_info,round_name,coord,category,order,value,daily_double,question,answer,correctAttempts,wrongAttempts
3002,1997-09-23,,Jeopardy,"(1, 1)",BODIES OF WATER,21,"(100,)",False,"The name of this ocean means ""peaceful""",the Pacific,1,0
3002,1997-09-23,,Jeopardy,"(2, 1)",APPROXIMATE WEIGHTS & MEASURES,1,"(100,)",False,"Amount of Brylcreem that'll ""do ya""",a little dab,1,0
3002,1997-09-23,,Jeopardy,"(3, 1)",ATHLETES,26,"(100,)",False,"Appropriately, Swiss teenage tennis star Martina Hingis was named for this woman",Martina Navratilova,1,0
3002,1997-09-23,,Jeopardy,"(4, 1)",THE 1940s,16,"(100,)",False,"On May 13, 1940 he told Britain's House of Commons, ""I have nothing to offer but blood, toil, tears & sweat""",Winston Churchill,1,0
3002,1997-09-23,,Jeopardy,"(5, 1)","""SON""NY",2,"(100,)",False,"By law it's the malicious burning of another's house, or, in some case, your own",arson,1,0
3002,1997-09-23,,Jeopardy,"(6, 1)",CHER FILMS,5,"(100,)",False,Cher won Nicolas Cage's heart & an Oscar in this romantic comedy,Moonstruck,1,0
3002,1997-09-23,,Jeopardy,"(1, 2)",BODIES OF WATER,22,"(400,)",True,It's the smallest & the most easterly of the 5 Great Lakes,Lake Ontario,1,0
3002,1997-09-23,,Jeopardy,"(2, 2)",APPROXIMATE WEIGHTS & MEASURES,12,"(200,)",False,An indefinite-sized mass that forms in the throat when you're a little choked up,a lump,1,0
3002,1997-09-23,,Jeopardy,"(3, 2)",ATHLETES,27,"(200,)",False,"In 1933 he hit in 61 straight games for the San Francisco Seals; he only reached 56 as the ""Yankee Clipper""",Joe DiMaggio,1,0
3002,1997-09-23,,Jeopardy,"(4, 2)",THE 1940s,17,"(200,)",False,"Popular songs of the decade included ""Tennessee Waltz"" & ""Deep In The Heart Of"" this state",Texas,1,0
3002,1997-09-23,,Jeopardy,"(5, 2)","""SON""NY",3,"(200,)",False,Brickwork or stonework,masonry,1,0
3002,1997-09-23,,Jeopardy,"(6, 2)",CHER FILMS,6,"(200,)",False,This film featured Cher as Meryl Streep's gal pal & co-worker at a nuclear plant,Silkwood,1,0
3002,1997-09-23,,Jeopardy,"(1, 3)",BODIES OF WATER,23,"(300,)",False,"Noted for its salmon fishing, the Tay is the longest river of this United Kingdom country",Scotland,1,0
3002,1997-09-23,,Jeopardy,"(2, 3)",APPROXIMATE WEIGHTS & MEASURES,13,"(300,)",False,"Abbreviated ""T"", it can be exact, or when approximate, rounded or heaping",a tablespoon,1,0
3002,1997-09-23,,Jeopardy,"(3, 3)",ATHLETES,28,"(300,)",False,In 1996 boxer Andrew Golota lost twice to Riddick Bowe by committing this foul,hitting below the belt,1,0
3002,1997-09-23,,Jeopardy,"(4, 3)",THE 1940s,18,"(300,)",False,Things developed rapidly after this Edwin Land creation went on sale in 1948,the Polaroid camera,1,0
3002,1997-09-23,,Jeopardy,"(5, 3)","""SON""NY",4,"(300,)",False,"One's public image, as opposed to the inner self",persona,1,0
3002,1997-09-23,,Jeopardy,"(6, 3)",CHER FILMS,7,"(300,)",False,"Cher was a ""bewitching"" sculptor in this movie based on a John Updike novel",The Witches of Eastwick,1,0
3002,1997-09-23,,Jeopardy,"(1, 4)",BODIES OF WATER,24,"(400,)",False,Lake Van in Anatolia is this country's largest lake,Turkey,1,0
3002,1997-09-23,,Jeopardy,"(2, 4)",APPROXIMATE WEIGHTS & MEASURES,14,"(400,)",False,"It's how much o' ""nuthin"" Porgy had",plenty,1,0
3002,1997-09-23,,Jeopardy,"(3, 4)",ATHLETES,29,"(400,)",False,"No. 33 on the Chicago Bulls, this Olympian has played most of his career in the shadow of No. 23",Scottie Pippen,0,3
3002,1997-09-23,,Jeopardy,"(4, 4)",THE 1940s,19,"(400,)",False,"3 days before it was destroyed by the British Navy in May 1941, this German battleship sank the HMS Hood",the Bismarck,1,1
3002,1997-09-23,,Jeopardy,"(5, 4)","""SON""NY",10,"(400,)",False,"This 2-wheeled, horse-drawn vehicle is used to carry coffins at military funerals",caisson,0,3
3002,1997-09-23,,Jeopardy,"(6, 4)",CHER FILMS,8,"(400,)",False,"In this 1985 film, Cher portrayed Rusty Dennis, the mother of a disfigured son",Mask,1,0
3002,1997-09-23,,Jeopardy,"(1, 5)",BODIES OF WATER,25,"(500,)",False,"Botany Bay on the coast of New South Wales, Australia is an inlet of this sea",the Tasman Sea,1,0
3002,1997-09-23,,Jeopardy,"(2, 5)",APPROXIMATE WEIGHTS & MEASURES,15,"(500,)",False,"Robert Frost had to get out of the woods; ""I have"" this far ""to go before I sleep"", he wrote",miles,1,0
3002,1997-09-23,,Jeopardy,"(3, 5)",ATHLETES,30,"(500,)",False,"Golf legend Sam Snead won every one of golf's major championships, except this one",the U.S. Open,0,3
3002,1997-09-23,,Jeopardy,"(4, 5)",THE 1940s,20,"(500,)",False,"On July 1, 1946 the U.S. detonated its first atomic bomb since WWII at this atoll",Bikini,1,0
3002,1997-09-23,,Jeopardy,"(5, 5)","""SON""NY",11,"(500,)",False,"To cast off junk, or to throw overboard, as from a junk",jettison,1,0
3002,1997-09-23,,Jeopardy,"(6, 5)",CHER FILMS,9,"(500,)",False,Chazz Palminteri stars as a hit man hired to kill Cher in this 1996 black comedy,Faithful,0,3
3002,1997-09-23,,Double Jeopardy,"(1, 1)",THAT'S MY BOY!,15,"(200,)",False,This wise son of David wrote songs as well as psalms & divided Israel into 12 administrative parts,Solomon,1,0
3002,1997-09-23,,Double Jeopardy,"(2, 1)",GIRL GROUPS,11,"(200,)",False,"Sandy ""Pepa"" Denton's rap partner Cheryl Jones is nicknamed this","""Salt""",1,0
3002,1997-09-23,,Double Jeopardy,"(3, 1)",PLANTS & TREES,21,"(200,)",False,"Closely related to the Saguaro, night-blooming Cereus is a type of this plant",a cactus,1,0
3002,1997-09-23,,Double Jeopardy,"(4, 1)",MEDICAL SPECIALTIES,26,"(200,)",False,"Term for a specialist who listens for clicks, murmurs, lub-dubs & pitter-patters",cardiologist,1,0
3002,1997-09-23,,Double Jeopardy,"(5, 1)",LANGUAGES,1,"(200,)",False,The Cantonese form of this language is also known as Yue,Chinese,1,0
3002,1997-09-23,,Double Jeopardy,"(6, 1)",SHAKESPEARE'S FIRST WORDS,6,"(200,)",False,"""Two households, both alike in dignity...""",Romeo and Juliet,1,0
3002,1997-09-23,,Double Jeopardy,"(1, 2)",THAT'S MY BOY!,16,"(400,)",False,Constantine I's son George II fled this country during WWII; he returned to rule in 1946,Greece,1,0
3002,1997-09-23,,Double Jeopardy,"(2, 2)",GIRL GROUPS,12,"(400,)",False,This group began as the Primettes; after signing with Motown it changed its name,The Supremes,1,0
3002,1997-09-23,,Double Jeopardy,"(3, 2)",PLANTS & TREES,22,"(400,)",False,The black & English varieties of this tree are valued for their wood & their nuts,a walnut,1,0
3002,1997-09-23,,Double Jeopardy,"(4, 2)",MEDICAL SPECIALTIES,27,"(400,)",False,"Creams, lotions & ointments are the major clinical tools of this skin specialty",dermatology,1,0
3002,1997-09-23,,Double Jeopardy,"(5, 2)",LANGUAGES,2,"(400,)",False,Nederlands is another name for this language,Dutch,1,0
3002,1997-09-23,,Double Jeopardy,"(6, 2)",SHAKESPEARE'S FIRST WORDS,7,"(400,)",False,"""When shall we three meet again""",Macbeth,1,0
3002,1997-09-23,,Double Jeopardy,"(1, 3)",THAT'S MY BOY!,18,"(600,)",False,"Around 1260 this country acquired Greenland & Iceland under Haakon IV, Haakon III's illegitimate son",Norway,1,1
3002,1997-09-23,,Double Jeopardy,"(2, 3)",GIRL GROUPS,13,"(600,)",False,In 1994 L7 gained in popularity as part of this alternative rock tour,Lollapalooza,1,0
3002,1997-09-23,,Double Jeopardy,"(3, 3)",PLANTS & TREES,23,"(600,)",False,This tree gave Ohio its nickname,the buckeye,1,0
3002,1997-09-23,,Double Jeopardy,"(4, 3)",MEDICAL SPECIALTIES,28,"(600,)",False,In the 1990s Prozac & other drugs have revolutionized this specialty's treatment of depression,psychiatry,1,0
3002,1997-09-23,,Double Jeopardy,"(5, 3)",LANGUAGES,3,"(600,)",False,In 1990 Belarusian replaced this as the official language of Belarus,Russian,1,0
3002,1997-09-23,,Double Jeopardy,"(6, 3)",SHAKESPEARE'S FIRST WORDS,8,"(600,)",False,"""Boatswain!""",The Tempest,0,3
3002,1997-09-23,,Double Jeopardy,"(1, 4)",THAT'S MY BOY!,19,"(800,)",False,"Unlike his father Pedro I, Pedro II worked to abolish slavery in this country",Brazil,1,0
3002,1997-09-23,,Double Jeopardy,"(2, 4)",GIRL GROUPS,14,"(1500,)",True,"(VIDEO DAILY DOUBLE):British group seen here in a hit from their debut album:""If you wanna be my lover /You gotta get with my friends /Make it last forever /Friendship never ends...""","The Spice Girls (""Wannabe"")",1,0
3002,1997-09-23,,Double Jeopardy,"(3, 4)",PLANTS & TREES,24,"(800,)",False,The blue gum is one of the most widely cultivated species of this tree,eucalyptus,1,0
3002,1997-09-23,,Double Jeopardy,"(4, 4)",MEDICAL SPECIALTIES,29,"(800,)",False,It's defined as the study of disease & may study the bodies of those killed by a disease,pathology,1,0
3002,1997-09-23,,Double Jeopardy,"(5, 4)",LANGUAGES,4,"(800,)",False,Belize's national anthem is usually sung in this language,English,0,3
3002,1997-09-23,,Double Jeopardy,"(6, 4)",SHAKESPEARE'S FIRST WORDS,9,"(800,)",False,"""O for a muse of fire...""",Henry V,1,0
3002,1997-09-23,,Double Jeopardy,"(1, 5)",THAT'S MY BOY!,20,"(1000,)",False,"The 11th son of Ibn Saud, he led Saudi Arabia during the Gulf War",King Fahd,1,0
3002,1997-09-23,,Double Jeopardy,"(2, 5)",GIRL GROUPS,17,"(1000,)",False,"According to Billboard, The Angels, with this 1963 song, were the 1st all-white girl group to have a No. 1 hit","""My Boyfriend\'s Back""",0,3
3002,1997-09-23,,Double Jeopardy,"(3, 5)",PLANTS & TREES,25,"(500,)",True,"The name of this climbing plant often found on poles is Greek for ""lover of trees""",philodendron,0,1
3002,1997-09-23,,Double Jeopardy,"(4, 5)",MEDICAL SPECIALTIES,30,"(1000,)",False,"A subspecialty of internal medicine, it deals with innards like the stomach & intestines",gastroenterology,1,0
3002,1997-09-23,,Double Jeopardy,"(5, 5)",LANGUAGES,5,"(1000,)",False,"The famous 15th century poem ""Orlando Innamorato"" was written in this language",Italian,1,0
3002,1997-09-23,,Double Jeopardy,"(6, 5)",SHAKESPEARE'S FIRST WORDS,10,"(1000,)",False,"""I learn in this letter that Don Pedro of Arragon comes this night in Messina.""",Much Ado About Nothing,1,0
3002,1997-09-23,,Final Jeopardy,"(1, 1)",HISTORIC GEOGRAPHY,0,"(5300, 5700, 4201)",False,In 1756 Voltaire said of this political entity that none of the 3 parts of its name was accurate,the Holy Roman Empire,2,1
