epNum,airDate,extra_info,round_name,coord,category,order,value,daily_double,question,answer,correctAttempts,wrongAttempts
3058,1997-12-10,,Jeopardy,"(1, 1)",HOODS,14,"(100,)",False,"She remarked on her ""Grandmother's"" tooth size",Little Red Riding Hood,1,0
3058,1997-12-10,,Jeopardy,"(2, 1)",BORN TO KILL,12,"(100,)",False,"They ensnare their prey in silk, then finish them off with poison-dispensing fangs",Spiders,1,0
3058,1997-12-10,,Jeopardy,"(3, 1)",LET'S PLAY CLUE,6,"(100,)",False,This murder weapon could also light up the table in the dining room,Candlestick,1,0
3058,1997-12-10,,Jeopardy,"(4, 1)","WE'RE ""THROUGH""",18,"(100,)",False,"Transparent, as a blouse",See-through,1,0
3058,1997-12-10,,Jeopardy,"(5, 1)",PEN NAMES,1,"(100,)",False,Perhaps this nickname for Alcatraz came from the composition of the island,"""The Rock""",1,0
3058,1997-12-10,,Jeopardy,"(6, 1)",SHAKESPEARE,4,"(100,)",False,"""A Midsummer Night's Dream"" includes the line ""The course of"" this ""never did run smooth""",True love,1,1
3058,1997-12-10,,Jeopardy,"(1, 2)",HOODS,15,"(200,)",False,"The English name of this hooded snake is from Portuguese for ""snake with a hood""",Cobra,1,0
3058,1997-12-10,,Jeopardy,"(2, 2)",BORN TO KILL,13,"(200,)",False,"Types of bear include the brown, black & this one whose name means ""streaked with gray""",Grizzly,1,0
3058,1997-12-10,,Jeopardy,"(3, 2)",LET'S PLAY CLUE,7,"(200,)",False,"In the 1985 film based on Clue, this ""Rocky Horror"" actor played Wadsworth the butler",Tim Curry,1,0
3058,1997-12-10,,Jeopardy,"(4, 2)","WE'RE ""THROUGH""",19,"(200,)",False,It completes a tennis or a golf stroke,Follow-through,1,0
3058,1997-12-10,,Jeopardy,"(5, 2)",PEN NAMES,2,"(200,)",False,John Belushi's alter ego Joliet Jake Blues served time in this state's Joliet Pen,Illinois,1,0
3058,1997-12-10,,Jeopardy,"(6, 2)",SHAKESPEARE,5,"(200,)",False,"To be sure, one of his soliloquies begins, ""How all occasions do inform against me""",Hamlet,1,0
3058,1997-12-10,,Jeopardy,"(1, 3)",HOODS,20,"(300,)",False,"According to his TV theme, he's ""feared by the bad, loved by the good""",Robin Hood,1,1
3058,1997-12-10,,Jeopardy,"(2, 3)",BORN TO KILL,28,"(300,)",False,"To smaller birds, the sharp-shinned type of this predator is as menacing as its name",Hawk,0,3
3058,1997-12-10,,Jeopardy,"(3, 3)",LET'S PLAY CLUE,9,"(300,)",False,"It's the main claim to fame of Anthony E. Pratt, a fire warden in Leeds, England","He invented the game (""Cluedo"")",0,3
3058,1997-12-10,,Jeopardy,"(4, 3)","WE'RE ""THROUGH""",23,"(300,)",False,"A significant advance in science, like the polio vaccine",Breakthrough,1,0
3058,1997-12-10,,Jeopardy,"(5, 3)",PEN NAMES,3,"(300,)",False,The New York prison in this town has the singsong name Sing Sing,Ossining,1,0
3058,1997-12-10,,Jeopardy,"(6, 3)",SHAKESPEARE,8,"(300,)",False,She persuades her husband to kill Duncan,Lady Macbeth,1,0
3058,1997-12-10,,Jeopardy,"(1, 4)",HOODS,26,"(400,)",False,It's the British term for the hood of a car; hopefully there are no bees in it,Bonnet,1,0
3058,1997-12-10,,Jeopardy,"(2, 4)",BORN TO KILL,29,"(400,)",False,This carnivorous member of the sundew family is native only to a small area of the Carolinas,Venus Flytrap,0,3
3058,1997-12-10,,Jeopardy,"(3, 4)",LET'S PLAY CLUE,10,"(400,)",False,He's the only academic among the 6 suspects,Professor Plum,1,0
3058,1997-12-10,,Jeopardy,"(4, 4)","WE'RE ""THROUGH""",24,"(400,)",False,A triple alliterative expression for when someone sticks with you in difficult times,"""Through thick & thin""",1,0
3058,1997-12-10,,Jeopardy,"(5, 4)",PEN NAMES,16,"(400,)",False,"A U.S. Army colonel left this name on a Kansas fort, the town near it & the prison there",Leavenworth,1,0
3058,1997-12-10,,Jeopardy,"(6, 4)",SHAKESPEARE,21,"(400,)",False,In this play Gratiano has the last speech; Portia has the next to last,"""The Merchant of Venice""",1,0
3058,1997-12-10,,Jeopardy,"(1, 5)",HOODS,27,"(500,)",False,Hoodman blind is another name for this game,Blind Man\'s Bluff,0,3
3058,1997-12-10,,Jeopardy,"(2, 5)",BORN TO KILL,30,"(500,)",False,"Pigs may be infected with trichinella spiralis, which causes this disease in humans",Trichinosis,1,0
3058,1997-12-10,,Jeopardy,"(3, 5)",LET'S PLAY CLUE,11,"(500,)",False,"In the U.S. version, the game of Clue starts when this man is found dead in his mansion",Mr. Boddy,1,0
3058,1997-12-10,,Jeopardy,"(4, 5)","WE'RE ""THROUGH""",25,"(500,)",False,"Having undergone a difficult experience, like a wet sock in an old washing machine","""Going through the wringer""",1,0
3058,1997-12-10,,Jeopardy,"(5, 5)",PEN NAMES,17,"(500,)",False,American P.O.W.s called North Vietnam's Hoa Lo Prison this after the hotels known for better accommodations,"""The Hanoi Hilton""",1,0
3058,1997-12-10,,Jeopardy,"(6, 5)",SHAKESPEARE,22,"(1000,)",True,The 1995 film of this play includes the following:,Othello,1,0
3058,1997-12-10,,Double Jeopardy,"(1, 1)",WORLD HISTORY,1,"(200,)",False,"In 1981 this country formally annexed the Golan Heights, land it had held militarily since 1967",Israel,1,0
3058,1997-12-10,,Double Jeopardy,"(2, 1)",RECORD PRODUCERS,30,"(200,)",False,"George Martin, often called a fifth member of this group, can be heard playing keyboard on ""In My Life""",The Beatles,1,0
3058,1997-12-10,,Double Jeopardy,"(3, 1)",AROUND THE U.S.A.,2,"(200,)",False,"Texarkana, Texas was incorporated in 1874; Texarkana in this state wasn't incorporated until 1880",Arkansas,1,0
3058,1997-12-10,,Double Jeopardy,"(4, 1)",CELEBRITY ODD JOBS,7,"(200,)",False,"His early career was so ""Rocky"" he had to sweep out the lion cages at the Central Park Zoo",Sylvester Stallone,1,0
3058,1997-12-10,,Double Jeopardy,"(5, 1)",FOREIGN FOOD & DRINK,5,"(200,)",False,"In Germany this beverage is made of malt, hops, yeast & water & nothing else",Beer,1,0
3058,1997-12-10,,Double Jeopardy,"(6, 1)","IT'S IN THE ""BOOK""",4,"(200,)",False,The 1997 Greater L.A. edition has 17 columns of Smiths & 20 columns of Rodriguezes,Telephone book,1,0
3058,1997-12-10,,Double Jeopardy,"(1, 2)",WORLD HISTORY,8,"(400,)",False,"Magellan visited these islands in 1521; MacArthur visited them in 1942, then returned in 1944",Philippines,1,0
3058,1997-12-10,,Double Jeopardy,"(2, 2)",RECORD PRODUCERS,10,"(400,)",False,"Known for his ""Wall of Sound"", he returned like a ""ghost"" with the 1991 compilation ""Back to Mono""",Phil Spector,1,0
3058,1997-12-10,,Double Jeopardy,"(3, 2)",AROUND THE U.S.A.,3,"(400,)",False,The town of Speedway lies within this Midwest capital,Indianapolis,1,0
3058,1997-12-10,,Double Jeopardy,"(4, 2)",CELEBRITY ODD JOBS,18,"(400,)",False,The Fabulous Baker Boys might know she was a supermarket checker before becoming a superstar,Michelle Pfeiffer,1,0
3058,1997-12-10,,Double Jeopardy,"(5, 2)",FOREIGN FOOD & DRINK,6,"(400,)",False,"This Mexican dish made with mashed avocados can be used as a dip, a sauce or a topping",Guacamole,1,0
3058,1997-12-10,,Double Jeopardy,"(6, 2)","IT'S IN THE ""BOOK""",21,"(400,)",False,It can mean an insect or a person who devours volumes,Bookworm,1,0
3058,1997-12-10,,Double Jeopardy,"(1, 3)",WORLD HISTORY,14,"(600,)",False,"After a 22-year reign, this country's Queen Christina abdicated June 6, 1654",Sweden,1,1
3058,1997-12-10,,Double Jeopardy,"(2, 3)",RECORD PRODUCERS,9,"(2200,)",True,He produced the all-time bestselling pop album by a single artist,"Quincy Jones (for Michael Jackson\'s ""Thriller"")",0,1
3058,1997-12-10,,Double Jeopardy,"(3, 3)",AROUND THE U.S.A.,19,"(600,)",False,This California city hosts America's oldest continuously running jazz festival,Monterey,1,2
3058,1997-12-10,,Double Jeopardy,"(4, 3)",CELEBRITY ODD JOBS,20,"(600,)",False,"The perfect comic ""foil"", this actor who played Young Frankenstein was once a fencing instructor",Gene Wilder,1,0
3058,1997-12-10,,Double Jeopardy,"(5, 3)",FOREIGN FOOD & DRINK,13,"(600,)",False,"This dish whose name comes from French for ""to puff up"" must be served the instant it comes out of the oven",Souffle,1,0
3058,1997-12-10,,Double Jeopardy,"(6, 3)","IT'S IN THE ""BOOK""",27,"(600,)",False,"Bob Hoskins' father was a bookkeeper & Peter O'Toole's father had this ""racier"" profession",Bookmaker/bookie,1,0
3058,1997-12-10,,Double Jeopardy,"(1, 4)",WORLD HISTORY,16,"(800,)",False,"The 1842 Treaty of Nanking ended the first of these ""drug"" wars",Opium Wars,1,0
3058,1997-12-10,,Double Jeopardy,"(2, 4)",RECORD PRODUCERS,11,"(800,)",False,Glen Ballard co-wrote as well as produced this smash hit album by Alanis Morissette,"""Jagged Little Pill""",1,0
3058,1997-12-10,,Double Jeopardy,"(3, 4)",AROUND THE U.S.A.,24,"(800,)",False,"Now the second largest, Nashua is predicted to become this New England state's largest city by the year 2000",New Hampshire,1,0
3058,1997-12-10,,Double Jeopardy,"(4, 4)",CELEBRITY ODD JOBS,22,"(800,)",True,This late comedian was once a Pentecostal preacher:,Sam Kinison,1,0
3058,1997-12-10,,Double Jeopardy,"(5, 4)",FOREIGN FOOD & DRINK,15,"(800,)",False,Risotto Alla Milanese gets its golden color from this expensive spice,Saffron,1,0
3058,1997-12-10,,Double Jeopardy,"(6, 4)","IT'S IN THE ""BOOK""",28,"(800,)",False,"Aimed at women, it's the biggest-selling U.S. magazine that fits the category",Redbook,1,0
3058,1997-12-10,,Double Jeopardy,"(1, 5)",WORLD HISTORY,17,"(1000,)",False,In 1959 a disgruntled Buddhist monk assassinated this country's PM Solomon Bandaranaike,Ceylon/Sri Lanka,0,3
3058,1997-12-10,,Double Jeopardy,"(2, 5)",RECORD PRODUCERS,12,"(1000,)",False,"Appropriately, disco giant Nile Rodgers of Chic produced this man's 1983 album ""Let's Dance""",David Bowie,1,0
3058,1997-12-10,,Double Jeopardy,"(3, 5)",AROUND THE U.S.A.,25,"(1000,)",False,The playing field for a popular outdoor game gave this Kentucky city its name,Bowling Green,1,0
3058,1997-12-10,,Double Jeopardy,"(4, 5)",CELEBRITY ODD JOBS,23,"(1000,)",False,He used to be a cab driver in London; now he's Bond...James Bond,Pierce Brosnan,1,0
3058,1997-12-10,,Double Jeopardy,"(5, 5)",FOREIGN FOOD & DRINK,26,"(1000,)",False,This English blue cheese is named for a small village in Huntingdonshire where it was first sold,Stilton,1,0
3058,1997-12-10,,Double Jeopardy,"(6, 5)","IT'S IN THE ""BOOK""",29,"(1000,)",False,"The 1954 work ""Seduction of the Innocent"" blamed these publications for corrupting America's youth",Comic books,1,0
3058,1997-12-10,,Final Jeopardy,"(1, 1)",WOMEN,0,"(800, 5700, 2401)",False,1 of the 3 women in the only statue that depicts women in the U.S. Capitol Rotunda,"(1 of) Susan B. Anthony, Lucretia Mott & Elizabeth Cady Stanton",1,2
