epNum,airDate,extra_info,round_name,coord,category,order,value,daily_double,question,answer,correctAttempts,wrongAttempts
309,1985-11-14,1985 Tournament of Champions quarterfinal game 4.,Jeopardy,"(1, 1)",INSECTS,19,"(100,)",False,What's done to a pesky mosquito or an acronym for a police special weapons team,swat,1,0
309,1985-11-14,1985 Tournament of Champions quarterfinal game 4.,Jeopardy,"(2, 1)",AMERICAN REVOLUTION,2,"(100,)",False,"“The regulars are out!” he warned Hancock & Adams on April 18, 1775",Paul Revere,1,0
309,1985-11-14,1985 Tournament of Champions quarterfinal game 4.,Jeopardy,"(3, 1)",LAS VEGAS,3,"(100,)",False,"The Sands, Frontier, Desert Inn, & Landmark Hotels were once owned by this mysterious billionaire",Howard Hughes,1,0
309,1985-11-14,1985 Tournament of Champions quarterfinal game 4.,Jeopardy,"(4, 1)",ACTORS & ROLES,14,"(100,)",False,"Since the face wasn't shown, a stand-in stood in for John Travolta in famous opening shot of this film",Saturday Night Fever,1,0
309,1985-11-14,1985 Tournament of Champions quarterfinal game 4.,Jeopardy,"(5, 1)",POTENT POTABLES,1,"(100,)",False,"For wines, it never means the opposite of wet",dry,1,0
309,1985-11-14,1985 Tournament of Champions quarterfinal game 4.,Jeopardy,"(6, 1)",“STREETS”,25,"(100,)",False,Financiers literally made a big impact on this street in October 1929,Wall Street,1,0
309,1985-11-14,1985 Tournament of Champions quarterfinal game 4.,Jeopardy,"(1, 2)",INSECTS,20,"(200,)",False,"Completes a Ben Franklin phrase, “Here skugg lies snug...”",as a bug in a rug,1,0
309,1985-11-14,1985 Tournament of Champions quarterfinal game 4.,Jeopardy,"(2, 2)",AMERICAN REVOLUTION,12,"(200,)",False,"General Howe faced him in Brandywine, Germantown, & Long Island battles",George Washington,0,3
309,1985-11-14,1985 Tournament of Champions quarterfinal game 4.,Jeopardy,"(3, 2)",LAS VEGAS,5,"(200,)",False,"Appropriately, you'll find “The Appian Way” at this hotel casino on The Strip",Caesar\'s Palace,1,0
309,1985-11-14,1985 Tournament of Champions quarterfinal game 4.,Jeopardy,"(4, 2)",ACTORS & ROLES,16,"(200,)",False,"In his 1st feature film, he played The Scarecrow in “The Wiz”",Michael Jackson,1,0
309,1985-11-14,1985 Tournament of Champions quarterfinal game 4.,Jeopardy,"(5, 2)",POTENT POTABLES,4,"(200,)",False,"Bacardi, America's single best-selling brand of liquor, is this type",rum,1,0
309,1985-11-14,1985 Tournament of Champions quarterfinal game 4.,Jeopardy,"(6, 2)",“STREETS”,26,"(200,)",False,"London street where in the '60s, you'd find the mods & the miniskirts",Carnaby Street,1,0
309,1985-11-14,1985 Tournament of Champions quarterfinal game 4.,Jeopardy,"(1, 3)",INSECTS,21,"(300,)",False,It's the shortest route taken back to the hive,beeline,1,0
309,1985-11-14,1985 Tournament of Champions quarterfinal game 4.,Jeopardy,"(2, 3)",AMERICAN REVOLUTION,13,"(300,)",False,"Now site of a military academy, Benedict Arnold plotted to turn over its fort to the British",West Point,1,0
309,1985-11-14,1985 Tournament of Champions quarterfinal game 4.,Jeopardy,"(3, 3)",LAS VEGAS,6,"(300,)",False,The smallest denomination of coin that can be played in Las Vegas slots,penny,1,0
309,1985-11-14,1985 Tournament of Champions quarterfinal game 4.,Jeopardy,"(4, 3)",ACTORS & ROLES,17,"(300,)",False,The queen Glenda Jackson played in “Mary Queen of Scots” & PBS mini-series,Queen Elizabeth I,1,0
309,1985-11-14,1985 Tournament of Champions quarterfinal game 4.,Jeopardy,"(5, 3)",POTENT POTABLES,9,"(300,)",False,This series built around wine currently makes your TV a potent portable,Falcon Crest,1,0
309,1985-11-14,1985 Tournament of Champions quarterfinal game 4.,Jeopardy,"(6, 3)",“STREETS”,27,"(500,)",True,"[Audio DD] In 1978, Gerry Rafferty found his way down this street:",Baker Street,0,1
309,1985-11-14,1985 Tournament of Champions quarterfinal game 4.,Jeopardy,"(1, 4)",INSECTS,22,"(400,)",False,The actual title of “Jimmy Crack Corn”,The Blue Tail Fly,1,0
309,1985-11-14,1985 Tournament of Champions quarterfinal game 4.,Jeopardy,"(2, 4)",AMERICAN REVOLUTION,15,"(400,)",False,Helping us fight bankrupted this country & sent it into internal revolution,France,1,0
309,1985-11-14,1985 Tournament of Champions quarterfinal game 4.,Jeopardy,"(3, 4)",LAS VEGAS,7,"(400,)",False,“Sparkling” nickname for Fremont St. in downtown Las Vegas,Glitter Gulch,1,0
309,1985-11-14,1985 Tournament of Champions quarterfinal game 4.,Jeopardy,"(4, 4)",ACTORS & ROLES,18,"(400,)",False,Both Susan Blakely & Jessica Lange played this tragic Hollywood actress in 1980s films,Frances Farmer,1,0
309,1985-11-14,1985 Tournament of Champions quarterfinal game 4.,Jeopardy,"(5, 4)",POTENT POTABLES,10,"(400,)",False,"Brooklynite Jennie Churchill, Winston's mother, created this whiskey & vermouth cocktail",Manhattan,1,0
309,1985-11-14,1985 Tournament of Champions quarterfinal game 4.,Jeopardy,"(6, 4)",“STREETS”,28,"(400,)",False,1973 Martin Scorsese film starring Robert De Niro about hoodlums in NYC's Little Italy,Mean Streets,1,0
309,1985-11-14,1985 Tournament of Champions quarterfinal game 4.,Jeopardy,"(1, 5)",INSECTS,23,"(500,)",False,"Of its varieties, the atlas is 1 of the largest & the death's head hawk chirps by blowing its nose",moths,0,3
309,1985-11-14,1985 Tournament of Champions quarterfinal game 4.,Jeopardy,"(2, 5)",AMERICAN REVOLUTION,24,"(500,)",False,"This building marked by a grasshopper weather vane, gained nickname “The cradle of liberty”",Faneuil Hall,1,1
309,1985-11-14,1985 Tournament of Champions quarterfinal game 4.,Jeopardy,"(3, 5)",LAS VEGAS,8,"(500,)",False,Pastoral meaning of “Las Vegas” in English inappropriate to its desert locale,the meadows,0,3
309,1985-11-14,1985 Tournament of Champions quarterfinal game 4.,Jeopardy,"(5, 5)",POTENT POTABLES,11,"(500,)",False,Slivovitz is a brandy made from this fruit,plum,0,3
309,1985-11-14,1985 Tournament of Champions quarterfinal game 4.,Jeopardy,"(6, 5)",“STREETS”,29,"(500,)",False,"The band that made Asbury Park, N.J. & Bruce Springsteen famous",the E Street Band,1,0
309,1985-11-14,1985 Tournament of Champions quarterfinal game 4.,Double Jeopardy,"(1, 1)",STATE MOTTOS,18,"(200,)",False,"According to Ohio's, “All things are possible” with him",God,1,0
309,1985-11-14,1985 Tournament of Champions quarterfinal game 4.,Double Jeopardy,"(2, 1)",HIGHER EDUCATION,7,"(200,)",False,"They say “You can always tell a Harvard man, but you can't tell him” this",much,1,0
309,1985-11-14,1985 Tournament of Champions quarterfinal game 4.,Double Jeopardy,"(3, 1)",FAIRY TALES,1,"(200,)",False,“The Ugly Duckling” was autobiographical for this shy author,Hans Christian Andersen,1,0
309,1985-11-14,1985 Tournament of Champions quarterfinal game 4.,Double Jeopardy,"(4, 1)",10-LETTER WORDS,23,"(200,)",False,"Wrinkled or furrowed, as cardboard or iron",corrugated,1,0
309,1985-11-14,1985 Tournament of Champions quarterfinal game 4.,Double Jeopardy,"(5, 1)",MAN IN SPACE,10,"(200,)",False,Country which had the 1st woman to walk in space,Soviet Union,1,0
309,1985-11-14,1985 Tournament of Champions quarterfinal game 4.,Double Jeopardy,"(6, 1)",NUTS,6,"(200,)",False,"A triangular-shaped nut grown in North America & Europe, or a brand of baby food",Beech Nut,1,0
309,1985-11-14,1985 Tournament of Champions quarterfinal game 4.,Double Jeopardy,"(1, 2)",STATE MOTTOS,19,"(400,)",False,"In 1956, Congress adopted this 4-word Florida motto to be our national motto",In God We Trust,1,0
309,1985-11-14,1985 Tournament of Champions quarterfinal game 4.,Double Jeopardy,"(2, 2)",HIGHER EDUCATION,8,"(400,)",False,"Pentecostal revivalist turned Methodist, in 1965 he founded a Tulsa, Oklahoma university",Oral Roberts,1,0
309,1985-11-14,1985 Tournament of Champions quarterfinal game 4.,Double Jeopardy,"(3, 2)",FAIRY TALES,2,"(400,)",False,"When Rapunzel did this, it wasn't her way of being informal",let down her hair,1,0
309,1985-11-14,1985 Tournament of Champions quarterfinal game 4.,Double Jeopardy,"(4, 2)",10-LETTER WORDS,27,"(400,)",False,Mercy killing,euthanasia,1,0
309,1985-11-14,1985 Tournament of Champions quarterfinal game 4.,Double Jeopardy,"(5, 2)",MAN IN SPACE,11,"(400,)",False,"On Sept. 29, 1985 this film director activated “META”, a radio to contact extra-terrestrials",Steven Spielberg,1,0
309,1985-11-14,1985 Tournament of Champions quarterfinal game 4.,Double Jeopardy,"(6, 2)",NUTS,16,"(400,)",False,America's leading pecan-growing state,Georgia,1,0
309,1985-11-14,1985 Tournament of Champions quarterfinal game 4.,Double Jeopardy,"(1, 3)",STATE MOTTOS,24,"(600,)",False,"Virginia's state motto, which John Wilkes Booth yelled as he shot Lincoln",Sic Semper Tyrannis,1,1
309,1985-11-14,1985 Tournament of Champions quarterfinal game 4.,Double Jeopardy,"(2, 3)",HIGHER EDUCATION,9,"(600,)",False,This D.C. university is America's oldest Roman Catholic-sponsored college,Georgetown,1,0
309,1985-11-14,1985 Tournament of Champions quarterfinal game 4.,Double Jeopardy,"(3, 3)",FAIRY TALES,3,"(600,)",False,"“Not I” said the duck & the cat & the dog when she asked them, “Who will thresh the wheat?”",The Little Red Hen,1,0
309,1985-11-14,1985 Tournament of Champions quarterfinal game 4.,Double Jeopardy,"(4, 3)",10-LETTER WORDS,28,"(600,)",False,"At record companies, it's what the “R” in “A & R” stands for",repertoire,0,3
309,1985-11-14,1985 Tournament of Champions quarterfinal game 4.,Double Jeopardy,"(5, 3)",MAN IN SPACE,13,"(600,)",False,"Apollo 11 astronauts Armstrong, Collins & Aldrin each also flew in this program",Gemini,1,0
309,1985-11-14,1985 Tournament of Champions quarterfinal game 4.,Double Jeopardy,"(6, 3)",NUTS,20,"(600,)",False,This variety of nut is grown only in the country it's named for & adjacent lands,Brazil nut,1,0
309,1985-11-14,1985 Tournament of Champions quarterfinal game 4.,Double Jeopardy,"(1, 4)",STATE MOTTOS,25,"(800,)",True,"“If you seek a pleasant peninsula look around you”, which is apt since this state consists of 2",Michigan,1,0
309,1985-11-14,1985 Tournament of Champions quarterfinal game 4.,Double Jeopardy,"(2, 4)",HIGHER EDUCATION,12,"(800,)",False,South Carolina military college whose name sound like a fortress,The Citadel,1,0
309,1985-11-14,1985 Tournament of Champions quarterfinal game 4.,Double Jeopardy,"(3, 4)",FAIRY TALES,4,"(800,)",False,"To become the “Sleeping Beauty”, the princess pricked her hand on this part of the spinning wheel",spindle,1,0
309,1985-11-14,1985 Tournament of Champions quarterfinal game 4.,Double Jeopardy,"(4, 4)",10-LETTER WORDS,29,"(800,)",False,"In Latin, rosa, rosae, rosam, for example",declension,1,1
309,1985-11-14,1985 Tournament of Champions quarterfinal game 4.,Double Jeopardy,"(5, 4)",MAN IN SPACE,14,"(800,)",False,"Called “Drogues”, they open during a capsule's descent",parachutes,1,0
309,1985-11-14,1985 Tournament of Champions quarterfinal game 4.,Double Jeopardy,"(6, 4)",NUTS,21,"(800,)",False,"In order to produce this green-kerneled nut, male & female trees must be near each other",pistachio,1,0
309,1985-11-14,1985 Tournament of Champions quarterfinal game 4.,Double Jeopardy,"(1, 5)",STATE MOTTOS,26,"(1000,)",False,"His words became North Dakota motto, “Liberty & Union, Now & Forever, One & Inseparable”",Daniel Webster,0,3
309,1985-11-14,1985 Tournament of Champions quarterfinal game 4.,Double Jeopardy,"(2, 5)",HIGHER EDUCATION,15,"(1000,)",False,"In 1804, this merchant got Rhode Island College to rename itself after him by donating $5000",(Nicholas) Brown,1,0
309,1985-11-14,1985 Tournament of Champions quarterfinal game 4.,Double Jeopardy,"(3, 5)",FAIRY TALES,5,"(1000,)",False,It lay in the house that Jack built,malt,0,3
309,1985-11-14,1985 Tournament of Champions quarterfinal game 4.,Double Jeopardy,"(4, 5)",10-LETTER WORDS,30,"(1000,)",True,"From German for “rear”, it's the region behind a coast or remote from other cities",hinterland,1,0
309,1985-11-14,1985 Tournament of Champions quarterfinal game 4.,Double Jeopardy,"(5, 5)",MAN IN SPACE,17,"(1000,)",False,"In February, 1984, the Soviets reactivated this space station",Salyut 7,0,3
309,1985-11-14,1985 Tournament of Champions quarterfinal game 4.,Double Jeopardy,"(6, 5)",NUTS,22,"(1000,)",False,"In the musical “South Pacific”, Bloody Mary was said to chew these nuts which blacken the teeth",betel nuts,1,0
309,1985-11-14,1985 Tournament of Champions quarterfinal game 4.,Final Jeopardy,"(1, 1)",U.S. GOVERNMENT,0,"(1000, 3000, 1000)",False,"Individual receiving 2nd-highest U.S. gov't salary -- $104,700 per year excluding expenses",chief justice,2,1
