epNum,airDate,extra_info,round_name,coord,category,order,value,daily_double,question,answer,correctAttempts,wrongAttempts
3155,1998-04-24,,Jeopardy,"(1, 1)",AROUND THE WORLD,5,"(100,)",False,"It wasn't until 1954, the year after it was first scaled, that a survey set it at 29,028 feet",Mount Everest,1,0
3155,1998-04-24,,Jeopardy,"(2, 1)",UNDER THE COVERS,6,"(100,)",False,"Siouxie & the Banshees' cover version of this group's ""Dear Prudence"" hit No. 3 in the U.K.",The Beatles,1,0
3155,1998-04-24,,Jeopardy,"(3, 1)",RIGHT HAND MEN,8,"(100,)",False,Snap!Crackle!_____,Pop!,1,0
3155,1998-04-24,,Jeopardy,"(4, 1)",BETTER MOUSETRAPS,21,"(100,)",False,This swimsuit made its debut shortly after the appearance of a mushroom cloud over this Pacific atoll,Bikini,1,0
3155,1998-04-24,,Jeopardy,"(6, 1)","""CHECK"" PLEASE",1,"(100,)",False,It's the annual general physical exam your doctor gives you,Checkup,1,0
3155,1998-04-24,,Jeopardy,"(1, 2)",AROUND THE WORLD,17,"(200,)",False,"Small ships can travel from this river's mouth 2,300 miles upstream to Iquitos, Peru",Amazon,1,0
3155,1998-04-24,,Jeopardy,"(2, 2)",UNDER THE COVERS,7,"(200,)",True,Dexy's Midnight Runners No. 1 hit heard here in a version by ska band Save Ferris:,"""Come On Eileen""",0,1
3155,1998-04-24,,Jeopardy,"(3, 2)",RIGHT HAND MEN,12,"(200,)",False,"Tom,Dick,_____",Harry,1,0
3155,1998-04-24,,Jeopardy,"(4, 2)",BETTER MOUSETRAPS,22,"(200,)",False,Keep your coffee warm in one of these bottles invented by Sir James Dewar in 1892,Thermos,1,0
3155,1998-04-24,,Jeopardy,"(5, 2)",WHAT'LL YA HAVE?,27,"(200,)",False,Juice of 1/2 lime1/2 oz. triple sec1 oz. tequila in a salt-rimmed glass,Margarita,1,1
3155,1998-04-24,,Jeopardy,"(6, 2)","""CHECK"" PLEASE",2,"(200,)",False,It's the all-too-common lie about payment being on the way,The check\'s in the mail,1,0
3155,1998-04-24,,Jeopardy,"(1, 3)",AROUND THE WORLD,18,"(300,)",False,"It's 8 stories high, cylindrical in shape & about 14 feet off the perpendicular",Leaning Tower of Pisa,1,0
3155,1998-04-24,,Jeopardy,"(2, 3)",UNDER THE COVERS,9,"(300,)",False,"In 1996 the Fugees updated her 1973 hit ""Killing Me Softly""",Roberta Flack,1,0
3155,1998-04-24,,Jeopardy,"(3, 3)",RIGHT HAND MEN,13,"(300,)",False,"Wynken,Blynken,_____",Nod,1,0
3155,1998-04-24,,Jeopardy,"(4, 3)",BETTER MOUSETRAPS,23,"(300,)",False,"Sure hope this guy didn't ""blimp"" up while celebrating his invention of vulcanized rubber",Charles Goodyear,1,0
3155,1998-04-24,,Jeopardy,"(5, 3)",WHAT'LL YA HAVE?,26,"(300,)",False,Fresh mint1/2 tsp. sugarbourbon,Mint julep,1,0
3155,1998-04-24,,Jeopardy,"(6, 3)","""CHECK"" PLEASE",3,"(300,)",False,"Singer heard here with the Fat Boys, updating one of his hits:(""The Twist"")",Chubby Checker,1,0
3155,1998-04-24,,Jeopardy,"(1, 4)",AROUND THE WORLD,19,"(400,)",False,"Anything but boring are the Northern Lights, also known by this Latin name",Aurora Borealis,1,0
3155,1998-04-24,,Jeopardy,"(2, 4)",UNDER THE COVERS,10,"(400,)",False,"This artist wrote & sang ""Kiss"", later covered by the Art of Noise & Tom Jones",Prince,1,0
3155,1998-04-24,,Jeopardy,"(3, 4)",RIGHT HAND MEN,14,"(400,)",False,"Tinker,Evers,_____",Chance,1,0
3155,1998-04-24,,Jeopardy,"(4, 4)",BETTER MOUSETRAPS,24,"(400,)",False,Cool!  He discovered his deep freezing method for food while in Labrador on a fur trading expedition,Clarence Birdseye,1,0
3155,1998-04-24,,Jeopardy,"(5, 4)",WHAT'LL YA HAVE?,29,"(400,)",False,1 oz. vodka1 oz. Kahluafresh cream,White Russian,1,1
3155,1998-04-24,,Jeopardy,"(6, 4)","""CHECK"" PLEASE",4,"(400,)",False,Americans who crossed the Berlin Wall to East Berlin used the guard station on Friedrichstrasse nicknamed this,"""Checkpoint Charlie""",1,0
3155,1998-04-24,,Jeopardy,"(1, 5)",AROUND THE WORLD,20,"(500,)",False,"1,250-mile-long wonder seen here:",Great Barrier Reef,1,0
3155,1998-04-24,,Jeopardy,"(2, 5)",UNDER THE COVERS,11,"(500,)",False,"Dolly Parton & 10,000 Maniacs have ridden to success with versions of this Cat Stevens song","""Peace Train""",0,3
3155,1998-04-24,,Jeopardy,"(3, 5)",RIGHT HAND MEN,15,"(500,)",False,"Shadrach,Meshach,_____",Abednego,1,0
3155,1998-04-24,,Jeopardy,"(4, 5)",BETTER MOUSETRAPS,25,"(500,)",False,This blacksmith improved the plow in the late 1830s by building the first one of steel,John Deere,1,0
3155,1998-04-24,,Jeopardy,"(5, 5)",WHAT'LL YA HAVE?,28,"(500,)",False,2 jiggers gin1 tbsp. sugarjuice of 1/2 lemonjuice of 1/2 limeclub soda,Gin fizz,0,3
3155,1998-04-24,,Jeopardy,"(6, 5)","""CHECK"" PLEASE",16,"(500,)",False,This system of government confers enough power on each of its branches to restrain the others,Checks and balances,1,0
3155,1998-04-24,,Double Jeopardy,"(1, 1)",JAZZ NICKNAMES,3,"(200,)",False,He was known as Pops as well as Satchmo,Louis Armstrong,1,0
3155,1998-04-24,,Double Jeopardy,"(2, 1)",FROM BEOWULF TO VIRGINIA WOOLF,1,"(200,)",False,"To avenge this monster's death, his mother slays a soldier but is later killed by Beowulf",Grendel,1,0
3155,1998-04-24,,Double Jeopardy,"(4, 1)","AND YOUR LITTLE DOG, TOO",13,"(200,)",False,"In ""The Wizard of Oz"", a cute Cairn terrier named Terry played this little dog",Toto,1,0
3155,1998-04-24,,Double Jeopardy,"(5, 1)",NATURE,20,"(200,)",False,"Japanese for ""harbor wave"", one of these giant sea waves may form a wall of water over 100 feet long",Tsunami,1,0
3155,1998-04-24,,Double Jeopardy,"(6, 1)",HOMOPHONES,9,"(200,)",False,"With a relaxed dress code, you won't need to wear one at this type of Asian restaurant's bar",Tie/Thai,1,0
3155,1998-04-24,,Double Jeopardy,"(1, 2)",JAZZ NICKNAMES,4,"(400,)",False,"With this nickname, Julian Edwin Adderly barrelled down ""Them Dirty Blues""",Cannonball,1,0
3155,1998-04-24,,Double Jeopardy,"(2, 2)",FROM BEOWULF TO VIRGINIA WOOLF,2,"(400,)",False,This author planned to have each pilgrim tell 2 tales on the way to Canterbury & 2 on the way back,Geoffrey Chaucer,1,0
3155,1998-04-24,,Double Jeopardy,"(4, 2)","AND YOUR LITTLE DOG, TOO",14,"(400,)",False,"He starred in the cartoon ""Canine Casanova"" without his master Mickey Mouse",Pluto,1,0
3155,1998-04-24,,Double Jeopardy,"(5, 2)",NATURE,21,"(400,)",False,"From the Greek word for ""drop"" & ""dripping"", they're the 2 types of formations seen here:",Stalagmites & stalactites,0,3
3155,1998-04-24,,Double Jeopardy,"(6, 2)",HOMOPHONES,10,"(400,)",False,"Zebulon Pike got only this glimpse of this, his namesake",Peek/peak,1,0
3155,1998-04-24,,Double Jeopardy,"(1, 3)",JAZZ NICKNAMES,8,"(600,)",False,"Oran Page, trumpeter & accompanist to Bessie Smith, was known as this, the same as a ""M*A*S*H"" nurse",Hot Lips,1,0
3155,1998-04-24,,Double Jeopardy,"(2, 3)",FROM BEOWULF TO VIRGINIA WOOLF,5,"(600,)",False,John Milton's 1671 sequel never gained the reputation of this 1667 epic,"""Paradise Lost""",1,0
3155,1998-04-24,,Double Jeopardy,"(4, 3)","AND YOUR LITTLE DOG, TOO",15,"(2000,)",True,"Title character who sang the following about her dog (""Sandy"") in a 1982 film:",Annie,1,0
3155,1998-04-24,,Double Jeopardy,"(5, 3)",NATURE,23,"(600,)",False,"Since prehistoric times, this single-celled fungus has been used to make beer & bread",Yeast,1,0
3155,1998-04-24,,Double Jeopardy,"(6, 3)",HOMOPHONES,18,"(600,)",False,What Hurricane Andrew did or how some people felt when he did it,Blew/blue,1,0
3155,1998-04-24,,Double Jeopardy,"(1, 4)",JAZZ NICKNAMES,11,"(800,)",False,"He's referrred to as the ""Hi De Ho"" man",Cab Calloway,1,0
3155,1998-04-24,,Double Jeopardy,"(2, 4)",FROM BEOWULF TO VIRGINIA WOOLF,6,"(800,)",False,"""All you need to know"", according to this Keats ode is ""Beauty is truth, truth beauty""","""Ode on A Grecian Urn""",0,3
3155,1998-04-24,,Double Jeopardy,"(3, 4)",MAY DAY!  MAY DAY!,27,"(800,)",False,"This singer heard here was born on May 1, 1909:(""God Bless America"")",Kate Smith,1,0
3155,1998-04-24,,Double Jeopardy,"(4, 4)","AND YOUR LITTLE DOG, TOO",16,"(800,)",False,"This pet of Nick & Nora Charles was a schnauzer in the novel ""The Thin Man"" & a fox terrier in the films",Asta,1,0
3155,1998-04-24,,Double Jeopardy,"(5, 4)",NATURE,24,"(800,)",False,In the 1940s zoologist Karl von Frisch discovered that bees use this as a compass,Sun,0,3
3155,1998-04-24,,Double Jeopardy,"(6, 4)",HOMOPHONES,19,"(800,)",False,"When a hunter aims at this red deer, this often beats faster",Hart/heart,1,0
3155,1998-04-24,,Double Jeopardy,"(1, 5)",JAZZ NICKNAMES,12,"(1000,)",False,"That he was born as an Armando in 1941 should tell you this ""Chick"" is a guy",Chick Corea,1,0
3155,1998-04-24,,Double Jeopardy,"(2, 5)",FROM BEOWULF TO VIRGINIA WOOLF,7,"(1000,)",False,In this essay Virginia Woolf said women need money & privacy to develop as writers,"""A Room of One\'s Own""",1,0
3155,1998-04-24,,Double Jeopardy,"(3, 5)",MAY DAY!  MAY DAY!,26,"(1000,)",False,"The ""Great Exhibition"" of industry opened at the Crystal Palace in this city May 1, 1851",London,1,0
3155,1998-04-24,,Double Jeopardy,"(4, 5)","AND YOUR LITTLE DOG, TOO",17,"(1000,)",False,"When this tobacco heiress died in 1993, she left a $100,000 trust fund to her dog Minni",Doris Duke,1,0
3155,1998-04-24,,Double Jeopardy,"(5, 5)",NATURE,25,"(1000,)",True,"Named for its most prominent feature (its nose), it's the primate seen here:",Proboscis monkey,1,0
3155,1998-04-24,,Double Jeopardy,"(6, 5)",HOMOPHONES,22,"(1000,)",False,He might predict you'll wind up with more money than expenses,Prophet/profit,0,3
3155,1998-04-24,,Final Jeopardy,"(1, 1)",ACTRESSES & ROLE,0,"(3399, 650, 7701)",False,Kathy Bates played her in 1997; Debbie Reynolds played her in 1964,"(\""The Unsinkable\"") Molly Brown",2,1
