epNum,airDate,extra_info,round_name,coord,category,order,value,daily_double,question,answer,correctAttempts,wrongAttempts
3178,1998-05-27,Lara Robillard game 2.,Jeopardy,"(1, 1)",BALLET IN THE '90s,1,"(100,)",False,"Of Jerome Robbins' ballet based on this musical, New York Magazine quipped, ""When you're a Jete...""",West Side Story,1,0
3178,1998-05-27,Lara Robillard game 2.,Jeopardy,"(2, 1)","""ACE"" IN THE HOLE",7,"(100,)",False,Indiana's NBA team,Indiana Pacers,1,0
3178,1998-05-27,Lara Robillard game 2.,Jeopardy,"(3, 1)",WOMEN IN SPORTS,3,"(100,)",False,400-meter star Cathy Freeman is the first of these indigenous Australians to win a world track gold medal,Aborigines,1,0
3178,1998-05-27,Lara Robillard game 2.,Jeopardy,"(4, 1)",OVER THE RIVER,23,"(100,)",False,"Before its completion in 1917, the Quebec railway bridge over this river collapsed twice",St. Lawrence River,1,0
3178,1998-05-27,Lara Robillard game 2.,Jeopardy,"(5, 1)",THROUGH THE WOODS,19,"(100,)",False,"""Don't sit under"" this hardwood ""tree with anyone else but me""",Apple tree,1,0
3178,1998-05-27,Lara Robillard game 2.,Jeopardy,"(6, 1)",TO GRANDMOTHER'S HOUSE WE GO,16,"(100,)",False,Just because Grandma collects these shakers doesn't mean there's too much sodium in her diet,Salt shakers,1,0
3178,1998-05-27,Lara Robillard game 2.,Jeopardy,"(1, 2)",BALLET IN THE '90s,11,"(200,)",False,"Matthew Bourne set his innovative new production of ""Cinderella"" in this city during the Blitz",London,1,0
3178,1998-05-27,Lara Robillard game 2.,Jeopardy,"(2, 2)","""ACE"" IN THE HOLE",8,"(200,)",False,A rhytidectomy; it's a nip & tuck done on the mug,Facelift,1,0
3178,1998-05-27,Lara Robillard game 2.,Jeopardy,"(3, 2)",WOMEN IN SPORTS,4,"(200,)",False,She had won 7 of 9 Grand Slam singles events when she was stabbed & wounded in 1993,Monica Seles,1,0
3178,1998-05-27,Lara Robillard game 2.,Jeopardy,"(4, 2)",OVER THE RIVER,25,"(200,)",False,"Clevelander Hart Crane's great poem ""The Bridge"" praises this one across NYC's East River",Brooklyn Bridge,1,0
3178,1998-05-27,Lara Robillard game 2.,Jeopardy,"(5, 2)",THROUGH THE WOODS,21,"(200,)",False,It precedes alder & Hazel & you may ask if it's a good one or a bad one,Witch,1,0
3178,1998-05-27,Lara Robillard game 2.,Jeopardy,"(6, 2)",TO GRANDMOTHER'S HOUSE WE GO,17,"(200,)",False,"Grandma collects this man's albums & has read his memoir ""The Kingdom Of Swing"" 25 times",Benny Goodman,1,0
3178,1998-05-27,Lara Robillard game 2.,Jeopardy,"(1, 3)",BALLET IN THE '90s,12,"(300,)",False,"We hope the Artist Formerly Known As this saw ""Billboards"", a rock ballet danced to his music",Prince,1,0
3178,1998-05-27,Lara Robillard game 2.,Jeopardy,"(2, 3)","""ACE"" IN THE HOLE",9,"(300,)",False,Keyboard button that may have the following symbol: (arrow pointing toward left),Backspace,1,0
3178,1998-05-27,Lara Robillard game 2.,Jeopardy,"(3, 3)",WOMEN IN SPORTS,5,"(300,)",False,Paula Newby-Fraser could be called Ironwoman for winning this Ironman event 7 times from 1986 to 1994,Triathlon,1,0
3178,1998-05-27,Lara Robillard game 2.,Jeopardy,"(4, 3)",OVER THE RIVER,26,"(300,)",False,This type of movable bridge that protected castles is also used to permit river traffic,Drawbridge,1,0
3178,1998-05-27,Lara Robillard game 2.,Jeopardy,"(5, 3)",THROUGH THE WOODS,22,"(300,)",False,By the year 2000 a species of this tree that's resistant to that dreaded Dutch disease should be available,American elm,1,0
3178,1998-05-27,Lara Robillard game 2.,Jeopardy,"(6, 3)",TO GRANDMOTHER'S HOUSE WE GO,18,"(300,)",False,On Grandma's wall there's a picture of this president from his Navy days on a PT boat,John F. Kennedy,1,0
3178,1998-05-27,Lara Robillard game 2.,Jeopardy,"(1, 4)",BALLET IN THE '90s,13,"(400,)",False,The 18 vampire brides in the Houston Ballet's show about this count could be called the corpse de ballet,Count Dracula,1,0
3178,1998-05-27,Lara Robillard game 2.,Jeopardy,"(2, 4)","""ACE"" IN THE HOLE",10,"(400,)",False,One goes between the dinner plate & the dinner table,Placemat,1,0
3178,1998-05-27,Lara Robillard game 2.,Jeopardy,"(3, 4)",WOMEN IN SPORTS,6,"(400,)",False,In 1997 this gymnast who vaulted hurt at the '96 Olympics went to Israel for the Maccabiah Games,Kerri Strug,1,0
3178,1998-05-27,Lara Robillard game 2.,Jeopardy,"(4, 4)",OVER THE RIVER,29,"(500,)",True,"River crossed by the Allenby, or King Hussein, Bridge",Jordan River,0,1
3178,1998-05-27,Lara Robillard game 2.,Jeopardy,"(5, 4)",THROUGH THE WOODS,24,"(400,)",False,"This hardwood may not be cheap, but it is an anagram of cheap",Peach,1,0
3178,1998-05-27,Lara Robillard game 2.,Jeopardy,"(6, 4)",TO GRANDMOTHER'S HOUSE WE GO,20,"(400,)",False,Grandma still has the diaries she wrote at this Poughkeepsie  school before it went co-ed,Vassar,1,0
3178,1998-05-27,Lara Robillard game 2.,Jeopardy,"(1, 5)",BALLET IN THE '90s,14,"(500,)",False,In just 2 months in 1993 the NYCB presented 73 works by this late Russian-American choreographer,George Balanchine,1,0
3178,1998-05-27,Lara Robillard game 2.,Jeopardy,"(2, 5)","""ACE"" IN THE HOLE",2,"(500,)",False,"Whales, dolphins & porpoises",Cetaceans,0,3
3178,1998-05-27,Lara Robillard game 2.,Jeopardy,"(3, 5)",WOMEN IN SPORTS,15,"(500,)",False,"In 1993 Marge Schott, owner of this team, was suspended for making racist remarks",Cincinnati Reds,1,0
3178,1998-05-27,Lara Robillard game 2.,Jeopardy,"(4, 5)",OVER THE RIVER,30,"(500,)",False,"Puente de Piedras is a centuries-old bridge in this country where ""The Bridge Of San Luis Rey"" is set",Peru,1,1
3178,1998-05-27,Lara Robillard game 2.,Jeopardy,"(5, 5)",THROUGH THE WOODS,27,"(500,)",False,It's the hardwood used to make clarinets & some piano keys,Ebony,1,0
3178,1998-05-27,Lara Robillard game 2.,Jeopardy,"(6, 5)",TO GRANDMOTHER'S HOUSE WE GO,28,"(500,)",False,"Grandma loves the puppy pictures on the plates she collects from this ""exchange""",The Bradford Exchange,0,3
3178,1998-05-27,Lara Robillard game 2.,Double Jeopardy,"(1, 1)",FICTIONAL CHARACTERS,1,"(200,)",False,Get too close to this beloved of Quasimodo & he might just ring your bell,Esmeralda,1,0
3178,1998-05-27,Lara Robillard game 2.,Double Jeopardy,"(2, 1)",NOT-SO-MAD SCIENTISTS,13,"(200,)",False,"The ""E"" in his equation, E=mc(squared), stands for energy, not his name",Albert Einstein,1,0
3178,1998-05-27,Lara Robillard game 2.,Double Jeopardy,"(3, 1)",1997 BUSINESS NEWS,7,"(200,)",False,In Jan. some said this computer chip maker would become the world's most profitable company by 1999,Intel,1,0
3178,1998-05-27,Lara Robillard game 2.,Double Jeopardy,"(4, 1)",CHARLES V,12,"(200,)",False,In 1541 Charles led a doomed naval campaign to take Algiers from this Turkish empire,Ottoman Empire,1,0
3178,1998-05-27,Lara Robillard game 2.,Double Jeopardy,"(5, 1)",MOVIE LOVE THEMES,6,"(200,)",False,"Whitney Houston:""I Will Always Love You""",The Bodyguard,1,0
3178,1998-05-27,Lara Robillard game 2.,Double Jeopardy,"(6, 1)",BEFORE & AFTER,15,"(200,)",False,1961 invasion of Cuba wrapped in a tasty pastry,"""Bay Of Pigs in a blanket""",1,0
3178,1998-05-27,Lara Robillard game 2.,Double Jeopardy,"(1, 2)",FICTIONAL CHARACTERS,2,"(400,)",False,He & his dog Wolf were hunting squirrels in the Catskills when he fell asleep,Rip Van Winkle,1,1
3178,1998-05-27,Lara Robillard game 2.,Double Jeopardy,"(2, 2)",NOT-SO-MAD SCIENTISTS,14,"(400,)",False,"This monk conceived the laws of heredity while minding his peas & Qs as a teacher in Brunn, Austria",Gregor Mendel,1,0
3178,1998-05-27,Lara Robillard game 2.,Double Jeopardy,"(3, 2)",1997 BUSINESS NEWS,21,"(400,)",False,In July this retailer said it was closing 400 stores; it had nickeled-&-dimed itself to death,Woolworth\'s,1,0
3178,1998-05-27,Lara Robillard game 2.,Double Jeopardy,"(4, 2)",CHARLES V,19,"(400,)",False,"In 1522 he wrote Charles that the Aztecs ""said that by no means would they give themselves up""",Hernando Cortez,1,0
3178,1998-05-27,Lara Robillard game 2.,Double Jeopardy,"(5, 2)",MOVIE LOVE THEMES,8,"(400,)",False,"""A Whole New World""",Aladdin,1,0
3178,1998-05-27,Lara Robillard game 2.,Double Jeopardy,"(6, 2)",BEFORE & AFTER,26,"(400,)",False,The lead singer of Hole appearing on Chuck Woolery's old show,"""Courtney Love Connection""",1,0
3178,1998-05-27,Lara Robillard game 2.,Double Jeopardy,"(1, 3)",FICTIONAL CHARACTERS,3,"(600,)",False,"In ""Vanity Fair"" Sir Pitt Crawley proposes to her but she's already secretly married to his son Rawdon",Becky Sharp,1,1
3178,1998-05-27,Lara Robillard game 2.,Double Jeopardy,"(2, 3)",NOT-SO-MAD SCIENTISTS,16,"(600,)",False,In 1920 this Dane became director of The Institute For Theoretic Physics in Copenhagen,Niels Bohr,1,0
3178,1998-05-27,Lara Robillard game 2.,Double Jeopardy,"(3, 3)",1997 BUSINESS NEWS,24,"(600,)",False,New on the magazine stand in 1997 was this women's fitness magazine that might be abbreviated O2,Oxygen,1,0
3178,1998-05-27,Lara Robillard game 2.,Double Jeopardy,"(4, 3)",CHARLES V,23,"(600,)",False,In 1530 Charles became the last of these emperors to be crowned by a Pope,Holy Roman Empire,1,0
3178,1998-05-27,Lara Robillard game 2.,Double Jeopardy,"(5, 3)",MOVIE LOVE THEMES,9,"(600,)",False,"Carly Simon:""Nobody Does It Better""",The Spy Who Loved Me,1,0
3178,1998-05-27,Lara Robillard game 2.,Double Jeopardy,"(6, 3)",BEFORE & AFTER,27,"(600,)",False,Long disputed Israeli-Palestinian land area that's a mini-shopping complex,"""The Gaza Strip Mall""",0,3
3178,1998-05-27,Lara Robillard game 2.,Double Jeopardy,"(1, 4)",FICTIONAL CHARACTERS,4,"(800,)",False,"Last name of Soames & Irene, the 2 principal characters in John Galsworthy's 3 novel ""Saga""",Forsyte,0,3
3178,1998-05-27,Lara Robillard game 2.,Double Jeopardy,"(2, 4)",NOT-SO-MAD SCIENTISTS,17,"(800,)",False,"His discoveries, published in the 1704 work ""Opticks"", explained why objects appear to be colored",Sir Isaac Newton,0,3
3178,1998-05-27,Lara Robillard game 2.,Double Jeopardy,"(3, 4)",1997 BUSINESS NEWS,29,"(800,)",False,The FTC blocked Staples' purchase of this company in March -- antitrust & all that,Office Depot,1,0
3178,1998-05-27,Lara Robillard game 2.,Double Jeopardy,"(4, 4)",CHARLES V,22,"(1500,)",True,In 1522 Charles introduced this Spanish institution to the Netherlands to persecute Protestants,The Inquisition,1,0
3178,1998-05-27,Lara Robillard game 2.,Double Jeopardy,"(5, 4)",MOVIE LOVE THEMES,10,"(800,)",False,"""You Must Love Me""",Evita,1,0
3178,1998-05-27,Lara Robillard game 2.,Double Jeopardy,"(6, 4)",BEFORE & AFTER,28,"(800,)",False,King Kong plunges from Edward Gibbon's massive history,"""The Decline & Fall of the Roman Empire State Building""",0,3
3178,1998-05-27,Lara Robillard game 2.,Double Jeopardy,"(1, 5)",FICTIONAL CHARACTERS,5,"(1000,)",False,Roxane married Christian de Neuvillette not knowing his love letters were written by this poet & soldier,Cyrano de Bergerac,1,0
3178,1998-05-27,Lara Robillard game 2.,Double Jeopardy,"(2, 5)",NOT-SO-MAD SCIENTISTS,18,"(1000,)",False,This Dane's 1572 supernova sighting helped disprove the idea that no changes occur past the moon's orbit,Tycho Brahe,1,1
3178,1998-05-27,Lara Robillard game 2.,Double Jeopardy,"(3, 5)",1997 BUSINESS NEWS,25,"(4500,)",True,"This automaker, whose logo is seen here, turned 50 in 1997 but has only made about 70,000 cars: (black stallion)",Ferrari,1,0
3178,1998-05-27,Lara Robillard game 2.,Double Jeopardy,"(4, 5)",CHARLES V,20,"(1000,)",False,Charles convened the Diet of Worms where this man refused to recant his beliefs,Martin Luther,1,0
3178,1998-05-27,Lara Robillard game 2.,Double Jeopardy,"(5, 5)",MOVIE LOVE THEMES,11,"(1000,)",False,"Barbra Streisand & Bryan Adams:""I Finally Found Someone""",The Mirror Has Two Faces,1,0
3178,1998-05-27,Lara Robillard game 2.,Double Jeopardy,"(6, 5)",BEFORE & AFTER,30,"(1000,)",False,"Jimmy Carter's ""Achy Breaky"" Secretary of State","""Billy Ray Cyrus Vance""",1,0
3178,1998-05-27,Lara Robillard game 2.,Final Jeopardy,"(1, 1)",COMPOSERS,0,"(100, 4500, 9301)",False,One of his most famous works had its premiere on a barge in 1717,George Frideric Handel (the Water Music),2,1
