epNum,airDate,extra_info,round_name,coord,category,order,value,daily_double,question,answer,correctAttempts,wrongAttempts
324,1985-12-05,Jared Eisenstat game 4.,Jeopardy,"(1, 1)",THE PLANETS,6,"(100,)",False,It's often called Earth's twin,Venus,0,0
324,1985-12-05,Jared Eisenstat game 4.,Jeopardy,"(2, 1)",NAMES IN THE NEWS,8,"(100,)",False,It's who spokesman Larry Speakes speaks for,the president,0,0
324,1985-12-05,Jared Eisenstat game 4.,Jeopardy,"(3, 1)","""WIND"" WORDS",16,"(100,)",False,"The largest one is in Hawaii, not Holland",a windmill,0,0
324,1985-12-05,Jared Eisenstat game 4.,Jeopardy,"(4, 1)",BOTTOMS UP,26,"(100,)",False,"100 years ago, Madeira wine was used as ballast in these",(sailing) ships,0,0
324,1985-12-05,Jared Eisenstat game 4.,Jeopardy,"(5, 1)",ROCK 'N ROLL,1,"(100,)",False,"Follows Righteous, Doobie, & Everly",Brothers,0,0
324,1985-12-05,Jared Eisenstat game 4.,Jeopardy,"(6, 1)",SUDDEN DEATH,19,"(100,)",False,"In U.S. prisons, about 2000 volts does it",the electric chair,0,0
324,1985-12-05,Jared Eisenstat game 4.,Jeopardy,"(1, 2)",THE PLANETS,7,"(200,)",False,"Averaging 30 miles a second on its orbit, it's a very fast planet",Mercury,0,0
324,1985-12-05,Jared Eisenstat game 4.,Jeopardy,"(2, 2)",NAMES IN THE NEWS,12,"(200,)",False,"Chapter on St. Vitus' dance has been dropped from 40th anniv. edition of his ""Baby & Child Care""",Dr. Spock,0,0
324,1985-12-05,Jared Eisenstat game 4.,Jeopardy,"(3, 2)","""WIND"" WORDS",17,"(200,)",False,This knot usually is wider than the 4-in-hand,a windsor knot,0,0
324,1985-12-05,Jared Eisenstat game 4.,Jeopardy,"(4, 2)",BOTTOMS UP,27,"(200,)",False,"When Jumbo the Elephant was crossing the ocean to join P.T. Barnum, he was soothed with this brew",beer,0,0
324,1985-12-05,Jared Eisenstat game 4.,Jeopardy,"(5, 2)",ROCK 'N ROLL,2,"(200,)",False,"Peter & Gordon's hit, ""World Without Love"", was written by this Beatle pair",Lennon & McCartney,0,0
324,1985-12-05,Jared Eisenstat game 4.,Jeopardy,"(6, 2)",SUDDEN DEATH,20,"(200,)",False,"Their ""Book of the Dead"" had hints for passing the tests of Osiris, god of the underworld",the Egyptians,0,0
324,1985-12-05,Jared Eisenstat game 4.,Jeopardy,"(1, 3)",THE PLANETS,9,"(300,)",False,"In a 1964 Christmas film, Pia Zadora played Girmar, a kid from this planet",Mars,0,0
324,1985-12-05,Jared Eisenstat game 4.,Jeopardy,"(2, 3)",NAMES IN THE NEWS,13,"(300,)",False,His cocaine bust in London put Mike Hammer in the slammer,Stacy Keach,0,0
324,1985-12-05,Jared Eisenstat game 4.,Jeopardy,"(3, 3)","""WIND"" WORDS",18,"(300,)",False,The tractor to convey Saturn rockets at Cape Canaveral has largest set of these squeegees,windshield wipers,0,0
324,1985-12-05,Jared Eisenstat game 4.,Jeopardy,"(4, 3)",BOTTOMS UP,28,"(300,)",False,"From German for ""squirt"", this drink is white wine & a squirt of seltzer",a spritzer,0,0
324,1985-12-05,Jared Eisenstat game 4.,Jeopardy,"(5, 3)",ROCK 'N ROLL,3,"(300,)",False,This Bill Haley classic has sold over 20 million singles,"""Rock Around The Clock""",0,0
324,1985-12-05,Jared Eisenstat game 4.,Jeopardy,"(6, 3)",SUDDEN DEATH,21,"(300,)",False,Appropriate personification of death that came to take Cyrus McCormick in 1884,the (grim) reaper,0,0
324,1985-12-05,Jared Eisenstat game 4.,Jeopardy,"(1, 4)",THE PLANETS,10,"(400,)",False,Only for a 20-year period every 248 years is this planet closer to the Sun than Neptune,Pluto,0,0
324,1985-12-05,Jared Eisenstat game 4.,Jeopardy,"(2, 4)",NAMES IN THE NEWS,14,"(400,)",False,"He's managed Minnesota, Detroit, Texas, N.Y., N.Y., Oakland, N.Y. & N.Y. in that order",Billy Martin,0,0
324,1985-12-05,Jared Eisenstat game 4.,Jeopardy,"(3, 4)","""WIND"" WORDS",24,"(400,)",False,President Carter proposed that oil companies would have to pay taxes on these,windfall profits,0,0
324,1985-12-05,Jared Eisenstat game 4.,Jeopardy,"(4, 4)",BOTTOMS UP,29,"(400,)",False,"In France, a big ""brut"" is usually this, not Mark Gastineau",a bottle of champagne,0,0
324,1985-12-05,Jared Eisenstat game 4.,Jeopardy,"(5, 4)",ROCK 'N ROLL,4,"(400,)",False,"Robb Royer, James Griffin, & David Gates made a lot of ""dough"" as this 1970's group",Bread,0,0
324,1985-12-05,Jared Eisenstat game 4.,Jeopardy,"(6, 4)",SUDDEN DEATH,22,"(400,)",False,Well-named newspaper office where reporters would find file information for an obituary,the morgue,0,0
324,1985-12-05,Jared Eisenstat game 4.,Jeopardy,"(1, 5)",THE PLANETS,11,"(300,)",True,Planet traveled to in film whose theme was the following:[Also sprach Zarathustra plays],Jupiter,0,0
324,1985-12-05,Jared Eisenstat game 4.,Jeopardy,"(2, 5)",NAMES IN THE NEWS,15,"(500,)",False,"2 Senators, William Cohen & this former presidential candidate, have teamed to write a spy thriller",Gary Hart,0,0
324,1985-12-05,Jared Eisenstat game 4.,Jeopardy,"(3, 5)","""WIND"" WORDS",25,"(500,)",False,The British call them windcheaters,windbreakers,0,0
324,1985-12-05,Jared Eisenstat game 4.,Jeopardy,"(5, 5)",ROCK 'N ROLL,5,"(500,)",False,"She liked to spend ""Midnight At The Oasis""",Maria Muldaur,0,0
324,1985-12-05,Jared Eisenstat game 4.,Jeopardy,"(6, 5)",SUDDEN DEATH,23,"(500,)",False,The death of this pair was just the beginning of their life with Topper,George & Marion Kirby,0,0
324,1985-12-05,Jared Eisenstat game 4.,Double Jeopardy,"(1, 1)",OREGON,11,"(200,)",False,Oregon product named for Tillamook Indians,tea,0,0
324,1985-12-05,Jared Eisenstat game 4.,Double Jeopardy,"(2, 1)",THE '70s,9,"(200,)",False,"Full name of Patty Hearst's kidnappers, the S.L.A.",the Symbionese Liberation Army,0,0
324,1985-12-05,Jared Eisenstat game 4.,Double Jeopardy,"(3, 1)",MOVIE QUOTES,4,"(200,)",False,"In this film, Anthony Perkins asserts, ""A boy's best friend is his mother""",Psycho,0,0
324,1985-12-05,Jared Eisenstat game 4.,Double Jeopardy,"(4, 1)",GOVERNMENT,18,"(200,)",False,Pair of national offices indirectly elected by voters,president & vice president,0,0
324,1985-12-05,Jared Eisenstat game 4.,Double Jeopardy,"(5, 1)",ANATOMY,26,"(200,)",False,"Equaling 1/10 of body weight, this fluid is 78% water & 22% solid",the blood,0,0
324,1985-12-05,Jared Eisenstat game 4.,Double Jeopardy,"(6, 1)",TRIVIA,1,"(200,)",False,"Plural of ""mongoose""",mongooses,0,0
324,1985-12-05,Jared Eisenstat game 4.,Double Jeopardy,"(1, 2)",OREGON,12,"(400,)",False,"By winning a coin toss in 1845, F. Pettygrove got this city named after his hometown in Maine",Portland,0,0
324,1985-12-05,Jared Eisenstat game 4.,Double Jeopardy,"(2, 2)",THE '70s,10,"(400,)",False,"The Tasadays, a tribe unchanged since this age of man, were discovered living in the Philippines",the stone age,0,0
324,1985-12-05,Jared Eisenstat game 4.,Double Jeopardy,"(3, 2)",MOVIE QUOTES,5,"(400,)",False,"Streisand's ""Funny Girl"" who said she was ""a bagel on a plate of onion rolls""",Fanny Brice,0,0
324,1985-12-05,Jared Eisenstat game 4.,Double Jeopardy,"(4, 2)",GOVERNMENT,19,"(400,)",False,"Until 1862, the Department of Agriculture was part of this ""inventive"" government office",the Patent Office,0,0
324,1985-12-05,Jared Eisenstat game 4.,Double Jeopardy,"(5, 2)",ANATOMY,27,"(400,)",False,"The 4 types of it are bristle, long scalp, downy, & sexual",hair,0,0
324,1985-12-05,Jared Eisenstat game 4.,Double Jeopardy,"(6, 2)",TRIVIA,2,"(400,)",False,It's done in all states except Arizona & Hawaii on the last Sunday in April,daylights savings time (move the clocks forward),0,0
324,1985-12-05,Jared Eisenstat game 4.,Double Jeopardy,"(1, 3)",OREGON,15,"(600,)",False,Paul Bunyan supposedly created it by shoveling blue snow into an old volcano,Crater Lake,0,0
324,1985-12-05,Jared Eisenstat game 4.,Double Jeopardy,"(2, 3)",THE '70s,23,"(600,)",False,"Completed in 1977, it runs from Prudhoe Bay to Valdez",the Alaska Pipeline,0,0
324,1985-12-05,Jared Eisenstat game 4.,Double Jeopardy,"(3, 3)",MOVIE QUOTES,6,"(600,)",False,"""Midnight Cowboy"" who ""ain't a real cowboy, but I am one helluva stud""",Jon Voight (Joe Buck),0,0
324,1985-12-05,Jared Eisenstat game 4.,Double Jeopardy,"(4, 3)",GOVERNMENT,20,"(600,)",False,The F.B.I. is under the jurisdiction of this department,Department of Justice,0,0
324,1985-12-05,Jared Eisenstat game 4.,Double Jeopardy,"(6, 3)",TRIVIA,3,"(600,)",False,"As of June 1985 Mike Wittkowski, an Illinois printer, held this record at $40 million",a lottery winner (the largest amount won by a man in a lottery),0,0
324,1985-12-05,Jared Eisenstat game 4.,Double Jeopardy,"(1, 4)",OREGON,16,"(800,)",False,"Highest mountain in Oregon, it's named for a British admiral, not a gangster",Mount Hood,0,0
324,1985-12-05,Jared Eisenstat game 4.,Double Jeopardy,"(2, 4)",THE '70s,24,"(800,)",False,"When the Cleveland Indians named him chief in 1974, he became 1st Black Major League manager",(Frank) Robinson,0,0
324,1985-12-05,Jared Eisenstat game 4.,Double Jeopardy,"(3, 4)",MOVIE QUOTES,7,"(800,)",False,"Carries the Bette Davis warning: ""Fasten your seat belts; it's going to be a bumpy night""",All About Eve,0,0
324,1985-12-05,Jared Eisenstat game 4.,Double Jeopardy,"(4, 4)",GOVERNMENT,21,"(600,)",True,Executive dept. in charge of the Bureau of the Census & U.S. Travel and Tourism Administration,the Department of Commerce,0,0
324,1985-12-05,Jared Eisenstat game 4.,Double Jeopardy,"(6, 4)",TRIVIA,13,"(800,)",False,"Comedian Jack Benny's response when a robber demanded ""Your money or your life""","Well, what is I'm thinking about it",0,0
324,1985-12-05,Jared Eisenstat game 4.,Double Jeopardy,"(1, 5)",OREGON,17,"(1000,)",False,"Said to be the richest man of his day, in 1811 he founded 1st permanent settlement in Oregon",(John Jacob) Astor,0,0
324,1985-12-05,Jared Eisenstat game 4.,Double Jeopardy,"(2, 5)",THE '70s,25,"(1000,)",False,"In 1975 Agatha Christie killed off the hero in this final, appropriately titled, Hercule Poirot novel",Curtain,0,0
324,1985-12-05,Jared Eisenstat game 4.,Double Jeopardy,"(3, 5)",MOVIE QUOTES,8,"(500,)",True,"In ""How to Marry a Millionaire"" she said,""That old guy in 'The African Queen', I'm crazy about him""",Lauren Bacall,0,0
324,1985-12-05,Jared Eisenstat game 4.,Double Jeopardy,"(4, 5)",GOVERNMENT,22,"(1000,)",False,Number of articles in the body of the Constitution,7,0,0
324,1985-12-05,Jared Eisenstat game 4.,Double Jeopardy,"(6, 5)",TRIVIA,14,"(1000,)",False,"Priscilla, who saved an 11-year-old Texas boy from drowning & got an award for valor, is this",a 22-pound piglet,0,0
324,1985-12-05,Jared Eisenstat game 4.,Final Jeopardy,"(1, 1)",MONEY,0,(),False,"Smallest U.S. denomination, it appears on no coins, just trading stamps, & tax notices",1 mill (1/10 of a cent),0,0
