epNum,airDate,extra_info,round_name,coord,category,order,value,daily_double,question,answer,correctAttempts,wrongAttempts
3336,1999-02-22,1999-A Teen Tournament quarterfinal game 1.,Jeopardy,"(1, 1)",FATHERLY NICKNAMES,1,"(100,)",False,"""The Father of Relativity""",Albert Einstein,1,0
3336,1999-02-22,1999-A Teen Tournament quarterfinal game 1.,Jeopardy,"(2, 1)","""IQ"" TEST",16,"(100,)",False,"The 3 normal states of matter are solid, gas & this",liquid,1,0
3336,1999-02-22,1999-A Teen Tournament quarterfinal game 1.,Jeopardy,"(3, 1)",WOLVES,21,"(100,)",False,He's the senior White House correspondent seen here,Wolf Blitzer,1,1
3336,1999-02-22,1999-A Teen Tournament quarterfinal game 1.,Jeopardy,"(4, 1)",NAME THE DIRECTOR,23,"(100,)",False,"""Always"",""E.T."",""Jurassic Park""",Steven Spielberg,1,0
3336,1999-02-22,1999-A Teen Tournament quarterfinal game 1.,Jeopardy,"(5, 1)",MINTY FRESH,11,"(100,)",False,"White Mazda Miatas bear an uncanny resemblance to these ""1 1/2 Calorie Breath Mints""",Tic-Tac,1,1
3336,1999-02-22,1999-A Teen Tournament quarterfinal game 1.,Jeopardy,"(6, 1)","KISS ME, YOU FOOL!",6,"(100,)",False,"In Charles Perrault's version of this classic fairy tale, a prince awakens a princess with a tender kiss","""Sleeping Beauty""",1,0
3336,1999-02-22,1999-A Teen Tournament quarterfinal game 1.,Jeopardy,"(1, 2)",FATHERLY NICKNAMES,2,"(200,)",False,"""The Father of the Constitution""",James Madison,1,1
3336,1999-02-22,1999-A Teen Tournament quarterfinal game 1.,Jeopardy,"(2, 2)","""IQ"" TEST",17,"(200,)",False,It's the set of rules for behaving properly in society; Miss Manners is an expert on this subject,etiquette,1,0
3336,1999-02-22,1999-A Teen Tournament quarterfinal game 1.,Jeopardy,"(3, 2)",WOLVES,27,"(200,)",False,"Most of these wolf groups have about 8 members, but may have as many as 20",packs,1,0
3336,1999-02-22,1999-A Teen Tournament quarterfinal game 1.,Jeopardy,"(4, 2)",NAME THE DIRECTOR,22,"(200,)",False,"""Get on the Bus"",""Malcolm X"",""He Got Game""",Spike Lee,1,0
3336,1999-02-22,1999-A Teen Tournament quarterfinal game 1.,Jeopardy,"(5, 2)",MINTY FRESH,12,"(200,)",False,Pep‑O‑Mint & Wint‑O‑Green are flavors of this candy mint,Life Savers,1,1
3336,1999-02-22,1999-A Teen Tournament quarterfinal game 1.,Jeopardy,"(6, 2)","KISS ME, YOU FOOL!",7,"(200,)",False,"In Genesis 2:7, he infuses the ""Spirit of Life"" into man with a kiss",God,1,0
3336,1999-02-22,1999-A Teen Tournament quarterfinal game 1.,Jeopardy,"(1, 3)",FATHERLY NICKNAMES,3,"(300,)",False,"""The Father of the Thesaurus""",Peter Mark Roget,0,3
3336,1999-02-22,1999-A Teen Tournament quarterfinal game 1.,Jeopardy,"(2, 3)","""IQ"" TEST",18,"(300,)",False,It's a device such as a bandage twisted around a limb to control the flow of blood,a tourniquet,1,0
3336,1999-02-22,1999-A Teen Tournament quarterfinal game 1.,Jeopardy,"(3, 3)",WOLVES,28,"(300,)",False,"Later dancing with Oscars, this actor is given the name ""Dances With Wolves"" in the movie of the same name",Kevin Costner,1,0
3336,1999-02-22,1999-A Teen Tournament quarterfinal game 1.,Jeopardy,"(4, 3)",NAME THE DIRECTOR,24,"(300,)",False,"""JFK',""Talk Radio"",""Born on the Fourth of July""",Oliver Stone,1,0
3336,1999-02-22,1999-A Teen Tournament quarterfinal game 1.,Jeopardy,"(5, 3)",MINTY FRESH,13,"(300,)",False,"This Certs ingredient is a mix of partially hydrogenated cottonseed oil, copper gluconate & flavoring",Retsyn,1,0
3336,1999-02-22,1999-A Teen Tournament quarterfinal game 1.,Jeopardy,"(6, 3)","KISS ME, YOU FOOL!",8,"(300,)",False,A girl who remains unkissed under this Christmas plant shouldn't expect marriage in the next year,mistletoe,1,0
3336,1999-02-22,1999-A Teen Tournament quarterfinal game 1.,Jeopardy,"(1, 4)",FATHERLY NICKNAMES,4,"(400,)",False,"""The Father of the Steamboat""",Robert Fulton,1,1
3336,1999-02-22,1999-A Teen Tournament quarterfinal game 1.,Jeopardy,"(2, 4)","""IQ"" TEST",19,"(400,)",False,"It means highly unusual, extraordinary, one of a kind",unique,1,0
3336,1999-02-22,1999-A Teen Tournament quarterfinal game 1.,Jeopardy,"(3, 4)",WOLVES,29,"(400,)",True,This U.S. state has more wolves than any other,Alaska,0,1
3336,1999-02-22,1999-A Teen Tournament quarterfinal game 1.,Jeopardy,"(4, 4)",NAME THE DIRECTOR,25,"(400,)",False,"""Ed Wood"",""Batman"",""Beetlejuice""",Tim Burton,1,0
3336,1999-02-22,1999-A Teen Tournament quarterfinal game 1.,Jeopardy,"(5, 4)",MINTY FRESH,14,"(400,)",False,"These ""Curiously Strong"" mints are ""So Strong, They Come in a Metal Box""",Altoids,1,0
3336,1999-02-22,1999-A Teen Tournament quarterfinal game 1.,Jeopardy,"(6, 4)","KISS ME, YOU FOOL!",9,"(400,)",False,"Surprisingly, Tony Curtis said kissing this blond actress in ""Some Like It Hot"" was ""like kissing Hitler""",Marilyn Monroe,1,0
3336,1999-02-22,1999-A Teen Tournament quarterfinal game 1.,Jeopardy,"(1, 5)",FATHERLY NICKNAMES,5,"(500,)",False,"""The Father of Rhode Island""",Roger Williams,1,0
3336,1999-02-22,1999-A Teen Tournament quarterfinal game 1.,Jeopardy,"(2, 5)","""IQ"" TEST",20,"(500,)",False,"Indirect, or any angle other than a right angle",oblique,0,3
3336,1999-02-22,1999-A Teen Tournament quarterfinal game 1.,Jeopardy,"(3, 5)",WOLVES,30,"(500,)",False,"Both endangered, the two types of wolves are the red wolf & this variety seen here",the gray wolf,1,0
3336,1999-02-22,1999-A Teen Tournament quarterfinal game 1.,Jeopardy,"(4, 5)",NAME THE DIRECTOR,26,"(500,)",False,"""Broken Arrow"",""Hard-Boiled"",""Face/Off""",John Woo,0,3
3336,1999-02-22,1999-A Teen Tournament quarterfinal game 1.,Jeopardy,"(5, 5)",MINTY FRESH,15,"(500,)",False,"""Fresh Goes Better in Life"" with these mints, ""Fresh and Full of Life""",Mentos,1,0
3336,1999-02-22,1999-A Teen Tournament quarterfinal game 1.,Jeopardy,"(6, 5)","KISS ME, YOU FOOL!",10,"(500,)",False,"As ""Private Benjamin"", she quipped, ""Usually by the time I kiss a guy I already know his mother's maiden name""",Goldie Hawn,1,0
3336,1999-02-22,1999-A Teen Tournament quarterfinal game 1.,Double Jeopardy,"(1, 1)",GREEK GODS,1,"(200,)",False,Cephissus was the god of these; one that bears his name flows to the west of Athens,rivers,1,0
3336,1999-02-22,1999-A Teen Tournament quarterfinal game 1.,Double Jeopardy,"(2, 1)",TV TEENS,6,"(200,)",False,Eddie Murphy was just 19 when this series made him an overnight star in 1980,Saturday Night Live,1,0
3336,1999-02-22,1999-A Teen Tournament quarterfinal game 1.,Double Jeopardy,"(3, 1)",REACH FOR THE STARS,11,"(200,)",False,The globular cluster M13 is in this constellation that to us looks nothing like Kevin Sorbo,Hercules,1,0
3336,1999-02-22,1999-A Teen Tournament quarterfinal game 1.,Double Jeopardy,"(4, 1)",CANADIAN POSTAL ABBREV.,16,"(200,)",False,NS,Nova Scotia,1,0
3336,1999-02-22,1999-A Teen Tournament quarterfinal game 1.,Double Jeopardy,"(5, 1)",THE ROAD TO MELVILLE,21,"(200,)",False,"Herman's grandfather was one of the ""Indians"" in this 1773 protest",the Boston Tea Party,1,0
3336,1999-02-22,1999-A Teen Tournament quarterfinal game 1.,Double Jeopardy,"(6, 1)",ADVERBS,25,"(200,)",False,"Adverb that begins Clark Gable's last line in ""Gone with the Wind""",frankly,1,0
3336,1999-02-22,1999-A Teen Tournament quarterfinal game 1.,Double Jeopardy,"(1, 2)",GREEK GODS,2,"(400,)",False,"Fire god Hephaestus was also the god of these, like black‑ & silver‑, not like Jaclyn & Will",smiths,1,0
3336,1999-02-22,1999-A Teen Tournament quarterfinal game 1.,Double Jeopardy,"(2, 2)",TV TEENS,7,"(400,)",False,"He was almost 20 when he started playing teenager Richie Cunningham on ""Happy Days"" in 1974",Ron Howard,1,0
3336,1999-02-22,1999-A Teen Tournament quarterfinal game 1.,Double Jeopardy,"(3, 2)",REACH FOR THE STARS,12,"(400,)",False,"Still familiar today, it's the 7-star constellation on the bottom of this ancient Chinese chart",the Big Dipper,1,0
3336,1999-02-22,1999-A Teen Tournament quarterfinal game 1.,Double Jeopardy,"(4, 2)",CANADIAN POSTAL ABBREV.,17,"(400,)",False,SK,Saskatchewan,1,0
3336,1999-02-22,1999-A Teen Tournament quarterfinal game 1.,Double Jeopardy,"(5, 2)",THE ROAD TO MELVILLE,22,"(400,)",False,"This 1851 masterpiece was at first a failure, misunderstood by critics & ignored by the public",Moby-Dick,1,0
3336,1999-02-22,1999-A Teen Tournament quarterfinal game 1.,Double Jeopardy,"(6, 2)",ADVERBS,26,"(400,)",False,"It's the word used most often in the ditty ""Row, Row, Row Your Boat""",merrily,1,1
3336,1999-02-22,1999-A Teen Tournament quarterfinal game 1.,Double Jeopardy,"(1, 3)",GREEK GODS,3,"(600,)",False,"God who's prayed to in the following reading from Homer by Homer SimpsonO hear me Lord, blue girdler of the islands...",Poseidon,0,3
3336,1999-02-22,1999-A Teen Tournament quarterfinal game 1.,Double Jeopardy,"(2, 3)",TV TEENS,8,"(600,)",False,"On the '80s sitcom ""It Takes Two!"", Anthony Edwards & this ""Mad About You"" star played Patty Duke's teenage kids",Helen Hunt,1,0
3336,1999-02-22,1999-A Teen Tournament quarterfinal game 1.,Double Jeopardy,"(3, 3)",REACH FOR THE STARS,13,"(600,)",False,"A ""super"" one of these hurls debris through space at over 40 million mph & then can form a nebula",a supernova,1,0
3336,1999-02-22,1999-A Teen Tournament quarterfinal game 1.,Double Jeopardy,"(4, 3)",CANADIAN POSTAL ABBREV.,18,"(600,)",False,MB,Manitoba,1,0
3336,1999-02-22,1999-A Teen Tournament quarterfinal game 1.,Double Jeopardy,"(5, 3)",THE ROAD TO MELVILLE,23,"(600,)",False,"Melville's last prose work, this novella about a young sailor on a warship, wasn't published until 1924",Billy Budd,0,3
3336,1999-02-22,1999-A Teen Tournament quarterfinal game 1.,Double Jeopardy,"(6, 3)",ADVERBS,27,"(600,)",False,"Someone facing a deadline works this way, as if his body temperature is rising",feverishly,1,1
3336,1999-02-22,1999-A Teen Tournament quarterfinal game 1.,Double Jeopardy,"(1, 4)",GREEK GODS,4,"(800,)",False,About a quarter of the Sun is a gas named for this sun god,Helios,1,2
3336,1999-02-22,1999-A Teen Tournament quarterfinal game 1.,Double Jeopardy,"(2, 4)",TV TEENS,9,"(800,)",False,You don't have to be a wizard to know that Oz is a teenage werewolf on this series,Buffy the Vampire Slayer,1,0
3336,1999-02-22,1999-A Teen Tournament quarterfinal game 1.,Double Jeopardy,"(3, 4)",REACH FOR THE STARS,14,"(800,)",False,"This constellation used to be the Claws of Scorpio (by the ""weigh"", scorpions don't have scales)",Libra,1,0
3336,1999-02-22,1999-A Teen Tournament quarterfinal game 1.,Double Jeopardy,"(4, 4)",CANADIAN POSTAL ABBREV.,19,"(1200,)",True,PE,Prince Edward Island,1,0
3336,1999-02-22,1999-A Teen Tournament quarterfinal game 1.,Double Jeopardy,"(5, 4)",THE ROAD TO MELVILLE,24,"(800,)",False,"Herman bought the farm ""Arrowhead"" in Pittsfield, in these hills of western Massachusetts",the Berkshires,0,3
3336,1999-02-22,1999-A Teen Tournament quarterfinal game 1.,Double Jeopardy,"(6, 4)",ADVERBS,28,"(800,)",False,"Take an adverb meaning ""close"", add -ly & you get this adverb meaning ""almost""",nearly,1,0
3336,1999-02-22,1999-A Teen Tournament quarterfinal game 1.,Double Jeopardy,"(1, 5)",GREEK GODS,5,"(1000,)",False,"This handsome young deity was the god of archery & brother of Artemis, goddess of the hunt",Apollo,1,0
3336,1999-02-22,1999-A Teen Tournament quarterfinal game 1.,Double Jeopardy,"(2, 5)",TV TEENS,10,"(1000,)",False,This title teenager had a best friend named Six,Blossom,1,0
3336,1999-02-22,1999-A Teen Tournament quarterfinal game 1.,Double Jeopardy,"(3, 5)",REACH FOR THE STARS,15,"(1900,)",True,"Unimaginably dense material is found in these ""stars"" named for subatomic particles",neutron stars,1,0
3336,1999-02-22,1999-A Teen Tournament quarterfinal game 1.,Double Jeopardy,"(4, 5)",CANADIAN POSTAL ABBREV.,20,"(1000,)",False,YT,Yukon Territory,1,0
3336,1999-02-22,1999-A Teen Tournament quarterfinal game 1.,Double Jeopardy,"(5, 5)",THE ROAD TO MELVILLE,30,"(1000,)",False,"Whenever this scrivener was asked to do anything else besides copy documents, he said, ""I would prefer not to""",Bartleby,0,3
3336,1999-02-22,1999-A Teen Tournament quarterfinal game 1.,Double Jeopardy,"(6, 5)",ADVERBS,29,"(1000,)",False,"A synonym for fast, or the name of a Shakespearean tavern mistress",Quickly,0,3
3336,1999-02-22,1999-A Teen Tournament quarterfinal game 1.,Final Jeopardy,"(1, 1)",WORLD GEOGRAPHY,0,"(2100, 3900, 4401)",False,"It's the only body of water with shores on the continents of Asia, Africa & Europe",Mediterranean Sea,2,1
