epNum,airDate,extra_info,round_name,coord,category,order,value,daily_double,question,answer,correctAttempts,wrongAttempts
3348,1999-03-10,,Jeopardy,"(1, 1)",50 YEARS AGO,13,"(100,)",False,No sacraments for Sergei: The Vatican approved excommunication of those spreading this doctrine,Communism,0,3
3348,1999-03-10,,Jeopardy,"(2, 1)",SPORTS HOME CITIES,11,"(100,)",False,The NFL'sJaguars,Jacksonville,1,0
3348,1999-03-10,,Jeopardy,"(3, 1)",TV BY THE NUMBERS,1,"(100,)",False,"On this show, Mr. Roper let Chrissy & Janet have a male roommate because he thought Jack was gay",Three\'s Company,1,0
3348,1999-03-10,,Jeopardy,"(4, 1)",PLANT INFO,26,"(100,)",False,"Children ""chain"" them; older folks pluck their petals to determine love status",Daisies,1,0
3348,1999-03-10,,Jeopardy,"(5, 1)","""IN""",6,"(100,)",False,"From the Latin for ""unrecognizable"", to travel this way is to have one's identity concealed or disguised",Incognito,1,0
3348,1999-03-10,,Jeopardy,"(6, 1)",LIKE A LION,18,"(100,)",False,"People of this Zodiac sign represented by a lion can be brave, noble & ferocious",Leo,1,0
3348,1999-03-10,,Jeopardy,"(1, 2)",50 YEARS AGO,14,"(200,)",False,Argentina's new 1949 constitution meant this incumbent president could succeed himself,Juan Peron,1,0
3348,1999-03-10,,Jeopardy,"(2, 2)",SPORTS HOME CITIES,12,"(200,)",False,MLB'sMariners,Seattle,1,0
3348,1999-03-10,,Jeopardy,"(3, 2)",TV BY THE NUMBERS,2,"(200,)",False,Johnny Depp & Holly Robinson were undercover officers who fought crime in high schools on this Fox drama,21 Jump Street,1,0
3348,1999-03-10,,Jeopardy,"(4, 2)",PLANT INFO,27,"(200,)",False,This plant is used as a symbol by Aer Lingus,Shamrock,1,0
3348,1999-03-10,,Jeopardy,"(5, 2)","""IN""",7,"(200,)",False,"The initials of computer giant ""IBM"" stand for this",International Business Machines,1,0
3348,1999-03-10,,Jeopardy,"(6, 2)",LIKE A LION,22,"(200,)",False,"This ""Lion-Hearted"" king was born in Oxford in 1157",Richard,1,0
3348,1999-03-10,,Jeopardy,"(1, 3)",50 YEARS AGO,15,"(300,)",False,"Ireland became a republic on this post-holiday Monday, the anniversary of the 1916 ""Rising""",Easter,1,0
3348,1999-03-10,,Jeopardy,"(2, 3)",SPORTS HOME CITIES,19,"(300,)",False,The NHL'sBlackhawks,Chicago,1,0
3348,1999-03-10,,Jeopardy,"(3, 3)",TV BY THE NUMBERS,3,"(300,)",False,On this series divorcee Ann Romano lived in an apartment building where Dwayne Schneider was the super,One Day at a Time,1,0
3348,1999-03-10,,Jeopardy,"(4, 3)",PLANT INFO,28,"(300,)",False,"Also called the goora nut, this caffeine-containing seed is popular in the beverage industry",Kola nut,0,3
3348,1999-03-10,,Jeopardy,"(5, 3)","""IN""",8,"(300,)",False,"Rod Stewart had a Top 10 hit in 1984 about this kind of foolish, unreasoned passion","""Infatuation""",1,0
3348,1999-03-10,,Jeopardy,"(6, 3)",LIKE A LION,23,"(300,)",False,More than one lion has been the spokesroarer for this legendary motion picture company,MGM (Metro-Goldwyn-Mayer),1,0
3348,1999-03-10,,Jeopardy,"(1, 4)",50 YEARS AGO,16,"(400,)",False,"On July 20, 1949 this country signed the final armistice of its 1948 war of independence, with Syria",Israel,1,0
3348,1999-03-10,,Jeopardy,"(2, 4)",SPORTS HOME CITIES,20,"(700,)",True,The WNBA'sLiberty,New York,0,1
3348,1999-03-10,,Jeopardy,"(3, 4)",TV BY THE NUMBERS,4,"(400,)",False,Adam Rich & Willie Aames were 2 of the kids on this show set in Sacramento,Eight is Enough,1,0
3348,1999-03-10,,Jeopardy,"(4, 4)",PLANT INFO,29,"(400,)",False,"Vitis vinifera, or its fruit",Grape,0,3
3348,1999-03-10,,Jeopardy,"(5, 4)","""IN""",9,"(400,)",False,Illegally obtained evidence is an example of this kind of evidence not allowed in a courtroom,Inadmissible evidence,1,0
3348,1999-03-10,,Jeopardy,"(6, 4)",LIKE A LION,24,"(400,)",False,This mythical hero wore the skin of the Nemean lion he had slain,Hercules,0,3
3348,1999-03-10,,Jeopardy,"(1, 5)",50 YEARS AGO,17,"(500,)",False,"Nathuram Godse was executed in November, almost 2 years after he assassinated this man",Mohandas Gandhi,0,3
3348,1999-03-10,,Jeopardy,"(2, 5)",SPORTS HOME CITIES,21,"(500,)",False,The NBA'sRaptors,Toronto,1,0
3348,1999-03-10,,Jeopardy,"(3, 5)",TV BY THE NUMBERS,5,"(500,)",False,"As its title suggests, correspondents originally followed a story for 2 days on this news show",48 Hours,1,0
3348,1999-03-10,,Jeopardy,"(4, 5)",PLANT INFO,30,"(500,)",False,This English courtier is credited with introducing Europe to the wonders of Nicotiana rustica,Sir Walter Raleigh,1,0
3348,1999-03-10,,Jeopardy,"(5, 5)","""IN""",10,"(500,)",False,This Korean port was the site of an important invasion by U.N. troops in September 1950,Inchon,0,3
3348,1999-03-10,,Jeopardy,"(6, 5)",LIKE A LION,25,"(500,)",False,"One of Ethiopian emperor Haile Selassie's titles was the ""Conquering Lion of"" this tribe",Judah,0,3
3348,1999-03-10,,Double Jeopardy,"(1, 1)",U.S. GEOGRAPHY,11,"(200,)",False,A small part of this California mountain range extends into the Lake Tahoe area of Nevada,Sierra Nevadas,1,0
3348,1999-03-10,,Double Jeopardy,"(2, 1)","NEXT IN LINE, PLEASE",21,"(200,)",False,"Venus,Earth,Mars...",Jupiter,1,0
3348,1999-03-10,,Double Jeopardy,"(3, 1)",WOMEN: WRITE ON!,1,"(200,)",False,"Her foreword to the 35th Anniv. edition of ""To Kill A Mockingbird"" says, ""I am still alive, although very quiet""",Harper Lee,1,0
3348,1999-03-10,,Double Jeopardy,"(4, 1)",MOVIE HODGEPODGE,4,"(200,)",False,"Burt Lancaster starred as a general plotting to overthrow the U.S. government in ""Seven Days in"" this month",May,1,0
3348,1999-03-10,,Double Jeopardy,"(5, 1)","""OUT""",16,"(200,)",False,"It can be a fugitive, a criminal or a social nonconformist; Josey Wales was one",Outlaw,1,0
3348,1999-03-10,,Double Jeopardy,"(6, 1)",LIKE A LAMB,24,"(200,)",False,"If your fleece is ""white as snow"", you might be tended by this classic nursery rhyme shepherdess",Mary,1,1
3348,1999-03-10,,Double Jeopardy,"(1, 2)",U.S. GEOGRAPHY,12,"(400,)",False,This Utah river named for a river in the Holy Land flows from freshwater Utah Lake to the Great Salt Lake,Jordan River,1,0
3348,1999-03-10,,Double Jeopardy,"(2, 2)","NEXT IN LINE, PLEASE",22,"(400,)",False,"In the U.S. Army:2nd Lieutenant,1st Lieutenant,Captain...",Major,1,0
3348,1999-03-10,,Double Jeopardy,"(3, 2)",WOMEN: WRITE ON!,2,"(400,)",False,"An accidental gunshot wound when she was 8 left this ""Color Purple"" author blind in one eye",Alice Walker,1,0
3348,1999-03-10,,Double Jeopardy,"(4, 2)",MOVIE HODGEPODGE,5,"(400,)",False,"This pop artist's 1974 film ""Dracula"" was actually directed by Paul Morrissey",Andy Warhol,1,0
3348,1999-03-10,,Double Jeopardy,"(5, 2)","""OUT""",17,"(400,)",False,"It's another name for the privy, cousin",Outhouse,1,0
3348,1999-03-10,,Double Jeopardy,"(6, 2)",LIKE A LAMB,27,"(400,)",False,For many years this award-winning puppeteer left her hand to Lamb Chop,Shari Lewis,1,0
3348,1999-03-10,,Double Jeopardy,"(1, 3)",U.S. GEOGRAPHY,13,"(600,)",False,In 1644 Aquidneck Island in Narragansett Bay was officially renamed this,Rhode Island,0,3
3348,1999-03-10,,Double Jeopardy,"(2, 3)","NEXT IN LINE, PLEASE",23,"(600,)",False,"Hexagon,heptagon,octagon...",Nonagon,1,0
3348,1999-03-10,,Double Jeopardy,"(3, 3)",WOMEN: WRITE ON!,3,"(600,)",False,"Henry Miller hailed this novel as a female ""Tropic of Cancer"" when Erica Jong published it in 1973","""Fear of Flying""",1,0
3348,1999-03-10,,Double Jeopardy,"(4, 3)",MOVIE HODGEPODGE,6,"(600,)",False,"Ella Fitzgerald played herself in ""St. Louis Blues"", the film biography of this composer",W.C. Handy,1,0
3348,1999-03-10,,Double Jeopardy,"(5, 3)","""OUT""",18,"(600,)",False,"Popular in Hawaii, it's the type of transport seen here",Outrigger canoe,1,0
3348,1999-03-10,,Double Jeopardy,"(6, 3)",LIKE A LAMB,28,"(600,)",False,The lambskin aprons worn by this largest fraternal order represent innocence & purity,Masons,0,3
3348,1999-03-10,,Double Jeopardy,"(1, 4)",U.S. GEOGRAPHY,14,"(800,)",False,"Of the states that have counties, it has the fewest: Kent, New Castle & Sussex",Delaware,0,3
3348,1999-03-10,,Double Jeopardy,"(2, 4)","NEXT IN LINE, PLEASE",25,"(1500,)",True,"Edward V,Richard III,Henry VII...",Henry VIII,1,0
3348,1999-03-10,,Double Jeopardy,"(3, 4)",WOMEN: WRITE ON!,9,"(800,)",False,"Jackie Collins published her first novel the year before this other Jackie published ""The Love Machine""",Jacqueline Susann,1,0
3348,1999-03-10,,Double Jeopardy,"(4, 4)",MOVIE HODGEPODGE,7,"(800,)",False,Topol was tops as this Italian astronomer in the 1973 film based on Bertolt Brecht's play,Galileo,1,0
3348,1999-03-10,,Double Jeopardy,"(5, 4)","""OUT""",19,"(800,)",False,"Bret Harte told the story of these ""Poker Flat"" exiles",Outcasts,1,0
3348,1999-03-10,,Double Jeopardy,"(6, 4)",LIKE A LAMB,29,"(800,)",False,"This controversial daughter of Winston Churchill has been called ""The lamb who strayed from the fold""",Sarah Churchill,0,3
3348,1999-03-10,,Double Jeopardy,"(1, 5)",U.S. GEOGRAPHY,15,"(500,)",True,The Valley of the Sun is the locale of this state capital,Phoenix,1,0
3348,1999-03-10,,Double Jeopardy,"(2, 5)","NEXT IN LINE, PLEASE",26,"(1000,)",False,"Pius XI,Pius XII,John XXIII...",Paul VI,0,3
3348,1999-03-10,,Double Jeopardy,"(3, 5)",WOMEN: WRITE ON!,10,"(1000,)",False,"Kids who grew up with her ""Are You There God?  It's Me, Margaret"" now enjoy her adult novels like ""Summer Sisters""",Judy Blume,1,0
3348,1999-03-10,,Double Jeopardy,"(4, 5)",MOVIE HODGEPODGE,8,"(1000,)",False,"This cartoonist wrote the screenplays for two 1971 films: ""Little Murders"" & ""Carnal Knowledge""",Jules Feiffer,1,0
3348,1999-03-10,,Double Jeopardy,"(5, 5)","""OUT""",20,"(1000,)",False,"Like a 1981 Sean Connery sci fi movie, or anything conspicuously unconventional or bizarre",Outlandish,1,0
3348,1999-03-10,,Double Jeopardy,"(6, 5)",LIKE A LAMB,30,"(1000,)",False,"You'd be like this ""Lady"" if you were Lord Byron's lover in 1812",Lady Caroline Lamb,1,0
3348,1999-03-10,,Final Jeopardy,"(1, 1)",BROADWAY MUSICALS,0,"(300, 3501, 2500)",False,"1960 musical that contains the line: ""Your table is cracking... can you hear the timbers split?""",Camelot,0,3
