epNum,airDate,extra_info,round_name,coord,category,order,value,daily_double,question,answer,correctAttempts,wrongAttempts
3360,1999-03-26,,Jeopardy,"(1, 1)",AFTER THE WHITE HOUSE,9,"(100,)",False,"Returning to the Senate in 1875, he served with senators who had voted ""Guilty"" at his impeachment trial",Andrew Johnson,1,0
3360,1999-03-26,,Jeopardy,"(2, 1)",JEFF GOLDBLUM FILMS,2,"(100,)",False,Jeff was the voice of caution in this 1993 dinosaur blockbuster,Jurassic Park,1,1
3360,1999-03-26,,Jeopardy,"(3, 1)",EPITAPHS,26,"(100,)",False,"""Author of the Declaration of American Independence...""",Thomas Jefferson,1,0
3360,1999-03-26,,Jeopardy,"(4, 1)","""DAY"" OR ""NIGHT""",1,"(100,)",False,"If you're habitually up & active late into the night you're one of these ""bird""s",Night owl,1,0
3360,1999-03-26,,Jeopardy,"(5, 1)",PIGS,7,"(100,)",False,"In the classic folktale, this trio faces off against a huffing, puffing wolf",The Three Little Pigs,1,0
3360,1999-03-26,,Jeopardy,"(6, 1)",FEET,16,"(100,)",False,This common name for the foot's calcaneus bone is also a command to control a dog,Heel,1,0
3360,1999-03-26,,Jeopardy,"(1, 2)",AFTER THE WHITE HOUSE,10,"(200,)",False,In 1841 he represented the Amistad mutineers before the Supreme Court,John Quincy Adams,1,0
3360,1999-03-26,,Jeopardy,"(2, 2)",JEFF GOLDBLUM FILMS,3,"(200,)",False,Jeff was an L.A. party guest who said that he'd forgotten his mantra in this 1977 Woody Allen classic,Annie Hall,1,0
3360,1999-03-26,,Jeopardy,"(3, 2)",EPITAPHS,27,"(200,)",False,"""Quoth the raven nevermore""",Edgar Allan Poe,1,0
3360,1999-03-26,,Jeopardy,"(4, 2)","""DAY"" OR ""NIGHT""",15,"(200,)",False,"A trademark for luminous paints & colors like that of my ""Rocket Red"" underwear",DayGlo,1,0
3360,1999-03-26,,Jeopardy,"(5, 2)",PIGS,8,"(200,)",False,Use this porcine anguagelay to confuse your iendsfray,Pig Latin,1,0
3360,1999-03-26,,Jeopardy,"(6, 2)",FEET,17,"(200,)",False,Fallen arches in adults can lead to this condition known medically as pes planus,Flat feet,1,0
3360,1999-03-26,,Jeopardy,"(1, 3)",AFTER THE WHITE HOUSE,11,"(300,)",False,"He continued to support the political career of protege James ""Young Hickory"" Polk",Andrew Jackson,1,0
3360,1999-03-26,,Jeopardy,"(2, 3)",JEFF GOLDBLUM FILMS,4,"(300,)",False,Jeff tests himself in a matter transporter machine with not-so-good results in this 1986 horror film,The Fly,1,0
3360,1999-03-26,,Jeopardy,"(3, 3)",EPITAPHS,28,"(300,)",False,"""Truth and history.  21 men.  The boy bandit king -- he died as he had lived""",Billy the Kid,1,0
3360,1999-03-26,,Jeopardy,"(4, 3)","""DAY"" OR ""NIGHT""",18,"(300,)",False,"One of mine is being chased by a tyrannosaurus rex, one of yours may be ""on Elm Street""",Nightmare,1,0
3360,1999-03-26,,Jeopardy,"(5, 3)",PIGS,12,"(300,)",False,"This country is the number one producer & consumer of fresh pork, hopefully not all sweet & sour",China,1,0
3360,1999-03-26,,Jeopardy,"(6, 3)",FEET,21,"(300,)",False,Someone held in high regard who shows disappointing weakness is said to have these kind of feet,Feet of clay,1,0
3360,1999-03-26,,Jeopardy,"(1, 4)",AFTER THE WHITE HOUSE,23,"(400,)",False,"Although he ""crashed"" in the election of 1932, he later led 2 commissions to reorganize the executive branch",Herbert Hoover,0,3
3360,1999-03-26,,Jeopardy,"(2, 4)",JEFF GOLDBLUM FILMS,5,"(400,)",False,Jeff was an executive at a shipping network & Eddie Murphy was a televangelist in this 1998 comedy,Holy Man,1,0
3360,1999-03-26,,Jeopardy,"(3, 4)",EPITAPHS,29,"(1000,)",True,"""61/61.  Against all odds""",Roger Maris,0,1
3360,1999-03-26,,Jeopardy,"(4, 4)","""DAY"" OR ""NIGHT""",19,"(400,)",False,The goddess Eos knows it's another word for dawn,Daybreak,1,0
3360,1999-03-26,,Jeopardy,"(5, 4)",PIGS,13,"(400,)",False,"In the ""Te"" of this character, he asks, ""Supposing a tree fell down, Pooh, when we were underneath it?""",Piglet,1,0
3360,1999-03-26,,Jeopardy,"(6, 4)",FEET,22,"(400,)",False,The bones of these foot parts are called phalanges,Toes,1,0
3360,1999-03-26,,Jeopardy,"(1, 5)",AFTER THE WHITE HOUSE,24,"(500,)",False,In 1984 Jimmy Carter worked his first building project for this international organization,Habitat for Humanity,1,0
3360,1999-03-26,,Jeopardy,"(2, 5)",JEFF GOLDBLUM FILMS,6,"(500,)",False,Alien Jeff Goldblum finds love with Valley Girl Geena Davis in this wacky 1989 musical,Earth Girls Are Easy,1,1
3360,1999-03-26,,Jeopardy,"(3, 5)",EPITAPHS,30,"(500,)",False,"""Man of 1000 Voices""",Mel Blanc,1,0
3360,1999-03-26,,Jeopardy,"(4, 5)","""DAY"" OR ""NIGHT""",20,"(500,)",False,"On his 20th attempt, Dale Earnhardt won this grueling auto race February 15, 1998",Daytona 500,1,0
3360,1999-03-26,,Jeopardy,"(5, 5)",PIGS,14,"(500,)",False,"The phrase about ""living"" this way is from a Southern expression for the better off getting the better pork",High on the hog,1,0
3360,1999-03-26,,Jeopardy,"(6, 5)",FEET,25,"(500,)",False,"From the Latin for ""on foot"", it's a person who travels that way",Pedestrian,1,0
3360,1999-03-26,,Double Jeopardy,"(1, 1)",TOWNS & CITIES,6,"(200,)",False,"This South Dakota capital was first known as Mahto, Sioux for ""bear""",Pierre,1,0
3360,1999-03-26,,Double Jeopardy,"(2, 1)",POP MUSIC,1,"(200,)",False,"Mark Knopfler & Neil Dorfsman produced this group's ""Money for Nothing""",Dire Straits,1,0
3360,1999-03-26,,Double Jeopardy,"(3, 1)",GRAB BAG,11,"(200,)",False,"This dentist drilled Tom McLowery at the O.K. Corral on October 26, 1881",Doc Holliday,1,0
3360,1999-03-26,,Double Jeopardy,"(4, 1)","ENDS IN ""UM""",16,"(200,)",False,"The Louvre or Prado, for example",Museum,1,0
3360,1999-03-26,,Double Jeopardy,"(5, 1)",CEDERS,26,"(200,)",False,After the First Punic War this island was ceded to Rome in an offer it couldn't refuse,Sicily,1,0
3360,1999-03-26,,Double Jeopardy,"(6, 1)",SINAI,21,"(200,)",False,"Before his ""of Arabia"" days, he built a raft in defiance of an Ottoman order & visited the Sinai's Pharaoh's Island",Lawrence,1,0
3360,1999-03-26,,Double Jeopardy,"(1, 2)",TOWNS & CITIES,7,"(400,)",False,"Every October 23 this California city's swallows leave its mission for the winter, but return on March 19",San Juan Capistrano,1,0
3360,1999-03-26,,Double Jeopardy,"(2, 2)",POP MUSIC,2,"(400,)",False,"Some Hindus were taken aback at her 1998 MTV Video Awards performance of ""Ray of Light""",Madonna,1,0
3360,1999-03-26,,Double Jeopardy,"(3, 2)",GRAB BAG,12,"(400,)",False,"It's the first color mentioned in the song ""America the Beautiful""",Amber,1,0
3360,1999-03-26,,Double Jeopardy,"(4, 2)","ENDS IN ""UM""",17,"(400,)",False,Term for the minimum number of people required at a meeting to conduct business legally,Quorum,1,0
3360,1999-03-26,,Double Jeopardy,"(5, 2)",CEDERS,27,"(400,)",False,Under the Treaty of Utrecht France ceded Acadia in what is now this country to England,Canada,1,0
3360,1999-03-26,,Double Jeopardy,"(6, 2)",SINAI,22,"(400,)",False,"Chapter 19 of this Biblical book says the Hebrews left Egypt & ""The same day came they into the wilderness of Sinai""",Exodus,1,0
3360,1999-03-26,,Double Jeopardy,"(1, 3)",TOWNS & CITIES,8,"(600,)",False,"Founded in 1565, this Florida city served as one of Spain's North American military headquarters",St. Augustine,1,0
3360,1999-03-26,,Double Jeopardy,"(2, 3)",POP MUSIC,3,"(1000,)",True,"(Hi, I'm Rebecca Herbst from ""General Hospital"")  On ""G.H."" Miguel Morez was played by Ricky Martin, an ex-member of this Puerto Rican singing group",Menudo,1,0
3360,1999-03-26,,Double Jeopardy,"(3, 3)",GRAB BAG,13,"(600,)",False,"This word for fun little facts comes from the Latin for ""The place where 3 roads meet""",Trivia,1,0
3360,1999-03-26,,Double Jeopardy,"(4, 3)","ENDS IN ""UM""",18,"(600,)",False,"It's where you keep your guppies, gourami & mollies",Aquarium,1,0
3360,1999-03-26,,Double Jeopardy,"(5, 3)",CEDERS,28,"(600,)",False,This national park created in 1890 didn't have its spectacular valley until California ceded it in 1906,Yosemite,1,0
3360,1999-03-26,,Double Jeopardy,"(6, 3)",SINAI,23,"(600,)",False,"Still in the Sinai are these ""inhabitants of the desert"" who wandered in over the last 1,400 years",Bedouins,1,0
3360,1999-03-26,,Double Jeopardy,"(1, 4)",TOWNS & CITIES,9,"(1000,)",True,"Located 60 miles west of Albany, it's the burial site of the author of the ""Leatherstocking Tales""",Cooperstown,0,1
3360,1999-03-26,,Double Jeopardy,"(2, 4)",POP MUSIC,4,"(800,)",False,"""Ukulele Lady"" is a track on her ""Bathhouse Betty"" album",Bette Midler,1,0
3360,1999-03-26,,Double Jeopardy,"(3, 4)",GRAB BAG,14,"(800,)",False,"It's elementary, if 98 is California & 100 is Enrico Fermi, then 99 is this man",Albert Einstein,1,0
3360,1999-03-26,,Double Jeopardy,"(4, 4)","ENDS IN ""UM""",19,"(800,)",False,This lightest metal is often used in the treatment of manic depression,Lithium,1,0
3360,1999-03-26,,Double Jeopardy,"(5, 4)",CEDERS,29,"(800,)",False,"The Munich Pact ceded the western part of Czechoslovakia, known as this, to Germany",Sudetenland,0,3
3360,1999-03-26,,Double Jeopardy,"(6, 4)",SINAI,24,"(800,)",False,This metal from the mines of El Maghara helped usher in the Bronze Age in the area,Copper,0,3
3360,1999-03-26,,Double Jeopardy,"(1, 5)",TOWNS & CITIES,10,"(1000,)",False,"Once a large Mormon settlement, this Illinois town is now home to a Labor Day weekend grape festival",Nauvoo,0,3
3360,1999-03-26,,Double Jeopardy,"(2, 5)",POP MUSIC,5,"(1000,)",False,"This ""We're an American Band"" band was named after a railroad line",Grand Funk Railroad,0,3
3360,1999-03-26,,Double Jeopardy,"(3, 5)",GRAB BAG,15,"(1000,)",False,"This futuristic novel written in the 1940s was originally to be titled ""The Last Man in Europe""","""1984""",0,3
3360,1999-03-26,,Double Jeopardy,"(4, 5)","ENDS IN ""UM""",20,"(1000,)",False,It's the point or support on which a lever pivots,Fulcrum,1,0
3360,1999-03-26,,Double Jeopardy,"(5, 5)",CEDERS,30,"(1000,)",False,Spain ceded this largest of the Marianas to the U.S. in 1898 & sold the rest to Germany in 1899,Guam,1,0
3360,1999-03-26,,Double Jeopardy,"(6, 5)",SINAI,25,"(1000,)",False,"Israel, which occupied the peninsula from 1967 to 1982, withdrew because of these accords",Camp David Accords,0,3
3360,1999-03-26,,Final Jeopardy,"(1, 1)",AMERICAN HISTORY,0,"(0, 3700, 4701)",False,"As minister to Mexico, he was authorized by President Pierce to buy border land for the railroads",James Gadsden,0,3
