epNum,airDate,extra_info,round_name,coord,category,order,value,daily_double,question,answer,correctAttempts,wrongAttempts
3361,1999-03-29,1999 Celebrity Jeopardy! Sitcom Stars Night.,Jeopardy,"(1, 1)",INSECTS,9,"(100,)",False,The female cockroach has a packing case for these & carries it until she finds a good spot for them,her eggs,1,0
3361,1999-03-29,1999 Celebrity Jeopardy! Sitcom Stars Night.,Jeopardy,"(2, 1)",BRAIN CANDY,7,"(100,)",False,"This Sir Arthur Conan Doyle character once remarked ""A man's brain originally is like a little empty attic""",Sherlock Holmes,1,0
3361,1999-03-29,1999 Celebrity Jeopardy! Sitcom Stars Night.,Jeopardy,"(3, 1)",CLASSIC TV,2,"(100,)",False,"As Kojak, this actor loved you, baby",Telly Savalas,1,0
3361,1999-03-29,1999 Celebrity Jeopardy! Sitcom Stars Night.,Jeopardy,"(4, 1)",LIQUOR BY LABEL,1,"(100,)",False,"Old Grand-Dad,Jim Beam,Wild Turkey",bourbon,1,0
3361,1999-03-29,1999 Celebrity Jeopardy! Sitcom Stars Night.,Jeopardy,"(5, 1)","""GO""ING",13,"(100,)",False,Transportation for kids,go-karts,1,0
3361,1999-03-29,1999 Celebrity Jeopardy! Sitcom Stars Night.,Jeopardy,"(6, 1)",AROUND THE WORLD,25,"(100,)",False,"Any Scottish one over 3,000' is called a Munro, for the man who made a list of them in 1891",mountain,1,0
3361,1999-03-29,1999 Celebrity Jeopardy! Sitcom Stars Night.,Jeopardy,"(1, 2)",INSECTS,15,"(200,)",False,"Of its nose, tongue or feet, it's where a fly has its ""taste buds""",feet,1,1
3361,1999-03-29,1999 Celebrity Jeopardy! Sitcom Stars Night.,Jeopardy,"(2, 2)",BRAIN CANDY,8,"(200,)",False,Examples of these pains in the brain include the cluster & tension varieties,headaches,1,0
3361,1999-03-29,1999 Celebrity Jeopardy! Sitcom Stars Night.,Jeopardy,"(3, 2)",CLASSIC TV,3,"(200,)",False,Darrin Stephens was the flabbergasted husband on this magical sitcom,Bewitched,1,0
3361,1999-03-29,1999 Celebrity Jeopardy! Sitcom Stars Night.,Jeopardy,"(4, 2)",LIQUOR BY LABEL,20,"(200,)",False,"Finlandia,Absolut,Stolichnaya",vodka,1,0
3361,1999-03-29,1999 Celebrity Jeopardy! Sitcom Stars Night.,Jeopardy,"(5, 2)","""GO""ING",14,"(200,)",False,"From a Persian word for ""snake-eater"", a markhor is a wild type of this bearded ruminant",goat,0,3
3361,1999-03-29,1999 Celebrity Jeopardy! Sitcom Stars Night.,Jeopardy,"(1, 3)",INSECTS,17,"(300,)",False,"When handled, these jumpers spit a brown liquid some call ""tobacco juice""",grasshoppers,1,0
3361,1999-03-29,1999 Celebrity Jeopardy! Sitcom Stars Night.,Jeopardy,"(2, 3)",BRAIN CANDY,10,"(300,)",False,"It does ""matter"" that you give us this colorful slang term for the brain",gray matter,1,1
3361,1999-03-29,1999 Celebrity Jeopardy! Sitcom Stars Night.,Jeopardy,"(3, 3)",CLASSIC TV,4,"(300,)",False,"In the ""Star Trek"" episode ""Amok Time"" this character wants to return to his home planet to mate",Mr. Spock,1,0
3361,1999-03-29,1999 Celebrity Jeopardy! Sitcom Stars Night.,Jeopardy,"(4, 3)",LIQUOR BY LABEL,21,"(300,)",False,"Bombay,Beefeater,Tanqueray",gin,1,0
3361,1999-03-29,1999 Celebrity Jeopardy! Sitcom Stars Night.,Jeopardy,"(5, 3)","""GO""ING",16,"(300,)",False,This 1965 record was Shirley Bassey's biggest hit in the U.S.,"""Goldfinger""",1,0
3361,1999-03-29,1999 Celebrity Jeopardy! Sitcom Stars Night.,Jeopardy,"(1, 4)",INSECTS,18,"(500,)",True,"These long-snouted pests may attack shrubs & berries, but the boll type concentrates on cotton",weevils,1,0
3361,1999-03-29,1999 Celebrity Jeopardy! Sitcom Stars Night.,Jeopardy,"(2, 4)",BRAIN CANDY,11,"(400,)",False,"It's not cloudbursts in the skull, but shared problem solving in which everyone contributes ideas",brainstorming,1,1
3361,1999-03-29,1999 Celebrity Jeopardy! Sitcom Stars Night.,Jeopardy,"(3, 4)",CLASSIC TV,5,"(400,)",False,Harvard-educated surgeon Charles Winchester replaced Major Frank Burns on this show,M*A*S*H,1,0
3361,1999-03-29,1999 Celebrity Jeopardy! Sitcom Stars Night.,Jeopardy,"(4, 4)",LIQUOR BY LABEL,22,"(400,)",False,"Appleton,Captain Morgan,Bacardi",rum,1,0
3361,1999-03-29,1999 Celebrity Jeopardy! Sitcom Stars Night.,Jeopardy,"(5, 4)","""GO""ING",24,"(400,)",False,A word for mining haphazardly in irregular holes comes from the name of this burrowing rodent,gopher,1,0
3361,1999-03-29,1999 Celebrity Jeopardy! Sitcom Stars Night.,Jeopardy,"(1, 5)",INSECTS,19,"(500,)",False,"The chigoe, or chigger, is also known as the sand type of this pest",flea,1,0
3361,1999-03-29,1999 Celebrity Jeopardy! Sitcom Stars Night.,Jeopardy,"(2, 5)",BRAIN CANDY,12,"(500,)",False,It's the name for the brain-wasting cattle infection that crippled the British beef industry in 1996,mad cow disease,1,0
3361,1999-03-29,1999 Celebrity Jeopardy! Sitcom Stars Night.,Jeopardy,"(3, 5)",CLASSIC TV,6,"(500,)",False,The Brady Bunch had a cat named Fluffy & a dog named this,Tiger,1,0
3361,1999-03-29,1999 Celebrity Jeopardy! Sitcom Stars Night.,Jeopardy,"(4, 5)",LIQUOR BY LABEL,23,"(500,)",False,"Two Fingers,Herradura,Jose Cuervo",tequila,1,0
3361,1999-03-29,1999 Celebrity Jeopardy! Sitcom Stars Night.,Jeopardy,"(5, 5)","""GO""ING",26,"(500,)",False,Biblical name shared by the oldest son of Japheth & a TV Marine,Gomer,1,0
3361,1999-03-29,1999 Celebrity Jeopardy! Sitcom Stars Night.,Double Jeopardy,"(1, 1)",SWITZERLAND,26,"(200,)",False,The flag of this international organization is based on the Swiss flag,the Red Cross,1,0
3361,1999-03-29,1999 Celebrity Jeopardy! Sitcom Stars Night.,Double Jeopardy,"(2, 1)",MUSICAL THEATRE,13,"(200,)",False,"Act I of this 1997 ""Best Musical"" features an opening sequence titled ""The Launching""",Titanic,1,0
3361,1999-03-29,1999 Celebrity Jeopardy! Sitcom Stars Night.,Double Jeopardy,"(3, 1)",KATHY-GORY,12,"(200,)",False,"She played Erica's cellmate on ""All My Children"" before she won an Oscar for ""Misery""",Kathy Bates,1,0
3361,1999-03-29,1999 Celebrity Jeopardy! Sitcom Stars Night.,Double Jeopardy,"(4, 1)",FILM ANIMALS,4,"(200,)",False,Flipper,dolphin,1,0
3361,1999-03-29,1999 Celebrity Jeopardy! Sitcom Stars Night.,Double Jeopardy,"(5, 1)",MAKEUP,1,"(200,)",False,"If you go swimming, wear the waterproof type of this lash enhancer so you don't get ""raccoon eyes""",mascara,1,0
3361,1999-03-29,1999 Celebrity Jeopardy! Sitcom Stars Night.,Double Jeopardy,"(6, 1)","""I"" SHADOW",11,"(200,)",False,Muy caliente!  This Spanish superstar has sung successful duets with Stevie Wonder & Willie Nelson,Julio Iglesias,1,0
3361,1999-03-29,1999 Celebrity Jeopardy! Sitcom Stars Night.,Double Jeopardy,"(1, 2)",SWITZERLAND,27,"(400,)",False,"On June 12, 1897 Karl Elsener officially registered this multipurpose pocket tool",Swiss army knife,1,0
3361,1999-03-29,1999 Celebrity Jeopardy! Sitcom Stars Night.,Double Jeopardy,"(2, 2)",MUSICAL THEATRE,18,"(400,)",False,"""Big River"", featuring such characters as the Widow Douglas & Tom Sawyer, is based on this book","""Huckleberry Finn""",1,0
3361,1999-03-29,1999 Celebrity Jeopardy! Sitcom Stars Night.,Double Jeopardy,"(3, 2)",KATHY-GORY,14,"(400,)",False,"This ""Suddenly Susan"" co-star appeared on film in ""The Cable Guy"" & ""Pulp Fiction""",Kathy Griffin,1,0
3361,1999-03-29,1999 Celebrity Jeopardy! Sitcom Stars Night.,Double Jeopardy,"(4, 2)",FILM ANIMALS,5,"(400,)",False,Mighty Joe Young,ape,1,0
3361,1999-03-29,1999 Celebrity Jeopardy! Sitcom Stars Night.,Double Jeopardy,"(5, 2)",MAKEUP,2,"(400,)",False,"French for ""red"", L'Oreal makes a ""Virtuale"" version of it",rouge,1,0
3361,1999-03-29,1999 Celebrity Jeopardy! Sitcom Stars Night.,Double Jeopardy,"(6, 2)","""I"" SHADOW",22,"(400,)",False,Gelato is the Italian word for this treat,ice cream,1,0
3361,1999-03-29,1999 Celebrity Jeopardy! Sitcom Stars Night.,Double Jeopardy,"(1, 3)",SWITZERLAND,28,"(600,)",False,"If you're into this Swiss product you may want to ""hole"" up in the town of Gruyeres",Swiss cheese,1,0
3361,1999-03-29,1999 Celebrity Jeopardy! Sitcom Stars Night.,Double Jeopardy,"(2, 3)",MUSICAL THEATRE,19,"(2000,)",True,"In an Andrew Lloyd Webber-Tim Rice show, it's the other title word describing Joseph's amazing dreamcoat",Technicolor,1,0
3361,1999-03-29,1999 Celebrity Jeopardy! Sitcom Stars Night.,Double Jeopardy,"(3, 3)",KATHY-GORY,15,"(600,)",False,"As Olive on ""Veronica's Closet"", she finds that life isn't the pits",Kathy Najimy,1,0
3361,1999-03-29,1999 Celebrity Jeopardy! Sitcom Stars Night.,Double Jeopardy,"(4, 3)",FILM ANIMALS,8,"(600,)",False,Black Beauty,horse,1,0
3361,1999-03-29,1999 Celebrity Jeopardy! Sitcom Stars Night.,Double Jeopardy,"(5, 3)",MAKEUP,3,"(600,)",False,"Estee Lauder suggests putting this on top of your foundation twice: with a cotton ball & a big, fluffy brush",powder,1,0
3361,1999-03-29,1999 Celebrity Jeopardy! Sitcom Stars Night.,Double Jeopardy,"(6, 3)","""I"" SHADOW",23,"(600,)",False,"In criminal law, it's defined as an individual's inability to distinguish right from wrong",insanity,1,0
3361,1999-03-29,1999 Celebrity Jeopardy! Sitcom Stars Night.,Double Jeopardy,"(1, 4)",SWITZERLAND,29,"(800,)",False,This geographic extreme for Switzerland is 636 feet above sea level at Lake Maggiore,the lowest point,0,3
3361,1999-03-29,1999 Celebrity Jeopardy! Sitcom Stars Night.,Double Jeopardy,"(2, 4)",MUSICAL THEATRE,20,"(800,)",False,"This Sondheim tune begins, ""Something familiar, something peculiar, something for everyone, a...""","""Comedy Tonight""",1,0
3361,1999-03-29,1999 Celebrity Jeopardy! Sitcom Stars Night.,Double Jeopardy,"(3, 4)",KATHY-GORY,16,"(800,)",False,"This supermodel's official website features shopping tips, a book corner & a ""Get in Touch with Kathy"" section",Kathy Ireland,1,0
3361,1999-03-29,1999 Celebrity Jeopardy! Sitcom Stars Night.,Double Jeopardy,"(4, 4)",FILM ANIMALS,9,"(800,)",False,Beethoven,St. Bernard,1,0
3361,1999-03-29,1999 Celebrity Jeopardy! Sitcom Stars Night.,Double Jeopardy,"(5, 4)",MAKEUP,6,"(800,)",False,"This makeup maven has the same name as Whitney Houston's husband, but she spells it differently",Bobbi Brown,1,0
3361,1999-03-29,1999 Celebrity Jeopardy! Sitcom Stars Night.,Double Jeopardy,"(6, 4)","""I"" SHADOW",24,"(800,)",False,We Canadians know this U.S. government branch is abbreviated I.N.S.,Immigration and Naturalization Service,0,3
3361,1999-03-29,1999 Celebrity Jeopardy! Sitcom Stars Night.,Double Jeopardy,"(1, 5)",SWITZERLAND,30,"(1000,)",False,You'd have to have your head examined to check into the C.G. Jung Institute of this largest Swiss city,Zurich,0,3
3361,1999-03-29,1999 Celebrity Jeopardy! Sitcom Stars Night.,Double Jeopardy,"(2, 5)",MUSICAL THEATRE,21,"(1000,)",False,"1959 musical that introduced the song ""Everything's Coming Up Roses""",Gypsy,1,0
3361,1999-03-29,1999 Celebrity Jeopardy! Sitcom Stars Night.,Double Jeopardy,"(3, 5)",KATHY-GORY,17,"(2000,)",True,"Lauren Chapin played Kathy, also known as ""Kitten"", on this classic sitcom",Father Knows Best,0,1
3361,1999-03-29,1999 Celebrity Jeopardy! Sitcom Stars Night.,Double Jeopardy,"(4, 5)",FILM ANIMALS,10,"(1000,)",False,Fievel,mouse,1,0
3361,1999-03-29,1999 Celebrity Jeopardy! Sitcom Stars Night.,Double Jeopardy,"(5, 5)",MAKEUP,7,"(1000,)",False,"Gash & acid rain are popular hues of Urban Decay makeup, whose ads have asked, ""Does"" this pastel color ""make you puke?""",pink,0,3
3361,1999-03-29,1999 Celebrity Jeopardy! Sitcom Stars Night.,Double Jeopardy,"(6, 5)","""I"" SHADOW",25,"(1000,)",False,This ancient Greek epic poem attributed to Homer describes the siege of Troy,"""The Iliad""",1,0
3361,1999-03-29,1999 Celebrity Jeopardy! Sitcom Stars Night.,Final Jeopardy,"(1, 1)",1999 ANNIVERSARIES,0,"(2300, 6000, 8400)",False,A traveling exhibit honoring the 200th anniversary of his death features his false teeth,George Washington,2,1
