epNum,airDate,extra_info,round_name,coord,category,order,value,daily_double,question,answer,correctAttempts,wrongAttempts
3398,1999-05-19,1999-A Celebrity Jeopardy! game 3.,Jeopardy,"(1, 1)",FINISH THE LINE,14,"(100,)",False,"The Beatles:""Yesterday all my troubles seemed...""",so far away,1,0
3398,1999-05-19,1999-A Celebrity Jeopardy! game 3.,Jeopardy,"(3, 1)",TARZAN'S ZOO,19,"(100,)",False,"To Tarzan, kal was milk & kalo was this source of milk",cow,1,0
3398,1999-05-19,1999-A Celebrity Jeopardy! game 3.,Jeopardy,"(4, 1)",NAME THE MUSICAL,12,"(100,)",False,"""Let the Sunshine in""",Hair,1,0
3398,1999-05-19,1999-A Celebrity Jeopardy! game 3.,Jeopardy,"(5, 1)",THE SILVER SCREEN,2,"(100,)",False,Jay Silverheels played this pal of the Lone Ranger on film as well as TV,Tonto,1,0
3398,1999-05-19,1999-A Celebrity Jeopardy! game 3.,Jeopardy,"(6, 1)","""S"" WORDS",11,"(100,)",False,John H. Breck was largely responsible for bringing this liquid into American showers,shampoo,1,0
3398,1999-05-19,1999-A Celebrity Jeopardy! game 3.,Jeopardy,"(1, 2)",FINISH THE LINE,15,"(200,)",False,"President Bush:""Read my lips...""",no new taxes,1,1
3398,1999-05-19,1999-A Celebrity Jeopardy! game 3.,Jeopardy,"(2, 2)",HAPPY BIRTHDAY TO US,28,"(200,)",False,"Did you ever notice that Faye Dunaway & this curmudgeonly ""60 Minutes"" commentator were both born Jan. 14?",Andy Rooney,1,0
3398,1999-05-19,1999-A Celebrity Jeopardy! game 3.,Jeopardy,"(3, 2)",TARZAN'S ZOO,20,"(200,)",False,"Tarzan despised Dango, this animal, maybe thinking it was laughing at him",hyena,1,0
3398,1999-05-19,1999-A Celebrity Jeopardy! game 3.,Jeopardy,"(4, 2)",NAME THE MUSICAL,9,"(200,)",False,"""Bali Ha'i""",South Pacific,1,0
3398,1999-05-19,1999-A Celebrity Jeopardy! game 3.,Jeopardy,"(5, 2)",THE SILVER SCREEN,3,"(200,)",False,"You should know that she played Batgirl in ""Batman & Robin"" -- unless you're ""Clueless""",Alicia Silverstone,1,0
3398,1999-05-19,1999-A Celebrity Jeopardy! game 3.,Jeopardy,"(6, 2)","""S"" WORDS",18,"(200,)",False,"Aba-ebi in Japanese, this sushi ingredient must be extremely fresh to be served raw",shrimp,1,0
3398,1999-05-19,1999-A Celebrity Jeopardy! game 3.,Jeopardy,"(1, 3)",FINISH THE LINE,16,"(300,)",False,"Your mom:""Penny wise...""",pound foolish,1,0
3398,1999-05-19,1999-A Celebrity Jeopardy! game 3.,Jeopardy,"(2, 3)",HAPPY BIRTHDAY TO US,27,"(300,)",False,"This jazz queen could have scatted ""Happy Birthday"" for herself & Al Pacino on their birthday, April 25",Ella Fitzgerald,1,1
3398,1999-05-19,1999-A Celebrity Jeopardy! game 3.,Jeopardy,"(4, 3)",NAME THE MUSICAL,8,"(300,)",False,"""The Music of the Night""",Phantom of the Opera,1,0
3398,1999-05-19,1999-A Celebrity Jeopardy! game 3.,Jeopardy,"(5, 3)",THE SILVER SCREEN,4,"(300,)",False,"Rent the 1978 film ""Silver Bears"" & you'll see this ""Tonight Show"" host playing a mafioso's son",Jay Leno,1,0
3398,1999-05-19,1999-A Celebrity Jeopardy! game 3.,Jeopardy,"(6, 3)","""S"" WORDS",23,"(300,)",False,"Famous ones have included Telstar, Milstar & Navstar",satellites,1,0
3398,1999-05-19,1999-A Celebrity Jeopardy! game 3.,Jeopardy,"(1, 4)",FINISH THE LINE,17,"(400,)",False,"An advertising slogan:""Pork the Other...""",White Meat,1,1
3398,1999-05-19,1999-A Celebrity Jeopardy! game 3.,Jeopardy,"(2, 4)",HAPPY BIRTHDAY TO US,26,"(400,)",False,"Robert Urich & this ""Flashdance""r should head to Vegas December 19 for a birthday bash",Jennifer Beals,1,0
3398,1999-05-19,1999-A Celebrity Jeopardy! game 3.,Jeopardy,"(3, 4)",TARZAN'S ZOO,22,"(400,)",False,"Tarzan knew someone was at death's door when he saw a group of ska, these birds, circling overhead",vultures,1,1
3398,1999-05-19,1999-A Celebrity Jeopardy! game 3.,Jeopardy,"(4, 4)",NAME THE MUSICAL,7,"(400,)",False,"""Luck Be a Lady""",Guys and Dolls,1,1
3398,1999-05-19,1999-A Celebrity Jeopardy! game 3.,Jeopardy,"(5, 4)",THE SILVER SCREEN,5,"(400,)",False,"The fact that this singing cowboy starred in ""Silver Spurs"" should ""Trigger"" your memory",Roy Rogers,1,0
3398,1999-05-19,1999-A Celebrity Jeopardy! game 3.,Jeopardy,"(6, 4)","""S"" WORDS",21,"(400,)",False,It's someone whose job is carrying your bags at an airport,skycap,1,0
3398,1999-05-19,1999-A Celebrity Jeopardy! game 3.,Jeopardy,"(1, 5)",FINISH THE LINE,24,"(500,)",False,"Helen Reddy:""I am woman...""",hear me roar,1,0
3398,1999-05-19,1999-A Celebrity Jeopardy! game 3.,Jeopardy,"(2, 5)",HAPPY BIRTHDAY TO US,25,"(500,)",False,"Corbin Bernsen & this ""I Will Survive"" singer have survived many birthdays on September 7",Gloria Gaynor,1,0
3398,1999-05-19,1999-A Celebrity Jeopardy! game 3.,Jeopardy,"(3, 5)",TARZAN'S ZOO,10,"(500,)",False,"Tarzan can tell Numa, the male of this cat species, from Sabor, the female, by its thick mane",lion,1,0
3398,1999-05-19,1999-A Celebrity Jeopardy! game 3.,Jeopardy,"(4, 5)",NAME THE MUSICAL,6,"(500,)",False,"""Seasons of Love""",Rent,1,0
3398,1999-05-19,1999-A Celebrity Jeopardy! game 3.,Jeopardy,"(5, 5)",THE SILVER SCREEN,1,"(500,)",True,This 1985 western starred 2 Kevins: Kline & Costner,Silverado,1,0
3398,1999-05-19,1999-A Celebrity Jeopardy! game 3.,Jeopardy,"(6, 5)","""S"" WORDS",13,"(500,)",False,A complete sentence needs a predicate & one of these,subject,1,0
3398,1999-05-19,1999-A Celebrity Jeopardy! game 3.,Double Jeopardy,"(1, 1)",IT WAS THE '70s,2,"(200,)",False,"""Y.M.C.A."" was a big hit for this group that included a biker, a cowboy & a hard hat",The Village People,1,0
3398,1999-05-19,1999-A Celebrity Jeopardy! game 3.,Double Jeopardy,"(2, 1)",WHICH CAME FIRST?,1,"(200,)",False,"""Maude"",""The Jeffersons"",""All in the Family""",All in the Family,1,0
3398,1999-05-19,1999-A Celebrity Jeopardy! game 3.,Double Jeopardy,"(3, 1)","FILE UNDER ""H""",25,"(200,)",False,It's something called a mouth organ,harmonica,1,0
3398,1999-05-19,1999-A Celebrity Jeopardy! game 3.,Double Jeopardy,"(4, 1)",LAS VEGAS,16,"(200,)",False,"It's the legal gambling age in Vegas, or a popular card game",21,1,0
3398,1999-05-19,1999-A Celebrity Jeopardy! game 3.,Double Jeopardy,"(5, 1)",TELEVISION,8,"(200,)",False,"It's the first word spoken in the opening title sequence on the original ""Star Trek"" series",Space,1,0
3398,1999-05-19,1999-A Celebrity Jeopardy! game 3.,Double Jeopardy,"(6, 1)",SWORDS,26,"(200,)",False,"At this 2-word command at the start of a fencing match, raise your sword toward your opponent",en garde,1,1
3398,1999-05-19,1999-A Celebrity Jeopardy! game 3.,Double Jeopardy,"(1, 2)",IT WAS THE '70s,3,"(400,)",False,"A June 23, 1972 tape on which Nixon discussed a Watergate cover-up was called this type of ""gun""",smoking gun,1,0
3398,1999-05-19,1999-A Celebrity Jeopardy! game 3.,Double Jeopardy,"(2, 2)",WHICH CAME FIRST?,23,"(400,)",False,"Woodrow Wilson,Dwight D. Eisenhower,James Garfield",James Garfield,1,0
3398,1999-05-19,1999-A Celebrity Jeopardy! game 3.,Double Jeopardy,"(3, 2)","FILE UNDER ""H""",24,"(400,)",False,"In 1997 the comet Hale-Bopp soared through our skies & this group soared up the charts with ""Mmmbop""",Hanson,1,0
3398,1999-05-19,1999-A Celebrity Jeopardy! game 3.,Double Jeopardy,"(4, 2)",LAS VEGAS,15,"(400,)",False,"You don't have to go to Egypt to see a pyramid, just check out this hotel on the strip",the Luxor,1,0
3398,1999-05-19,1999-A Celebrity Jeopardy! game 3.,Double Jeopardy,"(5, 2)",TELEVISION,7,"(400,)",False,Dang!  This actor rode to success as TV's Sam McCloud,Dennis Weaver,1,0
3398,1999-05-19,1999-A Celebrity Jeopardy! game 3.,Double Jeopardy,"(6, 2)",SWORDS,27,"(400,)",False,"If you're known for repartee, you have the type of ""wit"" named for this narrow-bladed sword",rapier,1,0
3398,1999-05-19,1999-A Celebrity Jeopardy! game 3.,Double Jeopardy,"(1, 3)",IT WAS THE '70s,11,"(600,)",False,The last names of bestselling authors Arthur & Alex were both pronounced this way,Hailey/Haley,1,0
3398,1999-05-19,1999-A Celebrity Jeopardy! game 3.,Double Jeopardy,"(2, 3)",WHICH CAME FIRST?,22,"(600,)",False,"Arizona statehood,Ohio statehood,Alaska statehood",Ohio statehood,1,0
3398,1999-05-19,1999-A Celebrity Jeopardy! game 3.,Double Jeopardy,"(3, 3)","FILE UNDER ""H""",21,"(600,)",False,"A little over 5 feet tall & weighing up to 8,000 pounds, this hoofed mammal spends its days in the water",hippopotamus,1,0
3398,1999-05-19,1999-A Celebrity Jeopardy! game 3.,Double Jeopardy,"(4, 3)",LAS VEGAS,13,"(600,)",False,"At the Mirage Hotel, these illusionists appear in what Time magazine has dubbed ""The Show of the Century""",Siegfried and Roy,1,0
3398,1999-05-19,1999-A Celebrity Jeopardy! game 3.,Double Jeopardy,"(5, 3)",TELEVISION,6,"(600,)",False,"Kevin James plays sports-crazed, blue-collar working stiff Doug Heffernan on this ""royal"" CBS sitcom",The King of Queens,1,0
3398,1999-05-19,1999-A Celebrity Jeopardy! game 3.,Double Jeopardy,"(6, 3)",SWORDS,28,"(600,)",False,"An extinct ""tiger"" got its name from teeth that resembled this fencing sword",saber,1,0
3398,1999-05-19,1999-A Celebrity Jeopardy! game 3.,Double Jeopardy,"(1, 4)",IT WAS THE '70s,10,"(800,)",False,"""All I ask is"" this type of vessel that helped NYC celebrate the Bicentennial ""and a star to steer her by""",tall ship,1,0
3398,1999-05-19,1999-A Celebrity Jeopardy! game 3.,Double Jeopardy,"(2, 4)",WHICH CAME FIRST?,18,"(2000,)",True,"The Rolling Stones,The Dave Clark Five,The Beatles",The Beatles,1,0
3398,1999-05-19,1999-A Celebrity Jeopardy! game 3.,Double Jeopardy,"(3, 4)","FILE UNDER ""H""",19,"(800,)",False,"Kanchenjunga, Annapurna I & Nanga Parbat are peaks in this mountain range",the Himalayas,1,0
3398,1999-05-19,1999-A Celebrity Jeopardy! game 3.,Double Jeopardy,"(4, 4)",LAS VEGAS,12,"(800,)",False,In 1997 this gangster's mug appeared on gaming chips celebrating the Flamingo Hilton's 50th anniversary,Bugsy Siegel,1,0
3398,1999-05-19,1999-A Celebrity Jeopardy! game 3.,Double Jeopardy,"(5, 4)",TELEVISION,5,"(2000,)",True,"(Hi everybody, I'm Brandy!)  In the TV movie ""Cinderella"", I played Cinderella & this singer played my fairy godmother",Whitney Houston,1,0
3398,1999-05-19,1999-A Celebrity Jeopardy! game 3.,Double Jeopardy,"(6, 4)",SWORDS,29,"(800,)",False,The swords the Romans & Vikings used had this quality which could probably work for them or against them,double-edged,1,0
3398,1999-05-19,1999-A Celebrity Jeopardy! game 3.,Double Jeopardy,"(1, 5)",IT WAS THE '70s,9,"(1000,)",False,"From the Spanish for ""to hinder"", one of these hindered U.S. motorists when Arab states imposed it on oil",embargo,1,0
3398,1999-05-19,1999-A Celebrity Jeopardy! game 3.,Double Jeopardy,"(2, 5)",WHICH CAME FIRST?,17,"(1000,)",False,"Catherine the Great,Constantine the Great,Ivan the Great",Constantine the Great,1,0
3398,1999-05-19,1999-A Celebrity Jeopardy! game 3.,Double Jeopardy,"(3, 5)","FILE UNDER ""H""",20,"(1000,)",False,'50s TV puppet that's the subject of a 1999 custody battle between the D.I.A. & its owner's heirs,Howdy Doody,1,0
3398,1999-05-19,1999-A Celebrity Jeopardy! game 3.,Double Jeopardy,"(4, 5)",LAS VEGAS,14,"(1000,)",False,It's a short trip from New York-New York to Detroit & the home cooking of this music-themed cafe,the Motown Cafe,0,3
3398,1999-05-19,1999-A Celebrity Jeopardy! game 3.,Double Jeopardy,"(5, 5)",TELEVISION,4,"(1000,)",False,"Howard Hesseman spun out the tunes as this hip ""medical"" deejay on ""WKRP in Cincinnati""",Dr. Johnny Fever,1,0
3398,1999-05-19,1999-A Celebrity Jeopardy! game 3.,Double Jeopardy,"(6, 5)",SWORDS,30,"(1000,)",False,"The name of this highly curved, highly deadly sword comes from the Persian shamshir",scimitar,1,0
3398,1999-05-19,1999-A Celebrity Jeopardy! game 3.,Final Jeopardy,"(1, 1)",INTERNATIONAL SPORTS,0,"(799, 6500, 3000)",False,"Jan Ullrich, the only German ever to win this event, has been nicknamed ""Der Tourminator""",the Tour de France,1,2
