epNum,airDate,extra_info,round_name,coord,category,order,value,daily_double,question,answer,correctAttempts,wrongAttempts
3442,1999-07-20,,Jeopardy,"(1, 1)",MUSEUMS,11,"(100,)",False,"10,000 years of rollin' along are chronicled in Memphis' museum dedicated to this river",Mississippi River,1,0
3442,1999-07-20,,Jeopardy,"(2, 1)",MOVIE SONGS,1,"(100,)",False,"In this 1968 Beatles title tune, ""Every one of us has all we need, sky of blue and sea of green""","""Yellow Submarine""",1,0
3442,1999-07-20,,Jeopardy,"(3, 1)",ANAGRAMMED STATE CAPITALS,21,"(100,)",False,OH NO LULU!,Honolulu,1,0
3442,1999-07-20,,Jeopardy,"(4, 1)",HODGEPODGE,6,"(100,)",False,He's considered the mascot of Mad Magazine,Alfred E. Neuman,1,0
3442,1999-07-20,,Jeopardy,"(5, 1)",4-LETTER CLOTHES,16,"(100,)",False,"One may be wedding, prom or dressing",Gown,1,0
3442,1999-07-20,,Jeopardy,"(6, 1)",COCKNEY RHYMING SLANG,23,"(100,)",False,This person is your trouble and strife -- though it might not be wise to call her that,Wife,1,0
3442,1999-07-20,,Jeopardy,"(1, 2)",MUSEUMS,12,"(200,)",False,"You can see old-time longboards at Huntington Beach, California's museum of this sport",Surfing,1,0
3442,1999-07-20,,Jeopardy,"(2, 2)",MOVIE SONGS,2,"(200,)",False,"This 1967 film featured such songs as ""The Vegetarian"", ""When I Look in Your Eyes"" & ""Talk to the Animals""",Doctor Dolittle,1,0
3442,1999-07-20,,Jeopardy,"(3, 2)",ANAGRAMMED STATE CAPITALS,22,"(200,)",False,SOB NOT,Boston,1,0
3442,1999-07-20,,Jeopardy,"(4, 2)",HODGEPODGE,7,"(200,)",False,"He said, ""You don't have to be drunk or intoxicated to be attracted to Carmen Electra.  She is a beautiful woman""",Dennis Rodman,1,0
3442,1999-07-20,,Jeopardy,"(5, 2)",4-LETTER CLOTHES,17,"(200,)",False,Piece that turns a man's 2-piece suit into a 3-piece suit,Vest,1,0
3442,1999-07-20,,Jeopardy,"(6, 2)",COCKNEY RHYMING SLANG,24,"(200,)",False,"Sausage and mash is this, & no one ever seems to have enough of it",Money/cash,0,3
3442,1999-07-20,,Jeopardy,"(1, 3)",MUSEUMS,13,"(300,)",False,Colorado Springs' American Cowboy Museum also has the hall of fame for this event,Rodeo,1,0
3442,1999-07-20,,Jeopardy,"(2, 3)",MOVIE SONGS,3,"(300,)",False,"His last No. 1 solo hit, ""Strangers in the Night"", was adapted from the movie ""A Man Could Get Killed""",Frank Sinatra,1,0
3442,1999-07-20,,Jeopardy,"(3, 3)",ANAGRAMMED STATE CAPITALS,28,"(300,)",False,RENT NOT,Trenton,1,0
3442,1999-07-20,,Jeopardy,"(4, 3)",HODGEPODGE,8,"(300,)",False,A lab in Berkeley recently tested this versatile product's ability to seal air ducts & it failed,Duct tape,1,0
3442,1999-07-20,,Jeopardy,"(5, 3)",4-LETTER CLOTHES,18,"(300,)",False,"Ballet wear, perhaps for Desmond",Tutu,1,0
3442,1999-07-20,,Jeopardy,"(6, 3)",COCKNEY RHYMING SLANG,25,"(300,)",False,"A weasel and stoat is one of these, even if it isn't made from weasel or stoat",Coat,1,0
3442,1999-07-20,,Jeopardy,"(1, 4)",MUSEUMS,14,"(400,)",False,This Hollywood store that includes a lingerie museum was named for a man whose last name was Mellinger,Frederick\'s of Hollywood,1,0
3442,1999-07-20,,Jeopardy,"(2, 4)",MOVIE SONGS,4,"(400,)",False,"Whitney Houston sang this 1974 Dolly Parton hit in ""The Bodyguard""; it topped the charts for 14 weeks","""I Will Always Love You""",1,0
3442,1999-07-20,,Jeopardy,"(3, 4)",ANAGRAMMED STATE CAPITALS,29,"(400,)",False,ROVED,Dover,1,0
3442,1999-07-20,,Jeopardy,"(4, 4)",HODGEPODGE,9,"(400,)",False,In December 1998 a Dutch court banned any publication questioning the veracity of this girl's diary,Anne Frank,1,0
3442,1999-07-20,,Jeopardy,"(5, 4)",4-LETTER CLOTHES,19,"(400,)",False,"After it comes back pink from the wash, you might use something similar to fire your laundress",Slip,1,0
3442,1999-07-20,,Jeopardy,"(6, 4)",COCKNEY RHYMING SLANG,26,"(400,)",False,"This liquor is a fine and dandy, & that's fine and dandy with me",Brandy,1,1
3442,1999-07-20,,Jeopardy,"(1, 5)",MUSEUMS,15,"(500,)",False,A Manhattan cultural museum is named for these Latin-American areas of U.S. cities,Barrios,0,3
3442,1999-07-20,,Jeopardy,"(2, 5)",MOVIE SONGS,5,"(500,)",False,"This No. 1 Bette Midler song from ""Beaches"" is also known as ""Hero""","""Wind Beneath My Wings""",1,0
3442,1999-07-20,,Jeopardy,"(3, 5)",ANAGRAMMED STATE CAPITALS,30,"(500,)",False,IS A NUT,Austin,1,0
3442,1999-07-20,,Jeopardy,"(4, 5)",HODGEPODGE,10,"(500,)",False,"According to the U.N. World Food Map, this country's people have the most per person; hope it doesn't get rotten!",Denmark,0,3
3442,1999-07-20,,Jeopardy,"(5, 5)",4-LETTER CLOTHES,20,"(800,)",True,Piece of clothing in the title of the first feature film in Cinemascope,The Robe,0,1
3442,1999-07-20,,Jeopardy,"(6, 5)",COCKNEY RHYMING SLANG,27,"(500,)",False,"It's what your Lucy locket is -- Lucy lost hers, by the way",Pocket,1,0
3442,1999-07-20,,Double Jeopardy,"(1, 1)",MYTHOLOGY,1,"(200,)",False,Xiuhtecuhtli was the fire god of these people also called the Tenochca,Aztecs,1,0
3442,1999-07-20,,Double Jeopardy,"(2, 1)",FUNNY MEN,8,"(200,)",False,"Be cool, man!  He's the hip '60s comedian being searched here by a cop",Lenny Bruce,1,0
3442,1999-07-20,,Double Jeopardy,"(3, 1)",LATIN AMERICAN HISTORY,6,"(200,)",False,In World War II only Mexico & this largest Latin American country provided troops to the Allied cause,Brazil,1,0
3442,1999-07-20,,Double Jeopardy,"(4, 1)",CELEBRITY RELATIVES,14,"(200,)",False,"In the 1920s this princess' father, John, won 3 Olympic gold medals for the U.S. in rowing",Grace Kelly,1,0
3442,1999-07-20,,Double Jeopardy,"(5, 1)",HERE COMES THE SUPREME COURT JUSTICE!,26,"(200,)",False,The commission that investigated JFK's assassination was chaired by & named for this chief justice,Earl Warren,1,0
3442,1999-07-20,,Double Jeopardy,"(6, 1)","""DIS"" IS FOR REAL!",19,"(200,)",False,A reduced price for goods,Discount,1,0
3442,1999-07-20,,Double Jeopardy,"(1, 2)",MYTHOLOGY,2,"(400,)",False,Some say she was detained by King Proteus & that the woman taken to Troy was a phantom made to look like her,Helen,1,0
3442,1999-07-20,,Double Jeopardy,"(2, 2)",FUNNY MEN,9,"(400,)",False,"Scantily clad dancers on this popular British TV comedian's show were called ""Hill's Angels""",Benny Hill,1,0
3442,1999-07-20,,Double Jeopardy,"(3, 2)",LATIN AMERICAN HISTORY,7,"(400,)",False,In 1903 the U.S. signed a treaty with Cuba for the rights to establish a naval base at this site,Guantanamo Bay,1,0
3442,1999-07-20,,Double Jeopardy,"(4, 2)",CELEBRITY RELATIVES,15,"(400,)",False,They're the mama & the papa of singer-actress Chynna Phillips,John & Michelle Phillips,1,0
3442,1999-07-20,,Double Jeopardy,"(5, 2)",HERE COMES THE SUPREME COURT JUSTICE!,27,"(400,)",False,This man was chief justice in 1803 when the Supreme Court decided the landmark case Marbury v. Madison,John Marshall,1,0
3442,1999-07-20,,Double Jeopardy,"(6, 2)","""DIS"" IS FOR REAL!",20,"(400,)",False,Army discharge below one for bad conduct,Dishonorable,1,0
3442,1999-07-20,,Double Jeopardy,"(1, 3)",MYTHOLOGY,3,"(600,)",False,Nekhbet the vulture goddess protected the upper part of this country; Buto the cobra goddess got the lower,Egypt,1,0
3442,1999-07-20,,Double Jeopardy,"(2, 3)",FUNNY MEN,10,"(600,)",False,"Today's secret word, it's the real first name of legendary comedian Groucho Marx",Julius,0,3
3442,1999-07-20,,Double Jeopardy,"(3, 3)",LATIN AMERICAN HISTORY,11,"(600,)",False,"In 1869 Ebenezer Bassett, the USA's first black diplomat, became minister to this French-speaking nation",Haiti,1,0
3442,1999-07-20,,Double Jeopardy,"(4, 3)",CELEBRITY RELATIVES,16,"(600,)",False,"He directed his daughter Alison in the film ""Midnight in the Garden of Good and Evil""",Clint Eastwood,1,0
3442,1999-07-20,,Double Jeopardy,"(5, 3)",HERE COMES THE SUPREME COURT JUSTICE!,28,"(700,)",True,Clarence Thomas replaced this Supreme Court justice who retired in 1991,Thurgood Marshall,1,0
3442,1999-07-20,,Double Jeopardy,"(6, 3)","""DIS"" IS FOR REAL!",21,"(600,)",False,"According to Shakespeare, it's ""the better part of valor""",Discretion,1,0
3442,1999-07-20,,Double Jeopardy,"(1, 4)",MYTHOLOGY,4,"(800,)",False,"This king of Ithaca, Odysseus' father, has the same name as Ophelia's brother in ""Hamlet""",Laertes,1,0
3442,1999-07-20,,Double Jeopardy,"(2, 4)",FUNNY MEN,12,"(800,)",False,"This onetime Vaudevillian & star of ""Modern Times"" was knighted in 1975",Charlie Chaplin,1,0
3442,1999-07-20,,Double Jeopardy,"(3, 4)",LATIN AMERICAN HISTORY,24,"(800,)",False,"In 1862 Great Britain formally took control of this country, then called British Honduras",Belize,0,3
3442,1999-07-20,,Double Jeopardy,"(4, 4)",CELEBRITY RELATIVES,17,"(800,)",False,"He appeared in the 1951 London stage production of ""South Pacific"", which starred his mom, Mary Martin",Larry Hagman,1,0
3442,1999-07-20,,Double Jeopardy,"(5, 4)",HERE COMES THE SUPREME COURT JUSTICE!,29,"(800,)",False,"The first female U.S. Supreme Court justice, Sandra Day O'Connor, was appointed by this president",Ronald Reagan,1,0
3442,1999-07-20,,Double Jeopardy,"(6, 4)","""DIS"" IS FOR REAL!",22,"(800,)",False,Infectious canine disease characterized by lethargy & fever,Distemper,1,0
3442,1999-07-20,,Double Jeopardy,"(1, 5)",MYTHOLOGY,5,"(1000,)",False,This Norse trickster liked to turn himself into a salmon & frolic in Franang's Falls,Loki,1,0
3442,1999-07-20,,Double Jeopardy,"(2, 5)",FUNNY MEN,13,"(1000,)",False,Things went from riches to rags for this corpulent comic in the 1920s,Fatty Arbuckle,1,0
3442,1999-07-20,,Double Jeopardy,"(3, 5)",LATIN AMERICAN HISTORY,25,"(2000,)",True,In November 1533 this Spanish conquistador triumphantly entered Cuzco,Francisco Pizarro,1,0
3442,1999-07-20,,Double Jeopardy,"(4, 5)",CELEBRITY RELATIVES,18,"(1000,)",False,"(Hi, I'm Joshua Morrow)  My ""Young & Restless"" co-star, Jeanne Cooper, is the real life mom of this former ""L.A. Law"" star",Corbin Bernsen,1,0
3442,1999-07-20,,Double Jeopardy,"(5, 5)",HERE COMES THE SUPREME COURT JUSTICE!,30,"(1000,)",False,"The last Supreme Court justice to be named (by Clinton in '94), he's currently first alphabetically",Stephen Breyer,0,3
3442,1999-07-20,,Double Jeopardy,"(6, 5)","""DIS"" IS FOR REAL!",23,"(1000,)",False,"Abbreviated DSM, it's a military decoration for exceptional performance of duty",Distinguished Service Medal,1,0
3442,1999-07-20,,Final Jeopardy,"(1, 1)",THE ANIMAL KINGDOM,0,"(2700, 5700, 1700)",False,The family Monodontidae is composed of 2 members: the beluga whale & this other marine mammal,Narwhal,0,3
