epNum,airDate,extra_info,round_name,coord,category,order,value,daily_double,question,answer,correctAttempts,wrongAttempts
3450,1999-09-10,1999 Back to School Week game 5.,Jeopardy,"(1, 1)",STATE CAPITALS,1,"(100,)",False,Massachusetts,Boston,1,0
3450,1999-09-10,1999 Back to School Week game 5.,Jeopardy,"(2, 1)",IN THE COOKIE JAR,12,"(100,)",False,These sun-dried grapes can be found in oatmeal cookies,Raisins,1,0
3450,1999-09-10,1999 Back to School Week game 5.,Jeopardy,"(3, 1)",KIDDIE LIT CHARACTERS,21,"(100,)",False,"He hangs around with the ""Man in the Yellow Hat""",Curious George,1,0
3450,1999-09-10,1999 Back to School Week game 5.,Jeopardy,"(4, 1)",MUSICAL YOUTH,11,"(100,)",False,"She was on the ""Mickey Mouse Club"" before topping the charts with ""...Baby One More Time""",Britney Spears,1,0
3450,1999-09-10,1999 Back to School Week game 5.,Jeopardy,"(5, 1)",OUR GOVERNMENT,26,"(100,)",False,"Instead of a president, each of the states has this chief executive",Governor,1,0
3450,1999-09-10,1999 Back to School Week game 5.,Jeopardy,"(6, 1)","""E"" FOR EFFORT",6,"(100,)",False,This joint connects your upper arm to your forearm,Elbow,1,0
3450,1999-09-10,1999 Back to School Week game 5.,Jeopardy,"(1, 2)",STATE CAPITALS,2,"(200,)",False,Nevada,Carson City,1,1
3450,1999-09-10,1999 Back to School Week game 5.,Jeopardy,"(2, 2)",IN THE COOKIE JAR,13,"(200,)",False,Recipes for the cookie named for this spread may call for the smooth or chunky variety,Peanut butter,1,0
3450,1999-09-10,1999 Back to School Week game 5.,Jeopardy,"(3, 2)",KIDDIE LIT CHARACTERS,22,"(200,)",False,"In the Winnie-the-Pooh stories, this very small animal is the only ""ham""",Piglet,1,0
3450,1999-09-10,1999 Back to School Week game 5.,Jeopardy,"(4, 2)",MUSICAL YOUTH,17,"(200,)",False,"He's the youngest member of the group heard here(""MMMbop"")",Zac,1,1
3450,1999-09-10,1999 Back to School Week game 5.,Jeopardy,"(5, 2)",OUR GOVERNMENT,27,"(200,)",False,The U.S. Constitution has 7 articles & 27 of these additions,Amendments,1,0
3450,1999-09-10,1999 Back to School Week game 5.,Jeopardy,"(6, 2)","""E"" FOR EFFORT",7,"(200,)",False,"On ""The Simpsons"", Mr. Burns usually uses this word when he finds something superb or first-rate","""Excellent!""",1,0
3450,1999-09-10,1999 Back to School Week game 5.,Jeopardy,"(1, 3)",STATE CAPITALS,3,"(300,)",False,North Dakota,Bismarck,1,0
3450,1999-09-10,1999 Back to School Week game 5.,Jeopardy,"(2, 3)",IN THE COOKIE JAR,14,"(300,)",False,This tool is pressed down on sugar cookie dough to give the cookies a fun shape,Cookie cutter,1,0
3450,1999-09-10,1999 Back to School Week game 5.,Jeopardy,"(3, 3)",KIDDIE LIT CHARACTERS,23,"(300,)",False,"You may have ""heard"" of this good-hearted pachyderm",Horton,1,0
3450,1999-09-10,1999 Back to School Week game 5.,Jeopardy,"(4, 3)",MUSICAL YOUTH,18,"(300,)",False,"The members of this ""(God Must Have Spent) A Little More Time on You"" group range in age from 18 to 27",NSYNC,1,0
3450,1999-09-10,1999 Back to School Week game 5.,Jeopardy,"(5, 3)",OUR GOVERNMENT,28,"(200,)",True,This group that meets in the Capitol started in 1789 with 22 members & now has 100,Senate,0,1
3450,1999-09-10,1999 Back to School Week game 5.,Jeopardy,"(6, 3)","""E"" FOR EFFORT",8,"(300,)",False,This verb means to sneak off & get married,Elope,1,0
3450,1999-09-10,1999 Back to School Week game 5.,Jeopardy,"(1, 4)",STATE CAPITALS,4,"(400,)",False,Pennsylvania,Harrisburg,1,0
3450,1999-09-10,1999 Back to School Week game 5.,Jeopardy,"(2, 4)",IN THE COOKIE JAR,15,"(400,)",False,About 1 of every 4 boxes of Girl Scout cookies sold is of this chocolaty-coated variety,Thin Mints,1,0
3450,1999-09-10,1999 Back to School Week game 5.,Jeopardy,"(3, 4)",KIDDIE LIT CHARACTERS,24,"(400,)",False,He's the E.B. White character seen here(voiced by Michael J. Fox),Stuart Little,1,0
3450,1999-09-10,1999 Back to School Week game 5.,Jeopardy,"(4, 4)",MUSICAL YOUTH,19,"(400,)",False,"This group of ""Boys"" was named after an open-air market in Orlando, Florida where it was formed",Backstreet Boys,1,0
3450,1999-09-10,1999 Back to School Week game 5.,Jeopardy,"(5, 4)",OUR GOVERNMENT,29,"(400,)",False,"NASA, which was created in 1958, stands for National Aeronautics & this Administration",Space,0,3
3450,1999-09-10,1999 Back to School Week game 5.,Jeopardy,"(6, 4)","""E"" FOR EFFORT",9,"(400,)",False,The solar type of this event happens when the moon comes between the sun & the Earth,Eclipse,1,0
3450,1999-09-10,1999 Back to School Week game 5.,Jeopardy,"(1, 5)",STATE CAPITALS,5,"(500,)",False,West Virginia,Charleston,1,0
3450,1999-09-10,1999 Back to School Week game 5.,Jeopardy,"(2, 5)",IN THE COOKIE JAR,16,"(500,)",False,Nabisco is unsure if these cookies were named for a scientist or a town in Massachusetts,Fig Newtons,0,3
3450,1999-09-10,1999 Back to School Week game 5.,Jeopardy,"(3, 5)",KIDDIE LIT CHARACTERS,25,"(500,)",False,She was based in part on a real child,"Alice (of ""Alice in Wonderland"")",0,3
3450,1999-09-10,1999 Back to School Week game 5.,Jeopardy,"(4, 5)",MUSICAL YOUTH,20,"(500,)",False,"Arnold is the last name of this 18-year-old who hit No. 1 with ""Angel of Mine""",Monica,1,0
3450,1999-09-10,1999 Back to School Week game 5.,Jeopardy,"(5, 5)",OUR GOVERNMENT,30,"(500,)",False,"Justice Department head Janet Reno isn't called the Secretary of Justice, but this",Attorney General,0,3
3450,1999-09-10,1999 Back to School Week game 5.,Jeopardy,"(6, 5)","""E"" FOR EFFORT",10,"(500,)",False,"For this Mexican dish, roll some meat & cheese in a corn tortilla & bake the ""whole"" thing",Enchiladas,1,0
3450,1999-09-10,1999 Back to School Week game 5.,Double Jeopardy,"(1, 1)",AROUND THE WORLD,26,"(200,)",False,The largest continent; it's also the continent that's home to the most people,Asia,1,2
3450,1999-09-10,1999 Back to School Week game 5.,Double Jeopardy,"(2, 1)",SCHOOL PICTURE DAY,17,"(200,)",False,"You'll score a hole-in-one if you can identify this ""A"" student of Anaheim's Western High",Tiger Woods,1,0
3450,1999-09-10,1999 Back to School Week game 5.,Double Jeopardy,"(3, 1)",SKY WATCHING,7,"(200,)",False,There are approximately this many weeks between full moons,4,0,3
3450,1999-09-10,1999 Back to School Week game 5.,Double Jeopardy,"(4, 1)",SPORTS STARS,2,"(200,)",False,"In ""Space Jam"", classic Looney Tunes characters recruit this NBA star to help them win a basketball game",Michael Jordan,1,0
3450,1999-09-10,1999 Back to School Week game 5.,Double Jeopardy,"(5, 1)",WHAT DOES MOM DO?,9,"(200,)",False,She presides over a courtroom & instructs the jury in the law,Judge,1,0
3450,1999-09-10,1999 Back to School Week game 5.,Double Jeopardy,"(6, 1)",OPPOSITES,1,"(200,)",False,"In sports & life, it's often said that the best defense is this opposite",(good) Offense,1,0
3450,1999-09-10,1999 Back to School Week game 5.,Double Jeopardy,"(1, 2)",AROUND THE WORLD,27,"(400,)",False,This line divides the Northern & Southern Hemispheres,Equator,1,0
3450,1999-09-10,1999 Back to School Week game 5.,Double Jeopardy,"(2, 2)",SCHOOL PICTURE DAY,18,"(400,)",False,"Before he was ""sent up the creek"", he was part of the Cheshire Academy",James Van Der Beek,1,1
3450,1999-09-10,1999 Back to School Week game 5.,Double Jeopardy,"(3, 2)",SKY WATCHING,22,"(400,)",False,Our solar system lies on one of the spiral arms of this galaxy,Milky Way,1,0
3450,1999-09-10,1999 Back to School Week game 5.,Double Jeopardy,"(4, 2)",SPORTS STARS,3,"(400,)",False,"This ""Great One"" won the National Hockey League scoring title in 10 of his 20 years in the league",Wayne Gretzky,1,0
3450,1999-09-10,1999 Back to School Week game 5.,Double Jeopardy,"(5, 2)",WHAT DOES MOM DO?,11,"(400,)",False,She gets $65 an hour to fix pipes & toilets,Plumber,1,0
3450,1999-09-10,1999 Back to School Week game 5.,Double Jeopardy,"(6, 2)",OPPOSITES,8,"(400,)",False,"3-letter opposite of ""con"" or ""amateur""",Pro,1,0
3450,1999-09-10,1999 Back to School Week game 5.,Double Jeopardy,"(1, 3)",AROUND THE WORLD,28,"(600,)",False,"I'll be doggone, the Chihuahua Desert is in this neighbor of the U.S.",Mexico,1,0
3450,1999-09-10,1999 Back to School Week game 5.,Double Jeopardy,"(2, 3)",SCHOOL PICTURE DAY,19,"(600,)",False,"The actor seen here played this vampire on ""Buffy""",Angel (played by David Boreanaz),1,1
3450,1999-09-10,1999 Back to School Week game 5.,Double Jeopardy,"(3, 3)",SKY WATCHING,23,"(600,)",False,"Last seen in 1997, another 2,400 years will pass before the next visiti of Hale-Bopp, one of these",Comet,1,0
3450,1999-09-10,1999 Back to School Week game 5.,Double Jeopardy,"(4, 3)",SPORTS STARS,4,"(700,)",True,"In the 1998 Winter Olympics, she became the youngest ever to win the women's figure skating gold medal",Tara Lipinski,1,0
3450,1999-09-10,1999 Back to School Week game 5.,Double Jeopardy,"(5, 3)",WHAT DOES MOM DO?,12,"(600,)",False,She uses her baton to lead a symphony orchestra,Conductor,1,0
3450,1999-09-10,1999 Back to School Week game 5.,Double Jeopardy,"(6, 3)",OPPOSITES,10,"(600,)",False,"This ocean liner & movie wouldn't have been as famous if they'd been called ""Diminutive""",Titanic,1,0
3450,1999-09-10,1999 Back to School Week game 5.,Double Jeopardy,"(1, 4)",AROUND THE WORLD,29,"(800,)",False,The Amundsen-Scott research base is located at this famous point on Antarctica,South Pole,0,3
3450,1999-09-10,1999 Back to School Week game 5.,Double Jeopardy,"(2, 4)",SCHOOL PICTURE DAY,20,"(800,)",False,"The photo of her ""On the 6"" CD is a little different from the 1987 high school yearbook photo seen here",Jennifer Lopez,1,0
3450,1999-09-10,1999 Back to School Week game 5.,Double Jeopardy,"(3, 4)",SKY WATCHING,24,"(800,)",False,This planet is the closest planet to Earth & is about the same size,Venus,1,0
3450,1999-09-10,1999 Back to School Week game 5.,Double Jeopardy,"(4, 4)",SPORTS STARS,5,"(800,)",False,"Between 1982 & 1998, this Oriole appeared in over 2,600 consecutive games & started every one","Cal Ripken, Jr.",1,0
3450,1999-09-10,1999 Back to School Week game 5.,Double Jeopardy,"(5, 4)",WHAT DOES MOM DO?,13,"(800,)",False,She provides food & supplies for weddings & other big parties,Caterer,1,0
3450,1999-09-10,1999 Back to School Week game 5.,Double Jeopardy,"(6, 4)",OPPOSITES,15,"(800,)",False,"In intelligence, it's the opposite of ""acute""; in geometry, it refers to a wider angle",Obtuse,1,0
3450,1999-09-10,1999 Back to School Week game 5.,Double Jeopardy,"(1, 5)",AROUND THE WORLD,30,"(1000,)",True,It's the longest river of the world's largest tropical forest,Amazon,0,1
3450,1999-09-10,1999 Back to School Week game 5.,Double Jeopardy,"(2, 5)",SCHOOL PICTURE DAY,21,"(1000,)",False,"This ""Party of Five"" star was part of the class of '86 at West Orange High in New Jersey",Scott Wolf,1,0
3450,1999-09-10,1999 Back to School Week game 5.,Double Jeopardy,"(3, 5)",SKY WATCHING,25,"(1000,)",False,The star Polaris doesn't seem to move through the sky because it is almost directly above this place,North Pole,1,0
3450,1999-09-10,1999 Back to School Week game 5.,Double Jeopardy,"(4, 5)",SPORTS STARS,6,"(1000,)",False,In 1999 this Denver Broncos quarterback retired after 16 seasons & 2 Super Bowl championships,John Elway,1,0
3450,1999-09-10,1999 Back to School Week game 5.,Double Jeopardy,"(5, 5)",WHAT DOES MOM DO?,14,"(1000,)",False,She's a doctor who specializes in caring for children,Pediatrician,1,0
3450,1999-09-10,1999 Back to School Week game 5.,Double Jeopardy,"(6, 5)",OPPOSITES,16,"(1000,)",False,"If you don't want to be attractive to insects, use this, the opposite of ""attractive""",Repellent,1,1
3450,1999-09-10,1999 Back to School Week game 5.,Final Jeopardy,"(1, 1)",FUN WITH NUMBERS,0,"(2500, 199, 500)",False,Number of degrees the minute hand on a standard clock travels in one hour,360,1,2
