epNum,airDate,extra_info,round_name,coord,category,order,value,daily_double,question,answer,correctAttempts,wrongAttempts
3471,1999-10-11,,Jeopardy,"(1, 1)",NICKNAMES,1,"(100,)",False,"""The Father of the Telegraph""",Samuel Morse,1,0
3471,1999-10-11,,Jeopardy,"(2, 1)",MOVIE REVIEWS,6,"(100,)",False,"Time said tickets for the 1st critics' screening of this prequel were ""more precious than a passport out of Kosovo""",Star Wars: The Phantom Menace,1,1
3471,1999-10-11,,Jeopardy,"(3, 1)",RELIGION,22,"(100,)",False,"On Tisha B'Av, the 9th day of the month of Av, Jews observe the destruction of the first & second of these",Temples,1,0
3471,1999-10-11,,Jeopardy,"(4, 1)",JIMMY,17,"(100,)",False,"The Kentucky Derby-winning jockey in 1878, or the president of the U.S. in 1978",Jimmy Carter,1,0
3471,1999-10-11,,Jeopardy,"(5, 1)",U.S. CURRENCY,12,"(100,)",False,An 1873 law states that this creature must appear on the reverse of all U.S. coins greater than 10 cents,Eagle,1,0
3471,1999-10-11,,Jeopardy,"(6, 1)","""T"" TIME",7,"(100,)",False,"A competition for fishermen, knights or ""Jeopardy!"" contestants",Tournament,1,0
3471,1999-10-11,,Jeopardy,"(1, 2)",NICKNAMES,2,"(200,)",False,"""America's Oldest Teenager""",Dick Clark,1,0
3471,1999-10-11,,Jeopardy,"(2, 2)",MOVIE REVIEWS,27,"(200,)",False,"Entertainment Weekly called this 1991 Billy Crystal film, ""Dances With Cows""",City Slickers,1,0
3471,1999-10-11,,Jeopardy,"(3, 2)",RELIGION,23,"(200,)",False,"Legend says he spent 98 days beneath a large bo tree, 49 to solve the riddle of suffering & 49 more to meditate",Buddha,1,0
3471,1999-10-11,,Jeopardy,"(4, 2)",JIMMY,18,"(200,)",False,"He's won the U.S Open on 3 surfaces: grass (1974), clay (1976) & hard courts (1978, 1982, 1983)",JImmy Connors,1,0
3471,1999-10-11,,Jeopardy,"(5, 2)",U.S. CURRENCY,13,"(200,)",False,"By federal law, all U.S. coins must bear this phrase which means ""Out of many, one""",E Pluribus Unum,1,0
3471,1999-10-11,,Jeopardy,"(6, 2)","""T"" TIME",8,"(200,)",False,"Mexican flat bread, or Steinbeck ""flat""",Tortilla,1,0
3471,1999-10-11,,Jeopardy,"(1, 3)",NICKNAMES,3,"(300,)",False,"Tuesday night's ""Mr. Television""",Milton Berle,1,0
3471,1999-10-11,,Jeopardy,"(2, 3)",MOVIE REVIEWS,30,"(300,)",False,"The New Yorker felt it had ""a democratic right to expect bandages"" in this 1999 horror flick",The Mummy,0,3
3471,1999-10-11,,Jeopardy,"(3, 3)",RELIGION,24,"(300,)",False,Among the 6 schools of philosophy of this religion are nyaya & yoga,Hinduism,0,3
3471,1999-10-11,,Jeopardy,"(4, 3)",JIMMY,19,"(300,)",False,"He helped bring down Jim & Tammy Bakker, then got knocked off his own pulpit",Jimmy Swaggart,1,0
3471,1999-10-11,,Jeopardy,"(5, 3)",U.S. CURRENCY,14,"(300,)",False,"An ""S"" on a U.S. coin indicates that it was minted in this city",San Francisco,1,1
3471,1999-10-11,,Jeopardy,"(6, 3)","""T"" TIME",9,"(300,)",False,It follows talk & precedes trot,turkey,1,1
3471,1999-10-11,,Jeopardy,"(1, 4)",NICKNAMES,4,"(400,)",False,"Would-be assassin ""Squeaky""",Lynette Fromme,1,0
3471,1999-10-11,,Jeopardy,"(2, 4)",MOVIE REVIEWS,29,"(1300,)",True,"(Hi, I'm Garry Marshall.)  I directed this 1990 movie that The New York Times said ""borrows a thing or two from Pygmalion... but has its own... wit""",Pretty Woman,0,1
3471,1999-10-11,,Jeopardy,"(3, 4)",RELIGION,25,"(400,)",False,The Japanese once worshiped their emperor as a descendant of Amaterasu Omikami. the top goddess in this religion,Shinto,1,0
3471,1999-10-11,,Jeopardy,"(4, 4)",JIMMY,20,"(400,)",False,Bobby Kennedy was chief council of the Senate committee investigating David Beck & this man,Jimmy Hoffa,1,0
3471,1999-10-11,,Jeopardy,"(5, 4)",U.S. CURRENCY,15,"(400,)",False,It's the only presidential home currently on a U.S. coin,Monticello (Thomas Jefferson\'s),1,0
3471,1999-10-11,,Jeopardy,"(6, 4)","""T"" TIME",10,"(400,)",False,"Yugoslavia's Josip Broz, or Michael Jackson's brother Toriano",Tito,1,0
3471,1999-10-11,,Jeopardy,"(1, 5)",NICKNAMES,5,"(500,)",False,"Aviator ""The Red Baron""",Manfred von Richthofen,1,0
3471,1999-10-11,,Jeopardy,"(2, 5)",MOVIE REVIEWS,28,"(500,)",False,"USA Today said that Meg Ryan & Tom Hanks ""Should win a Nobel Prize for Chemistry"" for this 1998 film",You\'ve Got Mail,1,0
3471,1999-10-11,,Jeopardy,"(3, 5)",RELIGION,26,"(500,)",False,"The sister of Moses & Aaron, she was the first woman given the title of prophetess",Miriam,1,0
3471,1999-10-11,,Jeopardy,"(4, 5)",JIMMY,21,"(500,)",False,He was dyn-o-mite as mayor of New York from 1926 to 1932,Jimmy Walker,1,0
3471,1999-10-11,,Jeopardy,"(5, 5)",U.S. CURRENCY,16,"(500,)",False,It's the only U.S. money on which you'll find a depiction of the White House,$20 bill,1,1
3471,1999-10-11,,Jeopardy,"(6, 5)","""T"" TIME",11,"(500,)",False,"Cretaceous ""king"" of carnivores",Tyrannosaurus Rex,1,0
3471,1999-10-11,,Double Jeopardy,"(1, 1)",ON THE MAP,1,"(200,)",False,"Some of the highest peaks in these mountains are Mont Blanc, Monte Rosa & the Matterhorn",Alps,1,0
3471,1999-10-11,,Double Jeopardy,"(2, 1)",BEES,26,"(200,)",False,"A scout bee may use the ""waggle"" variety of this to inform others about the location of flowers",Dance,0,3
3471,1999-10-11,,Double Jeopardy,"(3, 1)",CELEBRITY SPOUSES,11,"(200,)",False,Mrs. Paul Newman,Joanne Woodward,1,0
3471,1999-10-11,,Double Jeopardy,"(4, 1)",SUITE,21,"(200,)",False,"We could listen to the 1888 suite named for this tale-spinner for ""1001 Nights""",Scheherazade,0,3
3471,1999-10-11,,Double Jeopardy,"(5, 1)",MYSTERY,6,"(200,)",False,"Michael Connelly's ""Angels Flight"" is set in this city",Los Angeles,1,0
3471,1999-10-11,,Double Jeopardy,"(6, 1)","OF ""LIFE""",16,"(200,)",False,"The mother-daughter drama ""Marriage Material"" found a home in 1999 on this TV network",Lifetime,1,0
3471,1999-10-11,,Double Jeopardy,"(1, 2)",ON THE MAP,2,"(400,)",False,"This ""colorful"" branch of the Nile suppiles about two-thirds of the river's water",Blue Nile,1,1
3471,1999-10-11,,Double Jeopardy,"(2, 2)",BEES,27,"(400,)",False,"Of 1 MPH, 15 MPH or Mach 2, the flight speed of an average worker bee",15 MPH,1,0
3471,1999-10-11,,Double Jeopardy,"(3, 2)",CELEBRITY SPOUSES,12,"(400,)",False,Mrs. Antonio Banderas,Melanie Griffith,1,0
3471,1999-10-11,,Double Jeopardy,"(4, 2)",SUITE,22,"(400,)",False,"Yes, my children, ""Jeux D'Enfants"" is a suite for piano by this composer of ""Carmen""",Georges Bizet,1,0
3471,1999-10-11,,Double Jeopardy,"(5, 2)",MYSTERY,7,"(400,)",False,"In 1941 this mystery-solving character got his own ""Mystery Magazine""",Ellery Queen,1,0
3471,1999-10-11,,Double Jeopardy,"(6, 2)","OF ""LIFE""",17,"(400,)",False,It's the feature illustrated here,Lifeline,1,0
3471,1999-10-11,,Double Jeopardy,"(1, 3)",ON THE MAP,3,"(600,)",False,"Mainland Europe's only active volcano, it buried several Italian cities in 79 A.D.",Mount Vesuvius,1,0
3471,1999-10-11,,Double Jeopardy,"(2, 3)",BEES,28,"(600,)",False,"The queen bee's basic duty, it happens 2,000 times a day during summer",Laying eggs,0,3
3471,1999-10-11,,Double Jeopardy,"(3, 3)",CELEBRITY SPOUSES,13,"(600,)",False,Mrs. David Duchovny,Tea Leoni,1,0
3471,1999-10-11,,Double Jeopardy,"(4, 3)",SUITE,23,"(600,)",False,"Ferde Grofe's ""grandest"" suite, it premiered in Chicago, not in Arizona",Grand Canyon Suite,1,0
3471,1999-10-11,,Double Jeopardy,"(5, 3)",MYSTERY,8,"(600,)",False,"In a 1950 Patricia Highsmith novel, strangers meet on one of these & plot to exchange murders","Train (""Strangers on a Train"")",0,3
3471,1999-10-11,,Double Jeopardy,"(6, 3)","OF ""LIFE""",18,"(600,)",False,"This type of ""system"" refers to space suits & scuba gear as well as medical devices like incubators",Life support,1,1
3471,1999-10-11,,Double Jeopardy,"(1, 4)",ON THE MAP,4,"(1000,)",True,The Java or Sunda Trench contains this ocean's deepest point,Indian Ocean,1,0
3471,1999-10-11,,Double Jeopardy,"(2, 4)",BEES,29,"(800,)",False,These people had domesticated the bee as early as 3000 B.C.,Egyptians,1,0
3471,1999-10-11,,Double Jeopardy,"(3, 4)",CELEBRITY SPOUSES,14,"(800,)",False,Mrs. Ethan Hawke,Uma Thurman,0,3
3471,1999-10-11,,Double Jeopardy,"(4, 4)",SUITE,24,"(800,)",False,"This Norwegian's ""Holberg Suite"" isn't quite as famous as his ""Peer Gynt"" suite",Edvard Grieg,0,3
3471,1999-10-11,,Double Jeopardy,"(5, 4)",MYSTERY,9,"(800,)",False,"Here's this year's Sue Grafton clue:  the 14th book in her series was ""'N' is for...."" this",Noose,1,0
3471,1999-10-11,,Double Jeopardy,"(6, 4)","OF ""LIFE""",19,"(800,)",False,A character from this comic strip is seen here,"""Life In Hell""",0,3
3471,1999-10-11,,Double Jeopardy,"(1, 5)",ON THE MAP,5,"(1000,)",False,The African country once called Portuguese Guinea is known today by this hyphenated name,Guinea-Bissau,0,3
3471,1999-10-11,,Double Jeopardy,"(2, 5)",BEES,30,"(1000,)",False,"The cosmetics industry uses more of this product than any other industry, more than 1,000,000 pounds a year",Beeswax,1,1
3471,1999-10-11,,Double Jeopardy,"(3, 5)",CELEBRITY SPOUSES,15,"(1000,)",False,Mrs. Mel Brooks,Anne Bancroft,1,0
3471,1999-10-11,,Double Jeopardy,"(4, 5)",SUITE,25,"(100,)",True,"Bela Bartok wrote his 1923 ""Dance Suite"" for the 50th anniversary of this city's unification",Budapest,0,1
3471,1999-10-11,,Double Jeopardy,"(5, 5)",MYSTERY,10,"(1000,)",False,"In 1999's ""Havana Bay"" he brings back his ""Gorky Park"" investigator Arkady Renko",Martin Cruz Smith,0,3
3471,1999-10-11,,Double Jeopardy,"(6, 5)","OF ""LIFE""",20,"(1000,)",False,"Book in which Twain wrote, ""There was but one...ambition among my comrades...to be a steamboatman""",Life on the Mississippi,1,0
3471,1999-10-11,,Final Jeopardy,"(1, 1)",FAMOUS SCANDINAVIANS,0,"(2500, 0)",False,"The painter who said, ""Illness, madness and death were the dark angels who watched over my cradle""",Edvard Munch,0,2
