epNum,airDate,extra_info,round_name,coord,category,order,value,daily_double,question,answer,correctAttempts,wrongAttempts
3506,1999-11-29,,Jeopardy,"(1, 1)",BIBLICAL VOICES,23,"(100,)",False,"Jesus ""cried out with a loud voice"" & commanded this dead man to ""come forth""",Lazarus,1,0
3506,1999-11-29,,Jeopardy,"(2, 1)","THE ""A"" LIST",1,"(100,)",False,You're this if you're from the Pampas,Argentinian,1,0
3506,1999-11-29,,Jeopardy,"(3, 1)",MYTH & MAGIC,2,"(100,)",False,"Unlike in the U.S., if one of these crosses your path in England, it means good luck",a black cat,1,0
3506,1999-11-29,,Jeopardy,"(4, 1)",BEFORE & AFTER,6,"(100,)",False,"The buck stops with this president who wrote ""Breakfast at Tiffany's""",Harry S. Truman Capote,1,1
3506,1999-11-29,,Jeopardy,"(5, 1)",FOREIGN-BORN YANKS,11,"(100,)",False,"The G in MGM, he was born in Warsaw, Poland",Samuel Goldwyn,1,0
3506,1999-11-29,,Jeopardy,"(6, 1)",JOHNNY GILBERT ROCKS!,14,"(100,)",False,"More than 2,000 versions of this 1965 song have been recorded:""Suddenly /I'm not half the man I used to be /There's a shadow hanging over me""","""Yesterday""",1,0
3506,1999-11-29,,Jeopardy,"(1, 2)",BIBLICAL VOICES,24,"(200,)",False,"This apostle ""lifted up his voice"" & addressed the crowd at Pentecost",Peter,0,3
3506,1999-11-29,,Jeopardy,"(2, 2)","THE ""A"" LIST",7,"(200,)",False,You're this if you're from Adelaide,Australian,1,0
3506,1999-11-29,,Jeopardy,"(3, 2)",MYTH & MAGIC,3,"(200,)",False,Cloves of this are sometimes placed in a bridal bouquet for good luck,garlic,1,0
3506,1999-11-29,,Jeopardy,"(4, 2)",BEFORE & AFTER,27,"(200,)",False,George Washington's Virginia estate that co-chaired Clinton's transition team,Mount Vernon Jordan,1,0
3506,1999-11-29,,Jeopardy,"(5, 2)",FOREIGN-BORN YANKS,12,"(200,)",False,This member of Clinton's cabinet was born in Prague,Madeleine Albright,1,0
3506,1999-11-29,,Jeopardy,"(6, 2)",JOHNNY GILBERT ROCKS!,18,"(200,)",False,"This song topped the pop, R&B & country charts in 1957:""The warden said, 'Hey, buddy, don't you be no square /If you can't find a partner, use a wooden chair'""","""Jailhouse Rock""",1,0
3506,1999-11-29,,Jeopardy,"(1, 3)",BIBLICAL VOICES,22,"(300,)",False,This blind father recognized Jacob's voice but thought his goatskin-covered hands were those of Esau,Isaac,1,0
3506,1999-11-29,,Jeopardy,"(2, 3)","THE ""A"" LIST",8,"(300,)",False,You're this if you're from Innsbruck,Austrian,1,0
3506,1999-11-29,,Jeopardy,"(3, 3)",MYTH & MAGIC,4,"(300,)",False,This card deck's Minor Arcana has 14 cards in each suit; a page is between the 10 & jack,tarot,1,0
3506,1999-11-29,,Jeopardy,"(5, 3)",FOREIGN-BORN YANKS,15,"(300,)",False,"A college football head coach from 1918 to 1931, he hailed from Voss, Norway",Knute Rockne,1,0
3506,1999-11-29,,Jeopardy,"(6, 3)",JOHNNY GILBERT ROCKS!,19,"(300,)",False,"This song was written for a 1967 film:""Where have you gone, Joe DiMaggio /A nation turns its lonely eyes to you (Woo, woo, woo)""","""Mrs. Robinson""",1,1
3506,1999-11-29,,Jeopardy,"(1, 4)",BIBLICAL VOICES,25,"(1000,)",True,"His was the ""voice of one crying in the wilderness""",John the Baptist,1,0
3506,1999-11-29,,Jeopardy,"(2, 4)","THE ""A"" LIST",9,"(400,)",False,You're this if you're from Kabul,Afghanistanian,1,0
3506,1999-11-29,,Jeopardy,"(3, 4)",MYTH & MAGIC,5,"(400,)",False,"Not feeling well?  You may want to cleanse this field surrounding your body, from the Greek for ""breath"" or ""breeze""",an aura,1,0
3506,1999-11-29,,Jeopardy,"(5, 4)",FOREIGN-BORN YANKS,16,"(400,)",False,"He hosts a late-night network news show, but not from Lancashire, England, where he was born",Ted Koppel,1,1
3506,1999-11-29,,Jeopardy,"(6, 4)",JOHNNY GILBERT ROCKS!,20,"(400,)",False,"People were crazy about this 1999 song:""Her lips are devil-red and her skin's the color of mocha...""","""Livin\' La Vida Loca""",1,0
3506,1999-11-29,,Jeopardy,"(1, 5)",BIBLICAL VOICES,26,"(500,)",False,"In the first book of Samuel, he asked, ""Is this thy voice, my son David?""",Saul,0,3
3506,1999-11-29,,Jeopardy,"(2, 5)","THE ""A"" LIST",10,"(500,)",False,You're this if you're from Luanda,Angolan,1,0
3506,1999-11-29,,Jeopardy,"(3, 5)",MYTH & MAGIC,13,"(500,)",False,This plant yields a hair dye as well as as tint used in magical hand & foot tattoos,henna,1,0
3506,1999-11-29,,Jeopardy,"(5, 5)",FOREIGN-BORN YANKS,17,"(500,)",False,"Born in Petrovichi, Russia, this prolific writer's works include ""Foundation's Edge"" & ""The Gods Themselves""",Isaac Asimov,0,3
3506,1999-11-29,,Jeopardy,"(6, 5)",JOHNNY GILBERT ROCKS!,21,"(500,)",False,"The title track of a 1976 album, this song topped the charts in 1977:""You can check out any time you like, but you can never leave""","""Hotel California""",1,0
3506,1999-11-29,,Double Jeopardy,"(1, 1)",RUSSIAN CITIES,5,"(200,)",False,"By the 15th C., this city was capital of the Russian state & the seat of the Russian Orthodox Church",Moscow,1,0
3506,1999-11-29,,Double Jeopardy,"(2, 1)",FRED ASTAIRE FILMS,25,"(200,)",False,Astaire was nominated for a Supporting Actor Oscar for this fiery 1974 disaster epic,The Towering Inferno,1,0
3506,1999-11-29,,Double Jeopardy,"(3, 1)",WORD ORIGINS,1,"(200,)",False,Type of moustache named for its resemblance to a bicycle part,Handlebar,1,0
3506,1999-11-29,,Double Jeopardy,"(4, 1)",AMERICAN NICKNAMES,7,"(200,)",False,"The ""Tip"" of Congress","Thomas P. ""Tip"" O\'Neill",1,0
3506,1999-11-29,,Double Jeopardy,"(5, 1)",4 OUT OF 5,20,"(200,)",False,4 out of the 5 traditional human senses,"Hearing, sight, smell, taste, touch",1,0
3506,1999-11-29,,Double Jeopardy,"(6, 1)",DOCTORS,15,"(200,)",False,"With over $3 billion in annual sales, this soft drink has 6% of the U.S. market",Dr. Pepper,1,0
3506,1999-11-29,,Double Jeopardy,"(1, 2)",RUSSIAN CITIES,6,"(400,)",False,"Important Russian cities on this longest Russian river include Nizhniy Novgorod, Kazan & Samara",Volga,1,1
3506,1999-11-29,,Double Jeopardy,"(2, 2)",FRED ASTAIRE FILMS,26,"(400,)",False,Fred came out of retirement to replace an injured Gene Kelly as Judy Garland's co-star in this holiday musical,Easter Parade,1,0
3506,1999-11-29,,Double Jeopardy,"(3, 2)",WORD ORIGINS,2,"(400,)",False,This word for a shopping center comes from a London site where a ball & mallet game was played in narrow alleys,Mall (from Pall Mall),1,0
3506,1999-11-29,,Double Jeopardy,"(4, 2)",AMERICAN NICKNAMES,8,"(400,)",False,"1977's ""Son of Sam""",David Berkowitz,1,0
3506,1999-11-29,,Double Jeopardy,"(5, 2)",4 OUT OF 5,21,"(400,)",False,"4 out of 5 people living at 742 Evergreen Terrace on TV's ""The Simpsons""","Bart, Homer, Lisa, Maggie & Marge Simpson",1,0
3506,1999-11-29,,Double Jeopardy,"(6, 2)",DOCTORS,16,"(400,)",False,"A high school friend who was ""The Professor"" helped give this Philadelphia 76ers star his nickname, Dr. J.",Julius Erving,1,0
3506,1999-11-29,,Double Jeopardy,"(1, 3)",RUSSIAN CITIES,12,"(600,)",False,"This city of 180,000 shares its name with Marx' co-writer of ""The Communist Manifesto""",Engels,0,3
3506,1999-11-29,,Double Jeopardy,"(2, 3)",FRED ASTAIRE FILMS,27,"(600,)",False,Appropriate title question of this 1937 Fred Astaire-Ginger Rogers film,Shall We Dance?,0,3
3506,1999-11-29,,Double Jeopardy,"(3, 3)",WORD ORIGINS,3,"(600,)",False,"Sanskrit for ""great queen"", she's the wife of a maharajah",Maharani,0,3
3506,1999-11-29,,Double Jeopardy,"(4, 3)",AMERICAN NICKNAMES,9,"(600,)",False,"Hollywood's ""Swifty""","Irving ""Swifty"" Lazar",1,0
3506,1999-11-29,,Double Jeopardy,"(5, 3)",4 OUT OF 5,23,"(600,)",False,4 out of the 5 Biblical books of Moses known as the Pentateuch,"Genesis, Exodus, Leviticus, Numbers & Deuteronomy",1,1
3506,1999-11-29,,Double Jeopardy,"(6, 3)",DOCTORS,17,"(600,)",False,"His work includes ""Hunches in Bunches"", ""Fox in Socks"" & ""Gerald McBoing-Boing""",Dr. Seuss (Theodor Geisel),1,0
3506,1999-11-29,,Double Jeopardy,"(1, 4)",RUSSIAN CITIES,13,"(800,)",False,"Heavenly beings Gabriel, Michael & Raphael might enjoy this city on the Dvina River near the White Sea",Arkhangelsk (Archangel),0,3
3506,1999-11-29,,Double Jeopardy,"(3, 4)",WORD ORIGINS,4,"(800,)",False,This white gypsum cement that hardens quickly is named for the French city where it was originally made,Plaster of Paris,1,0
3506,1999-11-29,,Double Jeopardy,"(4, 4)",AMERICAN NICKNAMES,10,"(800,)",False,"""The Long Island Lolita"" of the tabloids",Amy Fisher,1,0
3506,1999-11-29,,Double Jeopardy,"(5, 4)",4 OUT OF 5,24,"(800,)",False,4 out of the first 5 letters of the Greek alphabet,"Alpha, beta, gamma, delta, epsilon",1,0
3506,1999-11-29,,Double Jeopardy,"(6, 4)",DOCTORS,18,"(1500,)",True,"In 1988 he said, ""I was proud of the youths who opposed the war in Vietnam -- they were my babies""",Dr. Benjamin Spock,1,0
3506,1999-11-29,,Double Jeopardy,"(1, 5)",RUSSIAN CITIES,14,"(900,)",True,"Like a ballet company, this city was named for revolutionary hero Sergei",Kirov,0,1
3506,1999-11-29,,Double Jeopardy,"(3, 5)",WORD ORIGINS,22,"(1000,)",False,"Dervied from Old French for ""crane's foot"", it's a genealogical chart or family tree",Pedigree,0,3
3506,1999-11-29,,Double Jeopardy,"(4, 5)",AMERICAN NICKNAMES,11,"(1000,)",False,"New York's former ""Senator Pothole""",Alfonse D\'Amato,1,0
3506,1999-11-29,,Double Jeopardy,"(6, 5)",DOCTORS,19,"(1000,)",False,"Published in 1957, this epic novel tells the story of a physician's love for the wife of a Russian revolutionary","""Doctor Zhivago""",1,0
3506,1999-11-29,,Final Jeopardy,"(1, 1)",U.S. STATES,0,"(4199, 2200, 3000)",False,It's the only state whose name & capital city both consist of 2 words,New Mexico (Santa Fe),1,2
