epNum,airDate,extra_info,round_name,coord,category,order,value,daily_double,question,answer,correctAttempts,wrongAttempts
3513,1999-12-08,,Jeopardy,"(1, 1)","SCI-""FI""",1,"(100,)",False,This bone runs down the side of the leg from just below the knee to the ankle,fibula,1,0
3513,1999-12-08,,Jeopardy,"(2, 1)",WINE & CHEESE,17,"(100,)",False,It's Gouda to know that Gouda & Edam are cheeses from this country,Netherlands (Holland),1,1
3513,1999-12-08,,Jeopardy,"(3, 1)",BRITISHISMS,2,"(100,)",False,"If you order bangers & mash at a London restaurant, you'll receive these & mashed potatoes",sausages,1,0
3513,1999-12-08,,Jeopardy,"(4, 1)",THE CINEMA,10,"(100,)",False,Scenes in this 1995 Oliver Stone film include the Checkers Speech & the summit in China,Nixon,1,0
3513,1999-12-08,,Jeopardy,"(5, 1)",MAIDEN,15,"(100,)",False,Rose Kennedy's was Fitzgerald,maiden name,1,0
3513,1999-12-08,,Jeopardy,"(6, 1)",JAPAN,26,"(100,)",False,"You'll find this sacred landmark, seen here, on the island of Honshu:",Mount Fuji,1,0
3513,1999-12-08,,Jeopardy,"(1, 2)","SCI-""FI""",3,"(200,)",False,"The splitting of a heavy nucleus -- it sounds like where Fermi has ""gone"" on vacation",fission,1,0
3513,1999-12-08,,Jeopardy,"(2, 2)",WINE & CHEESE,18,"(200,)",False,"This Belgian cheese is said to be ""undoubtedly the stinkiest of the strong-smelling cheeses""",Limburger,1,0
3513,1999-12-08,,Jeopardy,"(3, 2)",BRITISHISMS,4,"(200,)",False,You'll need to ask a Savile Row tailor for a waistcoat if you want to add one of these to your wardrobe,vest,1,0
3513,1999-12-08,,Jeopardy,"(4, 2)",THE CINEMA,11,"(200,)",False,"In this 1999 Steve Martin film, Eddie Murphy plays 2 roles: movie star Kit Ramsey & his brother Jiff, a hapless loser",Bowfinger,1,0
3513,1999-12-08,,Jeopardy,"(5, 2)",MAIDEN,19,"(200,)",False,Robin Hood's sweetheart,Maid Marian,1,0
3513,1999-12-08,,Jeopardy,"(6, 2)",JAPAN,27,"(200,)",False,The Japanese began following this religious leader's beliefs around 500 A.D.:,Buddha,1,0
3513,1999-12-08,,Jeopardy,"(1, 3)","SCI-""FI""",6,"(300,)",False,It's the fruit of the Ficus carica,fig,1,0
3513,1999-12-08,,Jeopardy,"(2, 3)",WINE & CHEESE,23,"(300,)",False,"In the '70s this name brand was advertised with the slogan ""We Will Sell No Wine Before Its Time""",Paul Masson,1,0
3513,1999-12-08,,Jeopardy,"(3, 3)",BRITISHISMS,5,"(300,)",False,"At British construction sites, a tipper lorry is this specific type of vehicle",dump truck,1,0
3513,1999-12-08,,Jeopardy,"(4, 3)",THE CINEMA,12,"(300,)",False,"This superstar directs himself as an investigative reporter in the 1999 film ""True Crime""",Clint Eastwood,1,0
3513,1999-12-08,,Jeopardy,"(5, 3)",MAIDEN,20,"(300,)",False,Nautical term for a first launch,maiden voyage,1,0
3513,1999-12-08,,Jeopardy,"(6, 3)",JAPAN,28,"(300,)",False,It's said a Baptist minister living in Yokohama invented this popular vehicle in 1869; it was quickly copied:,rickshaw,1,0
3513,1999-12-08,,Jeopardy,"(1, 4)","SCI-""FI""",7,"(400,)",False,"It's the hot, glowing part of an incandescent lamp",filament,1,0
3513,1999-12-08,,Jeopardy,"(2, 4)",WINE & CHEESE,24,"(400,)",False,Vermont & Tillamook are American varieties of this cheese,Cheddar,1,0
3513,1999-12-08,,Jeopardy,"(3, 4)",BRITISHISMS,8,"(400,)",False,"If you use a rubber to fix a mistake, you're using one of these",eraser,1,0
3513,1999-12-08,,Jeopardy,"(4, 4)",THE CINEMA,13,"(400,)",False,The music of Ritchie Valens was performed by Los Lobos in this 1987 biography of the rock star,La Bamba,1,1
3513,1999-12-08,,Jeopardy,"(5, 4)",MAIDEN,21,"(400,)",False,The chief unmarried woman attendant of a bride,maid of honor,1,0
3513,1999-12-08,,Jeopardy,"(6, 4)",JAPAN,29,"(400,)",False,"Known locally as Shinkansen, the Japanese technological advancement seen here is known by this ""ballistic"" name:",bullet train,1,0
3513,1999-12-08,,Jeopardy,"(1, 5)","SCI-""FI""",16,"(1000,)",True,This branch of physics came out of the combined work of Bell Labs & Corning Glass,fiber optics,0,1
3513,1999-12-08,,Jeopardy,"(2, 5)",WINE & CHEESE,25,"(500,)",False,"The name of this red-wine grape means ""young blackbird"" in French",Merlot,1,0
3513,1999-12-08,,Jeopardy,"(3, 5)",BRITISHISMS,9,"(500,)",False,A member of the RAF knows an airscrew is called this in the USAF,propeller,1,0
3513,1999-12-08,,Jeopardy,"(4, 5)",THE CINEMA,14,"(500,)",False,"1972 film that ends with ""Here life is beautiful.""  The girls are beautiful.  Even the orchestra is beautiful""",Cabaret,1,0
3513,1999-12-08,,Jeopardy,"(5, 5)",MAIDEN,22,"(500,)",False,"They guard the gold in ""Der Ring Des Nibelungen""",Rhine maidens,0,3
3513,1999-12-08,,Jeopardy,"(6, 5)",JAPAN,30,"(500,)",False,Chanting & melodramatic portrayal are hallmarks of this traditional Japanese art form seen here:,Kabuki,1,0
3513,1999-12-08,,Double Jeopardy,"(1, 1)",COLORFUL U.S. CITIES,7,"(200,)",False,"A part of Newark until 1806, it was named for the Dutch royal house of Prince William",Orange,1,0
3513,1999-12-08,,Double Jeopardy,"(2, 1)",PARDON MY ROBOT,1,"(200,)",False,Rosie was this futuristic cartoon family's robot maid,The Jetsons,1,0
3513,1999-12-08,,Double Jeopardy,"(3, 1)",MEDICAL EQUIPMENT,30,"(200,)",False,It's the organ associated with dioptometers & ophthalmoscopes,eye,1,0
3513,1999-12-08,,Double Jeopardy,"(4, 1)",BEASTLY BOOKS,20,"(200,)",False,This Richard Bach story is an allegory about a seabird who seeks to attain perfect flight,Jonathan Livingston Seagull,1,0
3513,1999-12-08,,Double Jeopardy,"(5, 1)",LET'S GET GRAPHIC,14,"(200,)",False,"In Gutenberg's time, each printer had his own lampblack & linseed oil formula for this",ink,1,0
3513,1999-12-08,,Double Jeopardy,"(6, 1)","CATCHING SOME ""Z""s",29,"(200,)",False,"If you don't keep an eye on it, this Italian squash can grow to the size of a watermelon",zucchini,1,0
3513,1999-12-08,,Double Jeopardy,"(1, 2)",COLORFUL U.S. CITIES,8,"(400,)",False,"Once the capital of the Colorado Territory, it's home to the Adolph Coors Brewery",Golden,1,0
3513,1999-12-08,,Double Jeopardy,"(2, 2)",PARDON MY ROBOT,2,"(400,)",False,Ripley discovers Ash is actually a dangerous robot in this 1979 sci-fi thriller,Alien,1,0
3513,1999-12-08,,Double Jeopardy,"(3, 2)",MEDICAL EQUIPMENT,24,"(400,)",False,"From the Greek for ""pipe"", this device can withdraw fluids from as well as inject fluids into a body",syringe,1,0
3513,1999-12-08,,Double Jeopardy,"(4, 2)",BEASTLY BOOKS,21,"(400,)",False,The romantic saga of sheep-rearing Australians plays out in this 1977 Colleen McCullough work,The Thorn Birds,1,0
3513,1999-12-08,,Double Jeopardy,"(5, 2)",LET'S GET GRAPHIC,15,"(400,)",False,"In dithering, shades of this are created by using different densities of black & white dots",gray,1,0
3513,1999-12-08,,Double Jeopardy,"(6, 2)","CATCHING SOME ""Z""s",27,"(400,)",False,Ye Gods!  One of the 7 Ancient Wonders was a 40 foot-high statue of him on his throne,Zeus,1,0
3513,1999-12-08,,Double Jeopardy,"(1, 3)",COLORFUL U.S. CITIES,10,"(1000,)",True,"Built around 1776, Tank Cottage in this city is said to be the oldest house in Wisconsin",Green Bay,1,0
3513,1999-12-08,,Double Jeopardy,"(2, 3)",PARDON MY ROBOT,3,"(600,)",False,"On this show the robot was often heard to remark ""Warning!  Warning!"" & ""Danger, Will Robinson!""",Lost In Space,1,0
3513,1999-12-08,,Double Jeopardy,"(3, 3)",MEDICAL EQUIPMENT,28,"(600,)",False,"A knife a surgeon uses for puncturing, or a famed medical journal",The Lancet,1,1
3513,1999-12-08,,Double Jeopardy,"(4, 3)",BEASTLY BOOKS,19,"(600,)",False,Daryl Hannah starred in the 1986 big screen version of this Jean Auel work,Clan of the Cave Bear,1,0
3513,1999-12-08,,Double Jeopardy,"(5, 3)",LET'S GET GRAPHIC,16,"(600,)",False,This software company makes the Photoshop & Illustrator graphic programs,Adobe,1,0
3513,1999-12-08,,Double Jeopardy,"(6, 3)","CATCHING SOME ""Z""s",6,"(600,)",False,In 1997 this country reverted to its previous name: The Democratic Republic of the Congo,Zaire,1,0
3513,1999-12-08,,Double Jeopardy,"(1, 4)",COLORFUL U.S. CITIES,11,"(800,)",False,Washington used Elijah Miller's house in this New York town as his HQ at the Battle of Chatterton Hill,White Plains,0,3
3513,1999-12-08,,Double Jeopardy,"(2, 4)",PARDON MY ROBOT,4,"(800,)",False,"The brave humans of ""Battlestar Galactica"" battled these towering men of metal",Cylons,0,3
3513,1999-12-08,,Double Jeopardy,"(3, 4)",MEDICAL EQUIPMENT,25,"(800,)",False,"To stitch up a wound, or the thread itself",suture,1,0
3513,1999-12-08,,Double Jeopardy,"(4, 4)",BEASTLY BOOKS,22,"(200,)",True,Desmond Morris stripped humanity bare in this provocative 1967 bestseller,The Naked Ape,1,0
3513,1999-12-08,,Double Jeopardy,"(5, 4)",LET'S GET GRAPHIC,17,"(800,)",False,"A print made to test the accuracy of the press, it's also ""in the pudding""",proof,1,0
3513,1999-12-08,,Double Jeopardy,"(6, 4)","CATCHING SOME ""Z""s",9,"(800,)",False,It's featured in the folk tune heard here:,zither,1,0
3513,1999-12-08,,Double Jeopardy,"(1, 5)",COLORFUL U.S. CITIES,12,"(1000,)",False,Texan & Mexican culture are combined in this city's pre-Lenten festival Charro Days,Brownsville,1,0
3513,1999-12-08,,Double Jeopardy,"(2, 5)",PARDON MY ROBOT,5,"(1000,)",False,This Capek play about machine-men premiered in London in 1923,"R.U.R. (""Rossum\'s Universal Robots"")",0,3
3513,1999-12-08,,Double Jeopardy,"(3, 5)",MEDICAL EQUIPMENT,26,"(1000,)",False,The bulldog type of these clamp blood vessels,forceps,0,3
3513,1999-12-08,,Double Jeopardy,"(4, 5)",BEASTLY BOOKS,23,"(1000,)",False,Savagery lurking beneath the Hollywood dream breaks free in this Nathanael West novel,The Day of the Locust,0,3
3513,1999-12-08,,Double Jeopardy,"(5, 5)",LET'S GET GRAPHIC,18,"(1000,)",False,"In 1987 this online company came up with the GIF, a graphics interchange format",CompuServe,0,3
3513,1999-12-08,,Double Jeopardy,"(6, 5)","CATCHING SOME ""Z""s",13,"(1000,)",False,Go shopping in Poland & you might need to swap your dollars for this unit of currency,zloty,0,3
3513,1999-12-08,,Final Jeopardy,"(1, 1)",AUTOMOTIVE HISTORY,0,"(1000, 2000, 100)",False,This man for whom a car is named previously worked for Daimler-Benz & designed the Volkswagen,Ferdinand Porsche,2,1
