epNum,airDate,extra_info,round_name,coord,category,order,value,daily_double,question,answer,correctAttempts,wrongAttempts
361,1986-01-27,Beryl Arbit game 1.,Jeopardy,"(1, 1)",MEDALS & DECORATIONS,8,"(100,)",False,The Order of Lenin is this country's highest decoration,the Soviet Union,0,0
361,1986-01-27,Beryl Arbit game 1.,Jeopardy,"(2, 1)",BEAUTY SHOP,7,"(100,)",False,"Once worn mostly for cosmetic reasons, it was common to take them out before meals",false teeth,0,0
361,1986-01-27,Beryl Arbit game 1.,Jeopardy,"(3, 1)",BIRDS,26,"(100,)",False,"From Spanish ""bobo"", meaning dunce, a clumsy bird or the prize it might win",booby,0,0
361,1986-01-27,Beryl Arbit game 1.,Jeopardy,"(4, 1)",SPORTS,13,"(100,)",False,Vast majority of National Hockey League players are from this country,Canada,0,0
361,1986-01-27,Beryl Arbit game 1.,Jeopardy,"(5, 1)",4-LETTER WORDS,21,"(100,)",False,"""Man of red earth"" in Hebrew, since it's said God used red clay for the 1st man",Adam,0,0
361,1986-01-27,Beryl Arbit game 1.,Jeopardy,"(6, 1)",STUPID ANSWERS,5,"(100,)",False,Middle East country whose capital is Kuwait,Kuwait,0,0
361,1986-01-27,Beryl Arbit game 1.,Jeopardy,"(1, 2)",MEDALS & DECORATIONS,4,"(200,)",False,"From 1813 through WWII, it was Germany's highest military decoration",the Iron Cross,0,0
361,1986-01-27,Beryl Arbit game 1.,Jeopardy,"(2, 2)",BEAUTY SHOP,12,"(200,)",False,"A former book seller began this cosmetics company in 1886, later naming it after the Bard's river",Avon,0,0
361,1986-01-27,Beryl Arbit game 1.,Jeopardy,"(3, 2)",BIRDS,27,"(200,)",False,2 toes at the back act as braces to help them hold on as they peck at trees,a woodpecker,0,0
361,1986-01-27,Beryl Arbit game 1.,Jeopardy,"(4, 2)",SPORTS,14,"(200,)",False,"Though it's the world's most popular sport, it hasn't succeeded on professional level in the U.S.",soccer,0,0
361,1986-01-27,Beryl Arbit game 1.,Jeopardy,"(5, 2)",4-LETTER WORDS,22,"(200,)",False,"In polite society, you can do it with a basketball but not with a doughnut",dunk,0,0
361,1986-01-27,Beryl Arbit game 1.,Jeopardy,"(6, 2)",STUPID ANSWERS,6,"(200,)",False,"NBC's ""Walt Disney's Wonderful World of Color"" was 1st broadcast this way in 1961",in color,0,0
361,1986-01-27,Beryl Arbit game 1.,Jeopardy,"(1, 3)",MEDALS & DECORATIONS,1,"(300,)",False,This country awards the Order of St. Olaf,Norway,0,0
361,1986-01-27,Beryl Arbit game 1.,Jeopardy,"(2, 3)",BEAUTY SHOP,16,"(500,)",True,"Before this was developed, people relied on perfumes, talcum powder, & bicarbonate of soda",deodorant,0,0
361,1986-01-27,Beryl Arbit game 1.,Jeopardy,"(4, 3)",SPORTS,15,"(300,)",False,"As a boy, this baseball great earned money carrying satchels at the Mobile railroad depot",Satchel Paige,0,0
361,1986-01-27,Beryl Arbit game 1.,Jeopardy,"(5, 3)",4-LETTER WORDS,23,"(300,)",False,"Some men do it reading ""Playboy""; dogs do it to cool off",pant,0,0
361,1986-01-27,Beryl Arbit game 1.,Jeopardy,"(6, 3)",STUPID ANSWERS,9,"(300,)",False,"The radio show ""Hear It Now"" became this when adapted for television",See It Now,0,0
361,1986-01-27,Beryl Arbit game 1.,Jeopardy,"(1, 4)",MEDALS & DECORATIONS,2,"(400,)",False,"A Briton who displays initials ""V.C."" after his name has received this medal",the Victoria Cross,0,0
361,1986-01-27,Beryl Arbit game 1.,Jeopardy,"(2, 4)",BEAUTY SHOP,17,"(400,)",False,"The 2nd century Greek, Galen, was 1st to give a skin care product this ""cool"" name",cold cream,0,0
361,1986-01-27,Beryl Arbit game 1.,Jeopardy,"(4, 4)",SPORTS,18,"(400,)",False,Basketball's former Baltimore Bullets now represent this city,Washington,0,0
361,1986-01-27,Beryl Arbit game 1.,Jeopardy,"(5, 4)",4-LETTER WORDS,24,"(400,)",False,"In ""The Mikado"", Ko-Ko had a little one of these",a list,0,0
361,1986-01-27,Beryl Arbit game 1.,Jeopardy,"(6, 4)",STUPID ANSWERS,10,"(400,)",False,"Of a pound of bricks, a pound of feathers, or a pound of iron, the 1 which weighs the most",none of them (they all weigh exactly the same),0,0
361,1986-01-27,Beryl Arbit game 1.,Jeopardy,"(1, 5)",MEDALS & DECORATIONS,3,"(500,)",False,"This country grants the Grand Cordon of the Supreme Order of the Chrysanthemum, but only to men",Japan,0,0
361,1986-01-27,Beryl Arbit game 1.,Jeopardy,"(2, 5)",BEAUTY SHOP,20,"(500,)",False,"Romans used to shadow their eyelids gold with this, the world's most expensive spice",saffron,0,0
361,1986-01-27,Beryl Arbit game 1.,Jeopardy,"(4, 5)",SPORTS,19,"(500,)",False,"Of the 4 ""major"" pro tournaments, it's the only 1 Sam Snead never won",the U.S. Open,0,0
361,1986-01-27,Beryl Arbit game 1.,Jeopardy,"(5, 5)",4-LETTER WORDS,25,"(500,)",False,A watery way to rest tired feet,soak,0,0
361,1986-01-27,Beryl Arbit game 1.,Jeopardy,"(6, 5)",STUPID ANSWERS,11,"(500,)",False,"Until beaten by United 25 years ago, this airline was #1 in America",American Airlines,0,0
361,1986-01-27,Beryl Arbit game 1.,Double Jeopardy,"(1, 1)",ENGLISH LITERATURE,1,"(200,)",False,"In Mallory, it seated 150, the siege perilous reserved for the most pure & perfect knight",the Round Table,0,0
361,1986-01-27,Beryl Arbit game 1.,Double Jeopardy,"(3, 1)",ANCIENT WORLDS,10,"(200,)",False,Pliny the Younger was not his son but his nephew,Pliny the Elder,0,0
361,1986-01-27,Beryl Arbit game 1.,Double Jeopardy,"(4, 1)",MOVIE PAIRS,13,"(200,)",False,"Their movie partnership started in 1976 as a couple of ""Silver Streakers""",Gene Wilder & Richard Pryor,0,0
361,1986-01-27,Beryl Arbit game 1.,Double Jeopardy,"(5, 1)",COMPOSERS,11,"(200,)",False,"Since his sons were musicians, this greatest Baroque composer could have written a family fugue",J.S. Bach,0,0
361,1986-01-27,Beryl Arbit game 1.,Double Jeopardy,"(6, 1)","""TABLE"" TALK",19,"(200,)",False,Where you'd hope to roll a 7 or 11 on the 1st throw in Las Vegas,at the craps table,0,0
361,1986-01-27,Beryl Arbit game 1.,Double Jeopardy,"(1, 2)",ENGLISH LITERATURE,26,"(400,)",False,"""It vanished quite slowly, beginning with the end of the tail & ending with the grin""",the Cheshire Cat,0,0
361,1986-01-27,Beryl Arbit game 1.,Double Jeopardy,"(2, 2)",TRANSPORTATION,2,"(800,)",True,"In 1969, Crosby, Stills, & Nash rode high on this North African train",the Marrakesh Express,0,0
361,1986-01-27,Beryl Arbit game 1.,Double Jeopardy,"(3, 2)",ANCIENT WORLDS,6,"(400,)",False,Construction of this longest structure ever built began in 5th century B.C.,the Great Wall of China,0,0
361,1986-01-27,Beryl Arbit game 1.,Double Jeopardy,"(4, 2)",MOVIE PAIRS,14,"(400,)",False,"In 1985, they were the ""Perfect"" couple",John Travolta & Jamie Curtis,0,0
361,1986-01-27,Beryl Arbit game 1.,Double Jeopardy,"(5, 2)",COMPOSERS,12,"(400,)",False,Composer & conductor of official Olympic fanfare for 1984 Summer Games,John Williams,0,0
361,1986-01-27,Beryl Arbit game 1.,Double Jeopardy,"(6, 2)","""TABLE"" TALK",20,"(400,)",False,"From 1x1 to 9x9, for example",the multiplication table,0,0
361,1986-01-27,Beryl Arbit game 1.,Double Jeopardy,"(1, 3)",ENGLISH LITERATURE,27,"(600,)",False,"Robert Burns called this creature a ""wee, sleekit, cow'rin tim'rous beastie""",a mouse,0,0
361,1986-01-27,Beryl Arbit game 1.,Double Jeopardy,"(2, 3)",TRANSPORTATION,3,"(600,)",False,"For the ride on this, the French test pilot brought pate, the Saudi prince, a few dates for snacks",the Space Shuttle,0,0
361,1986-01-27,Beryl Arbit game 1.,Double Jeopardy,"(3, 3)",ANCIENT WORLDS,7,"(600,)",False,The Medes were allied in a dual empire with these people,the Persians,0,0
361,1986-01-27,Beryl Arbit game 1.,Double Jeopardy,"(4, 3)",MOVIE PAIRS,15,"(600,)",False,"The ""reunion"" of these Oscar winners in ""Falling in Love"" was labeled by one critic ""falling asleep""",Meryl Streep & Robert De Niro,0,0
361,1986-01-27,Beryl Arbit game 1.,Double Jeopardy,"(5, 3)",COMPOSERS,17,"(600,)",False,"He did film scores for ""Our Town"" & ""The Red Pony"", as well as the ballet ""Rodeo""",Aaron Copland,0,0
361,1986-01-27,Beryl Arbit game 1.,Double Jeopardy,"(6, 3)","""TABLE"" TALK",21,"(600,)",False,"In this 1958 film, Lancaster & Hayworth were at 1, David Niven at another, & Wendy Hiller at a 3rd",Separate Tables,0,0
361,1986-01-27,Beryl Arbit game 1.,Double Jeopardy,"(2, 4)",TRANSPORTATION,4,"(800,)",False,It's what Reuter used to send the news between his German & Belgian telegraph stations,pigeons,0,0
361,1986-01-27,Beryl Arbit game 1.,Double Jeopardy,"(3, 4)",ANCIENT WORLDS,8,"(800,)",False,Its earliest recorded name was Albion,Britain,0,0
361,1986-01-27,Beryl Arbit game 1.,Double Jeopardy,"(4, 4)",MOVIE PAIRS,16,"(800,)",False,"Newlyweds in ""The Quiet Man"", they split up 21 years later in ""McLintock""",John Wayne & Maureen O'Hara,0,0
361,1986-01-27,Beryl Arbit game 1.,Double Jeopardy,"(5, 4)",COMPOSERS,18,"(800,)",False,"This Hungarian pianist helped many younger composers such as Wagner, Dvorak & Grieg",Liszt,0,0
361,1986-01-27,Beryl Arbit game 1.,Double Jeopardy,"(6, 4)","""TABLE"" TALK",22,"(2500,)",True,"The 1st line of ""The Wiffenpoof Song""","""To the tables down at Mory's""",0,0
361,1986-01-27,Beryl Arbit game 1.,Double Jeopardy,"(2, 5)",TRANSPORTATION,5,"(1000,)",False,"John Ford tried to drive it to an Academy Award, but ""Gone with the Wind"" won",Stagecoach,0,0
361,1986-01-27,Beryl Arbit game 1.,Double Jeopardy,"(3, 5)",ANCIENT WORLDS,9,"(1000,)",False,"This Jewish ""Roman"" was only historian to provide contemporary account of Masada",Josephus,0,0
361,1986-01-27,Beryl Arbit game 1.,Double Jeopardy,"(4, 5)",MOVIE PAIRS,24,"(1000,)",False,"In 1930, she was ""Min"" & he was ""Bill""",Marie Dressler & Wallace Beery,0,0
361,1986-01-27,Beryl Arbit game 1.,Double Jeopardy,"(5, 5)",COMPOSERS,25,"(1000,)",False,"Composer of the ""London"" & ""Drum Roll"" symphonies, he was an enthusiastic hunter & fisherman",Joseph Haydn,0,0
361,1986-01-27,Beryl Arbit game 1.,Double Jeopardy,"(6, 5)","""TABLE"" TALK",23,"(1000,)",False,"Unlike ""a la carte"", with each course charged separately, this meal comes complete at a fixed price",table d'hôte,0,0
361,1986-01-27,Beryl Arbit game 1.,Final Jeopardy,"(1, 1)",LANGUAGES,0,(),False,In the 16th & 17th centuries it replaced Latin as the language of diplomacy & official documents,French,0,0
