epNum,airDate,extra_info,round_name,coord,category,order,value,daily_double,question,answer,correctAttempts,wrongAttempts
3696,2000-10-02,2000 Back to School Week game 1.,Jeopardy,"(1, 1)",SCIENCE CLASS,2,"(100,)",False,This force causes an object to travel 32 feet per second faster for every second that it falls,gravity,1,0
3696,2000-10-02,2000 Back to School Week game 1.,Jeopardy,"(2, 1)",THE MOVIES,1,"(100,)",False,This 1981 blockbuster introduced the hero Indiana Jones,Raiders of the Lost Ark,1,0
3696,2000-10-02,2000 Back to School Week game 1.,Jeopardy,"(3, 1)",KID LIT,15,"(100,)",False,"In a Lewis Carroll story, this young girl has wondrous ""Adventures in Wonderland""",Alice,1,0
3696,2000-10-02,2000 Back to School Week game 1.,Jeopardy,"(4, 1)",NEW YORK CITY,7,"(100,)",False,It's the home stadium of the team that's won 25 World Series,Yankee Stadium,0,3
3696,2000-10-02,2000 Back to School Week game 1.,Jeopardy,"(5, 1)",SPORTS RULES,26,"(100,)",False,"Basketball positions include guard, forward & this position in the middle played by Patrick Ewing",center,1,0
3696,2000-10-02,2000 Back to School Week game 1.,Jeopardy,"(6, 1)",5-LETTER WORDS,13,"(100,)",False,This unit of measure is equal to 2 pints,quart,1,0
3696,2000-10-02,2000 Back to School Week game 1.,Jeopardy,"(1, 2)",SCIENCE CLASS,3,"(200,)",False,"A substance whose molecules contain more than one kind of atom, like water's hydrogen & oxygen atoms",compound,1,0
3696,2000-10-02,2000 Back to School Week game 1.,Jeopardy,"(2, 2)",THE MOVIES,10,"(200,)",False,"On meeting his new adopted brother in this film, George remarks, ""You look somewhat like a mouse""",Stuart Little,1,0
3696,2000-10-02,2000 Back to School Week game 1.,Jeopardy,"(3, 2)",KID LIT,16,"(200,)",False,"Along with her companions, Dorothy travels down this colorful ""road"" to visit the Wizard of Oz",the Yellow Brick Road,1,0
3696,2000-10-02,2000 Back to School Week game 1.,Jeopardy,"(4, 2)",NEW YORK CITY,8,"(200,)",False,"The Hayden, one of these attractions, features views like the one seen here",planetarium,1,0
3696,2000-10-02,2000 Back to School Week game 1.,Jeopardy,"(5, 2)",SPORTS RULES,27,"(200,)",False,In football you get 6 points for a touchdown & this many for a field goal,3,0,3
3696,2000-10-02,2000 Back to School Week game 1.,Jeopardy,"(6, 2)",5-LETTER WORDS,14,"(200,)",False,"The cirrus type of this is delicate & wispy, & is made up of ice crystals",cloud,1,0
3696,2000-10-02,2000 Back to School Week game 1.,Jeopardy,"(1, 3)",SCIENCE CLASS,4,"(300,)",False,This one of the 6 simple machines consists of a bar resting on a fulcrum,lever,1,0
3696,2000-10-02,2000 Back to School Week game 1.,Jeopardy,"(2, 3)",THE MOVIES,21,"(500,)",True,He's the lovable character seen here,Babe (the pig),1,0
3696,2000-10-02,2000 Back to School Week game 1.,Jeopardy,"(3, 3)",KID LIT,17,"(300,)",False,"Living in a high tower, this legendary girl lets down her long hair to draw up a prince",Rapunzel,1,0
3696,2000-10-02,2000 Back to School Week game 1.,Jeopardy,"(4, 3)",NEW YORK CITY,9,"(300,)",False,You can get into the city from New Jersey by the George Washington Bridge or the Lincoln one of these,tunnel,1,0
3696,2000-10-02,2000 Back to School Week game 1.,Jeopardy,"(5, 3)",SPORTS RULES,28,"(300,)",False,To get 3 strikeouts in an inning of baseball requires a minimum of this many pitches,9,0,3
3696,2000-10-02,2000 Back to School Week game 1.,Jeopardy,"(6, 3)",5-LETTER WORDS,18,"(300,)",False,"It's the type of bedcover that's often made at a ""bee""",quilt,1,0
3696,2000-10-02,2000 Back to School Week game 1.,Jeopardy,"(1, 4)",SCIENCE CLASS,5,"(400,)",False,"Including the cytoplasm, this jellylike material makes up the cells of all living organisms",protoplasm,1,0
3696,2000-10-02,2000 Back to School Week game 1.,Jeopardy,"(2, 4)",THE MOVIES,22,"(400,)",False,"Oui! Oui!  In 1998 this French school girl made it to the big screen, along with Miss Clavel",Madeline,1,0
3696,2000-10-02,2000 Back to School Week game 1.,Jeopardy,"(3, 4)",KID LIT,25,"(400,)",False,This Belgian cartoon boy with a dog named Snowy is an amateur detective,Tintin,0,3
3696,2000-10-02,2000 Back to School Week game 1.,Jeopardy,"(4, 4)",NEW YORK CITY,11,"(400,)",False,The name of this street that cuts diagonally through Manhattan is synonymous with big-time theater,Broadway,1,0
3696,2000-10-02,2000 Back to School Week game 1.,Jeopardy,"(6, 4)",5-LETTER WORDS,19,"(400,)",False,"The rear end of a ship, or an adjective describing a hard or strict teacher",stern,1,0
3696,2000-10-02,2000 Back to School Week game 1.,Jeopardy,"(1, 5)",SCIENCE CLASS,6,"(500,)",False,"The name of this lightest of all metals, symbol Li, comes from the Greek for ""stone""",lithium,0,3
3696,2000-10-02,2000 Back to School Week game 1.,Jeopardy,"(2, 5)",THE MOVIES,23,"(500,)",False,A young boy named Hogarth is a huge fan of heavy metal -- a heavy metal robot in this 1999 animated tale,The Iron Giant,1,0
3696,2000-10-02,2000 Back to School Week game 1.,Jeopardy,"(3, 5)",KID LIT,24,"(500,)",False,"After moving from ""The Big Woods"", Laura Ingalls Wilder set up her ""Little House on"" this area of the Old West",the Prairie,1,0
3696,2000-10-02,2000 Back to School Week game 1.,Jeopardy,"(4, 5)",NEW YORK CITY,12,"(500,)",False,"New York's 5 boroughs are Manhattan, Queens, Staten Island & these 2 that start with ""B""",Brooklyn & the Bronx,1,1
3696,2000-10-02,2000 Back to School Week game 1.,Jeopardy,"(6, 5)",5-LETTER WORDS,20,"(500,)",False,"It's a person who lures another into danger, or an artificial bird used by hunters to lure game",decoy,0,3
3696,2000-10-02,2000 Back to School Week game 1.,Double Jeopardy,"(1, 1)",BACK TO SCHOOL,11,"(200,)",False,Art class may include this ceramic art that uses a wheel to shape clay,pottery,1,0
3696,2000-10-02,2000 Back to School Week game 1.,Double Jeopardy,"(2, 1)",COMMON BONDS,24,"(200,)",False,"Tie,collar,scarf",things you wear around your neck,1,0
3696,2000-10-02,2000 Back to School Week game 1.,Double Jeopardy,"(3, 1)",FAMOUS WOMEN,7,"(200,)",False,"Co-host of ""The View"", this newswoman has interviewed every U.S. president & first lady since the Nixons",Barbara Walters,1,0
3696,2000-10-02,2000 Back to School Week game 1.,Double Jeopardy,"(4, 1)",HOLIDAYS & OBSERVANCES,1,"(200,)",False,"In Europe, some women believe the first man they see on this February day will marry them",Valentine\'s Day,1,0
3696,2000-10-02,2000 Back to School Week game 1.,Double Jeopardy,"(5, 1)",NATURE WALK,20,"(200,)",False,The cottontail is a common species of this animal that can jump 10 feet if you scare it,rabbit,1,0
3696,2000-10-02,2000 Back to School Week game 1.,Double Jeopardy,"(6, 1)",MY KID SISTER'S SONGS,5,"(200,)",False,"The ""little star"" is ""up above the world so high like"" one of these ""in the sky"" & if I hear it one more time, I'll cry",a diamond,1,0
3696,2000-10-02,2000 Back to School Week game 1.,Double Jeopardy,"(1, 2)",BACK TO SCHOOL,12,"(400,)",False,"In music, you may be the lucky one that gets to carry around this instrument",tuba,1,0
3696,2000-10-02,2000 Back to School Week game 1.,Double Jeopardy,"(2, 2)",COMMON BONDS,25,"(400,)",False,"Pipe,dry,vacuum",things that clean,1,0
3696,2000-10-02,2000 Back to School Week game 1.,Double Jeopardy,"(3, 2)",FAMOUS WOMEN,8,"(400,)",False,Since 1984 this former first lady has led an annual week-long blitz of house building for Habitat for Humanity,Rosalynn Carter,0,3
3696,2000-10-02,2000 Back to School Week game 1.,Double Jeopardy,"(4, 2)",HOLIDAYS & OBSERVANCES,2,"(400,)",False,"The USA's first parade celebrating this holiday took place on September 5, 1882",Labor Day,1,0
3696,2000-10-02,2000 Back to School Week game 1.,Double Jeopardy,"(5, 2)",NATURE WALK,21,"(400,)",False,"Frogs absorb oxygen through their skin, but also have these breathing organs, like us",lungs,1,0
3696,2000-10-02,2000 Back to School Week game 1.,Double Jeopardy,"(6, 2)",MY KID SISTER'S SONGS,17,"(400,)",False,"She sings ""A Song of Sixpence"" (whatever that is) & these baked in a pie?  Come on...",(four and twenty) blackbirds,1,0
3696,2000-10-02,2000 Back to School Week game 1.,Double Jeopardy,"(1, 3)",BACK TO SCHOOL,13,"(600,)",False,"In history class, you'll study this revolution that began replacing people with machines in the 1700s",the Industrial Revolution,1,0
3696,2000-10-02,2000 Back to School Week game 1.,Double Jeopardy,"(2, 3)",COMMON BONDS,26,"(600,)",False,"Period,caboose,Z",things at the end,1,0
3696,2000-10-02,2000 Back to School Week game 1.,Double Jeopardy,"(3, 3)",FAMOUS WOMEN,9,"(600,)",False,She was the queen of England from 1558 to 1603,Elizabeth I,1,0
3696,2000-10-02,2000 Back to School Week game 1.,Double Jeopardy,"(4, 3)",HOLIDAYS & OBSERVANCES,3,"(400,)",True,The historical event which this holiday celebrates occurred 508 years ago,Columbus Day,0,1
3696,2000-10-02,2000 Back to School Week game 1.,Double Jeopardy,"(5, 3)",NATURE WALK,22,"(600,)",False,"Seen here, it looks like any other bird & gets its name because it can sound like any other bird",mockingbird,0,3
3696,2000-10-02,2000 Back to School Week game 1.,Double Jeopardy,"(6, 3)",MY KID SISTER'S SONGS,18,"(600,)",False,"It ""went over the mountain to see what he could see"" & I hope he stays there so my sister will shut up",the bear,0,3
3696,2000-10-02,2000 Back to School Week game 1.,Double Jeopardy,"(1, 4)",BACK TO SCHOOL,14,"(200,)",True,"For geometry, you'll need to swallow this, the ratio of the circumference of a circle to its diameter",pi,1,0
3696,2000-10-02,2000 Back to School Week game 1.,Double Jeopardy,"(2, 4)",COMMON BONDS,27,"(800,)",False,"The letter T,the street,a bridge",something you cross,1,0
3696,2000-10-02,2000 Back to School Week game 1.,Double Jeopardy,"(3, 4)",FAMOUS WOMEN,10,"(800,)",False,"This style & decorating maven said she's moving from Westport, Conn., after complaining about the neighbors",Martha Stewart,1,0
3696,2000-10-02,2000 Back to School Week game 1.,Double Jeopardy,"(4, 4)",HOLIDAYS & OBSERVANCES,4,"(800,)",False,This African-American holiday begins on December 26 & lasts for 7 days,Kwanzaa,1,0
3696,2000-10-02,2000 Back to School Week game 1.,Double Jeopardy,"(5, 4)",NATURE WALK,23,"(800,)",False,"That ladybug in the grass represents one of about 300,000 species of this insect",beetles,1,0
3696,2000-10-02,2000 Back to School Week game 1.,Double Jeopardy,"(6, 4)",MY KID SISTER'S SONGS,19,"(800,)",False,"""Morning bells are ringing""; how can he sleep through that racket?","Brother John (""Frère Jacques"")",0,3
3696,2000-10-02,2000 Back to School Week game 1.,Double Jeopardy,"(1, 5)",BACK TO SCHOOL,15,"(1000,)",False,Your geography teacher may use this kind of map with contour lines to show the elevation of land,topography map,1,0
3696,2000-10-02,2000 Back to School Week game 1.,Double Jeopardy,"(2, 5)",COMMON BONDS,28,"(1000,)",False,"Fez,bowler,Stetson",hats,1,0
3696,2000-10-02,2000 Back to School Week game 1.,Double Jeopardy,"(3, 5)",FAMOUS WOMEN,16,"(1000,)",False,This scientist was born in 1867 in Poland with the name Marja Sklodowska,Marie Curie,1,0
3696,2000-10-02,2000 Back to School Week game 1.,Double Jeopardy,"(4, 5)",HOLIDAYS & OBSERVANCES,6,"(1000,)",False,"This holiday was first celebrated on June 19, 1910 in Spokane, Washington, due to the efforts of Sonora Dodd",Father\'s Day,0,3
3696,2000-10-02,2000 Back to School Week game 1.,Final Jeopardy,"(1, 1)",POP MUSIC,0,"(1700, 2600, 2000)",False,"In May 1999 he had the No. 1 spot on the Hot 100, Top 40, Hot Latin & Hot Dance Music/Maxi-Single Sales Billboard charts",Ricky Martin,3,0
