epNum,airDate,extra_info,round_name,coord,category,order,value,daily_double,question,answer,correctAttempts,wrongAttempts
3735,2000-11-24,,Jeopardy,"(1, 1)",SOUTH OF THE EQUATOR,21,"(100,)",False,"Boer voortrekkers who attempted to cross this desert in the late 19th century called it the ""Thirstland""",Kalahari,1,1
3735,2000-11-24,,Jeopardy,"(2, 1)",BREWERIES,18,"(100,)",False,Ghettoblaster is both a CD & a beer produced by Motor City Brewing Works in this city,Detroit,1,0
3735,2000-11-24,,Jeopardy,"(3, 1)",FAMOUS FACES,13,"(100,)",False,The small steps taken by this man seen here will be long remembered,Neil Armstrong,1,0
3735,2000-11-24,,Jeopardy,"(4, 1)",CLASSIC TV TITLE ROLES,8,"(100,)",False,"Dry cleaner Sherman Hemsley, Isabel Sanford & their son",The Jeffersons,1,0
3735,2000-11-24,,Jeopardy,"(5, 1)",INNOVATIONS,5,"(100,)",False,This handheld lens is one of Mr. Wizard's 10 most significant inventions of the last millennium,Magnifying glass,1,0
3735,2000-11-24,,Jeopardy,"(6, 1)","ENDS IN ""UP""",1,"(100,)",False,"Among kids, it's the favorite hot dog topping",Ketchup,1,0
3735,2000-11-24,,Jeopardy,"(1, 2)",SOUTH OF THE EQUATOR,22,"(200,)",False,"The Gran Chaco is a low, flat plain covering western Paraguay, southern Bolivia & the northern part of this country",Argentina,1,0
3735,2000-11-24,,Jeopardy,"(2, 2)",BREWERIES,19,"(200,)",False,"Young's Brewery claims London's last remaining cooperage, where these are made & repaired",Barrels,1,0
3735,2000-11-24,,Jeopardy,"(3, 2)",FAMOUS FACES,14,"(200,)",False,Psychedelic '60s soothsayer seen here,Timothy Leary,1,0
3735,2000-11-24,,Jeopardy,"(4, 2)",CLASSIC TV TITLE ROLES,9,"(200,)",False,Police captain Hal Linden,Barney Miller,1,0
3735,2000-11-24,,Jeopardy,"(5, 2)",INNOVATIONS,6,"(200,)",False,Industrial designer Brooks Stevens added this feature to a clothes dryer's door,Window,0,3
3735,2000-11-24,,Jeopardy,"(6, 2)","ENDS IN ""UP""",2,"(200,)",False,"Lipstick, mascara, foundation, etc.",Makeup,1,0
3735,2000-11-24,,Jeopardy,"(1, 3)",SOUTH OF THE EQUATOR,23,"(300,)",False,Geothermal steam in the volcanic area of this country's North Island is becoming an important source of power,New Zealand,1,2
3735,2000-11-24,,Jeopardy,"(2, 3)",BREWERIES,20,"(300,)",False,Tourists stumbling along Carlsberg Vej in this city may be coming from a brewery tour,Copenhagen,0,3
3735,2000-11-24,,Jeopardy,"(3, 3)",FAMOUS FACES,15,"(300,)",False,Boxing was one of the sports covered by this man seen here,Howard Cosell,1,0
3735,2000-11-24,,Jeopardy,"(4, 3)",CLASSIC TV TITLE ROLES,10,"(300,)",False,Alien life form voiced by Paul Fusco,ALF,1,0
3735,2000-11-24,,Jeopardy,"(5, 3)",INNOVATIONS,24,"(300,)",False,"Rubber sink plugs & drainboard mats were innovations by this company with ""Rubber"" in its name",Rubbermaid,1,0
3735,2000-11-24,,Jeopardy,"(6, 3)","ENDS IN ""UP""",3,"(300,)",False,"Hopefully you'll never have to identify a suspect, at the police station, from this group",Lineup,1,0
3735,2000-11-24,,Jeopardy,"(1, 4)",SOUTH OF THE EQUATOR,29,"(400,)",False,This island that's second in size only to Greenland has some of the world's largest gold & copper reserves,New Guinea,0,3
3735,2000-11-24,,Jeopardy,"(2, 4)",BREWERIES,27,"(400,)",False,A Mazatlan brewery makes this brand whose name refers to a nearby body of water,Pacifico Claro,0,3
3735,2000-11-24,,Jeopardy,"(3, 4)",FAMOUS FACES,16,"(400,)",False,She's the royal sibling & president of the Royal Ballet seen here in the 1950s,Princess Margaret,1,0
3735,2000-11-24,,Jeopardy,"(4, 4)",CLASSIC TV TITLE ROLES,11,"(400,)",False,Waitress Linda Lavin,Alice,1,0
3735,2000-11-24,,Jeopardy,"(5, 4)",INNOVATIONS,25,"(400,)",False,Big construction projects often include Francois Hennebique's reinforced type of this building material,Concrete,1,1
3735,2000-11-24,,Jeopardy,"(6, 4)","ENDS IN ""UP""",4,"(500,)",True,It's slang for a western or crime film that features a lot of gunfire,Shoot \'em up,0,1
3735,2000-11-24,,Jeopardy,"(1, 5)",SOUTH OF THE EQUATOR,30,"(500,)",False,French & Malagasy are this country's 2 official languages,Madagascar,1,0
3735,2000-11-24,,Jeopardy,"(2, 5)",BREWERIES,28,"(500,)",False,"A man named Heinrich established a brewery in Bremen that produces this, Germany's No. 1 export beer",Beck\'s,1,0
3735,2000-11-24,,Jeopardy,"(3, 5)",FAMOUS FACES,17,"(500,)",False,This New Yorker's groundbreaking first took place in 1984,Geraldine Ferraro,1,0
3735,2000-11-24,,Jeopardy,"(4, 5)",CLASSIC TV TITLE ROLES,12,"(500,)",False,Streetwise detective Robert Blake,Baretta,1,0
3735,2000-11-24,,Jeopardy,"(5, 5)",INNOVATIONS,26,"(500,)",False,Sebastien Vauban changed this military operation by using zigzag trenches to reach the defending fortress,Siege (lay siege to a fort),0,3
3735,2000-11-24,,Jeopardy,"(6, 5)","ENDS IN ""UP""",7,"(500,)",False,This mat-covered hut was once home for the typical Apache family,Wickiup,0,3
3735,2000-11-24,,Double Jeopardy,"(1, 1)",R.I.P. IN ALABAMA,20,"(200,)",False,This man who ground up a lot of peanuts is buried on the grounds of the Tuskegee Institute,George Washington Carver,1,0
3735,2000-11-24,,Double Jeopardy,"(2, 1)",MARRIAGE-GO-ROUND,5,"(200,)",False,Larry Fortensky's third wife,Elizabeth Taylor,1,0
3735,2000-11-24,,Double Jeopardy,"(3, 1)",ENGLISH,3,"(200,)",False,He set up his telegraph code by checking the frequency of each letter in the type of a printer's box,Samuel Morse,1,0
3735,2000-11-24,,Double Jeopardy,"(4, 1)",LEGAL LINGO,9,"(200,)",False,"An assault based on race or religion is called this emotional type of ""crime""",Hate crime,1,0
3735,2000-11-24,,Double Jeopardy,"(5, 1)",THE GREAT GATSBY,14,"(200,)",False,One of Gatsby's reputed professions is this illicit prohibition specialty,Bootlegging,1,0
3735,2000-11-24,,Double Jeopardy,"(6, 1)",OLD SPORT,1,"(200,)",False,"Way before Shaq & Kobe, this league's 1981 title game was aired after late local news",NBA (National Basketball Association),1,0
3735,2000-11-24,,Double Jeopardy,"(1, 2)",R.I.P. IN ALABAMA,21,"(400,)",False,"Eddie Kendricks, famed as an original member of this legendary singing group, is in Elmwood Cemetery",The Temptations,1,0
3735,2000-11-24,,Double Jeopardy,"(2, 2)",MARRIAGE-GO-ROUND,6,"(400,)",False,Senator John Warner's second wife,Elizabeth Taylor,1,0
3735,2000-11-24,,Double Jeopardy,"(3, 2)",ENGLISH,4,"(400,)",False,"""Debt"" contains this letter to show its etymology, from the Latin debitum",B,0,3
3735,2000-11-24,,Double Jeopardy,"(4, 2)",LEGAL LINGO,10,"(400,)",False,"Also called the complainant, it's the person bringing a civil suit",Plaintiff,1,0
3735,2000-11-24,,Double Jeopardy,"(5, 2)",THE GREAT GATSBY,15,"(400,)",False,"The 3 big-screen Gatsbys have been Warner Baxter, Robert Redford & this ""Shane"" star",Alan Ladd,1,0
3735,2000-11-24,,Double Jeopardy,"(6, 2)",OLD SPORT,2,"(400,)",False,"Before these were assigned numbers, the 5 wood was known as the baffy",Golf clubs,0,3
3735,2000-11-24,,Double Jeopardy,"(1, 3)",R.I.P. IN ALABAMA,22,"(600,)",False,"Hooterville's Mr. Haney, he's in a Haleyville, Alabama cemetery",Pat Buttram,0,3
3735,2000-11-24,,Double Jeopardy,"(2, 3)",MARRIAGE-GO-ROUND,7,"(600,)",False,Eddie Fisher's second wife,Elizabeth Taylor,1,0
3735,2000-11-24,,Double Jeopardy,"(3, 3)",ENGLISH,11,"(600,)",False,In 2000 Seamus Heaney's English translation of this Anglo-Saxon classic made the bestseller list,"""Beowulf""",1,0
3735,2000-11-24,,Double Jeopardy,"(4, 3)",LEGAL LINGO,13,"(600,)",False,"Term for jury discussions to reach a verdict; in O.J. Simpson's criminal trial, they took 4 hours",Deliberations,1,0
3735,2000-11-24,,Double Jeopardy,"(5, 3)",THE GREAT GATSBY,16,"(600,)",False,"The book is dedicated ""Once Again to"" this wife of the author",Zelda,1,0
3735,2000-11-24,,Double Jeopardy,"(6, 3)",OLD SPORT,17,"(600,)",False,"This man, ""The Great John L."", won the last bare-knuckle heavyweight title fight, a 75-rounder",John L. Sullivan,1,0
3735,2000-11-24,,Double Jeopardy,"(1, 4)",R.I.P. IN ALABAMA,25,"(800,)",False,"This country singing legend's tombstone reads, ""Praise the Lord I Saw the Light""","Hank Williams, Sr.",0,3
3735,2000-11-24,,Double Jeopardy,"(2, 4)",MARRIAGE-GO-ROUND,8,"(800,)",False,Eddie Fisher's first wife,Debbie Reynolds,1,0
3735,2000-11-24,,Double Jeopardy,"(3, 4)",ENGLISH,12,"(800,)",False,"""The Professor and the Madman"" tells how inmate Dr. W.C. Minor sent in thousands of definitions to this dictionary",Oxford English Dictionary,1,0
3735,2000-11-24,,Double Jeopardy,"(4, 4)",LEGAL LINGO,27,"(800,)",False,"(Hi, I'm Camryn Manheim from ""The Practice"") At this criminal proceeding, charges are read & the defendant enters his plea",Arraignment,1,1
3735,2000-11-24,,Double Jeopardy,"(5, 4)",THE GREAT GATSBY,23,"(800,)",False,Gatsby's friend Meyer Wolfsheim was the man behind this 1919 sporting scandal,Chicago Black Sox,1,0
3735,2000-11-24,,Double Jeopardy,"(6, 4)",OLD SPORT,18,"(800,)",False,Walter Johnson led the American League in strikeouts 12 times pitching for this team that no longer exists,Washington Senators,1,0
3735,2000-11-24,,Double Jeopardy,"(1, 5)",R.I.P. IN ALABAMA,26,"(1000,)",False,"Her marker reads, ""Governor, State of Alabama 1967-1968""",Lurleen B. Wallace,1,0
3735,2000-11-24,,Double Jeopardy,"(2, 5)",MARRIAGE-GO-ROUND,30,"(1000,)",False,Eddie Fisher's third wife,Connie Stevens,0,3
3735,2000-11-24,,Double Jeopardy,"(3, 5)",ENGLISH,29,"(1000,)",False,"This long word from 19th century America for ""an extraordinary thing"" was adopted by an all-day band fest",Lollapalooza,1,0
3735,2000-11-24,,Double Jeopardy,"(4, 5)",LEGAL LINGO,28,"(800,)",True,"The pretrial disclosure of facts to the other party, it's also the name of a TV channel",Discovery,0,1
3735,2000-11-24,,Double Jeopardy,"(5, 5)",THE GREAT GATSBY,24,"(1000,)",False,It's Gatsby's first name,Jay,1,0
3735,2000-11-24,,Double Jeopardy,"(6, 5)",OLD SPORT,19,"(600,)",True,"In 1980 Willie Davenport & Jeff Gadley, the USA's first black Winter Olympic athletes, were half of a team in this event",Bobsledding,1,0
3735,2000-11-24,,Final Jeopardy,"(1, 1)",AFRICAN MYTHOLOGY,0,"(3199, 2100, 3201)",False,"The great creator said these animals couldn't eat the fish of the river, so they fed on the land at night",Hippos,0,3
