epNum,airDate,extra_info,round_name,coord,category,order,value,daily_double,question,answer,correctAttempts,wrongAttempts
3950,2001-11-02,2001 Tournament of Champions final game 2.,Jeopardy,"(1, 1)",FOREIGN LEADERS QUIZ,4,"(100,)",False,"As the leader of this nation, Middle Eastern emir Sheikh Jaber Al-Ahmad Al-Sabah welcomed the U.S. invasion of Iraq",Kuwait,1,0
3950,2001-11-02,2001 Tournament of Champions final game 2.,Jeopardy,"(2, 1)",2001 ENTERTAINMENT NEWS,15,"(100,)",False,The woman seen here triumphed on Oscar night for her role as this woman,Erin Brockovich,1,0
3950,2001-11-02,2001 Tournament of Champions final game 2.,Jeopardy,"(3, 1)",FROM HERE TO MATERNITY,22,"(100,)",False,This French doctor called his childbirth preparation method psychoprophylaxis:  mental prevention,Fernand Lamaze,1,0
3950,2001-11-02,2001 Tournament of Champions final game 2.,Jeopardy,"(4, 1)",GANGSTER TALK,12,"(100,)",False,"Listen, you mugs, I didn't do it, see?  I have this airtight excuse--I was with Lola on the night of the 24th",alibi,1,0
3950,2001-11-02,2001 Tournament of Champions final game 2.,Jeopardy,"(5, 1)",NEW YORK CITY,1,"(100,)",False,"(Alright, let's hear from Cheryl on this clue):These days, one of Harlem's most prominent figures is this man, whose office is at 55 West 125th St.",Bill Clinton,1,0
3950,2001-11-02,2001 Tournament of Champions final game 2.,Jeopardy,"(6, 1)",CLEAN 4-LETTER WORDS,11,"(100,)",False,Dial & Zest are 4-letter brands of this,soap,1,0
3950,2001-11-02,2001 Tournament of Champions final game 2.,Jeopardy,"(1, 2)",FOREIGN LEADERS QUIZ,7,"(200,)",False,"Ending the long autocratic rule of his predecessor, Vojislav Kostunica won this country's presidency in 2000",Yugoslavia,1,1
3950,2001-11-02,2001 Tournament of Champions final game 2.,Jeopardy,"(2, 2)",2001 ENTERTAINMENT NEWS,16,"(200,)",False,"In 2001 she told David Letterman the best thing about her divorce from Tom Cruise:  ""I can wear heels now""",Nicole Kidman,1,0
3950,2001-11-02,2001 Tournament of Champions final game 2.,Jeopardy,"(3, 2)",FROM HERE TO MATERNITY,23,"(200,)",False,Doctors can assess an unborn baby's health by testing this fluid that surrounds the fetus,amniotic fluid,1,0
3950,2001-11-02,2001 Tournament of Champions final game 2.,Jeopardy,"(4, 2)",GANGSTER TALK,13,"(200,)",False,"Them coppers will never catch me--I've been using dozens of these fake names from the Latin for ""otherwise""",alias,1,0
3950,2001-11-02,2001 Tournament of Champions final game 2.,Jeopardy,"(5, 2)",NEW YORK CITY,2,"(200,)",False,"In winter, the Sea Grill boasts fine views of the skaters at this landmark's ice rink",Rockefeller Center,1,0
3950,2001-11-02,2001 Tournament of Champions final game 2.,Jeopardy,"(6, 2)",CLEAN 4-LETTER WORDS,20,"(200,)",False,"Everything ""will come out in"" this",the wash,1,0
3950,2001-11-02,2001 Tournament of Champions final game 2.,Jeopardy,"(1, 3)",FOREIGN LEADERS QUIZ,8,"(300,)",False,The man seen here is the president of this Western Hemisphere nation,Mexico (Vicente Fox),1,0
3950,2001-11-02,2001 Tournament of Champions final game 2.,Jeopardy,"(2, 3)",2001 ENTERTAINMENT NEWS,17,"(300,)",False,"For the second time in a year this actor used his helicopter to rescue a lost hiker from ""Clear & Present Danger""",Harrison Ford,1,0
3950,2001-11-02,2001 Tournament of Champions final game 2.,Jeopardy,"(3, 3)",FROM HERE TO MATERNITY,26,"(300,)",False,"Usually 16 to 24 inches long, this ropelike structure consists of 2 arteries & a vein surrounded by Wharton's jelly",umbilical cord,1,0
3950,2001-11-02,2001 Tournament of Champions final game 2.,Jeopardy,"(4, 3)",GANGSTER TALK,14,"(300,)",False,"You dirty rats, I'll never be one of these ""avian"" informers",a stool pigeon,1,0
3950,2001-11-02,2001 Tournament of Champions final game 2.,Jeopardy,"(5, 3)",NEW YORK CITY,3,"(300,)",False,"(Alright, here comes Sofia):I'm standing outside the Waldorf-Astoria, on this New York City street mentioned in the theme of ""Green Acres""",Park Avenue,1,0
3950,2001-11-02,2001 Tournament of Champions final game 2.,Jeopardy,"(6, 3)",CLEAN 4-LETTER WORDS,21,"(300,)",False,To polish or shine a floor or shoe,buff,1,0
3950,2001-11-02,2001 Tournament of Champions final game 2.,Jeopardy,"(1, 4)",FOREIGN LEADERS QUIZ,9,"(400,)",False,"Twice foreign minister of the former Soviet Union, he's now president of the nation of Georgia",Eduard Shevardnadze,1,0
3950,2001-11-02,2001 Tournament of Champions final game 2.,Jeopardy,"(2, 4)",2001 ENTERTAINMENT NEWS,18,"(1600,)",True,It was a record 12 Tonys for this Broadway hit shortly after springtime in 2001,The Producers,1,0
3950,2001-11-02,2001 Tournament of Champions final game 2.,Jeopardy,"(3, 4)",FROM HERE TO MATERNITY,28,"(400,)",False,This kind of scanning is often performed about 16 to 18 weeks into pregnancy,ultrasound,1,0
3950,2001-11-02,2001 Tournament of Champions final game 2.,Jeopardy,"(4, 4)",GANGSTER TALK,24,"(400,)",False,"Back in the 1920s Biggsy & me made a fortune doing this --  ya know, smuggling & selling booze, rumrunning",bootlegging,1,0
3950,2001-11-02,2001 Tournament of Champions final game 2.,Jeopardy,"(5, 4)",NEW YORK CITY,5,"(400,)",False,"Opened in 1736 as a 6-bed infirmary, a pavilion for the insane was added to this place in 1879",Bellevue Hospital,1,0
3950,2001-11-02,2001 Tournament of Champions final game 2.,Jeopardy,"(6, 4)",CLEAN 4-LETTER WORDS,27,"(400,)",False,"Meaning free from dirt or taint, it's used in describing food & drug laws",pure,1,0
3950,2001-11-02,2001 Tournament of Champions final game 2.,Jeopardy,"(1, 5)",FOREIGN LEADERS QUIZ,10,"(500,)",False,"On June 16, 1999 Nelson Mandela was replaced as president of South Africa by this man",Thabo Mbeki,0,3
3950,2001-11-02,2001 Tournament of Champions final game 2.,Jeopardy,"(2, 5)",2001 ENTERTAINMENT NEWS,19,"(500,)",False,"Like Kermit the Frog before him, this ""Blaze of Glory"" rocker addressed the Oxford Union Debating Society",Jon Bon Jovi,1,0
3950,2001-11-02,2001 Tournament of Champions final game 2.,Jeopardy,"(3, 5)",FROM HERE TO MATERNITY,30,"(500,)",False,A newborn given a 1-minute score of 7-10 on this scale is in excellent condition,Apgar scale,1,0
3950,2001-11-02,2001 Tournament of Champions final game 2.,Jeopardy,"(4, 5)",GANGSTER TALK,25,"(500,)",False,"I'm not ""No. 1"", but to the Feds I'm this title of a 1931 Cagney film",Public Enemy,1,0
3950,2001-11-02,2001 Tournament of Champions final game 2.,Jeopardy,"(5, 5)",NEW YORK CITY,6,"(500,)",False,(We'll wrap it up with Sofia in New York):You can ride the subway for 31 miles without changing trains from 207th St. to this area in the far reaches of Queens,Far Rockaway,1,0
3950,2001-11-02,2001 Tournament of Champions final game 2.,Jeopardy,"(6, 5)",CLEAN 4-LETTER WORDS,29,"(500,)",False,"It means ""orderly & clean"" & is also used to order drinks without ice or water added",neat,1,0
3950,2001-11-02,2001 Tournament of Champions final game 2.,Double Jeopardy,"(1, 1)",OBSCURE GEOGRAPHY,2,"(200,)",False,"Navodari, Romania is a community on this large sea",Black Sea,1,1
3950,2001-11-02,2001 Tournament of Champions final game 2.,Double Jeopardy,"(2, 1)",BEST ORIGINAL SCREENPLAY,7,"(200,)",False,Herman J. Mankiewicz & Orson Welles(1941),Citizen Kane,1,0
3950,2001-11-02,2001 Tournament of Champions final game 2.,Double Jeopardy,"(3, 1)",LITERARY TRILOGIES,18,"(200,)",False,Rosalind Miles wrote a trilogy of novels about this queen who knew her way around the round table,Guinevere,1,0
3950,2001-11-02,2001 Tournament of Champions final game 2.,Double Jeopardy,"(4, 1)",ALL-AMERICAN FOLKS,30,"(200,)",False,"Seen here, guitarist Rudy Gonzales is the first man with this job to play the Kennedy Center",cowboy,0,3
3950,2001-11-02,2001 Tournament of Champions final game 2.,Double Jeopardy,"(5, 1)","HANG ""IN"" THERE, BABY!",16,"(200,)",False,"Meaning ""impossible to separate into parts"", it's found in the Pledge of Allegiance",indivisible,1,0
3950,2001-11-02,2001 Tournament of Champions final game 2.,Double Jeopardy,"(6, 1)",NOBEL LAUREATES SPEAK,1,"(200,)",False,"(Hi, I'm Dr. David Baltimore.)  In 1975 I shared a Nobel Prize for my work in virology; this molecule found in all living cells consists of thousands of chemical units called nucleotides",DNA,1,0
3950,2001-11-02,2001 Tournament of Champions final game 2.,Double Jeopardy,"(1, 2)",OBSCURE GEOGRAPHY,12,"(400,)",False,"At 11,204 feet, the Sahara's highest point is Emi Koussi, an extinct volcano in this country with a 4-letter name",Chad,0,3
3950,2001-11-02,2001 Tournament of Champions final game 2.,Double Jeopardy,"(2, 2)",BEST ORIGINAL SCREENPLAY,8,"(400,)",False,Marc Norman & Tom Stoppard(1998),Shakespeare In Love,1,0
3950,2001-11-02,2001 Tournament of Champions final game 2.,Double Jeopardy,"(3, 2)",LITERARY TRILOGIES,20,"(400,)",False,"""The Romantic Comedians"" begins an Ellen Glasgow trilogy that ""Carries us back to"" this Southern state",Virginia,1,0
3950,2001-11-02,2001 Tournament of Champions final game 2.,Double Jeopardy,"(4, 2)",ALL-AMERICAN FOLKS,29,"(400,)",False,"Leonard Goldenson was the man who built this ""patriotic"" TV network",ABC (American Broadcasting Company),0,3
3950,2001-11-02,2001 Tournament of Champions final game 2.,Double Jeopardy,"(5, 2)","HANG ""IN"" THERE, BABY!",17,"(400,)",False,The introduction of a fluid by syringe,injection,1,0
3950,2001-11-02,2001 Tournament of Champions final game 2.,Double Jeopardy,"(6, 2)",NOBEL LAUREATES SPEAK,3,"(400,)",False,"(Hi, I'm Rudy Marcus, Nobel Prize winner in chemistry.)  Ferrous sulfide is produced when these 2 elements are heated together",iron & sulphur,1,0
3950,2001-11-02,2001 Tournament of Champions final game 2.,Double Jeopardy,"(1, 3)",OBSCURE GEOGRAPHY,13,"(1000,)",True,Tailless critters from this isle between England & Ireland are treasured by their owners,Isle of Man,1,0
3950,2001-11-02,2001 Tournament of Champions final game 2.,Double Jeopardy,"(2, 3)",BEST ORIGINAL SCREENPLAY,9,"(600,)",False,Cameron Crowe(2000),Almost Famous,1,0
3950,2001-11-02,2001 Tournament of Champions final game 2.,Double Jeopardy,"(3, 3)",LITERARY TRILOGIES,21,"(600,)",False,"This existentialist never finished the fourth volume of  ""Les Chemins de la Liberte"", so it's a trilogy",Jean-Paul Sartre,1,0
3950,2001-11-02,2001 Tournament of Champions final game 2.,Double Jeopardy,"(4, 3)",ALL-AMERICAN FOLKS,26,"(700,)",True,One of his classic Western photographs is seen here:,Ansel Adams,1,0
3950,2001-11-02,2001 Tournament of Champions final game 2.,Double Jeopardy,"(5, 3)","HANG ""IN"" THERE, BABY!",19,"(600,)",False,On the field of play in sports,inbounds,1,0
3950,2001-11-02,2001 Tournament of Champions final game 2.,Double Jeopardy,"(6, 3)",NOBEL LAUREATES SPEAK,4,"(600,)",False,"(Hi, I'm George Olah, Nobel Prize winner in chemistry.)  The ""P"" in Boyle's Law,  PV=K, stands for this",pressure,1,0
3950,2001-11-02,2001 Tournament of Champions final game 2.,Double Jeopardy,"(1, 4)",OBSCURE GEOGRAPHY,14,"(800,)",False,"Formerly Vila De Joao Belo, the city of Xai-Xai is found in this country of southern Africa",Mozambique,0,3
3950,2001-11-02,2001 Tournament of Champions final game 2.,Double Jeopardy,"(2, 4)",BEST ORIGINAL SCREENPLAY,10,"(800,)",False,Jane Campion(1993),The Piano,1,0
3950,2001-11-02,2001 Tournament of Champions final game 2.,Double Jeopardy,"(3, 4)",LITERARY TRILOGIES,24,"(800,)",False,"The ""Lords of Two Lands"" trilogy leads up to the story of Ahmose, who founded this civilization's 18th dynasty",Egypt,1,0
3950,2001-11-02,2001 Tournament of Champions final game 2.,Double Jeopardy,"(4, 4)",ALL-AMERICAN FOLKS,28,"(800,)",False,(Jimmy of the Clue Crew presents.)  This man built a chain of roadside stores featuring pecan log rolls like the one I'm about to enjoy,Williamson S. Stuckey,1,0
3950,2001-11-02,2001 Tournament of Champions final game 2.,Double Jeopardy,"(5, 4)","HANG ""IN"" THERE, BABY!",22,"(800,)",False,It fits inside a pneumatic tire,inner tube,1,0
3950,2001-11-02,2001 Tournament of Champions final game 2.,Double Jeopardy,"(6, 4)",NOBEL LAUREATES SPEAK,5,"(800,)",False,(Dr. Baltimore reads.)  This infectious agent that lives inside a cell & causes disease can be 100 times smaller than a bacterium,virus,1,0
3950,2001-11-02,2001 Tournament of Champions final game 2.,Double Jeopardy,"(1, 5)",OBSCURE GEOGRAPHY,15,"(1000,)",False,"Once called Sverdlovsk, this Ural Mountains city of 1.3 million was named after Catherine I",Ekaterinburg,1,0
3950,2001-11-02,2001 Tournament of Champions final game 2.,Double Jeopardy,"(2, 5)",BEST ORIGINAL SCREENPLAY,11,"(1000,)",False,Budd Schulberg(1954),On the Waterfront,1,0
3950,2001-11-02,2001 Tournament of Champions final game 2.,Double Jeopardy,"(3, 5)",LITERARY TRILOGIES,25,"(1000,)",False,"Robertson Davies called the third book in his Cornish trilogy ""The Lyre of"" this mythological figure",Orpheus,1,0
3950,2001-11-02,2001 Tournament of Champions final game 2.,Double Jeopardy,"(4, 5)",ALL-AMERICAN FOLKS,27,"(1000,)",False,"A California Air Force base is named for this man, a test pilot & an excellent dancer & apple pie baker",Glen Edwards,1,0
3950,2001-11-02,2001 Tournament of Champions final game 2.,Double Jeopardy,"(5, 5)","HANG ""IN"" THERE, BABY!",23,"(1000,)",False,An unsophisticated girl or a play's young heroine,ingenue,1,0
3950,2001-11-02,2001 Tournament of Champions final game 2.,Double Jeopardy,"(6, 5)",NOBEL LAUREATES SPEAK,6,"(1000,)",False,"(Hi, I'm Dr. Alan Heeger, Nobel prize winner in chemistry.)  In 1936 this German-born biochemist discovered his ""cycle"" of metabolism & energy production",Hans Krebs,1,0
3950,2001-11-02,2001 Tournament of Champions final game 2.,Final Jeopardy,"(1, 1)",U.S. PRESIDENTS,0,"(0, 3601, 7801)",False,Washington was the one who added these 4 words to the presidential oath; they're not in the Constitution,"\""So Help Me God\""",2,1
