epNum,airDate,extra_info,round_name,coord,category,order,value,daily_double,question,answer,correctAttempts,wrongAttempts
4057,2002-04-02,,Jeopardy,"(1, 1)",BEFORE THE WHITE HOUSE,16,"(200,)",False,Ax-wielding Chief Executive depicted hereas he might have lookedin 1833,Abraham Lincoln,1,0
4057,2002-04-02,,Jeopardy,"(2, 1)",BIBLICAL RULERS,11,"(200,)",False,Exodus 35:2--Whoever works on this day shall be put to death,the Sabbath,1,0
4057,2002-04-02,,Jeopardy,"(3, 1)",JUST RELAXING,23,"(200,)",False,"A doze, or a button on your alarm clock that lets you doze",snooze,1,0
4057,2002-04-02,,Jeopardy,"(4, 1)",MAKE,1,"(200,)",False,"The Golf, the Jetta",Volkswagen,1,0
4057,2002-04-02,,Jeopardy,"(5, 1)","""IT""",18,"(200,)",False,Something that provokes a desire to scratch the skin,an itch,1,0
4057,2002-04-02,,Jeopardy,"(6, 1)",BIG IN HOLLYWOOD,6,"(200,)",False,"In 1933 it was said of this big simian, ""Oh, no. It wasn't the airplanes. It was beauty killed the beast.""",King Kong,1,0
4057,2002-04-02,,Jeopardy,"(1, 2)",BEFORE THE WHITE HOUSE,17,"(400,)",False,This presidentis seen herein one of his earliestoccupations,Ronald Reagan,1,0
4057,2002-04-02,,Jeopardy,"(2, 2)",BIBLICAL RULERS,12,"(400,)",False,Deut. 19:15--You need this minimum number of witnesses to establish that a crime has been committed,2,0,3
4057,2002-04-02,,Jeopardy,"(3, 2)",JUST RELAXING,24,"(400,)",False,"This synonym for ""daydreaming"" can also mean collecting tufts left on bushes by sheep",wool gathering,0,3
4057,2002-04-02,,Jeopardy,"(4, 2)",MAKE,2,"(400,)",False,"The Bonneville, the GTO",Pontiac,1,0
4057,2002-04-02,,Jeopardy,"(5, 2)","""IT""",19,"(400,)",False,"Worldwide it's the native language of about 66,000,000 people",Italian,1,0
4057,2002-04-02,,Jeopardy,"(6, 2)",BIG IN HOLLYWOOD,7,"(400,)",False,"Opponents of this big movie reptile have included Megalon, the Smog Monster & Mothra",Godzilla,1,0
4057,2002-04-02,,Jeopardy,"(1, 3)",BEFORE THE WHITE HOUSE,28,"(600,)",False,They're the two presidents seen here in 1947,George Bush & George W. Bush,1,0
4057,2002-04-02,,Jeopardy,"(2, 3)",BIBLICAL RULERS,13,"(600,)",False,"Leviticus 21:20--Flat-nosed people & those with ""a blemish in"" this sense organ cannot become priests",the eye,1,2
4057,2002-04-02,,Jeopardy,"(3, 3)",JUST RELAXING,25,"(600,)",False,"An ""E-Cliner"" from this ""indolent"" recliner maker has a built-in keyboard for WebTV",La-Z-Boy,1,0
4057,2002-04-02,,Jeopardy,"(4, 3)",MAKE,3,"(600,)",False,"The Cordoba, the LeBaron",Chrysler,1,0
4057,2002-04-02,,Jeopardy,"(5, 3)","""IT""",20,"(600,)",False,"Used for emphasis, they're printed letters that usually slant to the right",italics,1,0
4057,2002-04-02,,Jeopardy,"(6, 3)",BIG IN HOLLYWOOD,8,"(600,)",False,"The Gotham City set for this 1989 film was reportedly the largest built for a movie since ""Cleopatra""",Batman,1,0
4057,2002-04-02,,Jeopardy,"(1, 4)",BEFORE THE WHITE HOUSE,29,"(800,)",False,An early 20th century photo of this man who would become president is seen here,FDR,1,0
4057,2002-04-02,,Jeopardy,"(2, 4)",BIBLICAL RULERS,14,"(800,)",False,"Deut. 25:5-10--A widow belongs to the husband's brother; if he refuses her she must do this ""in his face""",spit,1,0
4057,2002-04-02,,Jeopardy,"(3, 4)",JUST RELAXING,26,"(800,)",False,"Settle down by the pool with a planter's punch, made with fruit juice, grenadine & this liquor",rum,0,3
4057,2002-04-02,,Jeopardy,"(4, 4)",MAKE,4,"(800,)",False,"The Monza, the Vega",Chevy,1,0
4057,2002-04-02,,Jeopardy,"(5, 4)","""IT""",21,"(800,)",False,A list of places to be visited,itinerary,1,0
4057,2002-04-02,,Jeopardy,"(6, 4)",BIG IN HOLLYWOOD,9,"(800,)",False,"Truly on the big screen, movies in this large scale film format include ""Mission to Mir"" & ""Everest""",IMAX,1,0
4057,2002-04-02,,Jeopardy,"(1, 5)",BEFORE THE WHITE HOUSE,30,"(1000,)",False,Perhaps this presidentwanted to fiddlewith the Constitution,Nixon,1,1
4057,2002-04-02,,Jeopardy,"(2, 5)",BIBLICAL RULERS,15,"(1000,)",True,"Deut. 14:9-10--To be edible, water animals must have fins & these",scales,0,1
4057,2002-04-02,,Jeopardy,"(3, 5)",JUST RELAXING,27,"(1000,)",False,"In your space age bachelor pad, listen to the soothing '60s sounds of Ferrante & this piano partner",Teicher,1,0
4057,2002-04-02,,Jeopardy,"(4, 5)",MAKE,5,"(1000,)",False,"The Gremlin, the Pacer",AMC (American Motor Corp.),1,0
4057,2002-04-02,,Jeopardy,"(5, 5)","""IT""",22,"(1000,)",False,First name of violin virtuoso Perlman,Itzhak,1,0
4057,2002-04-02,,Jeopardy,"(6, 5)",BIG IN HOLLYWOOD,10,"(1000,)",False,This big screener about a bigfoot made big bucks in 1987,Harry and the Hendersons,1,0
4057,2002-04-02,,Double Jeopardy,"(1, 1)",PHYSICAL SCIENCE,18,"(400,)",False,This bending of light as it passes from air into water results from its slower speed,refraction,1,0
4057,2002-04-02,,Double Jeopardy,"(2, 1)",THE SPORTING LIFE,6,"(400,)",False,"In American football he's a kicker; in Britain he's a gambler, especially on thoroughbred  races",a punter,1,0
4057,2002-04-02,,Double Jeopardy,"(3, 1)",20th CENTURY BRITAIN,16,"(400,)",False,He's the well-intentioned1930s prime minister seen here,Neville Chamberlain,0,3
4057,2002-04-02,,Double Jeopardy,"(4, 1)",DO YOU KNOW WHO YOU'RE DEALING WITH?,26,"(400,)",False,"A shrewd bargainer is known as a ""trader"" of these animals",a horse-trader,1,0
4057,2002-04-02,,Double Jeopardy,"(5, 1)",STATES' FORMER CAPITALS,11,"(400,)",False,Omaha (1854-1867),Nebraska,1,0
4057,2002-04-02,,Double Jeopardy,"(6, 1)",BEFORE & AFTER,1,"(400,)",False,Eydie Gorme's spouse who is David Lean's epic 1962 film starring Peter O'Toole,Steve Lawrence of Arabia,1,0
4057,2002-04-02,,Double Jeopardy,"(1, 2)",PHYSICAL SCIENCE,22,"(800,)",False,The simplest organic compounds are made of just carbon & this element,hydrogen,1,0
4057,2002-04-02,,Double Jeopardy,"(2, 2)",THE SPORTING LIFE,7,"(800,)",False,Frank Beal invented this type of tennis for what it uses instead of a racquet,paddle tennis,0,3
4057,2002-04-02,,Double Jeopardy,"(3, 2)",20th CENTURY BRITAIN,17,"(5000,)",True,"On Oct. 31, 1956 British & French bombs destroyed much of this country's air force",Egypt,0,1
4057,2002-04-02,,Double Jeopardy,"(4, 2)",DO YOU KNOW WHO YOU'RE DEALING WITH?,27,"(800,)",False,One-word term for the proprietor of a cigar store,a tobacconist,0,3
4057,2002-04-02,,Double Jeopardy,"(5, 2)",STATES' FORMER CAPITALS,12,"(800,)",False,Natchez (1798-1802 & 1817-1821),Mississippi,1,0
4057,2002-04-02,,Double Jeopardy,"(6, 2)",BEFORE & AFTER,2,"(800,)",False,Crystal Gayle's No. 2 pop hit that's the type of dairy product that includes Roquefort & Gorgonzola,"""Don\'t It Make My Brown Eyes Blue Cheese""",1,0
4057,2002-04-02,,Double Jeopardy,"(1, 3)",PHYSICAL SCIENCE,23,"(1200,)",False,(Sarah of the Clue Crew presnts using a chalk board.) I've diagrammed the structure of methane; this is its familiar chemical formula,CH4,1,0
4057,2002-04-02,,Double Jeopardy,"(2, 3)",THE SPORTING LIFE,8,"(1200,)",False,"Unlike the 2-person type, the team type of this ""ball"" game has no walls; players throw the ball at a goal",handball,1,0
4057,2002-04-02,,Double Jeopardy,"(3, 3)",20th CENTURY BRITAIN,19,"(1200,)",False,In 1995 this oldest British merchant bank went bust after a trader lost $1 billion of its assets,Barings,0,3
4057,2002-04-02,,Double Jeopardy,"(5, 3)",STATES' FORMER CAPITALS,13,"(1200,)",False,Augusta (1786-1795),Georgia,1,1
4057,2002-04-02,,Double Jeopardy,"(6, 3)",BEFORE & AFTER,3,"(1200,)",False,"Movie star of gangster film like ""The Public Enemy"" who was partnered with Tyne Daly on a 1980s TV cop drama",James Cagney & Lacey,1,0
4057,2002-04-02,,Double Jeopardy,"(1, 4)",PHYSICAL SCIENCE,24,"(1600,)",False,"Magnets & batteries have this property, meaning each end produces opposite physical effects",polarized,1,0
4057,2002-04-02,,Double Jeopardy,"(2, 4)",THE SPORTING LIFE,9,"(1600,)",True,"As his last name suggess, this boxer who's twice beaten Mike Tyson is a devoted Christian",Evander Holyfield,0,1
4057,2002-04-02,,Double Jeopardy,"(3, 4)",20th CENTURY BRITAIN,20,"(1600,)",False,"On August 3 of this year, British Diplomat Edward Grey said, ""The lamps are going out all over Europe""",1914,0,3
4057,2002-04-02,,Double Jeopardy,"(5, 4)",STATES' FORMER CAPITALS,14,"(1600,)",False,Murfreesboro (1819-1825),Tennessee,1,0
4057,2002-04-02,,Double Jeopardy,"(6, 4)",BEFORE & AFTER,4,"(1600,)",False,Poe story in which an old man's body is buried under the floor & Marlow journeys in the Congo to find Kurtz,"""A Tell-Tale Heart of Darkness""",1,0
4057,2002-04-02,,Double Jeopardy,"(1, 5)",PHYSICAL SCIENCE,25,"(2000,)",False,"Seen in lamps, this type of luminescence from exposure to energy lasts only as long as the energy does",fluorescence,0,3
4057,2002-04-02,,Double Jeopardy,"(2, 5)",THE SPORTING LIFE,10,"(2000,)",False,In 1952 the great Willie Hoppe retired from this sport--we hope he had a cushion to fall back on,pool (billiards),0,3
4057,2002-04-02,,Double Jeopardy,"(3, 5)",20th CENTURY BRITAIN,21,"(2000,)",False,"Conductor Neville Marriner founded this British musical ""Academy"" named for a church on Trafalgar Square",the Academy of St. Martin in the Field,0,3
4057,2002-04-02,,Double Jeopardy,"(5, 5)",STATES' FORMER CAPITALS,15,"(2000,)",False,Portsmouth(1680-1775),New Hampshire,1,0
4057,2002-04-02,,Double Jeopardy,"(6, 5)",BEFORE & AFTER,5,"(2000,)",False,"It's the ""big deal"" Shakespeare play in which Brooke Shields reveals what she wears under her jeans in a classic ad","""Much Ado About Nothing Comes Between Me and My Calvins""",1,0
4057,2002-04-02,,Final Jeopardy,"(1, 1)",WORLD GEOGRAPHY,0,"(2400, 3799, 1000)",False,The only 2 South American countries with both an Atlantic & a Pacific coast,Chile & Colombia,0,3
