epNum,airDate,extra_info,round_name,coord,category,order,value,daily_double,question,answer,correctAttempts,wrongAttempts
4086,2002-05-13,2002 Million Dollar Masters final game 1.,Jeopardy,"(1, 1)",BRITISH ROYALTY,16,"(200,)",False,"Born in Corfu in 1921, he's a great grandson of the Danish king Christian IX",Prince Philip,1,0
4086,2002-05-13,2002 Million Dollar Masters final game 1.,Jeopardy,"(2, 1)",RECENT FILMS,9,"(200,)",False,"He played wise wizard Gandalf in 2001's ""Lord of the Rings""",Ian McKellen,1,0
4086,2002-05-13,2002 Million Dollar Masters final game 1.,Jeopardy,"(3, 1)",TOUGH POTPOURRI,1,"(200,)",False,"Wow!  This man bought Manhattan with trinkets worth about 60 guilders, usually quoted as $24",(Peter) Minuit,1,0
4086,2002-05-13,2002 Million Dollar Masters final game 1.,Jeopardy,"(4, 1)",AUTHORS' NATIVE LANDS,4,"(200,)",False,"""The Remains of the Day"" novelist Kazuo Ishiguro",Japan,1,0
4086,2002-05-13,2002 Million Dollar Masters final game 1.,Jeopardy,"(5, 1)","""GRAND"" CENTRAL",25,"(200,)",False,2-word French term for a competitive international road race,grand prix,1,0
4086,2002-05-13,2002 Million Dollar Masters final game 1.,Jeopardy,"(6, 1)",STATION,26,"(200,)",False,"On January 1, 1892 this receiving station for immigrants in Upper N.Y. Bay opened its doors for the first time",Ellis Island,1,0
4086,2002-05-13,2002 Million Dollar Masters final game 1.,Jeopardy,"(1, 2)",BRITISH ROYALTY,17,"(400,)",False,Some thought this Tudor would marry Lord Dudley when his wife was found dead after a suspicious accident in 1560,Elizabeth I,1,1
4086,2002-05-13,2002 Million Dollar Masters final game 1.,Jeopardy,"(2, 2)",RECENT FILMS,10,"(400,)",False,"He played wise wizard Dumbledore in 2001's ""Harry Potter and the Sorcerer's Stone""",Richard Harris,1,0
4086,2002-05-13,2002 Million Dollar Masters final game 1.,Jeopardy,"(3, 2)",TOUGH POTPOURRI,2,"(400,)",False,The jird is a common (& rather cute) type of this hamster relative,a gerbil,1,0
4086,2002-05-13,2002 Million Dollar Masters final game 1.,Jeopardy,"(4, 2)",AUTHORS' NATIVE LANDS,5,"(400,)",False,"Gabriel Garcia Marquez, chronicler of a death foretold",Colombia,1,0
4086,2002-05-13,2002 Million Dollar Masters final game 1.,Jeopardy,"(5, 2)","""GRAND"" CENTRAL",24,"(400,)",False,"This midwestern city of 190,000 was built on the site of an Ottawa Indian village",Grand Rapids,1,0
4086,2002-05-13,2002 Million Dollar Masters final game 1.,Jeopardy,"(6, 2)",STATION,27,"(400,)",False,"He took a failing UHF station in the 1970s & turned it into a ""Superstation""",Ted Turner,1,0
4086,2002-05-13,2002 Million Dollar Masters final game 1.,Jeopardy,"(1, 3)",BRITISH ROYALTY,18,"(600,)",False,"On Oct. 31, 1955 Princess Margaret announced that she was not going to marry the man she loved, this man",(Peter) Townsend,1,0
4086,2002-05-13,2002 Million Dollar Masters final game 1.,Jeopardy,"(2, 3)",RECENT FILMS,11,"(600,)",False,"""Leave no man behind"" was the tagline of this 2001 film that co-starred Josh Hartnett",Black Hawk Down,1,0
4086,2002-05-13,2002 Million Dollar Masters final game 1.,Jeopardy,"(3, 3)",TOUGH POTPOURRI,3,"(600,)",False,"This bejeweled N.Y. financier was so famous for overeating that one restaurateur called him ""my 25 best customers""","""Diamond"" Jim Brady",1,0
4086,2002-05-13,2002 Million Dollar Masters final game 1.,Jeopardy,"(4, 3)",AUTHORS' NATIVE LANDS,6,"(600,)",False,Celebrator of imperialism Rudyard Kipling,India,1,1
4086,2002-05-13,2002 Million Dollar Masters final game 1.,Jeopardy,"(5, 3)","""GRAND"" CENTRAL",21,"(600,)",False,Traditional term for a comprehensive survey of the continent for a young upper-class Englishman,the grand tour,1,0
4086,2002-05-13,2002 Million Dollar Masters final game 1.,Jeopardy,"(6, 3)",STATION,28,"(600,)",False,"In Catholic churches, there are 14 of these depicting the Passion of Christ",the stations of the cross,1,0
4086,2002-05-13,2002 Million Dollar Masters final game 1.,Jeopardy,"(1, 4)",BRITISH ROYALTY,22,"(800,)",False,This son of the Black Prince became king in 1377 & got his own Shakespeare play somewhat later,Richard II,0,3
4086,2002-05-13,2002 Million Dollar Masters final game 1.,Jeopardy,"(2, 4)",RECENT FILMS,14,"(800,)",False,Meg Ryan & Hugh Jackman found love across time in this romance,Kate & Leopold,1,0
4086,2002-05-13,2002 Million Dollar Masters final game 1.,Jeopardy,"(3, 4)",TOUGH POTPOURRI,12,"(800,)",False,"If you've read ""The Flame Trees of Thika"" (or if you saw the miniseries) you know that Thika is in this country",Kenya,0,3
4086,2002-05-13,2002 Million Dollar Masters final game 1.,Jeopardy,"(4, 4)",AUTHORS' NATIVE LANDS,7,"(1400,)",True,Godot writer Samuel Beckett,Ireland,1,0
4086,2002-05-13,2002 Million Dollar Masters final game 1.,Jeopardy,"(5, 4)","""GRAND"" CENTRAL",20,"(800,)",False,"Found off Newfoundland, it's a major source of food fish",the Grand Banks,1,0
4086,2002-05-13,2002 Million Dollar Masters final game 1.,Jeopardy,"(6, 4)",STATION,29,"(800,)",False,"This present-day San Francisco ""Hill"" was named for the semaphore station established there in the 1800s",Telegraph Hill,1,0
4086,2002-05-13,2002 Million Dollar Masters final game 1.,Jeopardy,"(1, 5)",BRITISH ROYALTY,23,"(1000,)",False,"England's beloved Queen Mother grew up in this castle that's featured in ""Macbeth""",Glamis,0,3
4086,2002-05-13,2002 Million Dollar Masters final game 1.,Jeopardy,"(2, 5)",RECENT FILMS,15,"(1000,)",False,Jennifer Connelly won an Oscar for playing the wife of this man,(John) Nash,1,0
4086,2002-05-13,2002 Million Dollar Masters final game 1.,Jeopardy,"(3, 5)",TOUGH POTPOURRI,13,"(1000,)",False,She was the first African-American author to win a Pulitzer Prize; she won in 1950 for her poetry,Gwendolyn Brooks,1,0
4086,2002-05-13,2002 Million Dollar Masters final game 1.,Jeopardy,"(4, 5)",AUTHORS' NATIVE LANDS,8,"(1000,)",False,Deptford trilogist Robertson Davies,Canada,1,0
4086,2002-05-13,2002 Million Dollar Masters final game 1.,Jeopardy,"(5, 5)","""GRAND"" CENTRAL",19,"(1000,)",False,"Named for a Paris theater, it's drama that emphasizes the horrific or macabre",Grand Guignol,1,0
4086,2002-05-13,2002 Million Dollar Masters final game 1.,Jeopardy,"(6, 5)",STATION,30,"(1000,)",False,It's the Greek letter designation for the International Space Station,Alpha,0,3
4086,2002-05-13,2002 Million Dollar Masters final game 1.,Double Jeopardy,"(1, 1)",GENERAL SCIENCE,21,"(400,)",False,In 1931 2 Americans modified the Mercalli scale to measure the intensity of these in California,earthquakes,1,0
4086,2002-05-13,2002 Million Dollar Masters final game 1.,Double Jeopardy,"(2, 1)",BIG NAMES IN SPORTS,3,"(400,)",False,(Sarah of the Clue Crew reports from Bank One Ballpark in Phoenix.)  In 2001 the Diamondbacks were going for their first world championship; this team was going for its 27th,the Yankees,1,0
4086,2002-05-13,2002 Million Dollar Masters final game 1.,Double Jeopardy,"(3, 1)",BALLET,2,"(400,)",False,A sexually confused stable boy is the focus of this ballet based on Peter Shaffer's play of the same name,Equus,1,0
4086,2002-05-13,2002 Million Dollar Masters final game 1.,Double Jeopardy,"(4, 1)",ARCHITECTS,1,"(400,)",False,This Asian-born architect designed Boston's John Hancock Tower,I.M. Pei,1,0
4086,2002-05-13,2002 Million Dollar Masters final game 1.,Double Jeopardy,"(5, 1)",NEAR EAST ANCIENT HISTORY,30,"(400,)",False,"To be or knot to be, it was the capital of Phrygia",Gordion (or Gordium),0,3
4086,2002-05-13,2002 Million Dollar Masters final game 1.,Double Jeopardy,"(6, 1)",GRAMMAR SCHOOL,16,"(400,)",False,"Strunk & White's 5th rule of usage says, do not join independent clauses with this; use a semicolon, as we just did",a comma,1,0
4086,2002-05-13,2002 Million Dollar Masters final game 1.,Double Jeopardy,"(1, 2)",GENERAL SCIENCE,25,"(800,)",False,There were only 63 known elements when this Russian devised the periodic table,Mendeleev,1,0
4086,2002-05-13,2002 Million Dollar Masters final game 1.,Double Jeopardy,"(2, 2)",BIG NAMES IN SPORTS,6,"(800,)",False,"At Wimbledon 1969, aged 41, this Mexican-American saved 7 match points to beat Charlie Pasarell",Pancho Gonzales,1,0
4086,2002-05-13,2002 Million Dollar Masters final game 1.,Double Jeopardy,"(3, 2)",BALLET,5,"(800,)",False,The 1938 premiere of this ballet featured Lew Christensen in the role of Pat Garrett,Billy the Kid,1,0
4086,2002-05-13,2002 Million Dollar Masters final game 1.,Double Jeopardy,"(4, 2)",ARCHITECTS,4,"(800,)",False,"From his mother's surname, the ""Glass Skyscraper"" architect added van der Rohe to this name",Mies,1,0
4086,2002-05-13,2002 Million Dollar Masters final game 1.,Double Jeopardy,"(5, 2)",NEAR EAST ANCIENT HISTORY,29,"(800,)",False,"With the kingdom split, in 920 B.C. you had Rehoboam ruling Judah & Jeroboam ruling this",Israel,1,0
4086,2002-05-13,2002 Million Dollar Masters final game 1.,Double Jeopardy,"(6, 2)",GRAMMAR SCHOOL,17,"(800,)",False,"This 5-letter word means break down a sentence into subject, object & predicate, or describe a word's grammatical role",parse,1,0
4086,2002-05-13,2002 Million Dollar Masters final game 1.,Double Jeopardy,"(1, 3)",GENERAL SCIENCE,24,"(1200,)",False,The Earth's crust consists of about 46% oxygen; this element is second most abundant at about 28%,silicon,1,0
4086,2002-05-13,2002 Million Dollar Masters final game 1.,Double Jeopardy,"(2, 3)",BIG NAMES IN SPORTS,11,"(1200,)",False,His last-minute field goal won Super Bowl XXXVI for the Patriots,Adam Vinatieri,1,0
4086,2002-05-13,2002 Million Dollar Masters final game 1.,Double Jeopardy,"(3, 3)",BALLET,7,"(1200,)",False,"Von Rotbart is the evil, bird-like sorcerer in this classic 1877 ballet",Swan Lake,0,3
4086,2002-05-13,2002 Million Dollar Masters final game 1.,Double Jeopardy,"(4, 3)",ARCHITECTS,10,"(1200,)",False,"Frank Lloyd Wright was a pupil of this noted Chicago architect, whom Wright called his ""Lieber Meister""",(Louis) Sullivan,1,0
4086,2002-05-13,2002 Million Dollar Masters final game 1.,Double Jeopardy,"(5, 3)",NEAR EAST ANCIENT HISTORY,28,"(1000,)",True,"Dagon was the top god of these people, whose name has come to mean ""uncouth"" & ""unsophisticated""",the Philistines,1,0
4086,2002-05-13,2002 Million Dollar Masters final game 1.,Double Jeopardy,"(6, 3)",GRAMMAR SCHOOL,18,"(600,)",True,"Besides fancy-sounding, ""in lieu of salary"" is this type of grammatical phrase",a prepositional phrase,1,0
4086,2002-05-13,2002 Million Dollar Masters final game 1.,Double Jeopardy,"(1, 4)",GENERAL SCIENCE,23,"(1600,)",False,Mayonnaise is an example of this colloidal dispersion of liquid particles in another liquid,an emulsion,1,0
4086,2002-05-13,2002 Million Dollar Masters final game 1.,Double Jeopardy,"(2, 4)",BIG NAMES IN SPORTS,14,"(1600,)",False,"In 1986, with the Springfield Fame, she became the first woman to play in a men's pro basketball league",Nancy Lieberman,0,3
4086,2002-05-13,2002 Million Dollar Masters final game 1.,Double Jeopardy,"(3, 4)",BALLET,8,"(1600,)",False,"In 1911 this great dancer leapt into immortality with his magnificent exit leap in ""Le spectre de la rose""",Nijinsky,1,0
4086,2002-05-13,2002 Million Dollar Masters final game 1.,Double Jeopardy,"(4, 4)",ARCHITECTS,12,"(1600,)",False,"This American architect who turned 95 in 2001 is known for his ""Glass House"" of 1949",Philip Johnson,1,0
4086,2002-05-13,2002 Million Dollar Masters final game 1.,Double Jeopardy,"(5, 4)",NEAR EAST ANCIENT HISTORY,27,"(1600,)",False,"Scholars label Old Persian royal inscriptions X for Xerxes, C for Cyrus & D for him",Darius,1,0
4086,2002-05-13,2002 Million Dollar Masters final game 1.,Double Jeopardy,"(6, 4)",GRAMMAR SCHOOL,19,"(1600,)",False,"A helping group, like the ladies' one of the VFW, or a helping verb like will or may",an auxiliary,1,0
4086,2002-05-13,2002 Million Dollar Masters final game 1.,Double Jeopardy,"(1, 5)",GENERAL SCIENCE,22,"(2000,)",False,In 1896 this French scientist accidentally discovered radioactivity while researching fluorescence,Antoine Becquerel,0,3
4086,2002-05-13,2002 Million Dollar Masters final game 1.,Double Jeopardy,"(2, 5)",BIG NAMES IN SPORTS,15,"(2000,)",False,"NHL goalie nicknames include Nikolai Khabibulin's ""Bulin Wall"" & this Maple Leaf player's ""Cujo""",Curtis Joseph,1,0
4086,2002-05-13,2002 Million Dollar Masters final game 1.,Double Jeopardy,"(3, 5)",BALLET,9,"(2000,)",False,"This choreographer played one of the sailors when his ballet ""Fancy Free"" premiered in 1944",Jerome Robbins,1,0
4086,2002-05-13,2002 Million Dollar Masters final game 1.,Double Jeopardy,"(4, 5)",ARCHITECTS,13,"(2000,)",False,"Surveyor General of royal buildings, he designed & constructed London's Covent Garden in the early 1630s",Inigo Jones,1,0
4086,2002-05-13,2002 Million Dollar Masters final game 1.,Double Jeopardy,"(5, 5)",NEAR EAST ANCIENT HISTORY,26,"(2000,)",False,We know Carians were in Egypt from graffiti they carved into a big Ramses statue at this temple site,Abu Simbel,1,1
4086,2002-05-13,2002 Million Dollar Masters final game 1.,Double Jeopardy,"(6, 5)",GRAMMAR SCHOOL,20,"(2000,)",False,"The Spanish levantarse, ""to get up"", is this type of verb whose subject & object are identical",reflexive,1,0
4086,2002-05-13,2002 Million Dollar Masters final game 1.,Final Jeopardy,"(1, 1)",WORD HISTORIES,0,"(7600, 3600, 4000)",False,"In old philosophy this 12-letter word referred to a fifth substance, superior to earth, air, fire or water",quintessence,0,3
