epNum,airDate,extra_info,round_name,coord,category,order,value,daily_double,question,answer,correctAttempts,wrongAttempts
4161,2002-10-07,Mark Brown game 3.,Jeopardy,"(1, 1)",RIVERS,1,"(200,)",False,As a baby Moses was left in a basket along this river's banks,Nile,1,1
4161,2002-10-07,Mark Brown game 3.,Jeopardy,"(2, 1)",REMAKES,17,"(200,)",False,In 1957 a recreation of this ship made a recreation of its 17th century trip from England to Massachusetts,Mayflower,1,0
4161,2002-10-07,Mark Brown game 3.,Jeopardy,"(3, 1)",WORLD LEADERS,6,"(200,)",False,"On November 22, 2001 he personally sent his first e-mail, a message to Roman Catholics in Oceania",Pope John Paul II,1,0
4161,2002-10-07,Mark Brown game 3.,Jeopardy,"(4, 1)",TINY THINGS,16,"(200,)",False,These minute grains link the flowers & the bees,pollen,1,0
4161,2002-10-07,Mark Brown game 3.,Jeopardy,"(5, 1)",SEWING,26,"(200,)",False,When these are made by hand you cut the hole first; when machine-worked you cut them open after,buttonholes,1,0
4161,2002-10-07,Mark Brown game 3.,Jeopardy,"(6, 1)","""I"" OBJECT",11,"(200,)",False,An experienced Inuit can build one of these icy dwellings in under 2 hours,igloo,1,0
4161,2002-10-07,Mark Brown game 3.,Jeopardy,"(1, 2)",RIVERS,2,"(400,)",False,"80% of Washington, D.C.'s fresh drinking water comes from this river",Potomac,1,0
4161,2002-10-07,Mark Brown game 3.,Jeopardy,"(2, 2)",REMAKES,18,"(400,)",False,In 2000 Hasbro gave this dot-gobbling '80s arcade star a new 3-D look for a PC game,Pac-Man,1,0
4161,2002-10-07,Mark Brown game 3.,Jeopardy,"(3, 2)",WORLD LEADERS,7,"(400,)",False,In 1999 he was elected to his (Wow!) fourth 6-year term as president of Egypt,Hosni Mubarak,1,0
4161,2002-10-07,Mark Brown game 3.,Jeopardy,"(4, 2)",TINY THINGS,22,"(400,)",False,Mayonnaise is an example of an emulsion that is a suspension of tiny globules of this in water,oil,1,0
4161,2002-10-07,Mark Brown game 3.,Jeopardy,"(5, 2)",SEWING,27,"(400,)",False,"To shorten one of these, whipstitch across the teeth 8 or 10 times to form a new bottom stop, then cut below it",zipper,1,0
4161,2002-10-07,Mark Brown game 3.,Jeopardy,"(6, 2)","""I"" OBJECT",12,"(400,)",False,"(Cheryl of the Clue Crew reports)  While these were first patented in 1819, it wasn't until the 1990s that they really took off",inline skates,1,0
4161,2002-10-07,Mark Brown game 3.,Jeopardy,"(1, 3)",RIVERS,3,"(600,)",False,Stratford & Warwick are important towns upon this river,Avon,1,0
4161,2002-10-07,Mark Brown game 3.,Jeopardy,"(2, 3)",REMAKES,19,"(600,)",False,"Released in 2002, ""Today's New International Version"" is a non-gender specific translation of this",the Bible,1,0
4161,2002-10-07,Mark Brown game 3.,Jeopardy,"(3, 3)",WORLD LEADERS,8,"(600,)",False,Eduard Shevardnadze had this former Soviet republic on his mind when he was reelected president in 1995,Georgia,1,0
4161,2002-10-07,Mark Brown game 3.,Jeopardy,"(4, 3)",TINY THINGS,23,"(600,)",False,"Access time on hard drives isn't measured in minutes, but in these units abbreviated ms",milliseconds,1,0
4161,2002-10-07,Mark Brown game 3.,Jeopardy,"(5, 3)",SEWING,28,"(600,)",False,Simplicity provides a guide to show how these are laid out on the fabric for cutting,patterns,1,0
4161,2002-10-07,Mark Brown game 3.,Jeopardy,"(6, 3)","""I"" OBJECT",13,"(600,)",False,"You're on the money if you know that it's a bar or block of metal like aluminum, steel or gold",ingot,1,0
4161,2002-10-07,Mark Brown game 3.,Jeopardy,"(1, 4)",RIVERS,4,"(800,)",False,"Mainz, Germany & Basel, Switzerland both lie on this river",Rhine,1,0
4161,2002-10-07,Mark Brown game 3.,Jeopardy,"(2, 4)",REMAKES,20,"(1600,)",True,Neil Simon has recreated this 1965 play for the 21st century; he did it once before in 1986 for female stars,The Odd Couple,1,0
4161,2002-10-07,Mark Brown game 3.,Jeopardy,"(3, 4)",WORLD LEADERS,9,"(800,)",False,"After its president Fernando de la Rua resigned December 20, 2001, Adolfo Rodriguez Saa got the post & lasted a week",Argentina,1,0
4161,2002-10-07,Mark Brown game 3.,Jeopardy,"(4, 4)",TINY THINGS,24,"(800,)",False,"Present in minute amounts in soil & water, these ""elements"", such as copper & zinc, are essential for your good health",trace elements,0,3
4161,2002-10-07,Mark Brown game 3.,Jeopardy,"(5, 4)",SEWING,29,"(800,)",False,"Robin Hood's friendly friar, or a decorative touch that may be blind, space or pin",tuck,1,0
4161,2002-10-07,Mark Brown game 3.,Jeopardy,"(6, 4)","""I"" OBJECT",14,"(800,)",False,"Seen here, this model of Chevy first hit the road in 1958",Impala,1,0
4161,2002-10-07,Mark Brown game 3.,Jeopardy,"(1, 5)",RIVERS,5,"(1000,)",False,"During WWI 2 famous battles were fought near this river, the largest branch of the Seine",Marne,1,0
4161,2002-10-07,Mark Brown game 3.,Jeopardy,"(2, 5)",REMAKES,21,"(1000,)",False,A 1997 TV remake of this 1957 film featured Tony Danza as Juror No. 7,12 Angry Men,1,0
4161,2002-10-07,Mark Brown game 3.,Jeopardy,"(3, 5)",WORLD LEADERS,10,"(1000,)",False,"Dragon King, or as they say in Thimphu, druk gyalpo, Jigme Singye Wangchuck is its head of state",Bhutan,1,0
4161,2002-10-07,Mark Brown game 3.,Jeopardy,"(4, 5)",TINY THINGS,25,"(1000,)",False,"Those minute red blood cells are erythrocytes, white ones are leukocytes & these are thrombocytes",platelets,1,0
4161,2002-10-07,Mark Brown game 3.,Jeopardy,"(5, 5)",SEWING,30,"(1000,)",False,This fuzzy finish on the fabric should line up when the garment is sewn together,nap,1,0
4161,2002-10-07,Mark Brown game 3.,Jeopardy,"(6, 5)","""I"" OBJECT",15,"(1000,)",False,Prior to 1984 this pain reliever found in Motrin & Nuprin was sold by prescription only,ibuprofen,1,0
4161,2002-10-07,Mark Brown game 3.,Double Jeopardy,"(1, 1)",ANCIENT HISTORY,1,"(400,)",False,"In the First Punic War, Rome & Carthage fought over possession of this island at the tip of Italy's ""boot""",Sicily,1,0
4161,2002-10-07,Mark Brown game 3.,Double Jeopardy,"(2, 1)",TOUGH CHICKS,21,"(400,)",False,Yvonne Craig on TV & Alicia Silverstone on film played this hero,Batgirl,1,0
4161,2002-10-07,Mark Brown game 3.,Double Jeopardy,"(3, 1)",SCIENCE & TECHNOLOGY,6,"(400,)",False,"In 1843 the Great Britain became the first oceangoing steamship with the screw type of this, not a paddlewheel",propeller,1,0
4161,2002-10-07,Mark Brown game 3.,Double Jeopardy,"(4, 1)",PUERTO RICAN HOLIDAYS,11,"(400,)",False,"Jose Barbosa, who is honored on July 27, founded Puerto Rico's Republican Party on this patriotic American holiday",4th of July (Independence Day),1,0
4161,2002-10-07,Mark Brown game 3.,Double Jeopardy,"(5, 1)",PULITZER-WINNING PLAYWRIGHTS,12,"(400,)",False,"""Cat on a Hot Tin Roof""",Tennessee Williams,1,0
4161,2002-10-07,Mark Brown game 3.,Double Jeopardy,"(6, 1)",11-LETTER WORDS,26,"(400,)",False,"It's a work page containing a multicolumn analysis of related entries, such as in Microsoft Excel",spreadsheet,1,0
4161,2002-10-07,Mark Brown game 3.,Double Jeopardy,"(1, 2)",ANCIENT HISTORY,2,"(800,)",False,"The latter years of his reign were marked by building projects, including the temple of Abu Simbel",Rameses the Great,1,0
4161,2002-10-07,Mark Brown game 3.,Double Jeopardy,"(2, 2)",TOUGH CHICKS,22,"(800,)",False,This New Zealander hung up her chakram in 2001,Lucy Lawless,0,3
4161,2002-10-07,Mark Brown game 3.,Double Jeopardy,"(3, 2)",SCIENCE & TECHNOLOGY,7,"(800,)",False,"(Hi, this is Janet Kavandi aboard the space shuttle Atlantis)  Canada's proud contribution to the Int'l Space Station, the Robotic Manipulator System, is better known as this robotic body part",arm,1,0
4161,2002-10-07,Mark Brown game 3.,Double Jeopardy,"(4, 2)",PUERTO RICAN HOLIDAYS,17,"(800,)",False,"As elsewhere, it works out that this is the first Monday in September",Labor Day,1,0
4161,2002-10-07,Mark Brown game 3.,Double Jeopardy,"(5, 2)",PULITZER-WINNING PLAYWRIGHTS,13,"(800,)",False,"""Death of a Salesman""",Arthur Miller,1,0
4161,2002-10-07,Mark Brown game 3.,Double Jeopardy,"(6, 2)",11-LETTER WORDS,27,"(800,)",False,"A collector of rupees, pesos & drachmas",numismatist,0,3
4161,2002-10-07,Mark Brown game 3.,Double Jeopardy,"(1, 3)",ANCIENT HISTORY,3,"(1200,)",False,"Among this Babylonian king's laws was: ""If a son has struck his father, they shall cut off his hand""",Hammurabi,1,1
4161,2002-10-07,Mark Brown game 3.,Double Jeopardy,"(2, 3)",TOUGH CHICKS,23,"(1200,)",False,"As this hero, Lynda Carter was in her satin tights, fighting for her rights",Wonder Woman,1,0
4161,2002-10-07,Mark Brown game 3.,Double Jeopardy,"(3, 3)",SCIENCE & TECHNOLOGY,8,"(1200,)",False,"In 2000 news, an experiment appeared to accelerate a pulse of this to 300 times its already high speed",light,2,0
4161,2002-10-07,Mark Brown game 3.,Double Jeopardy,"(4, 3)",PUERTO RICAN HOLIDAYS,18,"(1200,)",False,"January 11 is the birthday of Eugenio Maria de Hostos, founder of the 1st ""Normal"" one of these in Santo Domingo",school,1,0
4161,2002-10-07,Mark Brown game 3.,Double Jeopardy,"(5, 3)",PULITZER-WINNING PLAYWRIGHTS,14,"(1200,)",False,"""Buried Child""",Sam Shepard,0,3
4161,2002-10-07,Mark Brown game 3.,Double Jeopardy,"(6, 3)",11-LETTER WORDS,28,"(1200,)",False,"In this operation, a surgeon repairs a blood vessel by inserting a balloon-tipped catheter to unblock it",angioplasty,0,3
4161,2002-10-07,Mark Brown game 3.,Double Jeopardy,"(1, 4)",ANCIENT HISTORY,4,"(1600,)",False,"Around 165 B.C., this Jewish leader re-entered Jerusalem & repurified & rededicated the Temple",Judah the Maccabee,0,3
4161,2002-10-07,Mark Brown game 3.,Double Jeopardy,"(2, 4)",TOUGH CHICKS,24,"(1600,)",False,She was played on TV by Diana Rigg & on film by Uma Thurman,Emma Peel,1,0
4161,2002-10-07,Mark Brown game 3.,Double Jeopardy,"(3, 4)",SCIENCE & TECHNOLOGY,9,"(1600,)",False,"Common in California, it's the type of ""farm"" seen here",wind farm,1,0
4161,2002-10-07,Mark Brown game 3.,Double Jeopardy,"(4, 4)",PUERTO RICAN HOLIDAYS,19,"(1600,)",False,"A royal-sounding January 6 holiday, or a 1999 George Clooney film",Three Kings Day,1,0
4161,2002-10-07,Mark Brown game 3.,Double Jeopardy,"(5, 4)",PULITZER-WINNING PLAYWRIGHTS,15,"(1600,)",False,"""The Time of Your Life""",William Saroyan,0,3
4161,2002-10-07,Mark Brown game 3.,Double Jeopardy,"(1, 5)",ANCIENT HISTORY,5,"(2000,)",False,In 391 he was ordained a priest in Hippo in northern Africa; he served as the bishop of Hippo from 396 to 430,Saint Augustine,1,0
4161,2002-10-07,Mark Brown game 3.,Double Jeopardy,"(2, 5)",TOUGH CHICKS,25,"(2000,)",False,"She was a kick as Yu Shu Lien in ""Crouching Tiger"" & Wai Lin in ""Tomorrow Never Dies""",Michelle Yeoh,1,2
4161,2002-10-07,Mark Brown game 3.,Double Jeopardy,"(3, 5)",SCIENCE & TECHNOLOGY,10,"(3000,)",True,"VLSI, very large-scale integrated circuits, would be impossible without CAD, this kind of design",computer aided design,1,0
4161,2002-10-07,Mark Brown game 3.,Double Jeopardy,"(4, 5)",PUERTO RICAN HOLIDAYS,20,"(2000,)",False,"Luis Munoz Rivera, who fought for Puerto Rico's autonomy from these 2 countries, has his own holiday",Spain & the United States,1,1
4161,2002-10-07,Mark Brown game 3.,Double Jeopardy,"(5, 5)",PULITZER-WINNING PLAYWRIGHTS,16,"(2000,)",False,"""Three Tall Women""",Edward Albee,0,3
4161,2002-10-07,Mark Brown game 3.,Final Jeopardy,"(1, 1)",MOVIE MUSIC,0,"(3200, 9600, 6200)",False,"The end credits for this 1998 film with Woody Allen feature the song ""High Hopes""",Antz,3,0
