epNum,airDate,extra_info,round_name,coord,category,order,value,daily_double,question,answer,correctAttempts,wrongAttempts
4214,2002-12-19,,Jeopardy,"(1, 1)","BOSTON ""T"" PARTY",19,"(200,)",False,"The state dog of Massachusetts is the ""Boston"" this",terrier,1,0
4214,2002-12-19,,Jeopardy,"(2, 1)",CLASSROOM FILMS,16,"(200,)",False,1989:Robin Williams inspires his prep school students to discover Whitman & Tennyson,Dead Poets Society,1,0
4214,2002-12-19,,Jeopardy,"(3, 1)",DAIRY PRODUCTS,1,"(200,)",False,"Cottage cheese comes in small, medium & large sizes of this dairy substance",curd,1,0
4214,2002-12-19,,Jeopardy,"(4, 1)",INNOVATORS,14,"(200,)",False,Fred Morrison came up with the idea for the Frisbee & sold it to this company in 1955,Wham-O,1,1
4214,2002-12-19,,Jeopardy,"(5, 1)",COLORFUL WORDS & PHRASES,2,"(200,)",False,It's a notice of dismissal from a job,pink slip,1,0
4214,2002-12-19,,Jeopardy,"(6, 1)",GOING THROUGH THE MOTIONS,8,"(200,)",False,"Each engine of a 747 generates over 43,000 pounds of this force",thrust,1,0
4214,2002-12-19,,Jeopardy,"(1, 2)","BOSTON ""T"" PARTY",20,"(400,)",False,"In a Boston-set sitcom, they were paired with ""a Girl & a Pizza Place""",Two Guys,1,0
4214,2002-12-19,,Jeopardy,"(2, 2)",CLASSROOM FILMS,18,"(400,)",False,1955: Idealistic Glenn Ford tries to reach troubled students like Sidney Poitier,Blackboard Jungle,1,1
4214,2002-12-19,,Jeopardy,"(3, 2)",DAIRY PRODUCTS,3,"(400,)",False,"Yogurt is made by curdling milk with purified cultures of these, like Streptococcus thermophilus",bacteria,1,1
4214,2002-12-19,,Jeopardy,"(4, 2)",INNOVATORS,15,"(400,)",False,The work of Marion Donovan (a mom) & Victor Mills (a grandpa) made these disposable,diapers,1,0
4214,2002-12-19,,Jeopardy,"(5, 2)",COLORFUL WORDS & PHRASES,4,"(400,)",False,"""Love Story"" author Erich Segal helped with the script for this Beatles film",Yellow Submarine,1,0
4214,2002-12-19,,Jeopardy,"(6, 2)",GOING THROUGH THE MOTIONS,9,"(400,)",False,"A strong motion accelerograph, a type of this device, records shaking too strong for sensitive ones",seismograph,1,0
4214,2002-12-19,,Jeopardy,"(1, 3)","BOSTON ""T"" PARTY",21,"(600,)",False,Boston's Freedom one begins near the frog pond in Boston Common,Freedom Trail,1,0
4214,2002-12-19,,Jeopardy,"(2, 3)",CLASSROOM FILMS,24,"(600,)",False,"1967:Idealistic Sidney Poitier teaches rough East Enders, earns respect & a song from Lulu","To Sir, with Love",1,0
4214,2002-12-19,,Jeopardy,"(3, 3)",DAIRY PRODUCTS,5,"(600,)",False,This process uses moderately high temperatures for a short time to kill microorganisms in milk,pasteurization,1,0
4214,2002-12-19,,Jeopardy,"(4, 3)",INNOVATORS,17,"(600,)",False,George Ballas invented the powered plant-cutting tool known by this alliterative name,Weed Whacker,1,1
4214,2002-12-19,,Jeopardy,"(5, 3)",COLORFUL WORDS & PHRASES,11,"(600,)",False,"Members of the U.S. Army special forces are also called this, from part of their uniform",Green Berets,1,0
4214,2002-12-19,,Jeopardy,"(6, 3)",GOING THROUGH THE MOTIONS,10,"(600,)",False,(Sarah of the Clue Crew at the Science Museum of Minnesota)  Movement of the ocean floor can cause these fearsome waves with a Japanese name,tsunamis,1,0
4214,2002-12-19,,Jeopardy,"(1, 4)","BOSTON ""T"" PARTY",22,"(800,)",False,"In the Boston area, U.S. Interstate 90 is also known as this type of road",turnpike,1,0
4214,2002-12-19,,Jeopardy,"(2, 4)",CLASSROOM FILMS,25,"(800,)",False,1987:Edward James Olmos' students from the East L.A. barrio pass the A.P. calculus exam & are accused of cheating,Stand and Deliver,1,0
4214,2002-12-19,,Jeopardy,"(3, 4)",DAIRY PRODUCTS,6,"(800,)",False,Ghee is a clarified form of this,butter,1,0
4214,2002-12-19,,Jeopardy,"(4, 4)",INNOVATORS,27,"(800,)",False,"Unaffected by magnetic fields, Elmer Sperry's gyroscopic type of this device even worked at the North Pole",compass,1,0
4214,2002-12-19,,Jeopardy,"(5, 4)",COLORFUL WORDS & PHRASES,12,"(800,)",False,"To go out & celebrate boisterously, particularly by hitting bars & other nightspots",to paint the town red,1,0
4214,2002-12-19,,Jeopardy,"(6, 4)",GOING THROUGH THE MOTIONS,29,"(800,)",False,"In a car, the reciprocating, or up-&-down, motion of these is changed to rotary motion in the wheels",pistons,1,0
4214,2002-12-19,,Jeopardy,"(1, 5)","BOSTON ""T"" PARTY",23,"(1000,)",False,"In a kids' book, this young Boston Johnny-on-the-spot becomes a messenger for the Sons of Liberty",Johnny Tremain,1,0
4214,2002-12-19,,Jeopardy,"(2, 5)",CLASSROOM FILMS,26,"(1000,)",False,1995:Marine vet Michelle Pfeiffer uses unorthodox methods to teach inner city kids,Dangerous Minds,1,0
4214,2002-12-19,,Jeopardy,"(3, 5)",DAIRY PRODUCTS,7,"(1000,)",False,A special lowfat milk has a reduced content of this milk sugar that is hard for some people to digest,lactose,1,0
4214,2002-12-19,,Jeopardy,"(4, 5)",INNOVATORS,28,"(1000,)",False,"Mr. Alter, who designed a type of catamaran or ""cat"", goes by this first name",Hobie,0,3
4214,2002-12-19,,Jeopardy,"(5, 5)",COLORFUL WORDS & PHRASES,13,"(1000,)",False,"Originally, it was a tribute paid by English & Scottish farmers to freebooters for protection from harassment",blackmail,0,3
4214,2002-12-19,,Jeopardy,"(6, 5)",GOING THROUGH THE MOTIONS,30,"(1500,)",True,"(Jimmy of the Clue Crew paddling a kayak)  From the Latin for ""to twist"", this causes a kayak to rotate in the opposite direction from the side of a stroke",torque,1,0
4214,2002-12-19,,Double Jeopardy,"(1, 1)",WORLD OF AUTHORS,6,"(400,)",False,"While he wrote a lot of poems, ""Doctor Zhivago"" was his only novel",Boris Pasternak,1,0
4214,2002-12-19,,Double Jeopardy,"(2, 1)",19th CENTURY BASEBALL,26,"(400,)",False,Ned Cuthbert is credited with inventing this larcenous move in the 1860s,base stealing,1,0
4214,2002-12-19,,Double Jeopardy,"(3, 1)",VICE PRESIDENTS,11,"(400,)",False,"William King, Pierce's VP, used to be the roommate of this bachelor president",James Buchanan,1,0
4214,2002-12-19,,Double Jeopardy,"(4, 1)",INTERNATIONAL AIRPORT CODES,15,"(400,)",False,"When you say BUD, you're referring to this Hungarian city's airport",Budapest,1,0
4214,2002-12-19,,Double Jeopardy,"(5, 1)",A NIGHT AT THE OPERA,21,"(400,)",False,"Act IV of this opera begins with Desdemona's ""Willow Song""",Otello,1,0
4214,2002-12-19,,Double Jeopardy,"(6, 1)",GOING THROUGH THE EMOTIONS,1,"(400,)",False,"Emotion that's a homophone of a word meaning ""Stop!"" to a horse",woe (Whoa!),1,0
4214,2002-12-19,,Double Jeopardy,"(1, 2)",WORLD OF AUTHORS,7,"(800,)",False,"After going ""Out of Africa"" for good in 1931, Isak Dinesen returned to this country",Denmark,1,1
4214,2002-12-19,,Double Jeopardy,"(2, 2)",19th CENTURY BASEBALL,27,"(800,)",False,"In 1860s baseball, the pitching distance was this many feet, about three-quarters of what it is now",45,0,3
4214,2002-12-19,,Double Jeopardy,"(3, 2)",VICE PRESIDENTS,12,"(800,)",False,"Henry Wilson, later Grant's VP, left the Whigs & the Know-Nothings because of their soft stands on this issue",slavery,1,0
4214,2002-12-19,,Double Jeopardy,"(4, 2)",INTERNATIONAL AIRPORT CODES,17,"(800,)",False,"Go away mad & you've left from this world capital's airport, code MAD",Madrid,1,0
4214,2002-12-19,,Double Jeopardy,"(5, 2)",A NIGHT AT THE OPERA,22,"(800,)",False,"He was only 24 when he composed ""The Pearl Fishers"", which was rediscovered after the success of his ""Carmen""",Georges Bizet,1,0
4214,2002-12-19,,Double Jeopardy,"(6, 2)",GOING THROUGH THE EMOTIONS,2,"(800,)",False,These feelings of distress or sorrow are also what you send to decline an invitation,regrets,1,0
4214,2002-12-19,,Double Jeopardy,"(1, 3)",WORLD OF AUTHORS,8,"(1200,)",False,"After writing ""J'accuse"", he was convicted of libel",Emile Zola,0,3
4214,2002-12-19,,Double Jeopardy,"(2, 3)",19th CENTURY BASEBALL,28,"(1200,)",False,"An 1887 rule counting these ""free passes"" as hits led to 20 guys batting .400",walks,0,3
4214,2002-12-19,,Double Jeopardy,"(3, 3)",VICE PRESIDENTS,13,"(1200,)",False,"Elbridge Gerry almost became president when this man got very sick in 1813, but wound up dying in office himself",James Madison,1,0
4214,2002-12-19,,Double Jeopardy,"(4, 3)",INTERNATIONAL AIRPORT CODES,18,"(1200,)",False,The luck of the Irish is with you if you know SNN is this city,Shannon,1,0
4214,2002-12-19,,Double Jeopardy,"(5, 3)",A NIGHT AT THE OPERA,23,"(1200,)",False,"It's the English translation of the title of Bellini's ""La Sonnambula""",The Sleepwalker,1,0
4214,2002-12-19,,Double Jeopardy,"(6, 3)",GOING THROUGH THE EMOTIONS,3,"(1200,)",False,"The adjective ""blithe"" is closely related to this word meaning ""ecstasy""",bliss,1,0
4214,2002-12-19,,Double Jeopardy,"(1, 4)",WORLD OF AUTHORS,9,"(1600,)",False,"A rat infestation takes its toll on a French town in this Algerian-born author's ""The Plague""",Albert Camus,1,0
4214,2002-12-19,,Double Jeopardy,"(3, 4)",VICE PRESIDENTS,14,"(1600,)",False,"Seen here, he served as vice president for just over 2 years",Nelson Rockefeller,1,0
4214,2002-12-19,,Double Jeopardy,"(4, 4)",INTERNATIONAL AIRPORT CODES,19,"(1600,)",False,"In Spanish aca means ""here"" & if you land at ACA, you'll be here",Acapulco,1,0
4214,2002-12-19,,Double Jeopardy,"(5, 4)",A NIGHT AT THE OPERA,24,"(1600,)",False,The first & second Knights of the Grail are roles in this 1882 Wagner opera,Parsifal,0,3
4214,2002-12-19,,Double Jeopardy,"(6, 4)",GOING THROUGH THE EMOTIONS,4,"(3000,)",True,"This feeling of awe & respect follows ""Your"" in a form of address for certain clergymen",reverence,0,1
4214,2002-12-19,,Double Jeopardy,"(1, 5)",WORLD OF AUTHORS,10,"(2000,)",False,"The main character in his 1947 novel ""Doktor Faustus"" is a German composer named Adrian Leverkuhn",Thomas Mann,0,3
4214,2002-12-19,,Double Jeopardy,"(3, 5)",VICE PRESIDENTS,16,"(2000,)",False,Garret Hobart was such a good VP that this president didn't replace him after he died in 1899,William McKinley,0,3
4214,2002-12-19,,Double Jeopardy,"(4, 5)",INTERNATIONAL AIRPORT CODES,20,"(3000,)",True,"Landing at WLG, this city's airport, will set you south of the equator","Wellington, New Zealand",0,1
4214,2002-12-19,,Double Jeopardy,"(5, 5)",A NIGHT AT THE OPERA,25,"(2000,)",False,"This Tchaikovsky opera was based on Pushkin's 1833 ""Novel in Verse""",Eugene Onegin,0,3
4214,2002-12-19,,Double Jeopardy,"(6, 5)",GOING THROUGH THE EMOTIONS,5,"(2000,)",False,"In a poem, Wordsworth was ""surprised by"" this emotion & ""impatient as the wind""",joy,1,0
4214,2002-12-19,,Final Jeopardy,"(1, 1)",TV & MUSIC,0,"(5200, 7500, 7000)",False,Scooby-Doo's name was inspired by a line in this 1966 song standard,"\""Strangers in the Night\""",1,2
