epNum,airDate,extra_info,round_name,coord,category,order,value,daily_double,question,answer,correctAttempts,wrongAttempts
4249,2003-02-06,2003 Teen Tournament quarterfinal game 4.,Jeopardy,"(1, 1)",BODIES OF WATER,2,"(200,)",False,"This river's system gathers its waters from 9 countries, including Kenya, Ethiopia & Egypt",Nile,1,0
4249,2003-02-06,2003 Teen Tournament quarterfinal game 4.,Jeopardy,"(2, 1)",NURSING,21,"(200,)",False,"Nurses should never use Wite-Out on this, the usual 5-letter word for a record of a patient's care",chart,0,3
4249,2003-02-06,2003 Teen Tournament quarterfinal game 4.,Jeopardy,"(3, 1)",CHOOSE YOUR WEAPON,9,"(200,)",False,An M1 Abrams is one of these vehicles with a moving turret that rides on caterpillar tracks,tank,1,0
4249,2003-02-06,2003 Teen Tournament quarterfinal game 4.,Jeopardy,"(4, 1)",ACTRESS/SINGER,1,"(200,)",False,"She's singing to more than ""parties of five"" now that she's a ""BareNaked"" lady",Jennifer Love Hewitt,1,0
4249,2003-02-06,2003 Teen Tournament quarterfinal game 4.,Jeopardy,"(5, 1)",ANDREW JOHNSON,16,"(200,)",False,"Andrew Johnson succeeded this man as president, having served as his vice president for only 6 weeks",Abraham Lincoln,1,0
4249,2003-02-06,2003 Teen Tournament quarterfinal game 4.,Jeopardy,"(6, 1)",MISSING VOWELS,26,"(200,)",False,"A fest-ive month:""CTBR""",October,1,0
4249,2003-02-06,2003 Teen Tournament quarterfinal game 4.,Jeopardy,"(1, 2)",BODIES OF WATER,4,"(400,)",False,It's the gulf from which the Gulf Stream got its name,Gulf of Mexico,0,3
4249,2003-02-06,2003 Teen Tournament quarterfinal game 4.,Jeopardy,"(2, 2)",NURSING,22,"(400,)",False,Tell a patient using this metal frame to advance it at intervals of around 6 inches -- & don't forget the tennis balls,walker,1,0
4249,2003-02-06,2003 Teen Tournament quarterfinal game 4.,Jeopardy,"(3, 2)",CHOOSE YOUR WEAPON,10,"(400,)",False,"The Gatling gun was the first practical one of these guns that fire a rapid, continuous stream of bullets",machine gun,1,0
4249,2003-02-06,2003 Teen Tournament quarterfinal game 4.,Jeopardy,"(4, 2)",ACTRESS/SINGER,3,"(400,)",False,"While she was on this Keri Russell series, Amy Jo Johnson, seen here, did a song for the soundtrack",Felicity,1,0
4249,2003-02-06,2003 Teen Tournament quarterfinal game 4.,Jeopardy,"(5, 2)",ANDREW JOHNSON,17,"(400,)",False,Johnson was the first president to whom the House of Representatives did this; the Senate acquitted him in May 1868,impeached,1,0
4249,2003-02-06,2003 Teen Tournament quarterfinal game 4.,Jeopardy,"(6, 2)",MISSING VOWELS,27,"(400,)",False,"Summerwear:""BKN""",bikini,1,0
4249,2003-02-06,2003 Teen Tournament quarterfinal game 4.,Jeopardy,"(1, 3)",BODIES OF WATER,5,"(600,)",False,This sacred river begins in an ice cave in India's Uttaranchal state,Ganges,1,0
4249,2003-02-06,2003 Teen Tournament quarterfinal game 4.,Jeopardy,"(2, 3)",NURSING,23,"(600,)",False,"3 of the 4 vital signs to be monitored, according to the ""Illustrated Manual of Nursing Practice""","(3 of) temperature, pulse, blood pressure & respiration",0,3
4249,2003-02-06,2003 Teen Tournament quarterfinal game 4.,Jeopardy,"(3, 3)",CHOOSE YOUR WEAPON,11,"(600,)",False,"Abbreviated SAM, it's a guided weapon meant to be fired from the ground (or from a ship)",surface-to-air missile,1,1
4249,2003-02-06,2003 Teen Tournament quarterfinal game 4.,Jeopardy,"(4, 3)",ACTRESS/SINGER,8,"(600,)",False,"""Bada Bing"" is a cut on her ""Here to Heaven"" CD",Jamie-Lynn Sigler,0,3
4249,2003-02-06,2003 Teen Tournament quarterfinal game 4.,Jeopardy,"(5, 3)",ANDREW JOHNSON,18,"(600,)",False,"With no formal education, Andrew didn't learn these 3 often-linked basic skills until he was a teenager","reading, writing & arithmetic",1,0
4249,2003-02-06,2003 Teen Tournament quarterfinal game 4.,Jeopardy,"(6, 3)",MISSING VOWELS,28,"(600,)",False,"A well-protected mammal:""RMDLL""",armadillo,1,0
4249,2003-02-06,2003 Teen Tournament quarterfinal game 4.,Jeopardy,"(1, 4)",BODIES OF WATER,6,"(1200,)",True,"It's the only ocean that touches the shores of Europe, Asia & North America",Arctic,1,0
4249,2003-02-06,2003 Teen Tournament quarterfinal game 4.,Jeopardy,"(2, 4)",NURSING,24,"(800,)",False,"The U.S. has about 7,200 nurse-these, helping women through pregnancy & delivery",nurse-midwives,0,3
4249,2003-02-06,2003 Teen Tournament quarterfinal game 4.,Jeopardy,"(3, 4)",CHOOSE YOUR WEAPON,12,"(800,)",False,"Also known as an arbalest, this weapon can use a cranking mechanism & a trigger to fire arrows farther",crossbow,0,3
4249,2003-02-06,2003 Teen Tournament quarterfinal game 4.,Jeopardy,"(4, 4)",ACTRESS/SINGER,14,"(800,)",False,This singer is also a south-of-the-border soap star,Paulina Rubio,0,3
4249,2003-02-06,2003 Teen Tournament quarterfinal game 4.,Jeopardy,"(5, 4)",ANDREW JOHNSON,19,"(800,)",False,"A senator from this state, Andrew Johnson was the only Southern senator who refused to secede with his state",Tennessee,1,0
4249,2003-02-06,2003 Teen Tournament quarterfinal game 4.,Jeopardy,"(6, 4)",MISSING VOWELS,29,"(800,)",False,"1 of the 50:""DH""",Idaho,0,3
4249,2003-02-06,2003 Teen Tournament quarterfinal game 4.,Jeopardy,"(1, 5)",BODIES OF WATER,7,"(1000,)",False,"Of the 5 Great Lakes, Lake Erie lies farthest south, this one farthest north",Lake Superior,1,0
4249,2003-02-06,2003 Teen Tournament quarterfinal game 4.,Jeopardy,"(2, 5)",NURSING,25,"(1000,)",False,Intermittent infusion is a common type of this procedure also called a drip,IV,1,0
4249,2003-02-06,2003 Teen Tournament quarterfinal game 4.,Jeopardy,"(3, 5)",CHOOSE YOUR WEAPON,13,"(1000,)",False,"""Putting Descartes before the horse"" is an example of one of these groan up witticisms",pun,0,3
4249,2003-02-06,2003 Teen Tournament quarterfinal game 4.,Jeopardy,"(4, 5)",ACTRESS/SINGER,15,"(1000,)",False,"In ""Lilo & Stitch"", she sang ""Aloha Oe""",Tia Carrere,0,3
4249,2003-02-06,2003 Teen Tournament quarterfinal game 4.,Jeopardy,"(5, 5)",ANDREW JOHNSON,20,"(1000,)",False,"Johnson's secretary of state, he negotiated the purchase of Alaska for a cool $7.2 million",William Seward,1,0
4249,2003-02-06,2003 Teen Tournament quarterfinal game 4.,Jeopardy,"(6, 5)",MISSING VOWELS,30,"(1000,)",False,"One of the elements:""DN""",iodine,0,3
4249,2003-02-06,2003 Teen Tournament quarterfinal game 4.,Double Jeopardy,"(1, 1)",EXPLORERS,10,"(400,)",False,"When this Spaniard reached the shore of the Pacific Ocean on September 29, 1513, he called it the South Sea",Vasco de Balboa,1,0
4249,2003-02-06,2003 Teen Tournament quarterfinal game 4.,Double Jeopardy,"(2, 1)",50 YEARS OF TV,4,"(400,)",False,"On Feb. 3, 2002 U2 had a TV audience of about 800 million when they performed at this event",Super Bowl XXXVI,1,0
4249,2003-02-06,2003 Teen Tournament quarterfinal game 4.,Double Jeopardy,"(3, 1)",PAINTERS,3,"(400,)",False,"Dieric Bouts, Tintoretto & da Vinci created paintings named this that featured Jesus & his 12 disciples","""The Last Supper""",1,0
4249,2003-02-06,2003 Teen Tournament quarterfinal game 4.,Double Jeopardy,"(4, 1)",TASTE TREATS?,18,"(400,)",False,"This 31-flavors chain introduced a ""Fear Factor"" sundae with gummy spiders instead of those pesky live ones",Baskin-Robbins,1,0
4249,2003-02-06,2003 Teen Tournament quarterfinal game 4.,Double Jeopardy,"(5, 1)",AUSTEN POWERS,1,"(400,)",False,"Of Jane Austen's 6 major works, it's the only one named for its heroine","""Emma""",1,0
4249,2003-02-06,2003 Teen Tournament quarterfinal game 4.,Double Jeopardy,"(6, 1)",JA!  BABY!,23,"(400,)",False,This greeting is Guten Morgen!,Good Morning!,1,0
4249,2003-02-06,2003 Teen Tournament quarterfinal game 4.,Double Jeopardy,"(1, 2)",EXPLORERS,11,"(800,)",False,"Bartolomeu Dias, the 1st to land at the Cape of Good Hope, outfitted this man's ships for his 1497-99 India trip",Vasco da Gama,1,1
4249,2003-02-06,2003 Teen Tournament quarterfinal game 4.,Double Jeopardy,"(2, 2)",50 YEARS OF TV,5,"(800,)",False,"In a 1990 show based on a Matthew Broderick movie, Jennifer Aniston played the sister of this teen scam artist",Ferris Bueller,0,3
4249,2003-02-06,2003 Teen Tournament quarterfinal game 4.,Double Jeopardy,"(3, 2)",PAINTERS,6,"(800,)",False,This 1889 Van Gogh work showing the evening sky was painted from memory in an asylum at Saint-Remy,Starry Night,1,1
4249,2003-02-06,2003 Teen Tournament quarterfinal game 4.,Double Jeopardy,"(4, 2)",TASTE TREATS?,19,"(800,)",False,"S.F.'s Butter Restaurant serves these pasta rings that come from a can, ""like your babysitter used to make""",SpaghettiO\'s,1,0
4249,2003-02-06,2003 Teen Tournament quarterfinal game 4.,Double Jeopardy,"(5, 2)",AUSTEN POWERS,2,"(800,)",False,It's the main reason why 19-year-old Anne Elliot's family won't let her marry Frederick Wentworth,he doesn\'t have enough money,1,1
4249,2003-02-06,2003 Teen Tournament quarterfinal game 4.,Double Jeopardy,"(6, 2)",JA!  BABY!,24,"(800,)",False,5 is funf & this number is funfzehn,15,1,0
4249,2003-02-06,2003 Teen Tournament quarterfinal game 4.,Double Jeopardy,"(1, 3)",EXPLORERS,12,"(3800,)",True,In November 1642 this Dutchman discovered the island now named for him south of Australia's mainland,Abel Tasman (Tasmania),1,0
4249,2003-02-06,2003 Teen Tournament quarterfinal game 4.,Double Jeopardy,"(2, 3)",50 YEARS OF TV,28,"(1200,)",False,"This hit '60s show featured an Ozarks family who moved to ""Californy"" with their oil money",The Beverly Hillbillies,1,0
4249,2003-02-06,2003 Teen Tournament quarterfinal game 4.,Double Jeopardy,"(3, 3)",PAINTERS,15,"(1200,)",False,(Sarah of the Clue Crew reports from Rome)  Michelangelo was in his 60s when he painted this 60' X 30' fresco over the Sistine Chapel altar,"""The Last Judgment""",0,3
4249,2003-02-06,2003 Teen Tournament quarterfinal game 4.,Double Jeopardy,"(4, 3)",TASTE TREATS?,20,"(1200,)",False,The Entomology Club at Iowa State Univ. put these chirping insects into Chocolate Chirpie Chip Cookies,crickets,1,0
4249,2003-02-06,2003 Teen Tournament quarterfinal game 4.,Double Jeopardy,"(5, 3)",AUSTEN POWERS,7,"(1200,)",False,"Jane lived out in the boonies, but visited London & this spa city where much of ""Persuasion"" is set",Bath,1,0
4249,2003-02-06,2003 Teen Tournament quarterfinal game 4.,Double Jeopardy,"(6, 3)",JA!  BABY!,25,"(1200,)",False,In German this country is Ungarn,Hungary,1,0
4249,2003-02-06,2003 Teen Tournament quarterfinal game 4.,Double Jeopardy,"(1, 4)",EXPLORERS,13,"(1600,)",False,In 1682 this Frenchman claimed the entire region drained by the Mississippi River for France & named it Louisiana,La Salle,1,0
4249,2003-02-06,2003 Teen Tournament quarterfinal game 4.,Double Jeopardy,"(2, 4)",50 YEARS OF TV,29,"(5000,)",True,The news channel known by these 5 letters began in 1996 with innovations like web links,MSNBC,1,0
4249,2003-02-06,2003 Teen Tournament quarterfinal game 4.,Double Jeopardy,"(3, 4)",PAINTERS,16,"(1600,)",False,Grant Wood's sister Nan & his dentist Byron McKeeby were the models for this 1930 painting,"""American Gothic""",1,0
4249,2003-02-06,2003 Teen Tournament quarterfinal game 4.,Double Jeopardy,"(4, 4)",TASTE TREATS?,21,"(1600,)",False,These snakelike fish are jellied & served with hot chili vinegar for a traditional east London snack,eels,1,0
4249,2003-02-06,2003 Teen Tournament quarterfinal game 4.,Double Jeopardy,"(5, 4)",AUSTEN POWERS,8,"(1600,)",False,"This Austen book about Elinor & Marianne Dashwood was initially called ""Elinor and Marianne""","""Sense and Sensibility""",1,0
4249,2003-02-06,2003 Teen Tournament quarterfinal game 4.,Double Jeopardy,"(6, 4)",JA!  BABY!,26,"(1600,)",False,"""Ich moechte koffeinfreien kaffee"" means ""I would like"" this type of coffee",decaffeinated coffee,0,3
4249,2003-02-06,2003 Teen Tournament quarterfinal game 4.,Double Jeopardy,"(1, 5)",EXPLORERS,14,"(2000,)",False,"In 1492, 18 years before becoming governor of Puerto Rico, he helped drive the Moors out of Granada in Spain",Ponce de Leon,0,3
4249,2003-02-06,2003 Teen Tournament quarterfinal game 4.,Double Jeopardy,"(2, 5)",50 YEARS OF TV,30,"(2000,)",False,"On the '50s show ""Father Knows Best"", Father called oldest girl Betty by this royal nickname","""Princess""",1,0
4249,2003-02-06,2003 Teen Tournament quarterfinal game 4.,Double Jeopardy,"(3, 5)",PAINTERS,17,"(2000,)",False,"Artist Edward Hicks, now known for ""The Peaceable Kingdom"", was famous in life as a preacher for this group",Quakers (Society of Friends),0,3
4249,2003-02-06,2003 Teen Tournament quarterfinal game 4.,Double Jeopardy,"(4, 5)",TASTE TREATS?,22,"(2000,)",False,Have all the wildebeest you can eat at the Carnivore Restaurant in this Kenyan capital,Nairobi,1,0
4249,2003-02-06,2003 Teen Tournament quarterfinal game 4.,Double Jeopardy,"(5, 5)",AUSTEN POWERS,9,"(2000,)",False,Catherine Morland goes to Northanger Abbey; Fanny Price goes to this title place,"""Mansfield Park""",1,0
4249,2003-02-06,2003 Teen Tournament quarterfinal game 4.,Double Jeopardy,"(6, 5)",JA!  BABY!,27,"(2000,)",False,"(Sofia of the Clue Crew reports)  In German, this diacritical mark [two dots over the ""O"" in Dorfchen] indicates a change in vowel sound",umlaut,1,0
4249,2003-02-06,2003 Teen Tournament quarterfinal game 4.,Final Jeopardy,"(1, 1)",HISTORIC AMERICAN PLACES,0,"(7000, 14000, 5000)",False,"Over 260,000 people have been buried here, starting in 1864",Arlington National Cemetery,3,0
