epNum,airDate,extra_info,round_name,coord,category,order,value,daily_double,question,answer,correctAttempts,wrongAttempts
4309,2003-05-01,2003 Celebrity Jeopardy! game 4.,Jeopardy,"(1, 1)",TV WORKPLACES,2,"(200,)",False,"Bart's dad, he works at the Springfield Nuclear Power Plant, sector 7G",Homer Simpson,0,3
4309,2003-05-01,2003 Celebrity Jeopardy! game 4.,Jeopardy,"(2, 1)",COOKIES,7,"(200,)",False,Debbi is the first name of this woman whose name is on over 700 cookie franchises,Mrs. Fields,1,1
4309,2003-05-01,2003 Celebrity Jeopardy! game 4.,Jeopardy,"(3, 1)",GOVERNMENT & POLITICS,1,"(200,)",False,This date is written at the top of the Declaration of Independence,"July 4, 1776",1,0
4309,2003-05-01,2003 Celebrity Jeopardy! game 4.,Jeopardy,"(4, 1)",HARD BALLS,24,"(200,)",False,"Though it's not really made out of it, the ball used in this sport is nicknamed a pigskin",football,1,0
4309,2003-05-01,2003 Celebrity Jeopardy! game 4.,Jeopardy,"(5, 1)",WISH YOU WERE HERE,12,"(200,)",False,The Köln-Düsseldorfer line seen here takes you up & down the Rhine in this country,Germany,1,0
4309,2003-05-01,2003 Celebrity Jeopardy! game 4.,Jeopardy,"(6, 1)",THAT'S SO CLICHE!,15,"(200,)",False,"I was so clumsy at the Chicago NBA Arena that I felt like one of these critters ""in a china shop""",a bull,1,0
4309,2003-05-01,2003 Celebrity Jeopardy! game 4.,Jeopardy,"(1, 2)",TV WORKPLACES,3,"(400,)",False,It's where you could get a pitcher full of beer from Sam or Woody or an earful from Carla,Cheers,1,0
4309,2003-05-01,2003 Celebrity Jeopardy! game 4.,Jeopardy,"(2, 2)",COOKIES,20,"(400,)",False,He's the cookie maker seen here,the Keebler Elf,1,0
4309,2003-05-01,2003 Celebrity Jeopardy! game 4.,Jeopardy,"(3, 2)",GOVERNMENT & POLITICS,4,"(400,)",False,"Of 1, 3 or 5, it's the fewest number of electoral votes a state can have",3,1,0
4309,2003-05-01,2003 Celebrity Jeopardy! game 4.,Jeopardy,"(4, 2)",HARD BALLS,25,"(400,)",False,You strike this ball to begin a game of pool,the cue ball,1,0
4309,2003-05-01,2003 Celebrity Jeopardy! game 4.,Jeopardy,"(5, 2)",WISH YOU WERE HERE,13,"(400,)",False,The votive candles seen here are in this Gothic church located on the Île de la Cité,Notre Dame,1,1
4309,2003-05-01,2003 Celebrity Jeopardy! game 4.,Jeopardy,"(6, 2)",THAT'S SO CLICHE!,16,"(400,)",False,"I warned the ostrich farmer, ""Don't keep all"" of these ""in one basket""",an egg,1,0
4309,2003-05-01,2003 Celebrity Jeopardy! game 4.,Jeopardy,"(1, 3)",TV WORKPLACES,9,"(600,)",False,The title character on this NBC drama works for the Massachusetts State Coroner's Office,Crossing Jordan,1,1
4309,2003-05-01,2003 Celebrity Jeopardy! game 4.,Jeopardy,"(2, 3)",COOKIES,21,"(600,)",False,A machine that is a funnel within a funnel fills this cake-like cookie with fig jam,a Fig Newton,1,0
4309,2003-05-01,2003 Celebrity Jeopardy! game 4.,Jeopardy,"(3, 3)",GOVERNMENT & POLITICS,5,"(600,)",False,In 1994 Bill Clinton appointed Stephen Breyer to this body,the Supreme Court,1,0
4309,2003-05-01,2003 Celebrity Jeopardy! game 4.,Jeopardy,"(4, 3)",HARD BALLS,26,"(1000,)",True,It's where astronaut Alan Shepard famously hit a golf ball in February 1971,the moon,1,0
4309,2003-05-01,2003 Celebrity Jeopardy! game 4.,Jeopardy,"(5, 3)",WISH YOU WERE HERE,14,"(600,)",False,"Children's tales like ""Pippi Longstocking"" come to life at Junibacken in this capital of Sweden",Stockholm,0,3
4309,2003-05-01,2003 Celebrity Jeopardy! game 4.,Jeopardy,"(6, 3)",THAT'S SO CLICHE!,17,"(600,)",False,"I told the private investigator that one of these ""is worth a thousand words""",a picture,1,0
4309,2003-05-01,2003 Celebrity Jeopardy! game 4.,Jeopardy,"(1, 4)",TV WORKPLACES,10,"(800,)",False,"This drama was set at the firm of McKenzie, Brackman, Chaney and Kuzak",L.A. Law,1,0
4309,2003-05-01,2003 Celebrity Jeopardy! game 4.,Jeopardy,"(2, 4)",COOKIES,22,"(800,)",False,"In 1921 ""sandwich"" was added to the name of this cookie that you can take apart to eat the icing first",an Oreo,1,0
4309,2003-05-01,2003 Celebrity Jeopardy! game 4.,Jeopardy,"(3, 4)",GOVERNMENT & POLITICS,6,"(800,)",False,"The preamble to the Constitution begins, ""We the People of the United States, in order to form a more perfect"" this",Union,1,0
4309,2003-05-01,2003 Celebrity Jeopardy! game 4.,Jeopardy,"(4, 4)",HARD BALLS,27,"(800,)",False,The only player on a soccer team who can touch a live ball with his hands,the goalie,1,0
4309,2003-05-01,2003 Celebrity Jeopardy! game 4.,Jeopardy,"(6, 4)",THAT'S SO CLICHE!,18,"(800,)",False,"To ensure good luck, I tell piano players to always ""keep"" these crossed",fingers,1,0
4309,2003-05-01,2003 Celebrity Jeopardy! game 4.,Jeopardy,"(1, 5)",TV WORKPLACES,11,"(1000,)",False,"Restaurant where Alice, Vera & ""Kiss My Grits"" Flo waited tables",Mel\'s Diner,1,0
4309,2003-05-01,2003 Celebrity Jeopardy! game 4.,Jeopardy,"(2, 5)",COOKIES,23,"(1000,)",False,Founder Margaret Rudkin named this brand for a property her family owned in Connecticut,Pepperidge Farm,0,3
4309,2003-05-01,2003 Celebrity Jeopardy! game 4.,Jeopardy,"(3, 5)",GOVERNMENT & POLITICS,8,"(1000,)",False,"As minority leader of the House, this San Franciscan is the highest-ranking woman in the history of the U.S. Congress",Nancy Pelosi,1,0
4309,2003-05-01,2003 Celebrity Jeopardy! game 4.,Jeopardy,"(6, 5)",THAT'S SO CLICHE!,19,"(1000,)",False,"At the boring seance, I observed that this ""is willing, but the flesh is weak""",the spirit,1,0
4309,2003-05-01,2003 Celebrity Jeopardy! game 4.,Double Jeopardy,"(1, 1)",HISTORIC MOMENTS,4,"(400,)",False,"In a painting by his friend John Trumbull, he's seen here resigning his commission in 1783",George Washington,1,0
4309,2003-05-01,2003 Celebrity Jeopardy! game 4.,Double Jeopardy,"(2, 1)",ER TALK,1,"(400,)",False,"If a patient has suffered cardiac arrest, this color ""code"" should be called",blue,1,1
4309,2003-05-01,2003 Celebrity Jeopardy! game 4.,Double Jeopardy,"(3, 1)",GILMORE GIRLS & BOYS,8,"(400,)",False,This L.A. landmark opened in 1934 on land owned by the Gilmore family with 18 vendors selling fresh produce,the Farmer\'s Market,1,0
4309,2003-05-01,2003 Celebrity Jeopardy! game 4.,Double Jeopardy,"(4, 1)",YOU SHOULD BE IN AN OPERA!,16,"(400,)",False,"Good news: your agent booked you for the opera ""Hansel and Gretel""; bad news: you're playing this villainess",the witch,1,0
4309,2003-05-01,2003 Celebrity Jeopardy! game 4.,Double Jeopardy,"(5, 1)",HOLIDAYS & OBSERVANCES,10,"(400,)",False,This symbol of Halloween may have originated in Medieval Scotland & was originally carved from a large turnip,a jack-o\'-lantern,1,1
4309,2003-05-01,2003 Celebrity Jeopardy! game 4.,Double Jeopardy,"(6, 1)","ANIMAL, VEGETABLE OR MINERAL",17,"(400,)",False,Amethyst,mineral,1,0
4309,2003-05-01,2003 Celebrity Jeopardy! game 4.,Double Jeopardy,"(1, 2)",HISTORIC MOMENTS,5,"(800,)",False,"On March 30, 1865 General Fitzhugh Lee was enjoying a shad bake & missed the Battle of Five Forks in this war",the Civil War,1,0
4309,2003-05-01,2003 Celebrity Jeopardy! game 4.,Double Jeopardy,"(2, 2)",ER TALK,2,"(800,)",False,This 4-letter term means ASAP!  Immediately!,stat,1,0
4309,2003-05-01,2003 Celebrity Jeopardy! game 4.,Double Jeopardy,"(3, 2)",GILMORE GIRLS & BOYS,9,"(800,)",False,"Poet Dame Mary Gilmore fought for women's rights & the rights of the aborigines in this, her home country",Australia,1,0
4309,2003-05-01,2003 Celebrity Jeopardy! game 4.,Double Jeopardy,"(4, 2)",YOU SHOULD BE IN AN OPERA!,22,"(800,)",False,"Placido Domingo, Jose Carreras & this Italian called; they're doing a ""Four Tenors"" tour, & you're number four!!!!",Luciano Pavarotti,1,1
4309,2003-05-01,2003 Celebrity Jeopardy! game 4.,Double Jeopardy,"(5, 2)",HOLIDAYS & OBSERVANCES,11,"(800,)",False,"On June 28, 1894 President Grover Cleveland signed an act making the first Monday in September this holiday",Labor Day,1,0
4309,2003-05-01,2003 Celebrity Jeopardy! game 4.,Double Jeopardy,"(6, 2)","ANIMAL, VEGETABLE OR MINERAL",18,"(800,)",False,Semolina,vegetable,1,0
4309,2003-05-01,2003 Celebrity Jeopardy! game 4.,Double Jeopardy,"(1, 3)",HISTORIC MOMENTS,6,"(1200,)",False,He's seen here standing up for democracy in August 1991,Boris Yeltsin,1,0
4309,2003-05-01,2003 Celebrity Jeopardy! game 4.,Double Jeopardy,"(2, 3)",ER TALK,3,"(1200,)",False,"Give the patient 250 c.c.s of normal saline, c.c. standing for this",cubic centimeter,1,1
4309,2003-05-01,2003 Celebrity Jeopardy! game 4.,Double Jeopardy,"(3, 3)",GILMORE GIRLS & BOYS,25,"(1200,)",False,"Major League Baseball's top award to pitchers is named for this man who was born in Gilmore, Ohio in 1867",Cy Young,1,0
4309,2003-05-01,2003 Celebrity Jeopardy! game 4.,Double Jeopardy,"(4, 3)",YOU SHOULD BE IN AN OPERA!,23,"(1200,)",False,You're such a diva that folks compare you to this Greek soprano who was born in NYC in 1923,Maria Callas,1,0
4309,2003-05-01,2003 Celebrity Jeopardy! game 4.,Double Jeopardy,"(5, 3)",HOLIDAYS & OBSERVANCES,12,"(1000,)",True,"National Humor Month begins on this date, often with a joke-telling contest",April Fool\'s Day,0,1
4309,2003-05-01,2003 Celebrity Jeopardy! game 4.,Double Jeopardy,"(6, 3)","ANIMAL, VEGETABLE OR MINERAL",19,"(1200,)",False,Silica,mineral,1,0
4309,2003-05-01,2003 Celebrity Jeopardy! game 4.,Double Jeopardy,"(1, 4)",HISTORIC MOMENTS,7,"(1600,)",False,Toledo's El Transito changed from synagogue to church after Jews were expelled from this country in 1492,Spain,1,0
4309,2003-05-01,2003 Celebrity Jeopardy! game 4.,Double Jeopardy,"(2, 4)",ER TALK,28,"(1600,)",False,"You'll need follow-up rehab with a P.T., this professional",a physical therapist,1,0
4309,2003-05-01,2003 Celebrity Jeopardy! game 4.,Double Jeopardy,"(3, 4)",GILMORE GIRLS & BOYS,26,"(1600,)",False,The 1980 Pulitzer Prize for Fiction went to Norman Mailer for a book on this convicted murderer,Gary Gilmore,1,0
4309,2003-05-01,2003 Celebrity Jeopardy! game 4.,Double Jeopardy,"(4, 4)",YOU SHOULD BE IN AN OPERA!,24,"(1000,)",True,"Casting call for ""Anna Bolena""!  You'll need to sing bass (& gain 200 pounds) to play this hefty English king",Henry VIII,1,0
4309,2003-05-01,2003 Celebrity Jeopardy! game 4.,Double Jeopardy,"(5, 4)",HOLIDAYS & OBSERVANCES,13,"(1600,)",False,"The folk song ""Sivivon, Sov, Sov, Sov"" or ""Dreidel, Spin, Spin, Spin"", is traditionally sung during this Jewish holiday",Hanukkah,1,0
4309,2003-05-01,2003 Celebrity Jeopardy! game 4.,Double Jeopardy,"(6, 4)","ANIMAL, VEGETABLE OR MINERAL",20,"(1600,)",False,Ibex,animal,1,0
4309,2003-05-01,2003 Celebrity Jeopardy! game 4.,Double Jeopardy,"(1, 5)",HISTORIC MOMENTS,15,"(2000,)",False,"(Jimmy of the Clue Crew strolls the shores of Waimea Bay, Kauai.)  When this man arrived here on Kauai in the late 1770s, he was welcomed as the harvest god Lono",Captain Cook,1,0
4309,2003-05-01,2003 Celebrity Jeopardy! game 4.,Double Jeopardy,"(2, 5)",ER TALK,29,"(2000,)",False,"Know your ABCs: check this (the ""A""), breathing & circulation",airway,1,0
4309,2003-05-01,2003 Celebrity Jeopardy! game 4.,Double Jeopardy,"(3, 5)",GILMORE GIRLS & BOYS,27,"(2000,)",False,"Patrick Gilmore organized an 1869 concert that had 100 firemen on this ""instrument"" that's in the title of the following",the anvil,0,3
4309,2003-05-01,2003 Celebrity Jeopardy! game 4.,Double Jeopardy,"(4, 5)",YOU SHOULD BE IN AN OPERA!,30,"(2000,)",False,"Your performance as Loris in ""Fedora"" will make everyone forget this great tenor who originated the role in 1898",Caruso,1,0
4309,2003-05-01,2003 Celebrity Jeopardy! game 4.,Double Jeopardy,"(5, 5)",HOLIDAYS & OBSERVANCES,14,"(2000,)",False,Canada's version of this holiday is the 2nd Monday in October; the U.S. usually celebrates it 46 days later,Thanksgiving,1,0
4309,2003-05-01,2003 Celebrity Jeopardy! game 4.,Double Jeopardy,"(6, 5)","ANIMAL, VEGETABLE OR MINERAL",21,"(2000,)",False,Kale,vegetable,1,0
4309,2003-05-01,2003 Celebrity Jeopardy! game 4.,Final Jeopardy,"(1, 1)",GOVERNMENT AGENCIES,0,"(11100, 13000, 16200)",False,In 2000 Emma Peel's leather pants & Maxwell Smart's shoe phone were on display at this agency that's not open to the public,the CIA,2,1
