epNum,airDate,extra_info,round_name,coord,category,order,value,daily_double,question,answer,correctAttempts,wrongAttempts
4507,2004-03-23,,Jeopardy,"(1, 1)",WHO'S AFRAID OF,16,"(200,)",False,"Whether it passes too slowly or too quickly, chronophobia is a fear of this",time,1,0
4507,2004-03-23,,Jeopardy,"(2, 1)",VIRGINIA WOOLF,1,"(200,)",False,"Woolf was active in this cause which she wrote ""roused in man an extraordinary desire for self-assertion""",women\'s suffrage,1,1
4507,2004-03-23,,Jeopardy,"(3, 1)",GIANT,2,"(200,)",False,The giant ones of these mammals live in the bamboo forests of China,pandas,1,0
4507,2004-03-23,,Jeopardy,"(4, 1)","SUDDENLY, LAST SUMMER",26,"(200,)",False,Home field advantage in baseball's fall classic was decided in midsummer by this event,the All-Star Game,1,0
4507,2004-03-23,,Jeopardy,"(5, 1)","NATIONAL ""VELVET""",12,"(200,)",False,Bobby Vinton revived this Tony Bennett song & took it to No. 1 in 1963,Blue Velvet,1,0
4507,2004-03-23,,Jeopardy,"(6, 1)",ELIZABETH TAYLOR,8,"(200,)",False,"When asked what she wanted on her tombstone, she replied, ""Here lies Elizabeth.  She hated to be called"" this",Liz,1,0
4507,2004-03-23,,Jeopardy,"(1, 2)",WHO'S AFRAID OF,17,"(400,)",False,It's the opposite of agoraphobia,claustrophobia,1,0
4507,2004-03-23,,Jeopardy,"(2, 2)",VIRGINIA WOOLF,3,"(400,)",False,This gathering of artsy types that flourished between 1907 & 1930 sometimes met at Virginia's house,the Bloomsbury Group,1,1
4507,2004-03-23,,Jeopardy,"(3, 2)",GIANT,6,"(400,)",False,"Completes Neil Armstrong's July 20,1969 statement ""That's one small step for man...""",one giant leap for mankind,1,2
4507,2004-03-23,,Jeopardy,"(4, 2)","SUDDENLY, LAST SUMMER",27,"(400,)",False,"In France this weather event killed 5,000 & the director-general of health quit",a heat wave,1,0
4507,2004-03-23,,Jeopardy,"(5, 2)","NATIONAL ""VELVET""",13,"(400,)",False,"""Dark"" mixed drink of stout beer & champagne",Black Velvet,0,3
4507,2004-03-23,,Jeopardy,"(6, 2)",ELIZABETH TAYLOR,9,"(400,)",False,This man married her in Montreal & then again in Botswana,Richard Burton,1,0
4507,2004-03-23,,Jeopardy,"(1, 3)",WHO'S AFRAID OF,18,"(600,)",False,Erica Jong might know that aviophobia is this,fear of flying,1,0
4507,2004-03-23,,Jeopardy,"(2, 3)",VIRGINIA WOOLF,4,"(600,)",False,"A 1931 novel ends with the line: these, also the novel's title, ""Broke on the Shore""",Waves,0,3
4507,2004-03-23,,Jeopardy,"(3, 3)",GIANT,23,"(600,)",False,Giant tortoises & marine iguanas were featured in an IMAX film about these islands that Darwin visited in 1835,the Galapagos Islands,1,0
4507,2004-03-23,,Jeopardy,"(4, 3)","SUDDENLY, LAST SUMMER",28,"(600,)",False,"The Columbia accident investigation board reported, ""The breach was initiated by a piece of"" this",foam/insulation,1,0
4507,2004-03-23,,Jeopardy,"(5, 3)","NATIONAL ""VELVET""",14,"(600,)",False,"Holy Roman emperor Charles V spoke of power as ""An iron hand in"" one of these",a velvet glove,1,0
4507,2004-03-23,,Jeopardy,"(6, 3)",ELIZABETH TAYLOR,10,"(600,)",False,"Elizabeth Taylor was the first star to earn a million dollars for a film, for this 1963 title role",Cleopatra,1,0
4507,2004-03-23,,Jeopardy,"(1, 4)",WHO'S AFRAID OF,19,"(800,)",False,"For someone with eosophobia, ""it is always darkest"" at this point of the day",dawn,0,3
4507,2004-03-23,,Jeopardy,"(2, 4)",VIRGINIA WOOLF,5,"(800,)",False,"This event claims the life of the title character of ""Jacob's Room"", as it did of millions of real-life young men",World War I,1,0
4507,2004-03-23,,Jeopardy,"(3, 4)",GIANT,24,"(800,)",False,"The giant type of this seaweed, a form of leafy brown algae, can be 200 feet long",kelp,1,0
4507,2004-03-23,,Jeopardy,"(4, 4)","SUDDENLY, LAST SUMMER",29,"(800,)",False,A Frankfurt newspaper broke the story that this American hero had fathered 3 kids with a German hatmaker,(Charles) Lindbergh,1,0
4507,2004-03-23,,Jeopardy,"(5, 4)","NATIONAL ""VELVET""",21,"(800,)",False,"Classic songs by this '60s band include ""Venus in Furs"" & ""All Tomorrow's Parties""",The Velvet Underground,1,0
4507,2004-03-23,,Jeopardy,"(6, 4)",ELIZABETH TAYLOR,11,"(800,)",False,"On January 15, 2001 this man who has been married 7 times interviewed Ms. Taylor on TV",Larry King,1,0
4507,2004-03-23,,Jeopardy,"(1, 5)",WHO'S AFRAID OF,20,"(600,)",True,"""Autophobia"" could be the alternative title for Reba McEntire's hit ""The Fear of Being"" this",Alone,0,1
4507,2004-03-23,,Jeopardy,"(2, 5)",VIRGINIA WOOLF,7,"(1000,)",False,First name of Virginia's husband; he survived her by 28 years,Leonard,0,3
4507,2004-03-23,,Jeopardy,"(3, 5)",GIANT,25,"(1000,)",False,"In Greek mythology, this group of primeval gigantic beings includes Cronus & Rhea",the Titans,0,3
4507,2004-03-23,,Jeopardy,"(4, 5)","SUDDENLY, LAST SUMMER",30,"(1000,)",False,Fox News tried to sue Al Franken for using this 3-word phrase in the subtitle of a book,fair and balanced,1,0
4507,2004-03-23,,Jeopardy,"(5, 5)","NATIONAL ""VELVET""",22,"(1000,)",False,1989 Czechoslovakian uprising that led to democratic elections,"the ""Velvet Revolution""",1,0
4507,2004-03-23,,Jeopardy,"(6, 5)",ELIZABETH TAYLOR,15,"(1000,)",False,"On New Year's Eve 1999, Queen Elizabeth awarded her this title",Dame,1,0
4507,2004-03-23,,Double Jeopardy,"(1, 1)",ART & ARTISTS,2,"(400,)",False,This 4th century B.C. conqueror was said to let no one but the sculptor Lysippus do his portrait,Alexander (the Great),1,0
4507,2004-03-23,,Double Jeopardy,"(2, 1)",SPORTSMEN,1,"(400,)",False,"(Cheryl of the Clue Crew at Gleason's Gym in Brooklyn, N.Y.)  Among Gleason's trainees, Marvin Hagler was ""Marvelous"" & Joe Frazier had this ""hot"" nickname","""Smokin\' Joe""",1,0
4507,2004-03-23,,Double Jeopardy,"(3, 1)",TORONTO'S CN TOWER,16,"(400,)",False,"Between 1978 & 1994, an amazing 460 of these struck the CN Tower",lightning bolts,1,0
4507,2004-03-23,,Double Jeopardy,"(4, 1)",FRUITS IN FRENCH,27,"(400,)",False,Pomme,apple,1,0
4507,2004-03-23,,Double Jeopardy,"(5, 1)",NANA,7,"(400,)",False,In 1885 Nana & this other Apache leader broke out of the San Carlos Reservation; they were caught & sent to Florida,Geronimo,1,0
4507,2004-03-23,,Double Jeopardy,"(6, 1)",RAY,8,"(400,)",False,"Known for its barbed tail, it also lent its name to a Corvette",Stingray,1,0
4507,2004-03-23,,Double Jeopardy,"(1, 2)",ART & ARTISTS,5,"(800,)",False,6-letter title of the John Singer Sargent WWI painting seen here in detail; it's what happened to the men,"(they were) ""Gassed""",0,3
4507,2004-03-23,,Double Jeopardy,"(2, 2)",SPORTSMEN,3,"(2000,)",True,On the undercard in game 3 of the 2003 Red Sox-Yankees playoff was Don Zimmer vs. this pitcher,(Pedro) Martinez,1,0
4507,2004-03-23,,Double Jeopardy,"(3, 2)",TORONTO'S CN TOWER,17,"(800,)",False,"It's the numerical name of the CN Tower's revolving restaurant, & the incredible view it provides",360,1,0
4507,2004-03-23,,Double Jeopardy,"(4, 2)",FRUITS IN FRENCH,28,"(800,)",False,Raisin,grape,1,0
4507,2004-03-23,,Double Jeopardy,"(5, 2)",NANA,22,"(800,)",False,Sir James Barrie chose noted animal impersonator Arthur Lupino to play Nana in this play's 1904 opening,Peter Pan,1,0
4507,2004-03-23,,Double Jeopardy,"(6, 2)",RAY,11,"(800,)",False,"Being flat, rays spend much of their time here & some are colored to match it",the sea bottom,1,0
4507,2004-03-23,,Double Jeopardy,"(1, 3)",ART & ARTISTS,6,"(1000,)",True,This single-named Renaissance artist who died in 1520 was regarded in the 19th century as the greatest painter ever,Raphael,0,1
4507,2004-03-23,,Double Jeopardy,"(2, 3)",SPORTSMEN,4,"(1200,)",False,"(Sofia of the Clue Crew in Redondo Beach, California)  George Freeth, the man who brought surfing to California, was born in this present-day state capital in 1883",Honolulu,1,0
4507,2004-03-23,,Double Jeopardy,"(3, 3)",TORONTO'S CN TOWER,18,"(1200,)",False,"The horizontal bands are called ""Friday lines"" because they mark where the pouring of this was stopped each week",concrete,1,0
4507,2004-03-23,,Double Jeopardy,"(4, 3)",FRUITS IN FRENCH,26,"(1200,)",False,Citron,lemon/lime,1,0
4507,2004-03-23,,Double Jeopardy,"(5, 3)",NANA,23,"(1200,)",False,"At the end of this ""Star Trek"" series Kira, played by Nana Visitor, was in charge of the station",Deep Space Nine,0,3
4507,2004-03-23,,Double Jeopardy,"(6, 3)",RAY,12,"(1200,)",False,"Like a shark, a ray doesn't have bones; it has a skeleton made out of this",cartilage,1,0
4507,2004-03-23,,Double Jeopardy,"(1, 4)",ART & ARTISTS,13,"(1600,)",False,"For 37 years, 1623 to 1660, he painted Philip IV of Spain & his family, court & jesters",(Diego) Velázquez,1,1
4507,2004-03-23,,Double Jeopardy,"(2, 4)",SPORTSMEN,9,"(1600,)",False,"In January 2004 this South African golfer known as the ""Big Easy"" won the Sony Open for the second year in a row",Ernie Els,1,0
4507,2004-03-23,,Double Jeopardy,"(3, 4)",TORONTO'S CN TOWER,19,"(1600,)",False,"The world's tallest self-supporting structure at 1,815 feet, the CN Tower was built by this railway company",Canadian National,1,0
4507,2004-03-23,,Double Jeopardy,"(4, 4)",FRUITS IN FRENCH,29,"(1600,)",False,Poire,pear,1,0
4507,2004-03-23,,Double Jeopardy,"(5, 4)",NANA,24,"(1600,)",False,"Puu Nana is a peak on this island, home to Hawaii's leprosy treatment center",Molokai,1,0
4507,2004-03-23,,Double Jeopardy,"(6, 4)",RAY,14,"(1600,)",False,"These rays of the genus Raja produce eggs instead of live young, hopefully not on thin ice",skate,1,0
4507,2004-03-23,,Double Jeopardy,"(1, 5)",ART & ARTISTS,20,"(2000,)",False,"Elaine de Kooning, Willem's painter wife, wrote ""The Spirit of"" this 2-word art movement of the 1940s & '50s",Abstract Expressionism,0,3
4507,2004-03-23,,Double Jeopardy,"(2, 5)",SPORTSMEN,10,"(2000,)",False,"8 days older than Wayne Gretzky, this Edmonton teammate of Gretzky's was playing with the Rangers in 2004",Mark Messier,1,0
4507,2004-03-23,,Double Jeopardy,"(3, 5)",TORONTO'S CN TOWER,21,"(2000,)",False,In 1995 the American Society of Civil Engineers designated the CN Tower as one member of this numerical group,one of the 7 Wonders of the Modern World,1,0
4507,2004-03-23,,Double Jeopardy,"(4, 5)",FRUITS IN FRENCH,30,"(2000,)",False,Cerise,cherry,1,0
4507,2004-03-23,,Double Jeopardy,"(5, 5)",NANA,25,"(2000,)",False,"Britannica notes that this French author's 1880 work ""Nana"" is known as ""Nana"" in its English translation",(Emile) Zola,1,0
4507,2004-03-23,,Double Jeopardy,"(6, 5)",RAY,15,"(2000,)",False,"This ray was used by ancient Romans to treat gout & headaches (What's Latin for ""Clear!""?)",the electric ray,0,3
4507,2004-03-23,,Final Jeopardy,"(1, 1)",POSTAGE STAMPS,0,"(2200, 1800, 5401)",False,"""Oh, The Places He'll Go!"" was USA Today's headline announcing the 2004 stamp honoring this artist & author",Dr. Seuss,3,0
