epNum,airDate,extra_info,round_name,coord,category,order,value,daily_double,question,answer,correctAttempts,wrongAttempts
4508,2004-03-24,,Jeopardy,"(1, 1)",FAMOUS AMERICANS,6,"(200,)",False,This man for whom a large city is named became governor of Tennessee in 1827 & governor of Texas in 1859,Sam Houston,1,1
4508,2004-03-24,,Jeopardy,"(2, 1)",BIBLE MOVIES,11,"(200,)",False,"Vitagraph's 1909 ""Life of"" this Biblical hero included a $10,000 scene of the parting of the Red Sea",Moses,1,0
4508,2004-03-24,,Jeopardy,"(3, 1)",SCANDALOUS STORY HEADLINES,1,"(200,)",False,"""Police Arrest"" this egg boy ""After Drunken 'Jackass' Copycat Falling-Off-Wall Stunt!""",Humpty Dumpty,1,0
4508,2004-03-24,,Jeopardy,"(4, 1)",COLORS,12,"(200,)",False,"It's the color some French undie sellers call ""le shocking""",pink,1,0
4508,2004-03-24,,Jeopardy,"(5, 1)",TRAVEL & TOURISM,19,"(200,)",False,"In the 11th century, William the Conqueror ordered the construction of this fortress on the Thames",the Tower of London,1,0
4508,2004-03-24,,Jeopardy,"(6, 1)","""MINI"" BAR",13,"(200,)",False,"The Dodge Caravan & the Plymouth Voyager, for example",minivan,1,0
4508,2004-03-24,,Jeopardy,"(1, 2)",FAMOUS AMERICANS,7,"(400,)",False,"After winning the first International Tchaikovsky Competition in 1958, he got his own piano competition",Van Cliburn,1,0
4508,2004-03-24,,Jeopardy,"(2, 2)",BIBLE MOVIES,25,"(400,)",False,"Before he was Patton, this man played Abraham in 1966's ""The Bible""",George C. Scott,1,0
4508,2004-03-24,,Jeopardy,"(3, 2)",SCANDALOUS STORY HEADLINES,2,"(400,)",False,"""Arachnid Infestation Drives"" this young miss ""Away From Curds & Whey Eatery!""",Miss Muffet,1,0
4508,2004-03-24,,Jeopardy,"(4, 2)",COLORS,14,"(400,)",False,"Yeats wrote, ""When you are old and"" this color ""and full of sleep and nodding by the fire...""",gray,1,0
4508,2004-03-24,,Jeopardy,"(5, 2)",TRAVEL & TOURISM,20,"(400,)",False,Lausanne in this country is home to the International Olympic Committee & an Olympic museum,Switzerland,1,0
4508,2004-03-24,,Jeopardy,"(6, 2)","""MINI"" BAR",18,"(400,)",False,Dr. Evil's clone,Mini-Me,1,0
4508,2004-03-24,,Jeopardy,"(1, 3)",FAMOUS AMERICANS,8,"(600,)",False,In 1991 this archbishop of Los Angeles was elevated to cardinal,Roger Mahony,0,3
4508,2004-03-24,,Jeopardy,"(2, 3)",BIBLE MOVIES,29,"(600,)",False,"Set during Nero's reign, this film's title is a line uttered by Peter to Jesus & means ""Where are you going?""",Quo Vadis,1,0
4508,2004-03-24,,Jeopardy,"(3, 3)",SCANDALOUS STORY HEADLINES,3,"(600,)",False,"""In New Reality Show"", this fairy tale maiden ""Chooses Among Seven Stumpy Suitors!""",Snow White,1,0
4508,2004-03-24,,Jeopardy,"(4, 3)",COLORS,15,"(1000,)",True,The 2 opposing colors in the Wars of the Roses & in the Russian Civil War of 1918-1920,red & white,1,0
4508,2004-03-24,,Jeopardy,"(5, 3)",TRAVEL & TOURISM,21,"(600,)",False,"If people are parading through Copacabana playing their cuicas, it's this 4-day period",Carnival,1,0
4508,2004-03-24,,Jeopardy,"(6, 3)","""MINI"" BAR",24,"(600,)",False,It's also called putt-putt,mini golf,1,0
4508,2004-03-24,,Jeopardy,"(1, 4)",FAMOUS AMERICANS,9,"(800,)",False,"""The World's Greatest Gospel Singer"", she sang at President Kennedy's inauguration & Martin Luther King's funeral",Mahalia Jackson,1,1
4508,2004-03-24,,Jeopardy,"(2, 4)",BIBLE MOVIES,26,"(800,)",False,In 1949 Victor Mature & Hedy Lamarr played this dysfunctional Biblical couple with a penchant for barber-ism,Samson and Delilah,1,0
4508,2004-03-24,,Jeopardy,"(3, 4)",SCANDALOUS STORY HEADLINES,4,"(800,)",False,"This trio ""Requires Dangerous Rescue After Risky Oceangoing Venture in Bathtub!""","The Butcher, The Baker, The Candlestick Maker",1,1
4508,2004-03-24,,Jeopardy,"(4, 4)",COLORS,16,"(800,)",False,"(Hi, I'm Charlie Garner of the NFL)  These are the Oakland Raiders' 2 team colors; they strike fear in opponents",silver & black,1,0
4508,2004-03-24,,Jeopardy,"(5, 4)",TRAVEL & TOURISM,22,"(800,)",False,"The history of St. Thomas in this island group is exhibited at Fort Christian, named for Denmark's King Christian V",the Virgin Islands,1,0
4508,2004-03-24,,Jeopardy,"(6, 4)","""MINI"" BAR",27,"(800,)",False,"""Roots"" or ""The Thorn Birds""",a miniseries,1,0
4508,2004-03-24,,Jeopardy,"(1, 5)",FAMOUS AMERICANS,10,"(1000,)",False,This author died in New Hampshire in 1864 during a visit with old school chum Franklin Pierce,Nathaniel Hawthorne,1,0
4508,2004-03-24,,Jeopardy,"(2, 5)",BIBLE MOVIES,30,"(1000,)",False,Stewart Granger played Lot & Pier Angeli was his salty wife Ildith in the 1962 film about these 2 title cities,Sodom and Gomorrah,1,0
4508,2004-03-24,,Jeopardy,"(3, 5)",SCANDALOUS STORY HEADLINES,5,"(1000,)",False,"This abusive puppet ""Arrested Again in Domestic Disturbance Case; Wife Judy Says, 'This Time It's Over!'""",Punch,1,0
4508,2004-03-24,,Jeopardy,"(4, 5)",COLORS,17,"(1000,)",False,"Among natural dyes, you can get this color from fustic, weld or turmeric",yellow,1,0
4508,2004-03-24,,Jeopardy,"(5, 5)",TRAVEL & TOURISM,23,"(1000,)",False,The buildings in this Bermudan capital are commonly painted in pastels & the roofs are made of coral,Hamilton,1,0
4508,2004-03-24,,Jeopardy,"(6, 5)","""MINI"" BAR",28,"(1000,)",False,Abstract American art movement of the 1960s,Minimalist,1,0
4508,2004-03-24,,Double Jeopardy,"(1, 1)",THE ROMANTICS,21,"(400,)",False,"Washington Allston specialized in this type of painting; the work seen here is titled ""Moonlit"" one",Landscape,1,0
4508,2004-03-24,,Double Jeopardy,"(2, 1)",PLANTS & FLOWERS,1,"(400,)",False,"Despite its name this carnivorous plant also eats caterpillars, spiders & crickets",Venus Flytrap,1,0
4508,2004-03-24,,Double Jeopardy,"(3, 1)","COMPUTER ""I""s",24,"(400,)",False,"Your real desktop may be covered with Post-It notes, while your computer desktop is covered with these images",icons,1,0
4508,2004-03-24,,Double Jeopardy,"(4, 1)",IT BORDERS BOTH,8,"(400,)",False,Egypt & Lebanon,Israel,1,0
4508,2004-03-24,,Double Jeopardy,"(5, 1)",BEFORE & AFTER,3,"(400,)",False,Joan Crawford won an Oscar as this housewife-turned-waitress who went on to play James Bond,Mildred Pierce Brosnan,1,0
4508,2004-03-24,,Double Jeopardy,"(6, 1)",ET AL,16,"(400,)",False,"He parodied Nirvana's ""Smells Like Teen Spirit"" by singing ""Smells Like Nirvana""","""Weird Al"" Yankovic",1,0
4508,2004-03-24,,Double Jeopardy,"(1, 2)",THE ROMANTICS,22,"(800,)",False,"(Jimmy of the Clue Crew reports from Venice, Italy)  This poet talked about freedom at the Cafe Florian & later journeyed to help the Greeks fight for freedom",(Lord) Byron,1,0
4508,2004-03-24,,Double Jeopardy,"(2, 2)",PLANTS & FLOWERS,2,"(800,)",False,"Literally meaning ""flower of the lily"", it was long a symbol of French royalty",Fleur-de-lis,1,0
4508,2004-03-24,,Double Jeopardy,"(3, 2)","COMPUTER ""I""s",27,"(800,)",False,The name of this company can also mean information acquired by spies,Intel,1,0
4508,2004-03-24,,Double Jeopardy,"(4, 2)",IT BORDERS BOTH,9,"(800,)",False,Nepal & Mongolia,China,1,0
4508,2004-03-24,,Double Jeopardy,"(5, 2)",BEFORE & AFTER,4,"(800,)",False,"""Ali"" portrayer & handgun manufacturer who celebrated their 150th anniversary in 2002",Will Smith and Wesson,1,0
4508,2004-03-24,,Double Jeopardy,"(6, 2)",ET AL,17,"(800,)",False,"(Sofia of the Clue Crew reports from Louisville, Kentucky)  This mobster loved to play cards at the Seelbach Hilton & even sent a mirror here from Chicago so he could watch his back",Al Capone,1,0
4508,2004-03-24,,Double Jeopardy,"(1, 3)",THE ROMANTICS,23,"(1200,)",False,"This opera composer's art really took off with 1843's ""The Flying Dutchman""",Wagner,1,0
4508,2004-03-24,,Double Jeopardy,"(2, 3)",PLANTS & FLOWERS,13,"(1200,)",False,"""Morbid"" nickname for the Titan arum, the giant stinky flower seen here",the Corpse Flower,0,3
4508,2004-03-24,,Double Jeopardy,"(3, 3)","COMPUTER ""I""s",28,"(3000,)",True,"A 1994 article in Wired magazine said privacy was ""Roadkill Along"" this",the Information Superhighway,1,0
4508,2004-03-24,,Double Jeopardy,"(4, 3)",IT BORDERS BOTH,10,"(1200,)",False,France & Slovenia,Italy,0,3
4508,2004-03-24,,Double Jeopardy,"(5, 3)",BEFORE & AFTER,5,"(1200,)",False,Brutal Russian czar who's in the phase of toddlerhood marked by tantrums & contrary behavior,Ivan the Terrible Twos,1,0
4508,2004-03-24,,Double Jeopardy,"(6, 3)",ET AL,18,"(1200,)",False,"His mesmerizing Broadway debut as a junkie in the 1969 play ""Does a Tiger Wear a Necktie?"" won him a Tony Award",Al Pacino,1,0
4508,2004-03-24,,Double Jeopardy,"(1, 4)",THE ROMANTICS,25,"(2400,)",True,He's the British author-illustrator whose work is seen here,William Blake,1,0
4508,2004-03-24,,Double Jeopardy,"(2, 4)",PLANTS & FLOWERS,14,"(1600,)",False,"Common in the Southwestern U.S., the Strawberry Hedgehog belongs to this family of plants",Cactus,1,0
4508,2004-03-24,,Double Jeopardy,"(3, 4)","COMPUTER ""I""s",29,"(1600,)",False,The Epson Stylus C82 is this type of consumer product,inkjet printer,1,1
4508,2004-03-24,,Double Jeopardy,"(4, 4)",IT BORDERS BOTH,11,"(1600,)",False,Venezuela & Argentina,Brazil,1,0
4508,2004-03-24,,Double Jeopardy,"(5, 4)",BEFORE & AFTER,6,"(1600,)",False,"A Russian goldsmith first made this prized enameled, jeweled McDonald's breakfast sandwich in 1973",Faberge Egg McMuffin,1,0
4508,2004-03-24,,Double Jeopardy,"(6, 4)",ET AL,19,"(1600,)",False,"This trumpeter teamed up with Ann-Margret on the album ""Beauty and the Beard""",Al Hirt,1,0
4508,2004-03-24,,Double Jeopardy,"(1, 5)",THE ROMANTICS,26,"(2000,)",False,The film seen here is a romanticized biography of this Romantic man,Frederic Chopin,1,0
4508,2004-03-24,,Double Jeopardy,"(2, 5)",PLANTS & FLOWERS,15,"(2000,)",False,You don't have to go to New England to see this plant; lots of American homes have one,Boston Fern,0,3
4508,2004-03-24,,Double Jeopardy,"(3, 5)","COMPUTER ""I""s",30,"(2000,)",False,"Faster than a modem connection, it's a method of transmitting data digitally over phone lines",ISDN,0,3
4508,2004-03-24,,Double Jeopardy,"(4, 5)",IT BORDERS BOTH,12,"(2000,)",False,Libya & Morocco,Algeria,1,0
4508,2004-03-24,,Double Jeopardy,"(5, 5)",BEFORE & AFTER,7,"(2000,)",False,Andy Griffith gets his hair cut by this Mayberry character also known as Figaro in a Rossini opera,Floyd the Barber of Seville,1,0
4508,2004-03-24,,Double Jeopardy,"(6, 5)",ET AL,20,"(2000,)",False,"This singer must have been over the moon when he made ""Moonlighting"" a hit in 1987",Al Jarreau,0,3
4508,2004-03-24,,Final Jeopardy,"(1, 1)",WORD & PHRASE ORIGINS,0,"(7500, 13000, 6401)",False,This term was first used in an ice cream trade journal in 1937; it began to appear in the nuclear power industry in the '60s,meltdown,2,1
