epNum,airDate,extra_info,round_name,coord,category,order,value,daily_double,question,answer,correctAttempts,wrongAttempts
4562,2004-06-08,Ken Jennings game 5.,Jeopardy,"(1, 1)",NATIONAL ANTHEMS,6,"(200,)",False,"This Asian country's national anthem is ""Kimigayo"", ""His Majesty's Reign""",Japan,1,0
4562,2004-06-08,Ken Jennings game 5.,Jeopardy,"(2, 1)",TV-PODGE,1,"(200,)",False,"It's the series that gave us the classic catch phrases ""Yada, yada, yada"" & ""No soup for you!""",Seinfeld,1,0
4562,2004-06-08,Ken Jennings game 5.,Jeopardy,"(3, 1)",COLORS OF THE RAINBOW,16,"(200,)",False,In a sad mood,blue,1,0
4562,2004-06-08,Ken Jennings game 5.,Jeopardy,"(4, 1)",ALL THE PRESIDENTS' CHILDREN,21,"(200,)",False,"In 2002 she edited a new book of essays: ""Profiles in Courage for Our Time""",Caroline Kennedy,1,0
4562,2004-06-08,Ken Jennings game 5.,Jeopardy,"(5, 1)","""EXTRA"" HELPINGS",11,"(200,)",False,Not of this Earth,extraterrestrial,1,0
4562,2004-06-08,Ken Jennings game 5.,Jeopardy,"(6, 1)",I'M ON A DIET,26,"(200,)",False,"His ""Diet Revolution"" was first published in the 1970s",(Robert C.) Atkins,1,0
4562,2004-06-08,Ken Jennings game 5.,Jeopardy,"(1, 2)",NATIONAL ANTHEMS,7,"(400,)",False,"O, can you name this country whose anthem is heard here",Canada,1,0
4562,2004-06-08,Ken Jennings game 5.,Jeopardy,"(2, 2)",TV-PODGE,2,"(400,)",False,"Moon Unit Zappa & Wallace Langham co-starred on the TV series ""Fast Times"", based on this classic of teen cinema",Fast Times at Ridgemont High,1,0
4562,2004-06-08,Ken Jennings game 5.,Jeopardy,"(3, 2)",COLORS OF THE RAINBOW,17,"(400,)",False,The ink businesses try to avoid,red,1,0
4562,2004-06-08,Ken Jennings game 5.,Jeopardy,"(4, 2)",ALL THE PRESIDENTS' CHILDREN,22,"(400,)",False,In 1835 Zachary Taylor's daughter Sarah married this future president of the Confederacy,Jefferson Davis,1,0
4562,2004-06-08,Ken Jennings game 5.,Jeopardy,"(5, 2)","""EXTRA"" HELPINGS",12,"(400,)",False,"For many students, the yearbook, chess club & school newspaper fall under these ""activities""",extracurricular,1,0
4562,2004-06-08,Ken Jennings game 5.,Jeopardy,"(6, 2)",I'M ON A DIET,27,"(400,)",False,"Created by Herman Tarnower, this diet bears the name of an upscale NYC suburb",the Scarsdale Diet,1,0
4562,2004-06-08,Ken Jennings game 5.,Jeopardy,"(1, 3)",NATIONAL ANTHEMS,8,"(600,)",False,"The melody of its anthem, ""Land der Berge, Land am Strome"", was incorrectly attributed to Mozart",Austria,1,0
4562,2004-06-08,Ken Jennings game 5.,Jeopardy,"(2, 3)",TV-PODGE,3,"(600,)",False,Mel Blanc supplied the voice of Cosmo Spacely when this cartoon debuted in prime time in 1962,The Jetsons,1,0
4562,2004-06-08,Ken Jennings game 5.,Jeopardy,"(3, 3)",COLORS OF THE RAINBOW,18,"(600,)",False,Naive or inexperienced,green,1,0
4562,2004-06-08,Ken Jennings game 5.,Jeopardy,"(4, 3)",ALL THE PRESIDENTS' CHILDREN,23,"(600,)",False,It was the 3-letter nickname of Lincoln's youngest son Thomas,Tad,1,0
4562,2004-06-08,Ken Jennings game 5.,Jeopardy,"(5, 3)","""EXTRA"" HELPINGS",13,"(600,)",False,The handing over of a criminal to another country or state,extradition,1,0
4562,2004-06-08,Ken Jennings game 5.,Jeopardy,"(6, 3)",I'M ON A DIET,28,"(600,)",False,Blimey!  This former Royal is a spokeswoman for Weight Watchers,"Sarah, Duchess of York",1,0
4562,2004-06-08,Ken Jennings game 5.,Jeopardy,"(1, 4)",NATIONAL ANTHEMS,9,"(1800,)",True,It's the only Central American country whose national anthem is sung in English,Belize,1,0
4562,2004-06-08,Ken Jennings game 5.,Jeopardy,"(2, 4)",TV-PODGE,4,"(800,)",False,"(Hi, I'm Will Estes.)  As ""American Dreams"" is based around ""American Bandstand"" in the 1960s, it's set in this city",Philadelphia,1,0
4562,2004-06-08,Ken Jennings game 5.,Jeopardy,"(3, 4)",COLORS OF THE RAINBOW,19,"(800,)",False,Citrus sinensis,an orange,1,0
4562,2004-06-08,Ken Jennings game 5.,Jeopardy,"(4, 4)",ALL THE PRESIDENTS' CHILDREN,24,"(800,)",False,"His eldest son, Frederick, also graduated from West Point, & was later an aide to General Sheridan",(Ulysses) Grant,1,0
4562,2004-06-08,Ken Jennings game 5.,Jeopardy,"(5, 4)","""EXTRA"" HELPINGS",14,"(800,)",False,"Characterized by good flavor, this type of olive oil has an acid level of less than 1 percent",extra virgin,1,0
4562,2004-06-08,Ken Jennings game 5.,Jeopardy,"(6, 4)",I'M ON A DIET,29,"(800,)",False,"Dr. Dean Ornish came up with the 4-word diet book title that promises you can do this & ""Weigh Less""",eat more,1,0
4562,2004-06-08,Ken Jennings game 5.,Jeopardy,"(1, 5)",NATIONAL ANTHEMS,10,"(1000,)",False,The anthem heard here was composed in this century,the 18th century,1,1
4562,2004-06-08,Ken Jennings game 5.,Jeopardy,"(2, 5)",TV-PODGE,5,"(1000,)",False,"Angus T. Jones, who plays Jake Harper, is the half-pint on this Charlie Sheen show",Two and a Half Men,1,0
4562,2004-06-08,Ken Jennings game 5.,Jeopardy,"(3, 5)",COLORS OF THE RAINBOW,20,"(1000,)",False,"Liz Taylor's eyes, in a ""Doonesbury"" book title",violet,1,0
4562,2004-06-08,Ken Jennings game 5.,Jeopardy,"(4, 5)",ALL THE PRESIDENTS' CHILDREN,25,"(1000,)",False,"""I can be President,"" Teddy Roosevelt said, ""or I can control"" this daughter, ""I cannot possibly do both""",Alice,1,0
4562,2004-06-08,Ken Jennings game 5.,Jeopardy,"(5, 5)","""EXTRA"" HELPINGS",15,"(1000,)",False,"From the Italian for ""more than usual wandering"", it's a lavish entertainment or a spectacular display",an extravaganza,1,0
4562,2004-06-08,Ken Jennings game 5.,Jeopardy,"(6, 5)",I'M ON A DIET,30,"(1000,)",False,This currently popular diet bears the name of a section of Miami,the South Beach Diet,1,0
4562,2004-06-08,Ken Jennings game 5.,Double Jeopardy,"(1, 1)",OPERA,17,"(400,)",False,"For the gift of youth, this philosopher & alchemist pledges his soul to Mephistopheles",Faust,1,0
4562,2004-06-08,Ken Jennings game 5.,Double Jeopardy,"(2, 1)",CELEBRITY SURNAME SPELLING,6,"(400,)",False,Tha rapper Snoop,D-O-G-G,1,0
4562,2004-06-08,Ken Jennings game 5.,Double Jeopardy,"(3, 1)",QUOTATIONS,16,"(400,)",False,"Poet F.W. Bourdillon wrote, ""The night has a thousand"" of these, ""and the day but one""",eyes,1,0
4562,2004-06-08,Ken Jennings game 5.,Double Jeopardy,"(4, 1)","""B"" FOLKS",1,"(400,)",False,He's the super-smooth singer seen here,Tony Bennett,1,0
4562,2004-06-08,Ken Jennings game 5.,Double Jeopardy,"(5, 1)",1845,8,"(400,)",False,New baseball rules said you put a runner out this way instead of plugging him with the ball--sounds less fun,tagging him out,1,0
4562,2004-06-08,Ken Jennings game 5.,Double Jeopardy,"(6, 1)",4-LETTER WORDS,26,"(400,)",False,"By any means possible is ""by"" this ""or by crook""",hook,1,0
4562,2004-06-08,Ken Jennings game 5.,Double Jeopardy,"(1, 2)",OPERA,18,"(1800,)",True,Act I of this opera opens at Pinkerton's house in Nagasaki,Madame Butterfly,1,0
4562,2004-06-08,Ken Jennings game 5.,Double Jeopardy,"(2, 2)",CELEBRITY SURNAME SPELLING,7,"(800,)",False,The actress who'll always be TV's Buffy Summers to us,G-E-L-L-A-R,1,0
4562,2004-06-08,Ken Jennings game 5.,Double Jeopardy,"(3, 2)",QUOTATIONS,21,"(800,)",False,"W.C. Fields said, these ""are like elephants to me.  I like to look at them, but I wouldn't want to own one""",women,1,0
4562,2004-06-08,Ken Jennings game 5.,Double Jeopardy,"(4, 2)","""B"" FOLKS",2,"(800,)",False,"In the 1930s he built a distillery in Clermont, Kentucky",Jim Beam,1,0
4562,2004-06-08,Ken Jennings game 5.,Double Jeopardy,"(5, 2)",1845,9,"(800,)",False,"Also named James, this 11th president reinforced James Monroe with his own doctrine",Polk,1,0
4562,2004-06-08,Ken Jennings game 5.,Double Jeopardy,"(6, 2)",4-LETTER WORDS,27,"(800,)",False,"In ""Take Me Out To The Ball Game"", I do this, this, this ""for the home team""",root,1,0
4562,2004-06-08,Ken Jennings game 5.,Double Jeopardy,"(1, 3)",OPERA,19,"(1200,)",False,"This Beethoven opera was originally titled ""Leonore""",Fidelio,1,0
4562,2004-06-08,Ken Jennings game 5.,Double Jeopardy,"(2, 3)",CELEBRITY SURNAME SPELLING,10,"(1200,)",False,Comic hostess/fish-voicer seen here,D-E-G-E-N-E-R-E-S,1,0
4562,2004-06-08,Ken Jennings game 5.,Double Jeopardy,"(3, 3)",QUOTATIONS,23,"(1200,)",False,"That wit Saki wrote, ""I always say"" this ""is only sin deep""",beauty,1,0
4562,2004-06-08,Ken Jennings game 5.,Double Jeopardy,"(4, 3)","""B"" FOLKS",3,"(1200,)",False,"This American Jewish conductor & composer wrote ""Jeremiah"" & ""Kaddish"" symphonies",Leonard Bernstein,1,0
4562,2004-06-08,Ken Jennings game 5.,Double Jeopardy,"(5, 3)",1845,13,"(1200,)",False,"Over 300' long, theGreat Britainset sail as the first large oceangoing ship with a hull made of this",iron,1,0
4562,2004-06-08,Ken Jennings game 5.,Double Jeopardy,"(6, 3)",4-LETTER WORDS,28,"(8500,)",True,"From the Latin words for ""no one"" & ""empty"" come these 2 words that cancel a contract",null & void,1,0
4562,2004-06-08,Ken Jennings game 5.,Double Jeopardy,"(1, 4)",OPERA,20,"(1600,)",False,"Jacques Offenbach died on Oct. 5, 1880, 4 months before his ""Tales of"" this poet was first produced",Hoffmann,1,0
4562,2004-06-08,Ken Jennings game 5.,Double Jeopardy,"(2, 4)",CELEBRITY SURNAME SPELLING,11,"(1600,)",False,Filmmakers Joel & Ethan,C-O-E-N,1,0
4562,2004-06-08,Ken Jennings game 5.,Double Jeopardy,"(3, 4)",QUOTATIONS,24,"(1600,)",False,"The London Times quoted her in 1987: ""I don't mind how much my ministers talk--as long as they do what I say""",Thatcher,1,0
4562,2004-06-08,Ken Jennings game 5.,Double Jeopardy,"(4, 4)","""B"" FOLKS",4,"(1600,)",False,"(Sofia of the Clue Crew reports from the Titanic artifact exhibit at the California Science Center.)  This man, who led the Titanic's discovery, found that the iceberg didn't cut into the hull, but pushed its rivets out",Dr. Robert Ballard,0,3
4562,2004-06-08,Ken Jennings game 5.,Double Jeopardy,"(5, 4)",1845,14,"(1600,)",False,"The poke type of this was popular for ladies, especially those having bad hair days",a bonnet,0,3
4562,2004-06-08,Ken Jennings game 5.,Double Jeopardy,"(6, 4)",4-LETTER WORDS,29,"(1600,)",False,"(Sarah admires art at the Bishop's House in Sitka, Alaska.)  St. Innocent of Irkutsk is represented here in this type of image, traditional in the Eastern Church",an icon,1,0
4562,2004-06-08,Ken Jennings game 5.,Double Jeopardy,"(1, 5)",OPERA,22,"(2000,)",False,"In a Richard Wagner opera, this knight in shining armor arrives on a boat drawn by a swan",Lohengrin,1,1
4562,2004-06-08,Ken Jennings game 5.,Double Jeopardy,"(2, 5)",CELEBRITY SURNAME SPELLING,12,"(2000,)",False,Spidey portrayer Tobey,M-A-G-U-I-R-E,1,1
4562,2004-06-08,Ken Jennings game 5.,Double Jeopardy,"(3, 5)",QUOTATIONS,25,"(2000,)",False,"In a 1970 book this author wrote, ""The gull sees farthest who sees highest""",(Richard) Bach,1,0
4562,2004-06-08,Ken Jennings game 5.,Double Jeopardy,"(4, 5)","""B"" FOLKS",5,"(2000,)",False,"Her ""Ernie Pook's Comeek"" chronicles the troubled adolescence of Marlys & Maybonne",Lynda Barry,1,0
4562,2004-06-08,Ken Jennings game 5.,Double Jeopardy,"(5, 5)",1845,15,"(2000,)",False,"This future prime minister's novel ""Sybil"" was subtitled ""or the Two Nations""",Disraeli,1,0
4562,2004-06-08,Ken Jennings game 5.,Double Jeopardy,"(6, 5)",4-LETTER WORDS,30,"(2000,)",False,1/10 of a dollar is a dime; 1/10 of a cent is this,a mill,1,0
4562,2004-06-08,Ken Jennings game 5.,Final Jeopardy,"(1, 1)",EUROPEAN ISLANDS,0,"(1800, 17500, 2601)",False,"Gavdos, an islet administratively part of this larger island, is Europe's southernmost point",Crete,0,3
