epNum,airDate,extra_info,round_name,coord,category,order,value,daily_double,question,answer,correctAttempts,wrongAttempts
4579,2004-07-01,Ken Jennings game 22.,Jeopardy,"(1, 1)",WORLD RELIGION,1,"(200,)",False,"Founded by this reverend in 1979, the Moral Majority was against the Equal Rights Amendment",Falwell,1,0
4579,2004-07-01,Ken Jennings game 22.,Jeopardy,"(2, 1)",AMERICAN IDOL,6,"(200,)",False,She was the first champion,Kelly Clarkson,1,0
4579,2004-07-01,Ken Jennings game 22.,Jeopardy,"(3, 1)",DANGEROUS!,17,"(200,)",False,"On February 28, 2001 northwest Washington State was rocked by one of these that measured 6.8",an earthquake,1,0
4579,2004-07-01,Ken Jennings game 22.,Jeopardy,"(4, 1)",LOST IN TRANSLATION,7,"(200,)",False,Bai zhang,Chinese,1,0
4579,2004-07-01,Ken Jennings game 22.,Jeopardy,"(5, 1)",WHAT'S THAT?,16,"(200,)",False,A pipkin is a metal pot; a Pippin is a type of this fruit,an apple,1,0
4579,2004-07-01,Ken Jennings game 22.,Jeopardy,"(6, 1)",SOUNDS FISHY TO ME!,26,"(200,)",False,This feature on a shark's back acts as a stabilizer--& a warning to swimmers,the dorsal fin,1,1
4579,2004-07-01,Ken Jennings game 22.,Jeopardy,"(1, 2)",WORLD RELIGION,2,"(400,)",False,"(Sofia of the Clue Crew reports from the Schlosskirche in Wittenburg, Germany.) Number 25 of Luther's 95 Theses says this man had no more power to relieve souls in purgatory than any bishop",the pope,1,0
4579,2004-07-01,Ken Jennings game 22.,Jeopardy,"(2, 2)",AMERICAN IDOL,8,"(400,)",False,He co-hosted the first version & went solo hosting the second,Ryan Seacrest,1,0
4579,2004-07-01,Ken Jennings game 22.,Jeopardy,"(3, 2)",DANGEROUS!,18,"(400,)",False,In 1953 meteorologists began assigning female names to these,hurricanes,1,0
4579,2004-07-01,Ken Jennings game 22.,Jeopardy,"(4, 2)",LOST IN TRANSLATION,11,"(400,)",False,Perdido,Spanish,1,0
4579,2004-07-01,Ken Jennings game 22.,Jeopardy,"(5, 2)",WHAT'S THAT?,22,"(400,)",False,"Of a rug, a bug or a jug, the one you'd normally find weft in",a rug,1,0
4579,2004-07-01,Ken Jennings game 22.,Jeopardy,"(6, 2)",SOUNDS FISHY TO ME!,27,"(400,)",False,"Living up to its name, this Thai fish also called the betta will even attack its own reflection in a mirror",the Siamese fighting fish,0,3
4579,2004-07-01,Ken Jennings game 22.,Jeopardy,"(1, 3)",WORLD RELIGION,3,"(600,)",False,"During this 8-day Jewish observance, the eating of hametz, leavened bread, is prohibited",Passover,1,1
4579,2004-07-01,Ken Jennings game 22.,Jeopardy,"(2, 3)",AMERICAN IDOL,9,"(600,)",False,"This judge remarked, ""Did you really believe you could become the American Idol?  Well, then, you're deaf""",Simon Cowell,1,0
4579,2004-07-01,Ken Jennings game 22.,Jeopardy,"(3, 3)",DANGEROUS!,19,"(600,)",False,"The ""El Nino"" phenomenon of this ocean causes unusual weather patterns about every 3 to 7 years",the Pacific,1,0
4579,2004-07-01,Ken Jennings game 22.,Jeopardy,"(4, 3)",LOST IN TRANSLATION,12,"(600,)",False,Perdu,French,1,0
4579,2004-07-01,Ken Jennings game 22.,Jeopardy,"(5, 3)",WHAT'S THAT?,23,"(600,)",False,Common 10-letter name for a timbal or timpani,kettledrum,1,0
4579,2004-07-01,Ken Jennings game 22.,Jeopardy,"(6, 3)",SOUNDS FISHY TO ME!,28,"(600,)",False,"A guitarfish might say, ""You can call me"" this, because that's the type of fish it is",ray,0,3
4579,2004-07-01,Ken Jennings game 22.,Jeopardy,"(1, 4)",WORLD RELIGION,4,"(800,)",False,"Rachel, Monica & Phoebe might run away & join this group better known as the Quakers",the Society of Friends,1,0
4579,2004-07-01,Ken Jennings game 22.,Jeopardy,"(2, 4)",AMERICAN IDOL,10,"(800,)",False,"He edged out Clay Aiken to become the second ""American Idol""",Ruben Studdard,1,2
4579,2004-07-01,Ken Jennings game 22.,Jeopardy,"(3, 4)",DANGEROUS!,20,"(800,)",False,It's a suddenly formed large depression in the ground that may attain a depth over 100 feet,a sinkhole,1,0
4579,2004-07-01,Ken Jennings game 22.,Jeopardy,"(4, 4)",LOST IN TRANSLATION,14,"(800,)",False,Verloren,German,1,0
4579,2004-07-01,Ken Jennings game 22.,Jeopardy,"(5, 4)",WHAT'S THAT?,24,"(800,)",False,It's what one usually does behind a rostrum; you can also do it behind a lectern,give a speech,1,0
4579,2004-07-01,Ken Jennings game 22.,Jeopardy,"(6, 4)",SOUNDS FISHY TO ME!,29,"(200,)",True,The pigfish is a type of this fish named for a noise it makes when taken out of the water,a grunt,0,1
4579,2004-07-01,Ken Jennings game 22.,Jeopardy,"(1, 5)",WORLD RELIGION,5,"(1000,)",False,"One of the great Hindu gods, he's also called the ""Preserver""",Vishnu,1,0
4579,2004-07-01,Ken Jennings game 22.,Jeopardy,"(2, 5)",AMERICAN IDOL,13,"(1000,)",False,"It's the name of the original British TV singing contest on which ""American Idol"" was directly based",Pop Idol,0,3
4579,2004-07-01,Ken Jennings game 22.,Jeopardy,"(3, 5)",DANGEROUS!,21,"(1000,)",False,The record for a single snowstorm was 189 inches in 1959 on this California mountain with a soda pop name,Mount Shasta,1,0
4579,2004-07-01,Ken Jennings game 22.,Jeopardy,"(4, 5)",LOST IN TRANSLATION,15,"(1000,)",False,Rosuto,Japanese,0,3
4579,2004-07-01,Ken Jennings game 22.,Jeopardy,"(5, 5)",WHAT'S THAT?,25,"(1000,)",False,A neophyte is a new convert; neoprene is a synthetic type of this material,rubber,0,3
4579,2004-07-01,Ken Jennings game 22.,Jeopardy,"(6, 5)",SOUNDS FISHY TO ME!,30,"(1000,)",False,The striped type of this fish earned its stripes as the official state fish of Rhode Island,bass,1,0
4579,2004-07-01,Ken Jennings game 22.,Double Jeopardy,"(1, 1)",SOUTH AMERICAN GEOGRAPHY,2,"(400,)",False,"This Peruvian city was founded in 1535; Villa El Salvador, a squatter's camp of 350,000 on its outskirts, in 1971",Lima,1,0
4579,2004-07-01,Ken Jennings game 22.,Double Jeopardy,"(2, 1)",BOXING,21,"(400,)",False,"At the 2000 Olympics, 4 boxing golds went to fighters from this Caribbean island",Cuba,1,0
4579,2004-07-01,Ken Jennings game 22.,Double Jeopardy,"(3, 1)",STAY-AT-HOME MOMS,12,"(400,)",False,Blanche of Castile ruled France as regent when her son Louis went on one of these expeditions in 1248,a crusade,1,0
4579,2004-07-01,Ken Jennings game 22.,Double Jeopardy,"(4, 1)",COLLEGE COLLAGE,1,"(400,)",False,"Each fall this university holds its raucous pep rally known as the ""Gator Growl""",the University of Florida,1,0
4579,2004-07-01,Ken Jennings game 22.,Double Jeopardy,"(5, 1)",MAKING A LIST,24,"(400,)",False,"In January 2004 Dick Gephardt was on his show to present the top 10 signs ""You've Been on the Campaign Trail Too Long""",Letterman,1,0
4579,2004-07-01,Ken Jennings game 22.,Double Jeopardy,"(6, 1)","""B""EGINNINGS",7,"(400,)",False,"If someone tries to impress you with their baccalaureate, know it's just one of these degrees",bachelor\'s,1,0
4579,2004-07-01,Ken Jennings game 22.,Double Jeopardy,"(1, 2)",SOUTH AMERICAN GEOGRAPHY,3,"(800,)",False,The northern end of this country stands between Bolivia & a seacoast,Chile,1,0
4579,2004-07-01,Ken Jennings game 22.,Double Jeopardy,"(2, 2)",BOXING,22,"(800,)",False,In 1937 Joe Louis became heavyweight champ; in 1997 this Lewis wore the crown,Lennox Lewis,1,0
4579,2004-07-01,Ken Jennings game 22.,Double Jeopardy,"(3, 2)",STAY-AT-HOME MOMS,17,"(800,)",False,"We're sure this Ohioan's mother, Viola, was elated on July 20, 1969, but she kept her feet on the ground",Neil Armstrong,1,0
4579,2004-07-01,Ken Jennings game 22.,Double Jeopardy,"(4, 2)",COLLEGE COLLAGE,13,"(800,)",False,"Popularly known as the ""Zags"", the Bulldogs of this Spokane university are a force to be reckoned with in college athletics",Gonzaga,1,0
4579,2004-07-01,Ken Jennings game 22.,Double Jeopardy,"(5, 2)",MAKING A LIST,25,"(800,)",False,"(Jimmy of the Clue Crew reports from the Raptor Center in Alaska.) In 1999, President Clinton announced plans to remove the bald eagle from this list",the Endangered Species list,1,0
4579,2004-07-01,Ken Jennings game 22.,Double Jeopardy,"(6, 2)","""B""EGINNINGS",8,"(800,)",False,"Whittier wrote of a ""barefoot"" one with ""cheek of tan""",a boy,1,0
4579,2004-07-01,Ken Jennings game 22.,Double Jeopardy,"(1, 3)",SOUTH AMERICAN GEOGRAPHY,4,"(1200,)",False,This country's Atrato River flows into the Gulf of Darien,Colombia,1,0
4579,2004-07-01,Ken Jennings game 22.,Double Jeopardy,"(2, 3)",BOXING,23,"(1200,)",False,In 1973 Joe Frazier lost his title to this man,George Foreman,1,0
4579,2004-07-01,Ken Jennings game 22.,Double Jeopardy,"(3, 3)",STAY-AT-HOME MOMS,18,"(1200,)",False,"This globetrotting U.S. statesman always came back for the baking of his mom, born Paula Stern",Henry Kissinger,1,0
4579,2004-07-01,Ken Jennings game 22.,Double Jeopardy,"(4, 3)",COLLEGE COLLAGE,14,"(1200,)",False,"Booker T. Washington founded this college as a ""School for Colored Teachers"" in 1881",Tuskegee,1,0
4579,2004-07-01,Ken Jennings game 22.,Double Jeopardy,"(5, 3)",MAKING A LIST,26,"(1200,)",False,Dr. Kubler-Ross' list of the 5 states of grief runs from denial to this,acceptance,1,0
4579,2004-07-01,Ken Jennings game 22.,Double Jeopardy,"(6, 3)","""B""EGINNINGS",9,"(1200,)",False,It's a synonym for width,breadth,1,0
4579,2004-07-01,Ken Jennings game 22.,Double Jeopardy,"(1, 4)",SOUTH AMERICAN GEOGRAPHY,5,"(1600,)",False,"Uruguayans call their highlands Cuchilla Grande, or ""big"" this, for the sharp, narrow rock formations",knife,1,0
4579,2004-07-01,Ken Jennings game 22.,Double Jeopardy,"(2, 4)",BOXING,27,"(1600,)",False,Fearsome nickname of 1980s heavyweight champ James Smith,"""Bonecrusher""",0,3
4579,2004-07-01,Ken Jennings game 22.,Double Jeopardy,"(3, 4)",STAY-AT-HOME MOMS,19,"(6000,)",True,The woman born Mary Arden lived quietly in this town while her son gained fame in the London theater,Stratford,1,0
4579,2004-07-01,Ken Jennings game 22.,Double Jeopardy,"(4, 4)",COLLEGE COLLAGE,15,"(1600,)",False,This New Jersey college found in New Brunswick was originally called Queen's College,Rutgers,1,0
4579,2004-07-01,Ken Jennings game 22.,Double Jeopardy,"(5, 4)",MAKING A LIST,29,"(1600,)",False,"At Ellis Island you can look for your ancestors on these, ships' passenger lists including names & arrival dates",manifests,1,0
4579,2004-07-01,Ken Jennings game 22.,Double Jeopardy,"(6, 4)","""B""EGINNINGS",10,"(1600,)",False,"It's unglazed china or a thick, cream soup with shellfish",a bisque,1,0
4579,2004-07-01,Ken Jennings game 22.,Double Jeopardy,"(1, 5)",SOUTH AMERICAN GEOGRAPHY,6,"(2000,)",False,This country has border disputes with French Guiana to its east & Guyana to its west,Suriname,1,0
4579,2004-07-01,Ken Jennings game 22.,Double Jeopardy,"(2, 5)",BOXING,28,"(2000,)",False,"His sweetest moment came on June 17, 2000 when he beat Oscar De La Hoya","""Sugar"" Shane Mosley",0,3
4579,2004-07-01,Ken Jennings game 22.,Double Jeopardy,"(3, 5)",STAY-AT-HOME MOMS,20,"(2000,)",False,"After she killed her husband, her son Orestes went into exile, then returned to kill her",Clytemnestra,1,0
4579,2004-07-01,Ken Jennings game 22.,Double Jeopardy,"(4, 5)",COLLEGE COLLAGE,16,"(2400,)",True,This town is home to Hampshire College & a U. of Massachusetts campus as well as the college that shares its name,Amherst,1,0
4579,2004-07-01,Ken Jennings game 22.,Double Jeopardy,"(5, 5)",MAKING A LIST,30,"(2000,)",False,It's a list of cases in court for trial or the names of the parties who have cases pending,a docket,1,0
4579,2004-07-01,Ken Jennings game 22.,Double Jeopardy,"(6, 5)","""B""EGINNINGS",11,"(2000,)",False,We're not being prejudiced; it's a line diagonal to the grain of a fabric,a bias,1,0
4579,2004-07-01,Ken Jennings game 22.,Final Jeopardy,"(1, 1)",FRUIT,0,"(0, 0, 4800)",False,This fruit of North America shares its name with a literary character who debuted in an 1876 novel,the huckleberry,2,1
