epNum,airDate,extra_info,round_name,coord,category,order,value,daily_double,question,answer,correctAttempts,wrongAttempts
4612,2004-09-28,2004 Tournament of Champions semifinal game 2.,Jeopardy,"(1, 1)",BAHRAIN,26,"(200,)",False,This Iberian power occupied Bahrain from 1521 until the locals asked for Persian help in 1602,Portugal,1,1
4612,2004-09-28,2004 Tournament of Champions semifinal game 2.,Jeopardy,"(2, 1)",POP CULTURE,1,"(200,)",False,"Appropriately, Stephen King is the creator of this 2004 series based on a Danish TV production",Kingdom Hospital,1,0
4612,2004-09-28,2004 Tournament of Champions semifinal game 2.,Jeopardy,"(3, 1)",BRIDGES TO THE FUTURE,21,"(200,)",False,The new Woodrow Wilson Bridge project will connect Maryland & Virginia across this river,the Potomac,1,0
4612,2004-09-28,2004 Tournament of Champions semifinal game 2.,Jeopardy,"(4, 1)",GREAT BRITS,6,"(200,)",False,"In 1852, this poet laureate & lord wrote his ""Ode on the Death of the Duke of Wellington""",Tennyson,1,0
4612,2004-09-28,2004 Tournament of Champions semifinal game 2.,Jeopardy,"(5, 1)",A BRIEF HISTORY OF THYME,10,"(200,)",False,Thyme honey from the Iblei Mtns. on this large Mediterranean isle has been a delicacy for centuries,Sicily,1,0
4612,2004-09-28,2004 Tournament of Champions semifinal game 2.,Jeopardy,"(6, 1)","BROADWAY CROSSWORD CLUES ""T""",16,"(200,)",False,It's how modern Millie is(10),thoroughly,1,0
4612,2004-09-28,2004 Tournament of Champions semifinal game 2.,Jeopardy,"(1, 2)",BAHRAIN,27,"(400,)",False,"Bahrain is known as this ""of the Arabian Gulf"", although cultured ones are banned in the market of the same name",the Pearl,1,0
4612,2004-09-28,2004 Tournament of Champions semifinal game 2.,Jeopardy,"(2, 2)",POP CULTURE,2,"(400,)",False,"Debuting in 1982, it was the arcade follow-up to Centipede",Millipede,1,0
4612,2004-09-28,2004 Tournament of Champions semifinal game 2.,Jeopardy,"(3, 2)",BRIDGES TO THE FUTURE,22,"(400,)",False,"This 22 ½ mile Hangzhou bridge will cut 2 hours off the travel time from Ningbo to this city, China's largest",Shanghai,1,0
4612,2004-09-28,2004 Tournament of Champions semifinal game 2.,Jeopardy,"(4, 2)",GREAT BRITS,7,"(400,)",False,He joined the British navy at age 12 & died at the Battle of Trafalgar 35 years later,Lord Nelson,1,0
4612,2004-09-28,2004 Tournament of Champions semifinal game 2.,Jeopardy,"(5, 2)",A BRIEF HISTORY OF THYME,12,"(400,)",False,"Parsley, sage, rosemary & thyme figure prominently in this hit by Simon & Garfunkel","""Scarborough Fair""",1,0
4612,2004-09-28,2004 Tournament of Champions semifinal game 2.,Jeopardy,"(6, 2)","BROADWAY CROSSWORD CLUES ""T""",17,"(400,)",False,River City situation(7),trouble,1,0
4612,2004-09-28,2004 Tournament of Champions semifinal game 2.,Jeopardy,"(1, 3)",BAHRAIN,28,"(600,)",False,"The 5 triangular shapes on the Bahraini flag represent these ""foundations"" of Islam",pillars,1,0
4612,2004-09-28,2004 Tournament of Champions semifinal game 2.,Jeopardy,"(2, 3)",POP CULTURE,3,"(600,)",False,"In 2004, she starred as Jenna Rink, who's ""13 Going on 30""",Jennifer Garner,1,0
4612,2004-09-28,2004 Tournament of Champions semifinal game 2.,Jeopardy,"(3, 3)",BRIDGES TO THE FUTURE,23,"(600,)",False,The new Colorado River bridge downstream of Hoover Dam will connect these 2 adjacent states,Nevada and Arizona,1,0
4612,2004-09-28,2004 Tournament of Champions semifinal game 2.,Jeopardy,"(4, 3)",GREAT BRITS,8,"(600,)",False,"Returning from the Crusades in 1192, this English king was captured in Vienna & jailed for over a year",Richard I,1,0
4612,2004-09-28,2004 Tournament of Champions semifinal game 2.,Jeopardy,"(5, 3)",A BRIEF HISTORY OF THYME,13,"(600,)",False,"This ""elder"" Roman encyclopedist referred to thyme as a fumigant",Pliny,1,0
4612,2004-09-28,2004 Tournament of Champions semifinal game 2.,Jeopardy,"(6, 3)","BROADWAY CROSSWORD CLUES ""T""",18,"(600,)",False,"""No, No, Nanette"" ""beverage"" song(3, 3, 3)","""Tea For Two""",1,0
4612,2004-09-28,2004 Tournament of Champions semifinal game 2.,Jeopardy,"(1, 4)",BAHRAIN,29,"(800,)",False,"Bahrain's capital, it shares most of its letters with a Central American country",Manama,1,0
4612,2004-09-28,2004 Tournament of Champions semifinal game 2.,Jeopardy,"(2, 4)",POP CULTURE,4,"(800,)",False,Huey Freeman of this edgy comic strip is named after Black Panther Huey Newton,The Boondocks,1,0
4612,2004-09-28,2004 Tournament of Champions semifinal game 2.,Jeopardy,"(3, 4)",BRIDGES TO THE FUTURE,24,"(500,)",True,"A bridge over this river will connect Vidin, Bulgaria with Calafat, Romania",the Danube,0,1
4612,2004-09-28,2004 Tournament of Champions semifinal game 2.,Jeopardy,"(4, 4)",GREAT BRITS,9,"(800,)",False,There was no royal fun allowed when this man took power in England in 1653,Oliver Cromwell,1,0
4612,2004-09-28,2004 Tournament of Champions semifinal game 2.,Jeopardy,"(5, 4)",A BRIEF HISTORY OF THYME,14,"(800,)",False,"Monks know that thyme is an ingredient in this popular upscale French liquor, one of the ""B""s in B&B",benedictine,0,3
4612,2004-09-28,2004 Tournament of Champions semifinal game 2.,Jeopardy,"(6, 4)","BROADWAY CROSSWORD CLUES ""T""",19,"(800,)",False,"""Aida"" lyricist's first name(3)",Tim,1,0
4612,2004-09-28,2004 Tournament of Champions semifinal game 2.,Jeopardy,"(1, 5)",BAHRAIN,30,"(1000,)",False,In 1971 Bahrain joined this regional organization that was formed in Cairo in 1945,the Arab League,1,0
4612,2004-09-28,2004 Tournament of Champions semifinal game 2.,Jeopardy,"(2, 5)",POP CULTURE,5,"(1000,)",False,"Not to be confused with The Doves or Vines, this Swedish band had a hit with ""Hate To Say I Told You So""",The Hives,0,3
4612,2004-09-28,2004 Tournament of Champions semifinal game 2.,Jeopardy,"(3, 5)",BRIDGES TO THE FUTURE,25,"(1000,)",False,The Binh Bridge is being constructed for this Northern Vietnamese port city,Hai Phong,1,0
4612,2004-09-28,2004 Tournament of Champions semifinal game 2.,Jeopardy,"(4, 5)",GREAT BRITS,11,"(1000,)",False,"American-born, this first woman in the House of Commons said, ""I am the kind of woman I would run from""",Lady (Nancy Witcher) Astor,0,3
4612,2004-09-28,2004 Tournament of Champions semifinal game 2.,Jeopardy,"(5, 5)",A BRIEF HISTORY OF THYME,15,"(1000,)",False,"Thyme contains about 1% this type of ""oil"" used in fragrances & pharmaceuticals",essential oil,1,0
4612,2004-09-28,2004 Tournament of Champions semifinal game 2.,Jeopardy,"(6, 5)","BROADWAY CROSSWORD CLUES ""T""",20,"(1000,)",False,"""My One And Only"" tall Tony-winning Texan(5, 4)",Tommy Tune,1,0
4612,2004-09-28,2004 Tournament of Champions semifinal game 2.,Double Jeopardy,"(1, 1)",SCIENCE & NATURE,7,"(400,)",False,Samuel Schwabe got deeply into sunspots after trying to find a planet crossing the sun closer than this one,Mercury,1,0
4612,2004-09-28,2004 Tournament of Champions semifinal game 2.,Double Jeopardy,"(2, 1)",ART & ARTISTS,21,"(400,)",False,"This Dutch painter, a member of the Delft Guild, had a total output of only about 40 pictures (one with a pearl)",(Jan) Vermeer,1,0
4612,2004-09-28,2004 Tournament of Champions semifinal game 2.,Double Jeopardy,"(3, 1)",A CAJUN CATEGORY,26,"(400,)",False,Chicken-chasing & gathering ingredients for a communal gumbo are Cajun festivities for this pre-Lenten day,Mardi Gras,1,0
4612,2004-09-28,2004 Tournament of Champions semifinal game 2.,Double Jeopardy,"(4, 1)",TOP 40 MATH,2,"(400,)",False,"Tennessee Ernie Ford's ""Tons"" times Eddie Money's ""Tickets To Paradise""",32,1,1
4612,2004-09-28,2004 Tournament of Champions semifinal game 2.,Double Jeopardy,"(5, 1)",THE VEEP,1,"(400,)",False,His father was born Theodore Anagnostopoulos,Spiro Agnew,1,0
4612,2004-09-28,2004 Tournament of Champions semifinal game 2.,Double Jeopardy,"(6, 1)",LETTER PERFECT,12,"(400,)",False,"This letter begins the Shakespearean sonnet ""...truant muse, what shall be thy amends...""",O,1,0
4612,2004-09-28,2004 Tournament of Champions semifinal game 2.,Double Jeopardy,"(1, 2)",SCIENCE & NATURE,8,"(800,)",False,"A seal's these, also called vibrissae, sense vibrations in the water that can represent food",their whiskers,1,0
4612,2004-09-28,2004 Tournament of Champions semifinal game 2.,Double Jeopardy,"(2, 2)",ART & ARTISTS,22,"(800,)",False,"This Englishman described his work as ""modern moral subjects... similar to representations on the stage""",(William) Hogarth,1,0
4612,2004-09-28,2004 Tournament of Champions semifinal game 2.,Double Jeopardy,"(3, 2)",A CAJUN CATEGORY,27,"(800,)",False,"This Cajun favorite, deep-fried & dusted with sugar, is the state doughnut of Louisiana",a beignet,1,0
4612,2004-09-28,2004 Tournament of Champions semifinal game 2.,Double Jeopardy,"(4, 2)",TOP 40 MATH,3,"(800,)",False,"Rolling Stones' ""Nervous Breakdown"" number plus Beatles' ""Days A Week""",27,1,0
4612,2004-09-28,2004 Tournament of Champions semifinal game 2.,Double Jeopardy,"(5, 2)",THE VEEP,17,"(800,)",False,"Vice President under Thomas Jefferson, he was the first Vice President who did not later become President",Aaron Burr,1,0
4612,2004-09-28,2004 Tournament of Champions semifinal game 2.,Double Jeopardy,"(6, 2)",LETTER PERFECT,13,"(800,)",False,"As you might expect, this is the first letter in the poem ""Song of Myself""",I,1,0
4612,2004-09-28,2004 Tournament of Champions semifinal game 2.,Double Jeopardy,"(1, 3)",SCIENCE & NATURE,9,"(1000,)",True,A male moth's antennae are attuned to these released by female moths,pheromones,1,0
4612,2004-09-28,2004 Tournament of Champions semifinal game 2.,Double Jeopardy,"(2, 3)",ART & ARTISTS,23,"(1200,)",False,"Gericault's most famous work, ""The Raft of"" this ship, was based on a historic event & caused a political scandal",the Medusa,1,0
4612,2004-09-28,2004 Tournament of Champions semifinal game 2.,Double Jeopardy,"(3, 3)",A CAJUN CATEGORY,28,"(1200,)",False,"If we covered everything Cajun from A to Z, we'd finally come to this accordion-based musical style heard here",zydeco,1,0
4612,2004-09-28,2004 Tournament of Champions semifinal game 2.,Double Jeopardy,"(4, 3)",TOP 40 MATH,4,"(1200,)",False,"The Crests' ""Candles"" plus Boyz II Men's ""Season Of Loneliness""",20,1,0
4612,2004-09-28,2004 Tournament of Champions semifinal game 2.,Double Jeopardy,"(5, 3)",THE VEEP,18,"(1000,)",True,"This senator from Indiana who became Vice President has a city named for him--in Alaska, of all places",(Charles) Fairbanks,0,1
4612,2004-09-28,2004 Tournament of Champions semifinal game 2.,Double Jeopardy,"(6, 3)",LETTER PERFECT,14,"(1200,)",False,"John Doe played bass & wrote songs for this seminal punk rock band, ""discovered"" by Ray Manzarek of The Doors",X,1,0
4612,2004-09-28,2004 Tournament of Champions semifinal game 2.,Double Jeopardy,"(1, 4)",SCIENCE & NATURE,10,"(1600,)",False,It's the wavelike muscular contractions of the alimentary canal that move food through the digestive system,peristalsis,1,0
4612,2004-09-28,2004 Tournament of Champions semifinal game 2.,Double Jeopardy,"(2, 4)",ART & ARTISTS,24,"(1600,)",False,"His ""Jolly Toper"" of the 1600s is seen here",Franz Hals,0,3
4612,2004-09-28,2004 Tournament of Champions semifinal game 2.,Double Jeopardy,"(3, 4)",A CAJUN CATEGORY,29,"(1600,)",False,"After Louisiana, this state has the largest Cajun population, especially in areas like Port Arthur",Texas,1,0
4612,2004-09-28,2004 Tournament of Champions semifinal game 2.,Double Jeopardy,"(4, 4)",TOP 40 MATH,5,"(1600,)",False,"The speed Sammy Hagar ""Can't Drive"" minus Three Dog Night's title ""Loneliest Number""",54,1,0
4612,2004-09-28,2004 Tournament of Champions semifinal game 2.,Double Jeopardy,"(5, 4)",THE VEEP,19,"(1600,)",False,"The nation's 42nd Vice President, he was born in Ceylon... Ceylon, Minnesota, that is",(Walter) Mondale,1,0
4612,2004-09-28,2004 Tournament of Champions semifinal game 2.,Double Jeopardy,"(6, 4)",LETTER PERFECT,15,"(1600,)",False,"On a baseball scorecard, you can mark a walk with either a ""W"" or 2 of these",B,1,0
4612,2004-09-28,2004 Tournament of Champions semifinal game 2.,Double Jeopardy,"(1, 5)",SCIENCE & NATURE,11,"(2000,)",False,Conductors allow electric current to flow & these opposite materials restrict the flow of the current,insulators (or resistors),1,0
4612,2004-09-28,2004 Tournament of Champions semifinal game 2.,Double Jeopardy,"(2, 5)",ART & ARTISTS,25,"(2000,)",False,"Minerva, Venus & Juno are the 3 being ""judged"" in this famous Claude Lorrain painting",The Judgment of Paris,1,0
4612,2004-09-28,2004 Tournament of Champions semifinal game 2.,Double Jeopardy,"(3, 5)",A CAJUN CATEGORY,30,"(2000,)",False,"The Cajuns are descended from the Acadians, the subject of this famous 1847 poem",Evangeline,1,0
4612,2004-09-28,2004 Tournament of Champions semifinal game 2.,Double Jeopardy,"(4, 5)",TOP 40 MATH,6,"(2000,)",False,"In the song's title, Zager & Evans' ""In The Year"" this minus The Commodores' ""Times A Lady""",2522,1,0
4612,2004-09-28,2004 Tournament of Champions semifinal game 2.,Double Jeopardy,"(5, 5)",THE VEEP,20,"(2000,)",False,"As Harding's running mate in 1920, he said, ""One with the law is a majority""",(Calvin) Coolidge,1,0
4612,2004-09-28,2004 Tournament of Champions semifinal game 2.,Double Jeopardy,"(6, 5)",LETTER PERFECT,16,"(2000,)",False,The holes in the body of a typical violin get their name from being shaped like this letter,F,1,0
4612,2004-09-28,2004 Tournament of Champions semifinal game 2.,Final Jeopardy,"(1, 1)",POETS,0,"(2901, 0, 13201)",False,"A San Francisco resident since the 1950s, in 1998 he became the city's first Poet Laureate",Lawrence Ferlinghetti (owner of City Lights bookstore in San Francisco),2,1
