epNum,airDate,extra_info,round_name,coord,category,order,value,daily_double,question,answer,correctAttempts,wrongAttempts
4651,2004-11-22,2004 College Championship final game 1.,Jeopardy,"(1, 1)",PLACES FOR ANIMALS,2,"(200,)",False,"It can precede ""anemone"" or ""cow""",sea,1,0
4651,2004-11-22,2004 College Championship final game 1.,Jeopardy,"(2, 1)",STUPID ANSWERS,9,"(200,)",False,In 2002 Melissa Gilbert was reelected president of this guild formed by actors of the silver screen,the Screen Actors Guild,1,0
4651,2004-11-22,2004 College Championship final game 1.,Jeopardy,"(3, 1)",ROAD TRIPPING,29,"(200,)",False,"Just west of Davenport, the Iowa-80, one of these refuges for big rigs, features a dentist & barber shop",a truck stop,1,0
4651,2004-11-22,2004 College Championship final game 1.,Jeopardy,"(4, 1)",UNITS OF MEASURE,30,"(200,)",False,"To convert pints into these metric units of liquid measure, multiply by .47",a liter,1,0
4651,2004-11-22,2004 College Championship final game 1.,Jeopardy,"(5, 1)",WORD ORIGINS,4,"(200,)",False,"This light wood gets its name from the Spanish for ""raft"" because people in the tropics have used its logs for rafts",balsa,1,0
4651,2004-11-22,2004 College Championship final game 1.,Jeopardy,"(6, 1)","PITTSBURGH STEELERS, PIRATES & PENGUINS",1,"(200,)",False,This Puerto Rican Hall of Fame outfielder won 12 consecutive Gold Gloves during his 18-year career,(Roberto) Clemente,1,0
4651,2004-11-22,2004 College Championship final game 1.,Jeopardy,"(1, 2)",PLACES FOR ANIMALS,6,"(400,)",False,"This leopard lives at nearly 20,000 feet in Central Asia",a snow leopard,1,0
4651,2004-11-22,2004 College Championship final game 1.,Jeopardy,"(2, 2)",STUPID ANSWERS,10,"(400,)",False,The flag of the Organization of American States has 35 different ones of these on it,flags,1,0
4651,2004-11-22,2004 College Championship final game 1.,Jeopardy,"(3, 2)",ROAD TRIPPING,28,"(400,)",False,"Going west from Fargo, it's a 193-mile straight shot (about as straight as it gets) on I-94 to this state capital",Bismarck,1,0
4651,2004-11-22,2004 College Championship final game 1.,Jeopardy,"(4, 2)",UNITS OF MEASURE,24,"(400,)",False,This unit of weight used for gemstones equals 200 milligrams,carat,1,0
4651,2004-11-22,2004 College Championship final game 1.,Jeopardy,"(5, 2)",WORD ORIGINS,20,"(400,)",False,"The gigantic statue at Rhodes, one of the 7 ancient wonders, gave us this adjective meaning gigantic",colossal,1,0
4651,2004-11-22,2004 College Championship final game 1.,Jeopardy,"(6, 2)","PITTSBURGH STEELERS, PIRATES & PENGUINS",3,"(400,)",False,"A 10-time Pro Bowl defensive tackle, he wasn't so ""Mean"" when he tossed a kid his jersey in a Coke ad",Joe Greene,1,0
4651,2004-11-22,2004 College Championship final game 1.,Jeopardy,"(1, 3)",PLACES FOR ANIMALS,14,"(600,)",False,"Over 1,500 species of worm are named for this habitat",the earth,1,0
4651,2004-11-22,2004 College Championship final game 1.,Jeopardy,"(2, 3)",STUPID ANSWERS,11,"(600,)",False,"The great-grandson of a slave, he was the first black mayor of Washington, D.C.",Walter Washington,0,3
4651,2004-11-22,2004 College Championship final game 1.,Jeopardy,"(3, 3)",ROAD TRIPPING,25,"(600,)",False,"In Santa Fe, visit the USA's only art museum of international stature devoted to a single woman: her",Georgia O\'Keeffe,1,0
4651,2004-11-22,2004 College Championship final game 1.,Jeopardy,"(4, 3)",UNITS OF MEASURE,15,"(600,)",False,This unit for measuring type size was invented in 1737 by Pierre Simon Fournier,point,1,0
4651,2004-11-22,2004 College Championship final game 1.,Jeopardy,"(5, 3)",WORD ORIGINS,21,"(600,)",False,"Originally used to designate an errand boy, it was introduced into Scotland by golfer Mary, Queen of Scots",a caddy,1,0
4651,2004-11-22,2004 College Championship final game 1.,Jeopardy,"(6, 3)","PITTSBURGH STEELERS, PIRATES & PENGUINS",5,"(600,)",False,"This ""Miracle on Ice"" coach was the Penguin's head man in 1999 & 2000",(Herb) Brooks,1,0
4651,2004-11-22,2004 College Championship final game 1.,Jeopardy,"(1, 4)",PLACES FOR ANIMALS,18,"(800,)",False,"Grassy field that joins with ""lark""",meadow,1,0
4651,2004-11-22,2004 College Championship final game 1.,Jeopardy,"(2, 4)",STUPID ANSWERS,12,"(800,)",False,The very farthest west you can drive in the Florida Keys is to this island,Key West,1,0
4651,2004-11-22,2004 College Championship final game 1.,Jeopardy,"(3, 4)",ROAD TRIPPING,26,"(2000,)",True,There's a hang-gliding school named for this 2-word North Carolina town that became famous in 1903,Kitty Hawk,1,0
4651,2004-11-22,2004 College Championship final game 1.,Jeopardy,"(4, 4)",UNITS OF MEASURE,16,"(800,)",False,"Both the ounce & this unit of measure get their names from the Latin uncia, ""twelfth part""",the inch,0,3
4651,2004-11-22,2004 College Championship final game 1.,Jeopardy,"(5, 4)",WORD ORIGINS,22,"(800,)",False,"The Greek word ""iota"" gave us this 3-letter word that means to write down hastily",jot,1,0
4651,2004-11-22,2004 College Championship final game 1.,Jeopardy,"(6, 4)","PITTSBURGH STEELERS, PIRATES & PENGUINS",7,"(800,)",False,"Thomas Henderson said this Steeler QB ""couldn't spell cat if you spotted him the C & the A"", but he still won 4 Super Bowls",Terry Bradshaw,1,0
4651,2004-11-22,2004 College Championship final game 1.,Jeopardy,"(1, 5)",PLACES FOR ANIMALS,19,"(1000,)",False,This word refers to extreme opposites or a type of bear,polar,1,0
4651,2004-11-22,2004 College Championship final game 1.,Jeopardy,"(2, 5)",STUPID ANSWERS,13,"(1000,)",False,"(Cheryl and Sofia of the Clue Crew shoot some skeet.)  ""Pull!""  You should know the name of the person who releases the target in trap shooting",the puller,1,1
4651,2004-11-22,2004 College Championship final game 1.,Jeopardy,"(3, 5)",ROAD TRIPPING,27,"(1000,)",False,You can camp at Mazam Village when visiting this Northwestern body of water seen here,Crater Lake,1,0
4651,2004-11-22,2004 College Championship final game 1.,Jeopardy,"(4, 5)",UNITS OF MEASURE,17,"(1000,)",False,"By pedaling with all your might for a few minutes you can generate 250 watts, or barely one-third of this unit",horsepower,1,0
4651,2004-11-22,2004 College Championship final game 1.,Jeopardy,"(5, 5)",WORD ORIGINS,23,"(1000,)",False,They got their name from the wooden sandals worn by the French court to protect shoes on rainy days,galoshes,1,0
4651,2004-11-22,2004 College Championship final game 1.,Jeopardy,"(6, 5)","PITTSBURGH STEELERS, PIRATES & PENGUINS",8,"(1000,)",False,"You might see why this coach, seen here, tends to lead with this chin",Bill Cowher,1,0
4651,2004-11-22,2004 College Championship final game 1.,Double Jeopardy,"(1, 1)",CLIFFS NOTES,10,"(400,)",False,"The poet & his buddy Virgil spend some time in Hell, a fate you avoided by buying our version of this classic",The Divine Comedy,1,0
4651,2004-11-22,2004 College Championship final game 1.,Double Jeopardy,"(2, 1)",I HEAR YOU CALLING,21,"(400,)",False,"When this singer rings, it means she needs a partner for her Kabbalah class",Madonna,1,0
4651,2004-11-22,2004 College Championship final game 1.,Double Jeopardy,"(3, 1)",ROYAL SCANDALS,2,"(400,)",False,"""Drool Brittania"" might have been a better anthem for this English king who went insane & also lost the American colonies",George III,1,0
4651,2004-11-22,2004 College Championship final game 1.,Double Jeopardy,"(4, 1)",A REAL RHODES SCHOLAR,15,"(400,)",False,"A Rhodes Scholar, Howard Florey, led a research team at Oxford that discovered a way to mass-produce this antibiotic",penicillin,1,0
4651,2004-11-22,2004 College Championship final game 1.,Double Jeopardy,"(6, 1)","STEELERS, PIRATES & PENGUINS",1,"(400,)",False,"A ""Steel-drivin' Man"" who helped dig the Big Bend tunnel in the 1870s is said to be the basis of this folklore legend",John Henry,1,0
4651,2004-11-22,2004 College Championship final game 1.,Double Jeopardy,"(1, 2)",CLIFFS NOTES,11,"(800,)",False,"John Bunyan classic that we suspect has sold more ""Cliffs Notes"" copies than the real thing",Pilgrim\'s Progress,1,0
4651,2004-11-22,2004 College Championship final game 1.,Double Jeopardy,"(3, 2)",ROYAL SCANDALS,3,"(800,)",False,"This French dictator's sister Pauline was so scandalous, you might say her specialty was ""Foreign Affairs""",Napoleon,1,0
4651,2004-11-22,2004 College Championship final game 1.,Double Jeopardy,"(4, 2)",A REAL RHODES SCHOLAR,16,"(800,)",False,"Robert Reich met this man on the voyage to Oxford, where both were Rhodes Scholars, & later served as his Secretary of Labor",Bill Clinton,1,0
4651,2004-11-22,2004 College Championship final game 1.,Double Jeopardy,"(5, 2)",X GAMES,24,"(800,)",False,"In Britain, if you need these well-placed friends to land a job, they'd be spelled with an X instead of the CT",connections,1,0
4651,2004-11-22,2004 College Championship final game 1.,Double Jeopardy,"(6, 2)","STEELERS, PIRATES & PENGUINS",4,"(800,)",False,"In 1718 the British Navy took a little too much off the top of this pirate, captain of the Queen Anne's Revenge",Blackbeard,1,1
4651,2004-11-22,2004 College Championship final game 1.,Double Jeopardy,"(1, 3)",CLIFFS NOTES,14,"(1200,)",False,"Any 1 of the 3 Moliere plays which--admit it--you've only read in ""Cliffs Notes""","(1 of) The Misanthrope, Tartuffe or Le Bourgeois Gentilhomme",1,1
4651,2004-11-22,2004 College Championship final game 1.,Double Jeopardy,"(2, 3)",I HEAR YOU CALLING,25,"(1200,)",False,"It's ""The Long Road"" back to Canada when this band calls",Nickelback,0,3
4651,2004-11-22,2004 College Championship final game 1.,Double Jeopardy,"(3, 3)",ROYAL SCANDALS,7,"(1200,)",False,"Julia, the daughter of this first Roman emperor, was so outrageous he had her banished from Rome",Augustus,1,0
4651,2004-11-22,2004 College Championship final game 1.,Double Jeopardy,"(4, 3)",A REAL RHODES SCHOLAR,18,"(1200,)",False,This 2004 presidential hopeful graduated first in his class at West Point and was a Rhodes Scholar,Gen. Clark,1,0
4651,2004-11-22,2004 College Championship final game 1.,Double Jeopardy,"(5, 3)",X GAMES,22,"(1200,)",False,"Add an X to a word meaning ""a system of laws"" to get this term for an early type of book",a codex,0,3
4651,2004-11-22,2004 College Championship final game 1.,Double Jeopardy,"(6, 3)","STEELERS, PIRATES & PENGUINS",5,"(1200,)",False,"Maxing out at about 4 feet tall, this largest type of penguin can weigh 100 pounds",an emperor penguin,1,0
4651,2004-11-22,2004 College Championship final game 1.,Double Jeopardy,"(1, 4)",CLIFFS NOTES,13,"(1600,)",False,"Unlike Pangloss, this title character finally wises up, like you did when you got our version of this classic",Candide,1,0
4651,2004-11-22,2004 College Championship final game 1.,Double Jeopardy,"(3, 4)",ROYAL SCANDALS,8,"(1600,)",False,"Called ""The Merry Monarch"", this English king had 14 children by mistresses, but failed to sire a legal heir",Charles II,0,3
4651,2004-11-22,2004 College Championship final game 1.,Double Jeopardy,"(4, 4)",A REAL RHODES SCHOLAR,19,"(1600,)",False,This American astronomer for whom a telescope is named studied law as a Rhodes Scholar,Hubble,1,0
4651,2004-11-22,2004 College Championship final game 1.,Double Jeopardy,"(5, 4)",X GAMES,23,"(1600,)",False,"In Roman numerals, one-fifth of CL is this saucy-looking result",XXX,0,3
4651,2004-11-22,2004 College Championship final game 1.,Double Jeopardy,"(6, 4)","STEELERS, PIRATES & PENGUINS",6,"(2000,)",True,"Set in a coastal town in Cornwall, this Gilbert and Sullivan operetta premiered in 1879",The Pirates of Penzance,1,0
4651,2004-11-22,2004 College Championship final game 1.,Double Jeopardy,"(1, 5)",CLIFFS NOTES,12,"(2000,)",False,"Joyce classic about the Earwicker family... uh, maybe... okay, we admit it; we haven't read it either",Finnegan\'s Wake,1,1
4651,2004-11-22,2004 College Championship final game 1.,Double Jeopardy,"(3, 5)",ROYAL SCANDALS,9,"(2000,)",False,This Hungarian piano virtuoso was scandalously involved with the married princess Carolyn Sayn-Wittgenstein,Franz Liszt,1,0
4651,2004-11-22,2004 College Championship final game 1.,Double Jeopardy,"(4, 5)",A REAL RHODES SCHOLAR,17,"(2000,)",False,"This International Exchange Scholarship is named for the U.S. Senator, a Rhodes Scholar, who sponsored it",the Fulbright Scholarship,1,1
4651,2004-11-22,2004 College Championship final game 1.,Double Jeopardy,"(6, 5)","STEELERS, PIRATES & PENGUINS",20,"(2000,)",False,"In 1901, merging with this steeler, J.P. Morgan said, ""I congratulate you on being the richest man in the world""",Andrew Carnegie,1,0
4651,2004-11-22,2004 College Championship final game 1.,Final Jeopardy,"(1, 1)",20th CENTURY AMERICANS,0,"(3800, 6200, 3600)",False,"At the dedication of a fountain at Radcliffe College in 1960, she began her speech with the single word ""Water""",Helen Keller,0,3
