epNum,airDate,extra_info,round_name,coord,category,order,value,daily_double,question,answer,correctAttempts,wrongAttempts
4655,2004-11-26,Ken Jennings game 73.,Jeopardy,"(1, 1)",THE 50 STATES,2,"(200,)",False,It follows Miami in the name of Florida's most populous county,Dade,1,0
4655,2004-11-26,Ken Jennings game 73.,Jeopardy,"(2, 1)","I'M NOT A DOCTOR, BUT I PLAY ONE ON TV",1,"(200,)",False,Dr. Benjamin Franklin Pierce,Alan Alda,1,0
4655,2004-11-26,Ken Jennings game 73.,Jeopardy,"(3, 1)",AWARDS,21,"(200,)",False,"Michael Collins, Buzz Aldrin & this man were the first astronauts to receive the Presidential Medal of Freedom",Neil Armstrong,1,0
4655,2004-11-26,Ken Jennings game 73.,Jeopardy,"(4, 1)",NAME THE DECADE,22,"(200,)",False,"Ford Motors goes public, Dr. Seuss pens ""The Cat in the Hat"" & Ronald Reagan weds wife No. 2",the 1950s,1,1
4655,2004-11-26,Ken Jennings game 73.,Jeopardy,"(5, 1)",FRAIDY CAT,7,"(200,)",False,"Suriphobia, fear of these, may set a housewife screaming while standing on a kitchen chair",mice,1,0
4655,2004-11-26,Ken Jennings game 73.,Jeopardy,"(6, 1)","CROSSWORD CLUES ""D""",16,"(200,)",False,"Bram Stoker novel you can ""count"" on(7)",Dracula,1,0
4655,2004-11-26,Ken Jennings game 73.,Jeopardy,"(1, 2)",THE 50 STATES,12,"(400,)",False,"As you might expect, its state domestic animal is the dairy cow",Wisconsin,1,0
4655,2004-11-26,Ken Jennings game 73.,Jeopardy,"(2, 2)","I'M NOT A DOCTOR, BUT I PLAY ONE ON TV",3,"(400,)",False,Dr. Michaela Quinn,Jane Seymour,1,0
4655,2004-11-26,Ken Jennings game 73.,Jeopardy,"(3, 2)",AWARDS,23,"(400,)",False,In 1912 the Int'l Committee of the Red Cross created a medal for nursing named for this 19th century British woman,Florence Nightingale,1,0
4655,2004-11-26,Ken Jennings game 73.,Jeopardy,"(4, 2)",NAME THE DECADE,27,"(400,)",False,"(Al Franken reads.)  Chernobyl, Iran-Contra & Flock of Seagulls haircuts weren't exactly what I had in mind when I named this decade after me...""Al Franken""",the 1980s,1,0
4655,2004-11-26,Ken Jennings game 73.,Jeopardy,"(5, 2)",FRAIDY CAT,8,"(400,)",False,"Gallophobia is not a fear of wine, but a fear of this country that produces a lot of wine",France,1,0
4655,2004-11-26,Ken Jennings game 73.,Jeopardy,"(6, 2)","CROSSWORD CLUES ""D""",17,"(400,)",False,Samson's locks-smith(7),Delilah,1,0
4655,2004-11-26,Ken Jennings game 73.,Jeopardy,"(1, 3)",THE 50 STATES,13,"(600,)",False,The westernmost town in the lower 48 states is La Push in this state,Washington,1,0
4655,2004-11-26,Ken Jennings game 73.,Jeopardy,"(2, 3)","I'M NOT A DOCTOR, BUT I PLAY ONE ON TV",4,"(600,)",False,Dr. Doogie Howser,Neil Patrick Harris,1,0
4655,2004-11-26,Ken Jennings game 73.,Jeopardy,"(3, 3)",AWARDS,24,"(600,)",False,The Thailand edition of this CBS series won a 2003 People's Choice Award for best reality program,Survivor,1,0
4655,2004-11-26,Ken Jennings game 73.,Jeopardy,"(4, 3)",NAME THE DECADE,28,"(600,)",False,"This decade sees a congressional ""compromise"", the first Lincoln-Douglas debate & the death of Kierkegaard",1850s,1,0
4655,2004-11-26,Ken Jennings game 73.,Jeopardy,"(5, 3)",FRAIDY CAT,9,"(600,)",False,"""Erythrophobia is the fear of doing this"", he said, showing some embarrassment",blushing,1,0
4655,2004-11-26,Ken Jennings game 73.,Jeopardy,"(6, 3)","CROSSWORD CLUES ""D""",18,"(600,)",False,Greek gelt(8),drachmas,1,1
4655,2004-11-26,Ken Jennings game 73.,Jeopardy,"(1, 4)",THE 50 STATES,14,"(800,)",False,"The highest temperature ever recorded in this state was 117 degrees on July 5, 1985 in St. George",Utah,1,0
4655,2004-11-26,Ken Jennings game 73.,Jeopardy,"(2, 4)","I'M NOT A DOCTOR, BUT I PLAY ONE ON TV",5,"(800,)",False,"Dr. Leonard ""Bones"" McCoy",DeForest Kelley,1,0
4655,2004-11-26,Ken Jennings game 73.,Jeopardy,"(3, 4)",AWARDS,25,"(800,)",False,The Hugo & Nebula awards are presented to writers in this genre,science fiction,1,0
4655,2004-11-26,Ken Jennings game 73.,Jeopardy,"(4, 4)",NAME THE DECADE,29,"(800,)",False,"Edison invents the phonograph, U.S. Grant is re-elected & Bizet writes ""Carmen""",1870s,1,0
4655,2004-11-26,Ken Jennings game 73.,Jeopardy,"(5, 4)",FRAIDY CAT,10,"(800,)",False,"Hey dude, surfers aren't cymophobic; they don't fear these, man",waves,1,0
4655,2004-11-26,Ken Jennings game 73.,Jeopardy,"(6, 4)","CROSSWORD CLUES ""D""",19,"(800,)",False,Perry Mason's Street(5),Della,1,0
4655,2004-11-26,Ken Jennings game 73.,Jeopardy,"(1, 5)",THE 50 STATES,15,"(1000,)",False,"This state's Kennebec River meets with its main tributary, the Androscoggin, northeast of Brunswick",Maine,1,0
4655,2004-11-26,Ken Jennings game 73.,Jeopardy,"(2, 5)","I'M NOT A DOCTOR, BUT I PLAY ONE ON TV",6,"(1000,)",False,Dr. Joe Gannon,Chad Everett,1,0
4655,2004-11-26,Ken Jennings game 73.,Jeopardy,"(3, 5)",AWARDS,26,"(1000,)",False,In 1965 this U.N. Secretary-General from Asia became the first to win the Nehru Award for Int'l Understanding,U Thant,1,0
4655,2004-11-26,Ken Jennings game 73.,Jeopardy,"(4, 5)",NAME THE DECADE,30,"(1000,)",False,"Pre-""The West Wing"", the real Josiah Bartlett governs N.H., John Paul Jones gives up the fight & the Jay Treaty is inked",1790s,1,2
4655,2004-11-26,Ken Jennings game 73.,Jeopardy,"(5, 5)",FRAIDY CAT,11,"(2000,)",True,A person with ornithophobia & apiphobia may avoid a talk on this subject feared by erotophobics,the birds and the bees (or sex),1,0
4655,2004-11-26,Ken Jennings game 73.,Jeopardy,"(6, 5)","CROSSWORD CLUES ""D""",20,"(1000,)",False,"""American Tragedian"" Theodore(7)",Dreiser,1,0
4655,2004-11-26,Ken Jennings game 73.,Double Jeopardy,"(1, 1)",ART HISTORY,8,"(400,)",False,"6th century B.C. Greece must have been a happy place, as this facial expression is characteristic of its sculpture",a smile,1,0
4655,2004-11-26,Ken Jennings game 73.,Double Jeopardy,"(2, 1)",& JOAN RIVERS RUNS THROUGH IT,26,"(400,)",False,"Since 1986 when Joan left ""The Tonight Show"", this host has reportedly said ""No"" when asked ""Can we talk?""",Johnny Carson,1,1
4655,2004-11-26,Ken Jennings game 73.,Double Jeopardy,"(3, 1)",SHAKESPEARE'S SMALL PARTS,2,"(400,)",False,"Nym, a minor character, is a follower of this stout fellow in ""The Merry Wives of Windsor""",Falstaff,1,0
4655,2004-11-26,Ken Jennings game 73.,Double Jeopardy,"(4, 1)",COMMON BONDS,13,"(400,)",False,"Scope,Lavoris,Listerine",brands of mouthwash,1,0
4655,2004-11-26,Ken Jennings game 73.,Double Jeopardy,"(5, 1)","THE ""K"" TEAM",18,"(400,)",False,"He also said, ""Ask not what America will do for you, but what together we can do for the freedom of man""",John F. Kennedy,1,0
4655,2004-11-26,Ken Jennings game 73.,Double Jeopardy,"(6, 1)",MUSICAL IDIOMS,1,"(400,)",False,It's the action heard here; someone talking in fantasies is said to be doing it,"whistling ""Dixie""",1,0
4655,2004-11-26,Ken Jennings game 73.,Double Jeopardy,"(1, 2)",ART HISTORY,9,"(800,)",False,"Carlo Carlone's team painted these, originally an Italian term, on palace & church walls across Europe",frescoes,1,0
4655,2004-11-26,Ken Jennings game 73.,Double Jeopardy,"(2, 2)",& JOAN RIVERS RUNS THROUGH IT,27,"(800,)",False,Ms. R was Miss Piggy's coworker (we can only imagine the office dish) when the Muppets took this title place in '84,Manhattan,1,0
4655,2004-11-26,Ken Jennings game 73.,Double Jeopardy,"(3, 2)",SHAKESPEARE'S SMALL PARTS,4,"(800,)",False,"During his brief time on stage, Curtis, this man's aged servant, does get to say ""Shrew""",Petruchio,1,0
4655,2004-11-26,Ken Jennings game 73.,Double Jeopardy,"(4, 2)",COMMON BONDS,14,"(800,)",False,"Coral,krait,moccasin",snakes,1,0
4655,2004-11-26,Ken Jennings game 73.,Double Jeopardy,"(5, 2)","THE ""K"" TEAM",19,"(800,)",False,"On Oct. 6, 1951, this magnate died in Battle Creek, Michigan",Kellogg,1,0
4655,2004-11-26,Ken Jennings game 73.,Double Jeopardy,"(6, 2)",MUSICAL IDIOMS,3,"(2000,)",True,"To ""pay"" him is to bear the consequences of your action",the piper,1,0
4655,2004-11-26,Ken Jennings game 73.,Double Jeopardy,"(1, 3)",ART HISTORY,10,"(1200,)",False,The frolicsome painting seen here dates from this century,the 18th,1,0
4655,2004-11-26,Ken Jennings game 73.,Double Jeopardy,"(2, 3)",& JOAN RIVERS RUNS THROUGH IT,28,"(1200,)",False,"Joan voiced Julie, Bruce Willis' new baby sister, in this 1989 comedy",Look Who\'s Talking,1,0
4655,2004-11-26,Ken Jennings game 73.,Double Jeopardy,"(3, 3)",SHAKESPEARE'S SMALL PARTS,5,"(1200,)",False,Those portraying a Norwegian captain in this play don't have to worry about memorizing a lot of lines,Hamlet,1,0
4655,2004-11-26,Ken Jennings game 73.,Double Jeopardy,"(4, 3)",COMMON BONDS,15,"(1200,)",False,"Quicksilver Messenger Service,Hues Corporation,Big Brother and the Holding Company",rock bands,1,0
4655,2004-11-26,Ken Jennings game 73.,Double Jeopardy,"(5, 3)","THE ""K"" TEAM",20,"(1200,)",False,"On August 10, 1996 Bob Dole picked this man to be his running mate",Jack Kemp,1,0
4655,2004-11-26,Ken Jennings game 73.,Double Jeopardy,"(6, 3)",MUSICAL IDIOMS,23,"(1200,)",False,"This expression for what's being done here is found in Psalm 9""You are magnificent, you're marvelous, you're triumphant, and you're grand...""",singing his praises,1,0
4655,2004-11-26,Ken Jennings game 73.,Double Jeopardy,"(1, 4)",ART HISTORY,11,"(9800,)",True,The analytic type of this style broke the world into fragments; the synthetic type put it together,Cubism,1,0
4655,2004-11-26,Ken Jennings game 73.,Double Jeopardy,"(2, 4)",& JOAN RIVERS RUNS THROUGH IT,29,"(1600,)",False,"Joan gave a robotic performance as Dot Matrix in this Mel Brooks ""Star Wars"" spoof",Spaceballs,1,0
4655,2004-11-26,Ken Jennings game 73.,Double Jeopardy,"(3, 4)",SHAKESPEARE'S SMALL PARTS,6,"(1600,)",False,"In this fairy tale, Snug doesn't get the lion's share of lines, but he does get the lion's lines",A Midsummer Night\'s Dream,1,0
4655,2004-11-26,Ken Jennings game 73.,Double Jeopardy,"(4, 4)",COMMON BONDS,16,"(1600,)",False,"Movies,prospective employees,back doors",things that are screened,0,3
4655,2004-11-26,Ken Jennings game 73.,Double Jeopardy,"(5, 4)","THE ""K"" TEAM",21,"(1600,)",False,"This playwright's ""Man Who Came to Dinner"" character Sheridan Whiteside was such a plum role he even played it himself",George S. Kaufman,0,3
4655,2004-11-26,Ken Jennings game 73.,Double Jeopardy,"(6, 4)",MUSICAL IDIOMS,24,"(1600,)",False,"This 2-word phrase can mean a counterfeit bill or, when you ""strike"" it, a mistake in tone",a false note,1,0
4655,2004-11-26,Ken Jennings game 73.,Double Jeopardy,"(1, 5)",ART HISTORY,12,"(2000,)",False,"Georges de la Tour mastered candlelight in the type of painting called this, also a musical term",Nocturne,1,0
4655,2004-11-26,Ken Jennings game 73.,Double Jeopardy,"(2, 5)",& JOAN RIVERS RUNS THROUGH IT,30,"(2000,)",False,"Joan narrated The Electric Co.'s ""Adventures of Letterman"" starring him, though it wasn't in Wonka Vision",Gene Wilder,1,0
4655,2004-11-26,Ken Jennings game 73.,Double Jeopardy,"(3, 5)",SHAKESPEARE'S SMALL PARTS,7,"(2000,)",False,"In Act V, Scene ii Dr. Butts shows up for a couple of lines with Cranmer & this title king",Henry VIII,1,0
4655,2004-11-26,Ken Jennings game 73.,Double Jeopardy,"(4, 5)",COMMON BONDS,17,"(2000,)",False,"The Rhine Valley,a chessboard,Vernon & Irene's Dance School",things with castles,1,0
4655,2004-11-26,Ken Jennings game 73.,Double Jeopardy,"(5, 5)","THE ""K"" TEAM",22,"(2000,)",False,Anita O'Day & June Christy were singers for this man's 1940s big band,Stan Kenton,0,3
4655,2004-11-26,Ken Jennings game 73.,Double Jeopardy,"(6, 5)",MUSICAL IDIOMS,25,"(2000,)",False,This 2-word part of the piano is also a verb meaning to downplay something harsh or upsetting,soft-pedal,1,1
4655,2004-11-26,Ken Jennings game 73.,Final Jeopardy,"(1, 1)",19th CENTURY U.S. HISTORY,0,"(19, 7, 9200)",False,"Of the 5 times Congress has declared war, the 3 during the 19th century were against these 3 nations","Britain, Spain, & Mexico",1,2
