epNum,airDate,extra_info,round_name,coord,category,order,value,daily_double,question,answer,correctAttempts,wrongAttempts
4686,2005-01-10,,Jeopardy,"(1, 1)",PRESIDENTIAL LIBRARIES,14,"(200,)",False,"The Library of the first President Bush, in Texas, has a film of his first steps, in this state where the family vacations",Maine,1,0
4686,2005-01-10,,Jeopardy,"(2, 1)",FILMS OF THE '70s,1,"(200,)",False,"Not the frost, but the blood was on the punkin in this 1978 Jamie Lee Curtis film",Halloween,1,0
4686,2005-01-10,,Jeopardy,"(3, 1)",SO NICE THEY NICKNAMED ME TWICE,24,"(200,)",False,"""The Chairman of the Board"", ""Ol' Blue Eyes""",Frank Sinatra,1,0
4686,2005-01-10,,Jeopardy,"(4, 1)",BACK TO THE HOTEL,19,"(200,)",False,"In 1975, Lyn Weiner opened the Kennelworth, a hotel in New York City for these pets",dogs,1,0
4686,2005-01-10,,Jeopardy,"(5, 1)",THE WEATHER CHANNEL,6,"(200,)",False,"When it's muggy, ""it's not the heat, it's"" this, the amount of water vapor in the atmosphere",humidity,1,0
4686,2005-01-10,,Jeopardy,"(6, 1)",THE BIRD IS THE WORD,11,"(200,)",False,"What's good for the goose is good for this, also meaning a glance",the gander,1,0
4686,2005-01-10,,Jeopardy,"(1, 2)",PRESIDENTIAL LIBRARIES,15,"(400,)",False,"The war exhibit ""Korea Plus 50: No Longer Forgotten"" is a joint-access project between the libraries of these 2 presidents",Truman and Eisenhower,1,0
4686,2005-01-10,,Jeopardy,"(2, 2)",FILMS OF THE '70s,2,"(400,)",False,"(Hi.  I'm Bob Woodward.)  In ""All the President's Men"", Carl Bernstein was played by Dustin Hoffman & I was portrayed by this handsome star who bears no resemblence to me",Robert Redford,1,0
4686,2005-01-10,,Jeopardy,"(3, 2)",SO NICE THEY NICKNAMED ME TWICE,25,"(400,)",False,"""America's Sweetheart"", ""Little Sure Shot""",Annie Oakley,1,0
4686,2005-01-10,,Jeopardy,"(4, 2)",BACK TO THE HOTEL,20,"(400,)",False,The Celtic Lodge and Kelly's Hotel are famous hotels in this world capital,Dublin,1,0
4686,2005-01-10,,Jeopardy,"(5, 2)",THE WEATHER CHANNEL,7,"(400,)",False,Each second about 100 of these natural electrical discharges occur somewhere on Earth,lightning strikes,1,0
4686,2005-01-10,,Jeopardy,"(6, 2)",THE BIRD IS THE WORD,12,"(400,)",False,"That this bird leaves its eggs in other birds' nests, that's just ""crazy"", man",the cuckoo,0,3
4686,2005-01-10,,Jeopardy,"(1, 3)",PRESIDENTIAL LIBRARIES,16,"(600,)",False,The Ford Library is on the campus of this Ford alma mater,the University of Michigan,1,0
4686,2005-01-10,,Jeopardy,"(2, 3)",FILMS OF THE '70s,3,"(600,)",False,A canoe trip into the Georgia backwoods became a living nightmare for four friends in this 1972 film,Deliverance,1,0
4686,2005-01-10,,Jeopardy,"(3, 3)",SO NICE THEY NICKNAMED ME TWICE,26,"(600,)",False,"""Conqueror of the World"", ""Macedonia's Madman""",Alexander the Great,1,0
4686,2005-01-10,,Jeopardy,"(4, 3)",BACK TO THE HOTEL,21,"(600,)",False,This large ocean liner that's been docked in Long Beach since 1967 is a hotel & tourist attraction,Queen Mary,1,0
4686,2005-01-10,,Jeopardy,"(5, 3)",THE WEATHER CHANNEL,8,"(600,)",False,"A ""little"" one of these ""ages"" ran between the 14th and 19th Centuries",ice age,1,0
4686,2005-01-10,,Jeopardy,"(6, 3)",THE BIRD IS THE WORD,13,"(600,)",False,"It's a glossy black bird, or to toot your own horn",a crow,1,0
4686,2005-01-10,,Jeopardy,"(1, 4)",PRESIDENTIAL LIBRARIES,17,"(800,)",False,"The LBJ Library sells CDs of the President's phone calls, like the following one with herLBJ: ""...how we can carry on, if you give us a little strength.""Woman: ""But you know what I wanted to say to you about that letter?  I know how rare a letter is in a president's handwriting.""",Jacqueline Kennedy,0,3
4686,2005-01-10,,Jeopardy,"(2, 4)",FILMS OF THE '70s,4,"(600,)",True,"For this '74 flick, Mel Brooks used some of the same lab equipment that was used in a 1931 film",Young Frankenstein,1,0
4686,2005-01-10,,Jeopardy,"(3, 4)",SO NICE THEY NICKNAMED ME TWICE,27,"(800,)",False,"""The Father of the H-Bomb"", ""Dr. Strangelove""",Edward Teller,0,3
4686,2005-01-10,,Jeopardy,"(4, 4)",BACK TO THE HOTEL,22,"(800,)",False,"With canals, piazzas, and St. Mark's Square, this Vegas hotel sits on the old Sands Hotel site",the Venetian,1,0
4686,2005-01-10,,Jeopardy,"(5, 4)",THE WEATHER CHANNEL,9,"(800,)",False,"In terms of rainfall, it's the driest continent after Antarctica",Australia,0,3
4686,2005-01-10,,Jeopardy,"(6, 4)",THE BIRD IS THE WORD,29,"(800,)",False,Something done on a whim may be done on this songbird of the family alaudidae,a lark,1,0
4686,2005-01-10,,Jeopardy,"(1, 5)",PRESIDENTIAL LIBRARIES,18,"(1000,)",False,Lyn Nofziger and Edwin Meese have their own sets of folders for perusal at his library,Ronald Reagan,0,3
4686,2005-01-10,,Jeopardy,"(2, 5)",FILMS OF THE '70s,5,"(1000,)",False,Erich Segal actually wrote the screenplay for this 1970 movie first; then the novel,Love Story,1,0
4686,2005-01-10,,Jeopardy,"(3, 5)",SO NICE THEY NICKNAMED ME TWICE,28,"(1000,)",False,"""The Poet of the Commonplace"", ""The Children's Poet""",Longfellow,0,3
4686,2005-01-10,,Jeopardy,"(4, 5)",BACK TO THE HOTEL,23,"(1000,)",False,"This ""presidential"" hotel was elected to host the first Academy Awards ceremony",the Roosevelt,1,0
4686,2005-01-10,,Jeopardy,"(5, 5)",THE WEATHER CHANNEL,10,"(1000,)",False,"When the folks at the National Weather Service are feeling a bit ""DZ,"" ""DZ"" stands for this weather condition",drizzle,1,0
4686,2005-01-10,,Jeopardy,"(6, 5)",THE BIRD IS THE WORD,30,"(1000,)",False,(Jimmy of the Clue Crew holds a pink disc.)  It's the general two-word term for a trap shooting target--live ones went out in the early 1900s,a clay pigeon,1,0
4686,2005-01-10,,Double Jeopardy,"(1, 1)",FIRST THINGS FIRST,6,"(400,)",False,"Per the U.S. Naval Observatory, the date of the first day of the current millennium","January 1, 2001",1,0
4686,2005-01-10,,Double Jeopardy,"(2, 1)",SPORTS TROPHIES,1,"(400,)",False,The Davis Cup,tennis (golf accepted),1,0
4686,2005-01-10,,Double Jeopardy,"(3, 1)",ART,17,"(400,)",False,"Ususally an altarpiece, it's a painting consisting of 3 separate panels",a triptych,1,0
4686,2005-01-10,,Double Jeopardy,"(4, 1)",A RANK CATEGORY,26,"(400,)",False,It's the military rank the Constitution gives the U.S. President,Commander in Chief,1,0
4686,2005-01-10,,Double Jeopardy,"(5, 1)",OLD NAMES ON THE MAP,4,"(400,)",False,"After the British took over this island in 1797, they anglicized Puerto de Espana to Port of Spain",Trinidad,0,3
4686,2005-01-10,,Double Jeopardy,"(6, 1)","CATCHING SOME ""ZZ""s",3,"(400,)",False,"Also known as a silvertip, it can weigh up to 900 pounds",a grizzly bear,0,3
4686,2005-01-10,,Double Jeopardy,"(1, 2)",FIRST THINGS FIRST,7,"(800,)",False,"He wasn't a scenery-chewing actor, he was the first ""astrochimp"" that the U.S. launched into space",Ham,0,3
4686,2005-01-10,,Double Jeopardy,"(2, 2)",SPORTS TROPHIES,2,"(800,)",False,The Stanley Cup,hockey,1,0
4686,2005-01-10,,Double Jeopardy,"(3, 2)",ART,18,"(800,)",False,"He advocated sfumato, a subtle blending of tones, saying light and shade should blend like smoke as seen here",Da Vinci,0,3
4686,2005-01-10,,Double Jeopardy,"(4, 2)",A RANK CATEGORY,27,"(800,)",False,A Yokozuna is an athlete who has reaced the highest rank in this sport,sumo wrestling,1,0
4686,2005-01-10,,Double Jeopardy,"(5, 2)",OLD NAMES ON THE MAP,5,"(800,)",False,In 1946 the name of Podgorica was changed to this for Yugoslavia's leader; it was changed back in 1992,Titograd,0,3
4686,2005-01-10,,Double Jeopardy,"(6, 2)","CATCHING SOME ""ZZ""s",22,"(800,)",False,To overpower or dim the vision of by intense light,dazzle,1,0
4686,2005-01-10,,Double Jeopardy,"(1, 3)",FIRST THINGS FIRST,8,"(1200,)",False,In 1985 Andy Warhol did the first painting in what has become a big ad campaign for this vodka,Absolut,1,0
4686,2005-01-10,,Double Jeopardy,"(2, 3)",SPORTS TROPHIES,11,"(1200,)",False,The Jules Rimet Trophy,soccer,0,3
4686,2005-01-10,,Double Jeopardy,"(3, 3)",ART,19,"(1200,)",False,"Andre Breton hailed this man's art as ""the most hallucinatory known until now""",Dalí,1,0
4686,2005-01-10,,Double Jeopardy,"(4, 3)",A RANK CATEGORY,28,"(1200,)",False,"A lesser official in a royal household; some are ""of the guard""",yeoman,0,3
4686,2005-01-10,,Double Jeopardy,"(5, 3)",OLD NAMES ON THE MAP,14,"(1200,)",False,"This Spanish port was once Carthago Nova, or ""New Carthage""",Cartagena,0,3
4686,2005-01-10,,Double Jeopardy,"(6, 3)","CATCHING SOME ""ZZ""s",23,"(1200,)",False,"""Swift"" nickname of Supreme Court Justice Byron White",Whizzer,1,0
4686,2005-01-10,,Double Jeopardy,"(1, 4)",FIRST THINGS FIRST,9,"(3000,)",True,City Lights Books helped folks lacking space &/or money as the USA's first bookstore to sell only these,paperbacks,0,1
4686,2005-01-10,,Double Jeopardy,"(2, 4)",SPORTS TROPHIES,12,"(500,)",True,The Air Canada Silver Broom,curling,1,0
4686,2005-01-10,,Double Jeopardy,"(3, 4)",ART,20,"(1600,)",False,"Aptly, Georgia O'Keeffe's first one-woman show was at this man's 291 Gallery",Alfred Stieglitz,0,3
4686,2005-01-10,,Double Jeopardy,"(4, 4)",A RANK CATEGORY,29,"(1600,)",False,It's the Russian term for the son & heir of a czar,czarevich,0,3
4686,2005-01-10,,Double Jeopardy,"(5, 4)",OLD NAMES ON THE MAP,15,"(1600,)",False,"Madagascar retained the first 2 letters of this, its previous name",The Malagasy Republic,0,3
4686,2005-01-10,,Double Jeopardy,"(6, 4)","CATCHING SOME ""ZZ""s",24,"(1600,)",False,He's the conqueror of Jerusalem mentioned in II Kings 24,Nebuchadnezzar,1,0
4686,2005-01-10,,Double Jeopardy,"(1, 5)",FIRST THINGS FIRST,10,"(2000,)",False,In March 1825 Joel R. Poinsett was confirmed as the first U.S. minister to this country,Mexico,0,3
4686,2005-01-10,,Double Jeopardy,"(2, 5)",SPORTS TROPHIES,13,"(2000,)",False,The Lonsdale Belt,boxing,0,3
4686,2005-01-10,,Double Jeopardy,"(3, 5)",ART,21,"(2000,)",False,Courbet was the leader of this movement; verism is an extreme form of it,realism,0,3
4686,2005-01-10,,Double Jeopardy,"(4, 5)",A RANK CATEGORY,30,"(2000,)",False,"From a word meaning ""to send"", this 5-letter word designates an ""extraordinary"" diplomat",envoy,1,0
4686,2005-01-10,,Double Jeopardy,"(5, 5)",OLD NAMES ON THE MAP,16,"(2000,)",False,"What's now Kaliningrade, Russia was the capital of East Prussia under this name meaning ""King's Mountain""",Königsberg,0,3
4686,2005-01-10,,Double Jeopardy,"(6, 5)","CATCHING SOME ""ZZ""s",25,"(2000,)",False,This port city is the Republic of the Congo's capital,Brazzaville,1,0
4686,2005-01-10,,Final Jeopardy,"(1, 1)",20th CENTURY AUTHORS,0,"(400, 1300, 2400)",False,"This Russian-born author & scientist who died in 1992 said, ""I do not fear computers.  I fear the lack of them""",Isaac Asimov,3,0
