epNum,airDate,extra_info,round_name,coord,category,order,value,daily_double,question,answer,correctAttempts,wrongAttempts
4737,2005-03-22,"2005 Ultimate Tournament of Champions Round 1, game 30.",Jeopardy,"(1, 1)",WE WERE SOLDIERS,21,"(200,)",False,For General John Bell Hood this war cost him an arm & a leg (literally) at Gettysburg & Chickamauga,the Civil War,1,0
4737,2005-03-22,"2005 Ultimate Tournament of Champions Round 1, game 30.",Jeopardy,"(2, 1)",ROCK BAND DRUMMERS,1,"(200,)",False,In the beginning of Phil Collins' career was a stint as the drummer of this band,Genesis,1,0
4737,2005-03-22,"2005 Ultimate Tournament of Champions Round 1, game 30.",Jeopardy,"(3, 1)","BEN, BENJAMIN OR JUST PLAIN B",22,"(200,)",False,It indicates a playing piece in chess,just plain B,1,0
4737,2005-03-22,"2005 Ultimate Tournament of Champions Round 1, game 30.",Jeopardy,"(4, 1)",WORD ORIGINS,5,"(200,)",False,"The English borrowed this Tongan word for ""forbidden"" & made it a noun referring to the prohibition itself",taboo,1,0
4737,2005-03-22,"2005 Ultimate Tournament of Champions Round 1, game 30.",Jeopardy,"(5, 1)",DO IT LIKE THE EUROPEANS,11,"(200,)",False,"Europeans know this Louvre attraction as ""La Gioconda""",the Mona Lisa,1,0
4737,2005-03-22,"2005 Ultimate Tournament of Champions Round 1, game 30.",Jeopardy,"(6, 1)","THAT'S SO ""CONTINENTAL""",16,"(200,)",False,"It met for the first time in at Carpenter's Hall in Philadelphia on September 5, 1774",Continental Congress,1,0
4737,2005-03-22,"2005 Ultimate Tournament of Champions Round 1, game 30.",Jeopardy,"(1, 2)",WE WERE SOLDIERS,23,"(400,)",False,"In early 1944, George Patton assumed command of this army & planned a French campaign",the Third Army,1,0
4737,2005-03-22,"2005 Ultimate Tournament of Champions Round 1, game 30.",Jeopardy,"(2, 2)",ROCK BAND DRUMMERS,2,"(400,)",False,I'll be a believer when you ID this band for whom Micky Dolenz tapped the toms,The Monkees,1,0
4737,2005-03-22,"2005 Ultimate Tournament of Champions Round 1, game 30.",Jeopardy,"(3, 2)","BEN, BENJAMIN OR JUST PLAIN B",27,"(400,)",False,"In Scotland, it refers to a high hill",Ben,1,0
4737,2005-03-22,"2005 Ultimate Tournament of Champions Round 1, game 30.",Jeopardy,"(4, 2)",WORD ORIGINS,7,"(400,)",False,"The name for this type of worker comes from the Latin for ""lead worker""",plumber,1,0
4737,2005-03-22,"2005 Ultimate Tournament of Champions Round 1, game 30.",Jeopardy,"(5, 2)",DO IT LIKE THE EUROPEANS,12,"(400,)",False,"A museum in Silves, Portugal is devoted to this natural product important to Portugal's wine industry",cork,1,0
4737,2005-03-22,"2005 Ultimate Tournament of Champions Round 1, game 30.",Jeopardy,"(6, 2)","THAT'S SO ""CONTINENTAL""",17,"(400,)",False,"Its main hub cities are Newark, Cleveland & Houston",Continental Airlines,1,0
4737,2005-03-22,"2005 Ultimate Tournament of Champions Round 1, game 30.",Jeopardy,"(1, 3)",WE WERE SOLDIERS,26,"(600,)",False,This 5-star general was the first chairman of the Joint Chiefs of Staff 1949-1953,Bradley,1,0
4737,2005-03-22,"2005 Ultimate Tournament of Champions Round 1, game 30.",Jeopardy,"(2, 3)",ROCK BAND DRUMMERS,3,"(600,)",False,Keith Moon bashed the skins for this band with lunatic abandon,The Who,1,0
4737,2005-03-22,"2005 Ultimate Tournament of Champions Round 1, game 30.",Jeopardy,"(3, 3)","BEN, BENJAMIN OR JUST PLAIN B",30,"(600,)",False,"1982 was probably his favorite year, that was when he directed ""My Favorite Year""",(Richard) Benjamin,1,0
4737,2005-03-22,"2005 Ultimate Tournament of Champions Round 1, game 30.",Jeopardy,"(4, 3)",WORD ORIGINS,8,"(600,)",False,"This word used in Roman Catholic theology comes from the Latin for ""edge"" or ""border"", not ""dance""",limbo,0,3
4737,2005-03-22,"2005 Ultimate Tournament of Champions Round 1, game 30.",Jeopardy,"(5, 3)",DO IT LIKE THE EUROPEANS,13,"(600,)",False,This 15th-century European staked his claim to fame by inspiring a classic horror movie character,Vlad the Impaler,1,0
4737,2005-03-22,"2005 Ultimate Tournament of Champions Round 1, game 30.",Jeopardy,"(6, 3)","THAT'S SO ""CONTINENTAL""",18,"(600,)",False,"Abbreviated CBA, it includes teams called the Yakima Sun Kings & the Gary Steelheads",the Continental Basketball Association,1,0
4737,2005-03-22,"2005 Ultimate Tournament of Champions Round 1, game 30.",Jeopardy,"(1, 4)",WE WERE SOLDIERS,25,"(3000,)",True,A fort & a Tennessee city are named for this general who was also our nation's first Secretary of War,(Henry) Knox,1,0
4737,2005-03-22,"2005 Ultimate Tournament of Champions Round 1, game 30.",Jeopardy,"(2, 4)",ROCK BAND DRUMMERS,4,"(800,)",False,John Densmore rode out many a storm as this band's drummer,The Doors,1,0
4737,2005-03-22,"2005 Ultimate Tournament of Champions Round 1, game 30.",Jeopardy,"(3, 4)","BEN, BENJAMIN OR JUST PLAIN B",29,"(800,)",False,"In the names of political rivals in 1960s Algeria, it precedes ""Bella"" & ""Khedda""",Ben,1,0
4737,2005-03-22,"2005 Ultimate Tournament of Champions Round 1, game 30.",Jeopardy,"(4, 4)",WORD ORIGINS,9,"(800,)",False,"(Sarah of the Clue Crew reports from Naxos, Greece.)  Ostraka, broken pieces of pottery used as ballots to recommend exile gave us this word for banishment",ostracism,1,0
4737,2005-03-22,"2005 Ultimate Tournament of Champions Round 1, game 30.",Jeopardy,"(5, 4)",DO IT LIKE THE EUROPEANS,14,"(800,)",False,"Leks, levs & lats are all types of these still used in Eastern Europe",currency,1,0
4737,2005-03-22,"2005 Ultimate Tournament of Champions Round 1, game 30.",Jeopardy,"(6, 4)","THAT'S SO ""CONTINENTAL""",19,"(800,)",False,The theory of the slow tectonic movement of plates across the Earth,continental drift,1,0
4737,2005-03-22,"2005 Ultimate Tournament of Champions Round 1, game 30.",Jeopardy,"(1, 5)",WE WERE SOLDIERS,24,"(1000,)",False,"Later a Hollywood actor, he was the most decorated American soldier of World War II",Audie Murphy,1,0
4737,2005-03-22,"2005 Ultimate Tournament of Champions Round 1, game 30.",Jeopardy,"(2, 5)",ROCK BAND DRUMMERS,6,"(1000,)",False,"Mick Fleetwood of Fleetwood Mac risked combusting spontaneously in 2000, appearing with this band on VH1's ""The List""",Spinal Tap,0,3
4737,2005-03-22,"2005 Ultimate Tournament of Champions Round 1, game 30.",Jeopardy,"(3, 5)","BEN, BENJAMIN OR JUST PLAIN B",28,"(1000,)",False,"It follows ""Agnes"" in the name of a boutique whose first U.S. store opened in 1981",B,0,3
4737,2005-03-22,"2005 Ultimate Tournament of Champions Round 1, game 30.",Jeopardy,"(4, 5)",WORD ORIGINS,10,"(1000,)",False,"This word for a prolonged state of sadness comes from the Greek for ""black bile"" (once thought to be it's cause)",melancholy,1,0
4737,2005-03-22,"2005 Ultimate Tournament of Champions Round 1, game 30.",Jeopardy,"(5, 5)",DO IT LIKE THE EUROPEANS,15,"(1000,)",False,"Chartered in 1789, the town of Hammerfest in this country is the northernmost town in Europe",Norway,1,0
4737,2005-03-22,"2005 Ultimate Tournament of Champions Round 1, game 30.",Jeopardy,"(6, 5)","THAT'S SO ""CONTINENTAL""",20,"(1000,)",False,"To cartographers, it's known as CONUS",the Continental United States,0,3
4737,2005-03-22,"2005 Ultimate Tournament of Champions Round 1, game 30.",Double Jeopardy,"(1, 1)",GERMAN COMPOSERS,29,"(400,)",False,"In 1874, after more than 20 years, he finally completed his entire ""Ring"" cycle with ""The Twilight of the Gods""",Wagner,1,0
4737,2005-03-22,"2005 Ultimate Tournament of Champions Round 1, game 30.",Double Jeopardy,"(2, 1)",MOVIE TITLE PAIRS,1,"(400,)",False,1991:Susan Sarandon &Geena Davis,Thelma and Louise,1,0
4737,2005-03-22,"2005 Ultimate Tournament of Champions Round 1, game 30.",Double Jeopardy,"(3, 1)",20th CENTURY SCIENCE,6,"(400,)",False,In 1992 Alexander Wolszczan discovered the first ones of these outside our solar system,planets,1,0
4737,2005-03-22,"2005 Ultimate Tournament of Champions Round 1, game 30.",Double Jeopardy,"(4, 1)",YANKEE MAGAZINE,30,"(400,)",False,"A 1955 issue featured ""A Walk With"" this 81-year-old poet",Robert Frost,1,0
4737,2005-03-22,"2005 Ultimate Tournament of Champions Round 1, game 30.",Double Jeopardy,"(5, 1)",KIDDIE LIT,25,"(400,)",False,"Louis, a mute trumpeter swan in E.B. White's ""The Trumpet of the Swan"", was named for this musician",Armstrong,1,0
4737,2005-03-22,"2005 Ultimate Tournament of Champions Round 1, game 30.",Double Jeopardy,"(6, 1)",5-LETTER WORDS,12,"(400,)",False,"A state of stiffness in tissue; it can precede ""mortis""",rigor,1,0
4737,2005-03-22,"2005 Ultimate Tournament of Champions Round 1, game 30.",Double Jeopardy,"(1, 2)",GERMAN COMPOSERS,27,"(800,)",False,"Robert Schumann's high hopes for ""Genoveva"", his only one of these works, were dashed by a Leipzig audience",an opera,1,0
4737,2005-03-22,"2005 Ultimate Tournament of Champions Round 1, game 30.",Double Jeopardy,"(2, 2)",MOVIE TITLE PAIRS,2,"(800,)",False,1994:Jim Carrey &Jeff Daniels,Dumb and Dumber,1,0
4737,2005-03-22,"2005 Ultimate Tournament of Champions Round 1, game 30.",Double Jeopardy,"(3, 2)",20th CENTURY SCIENCE,9,"(800,)",False,"From the Greek for ""twig"", it's a plant or animal made from a portion of another without sex",a clone,1,1
4737,2005-03-22,"2005 Ultimate Tournament of Champions Round 1, game 30.",Double Jeopardy,"(4, 2)",YANKEE MAGAZINE,28,"(800,)",False,"Yankee profiled ""New England's greatest invention""--this one created in a restaurant on a Mass. toll road",the Toll House cookie,0,3
4737,2005-03-22,"2005 Ultimate Tournament of Champions Round 1, game 30.",Double Jeopardy,"(5, 2)",KIDDIE LIT,26,"(800,)",False,"This craftman's wife made clothes & knitted stockings for 2 elves, but they left his shop & never came back",the shoemaker,1,0
4737,2005-03-22,"2005 Ultimate Tournament of Champions Round 1, game 30.",Double Jeopardy,"(6, 2)",5-LETTER WORDS,13,"(800,)",False,"Each paragraph of an essay should include this type of ""sentence"" that states the main thought",topic,0,3
4737,2005-03-22,"2005 Ultimate Tournament of Champions Round 1, game 30.",Double Jeopardy,"(1, 3)",GERMAN COMPOSERS,23,"(1200,)",False,"When his brother Kaspar died in 1815, he became co-guardian of Kaspar's 9-year-old son Karl",Beethoven,0,3
4737,2005-03-22,"2005 Ultimate Tournament of Champions Round 1, game 30.",Double Jeopardy,"(2, 3)",MOVIE TITLE PAIRS,3,"(1200,)",False,1947:Cary Grant &Shirley Temple,The Bachelor and the Bobby-Soxer,1,0
4737,2005-03-22,"2005 Ultimate Tournament of Champions Round 1, game 30.",Double Jeopardy,"(3, 3)",20th CENTURY SCIENCE,10,"(1200,)",False,"The ""M"" in MASER stands for this; the rest of the acronym is the same as in ""LASER""",microwave,1,0
4737,2005-03-22,"2005 Ultimate Tournament of Champions Round 1, game 30.",Double Jeopardy,"(4, 3)",YANKEE MAGAZINE,24,"(1200,)",False,"A frequent Yankee advertiser is this business based in Freeport, Maine since 1912",L.L. Bean,1,1
4737,2005-03-22,"2005 Ultimate Tournament of Champions Round 1, game 30.",Double Jeopardy,"(5, 3)",KIDDIE LIT,17,"(1200,)",False,"Appropriately, this Andersen heroine had ""eyes as blue as the deepest sea""",the Little Mermaid,1,0
4737,2005-03-22,"2005 Ultimate Tournament of Champions Round 1, game 30.",Double Jeopardy,"(6, 3)",5-LETTER WORDS,14,"(1200,)",False,"To reduce 137,618 to 68,809",halve,1,0
4737,2005-03-22,"2005 Ultimate Tournament of Champions Round 1, game 30.",Double Jeopardy,"(1, 4)",GERMAN COMPOSERS,22,"(1600,)",False,"We're fortunate to have the ""Fingal's Cave"" overture by this composer whose first name means ""fortunate""",Felix Mendelssohn,0,3
4737,2005-03-22,"2005 Ultimate Tournament of Champions Round 1, game 30.",Double Jeopardy,"(2, 4)",MOVIE TITLE PAIRS,4,"(1600,)",False,1974:James Caan &Alan Arkin,Freebie and the Bean,1,0
4737,2005-03-22,"2005 Ultimate Tournament of Champions Round 1, game 30.",Double Jeopardy,"(3, 4)",20th CENTURY SCIENCE,11,"(1600,)",False,In 1932 this inventor figured out a better way than using Iceland spar to polarize light,Edwin Land,1,0
4737,2005-03-22,"2005 Ultimate Tournament of Champions Round 1, game 30.",Double Jeopardy,"(4, 4)",YANKEE MAGAZINE,16,"(1600,)",False,"A cautionary 1994 story listed 115 people who had perished on this, New England's highest mountain",Washington,1,0
4737,2005-03-22,"2005 Ultimate Tournament of Champions Round 1, game 30.",Double Jeopardy,"(5, 4)",KIDDIE LIT,21,"(6000,)",True,Hansel had a sister named Gretel; so did this boy in an 1865 novel,Hans Brinker,1,0
4737,2005-03-22,"2005 Ultimate Tournament of Champions Round 1, game 30.",Double Jeopardy,"(6, 4)",5-LETTER WORDS,18,"(1600,)",False,"(Cheryl of the Clue Crew reports from Park City, UT.)  This five-letter word can mean ""disposed"", or ""liable"", or ""biathlon position""",prone,1,0
4737,2005-03-22,"2005 Ultimate Tournament of Champions Round 1, game 30.",Double Jeopardy,"(1, 5)",GERMAN COMPOSERS,7,"(2200,)",True,"In 1940 he wrote ""Japanische Festmusik"" as a gesture of friendship between Germany & Japan",Richard Strauss,0,1
4737,2005-03-22,"2005 Ultimate Tournament of Champions Round 1, game 30.",Double Jeopardy,"(2, 5)",MOVIE TITLE PAIRS,5,"(2000,)",False,1951:Gregory Peck &Susan Hayward,David and Bathsheba,0,3
4737,2005-03-22,"2005 Ultimate Tournament of Champions Round 1, game 30.",Double Jeopardy,"(3, 5)",20th CENTURY SCIENCE,8,"(2000,)",False,In 1921 it was found that this hormone controlled your carbohydrate metabolism,insulin,1,0
4737,2005-03-22,"2005 Ultimate Tournament of Champions Round 1, game 30.",Double Jeopardy,"(4, 5)",YANKEE MAGAZINE,20,"(2000,)",False,The May 2004 issue visited the lobstermen of Stonington on this Maine bay,Penobscot Bay,0,3
4737,2005-03-22,"2005 Ultimate Tournament of Champions Round 1, game 30.",Double Jeopardy,"(5, 5)",KIDDIE LIT,15,"(2000,)",False,"Beatrix Potter wrote a ""tale about a tail--a tail that belonged to a little red squirrel, and his name was"" this",Nutkin,1,0
4737,2005-03-22,"2005 Ultimate Tournament of Champions Round 1, game 30.",Double Jeopardy,"(6, 5)",5-LETTER WORDS,19,"(2000,)",False,"It's the watery last word of ""The Lovesong of J. Alfred Prufrock""",drown,0,3
4737,2005-03-22,"2005 Ultimate Tournament of Champions Round 1, game 30.",Final Jeopardy,"(1, 1)",CYBER-GLOSSARY,0,"(2200, 12400, 1401)",False,In computerese this word from the Hindu faith means an icon of a user in virtual reality,an avatar,3,0
