epNum,airDate,extra_info,round_name,coord,category,order,value,daily_double,question,answer,correctAttempts,wrongAttempts
4799,2005-06-16,,Jeopardy,"(1, 1)",WHERE HISTORY HAPPENED,28,"(200,)",False,"Between Oct. 1946 & Oct. 1949, this international organization held its meetings in Flushing, N.Y.",the United Nations,1,0
4799,2005-06-16,,Jeopardy,"(2, 1)",TITLE FILM ANIMALS,5,"(200,)",False,"1974:""Benji""",a dog,1,0
4799,2005-06-16,,Jeopardy,"(3, 1)",WRITERS AT REST,25,"(200,)",False,She & Alice B. Toklas are buried next to each other at Pere Lachaise Cemetery in Paris,Gertrude Stein,1,0
4799,2005-06-16,,Jeopardy,"(4, 1)","HEY, THAT'S ""GREAT""!",11,"(200,)",False,"Stretching over 4,000 miles, it's been called the largest engineering & building project ever made by man",the Great Wall of China,1,0
4799,2005-06-16,,Jeopardy,"(5, 1)",SOCIAL TYPES,29,"(200,)",False,A fictional mutant monster gave us this term for a woman who's unbearable while planning her wedding,Bridezilla,1,0
4799,2005-06-16,,Jeopardy,"(6, 1)",ONE-WORD IMPERATIVES,1,"(200,)",False,The men seen here are waiting for this traditional final word in a 3-part command,Fire!,1,0
4799,2005-06-16,,Jeopardy,"(1, 2)",WHERE HISTORY HAPPENED,27,"(400,)",False,"In 1517 the Ottoman Empire put its foot down on this town in Galilee, the home of Joseph, Mary & Jesus",Nazareth,1,1
4799,2005-06-16,,Jeopardy,"(2, 2)",TITLE FILM ANIMALS,7,"(400,)",False,"1949:""Francis""",a mule,1,0
4799,2005-06-16,,Jeopardy,"(3, 2)",WRITERS AT REST,26,"(400,)",False,"In Asheville his gravestone bears the line ""The last voyage, the longest, the best"" from ""Look Homeward, Angel""",Thomas Wolfe,1,0
4799,2005-06-16,,Jeopardy,"(4, 2)","HEY, THAT'S ""GREAT""!",12,"(400,)",False,Much of this 1925 novel takes place in the West Egg area of Long Island,The Great Gatsby,1,0
4799,2005-06-16,,Jeopardy,"(5, 2)",SOCIAL TYPES,30,"(400,)",False,"A toff is a member of the upper classes of society, usually in this country",England,1,0
4799,2005-06-16,,Jeopardy,"(6, 2)",ONE-WORD IMPERATIVES,15,"(400,)",False,It's what rootin' tootin' Yosemite Sam shouts as he shoots at feet,Dance!,1,0
4799,2005-06-16,,Jeopardy,"(1, 3)",WHERE HISTORY HAPPENED,23,"(600,)",False,"In 1917 the British took the town of Al-Kut on the Tigris on their march to take this, now a capital city",Baghdad,1,0
4799,2005-06-16,,Jeopardy,"(2, 3)",TITLE FILM ANIMALS,8,"(600,)",False,"1943:""My Friend Flicka""",a horse,1,0
4799,2005-06-16,,Jeopardy,"(3, 3)",WRITERS AT REST,24,"(600,)",False,"It doesn't take a P.I. like his Sam Spade to find this man's grave at Arlington; it's in Section 12, Lot 508",Dashiell Hammett,1,0
4799,2005-06-16,,Jeopardy,"(4, 3)","HEY, THAT'S ""GREAT""!",13,"(600,)",False,This city in North-Central Montana is the seat of Cascade County,Great Falls,1,0
4799,2005-06-16,,Jeopardy,"(5, 3)",SOCIAL TYPES,21,"(600,)",False,"The ""Simpsons"" character seen here has no name; he's simply called this",Comic Book Guy,1,0
4799,2005-06-16,,Jeopardy,"(6, 3)",ONE-WORD IMPERATIVES,16,"(600,)",False,"The title of a novel by Sapphire about a teen mother, or a word often heard in delivery rooms",Push!,1,0
4799,2005-06-16,,Jeopardy,"(1, 4)",WHERE HISTORY HAPPENED,3,"(1200,)",True,"Corregidor, enveloped by this bay, was fortified by the Spanish in the 18th century",Manila Bay,1,0
4799,2005-06-16,,Jeopardy,"(2, 4)",TITLE FILM ANIMALS,9,"(800,)",False,"1977:Bernard & Bianca, ""The Rescuers""",mice,1,0
4799,2005-06-16,,Jeopardy,"(3, 4)",WRITERS AT REST,22,"(800,)",False,"She's buried at her Penn. farm, & the name on her tombstone is written in Chinese rather than English",Pearl Buck,1,0
4799,2005-06-16,,Jeopardy,"(4, 4)","HEY, THAT'S ""GREAT""!",14,"(800,)",False,"In this classic movie, Charlie Chaplin played dual roles including that of Adenoid Hynkel of Tomania",The Great Dictator,1,0
4799,2005-06-16,,Jeopardy,"(5, 4)",SOCIAL TYPES,20,"(800,)",False,A yuppie who lives for great dining experiences may be this word also ending in -ie,a foodie,0,3
4799,2005-06-16,,Jeopardy,"(6, 4)",ONE-WORD IMPERATIVES,17,"(800,)",False,"This word begins a ""Sesame Street"" tune that Barbra Streisand recorded because it was her son's favorite",Sing!,0,3
4799,2005-06-16,,Jeopardy,"(1, 5)",WHERE HISTORY HAPPENED,2,"(1000,)",False,"At Bannockburn in 1314 he led a small force to take Stirling Castle, Britain's last stronghold in Scotland",Robert the Bruce,1,1
4799,2005-06-16,,Jeopardy,"(2, 5)",TITLE FILM ANIMALS,10,"(1000,)",False,"1978:""Matilda""",a kangaroo,0,3
4799,2005-06-16,,Jeopardy,"(3, 5)",WRITERS AT REST,6,"(1000,)",False,"In 1851 she was laid to rest in an English churchyard along with husband Percy's heart & a copy of his ""Adonais""",Mary Shelley,1,0
4799,2005-06-16,,Jeopardy,"(4, 5)","HEY, THAT'S ""GREAT""!",4,"(1000,)",False,"In 1417 Martin V was elected the sole pope, ending this division within the Catholic Church",the Great Schism,1,0
4799,2005-06-16,,Jeopardy,"(5, 5)",SOCIAL TYPES,19,"(1000,)",False,"Ms. Poole from accounting who's tough on expense accounts, is known by this leguminous 2-word term",bean counter,1,0
4799,2005-06-16,,Jeopardy,"(6, 5)",ONE-WORD IMPERATIVES,18,"(1000,)",False,"On April 20, 1653 Oliver Cromwell told the Rump Parliament, ""In the name of God"", this 2-letter word",Go!,1,0
4799,2005-06-16,,Double Jeopardy,"(1, 1)",ART LECTURE,1,"(400,)",False,(Jimmy of the Clue Crew delivers the clue in front of a projected slide of a painting.)  The classical ruins in Montagna's St. Sebastian typify this movement's discovery of ancient culture,the Renaissance,1,0
4799,2005-06-16,,Double Jeopardy,"(2, 1)",THE FIRST MODERN OLYMPICS,3,"(400,)",False,"The Olympics were reborn on April 6, 1896 with 14 national teams made up of 241 men & this many women",0,1,0
4799,2005-06-16,,Double Jeopardy,"(3, 1)",JUST DESSERTS,7,"(400,)",False,"Spread jam (& whipped cream, too, if you like) on a cake, curl it up & you've got this old-fashioned favorite",a jelly roll,1,0
4799,2005-06-16,,Double Jeopardy,"(4, 1)","CROSSWORD CLUES ""M""",12,"(400,)",False,"A 1,000th anniversary(10)",millennium,1,0
4799,2005-06-16,,Double Jeopardy,"(5, 1)",YOU GO URUGUAY,26,"(400,)",False,"Like a child's drawing, the flag of Uruguay has this in the upper left-hand corner",a sun,1,1
4799,2005-06-16,,Double Jeopardy,"(6, 1)",I'LL GO MINE,17,"(400,)",False,I'll go mine some mica in this type of big open pit,a quarry,1,0
4799,2005-06-16,,Double Jeopardy,"(1, 2)",ART LECTURE,2,"(800,)",False,(Jimmy of the Clue Crew delivers the clue in front of a projected slide of a painting.)  The triangle formed by the figures in the Raphael work seen here is a symbol of this key Christian concept,the Trinity,1,0
4799,2005-06-16,,Double Jeopardy,"(2, 2)",THE FIRST MODERN OLYMPICS,22,"(800,)",False,"Becoming the 1st Olympic champion since the 4th C. was a hop, step & jump for American James Connolly in this field event",the triple jump,1,0
4799,2005-06-16,,Double Jeopardy,"(3, 2)",JUST DESSERTS,8,"(800,)",False,"The name of this custardy dessert means ""burnt cream""",crème brulée,1,0
4799,2005-06-16,,Double Jeopardy,"(4, 2)","CROSSWORD CLUES ""M""",13,"(800,)",False,Type of photo finish(5),matte,1,0
4799,2005-06-16,,Double Jeopardy,"(5, 2)",YOU GO URUGUAY,27,"(800,)",False,The mulita is a small Uruguayan type of this armored animal that's susceptible to becoming roadkill,an armadillo,1,0
4799,2005-06-16,,Double Jeopardy,"(6, 2)",I'LL GO MINE,18,"(800,)",False,"To act in ""Nobody Hears a Broken Drum"", dealing with the Molly Maguires, I'll go mine this to get in character",coal,1,0
4799,2005-06-16,,Double Jeopardy,"(1, 3)",ART LECTURE,4,"(1200,)",False,"(Jimmy of the Clue Crew delivers the clue in front of a projected slide of a painting.)  The traveling basket tells us the subject is ""Rest on the Flight into"" this country",Egypt,1,0
4799,2005-06-16,,Double Jeopardy,"(2, 3)",THE FIRST MODERN OLYMPICS,23,"(1200,)",False,"As in 2004, in 1896 Panathenaic Stadium had the finish of this, won back then by national hero Spiridon Louis",the marathon,1,0
4799,2005-06-16,,Double Jeopardy,"(3, 3)",JUST DESSERTS,9,"(1200,)",False,This Pennsylvania Dutch dessert made with brown sugar & molasses is partnered with apple pan dowdy in a classic song,shoo-fly pie,1,0
4799,2005-06-16,,Double Jeopardy,"(4, 3)","CROSSWORD CLUES ""M""",14,"(1200,)",False,Pipe smoker's mineral(10),meerschaum,0,3
4799,2005-06-16,,Double Jeopardy,"(5, 3)",YOU GO URUGUAY,28,"(1200,)",False,"Some rural people speak Portunol, a mix of these 2 languages of Uruguay's neighbors",Spanish & Portuguese,1,0
4799,2005-06-16,,Double Jeopardy,"(6, 3)",I'LL GO MINE,19,"(1200,)",False,"I'll go mine this, symbol Sn, if I can find some; it's only .001 percent of the Earth's crust",Tin,1,0
4799,2005-06-16,,Double Jeopardy,"(1, 4)",ART LECTURE,5,"(1600,)",False,"(Jimmy of the Clue Crew delivers the clue in front of a projected slide of a painting.)  Here, this great American artist contrasts the warm colors of nature with the harsh light of civilization",(Edward) Hopper,1,1
4799,2005-06-16,,Double Jeopardy,"(2, 4)",THE FIRST MODERN OLYMPICS,24,"(1600,)",True,Thomas Burke of the U.S. won this Olympic event in 1896 with a time of 12.0 seconds; the winning time in 2004 was 9.85,the 100 meter dash,1,0
4799,2005-06-16,,Double Jeopardy,"(3, 4)",JUST DESSERTS,10,"(1600,)",False,In France this holiday cake is called buche de Noel,a yule log (Christmas log accepted),1,0
4799,2005-06-16,,Double Jeopardy,"(4, 4)","CROSSWORD CLUES ""M""",15,"(1600,)",False,Tenon's woodworking partner(7),Mortise,1,0
4799,2005-06-16,,Double Jeopardy,"(5, 4)",YOU GO URUGUAY,29,"(800,)",True,Nueva Helvecia is a town founded by colonists from this country to which Uruguay is sometimes compared,Switzerland,0,1
4799,2005-06-16,,Double Jeopardy,"(6, 4)",I'LL GO MINE,20,"(1600,)",False,"I'll go mine sapphires in Sri Lanka, because I need the type whose optical effect gives it this name",star sapphires,0,3
4799,2005-06-16,,Double Jeopardy,"(1, 5)",ART LECTURE,6,"(2000,)",False,(Jimmy of the Clue Crew delivers the clue in front of a projected slide of a painting.)  Dutch still lifes often remind us of this Latin word for pride and mortality--the skull is a rather stern reminder,vanitas,0,3
4799,2005-06-16,,Double Jeopardy,"(2, 5)",THE FIRST MODERN OLYMPICS,25,"(2000,)",False,This Frenchman who revived the Games opposed a Greek proposal to make Athens their permanent site,Baron Pierre de Coubertin,0,3
4799,2005-06-16,,Double Jeopardy,"(3, 5)",JUST DESSERTS,11,"(2000,)",False,"This Italian dessert consists of egg yolks, wine & sugar whisked together",zabaglione,0,3
4799,2005-06-16,,Double Jeopardy,"(4, 5)","CROSSWORD CLUES ""M""",16,"(2000,)",False,Salamander also known as a water dog(8),mudpuppy,0,3
4799,2005-06-16,,Double Jeopardy,"(6, 5)",I'LL GO MINE,21,"(2000,)",False,"To save money on a ring, I'll go mine this form of carbon seen here and make a synthetic diamond",graphite,1,0
4799,2005-06-16,,Final Jeopardy,"(1, 1)",HISTORIC BUSINESSMAN,0,"(0, 2000, 5000)",False,"Tired of his fragile wares being smashed in transit, this man born in 1730 advocated British turnpike building",Wedgwood,1,2
