epNum,airDate,extra_info,round_name,coord,category,order,value,daily_double,question,answer,correctAttempts,wrongAttempts
4841,2005-10-03,Jason Richards game 1.,Jeopardy,"(1, 1)",MONUMENTS,9,"(200,)",False,"His words ""The people's heroes are immortal"" are engraved on a monument in Tiananmen Square",Mao Tse-tung,1,0
4841,2005-10-03,Jason Richards game 1.,Jeopardy,"(2, 1)",IN STYLE,21,"(200,)",False,"In Style's first issue, in 1994, visited Barbra Streisand's pad in this wealthy California coastal community",Malibu,0,3
4841,2005-10-03,Jason Richards game 1.,Jeopardy,"(3, 1)",COLLEGES & UNIVERSITIES,4,"(200,)",False,"In the 2005 Orange Bowl, this university's Trojans trampled the Sooners, 55-19",Southern California,1,0
4841,2005-10-03,Jason Richards game 1.,Jeopardy,"(4, 1)",DO YOU HAVE THE MUNCHIES?,16,"(200,)",False,The Incas munched on charque (what we call jerky) from the dried meat of this 5-letter pack animal,the llama,1,0
4841,2005-10-03,Jason Richards game 1.,Jeopardy,"(5, 1)",MANUEL LABOR,26,"(200,)",False,"On January 3, 1990 he surrendered to U.S. troops surrounding the Vatican Embassy",Manuel Noriega,1,0
4841,2005-10-03,Jason Richards game 1.,Jeopardy,"(6, 1)","HARD ""WORK""",1,"(200,)",False,"In the old song standard, it's the line that precedes ""all the livelong day""","""I\'ve been working on the railroad""",1,1
4841,2005-10-03,Jason Richards game 1.,Jeopardy,"(1, 2)",MONUMENTS,10,"(400,)",False,Vasco da Gama is among those depicted on this capital city's Monument to the Discoveries,Lisbon,1,0
4841,2005-10-03,Jason Richards game 1.,Jeopardy,"(2, 2)",IN STYLE,22,"(400,)",False,In Style's 10th anniversary cover girl was this South African actress in gold sequins,Charlize Theron,1,0
4841,2005-10-03,Jason Richards game 1.,Jeopardy,"(3, 2)",COLLEGES & UNIVERSITIES,5,"(1000,)",True,"Of the Ivy League colleges, this one is alphabetically first",Brown,1,0
4841,2005-10-03,Jason Richards game 1.,Jeopardy,"(4, 2)",DO YOU HAVE THE MUNCHIES?,17,"(400,)",False,2 of the 5 different nuts in a jar of Planters Deluxe Mixed Nuts,"cashews & pecans (also hazelnuts, brazils, & almonds)",1,0
4841,2005-10-03,Jason Richards game 1.,Jeopardy,"(5, 2)",MANUEL LABOR,27,"(400,)",False,Longtime congressman Manuel Lujan was appointed Secretary of the Interior by this man in 1989,George H.W. Bush,1,0
4841,2005-10-03,Jason Richards game 1.,Jeopardy,"(6, 2)","HARD ""WORK""",2,"(400,)",False,"This play is set in Tuscumbia, Alabama & at the Perkins Institute for the blind",The Miracle Worker,1,0
4841,2005-10-03,Jason Richards game 1.,Jeopardy,"(1, 3)",MONUMENTS,11,"(600,)",False,"Though Mumtaz died in 1631, this tomb of hers (& it was some tomb) wasn't completed until about 1643",the Taj Mahal,1,0
4841,2005-10-03,Jason Richards game 1.,Jeopardy,"(2, 3)",IN STYLE,23,"(600,)",False,"In Style often features these places that feature massage & pampering, named for a town in Belgium",spa,1,0
4841,2005-10-03,Jason Richards game 1.,Jeopardy,"(3, 3)",COLLEGES & UNIVERSITIES,6,"(600,)",False,"Seton Hill University is in Greensburg, Penn.; Seton Hall University is in South Orange in this state",New Jersey,1,0
4841,2005-10-03,Jason Richards game 1.,Jeopardy,"(4, 3)",DO YOU HAVE THE MUNCHIES?,18,"(600,)",False,In 2003 these frozen waffles let go with a 50th anniversary party,Eggos,1,0
4841,2005-10-03,Jason Richards game 1.,Jeopardy,"(5, 3)",MANUEL LABOR,28,"(600,)",False,"In this novel, Judge Miller's gardener's helper Manuel kidnaps the dog Buck & sells him to pay his gambling debts",The Call of the Wild,1,0
4841,2005-10-03,Jason Richards game 1.,Jeopardy,"(6, 3)","HARD ""WORK""",3,"(600,)",False,2-word term for insurance required of businesses for employees injured on the job,workman\'s compensation,1,0
4841,2005-10-03,Jason Richards game 1.,Jeopardy,"(1, 4)",MONUMENTS,12,"(800,)",False,"(Jimmy from the clue crew reports from Parris Island, SC.)  The Iwo Jima monument on Parris Island represents the famous raising of the flag on this mountain",Mount Suribachi,0,3
4841,2005-10-03,Jason Richards game 1.,Jeopardy,"(2, 4)",IN STYLE,24,"(800,)",False,"The TV special ""In Style Celebrity Weddings"" included the nuptials of Danielle Spencer to this actor",Russell Crowe,0,3
4841,2005-10-03,Jason Richards game 1.,Jeopardy,"(3, 4)",COLLEGES & UNIVERSITIES,7,"(800,)",False,"Wheaton College in Illinois recently ranked No. 1 in college food, followed by this school in Brunswick, Maine",Bowdoin College,1,0
4841,2005-10-03,Jason Richards game 1.,Jeopardy,"(4, 4)",DO YOU HAVE THE MUNCHIES?,19,"(800,)",False,"Though it sounds like the most terrible food, it's really just German for sausage",wurst,1,1
4841,2005-10-03,Jason Richards game 1.,Jeopardy,"(6, 4)","HARD ""WORK""",14,"(800,)",False,In 1962 Cesar Chavez founded the union that is today known as this,the United Farm Workers of America,0,3
4841,2005-10-03,Jason Richards game 1.,Jeopardy,"(1, 5)",MONUMENTS,13,"(1000,)",False,"Auckland's One Tree Hill is the former site of a ""pa"", or fortified village, of these people",the Maori,1,0
4841,2005-10-03,Jason Richards game 1.,Jeopardy,"(2, 5)",IN STYLE,25,"(1000,)",False,"In Style defined this type of ""fabulous"" as requiring lots of jewelry & fur, as seen on Lil' Kim & Missy Elliott",ghetto fabulous,1,0
4841,2005-10-03,Jason Richards game 1.,Jeopardy,"(3, 5)",COLLEGES & UNIVERSITIES,8,"(1000,)",False,In 1982 Jimmy Carter established the Carter Center in partnership with this university,Emory,1,0
4841,2005-10-03,Jason Richards game 1.,Jeopardy,"(4, 5)",DO YOU HAVE THE MUNCHIES?,20,"(1000,)",False,"Yum!  It's removed from a fish, pressed through a screen to remove membranes, put in brine, then packed with salt in a tin",caviar,1,0
4841,2005-10-03,Jason Richards game 1.,Jeopardy,"(6, 5)","HARD ""WORK""",15,"(1000,)",False,"One of the ""New Deal"" programs created for the unemployed, it was abbreviated the WPA",the Works Progress Administration,1,0
4841,2005-10-03,Jason Richards game 1.,Double Jeopardy,"(1, 1)",ROYAL ODDITIES,26,"(400,)",False,"Strangely, Charles XIV John of this Scandinavian country had a ""Death to all kings"" tattoo",Sweden,1,0
4841,2005-10-03,Jason Richards game 1.,Double Jeopardy,"(2, 1)",MOVIE DIRECTORS,2,"(400,)",False,"Dawson on ""Dawson's Creek"" idolized this man who directed ""The Sugarland Express"" in his mid-20s",Steven Spielberg,0,3
4841,2005-10-03,Jason Richards game 1.,Double Jeopardy,"(3, 1)",THE LAND DOWN UNDER,1,"(400,)",False,"Australia is home to 2 egg-laying mammals, or monotremes: the spiny anteater & this one",the platypus,1,0
4841,2005-10-03,Jason Richards game 1.,Double Jeopardy,"(4, 1)",SUBATOMIC MASS PERSUASION,7,"(400,)",False,It's where you'll find the protons in an atom,the nucleus,1,0
4841,2005-10-03,Jason Richards game 1.,Double Jeopardy,"(5, 1)","NOBEL LIT WINNERS, INITIALLY YOURS",12,"(400,)",False,"1958:B.P.,Russia",Boris Pasternak,1,0
4841,2005-10-03,Jason Richards game 1.,Double Jeopardy,"(6, 1)","""POT"" POURRI",17,"(400,)",False,"George Washington's birthplace is on Pope's Creek, a small stream that flows into this",the Potomac,1,0
4841,2005-10-03,Jason Richards game 1.,Double Jeopardy,"(1, 2)",ROYAL ODDITIES,27,"(800,)",False,Emperor Menelik II of this African country once used an electric chair as his throne,Ethiopia,0,3
4841,2005-10-03,Jason Richards game 1.,Double Jeopardy,"(2, 2)",MOVIE DIRECTORS,3,"(800,)",False,"(Hi, I'm Joel Schumacher.)  Directing movies based on this author's ""The Client"" & ""A Time to Kill"" was like getting paid to go to law school",John Grisham,1,0
4841,2005-10-03,Jason Richards game 1.,Double Jeopardy,"(3, 2)",THE LAND DOWN UNDER,22,"(800,)",False,In 1983 the Yacht Club of Perth became the first outside the U.S. to house this trophy,the Americas Cup,1,0
4841,2005-10-03,Jason Richards game 1.,Double Jeopardy,"(4, 2)",SUBATOMIC MASS PERSUASION,8,"(800,)",False,"These particles were named for Satyendra Nath Bose, who worked out their behavior in 1924",bosons,1,0
4841,2005-10-03,Jason Richards game 1.,Double Jeopardy,"(5, 2)","NOBEL LIT WINNERS, INITIALLY YOURS",13,"(800,)",False,"1946:H.H.,Switzerland",Hermann Hesse,1,0
4841,2005-10-03,Jason Richards game 1.,Double Jeopardy,"(6, 2)","""POT"" POURRI",18,"(800,)",False,Benjamin Bunny & Squirrel Nutkin were 2 of the many characters created by this harebrained author,Beatrix Potter,1,0
4841,2005-10-03,Jason Richards game 1.,Double Jeopardy,"(1, 3)",ROYAL ODDITIES,28,"(1200,)",False,"Although officially listed, this 18th century French king was never crowned & never ruled",Louis XVII,0,3
4841,2005-10-03,Jason Richards game 1.,Double Jeopardy,"(2, 3)",MOVIE DIRECTORS,4,"(1200,)",False,"His career includes directing ""Paper Moon"", writing the book ""Who the Devil Made It"" & acting in ""The Sopranos""",Peter Bogdanovich,0,3
4841,2005-10-03,Jason Richards game 1.,Double Jeopardy,"(3, 3)",THE LAND DOWN UNDER,23,"(1200,)",False,Australia's tallest building is the 823-foot high Rialto Towers in this former capital,Melbourne,1,1
4841,2005-10-03,Jason Richards game 1.,Double Jeopardy,"(4, 3)",SUBATOMIC MASS PERSUASION,9,"(1200,)",False,"The 2 main forms of quantum mechanics were developed by Erwin Schrodinger & this ""uncertain"" German",Heisenberg,1,0
4841,2005-10-03,Jason Richards game 1.,Double Jeopardy,"(5, 3)","NOBEL LIT WINNERS, INITIALLY YOURS",14,"(1200,)",False,"1957:A.C.,France",Albert Camus,1,0
4841,2005-10-03,Jason Richards game 1.,Double Jeopardy,"(6, 3)","""POT"" POURRI",19,"(1200,)",False,In 1905 a famous mutiny took place aboard it,the Potemkin,1,0
4841,2005-10-03,Jason Richards game 1.,Double Jeopardy,"(1, 4)",ROYAL ODDITIES,29,"(1600,)",False,"A spider that died by falling into a a poisoned drink saved the life of this ""Great"" Prussian king",Frederick,1,0
4841,2005-10-03,Jason Richards game 1.,Double Jeopardy,"(2, 4)",MOVIE DIRECTORS,5,"(3000,)",True,"This ""Philadelphia Story"" director was patriotically named for Admiral George Dewey",George Cukor,1,0
4841,2005-10-03,Jason Richards game 1.,Double Jeopardy,"(3, 4)",THE LAND DOWN UNDER,24,"(1600,)",False,"The title of this popular song refers to wandering with a blanket roll, not a dance or a lady","""Waltzing Matilda""",1,0
4841,2005-10-03,Jason Richards game 1.,Double Jeopardy,"(4, 4)",SUBATOMIC MASS PERSUASION,10,"(1600,)",False,The mass of any 1 proton is about equal to the mass of one atom of this element,hydrogen,1,0
4841,2005-10-03,Jason Richards game 1.,Double Jeopardy,"(5, 4)","NOBEL LIT WINNERS, INITIALLY YOURS",15,"(1600,)",False,"1971:P.N.,Chile",Pablo Neruda,1,0
4841,2005-10-03,Jason Richards game 1.,Double Jeopardy,"(6, 4)","""POT"" POURRI",20,"(1600,)",False,"Also known as a powwow, it's a Native American get-together for discussion & fun",potlatch,1,0
4841,2005-10-03,Jason Richards game 1.,Double Jeopardy,"(2, 5)",MOVIE DIRECTORS,6,"(2000,)",False,"This director of ""Casablanca"", a classic film about refugees, had himself left his homeland of Hungary",Michael Curtiz,1,0
4841,2005-10-03,Jason Richards game 1.,Double Jeopardy,"(3, 5)",THE LAND DOWN UNDER,25,"(5500,)",True,"Located in a national park, it's about 1 1/2 miles long & rises 1,142 feet above the desert floor",Ayers Rock,1,0
4841,2005-10-03,Jason Richards game 1.,Double Jeopardy,"(4, 5)",SUBATOMIC MASS PERSUASION,11,"(2000,)",False,In 1998 it was found that these particles that pass through everything at light speed do have mass,neutrinos,1,1
4841,2005-10-03,Jason Richards game 1.,Double Jeopardy,"(5, 5)","NOBEL LIT WINNERS, INITIALLY YOURS",16,"(2000,)",False,"1938:P.S.B.,United States",Pearl Buck,1,0
4841,2005-10-03,Jason Richards game 1.,Double Jeopardy,"(6, 5)","""POT"" POURRI",21,"(2000,)",False,"1969's ""The Promise"" & 1990's ""The Gift of Asher Lev"" are sequels to 2 of this writer's earlier works",(Chaim) Potok,1,0
4841,2005-10-03,Jason Richards game 1.,Final Jeopardy,"(1, 1)",PRESIDENTIAL RELATIVES,0,"(726, 3000, 5000)",False,He defended civil rights as a representative from Massachusetts' 11th District from 1895 to 1901,John Francis Fitzgerald,0,3
