epNum,airDate,extra_info,round_name,coord,category,order,value,daily_double,question,answer,correctAttempts,wrongAttempts
4846,2005-10-10,2005 Back to School Week game 1.,Jeopardy,"(1, 1)",KIDS IN HISTORY,2,"(200,)",False,"Even as a young girl in Philadelphia, this future flagmaker showed a talent for fine needlework",Betsy Ross,1,0
4846,2005-10-10,2005 Back to School Week game 1.,Jeopardy,"(2, 1)",WHERE WE WENT ON SUMMER VACATION,23,"(200,)",False,"...to Hawaii where we got to pig out & dance the hula at one of these native feasts, right on the beach",a luau,1,0
4846,2005-10-10,2005 Back to School Week game 1.,Jeopardy,"(3, 1)",IN THE BOOKSTORE,21,"(200,)",False,"He's the elusive writer of ""A Series of Unfortunate Events""",Lemony Snicket,1,0
4846,2005-10-10,2005 Back to School Week game 1.,Jeopardy,"(4, 1)",ANAGRAM ZOO,4,"(200,)",False,Tall fellow:FIFE RAG,giraffe,1,0
4846,2005-10-10,2005 Back to School Week game 1.,Jeopardy,"(5, 1)",HOW TO INVEST YOUR ALLOWANCE,13,"(200,)",False,Buy a desired collectible & you might make more money by auctioning it on this web site started in 1995,eBay,1,0
4846,2005-10-10,2005 Back to School Week game 1.,Jeopardy,"(6, 1)",LET'S GO TO THE MOVIES,1,"(200,)",False,"The strength of the outer part of a kernel of this determines if it's a nice fluffy one or a crunchy ""old maid""",popcorn,1,0
4846,2005-10-10,2005 Back to School Week game 1.,Jeopardy,"(1, 2)",KIDS IN HISTORY,3,"(400,)",False,"When this Italian explorer was a kid, his dad went to China without him; when he was a teen, his dad took him along",Marco Polo,1,0
4846,2005-10-10,2005 Back to School Week game 1.,Jeopardy,"(2, 2)",WHERE WE WENT ON SUMMER VACATION,24,"(400,)",False,"…to Paris, France where we saw this famous landmark that's pictured here",the Eiffel Tower,1,0
4846,2005-10-10,2005 Back to School Week game 1.,Jeopardy,"(3, 2)",IN THE BOOKSTORE,22,"(400,)",False,"In a novel by E.B. White, a spider named Charlotte becomes friends with this pig",Wilbur,1,0
4846,2005-10-10,2005 Back to School Week game 1.,Jeopardy,"(4, 2)",ANAGRAM ZOO,5,"(400,)",False,From Australia:ORGAN OAK,kangaroo,1,0
4846,2005-10-10,2005 Back to School Week game 1.,Jeopardy,"(5, 2)",HOW TO INVEST YOUR ALLOWANCE,14,"(400,)",False,"Buy real estate & name the buildings after yourself, like this host of ""The Apprentice""",Donald Trump,1,0
4846,2005-10-10,2005 Back to School Week game 1.,Jeopardy,"(6, 2)",LET'S GO TO THE MOVIES,9,"(400,)",False,"In the 1960s, California had over 200 of these, where people watched movies from their cars",drive-ins,1,0
4846,2005-10-10,2005 Back to School Week game 1.,Jeopardy,"(1, 3)",KIDS IN HISTORY,6,"(1000,)",True,"Born in Scotland in 1747, he sailed off as a cabin boy at age 12 & later became a naval hero in the Amer. Revolution",John Paul Jones,1,0
4846,2005-10-10,2005 Back to School Week game 1.,Jeopardy,"(2, 3)",WHERE WE WENT ON SUMMER VACATION,25,"(600,)",False,"…to Italy, where we tasted tiramisu, which was yummy, & gorgonzola, a type of this, which was yucky!",cheese,1,0
4846,2005-10-10,2005 Back to School Week game 1.,Jeopardy,"(3, 3)",IN THE BOOKSTORE,27,"(600,)",False,The Tuck family finds a fountain of youth in this novel by Natalie Babbitt,Tuck Everlasting,1,0
4846,2005-10-10,2005 Back to School Week game 1.,Jeopardy,"(4, 3)",ANAGRAM ZOO,18,"(600,)",False,A mountain ape:LIAR LOG,gorilla,1,0
4846,2005-10-10,2005 Back to School Week game 1.,Jeopardy,"(5, 3)",HOW TO INVEST YOUR ALLOWANCE,15,"(600,)",False,"You donate money to the charity that fights this disease, & buy a wristband like the one seen here",cancer,1,0
4846,2005-10-10,2005 Back to School Week game 1.,Jeopardy,"(6, 3)",LET'S GO TO THE MOVIES,10,"(600,)",False,"The people on the board that assigns these, such as G & R, have to have had kids",ratings,0,3
4846,2005-10-10,2005 Back to School Week game 1.,Jeopardy,"(1, 4)",KIDS IN HISTORY,7,"(800,)",False,"A gifted student & a fine athlete, this member of the Tudor family became the heir to Engl.'s throne at age 10, in 1502",Henry VIII,1,1
4846,2005-10-10,2005 Back to School Week game 1.,Jeopardy,"(2, 4)",WHERE WE WENT ON SUMMER VACATION,26,"(800,)",False,…to this U.S. city where we got to see Mt. Rainier form the top of the Space Needle,Seattle,1,0
4846,2005-10-10,2005 Back to School Week game 1.,Jeopardy,"(3, 4)",IN THE BOOKSTORE,28,"(800,)",False,Milo meets a dog named Tock (who has a giant alarm clock for a body) in this classic by Norton Juster,The Phantom Tollbooth,1,0
4846,2005-10-10,2005 Back to School Week game 1.,Jeopardy,"(4, 4)",ANAGRAM ZOO,19,"(800,)",False,Ocean mammal:PIN HOLD,a dolphin,1,0
4846,2005-10-10,2005 Back to School Week game 1.,Jeopardy,"(5, 4)",HOW TO INVEST YOUR ALLOWANCE,16,"(800,)",False,Buy shares of this in a company; there's an exchange for them on Wall St.,stock,1,0
4846,2005-10-10,2005 Back to School Week game 1.,Jeopardy,"(6, 4)",LET'S GO TO THE MOVIES,11,"(800,)",False,"The people at www.captiveaudience.org want to eliminate these before movies; coming attractions, they're OK with",commercials,0,3
4846,2005-10-10,2005 Back to School Week game 1.,Jeopardy,"(1, 5)",KIDS IN HISTORY,8,"(1000,)",False,This Polish-French composer who was born in 1810 composed a polonaise when he was only 7,(Fredric) Chopin,0,3
4846,2005-10-10,2005 Back to School Week game 1.,Jeopardy,"(2, 5)",WHERE WE WENT ON SUMMER VACATION,30,"(1000,)",False,"…to New York City where we visited the Museum of Modern Art & saw this man's famous painting, ""Starry Night""",Vincent Van Gogh,1,1
4846,2005-10-10,2005 Back to School Week game 1.,Jeopardy,"(3, 5)",IN THE BOOKSTORE,29,"(1000,)",False,Duchess is the mother of the title horse of this Anna Sewell story,Black Beauty,1,0
4846,2005-10-10,2005 Back to School Week game 1.,Jeopardy,"(4, 5)",ANAGRAM ZOO,20,"(1000,)",False,Asian snake fighter:EGO MOONS,a mongoose,1,0
4846,2005-10-10,2005 Back to School Week game 1.,Jeopardy,"(5, 5)",HOW TO INVEST YOUR ALLOWANCE,17,"(1000,)",False,Buy U.S. Savings Bonds from this government department founded in 1789,the U.S. Treasury,1,0
4846,2005-10-10,2005 Back to School Week game 1.,Jeopardy,"(6, 5)",LET'S GO TO THE MOVIES,12,"(1000,)",False,"This type of ""seating"", named for a place to watch sports, puts each row well above the one in front",stadium,1,0
4846,2005-10-10,2005 Back to School Week game 1.,Double Jeopardy,"(1, 1)","""B"" IN SCIENCE",1,"(400,)",False,This treelike grass with a woody stem is the favored food of pandas,bamboo,1,0
4846,2005-10-10,2005 Back to School Week game 1.,Double Jeopardy,"(2, 1)",TV DINNERS,2,"(400,)",False,This title character had to work as a frycook at the Chum Bucket after Mr. Krabs lost him in a bet,SpongeBob SquarePants,1,0
4846,2005-10-10,2005 Back to School Week game 1.,Double Jeopardy,"(3, 1)",YOU CAN QUOTE ME!,5,"(400,)",False,"A current U.S. governor:""America is a place where anyone can make it, even an Austrian farm boy""",Schwarzenegger,1,0
4846,2005-10-10,2005 Back to School Week game 1.,Double Jeopardy,"(4, 1)",THE AUDIOVISUAL HOUR,26,"(400,)",False,(Jon of the Clue Crew plays with his food.)  A traditional sound effect is crushing cornflakes to get the sound of footsteps on these in autumn,leaves,1,0
4846,2005-10-10,2005 Back to School Week game 1.,Double Jeopardy,"(5, 1)","I SEE LONDON, I SEE FRANCE",21,"(400,)",False,"Opened in 1994 & nearly 31 miles long, it has entrances near Folkstone, England & Coquelles, France",the Chunnel,0,3
4846,2005-10-10,2005 Back to School Week game 1.,Double Jeopardy,"(6, 1)",10-LETTER WORDS,16,"(400,)",False,"Superman knows it's from the Greek for ""mother city""",Metropolis,1,1
4846,2005-10-10,2005 Back to School Week game 1.,Double Jeopardy,"(1, 2)","""B"" IN SCIENCE",3,"(800,)",False,Toxins from these single-celled organisms can cause diseases like botulism,bacteria,1,0
4846,2005-10-10,2005 Back to School Week game 1.,Double Jeopardy,"(2, 2)",TV DINNERS,4,"(800,)",False,Restaurants on this animated series include The Frying Dutchman & Krusty Burger,The Simpsons,1,0
4846,2005-10-10,2005 Back to School Week game 1.,Double Jeopardy,"(3, 2)",YOU CAN QUOTE ME!,6,"(800,)",False,"In 1961:""Ask not what your country can do for you; ask what you can do for your country""",John F. Kennedy,1,0
4846,2005-10-10,2005 Back to School Week game 1.,Double Jeopardy,"(4, 2)",THE AUDIOVISUAL HOUR,27,"(800,)",False,This instrument heard here is popular in both jazz & classical ensembles,a clarinet,1,2
4846,2005-10-10,2005 Back to School Week game 1.,Double Jeopardy,"(5, 2)","I SEE LONDON, I SEE FRANCE",22,"(800,)",False,This roamin' Roman led the invasions of Gaul in 58 B.C. & Britain in 55 B.C.; he'd be dead 11 years after that,Julius Caesar,1,0
4846,2005-10-10,2005 Back to School Week game 1.,Double Jeopardy,"(6, 2)",10-LETTER WORDS,17,"(1400,)",True,The only continent that fits the category,Antarctica,1,0
4846,2005-10-10,2005 Back to School Week game 1.,Double Jeopardy,"(1, 3)","""B"" IN SCIENCE",12,"(1000,)",True,It's the theory that the universe was created in a cosmic explosion,the big bang theory,1,0
4846,2005-10-10,2005 Back to School Week game 1.,Double Jeopardy,"(2, 3)",TV DINNERS,9,"(1200,)",False,You can buy groceries to make your own dinner at Mr. Hooper's store on this famous PBS road,Sesame Street,0,3
4846,2005-10-10,2005 Back to School Week game 1.,Double Jeopardy,"(3, 3)",YOU CAN QUOTE ME!,7,"(1200,)",False,"In the Bible:""Let my people go!""",Moses,1,0
4846,2005-10-10,2005 Back to School Week game 1.,Double Jeopardy,"(4, 3)",THE AUDIOVISUAL HOUR,28,"(1200,)",False,The straight dope is it's the strait indicated here,the Strait of Gibraltar,1,0
4846,2005-10-10,2005 Back to School Week game 1.,Double Jeopardy,"(5, 3)","I SEE LONDON, I SEE FRANCE",23,"(1200,)",False,In 1066 William the Conqueror was crowned King at this famous abbey,Westminster Abbey,1,0
4846,2005-10-10,2005 Back to School Week game 1.,Double Jeopardy,"(6, 3)",10-LETTER WORDS,18,"(1200,)",False,"A round missile of war, or a splashy pool entry",cannonball,1,0
4846,2005-10-10,2005 Back to School Week game 1.,Double Jeopardy,"(1, 4)","""B"" IN SCIENCE",13,"(1600,)",False,"This attraction between atoms may be ionic, covalent or hydrogen",the bond,0,3
4846,2005-10-10,2005 Back to School Week game 1.,Double Jeopardy,"(2, 4)",TV DINNERS,10,"(1600,)",False,Hilary Duff had a nightmare about working at the Burger Planet on this show,Lizzie McGuire,1,0
4846,2005-10-10,2005 Back to School Week game 1.,Double Jeopardy,"(3, 4)",YOU CAN QUOTE ME!,8,"(1600,)",False,"Andy Warhol:""In the future, everyone will be famous for"" this many minutes",fifteen,1,0
4846,2005-10-10,2005 Back to School Week game 1.,Double Jeopardy,"(4, 4)",THE AUDIOVISUAL HOUR,29,"(1600,)",False,(Kelly of the Clue Crew reports from the chemistry lab.)  The soft mineral that I'm able to scratch easily gives its name to this popular powder for skin,talc (or talcum powder),1,0
4846,2005-10-10,2005 Back to School Week game 1.,Double Jeopardy,"(5, 4)","I SEE LONDON, I SEE FRANCE",24,"(1600,)",False,"Though France beat this future American president in a 1754 battle at Fort Necessity, it lost the war",George Washington,1,0
4846,2005-10-10,2005 Back to School Week game 1.,Double Jeopardy,"(6, 4)",10-LETTER WORDS,19,"(1600,)",False,"A 1920s dance, or a city in South Carolina",the Charleston,1,0
4846,2005-10-10,2005 Back to School Week game 1.,Double Jeopardy,"(1, 5)","""B"" IN SCIENCE",14,"(2000,)",False,This dark volcanic rock is low in silica content but fairly rich in iron & magnesium,basalt,1,0
4846,2005-10-10,2005 Back to School Week game 1.,Double Jeopardy,"(2, 5)",TV DINNERS,11,"(2000,)",False,You don't have to be psychic to know the Chill Grill is the home away from home on this Disney Channel show,That\'s So Raven,1,0
4846,2005-10-10,2005 Back to School Week game 1.,Double Jeopardy,"(3, 5)",YOU CAN QUOTE ME!,15,"(2000,)",False,"An inventor:""Genius is one percent inspiration & ninety-nine percent perspiration""",Thomas Alva Edison,1,1
4846,2005-10-10,2005 Back to School Week game 1.,Double Jeopardy,"(5, 5)","I SEE LONDON, I SEE FRANCE",25,"(2000,)",False,"After his capture during this long war with France, Chaucer's ransom was paid by King Edward III & he was released",the Hundred Years\' War,0,3
4846,2005-10-10,2005 Back to School Week game 1.,Double Jeopardy,"(6, 5)",10-LETTER WORDS,20,"(2000,)",False,A solid figure having 10 sides,a decahedron,0,3
4846,2005-10-10,2005 Back to School Week game 1.,Final Jeopardy,"(1, 1)",CHILDREN'S LITERATURE,0,"(10199, 1401)",False,This one-word name is derived from the fact that the character used to sit among the ashes,Cinderella,2,0
