epNum,airDate,extra_info,round_name,coord,category,order,value,daily_double,question,answer,correctAttempts,wrongAttempts
4921,2006-01-23,Bob Mesko game 1.,Jeopardy,"(1, 1)",HE WAS PRESIDENT WHEN...,6,"(200,)",False,the U.S. Senate rejected the Versailles Treaty,Wilson,1,0
4921,2006-01-23,Bob Mesko game 1.,Jeopardy,"(2, 1)",FILMOGRAPHIES,16,"(200,)",False,"""Little Women"",""A Place in the Sun"",""The Sandpiper""",Elizabeth Taylor,0,3
4921,2006-01-23,Bob Mesko game 1.,Jeopardy,"(3, 1)",HOLIDAYS & OBSERVANCES,1,"(200,)",False,June 17 is Bunker Hill Day in this state's Suffolk County,Massachusetts,1,0
4921,2006-01-23,Bob Mesko game 1.,Jeopardy,"(4, 1)","CAPITAL ""K""s",11,"(200,)",False,"Freed from the Taliban, in 2001 men in this capital lined up for their first shaves in 5 years",Kabul,1,0
4921,2006-01-23,Bob Mesko game 1.,Jeopardy,"(5, 1)",TEXTILES,26,"(200,)",False,"A certain rabbit could tell you this medium-weight fabric whose name comes from ""velet"" gives the look of velvet",velveteen,1,0
4921,2006-01-23,Bob Mesko game 1.,Jeopardy,"(6, 1)",THE SHORT FORM,21,"(200,)",False,"""Dis"" is short for this, what you show someone if you dis him",disrespect,1,0
4921,2006-01-23,Bob Mesko game 1.,Jeopardy,"(1, 2)",HE WAS PRESIDENT WHEN...,7,"(400,)",False,South Carolina became the first state to secede from the Union,Buchanan,1,0
4921,2006-01-23,Bob Mesko game 1.,Jeopardy,"(2, 2)",FILMOGRAPHIES,17,"(400,)",False,"""Inherit the Wind"",""Anchors Aweigh"",""An American in Paris""",Gene Kelly,1,1
4921,2006-01-23,Bob Mesko game 1.,Jeopardy,"(3, 2)",HOLIDAYS & OBSERVANCES,2,"(400,)",False,In Sweden the Julbord is the smorgasbord for this holiday,Christmas,1,0
4921,2006-01-23,Bob Mesko game 1.,Jeopardy,"(4, 2)","CAPITAL ""K""s",12,"(400,)",False,"Though it's in a valley, this Nepalese city is still 4,300 freet above sea level",Kathmandu,1,0
4921,2006-01-23,Bob Mesko game 1.,Jeopardy,"(5, 2)",TEXTILES,27,"(400,)",False,In the 400s B.C. Herodotus told the Greeks that India had plants that bear fleece--he meant this,cotton,1,0
4921,2006-01-23,Bob Mesko game 1.,Jeopardy,"(6, 2)",THE SHORT FORM,22,"(400,)",False,"""Fan"", as in ""a rabid sports fan"", comes from this word",fanatic,1,0
4921,2006-01-23,Bob Mesko game 1.,Jeopardy,"(1, 3)",HE WAS PRESIDENT WHEN...,8,"(600,)",False,Joe DiMaggio hit safely in a record 56 straight games,FDR,0,3
4921,2006-01-23,Bob Mesko game 1.,Jeopardy,"(2, 3)",FILMOGRAPHIES,18,"(600,)",False,"""Tortilla Flat"",""Thirty Seconds Over Tokyo"",""The Old Man and the Sea""",Spencer Tracy,1,0
4921,2006-01-23,Bob Mesko game 1.,Jeopardy,"(3, 3)",HOLIDAYS & OBSERVANCES,3,"(600,)",False,This holiday is the night before All Saints' Day,Halloween,1,0
4921,2006-01-23,Bob Mesko game 1.,Jeopardy,"(4, 3)","CAPITAL ""K""s",13,"(600,)",False,This present Malaysian capital replaced Klang as a regional capital in the late 1800s & began a growth spurt,Kuala Lumpur,1,0
4921,2006-01-23,Bob Mesko game 1.,Jeopardy,"(5, 3)",TEXTILES,28,"(600,)",False,"Now often used in scarves, cashmere was originally associated with this outer wrap for women",a shawl,1,0
4921,2006-01-23,Bob Mesko game 1.,Jeopardy,"(6, 3)",THE SHORT FORM,23,"(600,)",False,"Don't believe the hype, but believe that ""hype"" partly comes from shortening this word",hyperbole (hyperbolic accepted),1,0
4921,2006-01-23,Bob Mesko game 1.,Jeopardy,"(1, 4)",HE WAS PRESIDENT WHEN...,9,"(800,)",False,Lindbergh first flew the Atlantic solo,Coolidge,0,3
4921,2006-01-23,Bob Mesko game 1.,Jeopardy,"(2, 4)",FILMOGRAPHIES,19,"(800,)",False,"""Dark Victory"",""Of Human Bondage"",""The Petrified Forest""",Bette Davis,1,0
4921,2006-01-23,Bob Mesko game 1.,Jeopardy,"(3, 4)",HOLIDAYS & OBSERVANCES,4,"(800,)",False,"(Cheryl of the Clue Crew waxes eloquent in front of Lenin's tomb in Moscow, Russia.)  Soviet leaders reviewed a parade of military hardware from Lenin's tomb each year on this day, a Socialist holiday since 1889",May Day,1,0
4921,2006-01-23,Bob Mesko game 1.,Jeopardy,"(4, 4)","CAPITAL ""K""s",14,"(800,)",False,"In the movie with the same name as this city, Olivier says, ""The Nile must taste of blood for a thousand miles""",Khartoum,1,0
4921,2006-01-23,Bob Mesko game 1.,Jeopardy,"(5, 4)",TEXTILES,29,"(800,)",False,"Delicate Foulard textiles, used for ties & handkerchiefs, were originally this fabric",silk,1,0
4921,2006-01-23,Bob Mesko game 1.,Jeopardy,"(6, 4)",THE SHORT FORM,24,"(800,)",False,"To sum up, ""recap"" is a short form of this word",recapitulate,1,0
4921,2006-01-23,Bob Mesko game 1.,Jeopardy,"(1, 5)",HE WAS PRESIDENT WHEN...,10,"(1000,)",False,The U.S. Battleship Maine exploded in Havana Harbor,McKinley,1,0
4921,2006-01-23,Bob Mesko game 1.,Jeopardy,"(2, 5)",FILMOGRAPHIES,20,"(1000,)",False,"""Double Indemnity"",""The Apartment"",""The Shaggy Dog""",Fred MacMurray,0,3
4921,2006-01-23,Bob Mesko game 1.,Jeopardy,"(3, 5)",HOLIDAYS & OBSERVANCES,5,"(1000,)",False,It's the palindromic name for the Vietnamese New Year,Tet,1,0
4921,2006-01-23,Bob Mesko game 1.,Jeopardy,"(4, 5)","CAPITAL ""K""s",15,"(1400,)",True,A Caribbean capital or the first capital of the State of New York,Kingston,1,0
4921,2006-01-23,Bob Mesko game 1.,Jeopardy,"(5, 5)",TEXTILES,30,"(1000,)",False,(Cheryl of the Clue Crew delivers the goods from the NC State University's College of Textiles.)  This 2004 model loom still uses a method of controlling individual yarns based on the one developed in 1804 by this French loom inventor,Jacquard,1,0
4921,2006-01-23,Bob Mesko game 1.,Jeopardy,"(6, 5)",THE SHORT FORM,25,"(1000,)",False,"""Pan"", a camera move, comes from this longer word",panorama (or panoramic),0,3
4921,2006-01-23,Bob Mesko game 1.,Double Jeopardy,"(1, 1)",MEDICAL PIONEERS,11,"(400,)",False,"Life-changing & yummy too, the oral polio vaccine was developed by this University of Cincinnati researcher",Albert Sabin,0,3
4921,2006-01-23,Bob Mesko game 1.,Double Jeopardy,"(2, 1)","RIGHT ON ""Q""",5,"(400,)",False,"Mai oui, this province produces more maple syrup than all the U.S. states combined",Quebec,1,0
4921,2006-01-23,Bob Mesko game 1.,Double Jeopardy,"(3, 1)",A LITTLE DICKENS,1,"(400,)",False,"In ""Oliver Twist"", Bill Sikes' girl, Nancy, is a member of this man's gang of pickpockets",Fagin,1,1
4921,2006-01-23,Bob Mesko game 1.,Double Jeopardy,"(4, 1)",TEXAS,15,"(400,)",False,"Texas' King Ranch developed the Santa Gertrudis, the Western Hemisphere's first new breed of this",cattle,1,0
4921,2006-01-23,Bob Mesko game 1.,Double Jeopardy,"(5, 1)",CHAIN STORE,26,"(400,)",False,"It sounds like a sailors' surplus store, but this clothing store chain is a branch of GAP, Inc.",Old Navy,1,0
4921,2006-01-23,Bob Mesko game 1.,Double Jeopardy,"(6, 1)",MASSACRE,21,"(400,)",False,The greatest margin of victory in a Super Bowl came when this team stomped the Denver Broncos 55-10 in 1990,the San Francisco 49ers,0,3
4921,2006-01-23,Bob Mesko game 1.,Double Jeopardy,"(1, 2)",MEDICAL PIONEERS,12,"(800,)",False,"In 1901 this army surgeon who later had a D.C. hospital named for him published ""The Prevention of Yellow Fever""",Walter Reed,1,0
4921,2006-01-23,Bob Mesko game 1.,Double Jeopardy,"(2, 2)","RIGHT ON ""Q""",6,"(800,)",False,"In 1965 Maarten Schmidt identified the most distant object then seen, one of these high-energy objects in outer space",a quasar,1,0
4921,2006-01-23,Bob Mesko game 1.,Double Jeopardy,"(3, 2)",A LITTLE DICKENS,2,"(800,)",False,Uriah Heep had a heap of hate for this Dickens title character,David Copperfield,1,0
4921,2006-01-23,Bob Mesko game 1.,Double Jeopardy,"(4, 2)",TEXAS,16,"(800,)",False,"On Sept. 24, 2005 the Gulf region was still recovering from Katrina when this hurricane slammed into Texas",Rita,1,0
4921,2006-01-23,Bob Mesko game 1.,Double Jeopardy,"(5, 2)",CHAIN STORE,29,"(800,)",False,The name of an inspirational body of water is part of the name of this national bookstore chain,Waldenbooks,1,0
4921,2006-01-23,Bob Mesko game 1.,Double Jeopardy,"(6, 2)",MASSACRE,22,"(800,)",False,"In a career that ran from 1936 to 1963, Archie Moore scored an unprecedented 141 of these boxing decisions",knockouts,1,0
4921,2006-01-23,Bob Mesko game 1.,Double Jeopardy,"(1, 3)",MEDICAL PIONEERS,13,"(1200,)",False,This Italian anatomist's career went down the tubes in 1561 when he discovered the oviduct,Fallopius (or Gabriello Fallopio),0,3
4921,2006-01-23,Bob Mesko game 1.,Double Jeopardy,"(2, 3)","RIGHT ON ""Q""",7,"(1200,)",False,It's a Western Hemisphere national capital city of 1.4 million people,Quito,1,0
4921,2006-01-23,Bob Mesko game 1.,Double Jeopardy,"(3, 3)",A LITTLE DICKENS,3,"(1200,)",True,"This Dickens work was first published on December 17, 1843",A Christmas Carol,0,1
4921,2006-01-23,Bob Mesko game 1.,Double Jeopardy,"(4, 3)",TEXAS,17,"(1200,)",False,"While in custody of the Dallas Police he was shot & killed November 24, 1963",Lee Harvey Oswald,1,1
4921,2006-01-23,Bob Mesko game 1.,Double Jeopardy,"(5, 3)",CHAIN STORE,27,"(1200,)",False,John Madden & Connie Stevens have both been spokespeople for this supply shore,Ace Hardware,0,3
4921,2006-01-23,Bob Mesko game 1.,Double Jeopardy,"(6, 3)",MASSACRE,23,"(1200,)",False,In 1991 this Ohio-based team trounced the Miami Heat 148-80 in the biggest NBA triumph ever,the Cleveland Cavaliers,0,3
4921,2006-01-23,Bob Mesko game 1.,Double Jeopardy,"(1, 4)",MEDICAL PIONEERS,14,"(1600,)",False,"His 1543 landmark work on anatomy, ""De Humani Corporis Fabrica"", contained illustrations by Titian's studio",Vesalius,0,3
4921,2006-01-23,Bob Mesko game 1.,Double Jeopardy,"(2, 4)","RIGHT ON ""Q""",8,"(1600,)",False,"A term for any hunted animal, it comes from a Middle English word for ""the entrails given to the hounds""",quarry,1,0
4921,2006-01-23,Bob Mesko game 1.,Double Jeopardy,"(3, 4)",A LITTLE DICKENS,4,"(1600,)",False,It's the specific type of prison where Charles Dickens' father suffered in 1824,debtor\'s prison,1,0
4921,2006-01-23,Bob Mesko game 1.,Double Jeopardy,"(4, 4)",TEXAS,18,"(1600,)",False,"From the Spanish for ""little armed one"", it's the state small mammal of Texas",the armadillo,1,0
4921,2006-01-23,Bob Mesko game 1.,Double Jeopardy,"(5, 4)",CHAIN STORE,28,"(1400,)",True,The curly hair of founder Paul Orfalea gave this business-service chain its name,Kinko\'s,1,0
4921,2006-01-23,Bob Mesko game 1.,Double Jeopardy,"(6, 4)",MASSACRE,24,"(1600,)",False,"In the highest score ever in an int'l soccer game, Australia humbled this ""American"" territory 31-0 in 2001",American Samoa,1,0
4921,2006-01-23,Bob Mesko game 1.,Double Jeopardy,"(1, 5)",MEDICAL PIONEERS,20,"(2000,)",False,In 1949 the American Medical Women's Assoc. named an award for this pioneer who got her degree in 1849,Elizabeth Blackwell,1,0
4921,2006-01-23,Bob Mesko game 1.,Double Jeopardy,"(2, 5)","RIGHT ON ""Q""",9,"(2000,)",False,"It's Latin for ""something for something""; as in you do one thing for me, I'll do the same back for you",quid pro quo,1,0
4921,2006-01-23,Bob Mesko game 1.,Double Jeopardy,"(3, 5)",A LITTLE DICKENS,10,"(2000,)",False,"Little Paul is the ""son"" in this Dickens title business",Dombey and Son,0,3
4921,2006-01-23,Bob Mesko game 1.,Double Jeopardy,"(4, 5)",TEXAS,19,"(2000,)",False,"This West Texas city of about 600,000 sits on the Rio Grande opposite Ciudad Juarez, Mexico",El Paso,1,0
4921,2006-01-23,Bob Mesko game 1.,Double Jeopardy,"(5, 5)",CHAIN STORE,30,"(2000,)",False,"Appropriately, the ""C"" in the name of this department store chain named for its founder stands for ""Cash""",J.C. Penney,1,0
4921,2006-01-23,Bob Mesko game 1.,Double Jeopardy,"(6, 5)",MASSACRE,25,"(2000,)",False,"In a 1994 match between Durham & Warwickshire, Brian Lara scored 390 runs in a single day in this sport!",cricket,1,0
4921,2006-01-23,Bob Mesko game 1.,Final Jeopardy,"(1, 1)",GEM LORE,0,"(3800, 10599, 6201)",False,"In Greek myth this gem was ""created"" by tears of wine from Dionysus that stained the quartz statue of a maiden",the amethyst,0,3
