epNum,airDate,extra_info,round_name,coord,category,order,value,daily_double,question,answer,correctAttempts,wrongAttempts
4923,2006-01-25,Bob Mesko game 3.,Jeopardy,"(1, 1)",GOING NUCULAR,16,"(200,)",False,"On TV this Springfield safety inspector once corrected someone who said nuclear instead of ""nucular""",Homer Simpson,1,0
4923,2006-01-25,Bob Mesko game 3.,Jeopardy,"(2, 1)",BEATLES BEFORE & AFTER,17,"(200,)",False,Famous London church whose album cover showed the lads in a zebra crossing,Westminster Abbey Road,1,0
4923,2006-01-25,Bob Mesko game 3.,Jeopardy,"(3, 1)",BOROUGH BABIES,11,"(200,)",False,Donald Trump grew up in a 23-room house in Jamaica Estates here,Queens,1,0
4923,2006-01-25,Bob Mesko game 3.,Jeopardy,"(4, 1)",ALSO A BODY PART,24,"(200,)",False,"It's the bud of a potato, bud",the eye,1,0
4923,2006-01-25,Bob Mesko game 3.,Jeopardy,"(5, 1)",BOOZE,6,"(200,)",False,"This strong liquor is named for the town in Jalisco, Mexico that's a center for its production",tequila,1,0
4923,2006-01-25,Bob Mesko game 3.,Jeopardy,"(6, 1)","""FOO"" FINDERS",1,"(200,)",False,It's a Chinese-American chopped goodies omelet with gravy,egg foo young,1,0
4923,2006-01-25,Bob Mesko game 3.,Jeopardy,"(1, 2)",GOING NUCULAR,22,"(400,)",False,"This president who often said ""nucular"" proposed the ""Atoms for Peace"" plan at the U.N.",Eisenhower,1,0
4923,2006-01-25,Bob Mesko game 3.,Jeopardy,"(2, 2)",BEATLES BEFORE & AFTER,18,"(400,)",False,"This 1970 Beatles hit ""leads to your door"" with an angry outburst by the driver of a car","""The Long And Winding Road Rage""",1,0
4923,2006-01-25,Bob Mesko game 3.,Jeopardy,"(3, 2)",BOROUGH BABIES,12,"(400,)",False,"Born here, Cornelius Vanderbilt started a ferry service at age 16",Staten Island,1,1
4923,2006-01-25,Bob Mesko game 3.,Jeopardy,"(4, 2)",ALSO A BODY PART,25,"(400,)",False,(Kelly of the Clue Crew takes apart a microphone.)  A basic part of any microphone is this thin metal disk that vibrates in response to sound; it's also a body part,diaphragm,0,3
4923,2006-01-25,Bob Mesko game 3.,Jeopardy,"(5, 2)",BOOZE,7,"(400,)",False,"Rhyming name of the classic tropical cocktail of rum, curacao & lime juice",a mai tai,1,0
4923,2006-01-25,Bob Mesko game 3.,Jeopardy,"(6, 2)","""FOO"" FINDERS",2,"(400,)",False,Iron pyrite,fool\'s gold,1,0
4923,2006-01-25,Bob Mesko game 3.,Jeopardy,"(1, 3)",GOING NUCULAR,23,"(600,)",False,"Speechwriters for this 38th president often used ""atomic"" so he wouldn't say ""nucular""",Ford,1,0
4923,2006-01-25,Bob Mesko game 3.,Jeopardy,"(2, 3)",BEATLES BEFORE & AFTER,19,"(600,)",False,"""Unalienable rights"" include ""life, liberty"" & the ""White Album""'s ode to firearms",the pursuit of happiness is a warm gun,1,1
4923,2006-01-25,Bob Mesko game 3.,Jeopardy,"(3, 3)",BOROUGH BABIES,13,"(600,)",False,Sophisticated young Ralph Lifshitz (later Lauren) found it a zoo,the Bronx,1,0
4923,2006-01-25,Bob Mesko game 3.,Jeopardy,"(4, 3)",ALSO A BODY PART,26,"(600,)",False,"Ancient Romans called this flatfish ""Jupiter's sandal""",sole,1,0
4923,2006-01-25,Bob Mesko game 3.,Jeopardy,"(5, 3)",BOOZE,8,"(600,)",False,"Head to Asia for this cocktail of gin, cherry brandy, sugar & water",a Singapore sling,1,0
4923,2006-01-25,Bob Mesko game 3.,Jeopardy,"(6, 3)","""FOO"" FINDERS",3,"(600,)",False,"""Speedy"" term for McDonald's, etc.",fast food,1,0
4923,2006-01-25,Bob Mesko game 3.,Jeopardy,"(1, 4)",GOING NUCULAR,29,"(800,)",False,"The St. Petersburg Times reports this Florida senator, a 2004 Democratic presidential candidate, said, ""It doesn't pronounce the way it looks""",(Bob) Graham,1,0
4923,2006-01-25,Bob Mesko game 3.,Jeopardy,"(2, 4)",BEATLES BEFORE & AFTER,20,"(800,)",False,"1964 No. 2 hit that says, ""Do you promise not to tell"" that I'm a spy","""Do You Want To Know A Secret Agent""",0,3
4923,2006-01-25,Bob Mesko game 3.,Jeopardy,"(3, 4)",BOROUGH BABIES,14,"(1000,)",True,Author Betty Smith's borough of birth,Brooklyn,1,0
4923,2006-01-25,Bob Mesko game 3.,Jeopardy,"(4, 4)",ALSO A BODY PART,28,"(800,)",False,It equals 30.48 centimeters,a foot,1,0
4923,2006-01-25,Bob Mesko game 3.,Jeopardy,"(5, 4)",BOOZE,9,"(800,)",False,"If you don't add the salt to a salty dog, you have this other ""canine"" cocktail",a greyhound,0,3
4923,2006-01-25,Bob Mesko game 3.,Jeopardy,"(6, 4)","""FOO"" FINDERS",4,"(800,)",False,"From the Italian for ""clowning"", it's a 7-letter word for a person given to clowning & joking",buffoon,0,3
4923,2006-01-25,Bob Mesko game 3.,Jeopardy,"(1, 5)",GOING NUCULAR,30,"(1000,)",False,"On the PBS Newshour, Les Aspin, this president's Secretary of Defense, shot off ""nucular"" weapons",Clinton,0,3
4923,2006-01-25,Bob Mesko game 3.,Jeopardy,"(2, 5)",BEATLES BEFORE & AFTER,21,"(1000,)",False,"Take this sad song, a 1968 No. 1, & Thomas Hardy's last novel & make it better","""Hey Jude The Obscure""",1,0
4923,2006-01-25,Bob Mesko game 3.,Jeopardy,"(3, 5)",BOROUGH BABIES,15,"(1000,)",False,"Before moving to ""The O.C."", Peter Gallagher debuted at Lenox Hill Hospital here",Manhattan,1,0
4923,2006-01-25,Bob Mesko game 3.,Jeopardy,"(4, 5)",ALSO A BODY PART,27,"(1000,)",False,"(Cheryl of the Clue Crew holds a jacketless copy of Jane Austen's Persuasion.)  To some, books are like people--maybe that's why some of their parts have names like head, spine & this part that connects the spine & cover",the joint,0,3
4923,2006-01-25,Bob Mesko game 3.,Jeopardy,"(5, 5)",BOOZE,10,"(1000,)",False,"One cover story in the magazine devoted to & named for this liquor was ""The Birth of Blending""",whiskey,1,1
4923,2006-01-25,Bob Mesko game 3.,Jeopardy,"(6, 5)","""FOO"" FINDERS",5,"(1000,)",False,"""Essence of Emeril"" is a favorite show on this cable TV channel",the Food Network,1,0
4923,2006-01-25,Bob Mesko game 3.,Double Jeopardy,"(1, 1)",THE BRITISH ISLES,8,"(400,)",False,"Lough Neagh, about 20 miles west of this Northern Ireland capital, is the largest lake in the British Isles",Belfast,1,0
4923,2006-01-25,Bob Mesko game 3.,Double Jeopardy,"(2, 1)",GET YOUR FACTS STRAIGHT,18,"(400,)",False,"Tim Robbins wrote & starred in ""Bob Roberts""; Tom Robbins wrote ""Even"" these ""Get the Blues""",Cowgirls,1,0
4923,2006-01-25,Bob Mesko game 3.,Double Jeopardy,"(3, 1)",THE REAL ADAMS FAMILY,13,"(400,)",False,"Let's drink a beer to the memory of this man who died in Boston Oct. 2, 1803, aged 81",Sam Adams,1,0
4923,2006-01-25,Bob Mesko game 3.,Double Jeopardy,"(4, 1)","THE ""UN""CATEGORY",1,"(400,)",False,The totality of all matter & energy in space,the universe,1,0
4923,2006-01-25,Bob Mesko game 3.,Double Jeopardy,"(5, 1)",HITTING A HOMER,23,"(400,)",False,Hers was the face that launched a thousand ships,Helen of Troy,1,0
4923,2006-01-25,Bob Mesko game 3.,Double Jeopardy,"(6, 1)",WE'RE TALKING BASEBALL,3,"(400,)",False,"It took this team 88 years, but in 2005 they took it to the Astros & swept to victory in the World Series",the Chicago White Sox,1,0
4923,2006-01-25,Bob Mesko game 3.,Double Jeopardy,"(1, 2)",THE BRITISH ISLES,9,"(800,)",False,On a clear day you can see France from a castle named for this seaport in the county of Kent,Dover Castle,0,3
4923,2006-01-25,Bob Mesko game 3.,Double Jeopardy,"(2, 2)",GET YOUR FACTS STRAIGHT,19,"(800,)",False,Maz Azaria created the fashion line BCBG; Hilly Krystal founded this NYC underground music club,CBGB,1,0
4923,2006-01-25,Bob Mesko game 3.,Double Jeopardy,"(3, 2)",THE REAL ADAMS FAMILY,14,"(800,)",False,In 1900 Brooks Adams predicted that in 50 years these countries would be the world's 2 main powers,the United States & Russia,1,0
4923,2006-01-25,Bob Mesko game 3.,Double Jeopardy,"(4, 2)","THE ""UN""CATEGORY",2,"(800,)",False,A mortician or funeral director,an undertaker,1,0
4923,2006-01-25,Bob Mesko game 3.,Double Jeopardy,"(5, 2)",HITTING A HOMER,24,"(800,)",False,"In the ""Iliad"", he was the greatest of the Greek warriors",Achilles,1,0
4923,2006-01-25,Bob Mesko game 3.,Double Jeopardy,"(6, 2)",WE'RE TALKING BASEBALL,5,"(800,)",False,"In 2006 this team will play in the newly built Busch Stadium, their third home field to carry that name",the Cardinals,1,0
4923,2006-01-25,Bob Mesko game 3.,Double Jeopardy,"(1, 3)",THE BRITISH ISLES,10,"(1200,)",False,This island group that lies just north of the Scottish mainland was known to classical writers as the Orcades,the Orkney Islands,1,0
4923,2006-01-25,Bob Mesko game 3.,Double Jeopardy,"(2, 3)",GET YOUR FACTS STRAIGHT,20,"(1200,)",False,"The Book of Kells dates from about 800 A.D.; ""The Story of My Life"", which dates from 1902, is the book of her",Helen Keller,1,0
4923,2006-01-25,Bob Mesko game 3.,Double Jeopardy,"(3, 3)",THE REAL ADAMS FAMILY,15,"(1200,)",False,"On becoming president, he said he was ""less possessed of your confidence... than any of my predecessors""",John Quincy Adams,1,0
4923,2006-01-25,Bob Mesko game 3.,Double Jeopardy,"(4, 3)","THE ""UN""CATEGORY",4,"(1200,)",False,"A freshman or a sophomore, when spoken of as ""below"" a senior or junior",an underclassman,1,0
4923,2006-01-25,Bob Mesko game 3.,Double Jeopardy,"(5, 3)",HITTING A HOMER,28,"(1200,)",False,"Brother to Paris, he was the greatest of the Trojan warriors",Hector,1,0
4923,2006-01-25,Bob Mesko game 3.,Double Jeopardy,"(6, 3)",WE'RE TALKING BASEBALL,25,"(1200,)",False,"We bet you know that he's Major League Baseball's all-time singles leader at 3,215",Pete Rose,1,0
4923,2006-01-25,Bob Mesko game 3.,Double Jeopardy,"(1, 4)",THE BRITISH ISLES,11,"(1600,)",False,"Based on its name, you might want to wear a sweater while walking along the coast of this largest Welsh bay",Cardigan Bay,1,0
4923,2006-01-25,Bob Mesko game 3.,Double Jeopardy,"(2, 4)",GET YOUR FACTS STRAIGHT,21,"(1600,)",False,Harvard is a school; this is a mild cheese once known as Danish tilsit,Havarti,0,3
4923,2006-01-25,Bob Mesko game 3.,Double Jeopardy,"(3, 4)",THE REAL ADAMS FAMILY,16,"(1600,)",False,"Henry Adams lived in this city, & there's a memorial to his wife Clover in Rock Creek Cemetery there","Washington, D.C.",1,0
4923,2006-01-25,Bob Mesko game 3.,Double Jeopardy,"(4, 4)","THE ""UN""CATEGORY",6,"(1600,)",False,The first commercially available electronic computer,UNIVAC,1,0
4923,2006-01-25,Bob Mesko game 3.,Double Jeopardy,"(5, 4)",HITTING A HOMER,29,"(1600,)",False,The king of Troy & husband to Hecuba,Priam,1,0
4923,2006-01-25,Bob Mesko game 3.,Double Jeopardy,"(6, 4)",WE'RE TALKING BASEBALL,26,"(3000,)",True,In 1975 this ballplayer was awarded the NAACP's prestigious Spingarn Medal,Hank Aaron,0,1
4923,2006-01-25,Bob Mesko game 3.,Double Jeopardy,"(1, 5)",THE BRITISH ISLES,12,"(2000,)",False,"This low mountain range has been called the ""backbone of England""",the Pennine Range,0,3
4923,2006-01-25,Bob Mesko game 3.,Double Jeopardy,"(2, 5)",GET YOUR FACTS STRAIGHT,22,"(2000,)",False,"Bilirubin is a bile pigment; Robert Rubin was Secretary of this, 1995-1999",the Treasury,1,0
4923,2006-01-25,Bob Mesko game 3.,Double Jeopardy,"(3, 5)",THE REAL ADAMS FAMILY,17,"(2000,)",False,In 1848 Charles Francis Adams was on the ticket of this 2-word party formed to oppose the extension of slavery,the Free Soil Party,1,0
4923,2006-01-25,Bob Mesko game 3.,Double Jeopardy,"(4, 5)","THE ""UN""CATEGORY",7,"(2000,)",True,"From the Latin for ""small claw"", it's a generic term for a hoofed mammal",ungulate,0,1
4923,2006-01-25,Bob Mesko game 3.,Double Jeopardy,"(5, 5)",HITTING A HOMER,30,"(2000,)",False,"Leader of the Greek armies, he was murdered by his own wife after the war",Agamemnon,1,0
4923,2006-01-25,Bob Mesko game 3.,Double Jeopardy,"(6, 5)",WE'RE TALKING BASEBALL,27,"(2000,)",False,Commissioner Bud Selig is a former owner of this Midwestern Major League Baseball team,the Brewers,1,0
4923,2006-01-25,Bob Mesko game 3.,Final Jeopardy,"(1, 1)",WORD ORIGINS,0,"(4200, 1500, 4801)",False,"This word that has come to mean ""sudden prosperity"" means ""good weather"" in Spanish",bonanza,0,3
