epNum,airDate,extra_info,round_name,coord,category,order,value,daily_double,question,answer,correctAttempts,wrongAttempts
5044,2006-07-13,,Jeopardy,"(1, 1)",THE BARD WRITES,21,"(200,)",False,"In Act I, scene 1 of this play, 3 witches chant, ""Fair is foul, and foul is fair; hover through the fog and filthy air""",Macbeth,1,0
5044,2006-07-13,,Jeopardy,"(2, 1)","KIRSTEN, REESE OR SCARLETT",11,"(200,)",False,Has starred with Pitt & Cruise,Kirsten,1,1
5044,2006-07-13,,Jeopardy,"(3, 1)",NAME THAT AFRICAN COUNTRY,15,"(200,)",False,"Its history stretches back more than 5,000 years",Egypt,1,0
5044,2006-07-13,,Jeopardy,"(4, 1)",I'M SORRY,1,"(200,)",False,"This cabinet member: ""To those Iraqis... mistreated by members of the U.S. Armed Forces, I offer my deepest apology""",Rumsfeld,1,0
5044,2006-07-13,,Jeopardy,"(5, 1)",REMEMBERING THE '90s,20,"(200,)",False,"Avast, me hearties!  In 1995 Malcolm Glazer paid $192 million for this Florida football team",the (Tampa Bay) Buccaneers,1,0
5044,2006-07-13,,Jeopardy,"(6, 1)","BETTER ""RED""",2,"(200,)",False,"Jeff Foxworthy says, ""If your dad walks you to school because you're in the same grade, you might be"" one of these",a redneck,1,0
5044,2006-07-13,,Jeopardy,"(1, 2)",THE BARD WRITES,22,"(400,)",False,"This king tells Buckingham, ""I am not in the giving vein today"" & soon has Buckingham executed",Richard III,1,1
5044,2006-07-13,,Jeopardy,"(2, 2)","KIRSTEN, REESE OR SCARLETT",12,"(400,)",False,Born of a Danish father,Scarlett,1,1
5044,2006-07-13,,Jeopardy,"(3, 2)",NAME THAT AFRICAN COUNTRY,16,"(400,)",False,This kingdom has both an Atlantic coast & a Mediterranean coast,Morocco,1,0
5044,2006-07-13,,Jeopardy,"(4, 2)",I'M SORRY,7,"(400,)",False,"Citing his ""degrading and outrageous"" behavior, in 1990 this ex-D.C. mayor wrote he was ""deeply sorry""",Marion Barry,1,0
5044,2006-07-13,,Jeopardy,"(5, 2)",REMEMBERING THE '90s,26,"(400,)",False,In 1999 she was the commencement speaker at CCNY (perhaps lining up some votes for 2000),Hillary Clinton,1,0
5044,2006-07-13,,Jeopardy,"(6, 2)","BETTER ""RED""",3,"(400,)",False,A British soldier during the American Revolutionary War,a Redcoat,1,0
5044,2006-07-13,,Jeopardy,"(1, 3)",THE BARD WRITES,23,"(600,)",False,"She tells the Duke of Venice, ""That I did love the Moor to live with him""",Desdemona,1,0
5044,2006-07-13,,Jeopardy,"(2, 3)","KIRSTEN, REESE OR SCARLETT",13,"(600,)",False,"Married, with children",Reese,1,0
5044,2006-07-13,,Jeopardy,"(3, 3)",NAME THAT AFRICAN COUNTRY,17,"(600,)",False,"For more than 50 years in the 20th century, it was a colony of Belgium",Congo,1,1
5044,2006-07-13,,Jeopardy,"(4, 3)",I'M SORRY,8,"(600,)",False,"""To the degree I was too brash, too self-confident or too pushy, I apologize"", this Speaker of the House said in 1997",Newt Gingrich,1,0
5044,2006-07-13,,Jeopardy,"(5, 3)",REMEMBERING THE '90s,27,"(600,)",False,"This blonde proved that ""Les"" is more when she joined the ""60 Minutes"" team in 1991",(Leslie) Stahl,1,0
5044,2006-07-13,,Jeopardy,"(6, 3)","BETTER ""RED""",4,"(600,)",False,High-flying critter seen here,a robin redbreast,0,3
5044,2006-07-13,,Jeopardy,"(1, 4)",THE BARD WRITES,24,"(800,)",False,"This, which Shylock demands, ""is dearly bought, 'tis mine, and I will have it""",a pound of flesh,1,0
5044,2006-07-13,,Jeopardy,"(2, 4)","KIRSTEN, REESE OR SCARLETT",14,"(800,)",False,"The tallest at 5'7""",Kirsten,1,1
5044,2006-07-13,,Jeopardy,"(3, 4)",NAME THAT AFRICAN COUNTRY,18,"(800,)",False,Trouble spot seen here,Somalia,1,0
5044,2006-07-13,,Jeopardy,"(4, 4)",I'M SORRY,9,"(800,)",False,"He was ""sorry for... the events that led to my withdrawal from the race... I should not have been with Miss Rice""",Gary Hart,1,0
5044,2006-07-13,,Jeopardy,"(5, 4)",REMEMBERING THE '90s,28,"(2000,)",True,"In 1991 he made his first official public appearance, with his parents, on St. David's Day at Llandaff Cathedral",Prince William,0,1
5044,2006-07-13,,Jeopardy,"(6, 4)","BETTER ""RED""",5,"(800,)",False,"His film credits include ""Hatari!"" & ""The Poseidon Adventure""",Red Buttons,0,3
5044,2006-07-13,,Jeopardy,"(1, 5)",THE BARD WRITES,25,"(1000,)",False,"""A jest's prosperity lies in the ear of him that hears it, never in"" this part ""of him that makes it""",the tongue,1,1
5044,2006-07-13,,Jeopardy,"(2, 5)","KIRSTEN, REESE OR SCARLETT",19,"(1000,)",False,"Born in the 1970s, she's the oldest",Reese,1,0
5044,2006-07-13,,Jeopardy,"(3, 5)",NAME THAT AFRICAN COUNTRY,30,"(1000,)",False,"For many years, its territory was controlled by South Africa",Namibia,0,3
5044,2006-07-13,,Jeopardy,"(4, 5)",I'M SORRY,10,"(1000,)",False,"""I want to... ask for forgiveness (for my) arrogant lifestyle"", said this ex-PTL leader (even his doghouse had A/C)",James Bakker,1,1
5044,2006-07-13,,Jeopardy,"(5, 5)",REMEMBERING THE '90s,29,"(1000,)",False,"In 1990, 100 years after this artist's suicide, medical researchers said that he may have suffered from Meniere's disease",van Gogh,1,0
5044,2006-07-13,,Jeopardy,"(6, 5)","BETTER ""RED""",6,"(1000,)",False,It's Stendhal's novel about the pathologically ambitious Julien Sorel,The Red and the Black,0,3
5044,2006-07-13,,Double Jeopardy,"(1, 1)",WORLD RELIGION,21,"(400,)",False,"Ciaran, who founded an abbey in Clonmacnoise in this country, has his own feast day",Ireland,1,0
5044,2006-07-13,,Double Jeopardy,"(2, 1)",DISNEY FILM VOICES,7,"(400,)",False,Clint Howard was a small child when he provided the voice of a baby elephant for this 1967 Kipling classic,The Jungle Book,1,0
5044,2006-07-13,,Double Jeopardy,"(3, 1)",IT'S AN ILLUSION,12,"(400,)",False,(Cheryl of the Clue Crew shows an optical illusion on the monitor.) The duck-rabbit figure with a duck's bill here and a rabbit's nose here was first commented on by Joseph Jastro who studied the brain's role in perception as one of America's first professors of this,psychology,0,3
5044,2006-07-13,,Double Jeopardy,"(4, 1)","""F""RIENDS OF SCIENCE",2,"(400,)",False,"Before sending this ape expert to Africa in 1966, Louis Leakey asked her to get a pre-emptive appendectomy",(Dian) Fossey,1,0
5044,2006-07-13,,Double Jeopardy,"(5, 1)",WORLD LEADERS,24,"(400,)",False,The world leader & former judo champion seen here calls this world capital home,Moscow,1,0
5044,2006-07-13,,Double Jeopardy,"(6, 1)",MEATY WORDS,1,"(400,)",False,"It precedes wagon, Bednarik or Yeager",chuck,1,0
5044,2006-07-13,,Double Jeopardy,"(1, 2)",WORLD RELIGION,22,"(800,)",False,Polynesians believe the deity Maui learned to make this in the underworld,fire,1,0
5044,2006-07-13,,Double Jeopardy,"(2, 2)",DISNEY FILM VOICES,8,"(800,)",False,"Princess Jasmine's singing voice in ""Aladdin"" sounds a bit like this Chinese heroine's; Lea Salonga sang for both of them",Mulan,1,0
5044,2006-07-13,,Double Jeopardy,"(3, 2)",IT'S AN ILLUSION,13,"(800,)",False,Light distorted by heated air leads to illusions known by this French word,mirage,1,0
5044,2006-07-13,,Double Jeopardy,"(4, 2)","""F""RIENDS OF SCIENCE",16,"(2000,)",True,"Born in Danzig in 1686, he improved on a Galileo invention by using mercury instead of a gas",Fahrenheit,1,0
5044,2006-07-13,,Double Jeopardy,"(5, 2)",WORLD LEADERS,25,"(800,)",False,In 2001 he was sworn in as his country's prime minister,Junichiro Koizumi,0,3
5044,2006-07-13,,Double Jeopardy,"(6, 2)",MEATY WORDS,3,"(800,)",False,"A theater stage completely surrounded by seats for the audience is ""in the"" this",round,1,0
5044,2006-07-13,,Double Jeopardy,"(1, 3)",WORLD RELIGION,23,"(1200,)",False,The Panchen Lama was the abbot of Tashilhunpo in this autonomous region of China,Tibet,1,0
5044,2006-07-13,,Double Jeopardy,"(2, 3)",DISNEY FILM VOICES,9,"(1200,)",False,"Amanda Plummer, Paddi Edwards & Carole Shelley were destined to play the fates in the film about this mythical hunk",Hercules,1,0
5044,2006-07-13,,Double Jeopardy,"(3, 3)",IT'S AN ILLUSION,14,"(1200,)",False,"(Jon of the Clue Crew shows another illusion on the monitor.)  You think the two green vertical lines are different lengths, but they're not--it's the illusion of depth created by the horizontal lines doing this, from the Latin for ""inclined together""",converge,1,0
5044,2006-07-13,,Double Jeopardy,"(4, 3)","""F""RIENDS OF SCIENCE",17,"(1200,)",False,"During WWI this Brit debated the use of antiseptics on wound infections, finding they did more harm than good",(Alexander) Fleming,1,0
5044,2006-07-13,,Double Jeopardy,"(5, 3)",WORLD LEADERS,26,"(1200,)",False,"Seen here, he was his country's chancellor from 1998 to 2005",Gerhard Schröder,0,3
5044,2006-07-13,,Double Jeopardy,"(6, 3)",MEATY WORDS,4,"(1200,)",False,"A slang term for a type of car accident, or music's Mr. Burnett",T-bone,0,3
5044,2006-07-13,,Double Jeopardy,"(1, 4)",WORLD RELIGION,27,"(1600,)",False,"The name of these oldest sacred books of Hinduism means ""knowledge""",Vedas,0,3
5044,2006-07-13,,Double Jeopardy,"(2, 4)",DISNEY FILM VOICES,10,"(1600,)",False,Brian Bedford was the voice of this title character who out-foxed a British sheriff in a 1973 film,Robin Hood,1,0
5044,2006-07-13,,Double Jeopardy,"(3, 4)",IT'S AN ILLUSION,15,"(1600,)",False,"The 1965 exhibition ""The Responsive Eye"" popularized this art movement based on illusions",Op Art,1,0
5044,2006-07-13,,Double Jeopardy,"(4, 4)","""F""RIENDS OF SCIENCE",18,"(1600,)",False,"""Vous etes invité a venir voir tourner la terre"" was how this ""swinger"" extolled his 1851 experiment",Foucault,1,0
5044,2006-07-13,,Double Jeopardy,"(6, 4)",MEATY WORDS,5,"(1000,)",True,The extreme left or right side of an army,flank,1,0
5044,2006-07-13,,Double Jeopardy,"(1, 5)",WORLD RELIGION,28,"(2000,)",False,The 71 members of this Jewish religious council that ruled in Roman times were mostly Pharises,the Sanhedrin,1,0
5044,2006-07-13,,Double Jeopardy,"(2, 5)",DISNEY FILM VOICES,11,"(2000,)",False,"Eleanor Audley played Eddie Albert's mother on ""Green Acres"" after voicing this villainess in ""Sleeping Beauty""",Maleficent,1,0
5044,2006-07-13,,Double Jeopardy,"(3, 5)",IT'S AN ILLUSION,20,"(2000,)",False,(Cheryl of the Clue Crew shows one last illusion on the monitor.)  The image seen here is called figure & this; the shape that has more meaning to you is the one that you'll see as the figure,ground,0,3
5044,2006-07-13,,Double Jeopardy,"(4, 5)","""F""RIENDS OF SCIENCE",19,"(2000,)",False,This bongo-playing Manhattan Project physicist told how Challenger's O-rings failed in 1986,Richard Feynman,0,3
5044,2006-07-13,,Double Jeopardy,"(6, 5)",MEATY WORDS,6,"(2000,)",False,Name given to the English Parliament during the civil war in the mid-1600s,rump,1,0
5044,2006-07-13,,Final Jeopardy,"(1, 1)",U.S. HISTORY,0,"(3599, 5000, 3201)",False,"He was the commanding Union general at Bentonville, site of the last major Confederate offensive",William Tecumseh Sherman,1,2
