epNum,airDate,extra_info,round_name,coord,category,order,value,daily_double,question,answer,correctAttempts,wrongAttempts
5072,2006-10-03,2006 Back to School Week game 2.,Jeopardy,"(1, 1)",IN THE NEWS,9,"(200,)",False,This German-born man seen here made big news in April of 2005,Pope Benedict XVI,1,0
5072,2006-10-03,2006 Back to School Week game 2.,Jeopardy,"(2, 1)",POP MUSIC,1,"(200,)",False,"It wasn't deja vu when this member of Destiny's Child sang with Jay-Z on the 2006 song ""Deja Vu""",Beyoncé,1,0
5072,2006-10-03,2006 Back to School Week game 2.,Jeopardy,"(3, 1)",THE INTERNET,2,"(200,)",False,"Using this Time Warner ISP, you can see if ""you've got mail"" or sign up for its Instant Messenger",AOL,1,0
5072,2006-10-03,2006 Back to School Week game 2.,Jeopardy,"(4, 1)",STATE GOVERNORS,4,"(200,)",False,"Elected in 2003, dis guvenuh made his totally fantastic film debut in 1970's ""Hercules Goes Bananas""",Arnold Schwarzenegger,1,0
5072,2006-10-03,2006 Back to School Week game 2.,Jeopardy,"(5, 1)",LET'S CELEBRATE!,15,"(200,)",False,The patron saint of lovers is honored on this annual holiday,Valentine\'s Day,1,0
5072,2006-10-03,2006 Back to School Week game 2.,Jeopardy,"(6, 1)",I SENTENCE YOU,24,"(200,)",False,It's used in abbreviations & initials as well as to end sentences,the period,1,0
5072,2006-10-03,2006 Back to School Week game 2.,Jeopardy,"(1, 2)",IN THE NEWS,10,"(400,)",False,"Thought to be extinct since 1944, the ivory-billed species of this tree-tapping bird was rediscovered",the woodpecker,1,0
5072,2006-10-03,2006 Back to School Week game 2.,Jeopardy,"(2, 2)",POP MUSIC,3,"(400,)",False,"This ""Walk Away"" singer didn't thank ""American Idol"" when she won a Grammy in 2006",Kelly Clarkson,1,0
5072,2006-10-03,2006 Back to School Week game 2.,Jeopardy,"(3, 2)",THE INTERNET,5,"(400,)",False,"This 4-letter word, a shortened version of a 6-letter word, is a popular term for an e-journal",a blog,1,0
5072,2006-10-03,2006 Back to School Week game 2.,Jeopardy,"(4, 2)",STATE GOVERNORS,19,"(400,)",False,This patriot known for his bold signature died in 1793 while serving his 9th term as governor of Massachusetts,John Hancock,1,0
5072,2006-10-03,2006 Back to School Week game 2.,Jeopardy,"(5, 2)",LET'S CELEBRATE!,16,"(400,)",False,Former U.S. Senator Gaylord Nelson founded this annual observance devoted to the environment,Earth Day,1,0
5072,2006-10-03,2006 Back to School Week game 2.,Jeopardy,"(6, 2)",I SENTENCE YOU,26,"(400,)",False,"Of ""I did it"", ""Did you do it?"" of ""Do it!"", it's the imperative sentence","""Do it!""",0,3
5072,2006-10-03,2006 Back to School Week game 2.,Jeopardy,"(1, 3)",IN THE NEWS,11,"(600,)",False,A notorious head butt helped France lose the 2006 final of this sporting event,the World Cup,1,0
5072,2006-10-03,2006 Back to School Week game 2.,Jeopardy,"(2, 3)",POP MUSIC,6,"(600,)",False,"Michalka is the last name of these sisters who sing ""Chemicals React""",Aly & AJ,1,0
5072,2006-10-03,2006 Back to School Week game 2.,Jeopardy,"(3, 3)",THE INTERNET,14,"(1200,)",True,This 3-letter extension at the end of a web address indicates it's operated by a college or university,.edu,1,0
5072,2006-10-03,2006 Back to School Week game 2.,Jeopardy,"(4, 3)",STATE GOVERNORS,20,"(600,)",False,"By law, this ex-Texas governor can never be elected U.S. president again",George W. Bush,1,0
5072,2006-10-03,2006 Back to School Week game 2.,Jeopardy,"(5, 3)",LET'S CELEBRATE!,17,"(600,)",False,Customs on this 121st day of the year include dancing around a pole & giving baskets to friends & family,May Day,1,0
5072,2006-10-03,2006 Back to School Week game 2.,Jeopardy,"(6, 3)",I SENTENCE YOU,27,"(600,)",False,The sentence seen here is in desperate need of these punctuation marks--please do give generouslyOn the air since 1984 Jeopardy! we are proud to say has grown in viewership esteem and popularity while its staff all would agree remain humble modest and handsome.,a comma,1,0
5072,2006-10-03,2006 Back to School Week game 2.,Jeopardy,"(1, 4)",IN THE NEWS,12,"(800,)",False,"Steve Fossett flew solo around the world in a plane that weighed 22,000 lbs., of which 18,000 was this",fuel,1,0
5072,2006-10-03,2006 Back to School Week game 2.,Jeopardy,"(2, 4)",POP MUSIC,7,"(800,)",False,"In 2005, she topped the album charts with ""The Emancipation of Mimi""",Mariah Carey,1,0
5072,2006-10-03,2006 Back to School Week game 2.,Jeopardy,"(3, 4)",THE INTERNET,25,"(800,)",False,This file that gathers users' Internet info & sends it back to its maker sounds like a yummy baked treat,a cookie,0,3
5072,2006-10-03,2006 Back to School Week game 2.,Jeopardy,"(4, 4)",STATE GOVERNORS,21,"(800,)",False,This current Florida governor keeps saying he's not going to run for president in 2008,Jeb Bush,0,3
5072,2006-10-03,2006 Back to School Week game 2.,Jeopardy,"(5, 4)",LET'S CELEBRATE!,18,"(800,)",False,Collecting money for UNICEF on this holiday was begun in 1950 by a Philadelphia Sunday school class,Halloween,1,0
5072,2006-10-03,2006 Back to School Week game 2.,Jeopardy,"(6, 4)",I SENTENCE YOU,28,"(800,)",False,"Berton Braley contradicted himself & wrote this ""is a word you musn't end a sentence with""",a preposition,0,3
5072,2006-10-03,2006 Back to School Week game 2.,Jeopardy,"(1, 5)",IN THE NEWS,13,"(1000,)",False,"On April 18, 2006 this actress became the mother of Tom Cruise's new little baby, Suri",Katie Holmes,1,0
5072,2006-10-03,2006 Back to School Week game 2.,Jeopardy,"(2, 5)",POP MUSIC,8,"(1000,)",False,"This ""Girl Like Me"" songstress was born in Barbados",Rihanna,1,0
5072,2006-10-03,2006 Back to School Week game 2.,Jeopardy,"(4, 5)",STATE GOVERNORS,22,"(1000,)",False,"Hamilton Fish, Enos T. Throop & George Pataki have served as governors of this state",New York,1,0
5072,2006-10-03,2006 Back to School Week game 2.,Jeopardy,"(5, 5)",LET'S CELEBRATE!,23,"(1000,)",False,"Meaning ""a coming"", it's the period before Christmas that begins on the Sunday nearest to November 30",Advent,1,0
5072,2006-10-03,2006 Back to School Week game 2.,Double Jeopardy,"(1, 1)",YOUNG PEOPLE WHO MADE A DIFFERENCE,14,"(400,)",False,"On July 15, 1944 she entered into her diary, ""I can feel the sufferings of millions""",Anne Frank,1,1
5072,2006-10-03,2006 Back to School Week game 2.,Double Jeopardy,"(2, 1)",COOL MOVIES,1,"(400,)",False,"Yo ho yo ho, in 2006 Johnny Depp returned as this swashbuckler in ""Pirates of the Caribbean: Dead Man's Chest""",Captain Jack Sparrow,1,0
5072,2006-10-03,2006 Back to School Week game 2.,Double Jeopardy,"(3, 1)",THE HARRY POTTER BOOKS,3,"(400,)",False,Ron & Harry use this unusual transport to get to Hogwarts for their second year,a flying car,1,0
5072,2006-10-03,2006 Back to School Week game 2.,Double Jeopardy,"(4, 1)","MOM, I WANT I WANT I WANT!!",8,"(400,)",False,"I want one of these animals--not a Shetland, those are boring!  I want a Dartmoor",a pony,0,3
5072,2006-10-03,2006 Back to School Week game 2.,Double Jeopardy,"(5, 1)",ICE CREAM,19,"(400,)",False,Cohen & Greenfield are the last names of the co-founders of this company that created Cherry Garcia ice cream,Ben & Jerry\'s (Ben & Jerry accepted),1,0
5072,2006-10-03,2006 Back to School Week game 2.,Double Jeopardy,"(6, 1)","""KID""s RULE!",25,"(400,)",False,"4-word TV ad catchphrase that traditionally follows, ""Silly Rabbit...""","""Trix are for kids""",0,3
5072,2006-10-03,2006 Back to School Week game 2.,Double Jeopardy,"(1, 2)",YOUNG PEOPLE WHO MADE A DIFFERENCE,15,"(800,)",False,"In 338 B.C. at age 18, he commanded the cavalry in his father's army in the Battle of Chaeronea in Macedonia",Alexander the Great,1,0
5072,2006-10-03,2006 Back to School Week game 2.,Double Jeopardy,"(2, 2)",COOL MOVIES,2,"(800,)",False,In 2002 this Steven Spielberg classic about an alien was re-released with never-before-seen footage,E.T.,1,0
5072,2006-10-03,2006 Back to School Week game 2.,Double Jeopardy,"(3, 2)",THE HARRY POTTER BOOKS,4,"(800,)",False,"In this sport, Harry plays the position of seeker",Quidditch,1,0
5072,2006-10-03,2006 Back to School Week game 2.,Double Jeopardy,"(4, 2)","MOM, I WANT I WANT I WANT!!",9,"(800,)",False,"I want this ""lunar"" footwear, basically a pair of trampolines, to make me feel like I'm defying gravity",moon shoes,1,1
5072,2006-10-03,2006 Back to School Week game 2.,Double Jeopardy,"(5, 2)",ICE CREAM,20,"(800,)",False,"Though it started with just 31 flavors, this chain now has more than 1,000, including SPF 31",Baskin-Robbins,1,0
5072,2006-10-03,2006 Back to School Week game 2.,Double Jeopardy,"(6, 2)","""KID""s RULE!",26,"(800,)",False,"In 2006, Jack Black hosted this annual Nickelodeon show",the Kids\' Choice Awards,1,0
5072,2006-10-03,2006 Back to School Week game 2.,Double Jeopardy,"(1, 3)",YOUNG PEOPLE WHO MADE A DIFFERENCE,16,"(4000,)",True,"He restored Thebes as capital of Ancient Egypt but is probably better known for being ""discovered"" in 1922",King Tut,1,0
5072,2006-10-03,2006 Back to School Week game 2.,Double Jeopardy,"(2, 3)",COOL MOVIES,11,"(1200,)",False,"In ""The Incredibles"", Helen Parr isn't your ordinary mom; she also stretches herself thin as this superhero",Elastigirl,1,0
5072,2006-10-03,2006 Back to School Week game 2.,Double Jeopardy,"(3, 3)",THE HARRY POTTER BOOKS,5,"(1200,)",False,"A half-giant, he's the gamekeeper at Hogwarts",Hagrid,1,0
5072,2006-10-03,2006 Back to School Week game 2.,Double Jeopardy,"(4, 3)","MOM, I WANT I WANT I WANT!!",10,"(1200,)",False,"(Jon of the Clue Crew drives an RC car.)  I bet you want an RC car with a 49 MHz signal; RC can stand for ""remote control"" or this ""control""",radio control,0,3
5072,2006-10-03,2006 Back to School Week game 2.,Double Jeopardy,"(5, 3)",ICE CREAM,21,"(1200,)",False,The logo of this brand of ice cream bar is seen here,Eskimo (Pie),1,0
5072,2006-10-03,2006 Back to School Week game 2.,Double Jeopardy,"(1, 4)",YOUNG PEOPLE WHO MADE A DIFFERENCE,17,"(1600,)",False,"Born near what became Jamestown, Virginia around 1595, her name meant ""playful one""",Pocahontas,1,0
5072,2006-10-03,2006 Back to School Week game 2.,Double Jeopardy,"(2, 4)",COOL MOVIES,12,"(1600,)",False,A really cool film of 2006 was this one about a pack of sled dogs stranded in Antarctica,Eight Below,1,0
5072,2006-10-03,2006 Back to School Week game 2.,Double Jeopardy,"(3, 4)",THE HARRY POTTER BOOKS,6,"(1600,)",False,"Harry's nemesis, this member of Slytherin has a dad named Lucius who is a supporter of Voldemort",(Draco) Malfoy,1,0
5072,2006-10-03,2006 Back to School Week game 2.,Double Jeopardy,"(4, 4)","MOM, I WANT I WANT I WANT!!",24,"(1600,)",False,"Yo, Mom!  I want the whole line of these hip-hop-themed dolls from Mattel",Flavas,0,3
5072,2006-10-03,2006 Back to School Week game 2.,Double Jeopardy,"(5, 4)",ICE CREAM,22,"(1600,)",False,"This treat gets its name because a certain fruit is cut lengthwise & then topped with ice cream, nuts, & whipped cream",a banana split,1,0
5072,2006-10-03,2006 Back to School Week game 2.,Double Jeopardy,"(1, 5)",YOUNG PEOPLE WHO MADE A DIFFERENCE,18,"(2000,)",False,"In 1785, at age 16, he was commissioned as a second lt. of artillery in the French Army; fame was soon to come",Napoleon (Bonaparte),0,3
5072,2006-10-03,2006 Back to School Week game 2.,Double Jeopardy,"(2, 5)",COOL MOVIES,13,"(2000,)",False,"There's nothing cooler than the scruffy mutt who smiles in the movie ""Because of..."" this",Winn-Dixie,1,0
5072,2006-10-03,2006 Back to School Week game 2.,Double Jeopardy,"(3, 5)",THE HARRY POTTER BOOKS,7,"(2000,)",False,Any cat could tell you that she teaches transfiguration magic at Hogwarts,Professor McGonagall,1,0
5072,2006-10-03,2006 Back to School Week game 2.,Double Jeopardy,"(5, 5)",ICE CREAM,23,"(2000,)",False,Many claim to have invented these; one man made them from waffles at the 1904 St. Louis World's Fair,cones,1,0
5072,2006-10-03,2006 Back to School Week game 2.,Final Jeopardy,"(1, 1)",STATE CAPITALS,0,"(4000, 2000, 4500)",False,1 of 2 state capitals whose names start & end with the same letter,Atlanta (Georgia) or Augusta (Maine),0,3
