epNum,airDate,extra_info,round_name,coord,category,order,value,daily_double,question,answer,correctAttempts,wrongAttempts
5155,2007-01-26,,Jeopardy,"(1, 1)",SINGAPORE,15,"(200,)",False,More than 75% of Singaporeans are of this ethnicity,Chinese,1,1
5155,2007-01-26,,Jeopardy,"(2, 1)",THIS CATEGORY IS FULL OF BEANS,6,"(200,)",False,"Disguised as a man, Mollie Bean fought with the 47th North Carolina infantry during this war",the Civil War,1,0
5155,2007-01-26,,Jeopardy,"(3, 1)",STUPID ANSWERS,1,"(200,)",False,"The Great Hall in Russia's Catherine Palace is adorned with a painting called ""The Allegory of"" this country",Russia,1,0
5155,2007-01-26,,Jeopardy,"(4, 1)",19th CENTURY NAMES,16,"(200,)",False,"On Aug. 16, 1812 British general Sir Isaac Brock captured this Michigan city",Detroit,1,0
5155,2007-01-26,,Jeopardy,"(5, 1)","HEY, ""TEX""!",10,"(200,)",False,"As a noun, it's a reader used by students for a class; an adjective, it can mean typical or classic",textbook,1,0
5155,2007-01-26,,Jeopardy,"(6, 1)",YOU MUST BE FROM DALLAS,30,"(200,)",False,"Not Crosby or Nash but this supergroup member was born in Dallas Jan. 3, 1945",(Stephen) Stills,1,0
5155,2007-01-26,,Jeopardy,"(1, 2)",SINGAPORE,22,"(400,)",False,"Singapore's national flower is the Vanda Miss Joaquim, a purple species of this exotic corsage flower",an orchid,1,0
5155,2007-01-26,,Jeopardy,"(2, 2)",THIS CATEGORY IS FULL OF BEANS,7,"(400,)",False,This retailer who lived till age 94 attributed his long life & good health to the time he spent outdoors,L.L. Bean,1,0
5155,2007-01-26,,Jeopardy,"(3, 2)",STUPID ANSWERS,2,"(400,)",False,"(Jimmy of the Clue Crew reports from the Iowa State Fair.)  Will Rogers, Jeanne Crain & Pat Boone starred in different versions of this film about a family's adventures at the Iowa State Fair",State Fair,1,0
5155,2007-01-26,,Jeopardy,"(4, 2)",19th CENTURY NAMES,17,"(400,)",False,"There's a sucker born every minute, & this showman known for saying it was born on July 5, 1810",(P.T.) Barnum,1,0
5155,2007-01-26,,Jeopardy,"(5, 2)","HEY, ""TEX""!",11,"(400,)",False,The quality of a surface perceptible to the touch,the texture,1,0
5155,2007-01-26,,Jeopardy,"(6, 2)",YOU MUST BE FROM DALLAS,29,"(400,)",False,"Born Patsy Anne McClenny, she's the Dallas-born beauty seen here--yeah, that's the ticket",Morgan Fairchild,1,1
5155,2007-01-26,,Jeopardy,"(1, 3)",SINGAPORE,23,"(600,)",False,"With 4.4 million people in 267 square miles, Singapore is second only to Monaco in this population figure",density,1,0
5155,2007-01-26,,Jeopardy,"(2, 3)",THIS CATEGORY IS FULL OF BEANS,8,"(600,)",False,"He liked to boast that he was the only ""law west of the Pecos""",Judge (Roy) Bean,1,0
5155,2007-01-26,,Jeopardy,"(3, 3)",STUPID ANSWERS,3,"(600,)",False,"Actor Byron Barr changed his name to this after playing a man named Gig Young in the 1942 film ""The Gay Sisters""",Gig Young,1,0
5155,2007-01-26,,Jeopardy,"(4, 3)",19th CENTURY NAMES,18,"(600,)",False,"In 1894 this man ""Familiar"" with ""Quotations"" compiled a ""Complete Concordance to"" Shakespeare",(John) Bartlett,1,0
5155,2007-01-26,,Jeopardy,"(5, 3)","HEY, ""TEX""!",12,"(600,)",False,An emulsion of synthetic rubber or plastic,latex,0,3
5155,2007-01-26,,Jeopardy,"(6, 3)",YOU MUST BE FROM DALLAS,28,"(600,)",False,"This Dallas-born pro golfer titled his 1982 autobiography ""They Call Me Super Mex""",Lee Trevino,1,0
5155,2007-01-26,,Jeopardy,"(1, 4)",SINGAPORE,24,"(800,)",False,"""Lions"", actually tigers, once lived on the island, whose name means ""lion city"" in this ancient language of India",Sanskrit,1,0
5155,2007-01-26,,Jeopardy,"(2, 4)",THIS CATEGORY IS FULL OF BEANS,9,"(800,)",False,"Tarleton Bean, the first curator of fishes at the Smithsonian, was a noted one of these ""fish""y scientists",an ichthyologists,1,0
5155,2007-01-26,,Jeopardy,"(3, 4)",STUPID ANSWERS,4,"(800,)",False,"Every Friday, the Carillon in Duke University's chapel rings out the song ""Dear Old"" this",Duke,1,0
5155,2007-01-26,,Jeopardy,"(4, 4)",19th CENTURY NAMES,19,"(800,)",False,New Year's Eve 1876: actress Georgiana Drew marries into this famous acting family,the Barrymores,1,0
5155,2007-01-26,,Jeopardy,"(5, 4)","HEY, ""TEX""!",13,"(1000,)",True,"As a noun, it's a false reason; as a verb, it's to fake an identity to get someone's phone records",pretext,0,1
5155,2007-01-26,,Jeopardy,"(6, 4)",YOU MUST BE FROM DALLAS,27,"(800,)",False,"It was a ""family affair"" whenever this Dallas-born soul man got the crowd to ""Dance To The Music""",Sly Stone,1,0
5155,2007-01-26,,Jeopardy,"(1, 5)",SINGAPORE,25,"(1000,)",False,Singapore gained its independence in 1965 from this nation to which it's connected by a causeway,Malaysia,1,0
5155,2007-01-26,,Jeopardy,"(2, 5)",THIS CATEGORY IS FULL OF BEANS,21,"(1000,)",False,"In 1981, this astronaut gave up his day job and became a painter of pictures like the one seen here",Alan Bean,0,3
5155,2007-01-26,,Jeopardy,"(3, 5)",STUPID ANSWERS,5,"(1000,)",False,"The number of legs on one of the monopods in the ""Narnia"" books",1,1,0
5155,2007-01-26,,Jeopardy,"(4, 5)",19th CENTURY NAMES,20,"(1000,)",False,This Frenchman sculpted more than one statue for the NYC area: his statue of Lafayette is in Union Square,(Frédéric) Bartholdi,1,1
5155,2007-01-26,,Jeopardy,"(5, 5)","HEY, ""TEX""!",14,"(1000,)",False,The words preceding or following a particular word that help explain its full meaning,the context,1,0
5155,2007-01-26,,Jeopardy,"(6, 5)",YOU MUST BE FROM DALLAS,26,"(1000,)",False,"Born in Dallas in 1947, he hit the pop music charts with & like a ""Bat Out Of Hell""",Meat Loaf,1,0
5155,2007-01-26,,Double Jeopardy,"(1, 1)",NOVELS,2,"(400,)",False,"""The Mission Song"" is the 20th novel by this author of spy thrillers like ""Tinker, Taylor, Soldier, Spy""",(John) le Carré,1,0
5155,2007-01-26,,Double Jeopardy,"(2, 1)",FILM SCHOOL,11,"(400,)",False,It's a close shave for Ice Cube when he sells this title place of business in a 2002 film,Barbershop,1,0
5155,2007-01-26,,Double Jeopardy,"(3, 1)",PAINTERS & PAINTINGS,26,"(400,)",False,"He painted ""Starry Night"" in 1889 while checked into an asylum in Saint Remy",Van Gogh,1,0
5155,2007-01-26,,Double Jeopardy,"(4, 1)",POTPOURRI,15,"(400,)",False,"As a winner of this, you may be awakened in Stockholm's Grand Hotel by Swedes in St. Lucia's Day costumes",the Nobel Prize,1,0
5155,2007-01-26,,Double Jeopardy,"(5, 1)",SHE USED TO BE IN CHARGE,1,"(400,)",False,President Isabel Peron,Argentina,1,0
5155,2007-01-26,,Double Jeopardy,"(6, 1)",GERMAN,18,"(400,)",False,Friedrich Froebe coined this German word for pre-elementary school education (it's the same in English),kindergarten,1,0
5155,2007-01-26,,Double Jeopardy,"(1, 2)",NOVELS,3,"(1400,)",True,"In this Hemingway novel, wounded WWI soldier Frederic really presses the call button of Nurse Catherine",A Farewell to Arms,0,1
5155,2007-01-26,,Double Jeopardy,"(2, 2)",FILM SCHOOL,12,"(800,)",False,Viggo Mortensen gave up his sword & tresses to play a small town diner operator with a dark past in this 2005 film,A History of Violence,1,0
5155,2007-01-26,,Double Jeopardy,"(3, 2)",PAINTERS & PAINTINGS,30,"(800,)",False,Theodore Blake Bergman's painting seen here shows Queen Victoria with this Prime Minister,Disraeli,1,0
5155,2007-01-26,,Double Jeopardy,"(4, 2)",POTPOURRI,16,"(800,)",False,"These 2 words preceded ""England Inne"" in the name of a romantic getaway in Stowe, Vermont",Ye Olde,1,0
5155,2007-01-26,,Double Jeopardy,"(5, 2)",SHE USED TO BE IN CHARGE,5,"(800,)",False,Prime Minister Benazir Bhutto,Pakistan,1,1
5155,2007-01-26,,Double Jeopardy,"(6, 2)",GERMAN,19,"(800,)",False,"Ads for Sam Adams have mentioned the Reinheitsgebot, the German purity law for this",beer,1,0
5155,2007-01-26,,Double Jeopardy,"(1, 3)",NOVELS,4,"(1200,)",False,"Nathanael West wrote forgettable films like ""Let's Make Music"" & this 1939 book called the greatest of Hollywood novels",The Day of the Locust,0,3
5155,2007-01-26,,Double Jeopardy,"(2, 3)",FILM SCHOOL,13,"(1200,)",False,"Actually Count Laszlo de Almasy, Ralph Fiennes' character gets this title moniker in a 1996 film due to his amnesia",The English Patient,1,0
5155,2007-01-26,,Double Jeopardy,"(3, 3)",PAINTERS & PAINTINGS,29,"(1200,)",False,"Like David, Edvard Munch did a painting called ""The Death"" of this man, but he placed him on a bed, not in a bath",Marat,1,0
5155,2007-01-26,,Double Jeopardy,"(4, 3)",POTPOURRI,17,"(1200,)",False,"First 2 words of Variety's headline about rural audiences rejecting rural movies, preceding ""Hick Pix""",Sticks Nix,0,3
5155,2007-01-26,,Double Jeopardy,"(5, 3)",SHE USED TO BE IN CHARGE,8,"(1200,)",False,Prime Minister Edith Cresson,France,1,0
5155,2007-01-26,,Double Jeopardy,"(6, 3)",GERMAN,23,"(1200,)",False,Take ein Pastille(a lozenge)if you haveein Halsschmerzen(this ailment),a sore throat,1,0
5155,2007-01-26,,Double Jeopardy,"(1, 4)",NOVELS,6,"(1600,)",False,"In the Literary Arts stamp series, the vessel behind this writer recalls her famous novel ""Ship of Fools""",(Katherine Anne) Porter,1,0
5155,2007-01-26,,Double Jeopardy,"(2, 4)",FILM SCHOOL,14,"(1600,)",False,Harold Pinter wrote this movie in which Meryl Streep is both a 19th c. woman & the actress who plays her,The French Lieutenant\'s Woman,0,3
5155,2007-01-26,,Double Jeopardy,"(3, 4)",PAINTERS & PAINTINGS,28,"(1600,)",False,"In the late 1800s this Frenchman painted a feast of still lifes: ""With Plate of Cherries"", ""With Apples"" & ""With Onions""",Cézanne,1,0
5155,2007-01-26,,Double Jeopardy,"(4, 4)",POTPOURRI,20,"(1600,)",False,"This newsman's long career has included driving Marguerite Oswald to see her son in custody on Nov. 22, 1963",Bob Schieffer,0,3
5155,2007-01-26,,Double Jeopardy,"(5, 4)",SHE USED TO BE IN CHARGE,9,"(1600,)",False,President Vigdis Finnbogadottir,Iceland,1,0
5155,2007-01-26,,Double Jeopardy,"(6, 4)",GERMAN,24,"(1600,)",False,You are permitted to tell us this German word for forbidden,verboten,1,0
5155,2007-01-26,,Double Jeopardy,"(1, 5)",NOVELS,7,"(2000,)",False,"In 1906 he needed foresight to know that he wouldn't complete the novels in his ""Forsyte Saga"" until 1921",Galsworthy,1,0
5155,2007-01-26,,Double Jeopardy,"(2, 5)",FILM SCHOOL,22,"(2000,)",False,"In this probing 1959 Preminger film, Jimmy Stewart's a lawyer defending Ben Gazzara in a murder trial",Anatomy of a Murder,0,3
5155,2007-01-26,,Double Jeopardy,"(3, 5)",PAINTERS & PAINTINGS,27,"(2000,)",False,This famous Jean-Francois Millet painting shows 3 women picking up the remains left after a harvest,The Gleaners,0,3
5155,2007-01-26,,Double Jeopardy,"(4, 5)",POTPOURRI,21,"(2000,)",False,"In ""Gulliver's Travels"", Swift described this type of creature as ""the most unteachable of all brutes""",a Yahoo,1,1
5155,2007-01-26,,Double Jeopardy,"(5, 5)",SHE USED TO BE IN CHARGE,10,"(2000,)",False,Prime Minister Kim Campbell,Canada,1,0
5155,2007-01-26,,Double Jeopardy,"(6, 5)",GERMAN,25,"(2000,)",True,"Kleine is this adjective, as in ""Eine Kleine Nachtmusik""",little,1,0
5155,2007-01-26,,Final Jeopardy,"(1, 1)",ANIMALS,0,"(3201, 8200, 1401)",False,"The world's largest invertebrate, it plays a prominent part in an 1870 French novel & a 1954 film",the giant squid,3,0
