epNum,airDate,extra_info,round_name,coord,category,order,value,daily_double,question,answer,correctAttempts,wrongAttempts
5185,2007-03-09,,Jeopardy,"(1, 1)",ART WORKS,21,"(200,)",False,"""Three Musicians"",""Guitar, Sheet Music & Wine Glass"",""Les Demoiselles d'Avignon""",(Pablo) Picasso,1,0
5185,2007-03-09,,Jeopardy,"(2, 1)",STADIUMS & ARENAS,1,"(200,)",False,This L.A. arena is home court for 3 basketball teams & home ice to the L.A. Kings,the Staples Center,1,1
5185,2007-03-09,,Jeopardy,"(3, 1)",JERSEY BOYS & GIRLS,6,"(200,)",False,"This Jersey gal was acting on ""All My Children"" when she was chosen as Regis Philbin's co-host",(Kelly) Ripa,1,0
5185,2007-03-09,,Jeopardy,"(4, 1)",WHERE WORDS COME FROM,22,"(200,)",False,We got the word bock (as in beer) from this language,German,1,0
5185,2007-03-09,,Jeopardy,"(5, 1)",IF AT FIRST YOU DON'T SUCCEED...,16,"(200,)",False,"His first screen test brought the verdict ""Can't act.  Slightly bald.  Can dance a little""",Fred Astaire,1,0
5185,2007-03-09,,Jeopardy,"(6, 1)","TRY, TRY AGAIN",9,"(200,)",False,"Tyco executives were eventually convicted after a judge declared the first trial this faulty type of ""trial""",a mistrial,1,0
5185,2007-03-09,,Jeopardy,"(1, 2)",ART WORKS,24,"(400,)",False,"""Portrait of Pere Tanguy"",""Potato Eaters"",""Night Cafe""",(Vincent) van Gogh,1,1
5185,2007-03-09,,Jeopardy,"(2, 2)",STADIUMS & ARENAS,2,"(400,)",False,"The name of this city's Soldier Field, opened in 1924, is in memory of those who fought in WWI",Chicago,1,0
5185,2007-03-09,,Jeopardy,"(3, 2)",JERSEY BOYS & GIRLS,7,"(400,)",False,This illusionist really did take his name from a Dickens character,(David) Copperfield,1,0
5185,2007-03-09,,Jeopardy,"(4, 2)",WHERE WORDS COME FROM,23,"(400,)",False,"Bandha, or ""tie"", is a yoga method to lock in one's breath & also gave us this word for an accessory we tie & wear",a bandana,1,0
5185,2007-03-09,,Jeopardy,"(5, 2)",IF AT FIRST YOU DON'T SUCCEED...,17,"(400,)",False,"In 1754 at Fort Necessity, his first major military command brought the one surrender of his career--& to the French!",George Washington,1,0
5185,2007-03-09,,Jeopardy,"(6, 2)","TRY, TRY AGAIN",12,"(400,)",False,"A thorn in Pres. Mubarak's side, Saad Eddin Ibrahim was cleared of defaming this country on retrial in 2003",Egypt,1,0
5185,2007-03-09,,Jeopardy,"(1, 3)",ART WORKS,25,"(600,)",False,"""Danae"",""The Anatomy Lesson of Dr. Nicolaes Tulp"",""The Night Watch""",Rembrandt (van Rijn),0,3
5185,2007-03-09,,Jeopardy,"(2, 3)",STADIUMS & ARENAS,3,"(600,)",False,Check out El Birdos Cantina at this St. Louis ballpark,Busch Stadium,1,0
5185,2007-03-09,,Jeopardy,"(3, 3)",JERSEY BOYS & GIRLS,8,"(600,)",False,"He was an expert on wasps before becoming an expert on sexual behavior & issuing his famous ""Report""",(Alfred) Kinsey,1,0
5185,2007-03-09,,Jeopardy,"(4, 3)",WHERE WORDS COME FROM,26,"(600,)",False,"The name of this plumlike tree fruit is related to the Cree word pasiminan, meaning ""dried fruit""",the persimmon,1,0
5185,2007-03-09,,Jeopardy,"(5, 3)",IF AT FIRST YOU DON'T SUCCEED...,18,"(600,)",False,"He immortalized Donna Johnson, who refused to marry him, as the red-haired girl Charlie Brown adores",Charles Schulz,1,0
5185,2007-03-09,,Jeopardy,"(6, 3)","TRY, TRY AGAIN",13,"(600,)",False,In 1895 an English jury reached no verdict on this playwright's morals; he was retried just 3 weeks later,Oscar Wilde,1,0
5185,2007-03-09,,Jeopardy,"(1, 4)",ART WORKS,29,"(800,)",False,"""Bicycle Wheel"",""Fountain"",""Nude Descending a Staircase""",Marcel Duchamp,0,3
5185,2007-03-09,,Jeopardy,"(2, 4)",STADIUMS & ARENAS,4,"(800,)",False,It's home to the Minnesota Vikings & to the University of Minnesota Golden Gophers,the Metrodome,1,0
5185,2007-03-09,,Jeopardy,"(3, 4)",JERSEY BOYS & GIRLS,10,"(800,)",False,"If you know that this '50s beat poet hailed from Jersey, just ""Howl""",(Allen) Ginsberg,1,0
5185,2007-03-09,,Jeopardy,"(4, 4)",WHERE WORDS COME FROM,27,"(800,)",False,A Middle English word for a fishhook gives us this word for the peaceful practice of hook-&-line fishing,angling,0,3
5185,2007-03-09,,Jeopardy,"(5, 4)",IF AT FIRST YOU DON'T SUCCEED...,19,"(800,)",False,"In story, a beaten Robert the Bruce was inspired to keep fighting by seeing this creature weaving persistently",a spider,1,0
5185,2007-03-09,,Jeopardy,"(6, 4)","TRY, TRY AGAIN",14,"(800,)",False,In 1969 the Supreme Court ruled that the Fifth Amendment's ban on this practice is binding on states,double jeopardy,0,3
5185,2007-03-09,,Jeopardy,"(1, 5)",ART WORKS,30,"(1000,)",False,"""Family of Charles IV"",""Saturn Devouring One of His Children"",""The Naked Maja""",(Francisco) Goya,1,0
5185,2007-03-09,,Jeopardy,"(2, 5)",STADIUMS & ARENAS,5,"(1000,)",False,"The Super Bowl with the highest TV rating was No. XVI in 1982, held in this Michigan stadium",the Silverdome,1,0
5185,2007-03-09,,Jeopardy,"(3, 5)",JERSEY BOYS & GIRLS,11,"(1000,)",False,The Depression photographer born in N.J. as Dorothea Nutzhorn is better known as Dorothea this,Lange,0,3
5185,2007-03-09,,Jeopardy,"(4, 5)",WHERE WORDS COME FROM,28,"(1000,)",False,"This fabric is named for a Belgian town, & a bag (now usually canvas) is named for it",duffel,0,3
5185,2007-03-09,,Jeopardy,"(5, 5)",IF AT FIRST YOU DON'T SUCCEED...,20,"(1000,)",True,In 1962 his idea of putting big stores in small towns got zero response from the Ben Franklin retail chain,Sam Walton,1,0
5185,2007-03-09,,Jeopardy,"(6, 5)","TRY, TRY AGAIN",15,"(1000,)",False,"In the 1930s, after the Supreme Court ruled in favor of these ""Boys"", Alabama went ahead and retried them, one by one",the Scottsboro Boys,1,0
5185,2007-03-09,,Double Jeopardy,"(1, 1)",BODIES OF WATER,2,"(400,)",False,"About 2/3 of the water in the Nile comes from this river, not the White Nile",the Blue Nile,1,0
5185,2007-03-09,,Double Jeopardy,"(2, 1)",NAME THAT MOVIE,7,"(400,)",False,"1964:""Supercalifragilis-ticexpialidocious""",Mary Poppins,1,0
5185,2007-03-09,,Double Jeopardy,"(3, 1)",WAR FICTION,17,"(400,)",False,"""A Station in the Delta"", ""Gardens of Stone"" & ""In Country"" tell tales of this war",Vietnam,1,0
5185,2007-03-09,,Double Jeopardy,"(4, 1)",DESCRIPTIONS & DEFINITIONS,1,"(400,)",False,"Sir Thomas Browne communed with this by calling it ""the art of God""",nature,1,0
5185,2007-03-09,,Double Jeopardy,"(5, 1)",DANCING WITH THE STARS,21,"(400,)",False,The Great Nebula in this constellation lies in the middle of a hunter's sword,Orion,1,0
5185,2007-03-09,,Double Jeopardy,"(6, 1)","ON THE ""TELE""",12,"(400,)",False,"Partly from a word for an endurance test, it's a broadcast that's an appeal for charitable donations",a telethon,1,0
5185,2007-03-09,,Double Jeopardy,"(1, 2)",BODIES OF WATER,3,"(800,)",False,"At the 2 cities named Kansas City, this ""stately"" river meets the Kansas River",Missouri,1,0
5185,2007-03-09,,Double Jeopardy,"(2, 2)",NAME THAT MOVIE,8,"(800,)",False,"1968:""Open the pod bay doors, HAL""",2001,1,0
5185,2007-03-09,,Double Jeopardy,"(3, 2)",WAR FICTION,18,"(800,)",False,"Jeff Shaara's ""Gone for Soldiers"" chronicles the 1846-48 U.S. war with this country",Mexico,1,0
5185,2007-03-09,,Double Jeopardy,"(4, 2)",DESCRIPTIONS & DEFINITIONS,24,"(2000,)",True,"Animator Chuck Jones quotes Mark Twain on this: ""a long... sorry-looking skeleton with a gray wolf-skin""",coyote,0,1
5185,2007-03-09,,Double Jeopardy,"(5, 2)",DANCING WITH THE STARS,22,"(800,)",False,In 1934 a star in the constellation named for this legendary strongman was seen going nova,Hercules,1,0
5185,2007-03-09,,Double Jeopardy,"(6, 2)","ON THE ""TELE""",13,"(800,)",False,This San Francisco hill is named for the semaphore installed at its crest in 1850,Telegraph Hill,1,0
5185,2007-03-09,,Double Jeopardy,"(1, 3)",BODIES OF WATER,4,"(1200,)",False,The Atlantic Ocean began to form during this period of the Mesozoic Era when dinosaurs roamed,the Jurassic Period (the Jurassic Era accepted),1,0
5185,2007-03-09,,Double Jeopardy,"(2, 3)",NAME THAT MOVIE,9,"(1200,)",False,"1938 (full title!):""Welcome to Sherwood, my lady!""",The Adventures of Robin Hood,0,3
5185,2007-03-09,,Double Jeopardy,"(3, 3)",WAR FICTION,19,"(1200,)",False,"Tolstoy's ""War and Peace"" is an epic of the wars named for this man",Napoleon,1,0
5185,2007-03-09,,Double Jeopardy,"(4, 3)",DESCRIPTIONS & DEFINITIONS,25,"(1200,)",False,"As stated by Samuel Johnson & quoted by Bob Dylan, this is the last refuge of a scoundrel",patriotism,0,3
5185,2007-03-09,,Double Jeopardy,"(5, 3)",DANCING WITH THE STARS,28,"(1200,)",False,Doggone!  This star has a diameter 1.7 times that of the sun & gives off 23 times as much light,Sirius,1,0
5185,2007-03-09,,Double Jeopardy,"(6, 3)","ON THE ""TELE""",14,"(1200,)",False,Things that are at a distance appear closer when you use this type of camera lens,telephoto,1,0
5185,2007-03-09,,Double Jeopardy,"(1, 4)",BODIES OF WATER,5,"(1600,)",False,"(Jimmy of the Clue Crew reports from the Besh-ba-gowah Pueblo in Phoenix, AZ.)  The people who built these structures in Arizona are known to us as Salado, the Spanish word for this nearby river",Salt,0,3
5185,2007-03-09,,Double Jeopardy,"(2, 4)",NAME THAT MOVIE,10,"(1600,)",False,"1956:""They're here already!  You're next!  You're next!""",Invasion of the Body Snatchers,0,3
5185,2007-03-09,,Double Jeopardy,"(3, 4)",WAR FICTION,20,"(1600,)",False,"This Shelby Foote novel about a Tennessee battle could also have been called ""Pittsburg Landing""",Shiloh,0,3
5185,2007-03-09,,Double Jeopardy,"(4, 4)",DESCRIPTIONS & DEFINITIONS,26,"(1600,)",False,"H.L. Mencken called this bay ""an immense protein factory""",Chesapeake Bay,1,0
5185,2007-03-09,,Double Jeopardy,"(5, 4)",DANCING WITH THE STARS,29,"(5200,)",True,"This zodiac constellation is dominated by 2 stars; however, one is actually a complex system of at least 6 stars",Gemini,0,1
5185,2007-03-09,,Double Jeopardy,"(6, 4)","ON THE ""TELE""",15,"(1600,)",False,"I have to work at a studio, so I can't be this type of worker linked electronically to his office from his home",a telecommuter,1,0
5185,2007-03-09,,Double Jeopardy,"(1, 5)",BODIES OF WATER,6,"(2000,)",False,"The Red Sea, you see, is considered an arm of this sea",the Arabian Sea,1,0
5185,2007-03-09,,Double Jeopardy,"(2, 5)",NAME THAT MOVIE,11,"(2000,)",False,"1939:""My friends just call me Ringo--nickname I had as a kid""",Stagecoach,0,3
5185,2007-03-09,,Double Jeopardy,"(3, 5)",WAR FICTION,23,"(2000,)",False,"Jack DuArte's ""The Resistance"" tells of French efforts to keep Louvre artwork from this No. 2 Nazi & Luftwaffe chief",Göring,1,0
5185,2007-03-09,,Double Jeopardy,"(4, 5)",DESCRIPTIONS & DEFINITIONS,27,"(2000,)",False,"Historian Daniel Boorstin defined this word as ""a person who is well-known for his well-knownness""",a celebrity,1,0
5185,2007-03-09,,Double Jeopardy,"(5, 5)",DANCING WITH THE STARS,30,"(2000,)",False,"Alpheratz, the brightest star in this constellation named for Perseus' wife, completes the Square of Pegasus",Andromeda,0,3
5185,2007-03-09,,Double Jeopardy,"(6, 5)","ON THE ""TELE""",16,"(2000,)",False,(Kelly of the Clue Crew draws on a weather map on a screen.)  One of the few Individual Engineering Emmy Awards went to Leonard Reiffel who invented this technology in the 1960s,a telestrator,1,1
5185,2007-03-09,,Final Jeopardy,"(1, 1)",WORLD WAR II,0,"(7600, 4601)",False,Rhyming names of the 2 places where FDR & Winston Churchill met up in February 1945,Malta & Yalta,2,0
