epNum,airDate,extra_info,round_name,coord,category,order,value,daily_double,question,answer,correctAttempts,wrongAttempts
5198,2007-03-28,Doug Hicton game 4.,Jeopardy,"(1, 1)",JUST ONE OF THE 2...,11,"(200,)",False,wives of Napoleon,Josephine,1,0
5198,2007-03-28,Doug Hicton game 4.,Jeopardy,"(2, 1)",STATE TREES,16,"(200,)",False,The scarlet carnation is the state flower; the buckeye is its tree,Ohio,1,0
5198,2007-03-28,Doug Hicton game 4.,Jeopardy,"(3, 1)",ENTERTAINMENT AWARDS,1,"(200,)",False,"He became the first African American to win Best Song when his ""Theme From Shaft"" won the 1971 Oscar",Isaac Hayes,1,0
5198,2007-03-28,Doug Hicton game 4.,Jeopardy,"(4, 1)",SYMBOLIC STOCKS,26,"(200,)",False,NKE:This company sent the competition running with its Air & Shox products,Nike,1,0
5198,2007-03-28,Doug Hicton game 4.,Jeopardy,"(5, 1)",DIRECTIONAL DIVERSIONS,6,"(200,)",False,"Steinbeck shows sadness in Salinas:""____ of Eden""",East,1,0
5198,2007-03-28,Doug Hicton game 4.,Jeopardy,"(6, 1)",INITIALLY BEFORE & AFTER,21,"(200,)",False,"This outbreak prevention agency & broadcaster wows 'em with the ""Late Show with David Letterman""",CDCBS,1,0
5198,2007-03-28,Doug Hicton game 4.,Jeopardy,"(1, 2)",JUST ONE OF THE 2...,12,"(400,)",False,states that joined the Union in 1912,Arizona,1,0
5198,2007-03-28,Doug Hicton game 4.,Jeopardy,"(2, 2)",STATE TREES,17,"(400,)",False,"Tree cheers for the Black Hills spruce, this state's choice",South Dakota,1,0
5198,2007-03-28,Doug Hicton game 4.,Jeopardy,"(3, 2)",ENTERTAINMENT AWARDS,2,"(400,)",False,"At the 1998 Golden Globes, it was ""As Good As It Gets"" when he won the Best Actor award",Jack Nicholson,1,0
5198,2007-03-28,Doug Hicton game 4.,Jeopardy,"(4, 2)",SYMBOLIC STOCKS,27,"(400,)",False,JNJ:You'll have no more tears with this company,Johnson & Johnson,1,0
5198,2007-03-28,Doug Hicton game 4.,Jeopardy,"(5, 2)",DIRECTIONAL DIVERSIONS,7,"(400,)",False,"1948 Pulitzer winner for Michener:""Tales of the _____ Pacific""",South,1,0
5198,2007-03-28,Doug Hicton game 4.,Jeopardy,"(6, 2)",INITIALLY BEFORE & AFTER,22,"(400,)",False,End-of-the-work-week acronym who won an Oscar as Salieri,TGIF. Murray Abraham,1,0
5198,2007-03-28,Doug Hicton game 4.,Jeopardy,"(1, 3)",JUST ONE OF THE 2...,13,"(600,)",False,cities that the NBA's Hornets called home in the 2005-06 season,New Orleans,1,1
5198,2007-03-28,Doug Hicton game 4.,Jeopardy,"(2, 3)",STATE TREES,18,"(2200,)",True,"Pennsylvania's tree is the Eastern this; run, Socrates, run!",hemlock,1,0
5198,2007-03-28,Doug Hicton game 4.,Jeopardy,"(3, 3)",ENTERTAINMENT AWARDS,3,"(600,)",False,"(Hi, I'm Bebe Neuwirth.)  I won 2 Emmy Awards for playing this wife of Frasier Crane on ""Cheers"" & later played his then ex-wife on ""Frasier"" receiving another nomination",Lilith,1,0
5198,2007-03-28,Doug Hicton game 4.,Jeopardy,"(4, 3)",SYMBOLIC STOCKS,28,"(600,)",False,"ERTS:The game is on for this company if you're ""Madden"" got the ""Need for Speed""",Electronic Arts,1,0
5198,2007-03-28,Doug Hicton game 4.,Jeopardy,"(5, 3)",DIRECTIONAL DIVERSIONS,8,"(600,)",False,"Percy Bysshe Shelley:""Ode to the ____ Wind""",West,1,0
5198,2007-03-28,Doug Hicton game 4.,Jeopardy,"(6, 3)",INITIALLY BEFORE & AFTER,23,"(600,)",False,This cadet academy in the Shenandoah Valley produced the architect who made the Louvre's glass pyramid,VMI.M. Pei,1,0
5198,2007-03-28,Doug Hicton game 4.,Jeopardy,"(1, 4)",JUST ONE OF THE 2...,14,"(800,)",False,cities destroyed by Mount Vesuvius along with Stabiae,Pompeii,1,0
5198,2007-03-28,Doug Hicton game 4.,Jeopardy,"(2, 4)",STATE TREES,19,"(800,)",False,"The candlenut tree, or kukui, is this state's pick",Hawaii,1,0
5198,2007-03-28,Doug Hicton game 4.,Jeopardy,"(3, 4)",ENTERTAINMENT AWARDS,4,"(800,)",False,"Named Best New Artist at the 1988 Grammys, she also won Best Female Pop Vocal Performance for ""Fast Car""",Tracy Chapman,1,0
5198,2007-03-28,Doug Hicton game 4.,Jeopardy,"(4, 4)",SYMBOLIC STOCKS,29,"(800,)",False,"MVL:This company may be full of comics, but the X-Men are no joke",Marvel,1,0
5198,2007-03-28,Doug Hicton game 4.,Jeopardy,"(5, 4)",DIRECTIONAL DIVERSIONS,9,"(800,)",False,"Shared title of 2 tales, one by John Jakes & one by Elizabeth Gaskell:""_____ and _____""",North and South,1,0
5198,2007-03-28,Doug Hicton game 4.,Jeopardy,"(6, 4)",INITIALLY BEFORE & AFTER,24,"(800,)",False,"Ergot mold '60s hallucinogen that authored ""Sons and Lovers"" & ""The Rainbow""",LSD.H. Lawrence,1,0
5198,2007-03-28,Doug Hicton game 4.,Jeopardy,"(1, 5)",JUST ONE OF THE 2...,15,"(1000,)",False,movies in which Clark Gable starred that won consecutive Best Picture Oscars in the mid-1930s,It Happened One Night,1,0
5198,2007-03-28,Doug Hicton game 4.,Jeopardy,"(2, 5)",STATE TREES,20,"(1000,)",False,"Montana's tree is this type of pine; ""Bonanza"" men called it home",ponderosa,1,0
5198,2007-03-28,Doug Hicton game 4.,Jeopardy,"(3, 5)",ENTERTAINMENT AWARDS,5,"(1000,)",False,This NBC sitcom starring Jason Lee was named Best New TV Comedy at the 2006 People's Choice Awards,My Name Is Earl,1,0
5198,2007-03-28,Doug Hicton game 4.,Jeopardy,"(4, 5)",SYMBOLIC STOCKS,30,"(1000,)",False,"WFMI:If you want to go organic, go to this supermarket",Whole Foods,1,0
5198,2007-03-28,Doug Hicton game 4.,Jeopardy,"(5, 5)",DIRECTIONAL DIVERSIONS,10,"(1000,)",False,"Robert Frost's 1914 collection:""_____ of Boston""",North,0,3
5198,2007-03-28,Doug Hicton game 4.,Jeopardy,"(6, 5)",INITIALLY BEFORE & AFTER,25,"(1000,)",False,American Federation of Labor partner & short story writer whose real name is William Sydney Porter,CIO. Henry,1,0
5198,2007-03-28,Doug Hicton game 4.,Double Jeopardy,"(1, 1)",NOW NAME THE OTHER...,21,"(400,)",False,wife of Napoleon,Marie-Louise,1,0
5198,2007-03-28,Doug Hicton game 4.,Double Jeopardy,"(2, 1)","""C"" POTPOURRI",1,"(400,)",False,"A document establishing an organization, or a type of specialized flight",a charter,1,0
5198,2007-03-28,Doug Hicton game 4.,Double Jeopardy,"(3, 1)",THE WILD & WOOLLY 1800s,30,"(400,)",False,In October 1870 French minister Leon Gambetta made a daring escape from besieged Paris in one of these,a balloon,0,3
5198,2007-03-28,Doug Hicton game 4.,Double Jeopardy,"(4, 1)",2-LETTER RESPONSES,6,"(400,)",False,Your desktop or laptop,PC,1,0
5198,2007-03-28,Doug Hicton game 4.,Double Jeopardy,"(5, 1)",JEFF,11,"(400,)",False,"You might be a redneck if you know this comic worked at IBM for 5 years; yeah, those are better when he tells 'em",(Jeff) Foxworthy,1,0
5198,2007-03-28,Doug Hicton game 4.,Double Jeopardy,"(6, 1)",FIJI,16,"(400,)",False,"(Jeff Probst reads from a Fiji Islands beach.)  A traditional Fijian art is making tapa, a cloth that's produced by pounding this tree part",bark,1,0
5198,2007-03-28,Doug Hicton game 4.,Double Jeopardy,"(1, 2)",NOW NAME THE OTHER...,22,"(800,)",False,state that joined the Union in 1912,New Mexico,1,0
5198,2007-03-28,Doug Hicton game 4.,Double Jeopardy,"(2, 2)","""C"" POTPOURRI",2,"(800,)",False,The company called Jennifer these doesn't sell sports cars but sofa beds,Convertibles,1,0
5198,2007-03-28,Doug Hicton game 4.,Double Jeopardy,"(3, 2)",THE WILD & WOOLLY 1800s,29,"(5400,)",True,France got this territory back in 1800 & turned around & sold it to the U.S. a few years later,Louisiana,1,0
5198,2007-03-28,Doug Hicton game 4.,Double Jeopardy,"(4, 2)",2-LETTER RESPONSES,7,"(800,)",False,It's someone who presides over an event or who acts as host of a performance,an MC,1,0
5198,2007-03-28,Doug Hicton game 4.,Double Jeopardy,"(5, 2)",JEFF,12,"(800,)",False,"This Jeff & his brother played brothers in ""The Fabulous Baker Boys""",Bridges,1,0
5198,2007-03-28,Doug Hicton game 4.,Double Jeopardy,"(6, 2)",FIJI,17,"(800,)",False,"(Jeff Probst reads again.)  In 1774 this British explorer visited Totoya, one of Fiji's southern islands",Cook,1,0
5198,2007-03-28,Doug Hicton game 4.,Double Jeopardy,"(1, 3)",NOW NAME THE OTHER...,23,"(1200,)",False,city that the NBA's Hornets called home in the 2005-06 season,Oklahoma City,0,3
5198,2007-03-28,Doug Hicton game 4.,Double Jeopardy,"(2, 3)","""C"" POTPOURRI",3,"(1200,)",False,"A parliamentary motion to test support for the government is a vote of this; if the gov't loses, a vote of ""no"" this",confidence,1,0
5198,2007-03-28,Doug Hicton game 4.,Double Jeopardy,"(3, 3)",THE WILD & WOOLLY 1800s,26,"(1200,)",False,"Rudolf, heir to this dual throne, died in a suicide pact at Mayerling in 1889",Austria-Hungary,1,0
5198,2007-03-28,Doug Hicton game 4.,Double Jeopardy,"(4, 3)",2-LETTER RESPONSES,8,"(1200,)",False,High school students can earn college credit by taking this type of course & passing the exam,AP,1,0
5198,2007-03-28,Doug Hicton game 4.,Double Jeopardy,"(5, 3)",JEFF,13,"(1200,)",False,"Jeff Townes was known as this when he & Will Smith had a hit with ""Summertime""",DJ Jazzy Jeff,1,0
5198,2007-03-28,Doug Hicton game 4.,Double Jeopardy,"(6, 3)",FIJI,18,"(3000,)",True,(Jeff reads yet again.)  Fiji's flag includes a depiction of this other national flag; makes sense--Fiji was a Crown colony from 1874 to 1970,the Union Jack (the UK accepted),1,0
5198,2007-03-28,Doug Hicton game 4.,Double Jeopardy,"(1, 4)",NOW NAME THE OTHER...,24,"(1600,)",False,city destroyed by Mount Vesuvius along with Stabiae,Herculaneum,1,0
5198,2007-03-28,Doug Hicton game 4.,Double Jeopardy,"(2, 4)","""C"" POTPOURRI",4,"(1600,)",False,"Ian Fleming wrote, ""Once is happenstance, twice is"" this. ""The third time it's enemy action""",coincidence,1,0
5198,2007-03-28,Doug Hicton game 4.,Double Jeopardy,"(3, 4)",THE WILD & WOOLLY 1800s,27,"(1600,)",False,"In 1882 Lawyer Samuel Dodd found that to control companies in several states, Standard Oil could form these",monopolies (or trusts),1,0
5198,2007-03-28,Doug Hicton game 4.,Double Jeopardy,"(4, 4)",2-LETTER RESPONSES,9,"(1600,)",False,"This ""timely"" abbreviation is from the Latin for ""Year of the Lord""",A.D.,1,0
5198,2007-03-28,Doug Hicton game 4.,Double Jeopardy,"(5, 4)",JEFF,14,"(1600,)",False,"Political pundit and author of ""The People's Choice"" seen here",Jeff Greenfield,0,3
5198,2007-03-28,Doug Hicton game 4.,Double Jeopardy,"(6, 4)",FIJI,19,"(1600,)",False,(Jeff reads yet one more time.)  While we've been here in Fiji the government has not survived & has been overthrown in a coup in this capital city,Suva,1,0
5198,2007-03-28,Doug Hicton game 4.,Double Jeopardy,"(1, 5)",NOW NAME THE OTHER...,25,"(2000,)",False,movie in which Clark Gable starred that won consecutive Best Picture Oscars in the mid-1930s,Mutiny on the Bounty,0,3
5198,2007-03-28,Doug Hicton game 4.,Double Jeopardy,"(2, 5)","""C"" POTPOURRI",5,"(2000,)",False,"A barrow is a pig that's had certain involuntary surgery; a gelding is the equivalent horse, & this is the rooster",a capon,1,0
5198,2007-03-28,Doug Hicton game 4.,Double Jeopardy,"(3, 5)",THE WILD & WOOLLY 1800s,28,"(2000,)",False,"Formed in the 1820s amidst fears of a secretive order, it was the first major third political party in U.S. history",the Anti-Masonic Party,0,3
5198,2007-03-28,Doug Hicton game 4.,Double Jeopardy,"(4, 5)",2-LETTER RESPONSES,10,"(2000,)",False,In 1944 Congress passed the first one of these bills to provide education for war veterans,G.I.,1,0
5198,2007-03-28,Doug Hicton game 4.,Double Jeopardy,"(5, 5)",JEFF,15,"(2000,)",False,"In 1817 Francis Jeffrey coined this geographic term that refers to Southey, Coleridge & Wordsworth",the Lake Poets,1,0
5198,2007-03-28,Doug Hicton game 4.,Double Jeopardy,"(6, 5)",FIJI,20,"(2000,)",False,"(Jeff reads one last time.)  Culturally, Fiji is part of this island group, whose name is partly from the Greek for ""black""",Melanesia,1,0
5198,2007-03-28,Doug Hicton game 4.,Final Jeopardy,"(1, 1)",LITERARY FIGURES,0,"(7000, 20200, 19801)",False,"Bono, Jim Sheridan & Liam Neeson were featured in a 2004 documentary honoring the 150th anniversary of the birth of this man",Oscar Wilde,1,2
