epNum,airDate,extra_info,round_name,coord,category,order,value,daily_double,question,answer,correctAttempts,wrongAttempts
5322,2007-10-30,Paul Glaser game 3.,Jeopardy,"(1, 1)","LIKE, IT'S TOTALLY THE VALLEY",16,"(200,)",False,"On Dec. 23, 1777 there were ""2,873 men in camp unfit for duty"" here ""because they are barefooted and otherwise naked""",Valley Forge,1,0
5322,2007-10-30,Paul Glaser game 3.,Jeopardy,"(2, 1)",SPORTS QUOTES,26,"(200,)",False,"Johnny Logan:""We're honoring one of the all-time greats in baseball, Stan"" (The Man) him.  ""He's immoral""",Musial,1,0
5322,2007-10-30,Paul Glaser game 3.,Jeopardy,"(3, 1)",MSSNG VWLS,21,"(200,)",False,A really cool dwelling for an Eskimo:GL,an igloo,1,0
5322,2007-10-30,Paul Glaser game 3.,Jeopardy,"(4, 1)",BORN & DIED,11,"(200,)",False,"Born October 9, 1940 in Liverpool, he died tragically December 8, 1980 in New York City",John Lennon,1,0
5322,2007-10-30,Paul Glaser game 3.,Jeopardy,"(5, 1)",WAR,6,"(200,)",False,Henry V & Joan of Arc both fought in this war considered the longest in history,the Hundred Years\' War,1,0
5322,2007-10-30,Paul Glaser game 3.,Jeopardy,"(6, 1)",PIECE,1,"(200,)",False,"The pieces of this classic board game include a shoe, a top hat & a battleship",Monopoly,1,0
5322,2007-10-30,Paul Glaser game 3.,Jeopardy,"(1, 2)","LIKE, IT'S TOTALLY THE VALLEY",17,"(400,)",False,"In the Wonders of America stamp series, the ""Hottest Spot"",  this California site, has a picture that fits the name",Death Valley,1,0
5322,2007-10-30,Paul Glaser game 3.,Jeopardy,"(2, 2)",SPORTS QUOTES,27,"(400,)",False,"This Hall of Fame 1970s Reds catcher ""was thinking about making a comeback until I pulled a muscle vacuuming""",Johnny Bench,1,0
5322,2007-10-30,Paul Glaser game 3.,Jeopardy,"(3, 2)",MSSNG VWLS,22,"(400,)",False,A birthstone:PL,opal,1,0
5322,2007-10-30,Paul Glaser game 3.,Jeopardy,"(4, 2)",BORN & DIED,12,"(400,)",False,"He was born January 15, 1929 in Atlanta & died in Memphis April 4, 1968","Martin Luther King, Jr.",1,0
5322,2007-10-30,Paul Glaser game 3.,Jeopardy,"(5, 2)",WAR,7,"(400,)",False,"Of the 1940s, '50s or '60s, the decade the first operational nuclear submarine was launched",the \'50s,1,0
5322,2007-10-30,Paul Glaser game 3.,Jeopardy,"(6, 2)",PIECE,2,"(400,)",False,You have to fill up the piece seen here to win this game invented in 1979,Trivial Pursuit,1,0
5322,2007-10-30,Paul Glaser game 3.,Jeopardy,"(1, 3)","LIKE, IT'S TOTALLY THE VALLEY",18,"(600,)",False,Virginia Shenandoah Valley is bounded on its east side by these mountains,the Blue Ridge Mountains,1,0
5322,2007-10-30,Paul Glaser game 3.,Jeopardy,"(2, 3)",SPORTS QUOTES,28,"(600,)",False,"He made ""Bartlett's"" with ""If people don't want to come out to the ballpark, nobody's going to stop them""",Yogi Berra,1,0
5322,2007-10-30,Paul Glaser game 3.,Jeopardy,"(3, 3)",MSSNG VWLS,23,"(3000,)",True,A woodwind instrument:B,an oboe,1,0
5322,2007-10-30,Paul Glaser game 3.,Jeopardy,"(4, 3)",BORN & DIED,13,"(600,)",False,A profile of this film director says he was born in Britain in 1899 & died in Los Angeles in 1980,Alfred Hitchcock,1,0
5322,2007-10-30,Paul Glaser game 3.,Jeopardy,"(5, 3)",WAR,8,"(600,)",False,"In the biggest amphibious invasion in history, 350,000 troops invaded this historic region in 1944",Normandy,1,0
5322,2007-10-30,Paul Glaser game 3.,Jeopardy,"(6, 3)",PIECE,3,"(600,)",False,Professor Plum has his choice of 6 weapons in this board game,Clue,1,0
5322,2007-10-30,Paul Glaser game 3.,Jeopardy,"(1, 4)","LIKE, IT'S TOTALLY THE VALLEY",19,"(800,)",False,In 1933 FDR set up this agency to provide cheap power & flood control,the Tennessee Valley Authority,1,0
5322,2007-10-30,Paul Glaser game 3.,Jeopardy,"(2, 4)",SPORTS QUOTES,29,"(800,)",False,"At a dinner, Redskins RB John Riggins begged this Supreme Court justice, ""Come on, Sandy baby, loosen up""",Sandra Day O\'Connor,1,0
5322,2007-10-30,Paul Glaser game 3.,Jeopardy,"(3, 4)",MSSNG VWLS,24,"(800,)",False,An African country:GND,Uganda,1,0
5322,2007-10-30,Paul Glaser game 3.,Jeopardy,"(4, 4)",BORN & DIED,14,"(800,)",False,He was born on an Army post in Little Rock in 1880 & faded away at a D.C. hospital in 1964,(Douglas) MacArthur,1,0
5322,2007-10-30,Paul Glaser game 3.,Jeopardy,"(5, 4)",WAR,9,"(800,)",False,"Seen here, the Me 262 from this German manufacturer was the world's first operational fighter jet",Messerschmitt,1,0
5322,2007-10-30,Paul Glaser game 3.,Jeopardy,"(6, 4)",PIECE,4,"(800,)",False,Move your conquering army pieces into Siam or Yakutsk as part of your global strategy in this board game,Risk,1,0
5322,2007-10-30,Paul Glaser game 3.,Jeopardy,"(1, 5)","LIKE, IT'S TOTALLY THE VALLEY",20,"(1000,)",False,Thutmose III was eternally maxin' & relaxin' in this narrow gorge used as a cemetery between 1550 & 1100 B.C.,the Valley of the Kings,1,0
5322,2007-10-30,Paul Glaser game 3.,Jeopardy,"(2, 5)",SPORTS QUOTES,30,"(1000,)",False,"This 1950s Yankee mgr. said of a pitcher, ""He don't smoke, he don't drink, he don't chase women & he don't win""",(Casey) Stengel,1,0
5322,2007-10-30,Paul Glaser game 3.,Jeopardy,"(3, 5)",MSSNG VWLS,25,"(1000,)",False,A woolly mammal:LPC,an alpaca,1,0
5322,2007-10-30,Paul Glaser game 3.,Jeopardy,"(4, 5)",BORN & DIED,15,"(1000,)",False,"Born in Houston in 1905, he died en route from Acapulco to Houston in 1976; his money couldn't save him",Howard Hughes,0,3
5322,2007-10-30,Paul Glaser game 3.,Jeopardy,"(5, 5)",WAR,10,"(1000,)",False,The oldest army unit in the world is this one founded in 1506 that guards the Pope,the Swiss Guard,1,0
5322,2007-10-30,Paul Glaser game 3.,Jeopardy,"(6, 5)",PIECE,5,"(1000,)",False,It's the more correct name for the castle piece in a game of chess,a rook,1,0
5322,2007-10-30,Paul Glaser game 3.,Double Jeopardy,"(1, 1)",THE BODY HUMAN,6,"(400,)",False,This pigment in blood transports oxygen,hemoglobin,1,0
5322,2007-10-30,Paul Glaser game 3.,Double Jeopardy,"(2, 1)",POP DIVA TURNS MOVIE STAR,18,"(400,)",False,1972:Diana Ross in this biopic,Lady Sings the Blues,1,1
5322,2007-10-30,Paul Glaser game 3.,Double Jeopardy,"(3, 1)",17th CENTURY ART,11,"(400,)",False,"Though he was Flemish, van Dyck is best known for the portraits he did in this British city in the 1630s",London,1,0
5322,2007-10-30,Paul Glaser game 3.,Double Jeopardy,"(4, 1)",GEMS & JEWELRY,14,"(400,)",False,Legacy rings inspired by the Edwardian era are exclusive to this preeminent Fifth Avenue jeweler,Tiffany,1,0
5322,2007-10-30,Paul Glaser game 3.,Double Jeopardy,"(5, 1)",FICTIONAL FEMALES,26,"(400,)",False,This Nabokov nymphet first appears peering over dark glasses,Lolita,1,0
5322,2007-10-30,Paul Glaser game 3.,Double Jeopardy,"(6, 1)",FOOD WORDS & PHRASES,1,"(400,)",False,"This condiment's name once meant the genuine article, so to cut it meant to be good enough",the mustard,1,0
5322,2007-10-30,Paul Glaser game 3.,Double Jeopardy,"(1, 2)",THE BODY HUMAN,7,"(800,)",False,"Sometimes caused by tooth grinding, the disorder known by these 3 letters can lead to a clicking jaw",TMJ,1,0
5322,2007-10-30,Paul Glaser game 3.,Double Jeopardy,"(2, 2)",POP DIVA TURNS MOVIE STAR,19,"(800,)",False,1980:Dolly Parton in this workplace comedy,9 to 5,1,0
5322,2007-10-30,Paul Glaser game 3.,Double Jeopardy,"(3, 2)",17th CENTURY ART,12,"(800,)",False,Pietro da Cortona spent 1633 to 1639 painting a vast fresco on this part of the Great Hall of the Barberini Palace,the ceiling,1,0
5322,2007-10-30,Paul Glaser game 3.,Double Jeopardy,"(4, 2)",GEMS & JEWELRY,15,"(800,)",False,Miss Tamblyn knows that lots of jewelry is made from this brownish-yellow fossil resin,amber,1,0
5322,2007-10-30,Paul Glaser game 3.,Double Jeopardy,"(5, 2)",FICTIONAL FEMALES,27,"(800,)",False,Isadora Wing is the lusty heroine of this 1973 Erica Jong bestseller,Fear of Flying,1,0
5322,2007-10-30,Paul Glaser game 3.,Double Jeopardy,"(6, 2)",FOOD WORDS & PHRASES,2,"(800,)",False,"It's something added, originally spread on a bakery treat, to make a good thing even better",frosting,1,0
5322,2007-10-30,Paul Glaser game 3.,Double Jeopardy,"(1, 3)",THE BODY HUMAN,8,"(1200,)",False,Microscopic shaggy hairs called villi line the walls of this digestive organ,the small intestine,1,0
5322,2007-10-30,Paul Glaser game 3.,Double Jeopardy,"(2, 3)",POP DIVA TURNS MOVIE STAR,20,"(1200,)",False,2001:Mariah Carey in this shiny misfire,Glitter,1,0
5322,2007-10-30,Paul Glaser game 3.,Double Jeopardy,"(3, 3)",17th CENTURY ART,13,"(1200,)",False,"Winning favor by glorifying this man in paintings, Charles Le Brun became the arbiter of French taste",Louis XIV,0,3
5322,2007-10-30,Paul Glaser game 3.,Double Jeopardy,"(4, 3)",GEMS & JEWELRY,16,"(1200,)",False,"In 1974 the newly discovered gem tsavorite got its name, derived from this continent's Tsavo National Park",Africa,1,0
5322,2007-10-30,Paul Glaser game 3.,Double Jeopardy,"(5, 3)",FICTIONAL FEMALES,28,"(1200,)",False,"Becky Thatcher is in ""Tom Sawyer""; this Becky is the heroine of ""Vanity Fair""",Becky Sharp,0,3
5322,2007-10-30,Paul Glaser game 3.,Double Jeopardy,"(6, 3)",FOOD WORDS & PHRASES,3,"(1200,)",False,"(Jimmy of the Clue Crew cups a baseball in the top end of his mitt.) When a baseball player barely makes a catch, the look of the ball & glove is known as this sweet treat",an ice cream cone,1,0
5322,2007-10-30,Paul Glaser game 3.,Double Jeopardy,"(1, 4)",THE BODY HUMAN,9,"(1600,)",False,"In the arm, the name of this muscle precedes brachii; in the leg, femoris",the biceps,0,3
5322,2007-10-30,Paul Glaser game 3.,Double Jeopardy,"(2, 4)",POP DIVA TURNS MOVIE STAR,21,"(1600,)",False,"2002:Britney Spears in this ""road"" movie",Crossroads,1,0
5322,2007-10-30,Paul Glaser game 3.,Double Jeopardy,"(3, 4)",17th CENTURY ART,24,"(1600,)",False,"Claude Lorrain gave new status to this genre with works like ""A Pastoral"" one, now at Yale",landscape,0,3
5322,2007-10-30,Paul Glaser game 3.,Double Jeopardy,"(4, 4)",GEMS & JEWELRY,17,"(1600,)",False,Squash blossom necklaces made by the Zuni Indians often feature this bluish-green gem set in silver,turquoise,1,0
5322,2007-10-30,Paul Glaser game 3.,Double Jeopardy,"(5, 4)",FICTIONAL FEMALES,29,"(4000,)",True,This title heroine tries to set up her friend Harriet with Mr. Elton & is dismayed when Elton proposes to her instead,Emma,0,1
5322,2007-10-30,Paul Glaser game 3.,Double Jeopardy,"(6, 4)",FOOD WORDS & PHRASES,4,"(3400,)",True,"Someone suddenly saying flattering things to you may just be doing this, like on toast",buttering you up,1,0
5322,2007-10-30,Paul Glaser game 3.,Double Jeopardy,"(1, 5)",THE BODY HUMAN,10,"(2000,)",False,The human brain has billions of connections across these gaps between neurons,synapses,1,0
5322,2007-10-30,Paul Glaser game 3.,Double Jeopardy,"(2, 5)",POP DIVA TURNS MOVIE STAR,22,"(2000,)",False,1993:Janet Jackson in this urban drama,Poetic Justice,0,3
5322,2007-10-30,Paul Glaser game 3.,Double Jeopardy,"(3, 5)",17th CENTURY ART,25,"(2000,)",False,This 17th-century Spaniard was a technical master even at the age of 20: just look at the light on the glass,Diego Velázquez,0,3
5322,2007-10-30,Paul Glaser game 3.,Double Jeopardy,"(4, 5)",GEMS & JEWELRY,23,"(2000,)",False,The name of this romantic ring seen here comes from an old Irish fishing village that's now part of Galway,Claddagh,1,0
5322,2007-10-30,Paul Glaser game 3.,Double Jeopardy,"(5, 5)",FICTIONAL FEMALES,30,"(2000,)",False,This Sue Grafton detective was once part of the Santa Teresa Police Department,Kinsey Millhone,0,3
5322,2007-10-30,Paul Glaser game 3.,Double Jeopardy,"(6, 5)",FOOD WORDS & PHRASES,5,"(2000,)",False,"The lady seen here is wearing the fashionable style of sleeves called ""leg-of-"" this",leg-of-mutton,1,1
5322,2007-10-30,Paul Glaser game 3.,Final Jeopardy,"(1, 1)",LICENSE PLATES OF THE FAMOUS,0,"(1999, 14000, 6401)",False,"In 2006 his car was auctioned for charity, along with its personalized Nebraska plate reading ""thrifty""",Warren Buffett,2,1
