epNum,airDate,extra_info,round_name,coord,category,order,value,daily_double,question,answer,correctAttempts,wrongAttempts
5429,2008-03-27,,Jeopardy,"(1, 1)",EASTER,11,"(200,)",False,"1916's ""Easter Rebellion"" against British rule was centered in this capital city",Dublin,1,0
5429,2008-03-27,,Jeopardy,"(2, 1)",BUNNY,23,"(200,)",False,"In the 1940 cartoon ""A Wild Hare"", this character utters the iconic ""What's up, Doc?"" line for the first time",Bugs Bunny,1,0
5429,2008-03-27,,Jeopardy,"(3, 1)",LOCO FOR LOGOS,21,"(200,)",False,"Fast-forward into the 21st century with this electronic device that ""gets you way more than a DVR""",TiVo,1,0
5429,2008-03-27,,Jeopardy,"(4, 1)",NURSERY RHYMES ON THE 11 O'CLOCK NEWS,16,"(200,)",False,"Confrontation downtown today near the fair, as a pieman denied this penniless man food",Simple Simon,1,0
5429,2008-03-27,,Jeopardy,"(5, 1)",NOMS DE PLUME,1,"(200,)",False,In French this graceful swimmer is un cygne,a swan,1,0
5429,2008-03-27,,Jeopardy,"(6, 1)","""MAN"" IN THE MIDDLE",4,"(200,)",False,An annual publication chock full of facts & figures,an almanac,1,0
5429,2008-03-27,,Jeopardy,"(1, 2)",EASTER,12,"(400,)",False,These fund-raising stamps for disabled children were first issued in 1934,Easter Seals,1,0
5429,2008-03-27,,Jeopardy,"(2, 2)",BUNNY,27,"(400,)",False,This icon of extended battery life has been going & going since 1989,the Energizer Bunny,1,0
5429,2008-03-27,,Jeopardy,"(3, 2)",LOCO FOR LOGOS,22,"(400,)",False,Before being spun off in 1934 this airline was part of Boeing,United,1,0
5429,2008-03-27,,Jeopardy,"(4, 2)",NURSERY RHYMES ON THE 11 O'CLOCK NEWS,17,"(400,)",False,"Animal Control today swarmed over ""the house that"" he ""built"", finding a tossed dog, a worried cat & a dead rat",Jack,1,0
5429,2008-03-27,,Jeopardy,"(5, 2)",NOMS DE PLUME,2,"(400,)",False,This peaceful bird is une colombe,a dove,0,3
5429,2008-03-27,,Jeopardy,"(6, 2)","""MAN"" IN THE MIDDLE",5,"(400,)",False,Hellbenders & newts are types of these,salamanders,1,0
5429,2008-03-27,,Jeopardy,"(1, 3)",EASTER,13,"(600,)",False,It's where you'll find Chile's Isla de Pascua National Park,Easter Island,1,0
5429,2008-03-27,,Jeopardy,"(2, 3)",BUNNY,28,"(600,)",False,A 1950s hit song by Ray Anthony inspired this popular dance craze,the bunny hop,1,0
5429,2008-03-27,,Jeopardy,"(3, 3)",LOCO FOR LOGOS,24,"(600,)",False,"(Cheryl of the Clue Crew compares a logo with its antecedent.)  This association adapted the Duke of Lorraine's emblem because they, too, were fighting a crusade, but against tuberculosis",the American Lung Association,1,0
5429,2008-03-27,,Jeopardy,"(4, 3)",NURSERY RHYMES ON THE 11 O'CLOCK NEWS,18,"(600,)",False,She terrorized 3 non-sighted rodents & dismembered them; I've never seen such a sight in my life,the farmer\'s wife,1,0
5429,2008-03-27,,Jeopardy,"(5, 3)",NOMS DE PLUME,3,"(600,)",False,"Ask your ""mother""-- this ""silly"" bird is une oie",a goose,1,0
5429,2008-03-27,,Jeopardy,"(6, 3)","""MAN"" IN THE MIDDLE",8,"(600,)",False,To take apart,dismantle,1,0
5429,2008-03-27,,Jeopardy,"(1, 4)",EASTER,14,"(800,)",False,This Hollywood landmark began observing its famous Easter sunrise service in 1921,the Hollywood Bowl,1,0
5429,2008-03-27,,Jeopardy,"(2, 4)",BUNNY,29,"(800,)",False,"Gap-toothed supermodel & onetime Playboy Bunny who now plays a publicist on ""Nip/Tuck""",Lauren Hutton,1,0
5429,2008-03-27,,Jeopardy,"(3, 4)",LOCO FOR LOGOS,25,"(3000,)",True,The first credit card that could be used at multiple businesses was started by this company,Diners Club,1,0
5429,2008-03-27,,Jeopardy,"(4, 4)",NURSERY RHYMES ON THE 11 O'CLOCK NEWS,19,"(800,)",False,"This guy, ""the piper's son"", was arrested on pig-theft charges today, shortly after being beaten until he wept","Tom, Tom",1,0
5429,2008-03-27,,Jeopardy,"(5, 4)",NOMS DE PLUME,6,"(800,)",False,This nocturnal bird of prey is un hibou,an owl,1,0
5429,2008-03-27,,Jeopardy,"(6, 4)","""MAN"" IN THE MIDDLE",9,"(800,)",False,"In the photo seen here, it's the snow-laced mountain in the background",Kilimanjaro,1,0
5429,2008-03-27,,Jeopardy,"(1, 5)",EASTER,15,"(1000,)",False,"This location's first Easter Egg Roll was on April 22, 1878",the White House,1,0
5429,2008-03-27,,Jeopardy,"(2, 5)",BUNNY,30,"(1000,)",False,He was Bambi's bunny buddy on the big screen,Thumper,1,0
5429,2008-03-27,,Jeopardy,"(3, 5)",LOCO FOR LOGOS,26,"(1000,)",False,This company is named after the aircraft carrier the owner served on during World War II,Enterprise Rent-A-Car,1,0
5429,2008-03-27,,Jeopardy,"(4, 5)",NURSERY RHYMES ON THE 11 O'CLOCK NEWS,20,"(1000,)",False,"In a daring holdup this animal's ""three bags full"" of wool, intended for 3 locals, were taken at gunpoint today","baa, baa, black sheep",1,0
5429,2008-03-27,,Jeopardy,"(5, 5)",NOMS DE PLUME,7,"(1000,)",False,This small game bird is une caille,a quail,1,0
5429,2008-03-27,,Jeopardy,"(6, 5)","""MAN"" IN THE MIDDLE",10,"(1000,)",False,Not temporary,permanent,1,0
5429,2008-03-27,,Double Jeopardy,"(1, 1)",SHAKESPEARE,1,"(400,)",False,"She is the ""Shrew"" whom Petruchio must tame",Katherina,1,0
5429,2008-03-27,,Double Jeopardy,"(2, 1)",CLINT EASTWOOD: A CAREER IN HOLLYWOOD,6,"(400,)",False,Meryl Streep played an Iowa housewife who has a brief affair with Clint Eastwood in this film,The Bridges of Madison County,1,0
5429,2008-03-27,,Double Jeopardy,"(3, 1)","MY, YOU'VE AGED",26,"(400,)",False,"Maybe you can see here why Edison said ""Genius is one percent inspiration and 99 percent"" this",perspiration,1,0
5429,2008-03-27,,Double Jeopardy,"(4, 1)",VIVA ITALIA,11,"(400,)",False,The first part of Italy liberated by the Allies during World War II was this island invaded in July 1943,Sicily,1,0
5429,2008-03-27,,Double Jeopardy,"(5, 1)",I'LL HAVE THE LAME DUCK,21,"(400,)",False,"In 1968 this president cited a ""division in the American House"" & quit the upcoming race in the name of national unity",Lyndon Johnson,1,0
5429,2008-03-27,,Double Jeopardy,"(6, 1)","CROSSWORD CLUES ""Q""",16,"(400,)",False,To satisfy one's thirst(6),quench,1,0
5429,2008-03-27,,Double Jeopardy,"(1, 2)",SHAKESPEARE,2,"(800,)",False,He cannot overcome temptation or ambition but does ignore his own scruples to murder Duncan,Macbeth,1,0
5429,2008-03-27,,Double Jeopardy,"(2, 2)",CLINT EASTWOOD: A CAREER IN HOLLYWOOD,7,"(800,)",False,"The title trio of this movie classic are played by Clint, Lee Van Cleef & Eli Wallach","The Good, the Bad and the Ugly",1,0
5429,2008-03-27,,Double Jeopardy,"(3, 2)","MY, YOU'VE AGED",27,"(800,)",False,Men do it in order to look older; Abe Lincoln did it in 1860,grow a beard,1,0
5429,2008-03-27,,Double Jeopardy,"(4, 2)",VIVA ITALIA,12,"(800,)",False,The world's first major film festival was held in this city in 1932; today it awards the prestigious Golden Lion,Venice,1,0
5429,2008-03-27,,Double Jeopardy,"(5, 2)",I'LL HAVE THE LAME DUCK,22,"(800,)",False,"During his second term, he authorized the sale of missiles to Iran; it would lead to Iran-Contra issues",Ronald Reagan,1,0
5429,2008-03-27,,Double Jeopardy,"(6, 2)","CROSSWORD CLUES ""Q""",17,"(800,)",False,Good place to hunt slate & marble(6),quarry,1,0
5429,2008-03-27,,Double Jeopardy,"(1, 3)",SHAKESPEARE,3,"(1200,)",False,The title of this problem comedy tells you how everything is going to turn out when the play is over,All\'s Well that Ends Well,1,0
5429,2008-03-27,,Double Jeopardy,"(2, 3)",CLINT EASTWOOD: A CAREER IN HOLLYWOOD,8,"(1200,)",False,"For 7 years, Clint played Rowdy Yates on this long-running TV western that helped launch his career",Rawhide,1,0
5429,2008-03-27,,Double Jeopardy,"(3, 3)","MY, YOU'VE AGED",28,"(1200,)",False,"The 1530s were hard on Henry VIII; marital problems, weight gain, & this action taken by the Pope in 1533",excommunication,1,0
5429,2008-03-27,,Double Jeopardy,"(4, 3)",VIVA ITALIA,13,"(1200,)",False,"Begun in 312 B.C. & originally 20 feet wide, this first & most famous Roman road still handles traffic today",the Appian Way,1,0
5429,2008-03-27,,Double Jeopardy,"(5, 3)",I'LL HAVE THE LAME DUCK,23,"(1200,)",False,One of his final acts as President was the controversial pardoning of financier Marc Rich,Bill Clinton,1,0
5429,2008-03-27,,Double Jeopardy,"(6, 3)","CROSSWORD CLUES ""Q""",18,"(1200,)",False,Leap or mechanics preceder(7),quantum,1,0
5429,2008-03-27,,Double Jeopardy,"(1, 4)",SHAKESPEARE,4,"(3000,)",True,These 2 seasons are found in the titles of Shakespeare plays,winter & summer,0,1
5429,2008-03-27,,Double Jeopardy,"(2, 4)",CLINT EASTWOOD: A CAREER IN HOLLYWOOD,9,"(1600,)",False,Clint directed & starred in this 1971 film about a radio DJ & an obsessed female fan,Play Misty for Me,1,0
5429,2008-03-27,,Double Jeopardy,"(3, 4)","MY, YOU'VE AGED",29,"(1600,)",False,"In ""Little Big Man"", this actor's character ages from 17 to 121",Dustin Hoffman,1,0
5429,2008-03-27,,Double Jeopardy,"(4, 4)",VIVA ITALIA,14,"(1600,)",False,"Modeled in part on aircraft landing gear, this brand of motor scooter was first produced in Tuscany in 1946",Vespa,1,0
5429,2008-03-27,,Double Jeopardy,"(5, 4)",I'LL HAVE THE LAME DUCK,24,"(1600,)",False,"He said, ""I do not feel... it is my duty to spend another 4 years in the White House"", then campaigned for Adlai Stevenson",Harry Truman,1,0
5429,2008-03-27,,Double Jeopardy,"(6, 4)","CROSSWORD CLUES ""Q""",19,"(1600,)",False,Where FBI agents train(8),Quantico,1,0
5429,2008-03-27,,Double Jeopardy,"(1, 5)",SHAKESPEARE,5,"(2000,)",False,Achilles & Ajax are characters in this play,Troilus and Cressida,0,3
5429,2008-03-27,,Double Jeopardy,"(2, 5)",CLINT EASTWOOD: A CAREER IN HOLLYWOOD,10,"(2000,)",False,Clint has won 2 Oscars for directing & in 1995 got this memorial award from the Academy,the Irving G. Thalberg Memorial Award,1,1
5429,2008-03-27,,Double Jeopardy,"(3, 5)","MY, YOU'VE AGED",30,"(2000,)",False,"In the 1850s Robert E. Lee was a dashing, dark-haired officer; by this year of Gettysburg, his hair was white",1863,1,0
5429,2008-03-27,,Double Jeopardy,"(4, 5)",VIVA ITALIA,15,"(2000,)",False,"Giuseppe Mazzini, Conte di Cavour & this ""Redshirt"" were main figures of the Risorgimento movement",Giuseppe Garibaldi,0,3
5429,2008-03-27,,Double Jeopardy,"(5, 5)",I'LL HAVE THE LAME DUCK,25,"(5000,)",True,"Just before he left office he signed a bill creating the toxic waste-cleaning ""Superfund""",Jimmy Carter,1,0
5429,2008-03-27,,Double Jeopardy,"(6, 5)","CROSSWORD CLUES ""Q""",20,"(2000,)",False,The most typical of all(14),quintessential,1,0
5429,2008-03-27,,Final Jeopardy,"(1, 1)",CLASSICAL MUSICIANS,0,"(9800, 15000, 13000)",False,"In 1793, Haydn wrote he will be ""one of Europe's finest composers, & I shall be proud to be called his teacher""",Ludwig van Beethoven,2,1
