epNum,airDate,extra_info,round_name,coord,category,order,value,daily_double,question,answer,correctAttempts,wrongAttempts
5453,2008-04-30,Tom Morris game 2.,Jeopardy,"(1, 1)",WILL...OF...FORTUNE!,26,"(200,)",False,"This newspaper guy's estate south of San Francisco boasted 50 miles of ocean frontage & a 1,665-square-foot indoor pool",Hearst,1,0
5453,2008-04-30,Tom Morris game 2.,Jeopardy,"(2, 1)",BRITISH ROCKERS,1,"(200,)",False,"Mick Jagger & this group have had a satisfying career with hits like ""Satisfaction"" & ""Jumpin' Jack Flash""",The Rolling Stones,1,0
5453,2008-04-30,Tom Morris game 2.,Jeopardy,"(3, 1)",ANIMAL COMMON BONDS,16,"(200,)",False,"Schipperke,Borzoi,Bichon frise",dogs,1,0
5453,2008-04-30,Tom Morris game 2.,Jeopardy,"(4, 1)",BATTLES,10,"(200,)",False,The defeat of this city's invasion force at Syracuse in 413 B.C. was the beginning of its end & the start of Sparta's rise,Athens,1,0
5453,2008-04-30,Tom Morris game 2.,Jeopardy,"(5, 1)",STUPID ANSWERS,21,"(200,)",False,"Founded in 1929, this New York museum is dedicated to modern art",The Museum of Modern Art,1,1
5453,2008-04-30,Tom Morris game 2.,Jeopardy,"(6, 1)",3-LETTER WORDS,5,"(200,)",False,"It's the center part of a wheel, or the center of an activity",hub,1,0
5453,2008-04-30,Tom Morris game 2.,Jeopardy,"(1, 2)",WILL...OF...FORTUNE!,27,"(400,)",False,"This veteran actor loves to say his name as ""Boston Legal"" lawyer Denny Crane",William Shatner,1,0
5453,2008-04-30,Tom Morris game 2.,Jeopardy,"(2, 2)",BRITISH ROCKERS,2,"(400,)",False,"In 2008, at the 50th Grammy Awards, this Amy Winehouse hit won Song of the Year","""Rehab""",1,0
5453,2008-04-30,Tom Morris game 2.,Jeopardy,"(3, 2)",ANIMAL COMMON BONDS,17,"(400,)",False,"Jersey,Red poll,Angus",cows (or cattle),1,0
5453,2008-04-30,Tom Morris game 2.,Jeopardy,"(4, 2)",BATTLES,11,"(400,)",False,"This foolhardy ""charge"" took place at 1854's Battle of Balaklava during the Crimean War",the Charge of the Light Brigade,1,0
5453,2008-04-30,Tom Morris game 2.,Jeopardy,"(5, 2)",STUPID ANSWERS,22,"(400,)",False,"Carvings of a bell & a star are featured on her gravestone in Porum, Oklahoma",Belle Starr,1,0
5453,2008-04-30,Tom Morris game 2.,Jeopardy,"(6, 2)",3-LETTER WORDS,6,"(400,)",False,"In Psalms, ""thy"" this ""and thy staff they comfort me""",rod,1,0
5453,2008-04-30,Tom Morris game 2.,Jeopardy,"(1, 3)",WILL...OF...FORTUNE!,28,"(600,)",False,In 1666 this Quaker who founded an American colony went to Ireland to manage his father's estates,William Penn,1,0
5453,2008-04-30,Tom Morris game 2.,Jeopardy,"(2, 3)",BRITISH ROCKERS,3,"(600,)",False,"This Beatles song begins, ""When I find myself in times of trouble, Mother Mary comes to me""","""Let It Be""",1,0
5453,2008-04-30,Tom Morris game 2.,Jeopardy,"(3, 3)",ANIMAL COMMON BONDS,18,"(600,)",False,"Bushmaster,Coral,Hognose",snakes,1,0
5453,2008-04-30,Tom Morris game 2.,Jeopardy,"(4, 3)",BATTLES,12,"(1000,)",True,"In the 490 B.C. battle of this plain, the Greeks ran up their first important victory over the Persians",Marathon,0,1
5453,2008-04-30,Tom Morris game 2.,Jeopardy,"(5, 3)",STUPID ANSWERS,23,"(600,)",False,In 1976 Marcel Marceau had the only spoken line in this otherwise silent movie,Silent Movie,1,0
5453,2008-04-30,Tom Morris game 2.,Jeopardy,"(6, 3)",3-LETTER WORDS,7,"(600,)",False,A sweet potato lookalike,yam,1,0
5453,2008-04-30,Tom Morris game 2.,Jeopardy,"(1, 4)",WILL...OF...FORTUNE!,29,"(800,)",False,"In an opera, he was fortunate--& skilled--enough to shoot an arrow into an apple (& later, into the evil Gessler)",William Tell,1,0
5453,2008-04-30,Tom Morris game 2.,Jeopardy,"(2, 4)",BRITISH ROCKERS,4,"(800,)",False,"Born in Belfast, he sang lead for the group Them before scoring hits on his own like ""Brown Eyed Girl""",Van Morrison,1,0
5453,2008-04-30,Tom Morris game 2.,Jeopardy,"(3, 4)",ANIMAL COMMON BONDS,19,"(800,)",False,"Bufflehead,Eider,Teal",ducks,1,0
5453,2008-04-30,Tom Morris game 2.,Jeopardy,"(4, 4)",BATTLES,13,"(800,)",False,England's King Harold II lost the all-important Battle of Hastings in this year,1066,1,0
5453,2008-04-30,Tom Morris game 2.,Jeopardy,"(5, 4)",STUPID ANSWERS,24,"(800,)",False,Physician Robert Graves first identified this disease in 1835,Graves\' Disease,1,0
5453,2008-04-30,Tom Morris game 2.,Jeopardy,"(6, 4)",3-LETTER WORDS,8,"(800,)",False,"To a criminal, this slang term can mean ""diamonds"" or ""to kill"", so be specific when taking out a contract",ice,1,0
5453,2008-04-30,Tom Morris game 2.,Jeopardy,"(1, 5)",WILL...OF...FORTUNE!,30,"(1000,)",False,This orator & Nebraska representative opposed the gold standard & urged the free coinage of silver,William Jennings Bryan,1,0
5453,2008-04-30,Tom Morris game 2.,Jeopardy,"(2, 5)",BRITISH ROCKERS,15,"(1000,)",False,"In hits like ""Tuesday Afternoon"" from ""Days of Future Passed"", this band blended rock and classical sounds",The Moody Blues,1,0
5453,2008-04-30,Tom Morris game 2.,Jeopardy,"(3, 5)",ANIMAL COMMON BONDS,20,"(1000,)",False,"Green tree,Leopard,Bull",frogs,1,0
5453,2008-04-30,Tom Morris game 2.,Jeopardy,"(4, 5)",BATTLES,14,"(1000,)",False,"""2 ships, 2 brigs, 1 schooner & 1 sloop"" were the fleet defeated in this battle in the War of 1812",the Battle of Lake Erie,0,3
5453,2008-04-30,Tom Morris game 2.,Jeopardy,"(5, 5)",STUPID ANSWERS,25,"(1000,)",False,Since 1970 the General Synod has governed this church of England,the Anglican Church (aka the Church of England),1,0
5453,2008-04-30,Tom Morris game 2.,Jeopardy,"(6, 5)",3-LETTER WORDS,9,"(1000,)",False,One female gamete,an egg,1,0
5453,2008-04-30,Tom Morris game 2.,Double Jeopardy,"(1, 1)",WHEELS OF FORTUNE,18,"(400,)",False,"The hood ornament, the Spirit of Ecstasy, can retract with a button push on some cars made by this company",Rolls-Royce,1,0
5453,2008-04-30,Tom Morris game 2.,Double Jeopardy,"(2, 1)",DIDN'T DIRECT IT,1,"(400,)",False,"Francis Coppola:""The Conversation"",""The Deer Hunter"",""The Cotton Club""",The Deer Hunter,1,2
5453,2008-04-30,Tom Morris game 2.,Double Jeopardy,"(3, 1)",MUSIC APPRECIATION,6,"(400,)",False,In 1717 this oratorio composer found a position writing music for the future Duke of Chandos,Handel,0,3
5453,2008-04-30,Tom Morris game 2.,Double Jeopardy,"(4, 1)",COLORFUL SCIENCE,8,"(400,)",False,"A likely problem at traffic signals, the defect called deuteranopia usually causes confusion of red & this color",green,1,0
5453,2008-04-30,Tom Morris game 2.,Double Jeopardy,"(5, 1)",LITERARY TITLE PAIRS,23,"(400,)",False,"1871:""...and the Pussycat""",The Owl,1,0
5453,2008-04-30,Tom Morris game 2.,Double Jeopardy,"(6, 1)","KILLER ""AP""s",13,"(400,)",False,A supernatural appearance of a person or thing,an apparition,1,0
5453,2008-04-30,Tom Morris game 2.,Double Jeopardy,"(1, 2)",WHEELS OF FORTUNE,19,"(800,)",False,"Budget shoppers go for the $200,000 CL65 AMG; you might want the $500,000 SLR McLaren from this German brand",Mercedes(-Benz),1,0
5453,2008-04-30,Tom Morris game 2.,Double Jeopardy,"(2, 2)",DIDN'T DIRECT IT,2,"(800,)",False,"Martin Scorsese:""Platoon"",""Cape Fear"",""The Last Temptation of Christ""",Platoon,1,0
5453,2008-04-30,Tom Morris game 2.,Double Jeopardy,"(3, 2)",MUSIC APPRECIATION,7,"(800,)",False,"A French term for a ""rocking chair"", berceuse is also a synonym for this type of piece often sung softly while rocking",a lullaby,1,1
5453,2008-04-30,Tom Morris game 2.,Double Jeopardy,"(4, 2)",COLORFUL SCIENCE,9,"(800,)",False,"A prism breaks sunlight into the visible part of this, containing all the colors of the rainbow",the spectrum,1,0
5453,2008-04-30,Tom Morris game 2.,Double Jeopardy,"(5, 2)",LITERARY TITLE PAIRS,24,"(800,)",False,"1961:""...and the Ecstasy""",The Agony,1,0
5453,2008-04-30,Tom Morris game 2.,Double Jeopardy,"(6, 2)","KILLER ""AP""s",14,"(800,)",False,It's an inflammation of the vermiform organ found in the abdomen,appendicitis,1,0
5453,2008-04-30,Tom Morris game 2.,Double Jeopardy,"(1, 3)",WHEELS OF FORTUNE,20,"(1200,)",False,This car company's Enzo is named for its founder; there was a crash in 2006 of a $1 mil. model in Malibu,Ferrari,1,0
5453,2008-04-30,Tom Morris game 2.,Double Jeopardy,"(2, 3)",DIDN'T DIRECT IT,3,"(1200,)",False,"Stanley Kubrick:""The Sting"",""The Killing"",""Killer's Kiss""",The Sting,1,2
5453,2008-04-30,Tom Morris game 2.,Double Jeopardy,"(3, 3)",MUSIC APPRECIATION,28,"(1200,)",False,"Italian for ""half"", this prefix often precedes forte & soprano",mezzo-,1,0
5453,2008-04-30,Tom Morris game 2.,Double Jeopardy,"(4, 3)",COLORFUL SCIENCE,10,"(1200,)",False,This reddish metal is a main ingredient of both brass & bronze,copper,1,0
5453,2008-04-30,Tom Morris game 2.,Double Jeopardy,"(5, 3)",LITERARY TITLE PAIRS,25,"(1200,)",False,"1937:""...and Daniel Webster""",The Devil,1,0
5453,2008-04-30,Tom Morris game 2.,Double Jeopardy,"(6, 3)","KILLER ""AP""s",15,"(1200,)",False,"It's a lack of interest in, or emotion for, something that others find exciting",apathy,1,0
5453,2008-04-30,Tom Morris game 2.,Double Jeopardy,"(1, 4)",WHEELS OF FORTUNE,21,"(1600,)",False,"You'll want to soup up the 911 Turbo Cabriolet by this company, as the base price is just $136,500",Porsche,1,0
5453,2008-04-30,Tom Morris game 2.,Double Jeopardy,"(2, 4)",DIDN'T DIRECT IT,4,"(1600,)",False,"David Lean:""Ben-Hur"",""Lawrence of Arabia"",""The Bridge on the River Kwai""",Ben-Hur,0,3
5453,2008-04-30,Tom Morris game 2.,Double Jeopardy,"(3, 4)",MUSIC APPRECIATION,29,"(1000,)",True,It's the part of a wind instrument that's called an embouchure,the mouthpiece,1,0
5453,2008-04-30,Tom Morris game 2.,Double Jeopardy,"(4, 4)",COLORFUL SCIENCE,11,"(2400,)",True,"In violet, this distance is a short 3,800 to 4,500 angstroms",wavelength,1,0
5453,2008-04-30,Tom Morris game 2.,Double Jeopardy,"(5, 4)",LITERARY TITLE PAIRS,26,"(1600,)",False,"1953:""...and Sympathy""",Tea,1,0
5453,2008-04-30,Tom Morris game 2.,Double Jeopardy,"(6, 4)","KILLER ""AP""s",16,"(1600,)",False,"Sounding like something found in a kitchen, it's a prosthetic used in filmmaking, like a fake nose",an appliance,0,3
5453,2008-04-30,Tom Morris game 2.,Double Jeopardy,"(1, 5)",WHEELS OF FORTUNE,22,"(2000,)",False,"As the founder was born under the sign of Taurus, this sports car company uses the bull as its symbol",Lamborghini,1,0
5453,2008-04-30,Tom Morris game 2.,Double Jeopardy,"(2, 5)",DIDN'T DIRECT IT,5,"(2000,)",False,"Sam Raimi:""Army of Darkness"",""The Quick and the Dead"",""Terminator 3""",Terminator 3,1,1
5453,2008-04-30,Tom Morris game 2.,Double Jeopardy,"(3, 5)",MUSIC APPRECIATION,30,"(2000,)",False,"The name of this small harpsichord may come from the Latin for ""rod"" or for ""maiden""",a virginal,0,3
5453,2008-04-30,Tom Morris game 2.,Double Jeopardy,"(4, 5)",COLORFUL SCIENCE,12,"(2000,)",False,"2 colors called this aren't praising each other, they're directly opposite each other on a color wheel",complementary,1,0
5453,2008-04-30,Tom Morris game 2.,Double Jeopardy,"(5, 5)",LITERARY TITLE PAIRS,27,"(2000,)",False,"1961:""...and Zooey""",Franny,1,0
5453,2008-04-30,Tom Morris game 2.,Double Jeopardy,"(6, 5)","KILLER ""AP""s",17,"(2000,)",False,It's the point farthest from the Earth in the orbit of a body traveling around it,apogee,1,0
5453,2008-04-30,Tom Morris game 2.,Final Jeopardy,"(1, 1)",BUSINESS,0,"(9950, 10000, 14000)",False,"In 1952 Glen Bell was selling burgers; he then added these to the drive-in menu for 19¢, & the rest is history",tacos,1,2
