epNum,airDate,extra_info,round_name,coord,category,order,value,daily_double,question,answer,correctAttempts,wrongAttempts
547,1987-01-13,,Jeopardy,"(1, 1)",TECHNOLOGY,17,"(100,)",False,"Originally intended for lab use, his burner advanced gas lighting technology",Robert Bunsen,1,0
547,1987-01-13,,Jeopardy,"(2, 1)",POTENT POTABLES,13,"(100,)",False,It puts the kick in Welsh Rabbit,beer,0,3
547,1987-01-13,,Jeopardy,"(3, 1)",CELEBRITY SECRETS,1,"(100,)",False,"When this partner died in 1959, Bud Abbott was suing him for unpaid royalties",Lou Costello,1,0
547,1987-01-13,,Jeopardy,"(4, 1)",EASY OPERA,7,"(100,)",False,"In Wagner's ""Ring Cycle"", a coveted ring made of this allows its owner to rule the world",gold,0,3
547,1987-01-13,,Jeopardy,"(5, 1)",SPORTS TRIVIA,6,"(100,)",False,L.A. Times says more NBA coaches were born in this N.Y. borough than any other U.S. city,Brooklyn,1,0
547,1987-01-13,,Jeopardy,"(6, 1)",ACCORDING TO SPOCK,2,"(100,)",False,This traditional form of punishment may be a major reason for excessive violence in U.S.,spanking,1,0
547,1987-01-13,,Jeopardy,"(1, 2)",TECHNOLOGY,18,"(200,)",False,"In 1877, to carry meat to France, the ""Frigorifique"" became 1st ship equipped with this",refrigeration,1,0
547,1987-01-13,,Jeopardy,"(2, 2)",POTENT POTABLES,14,"(200,)",False,"Lying north of Burgundy & east of Paris, this region turns its black pinot noir grapes into sparkling wines",Champagne,1,0
547,1987-01-13,,Jeopardy,"(3, 2)",CELEBRITY SECRETS,3,"(200,)",False,"Yoko Ono said it was these 4 who ""broke up the Beatles""",The Beatles,0,3
547,1987-01-13,,Jeopardy,"(4, 2)",EASY OPERA,8,"(200,)",False,"Of tragic, comic, or dramatic, the style of ""Opera Buffa""",comic,1,0
547,1987-01-13,,Jeopardy,"(5, 2)",SPORTS TRIVIA,10,"(200,)",False,"Born in Panama, this former Angels 1st baseman considers himself Jewish",Rod Carew,1,0
547,1987-01-13,,Jeopardy,"(6, 2)",ACCORDING TO SPOCK,5,"(200,)",False,"So that a playpen isn't regarded as a prison, a baby should get used to it before he learns to do this",crawl,1,1
547,1987-01-13,,Jeopardy,"(1, 3)",TECHNOLOGY,19,"(300,)",False,Gasoline engines commonly use a fuel injector or this to mix fuel & air,carburetor,1,0
547,1987-01-13,,Jeopardy,"(3, 3)",CELEBRITY SECRETS,4,"(300,)",False,"While stranded on an island, this ""Baby Doll"" bit the head off a lizard & drank its ""juice""",Carroll Baker,0,3
547,1987-01-13,,Jeopardy,"(4, 3)",EASY OPERA,9,"(300,)",False,"""La Sonnambula"" is about a lady whose presence in the wrong man's bedroom is merely a case of this",sleepwalking,1,0
547,1987-01-13,,Jeopardy,"(5, 3)",SPORTS TRIVIA,11,"(300,)",False,"Of calfskin, goatskin, or horsehide, covering used on jai alai balls",goatskin,0,3
547,1987-01-13,,Jeopardy,"(6, 3)",ACCORDING TO SPOCK,25,"(300,)",False,"Of often, occasionally, or never, how often a child should be allowed to sleep with parents in their bed",never,1,1
547,1987-01-13,,Jeopardy,"(1, 4)",TECHNOLOGY,20,"(400,)",False,This alloy was cast into tools even before 3000 B.C.,bronze,1,0
547,1987-01-13,,Jeopardy,"(3, 4)",CELEBRITY SECRETS,15,"(400,)",False,"His ex-wife Anna Kashfi wrote that this ""Sayonara"" star made her dress like a geisha & wait on him",Marlon Brando,1,0
547,1987-01-13,,Jeopardy,"(4, 4)",EASY OPERA,21,"(400,)",False,"At the end of Mozart's opera of the same name, this famous lover is dragged into hell by a statue",Don Juan (Don Giovanni),1,1
547,1987-01-13,,Jeopardy,"(5, 4)",SPORTS TRIVIA,12,"(400,)",False,"Surprisingly, Encyclopedia International says Aussies took up this sport 30 years before the Swiss",skiing,1,0
547,1987-01-13,,Jeopardy,"(6, 4)",ACCORDING TO SPOCK,26,"(400,)",False,"When washing diapers, this shouldn't be used, as it leaves a coating which decreases absorbency",fabric softener,0,3
547,1987-01-13,,Jeopardy,"(1, 5)",TECHNOLOGY,22,"(600,)",True,"To keep son from falling off his tricycle, veterinarian John Dunlop improved the tires this way",filling them with air (pneumatic tires),0,1
547,1987-01-13,,Jeopardy,"(3, 5)",CELEBRITY SECRETS,23,"(500,)",False,"In ""Please Don't Shoot My Dog"", this child star said he was 17 when Joan Crawford seduced him",Jackie Cooper,1,0
547,1987-01-13,,Jeopardy,"(4, 5)",EASY OPERA,24,"(500,)",False,"NBC's Italian maestro who, at age 19, replaced an unpopular conductor & did ""Aida"" from memory",Arturo Toscanini,1,0
547,1987-01-13,,Jeopardy,"(5, 5)",SPORTS TRIVIA,16,"(500,)",False,"Number worn by Sandy Koufax, O.J. Simpson, & Magic Johnson",32,1,0
547,1987-01-13,,Double Jeopardy,"(1, 1)",NATURE,21,"(200,)",False,"While flora refers to the plants of a certain region or time, this word refers to the animals",fauna,1,0
547,1987-01-13,,Double Jeopardy,"(2, 1)",MOVIE ROYALTY,2,"(200,)",False,"The evil queen in ""Snow White"" was obsessed with the beauty opinions of this household object",mirror,1,0
547,1987-01-13,,Double Jeopardy,"(3, 1)",TRAVEL & TOURISM,7,"(200,)",False,"From atop the Danube Tower in this city, one can see the Spanish Riding School",Vienna,1,0
547,1987-01-13,,Double Jeopardy,"(4, 1)",WOMEN AUTHORS,16,"(200,)",False,"This ""Little Chickadee"" got thrown in jail for ""Sex"", a 1926 play she not only starred in, but wrote",Mae West,1,0
547,1987-01-13,,Double Jeopardy,"(5, 1)",REMEMBER DISCO?,11,"(200,)",False,"Alicia Bridges sang, ""I love the nightlife, I've got to"" do this",boogie,1,0
547,1987-01-13,,Double Jeopardy,"(6, 1)","""B.S.""",1,"(200,)",False,The degree,Bachelor of Science,1,0
547,1987-01-13,,Double Jeopardy,"(1, 2)",NATURE,22,"(400,)",False,Mosquitoes will only lay their eggs in or near this,water,1,0
547,1987-01-13,,Double Jeopardy,"(2, 2)",MOVIE ROYALTY,3,"(400,)",False,"He was Philip II of Spain in ""Fire over England"" but was more famous for playing Lincoln",Raymond Massey,1,0
547,1987-01-13,,Double Jeopardy,"(3, 2)",TRAVEL & TOURISM,8,"(400,)",True,Continent on which you'd find 2nd-largest French-speaking city in the world,North America (Montreal),1,0
547,1987-01-13,,Double Jeopardy,"(4, 2)",WOMEN AUTHORS,17,"(400,)",False,"She wrote ""Out of the Dark"" & ""Teacher: Anne Sullivan Macy"" about the woman who led her out of the dark",Helen Keller,1,0
547,1987-01-13,,Double Jeopardy,"(5, 2)",REMEMBER DISCO?,12,"(400,)",False,"After this ""Disco Queen"" recorded ""I Will Survive"", she never had another hit",Gloria Gaynor,1,0
547,1987-01-13,,Double Jeopardy,"(6, 2)","""B.S.""",26,"(400,)",False,Passage which connects the Pacific Ocean to the Arctic Ocean,Bering Strait,1,0
547,1987-01-13,,Double Jeopardy,"(1, 3)",NATURE,23,"(600,)",False,"If you see a gibbon brachiating, you're watching him do this",swinging through the trees,0,3
547,1987-01-13,,Double Jeopardy,"(2, 3)",MOVIE ROYALTY,4,"(600,)",False,"The French or the Egyptian actor cast as Austrian Crown Prince Rudolf in '36 & '68 versions of ""Mayerling""",Omar Sharif (or Charles Boyer),1,0
547,1987-01-13,,Double Jeopardy,"(3, 3)",TRAVEL & TOURISM,9,"(600,)",False,Glass collectors might bring home some Kosta Boda or Orrefors crystal from this country,Sweden,1,0
547,1987-01-13,,Double Jeopardy,"(4, 3)",WOMEN AUTHORS,18,"(600,)",False,"Baroness Blixen never ran ""out of"" pen names using ""Osceola"" before & ""Pierre Andrezel"" after this one",Isak Dinesen,1,0
547,1987-01-13,,Double Jeopardy,"(5, 3)",REMEMBER DISCO?,13,"(600,)",False,"Disco singer who traded in her childhood nickname, ""Bubbles"", for ""Champagne""",Evelyn King,1,0
547,1987-01-13,,Double Jeopardy,"(6, 3)","""B.S.""",27,"(600,)",False,"Cary Grant & Shirley Temple were ""The Bachelor & ..."" her",the Bobby-Soxer,1,0
547,1987-01-13,,Double Jeopardy,"(1, 4)",NATURE,24,"(800,)",False,"In ""A Native Diary"", this author of ""Watership Down"" recorded stories of his daily rambles",Richard Adams,1,0
547,1987-01-13,,Double Jeopardy,"(2, 4)",MOVIE ROYALTY,5,"(800,)",False,"Robert Morley tried to have his cake & eat it, too, as this king in ""Marie Antoinette""",Louis XVI,1,0
547,1987-01-13,,Double Jeopardy,"(3, 4)",TRAVEL & TOURISM,10,"(800,)",False,"If you want to retrace Andy & Fergie's honeymoon, hop on the ""Britannia"" & cruise these Port. islands",Azores,1,0
547,1987-01-13,,Double Jeopardy,"(4, 4)",WOMEN AUTHORS,19,"(800,)",False,"""Life with Jackie"" was Irving Mansfield's memoir of this best-selling wife",Jacqueline Susann,1,0
547,1987-01-13,,Double Jeopardy,"(5, 4)",REMEMBER DISCO?,14,"(800,)",False,"Some called it ""Dueling Divas"" when Summer & Streisand recorded this disco duet in 1979","""Enough is Enough""",1,0
547,1987-01-13,,Double Jeopardy,"(6, 4)","""B.S.""",28,"(800,)",False,Noel Coward play about the haunting of a man by his 1st wife while he lives with his 2nd,"""Blithe Spirit""",1,0
547,1987-01-13,,Double Jeopardy,"(2, 5)",MOVIE ROYALTY,6,"(1000,)",False,"Dressed in men's clothes, Garbo played not a drag queen but this Swedish queen",Queen Christina,1,0
547,1987-01-13,,Double Jeopardy,"(3, 5)",TRAVEL & TOURISM,25,"(1000,)",False,"What any of the 3 letters stand for in the French airline, UTA",Union de Transports Aeriens,0,3
547,1987-01-13,,Double Jeopardy,"(4, 5)",WOMEN AUTHORS,20,"(1000,)",False,"Feminist author of ""The Female Eunuch"", she married 1 of Cosmopolitan's 1st nude male centerfolds",Germaine Greer,1,0
547,1987-01-13,,Double Jeopardy,"(5, 5)",REMEMBER DISCO?,15,"(1000,)",True,(Audio Daily Double)Beethoven might well have rolled over hearing the music set to a disco beat on this album:,"""Hooked on Classics""",0,1
547,1987-01-13,,Double Jeopardy,"(6, 5)","""B.S.""",29,"(1000,)",False,"U.S. military decoration, instituted in 1944, awarded for heroism",Bronze Star,1,0
547,1987-01-13,,Final Jeopardy,"(1, 1)",THE CENSUS,0,"(1198, 4100, 5101)",False,"Of the 10 largest cities in population in the U.S., 3 are in this state","Texas (Dallas, Houston & San Antonio)",0,3
