epNum,airDate,extra_info,round_name,coord,category,order,value,daily_double,question,answer,correctAttempts,wrongAttempts
5479,2008-06-05,Donna Vogel game 1.,Jeopardy,"(1, 1)",AMERICAN LIT,1,"(200,)",False,"In a poem by Longfellow, Hiawatha's marriage to her is no laughing matter",Minnehaha,1,0
5479,2008-06-05,Donna Vogel game 1.,Jeopardy,"(2, 1)",ALL NATURAL EATS,3,"(200,)",False,American pioneer John Chapman would press you to eat this fruit & would plant the seeds to make orchards,the apple,1,0
5479,2008-06-05,Donna Vogel game 1.,Jeopardy,"(3, 1)",GOVERNMENT,9,"(200,)",False,"It's the term of office of Ohio state representatives--come on, take a guess",2 years,1,0
5479,2008-06-05,Donna Vogel game 1.,Jeopardy,"(4, 1)",THEY SAID IT,24,"(200,)",False,"This oft-divorced Hungarian said, ""I am a marvelous housekeeper. Every time I leave a man, I keep his house""",Zsa Zsa Gabor,1,0
5479,2008-06-05,Donna Vogel game 1.,Jeopardy,"(5, 1)",CASING YOUR STATE,20,"(200,)",False,"In 1864 its capital moved from Fort Whipple to Prescott, which lost the honor in 1867, then got it back in 1877",Arizona,0,3
5479,2008-06-05,Donna Vogel game 1.,Jeopardy,"(6, 1)",FROM THE FRENCH,16,"(200,)",False,"This word for a type of business like Quizno's comes from the French for ""free""",a franchise,1,1
5479,2008-06-05,Donna Vogel game 1.,Jeopardy,"(1, 2)",AMERICAN LIT,2,"(400,)",False,"In this 1959 William Gibson drama, Helen Keller realizes things have names",The Miracle Worker,1,1
5479,2008-06-05,Donna Vogel game 1.,Jeopardy,"(2, 2)",ALL NATURAL EATS,4,"(400,)",False,"Eat some orange vegetables, like the acorn, butternut & hubbard types of this gourd",a squash,1,0
5479,2008-06-05,Donna Vogel game 1.,Jeopardy,"(3, 2)",GOVERNMENT,10,"(400,)",False,"In both NYC & L.A., the mayor is the chief executive & this is the main legislative body",the city council,1,0
5479,2008-06-05,Donna Vogel game 1.,Jeopardy,"(4, 2)",THEY SAID IT,26,"(400,)",False,"This country star said she's not offended by dumb blonde jokes: ""I know... I'm not dumb... I also know I'm not blonde""",Dolly Parton,1,0
5479,2008-06-05,Donna Vogel game 1.,Jeopardy,"(5, 2)",CASING YOUR STATE,21,"(400,)",False,A then 1 1/2-mile horse race was inaugurated in this state in 1875; Aristides won by 2 lengths,Kentucky,1,0
5479,2008-06-05,Donna Vogel game 1.,Jeopardy,"(6, 2)",FROM THE FRENCH,17,"(400,)",False,"The name of this rodent that hibernates nearly half the year may come from the French for ""sleep""",a dormouse,1,0
5479,2008-06-05,Donna Vogel game 1.,Jeopardy,"(1, 3)",AMERICAN LIT,5,"(600,)",False,"""Living By The Word"" is a collection of prose pieces by this author of ""The Color Purple""",Alice Walker,1,0
5479,2008-06-05,Donna Vogel game 1.,Jeopardy,"(2, 3)",ALL NATURAL EATS,6,"(600,)",False,"Eat spears of this green vegetable, but not the same-named fern, which is a houseplant",asparagus,1,0
5479,2008-06-05,Donna Vogel game 1.,Jeopardy,"(3, 3)",GOVERNMENT,11,"(600,)",False,The USA's oldest appellate court in continuous existence is this highest body in Massachusetts,the Supreme Court of Massachusetts,1,0
5479,2008-06-05,Donna Vogel game 1.,Jeopardy,"(4, 3)",THEY SAID IT,27,"(600,)",False,"The witticism A verbal agreement isn't worth the paper it's printed on"" is attributed to this film pioneer",Samuel Goldwyn,0,3
5479,2008-06-05,Donna Vogel game 1.,Jeopardy,"(5, 3)",CASING YOUR STATE,22,"(600,)",False,"Don't go nuclear on us, but the federal government owns about 85% of this state's land",Nevada,1,1
5479,2008-06-05,Donna Vogel game 1.,Jeopardy,"(6, 3)",FROM THE FRENCH,18,"(600,)",False,"This elaborate sumptuous meal takes its name from the French for ""little bench""",a banquet,0,3
5479,2008-06-05,Donna Vogel game 1.,Jeopardy,"(1, 4)",AMERICAN LIT,12,"(800,)",False,"Sinclair Lewis' real estate salesman who's ""never done a single thing I've wanted to do in my whole life""",(George) Babbitt,1,0
5479,2008-06-05,Donna Vogel game 1.,Jeopardy,"(2, 4)",ALL NATURAL EATS,7,"(800,)",False,"They have no flavor or aroma, but cloud ears, a type of this, are used in many Chinese dishes for their texture",a mushroom,1,0
5479,2008-06-05,Donna Vogel game 1.,Jeopardy,"(3, 4)",GOVERNMENT,14,"(800,)",False,"Created in 1914, this commission works to maintain competition & protect customers",the F.T.C. (the Federal Trade Commission),1,0
5479,2008-06-05,Donna Vogel game 1.,Jeopardy,"(4, 4)",THEY SAID IT,28,"(800,)",False,"Trailing in the GOP nomination race in 2008, this Arkansan said, ""I didn't major in math--I majored in miracles""",Huckabee,1,0
5479,2008-06-05,Donna Vogel game 1.,Jeopardy,"(5, 4)",CASING YOUR STATE,23,"(1000,)",True,Hop over to Grasshopper Glacier in this state's Custer National Forest; you can still see 'em in the ice,Montana,0,1
5479,2008-06-05,Donna Vogel game 1.,Jeopardy,"(6, 4)",FROM THE FRENCH,19,"(800,)",False,"The name of this type of silk is from the French for ""curled""",crêpe,0,3
5479,2008-06-05,Donna Vogel game 1.,Jeopardy,"(1, 5)",AMERICAN LIT,13,"(1000,)",False,"""Lost Laysen"" is a once-lost novella that this ""Gone With The Wind"" author wrote when she was just 16",Margaret Mitchell,1,0
5479,2008-06-05,Donna Vogel game 1.,Jeopardy,"(2, 5)",ALL NATURAL EATS,8,"(1000,)",False,"Whether it's the pascal or golden variety of this vegetable, its name comes from the Greek for ""parsley""",celery,1,0
5479,2008-06-05,Donna Vogel game 1.,Jeopardy,"(3, 5)",GOVERNMENT,15,"(1000,)",False,"Some say the Bush administration's domestic spying conflicts with FISA, the Foreign Intelligence this Act",Surveillance,1,0
5479,2008-06-05,Donna Vogel game 1.,Jeopardy,"(4, 5)",THEY SAID IT,29,"(1000,)",False,"""Brevity is the soul of lingerie"" is attributed to this ""Round Table"" wit",Dorothy Parker,1,0
5479,2008-06-05,Donna Vogel game 1.,Jeopardy,"(5, 5)",CASING YOUR STATE,25,"(1000,)",False,"(Cheryl of the Clue Crew stands next to a Seeing Eye dog.) While there are other schools, only dogs trained at The Seeing Eye's Morristown location in this East Coast state can rightly be called Seeing Eye dogs",New Jersey,1,0
5479,2008-06-05,Donna Vogel game 1.,Double Jeopardy,"(1, 1)",HBO,26,"(400,)",False,"""Big Love"", about a polygamist & his 3 wives, is set in this state",Utah,1,0
5479,2008-06-05,Donna Vogel game 1.,Double Jeopardy,"(2, 1)","""BIG"" LOVE",4,"(400,)",False,"In a classic children's story, he tries to get the 3 little pigs & instead ends up in a pot of boiling water",the Big Bad Wolf,1,0
5479,2008-06-05,Donna Vogel game 1.,Double Jeopardy,"(3, 1)",EXTRAS,11,"(400,)",False,Koalas are fussy eaters & dine almost exclusively on the leaves of this genus of trees in the myrtle family,eucalyptus,1,0
5479,2008-06-05,Donna Vogel game 1.,Double Jeopardy,"(4, 1)",ROME,1,"(400,)",False,Roman candidates for public office made these whiter by rubbing them with chalk; black ones were worn at funerals,togas,1,0
5479,2008-06-05,Donna Vogel game 1.,Double Jeopardy,"(5, 1)",OZ,18,"(400,)",False,"The MGM classic ""The Wizard of Oz"" premiered in August of this year",1939,1,0
5479,2008-06-05,Donna Vogel game 1.,Double Jeopardy,"(6, 1)",SIX FEET UNDER,16,"(400,)",False,"A statue at his memorial reads, ""I never met a man I didn't like""",Will Rogers,1,0
5479,2008-06-05,Donna Vogel game 1.,Double Jeopardy,"(1, 2)",HBO,27,"(800,)",False,"On ""Extras"", this British heartthrob sent himself up by acting jealous of one of his ""Pirates"" co-stars",Orlando Bloom,1,0
5479,2008-06-05,Donna Vogel game 1.,Double Jeopardy,"(2, 2)","""BIG"" LOVE",7,"(800,)",False,"Rooseveltian partner of ""speak softly""",big stick,1,0
5479,2008-06-05,Donna Vogel game 1.,Double Jeopardy,"(3, 2)",EXTRAS,12,"(800,)",False,"In one production of the ballet ""Cinderella"", Robert Helpmann & Frederick Ashton danced the parts of these 2 meanies",the ugly stepsisters,1,0
5479,2008-06-05,Donna Vogel game 1.,Double Jeopardy,"(4, 2)",ROME,2,"(800,)",False,"In the mid-1st century, Rome was trading one amphora of this for one slave from Gaul",wine,1,1
5479,2008-06-05,Donna Vogel game 1.,Double Jeopardy,"(5, 2)",OZ,22,"(800,)",False,"""The Wizard of Oz"" won 2 Oscars, one for Original Score & one for Best Song--this one almost cut from the film","""Over The Rainbow""",1,0
5479,2008-06-05,Donna Vogel game 1.,Double Jeopardy,"(6, 2)",SIX FEET UNDER,17,"(800,)",False,"""The best is yet to come"" says this swingin' singer's grave in California's Desert Memorial Park",(Frank) Sinatra,1,0
5479,2008-06-05,Donna Vogel game 1.,Double Jeopardy,"(1, 3)",HBO,28,"(1200,)",False,"On the 7th episode of ""Rome"", this warring general & rival of Julius Caesar is killed after fleeing to Egypt",Pompey,1,1
5479,2008-06-05,Donna Vogel game 1.,Double Jeopardy,"(2, 3)","""BIG"" LOVE",8,"(1200,)",False,Bogey played Philip Marlowe in this 1946 big screener,The Big Sleep,1,0
5479,2008-06-05,Donna Vogel game 1.,Double Jeopardy,"(3, 3)",EXTRAS,13,"(1200,)",False,"An apple that the USDA grades ""extra"" this doesn't have a ribbon on it but is mature, clean & well-formed",fancy,1,0
5479,2008-06-05,Donna Vogel game 1.,Double Jeopardy,"(4, 3)",ROME,3,"(1200,)",False,"The domus was a single-family house, & insulae were a block or blocks of these",apartments,1,0
5479,2008-06-05,Donna Vogel game 1.,Double Jeopardy,"(5, 3)",OZ,23,"(1200,)",False,"In 2000 a whopping $666,000 was paid by a collector for a pair of these worn in the film",ruby slippers,1,0
5479,2008-06-05,Donna Vogel game 1.,Double Jeopardy,"(6, 3)",SIX FEET UNDER,19,"(1200,)",False,"New Englander whose epitaph, ""I had a lover's quarrel with the world"", is from his poem ""The Lesson For Today""",(Robert) Frost,1,0
5479,2008-06-05,Donna Vogel game 1.,Double Jeopardy,"(1, 4)",HBO,29,"(1600,)",False,"She played a corrections officer on ""Oz"" but is more famous as Tony's dissatisfied wife Carmela Soprano",Edie Falco,0,3
5479,2008-06-05,Donna Vogel game 1.,Double Jeopardy,"(2, 4)","""BIG"" LOVE",9,"(1600,)",False,The state animal of Colorado is a breed of this,a bighorn sheep,1,0
5479,2008-06-05,Donna Vogel game 1.,Double Jeopardy,"(3, 4)",EXTRAS,14,"(1600,)",False,Differences in this bony structure that includes the hip distinguish the sexes & reveal if a woman ever gave birth,the pelvis,1,0
5479,2008-06-05,Donna Vogel game 1.,Double Jeopardy,"(4, 4)",ROME,5,"(3800,)",True,Virgil tells of the travels of this vowel-heavy Trojan prince who laid the groundwork for Rome,Aeneas,1,0
5479,2008-06-05,Donna Vogel game 1.,Double Jeopardy,"(5, 4)",OZ,24,"(1600,)",False,Buddy Ebsen was hired to play this character but had to quit after he developed an allergy to aluminum dust,the Tin Man,1,0
5479,2008-06-05,Donna Vogel game 1.,Double Jeopardy,"(6, 4)",SIX FEET UNDER,20,"(1600,)",False,"His tombstone says, ""He gave to man control over that dreadful scourge, yellow fever""",Walter Reed,1,0
5479,2008-06-05,Donna Vogel game 1.,Double Jeopardy,"(2, 5)","""BIG"" LOVE",10,"(2000,)",False,"In the hobo song, it's the mountain ""where you sleep all day"" & ""where they hung that jerk who invented work""",the Big Rock Candy Mountain,1,0
5479,2008-06-05,Donna Vogel game 1.,Double Jeopardy,"(3, 5)",EXTRAS,15,"(2000,)",False,"A song in this duo's operetta ""Iolanthe"" says, ""What a joy to breathe the balmy air of Grosvenor Square""",Gilbert & Sullivan,1,0
5479,2008-06-05,Donna Vogel game 1.,Double Jeopardy,"(4, 5)",ROME,6,"(2000,)",False,"It's said Romulus founded Rome on this hill, found between the Circus Maximus & the Colosseum",the Palatine,0,3
5479,2008-06-05,Donna Vogel game 1.,Double Jeopardy,"(5, 5)",OZ,25,"(2000,)",False,"Frank Morgan played 5 different roles in the movie: a guard, a professor, a gatekeeper, a cabbie & this",the Wizard,0,3
5479,2008-06-05,Donna Vogel game 1.,Double Jeopardy,"(6, 5)",SIX FEET UNDER,21,"(4000,)",True,"From one of his works, this Irish poet's epitaph is ""Cast a cold eye on life, on death. Horseman, pass by!""",William Butler Yeats,0,1
5479,2008-06-05,Donna Vogel game 1.,Final Jeopardy,"(1, 1)",THE GREAT CHEFS OF EUROPE,0,"(4200, 5999, 13801)",False,"Living from 1846 to 1935, this celebrated Frenchman was known as ""the king of chefs and the chef of kings""",Georges Auguste Escoffier,1,2
