epNum,airDate,extra_info,round_name,coord,category,order,value,daily_double,question,answer,correctAttempts,wrongAttempts
5485,2008-06-13,,Jeopardy,"(1, 1)","""N""ATIONS OF THE WORLD",1,"(200,)",False,Its territory extends 300 miles above the Arctic Circle,Norway,1,0
5485,2008-06-13,,Jeopardy,"(2, 1)",5-LETTER WORDS,18,"(200,)",False,The 2 months that fit the category,March & April,1,1
5485,2008-06-13,,Jeopardy,"(3, 1)",HODGEPODGE,26,"(200,)",False,"This ""feline"" variety of willow tree belongs to the same family as aspens & cottonwoods",the pussy willow,1,0
5485,2008-06-13,,Jeopardy,"(4, 1)",MYTHOLOGY,14,"(200,)",False,"In Incan myth, it was this South American camel relative that warned man about the impending flood",the llama,1,0
5485,2008-06-13,,Jeopardy,"(5, 1)",HERSHEY vs. NESTLE,11,"(200,)",False,Nestle began making this in 1904; they claim to make the very best of it,chocolate,1,0
5485,2008-06-13,,Jeopardy,"(6, 1)",LITTLE LEAGUE BASEBALL,6,"(200,)",False,"(Jimmy pitches one up from Williamsport, PA.) In the major leagues, this goes to about halfway up the torso; in Little League, it goes to the armpits",the strike zone,1,0
5485,2008-06-13,,Jeopardy,"(1, 2)","""N""ATIONS OF THE WORLD",2,"(400,)",False,It stretches from the Gulf of Guinea in the southwest to Lake Chad in the northeast,Nigeria,1,1
5485,2008-06-13,,Jeopardy,"(2, 2)",5-LETTER WORDS,19,"(400,)",False,"A kind of cereal grain, triticale is produced by crossing rye & this",wheat,1,0
5485,2008-06-13,,Jeopardy,"(3, 2)",HODGEPODGE,27,"(400,)",False,Psychologist Otto Rank ranked this trauma as the No. 1 cause of neurosis,birth,0,3
5485,2008-06-13,,Jeopardy,"(4, 2)",MYTHOLOGY,15,"(400,)",False,Go to Ellen in the name books & you'll find it's a form of this name from Greek myth,Helen,1,0
5485,2008-06-13,,Jeopardy,"(5, 2)",HERSHEY vs. NESTLE,12,"(400,)",False,In 1939 Nestle introduced an instant form of this non-milk product,coffee,0,3
5485,2008-06-13,,Jeopardy,"(6, 2)",LITTLE LEAGUE BASEBALL,7,"(400,)",False,"(Jimmy lays another clue down from Williamsport, PA.) Unlike Major League Baseball, Little League batters may use non-wood bats; most are made of this metal that has a distinctive sound when it meets the ball",aluminum,1,0
5485,2008-06-13,,Jeopardy,"(1, 3)","""N""ATIONS OF THE WORLD",3,"(600,)",False,Its territory includes Great Barrier Island & the Antipodes Islands,New Zealand,0,3
5485,2008-06-13,,Jeopardy,"(2, 3)",5-LETTER WORDS,20,"(600,)",False,"As a noun, it's a steep-walled canyon; as a verb, it means to stuff yourself with food",gorge,1,0
5485,2008-06-13,,Jeopardy,"(3, 3)",HODGEPODGE,28,"(600,)",False,10-letter word describing a woman's dress without arm coverings,sleeveless,0,3
5485,2008-06-13,,Jeopardy,"(4, 3)",MYTHOLOGY,21,"(600,)",False,"In Roman myth, this powerful tot killed 2 serpents in his cradle",Hercules,1,0
5485,2008-06-13,,Jeopardy,"(5, 3)",HERSHEY vs. NESTLE,13,"(600,)",False,This peanut butter cup is one of Hershey's bestselling products,Reese\'s,1,0
5485,2008-06-13,,Jeopardy,"(6, 3)",LITTLE LEAGUE BASEBALL,8,"(600,)",False,"(Jimmy reports from a distance from Williamsport, PA.) The distance between the bases in Little League is this many feet, two-thirds that of Major League Baseball",60 feet,1,0
5485,2008-06-13,,Jeopardy,"(1, 4)","""N""ATIONS OF THE WORLD",4,"(800,)",False,"Swampy & indented, its Caribbean shore is aptly called the ""Mosquito Coast""",Nicaragua,1,0
5485,2008-06-13,,Jeopardy,"(2, 4)",5-LETTER WORDS,22,"(800,)",False,"An organism's ecological role in the community, or a recess in the wall for a statue",niche,1,0
5485,2008-06-13,,Jeopardy,"(3, 4)",HODGEPODGE,29,"(800,)",False,"Augusto Pinochet, who ousted Salvador Allende in 1973, led the junta in this country until 1990",Chile,1,0
5485,2008-06-13,,Jeopardy,"(4, 4)",MYTHOLOGY,24,"(1000,)",True,"According to Greek mythology, this horn of plenty is the horn of the goat Amalthea",the cornucopia,1,0
5485,2008-06-13,,Jeopardy,"(5, 4)",HERSHEY vs. NESTLE,16,"(800,)",False,"Now a Hershey's product, Mounds was introduced in 1920; this nutty counterpart didn't appear until 1946",Almond Joy,1,0
5485,2008-06-13,,Jeopardy,"(6, 4)",LITTLE LEAGUE BASEBALL,9,"(800,)",False,"(Jimmy gives us another clue from Williamsport, PA.) Little League games are shorter than big league ones, so as a dramatic moment, as Kyle comes to bat in the last regulation inning, the bottom of this",the sixth inning,1,1
5485,2008-06-13,,Jeopardy,"(1, 5)","""N""ATIONS OF THE WORLD",5,"(1000,)",False,In 1968 the U.N. called for South Africa's withdrawal from the territory that is today this country,Namibia,0,3
5485,2008-06-13,,Jeopardy,"(2, 5)",5-LETTER WORDS,23,"(1000,)",False,"It can be an object from the past, or a personal item associated with a saint",a relic,1,0
5485,2008-06-13,,Jeopardy,"(3, 5)",HODGEPODGE,30,"(1000,)",False,"In 1935 he invented a self-adhesive label, & even though he's gone, his name still sticks with us",(R. Stanton) Avery,1,0
5485,2008-06-13,,Jeopardy,"(4, 5)",MYTHOLOGY,25,"(1000,)",False,Island on which Theseus slew the Minotaur,Crete,1,0
5485,2008-06-13,,Jeopardy,"(5, 5)",HERSHEY vs. NESTLE,17,"(1000,)",False,In 1938 Nestle introduced its Crunch bar & Hershey introduced this rival,Krackel,1,0
5485,2008-06-13,,Jeopardy,"(6, 5)",LITTLE LEAGUE BASEBALL,10,"(1000,)",False,"(Jimmy preserves another one for us from Williamsport, PA.) I'm caught between the bases, and I've gotten myself into one of these; it's also called a pickle, because that's what I'm in",a rundown,1,0
5485,2008-06-13,,Double Jeopardy,"(1, 1)",ITALIAN ART & ARTISTS,7,"(400,)",False,"Add 1 letter to ""Titan"" to get this Renaissance titan known for his nudes",Titian,1,0
5485,2008-06-13,,Double Jeopardy,"(2, 1)",POP MUSIC,3,"(400,)",False,In 1977 they were one of the biggest bands in the world & Steve Miller told us to fly like one of them,The Eagles,1,0
5485,2008-06-13,,Double Jeopardy,"(3, 1)",BUGS,18,"(400,)",False,Give it a month & the may beetle becomes known by this 7-letter name,a junebug,1,0
5485,2008-06-13,,Double Jeopardy,"(4, 1)",WEAR IT WELL,13,"(400,)",False,"Since its 1992 introduction, this cool brand of sneakers with big thick soles has been ""drawing"" business",Skechers,0,3
5485,2008-06-13,,Double Jeopardy,"(5, 1)",LITERARY TRILOGIES,1,"(400,)",False,"He completed a sci-fi trilogy in 1945, a few years before taking us to Narnia",C.S. Lewis,1,0
5485,2008-06-13,,Double Jeopardy,"(6, 1)","""I"" AYE",19,"(400,)",False,This verb form is used for commands,imperative,1,0
5485,2008-06-13,,Double Jeopardy,"(1, 2)",ITALIAN ART & ARTISTS,8,"(800,)",False,This Leonardo fresco painted in a Milan convent dining hall began crumbling & fading during the artist's lifetime,"""The Last Supper""",1,0
5485,2008-06-13,,Double Jeopardy,"(2, 2)",POP MUSIC,4,"(800,)",False,"""You Oughta Know"" that ""Hands Clean"" was the first single from her 2002 CD ""Under Rug Swept""",Alanis Morissette,1,0
5485,2008-06-13,,Double Jeopardy,"(3, 2)",BUGS,24,"(800,)",False,"Because of their long snouts, these cotton destroyers are sometimes called snout beetles",boll weevils,1,0
5485,2008-06-13,,Double Jeopardy,"(4, 2)",WEAR IT WELL,14,"(800,)",False,"Also known as painter pants, these multi-pocketed pants are named for another profession",carpenter pants,1,0
5485,2008-06-13,,Double Jeopardy,"(5, 2)",LITERARY TRILOGIES,2,"(800,)",False,"""The Romantic Comedians"" begins an Ellen Glasgow trilogy that ""carries us back to"" this Southern state",Virginia,0,3
5485,2008-06-13,,Double Jeopardy,"(6, 2)","""I"" AYE",20,"(800,)",False,"Ron Kovic could have called his book ""Born On"" this--it's the same thing",Independence Day,1,0
5485,2008-06-13,,Double Jeopardy,"(1, 3)",ITALIAN ART & ARTISTS,9,"(1200,)",False,"The first stone for this Roman basilica was laid in 1506, following the plan of Italian architect Donato Bramante",St. Peter\'s,1,0
5485,2008-06-13,,Double Jeopardy,"(2, 3)",POP MUSIC,5,"(1200,)",False,"In 1973 Bette Midler revived this 32-year-old Andrews Sisters hit, reaching the top 10","""The Boogie Woogie Bugle Boy""",1,0
5485,2008-06-13,,Double Jeopardy,"(3, 3)",BUGS,25,"(1200,)",False,"A giant species of this ""hundred-legged"" insect grows to 12 inches in length & eats lizards",a centipede,1,0
5485,2008-06-13,,Double Jeopardy,"(4, 3)",WEAR IT WELL,30,"(1200,)",False,The formless chemise dubbed this by Balenciaga & Givenchy was popular in 1957,the sack dress,1,0
5485,2008-06-13,,Double Jeopardy,"(5, 3)",LITERARY TRILOGIES,15,"(1200,)",False,"This existentialist never finished the fourth volume of ""Les Chemins de la Liberte"", so it's a trilogy",Sartre,1,0
5485,2008-06-13,,Double Jeopardy,"(6, 3)","""I"" AYE",21,"(1200,)",False,"Alexander Woollcott said everything he likes to do is these 2 things, or fattening",illegal or immoral,1,0
5485,2008-06-13,,Double Jeopardy,"(1, 4)",ITALIAN ART & ARTISTS,10,"(2000,)",True,Lorenzo Ghiberti is best known for the magnificent bronze doors he created for the baptistery in this city,Florence,1,0
5485,2008-06-13,,Double Jeopardy,"(2, 4)",POP MUSIC,6,"(1600,)",False,"This single-named ""Konvicted"" singer moved to the U.S. from Senegal when he was 7",Akon,0,3
5485,2008-06-13,,Double Jeopardy,"(3, 4)",BUGS,26,"(1600,)",False,"Although there are about 2,000 species of these ""white ants"", only 2 live in Europe",termites,0,3
5485,2008-06-13,,Double Jeopardy,"(4, 4)",WEAR IT WELL,28,"(1500,)",True,"In the late '60s, this long cover-up with a Turkish name became popular not only for women but for men too",a caftan,0,1
5485,2008-06-13,,Double Jeopardy,"(5, 4)",LITERARY TRILOGIES,16,"(1600,)",False,"His trilogy that began with ""The Hamlet"" & ended with ""The Mansion"" was written over a 30-year period",William Faulkner,0,3
5485,2008-06-13,,Double Jeopardy,"(6, 4)","""I"" AYE",22,"(1600,)",False,"From the Latin for ""to nod"", it's a verbal hint of something improper",an innuendo,1,0
5485,2008-06-13,,Double Jeopardy,"(1, 5)",ITALIAN ART & ARTISTS,11,"(2000,)",False,Andrea d'Agnolo di Francesco is better known by this name found in the title of Robert Browning's poem about him,Andrea del Sarto,0,3
5485,2008-06-13,,Double Jeopardy,"(2, 5)",POP MUSIC,12,"(2000,)",False,"""Hey Ya!"" by OutKast says to ""Shake it like"" one of these",a Polaroid picture,0,3
5485,2008-06-13,,Double Jeopardy,"(3, 5)",BUGS,27,"(2000,)",False,"A gnat's compound eye has multiple lenses called these, like the surfaces of a cut gem",facets,1,0
5485,2008-06-13,,Double Jeopardy,"(4, 5)",WEAR IT WELL,29,"(2000,)",False,"These shoes that sometimes have a 3"" cork sole sound like they were made to be worn waiting for a train",platform shoes,1,0
5485,2008-06-13,,Double Jeopardy,"(5, 5)",LITERARY TRILOGIES,17,"(2000,)",False,"Robertson Davies called the third book in his Cornish Trilogy ""The Lyre of"" this mythological figure",Orpheus,0,3
5485,2008-06-13,,Double Jeopardy,"(6, 5)","""I"" AYE",23,"(2000,)",False,"Eugene O'Neill wrote about a ""Strange"" one",Interlude,1,0
5485,2008-06-13,,Final Jeopardy,"(1, 1)",HOLIDAYS,0,"(9500, 9600, 7501)",False,"The Society for Human Resource Management says, of the 10 federal holidays, it's the least observed by the private sector",Columbus Day,1,2
