epNum,airDate,extra_info,round_name,coord,category,order,value,daily_double,question,answer,correctAttempts,wrongAttempts
5670,2009-04-10,,Jeopardy,"(1, 1)",THE NOVEL LIST,6,"(200,)",False,"""The Three Musketeers"",""Joseph Balsamo""",(Alexandre) Dumas,1,0
5670,2009-04-10,,Jeopardy,"(2, 1)",THE NEW YORK TIMES: ARTS & LEISURE,1,"(200,)",False,"The Times said of these thin young twins, ""It isn't the cover of Vogue they seem to seek as much as the cover of Fortune""",the Olsen Twins,1,0
5670,2009-04-10,,Jeopardy,"(3, 1)","A PRIEST, AN ELEPHANT & EVEL KNIEVEL...",16,"(200,)",False,"On elephants this prehensile body part has an estimated 150,000 muscles",a trunk,1,0
5670,2009-04-10,,Jeopardy,"(4, 1)","WALK INTO A ""BAR""",11,"(200,)",False,"A villainous type of mustache, a la Snidely Whiplash",a handlebar,1,0
5670,2009-04-10,,Jeopardy,"(5, 1)",THE BARTENDER SAYS...,21,"(200,)",False,"Alone again at Christmas?  Time for a big mug of this milk, cream, eggs & rum favorite with a nutmeg garnish",eggnog,1,0
5670,2009-04-10,,Jeopardy,"(6, 1)","WHAT IS THIS, SOME KIND OF JOKE?",26,"(200,)",False,"From this sitcom:""How's life treating you, Norm?""""Like it caught me in bed with his wife""",Cheers,1,0
5670,2009-04-10,,Jeopardy,"(1, 2)",THE NOVEL LIST,7,"(400,)",False,"""Tom Jones"",""Joseph Andrews""",(Henry) Fielding,1,0
5670,2009-04-10,,Jeopardy,"(2, 2)",THE NEW YORK TIMES: ARTS & LEISURE,2,"(400,)",False,"nytimes.com's ""Find a Show"" section tells how to get tickets to ""Avenue Q"" or this masked man musical",The Phantom of the Opera,1,0
5670,2009-04-10,,Jeopardy,"(3, 2)","A PRIEST, AN ELEPHANT & EVEL KNIEVEL...",17,"(400,)",False,"Catholic priests administer 7 of these acts, like penance & holy orders",sacraments,1,0
5670,2009-04-10,,Jeopardy,"(4, 2)","WALK INTO A ""BAR""",12,"(400,)",False,"A style of singing in 4-part harmony; you know, as a ""quartet""",barbershop,1,0
5670,2009-04-10,,Jeopardy,"(5, 2)",THE BARTENDER SAYS...,22,"(400,)",False,"Running a fever, eh?  Try a ""black balsam"" of herbs & this liquor, reputed to have cured Catherine the Great",vodka,1,0
5670,2009-04-10,,Jeopardy,"(6, 2)","WHAT IS THIS, SOME KIND OF JOKE?",27,"(400,)",False,"From this '70s radio station sitcom:""As god is my witness, I thought turkeys could fly""",WKRP in Cincinnati,1,0
5670,2009-04-10,,Jeopardy,"(1, 3)",THE NOVEL LIST,8,"(600,)",False,"""The Winter of Our Discontent"",""The Moon is Down""",John Steinbeck,0,3
5670,2009-04-10,,Jeopardy,"(2, 3)",THE NEW YORK TIMES: ARTS & LEISURE,3,"(600,)",False,"From an artsbeat blog: The Vivian Girls, rockers from this NYC borough, are ""really, really, really cute""",Brooklyn,0,3
5670,2009-04-10,,Jeopardy,"(3, 3)","A PRIEST, AN ELEPHANT & EVEL KNIEVEL...",18,"(600,)",False,"On his ""Sky-Cycle"" Evel tried to jump a canyon above this river in Idaho in 1974; too bad the parachute opened early",the Snake River,1,0
5670,2009-04-10,,Jeopardy,"(4, 3)","WALK INTO A ""BAR""",13,"(600,)",False,An 11-letter acid derivative used in medicine as a sedative,a barbiturate,1,0
5670,2009-04-10,,Jeopardy,"(5, 3)",THE BARTENDER SAYS...,23,"(600,)",False,"Caught in the rain, Mac?  How about one of these, the subject of a 1979 No. 1 song by Rupert Holmes",a piña colada,1,0
5670,2009-04-10,,Jeopardy,"(6, 3)","WHAT IS THIS, SOME KIND OF JOKE?",28,"(600,)",False,"Shatner, on this show:""dennycranelaw.com.  Pictures, bios, hobbies.  I once captained my own spaceship.  Multi-talented""",Boston Legal,1,0
5670,2009-04-10,,Jeopardy,"(1, 4)",THE NOVEL LIST,9,"(800,)",False,"""The Moon is a Harsh Mistress"",""Stranger in a Strange Land""",Heinlein,1,0
5670,2009-04-10,,Jeopardy,"(2, 4)",THE NEW YORK TIMES: ARTS & LEISURE,4,"(1000,)",True,"The times headlined its 2007 review of this series' first episode ""smoking, drinking, cheating and selling""",Mad Men,1,0
5670,2009-04-10,,Jeopardy,"(3, 4)","A PRIEST, AN ELEPHANT & EVEL KNIEVEL...",19,"(800,)",False,On New Year's Eve in 1967 Evel jumped 151 feet over the fountains at this Las Vegas casino; never mind the landing...,Caesars Palace,1,0
5670,2009-04-10,,Jeopardy,"(4, 4)","WALK INTO A ""BAR""",14,"(800,)",False,A conference between the judge & lawyers out of the hearing of the jury,a sidebar,1,0
5670,2009-04-10,,Jeopardy,"(5, 4)",THE BARTENDER SAYS...,24,"(800,)",False,"I can just tell you're sweating for a Lynchburg lemonade, the Lynchburg referring to this brand of whiskey",Jack Daniel\'s,1,0
5670,2009-04-10,,Jeopardy,"(6, 4)","WHAT IS THIS, SOME KIND OF JOKE?",29,"(800,)",False,"Chandler, to Ross on this show:""3 failed marriages, 2 illegitimate children... the personal ad writes itself""",Friends,1,0
5670,2009-04-10,,Jeopardy,"(1, 5)",THE NOVEL LIST,10,"(1000,)",False,"""The Joke"",""The Book of Laughter and Forgetting""",Milan Kundera,0,3
5670,2009-04-10,,Jeopardy,"(2, 5)",THE NEW YORK TIMES: ARTS & LEISURE,5,"(1000,)",False,"nytimes.com has up-to-date info on this NYC museum of American art, like its exhibition on ""artists making photographs""",the Whitney,0,3
5670,2009-04-10,,Jeopardy,"(3, 5)","A PRIEST, AN ELEPHANT & EVEL KNIEVEL...",20,"(1000,)",False,This priestly class is the highest class in Hinduism,the Brahmans,1,0
5670,2009-04-10,,Jeopardy,"(4, 5)","WALK INTO A ""BAR""",15,"(1000,)",False,It's a verb meaning to get off a plane or ship,debark (or disembark),1,0
5670,2009-04-10,,Jeopardy,"(5, 5)",THE BARTENDER SAYS...,25,"(1000,)",False,"Bad day, huh?  You might need shots of these 2 alcohols made from the agave plant",tequila & mezcal,0,3
5670,2009-04-10,,Jeopardy,"(6, 5)","WHAT IS THIS, SOME KIND OF JOKE?",30,"(1000,)",False,"Steven Culp on this show (after being called Dr. Van de Kamp):""Please, you're dating my wife.  Call me Rex""",Desperate Housewives,1,0
5670,2009-04-10,,Double Jeopardy,"(1, 1)",BORN IN 1909,17,"(400,)",False,"Barry Goldwater, in Arizona, which still had this status",a territory,1,0
5670,2009-04-10,,Double Jeopardy,"(2, 1)",WHAT THE '90s MOVIE TITLE MEANS,6,"(400,)",False,It's what the tail does if things are backwards,Wag the Dog,0,3
5670,2009-04-10,,Double Jeopardy,"(3, 1)",SCIENTISTS,1,"(400,)",False,The first known design of a self-propelled vehicle was made by this artist & scientist around 1478,Da Vinci,1,0
5670,2009-04-10,,Double Jeopardy,"(4, 1)",WHERE AM I?,8,"(400,)",False,"(Kelly of the Clue Crew stands at a monument.)  I'm at this country's Monument to the Discoveries, looking at national hero Vasco da Gama",Portugal,1,0
5670,2009-04-10,,Double Jeopardy,"(5, 1)",MUSICAL INSTRUMENTS,18,"(400,)",False,Pairs of these slightly dished metal circular plates have clashed together since Assyrian times,cymbals,1,0
5670,2009-04-10,,Double Jeopardy,"(6, 1)",PLEDGE OF ALLEGIANCE WORDS,10,"(400,)",False,A standard or pennant,a flag,1,0
5670,2009-04-10,,Double Jeopardy,"(1, 2)",BORN IN 1909,27,"(800,)",False,"U Thant, in this current country",Myanmar (or Burma),1,0
5670,2009-04-10,,Double Jeopardy,"(2, 2)",WHAT THE '90s MOVIE TITLE MEANS,7,"(800,)",False,Who can forget Mena Suvari on a bed of petals in this film? (The title is a type of rose),American Beauty,1,0
5670,2009-04-10,,Double Jeopardy,"(3, 2)",SCIENTISTS,2,"(800,)",False,"Some scientists predict this ""seasonal"" period of cold & dark weather would be the result of atomic warfare",nuclear winter,1,0
5670,2009-04-10,,Double Jeopardy,"(4, 2)",WHERE AM I?,9,"(800,)",False,(Jimmy of the Clue Crew stands at a windmill.)  I'm at a windmill in the city of Woerden in this country,the Netherlands,1,0
5670,2009-04-10,,Double Jeopardy,"(5, 2)",MUSICAL INSTRUMENTS,19,"(800,)",False,There's a Great Highland type of this musical instrument,bagpipes,1,0
5670,2009-04-10,,Double Jeopardy,"(6, 2)",PLEDGE OF ALLEGIANCE WORDS,23,"(800,)",False,Temperance leader Carry,nation,1,0
5670,2009-04-10,,Double Jeopardy,"(1, 3)",BORN IN 1909,28,"(1200,)",False,"This ""Streetcar Named Desire"" director, in Constantinople",Elia Kazan,0,3
5670,2009-04-10,,Double Jeopardy,"(2, 3)",WHAT THE '90s MOVIE TITLE MEANS,14,"(1200,)",False,"Americans say ""the whole enchilada""; Brits say this, a Best Picture Oscar nominee from 1997",The Full Monty,1,0
5670,2009-04-10,,Double Jeopardy,"(3, 3)",SCIENTISTS,3,"(1200,)",False,Astronomer Michael Brown discovered the object classified as UB313 in 2003 & named it for this TV princess,Xena,1,0
5670,2009-04-10,,Double Jeopardy,"(4, 3)",WHERE AM I?,11,"(1200,)",False,"(Kelly of the Clue Crew stands in a Spanish city.)  I'm in this Spanish city, the home of the world-famous Running of the Bulls",Pamplona,1,0
5670,2009-04-10,,Double Jeopardy,"(5, 3)",MUSICAL INSTRUMENTS,20,"(1200,)",False,"In ""The Music Man"", ""Seventy-six trombones led the big parade with a hundred and ten"" of these ""close at hand""",cornets,1,0
5670,2009-04-10,,Double Jeopardy,"(6, 3)",PLEDGE OF ALLEGIANCE WORDS,24,"(1200,)",False,Permission granted to a sailor to go ashore,liberty,0,3
5670,2009-04-10,,Double Jeopardy,"(1, 4)",BORN IN 1909,29,"(1600,)",False,"This film critic & ""A Death in the Family"" novelist",(James) Agee,1,0
5670,2009-04-10,,Double Jeopardy,"(2, 4)",WHAT THE '90s MOVIE TITLE MEANS,15,"(1600,)",False,"This 1996 Geena Davis action title can be a euphemism for death (Hint: In the film, she puts her past life to bed)",The Long Kiss Goodnight,0,3
5670,2009-04-10,,Double Jeopardy,"(3, 4)",SCIENTISTS,4,"(1600,)",False,These radiation belts named for an American physicist are found in the earth's magnetosphere,the Van Allen Belts,1,0
5670,2009-04-10,,Double Jeopardy,"(4, 4)",WHERE AM I?,12,"(1600,)",False,"(Kelly of the Clue Crew stands at a shrine.)  I'm near Kyoto at the famed Fushimi Inari Shrine, so I'm in the southwestern part of this island",Honshu,1,0
5670,2009-04-10,,Double Jeopardy,"(5, 4)",MUSICAL INSTRUMENTS,21,"(1600,)",False,"As a verb, this musical instrument means ""to dwell upon persistently & tediously""",harp,1,1
5670,2009-04-10,,Double Jeopardy,"(6, 4)",PLEDGE OF ALLEGIANCE WORDS,25,"(1600,)",False,Declares,States,1,0
5670,2009-04-10,,Double Jeopardy,"(1, 5)",BORN IN 1909,30,"(2000,)",False,"Andrei Gromyko, the face of the USSR as this minister from 1957 to 1985",Foreign Minister,1,0
5670,2009-04-10,,Double Jeopardy,"(2, 5)",WHAT THE '90s MOVIE TITLE MEANS,16,"(2000,)",False,"Of the 10 targets one bowls at, it's designated No. 5; it also can refer to a person of chief importance",Kingpin,1,0
5670,2009-04-10,,Double Jeopardy,"(3, 5)",SCIENTISTS,5,"(2000,)",False,"Darwin's younger contemporary, this 3-named scientist evolved a similar 1850s theory of natural selection",Alfred Russel Wallace,0,3
5670,2009-04-10,,Double Jeopardy,"(4, 5)",WHERE AM I?,13,"(5000,)",True,"(Jimmy of the Clue Crew stands on a verdant mountain peak.)  I'm at this legendary South American site whose name means ""old peak""; over there is ""new peak""",Machu Picchu,1,0
5670,2009-04-10,,Double Jeopardy,"(5, 5)",MUSICAL INSTRUMENTS,22,"(2000,)",False,"Comrade, enjoy this 3-stringed Russian instrument with a triangular body & a thin neck",a balalaika,1,0
5670,2009-04-10,,Double Jeopardy,"(6, 5)",PLEDGE OF ALLEGIANCE WORDS,26,"(3000,)",True,"The meaning of the Greek word ""atomos"" which gives us ""atom""",indivisible,0,1
5670,2009-04-10,,Final Jeopardy,"(1, 1)",COMPOSERS,0,"(6792, 12400, 10001)",False,"In 1912, midway through one of his works, he wrote, ""I have penetrated the secret of the rhythm of spring""",Igor Stravinsky,3,0
