epNum,airDate,extra_info,round_name,coord,category,order,value,daily_double,question,answer,correctAttempts,wrongAttempts
5720,2009-06-19,,Jeopardy,"(1, 1)",U.S. CITIES,17,"(200,)",False,"New York State's second-largest city, it's the seat of Erie County",Buffalo,1,1
5720,2009-06-19,,Jeopardy,"(2, 1)",ARE YOU READY FOR SOME FOOSBALL,26,"(200,)",False,"The 2007 this of foosball was held in Lexington, Ky. in January; the NFL held its in Miami a few weeks later",the Super Bowl,1,0
5720,2009-06-19,,Jeopardy,"(3, 1)",COMMON COMPUTER ABBREV.,16,"(200,)",False,Windows is one:OS,operating system,1,0
5720,2009-06-19,,Jeopardy,"(4, 1)",WEIRD SCENTS,1,"(200,)",False,"Tony Sirico, who played Paulie Walnuts on this HBO show, unveiled his cologne, Paolo per Uomo, in 2008",The Sopranos,1,0
5720,2009-06-19,,Jeopardy,"(5, 1)",NAME CALLING,2,"(200,)",False,"I hate to call you a dumb this, like the extinct bird from Mauritius, but what were you thinking?",a dodo,1,0
5720,2009-06-19,,Jeopardy,"(6, 1)","""J"" MART",3,"(200,)",False,"This term for a holy war against nonbelievers comes from the Arabic word for ""struggle""",jihad,1,0
5720,2009-06-19,,Jeopardy,"(1, 2)",U.S. CITIES,20,"(1000,)",True,"Jestine's Kitchen is a soulful stop for catfish in this city, home of Catfish Row in story & opera",Charleston,0,1
5720,2009-06-19,,Jeopardy,"(2, 2)",ARE YOU READY FOR SOME FOOSBALL,27,"(400,)",False,"In 1975 this leading U.S. sports magazine called foosball ""a real first-class professional sport""",Sports Illustrated,1,0
5720,2009-06-19,,Jeopardy,"(3, 2)",COMMON COMPUTER ABBREV.,18,"(400,)",False,Hello:IM,instant message,1,0
5720,2009-06-19,,Jeopardy,"(4, 2)",WEIRD SCENTS,9,"(400,)",False,"For its 50th anniversary, this sculptable hyphenated compound got its own fragrance",Play-Doh,1,0
5720,2009-06-19,,Jeopardy,"(5, 2)",NAME CALLING,8,"(400,)",False,"Maybe it was all the brandy & brown sugar, but you're ""nuttier than"" this Christmas treat",a fruitcake,1,0
5720,2009-06-19,,Jeopardy,"(6, 2)","""J"" MART",4,"(400,)",False,"The Spanish word for ""water"" is found within this sleek feline's name",the jaguar,1,0
5720,2009-06-19,,Jeopardy,"(1, 3)",U.S. CITIES,21,"(600,)",False,"The roadside attraction called the Cadillac Ranch is in this Texas city whose name is Spanish for ""yellow""",Amarillo,1,0
5720,2009-06-19,,Jeopardy,"(2, 3)",ARE YOU READY FOR SOME FOOSBALL,28,"(600,)",False,"Like an NBA player who camps in the key, a foosballer who takes longer than this to get ready for a serve gets penalized",3 seconds,1,0
5720,2009-06-19,,Jeopardy,"(3, 3)",COMMON COMPUTER ABBREV.,19,"(600,)",False,It's the brains of the operation:CPU,central processing unit,1,0
5720,2009-06-19,,Jeopardy,"(4, 3)",WEIRD SCENTS,10,"(600,)",False,"If you want to smell like a blue one of these, spritz on Eau de Stilton",cheese,1,0
5720,2009-06-19,,Jeopardy,"(5, 3)",NAME CALLING,13,"(600,)",False,"You just don't get it, do you?  You're a big this; now go sit in the corner & put on the cap of the same name",a dunce,1,0
5720,2009-06-19,,Jeopardy,"(6, 3)","""J"" MART",5,"(600,)",False,Pass the jelly to Boy Scouts around the world at one of these camping rallies,a jamboree,1,0
5720,2009-06-19,,Jeopardy,"(1, 4)",U.S. CITIES,22,"(800,)",False,This city near San Francisco grew when it became the western terminus of the Transcontinental Railroad,Oakland,1,0
5720,2009-06-19,,Jeopardy,"(2, 4)",ARE YOU READY FOR SOME FOOSBALL,29,"(800,)",False,"It's illegal to rotate the rods more than this many degrees, so forget about spinning off a ""slap"" shot",360,1,0
5720,2009-06-19,,Jeopardy,"(3, 4)",COMMON COMPUTER ABBREV.,24,"(800,)",False,It's a measure of speed:BPS,bytes per second,1,0
5720,2009-06-19,,Jeopardy,"(4, 4)",WEIRD SCENTS,11,"(800,)",False,"A buccal swab is the first step to get ""Your Fragrance in the Bottle"", based on this",DNA,1,0
5720,2009-06-19,,Jeopardy,"(5, 4)",NAME CALLING,14,"(800,)",False,"You keep dropping things!  Oy, you're such a this, Yiddish for ""wooden block""",a klutz,1,0
5720,2009-06-19,,Jeopardy,"(6, 4)","""J"" MART",6,"(800,)",False,He succeeded a daughter of Henry VIII in 1603,James I,1,1
5720,2009-06-19,,Jeopardy,"(1, 5)",U.S. CITIES,23,"(1000,)",False,It's the biggest city in eastern Washington,Spokane,0,3
5720,2009-06-19,,Jeopardy,"(2, 5)",ARE YOU READY FOR SOME FOOSBALL,30,"(1000,)",False,"Foosball's governing body is the ITSF, which stands for this (the ""TS"" is for foosball's more formal name)",International Table Soccer Federation,1,1
5720,2009-06-19,,Jeopardy,"(3, 5)",COMMON COMPUTER ABBREV.,25,"(1000,)",False,A regional computer linker:LAN,local area network,1,0
5720,2009-06-19,,Jeopardy,"(4, 5)",WEIRD SCENTS,12,"(1000,)",False,"This eatery has created ""Flame"", combining a ""scent of seduction with a hint of flame-broiled meat""",Burger King,1,0
5720,2009-06-19,,Jeopardy,"(5, 5)",NAME CALLING,15,"(1000,)",False,"Watch yourself you big this, (& did you know it comes from the word ""elf""?)",an oaf,1,0
5720,2009-06-19,,Jeopardy,"(6, 5)","""J"" MART",7,"(1000,)",False,"Carved from the living rock, the pink stone city of Petra is found in this Middle Eastern kingdom",Jordan,1,0
5720,2009-06-19,,Double Jeopardy,"(1, 1)",HISTORICAL PAINTINGS,26,"(400,)",False,"A Remington painting shows the ""Coming and Going of"" this delivery service that came & went in less than 2 years' time",the Pony Express,1,0
5720,2009-06-19,,Double Jeopardy,"(2, 1)",ROCK STARS SAY THE DARNDEST THINGS,1,"(400,)",False,"This ""Purple Rain"" guy had a simple request: ""Don't hate me because I'm fabulous""",Prince,1,0
5720,2009-06-19,,Double Jeopardy,"(3, 1)",THIRD IN SEQUENCE,11,"(400,)",False,"In a Stevie Wonder song:""Signed,Sealed,_____""",Delivered,1,0
5720,2009-06-19,,Double Jeopardy,"(4, 1)",FOREIGN WORDS & PHRASES,6,"(400,)",False,"In Dutch this holiday greeting is ""Vrolijk Kerstfeest""",Merry Christmas,1,0
5720,2009-06-19,,Double Jeopardy,"(5, 1)",WILLA CATHER,15,"(400,)",False,"Willa Cather was born in this ""Old Dominion"" state, not in Nebraska",Virginia,1,0
5720,2009-06-19,,Double Jeopardy,"(6, 1)",O PIONEERS!,21,"(400,)",False,"In the 1840s this religious sect left Nauvoo, Illinois & headed west",the Mormons,1,0
5720,2009-06-19,,Double Jeopardy,"(1, 2)",HISTORICAL PAINTINGS,27,"(800,)",False,"Paolo Uccello's ""The Battle of San Romano"" was commissioned by a member of this family in the 1450s",the Medici,1,0
5720,2009-06-19,,Double Jeopardy,"(2, 2)",ROCK STARS SAY THE DARNDEST THINGS,2,"(800,)",False,"""I got rabies shots for biting the head off a bat but that's OK--the bat had to get"" this singer ""shots""",Ozzy Osbourne,1,0
5720,2009-06-19,,Double Jeopardy,"(3, 2)",THIRD IN SEQUENCE,12,"(800,)",False,"In George Bush's ""Axis Of Evil"":Iran,Iraq,_____",North Korea,1,0
5720,2009-06-19,,Double Jeopardy,"(4, 2)",FOREIGN WORDS & PHRASES,7,"(800,)",False,"A clever saying or witticism, it literally means ""good word"" in French",bon mot,1,0
5720,2009-06-19,,Double Jeopardy,"(5, 2)",WILLA CATHER,17,"(800,)",False,"F. Scott Fitzgerald wrote Cather that the similarity of passages in this 1925 book & her ""A Lost Lady"" was just a coincidence",The Great Gatsby,1,0
5720,2009-06-19,,Double Jeopardy,"(6, 2)",O PIONEERS!,22,"(800,)",False,"1849's ""The Emigrants' Guide to California"" says the biggest travel expense was 8 of these--yoke not included",oxen,1,0
5720,2009-06-19,,Double Jeopardy,"(1, 3)",HISTORICAL PAINTINGS,28,"(1200,)",False,"(Jimmy of the Clue Crew points out a famous painting on the monitor.)  In Emanuel Leutze's painting of Washington crossing the Delaware, the man holding the anachronistic flag is said to be this future fifth president",Monroe,1,0
5720,2009-06-19,,Double Jeopardy,"(2, 3)",ROCK STARS SAY THE DARNDEST THINGS,3,"(1200,)",False,"This ""Ziggy Stardust"" singer:""I think I was always a closet heterosexual""",David Bowie,1,0
5720,2009-06-19,,Double Jeopardy,"(3, 3)",THIRD IN SEQUENCE,13,"(1200,)",False,"3 main types of rocks:igneous,metamorphic,_____",sedimentary,1,0
5720,2009-06-19,,Double Jeopardy,"(4, 3)",FOREIGN WORDS & PHRASES,8,"(1200,)",False,"Italian for ""the sweet life"", it served as the title for a 1960 Federico Fellini film",La Dolce Vita,1,0
5720,2009-06-19,,Double Jeopardy,"(5, 3)",WILLA CATHER,18,"(1200,)",False,"Cather took the title ""O Pioneers!"" from a poem by Walt Whitman that appeared in this collection",Leaves of Grass,1,0
5720,2009-06-19,,Double Jeopardy,"(6, 3)",O PIONEERS!,23,"(1200,)",False,"In treeless areas, pioneers built houses of this 3-letter material, filling cracks with mud; hey, it was dirt cheap!",sod,1,0
5720,2009-06-19,,Double Jeopardy,"(1, 4)",HISTORICAL PAINTINGS,29,"(1600,)",False,"An 1830s painting by Karl Briullov depicts ""The Last Day of"" this city, before it was obliterated by a volcano",Pompeii,1,1
5720,2009-06-19,,Double Jeopardy,"(2, 4)",ROCK STARS SAY THE DARNDEST THINGS,4,"(1600,)",False,"This ""Maggie May"" guy: ""Instead of... (marrying) again, I'm going to find a woman I don't like and just give her a house""",Rod Stewart,1,1
5720,2009-06-19,,Double Jeopardy,"(3, 4)",THIRD IN SEQUENCE,14,"(1600,)",False,"Noah's sons:Ham,Shem,_____",Japheth,0,3
5720,2009-06-19,,Double Jeopardy,"(4, 4)",FOREIGN WORDS & PHRASES,9,"(2500,)",True,"""Negus, from the Amharic for ""king"", was once used as a title for the emperors of this African nation",Ethiopia,0,1
5720,2009-06-19,,Double Jeopardy,"(5, 4)",WILLA CATHER,19,"(3000,)",True,Cather chose to put an accent over the first letter of this character's name so as to stress the first syllable,Ántonia,1,0
5720,2009-06-19,,Double Jeopardy,"(6, 4)",O PIONEERS!,24,"(1600,)",False,"Families traveling west lived in these covered wagons, so-named because their white tops looked like ships' sails",prairie schooners,1,0
5720,2009-06-19,,Double Jeopardy,"(1, 5)",HISTORICAL PAINTINGS,30,"(2000,)",False,"Seen here, the portrait of Napoleon in his study was done by this favorite painter of his in 1812",Jacques-Louis David,0,3
5720,2009-06-19,,Double Jeopardy,"(2, 5)",ROCK STARS SAY THE DARNDEST THINGS,5,"(2000,)",False,"This Van Halen singer:""Money can't buy you happiness, but it can buy you a yacht... to pull up alongside it""",David Lee Roth,1,0
5720,2009-06-19,,Double Jeopardy,"(3, 5)",THIRD IN SEQUENCE,16,"(2000,)",False,"Rome's Second Triumvirate:Octavian,Lepidus,_____",Marc Antony,0,3
5720,2009-06-19,,Double Jeopardy,"(4, 5)",FOREIGN WORDS & PHRASES,10,"(2000,)",False,"""Auto-da-fe"" is associated with the Spanish Inquisition, but the phrase, which means this, is Portuguese",act of faith,1,1
5720,2009-06-19,,Double Jeopardy,"(5, 5)",WILLA CATHER,20,"(2000,)",False,"This Nebraska town where Cather spent her youth was named for a ""colorful"" Sioux chief",Red Cloud,0,3
5720,2009-06-19,,Double Jeopardy,"(6, 5)",O PIONEERS!,25,"(2000,)",False,"Textbooks used by pioneer children included Webster's spelling books & this man's ""Eclectic Readers""",(William) McGuffey,1,0
5720,2009-06-19,,Final Jeopardy,"(1, 1)",WORDS IN PHYSICS,0,"(1300, 3599, 4201)",False,"Also found before ""pack"" & ""team"", it's defined as increase in volume resulting from increase in temperature",expansion,2,1
