epNum,airDate,extra_info,round_name,coord,category,order,value,daily_double,question,answer,correctAttempts,wrongAttempts
5804,2009-12-03,Dave Belote game 2.,Jeopardy,"(1, 1)",NATIONAL ANTHEMS,1,"(200,)",False,"""Send her victorious, Happy and glorious, Long to reign over us, God save the Queen""",the United Kingdom,1,0
5804,2009-12-03,Dave Belote game 2.,Jeopardy,"(2, 1)",DOUBLE-LETTER WORDS,30,"(200,)",False,"In Islam, the supreme being",Allah,1,0
5804,2009-12-03,Dave Belote game 2.,Jeopardy,"(3, 1)",JAILHOUSE ROCK,12,"(200,)",False,Al Capone and Machine Gun Kelly did time on this rock in San Francisco Bay,Alcatraz,1,0
5804,2009-12-03,Dave Belote game 2.,Jeopardy,"(4, 1)",ALSO A U.S. STATE,17,"(200,)",False,"It was destroyed in Havana Harbor on Feb. 15, 1898",the USS Maine,1,0
5804,2009-12-03,Dave Belote game 2.,Jeopardy,"(5, 1)",COMMON LAST NAME'S THE SAME,7,"(200,)",False,"Samuel,Don,Rafer",Johnson,0,3
5804,2009-12-03,Dave Belote game 2.,Jeopardy,"(6, 1)",WOODSTOCK,2,"(200,)",False,"(Jimmy of the Clue Crew reports from inside the Museum at Bethel Woods, New York.)  For an exhibit commemorating the 40th anniversary of the event, the museum constructed a replica of the Montreal hotel room used by this couple during their Bed-In for Peace",John & Yoko,1,0
5804,2009-12-03,Dave Belote game 2.,Jeopardy,"(1, 2)",NATIONAL ANTHEMS,22,"(400,)",False,"""Arise, Ye Who Refuse To Be Slaves; With Our Very Flesh And Blood Let Us Build Our New Great Wall""",China,1,0
5804,2009-12-03,Dave Belote game 2.,Jeopardy,"(2, 2)",DOUBLE-LETTER WORDS,29,"(400,)",False,"In baseball, it's a play in which a runner is caught off base & thrown out by the pitcher or catcher",a pickoff,1,2
5804,2009-12-03,Dave Belote game 2.,Jeopardy,"(3, 2)",JAILHOUSE ROCK,13,"(400,)",False,From 1964 to 1982 this Nobelist was incarcerated on rocky Robben Island off the coast of Cape Town,Mandela,1,0
5804,2009-12-03,Dave Belote game 2.,Jeopardy,"(4, 2)",ALSO A U.S. STATE,18,"(400,)",False,A numbered shirt you just bought from your favorite football team,a New Jersey,1,1
5804,2009-12-03,Dave Belote game 2.,Jeopardy,"(5, 2)",COMMON LAST NAME'S THE SAME,8,"(400,)",False,"Tom,Shirley,Davy",Jones,1,0
5804,2009-12-03,Dave Belote game 2.,Jeopardy,"(6, 2)",WOODSTOCK,3,"(400,)",False,"(Jimmy of the Clue Crew reports from outside the Museum at Bethel Woods, New York.)  If you can't make it here to upstate New York, go to woodstock.com to read bios of performers like this man who closed the festival with blistering versions of ""The Star Spangled Banner"" & ""Hey Joe""",Jimi Hendrix,1,0
5804,2009-12-03,Dave Belote game 2.,Jeopardy,"(1, 3)",NATIONAL ANTHEMS,23,"(600,)",False,"""All Should Love, Awe And Cherish Thee, Gracious Is Thy Nile To Humanity""",Egypt,1,0
5804,2009-12-03,Dave Belote game 2.,Jeopardy,"(2, 3)",DOUBLE-LETTER WORDS,28,"(600,)",False,"To baby, or to cook eggs in water just below the boiling point",to coddle,1,0
5804,2009-12-03,Dave Belote game 2.,Jeopardy,"(3, 3)",JAILHOUSE ROCK,14,"(600,)",False,The infamous penal colony on this rocky islet off the coast of South America opened in 1852,Devil\'s Island,1,0
5804,2009-12-03,Dave Belote game 2.,Jeopardy,"(4, 3)",ALSO A U.S. STATE,19,"(600,)",False,"This band of ""Wayward Sons"" is fronted by Steve Walsh",Kansas,1,0
5804,2009-12-03,Dave Belote game 2.,Jeopardy,"(5, 3)",COMMON LAST NAME'S THE SAME,9,"(600,)",False,"Kate,Keely,Will",Smith,1,0
5804,2009-12-03,Dave Belote game 2.,Jeopardy,"(6, 3)",WOODSTOCK,4,"(600,)",False,"(Kelly of the Clue Crew reports from inside the Museum at Bethel Woods, New York.)  In the museum's theater, visitors can relax on beanbag chairs and watch festival highlights, such as the work of this Indian sitar master & friend of the Beatles",Ravi Shankar,1,0
5804,2009-12-03,Dave Belote game 2.,Jeopardy,"(1, 4)",NATIONAL ANTHEMS,24,"(800,)",False,"""Sons Of The Gael! Men Of The Pale! The Long Watched Day Is Breaking""",Ireland,1,0
5804,2009-12-03,Dave Belote game 2.,Jeopardy,"(2, 4)",DOUBLE-LETTER WORDS,27,"(800,)",False,"From the Middle English for ""knife"", it means to cut small shavings from a piece of wood",to whittle,1,0
5804,2009-12-03,Dave Belote game 2.,Jeopardy,"(3, 4)",JAILHOUSE ROCK,15,"(800,)",False,Accused Kurdish terrorist Abdullah Ocalan is the sole inmate held on this country's rocky island of Imrali,Turkey,1,0
5804,2009-12-03,Dave Belote game 2.,Jeopardy,"(4, 4)",ALSO A U.S. STATE,20,"(4000,)",True,2-word beseeching request for Ms. Fanning to continue in the direction of Antarctica,South Dakota,1,0
5804,2009-12-03,Dave Belote game 2.,Jeopardy,"(5, 4)",COMMON LAST NAME'S THE SAME,10,"(800,)",False,"Seth,Isiah,Clarence",Thomas,1,0
5804,2009-12-03,Dave Belote game 2.,Jeopardy,"(6, 4)",WOODSTOCK,5,"(800,)",False,"(Jimmy of the Clue Crew reports from inside the Museum at Bethel Woods, New York.)  The festival's iconic poster lists several acts who didn't end up playing, including these heavy metal forefathers who sang ""In-A-Gadda-Da-Vida""--they ended up stuck at an airport",Iron Butterfly,1,0
5804,2009-12-03,Dave Belote game 2.,Jeopardy,"(1, 5)",NATIONAL ANTHEMS,25,"(1000,)",False,"""Beneath Our Radiant Southern Cross We'll Toil With Hearts And Hands""",Australia,1,0
5804,2009-12-03,Dave Belote game 2.,Jeopardy,"(2, 5)",DOUBLE-LETTER WORDS,26,"(1000,)",False,"A sophisticated debating technique is to point out that ""I'm"" this, ""you're glue""",rubber,1,0
5804,2009-12-03,Dave Belote game 2.,Jeopardy,"(3, 5)",JAILHOUSE ROCK,16,"(1000,)",False,"This ""Chateau"" on a tiny rock in the Mediterranean was a prison in real life, not just in ""The Count of Monte Cristo""",Château d\'If,1,0
5804,2009-12-03,Dave Belote game 2.,Jeopardy,"(4, 5)",ALSO A U.S. STATE,21,"(1000,)",False,"First name of Ms. Engel of ""Mary Tyler Moore"" fame",Georgia,1,0
5804,2009-12-03,Dave Belote game 2.,Jeopardy,"(5, 5)",COMMON LAST NAME'S THE SAME,11,"(1000,)",False,"James,Jerry,Gatemouth",Brown,1,0
5804,2009-12-03,Dave Belote game 2.,Jeopardy,"(6, 5)",WOODSTOCK,6,"(1000,)",False,"(Jimmy of the Clue Crew reports from outside the Museum at Bethel Woods, New York.)  Woodstock opened with a performance by this African-American folk artist who was called back for so many encores, he ran out of material and had to improvise his now classic ""Freedom""",Richie Havens,1,1
5804,2009-12-03,Dave Belote game 2.,Double Jeopardy,"(1, 1)",MATH,11,"(400,)",False,"Popular in geometry, as in logic, are statements known as ""if..."" this",& then,1,0
5804,2009-12-03,Dave Belote game 2.,Double Jeopardy,"(2, 1)",MILESTONE BIRTHDAYS 2009,16,"(400,)",False,On September 25 she turned 40 & her husband Michael Douglas turned 65,Catherine Zeta-Jones,1,0
5804,2009-12-03,Dave Belote game 2.,Double Jeopardy,"(3, 1)",OPERA,23,"(400,)",False,"""The Canterbury Pilgrims"", an 1884 opera, is based on a work by him",Geoffrey Chaucer,1,0
5804,2009-12-03,Dave Belote game 2.,Double Jeopardy,"(4, 1)","LETTER, PLEASE",6,"(400,)",False,Thiamin is the first of this vitamin group,B,1,0
5804,2009-12-03,Dave Belote game 2.,Double Jeopardy,"(5, 1)",DEATH IN VENICE,1,"(400,)",False,Peggy of this American family of art patrons turned her Venice palazzo into a museum; her ashes are in its garden,Guggenheim,1,0
5804,2009-12-03,Dave Belote game 2.,Double Jeopardy,"(6, 1)",LIFE IN DES MOINES,21,"(400,)",False,"You can't miss this building, finished in 1886 & regilded in 1927, 1965 & 1998",the Capitol,1,0
5804,2009-12-03,Dave Belote game 2.,Double Jeopardy,"(1, 2)",MATH,12,"(800,)",False,The formula to find the area of one of these is 1/2 base times height,a triangle,1,0
5804,2009-12-03,Dave Belote game 2.,Double Jeopardy,"(2, 2)",MILESTONE BIRTHDAYS 2009,17,"(800,)",False,"Don't expect this Fox News ""Culture Warrior"" to mellow in his 60s, which started September 10",Bill O\'Reilly,1,0
5804,2009-12-03,Dave Belote game 2.,Double Jeopardy,"(3, 2)",OPERA,29,"(4000,)",True,"Several operas based on ""The Hunchback of Notre Dame"" are named for this Gypsy girl",Esméralda,1,0
5804,2009-12-03,Dave Belote game 2.,Double Jeopardy,"(4, 2)","LETTER, PLEASE",7,"(800,)",False,U.N. Secretary-General Thant's initial letter,U,1,0
5804,2009-12-03,Dave Belote game 2.,Double Jeopardy,"(5, 2)",DEATH IN VENICE,2,"(800,)",False,"It's the main character Gustave von Aschenbach who succumbs in this author's ""Death in Venice""",Thomas Mann,1,0
5804,2009-12-03,Dave Belote game 2.,Double Jeopardy,"(6, 2)",LIFE IN DES MOINES,22,"(800,)",False,"A bar, opened in 2005, that re-creates an old-time tavern atmosphere is named for this Miller beer",High Life,1,0
5804,2009-12-03,Dave Belote game 2.,Double Jeopardy,"(1, 3)",MATH,13,"(1200,)",False,"In coordinate geometry, the abscissa is the distance of a point from this vertical axis",the y-axis,1,0
5804,2009-12-03,Dave Belote game 2.,Double Jeopardy,"(2, 3)",MILESTONE BIRTHDAYS 2009,18,"(1200,)",False,"September marked the 80th birthday of this golfer & the 20th of his hospital that's helped an ""Army"" of kids",Arnold Palmer,1,0
5804,2009-12-03,Dave Belote game 2.,Double Jeopardy,"(3, 3)",OPERA,27,"(1200,)",False,"In a fairy tale Rossini opera, Angelina is called this",Cinderella (La Cenerentola),0,3
5804,2009-12-03,Dave Belote game 2.,Double Jeopardy,"(4, 3)","LETTER, PLEASE",8,"(1200,)",False,Females have 2 copies of this chromosome,X,1,0
5804,2009-12-03,Dave Belote game 2.,Double Jeopardy,"(5, 3)",DEATH IN VENICE,3,"(1200,)",False,"This composer died in the Palazzo Vendramin but was buried in the garden at Wahnfried, his home in Bayreuth",(Richard) Wagner,1,0
5804,2009-12-03,Dave Belote game 2.,Double Jeopardy,"(6, 3)",LIFE IN DES MOINES,24,"(1200,)",False,"Let's visit Wallace House, home to a family that produced 2 Secys. of this; maybe there'll be Vilsack House someday",agriculture,1,0
5804,2009-12-03,Dave Belote game 2.,Double Jeopardy,"(1, 4)",MATH,14,"(1600,)",False,"The continuous summing of a change in a function over an interval, it's the inverse process of differentiation",integration,1,0
5804,2009-12-03,Dave Belote game 2.,Double Jeopardy,"(2, 4)",MILESTONE BIRTHDAYS 2009,19,"(1600,)",False,"We hope his cast mates threw him an ""Office"" party when he turned 30 on October 20",(John) Krasinski,1,0
5804,2009-12-03,Dave Belote game 2.,Double Jeopardy,"(3, 4)",OPERA,26,"(1600,)",False,"""Pagliacci"" is almost always performed with this 1-act Mascagni opera, ""Cav"" for short",Cavalleria rusticana,0,3
5804,2009-12-03,Dave Belote game 2.,Double Jeopardy,"(4, 4)","LETTER, PLEASE",9,"(1600,)",False,"Tomcats, Falcons & Eagles get this alphabetical designation in the Air Force",F,1,0
5804,2009-12-03,Dave Belote game 2.,Double Jeopardy,"(5, 4)",DEATH IN VENICE,4,"(3000,)",True,This physicist who noted an effect in sound waves from moving sources died in Venice in 1853 & is buried in its San Michele,(Christian) Doppler,1,0
5804,2009-12-03,Dave Belote game 2.,Double Jeopardy,"(6, 4)",LIFE IN DES MOINES,25,"(1600,)",False,The annual Pridefest is more festive since the April 2009 decision that allowed this in Iowa,gay marriage,1,0
5804,2009-12-03,Dave Belote game 2.,Double Jeopardy,"(1, 5)",MATH,15,"(2000,)",False,"When 2 of these intersect, their intersection is a straight line",a plane,1,0
5804,2009-12-03,Dave Belote game 2.,Double Jeopardy,"(2, 5)",MILESTONE BIRTHDAYS 2009,20,"(2000,)",False,"She married fellow musician Ryan Adams in March, a month before turning 25",Mandy Moore,1,0
5804,2009-12-03,Dave Belote game 2.,Double Jeopardy,"(3, 5)",OPERA,28,"(2000,)",False,Tom Rakewell is lured into a life of vice in this 1951 opera based on a series of engravings by William Hogarth,The Rake\'s Progress,0,3
5804,2009-12-03,Dave Belote game 2.,Double Jeopardy,"(4, 5)","LETTER, PLEASE",10,"(2000,)",False,"Precedes ""priori"" in a Latin phrase used in the study of logic",a,1,0
5804,2009-12-03,Dave Belote game 2.,Double Jeopardy,"(5, 5)",DEATH IN VENICE,5,"(2000,)",False,This Russian founder of the Ballets Russes fell into a coma & died while on holiday in Venice,Sergei Diaghilev,0,3
5804,2009-12-03,Dave Belote game 2.,Double Jeopardy,"(6, 5)",LIFE IN DES MOINES,30,"(2000,)",False,"Des Moinesians keep current with this newspaper, founded in a log cabin in 1849",The Des Moines Register,0,3
5804,2009-12-03,Dave Belote game 2.,Final Jeopardy,"(1, 1)",SHAKESPEARE'S WOMEN,0,"(7401, 15200, 0)",False,"The name of this royal daughter from a tragedy is from a word meaning ""little king""",Regan (from King Lear),1,2
