epNum,airDate,extra_info,round_name,coord,category,order,value,daily_double,question,answer,correctAttempts,wrongAttempts
5817,2009-12-22,Ryan Chaffee game 3.,Jeopardy,"(1, 1)",CURSES,11,"(200,)",False,"The ""Cover Curse"" of this Time, Inc. magazine is notable for athletes; appear & your career may soon disappear",Sports Illustrated,1,0
5817,2009-12-22,Ryan Chaffee game 3.,Jeopardy,"(2, 1)",I'LL BE DOGGONE,25,"(200,)",False,"As a pet, the border type of this may have to learn to relax & stop herding everything in sight",a collie,1,0
5817,2009-12-22,Ryan Chaffee game 3.,Jeopardy,"(3, 1)","DAD, GUM IT",16,"(200,)",False,Nicorette is a gum designed to help your dad stop doing this,smoking,1,0
5817,2009-12-22,Ryan Chaffee game 3.,Jeopardy,"(4, 1)",DOUGH!,1,"(200,)",False,Some suggest eliminating this coin; the mint spends $134 million a year to produce $80 million worth,the penny,1,0
5817,2009-12-22,Ryan Chaffee game 3.,Jeopardy,"(5, 1)",FOR PETE'S SAKE,18,"(200,)",False,"In 1682 he came to the throne at the age of 10, along with his weak-minded half-brother, Ivan V",Peter the Great,1,0
5817,2009-12-22,Ryan Chaffee game 3.,Jeopardy,"(6, 1)","""CON""SARNIT",6,"(200,)",False,"It means to yield or admit, perhaps to a point of argument",concede,1,0
5817,2009-12-22,Ryan Chaffee game 3.,Jeopardy,"(1, 2)",CURSES,12,"(400,)",False,The Madden video game cover curse claimed this QB; first he got hurt & we won't even get into the dog thing,Michael Vick,1,0
5817,2009-12-22,Ryan Chaffee game 3.,Jeopardy,"(2, 2)",I'LL BE DOGGONE,27,"(400,)",False,"Yes, comrade, the Borzoi is also known as the Russian this",wolfhound,0,3
5817,2009-12-22,Ryan Chaffee game 3.,Jeopardy,"(3, 2)","DAD, GUM IT",17,"(400,)",False,"Born Frances Gumm, she made her singing debut at age 2 in her dad's theater & then went on to visit Oz",(Judy) Garland,1,0
5817,2009-12-22,Ryan Chaffee game 3.,Jeopardy,"(4, 2)",DOUGH!,2,"(400,)",False,"(Jimmy of the Clue Crew reports from the Bureau of Engraving and Printing in Washington, D.C.)  I'm at the Bureau of Engraving and Printing with a replica of the current $2 bill, which has an engraving of this event on the back; limited space on the note meant five guys got left out",the signing of the Declaration of Independence,1,0
5817,2009-12-22,Ryan Chaffee game 3.,Jeopardy,"(5, 2)",FOR PETE'S SAKE,19,"(400,)",False,"The last name of this Peter, a British navy man, is on a Columbia River island & a Washington sound",Puget,1,0
5817,2009-12-22,Ryan Chaffee game 3.,Jeopardy,"(6, 2)","""CON""SARNIT",7,"(400,)",False,"Let's take a pregnant pause for this 8-letter verb, meaning to construct an image or idea",conceive,1,0
5817,2009-12-22,Ryan Chaffee game 3.,Jeopardy,"(1, 3)",CURSES,13,"(600,)",False,Curse averted!  The Yankees dug up a buried jersey of this rival team out of the concrete of the new stadium in 2008,the Boston Red Sox,1,0
5817,2009-12-22,Ryan Chaffee game 3.,Jeopardy,"(2, 3)",I'LL BE DOGGONE,28,"(600,)",False,"Appropriately, the mountain pass with this dog's name is in the Alps, between Italy & Switzerland",Saint Bernard,1,0
5817,2009-12-22,Ryan Chaffee game 3.,Jeopardy,"(3, 3)","DAD, GUM IT",23,"(600,)",False,"When a man with this last name offered gum with his dad's soap, it started a chewing gum empire",Wrigley,1,0
5817,2009-12-22,Ryan Chaffee game 3.,Jeopardy,"(4, 3)",DOUGH!,3,"(600,)",False,"From the 1970s, some quarters commemorating this featured a Colonial drummer",the Bicentennial,1,0
5817,2009-12-22,Ryan Chaffee game 3.,Jeopardy,"(5, 3)",FOR PETE'S SAKE,20,"(600,)",False,Last name of the Peter whose hall in Boston was completed in 1742,Faneuil,1,0
5817,2009-12-22,Ryan Chaffee game 3.,Jeopardy,"(6, 3)","""CON""SARNIT",8,"(600,)",False,"Exclusive attention to one object, or a game that requires memory skills",concentration,1,0
5817,2009-12-22,Ryan Chaffee game 3.,Jeopardy,"(1, 4)",CURSES,14,"(800,)",False,"A black cat in 1969 & a fan's try for a foul ball (let him be, folks!) have been blamed for this team's woes",the Cubs,1,0
5817,2009-12-22,Ryan Chaffee game 3.,Jeopardy,"(2, 4)",I'LL BE DOGGONE,29,"(800,)",False,"This prestigious dog show was first held in New York City in 1877 & showcased 1,201 pooches",the Westminster Kennel Club Dog Show,1,0
5817,2009-12-22,Ryan Chaffee game 3.,Jeopardy,"(3, 4)","DAD, GUM IT",24,"(800,)",False,"Gumby's father has this name, also a Bantu word for ""okra""",Gumbo,0,3
5817,2009-12-22,Ryan Chaffee game 3.,Jeopardy,"(4, 4)",DOUGH!,4,"(800,)",False,"(Jimmy of the Clue Crew reports from the Bureau of Engraving and Printing in Washington, D.C.)  Defacement of currency is a criminal offense, punishable by a fine up to this much, also the largest denomination the U.S. now issues",$100,1,0
5817,2009-12-22,Ryan Chaffee game 3.,Jeopardy,"(5, 4)",FOR PETE'S SAKE,21,"(800,)",False,In 1626 this Colonial gov. spent the best 60 Dutch guilders of his life when he bought Manhattan Island,Minuit,1,0
5817,2009-12-22,Ryan Chaffee game 3.,Jeopardy,"(6, 4)","""CON""SARNIT",9,"(800,)",False,"If I'm holding this spiral shell of a gastropod, a fabled trumpet of the Tritons, I get to speak",a conch (shell),1,0
5817,2009-12-22,Ryan Chaffee game 3.,Jeopardy,"(1, 5)",CURSES,15,"(1000,)",False,"Norm Van Lier was so upset this NBA team didn't retire his No. 2, he put a hex on anyone who wore it; lucky it wasn't 23",the (Chicago) Bulls,1,0
5817,2009-12-22,Ryan Chaffee game 3.,Jeopardy,"(2, 5)",I'LL BE DOGGONE,30,"(1000,)",False,"For 10 years after his master's death, a dog of this breed waited daily for his return at a Tokyo train station",Akita,1,0
5817,2009-12-22,Ryan Chaffee game 3.,Jeopardy,"(3, 5)","DAD, GUM IT",26,"(1000,)",False,"This ""colorful"" gum-chewing girl has a golden ticket that gets her & her dad in to see Willy Wonka",Violet Beauregarde,0,3
5817,2009-12-22,Ryan Chaffee game 3.,Jeopardy,"(4, 5)",DOUGH!,5,"(1000,)",False,"The dime known as this ""Head"" was designed by Charles Barber, the Mint's chief engraver from 1879 to 1917",the Liberty Head,1,0
5817,2009-12-22,Ryan Chaffee game 3.,Jeopardy,"(5, 5)",FOR PETE'S SAKE,22,"(500,)",True,"World Book says it, flat out: this man ""was the greatest Flemish painter of the 1600s""",(Peter Paul) Rubens,1,0
5817,2009-12-22,Ryan Chaffee game 3.,Jeopardy,"(6, 5)","""CON""SARNIT",10,"(1000,)",False,"From the Latin for ""to run together"", it means existing simultaneously or side by side",concurrent (concurrently accepted),1,1
5817,2009-12-22,Ryan Chaffee game 3.,Double Jeopardy,"(1, 1)","""U"" COUNTRIES",1,"(400,)",False,Kharkov is the second-most populous city in this republic of 46 million,the Ukraine,1,0
5817,2009-12-22,Ryan Chaffee game 3.,Double Jeopardy,"(2, 1)",GREAT DAMES,15,"(400,)",False,"""I've always been a broad, now it's a great honor to be a dame"", said this violet-eyed actress in 1999",(Elizabeth) Taylor,1,0
5817,2009-12-22,Ryan Chaffee game 3.,Double Jeopardy,"(3, 1)",WRITERS' MIDDLE NAMES,10,"(400,)",False,A Pulitzer Prize-winning poet:St. Vincent,(Edna St. Vincent) Millay,1,0
5817,2009-12-22,Ryan Chaffee game 3.,Double Jeopardy,"(4, 1)",INDULGE YOURSELF,22,"(400,)",False,"Eat twice as much of this English dessert that features berries & vanilla custard--its name means ""a trivial matter""",a trifle,1,0
5817,2009-12-22,Ryan Chaffee game 3.,Double Jeopardy,"(5, 1)",MUSIC & MUSICIANS,6,"(400,)",False,"Most orchestral scores place this group of instruments, which includes the oboe, at the top of the page",woodwinds,1,0
5817,2009-12-22,Ryan Chaffee game 3.,Double Jeopardy,"(6, 1)",SET THE COMPOUND FRACTURE,18,"(400,)",False,An area for playing racquetball & a seagoing vessel,a courtship,1,0
5817,2009-12-22,Ryan Chaffee game 3.,Double Jeopardy,"(1, 2)","""U"" COUNTRIES",2,"(800,)",False,"This country's president Museveni, seen as a godsend after leaders like Idi Amin, has been in power since 1986",Uganda,1,0
5817,2009-12-22,Ryan Chaffee game 3.,Double Jeopardy,"(2, 2)",GREAT DAMES,16,"(800,)",False,"In 1995 she was ""Victor/Victoria"" onstage; maybe she could get a knighthood, as well",Julie Andrews,0,3
5817,2009-12-22,Ryan Chaffee game 3.,Double Jeopardy,"(3, 2)",WRITERS' MIDDLE NAMES,11,"(800,)",False,"He wrote ""O.T.: A Danish Romance"" & lived a fairy tale life:Christian",Hans Christian Andersen,1,0
5817,2009-12-22,Ryan Chaffee game 3.,Double Jeopardy,"(5, 2)",MUSIC & MUSICIANS,7,"(800,)",False,Joseph Haydn's brother Michael succeeded Mozart as this city's cathedral organist,Salzburg,0,3
5817,2009-12-22,Ryan Chaffee game 3.,Double Jeopardy,"(6, 2)",SET THE COMPOUND FRACTURE,19,"(800,)",False,Obstructing a defensive player in football & silent film's Mr. Keaton,a blockbuster,1,0
5817,2009-12-22,Ryan Chaffee game 3.,Double Jeopardy,"(1, 3)","""U"" COUNTRIES",3,"(1200,)",False,Its national team won soccer's World Cup in 1930 & 1950,Uruguay,1,0
5817,2009-12-22,Ryan Chaffee game 3.,Double Jeopardy,"(2, 3)",GREAT DAMES,17,"(1200,)",False,"This Helen was in 2004's ""Raising Helen""; she plays queens pretty well, too",(Helen) Mirren,1,0
5817,2009-12-22,Ryan Chaffee game 3.,Double Jeopardy,"(3, 3)",WRITERS' MIDDLE NAMES,12,"(1200,)",False,A poet & a 6-year member of the Irish Senate:Butler,(William Butler) Yeats,1,0
5817,2009-12-22,Ryan Chaffee game 3.,Double Jeopardy,"(5, 3)",MUSIC & MUSICIANS,8,"(1200,)",False,"Berlioz never intended ""The Damnation of"" him to be staged, but damned if opera companies don't do it anyway",Faust,1,0
5817,2009-12-22,Ryan Chaffee game 3.,Double Jeopardy,"(6, 3)",SET THE COMPOUND FRACTURE,20,"(1200,)",False,The heart of downtown Chicago & an animal's burrow,a loophole,0,3
5817,2009-12-22,Ryan Chaffee game 3.,Double Jeopardy,"(1, 4)","""U"" COUNTRIES",4,"(1600,)",False,"Part of the Soviet space mission Project Juno, Helen Sharman was this country's first astronaut",the United Kingdom,0,3
5817,2009-12-22,Ryan Chaffee game 3.,Double Jeopardy,"(2, 4)",GREAT DAMES,28,"(1600,)",False,"This actress now portrays James Bond's M; she plays queens pretty well, too",(Judi) Dench,1,0
5817,2009-12-22,Ryan Chaffee game 3.,Double Jeopardy,"(3, 4)",WRITERS' MIDDLE NAMES,13,"(1600,)",False,A Polish-born writer of short stories:Bashevis,Singer,1,0
5817,2009-12-22,Ryan Chaffee game 3.,Double Jeopardy,"(4, 4)",INDULGE YOURSELF,24,"(1600,)",False,"Mmm... ladyfingers soaked in brandy & espresso!  Quite a ""pick me up"", as the name of this Italian dessert says",tiramisu,1,0
5817,2009-12-22,Ryan Chaffee game 3.,Double Jeopardy,"(5, 4)",MUSIC & MUSICIANS,9,"(300,)",True,"The ballet ""Pulcinella"" has music by this Russian-born composer who dominated early 20th c. ballet music",Stravinsky,1,0
5817,2009-12-22,Ryan Chaffee game 3.,Double Jeopardy,"(6, 4)",SET THE COMPOUND FRACTURE,21,"(1600,)",False,To fit together 2 corresponding items & to fight with gloves in a ring,matchbox,1,0
5817,2009-12-22,Ryan Chaffee game 3.,Double Jeopardy,"(1, 5)","""U"" COUNTRIES",5,"(300,)",True,Islam Karimov has been the president of this Central Asian nation since 1991,Uzbekistan,1,0
5817,2009-12-22,Ryan Chaffee game 3.,Double Jeopardy,"(2, 5)",GREAT DAMES,27,"(2000,)",False,"Hello, possums!  In 2006 her (?) face was on Australian stamps as an ""Australian Legend""; so was Barry Humphries'",Dame Edna,0,3
5817,2009-12-22,Ryan Chaffee game 3.,Double Jeopardy,"(3, 5)",WRITERS' MIDDLE NAMES,14,"(2000,)",False,"""Cross Creek"" chronicler:Kinnan",Marjorie Kinnan Rawlings,0,3
5817,2009-12-22,Ryan Chaffee game 3.,Double Jeopardy,"(4, 5)",INDULGE YOURSELF,25,"(2000,)",False,"The name of this caramel-like mixture is Spanish for ""sweet milk""",dulce de leche,1,0
5817,2009-12-22,Ryan Chaffee game 3.,Double Jeopardy,"(5, 5)",MUSIC & MUSICIANS,26,"(2000,)",False,Austrian writer Franz Grillparzer was among the few who saw the genius of this fellow Franz' music,(Franz) Schubert,1,1
5817,2009-12-22,Ryan Chaffee game 3.,Double Jeopardy,"(6, 5)",SET THE COMPOUND FRACTURE,23,"(2000,)",False,A gymnastics trestle & a drama,horseplay,0,3
5817,2009-12-22,Ryan Chaffee game 3.,Final Jeopardy,"(1, 1)",FLAGS,0,"(2000, 2401, 0)",False,"In a policy begun in 2002 as a symbol of the War on Terrorism, U.S. Navy ships fly the 18th c. flag with this 4-word motto",Dont tread on me,1,2
