epNum,airDate,extra_info,round_name,coord,category,order,value,daily_double,question,answer,correctAttempts,wrongAttempts
5938,2010-06-09,,Jeopardy,"(1, 1)",THE VIKINGS,6,"(200,)",False,"Almost a yard long, this 5-letter weapon had a decorated hilt & was often given a personal name by its Viking owner",a sword,1,0
5938,2010-06-09,,Jeopardy,"(2, 1)",TALES FROM THE SCRIPT,9,"(200,)",False,"Francis Ford Coppola said that to satisfy Al Pacino, he rewrote the first sequel in this series over a weekend",The Godfather,1,0
5938,2010-06-09,,Jeopardy,"(3, 1)",20 IS PLENTY,1,"(200,)",False,It means that you can see from 6 meters away what should normally be seen at that distance,20/20 vision,1,0
5938,2010-06-09,,Jeopardy,"(4, 1)","WHAT'S ""BLACK"" & ""WHITE""?",14,"(200,)",False,"In Las Vegas, I tell the dealer to ""hit me"" when I want another card in this game",blackjack,1,0
5938,2010-06-09,,Jeopardy,"(5, 1)",READ ALL OVER,23,"(200,)",False,This Harper Lee novel has been required reading in Australian & Canadian schools as well as in the United States,To Kill a Mockingbird,1,0
5938,2010-06-09,,Jeopardy,"(6, 1)",NEWSPAPERS,19,"(200,)",False,This national newspaper was first distributed in 1982 in the Baltimore & Washington areas,USA Today,1,0
5938,2010-06-09,,Jeopardy,"(1, 2)",THE VIKINGS,7,"(400,)",False,"(Sarah of the Clue Crew shows a map on the monitor.)  In three waves, the Vikings expanded their territory; the Norwegians sailed south and west, the Swedes marched eastward, & these people raided mainland Europe as far south as the Strait of Gibraltar",the Danes,1,0
5938,2010-06-09,,Jeopardy,"(2, 2)",TALES FROM THE SCRIPT,10,"(400,)",False,"The script for ""Casablanca"" read, ""Here's good luck to you, kid""; Bogart changed it to this","""Here\'s looking at you, kid""",1,0
5938,2010-06-09,,Jeopardy,"(3, 2)",20 IS PLENTY,2,"(400,)",False,"In a 19th century story, he sleeps for 20 years",Rip Van Winkle,1,0
5938,2010-06-09,,Jeopardy,"(4, 2)","WHAT'S ""BLACK"" & ""WHITE""?",15,"(400,)",False,"Embezzlement, tax evasion & mail fraud are all examples of this type of crime",white-collar,1,0
5938,2010-06-09,,Jeopardy,"(5, 2)",READ ALL OVER,24,"(400,)",False,An Indian-born English professor had to read this first Harry Potter novel 35 times before translating it into Hindi,Harry Potter and the Sorceror\'s Stone,1,0
5938,2010-06-09,,Jeopardy,"(6, 2)",NEWSPAPERS,20,"(400,)",False,This newspaper was started at the urging of Mary Baker Eddy as a response to the sensationalism of the popular press,The Christian Science Monitor,1,0
5938,2010-06-09,,Jeopardy,"(1, 3)",THE VIKINGS,8,"(600,)",False,In 832 residents of Armagh on this island couldn't get a break; they were invaded by the Vikings 3 times in one month,Ireland,1,0
5938,2010-06-09,,Jeopardy,"(2, 3)",TALES FROM THE SCRIPT,11,"(600,)",False,"This script had Indy going hand to hand against the man with the scimitar--but Harrison had food poisoning, so he just shot him",Raiders of the Lost Ark,1,0
5938,2010-06-09,,Jeopardy,"(3, 3)",20 IS PLENTY,3,"(600,)",False,Jamie Oliver has an iPhone app of 20-minute these,recipes,1,0
5938,2010-06-09,,Jeopardy,"(4, 3)","WHAT'S ""BLACK"" & ""WHITE""?",16,"(600,)",False,"Songs featured on it include ""Dear Prudence"" & ""Happiness is a Warm Gun""","the ""White Album""",1,0
5938,2010-06-09,,Jeopardy,"(5, 3)",READ ALL OVER,26,"(600,)",False,"With an e-reader edition of his ""Little Bed Book"", you can take this chairman's quotes everywhere with you",Mao,1,0
5938,2010-06-09,,Jeopardy,"(6, 3)",NEWSPAPERS,21,"(600,)",False,"This paper was shut down in 1991 by Boris Yeltsin, but there have been recent incarnations",Pravda,1,0
5938,2010-06-09,,Jeopardy,"(1, 4)",THE VIKINGS,29,"(800,)",False,Viking ships had sails made of this dense woven fabric; natural lanolin made the fabric water repellent,wool,1,0
5938,2010-06-09,,Jeopardy,"(2, 4)",TALES FROM THE SCRIPT,12,"(800,)",False,Marlon Brando returned the script to this 1954 Elia Kazan classic unread; the part nearly went to Frank Sinatra,On the Waterfront,1,0
5938,2010-06-09,,Jeopardy,"(3, 4)",20 IS PLENTY,4,"(800,)",False,Resh is the 20th letter in this alphabet,the Hebrew alphabet,1,0
5938,2010-06-09,,Jeopardy,"(4, 4)","WHAT'S ""BLACK"" & ""WHITE""?",17,"(800,)",False,"Thanks to a group of science students, in 2006 this largest mammal of Alabama became the state's official mammal",the black bear,0,3
5938,2010-06-09,,Jeopardy,"(5, 4)",READ ALL OVER,27,"(800,)",False,One of the most translated authors in the world is this founder of Dianetics & Scientology,L. Ron Hubbard,1,0
5938,2010-06-09,,Jeopardy,"(6, 4)",NEWSPAPERS,22,"(800,)",False,"Days after it was founded, this Sacramento paper stung the state treasurer with an expose that got him impeached",the Bee,1,0
5938,2010-06-09,,Jeopardy,"(1, 5)",THE VIKINGS,30,"(1000,)",False,"Banned from Iceland for 3 years after being convicted of manslaughter, he headed to Greenland in 982",Erik the Red,1,0
5938,2010-06-09,,Jeopardy,"(2, 5)",TALES FROM THE SCRIPT,13,"(1000,)",False,"Ben Hecht didn't know the story, so Victor Fleming & David O. Selznick acted it out for him as he rewrote this script",Gone with the Wind,0,3
5938,2010-06-09,,Jeopardy,"(3, 5)",20 IS PLENTY,5,"(1000,)",False,20 is the number of grooves on this classical column style,Doric,0,3
5938,2010-06-09,,Jeopardy,"(4, 5)","WHAT'S ""BLACK"" & ""WHITE""?",18,"(1000,)",False,Expression meaning an unwanted possession that's hard to get rid of,a white elephant,1,0
5938,2010-06-09,,Jeopardy,"(5, 5)",READ ALL OVER,28,"(2000,)",True,"In Spanish speaking countries, this 19th century novel is ""Historia de Dos Ciudades""",A Tale of Two Cities,1,0
5938,2010-06-09,,Jeopardy,"(6, 5)",NEWSPAPERS,25,"(1000,)",False,It was started on the orders of de Gaulle in 1944 to provide a respected voice,Le Monde,0,3
5938,2010-06-09,,Double Jeopardy,"(1, 1)",MIDDLE EAST GEOGRAPHY,16,"(400,)",False,These 2 rivers meet north of the city of Basra,the Tigris & Euphrates,1,0
5938,2010-06-09,,Double Jeopardy,"(2, 1)",2001: A SPORTS ODYSSEY,21,"(400,)",False,"When Mr. Woods won the Masters to hold all 4 major titles at once, it was dubbed not the Grand Slam but this",the Tiger Slam,0,3
5938,2010-06-09,,Double Jeopardy,"(3, 1)",PICTURE THE WORLD LEADER,19,"(400,)",False,"""Good show, old man.  Hey, what?""  This labor guy took the top spot in 2007",(Gordon) Brown,1,0
5938,2010-06-09,,Double Jeopardy,"(4, 1)",CLASSICAL MUSIC,11,"(400,)",False,A 1786 Mozart opera concerns his nuptials,Figaro,1,0
5938,2010-06-09,,Double Jeopardy,"(5, 1)",VIRAL VIDEO,2,"(400,)",False,"There's a DVD of the PBS ""American Experience"" show ""The Great Fever"", about Walter Reed & this ""colorful"" viral disease",yellow fever,1,0
5938,2010-06-09,,Double Jeopardy,"(6, 1)","XXX""O""",5,"(400,)",False,The dog that went to Oz,Toto,1,0
5938,2010-06-09,,Double Jeopardy,"(1, 2)",MIDDLE EAST GEOGRAPHY,17,"(800,)",False,Ras Mohammed National Park at the southern end of this peninsula was Egypt's first national park,the Sinai Peninsula,1,0
5938,2010-06-09,,Double Jeopardy,"(2, 2)",2001: A SPORTS ODYSSEY,22,"(800,)",False,"In 2001, he hit .300 with 36 homers & appeared on Celebrity ""Jeopardy!""",Mike Piazza,0,3
5938,2010-06-09,,Double Jeopardy,"(3, 2)",PICTURE THE WORLD LEADER,20,"(800,)",False,The United States has had some issues with this South American man,Hugo Chavez,0,3
5938,2010-06-09,,Double Jeopardy,"(4, 2)",CLASSICAL MUSIC,12,"(800,)",False,"In 1741, if oratorio lovers asked this composer, ""Where's your 'Messiah' now?"", he could say, ""I just finished it""",Handel,1,0
5938,2010-06-09,,Double Jeopardy,"(5, 2)",VIRAL VIDEO,3,"(800,)",False,Cujo had this viral disease,rabies,1,0
5938,2010-06-09,,Double Jeopardy,"(6, 2)","XXX""O""",6,"(800,)",False,Texas city on the Rio Brazos,Waco,1,0
5938,2010-06-09,,Double Jeopardy,"(1, 3)",MIDDLE EAST GEOGRAPHY,18,"(1000,)",True,"The Omani peninsula of Musandam juts into this strait, an important route for oil tankers",the Strait of Hormuz,0,1
5938,2010-06-09,,Double Jeopardy,"(2, 3)",2001: A SPORTS ODYSSEY,23,"(1200,)",False,Shane Battier's jersey was retired by this school before he led it to the NCAA basketball title,Duke,0,3
5938,2010-06-09,,Double Jeopardy,"(3, 3)",PICTURE THE WORLD LEADER,25,"(1200,)",False,"In 2008, this African leader won election in controversial fashion",Mugabe,0,3
5938,2010-06-09,,Double Jeopardy,"(4, 3)",CLASSICAL MUSIC,13,"(1200,)",False,"Al Hirt jazzed up this Rimsky-Korsakov tune for the '60s ""Green Hornet""' TV series","""Flight Of The Bumblebee""",1,0
5938,2010-06-09,,Double Jeopardy,"(5, 3)",VIRAL VIDEO,4,"(1200,)",False,"nationalgeographic.com has a video about how this disease softened up the Inca, easing the Spanish conquest",smallpox,1,0
5938,2010-06-09,,Double Jeopardy,"(6, 3)","XXX""O""",7,"(1200,)",False,He succeeded Claudius as Roman emperor,Nero,1,0
5938,2010-06-09,,Double Jeopardy,"(1, 4)",MIDDLE EAST GEOGRAPHY,24,"(1600,)",False,"Israel's third-largest city, this port was built on the northern slopes of Mount Carmel",Haifa,1,0
5938,2010-06-09,,Double Jeopardy,"(2, 4)",2001: A SPORTS ODYSSEY,28,"(1600,)",False,This AFC East team went from last to first place on its way to its first Super Bowl title,the New England Patriots,0,3
5938,2010-06-09,,Double Jeopardy,"(4, 4)",CLASSICAL MUSIC,14,"(1600,)",False,"He's the title guy who ""spake"" in an 1896 tone poem by Richard Strauss",Zarathustra,1,0
5938,2010-06-09,,Double Jeopardy,"(5, 4)",VIRAL VIDEO,10,"(3000,)",True,"""Fatal Contact"" is a 2006 TV movie about this fowl disease",bird flu (avian flu),1,0
5938,2010-06-09,,Double Jeopardy,"(6, 4)","XXX""O""",8,"(1600,)",False,African republic of 6 million on the Gulf of Guinea,Togo,1,0
5938,2010-06-09,,Double Jeopardy,"(1, 5)",MIDDLE EAST GEOGRAPHY,29,"(2000,)",False,This country's provinces include Nabatiyeh & Beqaa,Lebanon,0,3
5938,2010-06-09,,Double Jeopardy,"(2, 5)",2001: A SPORTS ODYSSEY,27,"(2000,)",False,This Aussie lliving llegend became the youngest year-end No. 1 in men's tennis history,Lleyton Hewitt,1,0
5938,2010-06-09,,Double Jeopardy,"(3, 5)",PICTURE THE WORLD LEADER,26,"(2000,)",False,"Check out this zillionaire--a European prime minister in 1994, 2001 to 2006 & again since 2008",Berlusconi,1,0
5938,2010-06-09,,Double Jeopardy,"(4, 5)",CLASSICAL MUSIC,15,"(2000,)",False,"This Italian composer known for his Concerti Grossi, Opus 6, played violin, not mandolin",Corelli,0,3
5938,2010-06-09,,Double Jeopardy,"(5, 5)",VIRAL VIDEO,1,"(2000,)",False,"The webmd.com video archive includes one on the future of the HPV vaccine, HPV standing for human this",papilloma virus,1,1
5938,2010-06-09,,Double Jeopardy,"(6, 5)","XXX""O""",9,"(2000,)",False,Partisan Guerrilla leader of Yugoslavia against the Nazis in WWII,Tito,1,0
5938,2010-06-09,,Final Jeopardy,"(1, 1)",ARTISTS,0,"(3600, 600, 0)",False,"She's seen wearing a rebozo in her 1937 ""Self-Portrait Dedicated to Leon Trotsky""",Frida Kahlo,2,1
