epNum,airDate,extra_info,round_name,coord,category,order,value,daily_double,question,answer,correctAttempts,wrongAttempts
5950,2010-06-25,,Jeopardy,"(1, 1)",IT HAPPENED IN JUNE,16,"(200,)",False,"On June 16, 1858 this man gave his ""House Divided"" speech in Springfield, Illinois",Abraham Lincoln,1,0
5950,2010-06-25,,Jeopardy,"(2, 1)",NAME THAT SPORTS CONFERENCE,6,"(200,)",False,"Michigan,Ohio State",the Big Ten,1,0
5950,2010-06-25,,Jeopardy,"(3, 1)",KEEP ON TRUCKIN',22,"(200,)",False,In 2010 the D.O.T. issued rules banning this new form of communication by truckers while driving,texting,1,0
5950,2010-06-25,,Jeopardy,"(4, 1)",CHICK LIT,17,"(200,)",False,"Rebecca is an unrepentant spender in Sophie Kinsella's ""Confessions of"" this",a Shopaholic,1,0
5950,2010-06-25,,Jeopardy,"(5, 1)",WE PREDICT YOU'LL DEAL WITH THE ZODIAC,11,"(200,)",False,"Nothing, or perhaps everything, is fishy about Neptune being one of the 2 planets said to rule this sign",Pisces,1,0
5950,2010-06-25,,Jeopardy,"(6, 1)",BODY LANGUAGE,1,"(200,)",False,"A kleptomaniac could be accused of having ""sticky"" these",fingers,1,0
5950,2010-06-25,,Jeopardy,"(1, 2)",IT HAPPENED IN JUNE,18,"(400,)",False,"Acrobat Charles Blondin crossed this North American landmark on a tightrope on June 30, 1859",Niagara Falls,1,0
5950,2010-06-25,,Jeopardy,"(2, 2)",NAME THAT SPORTS CONFERENCE,7,"(400,)",False,"Oregon,Oregon State",the Pac-10,1,0
5950,2010-06-25,,Jeopardy,"(3, 2)",KEEP ON TRUCKIN',23,"(400,)",False,"""Massive"" rhyming term for your standard tractor-trailer truck",big rig,1,0
5950,2010-06-25,,Jeopardy,"(4, 2)",CHICK LIT,27,"(400,)",False,"6 Californians read & discuss ""Persuasion"", ""Emma"" & 4 other novels in Karen Joy Fowler's novel her ""Book Club""",Jane Austen,1,0
5950,2010-06-25,,Jeopardy,"(5, 2)",WE PREDICT YOU'LL DEAL WITH THE ZODIAC,12,"(400,)",False,"The 10th sign of the zodiac, this cardinal earth sign really gets your goat",Capricorn,1,1
5950,2010-06-25,,Jeopardy,"(6, 2)",BODY LANGUAGE,2,"(400,)",False,"Intimidation using looks or words is called this kind of ""beating""",brow beating,0,3
5950,2010-06-25,,Jeopardy,"(1, 3)",IT HAPPENED IN JUNE,19,"(600,)",False,In June 2006 this newsman ended his 44-year career at CBS,Dan Rather,1,0
5950,2010-06-25,,Jeopardy,"(2, 3)",NAME THAT SPORTS CONFERENCE,8,"(600,)",False,"Baylor,Oklahoma",the Big 12,1,0
5950,2010-06-25,,Jeopardy,"(3, 3)",KEEP ON TRUCKIN',24,"(600,)",False,"In 2008 Atlanta truckers protested the rising price of this type of fuel, their lifeline",Diesel,1,0
5950,2010-06-25,,Jeopardy,"(4, 3)",CHICK LIT,28,"(600,)",False,"Andrea Sachs, assistant to the editor of a fashion magazine, is the protagonist of this novel by Lauren Weisberger",The Devil Wears Prada,1,0
5950,2010-06-25,,Jeopardy,"(5, 3)",WE PREDICT YOU'LL DEAL WITH THE ZODIAC,13,"(600,)",False,"""The Astrology Encyclopedia"" says the key phrase for this sign is ""I balance""",Libra,1,0
5950,2010-06-25,,Jeopardy,"(6, 3)",BODY LANGUAGE,3,"(600,)",False,"If you're earning money rapidly, you're said to be making it this body part ""over"" this partner body part",hand over fist,1,0
5950,2010-06-25,,Jeopardy,"(1, 4)",IT HAPPENED IN JUNE,20,"(1000,)",True,"According to calculations by  Eratosthenes, it was June 11, 1184 B.C. that this mythic city was sacked & burned",Troy,0,1
5950,2010-06-25,,Jeopardy,"(2, 4)",NAME THAT SPORTS CONFERENCE,9,"(800,)",False,"Alabama,Georgia",the SEC,1,0
5950,2010-06-25,,Jeopardy,"(3, 4)",KEEP ON TRUCKIN',25,"(800,)",False,"Also called splash guards, these on a truck help prevent splashing on following cars",mud flaps,1,0
5950,2010-06-25,,Jeopardy,"(4, 4)",CHICK LIT,29,"(800,)",False,A sisterly rivalry to give Henry VIII a male heir is the basis for this Philippa Gregory historical novel,The Other Boleyn Girl,1,0
5950,2010-06-25,,Jeopardy,"(5, 4)",WE PREDICT YOU'LL DEAL WITH THE ZODIAC,14,"(800,)",False,A person born under this May 22-June 21 sign is said to have a 2-sided personality & to often change moods quickly,Gemini,1,0
5950,2010-06-25,,Jeopardy,"(6, 4)",BODY LANGUAGE,4,"(800,)",False,This 2-word phrase means space to work comfortably & mentions a certain joint,elbow room,1,0
5950,2010-06-25,,Jeopardy,"(1, 5)",IT HAPPENED IN JUNE,21,"(1000,)",False,"This leader did some sightseeing around a newly defeated Paris on June 23, 1940",Adolf Hitler,1,0
5950,2010-06-25,,Jeopardy,"(2, 5)",NAME THAT SPORTS CONFERENCE,10,"(1000,)",False,"Boise State,Fresno State",the Western Athletic Conference,0,3
5950,2010-06-25,,Jeopardy,"(3, 5)",KEEP ON TRUCKIN',26,"(1000,)",False,Truckers know these have a range of about 25 miles in motor vehicles & federally limited power of 4 watts,C.B. radios,1,1
5950,2010-06-25,,Jeopardy,"(4, 5)",CHICK LIT,30,"(1000,)",False,"Her classics of the genre include ""Lipstick Jungle"", ""4 Blondes"" &, of course, ""Sex and the City""",Candace Bushnell,1,0
5950,2010-06-25,,Jeopardy,"(5, 5)",WE PREDICT YOU'LL DEAL WITH THE ZODIAC,15,"(1000,)",False,"(Sarah of the Clue Crew shows two zodiological signs on the monitor.) The symbol for Virgo & this sign are sometimes confused, but the difference is the tail pointing outward",Scorpio,1,1
5950,2010-06-25,,Jeopardy,"(6, 5)",BODY LANGUAGE,5,"(1000,)",False,"To seriously apply oneself or redouble one's efforts is to this body part ""down""",knuckle,0,3
5950,2010-06-25,,Double Jeopardy,"(1, 1)",SUPER,17,"(400,)",False,"The 2006 film ""Superman Returns"" contains a dedication to this actor who died in 2004",Christopher Reeve,1,0
5950,2010-06-25,,Double Jeopardy,"(2, 1)",CALI,1,"(400,)",False,Events in 1849 certainly helped California earn this official state nickname,The Golden State,1,0
5950,2010-06-25,,Double Jeopardy,"(3, 1)",GO BALLISTIC!,16,"(400,)",False,"Ballistics, the science of projectiles, comes from the Greek ""ballein"", to do this to something",throw,0,3
5950,2010-06-25,,Double Jeopardy,"(4, 1)",EXPO,6,"(400,)",False,In 1986 the world came to this Canadian city for an expo; in 2010 the world was back,Vancouver,1,1
5950,2010-06-25,,Double Jeopardy,"(5, 1)","""ALL""",9,"(400,)",False,"A small one is a cascade; a large one, a cataract",a waterfall,1,0
5950,2010-06-25,,Double Jeopardy,"(6, 1)",A CROCUS,23,"(400,)",False,"Crocuses grow from corms, sometimes called ""solid"" these objects from which tulips grow",bulbs,1,0
5950,2010-06-25,,Double Jeopardy,"(1, 2)",SUPER,18,"(800,)",False,The title superhero of this 2008 film shares his name with a signer of the Declaration of Independence,Hancock,1,0
5950,2010-06-25,,Double Jeopardy,"(2, 2)",CALI,2,"(800,)",False,This great fracture of California's crust is the principal fault of a 600-mile network of faults across the state,the San Andreas Fault,1,0
5950,2010-06-25,,Double Jeopardy,"(3, 2)",GO BALLISTIC!,22,"(800,)",False,"A projectile's trajectory is subject to gravity, lift & this force that's heavily dependent on nose shape",drag,0,3
5950,2010-06-25,,Double Jeopardy,"(4, 2)",EXPO,7,"(800,)",False,"It's the structure representing a country; at the 1937 Paris Expo, you could see ""Guernica"" at the Spanish one",a pavilion,1,0
5950,2010-06-25,,Double Jeopardy,"(5, 2)","""ALL""",12,"(800,)",False,A booth where items are displayed for sale,a stall,1,0
5950,2010-06-25,,Double Jeopardy,"(6, 2)",A CROCUS,24,"(800,)",False,A king by the name of Crocus was a leader of the Alamanni Tribe when it attacked forces of this empire in 260 A.D.,Rome,1,1
5950,2010-06-25,,Double Jeopardy,"(1, 3)",SUPER,19,"(1200,)",False,"This hero-studded film is set during Nixon's fifth term, as the world is on the brink of nuclear war",Watchmen,1,0
5950,2010-06-25,,Double Jeopardy,"(2, 3)",CALI,3,"(1200,)",False,"This 25,000-square-mile California desert includes Joshua Tree National Park",the Mojave,1,0
5950,2010-06-25,,Double Jeopardy,"(3, 3)",GO BALLISTIC!,28,"(1200,)",False,"This 2-word term that includes part of the gun refers to a bullet's speed as it leaves; 2,000 F.P.S. is not uncommon",muzzle velocity,0,3
5950,2010-06-25,,Double Jeopardy,"(4, 3)",EXPO,8,"(1200,)",False,"Nearly 20,000 homes were demolished in preparation for this Chinese city's 2010 expo",Shanghai,1,0
5950,2010-06-25,,Double Jeopardy,"(5, 3)","""ALL""",13,"(1200,)",False,Ocular orb,an eyeball,1,0
5950,2010-06-25,,Double Jeopardy,"(6, 3)",A CROCUS,25,"(1200,)",False,"Crocus is a shade of this color, as are primrose & jonquil",yellow,1,0
5950,2010-06-25,,Double Jeopardy,"(1, 4)",SUPER,20,"(1600,)",False,"Cutlery was the chosen weapon of the Blue Raja, played by Hank Azaria in this 1999 superfilm spoof",Mystery Men,1,0
5950,2010-06-25,,Double Jeopardy,"(2, 4)",CALI,4,"(1600,)",False,"At 14,495 feet, this peak is California's highest point",Mt. Whitney,1,0
5950,2010-06-25,,Double Jeopardy,"(3, 4)",GO BALLISTIC!,29,"(2000,)",True,An early forensic ballistics debate was central to the 1921 murder trial of these 2 Italian-American anarchists,Sacco & Vanzetti,1,0
5950,2010-06-25,,Double Jeopardy,"(4, 4)",EXPO,10,"(2000,)",True,A 1906 Milan fair celebrated the opening of the Simplon Tunnel under these,the Alps,1,0
5950,2010-06-25,,Double Jeopardy,"(5, 4)","""ALL""",14,"(1600,)",False,Type of commercial site the Westfield Group specializes in running,a shopping mall,1,0
5950,2010-06-25,,Double Jeopardy,"(6, 4)",A CROCUS,26,"(1600,)",False,"Botanically, the crocus is a member of this 4-letter plant family named for the Greek goddess of the rainbow",iris,1,0
5950,2010-06-25,,Double Jeopardy,"(1, 5)",SUPER,21,"(2000,)",False,"A scene at the end of ""Iron Man"" finds Samuel L. Jackson as this one-eyed S.H.I.E.L.D. director",Nick Fury,0,3
5950,2010-06-25,,Double Jeopardy,"(2, 5)",CALI,5,"(2000,)",False,"Named after a companion of St. Paul, this ""San"" county is the largest in area in the lower 48",San Bernardino County,1,0
5950,2010-06-25,,Double Jeopardy,"(3, 5)",GO BALLISTIC!,30,"(2000,)",False,Internal ballistics studies the conversion of a propellant's chemical energy into a projectile's energy of this type,kinetic,0,3
5950,2010-06-25,,Double Jeopardy,"(4, 5)",EXPO,11,"(2000,)",False,"A 21-hour production of this Goethe tale was a highlight of the 2000 expo in Hanover, Germany",Faust,1,0
5950,2010-06-25,,Double Jeopardy,"(5, 5)","""ALL""",15,"(2000,)",False,"On a Volga River cruise, Uglich & Yaroslavl might be these 3-word stops",ports of call,1,0
5950,2010-06-25,,Double Jeopardy,"(6, 5)",A CROCUS,27,"(2000,)",False,Early cultivation of crocus is depicted in frescoes found in this Mediterranean island's Knossos Archaeology Site,Crete,1,0
5950,2010-06-25,,Final Jeopardy,"(1, 1)",LITERATURE & MUSIC,0,"(3800, 3601, 12005)",False,"The band called ""They Might Be Giants"" ultimately gets its name from a phrase said by this title hero in a 1605 work",Don Quixote,0,3
