epNum,airDate,extra_info,round_name,coord,category,order,value,daily_double,question,answer,correctAttempts,wrongAttempts
6043,2010-12-15,Tom Nissley game 2.,Jeopardy,"(1, 1)",ART,11,"(200,)",False,It can mean the closely woven durable cloth on which oil paintings are made or refer to the painting itself,a canvas,1,0
6043,2010-12-15,Tom Nissley game 2.,Jeopardy,"(2, 1)",ONE FACT AMONG THE FALSE GOSSIP,1,"(200,)",False,"She & Billy Ray are doing a Metallica tribute album!  She voiced Penny in the film ""Bolt""!  She has 14 toes!",Miley Cyrus,1,1
6043,2010-12-15,Tom Nissley game 2.,Jeopardy,"(3, 1)",MALL-EDGE,6,"(200,)",False,"You can donate old eyewear to the mall store called this ""Hut"", which gives it to a charity called OneSight",Sunglass Hut International,1,1
6043,2010-12-15,Tom Nissley game 2.,Jeopardy,"(4, 1)",THE CITY'S MAYOR,16,"(200,)",False,Richard Daley (1955 to 1976),Chicago,1,0
6043,2010-12-15,Tom Nissley game 2.,Jeopardy,"(5, 1)",LET THE GAMES BEGIN,21,"(200,)",False,Joint military exercises like the ones the U.S. conducts with South Korea also have this more playful name,war games,1,0
6043,2010-12-15,Tom Nissley game 2.,Jeopardy,"(6, 1)","""D"" BRIEFING",26,"(200,)",False,"""Arid"" sheets of plasterboard used in home construction",drywall,1,0
6043,2010-12-15,Tom Nissley game 2.,Jeopardy,"(1, 2)",ART,12,"(400,)",False,"In Britain the last name of this British painter (1776-1837) means ""police officer""",(John) Constable,1,0
6043,2010-12-15,Tom Nissley game 2.,Jeopardy,"(2, 2)",ONE FACT AMONG THE FALSE GOSSIP,2,"(400,)",False,"She's dating the Jonas Brothers! She rejoined her friend Courteney Cox as Tina on ""Dirt""! She's dating Wilford Brimley!",Jennifer Aniston,1,0
6043,2010-12-15,Tom Nissley game 2.,Jeopardy,"(3, 2)",MALL-EDGE,7,"(400,)",False,A&F is short for this store that sells collegiate-inspired clothing,Abercrombie & Fitch,1,0
6043,2010-12-15,Tom Nissley game 2.,Jeopardy,"(4, 2)",THE CITY'S MAYOR,17,"(400,)",False,Marion Barry (1978 to 1990),"Washington, D.C.",1,0
6043,2010-12-15,Tom Nissley game 2.,Jeopardy,"(5, 2)",LET THE GAMES BEGIN,22,"(400,)",False,"The first world mind sports games, Beijing 2008, included chess, checkers & this card game",bridge,0,3
6043,2010-12-15,Tom Nissley game 2.,Jeopardy,"(6, 2)","""D"" BRIEFING",27,"(400,)",False,Necrolatry is the worship of this group who don't get around much anymore,the dead,1,0
6043,2010-12-15,Tom Nissley game 2.,Jeopardy,"(1, 3)",ART,13,"(600,)",False,"Her dominant motifs, the animal bones & landscape of the Southwest, are seen here",Georgia O\'Keeffe,1,0
6043,2010-12-15,Tom Nissley game 2.,Jeopardy,"(2, 3)",ONE FACT AMONG THE FALSE GOSSIP,3,"(600,)",False,"He invented the guitar!  He played defective Allen Gamble in ""The Other Guys""!  He taught cowbell at USC!",Will Ferrell,1,0
6043,2010-12-15,Tom Nissley game 2.,Jeopardy,"(3, 3)",MALL-EDGE,8,"(600,)",False,"Take a break from shopping & head to the food court for ""sbaghetti"" from this franchise that started as a Brooklyn grocery",Sbarro\'s,1,0
6043,2010-12-15,Tom Nissley game 2.,Jeopardy,"(4, 3)",THE CITY'S MAYOR,18,"(600,)",False,Tom Bradley (1973 to 1993),Los Angeles,1,0
6043,2010-12-15,Tom Nissley game 2.,Jeopardy,"(5, 3)",LET THE GAMES BEGIN,23,"(1000,)",True,"These games held in Rio in 2007 & slated for Guadalajara in 2011, outlived the similarly named airline",the Pan Am games,0,1
6043,2010-12-15,Tom Nissley game 2.,Jeopardy,"(6, 3)","""D"" BRIEFING",28,"(600,)",False,The shot put & the pole vault are 2 of the events in this track & field contest,the decathlon,1,0
6043,2010-12-15,Tom Nissley game 2.,Jeopardy,"(1, 4)",ART,14,"(800,)",False,"This Belgian artist's painting ""Threatening Weather"" includes a cloud shaped like a tuba",Rene Magritte,0,3
6043,2010-12-15,Tom Nissley game 2.,Jeopardy,"(2, 4)",ONE FACT AMONG THE FALSE GOSSIP,4,"(800,)",False,"This dame is really from Des Moines!  Between 1998 & 2007, this dame got 6 Oscar noms!  This dame is having Kid Rock's love child!",Judi Dench,1,0
6043,2010-12-15,Tom Nissley game 2.,Jeopardy,"(3, 4)",MALL-EDGE,9,"(800,)",False,It's crystal clear that this store uses the logo seen here,Swarovski,1,0
6043,2010-12-15,Tom Nissley game 2.,Jeopardy,"(4, 4)",THE CITY'S MAYOR,19,"(800,)",False,Ed Koch (1978 to 1989),New York City,1,0
6043,2010-12-15,Tom Nissley game 2.,Jeopardy,"(5, 4)",LET THE GAMES BEGIN,24,"(800,)",False,These games for athletes with physical disabilities began in Rome in 1960,the Paralympics,1,1
6043,2010-12-15,Tom Nissley game 2.,Jeopardy,"(6, 4)","""D"" BRIEFING",29,"(800,)",False,"This undemocratic type of government comes from the Latin for ""to say""",a dictatorship,1,0
6043,2010-12-15,Tom Nissley game 2.,Jeopardy,"(1, 5)",ART,15,"(1000,)",False,The name of this heavily decorated & frothy 18th century style was coined by Maurice Quai as a term of ridicule,rococo,1,1
6043,2010-12-15,Tom Nissley game 2.,Jeopardy,"(2, 5)",ONE FACT AMONG THE FALSE GOSSIP,5,"(1000,)",False,"He grew up in Werewolfia, Wyo.! He played Jacob the werewolf in ""New Moon""! He is, in fact, a werewolf!",Taylor Lautner,1,0
6043,2010-12-15,Tom Nissley game 2.,Jeopardy,"(3, 5)",MALL-EDGE,10,"(1000,)",False,"The Madewell brand was re-launched by this mall & catalog retailer, a favorite of Michelle Obama",J. Crew,1,0
6043,2010-12-15,Tom Nissley game 2.,Jeopardy,"(4, 5)",THE CITY'S MAYOR,20,"(1000,)",False,"Jerry Springer (1977 to 1981); yes, that Jerry Springer",Cincinnati,1,0
6043,2010-12-15,Tom Nissley game 2.,Jeopardy,"(5, 5)",LET THE GAMES BEGIN,25,"(1000,)",False,"These are held wherever Scottish culture has spread, like Maxville, Ontario, home of the Glengarry ones",the Highland Games,1,0
6043,2010-12-15,Tom Nissley game 2.,Jeopardy,"(6, 5)","""D"" BRIEFING",30,"(1000,)",False,Directional term meaning along the flight line away from a missile launching site,downrange,0,3
6043,2010-12-15,Tom Nissley game 2.,Double Jeopardy,"(1, 1)",CANADIAN GEOGRAPHY,18,"(400,)",False,"This French-speaking city is 150 miles down the St. Lawrence from Montreal, at the confluence of the St. Charles",Quebec City,1,0
6043,2010-12-15,Tom Nissley game 2.,Double Jeopardy,"(2, 1)",COWBOY SONGS,26,"(400,)",False,"The song ""The Streets of"" this Texas town is also known as ""The Cowboy's Lament""","""Laredo""",1,0
6043,2010-12-15,Tom Nissley game 2.,Double Jeopardy,"(3, 1)",AMERICAN POETRY,2,"(400,)",False,"Ogden Nash wrote that this explorer ""discovered America and they put him in jail for it""",Columbus,1,0
6043,2010-12-15,Tom Nissley game 2.,Double Jeopardy,"(4, 1)",COLORFUL FOODS,1,"(400,)",False,"An annual Jackson, Mississippi festival celebrates the pairing of these legumes & rice",red beans,1,0
6043,2010-12-15,Tom Nissley game 2.,Double Jeopardy,"(5, 1)",LET'S GET SMALL,13,"(400,)",False,"(Jimmy of the Clue Crew presents the clue on a monitor.)  Round, rod-like, and spiral are the three main shapes of these organisms",bacteria,1,0
6043,2010-12-15,Tom Nissley game 2.,Double Jeopardy,"(6, 1)",MANDARIN CHINESE,10,"(400,)",False,"Che is the word & character for vehicle: huo che, or ""fire vehicle"", is this transport that can take you across China",a train,1,1
6043,2010-12-15,Tom Nissley game 2.,Double Jeopardy,"(1, 2)",CANADIAN GEOGRAPHY,19,"(5000,)",True,"This province has 3 counties: Kings, Queens & Prince",Prince Edward Island,1,0
6043,2010-12-15,Tom Nissley game 2.,Double Jeopardy,"(2, 2)",COWBOY SONGS,27,"(800,)",False,"In Marty Robbins' ""El Paso"", the ""music would play and Felina would whirl"" in her cantina",Rosa\'s Cantina,0,3
6043,2010-12-15,Tom Nissley game 2.,Double Jeopardy,"(3, 2)",AMERICAN POETRY,3,"(800,)",False,"In ""Stopping by Woods on a Snowy Evening"", he wrote that he had ""promises to keep, and miles to go before I sleep""",(Robert) Frost,1,0
6043,2010-12-15,Tom Nissley game 2.,Double Jeopardy,"(4, 2)",COLORFUL FOODS,7,"(800,)",False,You couldn't get a better example of a certain light-orange color than this,salmon,1,0
6043,2010-12-15,Tom Nissley game 2.,Double Jeopardy,"(5, 2)",LET'S GET SMALL,14,"(800,)",False,"Preparing objects for a microscope may include sectioning & this, the dyeing of the object for study",staining,0,3
6043,2010-12-15,Tom Nissley game 2.,Double Jeopardy,"(6, 2)",MANDARIN CHINESE,11,"(800,)",False,Some English names have standard Chinese versions; this gospel writer is Yuehan,John,1,0
6043,2010-12-15,Tom Nissley game 2.,Double Jeopardy,"(1, 3)",CANADIAN GEOGRAPHY,20,"(1200,)",False,"Cape Spear, Canada's easternmost point, is a short drive from St. John's, the capital of this province",Newfoundland,1,0
6043,2010-12-15,Tom Nissley game 2.,Double Jeopardy,"(2, 3)",COWBOY SONGS,28,"(1200,)",False,"These apparitions were chasing a herd of red-eyed cows whose ""hooves were made of steel""",the Ghost Riders (in the sky),1,0
6043,2010-12-15,Tom Nissley game 2.,Double Jeopardy,"(3, 3)",AMERICAN POETRY,4,"(1200,)",False,"In ""The Courtship of Miles Standish"", Longfellow wrote, ""Youngest of all was he of the men who came in"" this ship",the Mayflower,1,0
6043,2010-12-15,Tom Nissley game 2.,Double Jeopardy,"(4, 3)",COLORFUL FOODS,8,"(1200,)",False,"It's penicillium that gives these, like Gorgonzola, the color in their name",blue cheese,1,0
6043,2010-12-15,Tom Nissley game 2.,Double Jeopardy,"(5, 3)",LET'S GET SMALL,15,"(1200,)",False,These asexual reproductive cells can be used to identify different types of molds,spores,1,0
6043,2010-12-15,Tom Nissley game 2.,Double Jeopardy,"(6, 3)",MANDARIN CHINESE,12,"(1200,)",False,"The ""sh"" in... [Deng ""Sh""iaoping] ...has no exact equivalent in English; it's usually rendered with this letter",an X,1,0
6043,2010-12-15,Tom Nissley game 2.,Double Jeopardy,"(1, 4)",CANADIAN GEOGRAPHY,21,"(1600,)",False,The 4th daughter of Queen Victoria lent 1 of her names to a province & another to this emerald-colored lake near Banff,(Lake) Louise,1,1
6043,2010-12-15,Tom Nissley game 2.,Double Jeopardy,"(3, 4)",AMERICAN POETRY,5,"(1600,)",False,"This Poe maiden lived ""in a kingdom by the sea""",Annabel Lee,1,0
6043,2010-12-15,Tom Nissley game 2.,Double Jeopardy,"(4, 4)",COLORFUL FOODS,9,"(1600,)",False,This variety of kale has a color in its two-word name,collard greens,1,0
6043,2010-12-15,Tom Nissley game 2.,Double Jeopardy,"(5, 4)",LET'S GET SMALL,16,"(1600,)",False,This type of high resolution microscope with a particle in its name is used to magnify objects up to 1 million times,an electron microscope,1,0
6043,2010-12-15,Tom Nissley game 2.,Double Jeopardy,"(6, 4)",MANDARIN CHINESE,24,"(1600,)",False,"Because Chinese makes limited use of shi as this English verb, ""he very tall"" perfectly acceptable","is (the verb ""to be"")",1,0
6043,2010-12-15,Tom Nissley game 2.,Double Jeopardy,"(1, 5)",CANADIAN GEOGRAPHY,22,"(2000,)",False,"This ""great"" lake on the Arctic circle is the largest lake entirely within Canada",Great Bear Lake,1,0
6043,2010-12-15,Tom Nissley game 2.,Double Jeopardy,"(2, 5)",COWBOY SONGS,29,"(2000,)",False,"This cowboy is a hifalutin', scootin', shootin' son-of-a-gun from Arizona",Ragtime Cowboy Joe,0,3
6043,2010-12-15,Tom Nissley game 2.,Double Jeopardy,"(3, 5)",AMERICAN POETRY,6,"(2000,)",False,"This poet wrote, ""next to of course god america i love you land of the pilgrims' and so forth""",E.E. Cummings,1,0
6043,2010-12-15,Tom Nissley game 2.,Double Jeopardy,"(4, 5)",COLORFUL FOODS,23,"(2000,)",True,Ahi is also called this type of tuna,yellowfin,1,0
6043,2010-12-15,Tom Nissley game 2.,Double Jeopardy,"(5, 5)",LET'S GET SMALL,17,"(2000,)",False,"From the Greek for oblong, this protozoan is only one cell big, but ten letters long",a paramecium,0,3
6043,2010-12-15,Tom Nissley game 2.,Double Jeopardy,"(6, 5)",MANDARIN CHINESE,25,"(2000,)",False,"To communicate you must master the 4 of these: a tip for learning the second, rising one, is to raise your eyebrows",tones,0,3
6043,2010-12-15,Tom Nissley game 2.,Final Jeopardy,"(1, 1)",BRITISH ROYALTY,0,"(4500, 11600, 4401)",False,"From the Latin for ""greatest"", this form of address was introduced by the narcissistic King Richard II",majesty,1,2
