epNum,airDate,extra_info,round_name,coord,category,order,value,daily_double,question,answer,correctAttempts,wrongAttempts
6114,2011-03-24,,Jeopardy,"(1, 1)",A FAIR TO REMEMBER,11,"(200,)",False,Philadelphia's Centennial Exposition of 1876 was held to commemorate the 100th anniversary of this local event,the signing of the Declaration of Independence,1,0
6114,2011-03-24,,Jeopardy,"(2, 1)",THE GENTLE ART OF RUGBY,24,"(200,)",False,"If the ball is in-goal & you hold it & touch it to the earth, 5 points are scored by what's called this electrical term",grounding,0,3
6114,2011-03-24,,Jeopardy,"(3, 1)",RUSSIAN FOOD & DRINK,3,"(200,)",False,This Russian vodka brand is known as Stoli for short,Stolichnaya,1,0
6114,2011-03-24,,Jeopardy,"(4, 1)",WHAT THE HECK IS THAT CRITTER?,16,"(200,)",False,A Guernsey,a cow,1,0
6114,2011-03-24,,Jeopardy,"(5, 1)",THE MANSION FAMILY,21,"(200,)",False,"Their family ""Compound"" is 6 acres of waterfront property on Nantucket Sound",the Kennedys,1,0
6114,2011-03-24,,Jeopardy,"(6, 1)","DOUBLE LETTER, DOUBLE MEANING",1,"(200,)",False,This 5-letter word can refer to an event in Genesis or to what you do in supplying too much fuel to your carburetor,flood,1,0
6114,2011-03-24,,Jeopardy,"(1, 2)",A FAIR TO REMEMBER,12,"(400,)",False,The World Expo of 1893 was held to celebrate the 400th anniversary of one of this man's voyages,Columbus,1,0
6114,2011-03-24,,Jeopardy,"(2, 2)",THE GENTLE ART OF RUGBY,25,"(400,)",False,"With 16 players fighting for possession, this way of re-starting play is a synonym for a disorderly struggle",a scrum,1,0
6114,2011-03-24,,Jeopardy,"(3, 2)",RUSSIAN FOOD & DRINK,4,"(400,)",False,This beet soup can be served hot or cold but it should always come with a dollop of sour cream,borscht,1,0
6114,2011-03-24,,Jeopardy,"(4, 2)",WHAT THE HECK IS THAT CRITTER?,17,"(400,)",False,A leghorn,a chicken,1,0
6114,2011-03-24,,Jeopardy,"(5, 2)",THE MANSION FAMILY,22,"(400,)",False,"Alfred, a scion of this munitions & chemicals family, built Nemours Mansion in Wilmington, Del. for his new bride",DuPont,1,0
6114,2011-03-24,,Jeopardy,"(6, 2)","DOUBLE LETTER, DOUBLE MEANING",2,"(400,)",False,"A group of news reporters, or to make smooth by ironing",press,1,0
6114,2011-03-24,,Jeopardy,"(1, 3)",A FAIR TO REMEMBER,13,"(600,)",False,The International Exposition Bureau didn't recognize the NYC World's Fair of this year; it was too soon after Seattle 1962,1964,0,3
6114,2011-03-24,,Jeopardy,"(2, 3)",THE GENTLE ART OF RUGBY,26,"(600,)",False,"Like a score in U.S. football, a goal kick, a reminder of rugby's soccer origins, is worth this many points",3,1,1
6114,2011-03-24,,Jeopardy,"(3, 3)",RUSSIAN FOOD & DRINK,5,"(600,)",False,"Like latkes, draniki are these",potato pancakes,1,0
6114,2011-03-24,,Jeopardy,"(4, 3)",WHAT THE HECK IS THAT CRITTER?,18,"(600,)",False,A Lipizzaner,a horse,1,0
6114,2011-03-24,,Jeopardy,"(5, 3)",THE MANSION FAMILY,23,"(600,)",False,"This European banking dynasty's properties include Chateau Lafite, which makes a pretty good Bordeaux",the Rothschilds,1,0
6114,2011-03-24,,Jeopardy,"(6, 3)","DOUBLE LETTER, DOUBLE MEANING",7,"(600,)",False,"Also one end of a swimming pool, this adjective can mean ""superficial""",shallow,1,0
6114,2011-03-24,,Jeopardy,"(1, 4)",A FAIR TO REMEMBER,14,"(1800,)",True,This U.S. city's 1915 Panama Pacific Expo was held over a landfill made partly of earthquake debris,San Francisco,1,0
6114,2011-03-24,,Jeopardy,"(2, 4)",THE GENTLE ART OF RUGBY,27,"(800,)",False,This position is the last line of defense; in the NFL it's the offensive role of Larry Csonka & Moose Johnston,the fullback,0,3
6114,2011-03-24,,Jeopardy,"(3, 4)",RUSSIAN FOOD & DRINK,6,"(800,)",False,"A traditional appetizer is caviar, the red type being the roe of this fish",the salmon,0,3
6114,2011-03-24,,Jeopardy,"(4, 4)",WHAT THE HECK IS THAT CRITTER?,19,"(800,)",False,A Thomson's,a gazelle,0,3
6114,2011-03-24,,Jeopardy,"(5, 4)",THE MANSION FAMILY,29,"(800,)",False,"Marble House in Newport, Rhode Island was bilt in the late 1800s for William, last name this",Vanderbilt,0,3
6114,2011-03-24,,Jeopardy,"(6, 4)","DOUBLE LETTER, DOUBLE MEANING",8,"(800,)",False,"To move unsteadily, or to arrange in a zigzagged order",stagger,1,0
6114,2011-03-24,,Jeopardy,"(1, 5)",A FAIR TO REMEMBER,15,"(1000,)",False,"The First World's Fair, the Great Exhibition of 1851, was held in this London park famed for its Speakers' Corner",Hyde Park,1,0
6114,2011-03-24,,Jeopardy,"(2, 5)",THE GENTLE ART OF RUGBY,28,"(1000,)",False,"The USA's national team is the Eagles; Argentina's is Los these, aka mountain lions",Pumas,0,3
6114,2011-03-24,,Jeopardy,"(3, 5)",RUSSIAN FOOD & DRINK,10,"(1000,)",False,Sharlotka is a Russian dessert made with this fruit,apple,1,0
6114,2011-03-24,,Jeopardy,"(4, 5)",WHAT THE HECK IS THAT CRITTER?,20,"(1000,)",False,A Poland China,a pig,1,0
6114,2011-03-24,,Jeopardy,"(5, 5)",THE MANSION FAMILY,30,"(1000,)",False,"269-room Villa Hugel in Essen, Germany was home to this arms & steel industry family until 1945",the Krupps,1,0
6114,2011-03-24,,Jeopardy,"(6, 5)","DOUBLE LETTER, DOUBLE MEANING",9,"(1000,)",False,"A small tower, or a revolving gun structure on a military plane",turret,1,0
6114,2011-03-24,,Double Jeopardy,"(1, 1)",GEOGRAPHIC TERMS,1,"(400,)",False,A cascade is a small one of these & a ribbon is a tall narrow one,a waterfall,1,0
6114,2011-03-24,,Double Jeopardy,"(2, 1)",THE YUCKS STOP HERE,2,"(400,)",False,"He went to join Gracie in 1996, less than 2 months after his 100th birthday",George Burns,1,0
6114,2011-03-24,,Double Jeopardy,"(3, 1)",ALL GODS' CHILDREN,25,"(400,)",False,This watery fella's kids included Orion & Polyphemus,Poseidon,1,2
6114,2011-03-24,,Double Jeopardy,"(4, 1)",MAN UP,20,"(400,)",False,In 1961 he reached an altitude of 115 miles in the Freedom 7,Alan Shepard,0,3
6114,2011-03-24,,Double Jeopardy,"(5, 1)",DANCE WITH ME!,12,"(400,)",False,"Eat it with corn chips, señor",salsa,1,0
6114,2011-03-24,,Double Jeopardy,"(6, 1)","I'M GONNA ""SIT""",7,"(400,)",False,"""Cheers"" or ""Two and a Half Men""",a sitcom,1,0
6114,2011-03-24,,Double Jeopardy,"(1, 2)",GEOGRAPHIC TERMS,13,"(800,)",False,A fertile spot in a desert; the Sahara's Erg Awbari comes complete with palm trees & lakes,an oasis,1,0
6114,2011-03-24,,Double Jeopardy,"(2, 2)",THE YUCKS STOP HERE,3,"(800,)",False,"A ""Hee Haw"" regular known for her straw hat with dangling price tag, she said good-bye in Nashville in 1996",Minnie Pearl,1,0
6114,2011-03-24,,Double Jeopardy,"(3, 2)",ALL GODS' CHILDREN,26,"(800,)",False,"Oddly, in one tradition the war god Ares fathered this Greek love god",Eros,1,1
6114,2011-03-24,,Double Jeopardy,"(4, 2)",MAN UP,22,"(800,)",False,"On July 20, 1969 he was alone in the command module Columbia, circling the Moon at an altitude of 60-75 miles",(Michael) Collins,1,0
6114,2011-03-24,,Double Jeopardy,"(5, 2)",DANCE WITH ME!,14,"(800,)",False,An unforeseen & clever plot change towards the end of a movie,twist,1,0
6114,2011-03-24,,Double Jeopardy,"(6, 2)","I'M GONNA ""SIT""",8,"(800,)",False,"In February 1960 black college students staged one at a Greensboro, North Carolina lunch counter",a sit-in,1,0
6114,2011-03-24,,Double Jeopardy,"(1, 3)",GEOGRAPHIC TERMS,15,"(1200,)",False,"(Sarah of the Clue Crew reports from about the National Geographic Explorer.)  Today we're crossing 66 degrees, 33 minutes south latitude; it was 250 years ago that Captain Cook was the first to cross this same borderline",the Antarctic Circle,0,3
6114,2011-03-24,,Double Jeopardy,"(2, 3)",THE YUCKS STOP HERE,4,"(1200,)",False,"Chance the gardener, he stopped ""Being There"" in London in 1980",Peter Sellers,1,0
6114,2011-03-24,,Double Jeopardy,"(3, 3)",ALL GODS' CHILDREN,27,"(4000,)",True,"Mnemosyne, or ""memory"", was the mom of these inspirational sister goddesses",the muses,1,0
6114,2011-03-24,,Double Jeopardy,"(4, 3)",MAN UP,23,"(1200,)",False,"Haise, Swigert & this commander were about 205,000 miles from Earth when an explosion ruptured an oxygen tank",(James) Lovell,1,0
6114,2011-03-24,,Double Jeopardy,"(5, 3)",DANCE WITH ME!,16,"(1200,)",False,A design dot used in regular patterns,polka,1,0
6114,2011-03-24,,Double Jeopardy,"(6, 3)","I'M GONNA ""SIT""",9,"(1200,)",False,This toy from Hasbro uses 2 revolving plastic discs around an axis,a Sit \'n Spin,1,0
6114,2011-03-24,,Double Jeopardy,"(1, 4)",GEOGRAPHIC TERMS,19,"(1600,)",False,"From the Latin for ""one who makes a levied payment"" comes this term for a stream that flows into a larger stream",tributary,1,0
6114,2011-03-24,,Double Jeopardy,"(2, 4)",THE YUCKS STOP HERE,5,"(1600,)",False,"The ""Monty Python"" member who played King Arthur, he ended his grail quest in Maidstone, England",Graham Chapman,1,0
6114,2011-03-24,,Double Jeopardy,"(3, 4)",ALL GODS' CHILDREN,28,"(1600,)",False,"A big supporter of the heavens, he was the son of the Titan Iapetus",Atlas,1,0
6114,2011-03-24,,Double Jeopardy,"(4, 4)",MAN UP,24,"(1600,)",True,"He described the moonscape that he walked on as ""magnificent desolation"", also the title of his 2009 memoir",Buzz Aldrin,0,1
6114,2011-03-24,,Double Jeopardy,"(5, 4)",DANCE WITH ME!,17,"(1600,)",False,The sixth letter of the NATO phonetic alphabet,foxtrot,1,1
6114,2011-03-24,,Double Jeopardy,"(6, 4)","I'M GONNA ""SIT""",10,"(1600,)",False,This southeastern Alaskan town was once the territorial capital,Sitka,1,0
6114,2011-03-24,,Double Jeopardy,"(1, 5)",GEOGRAPHIC TERMS,21,"(2000,)",False,"Spanish for ""table"" & common in the southwest, it's a broad, flat-topped elevation with clifflike sides",a mesa,1,0
6114,2011-03-24,,Double Jeopardy,"(2, 5)",THE YUCKS STOP HERE,6,"(2000,)",False,An overdose killed this controversial standup comic in Hollywood in 1966,Lenny Bruce,1,0
6114,2011-03-24,,Double Jeopardy,"(3, 5)",ALL GODS' CHILDREN,29,"(2000,)",False,This son of the Celtic river god Boann shares his name with a breed of cattle,Angus,1,0
6114,2011-03-24,,Double Jeopardy,"(4, 5)",MAN UP,30,"(2000,)",False,This Apollo 12 astronaut painted himself tiptoeing on the Ocean of Storms,Alan Bean,0,3
6114,2011-03-24,,Double Jeopardy,"(5, 5)",DANCE WITH ME!,18,"(2000,)",False,"In Catholic theology, it's a region reserved for unbaptized babies",limbo,1,0
6114,2011-03-24,,Double Jeopardy,"(6, 5)","I'M GONNA ""SIT""",11,"(2000,)",False,Last name of poet Dame Edith,Sitwell,1,0
6114,2011-03-24,,Final Jeopardy,"(1, 1)",19th CENTURY LITERATURE,0,"(1798, 12999, 14001)",False,Armor-clad knights face off in a game of baseball in an 1889 work by this author,Mark Twain,3,0
