epNum,airDate,extra_info,round_name,coord,category,order,value,daily_double,question,answer,correctAttempts,wrongAttempts
6131,2011-04-18,,Jeopardy,"(1, 1)",REAL HISTORICAL HOUSEWIVES OF D.C.,6,"(200,)",False,"In February 1962 millions of Americans tuned in to watch her TV ""Tour of the White House""",(Jackie) Kennedy,1,0
6131,2011-04-18,,Jeopardy,"(2, 1)",FOOD WORDS & PHRASES,1,"(200,)",False,"To savor the taste of, like a certain hot dog topping",relish,1,0
6131,2011-04-18,,Jeopardy,"(3, 1)",FORBES' MOST-EDUCATED SMALL TOWNS,23,"(200,)",False,No. 1:This Maryland town that's home to a naval hospital,Bethesda,1,0
6131,2011-04-18,,Jeopardy,"(4, 1)","""A"" IS FOR AUTHOR",8,"(200,)",False,"...of ""Little Men""",(Louisa May) Alcott,1,0
6131,2011-04-18,,Jeopardy,"(5, 1)",HOLIDAYS & OBSERVANCES,13,"(200,)",False,"Horton heard that ""Read Across America Day"", March 2, coincides with the birthday of this children's author",Dr. Seuss,1,0
6131,2011-04-18,,Jeopardy,"(6, 1)",BACKSTAGE AT THE MET,18,"(200,)",False,"(Sarah reports from backstage at the Metropolitan Opera in New York.)  The great soprano Deborah Voigt wears this costume in the Met's 2011 production of this Wagner opera, in which she plays the title role",Die Walküre (The Valkyrie),0,3
6131,2011-04-18,,Jeopardy,"(1, 2)",REAL HISTORICAL HOUSEWIVES OF D.C.,7,"(400,)",False,"Only 6 rooms were finished when she moved in in 1800, & she ended up using the East Room to hang laundry",Abigail Adams,1,1
6131,2011-04-18,,Jeopardy,"(2, 2)",FOOD WORDS & PHRASES,2,"(400,)",False,"To thwart someone's plans is ""to cook"" this web-footed bird",his goose,1,0
6131,2011-04-18,,Jeopardy,"(3, 2)",FORBES' MOST-EDUCATED SMALL TOWNS,24,"(400,)",False,"No. 12:You'll find some southern Ph.D.'s here, 10 miles from Durham & 25 from Raleigh",Chapel Hill,0,3
6131,2011-04-18,,Jeopardy,"(4, 2)","""A"" IS FOR AUTHOR",9,"(400,)",False,"...of ""Metaphysics"" in the 300s B.C.",Aristotle,0,3
6131,2011-04-18,,Jeopardy,"(5, 2)",HOLIDAYS & OBSERVANCES,14,"(400,)",False,"Britannica says this animal observed on Feb. 2 is ""basically a giant North American ground squirrel""",a groundhog,1,0
6131,2011-04-18,,Jeopardy,"(6, 2)",BACKSTAGE AT THE MET,19,"(400,)",False,"(Sarah reports from backstage at the Metropolitan Opera in New York.)  Now what opera might feature dancing bears?  ""The Magic Flute"", when staged at the Met by this director, famed for her Broadway version of ""The Lion King""",Julie Taymor,1,0
6131,2011-04-18,,Jeopardy,"(1, 3)",REAL HISTORICAL HOUSEWIVES OF D.C.,20,"(600,)",False,"After her husband suffered a stroke in 1919, any requests to see him or communicate with him had to go through her first",Edith Wilson,1,0
6131,2011-04-18,,Jeopardy,"(2, 3)",FOOD WORDS & PHRASES,3,"(600,)",False,This food staple is paired with circuses to mean extravagant entertainment to appease the masses,bread,1,0
6131,2011-04-18,,Jeopardy,"(3, 3)",FORBES' MOST-EDUCATED SMALL TOWNS,25,"(600,)",False,"No. 15:This Pennsylvania town that's also known for some football, Nittany Lions style",State College,0,3
6131,2011-04-18,,Jeopardy,"(4, 3)","""A"" IS FOR AUTHOR",10,"(600,)",False,...of a poem she read at Clinton's first inauguration,(Maya) Angelou,1,0
6131,2011-04-18,,Jeopardy,"(5, 3)",HOLIDAYS & OBSERVANCES,15,"(600,)",False,"Casimir Pulaski Day, the first Monday in March, celebrates a Revolutionary War hero born in this country",Poland,1,0
6131,2011-04-18,,Jeopardy,"(6, 3)",BACKSTAGE AT THE MET,26,"(600,)",False,"(Jimmy reports from backstage at the Metropolitan Opera in New York.)  Here in the scenic shop, we're hammering away at the items that are used onstage in this number performed by the Gypsies in ""Il trovatore""","the ""Anvil Chorus""",1,0
6131,2011-04-18,,Jeopardy,"(1, 4)",REAL HISTORICAL HOUSEWIVES OF D.C.,21,"(800,)",False,The woman enjoying her grandkids in the White House movie theater isn't any old granny--she's this First Lady,Mamie Eisenhower,1,0
6131,2011-04-18,,Jeopardy,"(2, 4)",FOOD WORDS & PHRASES,4,"(800,)",False,"Joyce's ""Ulysses"" includes a version of this ""sweet"" proverb about using something up & still having it to enjoy","""You can\'t have your cake and eat it, too""",1,0
6131,2011-04-18,,Jeopardy,"(3, 4)",FORBES' MOST-EDUCATED SMALL TOWNS,29,"(800,)",False,No. 2:This Boston suburb that's home to one of the Seven Sisters,Wellesley,0,3
6131,2011-04-18,,Jeopardy,"(4, 4)","""A"" IS FOR AUTHOR",11,"(800,)",False,"...of the ancient Greek comedy ""Clouds""",Aristophanes,1,0
6131,2011-04-18,,Jeopardy,"(5, 4)",HOLIDAYS & OBSERVANCES,16,"(800,)",False,Daisy Gatson Bates Day in this state celebrates a civil rights activist who helped integrate Little Rock's schools,Arkansas,1,0
6131,2011-04-18,,Jeopardy,"(6, 4)",BACKSTAGE AT THE MET,27,"(800,)",False,"(Jimmy reports from backstage at the Metropolitan Opera in New York.)  Backstage at the Met, you can find sets for operas by Verdi, Mozart & Puccini, who begins this opera in a Latin quarter garret""O, Mimi, tu pi...""",La bohème,1,0
6131,2011-04-18,,Jeopardy,"(1, 5)",REAL HISTORICAL HOUSEWIVES OF D.C.,22,"(2000,)",True,She actually served wine at an 1877 White House dinner before the ban on alcohol went into effect,"""Lemonade"" Lucy Hayes",0,1
6131,2011-04-18,,Jeopardy,"(2, 5)",FOOD WORDS & PHRASES,5,"(1000,)",False,"(Kelly of the Clue Crew shows a map of recent earthquakes around the San Andreas Fault on the monitor.)  A Japanese seismologist saw a possible circular earthquake pattern that could build up to one very large quake, in the hole in what's called the Mogi this, like a bakery treat",a doughnut,1,1
6131,2011-04-18,,Jeopardy,"(4, 5)","""A"" IS FOR AUTHOR",12,"(1000,)",False,"...of 1980's ""The Clan of the Cave Bear""",(Jean) Auel,1,0
6131,2011-04-18,,Jeopardy,"(5, 5)",HOLIDAYS & OBSERVANCES,17,"(1000,)",False,"Seward's Day, the last Monday in March, is one of this state's holidays",Alaska,1,0
6131,2011-04-18,,Jeopardy,"(6, 5)",BACKSTAGE AT THE MET,28,"(1000,)",False,"(Sarah reports from backstage at the Metropolitan Opera in New York.)  The jewelry here was worn by Elisabeth Rethberg, portraying this Verdi slave girl, a role in which she made both her 1922 met debut & her 1942 farewell",Aida,1,0
6131,2011-04-18,,Double Jeopardy,"(1, 1)",CALIFORNIA GOVERNORS,18,"(400,)",False,Earl Warren was the first 3-term governor of California & was this man's running mate on a 1948 ticket,(Thomas) Dewey,1,0
6131,2011-04-18,,Double Jeopardy,"(2, 1)",SCHWARZENEGGER,7,"(400,)",False,"The logical choice was to cast this comic actor as Arnold's brother in ""Twins""",(Danny) DeVito,1,0
6131,2011-04-18,,Double Jeopardy,"(3, 1)",GRADE AVIS,26,"(400,)",False,"The wingspan of the California this can be nearly 10 feet; instead of giving it an E for endangered, it gets a gentleman's ""C""",a condor,1,0
6131,2011-04-18,,Double Jeopardy,"(4, 1)",RE: GUN,1,"(400,)",False,"A part of a .45, or last name of Mike in Mickey Spillane's ""My Gun Is Quick""",Hammer,1,0
6131,2011-04-18,,Double Jeopardy,"(5, 1)",THE BROWNS,2,"(400,)",False,"Seen here, the brown four-eyed one of these critters is the only large American marsupial that lacks a pouch",an opossum,1,0
6131,2011-04-18,,Double Jeopardy,"(6, 1)",WARRIN',16,"(400,)",False,"From the Latin for ""war"" comes this adjective meaning ""ready to fight""",bellicose,1,0
6131,2011-04-18,,Double Jeopardy,"(1, 2)",CALIFORNIA GOVERNORS,19,"(800,)",False,"President of the Central Pacific Railroad, he was governor from 1862 to 1863 & later opened a university",(Leland) Stanford,1,0
6131,2011-04-18,,Double Jeopardy,"(2, 2)",SCHWARZENEGGER,8,"(800,)",False,"The few lines that Arnold mouthed in ""Conan the Barbarian"" were written by John Milius & this ""Wall Street"" director",Oliver Stone,1,0
6131,2011-04-18,,Double Jeopardy,"(3, 2)",GRADE AVIS,27,"(800,)",False,"The red-winged this gets a ""B"" for its ""konk-ka-reee"" song; Mr. McCartney heard it ""singing in the dead of night""",a blackbird,1,0
6131,2011-04-18,,Double Jeopardy,"(4, 2)",RE: GUN,3,"(800,)",False,"In a James Bond novel, Francisco ""Pistols"" Scaramanga is also known as ""The Man with"" this",the Golden Gun,1,0
6131,2011-04-18,,Double Jeopardy,"(5, 2)",THE BROWNS,12,"(800,)",False,"This record-setting athlete is a member of the halls of fame for college football, pro football & lacrosse, too",Jim Brown,1,0
6131,2011-04-18,,Double Jeopardy,"(6, 2)",WARRIN',17,"(800,)",False,"This ""avian"" word refers to those advocating conflict",hawks (war hawks accepted),1,0
6131,2011-04-18,,Double Jeopardy,"(1, 3)",CALIFORNIA GOVERNORS,20,"(1200,)",False,Dr. George Pardee was elected governor in 1902 in part to eradicate this rat-borne illness in San Francisco,the plague,1,0
6131,2011-04-18,,Double Jeopardy,"(2, 3)",SCHWARZENEGGER,9,"(1200,)",False,"Arnold used the last name ""Strong"" when portraying this demigod ""in New York""",Hercules,1,0
6131,2011-04-18,,Double Jeopardy,"(3, 3)",GRADE AVIS,28,"(1200,)",False,"The St. Andreasburg type of this bird is noted for its singing; be the ""cat who swallowed"" one & earn a ""C""",a canary,1,0
6131,2011-04-18,,Double Jeopardy,"(4, 3)",RE: GUN,4,"(1200,)",False,"In a 1939 Dalton Trumbo novel, he ""Got his Gun"" & got badly wounded",Johnny,1,0
6131,2011-04-18,,Double Jeopardy,"(5, 3)",THE BROWNS,13,"(1200,)",False,"The 2 main types of mustard seed are yellow, from the Mediterranean region, & brown, from these lofty Asian mountains",the Himalayas,1,0
6131,2011-04-18,,Double Jeopardy,"(6, 3)",WARRIN',23,"(1200,)",False,"From the Greek for ""fist"" comes this adjective used to describe boxers, & perhaps some little dogs...",pugnacious,1,0
6131,2011-04-18,,Double Jeopardy,"(1, 4)",CALIFORNIA GOVERNORS,21,"(4000,)",True,"Frank Merriam didn't suffer from ""Jungle"" fever after beating this novelist in the 1934 gubernatorial race",Upton Sinclair,0,1
6131,2011-04-18,,Double Jeopardy,"(2, 4)",SCHWARZENEGGER,10,"(1600,)",False,"In ""The Running Man"", Arnold feuded with this British game show host",Richard Dawson,1,0
6131,2011-04-18,,Double Jeopardy,"(4, 4)",RE: GUN,5,"(1600,)",False,"""The Gun"" is a tale of the Napoleonic Wars by C.S. Forester, creator of this sea captain who also fights Napoleon",Horatio Hornblower,0,3
6131,2011-04-18,,Double Jeopardy,"(5, 4)",THE BROWNS,14,"(1600,)",False,"Before his time at No. 10 Downing Street, he won election in 1983 as the MP for Dunfermline East",Gordon Brown,1,0
6131,2011-04-18,,Double Jeopardy,"(6, 4)",WARRIN',24,"(1600,)",False,This warlike word is a homophone for a residence for youths abroad,hostile,1,0
6131,2011-04-18,,Double Jeopardy,"(1, 5)",CALIFORNIA GOVERNORS,22,"(2000,)",False,In 1982 George Deukmejian beat this L.A. mayor to win the office,Tom Bradley,1,0
6131,2011-04-18,,Double Jeopardy,"(2, 5)",SCHWARZENEGGER,11,"(2000,)",False,"Arnold reteamed with this innovative director for 1994's ""True Lies""",James Cameron,0,3
6131,2011-04-18,,Double Jeopardy,"(4, 5)",RE: GUN,6,"(2000,)",False,"A big-fifty Sharps & a sawed-off 12-gauge show up in chapter 1 of ""Gunsights"" by this author of ""Get Shorty""",Elmore Leonard,0,3
6131,2011-04-18,,Double Jeopardy,"(5, 5)",THE BROWNS,15,"(2000,)",False,"This American playwright's 1926 work ""The Great God Brown"" was significant for its symbolic use of masks",Eugene O\'Neill,0,3
6131,2011-04-18,,Double Jeopardy,"(6, 5)",WARRIN',25,"(1000,)",True,"The first 7 letters of this word meaning ""quarrelsome"" spell a word meaning satisfied",contentious,1,0
6131,2011-04-18,,Final Jeopardy,"(1, 1)",BASEBALL GEOGRAPHY,0,"(5000, 7000, 601)",False,"After Alaska, it's the largest state in area without a Major League Baseball team",Montana,3,0
