epNum,airDate,extra_info,round_name,coord,category,order,value,daily_double,question,answer,correctAttempts,wrongAttempts
6216,2011-10-03,Joon Pahk game 1.,Jeopardy,"(1, 1)",ARTISTS ON FILM,11,"(200,)",False,"Charlton Heston felt ""The Agony and the Ecstasy"" as this ceiling painter",Michelangelo,1,0
6216,2011-10-03,Joon Pahk game 1.,Jeopardy,"(2, 1)",FOR YOUR REFERENCE,9,"(200,)",False,It's a 5-letter word for a book of maps,an atlas,1,0
6216,2011-10-03,Joon Pahk game 1.,Jeopardy,"(3, 1)",BASEBALL NICKNAMES,20,"(200,)",False,"""A-Rod""",Alex Rodriguez,1,0
6216,2011-10-03,Joon Pahk game 1.,Jeopardy,"(4, 1)",I'M GAME,29,"(200,)",False,"The organization that governs this board game is FIDE, the Federation Internationale des Echecs",chess,1,1
6216,2011-10-03,Joon Pahk game 1.,Jeopardy,"(5, 1)",THE HUMAN BODY,30,"(200,)",False,"8 bones form this portion of the skull, also called the braincase",the cranium,1,0
6216,2011-10-03,Joon Pahk game 1.,Jeopardy,"(6, 1)","""AL""-X",2,"(200,)",False,The men who died defending this locale in 1836 included William E. Summers & William DePriest Sutherland,the Alamo,1,0
6216,2011-10-03,Joon Pahk game 1.,Jeopardy,"(1, 2)",ARTISTS ON FILM,1,"(400,)",False,"Alfred Molina was this painter & husband of the title character in ""Frida""",Diego Rivera,1,0
6216,2011-10-03,Joon Pahk game 1.,Jeopardy,"(2, 2)",FOR YOUR REFERENCE,12,"(400,)",False,In 1855 John Bartlett first published a collection of these,quotations,1,0
6216,2011-10-03,Joon Pahk game 1.,Jeopardy,"(3, 2)",BASEBALL NICKNAMES,21,"(400,)",False,"""The Lip""",Leo Durocher,1,0
6216,2011-10-03,Joon Pahk game 1.,Jeopardy,"(4, 2)",I'M GAME,25,"(400,)",False,"This family game that ties you up in knots was originally called ""Pretzel""",Twister,1,0
6216,2011-10-03,Joon Pahk game 1.,Jeopardy,"(5, 2)",THE HUMAN BODY,16,"(400,)",False,"This, the tailbone, consists of 3-5 fused vertebrae",the coccyx,1,0
6216,2011-10-03,Joon Pahk game 1.,Jeopardy,"(6, 2)","""AL""-X",3,"(400,)",False,"These primitive aquatic plants are similar to bryophytes in that they lack true stems, roots & leaves",algae,1,0
6216,2011-10-03,Joon Pahk game 1.,Jeopardy,"(1, 3)",ARTISTS ON FILM,5,"(600,)",False,Both Donald & Kiefer Sutherland have portrayed this artist who journeyed to & from Tahiti,(Paul) Gauguin,1,0
6216,2011-10-03,Joon Pahk game 1.,Jeopardy,"(2, 3)",FOR YOUR REFERENCE,13,"(600,)",False,Every year our writers get excited by new editions of these books that originally carried astronomical data,almanacs,1,0
6216,2011-10-03,Joon Pahk game 1.,Jeopardy,"(3, 3)",BASEBALL NICKNAMES,22,"(600,)",False,"""Dr. K""",Dwight Gooden,1,0
6216,2011-10-03,Joon Pahk game 1.,Jeopardy,"(4, 3)",I'M GAME,26,"(600,)",False,"In 1996 someone got 311 points for playing ""craziest"" in this board game",Scrabble,1,0
6216,2011-10-03,Joon Pahk game 1.,Jeopardy,"(5, 3)",THE HUMAN BODY,17,"(600,)",False,(Jimmy of the Clue Crew shows the clue on the monitor and demonstrates.)  These fan-shaped muscles are used to lift the arms up as well as turn the arms inward,the pectorals,1,0
6216,2011-10-03,Joon Pahk game 1.,Jeopardy,"(6, 3)","""AL""-X",4,"(600,)",False,"John Bunyan's ""Pilgrim's Progress"" is a work in this genre",allegory,1,0
6216,2011-10-03,Joon Pahk game 1.,Jeopardy,"(1, 4)",ARTISTS ON FILM,7,"(800,)",False,In a 1996 biopic Francoise Gilot manages to survive her affair with this great artist of the 20th century (Anthony Hopkins),(Pablo) Picasso,1,0
6216,2011-10-03,Joon Pahk game 1.,Jeopardy,"(2, 4)",FOR YOUR REFERENCE,14,"(800,)",False,This word for a geographic dictionary once meant someone who writes for a newspaper,a gazetteer,0,3
6216,2011-10-03,Joon Pahk game 1.,Jeopardy,"(3, 4)",BASEBALL NICKNAMES,23,"(800,)",False,"Hall of Famer ""Eck""",Dennis Eckersley,1,0
6216,2011-10-03,Joon Pahk game 1.,Jeopardy,"(4, 4)",I'M GAME,27,"(800,)",False,"In British Monopoly, this becomes Super Tax",Luxury Tax,1,0
6216,2011-10-03,Joon Pahk game 1.,Jeopardy,"(5, 4)",THE HUMAN BODY,18,"(800,)",False,This airway connects the pharynx with the bronchi,the trachea,1,0
6216,2011-10-03,Joon Pahk game 1.,Jeopardy,"(6, 4)","""AL""-X",6,"(800,)",False,"Serving meals outdoors is called this, from the Italian for ""in the open air""",al fresco,1,0
6216,2011-10-03,Joon Pahk game 1.,Jeopardy,"(1, 5)",ARTISTS ON FILM,8,"(1000,)",False,"Colin Firth painted the title work as this artist in ""Girl with a Pearl Earring""",(Jan) Vermeer,1,0
6216,2011-10-03,Joon Pahk game 1.,Jeopardy,"(2, 5)",FOR YOUR REFERENCE,15,"(1000,)",False,An Internet publisher of great works is named for this Melville scrivener & of course has his tale online,Bartleby,1,0
6216,2011-10-03,Joon Pahk game 1.,Jeopardy,"(3, 5)",BASEBALL NICKNAMES,24,"(1000,)",False,"""The Scooter"" of the Bronx",Phil Rizzuto,1,0
6216,2011-10-03,Joon Pahk game 1.,Jeopardy,"(4, 5)",I'M GAME,28,"(1000,)",False,This solitaire game goes back to a version Paul Alfille wrote in 1978 for the Plato computer system,FreeCell,1,0
6216,2011-10-03,Joon Pahk game 1.,Jeopardy,"(5, 5)",THE HUMAN BODY,19,"(2000,)",True,"(Sarah of the Clue Crew presents the clue on a monitor.)  The thyroid gland has two lobes that are connected by a bridge of tissue called this, also a geographic term for a similar-looking narrow strip of land",an isthmus,1,0
6216,2011-10-03,Joon Pahk game 1.,Jeopardy,"(6, 5)","""AL""-X",10,"(1000,)",False,In 1992 the Winter Olympic games were held in this French city,Albertville,1,0
6216,2011-10-03,Joon Pahk game 1.,Double Jeopardy,"(1, 1)",20th CENTURY LIT,25,"(400,)",False,"A line from this Orwell tale says, ""As for the pigs, they could already read and write perfectly""",Animal Farm,1,0
6216,2011-10-03,Joon Pahk game 1.,Double Jeopardy,"(2, 1)",GODLY RHYME TIME,1,"(400,)",False,Dumb little Roman love god,a stupid Cupid,1,0
6216,2011-10-03,Joon Pahk game 1.,Double Jeopardy,"(3, 1)",SOMETHING ABOUT MARY,9,"(400,)",False,"Born in Linlithgow in 1542, she married into French royalty & thus became the queen of 2 countries","Mary, Queen of Scots",1,0
6216,2011-10-03,Joon Pahk game 1.,Double Jeopardy,"(4, 1)",JERSEY TV,26,"(400,)",False,The opening credits to this series showed Tony's commute home to the suburbs of Northern New Jersey,The Sopranos,1,0
6216,2011-10-03,Joon Pahk game 1.,Double Jeopardy,"(5, 1)",ALL HAT,15,"(400,)",False,"The name of this broad-brimmed hat derives from the Spanish for ""shade""",a sombrero,1,0
6216,2011-10-03,Joon Pahk game 1.,Double Jeopardy,"(6, 1)",NO CATTLE,24,"(400,)",False,"This term for a type of fat, heavy pig developed in the late 19th c. is now applied to any pig of more than 120 pounds",a hog,1,0
6216,2011-10-03,Joon Pahk game 1.,Double Jeopardy,"(1, 2)",20th CENTURY LIT,5,"(800,)",False,"His ""And Now Good-bye"" wasn't quite as popular as his ""Good-bye, Mr. Chips""",James Hilton,0,3
6216,2011-10-03,Joon Pahk game 1.,Double Jeopardy,"(2, 2)",GODLY RHYME TIME,2,"(800,)",False,Designs made by a god whose name is remembered in a weekend day,Saturn\'s patterns,1,0
6216,2011-10-03,Joon Pahk game 1.,Double Jeopardy,"(3, 2)",SOMETHING ABOUT MARY,10,"(800,)",False,"In 1974 columnist Mary McGrory called this veep ""a blind date who has been proposed to""",Ford,1,0
6216,2011-10-03,Joon Pahk game 1.,Double Jeopardy,"(4, 2)",JERSEY TV,27,"(800,)",False,"It's the nickname of ""Jersey Shore"" cast member Mike Sorrentino, who has it under control",The Situation,1,0
6216,2011-10-03,Joon Pahk game 1.,Double Jeopardy,"(5, 2)",ALL HAT,16,"(800,)",False,"A mark of prestige in Muslim countries, the brimless taj gets its name from the Persian for this royal headgear",a crown,1,0
6216,2011-10-03,Joon Pahk game 1.,Double Jeopardy,"(6, 2)",NO CATTLE,20,"(800,)",False,"Don't be afraid to tell us the familiar name of this fowl, Gallus gallus domesticus",chicken,1,0
6216,2011-10-03,Joon Pahk game 1.,Double Jeopardy,"(1, 3)",20th CENTURY LIT,6,"(1200,)",False,"""Billy Phelan's Greatest Game"" & ""Ironweed "" are books in his Albany Cycle",(William) Kennedy,1,0
6216,2011-10-03,Joon Pahk game 1.,Double Jeopardy,"(2, 3)",GODLY RHYME TIME,3,"(1200,)",False,Supreme Greek god's suspensions of hostilities,Zeus\'s truces,1,0
6216,2011-10-03,Joon Pahk game 1.,Double Jeopardy,"(3, 3)",SOMETHING ABOUT MARY,11,"(1200,)",False,"Check out the makeup on the woman here; born Mary Kathlyn Wagner, she founded this cosmetics giant",Mary Kay,1,1
6216,2011-10-03,Joon Pahk game 1.,Double Jeopardy,"(4, 3)",JERSEY TV,28,"(1200,)",False,Caroline Manzo & Jacqueline Laurita are 2 of the title women of this TV show that's on Bravo,The Real Housewives of New Jersey,1,0
6216,2011-10-03,Joon Pahk game 1.,Double Jeopardy,"(5, 3)",ALL HAT,17,"(1200,)",False,"Called a derby in the U.S., this British hat is named for a manufacturer, not a kegler",a bowler,1,0
6216,2011-10-03,Joon Pahk game 1.,Double Jeopardy,"(6, 3)",NO CATTLE,21,"(1200,)",False,"Species of this food & clothing provider include the Shropshire, karakul & merino",sheep,1,0
6216,2011-10-03,Joon Pahk game 1.,Double Jeopardy,"(1, 4)",20th CENTURY LIT,8,"(1600,)",False,"Chapters in this Pulitzer Prize winner by Carol Shields include ""Birth, 1905"", ""Marriage, 1927"" & ""Sorrow, 1965""",The Stone Diaries,0,3
6216,2011-10-03,Joon Pahk game 1.,Double Jeopardy,"(2, 4)",GODLY RHYME TIME,4,"(1600,)",False,Egyptian god of death & resurrection's tiny infectious agents,Osiris\'s viruses,1,0
6216,2011-10-03,Joon Pahk game 1.,Double Jeopardy,"(3, 4)",SOMETHING ABOUT MARY,12,"(1600,)",False,"Religious martyr Mary Barrett Dyer was hanged in Boston in 1660 for her devotion to this group, the Society of Friends",the Quakers,1,0
6216,2011-10-03,Joon Pahk game 1.,Double Jeopardy,"(4, 4)",JERSEY TV,29,"(1600,)",False,"Steve Buscemi plays Nucky Thompson, the undisputed ruler of Atlantic City in this HBO drama",Boardwalk Empire,1,0
6216,2011-10-03,Joon Pahk game 1.,Double Jeopardy,"(5, 4)",ALL HAT,18,"(1600,)",True,"It's not kosher, but Buster Keaton, Popeye Doyle & Justin Timberlake have all sported these round, flat hats",pork pies,1,0
6216,2011-10-03,Joon Pahk game 1.,Double Jeopardy,"(6, 4)",NO CATTLE,22,"(1600,)",False,"""Lamoid"" (with one ""L"") is the collective term for this South American herd animal & its relatives",llamas,1,0
6216,2011-10-03,Joon Pahk game 1.,Double Jeopardy,"(1, 5)",20th CENTURY LIT,14,"(2000,)",False,"A short story by Ernest Hemingway tells of ""The Short Happy Life of"" this American on safari in Africa",Francis Macomber,1,0
6216,2011-10-03,Joon Pahk game 1.,Double Jeopardy,"(2, 5)",GODLY RHYME TIME,7,"(2000,)",False,Hindu preserver god's bouillabaisses,Vishnu\'s fish stews,1,0
6216,2011-10-03,Joon Pahk game 1.,Double Jeopardy,"(3, 5)",SOMETHING ABOUT MARY,13,"(3500,)",True,"She co-wrote the popular 19th century work ""Tales from Shakespear"" with her brother Charles",Mary Lamb,0,1
6216,2011-10-03,Joon Pahk game 1.,Double Jeopardy,"(4, 5)",JERSEY TV,30,"(2000,)",False,"This show on Oxygen follows the Scali family, who own & run an extravagant dress shop",Jersey Couture,0,3
6216,2011-10-03,Joon Pahk game 1.,Double Jeopardy,"(5, 5)",ALL HAT,19,"(2000,)",False,"A type of top hat popular in the 19th century was named for this ""Iron Duke""",(the Duke of) Wellington,1,1
6216,2011-10-03,Joon Pahk game 1.,Double Jeopardy,"(6, 5)",NO CATTLE,23,"(2000,)",False,"The muscovy type of this fowl was originally domesticated in South America, not Russia",a duck,1,0
6216,2011-10-03,Joon Pahk game 1.,Final Jeopardy,"(1, 1)",REMEMBERING U.S. HISTORY,0,"(2000, 11598, 7500)",False,"Issued in 2011, a stamp commemorating the 150th anniversary of a major event in U.S. history depicts this stronghold",Fort Sumter,3,0
