epNum,airDate,extra_info,round_name,coord,category,order,value,daily_double,question,answer,correctAttempts,wrongAttempts
6308,2012-02-08,2012 College Championship semifinal game 1.,Jeopardy,"(1, 1)",KNOW YOUR CONSTITUTION,30,"(200,)",False,"""The Congress, whenever two-thirds of both houses shall deem it necessary, shall propose"" these ""to this Constitution""",amendments,1,0
6308,2012-02-08,2012 College Championship semifinal game 1.,Jeopardy,"(2, 1)",WEIGHTS & MEASURES,1,"(200,)",False,"Also a bit of sand, it's the smallest unit of measure in the avoirdupois system, 7,000 to the pound",a grain,1,0
6308,2012-02-08,2012 College Championship semifinal game 1.,Jeopardy,"(3, 1)",BUZZ BANDS,5,"(200,)",False,"Bethany Cosentino fronts the L.A. band called not ""West"" but ""Best"" this--in your face, Eastern Seaboard!",Coast,1,0
6308,2012-02-08,2012 College Championship semifinal game 1.,Jeopardy,"(4, 1)",QUESTIONS,15,"(200,)",False,"""Is the Pope"" this denomination?",Catholic,1,0
6308,2012-02-08,2012 College Championship semifinal game 1.,Jeopardy,"(5, 1)",LITERARY LOCALES,29,"(200,)",False,"""Kangaroo"" by D.H. Lawrence:This country",Australia,1,0
6308,2012-02-08,2012 College Championship semifinal game 1.,Jeopardy,"(6, 1)","COLLEGE ""M""",27,"(200,)",False,"This university is in ""The Buckeye State""; the university of this is in ""The Sunshine State""",Miami,1,0
6308,2012-02-08,2012 College Championship semifinal game 1.,Jeopardy,"(1, 2)",KNOW YOUR CONSTITUTION,13,"(400,)",False,"""Neither shall any person be eligible"" to be president ""who shall not have attained to the age of"" this",35,1,0
6308,2012-02-08,2012 College Championship semifinal game 1.,Jeopardy,"(2, 2)",WEIGHTS & MEASURES,2,"(400,)",False,"In freezing temperatures at sea level, this travels at 1,087 feet per second",sound,1,0
6308,2012-02-08,2012 College Championship semifinal game 1.,Jeopardy,"(3, 2)",BUZZ BANDS,6,"(400,)",False,"Put on your gas mask before completing the deadly name of the band heard here:The Airborne...""And it starts /Sometime around midnight""",The Airborne Toxic Event,1,0
6308,2012-02-08,2012 College Championship semifinal game 1.,Jeopardy,"(4, 2)",QUESTIONS,26,"(400,)",False,"Asked by celebs with mustaches, ""Got"" this?",milk,1,0
6308,2012-02-08,2012 College Championship semifinal game 1.,Jeopardy,"(5, 2)",LITERARY LOCALES,17,"(400,)",False,"""Into Thin Air"":This mountain",Mount Everest,1,0
6308,2012-02-08,2012 College Championship semifinal game 1.,Jeopardy,"(6, 2)","COLLEGE ""M""",28,"(400,)",False,"""We are"" this West Virginia university, home to the Byrd Biotechnology Science Center",Marshall,1,0
6308,2012-02-08,2012 College Championship semifinal game 1.,Jeopardy,"(1, 3)",KNOW YOUR CONSTITUTION,9,"(600,)",False,"The new prez says, ""I will... preserve, protect and"" this ""the Constitution of the United States""'",defend,1,0
6308,2012-02-08,2012 College Championship semifinal game 1.,Jeopardy,"(2, 3)",WEIGHTS & MEASURES,3,"(600,)",False,Half a quarter is 12 1/2 cents; half a quart is this unit,a pint,1,0
6308,2012-02-08,2012 College Championship semifinal game 1.,Jeopardy,"(3, 3)",BUZZ BANDS,8,"(600,)",False,"The Belle Brigade is composed of grandkids of this composer of the music for the ""Star Wars"" series",John Williams,1,0
6308,2012-02-08,2012 College Championship semifinal game 1.,Jeopardy,"(4, 3)",QUESTIONS,20,"(600,)",False,"""How do you like them"" fruits, maybe honeycrisps",apples,1,0
6308,2012-02-08,2012 College Championship semifinal game 1.,Jeopardy,"(5, 3)",LITERARY LOCALES,16,"(600,)",False,"""Game of Thrones"":This imaginary land of ""Seven Kingdoms""",Westeros,1,0
6308,2012-02-08,2012 College Championship semifinal game 1.,Jeopardy,"(6, 3)","COLLEGE ""M""",23,"(600,)",False,"Using the colors of its state flag, this ACC university made a bold 2-sided fashion choice for its football team in 2011",the University of Maryland,1,0
6308,2012-02-08,2012 College Championship semifinal game 1.,Jeopardy,"(1, 4)",KNOW YOUR CONSTITUTION,10,"(800,)",False,"The president shall be removed from office on conviction of ""high crimes and"" these",misdemeanors,1,0
6308,2012-02-08,2012 College Championship semifinal game 1.,Jeopardy,"(2, 4)",WEIGHTS & MEASURES,4,"(800,)",False,"Chicken eggs come in sizes including this largest one, in which a dozen weigh 30 ounces",jumbo,1,0
6308,2012-02-08,2012 College Championship semifinal game 1.,Jeopardy,"(3, 4)",BUZZ BANDS,11,"(800,)",False,"Get out the tranquilizer gun!  Time to round up the rampaging circus animal that's this band""Oh, there ain't no rest  for the wicked /Money don't grow on trees...""",Cage the Elephant,1,0
6308,2012-02-08,2012 College Championship semifinal game 1.,Jeopardy,"(4, 4)",QUESTIONS,21,"(800,)",False,"""Who has seen"" this?  ""Neither you nor I: but when the trees bow down their heads"" this ""is passing by""",the wind,1,0
6308,2012-02-08,2012 College Championship semifinal game 1.,Jeopardy,"(5, 4)",LITERARY LOCALES,18,"(800,)",False,"""Dover Beach"":Beside this ""national"" body of water",the English Channel,1,0
6308,2012-02-08,2012 College Championship semifinal game 1.,Jeopardy,"(6, 4)","COLLEGE ""M""",24,"(800,)",False,"Emily Dickinson & Wendy Wasserstein were alums of this ""Seven Sisters"" school in South Hadley, Massachusetts",Mount Holyoke,1,0
6308,2012-02-08,2012 College Championship semifinal game 1.,Jeopardy,"(1, 5)",KNOW YOUR CONSTITUTION,12,"(1000,)",False,"The president, ""with"" these 2 types of input ""of the Senate, shall appoint... judges""",advice & consent,0,3
6308,2012-02-08,2012 College Championship semifinal game 1.,Jeopardy,"(2, 5)",WEIGHTS & MEASURES,7,"(1000,)",False,"As in a poem, if we go this distance ""onward"", that's a mile & a half",half a league,1,0
6308,2012-02-08,2012 College Championship semifinal game 1.,Jeopardy,"(3, 5)",BUZZ BANDS,14,"(1000,)",False,"Despite the name, the members of this ""Little Lion Man"" band are all about the same age",Mumford & Sons,1,0
6308,2012-02-08,2012 College Championship semifinal game 1.,Jeopardy,"(4, 5)",QUESTIONS,22,"(1000,)",False,"In a carol, it's the title question that follows ""Said the little lamb to the shepherd boy""","""Do You Hear What I Hear?""",1,0
6308,2012-02-08,2012 College Championship semifinal game 1.,Jeopardy,"(5, 5)",LITERARY LOCALES,19,"(1000,)",False,"""Moby Dick"":Mostly aboard this whaling ship",the Pequod,1,0
6308,2012-02-08,2012 College Championship semifinal game 1.,Jeopardy,"(6, 5)","COLLEGE ""M""",25,"(2500,)",True,"Founded in 1800, this liberal arts college has the Adirondacks to the west & the Green Mountains to the east",Middlebury,0,1
6308,2012-02-08,2012 College Championship semifinal game 1.,Double Jeopardy,"(1, 1)",ROGET'S MEETS BARTLETT'S,2,"(400,)",False,"Chums, imperial citizens, compatriots, allow the borrowing of thy hearing organs","""Friends, Romans, countrymen, lend me your ears""",0,3
6308,2012-02-08,2012 College Championship semifinal game 1.,Double Jeopardy,"(2, 1)",THE 21st CENTURY,28,"(400,)",False,"In 2009 C.B. ""Sully"" Sullenberger became a national hero after demonstrating his prowess at this job",flying airplanes,1,0
6308,2012-02-08,2012 College Championship semifinal game 1.,Double Jeopardy,"(3, 1)","YAY, PHYSICS!",12,"(400,)",False,"Physics has been defined as ""the science of matter, motion, and"" this, the ""E"" in a 1905 equation",energy,1,0
6308,2012-02-08,2012 College Championship semifinal game 1.,Double Jeopardy,"(4, 1)",ON CABLE,13,"(400,)",False,Who can resist this animated title guy & his friends from Bikini Bottom?,SpongeBob SquarePants,1,0
6308,2012-02-08,2012 College Championship semifinal game 1.,Double Jeopardy,"(5, 1)",ART & ARTISTS,24,"(400,)",False,"In 1934 this Spanish surrealist was ""expelled"" from the movement over his paintings & views",Salvador Dalí,1,0
6308,2012-02-08,2012 College Championship semifinal game 1.,Double Jeopardy,"(6, 1)",SILENT B,3,"(400,)",False,Horticulturists use trellises to train their flowers & vines to do this,climb,1,0
6308,2012-02-08,2012 College Championship semifinal game 1.,Double Jeopardy,"(1, 2)",ROGET'S MEETS BARTLETT'S,9,"(800,)",False,A single enormous jump on behalf of all humanity,"""one giant leap for mankind""",1,2
6308,2012-02-08,2012 College Championship semifinal game 1.,Double Jeopardy,"(2, 2)",THE 21st CENTURY,18,"(800,)",False,In 2010 Alaska's Lisa Murkowski became the first candidate since 1954 to win a Senate seat this way,through a write-in campaign,1,0
6308,2012-02-08,2012 College Championship semifinal game 1.,Double Jeopardy,"(3, 2)","YAY, PHYSICS!",11,"(3000,)",True,"(Jimmy of the Clue Crew holds a flying toy.)  The flying spaceman's twin rotors spin in opposite directions, keeping him from spinning out of control by canceling out the effects of this rotational force",torque,1,0
6308,2012-02-08,2012 College Championship semifinal game 1.,Double Jeopardy,"(4, 2)",ON CABLE,14,"(800,)",False,"Here's the situation--for Season 4 of this show, Snooki & the gang were in Italy",Jersey Shore,1,0
6308,2012-02-08,2012 College Championship semifinal game 1.,Double Jeopardy,"(5, 2)",ART & ARTISTS,25,"(800,)",False,"This artist wrote his sister that ""putting little white dots on the blue-black is not enough to paint a starry sky""",Vincent van Gogh,1,0
6308,2012-02-08,2012 College Championship semifinal game 1.,Double Jeopardy,"(6, 2)",SILENT B,4,"(800,)",False,"Birds ate Hansel & Gretel's trail of these, so they weren't able to find their way home",crumbs,1,0
6308,2012-02-08,2012 College Championship semifinal game 1.,Double Jeopardy,"(1, 3)",ROGET'S MEETS BARTLETT'S,27,"(1200,)",False,"Bring forth ripened plant structures copiously, & also propagate","""Be fruitful and multiply""",1,0
6308,2012-02-08,2012 College Championship semifinal game 1.,Double Jeopardy,"(2, 3)",THE 21st CENTURY,19,"(1200,)",False,In 2005 Israel gave up control of this coastal territory,the Gaza Strip,1,0
6308,2012-02-08,2012 College Championship semifinal game 1.,Double Jeopardy,"(3, 3)","YAY, PHYSICS!",1,"(1200,)",False,"""Classical"" this branch of physics deals with motion & forces; the ""quantum"" branch, with subatomic particles",mechanics,1,0
6308,2012-02-08,2012 College Championship semifinal game 1.,Double Jeopardy,"(4, 3)",ON CABLE,15,"(1200,)",False,"His popularity as a mentor on ""Project Runway"" led briefly to his own Bravo series ""Guide to Style""",Tim Gunn,1,0
6308,2012-02-08,2012 College Championship semifinal game 1.,Double Jeopardy,"(5, 3)",ART & ARTISTS,20,"(1200,)",False,"Prior to gaining fame in Toledo, this Cretan-born artist studied with Titian in Venice",El Greco,1,0
6308,2012-02-08,2012 College Championship semifinal game 1.,Double Jeopardy,"(6, 3)",SILENT B,5,"(1200,)",False,"It can be money owed, or an offense requiring forgiveness",a debt,1,0
6308,2012-02-08,2012 College Championship semifinal game 1.,Double Jeopardy,"(1, 4)",ROGET'S MEETS BARTLETT'S,29,"(1600,)",False,That nation populated by the liberated paired with that domicile where the courageous live,"""the land of the free and the home of the brave""",1,0
6308,2012-02-08,2012 College Championship semifinal game 1.,Double Jeopardy,"(2, 4)",THE 21st CENTURY,23,"(1500,)",True,"Named for this San Franciscan, the USA's first public high school for gay students opened in 2003",Harvey Milk,1,0
6308,2012-02-08,2012 College Championship semifinal game 1.,Double Jeopardy,"(3, 4)","YAY, PHYSICS!",8,"(1600,)",False,"(Jimmy of the Clue Crew holds a book against the wall.)  Abbreviated ""N"", it's the ordinary term for the perpendicular force I'm exerting on the book to keep it in contact with the wall",normal,1,0
6308,2012-02-08,2012 College Championship semifinal game 1.,Double Jeopardy,"(4, 4)",ON CABLE,16,"(1600,)",False,Chris Matthews' game is to fire off tough questions on this MSNBC show that he's hosted since the 1990s,Hardball,1,0
6308,2012-02-08,2012 College Championship semifinal game 1.,Double Jeopardy,"(5, 4)",ART & ARTISTS,21,"(1600,)",False,The lad in this Thomas Gainsborough work is wearing clothes that were popular 140 years before the painting,The Blue Boy,1,0
6308,2012-02-08,2012 College Championship semifinal game 1.,Double Jeopardy,"(6, 4)",SILENT B,6,"(1600,)",False,Distrust or uncertainty,doubt,1,0
6308,2012-02-08,2012 College Championship semifinal game 1.,Double Jeopardy,"(1, 5)",ROGET'S MEETS BARTLETT'S,30,"(2000,)",False,"That man is able to move swiftly on foot, yet will not succeed in concealment","""He can run, but he can\'t hide""",1,1
6308,2012-02-08,2012 College Championship semifinal game 1.,Double Jeopardy,"(2, 5)",THE 21st CENTURY,26,"(2000,)",False,In July 2005 the world danced to the anti-poverty concerts known by this numerical name,Live 8,1,0
6308,2012-02-08,2012 College Championship semifinal game 1.,Double Jeopardy,"(3, 5)","YAY, PHYSICS!",10,"(2000,)",False,James Clerk Maxwell formulated the 4 basic laws of this science of charge & the associated fields & forces,electromagnetism,1,0
6308,2012-02-08,2012 College Championship semifinal game 1.,Double Jeopardy,"(4, 5)",ON CABLE,17,"(2000,)",False,This MTV comedy stars Ashley Rickards as high schooler Jenna Hamilton; can you say...,Awkward.,0,3
6308,2012-02-08,2012 College Championship semifinal game 1.,Double Jeopardy,"(5, 5)",ART & ARTISTS,22,"(2000,)",False,"Rembrandt's ""Aristotle with a Bust of"" this poet was one of his few paintings sent abroad during his lifetime",Homer,1,0
6308,2012-02-08,2012 College Championship semifinal game 1.,Double Jeopardy,"(6, 5)",SILENT B,7,"(2000,)",False,So slight as to be difficult to detect,subtle,1,0
6308,2012-02-08,2012 College Championship semifinal game 1.,Final Jeopardy,"(1, 1)",COMIC BOOKS,0,"(12000, 1500, 6000)",False,An inspiration for this character introduced in 1929 was 15-year-old Palle Huld's 1928 44-day voyage around the world,Tintin,1,2
