epNum,airDate,extra_info,round_name,coord,category,order,value,daily_double,question,answer,correctAttempts,wrongAttempts
6413,2012-07-04,,Jeopardy,"(1, 1)",ROYAL DYNASTIES,1,"(200,)",False,France's Louis XIII (1610-1643),Bourbon,1,0
6413,2012-07-04,,Jeopardy,"(2, 1)",LONG RUNS IN PRIME TIME,13,"(200,)",False,"Steve Zirnkilton read the opening on this series that ran from 1990 to 2010: ""In the criminal justice system...""",Law & Order,1,0
6413,2012-07-04,,Jeopardy,"(3, 1)",THE BEST OF DEAR ABBY,26,"(200,)",False,"My son ""has been paying a psychiatrist $50.00 an hour every week for two-and-a-half years. He must be"" this",crazy,1,0
6413,2012-07-04,,Jeopardy,"(4, 1)",SEAPORTS,5,"(200,)",False,It's Egypt's busiest seaport & second-largest city,Alexandria,1,0
6413,2012-07-04,,Jeopardy,"(5, 1)",ANCHORS AWEIGH,7,"(200,)",False,This 4-letter traditional greeting for hailing other vessels may be from the name of a type of boat,ahoy,1,0
6413,2012-07-04,,Jeopardy,"(6, 1)","""FUL"" STEAM AHEAD",10,"(200,)",False,A dress or mirror that goes down to the feet,full-length,1,0
6413,2012-07-04,,Jeopardy,"(1, 2)",ROYAL DYNASTIES,2,"(400,)",False,China's Jiajing (1521-1566),Ming,1,0
6413,2012-07-04,,Jeopardy,"(2, 2)",LONG RUNS IN PRIME TIME,14,"(400,)",False,"No pelvic gyrations allowed, but this hosts's really big shew did run from 1948 to 1971",Ed Sullivan,1,0
6413,2012-07-04,,Jeopardy,"(3, 2)",THE BEST OF DEAR ABBY,27,"(400,)",False,"""I was married to Bill for three months and I didn't know he drank until one night he came home"" this",sober,0,3
6413,2012-07-04,,Jeopardy,"(4, 2)",SEAPORTS,18,"(400,)",False,San Juan is this commonwealth's chief seaport & capital,Puerto Rico,1,0
6413,2012-07-04,,Jeopardy,"(5, 2)",ANCHORS AWEIGH,8,"(400,)",False,These wide pants were made to roll up above the knee when swabbing the decks & to remove easily when you fall overboard,bell-bottoms,1,0
6413,2012-07-04,,Jeopardy,"(6, 2)","""FUL"" STEAM AHEAD",11,"(400,)",False,"Pivot point, from the Latin for ""couch foot""",a fulcrum,1,0
6413,2012-07-04,,Jeopardy,"(1, 3)",ROYAL DYNASTIES,3,"(600,)",False,England's Charles I (1625-1649),Stuart,1,0
6413,2012-07-04,,Jeopardy,"(2, 3)",LONG RUNS IN PRIME TIME,15,"(600,)",False,"It's now on Sunday mornings, but this news show ran from 1947 to 1965 in prime time",Meet the Press,1,0
6413,2012-07-04,,Jeopardy,"(3, 3)",THE BEST OF DEAR ABBY,28,"(600,)",False,"""My mother is mean and short tempered--I think she is going through her mental"" this",pause,0,3
6413,2012-07-04,,Jeopardy,"(4, 3)",SEAPORTS,23,"(600,)",False,"Hammerfest, a seaport in this country, calls itself the northernmost city in Europe",Norway,1,0
6413,2012-07-04,,Jeopardy,"(5, 3)",ANCHORS AWEIGH,9,"(600,)",False,"This name for a heavy garment worn by sailors in cold weather comes from a word for cloth, not a vegetable",a peacoat,1,0
6413,2012-07-04,,Jeopardy,"(6, 3)","""FUL"" STEAM AHEAD",12,"(600,)",False,Endowed with a pure pedigree,full-blooded,0,3
6413,2012-07-04,,Jeopardy,"(1, 4)",ROYAL DYNASTIES,4,"(800,)",False,Iran's Reza Shah & Mohammad Reza Shah,Pahlavi,1,0
6413,2012-07-04,,Jeopardy,"(2, 4)",LONG RUNS IN PRIME TIME,19,"(800,)",False,"""Guess the occupation"" was the concept on this prime-time game show that ran from 1950 to 1967",What\'s My Line?,1,0
6413,2012-07-04,,Jeopardy,"(3, 4)",THE BEST OF DEAR ABBY,30,"(800,)",False,"""Are"" these ""pills deductible?"" ""Only if they don't work""",birth control pills,0,3
6413,2012-07-04,,Jeopardy,"(4, 4)",SEAPORTS,24,"(800,)",True,"21 miles from Dover, this French seaport is closer to England than any other city in mainland Europe",Calais,1,0
6413,2012-07-04,,Jeopardy,"(5, 4)",ANCHORS AWEIGH,16,"(800,)",False,This punishment involved dragging a person under a ship from one side to the other,keelhauling,1,0
6413,2012-07-04,,Jeopardy,"(6, 4)","""FUL"" STEAM AHEAD",21,"(800,)",False,Giving excessive praise,fulsome,0,3
6413,2012-07-04,,Jeopardy,"(1, 5)",ROYAL DYNASTIES,6,"(1000,)",False,Frederick III of Germany (1440-1493),Hapsburg,1,1
6413,2012-07-04,,Jeopardy,"(2, 5)",LONG RUNS IN PRIME TIME,20,"(1000,)",False,"What's that, girl? Jimmy's in the well & you starred in this TV show that lasted from 1954 to 1974?",Lassie,1,0
6413,2012-07-04,,Jeopardy,"(3, 5)",THE BEST OF DEAR ABBY,29,"(1000,)",False,"To someone asking if a 10-pound baby born 5 mos. after a marriage could be premature: ""The baby was on time."" This ""was late""",the wedding,1,1
6413,2012-07-04,,Jeopardy,"(4, 5)",SEAPORTS,25,"(1000,)",False,In 1905 sailors from the Battleship Potemkin staged a mutiny in this port on the Black Sea,Odessa,0,3
6413,2012-07-04,,Jeopardy,"(5, 5)",ANCHORS AWEIGH,17,"(1000,)",False,"Now a term for small high-tech devices, it was originally a sailors' equivalent of ""doohickey""",gadget,0,3
6413,2012-07-04,,Jeopardy,"(6, 5)","""FUL"" STEAM AHEAD",22,"(1000,)",False,"In 2005, after 183 years in Lower Manhattan, this fish market moved to the Bronx",Fulton,1,0
6413,2012-07-04,,Double Jeopardy,"(1, 1)",PEOPLE WITH BRADY KID NAMES,6,"(400,)",False,"Known as The Shark, he was the first PGA Tour player to surpass $10 million in earnings",Greg Norman,1,0
6413,2012-07-04,,Double Jeopardy,"(2, 1)",RAIDERS OF THE LOST ARCHAEOLOGY,1,"(400,)",False,In 1870 Heinrich Schliemann began his excavation of Troy following the descriptions in this epic poem,the Iliad,1,0
6413,2012-07-04,,Double Jeopardy,"(3, 1)",SPIRITUALS,25,"(400,)",False,"A low-swinging, sweet one is ""comin' for to carry me home""",a sweet chariot,1,0
6413,2012-07-04,,Double Jeopardy,"(4, 1)","ISN'T IT AN -""ISM""?",15,"(400,)",False,"If you said someone ""went into the fertilizing business"" instead of saying he died, you used this noun",a euphemism,0,3
6413,2012-07-04,,Double Jeopardy,"(5, 1)",TITLE CHARACTERS,20,"(400,)",False,"In a 1937 novel, Bilbo Baggins",The Hobbit,1,0
6413,2012-07-04,,Double Jeopardy,"(6, 1)",HALLEY'S CATEGORY,10,"(400,)",False,"Halley calculated that one of these sighted in 1682 would reappear in 1758; it did, & his name was forever attached to it",a comet,1,0
6413,2012-07-04,,Double Jeopardy,"(1, 2)",PEOPLE WITH BRADY KID NAMES,7,"(800,)",False,He founded the Black Panther Party with Huey Newton in 1966,Bobby Seale,0,3
6413,2012-07-04,,Double Jeopardy,"(2, 2)",RAIDERS OF THE LOST ARCHAEOLOGY,2,"(800,)",False,Archaeologists have found some remains of this structure mentioned in Genesis 11 (but it only had 7 stories),the Tower of Babel,1,0
6413,2012-07-04,,Double Jeopardy,"(3, 2)",SPIRITUALS,26,"(800,)",False,"He ""fit the battle of Jericho""",Joshua,1,0
6413,2012-07-04,,Double Jeopardy,"(4, 2)","ISN'T IT AN -""ISM""?",16,"(800,)",False,"If my daughter ever hosts the show, it won't be because of this, from the Latin for ""nephew""; the girl is a natural!",nepotism,1,0
6413,2012-07-04,,Double Jeopardy,"(5, 2)",TITLE CHARACTERS,21,"(800,)",False,"In the first book of a bestselling trilogy, superhacker Lisbeth Salander",The Girl with the Dragon Tattoo,1,0
6413,2012-07-04,,Double Jeopardy,"(6, 2)",HALLEY'S CATEGORY,11,"(800,)",False,"The Royal Society said that Halley should pay to have this man's ""Principia"" published, so Halley ponied up",Newton,1,0
6413,2012-07-04,,Double Jeopardy,"(1, 3)",PEOPLE WITH BRADY KID NAMES,8,"(1200,)",False,His father was the first anchor of a nightly news program in Canada; he came south & anchored at ABC,Peter Jennings,1,0
6413,2012-07-04,,Double Jeopardy,"(2, 3)",RAIDERS OF THE LOST ARCHAEOLOGY,3,"(1200,)",False,"In 1978 she found at Laetoli, south of Olduvai Gorge, footprints in volcanic ash made by hominins living 3.5 mil. years ago",Mary Leakey,1,0
6413,2012-07-04,,Double Jeopardy,"(3, 3)",SPIRITUALS,27,"(1200,)",False,"""Lord I want to be in that number when"" this happens",when the saints go marching in,1,1
6413,2012-07-04,,Double Jeopardy,"(4, 3)","ISN'T IT AN -""ISM""?",17,"(1200,)",False,"A term originating from Greek myth, it's an inordinate fascination with oneself",narcissism,1,1
6413,2012-07-04,,Double Jeopardy,"(5, 3)",TITLE CHARACTERS,22,"(2000,)",True,"In a 17th century French comedy, mankind hater Alceste",The Misanthrope,0,1
6413,2012-07-04,,Double Jeopardy,"(6, 3)",HALLEY'S CATEGORY,12,"(1200,)",False,"In 1720 Halley became Astronomer Royal at this observatory, a post he held until his death in 1742",the Greenwich Observatory,1,0
6413,2012-07-04,,Double Jeopardy,"(1, 4)",PEOPLE WITH BRADY KID NAMES,9,"(1600,)",False,She & Christopher Darden headed up the prosecution team in the O.J. murder case,Marcia Clark,1,0
6413,2012-07-04,,Double Jeopardy,"(2, 4)",RAIDERS OF THE LOST ARCHAEOLOGY,4,"(1600,)",False,Beginning in 1900 Sir Arthur Evans uncovered the Palace of Minos at Knossos on this island,Crete,1,0
6413,2012-07-04,,Double Jeopardy,"(4, 4)","ISN'T IT AN -""ISM""?",18,"(1600,)",False,"Holland Carter won a 2009 Pulitzer in this category ""for his wide ranging reviews of art""",criticism,1,0
6413,2012-07-04,,Double Jeopardy,"(5, 4)",TITLE CHARACTERS,23,"(1600,)",False,Edward Tudor of Wales & street urchin Tom Canty,The Prince and the Pauper,1,0
6413,2012-07-04,,Double Jeopardy,"(6, 4)",HALLEY'S CATEGORY,13,"(3000,)",True,"(Kelly of the Clue Crew shows an astronomical animation on the monitor.)  In 1677 Edmond Halley observed one of these rare astronomical events--the passage of a planet across the Sun's bright disk; in his case, it was Mercury",a transit,0,1
6413,2012-07-04,,Double Jeopardy,"(2, 5)",RAIDERS OF THE LOST ARCHAEOLOGY,5,"(2000,)",False,"In 1923 this British archaeologist published ""The Tomb of Tut-ankh-Amen""; fitting, 'cause he found it",(Howard) Carter,1,0
6413,2012-07-04,,Double Jeopardy,"(4, 5)","ISN'T IT AN -""ISM""?",19,"(2000,)",False,"A thing that belongs to an earlier time; we'll give you an ""A"" for effort if you get it",an anachronism,1,0
6413,2012-07-04,,Double Jeopardy,"(5, 5)",TITLE CHARACTERS,24,"(2000,)",False,"In a Shakespeare play, Mistress Page & Mistress Ford",The Merry Wives of Windsor,1,0
6413,2012-07-04,,Double Jeopardy,"(6, 5)",HALLEY'S CATEGORY,14,"(2000,)",False,The development of these tables used in life insurance was influenced by mortality tables Halley made for the city of Breslau,actuarial tables,1,0
6413,2012-07-04,,Final Jeopardy,"(1, 1)",NUCLEAR NATIONS,0,"(6800, 6401, 1001)",False,"On May 18, 1974 this country tested its first nuclear device, nicknamed ""Smiling Buddha""",India,1,2
