epNum,airDate,extra_info,round_name,coord,category,order,value,daily_double,question,answer,correctAttempts,wrongAttempts
6432,2012-07-31,2012 Kids Week game 2.,Jeopardy,"(1, 1)",HIDING PLACES,17,"(200,)",False,"Built into a wall to store clothes, this small room is great for a game of hide & seek",a closet,1,0
6432,2012-07-31,2012 Kids Week game 2.,Jeopardy,"(2, 1)",SUPER BOWL WINNERS,10,"(200,)",False,"In 2012 underdogs & Madonna were in vogue at Super Bowl XLVI, where this team won 21-17",the New York Giants,1,0
6432,2012-07-31,2012 Kids Week game 2.,Jeopardy,"(3, 1)",NAME THAT CONTINENT,20,"(200,)",False,Mongolia,Asia,1,0
6432,2012-07-31,2012 Kids Week game 2.,Jeopardy,"(4, 1)",THE PLANETS,18,"(200,)",False,It's the largest & most massive of the planets in the solar system,Jupiter,1,0
6432,2012-07-31,2012 Kids Week game 2.,Jeopardy,"(5, 1)",HODGEPODGE,6,"(200,)",False,Steve Jobs sold his VW minibus & Steve Wozniak sold his calculator to get the money to form this company,Apple,1,0
6432,2012-07-31,2012 Kids Week game 2.,Jeopardy,"(6, 1)",GETTING DRESSED,2,"(200,)",False,The name of these holey slip-on shoes is also a slang term for alligator relatives,Crocs,1,0
6432,2012-07-31,2012 Kids Week game 2.,Jeopardy,"(1, 2)",HIDING PLACES,21,"(400,)",False,If it's long enough crawl behind this; it's also found at the front of a theater stage,a curtain,0,3
6432,2012-07-31,2012 Kids Week game 2.,Jeopardy,"(2, 2)",SUPER BOWL WINNERS,13,"(400,)",False,Drew Brees wore no. 9 when this team came marching in for a win in Super Bowl XLIV,the New Orleans Saints,1,0
6432,2012-07-31,2012 Kids Week game 2.,Jeopardy,"(3, 2)",NAME THAT CONTINENT,26,"(400,)",False,Vatican City,Europe,1,0
6432,2012-07-31,2012 Kids Week game 2.,Jeopardy,"(4, 2)",THE PLANETS,1,"(400,)",False,In 2006 the Cassini spacecraft found yet another ring around this planet,Saturn,1,0
6432,2012-07-31,2012 Kids Week game 2.,Jeopardy,"(5, 2)",HODGEPODGE,29,"(400,)",False,"A national holiday observed each year on the third Monday of January honors this man--his actual birthday was Jan. 15, 1929",Martin Luther King,1,0
6432,2012-07-31,2012 Kids Week game 2.,Jeopardy,"(6, 2)",GETTING DRESSED,3,"(400,)",False,It's the 4-letter word for the netting at the back of a baseball cap that helps keep you cool,mesh,0,3
6432,2012-07-31,2012 Kids Week game 2.,Jeopardy,"(1, 3)",HIDING PLACES,22,"(600,)",False,"If I go up to this highest room in a house & hide, I should be able to see anyone coming",the attic,1,0
6432,2012-07-31,2012 Kids Week game 2.,Jeopardy,"(2, 3)",SUPER BOWL WINNERS,14,"(600,)",False,Aaron Rodgers was muy macho as this team won the whole enchilada in 2011,the Green Bay Packers,1,0
6432,2012-07-31,2012 Kids Week game 2.,Jeopardy,"(3, 3)",NAME THAT CONTINENT,25,"(600,)",False,Mount Kilimanjaro,Africa,1,0
6432,2012-07-31,2012 Kids Week game 2.,Jeopardy,"(4, 3)",THE PLANETS,19,"(2000,)",True,The Greeks called this planet Ares,Mars,1,0
6432,2012-07-31,2012 Kids Week game 2.,Jeopardy,"(5, 3)",HODGEPODGE,28,"(600,)",False,"Flavors from this ice cream maker include Bonnaroo Buzz, Chunky Monkey & Chocolate",Ben & Jerry\'s,1,0
6432,2012-07-31,2012 Kids Week game 2.,Jeopardy,"(6, 3)",GETTING DRESSED,4,"(600,)",False,"UnderArmour clothes for girls include the ColdGear line of these bottoms, similar to tights or long johns",leggings,1,0
6432,2012-07-31,2012 Kids Week game 2.,Jeopardy,"(1, 4)",HIDING PLACES,27,"(800,)",False,I can fit in this small room off the kitchen used for storing dry food: originally it was just for bread,a pantry,1,0
6432,2012-07-31,2012 Kids Week game 2.,Jeopardy,"(2, 4)",SUPER BOWL WINNERS,15,"(800,)",False,"Ray Lewis & this team took care of business in 2001, winning 34-7",the Baltimore Ravens,1,0
6432,2012-07-31,2012 Kids Week game 2.,Jeopardy,"(3, 4)",NAME THAT CONTINENT,8,"(800,)",False,The Brisbane River,Australia,1,0
6432,2012-07-31,2012 Kids Week game 2.,Jeopardy,"(4, 4)",THE PLANETS,12,"(800,)",False,"In a photo from NASA, this brightest planet in the night sky shines below and to the left of the moon",Venus,1,0
6432,2012-07-31,2012 Kids Week game 2.,Jeopardy,"(5, 4)",HODGEPODGE,30,"(800,)",False,"In the sentence ""Yo, check it, I left my CD on C-Dub's desk"", ""on"" is this part of speech",a preposition,1,0
6432,2012-07-31,2012 Kids Week game 2.,Jeopardy,"(6, 4)",GETTING DRESSED,5,"(800,)",False,"A long-sleeved shirt with a collar not high enough to fold over is called a ""mock"" this",a turtle(neck),1,0
6432,2012-07-31,2012 Kids Week game 2.,Jeopardy,"(1, 5)",HIDING PLACES,24,"(1000,)",False,No one will look for us in this attached building that can also mean an auto repair shop,a garage,1,0
6432,2012-07-31,2012 Kids Week game 2.,Jeopardy,"(2, 5)",SUPER BOWL WINNERS,16,"(1000,)",False,Hines Ward was MVP for this team in 2006,the Pittsburgh Steelers,1,0
6432,2012-07-31,2012 Kids Week game 2.,Jeopardy,"(3, 5)",NAME THAT CONTINENT,7,"(1000,)",False,"Named for an explorer, Byrd Station",Antarctica,1,0
6432,2012-07-31,2012 Kids Week game 2.,Jeopardy,"(4, 5)",THE PLANETS,11,"(1000,)",False,"This planet, the third largest in our solar system, was discovered by William Herschel in 1781",Uranus,1,0
6432,2012-07-31,2012 Kids Week game 2.,Jeopardy,"(5, 5)",HODGEPODGE,23,"(1000,)",False,"The second U.S. president born in Virginia, he enrolled at the College of William & Mary at age 16",Thomas Jefferson,1,0
6432,2012-07-31,2012 Kids Week game 2.,Jeopardy,"(6, 5)",GETTING DRESSED,9,"(1000,)",False,"Along with the toga, it was the basic garment of ancient Rome; now it's a long blouse for women & girls",a tunic,0,3
6432,2012-07-31,2012 Kids Week game 2.,Double Jeopardy,"(1, 1)",MALADIES,22,"(400,)",False,"This body part often follows ""strep"" in an illness that can cause trouble swallowing",throat,1,0
6432,2012-07-31,2012 Kids Week game 2.,Double Jeopardy,"(2, 1)",TV OR NOT TV,16,"(400,)",False,Danny DeVito was the voice of this Dr. Seuss character who tries to protect the truffula trees,the Lorax,1,0
6432,2012-07-31,2012 Kids Week game 2.,Double Jeopardy,"(3, 1)",MEASURE FOR MEASURE,15,"(400,)",False,It's the number of degrees in half a circle,180,1,0
6432,2012-07-31,2012 Kids Week game 2.,Double Jeopardy,"(4, 1)",SAY GOODBYE,6,"(400,)",False,"""Adios""",Spanish,1,0
6432,2012-07-31,2012 Kids Week game 2.,Double Jeopardy,"(5, 1)",AMERICAN HISTORY,2,"(400,)",False,In March 1964 this largest Alaska city was struck by a 9.2 magnitude earthquake,Anchorage,1,0
6432,2012-07-31,2012 Kids Week game 2.,Double Jeopardy,"(6, 1)",THE WIZARDING WORLD OF HARRY POTTER,20,"(400,)",False,"(Sarah of the Clue Crew shows us a castle at the Wizarding World of Harry Potter at Universal Orlando.) At the Wizarding World of Harry Potter, you'll see the familiar castle that's home to this prestigious school of witchcraft and wizardry",Hogwarts,1,0
6432,2012-07-31,2012 Kids Week game 2.,Double Jeopardy,"(1, 2)",MALADIES,24,"(800,)",False,The mumps causes swelling of these glands that provide moisture for your mouth,salivary glands,1,1
6432,2012-07-31,2012 Kids Week game 2.,Double Jeopardy,"(2, 2)",TV OR NOT TV,17,"(800,)",False,"At nick.com games based on this series include ""One Million Wishes"" & ""Timmy the Barbarian""",The Fairly OddParents,1,0
6432,2012-07-31,2012 Kids Week game 2.,Double Jeopardy,"(3, 2)",MEASURE FOR MEASURE,11,"(2000,)",True,Number of karats in pure gold,24,1,0
6432,2012-07-31,2012 Kids Week game 2.,Double Jeopardy,"(4, 2)",SAY GOODBYE,7,"(800,)",False,"""Au revoir""",French,1,0
6432,2012-07-31,2012 Kids Week game 2.,Double Jeopardy,"(5, 2)",AMERICAN HISTORY,3,"(800,)",False,"After leaving Congress, this Tennessean left for Texas, where he was killed at the Alamo",Davy Crockett,1,0
6432,2012-07-31,2012 Kids Week game 2.,Double Jeopardy,"(6, 2)",THE WIZARDING WORLD OF HARRY POTTER,28,"(800,)",False,"(Sarah of the Clue Crew stands on a ladder next to a large shelf full of books at the Wizarding World of Harry Potter at Universal Orlando.) Books that put themselves away, a pensieve & an imposing desk can all be found in the office occupied primarily by this wizard during Harry's years at school",Dumbledore,1,0
6432,2012-07-31,2012 Kids Week game 2.,Double Jeopardy,"(1, 3)",MALADIES,25,"(1200,)",False,"JRA, or juvenile rheumatoid this, painfully affects the joints",arthritis,1,0
6432,2012-07-31,2012 Kids Week game 2.,Double Jeopardy,"(2, 3)",TV OR NOT TV,23,"(1200,)",False,Alvin & the Chipmunks find themselves marooned on an island in this 2011 movie sequel,Alvin and the Chipmunks: Chipwrecked,1,0
6432,2012-07-31,2012 Kids Week game 2.,Double Jeopardy,"(3, 3)",MEASURE FOR MEASURE,14,"(1200,)",False,One of these metric units equals 2.2 pounds,kilogram,1,0
6432,2012-07-31,2012 Kids Week game 2.,Double Jeopardy,"(4, 3)",SAY GOODBYE,8,"(1200,)",False,"""Aloha""",Hawaiian,1,0
6432,2012-07-31,2012 Kids Week game 2.,Double Jeopardy,"(5, 3)",AMERICAN HISTORY,5,"(2000,)",True,"This pioneer route stretched more than 2,000 miles from Missouri northwest to near the Pacific Ocean",the Oregon Trail,1,0
6432,2012-07-31,2012 Kids Week game 2.,Double Jeopardy,"(6, 3)",THE WIZARDING WORLD OF HARRY POTTER,29,"(1200,)",False,(Sarah of the Clue Crew stands outside near a rustic hut at the Wizarding World of Harry Potter at Universal Orlando.) Behind me is the hut of this gamekeeper which he shares with his dog Fang,Hagrid,1,0
6432,2012-07-31,2012 Kids Week game 2.,Double Jeopardy,"(1, 4)",MALADIES,27,"(1600,)",False,Kids can be diagnosed with allergy-triggered this breathing malady that begins & ends with the same letter,asthma,1,0
6432,2012-07-31,2012 Kids Week game 2.,Double Jeopardy,"(2, 4)",TV OR NOT TV,19,"(1600,)",False,"It's the title question that Jeff Foxworthy began asking TV contestants in 2007; we know your answer is ""yes""!",Are You Smarter than a Fifth Grader?,1,0
6432,2012-07-31,2012 Kids Week game 2.,Double Jeopardy,"(3, 4)",MEASURE FOR MEASURE,13,"(1600,)",False,In a square mile there are 640 of these,an acre,1,0
6432,2012-07-31,2012 Kids Week game 2.,Double Jeopardy,"(4, 4)",SAY GOODBYE,9,"(1600,)",False,"""Arrivederci""",Italian,1,1
6432,2012-07-31,2012 Kids Week game 2.,Double Jeopardy,"(5, 4)",AMERICAN HISTORY,4,"(1600,)",False,Miles Standish was one of 41 male passengers who signed this document in 1620,the Mayflower Compact,1,0
6432,2012-07-31,2012 Kids Week game 2.,Double Jeopardy,"(6, 4)",THE WIZARDING WORLD OF HARRY POTTER,21,"(1600,)",False,"(Sarah shows us a bubbly beverage inside a pub at the Wizarding World of Harry Potter at Universal Orlando.) At the Wizarding World of Harry Potter, you can visit Hog's Head pub for a mug of this sweet beverage with a frothy top",butterbeer,1,0
6432,2012-07-31,2012 Kids Week game 2.,Double Jeopardy,"(1, 5)",MALADIES,26,"(2000,)",False,Careful! Cuts you get on the playground could lead to this infectious disease aka lockjaw,tetanus,0,3
6432,2012-07-31,2012 Kids Week game 2.,Double Jeopardy,"(2, 5)",TV OR NOT TV,18,"(2000,)",False,A recent episode of this science & discovery series showed the creation of sombreros & salad dressings,How It\'s Made,1,0
6432,2012-07-31,2012 Kids Week game 2.,Double Jeopardy,"(3, 5)",MEASURE FOR MEASURE,12,"(2000,)",False,A 150-ton blue whale weighs this many pounds,"300,000",1,1
6432,2012-07-31,2012 Kids Week game 2.,Double Jeopardy,"(4, 5)",SAY GOODBYE,10,"(2000,)",False,"""Sayonara""",Japanese,1,0
6432,2012-07-31,2012 Kids Week game 2.,Double Jeopardy,"(5, 5)",AMERICAN HISTORY,1,"(2000,)",False,In July 1787 Congress created this new territory in the area north of the Ohio River,the Northwest Territory,1,0
6432,2012-07-31,2012 Kids Week game 2.,Double Jeopardy,"(6, 5)",THE WIZARDING WORLD OF HARRY POTTER,30,"(2000,)",False,"(Sarah shows us an old car at the Wizarding World of Harry Potter at Universal Orlando.) The Weasleys' flying car seen here was used in this Harry Potter film, the second in the series, when Harry and Ron crash into the Whomping Willow",Harry Potter and the Chamber of Secrets,1,0
6432,2012-07-31,2012 Kids Week game 2.,Final Jeopardy,"(1, 1)",KIDS' BUSINESS,0,"(8400, 14500, 13000)",False,"The corporate headquarters of this store founded in 1948 is at One Geoffrey Way in Wayne, New Jersey","Toys \""R\"" Us",1,2
