epNum,airDate,extra_info,round_name,coord,category,order,value,daily_double,question,answer,correctAttempts,wrongAttempts
6493,2012-12-05,,Jeopardy,"(1, 1)",GREENBACKS,6,"(200,)",False,"More bills of this denomination are printed every year than any other, about 45% of the total",$1,1,0
6493,2012-12-05,,Jeopardy,"(2, 1)",HITS & MISSES,1,"(200,)",False,"1986: ""Greatest Love Of All""",Whitney Houston,1,0
6493,2012-12-05,,Jeopardy,"(3, 1)",CANADIAN CAPITALS,8,"(200,)",False,"Although Vancouver is not on Vancouver Island, this capital named for a queen is",Victoria,1,0
6493,2012-12-05,,Jeopardy,"(4, 1)",THIS REVOLUTION WILL BE TELEVISED,20,"(200,)",False,"In HBO's ""John Adams"", starting with episode 2",the American Revolution (the Revolutionary War accepted),1,0
6493,2012-12-05,,Jeopardy,"(5, 1)",DOUBLE VOWELS,15,"(200,)",False,This 10-letter word means impervious to H20,waterproof,1,0
6493,2012-12-05,,Jeopardy,"(6, 1)",THE CHRISTMAS TREE,25,"(200,)",False,"(Jimmy of the Clue Crew stands in front of the Metropolitan Opera Christmas tree at Lincoln Center in New York.)  In 1882, the first Christmas tree with electric lights was set up by Edward Johnson, an engineer & vice president of this man's Electric Company",(Thomas) Edison,1,1
6493,2012-12-05,,Jeopardy,"(1, 2)",GREENBACKS,7,"(400,)",False,On $20 bills a seal represents this system; a letter & number represent its component bank issuing the note,the Federal Reserve System,1,0
6493,2012-12-05,,Jeopardy,"(2, 2)",HITS & MISSES,2,"(400,)",False,"1989: ""Wind Beneath My Wings""",Bette Midler,1,0
6493,2012-12-05,,Jeopardy,"(3, 2)",CANADIAN CAPITALS,11,"(400,)",False,This provincial capital is home to Canada's tallest structure,Toronto,1,0
6493,2012-12-05,,Jeopardy,"(4, 2)",THIS REVOLUTION WILL BE TELEVISED,21,"(400,)",False,"In the Dickens adaptation ""Hard Times""",the Industrial Revolution,1,1
6493,2012-12-05,,Jeopardy,"(5, 2)",DOUBLE VOWELS,16,"(400,)",False,Term for either a New England native or Derek Jeter,Yankee,1,0
6493,2012-12-05,,Jeopardy,"(6, 2)",THE CHRISTMAS TREE,26,"(400,)",False,"If there's blue in your decor, the Colorado blue type of this conifer might be a good tree choice",a blue spruce,1,0
6493,2012-12-05,,Jeopardy,"(1, 3)",GREENBACKS,9,"(1400,)",True,It's the only current bill with the face of a treasury secretary on it,the $10 bill,1,0
6493,2012-12-05,,Jeopardy,"(2, 3)",HITS & MISSES,3,"(600,)",False,"2012: ""Rumour Has It""",Adele,1,0
6493,2012-12-05,,Jeopardy,"(3, 3)",CANADIAN CAPITALS,12,"(600,)",False,During WWII this capital of Nova Scotia was Canada's main naval base,Halifax,1,0
6493,2012-12-05,,Jeopardy,"(4, 3)",THIS REVOLUTION WILL BE TELEVISED,22,"(600,)",False,"In the BBC's ""Terror!""",the French Revolution,0,3
6493,2012-12-05,,Jeopardy,"(5, 3)",DOUBLE VOWELS,17,"(600,)",False,A wind of 4 to 31 mph; every little one seems to whisper Louise,breeze,1,0
6493,2012-12-05,,Jeopardy,"(6, 3)",THE CHRISTMAS TREE,27,"(600,)",False,(Sarah of the Clue Crew stands in front of the Metropolitan Opera Christmas tree at Lincoln Center in New York.)  One of the groups that helped make the Christmas tree a tradition in the U.S. were these German mercenaries,the Hessians,1,1
6493,2012-12-05,,Jeopardy,"(1, 4)",GREENBACKS,10,"(800,)",False,A star at the end of this indicates that it's out of sequence with those on the other bills in its series,the serial number,1,0
6493,2012-12-05,,Jeopardy,"(2, 4)",HITS & MISSES,4,"(800,)",False,"1999: ""That Don't Impress Me Much""",Shania Twain,1,0
6493,2012-12-05,,Jeopardy,"(3, 4)",CANADIAN CAPITALS,13,"(800,)",False,"Its nicknames include ""Oil City"" & ""E-Town""",Edmonton,1,0
6493,2012-12-05,,Jeopardy,"(4, 4)",THIS REVOLUTION WILL BE TELEVISED,23,"(800,)",False,"In the 1969 documentary ""Mao Tse-tung and the...""",the Cultural Revolution,0,3
6493,2012-12-05,,Jeopardy,"(5, 4)",DOUBLE VOWELS,18,"(800,)",False,"For 729, it's 27",a square root,1,0
6493,2012-12-05,,Jeopardy,"(6, 4)",THE CHRISTMAS TREE,28,"(800,)",False,"Original German title of the song we know as ""O Christmas Tree""","""O Tannenbaum""",1,0
6493,2012-12-05,,Jeopardy,"(1, 5)",GREENBACKS,30,"(1000,)",False,"Every day this bureau, the B.E.P., produces millions of paper bills, with a face value over $400 million",the Bureau of Engraving and Printing,1,0
6493,2012-12-05,,Jeopardy,"(2, 5)",HITS & MISSES,5,"(1000,)",False,"2007: ""Umbrella""",Rihanna,1,0
6493,2012-12-05,,Jeopardy,"(3, 5)",CANADIAN CAPITALS,14,"(1000,)",False,It's the capital & second-largest city of Saskatchewan,Regina,1,0
6493,2012-12-05,,Jeopardy,"(4, 5)",THIS REVOLUTION WILL BE TELEVISED,24,"(1000,)",False,"In ""The Train"", set in the early 20th century & starring Ben Kingsley",the Russian Revolution,0,3
6493,2012-12-05,,Jeopardy,"(5, 5)",DOUBLE VOWELS,19,"(1000,)",False,"Arabic for ""peace"", it often precedes ""aleikum""",salaam,1,1
6493,2012-12-05,,Jeopardy,"(6, 5)",THE CHRISTMAS TREE,29,"(1000,)",False,John Paul II started a tradition of different countries sending a great big tree to light in this square,St. Peter\'s Square,1,1
6493,2012-12-05,,Double Jeopardy,"(1, 1)",GREENE BOOKS,8,"(400,)",False,"""Our Man in ___""",Havana,1,0
6493,2012-12-05,,Double Jeopardy,"(2, 1)",MINORITY POPULATIONS,7,"(400,)",False,A large Welsh community has been thriving in Chubut Province in this country's Patagonia region for over 100 years,Argentina,1,1
6493,2012-12-05,,Double Jeopardy,"(3, 1)",POPULAR MECHANICS,18,"(400,)",False,"Aaaaaay! This ""Happy Days"" mechanic got out of the garage to be Dean of Boys at a vocational high school",the Fonz,1,0
6493,2012-12-05,,Double Jeopardy,"(4, 1)",WE'RE AFTER SOME CONSISTENCY,2,"(400,)",False,This name of late comedian Sales can refer to the consistency of some liquids,Soupy,1,0
6493,2012-12-05,,Double Jeopardy,"(5, 1)",18th CENTURY PEOPLE,10,"(400,)",False,"Dennis O'Kelly owned Eclipse, one of these, & won a bet that Eclipse would beat the field by 240 yards",a racehorse,1,0
6493,2012-12-05,,Double Jeopardy,"(6, 1)",TO THE LIBRARY!,1,"(400,)",False,In 1901 the USA's first reference library for state legislators was set up in this Wisconsin capital,Madison,1,0
6493,2012-12-05,,Double Jeopardy,"(1, 2)",GREENE BOOKS,9,"(800,)",False,"""The ___ American""",Quiet,1,1
6493,2012-12-05,,Double Jeopardy,"(2, 2)",MINORITY POPULATIONS,27,"(2000,)",True,"Marseilles has a large number of North Africans, most coming from this former colony",Algeria,0,1
6493,2012-12-05,,Double Jeopardy,"(3, 2)",POPULAR MECHANICS,19,"(800,)",False,"This hirsute movie character is 7 feet tall, from Kashyyyk, a limited conversationalist & great at spaceship repair",Chewbacca,1,0
6493,2012-12-05,,Double Jeopardy,"(4, 2)",WE'RE AFTER SOME CONSISTENCY,20,"(800,)",False,"Similar to ""gritty"", it's the adjective used of old-time film from the clumping together of particles in the emulsion",grainy,1,0
6493,2012-12-05,,Double Jeopardy,"(5, 2)",18th CENTURY PEOPLE,11,"(800,)",False,"Robert Walpole, in power from 1721 to 1742, is regarded as the first of these British heads of government",prime minister,1,0
6493,2012-12-05,,Double Jeopardy,"(6, 2)",TO THE LIBRARY!,3,"(800,)",False,L.A.'s Central Library used some of the 7 million obsolete cards from this file to wallpaper the elevators,the card catalog,1,0
6493,2012-12-05,,Double Jeopardy,"(1, 3)",GREENE BOOKS,12,"(1200,)",False,"""This ___ for Hire""",Gun,1,1
6493,2012-12-05,,Double Jeopardy,"(2, 3)",MINORITY POPULATIONS,26,"(1200,)",False,"Brazil has the largest Japanese population outside of Japan, with the most living in the state named for this largest city",São Paulo,0,3
6493,2012-12-05,,Double Jeopardy,"(3, 3)",POPULAR MECHANICS,21,"(1200,)",False,Sparkplug Witwicky was a character in this animated TV series whose main characters could use a good mechanic,The Transformers,0,3
6493,2012-12-05,,Double Jeopardy,"(4, 3)",WE'RE AFTER SOME CONSISTENCY,23,"(1200,)",False,"Sticky stuff to catch birds was once made from mistletoe, viscum in Latin; hence this adjective",viscous,1,0
6493,2012-12-05,,Double Jeopardy,"(5, 3)",18th CENTURY PEOPLE,15,"(1200,)",False,She disliked living in New York City; living in Philadelphia from 1790 to 1797 suited her a bit better,Martha Washington,1,0
6493,2012-12-05,,Double Jeopardy,"(6, 3)",TO THE LIBRARY!,4,"(1200,)",False,His Nobel Peace Prize is on display at his presidential library in Atlanta,Jimmy Carter,1,0
6493,2012-12-05,,Double Jeopardy,"(1, 4)",GREENE BOOKS,13,"(1600,)",False,"""The Power and the ___""",Glory,1,0
6493,2012-12-05,,Double Jeopardy,"(3, 4)",POPULAR MECHANICS,22,"(1600,)",False,"From Paul Sr. to Jr., this reality show on Discovery Teutul-ly covers motorcycle mechanic madness",American Chopper,0,3
6493,2012-12-05,,Double Jeopardy,"(4, 4)",WE'RE AFTER SOME CONSISTENCY,24,"(1600,)",False,This adjective describes the slippery texture of okra or a despicable person,slimy,1,0
6493,2012-12-05,,Double Jeopardy,"(5, 4)",18th CENTURY PEOPLE,16,"(1600,)",False,This Russian's achievements included the founding of cities,Peter the Great,1,0
6493,2012-12-05,,Double Jeopardy,"(6, 4)",TO THE LIBRARY!,5,"(1600,)",False,Shh! The name of this official policy of San Diego's Copley Library sounds like it's kept hush-hush,Quiet Policy,0,3
6493,2012-12-05,,Double Jeopardy,"(1, 5)",GREENE BOOKS,14,"(2000,)",False,"""The ___ of the Matter""",Heart,1,0
6493,2012-12-05,,Double Jeopardy,"(4, 5)",WE'RE AFTER SOME CONSISTENCY,25,"(2000,)",False,Many plants are afflicted by this type of mildew named for feeling like soft feathers,downy,1,0
6493,2012-12-05,,Double Jeopardy,"(5, 5)",18th CENTURY PEOPLE,17,"(2000,)",False,"In 1781 he ""critique""d Leibniz' idea that the mind can grasp truths about entities like God",Immanuel Kant,0,3
6493,2012-12-05,,Double Jeopardy,"(6, 5)",TO THE LIBRARY!,6,"(1000,)",True,"Some of its collections were housed in the Serapeum, a temple dedicated to the god Serapis",the Alexandria library,1,0
6493,2012-12-05,,Final Jeopardy,"(1, 1)",U.S. PRESIDENTS,0,"(2000, 3200, 5201)",False,This man is the only U.S. president since Hoover not named Time magazine's Man or Person of the Year,Gerald Ford,2,1
