epNum,airDate,extra_info,round_name,coord,category,order,value,daily_double,question,answer,correctAttempts,wrongAttempts
6556,2013-03-04,,Jeopardy,"(1, 1)",CHESS? YES!,21,"(200,)",False,This piece that starts off in the corner is generally worth about 5 pawns,a rook,1,0
6556,2013-03-04,,Jeopardy,"(2, 1)",3-LETTER WORDS,16,"(200,)",False,"A female goat can be referred to as a nanny goat or this, just like a female deer",a doe,1,0
6556,2013-03-04,,Jeopardy,"(3, 1)",EXILED,11,"(200,)",False,"After declaring Napoleon III a traitor to France, this ""Les Miserables"" author went into exile for 19 years",Victor Hugo,1,0
6556,2013-03-04,,Jeopardy,"(4, 1)",SHOPPING ABBREV.,26,"(200,)",False,It revamped its stores in 2012:JCP,J. C. Penney,1,0
6556,2013-03-04,,Jeopardy,"(5, 1)",CELEBRITIES LOVE TV,6,"(200,)",False,"(I'm CNN correspondent Lizzie O'Leary.)  Just like a lot of people, I'm watching this AMC show created by Matthew Weiner, who writes great characters like Betty Draper & Roger Sterling",Mad Men,1,0
6556,2013-03-04,,Jeopardy,"(6, 1)","""V"" ARE THE WORLD",1,"(200,)",False,The highest point in this country is Pico Bolivar,Venezuela,1,0
6556,2013-03-04,,Jeopardy,"(1, 2)",CHESS? YES!,22,"(400,)",False,"To earn this title, a player must attain a minimum of 2500 rating points",Grandmaster,1,0
6556,2013-03-04,,Jeopardy,"(2, 2)",3-LETTER WORDS,17,"(400,)",False,Cheers to you if you know that London dry is a common type of this,gin,1,0
6556,2013-03-04,,Jeopardy,"(3, 2)",EXILED,12,"(400,)",False,In 1302 this poet was exiled from Florence by political enemies & faced being burnt at the stake if he returned,Dante,1,0
6556,2013-03-04,,Jeopardy,"(4, 2)",SHOPPING ABBREV.,27,"(400,)",False,Take flight with this patriotic-sounding clothing store: AE,American Eagle,1,0
6556,2013-03-04,,Jeopardy,"(5, 2)",CELEBRITIES LOVE TV,7,"(400,)",False,"(I'm BBC news anchor Katty Kay.)  I can't get enough of Maggie Smith's dowager countess on this PBS show with lines like ""Don't be defeatist, dear, it's very middle class""",Downton Abbey,1,0
6556,2013-03-04,,Jeopardy,"(6, 2)","""V"" ARE THE WORLD",2,"(400,)",False,"Stanley Park occupies 1,000 acres of this British Columbia city",Vancouver,1,1
6556,2013-03-04,,Jeopardy,"(1, 3)",CHESS? YES!,23,"(600,)",False,To fianchetto one of these pieces is to move it onto one of the board's long diagonals,a bishop,1,0
6556,2013-03-04,,Jeopardy,"(2, 3)",3-LETTER WORDS,18,"(600,)",False,"In a patriotic song Columbia is the this ""of the ocean""","""Columbia, Gem of the Ocean""",0,3
6556,2013-03-04,,Jeopardy,"(3, 3)",EXILED,13,"(600,)",False,"In the '70s this Oscar-nominated ""Chinatown"" director fled the United States",Roman Polanski,1,0
6556,2013-03-04,,Jeopardy,"(4, 3)",SHOPPING ABBREV.,28,"(600,)",False,It has a line called pink: VS,Victoria\'s Secret,1,0
6556,2013-03-04,,Jeopardy,"(5, 3)",CELEBRITIES LOVE TV,8,"(600,)",False,"(I'm columnist Clarence Page.)  I like to watch this NBC sitcom, which I think is an inspired satire of small-town governance & political ambition",Parks & Recreation,1,0
6556,2013-03-04,,Jeopardy,"(6, 3)","""V"" ARE THE WORLD",3,"(600,)",False,"This major city on the Adriatic is vulnerable to floods, as was the case in 2008",Venice,1,0
6556,2013-03-04,,Jeopardy,"(1, 4)",CHESS? YES!,24,"(800,)",False,"A game in which each player is allotted 5 minutes or less is called this type, German for ""lightning""",blitz,1,0
6556,2013-03-04,,Jeopardy,"(2, 4)",3-LETTER WORDS,19,"(800,)",False,This Hawaiian dish made from cooked taro root that's pounded to a paste is eaten with the fingers,poi,1,0
6556,2013-03-04,,Jeopardy,"(3, 4)",EXILED,14,"(400,)",True,He's been in exile since 1959 after a failed Tibetan uprising against Chinese occupation,the Dalai Lama,1,0
6556,2013-03-04,,Jeopardy,"(4, 4)",SHOPPING ABBREV.,29,"(800,)",False,Clothes for the working woman: AT,Ann Taylor,1,0
6556,2013-03-04,,Jeopardy,"(5, 4)",CELEBRITIES LOVE TV,9,"(800,)",False,(I'm CNBC reporter David Faber.)  I enjoy getting a look at commerce far from Wall Street on this drama from David Simon about Baltimore's inner city drug trade,The Wire,1,1
6556,2013-03-04,,Jeopardy,"(6, 4)","""V"" ARE THE WORLD",4,"(800,)",False,"Of Austria's 9 states, it's the smallest in area",Vienna,1,0
6556,2013-03-04,,Jeopardy,"(1, 5)",CHESS? YES!,25,"(1000,)",False,"One of black's most popular defenses is called this, a term for a person from a Mediterranean island",Sicilian,1,0
6556,2013-03-04,,Jeopardy,"(2, 5)",3-LETTER WORDS,20,"(1000,)",False,"A unit of energy, it has also been used in slang to mean cool, great, wonderful",rad,0,3
6556,2013-03-04,,Jeopardy,"(3, 5)",EXILED,15,"(1000,)",False,The government of Russia didn't like Peter Kropotkin's being lead thinker of this no-government philosophy,anarchy,1,0
6556,2013-03-04,,Jeopardy,"(4, 5)",SHOPPING ABBREV.,30,"(1000,)",False,There's one at 5th & 58th in NYC: BG,Bergdorf Goodman,0,3
6556,2013-03-04,,Jeopardy,"(5, 5)",CELEBRITIES LOVE TV,10,"(1000,)",False,(I'm Lewis Black.)  I'm watching this gritty drama based on the works of Elmore Leonard & starring Timothy Olyphant as an old-school U.S. Marshal  in the 21st century,Justified,1,0
6556,2013-03-04,,Jeopardy,"(6, 5)","""V"" ARE THE WORLD",5,"(1000,)",False,"This ""City"" was created in 1929 by the Lateran treaty",Vatican City,1,0
6556,2013-03-04,,Double Jeopardy,"(1, 1)",PARDON THE ERUPTION,26,"(400,)",False,In the 1780s fumes & lava from the Laki volcano in this North Atlantic nation killed most of its livestock,Iceland,0,3
6556,2013-03-04,,Double Jeopardy,"(2, 1)",OLYMPIC FACT SHEET,11,"(400,)",False,This was changed from 25 to 26.2 miles at London's 1908 Games so it would end in front of the royal family's box,the marathon,1,0
6556,2013-03-04,,Double Jeopardy,"(3, 1)",AMERICAN ARCHITECTS,6,"(400,)",False,The Senate & house wings as we know them of this D.C. building were added by Thomas Walter in the 1850s,the Capitol,1,0
6556,2013-03-04,,Double Jeopardy,"(4, 1)",EDIBLE BEFORE & AFTER,21,"(400,)",False,"Boy George's group that's a double-decker creation with bacon, lettuce, tomato & turkey on 3 slices of bread",Culture Club sandwich,1,0
6556,2013-03-04,,Double Jeopardy,"(5, 1)",GEOGRAPHIC TITLES,1,"(400,)",False,"Agatha Christie: ""Death on the _____""",Nile,1,0
6556,2013-03-04,,Double Jeopardy,"(6, 1)","2 LETTERS, 1 WORD",16,"(400,)",False,It's not difficult,easy,1,0
6556,2013-03-04,,Double Jeopardy,"(1, 2)",PARDON THE ERUPTION,27,"(800,)",False,"Cleveland Volcano in this Alaskan island group just keeps on erupting; a June 19, 2012 belch sent ash 35,000 feet up",the Aleutians,1,0
6556,2013-03-04,,Double Jeopardy,"(2, 2)",OLYMPIC FACT SHEET,12,"(800,)",False,"Including 1952's ""Magnificent Magyars"", it has won more men's soccer medals than any other current country",Hungary,1,0
6556,2013-03-04,,Double Jeopardy,"(3, 2)",AMERICAN ARCHITECTS,7,"(800,)",False,"Michael Graves, a leader of the post-modernism movement, designed hotels for this Orlando-area theme park",Disney World,1,0
6556,2013-03-04,,Double Jeopardy,"(4, 2)",EDIBLE BEFORE & AFTER,22,"(800,)",False,Dairy-filled pastry that frolicked in the autumn mist in a land called Honah Lee,cream Puff the Magic dragon,1,0
6556,2013-03-04,,Double Jeopardy,"(5, 2)",GEOGRAPHIC TITLES,2,"(800,)",False,"Peter Mayle: ""A Year in _____""",Provence,1,0
6556,2013-03-04,,Double Jeopardy,"(6, 2)","2 LETTERS, 1 WORD",17,"(800,)",False,A tent used by Native Americans,teepee,1,0
6556,2013-03-04,,Double Jeopardy,"(1, 3)",PARDON THE ERUPTION,28,"(1200,)",False,"When this volcano in the Sunda Strait erupted Aug. 27, 1883, the shock wave traveled around the world 7 times",Krakatoa,1,0
6556,2013-03-04,,Double Jeopardy,"(2, 3)",OLYMPIC FACT SHEET,13,"(1200,)",False,"After teams from China, South Korea & Indonesia were disqualified in 2012, this sport mulled format changes",badminton,1,0
6556,2013-03-04,,Double Jeopardy,"(3, 3)",AMERICAN ARCHITECTS,8,"(1200,)",False,In 1904 in Buffalo he designed one of the USA's first all air-conditioned office buildings,Frank Lloyd Wright,0,3
6556,2013-03-04,,Double Jeopardy,"(4, 3)",EDIBLE BEFORE & AFTER,23,"(1200,)",False,A fried Asian appetizer that you use for personal grooming like Ban or Dry Idea,egg roll-on deodorant,0,3
6556,2013-03-04,,Double Jeopardy,"(5, 3)",GEOGRAPHIC TITLES,3,"(1200,)",False,"Paula McLain's portrait of the lost generation: ""The _____ Wife""",Paris,1,1
6556,2013-03-04,,Double Jeopardy,"(6, 3)","2 LETTERS, 1 WORD",18,"(1200,)",False,"A short non-fiction literary composition, or to try",essay,1,0
6556,2013-03-04,,Double Jeopardy,"(1, 4)",PARDON THE ERUPTION,29,"(1600,)",False,Materials in the atmosphere from the 1991 eruption of this volcano on Luzon caused the world's temp. to drop by 1 degree,Mount Pinatubo,0,3
6556,2013-03-04,,Double Jeopardy,"(2, 4)",OLYMPIC FACT SHEET,14,"(1000,)",True,"In 1952 Lis Hartel, a paralyzed entrant in this sport, won silver with help from a friend named Jubilee",equestrian,0,1
6556,2013-03-04,,Double Jeopardy,"(3, 4)",AMERICAN ARCHITECTS,9,"(400,)",True,His projects in the country of his birth include  the Suzhou Museum,I.M. Pei,1,0
6556,2013-03-04,,Double Jeopardy,"(4, 4)",EDIBLE BEFORE & AFTER,24,"(1600,)",False,Charlie Brown's gal pal is a hamburger with Swiss cheese & onions served on grilled rye,Peppermint Patty melt,1,0
6556,2013-03-04,,Double Jeopardy,"(5, 4)",GEOGRAPHIC TITLES,4,"(1600,)",False,"Mary Ann Shaffer & Annie Barrows:""The ____ Literary and Potato Peel Pie Society""",Guernsey,0,3
6556,2013-03-04,,Double Jeopardy,"(6, 4)","2 LETTERS, 1 WORD",19,"(1600,)",False,"Shabby & rundown, or like a watermelon",seedy,1,0
6556,2013-03-04,,Double Jeopardy,"(1, 5)",PARDON THE ERUPTION,30,"(2000,)",False,"It sounds morelike Italian food,but this volcanoon an island north of Sicilyis known as the Lighthouseof the Mediterranean",Mount Stromboli,0,3
6556,2013-03-04,,Double Jeopardy,"(2, 5)",OLYMPIC FACT SHEET,15,"(2000,)",False,"The numbered gates in the canoe slalom have 2 colors, red & green, which stand for these 2 directions on a river",upstream & downstream,1,0
6556,2013-03-04,,Double Jeopardy,"(3, 5)",AMERICAN ARCHITECTS,10,"(2000,)",False,"California's first licensed female architect, Julia Morgan, designed this tycoon's castle",Hearst,1,0
6556,2013-03-04,,Double Jeopardy,"(4, 5)",EDIBLE BEFORE & AFTER,25,"(2000,)",False,"Bourbon-&-peach liqueur that's a cozy dish from childhood, like meatloaf or macaroni & cheese",Southern Comfort food,1,0
6556,2013-03-04,,Double Jeopardy,"(5, 5)",GEOGRAPHIC TITLES,5,"(2000,)",False,"Ken Follett: ""The Man from _____ _____""",St. Petersburg,0,3
6556,2013-03-04,,Double Jeopardy,"(6, 5)","2 LETTERS, 1 WORD",20,"(2000,)",False,"Before ""one"" it means this one, that one, whatever one",any,1,0
6556,2013-03-04,,Final Jeopardy,"(1, 1)",COLLEGES & UNIVERSITIES,0,"(5000, 4001, 9201)",False,One of its mascots is a restored 1930 sport coupe that's been in use at the school since 1961,Georgia Tech,0,3
