epNum,airDate,extra_info,round_name,coord,category,order,value,daily_double,question,answer,correctAttempts,wrongAttempts
6561,2013-03-11,Drew Horwood game 5.,Jeopardy,"(1, 1)",THE MAIN ALCOHOLIC INGREDIENT,1,"(200,)",False,In a mimosa,champagne,1,0
6561,2013-03-11,Drew Horwood game 5.,Jeopardy,"(2, 1)",STATELY GEOGRAPHY,11,"(200,)",False,"The Sevier Desert,Starvation State Park,the Provo River",Utah,1,0
6561,2013-03-11,Drew Horwood game 5.,Jeopardy,"(3, 1)",TONY WINNERS FOR BEST MUSICAL,6,"(200,)",False,1976:It's about Broadway itself & its hopefuls,A Chorus Line,1,1
6561,2013-03-11,Drew Horwood game 5.,Jeopardy,"(4, 1)",MacARTHUR FOUNDATION FELLOWS,16,"(200,)",False,"Benoit Rolland won $500,000, no strings attached, for his expertise in making these, used to play string instruments",bows,1,0
6561,2013-03-11,Drew Horwood game 5.,Jeopardy,"(5, 1)",DOUBLE LETTER 8-LETTER WORDS,21,"(200,)",False,Spray-painted markings or initials on a building,graffiti,1,0
6561,2013-03-11,Drew Horwood game 5.,Jeopardy,"(6, 1)",& FINALLY,26,"(200,)",False,"You'll find the French word for ""day"" in this word that signifies the end of a court session",adjournment,1,0
6561,2013-03-11,Drew Horwood game 5.,Jeopardy,"(1, 2)",THE MAIN ALCOHOLIC INGREDIENT,2,"(400,)",False,In a Moscow mule,vodka,1,0
6561,2013-03-11,Drew Horwood game 5.,Jeopardy,"(2, 2)",STATELY GEOGRAPHY,12,"(400,)",False,"Badlands National Park,the Big Sioux River",South Dakota,1,0
6561,2013-03-11,Drew Horwood game 5.,Jeopardy,"(3, 2)",TONY WINNERS FOR BEST MUSICAL,7,"(400,)",False,2005:A very silly tale of knights & coconuts,Spamalot,1,0
6561,2013-03-11,Drew Horwood game 5.,Jeopardy,"(4, 2)",MacARTHUR FOUNDATION FELLOWS,17,"(400,)",False,Coronagraph expert Olivier Guyon designs these instruments to look for exoplanets,telescopes,1,0
6561,2013-03-11,Drew Horwood game 5.,Jeopardy,"(5, 2)",DOUBLE LETTER 8-LETTER WORDS,22,"(400,)",False,Adjective for a stain that won't come out or a person who won't change his mind,stubborn,1,0
6561,2013-03-11,Drew Horwood game 5.,Jeopardy,"(6, 2)",& FINALLY,27,"(400,)",False,"The C&D in a C&D order stand for these 2 words, though either one would make the point",cease & desist,1,0
6561,2013-03-11,Drew Horwood game 5.,Jeopardy,"(1, 3)",THE MAIN ALCOHOLIC INGREDIENT,3,"(600,)",False,In a mexicola,tequila,1,0
6561,2013-03-11,Drew Horwood game 5.,Jeopardy,"(2, 3)",STATELY GEOGRAPHY,13,"(600,)",False,"The Wheeling Heritage Trails,Blennerhassett Island",West Virginia,1,0
6561,2013-03-11,Drew Horwood game 5.,Jeopardy,"(3, 3)",TONY WINNERS FOR BEST MUSICAL,8,"(600,)",False,1952:Anna Leonowens is one of the title pair,The King and I,1,0
6561,2013-03-11,Drew Horwood game 5.,Jeopardy,"(4, 3)",MacARTHUR FOUNDATION FELLOWS,18,"(600,)",False,"Nancy Rabalais studies Gulf of Mexico ""dead zones"", mainly caused by low levels of this",oxygen,1,0
6561,2013-03-11,Drew Horwood game 5.,Jeopardy,"(5, 3)",DOUBLE LETTER 8-LETTER WORDS,23,"(600,)",False,Don't fuhgedaboudit! Bensonhurst is one neighborhood in this NYC borough,Brooklyn,1,0
6561,2013-03-11,Drew Horwood game 5.,Jeopardy,"(6, 3)",& FINALLY,28,"(600,)",False,It can refer to the preparatory motion of a baseball pitcher or the final action of any event,the wind-up,0,3
6561,2013-03-11,Drew Horwood game 5.,Jeopardy,"(1, 4)",THE MAIN ALCOHOLIC INGREDIENT,4,"(800,)",False,In a Havana cocktail,rum,1,0
6561,2013-03-11,Drew Horwood game 5.,Jeopardy,"(2, 4)",STATELY GEOGRAPHY,14,"(800,)",False,"13,147-foot Boundary Peak,Area 51 (which we can't confirm or deny)",Nevada,1,1
6561,2013-03-11,Drew Horwood game 5.,Jeopardy,"(3, 4)",TONY WINNERS FOR BEST MUSICAL,9,"(800,)",False,"1956:It concerns baseball, darn it!",Damn Yankees,1,0
6561,2013-03-11,Drew Horwood game 5.,Jeopardy,"(4, 4)",MacARTHUR FOUNDATION FELLOWS,19,"(800,)",False,David Finkel wrote a book on being embedded with a U.S. battalion in this world capital,Baghdad,1,0
6561,2013-03-11,Drew Horwood game 5.,Jeopardy,"(5, 4)",DOUBLE LETTER 8-LETTER WORDS,24,"(800,)",False,To begin an activity,to commence,1,0
6561,2013-03-11,Drew Horwood game 5.,Jeopardy,"(6, 4)",& FINALLY,29,"(800,)",False,"""Yours faithfully"" at the end of a letter is an example of a ""complimentary"" one of these",close,0,3
6561,2013-03-11,Drew Horwood game 5.,Jeopardy,"(1, 5)",THE MAIN ALCOHOLIC INGREDIENT,5,"(1000,)",False,"In a T & T, this brand of gin",Tanqueray,1,0
6561,2013-03-11,Drew Horwood game 5.,Jeopardy,"(2, 5)",STATELY GEOGRAPHY,15,"(1000,)",False,"The Red River region,Geronimo's grave",Oklahoma,0,3
6561,2013-03-11,Drew Horwood game 5.,Jeopardy,"(3, 5)",TONY WINNERS FOR BEST MUSICAL,10,"(1000,)",True,1949:Based on a Shakespearean romantic comedy,"Kiss Me, Kate",1,0
6561,2013-03-11,Drew Horwood game 5.,Jeopardy,"(4, 5)",MacARTHUR FOUNDATION FELLOWS,20,"(1000,)",False,"Some may find it tough to swallow the award to Sarkis Mazmanian; he studies bacteria in the G.I. tract, short for this",gastrointestinal,1,0
6561,2013-03-11,Drew Horwood game 5.,Jeopardy,"(5, 5)",DOUBLE LETTER 8-LETTER WORDS,25,"(1000,)",False,"In 1900 the LZ-1, the first airship of this type, topped out at about 17 miles per hour",a zeppelin,1,0
6561,2013-03-11,Drew Horwood game 5.,Jeopardy,"(6, 5)",& FINALLY,30,"(1000,)",False,There's nothing lower case about this 2-word term for the death penalty,capital punishment,1,0
6561,2013-03-11,Drew Horwood game 5.,Double Jeopardy,"(1, 1)","OFF TO A ""GOOD"" START",26,"(400,)",False,"In Italian, this phrase you wish someone is ""buona fortuna""",good luck,1,0
6561,2013-03-11,Drew Horwood game 5.,Double Jeopardy,"(2, 1)",THE HITTITES,1,"(400,)",False,The Hittite military redesigned these vehicles so they could carry 3 men instead of 2,chariots,1,0
6561,2013-03-11,Drew Horwood game 5.,Double Jeopardy,"(3, 1)",NEWSPAPER MOGULS,7,"(400,)",False,"In 2012 he said it was ""a big move"" to split News Corp. into entertainment (cha-ching) & print (not so much)",Murdoch,1,0
6561,2013-03-11,Drew Horwood game 5.,Double Jeopardy,"(4, 1)",COLORFUL QUOTES,21,"(400,)",False,"Samuel Butler:""'Twas Presbyterian true ____""",blue,1,0
6561,2013-03-11,Drew Horwood game 5.,Double Jeopardy,"(5, 1)",3-NAMED ACTRESSES,2,"(400,)",False,"In 2010 this ""Seinfeld"" veteran returned to NBC to briefly take over the role of Liz Lemon on a live ""30 Rock""",Julia Louis-Dreyfus,1,0
6561,2013-03-11,Drew Horwood game 5.,Double Jeopardy,"(6, 1)","WHO, WHAT, WHEN, WHERE, WHY",16,"(400,)",False,Who:The guy who ran the Soviet Union from the 1920s to 1953,Stalin,1,0
6561,2013-03-11,Drew Horwood game 5.,Double Jeopardy,"(1, 2)","OFF TO A ""GOOD"" START",27,"(800,)",False,This 2-word trucker's salutation became associated with CB radio,good buddy,0,3
6561,2013-03-11,Drew Horwood game 5.,Double Jeopardy,"(2, 2)",THE HITTITES,12,"(800,)",False,"Around 1400 B.C. the Hittites began working with this metal that's softer than bronze, helping to usher in its ""Age""",Iron,0,3
6561,2013-03-11,Drew Horwood game 5.,Double Jeopardy,"(3, 2)",NEWSPAPER MOGULS,8,"(800,)",False,"Known as ""Lady Pub"", Katharine Graham gained control of this paper upon the death of her husband in 1963",The Washington Post,1,0
6561,2013-03-11,Drew Horwood game 5.,Double Jeopardy,"(4, 2)",COLORFUL QUOTES,22,"(800,)",False,"Tennyson:""Nature, ____ in tooth and claw""",red,1,0
6561,2013-03-11,Drew Horwood game 5.,Double Jeopardy,"(5, 2)",3-NAMED ACTRESSES,3,"(800,)",False,"She was Oscar-nominated for a 1980 movie, won a 1980 Tony Award & has been known to turn the world on with her smile",Mary Tyler Moore,1,0
6561,2013-03-11,Drew Horwood game 5.,Double Jeopardy,"(6, 2)","WHO, WHAT, WHEN, WHERE, WHY",17,"(800,)",False,"When:Mother's Day, this day each year",the 2nd Sunday in May,1,0
6561,2013-03-11,Drew Horwood game 5.,Double Jeopardy,"(1, 3)","OFF TO A ""GOOD"" START",28,"(1200,)",False,"In the name of this religious observance, ""good"" means ""holy"", not ""positive""",Good Friday,1,0
6561,2013-03-11,Drew Horwood game 5.,Double Jeopardy,"(2, 3)",THE HITTITES,13,"(1200,)",False,"Hattusa, the Hittite capital from around 1650 B.C., was just east of this present-day Turkish capital",Ankara,1,0
6561,2013-03-11,Drew Horwood game 5.,Double Jeopardy,"(3, 3)",NEWSPAPER MOGULS,9,"(4000,)",True,In 1894 this man whose company later partnered with Roy Howard founded the USA's 1st major newspaper chain,Edward Scripps,0,1
6561,2013-03-11,Drew Horwood game 5.,Double Jeopardy,"(4, 3)",COLORFUL QUOTES,23,"(1200,)",False,"Henry Ford on customers' Model T options:""Any color--so long as it's ____""",black,1,0
6561,2013-03-11,Drew Horwood game 5.,Double Jeopardy,"(5, 3)",3-NAMED ACTRESSES,4,"(1200,)",False,"Fittingly, this Welsh beauty played Catherine the Great in a 1996 TV movie",Catherine Zeta-Jones,1,0
6561,2013-03-11,Drew Horwood game 5.,Double Jeopardy,"(6, 3)","WHO, WHAT, WHEN, WHERE, WHY",18,"(1200,)",False,Where:The body of water surrounding the Canary Islands,the Atlantic Ocean,1,0
6561,2013-03-11,Drew Horwood game 5.,Double Jeopardy,"(1, 4)","OFF TO A ""GOOD"" START",29,"(1600,)",False,"By reading poetry & such pursuits, Charlie the tuna is always trying to show Star-Kist he has this",good taste,1,0
6561,2013-03-11,Drew Horwood game 5.,Double Jeopardy,"(2, 4)",THE HITTITES,14,"(1000,)",True,Most knowledge of the Hittites comes from clay tablets with writing in this wedge-shaped system,cuneiform,1,0
6561,2013-03-11,Drew Horwood game 5.,Double Jeopardy,"(3, 4)",NEWSPAPER MOGULS,10,"(1600,)",False,This New York World publisher's 1911 will established the Columbia University School of Journalism,Pulitzer,1,0
6561,2013-03-11,Drew Horwood game 5.,Double Jeopardy,"(4, 4)",COLORFUL QUOTES,24,"(1600,)",False,"T.S. Eliot:""Shall I part my hair behind?  Do I dare to eat a peach?  I shall wear ____ flannel trousers and walk upon the beach""",white,0,3
6561,2013-03-11,Drew Horwood game 5.,Double Jeopardy,"(5, 4)",3-NAMED ACTRESSES,5,"(1600,)",False,"In 2012 she came out of the ""Weeds"" after being its star for all 8 seasons",Mary Louise Parker,1,0
6561,2013-03-11,Drew Horwood game 5.,Double Jeopardy,"(6, 4)","WHO, WHAT, WHEN, WHERE, WHY",19,"(1600,)",False,"What:Illinois' state amphibian, the eastern tiger variety of this",salamander,1,0
6561,2013-03-11,Drew Horwood game 5.,Double Jeopardy,"(1, 5)","OFF TO A ""GOOD"" START",30,"(2000,)",False,"Given by eager home buyers, it's also called an earnest money deposit",a good-faith deposit,0,3
6561,2013-03-11,Drew Horwood game 5.,Double Jeopardy,"(2, 5)",THE HITTITES,15,"(2000,)",False,"In the Old Testament, David had this Hittite killed in battle so he could marry his wife Bathsheba",Uriah the Hittite,0,3
6561,2013-03-11,Drew Horwood game 5.,Double Jeopardy,"(3, 5)",NEWSPAPER MOGULS,11,"(2000,)",False,"In 1896 he bought the New York times for 875,000 & created its slogan ""all the news that's fit to print""",Adolph Ochs,0,3
6561,2013-03-11,Drew Horwood game 5.,Double Jeopardy,"(4, 5)",COLORFUL QUOTES,25,"(2000,)",False,"E.E. Cummings:""All in ____ went my love riding on a great horse of gold into the silver dawn""",green,0,3
6561,2013-03-11,Drew Horwood game 5.,Double Jeopardy,"(5, 5)",3-NAMED ACTRESSES,6,"(2000,)",False,"She's played roles from Ridgemont high innocent Stacy to ""Revenge"" mom Kara",Jennifer Jason Leigh,0,3
6561,2013-03-11,Drew Horwood game 5.,Double Jeopardy,"(6, 5)","WHO, WHAT, WHEN, WHERE, WHY",20,"(2000,)",False,"Why:Because it was filled with flammable gas that was ignited by electricity, said the report of August 1937",the Hindenburg,1,0
6561,2013-03-11,Drew Horwood game 5.,Final Jeopardy,"(1, 1)",BRITISH NOVELS,0,"(5600, 6600, 3401)",False,"Fittingly, this Thomas Hardy character is introduced near the Pure Drop Inn",Tess of the d\'Urbervilles,0,3
