epNum,airDate,extra_info,round_name,coord,category,order,value,daily_double,question,answer,correctAttempts,wrongAttempts
6587,2013-04-16,,Jeopardy,"(1, 1)",AMERICAN HISTORY,7,"(200,)",False,"In 1620 pilgrims established this colony, the first permanent English settlement in New England",Plymouth,1,0
6587,2013-04-16,,Jeopardy,"(2, 1)",INSTRUMENT-ATION,26,"(200,)",False,"Proverbially, if you're in perfect health, you're ""fit as"" one of these",a fiddle,1,0
6587,2013-04-16,,Jeopardy,"(3, 1)",19th CENTURY SPORTS,15,"(200,)",False,"In 1896, for the longest Olympic event in this sport the athletes were taken 1,200 meters out to sea by boat & left there",swimming,1,0
6587,2013-04-16,,Jeopardy,"(4, 1)","""D"" LICIOUS",1,"(200,)",False,A cruller or old-fashioned,a donut,1,1
6587,2013-04-16,,Jeopardy,"(5, 1)",HAWAIIAN CROSSWORD CLUES,6,"(200,)",False,Lei day dance (4),a hula,1,0
6587,2013-04-16,,Jeopardy,"(6, 1)",WE'VE GOT YOU SURROUNDED!,20,"(200,)",False,"Italy, France, Germany, Austria, Liechtenstein",Switzerland,1,0
6587,2013-04-16,,Jeopardy,"(1, 2)",AMERICAN HISTORY,8,"(400,)",False,"At least 50 of the 85 letters making up the ""Federalist Papers"" were written by this future treasury secretary",Hamilton,1,0
6587,2013-04-16,,Jeopardy,"(2, 2)",INSTRUMENT-ATION,27,"(400,)",False,It's the instrumental name of the wine glasses seen here,a flute,1,0
6587,2013-04-16,,Jeopardy,"(3, 2)",19th CENTURY SPORTS,16,"(400,)",False,"On May 27, 1873 Survivor won the first running of this Triple Crown race in Baltimore by 10 lengths",the Preakness,1,0
6587,2013-04-16,,Jeopardy,"(4, 2)","""D"" LICIOUS",2,"(400,)",False,"2-word Chinese term for small, often steamed dishes served as light meals or appetizers",a dim sum,1,0
6587,2013-04-16,,Jeopardy,"(5, 2)",HAWAIIAN CROSSWORD CLUES,10,"(400,)",False,Outdoor bash (4),a luau,1,0
6587,2013-04-16,,Jeopardy,"(6, 2)",WE'VE GOT YOU SURROUNDED!,21,"(400,)",False,"India, China",Nepal,1,0
6587,2013-04-16,,Jeopardy,"(1, 3)",AMERICAN HISTORY,9,"(600,)",False,"For fiscal 2000, the U.S. had a $236 billion one of these, our largest ever",a surplus,0,3
6587,2013-04-16,,Jeopardy,"(2, 3)",INSTRUMENT-ATION,28,"(600,)",False,"Sawyer Sawyer, Thumb Thumb or Brokaw Brokaw",a Tom Tom,1,0
6587,2013-04-16,,Jeopardy,"(3, 3)",19th CENTURY SPORTS,17,"(600,)",False,"In the 1890s strategy in this sport included kicking opponents, & the flying wedge was a popular offensive play",football,1,0
6587,2013-04-16,,Jeopardy,"(4, 3)","""D"" LICIOUS",3,"(600,)",False,"Demonic term for a dark, dense baked chocolate item",a devil\'s food cake,1,0
6587,2013-04-16,,Jeopardy,"(5, 3)",HAWAIIAN CROSSWORD CLUES,11,"(600,)",False,Necklace shell (4),a puka,1,1
6587,2013-04-16,,Jeopardy,"(6, 3)",WE'VE GOT YOU SURROUNDED!,22,"(600,)",False,"Brazil, Argentina, Bolivia",Paraguay,1,0
6587,2013-04-16,,Jeopardy,"(1, 4)",AMERICAN HISTORY,14,"(1200,)",True,"Selling out early, this prospector who gave his name to a mother lode of silver ended up broke & took his own life",(Henry) Comstock,1,0
6587,2013-04-16,,Jeopardy,"(2, 4)",INSTRUMENT-ATION,29,"(800,)",False,"Don't be obtuse! okay, be obtuse if you're one of these figures, or even isosceles if you'd like",a triangle,1,0
6587,2013-04-16,,Jeopardy,"(3, 4)",19th CENTURY SPORTS,18,"(800,)",False,"What's now this tennis tournament began as an event hosted by a Newport, Rhode Island casino in 1881",the U.S. Open,1,0
6587,2013-04-16,,Jeopardy,"(4, 4)","""D"" LICIOUS",4,"(800,)",False,These British biscuits got their name because the baking soda in them was thought to help the body process food,a digestive,1,0
6587,2013-04-16,,Jeopardy,"(5, 4)",HAWAIIAN CROSSWORD CLUES,12,"(800,)",False,"Honolulu's gem of a landmark (7, 4)",Diamond Head,1,0
6587,2013-04-16,,Jeopardy,"(6, 4)",WE'VE GOT YOU SURROUNDED!,23,"(800,)",False,"Congo, Uganda, Tanzania, Burundi",Rwanda,1,0
6587,2013-04-16,,Jeopardy,"(1, 5)",AMERICAN HISTORY,25,"(1000,)",False,"""His name is"" this & in 1869 this Doctor who had set John Wilkes Booth's leg was pardoned & freed from prison",(Samuel) Mudd,1,0
6587,2013-04-16,,Jeopardy,"(2, 5)",INSTRUMENT-ATION,30,"(1000,)",False,"In ""Twelfth Night"", she's Sebastian's twin",Viola,0,3
6587,2013-04-16,,Jeopardy,"(3, 5)",19th CENTURY SPORTS,19,"(1000,)",False,Candy Cummings is credited with introducing this pitch in the 1860s; some thought it was an optical illusion,a curve ball,1,0
6587,2013-04-16,,Jeopardy,"(4, 5)","""D"" LICIOUS",5,"(1000,)",False,2-word term for any cow's milk cheese enriched to contain at least 60% butterfat,double cream,0,3
6587,2013-04-16,,Jeopardy,"(5, 5)",HAWAIIAN CROSSWORD CLUES,13,"(1000,)",False,A young woman (6),a wahine,1,0
6587,2013-04-16,,Jeopardy,"(6, 5)",WE'VE GOT YOU SURROUNDED!,24,"(1000,)",False,"France, Germany, Belgium",Luxembourg,1,0
6587,2013-04-16,,Double Jeopardy,"(1, 1)",KEEPING UP WITH THE JOANS,16,"(400,)",False,"John's big sister, she recently played William H. Macy's love interest on ""Shameless""",(Joan) Cusack,1,0
6587,2013-04-16,,Double Jeopardy,"(2, 1)",NONFICTION,6,"(400,)",False,"A former Navy SEAL chronicled ""No Easy Day: The Firsthand Account of the Mission that Killed"" him",Osama bin Laden,1,0
6587,2013-04-16,,Double Jeopardy,"(3, 1)",MEDICAL PROCEDURES,2,"(400,)",False,"(Sarah of the Clue Crew presents the clue from the American Red Cross in Washington, D.C..)  The amount of blood taken from you is one unit, or about a pint, less than half the amount used in one of these medical procedures where someone else gets your blood",a transfusion,1,0
6587,2013-04-16,,Double Jeopardy,"(4, 1)","""M.C.""",4,"(400,)",False,"Usually a den with a TV & not a hollow in the earth, it's a place where a guy can get away from it all",a man cave,1,0
6587,2013-04-16,,Double Jeopardy,"(5, 1)",ANCIENT BABYLON,1,"(400,)",False,"Babylonian society had 3 classes: free citizens, partially free dependents & these people who could buy their freedom",slaves,1,0
6587,2013-04-16,,Double Jeopardy,"(6, 1)",MODERN BABBLING,5,"(400,)",False,"The book's title says it all: ""It's Not"" this science ""and Other Irritating Modern Cliches""",It\'s not Rocket Science,0,3
6587,2013-04-16,,Double Jeopardy,"(1, 2)",KEEPING UP WITH THE JOANS,21,"(800,)",False,"She was once dubbed ""Queen of the Movies""",Joan Crawford,1,0
6587,2013-04-16,,Double Jeopardy,"(2, 2)",NONFICTION,25,"(800,)",False,"In ""Dream New Dreams"", Jai Pausch carries on after the death of her husband Randy, best known for this ""Last"" book",The Last Lecture,0,3
6587,2013-04-16,,Double Jeopardy,"(3, 2)",MEDICAL PROCEDURES,3,"(800,)",False,"Reduction is the medical name for ""popping it back in"", which tough guys try to do with this displacement of a joint",a dislocation,1,1
6587,2013-04-16,,Double Jeopardy,"(4, 2)","""M.C.""",7,"(800,)",False,A mix of batters gives this dessert its characteristic look,a marble cake,1,0
6587,2013-04-16,,Double Jeopardy,"(5, 2)",ANCIENT BABYLON,13,"(800,)",False,This Macedonian wanted to combine Asia & Europe into one country & make Babylon its capital; he died in the city in 323 B.C.,Alexander the Great,1,0
6587,2013-04-16,,Double Jeopardy,"(6, 2)",MODERN BABBLING,18,"(800,)",False,"As John McCain lagged in fund-raising in 2007, an ex-supporter said in a Texas paper, ""stick"" this ""in him, he's done""",a fork,1,0
6587,2013-04-16,,Double Jeopardy,"(1, 3)",KEEPING UP WITH THE JOANS,22,"(1200,)",False,"This folk singer who once dated Steve Jobs sang ""Swing Low, Sweet Chariot"" at his memorial",(Joan) Baez,1,0
6587,2013-04-16,,Double Jeopardy,"(2, 3)",NONFICTION,26,"(1200,)",False,"This author who died in 2012 sold over 20 million copies of his ""7 Habits"" books, not to mention ""The 8th Habit""",(Stephen) Covey,1,0
6587,2013-04-16,,Double Jeopardy,"(3, 3)",MEDICAL PROCEDURES,8,"(1200,)",False,"Carrie on ""Homeland"" had ECT, electroconvulsive therapy, on this organ",your brain,1,0
6587,2013-04-16,,Double Jeopardy,"(4, 3)","""M.C.""",10,"(2600,)",True,"It's ""my bad""--in Latin",mea culpa,1,0
6587,2013-04-16,,Double Jeopardy,"(5, 3)",ANCIENT BABYLON,14,"(1200,)",False,26 of his laws concerned regulations for professional men such as physicians & boatbuilders,Hammurabi,1,0
6587,2013-04-16,,Double Jeopardy,"(6, 3)",MODERN BABBLING,19,"(1200,)",False,"Seems impossible, but Victoria Beckham says, ""I give"" this percent & ""I expect that from the people that work with me""",110%,1,0
6587,2013-04-16,,Double Jeopardy,"(1, 4)",KEEPING UP WITH THE JOANS,23,"(1600,)",False,"Her films include ""Bonneville"", ""Pleasantville"", and ""The Upside of Anger""",Joan Allen,0,3
6587,2013-04-16,,Double Jeopardy,"(2, 4)",NONFICTION,27,"(1600,)",False,"""American Prometheus"" was subtitled ""The Triumph and Tragedy of"" this father of the atomic bomb",Oppenheimer,1,0
6587,2013-04-16,,Double Jeopardy,"(3, 4)",MEDICAL PROCEDURES,9,"(1600,)",False,"You can plump up those wrinkles by injecting zyderm, a cow type of this protein",collagen,1,0
6587,2013-04-16,,Double Jeopardy,"(4, 4)","""M.C.""",11,"(1600,)",False,It's the feature of the garment seen here that fits the category,a Mandarin collar,1,0
6587,2013-04-16,,Double Jeopardy,"(5, 4)",ANCIENT BABYLON,15,"(1200,)",True,This longest river in southwest Asia flowed through the center of ancient Babylon,the Euphrates,1,0
6587,2013-04-16,,Double Jeopardy,"(6, 4)",MODERN BABBLING,20,"(1600,)",False,"Resigning in 2001, Canadian senator Therese Lavoie-Roux, like many politicians, said she wanted to do this ""time""ly thing",spend time with her grandchildren/family,2,0
6587,2013-04-16,,Double Jeopardy,"(1, 5)",KEEPING UP WITH THE JOANS,24,"(2000,)",False,"""A Prima Donna's Progress"" is the autobiography of this Aussie dame",Joan Sutherland,1,0
6587,2013-04-16,,Double Jeopardy,"(2, 5)",NONFICTION,28,"(2000,)",False,"Cheryl Strayed's ""Wild"" takes her ""From Lost to Found"" on this West Coast pathway, the PCT",the Pacific Crest Trail,0,3
6587,2013-04-16,,Double Jeopardy,"(3, 5)",MEDICAL PROCEDURES,30,"(2000,)",False,"""Daddy, you're so handsome"", said the 3-year-old daughter of the man who got the USA's 1st full one of these surgeries",face transplant,1,0
6587,2013-04-16,,Double Jeopardy,"(4, 5)","""M.C.""",12,"(2000,)",False,"A diamond shaped in this style is an oval, usually with 58 facets",a marquise cut,1,0
6587,2013-04-16,,Double Jeopardy,"(5, 5)",ANCIENT BABYLON,17,"(2000,)",False,"Processional Way, Babylon's main street, ran through this gate on the north known for its blue glazed brick",the Ishtar Gate,0,3
6587,2013-04-16,,Double Jeopardy,"(6, 5)",MODERN BABBLING,29,"(2000,)",False,"One of Forbes' ""89 business cliches that will get any MBA promoted"" is ""low-hanging"" this",fruit,1,0
6587,2013-04-16,,Final Jeopardy,"(1, 1)",NOBEL PEACE PRIZE WINNERS,0,"(8799, 7401, 5401)",False,"The winner in 1984, he likes to be called ""Arch"", a reference to his job",Desmond Tutu,2,1
