epNum,airDate,extra_info,round_name,coord,category,order,value,daily_double,question,answer,correctAttempts,wrongAttempts
6827,2014-04-29,Julia Collins game 7.,Jeopardy,"(1, 1)",THE NEW YORK TIMES YOU NEVER FORGET YOUR FIRST,1,"(200,)",False,(I'm Ben Brantley.)  The first show I reviewed for The New York Times was an ill-fated 1993 sequel to this beloved musical; there wasn't much to like--even the dog who played Sandy was rather wooden,Annie,1,0
6827,2014-04-29,Julia Collins game 7.,Jeopardy,"(2, 1)",ARMY BRATS,12,"(200,)",False,"The father of this ""Stormin'"" commander in the first Gulf War served in the military during WWI & WWII",Norman Schwarzkopf,1,0
6827,2014-04-29,Julia Collins game 7.,Jeopardy,"(3, 1)","IT'S THE END ""FER"" YOU!",19,"(200,)",False,"A pine, fir or spruce",a conifer,1,0
6827,2014-04-29,Julia Collins game 7.,Jeopardy,"(4, 1)",THE TV CHESSBOARD,9,"(200,)",False,"Desperate sellers come to the Vegas shop run by the Harrisons & ask, ""What's it worth?"" on this History Channel show",Pawn Stars,1,0
6827,2014-04-29,Julia Collins game 7.,Jeopardy,"(5, 1)",DAM LIES,4,"(200,)",False,Russia's Bratsk Dam lies in this region where there's frost most days of the year,Siberia,1,0
6827,2014-04-29,Julia Collins game 7.,Jeopardy,"(6, 1)",STATISTICS,18,"(200,)",False,"Positive news: in 2013 NYC had fewer than 350 of these, compared to more than 2,100 in 1991",murders,1,0
6827,2014-04-29,Julia Collins game 7.,Jeopardy,"(1, 2)",THE NEW YORK TIMES YOU NEVER FORGET YOUR FIRST,2,"(400,)",False,"(I'm Mark Bittman.)  Today locally grown food is the rage, but in 1991 my first Times  article was about how overnight mail brings fresh food from far off, like these crustaceans sent from Maine",lobsters,1,0
6827,2014-04-29,Julia Collins game 7.,Jeopardy,"(2, 2)",ARMY BRATS,13,"(400,)",False,RG2 was stationed on Okinawa when this son & future football star was born,R(obert) Griffin III,1,0
6827,2014-04-29,Julia Collins game 7.,Jeopardy,"(3, 2)","IT'S THE END ""FER"" YOU!",20,"(400,)",False,Troy Aikman did this from Oklahoma to UCLA--good move,transfer,1,0
6827,2014-04-29,Julia Collins game 7.,Jeopardy,"(4, 2)",THE TV CHESSBOARD,10,"(400,)",False,In 2010 this suspenders-wearing host signed off from his CNN talk show after 25 years,Larry King,1,0
6827,2014-04-29,Julia Collins game 7.,Jeopardy,"(5, 2)",DAM LIES,5,"(1000,)",True,The Euphrates Dam in this country created Lake Assad,Syria,0,1
6827,2014-04-29,Julia Collins game 7.,Jeopardy,"(1, 3)",THE NEW YORK TIMES YOU NEVER FORGET YOUR FIRST,3,"(600,)",False,"(I'm Andrew R. Sorkin.)  I wrote my first article for the Times in 1995 when I was still in high school about ""Why You Still Can't Buy a Flaming Pink Computer""; this Apple model came along 3 years later",the iMac,1,0
6827,2014-04-29,Julia Collins game 7.,Jeopardy,"(2, 3)",ARMY BRATS,14,"(600,)",False,"He grew up on bases before he was a Georgia congressman, House speaker & candidate for president",Newt Gingrich,1,0
6827,2014-04-29,Julia Collins game 7.,Jeopardy,"(3, 3)","IT'S THE END ""FER"" YOU!",21,"(600,)",False,A box or chest for valuables; fill it now!,coffer,1,0
6827,2014-04-29,Julia Collins game 7.,Jeopardy,"(4, 3)",THE TV CHESSBOARD,11,"(600,)",False,KITT was the talking car on this '80s adventure show,Knight Rider,1,0
6827,2014-04-29,Julia Collins game 7.,Jeopardy,"(5, 3)",DAM LIES,6,"(600,)",False,"BC Hydro operates the Mica Dam, which lies on this U.S.-Canadian river",the Columbia,1,1
6827,2014-04-29,Julia Collins game 7.,Jeopardy,"(6, 3)",STATISTICS,28,"(600,)",False,"A Logitech survey found that about half the time, that TV remote you can't locate is actually here",in the couch cushions,1,0
6827,2014-04-29,Julia Collins game 7.,Jeopardy,"(1, 4)",THE NEW YORK TIMES YOU NEVER FORGET YOUR FIRST,7,"(800,)",False,"(I'm Amy Harmon.)  My first Times byline was in 1997, about the 50th anniversary of a mysterious event in this New Mexico city; ""The X-Files"" & Art Bell's radio show were other signs of the '90s interest in UFOs",Roswell,1,0
6827,2014-04-29,Julia Collins game 7.,Jeopardy,"(2, 4)",ARMY BRATS,15,"(800,)",False,"This redheaded daughter of a U.S. Army judge scored same-year Oscar nominations for ""The Hours"" & ""Far from Heaven""",Julianne Moore,1,0
6827,2014-04-29,Julia Collins game 7.,Jeopardy,"(3, 4)","IT'S THE END ""FER"" YOU!",22,"(800,)",False,"To steal, purloin or filch",pilfer,1,0
6827,2014-04-29,Julia Collins game 7.,Jeopardy,"(4, 4)",THE TV CHESSBOARD,16,"(800,)",False,Kelly Bishop played Lauren Graham's often critical mother on this early 2000s show,Gilmore Girls,1,0
6827,2014-04-29,Julia Collins game 7.,Jeopardy,"(5, 4)",DAM LIES,25,"(800,)",False,The Aswan High Dam created this reservoir named for an Egyptian president,Lake Nasser,0,3
6827,2014-04-29,Julia Collins game 7.,Jeopardy,"(6, 4)",STATISTICS,27,"(800,)",False,"According to a Pew report, today 20% of Americans 18-29 have this status; in 1960 it was 59%",married,1,0
6827,2014-04-29,Julia Collins game 7.,Jeopardy,"(1, 5)",THE NEW YORK TIMES YOU NEVER FORGET YOUR FIRST,8,"(1000,)",False,"(I'm Frank Bruni.)  In June 2004 I started a pretty good gig as the Times restaurant critic with a review of the squab liver & buttered breadcrumb pasta topping at Babbo, run by this exuberant master of Italian food",Mario Batali,1,0
6827,2014-04-29,Julia Collins game 7.,Jeopardy,"(2, 5)",ARMY BRATS,24,"(1000,)",False,"Robert E. Lee was the son of this soldier, seen here  with one of the beasts that gave him his nickname","""Lighthorse"" Harry Lee",1,0
6827,2014-04-29,Julia Collins game 7.,Jeopardy,"(3, 5)","IT'S THE END ""FER"" YOU!",23,"(1000,)",False,A geological formation conducting ground water,aquifer,1,0
6827,2014-04-29,Julia Collins game 7.,Jeopardy,"(4, 5)",THE TV CHESSBOARD,17,"(1000,)",False,"In 1993 Halle Berry played this title Alex Haley heroine, daughter of a plantation owner & a slave",Queen,0,3
6827,2014-04-29,Julia Collins game 7.,Jeopardy,"(6, 5)",STATISTICS,26,"(1000,)",False,"2000-2010 figures show the fatality rate in this job is 31 times that for all workers, 1/3 of deaths from falling overboard",fishermen,1,1
6827,2014-04-29,Julia Collins game 7.,Double Jeopardy,"(1, 1)",RECENT HISTORICAL FICTION,5,"(400,)",False,"Melanie Benjamin's ""The Aviator's Wife"" fictionalized the life & marriage of Anne Morrow & this man",Charles Lindbergh,1,0
6827,2014-04-29,Julia Collins game 7.,Double Jeopardy,"(2, 1)",AMERICANA,7,"(400,)",False,"These kitschy front yard birds have their own ""scientific"" name, Phoenicopteris ruber plasticus",pink flamingos,1,0
6827,2014-04-29,Julia Collins game 7.,Double Jeopardy,"(3, 1)",ABBREVIATED ABC,25,"(400,)",False,ABC is not only the American Broadcasting Company but also this Commonwealth one,the Australian Broadcasting Company,1,0
6827,2014-04-29,Julia Collins game 7.,Double Jeopardy,"(4, 1)",I DIRECTED MY WIFE IN THAT FILM,13,"(400,)",False,"Joanne Woodwardin ""The Glass Menagerie""",Paul Newman,1,0
6827,2014-04-29,Julia Collins game 7.,Double Jeopardy,"(5, 1)",GEOGRAPHIC ANAGRAMS,30,"(400,)",False,From Kyoto we flew to this city,Tokyo (from Kyoto),1,0
6827,2014-04-29,Julia Collins game 7.,Double Jeopardy,"(6, 1)",SCIENCE & SCIENTISTS,15,"(400,)",False,"This German-born engineer oversaw the production of Saturn rockets in Huntsville, Alabama",Wernher von Braun,0,3
6827,2014-04-29,Julia Collins game 7.,Double Jeopardy,"(1, 2)",RECENT HISTORICAL FICTION,6,"(800,)",False,"""The Painted Girls"" is a novel of 2 sisters in Paris, one of whom models for a dancer sculpture by this artist",Degas,1,0
6827,2014-04-29,Julia Collins game 7.,Double Jeopardy,"(2, 2)",AMERICANA,1,"(2000,)",True,"After Noah Webster's death, the company named for these brothers bought the rights to his dictionary",the Merriam Brothers,1,0
6827,2014-04-29,Julia Collins game 7.,Double Jeopardy,"(3, 2)",ABBREVIATED ABC,29,"(800,)",False,"Used as shorthand when administering CPR, ABC is ""airway"", this function & ""circulation""",breathing,1,0
6827,2014-04-29,Julia Collins game 7.,Double Jeopardy,"(4, 2)",I DIRECTED MY WIFE IN THAT FILM,17,"(800,)",False,"Paulette Goddardin ""The Great Dictator""",Charlie Chaplin,1,0
6827,2014-04-29,Julia Collins game 7.,Double Jeopardy,"(5, 2)",GEOGRAPHIC ANAGRAMS,11,"(800,)",False,As soon as I got to this country it started to rain,Iran (from rain),1,0
6827,2014-04-29,Julia Collins game 7.,Double Jeopardy,"(6, 2)",SCIENCE & SCIENTISTS,16,"(800,)",False,This zoological class includes spiders & scorpions,arachnids,1,0
6827,2014-04-29,Julia Collins game 7.,Double Jeopardy,"(1, 3)",RECENT HISTORICAL FICTION,8,"(1200,)",False,"""The Dovekeepers"" blends together stories centered on the siege at this Judean desert stronghold 2,000 years ago",Masada,1,0
6827,2014-04-29,Julia Collins game 7.,Double Jeopardy,"(2, 3)",AMERICANA,2,"(1200,)",False,"Florida's Lake Worth was named for William Worth, a U.S. military leader during these nearby native wars",the Seminole Wars,1,0
6827,2014-04-29,Julia Collins game 7.,Double Jeopardy,"(3, 3)",ABBREVIATED ABC,28,"(1200,)",False,"To standardize the rules, the ABC or American Congress of this popular participation sport was founded in 1895",bowling,0,3
6827,2014-04-29,Julia Collins game 7.,Double Jeopardy,"(4, 3)",I DIRECTED MY WIFE IN THAT FILM,18,"(1200,)",False,"Leslie Mann in""The 40-Year-Old Virgin""",Judd Apatow,1,0
6827,2014-04-29,Julia Collins game 7.,Double Jeopardy,"(5, 3)",GEOGRAPHIC ANAGRAMS,12,"(1200,)",False,Today I received mail from this African country,Mali (from mail),1,0
6827,2014-04-29,Julia Collins game 7.,Double Jeopardy,"(6, 3)",SCIENCE & SCIENTISTS,22,"(3500,)",True,He was in charge of Italy's radio service during World War I,Marconi,1,0
6827,2014-04-29,Julia Collins game 7.,Double Jeopardy,"(1, 4)",RECENT HISTORICAL FICTION,9,"(1600,)",False,"In 2011's ""Caleb's Crossing"", a man strives to become the first Native American to graduate from this college",Harvard,0,3
6827,2014-04-29,Julia Collins game 7.,Double Jeopardy,"(2, 4)",AMERICANA,3,"(1600,)",False,"This cowboy of folklore met his first wife, Slue-Foot Sue, while she was riding a catfish on the Rio Grande",Pecos Bill,1,0
6827,2014-04-29,Julia Collins game 7.,Double Jeopardy,"(3, 4)",ABBREVIATED ABC,27,"(1600,)",False,"The 1980s introduction of ABC, or activity-based costing, revolutionized this ""A"" field",accounting,1,0
6827,2014-04-29,Julia Collins game 7.,Double Jeopardy,"(4, 4)",I DIRECTED MY WIFE IN THAT FILM,19,"(1600,)",False,"Kate Winslet in""Revolutionary Road""",Sam Mendes,1,0
6827,2014-04-29,Julia Collins game 7.,Double Jeopardy,"(5, 4)",GEOGRAPHIC ANAGRAMS,14,"(1600,)",False,"After my trip to Tobago, I'll visit this world capital",Bogotá (from Tobago),1,0
6827,2014-04-29,Julia Collins game 7.,Double Jeopardy,"(6, 4)",SCIENCE & SCIENTISTS,23,"(1600,)",False,Fritz Haber won a Nobel Prize for producing this gas from hydrogen & nitrogen,ammonia,0,3
6827,2014-04-29,Julia Collins game 7.,Double Jeopardy,"(1, 5)",RECENT HISTORICAL FICTION,10,"(2000,)",False,"Made into a successful TV miniseries, this Philippa Gregory novel dramatized the life of the wife of Edward IV",The White Queen,0,3
6827,2014-04-29,Julia Collins game 7.,Double Jeopardy,"(2, 5)",AMERICANA,4,"(2000,)",False,This minister wrote anecdotal bios of Ben Franklin & William Penn as well as the one about George Washington,Parson Weems,1,0
6827,2014-04-29,Julia Collins game 7.,Double Jeopardy,"(3, 5)",ABBREVIATED ABC,26,"(2000,)",False,"The Caribbean ABC islands are Aruba, Bonaire & this one",Curaçao,1,0
6827,2014-04-29,Julia Collins game 7.,Double Jeopardy,"(4, 5)",I DIRECTED MY WIFE IN THAT FILM,20,"(2000,)",False,"Gena Rowlands in""A Woman Under the Influence""",John Cassavetes,1,0
6827,2014-04-29,Julia Collins game 7.,Double Jeopardy,"(5, 5)",GEOGRAPHIC ANAGRAMS,21,"(2000,)",False,I cannot believe this Chinese city is properly called Guangzhou,Canton (from cannot),1,0
6827,2014-04-29,Julia Collins game 7.,Double Jeopardy,"(6, 5)",SCIENCE & SCIENTISTS,24,"(2000,)",False,In 1867 he came up with the idea of using carbolic acid to kill germs in surgical wounds,(Joseph) Lister,1,0
6827,2014-04-29,Julia Collins game 7.,Final Jeopardy,"(1, 1)",U.S. HISTORY,0,"(6199, 9999, 5000)",False,"Messrs. Gusenberg, Gusenberg, May, Weinshank, Clark, Heyer & Schwimmer famously died on this day in 1929",February 14 (or Valentine\'s Day),0,3
