epNum,airDate,extra_info,round_name,coord,category,order,value,daily_double,question,answer,correctAttempts,wrongAttempts
6851,2014-06-02,Julia Collins game 21.,Jeopardy,"(1, 1)",EASY BEING GREEN,8,"(200,)",False,"The green of this rich gemstone, harder than quartz, comes from small amounts of chromium in the crystals",emerald,1,1
6851,2014-06-02,Julia Collins game 21.,Jeopardy,"(2, 1)",WE MAKE THAT!,7,"(200,)",False,Its Clic Stic ballpoint pen has the write stuff,Bic,1,0
6851,2014-06-02,Julia Collins game 21.,Jeopardy,"(3, 1)",HAVE A COUNTY SEAT,18,"(200,)",False,"Take a load off in White Plains, the county seat of Westchester in this state",New York,1,0
6851,2014-06-02,Julia Collins game 21.,Jeopardy,"(4, 1)",HISTORIC PEOPLE IN ART,1,"(200,)",False,"In a 16th-century work, the ruler of this empire is receiving tributes",the Aztec Empire,1,1
6851,2014-06-02,Julia Collins game 21.,Jeopardy,"(5, 1)","""BABY"" ON BOARD",3,"(200,)",False,This style of dress was introduced in the late 1950s as empire-waisted styles came back into vogue,baby-doll,1,0
6851,2014-06-02,Julia Collins game 21.,Jeopardy,"(6, 1)",LITTLE LEAGUE BASEBALL,13,"(200,)",False,"Little League is now in 80+ countries; in 2013, Perth Metro became the first team from this one to reach the World Series",Australia,1,0
6851,2014-06-02,Julia Collins game 21.,Jeopardy,"(3, 2)",HAVE A COUNTY SEAT,19,"(400,)",False,Washtenaw's county seat is Ann Arbor in this state; go Blue!,Michigan,1,0
6851,2014-06-02,Julia Collins game 21.,Jeopardy,"(4, 2)",HISTORIC PEOPLE IN ART,2,"(400,)",False,"In the 1520s, this ex-priest was painted by his close friend, Lucas Cranach the Elder",Martin Luther,0,3
6851,2014-06-02,Julia Collins game 21.,Jeopardy,"(5, 2)","""BABY"" ON BOARD",4,"(400,)",False,A small nocturnal primate of the genus Galago with dense fur & large round eyes,a bush baby,1,0
6851,2014-06-02,Julia Collins game 21.,Jeopardy,"(6, 2)",LITTLE LEAGUE BASEBALL,14,"(400,)",False,In 1953 Joey Jay became the first Little Leaguer in the majors; in 1989 Carl Yastrzemski became the first inducted here,the Hall of Fame,1,0
6851,2014-06-02,Julia Collins game 21.,Jeopardy,"(3, 3)",HAVE A COUNTY SEAT,20,"(600,)",False,Check out some bridges of Madison County near its county seat of Winterset in this state,Iowa,1,1
6851,2014-06-02,Julia Collins game 21.,Jeopardy,"(4, 3)",HISTORIC PEOPLE IN ART,9,"(600,)",False,"(Sarah of the Clue Crew shows a painting on the monitor.)  The so-called Pelican Portrait was named for the bird on the brooch, a symbol of motherhood, as it was believed it fed its young with its own blood, just as this woman sacrificed for her country",Elizabeth I,1,0
6851,2014-06-02,Julia Collins game 21.,Jeopardy,"(5, 3)","""BABY"" ON BOARD",5,"(600,)",False,Lester Gillis was the real name of this 1930s gangster,Baby Face Nelson,1,0
6851,2014-06-02,Julia Collins game 21.,Jeopardy,"(6, 3)",LITTLE LEAGUE BASEBALL,15,"(600,)",False,"In adult baseball, this is 90'; in Little League, it's 60'",the distance from home to first (the distance between bases),1,1
6851,2014-06-02,Julia Collins game 21.,Jeopardy,"(1, 4)",EASY BEING GREEN,26,"(800,)",False,"Not many folks can sucker-punch Thor, but this character does, in ""The Avengers"" movie",The Hulk,1,0
6851,2014-06-02,Julia Collins game 21.,Jeopardy,"(2, 4)",WE MAKE THAT!,25,"(800,)",False,"Happy landings in a G650 from this company, yours for $65 million--note the ""G""",Gulfstream,1,0
6851,2014-06-02,Julia Collins game 21.,Jeopardy,"(3, 4)",HAVE A COUNTY SEAT,21,"(800,)",False,Muskogee is both a county & county seat in this state,Oklahoma,1,0
6851,2014-06-02,Julia Collins game 21.,Jeopardy,"(4, 4)",HISTORIC PEOPLE IN ART,11,"(800,)",False,"As well as paintingentertainers, Andy Warhol portrayed leaders, like this man",Chairman Mao,1,0
6851,2014-06-02,Julia Collins game 21.,Jeopardy,"(5, 4)","""BABY"" ON BOARD",6,"(800,)",False,Gypsophila elegans rosea is a pink variety of this bouquet flower,baby\'s breath,1,0
6851,2014-06-02,Julia Collins game 21.,Jeopardy,"(6, 4)",LITTLE LEAGUE BASEBALL,16,"(800,)",False,"(Jimmy of the Clue Crew presents the clue on a monitor.)  Carl Stotz was inspired to found Little League in 1939 after he stumbled into a bushwhile playing backyard baseball with his nephews in this town that, despite its name, is more than 100 miles inland",Williamsport,1,0
6851,2014-06-02,Julia Collins game 21.,Jeopardy,"(1, 5)",EASY BEING GREEN,24,"(1000,)",False,"Known for its painted green bottles, this beer has been ""doing our thing since 1939""",Rolling Rock,1,1
6851,2014-06-02,Julia Collins game 21.,Jeopardy,"(2, 5)",WE MAKE THAT!,23,"(1000,)",False,"See ""the bold look"" of Numi, this brand's ""most advanced toilet""",Kohler,1,0
6851,2014-06-02,Julia Collins game 21.,Jeopardy,"(3, 5)",HAVE A COUNTY SEAT,22,"(1000,)",False,No one takes a back county seat to Jackson in this state's Teton County,Wyoming,1,0
6851,2014-06-02,Julia Collins game 21.,Jeopardy,"(4, 5)",HISTORIC PEOPLE IN ART,12,"(1800,)",True,A book of psalmsfrom the 13th centuryshows the 12th-century murder of this man,Becket,1,0
6851,2014-06-02,Julia Collins game 21.,Jeopardy,"(5, 5)","""BABY"" ON BOARD",10,"(1000,)",False,"A fetus in position to be born butt-first, as in about 1 in 25 full-term births",a breech baby (baby breech accepted),1,1
6851,2014-06-02,Julia Collins game 21.,Jeopardy,"(6, 5)",LITTLE LEAGUE BASEBALL,17,"(1000,)",False,"""A--pint--sized--Hercules--wielding--a--mighty--club"" was perhaps heard in his broadcast debut, for a 1953 Little League game",Howard Cosell,1,0
6851,2014-06-02,Julia Collins game 21.,Double Jeopardy,"(1, 1)",EASY BEING GREEN,5,"(400,)",False,The kinetic energy of this 4-letter natual phenomenon is estimated at 11 quadrillion kilowatt-hours per year,wind,0,3
6851,2014-06-02,Julia Collins game 21.,Double Jeopardy,"(2, 1)",MEMOIRS,21,"(400,)",False,"From 1845, the ""Narrative of the Life of"" this man is a firsthand account of the life of an American slave",Frederick Douglass,1,0
6851,2014-06-02,Julia Collins game 21.,Double Jeopardy,"(3, 1)",INDIA,1,"(400,)",False,Construction on this city designed by 2 British architects began in 1912 but was delayed during World War I,New Delhi,0,3
6851,2014-06-02,Julia Collins game 21.,Double Jeopardy,"(4, 1)",WORD ORIGINS,16,"(400,)",False,"From the Latin for ""increase"", it's a public sale where the price gradually increases until an item sells",an auction,1,0
6851,2014-06-02,Julia Collins game 21.,Double Jeopardy,"(5, 1)",DIDN'T MAKE THE BILLBOARD TOP 40,8,"(400,)",False,"Relased in '67 & only reaching No. 67, his ""Foxy Lady""",Jimi Hendrix,1,0
6851,2014-06-02,Julia Collins game 21.,Double Jeopardy,"(6, 1)",YOU'RE A 3-LETTER ANIMAL,12,"(400,)",False,"Available in more than 1,100 species, it's the only mammal to have evolved true flight",a bat,1,0
6851,2014-06-02,Julia Collins game 21.,Double Jeopardy,"(1, 2)",EASY BEING GREEN,6,"(800,)",False,"""This Old House"" says your dryer is an energy-guzzler, so this low-tech idea--$69 to build, with posts--is a nice ""solar dryer""",a clothesline,1,0
6851,2014-06-02,Julia Collins game 21.,Double Jeopardy,"(2, 2)",MEMOIRS,22,"(800,)",False,"""De Profundis"" tells the story of his affair with Alfred Douglas & its aftermath",Oscar Wilde,1,0
6851,2014-06-02,Julia Collins game 21.,Double Jeopardy,"(3, 2)",INDIA,2,"(800,)",False,"Not to put down the honey buzzard & hog deer, but the big attraction at Kaziranga Natl. Park is the Indian one-horned this",rhinoceros,1,0
6851,2014-06-02,Julia Collins game 21.,Double Jeopardy,"(4, 2)",WORD ORIGINS,17,"(800,)",False,"This word once used for the effigy of a man who tried to blow up Parliament is now a man, a dude, a fellow","""guy""",1,0
6851,2014-06-02,Julia Collins game 21.,Double Jeopardy,"(5, 2)",DIDN'T MAKE THE BILLBOARD TOP 40,9,"(800,)",False,"At No. 83, his ""Tenth Avenue Freeze-Out""",Bruce Springsteen,1,0
6851,2014-06-02,Julia Collins game 21.,Double Jeopardy,"(6, 2)",YOU'RE A 3-LETTER ANIMAL,13,"(800,)",False,Want to bet this animal can provide rich milk?  You're on!,a yak,1,0
6851,2014-06-02,Julia Collins game 21.,Double Jeopardy,"(1, 3)",EASY BEING GREEN,7,"(1200,)",False,"When fully charged, the Volt from this car maker can go about 38 miles on electricity alone",Chevrolet,1,0
6851,2014-06-02,Julia Collins game 21.,Double Jeopardy,"(2, 3)",MEMOIRS,24,"(1200,)",False,"In ""Waging Heavy Peace"", this Canadian-born musician talks about writing the song ""Ohio""",Neil Young,1,0
6851,2014-06-02,Julia Collins game 21.,Double Jeopardy,"(3, 3)",INDIA,3,"(1200,)",False,In 1615 Sir Thomas Roe reached the court of Mughal Emperor Jahangir & was granted trading rights for this firm,the British East India Company,1,0
6851,2014-06-02,Julia Collins game 21.,Double Jeopardy,"(4, 3)",WORD ORIGINS,18,"(1200,)",False,"This anglicized French word once meant ""hearthside"" but now refers to a lobby or entrance hall",foyer,0,3
6851,2014-06-02,Julia Collins game 21.,Double Jeopardy,"(5, 3)",DIDN'T MAKE THE BILLBOARD TOP 40,10,"(1200,)",False,"At No. 55, their ""Let's Spend The Night Together""",The Rolling Stones,1,0
6851,2014-06-02,Julia Collins game 21.,Double Jeopardy,"(6, 3)",YOU'RE A 3-LETTER ANIMAL,14,"(1200,)",False,"What's this African antelope with curved horns, thin legs & a horselike tail?  Not much...  What's this with you?",a gnu,1,0
6851,2014-06-02,Julia Collins game 21.,Double Jeopardy,"(1, 4)",EASY BEING GREEN,27,"(1600,)",False,"You can ""donate & protect an acre"" of tropical area at thisfoundationuk.org, a group co-founded by Sting in 1989",Rainforest,0,3
6851,2014-06-02,Julia Collins game 21.,Double Jeopardy,"(2, 4)",MEMOIRS,25,"(1600,)",False,"""The Man Died"" by Wole Soyinka was inspired by his years in prison in this West African country",Nigeria,0,3
6851,2014-06-02,Julia Collins game 21.,Double Jeopardy,"(3, 4)",INDIA,4,"(1600,)",False,In 2004 economist Manmohan Singh became the first of this religion to become India's Prime Minister,Sikh,1,0
6851,2014-06-02,Julia Collins game 21.,Double Jeopardy,"(4, 4)",WORD ORIGINS,19,"(3200,)",True,"The Greek for ""sand tray"" gives us the name of this counting device",abacus,0,1
6851,2014-06-02,Julia Collins game 21.,Double Jeopardy,"(5, 4)",DIDN'T MAKE THE BILLBOARD TOP 40,11,"(1600,)",False,"At No. 84, ""Runnin' With The Devil"" by these rockers",Van Halen,0,3
6851,2014-06-02,Julia Collins game 21.,Double Jeopardy,"(6, 4)",YOU'RE A 3-LETTER ANIMAL,29,"(1600,)",False,This flightless Australian bird can be more than 5 feet tall,an emu,1,0
6851,2014-06-02,Julia Collins game 21.,Double Jeopardy,"(1, 5)",EASY BEING GREEN,28,"(2000,)",True,"This city's 1997 protocol limits emissions of carbon dioxide, methane, nitrous oxide & other greenhouse gases",Kyoto,1,0
6851,2014-06-02,Julia Collins game 21.,Double Jeopardy,"(2, 5)",MEMOIRS,26,"(2000,)",False,"This 18th century Frenchman's ""Confessions"" set the template for modern autobiographies",Rousseau,0,3
6851,2014-06-02,Julia Collins game 21.,Double Jeopardy,"(3, 5)",INDIA,23,"(2000,)",False,In 1961 Indian forces invaded the territory of Goa & took it from this European power,Portugal,1,0
6851,2014-06-02,Julia Collins game 21.,Double Jeopardy,"(4, 5)",WORD ORIGINS,20,"(2000,)",False,"It once referred to a ""crazy"" Viking who fought with the fury of a wild beast",berserk,0,3
6851,2014-06-02,Julia Collins game 21.,Double Jeopardy,"(5, 5)",DIDN'T MAKE THE BILLBOARD TOP 40,15,"(2000,)",False,"At No. 76, this New Wave band with ""I Melt With You""",Modern English,0,3
6851,2014-06-02,Julia Collins game 21.,Double Jeopardy,"(6, 5)",YOU'RE A 3-LETTER ANIMAL,30,"(2000,)",False,"Also known as an alcid, this sea bird looks & behaves like a penguin but can fly",an auk,1,0
6851,2014-06-02,Julia Collins game 21.,Final Jeopardy,"(1, 1)",OSCAR-WINNING WRITERS,0,"(0, 11000, 10000)",False,"Winning for 1999, this New England writer is the last person to win an Oscar for adapting his own novel",John Irving,1,2
