epNum,airDate,extra_info,round_name,coord,category,order,value,daily_double,question,answer,correctAttempts,wrongAttempts
6936,2014-11-10,2014 Tournament of Champions quarterfinal game 1.,Jeopardy,"(1, 1)",TWITTER FEEDS,27,"(200,)",False,"A parody feed for this London landmark reads ""Bong"" at 1 o'clock & ""Bong bong"" at 2 o'clock",Big Ben,1,0
6936,2014-11-10,2014 Tournament of Champions quarterfinal game 1.,Jeopardy,"(2, 1)",A LITTLE ALLITERATION,19,"(200,)",False,The steady-state theory lost favor to this theory on the evolution of the universe,the Big Bang,1,0
6936,2014-11-10,2014 Tournament of Champions quarterfinal game 1.,Jeopardy,"(3, 1)",FASHIONABLE COMMON BONDS,18,"(200,)",False,"Bike,balloon,Bermuda",shorts,1,0
6936,2014-11-10,2014 Tournament of Champions quarterfinal game 1.,Jeopardy,"(4, 1)",I MARRIED...,9,"(200,)",False,"Publisher George Putnam, who arranged my book ""Last Flight""",(Amelia) Earhart,1,0
6936,2014-11-10,2014 Tournament of Champions quarterfinal game 1.,Jeopardy,"(5, 1)","""A"" MONSTER",4,"(200,)",False,"In ""Tintin in Tibet"" the hero's search for his friend Chang is made harder by the presence of this beast",the abominable snowman,1,0
6936,2014-11-10,2014 Tournament of Champions quarterfinal game 1.,Jeopardy,"(6, 1)",FROM OUTER SPACE,16,"(200,)",False,A crab & a scorpion are part of this familiar circle of constellations,the zodiac,1,0
6936,2014-11-10,2014 Tournament of Champions quarterfinal game 1.,Jeopardy,"(1, 2)",TWITTER FEEDS,30,"(400,)",False,"In 2011, after a 7-year breakup, this doll couple announced on Twitter that they were back together",Ken & Barbie,1,0
6936,2014-11-10,2014 Tournament of Champions quarterfinal game 1.,Jeopardy,"(2, 2)",A LITTLE ALLITERATION,20,"(400,)",False,"The name of this baking utensil has come to mean ""lacking individuality""",cookie cutter,1,0
6936,2014-11-10,2014 Tournament of Champions quarterfinal game 1.,Jeopardy,"(3, 2)",FASHIONABLE COMMON BONDS,22,"(400,)",False,"Cowboy,combat,waders",boots,1,0
6936,2014-11-10,2014 Tournament of Champions quarterfinal game 1.,Jeopardy,"(4, 2)",I MARRIED...,24,"(400,)",False,Heloise in secret after we had a son called Astrolabe (nice name),(Peter) Abelard,1,0
6936,2014-11-10,2014 Tournament of Champions quarterfinal game 1.,Jeopardy,"(5, 2)","""A"" MONSTER",5,"(400,)",False,In Homeric poems Hermes is called the slayer of this giant with 100 eyes,Argus,1,0
6936,2014-11-10,2014 Tournament of Champions quarterfinal game 1.,Jeopardy,"(6, 2)",FROM OUTER SPACE,17,"(400,)",False,It's the smallest of the 8 planets in the solar system,Mercury,1,0
6936,2014-11-10,2014 Tournament of Champions quarterfinal game 1.,Jeopardy,"(1, 3)",TWITTER FEEDS,11,"(600,)",False,"Elaine's boyfriend won't stop posting BuzzFeed quiz results & Jerry overuses emojis on the ""Modern"" this feed",Seinfeld,1,0
6936,2014-11-10,2014 Tournament of Champions quarterfinal game 1.,Jeopardy,"(2, 3)",A LITTLE ALLITERATION,14,"(600,)",False,The cornflower also has this alliterative masculine name,bachelor\'s button,0,3
6936,2014-11-10,2014 Tournament of Champions quarterfinal game 1.,Jeopardy,"(3, 3)",FASHIONABLE COMMON BONDS,10,"(600,)",False,"Cap,Kimono,3/4",sleeves,0,3
6936,2014-11-10,2014 Tournament of Champions quarterfinal game 1.,Jeopardy,"(4, 3)",I MARRIED...,25,"(600,)",False,"Maria Sklodowska, my radiant partner in the lab, too",Pierre Curie,1,0
6936,2014-11-10,2014 Tournament of Champions quarterfinal game 1.,Jeopardy,"(5, 3)","""A"" MONSTER",6,"(600,)",False,"The '80s show ""Little Muppet Monsters"" featured this feral drummer for Dr. Teeth & the Electric Mayhem",Animal,1,0
6936,2014-11-10,2014 Tournament of Champions quarterfinal game 1.,Jeopardy,"(6, 3)",FROM OUTER SPACE,1,"(600,)",False,"Scientifically Alpha Canis Majoris, it is a mere 8.6 light years away & the brightest star in the night sky",Sirius,1,0
6936,2014-11-10,2014 Tournament of Champions quarterfinal game 1.,Jeopardy,"(1, 4)",TWITTER FEEDS,12,"(800,)",False,"""Just seen a group of elderly fish.  Old school"" is a tweet from the feed called this -damentalism",pundamentalism,0,3
6936,2014-11-10,2014 Tournament of Champions quarterfinal game 1.,Jeopardy,"(2, 4)",A LITTLE ALLITERATION,15,"(1800,)",True,"""Put the ship of state on its feet"" & ""Play your cards to the hilt"" are 2 of these expressions",mixed metaphors,0,1
6936,2014-11-10,2014 Tournament of Champions quarterfinal game 1.,Jeopardy,"(3, 4)",FASHIONABLE COMMON BONDS,23,"(800,)",False,"Knee high,crew,peds",socks,1,0
6936,2014-11-10,2014 Tournament of Champions quarterfinal game 1.,Jeopardy,"(4, 4)",I MARRIED...,26,"(800,)",False,"The future Holy Roman Emperor Francis I, a love match that produced 16 kids",Maria Theresa,0,3
6936,2014-11-10,2014 Tournament of Champions quarterfinal game 1.,Jeopardy,"(5, 4)","""A"" MONSTER",7,"(800,)",False,"The title character in Anne Rice's ""Queen of the Damned"", she's a really old vampire",Akasha,1,0
6936,2014-11-10,2014 Tournament of Champions quarterfinal game 1.,Jeopardy,"(6, 4)",FROM OUTER SPACE,2,"(800,)",False,"(Jimmy of the Clue Crew shows an animation of an expanding Sun obliterating planets on the monitor.)  Today our Sun is a main sequence yellow dwarf, but in about 5 billion years when it uses up all its core hydrogen, it will become one of these massive objects, expanding past the orbits of some of the inner planets--maybe even Earth",a red giant,1,0
6936,2014-11-10,2014 Tournament of Champions quarterfinal game 1.,Jeopardy,"(1, 5)",TWITTER FEEDS,13,"(1000,)",False,"This San Francisco weather condition has its own Twitter feed; it's named Karl, & it notes, ""Not all those in"" it ""are lost""",fog,1,0
6936,2014-11-10,2014 Tournament of Champions quarterfinal game 1.,Jeopardy,"(2, 5)",A LITTLE ALLITERATION,21,"(1000,)",False,This class of proteins in blood plasma is injected to treat measles,gamma globulins,0,3
6936,2014-11-10,2014 Tournament of Champions quarterfinal game 1.,Jeopardy,"(3, 5)",FASHIONABLE COMMON BONDS,29,"(1000,)",False,"Peg-top,pencil,flared",skirts,1,0
6936,2014-11-10,2014 Tournament of Champions quarterfinal game 1.,Jeopardy,"(4, 5)",I MARRIED...,28,"(1000,)",False,"Mumtaz Mahal, my favorite wife, & built the Taj Mahal to honor her",Shah Jahan,1,0
6936,2014-11-10,2014 Tournament of Champions quarterfinal game 1.,Jeopardy,"(5, 5)","""A"" MONSTER",8,"(1000,)",False,Pete Seeger's picture book about this giant was inspired by a South African folktale,Abiyoyo,0,3
6936,2014-11-10,2014 Tournament of Champions quarterfinal game 1.,Jeopardy,"(6, 5)",FROM OUTER SPACE,3,"(1000,)",False,Collective 2-word name for the 4 natural satellites orbiting Jupiter that were discovered in 1610,the Galilean moons,1,0
6936,2014-11-10,2014 Tournament of Champions quarterfinal game 1.,Double Jeopardy,"(1, 1)",UNDER THE SEA OR OCEAN,14,"(400,)",False,Under this sea:The Nile Fan,the Mediterranean,1,0
6936,2014-11-10,2014 Tournament of Champions quarterfinal game 1.,Double Jeopardy,"(2, 1)",THEY TURNED MY BOOK INTO A MOVIE,15,"(400,)",False,"""A Clockwork Orange""",(Anthony) Burgess,1,0
6936,2014-11-10,2014 Tournament of Champions quarterfinal game 1.,Double Jeopardy,"(3, 1)",WHAT KIND OF ANIMAL ARE YOU?,20,"(400,)",False,It's another name for the shuttlecock in badminton,a birdie,1,0
6936,2014-11-10,2014 Tournament of Champions quarterfinal game 1.,Double Jeopardy,"(4, 1)","GETTING ""ANCE""-Y",17,"(400,)",False,A horse does it by springing forward on its hind legs,prance,1,0
6936,2014-11-10,2014 Tournament of Champions quarterfinal game 1.,Double Jeopardy,"(5, 1)",TOP 40 INSTRUMENTALS,21,"(400,)",False,The opening theme to this movie about a Jew & a Christian racing at the Olympics was a No. 1 hit,Chariots of Fire,1,0
6936,2014-11-10,2014 Tournament of Champions quarterfinal game 1.,Double Jeopardy,"(6, 1)",THE NEW YORK TIMES: POLITICS,25,"(400,)",False,(I'm Ross Douthat.)  I started as a Times op-ed columnist in 2009 with a provocative argument that the 2008 race would have been a clearer choice if this man from Wyoming had been the GOP nominee for president,Dick Cheney,1,0
6936,2014-11-10,2014 Tournament of Champions quarterfinal game 1.,Double Jeopardy,"(1, 2)",UNDER THE SEA OR OCEAN,12,"(800,)",False,Ocean:Reykjanes Ridge,the Atlantic,1,0
6936,2014-11-10,2014 Tournament of Champions quarterfinal game 1.,Double Jeopardy,"(2, 2)",THEY TURNED MY BOOK INTO A MOVIE,11,"(800,)",False,"""All the President's Men""",Woodward & Bernstein,1,1
6936,2014-11-10,2014 Tournament of Champions quarterfinal game 1.,Double Jeopardy,"(3, 2)",WHAT KIND OF ANIMAL ARE YOU?,19,"(800,)",False,"Douglas Engelbart's 1970 patent for this device calls it a ""position indicator control""",a computer mouse,0,3
6936,2014-11-10,2014 Tournament of Champions quarterfinal game 1.,Double Jeopardy,"(4, 2)","GETTING ""ANCE""-Y",16,"(800,)",False,In 1969 Robert Redford founded this Utah ski resort at the base of Mount Timpanogos,Sundance,1,0
6936,2014-11-10,2014 Tournament of Champions quarterfinal game 1.,Double Jeopardy,"(5, 2)",TOP 40 INSTRUMENTALS,22,"(800,)",False,"This smooth sax man first flew into the Top 40 in 1987 with ""Songbird""",Kenny G,1,0
6936,2014-11-10,2014 Tournament of Champions quarterfinal game 1.,Double Jeopardy,"(6, 2)",THE NEW YORK TIMES: POLITICS,27,"(800,)",False,"David Brooks said a scandal like Bridgegate makes this governor ""look unpleasant, but not unelectable""",Chris Christie,1,0
6936,2014-11-10,2014 Tournament of Champions quarterfinal game 1.,Double Jeopardy,"(1, 3)",UNDER THE SEA OR OCEAN,2,"(1200,)",False,Sea:The Aleutian Basin,the Bering Sea,1,0
6936,2014-11-10,2014 Tournament of Champions quarterfinal game 1.,Double Jeopardy,"(2, 3)",THEY TURNED MY BOOK INTO A MOVIE,1,"(1200,)",False,"""The Fault in Our Stars""",(John) Green,1,0
6936,2014-11-10,2014 Tournament of Champions quarterfinal game 1.,Double Jeopardy,"(3, 3)",WHAT KIND OF ANIMAL ARE YOU?,8,"(1200,)",False,It's the type of shoe seen here,a mule,0,3
6936,2014-11-10,2014 Tournament of Champions quarterfinal game 1.,Double Jeopardy,"(4, 3)","GETTING ""ANCE""-Y",5,"(1200,)",False,"Karl Marx wrote, ""All the powers of old Europe have entered into a holy"" one of these ""to exorcise"" communism",alliance,1,0
6936,2014-11-10,2014 Tournament of Champions quarterfinal game 1.,Double Jeopardy,"(5, 3)",TOP 40 INSTRUMENTALS,23,"(1200,)",False,"""Axel F"", by one-hit wonder Harold Faltermeyer, was featured in this 1984 film",Beverly Hills Cop,1,0
6936,2014-11-10,2014 Tournament of Champions quarterfinal game 1.,Double Jeopardy,"(6, 3)",THE NEW YORK TIMES: POLITICS,28,"(1200,)",False,"(I'm Frank Bruni.)  When I was New York Times Rome Bureau Chief in 2003 this man was the definition of ""good copy""--like the week he went on trial while complaining that saving Italy was keeping him away from his house in Bermuda",Berlusconi,1,0
6936,2014-11-10,2014 Tournament of Champions quarterfinal game 1.,Double Jeopardy,"(1, 4)",UNDER THE SEA OR OCEAN,3,"(1600,)",False,Ocean:Ninety East Ridge,the Indian Ocean,1,0
6936,2014-11-10,2014 Tournament of Champions quarterfinal game 1.,Double Jeopardy,"(2, 4)",THEY TURNED MY BOOK INTO A MOVIE,9,"(2000,)",True,"""Apocalypse Now""",Joseph Conrad,0,1
6936,2014-11-10,2014 Tournament of Champions quarterfinal game 1.,Double Jeopardy,"(3, 4)",WHAT KIND OF ANIMAL ARE YOU?,13,"(100,)",True,Grete Waitz served as one of these pacesetters in her first New York City Marathon: she won the race & set a world record,a rabbit,1,0
6936,2014-11-10,2014 Tournament of Champions quarterfinal game 1.,Double Jeopardy,"(4, 4)","GETTING ""ANCE""-Y",6,"(1600,)",False,"This word that precedes ""of the evidence"" means ""superiority in weight""",preponderance,1,0
6936,2014-11-10,2014 Tournament of Champions quarterfinal game 1.,Double Jeopardy,"(5, 4)",TOP 40 INSTRUMENTALS,24,"(1600,)",False,No copping out--in 1985 Jan Hammer hammered home the No. 1 theme to this TV series,Miami Vice,1,0
6936,2014-11-10,2014 Tournament of Champions quarterfinal game 1.,Double Jeopardy,"(6, 4)",THE NEW YORK TIMES: POLITICS,29,"(1600,)",False,"The Times' tragic Nov. 23, 1963 headline: ""Kennedy Is Killed by Sniper""; a sub-headline: this gov. ""Shot, Mrs. Kennedy Safe""",Connally,1,0
6936,2014-11-10,2014 Tournament of Champions quarterfinal game 1.,Double Jeopardy,"(1, 5)",UNDER THE SEA OR OCEAN,4,"(2000,)",False,Sea:The West Mariana Basin,the Philippine Sea,1,1
6936,2014-11-10,2014 Tournament of Champions quarterfinal game 1.,Double Jeopardy,"(2, 5)",THEY TURNED MY BOOK INTO A MOVIE,10,"(2000,)",False,"""Exodus"", in 1960",Leon Uris,1,0
6936,2014-11-10,2014 Tournament of Champions quarterfinal game 1.,Double Jeopardy,"(3, 5)",WHAT KIND OF ANIMAL ARE YOU?,18,"(2000,)",False,"You get closure with this type of clasp, seen here",a lobster claw,1,0
6936,2014-11-10,2014 Tournament of Champions quarterfinal game 1.,Double Jeopardy,"(4, 5)","GETTING ""ANCE""-Y",7,"(2000,)",False,"To look at someone this way means with a sideways, distrusting glance",askance,1,0
6936,2014-11-10,2014 Tournament of Champions quarterfinal game 1.,Double Jeopardy,"(5, 5)",TOP 40 INSTRUMENTALS,26,"(2000,)",False,"He tooted his own horn, a flugelhorn, on his Top 10 hit ""Feels So Good""",(Chuck) Mangione,1,0
6936,2014-11-10,2014 Tournament of Champions quarterfinal game 1.,Double Jeopardy,"(6, 5)",THE NEW YORK TIMES: POLITICS,30,"(2000,)",False,"(I'm Linda Greenhouse.)  In 1969 my first Times article was about the municipal election that saw this Republican, soon to turn Democrat, re-elected mayor",John Lindsay,0,3
6936,2014-11-10,2014 Tournament of Champions quarterfinal game 1.,Final Jeopardy,"(1, 1)",STATE HOLIDAYS,0,"(5000, 8400, 701)",False,This is the only state that honors a former U.S. Secretary of State with his own legal holiday,Alaska,2,1
