epNum,airDate,extra_info,round_name,coord,category,order,value,daily_double,question,answer,correctAttempts,wrongAttempts
7063,2015-05-06,,Jeopardy,"(1, 1)",WORLD OF WATERCRAFT,15,"(200,)",False,"In 1932 Oskar Speck paddled from Germany to Australia in one of these whose name is Inuit for ""small boat of skins""",a kayak,1,0
7063,2015-05-06,,Jeopardy,"(2, 1)",CENTRAL AMERICA,5,"(200,)",False,"A rain forest area called the Darien Gap is an obstacle to the completion of this highway system of almost 30,000 miles",the Pan-American Highway,1,0
7063,2015-05-06,,Jeopardy,"(3, 1)",WHAT ABOUT BOB?,1,"(200,)",False,"I gotta tell ya, this comic got 5 special Academy Awards for his humanitarian services & services to the film biz",Bob Hope,1,0
7063,2015-05-06,,Jeopardy,"(4, 1)",COMPLETE THE NATIONAL BOOK AWARD TITLE,13,"(200,)",False,"William Styron, 1980:""____ Choice""",Sophie\'s,1,0
7063,2015-05-06,,Jeopardy,"(5, 1)",LIGHT THE CANDLES,19,"(200,)",False,"Idiomatically, do this to the candle & you're going too hard by both day & night",burning it at both ends,1,0
7063,2015-05-06,,Jeopardy,"(6, 1)","ADD AN ""S""",11,"(200,)",False,"An empty space fills up with an ""S"" to be a sudden, short, surprised intake of breath",gap & gasp,1,0
7063,2015-05-06,,Jeopardy,"(2, 2)",CENTRAL AMERICA,6,"(400,)",False,A 1972 earthquake destroyed just about all of this Nicaraguan capital's downtown,Managua,1,0
7063,2015-05-06,,Jeopardy,"(3, 2)",WHAT ABOUT BOB?,2,"(400,)",False,"But I would not feel so all alone, everybody must get this man who gave us ""Lay Lady Lay"" in 1969",Bob Dylan,1,0
7063,2015-05-06,,Jeopardy,"(4, 2)",COMPLETE THE NATIONAL BOOK AWARD TITLE,14,"(400,)",False,"E. Annie Proulx, 1993:""The ____ News""",Shipping,1,0
7063,2015-05-06,,Jeopardy,"(5, 2)",LIGHT THE CANDLES,23,"(400,)",False,This facility was renamed for the tech company 3Com from 1995 to 2002,Candlestick Park,1,0
7063,2015-05-06,,Jeopardy,"(6, 2)","ADD AN ""S""",12,"(400,)",False,"A pricey place for lodging travelers tones it down with an ""S"" to put up kids on a bike trip, inexpensively",hotel & hostel,1,0
7063,2015-05-06,,Jeopardy,"(2, 3)",CENTRAL AMERICA,7,"(600,)",False,"""Rich coast""?  Heck, this country has 2 of 'em--one on the Caribbean & one on the Pacific",Costa Rica,1,0
7063,2015-05-06,,Jeopardy,"(3, 3)",WHAT ABOUT BOB?,3,"(600,)",False,This Olympic & team sports broadcaster carries a 1958 Mickey Mantle baseball card everywhere,Bob Costas,1,0
7063,2015-05-06,,Jeopardy,"(4, 3)",COMPLETE THE NATIONAL BOOK AWARD TITLE,16,"(600,)",False,"1950:""The Man with the ____ Arm""",Golden,1,0
7063,2015-05-06,,Jeopardy,"(5, 3)",LIGHT THE CANDLES,24,"(600,)",False,A 1997 revised version of this song sold more than 30 million copies,"""Candle In The Wind""",1,0
7063,2015-05-06,,Jeopardy,"(6, 3)","ADD AN ""S""",20,"(600,)",False,"A term meaning to remain inactive until something expected happens adds an ""S"" to be a body part we ""watch""",wait & waist,0,3
7063,2015-05-06,,Jeopardy,"(1, 4)",WORLD OF WATERCRAFT,28,"(800,)",False,3-word name of the boating weather advisory issued when winds reach 20+ knots along with dangerous wave conditions,a small-craft advisory,0,3
7063,2015-05-06,,Jeopardy,"(2, 4)",CENTRAL AMERICA,8,"(800,)",False,Guatemala's 37 of these tempt some climbers; be careful on the one fittingly named Fuego,a volcano,1,0
7063,2015-05-06,,Jeopardy,"(3, 4)",WHAT ABOUT BOB?,4,"(1200,)",True,"He put out the live double album ""Babylon by Bus"" in 1978",Bob Marley,0,1
7063,2015-05-06,,Jeopardy,"(4, 4)",COMPLETE THE NATIONAL BOOK AWARD TITLE,17,"(800,)",False,"1982:""____ Is Rich""",Rabbit,1,0
7063,2015-05-06,,Jeopardy,"(5, 4)",LIGHT THE CANDLES,25,"(800,)",False,"As a verb, it means to get thinner at one end; as a noun, it's a tall candle",a taper,1,0
7063,2015-05-06,,Jeopardy,"(6, 4)","ADD AN ""S""",21,"(800,)",False,"A word meaning to defeat gets that ""S"" & morphs into a savage animal",beat & beast,1,0
7063,2015-05-06,,Jeopardy,"(1, 5)",WORLD OF WATERCRAFT,27,"(1000,)",False,"Depicting an event from 1816, Theodore Gericault's ""Raft of"" this vessel might make you a little seasick",the Medusa,1,0
7063,2015-05-06,,Jeopardy,"(2, 5)",CENTRAL AMERICA,9,"(1000,)",False,The southern coast on the Gulf of Fonseca is the only outlet to the Pacific for this country big in bananas,Honduras,0,3
7063,2015-05-06,,Jeopardy,"(3, 5)",WHAT ABOUT BOB?,10,"(1000,)",False,"In 1978, this choreographer's final Broadway hit was titled, appropriately, ""Dancin'""",Bob Fosse,1,0
7063,2015-05-06,,Jeopardy,"(4, 5)",COMPLETE THE NATIONAL BOOK AWARD TITLE,18,"(1000,)",False,"Jaimy Gordon, 2010:""Lord of ____""",Misrule,0,3
7063,2015-05-06,,Jeopardy,"(5, 5)",LIGHT THE CANDLES,26,"(1000,)",False,These 2 items were paired with candle in a Roman Catholic excommunication ceremony,bell & book,0,3
7063,2015-05-06,,Jeopardy,"(6, 5)","ADD AN ""S""",22,"(1000,)",False,"An amount of money set by a court picks up an ""S"" & becomes an aromatic herb of the mint family",bail & basil,1,0
7063,2015-05-06,,Double Jeopardy,"(1, 1)",AGRICULTURE,9,"(400,)",False,About 400 of these beans are required to make a pound of chocolate,cocoa beans,1,0
7063,2015-05-06,,Double Jeopardy,"(3, 1)",TV ODDS & ENDS,29,"(400,)",False,"Robin Leach promised ""champagne wishes & caviar dreams"" on the TV show ""Lifestyles of"" these people",the Rich and Famous,1,0
7063,2015-05-06,,Double Jeopardy,"(4, 1)",UNNAMED BIBLE PEOPLE NAMED,16,"(400,)",False,The 1st century Book of Jubilees lists this man's wife as Emzara; hope she could swim!,Noah,1,1
7063,2015-05-06,,Double Jeopardy,"(5, 1)",YOU,28,"(400,)",False,"...are made up of more than 35 trillion of these, the basic units of the human body",cells,1,0
7063,2015-05-06,,Double Jeopardy,"(6, 1)",...& WHAT ARMY?,1,"(400,)",False,"In 1862 Robert E, Lee's Confederate Army of the Potomac was renamed the Army of Northern this",Virginia,1,0
7063,2015-05-06,,Double Jeopardy,"(1, 2)",AGRICULTURE,10,"(800,)",False,California's top cash crop is grapes; a close 2nd is this nut for which the state supplies 80% of world production,almonds,1,0
7063,2015-05-06,,Double Jeopardy,"(2, 2)",9-LETTER WORDS,6,"(800,)",False,A practice session between 2 units of the same sports team,scrimmage,1,0
7063,2015-05-06,,Double Jeopardy,"(3, 2)",TV ODDS & ENDS,3,"(800,)",False,The Facebook page for the Indiana Office of Tourism said they'd miss this retiring sitcom almost as much as Li'l Sebastian,Parks and Recreation,1,0
7063,2015-05-06,,Double Jeopardy,"(4, 2)",UNNAMED BIBLE PEOPLE NAMED,17,"(800,)",False,"The Bible doesn't name her, but Josephus gives us this name for Herod's dancing stepdaughter",Salome,1,0
7063,2015-05-06,,Double Jeopardy,"(5, 2)",YOU,27,"(800,)",False,"...have 23 intervertebral these, each composed of a soft center surrounded by a tough, flexible ring",a disc,1,0
7063,2015-05-06,,Double Jeopardy,"(6, 2)",...& WHAT ARMY?,21,"(4500,)",True,"In 1974, farmers in China discovered the army seen here, made of this earthy material",terra-cotta,1,0
7063,2015-05-06,,Double Jeopardy,"(1, 3)",AGRICULTURE,11,"(1200,)",False,"The emblem of this ""forward-looking"" youth organization features an ear of corn & an owl sitting on a plow",the Future Farmers of America,1,0
7063,2015-05-06,,Double Jeopardy,"(2, 3)",9-LETTER WORDS,5,"(1200,)",False,This peace officer has less authority than a sheriff & is empowered to serve warrants & make arrests,constable,0,3
7063,2015-05-06,,Double Jeopardy,"(3, 3)",TV ODDS & ENDS,2,"(1200,)",False,"After ""Cheers"", she went on to star in ""Veronica's Closet""",Kirstie Alley,1,0
7063,2015-05-06,,Double Jeopardy,"(4, 3)",UNNAMED BIBLE PEOPLE NAMED,18,"(1200,)",False,Traditional Ethiopian lore names this royal female friend of Solomon as Makeda,the Queen of Sheba,1,0
7063,2015-05-06,,Double Jeopardy,"(5, 3)",YOU,12,"(2000,)",True,"...were one of these, from Greek for ""newborn animal"", for the first 7 weeks after you were conceived",an embryo,1,0
7063,2015-05-06,,Double Jeopardy,"(6, 3)",...& WHAT ARMY?,22,"(1200,)",False,"A 2014 documentary titled this ""Army"" isn't about war but a great hockey team led by Vyacheslav Fetisov",the Red Army,1,0
7063,2015-05-06,,Double Jeopardy,"(1, 4)",AGRICULTURE,14,"(1600,)",False,"The Bible commands that every 7 years, land should be left unused, lying this 6-letter word",fallow,1,0
7063,2015-05-06,,Double Jeopardy,"(2, 4)",9-LETTER WORDS,7,"(1600,)",False,It's a young bird that has recently acquired its flight feathers,fledgling,1,0
7063,2015-05-06,,Double Jeopardy,"(3, 4)",TV ODDS & ENDS,4,"(1600,)",False,McArdle & Lowell were the last names of this sitcom-title pair played by Susan Saint James & Jane Curtin,Kate & Allie,1,0
7063,2015-05-06,,Double Jeopardy,"(4, 4)",UNNAMED BIBLE PEOPLE NAMED,19,"(1600,)",False,The Babylonian Talmud identifies this patriarch's mother as Amthlai Bath Khrubu,Abraham,0,3
7063,2015-05-06,,Double Jeopardy,"(5, 4)",YOU,25,"(1600,)",False,"...have a fissure of Rolando in this organ, even if you're not named Rolando",the brain,0,3
7063,2015-05-06,,Double Jeopardy,"(6, 4)",...& WHAT ARMY?,23,"(1600,)",False,"This name for an army that went kaput at the end of World War II is German for ""defense force""",the Wehrmacht,1,0
7063,2015-05-06,,Double Jeopardy,"(1, 5)",AGRICULTURE,15,"(2000,)",False,"Last name of father & son John & Don, who made Arkansas a national leader in poultry",Tyson,1,1
7063,2015-05-06,,Double Jeopardy,"(2, 5)",9-LETTER WORDS,8,"(2000,)",False,It's a colonnade surrounding an open area,peristyle,0,3
7063,2015-05-06,,Double Jeopardy,"(3, 5)",TV ODDS & ENDS,13,"(2000,)",False,Adrian Paul starred as Duncan MacLeod in this TV series that was based on a Christopher Lambert film,Highlander,1,0
7063,2015-05-06,,Double Jeopardy,"(4, 5)",UNNAMED BIBLE PEOPLE NAMED,20,"(2000,)",False,The Gospel of Nicodemus names the thieves crucified with Jesus: him & Gestas,Dismas,0,3
7063,2015-05-06,,Double Jeopardy,"(5, 5)",YOU,26,"(2000,)",False,...are hearing me through this membrane aka the eardrum,the tympanic membrane,1,0
7063,2015-05-06,,Double Jeopardy,"(6, 5)",...& WHAT ARMY?,24,"(2000,)",False,"John J. Pershing commanded the AEF; despite his name, John French was in charge of the BEF, this ""Force""",the British Expeditionary Force,1,0
7063,2015-05-06,,Final Jeopardy,"(1, 1)",SCHOOLS AROUND THE WORLD,0,"(1989, 1980, 350)",False,In 1906 this city's Academy of Fine Arts admitted Egon Schiele; in 1907 it rejected Adolf Hitler,"Vienna, Austria",3,0
