epNum,airDate,extra_info,round_name,coord,category,order,value,daily_double,question,answer,correctAttempts,wrongAttempts
7109,2015-07-09,,Jeopardy,"(1, 1)",THE LIFE OF A NOVELIST,2,"(200,)",False,This Mississippian kept taking screenwriting work even after winning the 1949 Nobel Prize,(William) Faulkner,1,0
7109,2015-07-09,,Jeopardy,"(2, 1)",THE 114th CONGRESS,6,"(200,)",False,From 1967 to 1973 this senator in the 114th Congress was a prisoner of war in Vietnam,(John) McCain,1,0
7109,2015-07-09,,Jeopardy,"(3, 1)",WELCOME TO BOOZETOWN!,1,"(200,)",False,Anheuser-Busch is headquartered at One Busch Place in this city,St. Louis,1,1
7109,2015-07-09,,Jeopardy,"(4, 1)",1990s SITCOM SUMMARIES,7,"(200,)",False,A radio psychiatrist moves back home & lives with his father,Frasier,1,0
7109,2015-07-09,,Jeopardy,"(5, 1)","""V"" IS FOR...",13,"(200,)",False,This most popular ice cream flavor,vanilla,1,0
7109,2015-07-09,,Jeopardy,"(6, 1)",VICTORY,24,"(200,)",False,The Duke of Wellington's victory at this 1815 battle brought an end to the Napoleonic era,Waterloo,1,0
7109,2015-07-09,,Jeopardy,"(1, 2)",THE LIFE OF A NOVELIST,4,"(400,)",False,"Gee, wizard!  Before hitting it big, she worked for Amnesty International & lived in Portugal teaching English",J.K. Rowling,0,3
7109,2015-07-09,,Jeopardy,"(2, 2)",THE 114th CONGRESS,16,"(400,)",False,"The 12th House district of this woman includes the Presidio, the Mission & Chinatown",Nancy Pelosi,1,0
7109,2015-07-09,,Jeopardy,"(3, 2)",WELCOME TO BOOZETOWN!,3,"(400,)",False,The Town of Bushmills in County Antrim is renowned for this stuff distilled there,Irish whiskey,1,1
7109,2015-07-09,,Jeopardy,"(4, 2)",1990s SITCOM SUMMARIES,8,"(400,)",False,A shoe salesman & his family try to survive each other in suburbia,Married... with Children,1,0
7109,2015-07-09,,Jeopardy,"(5, 2)","""V"" IS FOR...",14,"(400,)",False,This large open porch popular in the south,veranda,1,0
7109,2015-07-09,,Jeopardy,"(6, 2)",VICTORY,25,"(400,)",False,A decisive victory at this January 1815 battle made Andrew Jackson a national hero,the Battle of New Orleans,1,0
7109,2015-07-09,,Jeopardy,"(1, 3)",THE LIFE OF A NOVELIST,5,"(600,)",False,"He was appointed surveyor of Salem's custom house in 1846; he lost the gig 3 years later, but things worked out",Nathaniel Hawthorne,1,0
7109,2015-07-09,,Jeopardy,"(2, 3)",THE 114th CONGRESS,17,"(600,)",False,"It's the 20th & last Congress for Barbara Mikulski of this state, the first Democratic woman to serve in both houses",Maryland,1,0
7109,2015-07-09,,Jeopardy,"(3, 3)",WELCOME TO BOOZETOWN!,11,"(600,)",False,"Henry Weinhard built a brewery there in 1862, long before it was Microbrewlandia",Portland (Oregon),1,0
7109,2015-07-09,,Jeopardy,"(4, 3)",1990s SITCOM SUMMARIES,9,"(600,)",False,"Edina & Patsy, 2 middle-aged British women, self-medicate with booze & drugs",Absolutely Fabulous,1,0
7109,2015-07-09,,Jeopardy,"(5, 3)","""V"" IS FOR...",15,"(600,)",False,This Italian word for a masterful musician,virtuoso,1,0
7109,2015-07-09,,Jeopardy,"(6, 3)",VICTORY,26,"(600,)",False,"A Soviet victory, the Aug. 1942-Feb. 1943 battle of this Russian city reversed the Nazis' advance on the Eastern Front",Stalingrad,1,0
7109,2015-07-09,,Jeopardy,"(2, 4)",THE 114th CONGRESS,18,"(800,)",False,This New Jersey senator played football at Stanford,(Cory) Booker,1,0
7109,2015-07-09,,Jeopardy,"(3, 4)",WELCOME TO BOOZETOWN!,12,"(800,)",False,"This ""White Label"" brand was founded in Perth (Scotland, not Australia) in 1846",Dewar\'s,0,3
7109,2015-07-09,,Jeopardy,"(4, 4)",1990s SITCOM SUMMARIES,10,"(800,)",False,The domestic affairs of the host of a TV show about domestic repairs,Home Improvement,1,0
7109,2015-07-09,,Jeopardy,"(5, 4)","""V"" IS FOR...",22,"(800,)",False,This alma mater of Mary McCarthy & Meryl Streep,Vassar,1,0
7109,2015-07-09,,Jeopardy,"(6, 4)",VICTORY,27,"(2000,)",True,A turning point of the Civil War was the Union victory in this 1862-1863 campaign in Mississippi,Vicksburg,0,1
7109,2015-07-09,,Jeopardy,"(2, 5)",THE 114th CONGRESS,19,"(1000,)",False,"Like Ruben Studdard, Renee Ellmers of this state made Clay Aiken a runner-up",North Carolina,1,0
7109,2015-07-09,,Jeopardy,"(3, 5)",WELCOME TO BOOZETOWN!,20,"(1000,)",False,"This city's ""Big 6"" breweries are Augustiner, Hofbrau, Hacker-Pschorr, Lowenbrau, Paulaner & Spaten",Munich,0,3
7109,2015-07-09,,Jeopardy,"(4, 5)",1990s SITCOM SUMMARIES,21,"(1000,)",False,A kid remembers growing up in the turbulent late '60s & early '70s,The Wonder Years,1,0
7109,2015-07-09,,Jeopardy,"(5, 5)","""V"" IS FOR...",23,"(1000,)",False,"This orange & black butterfly similar in appearance to a monarch, but smaller",viceroy,0,3
7109,2015-07-09,,Jeopardy,"(6, 5)",VICTORY,28,"(1000,)",False,Victory over Mark Antony in this 31 B.C. naval battle made Octavian the undisputed ruler of Rome,the Battle of Actium,0,3
7109,2015-07-09,,Double Jeopardy,"(1, 1)",KING JAMES BIBLE PHRASES,13,"(400,)",False,"In Exodus, God says he'll bring his people to a land flowing with these 2 things",milk & honey,1,0
7109,2015-07-09,,Double Jeopardy,"(2, 1)",THE ARTFUL ROGER,12,"(400,)",False,British photographer Roger Fenton is known for his extensive images of this 1853-56 peninsular war,the Crimean War,1,0
7109,2015-07-09,,Double Jeopardy,"(3, 1)",COLORFUL PLACES,3,"(400,)",False,"As Bart Starr often did, take a hike! in this eastern Wisconsin city",Green Bay,1,0
7109,2015-07-09,,Double Jeopardy,"(4, 1)",THAT'S JUST SAD,1,"(400,)",False,Doom's proverbial rhyming partner,gloom,1,0
7109,2015-07-09,,Double Jeopardy,"(5, 1)",OLYMPIANS,19,"(400,)",False,In 1996 this former U.S. Olympic boxer lit the flame at the start of the Summer Olympics in Atlanta,Muhammad Ali,1,0
7109,2015-07-09,,Double Jeopardy,"(6, 1)",PAPARAZZ-SEA,7,"(400,)",False,"This creature got in a fight outside a sand bar & swung its tail upward to inflict its poison, as dangerous as a snake bite",a stingray,1,0
7109,2015-07-09,,Double Jeopardy,"(1, 2)",KING JAMES BIBLE PHRASES,16,"(800,)",False,"Matthew tells us that ""the spirit indeed is willing, but"" there's this problem",the flesh is weak,1,0
7109,2015-07-09,,Double Jeopardy,"(2, 2)",THE ARTFUL ROGER,14,"(800,)",False,"(Kelly of the Clue Crew shows a sculpture on the monitor.)  ""Nydia, the Blind Girl of"" this city by Randolph Rogers shows Nydia moving through its ash-lined streets; the broken Corinthian capital at her foot represents the city's fall",Pompeii,1,0
7109,2015-07-09,,Double Jeopardy,"(3, 2)",COLORFUL PLACES,9,"(800,)",False,"In Chinese, these 2 bodies of water are the Huang He & the Huang Hai",the Yellow River & the Yellow Sea,0,3
7109,2015-07-09,,Double Jeopardy,"(4, 2)",THAT'S JUST SAD,2,"(800,)",False,"It's a 5-letter word meaning ""keen distress"", Charlie Brown!  Good...!",grief,1,0
7109,2015-07-09,,Double Jeopardy,"(5, 2)",OLYMPIANS,20,"(800,)",False,"Losing to a countryman, Yohan Blake of this nation won silver in both the 100 meters & 200 meters in 2012",Jamaica,0,3
7109,2015-07-09,,Double Jeopardy,"(6, 2)",PAPARAZZ-SEA,8,"(800,)",False,"One fish, two fish, this food fish that can swim in schools that extend for miles was seen hanging out in Nova Scotia",bluefish,1,1
7109,2015-07-09,,Double Jeopardy,"(1, 3)",KING JAMES BIBLE PHRASES,17,"(1200,)",False,"In a list of penalties in Exodus, this exchange precedes ""tooth for tooth, hand for hand, foot for foot""",an eye for an eye,1,0
7109,2015-07-09,,Double Jeopardy,"(2, 3)",THE ARTFUL ROGER,15,"(1200,)",False,"Imagist painter Roger Brown also did set design for productions like this composer's ""Cosi Fan Tutte""",Mozart,1,0
7109,2015-07-09,,Double Jeopardy,"(3, 3)",COLORFUL PLACES,10,"(1200,)",False,"This section of the Appalachians runs from Carlisle, Pennsylvania to Mount Oglethorpe, Georgia",the Blue Ridge,1,0
7109,2015-07-09,,Double Jeopardy,"(4, 3)",THAT'S JUST SAD,4,"(1200,)",False,"Dreary, like an 1852 title ""House""",bleak,1,0
7109,2015-07-09,,Double Jeopardy,"(5, 3)",OLYMPIANS,25,"(2000,)",True,"The youngest medalist ever was 10-year-old gymnast Dimitrios Loundras, in his homeland in this year",1896,0,1
7109,2015-07-09,,Double Jeopardy,"(1, 4)",KING JAMES BIBLE PHRASES,18,"(1600,)",False,"Revelation 1:8: ""I am"" these 2 things, ""the beginning and the ending""",the Alpha & Omega,1,0
7109,2015-07-09,,Double Jeopardy,"(2, 4)",THE ARTFUL ROGER,22,"(1600,)",False,"Roger de la Fresnaye was a pioneer in this early 20th century artistic ""ism""",Cubism,0,3
7109,2015-07-09,,Double Jeopardy,"(3, 4)",COLORFUL PLACES,11,"(1600,)",False,"You won't have a bad day at Pu'u Keka'a, aka this lava formation on Maui's Ka'anapali Beach",Black Rock,0,3
7109,2015-07-09,,Double Jeopardy,"(4, 4)",THAT'S JUST SAD,5,"(1600,)",False,"This sad 10-letter state of mind is from the Greek for ""black""",melancholy,1,0
7109,2015-07-09,,Double Jeopardy,"(5, 4)",OLYMPIANS,26,"(1600,)",False,"China's 4'11"" Deng Yaping won 4 golds in this racket sport in the 1990s",ping-pong (or table tennis),1,1
7109,2015-07-09,,Double Jeopardy,"(1, 5)",KING JAMES BIBLE PHRASES,21,"(2000,)",True,"""He is brought as"" this phrase, ""and as a sheep before her shearers is dumb, so he openeth not his mouth""",a lamb to the slaughter,0,1
7109,2015-07-09,,Double Jeopardy,"(2, 5)",THE ARTFUL ROGER,23,"(2000,)",False,"Enamored of Cezanne's work, art critic Roger Fry was credited with coining the term ""Post-"" this",Impressionism,1,0
7109,2015-07-09,,Double Jeopardy,"(3, 5)",COLORFUL PLACES,24,"(2000,)",False,The Boers formed this in 1854; in 1995 a post-apartheid government kicked a color out of its name,the Orange Free State,0,3
7109,2015-07-09,,Double Jeopardy,"(4, 5)",THAT'S JUST SAD,6,"(2000,)",False,"Like in the old song, ""I am a man of constant"" this",sorrow,1,0
7109,2015-07-09,,Final Jeopardy,"(1, 1)",SCRABBLE & CHEMISTRY,0,"(4000, 1201, 7201)",False,"As a word used in Scrabble, this longest-named one of the 6 noble gases would give you the highest score",krypton,1,2
