epNum,airDate,extra_info,round_name,coord,category,order,value,daily_double,question,answer,correctAttempts,wrongAttempts
7369,2016-09-29,Seth Wilson game 9.,Jeopardy,"(1, 1)",BOY SCOUT LAW WORDS,14,"(200,)",False,"""A scout is trustworthy..."", then this word describing one faithful to a leader or friend",loyal,1,0
7369,2016-09-29,Seth Wilson game 9.,Jeopardy,"(2, 1)",A LOOK AT BOOKS,4,"(200,)",False,"Harper Lee's ""Go Set a Watchman"" features characters from this novel set 20 years earlier",To Kill a Mockingbird,1,0
7369,2016-09-29,Seth Wilson game 9.,Jeopardy,"(3, 1)",EPISODES OF THE SITCOM,1,"(200,)",False,"""Weekend at Barney's"",""The Best Man""",How I Met Your Mother,1,0
7369,2016-09-29,Seth Wilson game 9.,Jeopardy,"(4, 1)",IN-LAWS,20,"(200,)",False,"It would be natural for her, Prince Charles' second wife, to be intimidated by her mother-in-law (Queen Elizabeth)",Camilla,1,0
7369,2016-09-29,Seth Wilson game 9.,Jeopardy,"(5, 1)",YOU CAN'T FIGHT,12,"(200,)",False,"Jesus' words ""Whosoever shall smite thee on thy right"" one, ""turn to him the other"" have been taken as a pacifist message",cheek,1,0
7369,2016-09-29,Seth Wilson game 9.,Jeopardy,"(6, 1)",CITY HALL,17,"(200,)",False,"In this Western state capital, the City Hall went up in 1894 & was controversial because it rivaled the Temple",Salt Lake City,1,0
7369,2016-09-29,Seth Wilson game 9.,Jeopardy,"(1, 2)",BOY SCOUT LAW WORDS,27,"(400,)",False,This synonym for frugal is also the name of a car rental company,thrifty,0,3
7369,2016-09-29,Seth Wilson game 9.,Jeopardy,"(2, 2)",A LOOK AT BOOKS,5,"(400,)",False,"In 1932 Pearl Buck's ""Sons"" was a No. 3 bestseller; this other Buck book held the top spot",The Good Earth,1,0
7369,2016-09-29,Seth Wilson game 9.,Jeopardy,"(3, 2)",EPISODES OF THE SITCOM,2,"(400,)",False,"""Citizen Keaton"",""Alex Doesn't Live Here Anymore""",Family Ties,1,0
7369,2016-09-29,Seth Wilson game 9.,Jeopardy,"(4, 2)",IN-LAWS,23,"(400,)",False,"This handbag designer, sister-in-law to comedian & actor David, recently changed her last name to Valentine",Kate Spade,1,0
7369,2016-09-29,Seth Wilson game 9.,Jeopardy,"(5, 2)",YOU CAN'T FIGHT,15,"(400,)",False,His first major nonviolent satyagraha action was protesting salt taxes imposed by the British,Gandhi,1,0
7369,2016-09-29,Seth Wilson game 9.,Jeopardy,"(6, 2)",CITY HALL,10,"(500,)",True,"One of the world's tallest buildings when completed in 1901, Philly's City Hall is 548 feet tall & topped by a statue of this man",William Penn,0,1
7369,2016-09-29,Seth Wilson game 9.,Jeopardy,"(1, 3)",BOY SCOUT LAW WORDS,28,"(600,)",False,"Immaculate is a synonym for this word that can precede ""getaway"" or a ""sweep""",clean,1,0
7369,2016-09-29,Seth Wilson game 9.,Jeopardy,"(2, 3)",A LOOK AT BOOKS,8,"(600,)",False,"""GEB"" is devotees' name for Douglas Hofstadter's ""Godel, Escher,"" this composer",Bach,0,3
7369,2016-09-29,Seth Wilson game 9.,Jeopardy,"(3, 3)",EPISODES OF THE SITCOM,3,"(600,)",False,"""Daddy Dre-Care"",""Keeping Up with the Johnsons""",Black-ish,1,0
7369,2016-09-29,Seth Wilson game 9.,Jeopardy,"(4, 3)",IN-LAWS,24,"(600,)",False,"For a brief time, Janet Jackson was sister-in-law to this daughter of ""the King""",Lisa Marie Presley,1,0
7369,2016-09-29,Seth Wilson game 9.,Jeopardy,"(5, 3)",YOU CAN'T FIGHT,16,"(600,)",False,"This religious group founded in the 1600s is dedicated to pacifism & to following the ""inward light""",the Quakers (Society of Friends),1,0
7369,2016-09-29,Seth Wilson game 9.,Jeopardy,"(6, 3)",CITY HALL,11,"(600,)",False,"Completed in 1928, Asheville, North Carolina's City Hall is a masterpiece of this style, named for a Parisian expo held in 1925",Art Deco,1,0
7369,2016-09-29,Seth Wilson game 9.,Jeopardy,"(2, 4)",A LOOK AT BOOKS,9,"(800,)",False,"""So Long, and Thanks for All the Fish"" was a 1984 offering from this British satirical sci-fi writer",Douglas Adams,1,0
7369,2016-09-29,Seth Wilson game 9.,Jeopardy,"(3, 4)",EPISODES OF THE SITCOM,6,"(800,)",False,"""Coffee, Tea or Jack"",""Roper's Niece""",Three\'s Company,1,0
7369,2016-09-29,Seth Wilson game 9.,Jeopardy,"(4, 4)",IN-LAWS,25,"(800,)",False,"Frederic Joliot, winner of a Nobel with wife Irene, could hold his own at the dinner table with her, his mother-in-law",Marie Curie,1,0
7369,2016-09-29,Seth Wilson game 9.,Jeopardy,"(5, 4)",YOU CAN'T FIGHT,18,"(800,)",False,"2-word military draft registration status that means you can serve, but without fighting",conscientious objector,1,0
7369,2016-09-29,Seth Wilson game 9.,Jeopardy,"(6, 4)",CITY HALL,21,"(800,)",False,"You can't visit this ancient wonder at Halicarnassus, but behold the tower of Los Angeles City Hall, designed to resemble it",the Mausoleum,1,0
7369,2016-09-29,Seth Wilson game 9.,Jeopardy,"(2, 5)",A LOOK AT BOOKS,13,"(1000,)",False,"Norman Mailer said a novel by this man didn't have the right stuff: ""It is a 742-page work that reads as if it is 1,500""",Tom Wolfe,1,0
7369,2016-09-29,Seth Wilson game 9.,Jeopardy,"(3, 5)",EPISODES OF THE SITCOM,7,"(1000,)",False,"""Smother's Day"",""Family Takes Care of Beverly""",The Goldbergs,0,3
7369,2016-09-29,Seth Wilson game 9.,Jeopardy,"(4, 5)",IN-LAWS,26,"(1000,)",False,"As Henry IV of France was married to Margaret of Valois, this influential Medici was his mother-in-law",Catherine Medici,1,0
7369,2016-09-29,Seth Wilson game 9.,Jeopardy,"(5, 5)",YOU CAN'T FIGHT,19,"(1000,)",False,"Last name of brothers Daniel & Philip, pacifist priests known for their opposition to the Vietnam War",Berrigan,0,3
7369,2016-09-29,Seth Wilson game 9.,Jeopardy,"(6, 5)",CITY HALL,22,"(1000,)",False,The building housing this burg's City Hall also houses the offices administering Cook County,Chicago,1,0
7369,2016-09-29,Seth Wilson game 9.,Double Jeopardy,"(1, 1)",MICHIGAN HISTORY,18,"(400,)",False,"December 10, 1915 marked a milestone with the production of the one millionth car from this company",Ford,1,0
7369,2016-09-29,Seth Wilson game 9.,Double Jeopardy,"(2, 1)",HONORS & AWARDS,21,"(400,)",False,The award in these sciences is technically not a Nobel Prize but the Sveriges Riksbank Prize in Memory of Alfred Nobel,economics,1,0
7369,2016-09-29,Seth Wilson game 9.,Double Jeopardy,"(3, 1)",RECENT MEMOIRISTS,7,"(400,)",False,"Courtney Robertson gave us the ins & outs of her time on this reality TV show in ""I Didn't Come Here to Make Friends""",The Bachelor,0,3
7369,2016-09-29,Seth Wilson game 9.,Double Jeopardy,"(4, 1)",NATIONAL CURRENCY UNITS,1,"(400,)",False,Japan,the yen,1,0
7369,2016-09-29,Seth Wilson game 9.,Double Jeopardy,"(5, 1)",MUSIC IN MOVIES,2,"(400,)",False,"After the Nazis sing ""Die Wacht Am Rhein"" in ""Casablanca"", Laszlo tells the band to play this French anthem","""La Marseillaise""",1,0
7369,2016-09-29,Seth Wilson game 9.,Double Jeopardy,"(6, 1)","""SQ""s ME",26,"(400,)",False,"By shooting out its feeding tentacles, a giant one of these sea creatures can catch prey over 30 feet away",a squid,1,0
7369,2016-09-29,Seth Wilson game 9.,Double Jeopardy,"(1, 2)",MICHIGAN HISTORY,13,"(800,)",False,"(Jimmy of the Clue Crew shows a graph on the monitor.)  In 2016, the Washington Post showed lead in parts-per-billion in Michigan; with the normal level of cause for concern being 5, in Troy, it was 1.1, in Detroit, it was 2.3, & in this city, a staggering 27",Flint,1,0
7369,2016-09-29,Seth Wilson game 9.,Double Jeopardy,"(2, 2)",HONORS & AWARDS,22,"(800,)",False,An Academy Award is named for this boy wonder movie producer who died at 37,Irving Thalberg,0,3
7369,2016-09-29,Seth Wilson game 9.,Double Jeopardy,"(3, 2)",RECENT MEMOIRISTS,8,"(800,)",False,"""Every Day I Fight"" is the memoir of this late ESPN anchor & his battle against cancer",Stuart Scott,1,0
7369,2016-09-29,Seth Wilson game 9.,Double Jeopardy,"(4, 2)",NATIONAL CURRENCY UNITS,3,"(800,)",False,Argentina,the peso,1,0
7369,2016-09-29,Seth Wilson game 9.,Double Jeopardy,"(5, 2)",MUSIC IN MOVIES,10,"(800,)",False,"In ""Moulin Rouge"" Ewan McGregor is taunted with a rendition of this Police song","""Roxanne""",1,0
7369,2016-09-29,Seth Wilson game 9.,Double Jeopardy,"(6, 2)","""SQ""s ME",29,"(800,)",False,"In TV ads it's what Mr. Whipple always told customers not to do to ""the Charmin""",squeeze,1,0
7369,2016-09-29,Seth Wilson game 9.,Double Jeopardy,"(1, 3)",MICHIGAN HISTORY,14,"(1200,)",False,In 1925 Gertrude Brown was the first this pie fruit queen & Traverse City's annual festival was born,cherry,1,0
7369,2016-09-29,Seth Wilson game 9.,Double Jeopardy,"(2, 3)",HONORS & AWARDS,23,"(1200,)",False,"A social media account called Goats of Anarchy was a 2016 winner of one of these, honoring Internet excellence",a Webby,1,0
7369,2016-09-29,Seth Wilson game 9.,Double Jeopardy,"(3, 3)",RECENT MEMOIRISTS,9,"(1200,)",False,"Holly Madison's ""Down the Rabbit Hole"" is her cautionary memoir of her time as one of these lagomorphs",a Playboy Bunny,1,0
7369,2016-09-29,Seth Wilson game 9.,Double Jeopardy,"(4, 3)",NATIONAL CURRENCY UNITS,4,"(1200,)",False,Belarus,the ruble,0,3
7369,2016-09-29,Seth Wilson game 9.,Double Jeopardy,"(5, 3)",MUSIC IN MOVIES,11,"(1200,)",False,"At the riff-off in this 2012 movie, the Treblemakers sing ""Feels Like The First Time"", while the Bellas go with ""No Diggity""",Pitch Perfect,1,0
7369,2016-09-29,Seth Wilson game 9.,Double Jeopardy,"(1, 4)",MICHIGAN HISTORY,19,"(1600,)",False,A city up north is named for this French priest who founded Michigan's first permanent Eur. settlement c. 1668,Father Marquette,0,3
7369,2016-09-29,Seth Wilson game 9.,Double Jeopardy,"(2, 4)",HONORS & AWARDS,24,"(1600,)",False,The Natl. Assoc. of Broadcasters came up with these radio awards in 1938 as the equivalent of a Pulitzer,the Peabody Awards,0,3
7369,2016-09-29,Seth Wilson game 9.,Double Jeopardy,"(3, 4)",RECENT MEMOIRISTS,16,"(1600,)",False,"She followed up her memoir ""A Stolen Life"" with ""Freedom: My Book of Firsts""",Jaycee Dugard,0,3
7369,2016-09-29,Seth Wilson game 9.,Double Jeopardy,"(4, 4)",NATIONAL CURRENCY UNITS,5,"(1600,)",False,Pakistan,the rupee,1,0
7369,2016-09-29,Seth Wilson game 9.,Double Jeopardy,"(5, 4)",MUSIC IN MOVIES,12,"(1600,)",False,"In the third installment of this comedy, Ken Jeong as Mr. Chow sings ""I Believe I Can Fly"" while flying over Vegas",The Hangover,1,0
7369,2016-09-29,Seth Wilson game 9.,Double Jeopardy,"(6, 4)","""SQ""s ME",27,"(1600,)",False,"The sight of blood makes some people this, meaning easily nauseated",squeamish,1,0
7369,2016-09-29,Seth Wilson game 9.,Double Jeopardy,"(1, 5)",MICHIGAN HISTORY,20,"(2000,)",False,"FDR's 1940 phrase ""the great"" this ""of democracy"" was later applied to Detroit as it turned out jeeps, tanks & bombers",arsenal,0,3
7369,2016-09-29,Seth Wilson game 9.,Double Jeopardy,"(2, 5)",HONORS & AWARDS,25,"(1500,)",True,Napoleon created it in 1802 as a general military & civil order of merit,the Legion of Honor (la Légion d\'Honneur),0,1
7369,2016-09-29,Seth Wilson game 9.,Double Jeopardy,"(3, 5)",RECENT MEMOIRISTS,17,"(2000,)",False,"This former Fed chairman wrote the 2015 memoir ""The Courage to Act: A Memoir of a Crisis and its Aftermath""",Bernanke,1,0
7369,2016-09-29,Seth Wilson game 9.,Double Jeopardy,"(4, 5)",NATIONAL CURRENCY UNITS,6,"(1000,)",True,Brazil,the real,1,0
7369,2016-09-29,Seth Wilson game 9.,Double Jeopardy,"(5, 5)",MUSIC IN MOVIES,15,"(2000,)",False,"In a scene from ""Almost Famous"", the Stillwater tour bus sings this Elton John tune","""Tiny Dancer""",1,0
7369,2016-09-29,Seth Wilson game 9.,Double Jeopardy,"(6, 5)","""SQ""s ME",28,"(2000,)",False,In medieval times a young nobleman who served a knight was called this,a squire,1,0
7369,2016-09-29,Seth Wilson game 9.,Final Jeopardy,"(1, 1)",MYTHOLOGY,0,"(5499, 3499, 4000)",False,"Banished from Athens, this inventor found trouble on Crete too, but escaped",Daedalus,2,1
