epNum,airDate,extra_info,round_name,coord,category,order,value,daily_double,question,answer,correctAttempts,wrongAttempts
7376,2016-10-10,,Jeopardy,"(1, 1)",WORLD AIRPORTS,1,"(200,)",False,"Long layover?  No problem at this Finnish capital's airport, which offers sleep pods, a spa & more",Helsinki,1,0
7376,2016-10-10,,Jeopardy,"(2, 1)",WHERE DO YOU WEAR IT?,11,"(200,)",False,Slingback,on your feet,1,0
7376,2016-10-10,,Jeopardy,"(4, 1)",HEALTH ISSUES,14,"(200,)",False,Regular brushing can help prevent this inflammation of the gums,gingivitis,1,0
7376,2016-10-10,,Jeopardy,"(5, 1)",OBVIOUS BROADWAY,2,"(200,)",False,"This show's ""Six Merry Murderesses"" do the ""Cell Block Tango"" in Chicago's Cook County Jail""They had it coming (They had it coming) /They had it coming (They had it coming) /They had it coming all along...""",Chicago,1,0
7376,2016-10-10,,Jeopardy,"(6, 1)",LATE WORDS,19,"(200,)",False,"You'll find ""late"" in the middle of this word you use when you wish someone happy birthday the day after",belated,1,0
7376,2016-10-10,,Jeopardy,"(1, 2)",WORLD AIRPORTS,3,"(1000,)",True,"The Tenzing-Hillary airport in this country is 9,200 feet above sea level",Nepal,1,0
7376,2016-10-10,,Jeopardy,"(2, 2)",WHERE DO YOU WEAR IT?,12,"(400,)",False,"Kid, as in a familiar expression",on your hands,1,0
7376,2016-10-10,,Jeopardy,"(3, 2)",THAT'S A FACT,29,"(400,)",False,The highest & lowest points in the 48 contiguous states are within 100 miles of each other in this state,California,1,0
7376,2016-10-10,,Jeopardy,"(4, 2)",HEALTH ISSUES,15,"(400,)",False,"During a 1721 epidemic in Boston, Zabdiel Boylston gave the 1st Amer. inoculations against this now-eradicated disease",smallpox,1,0
7376,2016-10-10,,Jeopardy,"(5, 2)",OBVIOUS BROADWAY,5,"(400,)",False,"""My Boyfriend's Back"" is one of the songs in this show that begins in New Jersey in 1962",Jersey Boys,1,0
7376,2016-10-10,,Jeopardy,"(6, 2)",LATE WORDS,20,"(400,)",False,Many schools have policies against being this 5-letter late word,tardy,1,0
7376,2016-10-10,,Jeopardy,"(1, 3)",WORLD AIRPORTS,4,"(600,)",False,"A British airport renamed for him in 2001 also adopted the slogan ""Above us only sky""",John Lennon,1,0
7376,2016-10-10,,Jeopardy,"(2, 3)",WHERE DO YOU WEAR IT?,13,"(600,)",False,Money--Rick Steves never travels without one,your waist,1,2
7376,2016-10-10,,Jeopardy,"(3, 3)",THAT'S A FACT,28,"(600,)",False,"Some mammals, like cattle, can sleep standing up but can only do this, from the Old English for ""joy"", lying down",dream,0,3
7376,2016-10-10,,Jeopardy,"(4, 3)",HEALTH ISSUES,16,"(600,)",False,Coumadin & heparin are in this class of drugs whose name means that they thin your blood,anticoagulants,0,3
7376,2016-10-10,,Jeopardy,"(5, 3)",OBVIOUS BROADWAY,6,"(600,)",False,"Sara Bareilles wrote the music for this 2016 show seen here; note the women's uniforms""...keep racing /Let's make mistakes /Let us say, ""So what?"" and make worse what was...""",Waitress,1,0
7376,2016-10-10,,Jeopardy,"(6, 3)",LATE WORDS,21,"(600,)",False,It's the usual adjective for a library book that's not been returned on time,overdue,1,0
7376,2016-10-10,,Jeopardy,"(1, 4)",WORLD AIRPORTS,9,"(800,)",False,"Resembling a bird about to take off, the terminal at Bilbao airport is nicknamed ""La Paloma"", Spanish for this",a dove,1,0
7376,2016-10-10,,Jeopardy,"(2, 4)",WHERE DO YOU WEAR IT?,24,"(800,)",False,"Tennis, so named because Chris Evert wore one",the wrist,1,0
7376,2016-10-10,,Jeopardy,"(3, 4)",THAT'S A FACT,27,"(800,)",False,"The Peruvian part of this lake covers more than 1,900 square miles but even more importantly, it's funny to say",Titicaca,1,0
7376,2016-10-10,,Jeopardy,"(4, 4)",HEALTH ISSUES,17,"(800,)",False,"Creutzfeldt-Jakob disease is the human form of this ""beastly"" affliction",mad cow disease,1,0
7376,2016-10-10,,Jeopardy,"(5, 4)",OBVIOUS BROADWAY,7,"(800,)",False,"It's the plural title of the 2016 revival that combines ""The March of the Falsettos"" & ""Falsettoland""",Falsettos,1,0
7376,2016-10-10,,Jeopardy,"(6, 4)",LATE WORDS,22,"(800,)",False,"Just like former House Majority Leader Tom's last name, you could have been beset by one of these",delay,1,0
7376,2016-10-10,,Jeopardy,"(1, 5)",WORLD AIRPORTS,10,"(1000,)",False,You can still see one of Air France's Concorde jets outside the Paris airport named for him,Charles de Gaulle,1,0
7376,2016-10-10,,Jeopardy,"(2, 5)",WHERE DO YOU WEAR IT?,25,"(1000,)",False,Four-in-hand,your neck,1,0
7376,2016-10-10,,Jeopardy,"(3, 5)",THAT'S A FACT,26,"(1000,)",False,In 1642 this Frenchman whose name became a computer language built a machine that could add & subtract,Pascal,1,0
7376,2016-10-10,,Jeopardy,"(4, 5)",HEALTH ISSUES,18,"(1000,)",False,Bright's disease is an inflammation in these organs,your kidneys,0,3
7376,2016-10-10,,Jeopardy,"(5, 5)",OBVIOUS BROADWAY,8,"(1000,)",False,"This 2015 Tony winner is set in a funeral home, given a slightly shorter nickname by the family's children""...right clothes you're wearing /Your short hair and your dungarees /And your lace-up boots...""",Fun Home,1,0
7376,2016-10-10,,Jeopardy,"(6, 5)",LATE WORDS,23,"(1000,)",False,"A restaurant worker who's falling behind is said to be ""in"" these garden annoyances",the weeds,1,0
7376,2016-10-10,,Double Jeopardy,"(1, 1)",CARRIE-OKE,7,"(400,)",False,"Her album ""Storyteller"" dominated country album sales in 2015",Carrie Underwood,1,0
7376,2016-10-10,,Double Jeopardy,"(2, 1)",THE OTTOMAN EMPIRE,26,"(400,)",False,In the late 1400s Ottoman slaves of this religion were forced to convert to Islam & serve in an infantry called the Janissaries,Christianity,1,0
7376,2016-10-10,,Double Jeopardy,"(3, 1)",U.S. RIVERS,6,"(400,)",False,"7-foot, 100-pound sturgeon have returned to the St. Louis River, Minnesota's largest tributary of this Great Lake",Superior,1,0
7376,2016-10-10,,Double Jeopardy,"(4, 1)",LIT-POURRI,1,"(400,)",False,"In ""Lord of the Rings"", Frodo is a hobbit & Gimli is one of these",a dwarf,1,0
7376,2016-10-10,,Double Jeopardy,"(5, 1)",VERY CLEVER,12,"(400,)",False,"(Kelly of the Clue Crew demonstrates with a bent Jackson.)  Bending a $20 bill at precise places can make Andrew's face appear to smile or frown, an effective one of these 2-word tricks",an optical illusion,1,0
7376,2016-10-10,,Double Jeopardy,"(6, 1)","""L""8 WORDS",18,"(400,)",False,It's the fetching dog seen here,a Labrador,1,0
7376,2016-10-10,,Double Jeopardy,"(1, 2)",CARRIE-OKE,8,"(800,)",False,"This actress sang a song about Life Day, ""a day of peace"", in the 1978 ""Star Wars Holiday Special""",Carrie Fisher,1,0
7376,2016-10-10,,Double Jeopardy,"(2, 2)",THE OTTOMAN EMPIRE,27,"(800,)",False,In 1457 this city became capital of the Ottoman Empire & 60 years later the seat of the caliph,Istanbul (or Constantinople),1,0
7376,2016-10-10,,Double Jeopardy,"(3, 2)",U.S. RIVERS,16,"(800,)",False,"Way down upon this river, the old folks (& everyone else) can see Florida's largest whitewater rapids",the Suwannee,1,0
7376,2016-10-10,,Double Jeopardy,"(4, 2)",LIT-POURRI,2,"(800,)",False,"In ""Paradise Lost"" this character disguises himself as a cherub to sneak into the Garden of Eden",Satan,1,0
7376,2016-10-10,,Double Jeopardy,"(5, 2)",VERY CLEVER,13,"(800,)",False,The browser ploy with this Agatha Christie-esque name keeps users at a website by disabling the back button,a mouse trap,1,0
7376,2016-10-10,,Double Jeopardy,"(6, 2)","""L""8 WORDS",19,"(800,)",False,"In the original Iroquois version of this sport, goals were miles apart, & games had hundreds of players",lacrosse,1,0
7376,2016-10-10,,Double Jeopardy,"(1, 3)",CARRIE-OKE,9,"(1200,)",False,"Carrie Brownstein & Corin Tucker named this hyphenated alt rock band after a road in Lacey, Washington",Sleater-Kinney,1,0
7376,2016-10-10,,Double Jeopardy,"(2, 3)",THE OTTOMAN EMPIRE,28,"(1200,)",False,Capturing Mesopotamia in 1534 gave the Ottomans access to this large gulf to the south,the Persian Gulf,1,0
7376,2016-10-10,,Double Jeopardy,"(3, 3)",U.S. RIVERS,23,"(1200,)",False,"This river that runs east-west, bisecting Alaska, is known for the Chinook salmon that spawn in its creeks",the Yukon River,0,3
7376,2016-10-10,,Double Jeopardy,"(4, 3)",LIT-POURRI,3,"(1200,)",False,"Not Fog nor Cloud, but this is Lolita's last name in Nabokov's lecherous classic",Haze,1,0
7376,2016-10-10,,Double Jeopardy,"(5, 3)",VERY CLEVER,14,"(1200,)",False,"Change 1 letter in ""rube"" to get this, which a rube might fall for",a ruse,1,0
7376,2016-10-10,,Double Jeopardy,"(6, 3)","""L""8 WORDS",20,"(1200,)",False,"For the song ""The Lady Is A Tramp"", it was Lorenz Hart",a lyricist,1,0
7376,2016-10-10,,Double Jeopardy,"(1, 4)",CARRIE-OKE,10,"(1600,)",False,"When Graham Nash wrote about this singer he was too shy to use her 1st name so he chose one that rhymed: ""Carrie Ann""",Marianne Faithfull,1,0
7376,2016-10-10,,Double Jeopardy,"(3, 4)",U.S. RIVERS,24,"(1600,)",False,"There's a maritime museum named for this river near its mouth in Astoria, Oregon",the Columbia,1,0
7376,2016-10-10,,Double Jeopardy,"(4, 4)",LIT-POURRI,4,"(1600,)",False,This 1913 George Bernard Shaw play was based on an ancient Greek myth recounted by Ovid,Pygmalion,1,0
7376,2016-10-10,,Double Jeopardy,"(5, 4)",VERY CLEVER,15,"(3000,)",True,"Supposedly an offering to Athena, it was built by the master carpenter Epeius",the Trojan Horse,0,1
7376,2016-10-10,,Double Jeopardy,"(6, 4)","""L""8 WORDS",21,"(1600,)",False,To suffer hardship; many are said to do it in prison,languish,1,0
7376,2016-10-10,,Double Jeopardy,"(1, 5)",CARRIE-OKE,11,"(2000,)",False,"Dr. Hook & the Medicine Show's ""Carry Me, Carrie"" & ""Cover Of The Rolling Stone"" were penned by this poet & author",Shel Silverstein,1,0
7376,2016-10-10,,Double Jeopardy,"(3, 5)",U.S. RIVERS,25,"(2000,)",False,"This river named for a state rises in the Sawatch Range of the Rockies & flows 1,460 miles southeast to the Mississippi River",the Arkansas River,0,3
7376,2016-10-10,,Double Jeopardy,"(4, 5)",LIT-POURRI,5,"(2000,)",True,"In ""Gulliver's Travels"" a race of talking horses called Houyhnhnms have enslaved humanlike beings called these",Yahoos,0,1
7376,2016-10-10,,Double Jeopardy,"(5, 5)",VERY CLEVER,17,"(2000,)",False,"In a 12th century French beast epic, Bruin the bear was outfoxed by this fox",Reynard,0,3
7376,2016-10-10,,Double Jeopardy,"(6, 5)","""L""8 WORDS",22,"(2000,)",False,It's the word for the type of musician seen here,a lutenist,0,3
7376,2016-10-10,,Final Jeopardy,"(1, 1)",INAUGURAL ADDRESSES,0,"(4000, 8798, 6601)",False,"One of his addresses used the term ""security shield"" about international affairs as well as ""golden years""",President Ronald Reagan,3,0
