epNum,airDate,extra_info,round_name,coord,category,order,value,daily_double,question,answer,correctAttempts,wrongAttempts
7461,2017-02-06,Lisa Schlitt game 7.,Jeopardy,"(1, 1)",FAMILIAR ACTING FACES,6,"(200,)",False,"Ned?  Ned Ryerson?  No, it's actually Stephen Tobolowsky, who played Ned over & over in this 1993 comedy",Groundhog Day,1,0
7461,2017-02-06,Lisa Schlitt game 7.,Jeopardy,"(2, 1)",A RUDE AWAKENING,21,"(200,)",False,You may grow to hate this bugle call used by the Army to awaken the troops for morning roll call,"""Reveille""",1,0
7461,2017-02-06,Lisa Schlitt game 7.,Jeopardy,"(3, 1)",A FICTIONAL DEATH,1,"(200,)",False,"Post-mortem the title character of this H.G. Wells novel can be seen, hands & feet first",The Invisible Man,1,0
7461,2017-02-06,Lisa Schlitt game 7.,Jeopardy,"(4, 1)",FOREIGN EXCHANGE,26,"(200,)",False,"2 grazing yaks, the temple of Taleju & Mount Everest are depicted on its 5-rupee note",Nepal,1,0
7461,2017-02-06,Lisa Schlitt game 7.,Jeopardy,"(5, 1)","""MIS""QUOTES",11,"(200,)",False,"Mark Twain wrote about ""the magnificent"" this river ""rolling its mile-wide tide along, shining in the sun""",the Mississippi,1,0
7461,2017-02-06,Lisa Schlitt game 7.,Jeopardy,"(6, 1)",RENTING A CAR,16,"(200,)",False,How about this company that shares its name with Captain Kirk's craft?,Enterprise,1,0
7461,2017-02-06,Lisa Schlitt game 7.,Jeopardy,"(1, 2)",FAMILIAR ACTING FACES,7,"(400,)",False,"Many familiar faces played judges on this Julianna Margulies show, including the omnipresent Denis O'Hare",The Good Wife,1,0
7461,2017-02-06,Lisa Schlitt game 7.,Jeopardy,"(2, 2)",A RUDE AWAKENING,22,"(400,)",False,I really wish you wouldn't wake me up using one of these,an air horn,1,0
7461,2017-02-06,Lisa Schlitt game 7.,Jeopardy,"(3, 2)",A FICTIONAL DEATH,2,"(400,)",False,"This author said, ""I killed Ned in the first book and it shocked a lot of people""; he was far from finished with the shocking",George R.R. Martin,1,0
7461,2017-02-06,Lisa Schlitt game 7.,Jeopardy,"(4, 2)",FOREIGN EXCHANGE,27,"(400,)",False,In 2015 Russia began issuing 100-ruble notes commemorating the annexation of this peninsula from Ukraine,Crimea,1,0
7461,2017-02-06,Lisa Schlitt game 7.,Jeopardy,"(5, 2)","""MIS""QUOTES",12,"(400,)",False,"Frank Lloyd Wright claimed that ""the physician can bury his"" these ""but the architect can only advise his client to plant vines""",mistakes,1,0
7461,2017-02-06,Lisa Schlitt game 7.,Jeopardy,"(6, 2)",RENTING A CAR,17,"(400,)",False,Get a car from this company whose use of yellow comes from its founder's cab company,Hertz,1,0
7461,2017-02-06,Lisa Schlitt game 7.,Jeopardy,"(1, 3)",FAMILIAR ACTING FACES,8,"(600,)",False,"James Hong's 400-plus credits include ""Blade Runner"" and a restaurant host calling Cartwright & not Costanza on this sitcom",Seinfeld,1,0
7461,2017-02-06,Lisa Schlitt game 7.,Jeopardy,"(2, 3)",A RUDE AWAKENING,23,"(600,)",False,Ugh! It's one of these leg cramps with an equine name!,a Charlie horse,1,0
7461,2017-02-06,Lisa Schlitt game 7.,Jeopardy,"(3, 3)",A FICTIONAL DEATH,3,"(600,)",False,"The bell tolls for Esmeralda, executed as a sorceress in this 1831 classic",The Hunchback of Notre-Dame,1,0
7461,2017-02-06,Lisa Schlitt game 7.,Jeopardy,"(4, 3)",FOREIGN EXCHANGE,28,"(600,)",False,"Sweden's 200-kronor note honors this director with a depiction of him on the set of ""The Seventh Seal""",(Ingmar) Bergman,1,0
7461,2017-02-06,Lisa Schlitt game 7.,Jeopardy,"(5, 3)","""MIS""QUOTES",13,"(600,)",False,"Chekhov wrote that he had ""two professions.... Medicine is my lawful wife and literature is my"" this",mistress,1,0
7461,2017-02-06,Lisa Schlitt game 7.,Jeopardy,"(6, 3)",RENTING A CAR,18,"(600,)",False,"If you're watching what you spend, try this company whose name is also found between ""Congressional"" & ""Office""",Budget,1,0
7461,2017-02-06,Lisa Schlitt game 7.,Jeopardy,"(1, 4)",FAMILIAR ACTING FACES,9,"(800,)",False,"Lately dealing with ""Code Black"" on TV, the always busy Luis Guzman was on the big screen in this 1997 drama about Dirk Diggler",Boogie Nights,1,0
7461,2017-02-06,Lisa Schlitt game 7.,Jeopardy,"(2, 4)",A RUDE AWAKENING,24,"(800,)",False,"This challenge to raise money for ALS ended in 2014, so why the cold shower, especially at 3 A.M.?",the Ice Bucket Challenge,1,0
7461,2017-02-06,Lisa Schlitt game 7.,Jeopardy,"(3, 4)",A FICTIONAL DEATH,4,"(800,)",False,"This justifiably upset ""Romeo and Juliet"" character says, ""A plague o' both your houses!"" before he dies",Mercutio,1,1
7461,2017-02-06,Lisa Schlitt game 7.,Jeopardy,"(5, 4)","""MIS""QUOTES",14,"(800,)",False,"The constitution states that a president can be removed from office for ""high crimes and"" these",misdemeanors,1,0
7461,2017-02-06,Lisa Schlitt game 7.,Jeopardy,"(6, 4)",RENTING A CAR,19,"(800,)",False,"In terms of currency, there's always this company that allows you to ""lock low and go""",Dollar,1,0
7461,2017-02-06,Lisa Schlitt game 7.,Jeopardy,"(1, 5)",FAMILIAR ACTING FACES,10,"(1000,)",False,"Carol Christine Hilaria became initially yours as she worked under this name on shows like ""The Shield""",CCH Pounder,1,0
7461,2017-02-06,Lisa Schlitt game 7.,Jeopardy,"(2, 5)",A RUDE AWAKENING,25,"(1000,)",False,"Chronic snoring that's loud enough to wake a bed partner can be a sign of OSA, obstructive sleep this disorder",sleep apnea,1,0
7461,2017-02-06,Lisa Schlitt game 7.,Jeopardy,"(3, 5)",A FICTIONAL DEATH,5,"(1000,)",True,In 1991 John Updike won his second Pulitzer for this aptly titled final novel about Harry Angstrom,Rabbit at Rest,1,0
7461,2017-02-06,Lisa Schlitt game 7.,Jeopardy,"(5, 5)","""MIS""QUOTES",15,"(1000,)",False,"In TV's ""Rudolph the Red-Nosed Reindeer"", Charlie-in-the-box tells Hermey he's the ""Sentry of the Island of"" these",misfit toys,1,1
7461,2017-02-06,Lisa Schlitt game 7.,Jeopardy,"(6, 5)",RENTING A CAR,20,"(1000,)",False,"Bird lovers will love this car rental company whose name is also the Latin for ""bird""",Avis,1,0
7461,2017-02-06,Lisa Schlitt game 7.,Double Jeopardy,"(1, 1)",BROADWAY SHOWS IN LATIN,6,"(400,)",False,"""Homo Musicus""",The Music Man,1,0
7461,2017-02-06,Lisa Schlitt game 7.,Double Jeopardy,"(2, 1)",VENICE,21,"(400,)",False,"To curb excessive decoration of these boats by nobles, Venice passed a law that kept them black",a gondola,1,0
7461,2017-02-06,Lisa Schlitt game 7.,Double Jeopardy,"(3, 1)",ALLITERATIVE 2-WORD TERMS,1,"(400,)",False,"""She sells seashells by the sea shore"" is a classic one of these",a tongue twister,1,0
7461,2017-02-06,Lisa Schlitt game 7.,Double Jeopardy,"(5, 1)","HARD ""G""",12,"(400,)",False,The midnight to 8 A.M. shift,the graveyard shift,1,0
7461,2017-02-06,Lisa Schlitt game 7.,Double Jeopardy,"(6, 1)",NATIONAL MUSEUM OF AFRICAN-AMERICAN HISTORY AND CULTURE,7,"(400,)",False,"(Alex delivers the clue from the National Museum of African American History and Culture in Washington, D.C.)  At the gift shop, you can pick up a kinara, a candleholder that represents African roots; it'll hold candles in the symbolic colors of black for the people, red for their struggle & green for hope, all to help you celebrate this late December holiday",Kwanzaa,1,0
7461,2017-02-06,Lisa Schlitt game 7.,Double Jeopardy,"(1, 2)",BROADWAY SHOWS IN LATIN,15,"(800,)",False,"""Feles""",Cats,1,0
7461,2017-02-06,Lisa Schlitt game 7.,Double Jeopardy,"(2, 2)",VENICE,22,"(800,)",False,"At the height of its naval power, Venice was known as the ""Queen of"" this sea",the Adriatic,1,0
7461,2017-02-06,Lisa Schlitt game 7.,Double Jeopardy,"(3, 2)",ALLITERATIVE 2-WORD TERMS,2,"(800,)",False,No need to cry over this tree,a weeping willow,1,0
7461,2017-02-06,Lisa Schlitt game 7.,Double Jeopardy,"(4, 2)",CLASSICAL MUSIC,27,"(800,)",False,"After Bizet's death at age 36, Ernest Guiraud assembled 2 instrumental suites from this opera",Carmen,1,0
7461,2017-02-06,Lisa Schlitt game 7.,Double Jeopardy,"(5, 2)","HARD ""G""",13,"(800,)",False,"""Mikado"" librettist",Gilbert,1,0
7461,2017-02-06,Lisa Schlitt game 7.,Double Jeopardy,"(6, 2)",NATIONAL MUSEUM OF AFRICAN-AMERICAN HISTORY AND CULTURE,8,"(800,)",False,"(Alex delivers the clue from the National Museum of African American History and Culture in Washington, D.C.)  Thomas Jefferson wrote that ""all men are created equal"", yet, as seen from the names on the bricks, he was a major slaveholder owning hundreds at this home and plantation in Virginia",Monticello,1,0
7461,2017-02-06,Lisa Schlitt game 7.,Double Jeopardy,"(1, 3)",BROADWAY SHOWS IN LATIN,18,"(1200,)",True,"""Mea Domina Bella""",My Fair Lady,1,0
7461,2017-02-06,Lisa Schlitt game 7.,Double Jeopardy,"(2, 3)",VENICE,23,"(1200,)",False,"Venice's ""Main Street"", it winds through the city's center for almost 2 1/2 miles",the Grand Canal,1,0
7461,2017-02-06,Lisa Schlitt game 7.,Double Jeopardy,"(3, 3)",ALLITERATIVE 2-WORD TERMS,3,"(1200,)",False,It's the bovine term for a business or product that generates a steady flow of income,a cash cow,1,0
7461,2017-02-06,Lisa Schlitt game 7.,Double Jeopardy,"(4, 3)",CLASSICAL MUSIC,26,"(400,)",True,"Gustav Holst finished this work by writing ""Mercury"" in 1916",The Planets,0,1
7461,2017-02-06,Lisa Schlitt game 7.,Double Jeopardy,"(5, 3)","HARD ""G""",14,"(1200,)",False,There's a ruffed type of this game bird,a grouse,1,0
7461,2017-02-06,Lisa Schlitt game 7.,Double Jeopardy,"(6, 3)",NATIONAL MUSEUM OF AFRICAN-AMERICAN HISTORY AND CULTURE,9,"(1200,)",False,"(Alex delivers the clue from the National Museum of African American History and Culture in Washington, D.C.)  Among Harriet Tubman's most treasured possessions was a lace shawl she received in recognition of her heroic efforts from this woman, who was celebrating her diamond jubilee",Queen Victoria,1,0
7461,2017-02-06,Lisa Schlitt game 7.,Double Jeopardy,"(1, 4)",BROADWAY SHOWS IN LATIN,19,"(1600,)",False,"""Quadragesimus Secundus Vicus""",42nd Street,0,3
7461,2017-02-06,Lisa Schlitt game 7.,Double Jeopardy,"(2, 4)",VENICE,24,"(1600,)",False,"This sandbar, home to the Venice Film Festival since 1932, is one of Europe's most popular beach resorts",Lido Beach,0,3
7461,2017-02-06,Lisa Schlitt game 7.,Double Jeopardy,"(3, 4)",ALLITERATIVE 2-WORD TERMS,4,"(1600,)",False,They're the classic footwear seen here,saddle shoes,0,3
7461,2017-02-06,Lisa Schlitt game 7.,Double Jeopardy,"(4, 4)",CLASSICAL MUSIC,28,"(1600,)",False,"Mendelssohn's ""Calm Sea And Prosperous Voyage"" is a concert one--not before an opera but standing alone",an overture,0,3
7461,2017-02-06,Lisa Schlitt game 7.,Double Jeopardy,"(5, 4)","HARD ""G""",16,"(1600,)",False,He built what's now Hollywood's TCL Chinese Theatre,(SId) Grauman,1,0
7461,2017-02-06,Lisa Schlitt game 7.,Double Jeopardy,"(6, 4)",NATIONAL MUSEUM OF AFRICAN-AMERICAN HISTORY AND CULTURE,10,"(1600,)",False,"(Alex delivers the clue from the National Museum of African American History and Culture in Washington, D.C.)  ""Our feet are tired, but our souls are rested"", said Martin Luther King, and then soaked his feet in the bucket on display here after leading thousands on a 5-day, 54 mile freedom march from Selma to the steps of the Capitol in this city",Montgomery,1,0
7461,2017-02-06,Lisa Schlitt game 7.,Double Jeopardy,"(1, 5)",BROADWAY SHOWS IN LATIN,20,"(2000,)",False,"""Caligae Torquentes""",Kinky Boots,0,3
7461,2017-02-06,Lisa Schlitt game 7.,Double Jeopardy,"(2, 5)",VENICE,25,"(2000,)",False,The Museum of Glass Art in the Giustinian Palace chronicles this nearby island's glassmaking history,Murano,0,3
7461,2017-02-06,Lisa Schlitt game 7.,Double Jeopardy,"(3, 5)",ALLITERATIVE 2-WORD TERMS,5,"(2000,)",False,Alliterative synonym for a shaman,a medicine man,0,3
7461,2017-02-06,Lisa Schlitt game 7.,Double Jeopardy,"(4, 5)",CLASSICAL MUSIC,29,"(2000,)",False,"In a performance of this 1931 suite, the percussionist needs coconut shells to imitate a burro on the trail",Grand Canyon Suite,1,0
7461,2017-02-06,Lisa Schlitt game 7.,Double Jeopardy,"(5, 5)","HARD ""G""",17,"(2000,)",False,Japanese dumplings,gyoza,1,0
7461,2017-02-06,Lisa Schlitt game 7.,Double Jeopardy,"(6, 5)",NATIONAL MUSEUM OF AFRICAN-AMERICAN HISTORY AND CULTURE,11,"(2000,)",False,"(Alex delivers the clue from the National Museum of African American History and Culture in Washington, D.C.)  The tape recorder was used by this man, whose ideas for black activism couldn't be contained by the Nation of Islam, leading to the sad correctness of his prediction in his autobiography that, ""I, too, will die by violence""",Malcolm X,1,0
7461,2017-02-06,Lisa Schlitt game 7.,Final Jeopardy,"(1, 1)",MYTHOLOGICAL NAMES,0,"(9800, 13000, 399)",False,"With depths of up to 30,000 feet, ocean trenches make up a zone named for this brother of Poseidon & his domain",Hades,0,3
