epNum,airDate,extra_info,round_name,coord,category,order,value,daily_double,question,answer,correctAttempts,wrongAttempts
7495,2017-03-24,,Jeopardy,"(1, 1)",ART & THE BIBLE,13,"(200,)",False,"Here, Fra Angelico depicts this happening to Adam & Eve, like students who've misbehaved at school",banishment (or being expelled from the garden),1,0
7495,2017-03-24,,Jeopardy,"(2, 1)",STATE,20,"(200,)",False,Wisconsin named this type of cow such as Holstein its state domestic animal & milks it for all it's worth,a dairy cow,1,0
7495,2017-03-24,,Jeopardy,"(3, 1)","OH, THE HORROR!",24,"(200,)",False,In the original film it's the night in 1963 when 6-year-old Michael Myers stabbed his sister to death,Halloween,1,0
7495,2017-03-24,,Jeopardy,"(4, 1)","THE ""LONG"" & THE ""SHORT"" OF IT",1,"(200,)",False,Thermal underwear,long johns,1,0
7495,2017-03-24,,Jeopardy,"(5, 1)",GREETINGS,14,"(200,)",False,Bear is an enthusiastic type of this greeting,a hug,1,0
7495,2017-03-24,,Jeopardy,"(6, 1)",WHAT'S IN YOUR POCKET?,9,"(200,)",False,"One of these 5-letter drives so when we get to your house, I can show you thousands of photos of my cats",a flash drive,1,0
7495,2017-03-24,,Jeopardy,"(1, 2)",ART & THE BIBLE,16,"(400,)",False,"2 ancient sculptures at the Cleveland Museum of Art show him being ""swallowed"" & ""cast up""",Jonah,1,0
7495,2017-03-24,,Jeopardy,"(2, 2)",STATE,19,"(400,)",False,The back of Virginia's state quarter shows 3 ships landing at this spot in 1607,Jamestown,1,0
7495,2017-03-24,,Jeopardy,"(3, 2)","OH, THE HORROR!",26,"(400,)",False,"""Roanoke"", about a haunted farm house in North Carolina, is the sixth season of this FX anthology",American Horror Story,1,0
7495,2017-03-24,,Jeopardy,"(4, 2)","THE ""LONG"" & THE ""SHORT"" OF IT",2,"(400,)",False,"When it's Girl Scout cookie time, stock up on Trefoils, this type of cookie",shortbread,1,0
7495,2017-03-24,,Jeopardy,"(5, 2)",GREETINGS,15,"(400,)",False,"In 2014 Maori leaders in this nation greeted the Duchess of Cambridge with the traditional hongi, touching noses",New Zealand,1,0
7495,2017-03-24,,Jeopardy,"(6, 2)",WHAT'S IN YOUR POCKET?,10,"(400,)",False,This 6-letter synonym for a talisman that I carry for good luck & to ward off evil,an amulet,1,0
7495,2017-03-24,,Jeopardy,"(1, 3)",ART & THE BIBLE,17,"(600,)",False,"""The Penitent"" this woman is the subject of a painting by van Dyck",Mary Magdalene,1,0
7495,2017-03-24,,Jeopardy,"(2, 3)",STATE,4,"(600,)",False,"Though today we think of it as Midwestern, Ohio was the first state carved out of this territory",the Northwest Territory,1,0
7495,2017-03-24,,Jeopardy,"(3, 3)","OH, THE HORROR!",27,"(600,)",False,Both a 1999 film & its 2016 sequel feature found footage exploring this title figure in the Maryland woods,The Blair Witch Project,1,0
7495,2017-03-24,,Jeopardy,"(4, 3)","THE ""LONG"" & THE ""SHORT"" OF IT",3,"(600,)",False,MLB's Carlos Correa & Corey Seager,shortstops,1,0
7495,2017-03-24,,Jeopardy,"(5, 3)",GREETINGS,21,"(600,)",False,"If you're eager to receive a guest you proverbially ""put out"" this item with a 7-letter word on it",the welcome mat,1,0
7495,2017-03-24,,Jeopardy,"(6, 3)",WHAT'S IN YOUR POCKET?,11,"(600,)",False,"I carry a flask full of this cinnamon whisky  that ""tastes like heaven"" & ""burns like hell""",Fireball,1,0
7495,2017-03-24,,Jeopardy,"(1, 4)",ART & THE BIBLE,18,"(800,)",False,At the Hermitage in Russia is Rembrandt's painting of David saying goodbye to this friend & son of Saul,Jonathan,1,0
7495,2017-03-24,,Jeopardy,"(2, 4)",STATE,5,"(800,)",False,"Bradford, Brevard & Broward are all counties in this state",Florida,1,0
7495,2017-03-24,,Jeopardy,"(3, 4)","OH, THE HORROR!",29,"(800,)",False,"""What's Wrong With Norman"" was an episode of this drama on A&E",Bates Motel,1,0
7495,2017-03-24,,Jeopardy,"(4, 4)","THE ""LONG"" & THE ""SHORT"" OF IT",7,"(800,)",False,"Stephen King's ""The Glass Floor"" or ""Graveyard Shift""",short stories,1,0
7495,2017-03-24,,Jeopardy,"(5, 4)",GREETINGS,22,"(1200,)",True,British restraint doesn't get much more restrained than this 4-word greeting used in Africa in 1871,"""Dr. Livingstone, I presume?""",0,1
7495,2017-03-24,,Jeopardy,"(6, 4)",WHAT'S IN YOUR POCKET?,12,"(800,)",False,"Glad you asked; it's a fountain pen from this ""Alpine"" company with an 18K gold nib & a diamond cap-top",Montblanc,1,0
7495,2017-03-24,,Jeopardy,"(1, 5)",ART & THE BIBLE,25,"(1000,)",False,The painting seen here depicts this event found in Matthew,the Sermon on the Mount,0,3
7495,2017-03-24,,Jeopardy,"(2, 5)",STATE,6,"(1000,)",False,New York's 445-mile border with Canada includes all 36 miles of this river,the Niagara River,0,3
7495,2017-03-24,,Jeopardy,"(3, 5)","OH, THE HORROR!",30,"(1000,)",False,"Ghostface, the white-masked killer in this 1996 film, asks, ""What's your favorite scary movie?",Scream,1,0
7495,2017-03-24,,Jeopardy,"(4, 5)","THE ""LONG"" & THE ""SHORT"" OF IT",8,"(1000,)",False,"This phrase meaning ""old"" alludes to a horse's gums receding as it ages",long in the tooth,1,0
7495,2017-03-24,,Jeopardy,"(5, 5)",GREETINGS,23,"(1000,)",False,Spoken greetings in more than 50 languages were sent along on this craft & its twin launched in 1977,Voyager,0,3
7495,2017-03-24,,Jeopardy,"(6, 5)",WHAT'S IN YOUR POCKET?,28,"(1000,)",False,The keys to my 911 Turbo one of these,a Porsche,1,0
7495,2017-03-24,,Double Jeopardy,"(1, 1)",LITERARY EDINBURGH,6,"(400,)",False,"She finished writing the first ""Harry Potter"" book while living in Edinburgh",Rowling,1,0
7495,2017-03-24,,Double Jeopardy,"(2, 1)","""BETA"" TEST",7,"(400,)",False,"AKA Provitamin A, it gives a bright orange color to vegetables",beta-Carotene,1,0
7495,2017-03-24,,Double Jeopardy,"(3, 1)",BLUESY MUSIC,19,"(400,)",False,The standard blues musical form is one of this many bars,twelve,0,3
7495,2017-03-24,,Double Jeopardy,"(4, 1)",OIL!,29,"(400,)",False,"With over 250 billion barrels of crude reserves, this Mideast nation is the world's No. 1 oil exporter",Saudi Arabia,1,0
7495,2017-03-24,,Double Jeopardy,"(5, 1)",FAMOUS AMERICAN WOMEN,1,"(400,)",False,"In 2016, 40 years after she became a ""Today"" show regular, she became the new host of CBS' ""Sunday Morning""",Jane Pauley,1,0
7495,2017-03-24,,Double Jeopardy,"(6, 1)",DIFFERING BY A VOWEL,20,"(400,)",False,A prophetic sign & a prayer ending,omen and amen,1,0
7495,2017-03-24,,Double Jeopardy,"(1, 2)",LITERARY EDINBURGH,11,"(800,)",False,It's elementary! Here's this author who was born in Edinburgh,(Sir Arthur Conan) Doyle,1,0
7495,2017-03-24,,Double Jeopardy,"(2, 2)","""BETA"" TEST",8,"(800,)",False,These drugs that suppress reactions in heart cells are prescribed to treat anxiety & angina,beta blockers,1,0
7495,2017-03-24,,Double Jeopardy,"(3, 2)",BLUESY MUSIC,25,"(800,)",False,"Legend has it, having forgotten about a 1924 deadline, George Gershwin wrote this piece in 3 weeks","""Rhapsody In Blue""",1,0
7495,2017-03-24,,Double Jeopardy,"(4, 2)",OIL!,17,"(800,)",False,In oil exploration geologists look for these compounds that consist only of the 2 elements symbolized by H & C,hydrocarbons,1,1
7495,2017-03-24,,Double Jeopardy,"(5, 2)",FAMOUS AMERICAN WOMEN,2,"(800,)",False,"In 1889 journalist Nellie Bly tried to beat the record of Phileas Fogg in this novel & did, by more than a week",Around the World in Eighty Days,1,0
7495,2017-03-24,,Double Jeopardy,"(6, 2)",DIFFERING BY A VOWEL,14,"(800,)",False,Large & heavy & a written message or letter,massive and missive,1,0
7495,2017-03-24,,Double Jeopardy,"(1, 3)",LITERARY EDINBURGH,22,"(1200,)",False,"In this time-traveling series, Jamie & Claire Fraser visit Bonnie Prince Charlie at Edinburgh's palace of Holyroodhouse",Outlander,1,0
7495,2017-03-24,,Double Jeopardy,"(2, 3)","""BETA"" TEST",9,"(1200,)",False,It's the second-brightest star in a constellation named for a man-horse hybrid,Beta Centauri,1,0
7495,2017-03-24,,Double Jeopardy,"(3, 3)",BLUESY MUSIC,26,"(1200,)",False,"Before going solo, Teddy Pendergrass was the lead singer of Harold Melvin & this group",the Blue Notes,1,0
7495,2017-03-24,,Double Jeopardy,"(4, 3)",OIL!,13,"(1200,)",False,The jackknife type of this tower over an oil well comes in 2 sections that are assembled on site,an oil derrick,0,3
7495,2017-03-24,,Double Jeopardy,"(5, 3)",FAMOUS AMERICAN WOMEN,3,"(1200,)",False,"This historian wrote the memoir ""Wait Till Next Year"" about her childhood as Brooklyn Dodgers fan Doris Kearns",Doris Kearns Goodwin,1,0
7495,2017-03-24,,Double Jeopardy,"(6, 3)",DIFFERING BY A VOWEL,15,"(1200,)",False,The two Greek letters seen here,epsilon and upsilon,1,0
7495,2017-03-24,,Double Jeopardy,"(1, 4)",LITERARY EDINBURGH,23,"(1600,)",False,This Irvine Welsh novel about heroin addicts in Edinburgh became a film starring Ewan McGregor,Trainspotting,1,0
7495,2017-03-24,,Double Jeopardy,"(2, 4)","""BETA"" TEST",10,"(1600,)",False,It was founded at the College of William & Mary in 1776; are you a member?,Phi Beta Kappa,1,0
7495,2017-03-24,,Double Jeopardy,"(3, 4)",BLUESY MUSIC,27,"(1600,)",False,"He retitled his 1909 song ""Mr. Crump"" ""Memphis Blues"" & the rest is history",W.C. Handy,1,1
7495,2017-03-24,,Double Jeopardy,"(4, 4)",OIL!,18,"(1600,)",False,"The site of a major oil leak in 1979, the Bay of Campeche is the southernmost part of this body of water",the Gulf of Mexico,0,3
7495,2017-03-24,,Double Jeopardy,"(5, 4)",FAMOUS AMERICAN WOMEN,4,"(2000,)",True,"After the Battle of Cedar Mountain in 1862, a surgeon wrote, ""If heaven ever sent out a(n)...angel,"" she ""must be one""",Clara Barton,1,0
7495,2017-03-24,,Double Jeopardy,"(6, 4)",DIFFERING BY A VOWEL,16,"(2000,)",True,To give an order & to give praise,command and commend,1,0
7495,2017-03-24,,Double Jeopardy,"(1, 5)",LITERARY EDINBURGH,24,"(2000,)",False,"Muriel Spark wrote about ""The Prime of"" this title miss, ""An Edinburgh Spinster""",Miss Jean Brodie,1,0
7495,2017-03-24,,Double Jeopardy,"(2, 5)","""BETA"" TEST",12,"(2000,)",False,Electron emission & positron emission are types of this radioactive disintegration,beta decay,0,3
7495,2017-03-24,,Double Jeopardy,"(3, 5)",BLUESY MUSIC,28,"(2000,)",False,"The 1970 hit song ""Roadhouse Blues"" by this band warns ""Keep your eyes on the road, your hands upon the wheel""",The Doors,0,3
7495,2017-03-24,,Double Jeopardy,"(4, 5)",OIL!,30,"(2000,)",False,"Last name of Erle, who started an oil well services firm in 1919 that spread worldwide, including Iraq",Halliburton,0,3
7495,2017-03-24,,Double Jeopardy,"(5, 5)",FAMOUS AMERICAN WOMEN,5,"(2000,)",False,This New York-born Supreme Court justice was the first female U.S. Solicitor General,Elena Kagan,0,3
7495,2017-03-24,,Double Jeopardy,"(6, 5)",DIFFERING BY A VOWEL,21,"(2000,)",False,A vow to do something & the basis of a theory or plot,promise and premise,0,3
7495,2017-03-24,,Final Jeopardy,"(1, 1)",NATIVE AMERICAN PLACE NAMES,0,"(1800, 2000, 5601)",False,You have to go through military security to reach this town with a Marine base on 3 sides & the Potomac on the other,Quantico,1,2
