epNum,airDate,extra_info,round_name,coord,category,order,value,daily_double,question,answer,correctAttempts,wrongAttempts
7536,2017-05-22,,Jeopardy,"(1, 1)",DGA FEATURE FILM AWARD WINNERS,17,"(200,)",False,2016: Damien Chazelle for this musical,La La Land,1,0
7536,2017-05-22,,Jeopardy,"(2, 1)",THUNDER & LIGHTNING,12,"(200,)",False,"Familiar name for a roof-mounted air terminal, so called because it's a terminal for the electricity in the air",a lightning rod,1,0
7536,2017-05-22,,Jeopardy,"(3, 1)",BOOKS,1,"(200,)",False,"E.L. James added to her oeuvre with ""Grey: Fifty Shades of Grey as Told by"" him",Christian Grey,1,0
7536,2017-05-22,,Jeopardy,"(4, 1)",WORDS WITH SILENT LETTERS,30,"(200,)",False,50 percent,half,1,0
7536,2017-05-22,,Jeopardy,"(5, 1)",BEERS BY STATE,3,"(200,)",False,Samuel Adams,Massachusetts,1,0
7536,2017-05-22,,Jeopardy,"(6, 1)",THE BOLD AND THE BEAUTIFUL,10,"(200,)",False,"(Alley Mills and Dick Christie give the clue as Pamela and Charlie from The Bold and the Beautiful.)""You go ahead, Charlie, I'll be home in a few hours.""""Pammy, do I need to steal you away like this beautiful Grecian woman abducted by Paris around 1100 B.C.""",Helen of Troy,1,0
7536,2017-05-22,,Jeopardy,"(1, 2)",DGA FEATURE FILM AWARD WINNERS,18,"(400,)",False,"1995: Ron Howard, who must have been over the moon",Apollo 13,1,0
7536,2017-05-22,,Jeopardy,"(2, 2)",THUNDER & LIGHTNING,13,"(400,)",False,"Ar-Ra'd, the 13th Surah or chapter of this holy book, is also known as ""The Thunder""",the Koran,1,0
7536,2017-05-22,,Jeopardy,"(3, 2)",BOOKS,2,"(400,)",False,"Chapter 1 of this novel says, ""For the record... I didn't die on Sol 6. Certainly the rest of the crew thought I did""",The Martian,1,0
7536,2017-05-22,,Jeopardy,"(4, 2)",WORDS WITH SILENT LETTERS,29,"(400,)",False,"In the Bible No. 137 begins, ""By the rivers of Babylon""",Psalm,1,0
7536,2017-05-22,,Jeopardy,"(5, 2)",BEERS BY STATE,4,"(400,)",False,Sierra Nevada Pale Ale,California,1,0
7536,2017-05-22,,Jeopardy,"(6, 2)",THE BOLD AND THE BEAUTIFUL,22,"(400,)",False,"(Karla Mosley and Jacob Young give the clue as Maya and Rick from The Bold and the Beautiful.)""Rick, if you keep obsessing about taking over the company, you're gonna make yourself sick.""""No, Maya, it's time to strike like this bold U.S. commander during the Korean War who cut off & surrounded the enemy with his brilliant Inchon landing""",(Douglas) MacArthur,1,0
7536,2017-05-22,,Jeopardy,"(1, 3)",DGA FEATURE FILM AWARD WINNERS,19,"(600,)",False,"2013: Alfonso Cuaron, who must have been at least nearer to the moon",Gravity,1,1
7536,2017-05-22,,Jeopardy,"(2, 3)",THUNDER & LIGHTNING,14,"(600,)",False,"This NFL team's mascot, an Arabian horse named Thunder, sprints down the sidelines when the team scores",the Denver Broncos,1,0
7536,2017-05-22,,Jeopardy,"(3, 3)",BOOKS,7,"(600,)",False,"In 2016 this independent senator released ""Our Revolution: A Future to Believe in""",Bernie Sanders,1,0
7536,2017-05-22,,Jeopardy,"(4, 3)",WORDS WITH SILENT LETTERS,28,"(600,)",False,The day that gets you over the hump,Wednesday,1,0
7536,2017-05-22,,Jeopardy,"(5, 3)",BEERS BY STATE,5,"(600,)",False,Jai Alai IPA,Florida,1,0
7536,2017-05-22,,Jeopardy,"(6, 3)",THE BOLD AND THE BEAUTIFUL,23,"(600,)",False,"Last name of Floria, the bold & beautiful title diva in an opera by Puccini",Tosca,0,3
7536,2017-05-22,,Jeopardy,"(1, 4)",DGA FEATURE FILM AWARD WINNERS,20,"(800,)",False,"2009: Kathryn Bigelow, who is the bomb",The Hurt Locker,1,0
7536,2017-05-22,,Jeopardy,"(2, 4)",THUNDER & LIGHTNING,15,"(800,)",False,"On summer nights watch the flashes of the lightning bugs, better known as these",fireflies,1,0
7536,2017-05-22,,Jeopardy,"(3, 4)",BOOKS,8,"(800,)",False,"A review said ancestors of this Yann Martel novel include ""Gulliver's Travels"" & ""Robinson Crusoe""",the Life of Pi,1,0
7536,2017-05-22,,Jeopardy,"(4, 4)",WORDS WITH SILENT LETTERS,27,"(800,)",False,Total throne time for a monarch,reign,1,0
7536,2017-05-22,,Jeopardy,"(5, 4)",BEERS BY STATE,6,"(800,)",False,Yuengling,Pennsylvania,1,0
7536,2017-05-22,,Jeopardy,"(6, 4)",THE BOLD AND THE BEAUTIFUL,24,"(800,)",False,"(Katherine Kelly Lang and Don Diamont give the clue as Brooke and Bill from The Bold and the Beautiful.) ""Bill, you've got to concentrate & do the right thing.""""You expect me to concentrate, when you walk in the room like this Greek goddess of love walking ashore from the sea in all your radiant glory""",Aphrodite,1,0
7536,2017-05-22,,Jeopardy,"(1, 5)",DGA FEATURE FILM AWARD WINNERS,21,"(1000,)",False,"2010: Tom Hooper, who then had to give a non-royal one",The King\'s Speech,1,0
7536,2017-05-22,,Jeopardy,"(2, 5)",THUNDER & LIGHTNING,16,"(1000,)",False,"Lying on the shore of Lake Superior, this Ontario city was created in 1970 from the twin cities of Port Arthur & Fort William",Thunder Bay,0,3
7536,2017-05-22,,Jeopardy,"(3, 5)",BOOKS,9,"(1200,)",True,"William Strunk said this book ""aims to give in brief space the principal requirements of plain English"" form",The Elements of Style,1,0
7536,2017-05-22,,Jeopardy,"(4, 5)",WORDS WITH SILENT LETTERS,26,"(1000,)",False,This 9-letter type of episode involves a break from reality & may include hallucinations & delusions,psychotic break,1,0
7536,2017-05-22,,Jeopardy,"(5, 5)",BEERS BY STATE,11,"(1000,)",False,Shiner Bock,Texas,1,0
7536,2017-05-22,,Jeopardy,"(6, 5)",THE BOLD AND THE BEAUTIFUL,25,"(1000,)",False,"(Heather Tom and Thorsten Kaye give the clue as Katie and Ridge from The Bold and the Beautiful.) ""Ridge, why are you still concealing the truth?"" ""Because, Katie, it is our secret to reveal, no one else's. & I'll stand behind that like Leonidas & his 300 men at this famous mountain pass in the 5th century B.C.""",Thermopylae,1,0
7536,2017-05-22,,Double Jeopardy,"(1, 1)",RUSSIAN CULTURE,7,"(400,)",False,"This epic novel was first published in its entirety in 1869 under the title ""Voyna i Mir""",War and Peace,1,0
7536,2017-05-22,,Double Jeopardy,"(3, 1)",ASIAN-AMERICAN PERFORMERS,21,"(400,)",False,"In 2004 New Jersey-born Kal Penn played Kumar, hungry for this title place for some reason",White Castle,1,0
7536,2017-05-22,,Double Jeopardy,"(4, 1)",WORLD TOUR,8,"(400,)",False,"The 4,500-year-old pyramids of Giza are today just 10 minutes from the center of this capital",Cairo,1,0
7536,2017-05-22,,Double Jeopardy,"(5, 1)",19th CENTURY CONGRESSMEN,10,"(400,)",False,"Before dealing with the wild frontier, Davy... Davy Crockett dealt with Congress for this southern state",Tennessee,1,0
7536,2017-05-22,,Double Jeopardy,"(6, 1)",ENDS WITH A DOUBLE VOWEL,16,"(400,)",False,"From the French for a tuft of hair, it's a man's wig",a toupee,1,0
7536,2017-05-22,,Double Jeopardy,"(1, 2)",RUSSIAN CULTURE,6,"(800,)",False,"Made of gold and enamel, the hen egg was the first of some 50 creations he produced for the imperial family beginning in 1885",(Peter Carl) Fabergé,1,0
7536,2017-05-22,,Double Jeopardy,"(2, 2)",WEEDS,15,"(800,)",False,"Some scientists believe this ""crazy"" herb is poisonous because of the large amounts of selenium absorbed from the soil",locoweed,1,0
7536,2017-05-22,,Double Jeopardy,"(3, 2)",ASIAN-AMERICAN PERFORMERS,22,"(800,)",False,Maggie Q fulfilled the second part of this 2007 Bruce Willis title after plunging down an elevator shaft in an SUV,Live Free or Die Hard,0,3
7536,2017-05-22,,Double Jeopardy,"(4, 2)",WORLD TOUR,4,"(800,)",False,Rio de Janeiro's version of this several-day pre-Lenten celebration has been called the biggest party in the world,Carnival,1,0
7536,2017-05-22,,Double Jeopardy,"(5, 2)",19th CENTURY CONGRESSMEN,17,"(800,)",False,There's no debating Illinois sent this state Supreme Court judge to the House in 1843,(Stephen) Douglas,1,0
7536,2017-05-22,,Double Jeopardy,"(6, 2)",ENDS WITH A DOUBLE VOWEL,13,"(800,)",False,One piece of dermis art,tattoo,1,0
7536,2017-05-22,,Double Jeopardy,"(1, 3)",RUSSIAN CULTURE,5,"(1200,)",False,"The 1980 Oscar for Best Foreign Language Film went to the Soviet romcom ""Moscow Does Not Believe in"" these",tears,0,3
7536,2017-05-22,,Double Jeopardy,"(2, 3)",WEEDS,14,"(1200,)",False,"One of these hay fever plants, Ambrosia artemisiifolia, can produce 1 billion pollen grains",ragweed,0,3
7536,2017-05-22,,Double Jeopardy,"(3, 3)",ASIAN-AMERICAN PERFORMERS,23,"(1200,)",False,"As Tom Haverford on ""Parks & Rec"", he said, ""I have no interest in art. Let me clarify--I have no interest in non-nude images""",Aziz Ansari,1,0
7536,2017-05-22,,Double Jeopardy,"(4, 3)",WORLD TOUR,1,"(3000,)",True,"The Coliseum is one structure bolstering this nickname for Rome, suggesting it'll endure for all time",the Eternal City,1,0
7536,2017-05-22,,Double Jeopardy,"(5, 3)",19th CENTURY CONGRESSMEN,18,"(1200,)",False,"James G. Blaine, former co-owner of the Kennebec Journal, repped this state",Maine,1,1
7536,2017-05-22,,Double Jeopardy,"(6, 3)",ENDS WITH A DOUBLE VOWEL,9,"(1200,)",False,Hawaiian housedress,a muumuu,1,0
7536,2017-05-22,,Double Jeopardy,"(1, 4)",RUSSIAN CULTURE,25,"(1600,)",False,"Rimsky-Korsakov's opera ""The Tale of Tsar Saltan"" features this famous piece heard here",Flight of the Bumblebee,1,0
7536,2017-05-22,,Double Jeopardy,"(3, 4)",ASIAN-AMERICAN PERFORMERS,24,"(1600,)",False,This part-Korean singer who goes by a name & an initial fronts the Yeah Yeah Yeahs,Karen O.,0,3
7536,2017-05-22,,Double Jeopardy,"(4, 4)",WORLD TOUR,3,"(1600,)",False,"In 1406 the Hall of Supreme Harmony, once China's highest structure, was built by this dynasty known for smaller scale art",the Ming Dynasty,1,0
7536,2017-05-22,,Double Jeopardy,"(5, 4)",19th CENTURY CONGRESSMEN,19,"(2000,)",True,This man said that Massachusetts electing him to the House pleased him more than winning the presidency,John Quincy Adams,1,0
7536,2017-05-22,,Double Jeopardy,"(6, 4)",ENDS WITH A DOUBLE VOWEL,11,"(1600,)",False,A low droning wooden tube instrument of the Aborigines,didgeridoo,1,0
7536,2017-05-22,,Double Jeopardy,"(1, 5)",RUSSIAN CULTURE,26,"(2000,)",False,"The ""Father of Russian Literature"", this poet & dramatist was mortally wounded in a duel in 1837",Pushkin,1,0
7536,2017-05-22,,Double Jeopardy,"(2, 5)",WEEDS,28,"(2000,)",False,"This ""stinging"" weed is sold as a diuretic & as an herbal drug for prostate diseases",stinging nettle,1,0
7536,2017-05-22,,Double Jeopardy,"(3, 5)",ASIAN-AMERICAN PERFORMERS,27,"(2000,)",False,Constance Wu has recently arrived on & is all aboard with this ABC sitcom as Jessica Huang,Fresh Off the Boat,1,0
7536,2017-05-22,,Double Jeopardy,"(4, 5)",WORLD TOUR,2,"(2000,)",False,"London has not the Left Bank but this artsy bank, where in 1999 the London Eye went up and changed the iconic skyline",the South Bank,0,3
7536,2017-05-22,,Double Jeopardy,"(5, 5)",19th CENTURY CONGRESSMEN,20,"(2000,)",False,He was a congressman from Georgia before & after his stint as vice president of the Confederacy,(Alexander) Stephens,1,0
7536,2017-05-22,,Double Jeopardy,"(6, 5)",ENDS WITH A DOUBLE VOWEL,12,"(2000,)",False,Delicate ornamentation in gold or silver wire,filigree,1,0
7536,2017-05-22,,Final Jeopardy,"(1, 1)",THE BRITISH EMPIRE,0,"(1200, 16199, 16205)",False,"The city that some 19th century Englishmen called ""Caranjee"" is now the biggest city in this country",Pakistan,2,1
