epNum,airDate,extra_info,round_name,coord,category,order,value,daily_double,question,answer,correctAttempts,wrongAttempts
7554,2017-06-15,,Jeopardy,"(1, 1)","CHARLIE BROWN, THIS IS YOUR LIFE",6,"(200,)",False,In Snoopy you have not only a loyal pet but a flying ace in this war,the First World War,1,0
7554,2017-06-15,,Jeopardy,"(2, 1)",STATE THE CITY,1,"(200,)",False,"Leavenworth, named for Colonel Henry",Kansas,1,0
7554,2017-06-15,,Jeopardy,"(3, 1)",WATCH OUT FOR SPIDERS,26,"(200,)",False,"The bite of this spider named for a town in Italy was once thought to make the victim cry, skip & dance",a tarantula,1,0
7554,2017-06-15,,Jeopardy,"(4, 1)","""NME""s LIST",21,"(200,)",False,"2-word Latin term meaning ""to the memory of""",in memoriam,1,0
7554,2017-06-15,,Jeopardy,"(5, 1)",A HERO,11,"(200,)",False,In 1969 he received a hero's welcome home after taking man's first steps on the moon,Neil Armstrong,1,0
7554,2017-06-15,,Jeopardy,"(6, 1)",AIN'T NOTHING BUT A SANDWICH,16,"(200,)",False,"With the addition of this ingredient, your BLT becomes a BLAT",avocado,1,0
7554,2017-06-15,,Jeopardy,"(1, 2)","CHARLIE BROWN, THIS IS YOUR LIFE",7,"(400,)",False,"Like your creator's dad, you father has this profession, perhaps explaining your unusual coif",barber,1,0
7554,2017-06-15,,Jeopardy,"(2, 2)",STATE THE CITY,2,"(400,)",False,"Aurora, elevation 5,435 feet",Colorado,1,0
7554,2017-06-15,,Jeopardy,"(3, 2)",WATCH OUT FOR SPIDERS,27,"(400,)",False,"Seen here, Eriovixia gryffindori is named for its resemblance to this Harry Potter item",the Sorting Hat,1,0
7554,2017-06-15,,Jeopardy,"(4, 2)","""NME""s LIST",22,"(400,)",False,"Heart Mountain in Wyoming was one of these World War II ""camps"" for Japanese Americans",internment,1,0
7554,2017-06-15,,Jeopardy,"(5, 2)",A HERO,12,"(400,)",False,This legendary bowman is a national hero of Switzerland,William Tell,1,0
7554,2017-06-15,,Jeopardy,"(6, 2)",AIN'T NOTHING BUT A SANDWICH,17,"(400,)",False,This sandwich whose name reflects its messiness evolved from the loose meat sandwich of the Midwest,a sloppy joe,1,0
7554,2017-06-15,,Jeopardy,"(1, 3)","CHARLIE BROWN, THIS IS YOUR LIFE",8,"(600,)",False,"Siblings are like built-in pals & this one arrived to ask meaningful questions like ""Who cares?""",Sally,1,2
7554,2017-06-15,,Jeopardy,"(2, 3)",STATE THE CITY,3,"(600,)",False,"Riverside, on the Santa Ana River",California,1,0
7554,2017-06-15,,Jeopardy,"(3, 3)",WATCH OUT FOR SPIDERS,28,"(600,)",False,"Like the shellfish for which they are named, these spiders are known to walk sideways & backwards",a crab,1,0
7554,2017-06-15,,Jeopardy,"(4, 3)","""NME""s LIST",23,"(600,)",False,"That's this, amusement provided by performers",entertainment,1,0
7554,2017-06-15,,Jeopardy,"(5, 3)",A HERO,13,"(600,)",False,"On Jan. 15, 2009 he told passengers to ""brace for impact"" before safely landing his plane on the Hudson river",(Sully) Sullenberger,1,0
7554,2017-06-15,,Jeopardy,"(6, 3)",AIN'T NOTHING BUT A SANDWICH,18,"(600,)",False,The pit viper at this ball team's Chase Field isn't really snake but a battered & deep-fried pork sandwich,the (Arizona) Diamondbacks,1,0
7554,2017-06-15,,Jeopardy,"(1, 4)","CHARLIE BROWN, THIS IS YOUR LIFE",9,"(800,)",False,This acquaintance of yours had only a passing acquaintance with soap & water,Pig Pen,1,0
7554,2017-06-15,,Jeopardy,"(2, 4)",STATE THE CITY,4,"(800,)",False,"Greensboro, in Guilford County",North Carolina,1,0
7554,2017-06-15,,Jeopardy,"(3, 4)",WATCH OUT FOR SPIDERS,29,"(800,)",False,"(Jimmy of the Clue Crew shows a spider on the monitor.) Black widows' bites are rarely fatal to humans, but the venom can produce temporary paralysis in this muscle, making breathing difficult",the diaphragm,1,0
7554,2017-06-15,,Jeopardy,"(4, 4)","""NME""s LIST",24,"(800,)",False,"It's the ""E"" in a government agency established in 1970",environmental,1,0
7554,2017-06-15,,Jeopardy,"(5, 4)",A HERO,14,"(800,)",False,"After 2 brothers died fighting in France in 1915, he headed for Arabia to become a guerrilla leader against the Turks",Lawrence (of Arabia),1,0
7554,2017-06-15,,Jeopardy,"(6, 4)",AIN'T NOTHING BUT A SANDWICH,19,"(2000,)",True,"Served on a warm baguette & filled with grilled meats & pickled vegetables, banh mi is a sandwich from this country",Vietnam,1,0
7554,2017-06-15,,Jeopardy,"(1, 5)","CHARLIE BROWN, THIS IS YOUR LIFE",10,"(1000,)",False,"We do have to ask--why did you choose bossy, crabby Lucy as this professional for help?",psychiatrist,1,0
7554,2017-06-15,,Jeopardy,"(2, 5)",STATE THE CITY,5,"(1000,)",False,"Henderson, incorporated 1953",Nevada,1,0
7554,2017-06-15,,Jeopardy,"(3, 5)",WATCH OUT FOR SPIDERS,30,"(1000,)",False,"Garden spiders are part of the spider group known as these ""weavers"" due to the oval shape of their webs",orb weavers,0,3
7554,2017-06-15,,Jeopardy,"(4, 5)","""NME""s LIST",25,"(1000,)",False,"2-word term for speaking in accordance with an official position; politicians try to ""stay"" there",on message,1,0
7554,2017-06-15,,Jeopardy,"(5, 5)",A HERO,15,"(1000,)",False,His Olympic records in track & field during the 1920s made him a national hero of Finland,Paavo Nurmi,1,0
7554,2017-06-15,,Jeopardy,"(6, 5)",AIN'T NOTHING BUT A SANDWICH,20,"(1000,)",False,"From Kentucky, the hot brown is an open-faced turkey & bacon sandwich topped with this cheesy bechamel sauce",Mornay,0,3
7554,2017-06-15,,Double Jeopardy,"(1, 1)",ANCIENT ROME,11,"(400,)",False,"A typical Roman home had a cubiculum, or bedroom & a culina, this",a kitchen,1,0
7554,2017-06-15,,Double Jeopardy,"(2, 1)",JUST JOSHING,26,"(400,)",False,Josh Holloway survived a plane crash & 6 seasons as Sawyer on this TV series,Lost,1,0
7554,2017-06-15,,Double Jeopardy,"(3, 1)",U.S. MUSEUMS,4,"(400,)",False,"Catch a wave to Oceanside, California, where you can visit a museum devoted to this sport",surfing,1,0
7554,2017-06-15,,Double Jeopardy,"(4, 1)",NONFICTION,15,"(400,)",False,"""Reason, even science, was what Billy Beane was intent on bringing to baseball"" is a line from this book",Moneyball,1,0
7554,2017-06-15,,Double Jeopardy,"(5, 1)",9-LETTER WORDS,1,"(400,)",False,Don't be this type of person who sounds like a type of pest and is,a litterbug,1,0
7554,2017-06-15,,Double Jeopardy,"(6, 1)",MINORITY REPORT,21,"(400,)",False,"Bosnia & Herzegovina is about half Bosniak, 30% Serb & 15% this (not Herzegovinak)",Croat,1,0
7554,2017-06-15,,Double Jeopardy,"(1, 2)",ANCIENT ROME,12,"(800,)",False,"This first emperor overhauled all aspects of Roman life in his regime, which he called the principate",Augustus,1,1
7554,2017-06-15,,Double Jeopardy,"(2, 2)",JUST JOSHING,27,"(800,)",False,"In 2016 this crooner & sometime actor made his Broadway debut in ""Natasha, Pierre & the Great Comet of 1812""",Josh Groban,1,0
7554,2017-06-15,,Double Jeopardy,"(3, 2)",U.S. MUSEUMS,7,"(800,)",False,"This museum in Washington, D.C. includes a Hall of Witness & a Hall of Remembrance",the Holocaust Museum,1,0
7554,2017-06-15,,Double Jeopardy,"(4, 2)",NONFICTION,16,"(800,)",False,"Jon Krakauer's ""Into Thin Air"" tells of a tragedy at this location",Mount Everest,1,0
7554,2017-06-15,,Double Jeopardy,"(5, 2)",9-LETTER WORDS,2,"(800,)",False,"Impossible to erase or wash away, such as certain inks",indelible,1,0
7554,2017-06-15,,Double Jeopardy,"(6, 2)",MINORITY REPORT,22,"(1100,)",True,This minority group makes up about 20% of Turkey & Iraq,the Kurds,1,0
7554,2017-06-15,,Double Jeopardy,"(1, 3)",ANCIENT ROME,13,"(1200,)",False,A retiarius was a gladiator who wore very little armor & fought with a trident & this to entangle his opponent,a net,1,0
7554,2017-06-15,,Double Jeopardy,"(2, 3)",JUST JOSHING,28,"(1200,)",False,"In ""The Hunger Games"" movies, Josh Hutcherson plays this tribute & love interest of Katniss",Peeta,1,0
7554,2017-06-15,,Double Jeopardy,"(3, 3)",U.S. MUSEUMS,8,"(1200,)",False,"As you're walking the streets of this city, drop by the Republic of the Rio Grande Museum",Laredo,0,3
7554,2017-06-15,,Double Jeopardy,"(4, 3)",NONFICTION,14,"(1200,)",False,"Charles Duhigg explored ""Why We Do What We Do in Life and Business"" in ""The Power of"" this",The Power of Habit,0,3
7554,2017-06-15,,Double Jeopardy,"(5, 3)",9-LETTER WORDS,3,"(1200,)",False,"While eating barbecued ribs, it helps to have this small piece of cloth that often follows ""moist""",a towelette,1,0
7554,2017-06-15,,Double Jeopardy,"(6, 3)",MINORITY REPORT,23,"(1200,)",False,This largest minority group in Latvia is about 30% of the population,Russians,1,0
7554,2017-06-15,,Double Jeopardy,"(1, 4)",ANCIENT ROME,19,"(1600,)",False,"With a population of more than a half million, this Egyptian seaport was the second-largest city in the empire",Alexandria,1,0
7554,2017-06-15,,Double Jeopardy,"(2, 4)",JUST JOSHING,29,"(1600,)",False,"He's been heard as Olaf the snowman & seen in the FX series ""The Comedians""",Josh Gad,1,0
7554,2017-06-15,,Double Jeopardy,"(3, 4)",U.S. MUSEUMS,9,"(1600,)",False,A contemporary art museum in Pittsburgh is housed in & named for this type of factory owned by Stearns & Foster,a mattress,1,1
7554,2017-06-15,,Double Jeopardy,"(4, 4)",NONFICTION,17,"(1600,)",False,"''The Hot Zone"" by Richard Preston recounts the scary outbreak of this virus at a U.S. government facility",Ebola,1,0
7554,2017-06-15,,Double Jeopardy,"(5, 4)",9-LETTER WORDS,5,"(1500,)",True,"Teddy Roosevelt took this term from ""Pilgrim's Progress"" to refer to one who digs up scandal about famous people",muckraker,0,1
7554,2017-06-15,,Double Jeopardy,"(6, 4)",MINORITY REPORT,24,"(1600,)",False,Nepalese constitute a majority in the southern part of this country just a little strip of India away,Bhutan,0,3
7554,2017-06-15,,Double Jeopardy,"(1, 5)",ANCIENT ROME,20,"(2000,)",False,By 23 A.D. the prefect Sejanus became the sole commander of these elite protectors of the emperor,the Praetorian Guard,1,0
7554,2017-06-15,,Double Jeopardy,"(2, 5)",JUST JOSHING,30,"(2000,)",False,"At age 14, Joshua Bell, on this instrument, became the Philadelphia Orch.'s youngest-ever soloist",violin,1,0
7554,2017-06-15,,Double Jeopardy,"(3, 5)",U.S. MUSEUMS,10,"(2000,)",False,Learn about these mysterious ancestors of the Pueblo people at the Manitou cliff Dwellings & Museum in Colorado,the Anasazi,1,0
7554,2017-06-15,,Double Jeopardy,"(4, 5)",NONFICTION,18,"(2000,)",False,"Don't confuse ""Heat"" memoirist Bill Buford with this Bill who took a quirky look at English in ""The Mother Tongue""",Bill Bryson,1,0
7554,2017-06-15,,Double Jeopardy,"(5, 5)",9-LETTER WORDS,6,"(2000,)",False,A herbicide is used to kill weeds & this similar-sounding pesticide is specifically used to kill worms,vermicide,1,0
7554,2017-06-15,,Double Jeopardy,"(6, 5)",MINORITY REPORT,25,"(2000,)",False,"Related to the Inuit, they speak a different language & live on an island chain off the Alaska peninsula",the Aleuts,1,0
7554,2017-06-15,,Final Jeopardy,"(1, 1)",RECENT OSCAR WINNERS,0,"(2500, 3200, 5900)",False,"For his portrayal of a famous man born in the 1940s, he was the first actor born in the '80s to win the Best Actor Oscar",Eddie Redmayne,0,3
