epNum,airDate,extra_info,round_name,coord,category,order,value,daily_double,question,answer,correctAttempts,wrongAttempts
7655,2017-12-15,,Jeopardy,"(1, 1)",COKE SLOGANS THROUGH THE YEARS,21,"(200,)",False,"1989: ""The official soft drink of"" this season",summer,1,0
7655,2017-12-15,,Jeopardy,"(2, 1)",TREES,26,"(200,)",False,"(Kelly of the Clue Crew shows a tree on the monitor.) The tallest living tree, the coast redwood, loses its lower branches as it grows, revealing the slender trunk that distinguishes it from this giant tree with an immense trunk",a sequoia,1,0
7655,2017-12-15,,Jeopardy,"(3, 1)",VOTE-CABULARY,6,"(200,)",False,"To express your opinion of a place by leaving it is to ""vote with your"" these body parts",your feet,1,0
7655,2017-12-15,,Jeopardy,"(4, 1)",TV NICKNAMES,1,"(200,)",False,"Mac on ""It's Always Sunny in Philadelphia"" has this for a real name, just like a fast food icon",Ronald McDonald,0,3
7655,2017-12-15,,Jeopardy,"(5, 1)",BEFORE THE EURO,7,"(200,)",False,"Cyprus used a currency called this, as did Ireland",the pound,1,0
7655,2017-12-15,,Jeopardy,"(6, 1)",MAIN STREAM MEDIA,16,"(200,)",False,Hercule Poirot is on vacation in Africa in this mystery mainstay,Death on the Nile,0,3
7655,2017-12-15,,Jeopardy,"(1, 2)",COKE SLOGANS THROUGH THE YEARS,22,"(400,)",False,"1929: ""The pause that"" does this",refreshes,1,0
7655,2017-12-15,,Jeopardy,"(2, 2)",TREES,27,"(400,)",False,In 2017 U2 celebrated the 30th anniversary of its album named for this plant by playing all of its songs on tour,Joshua tree,1,0
7655,2017-12-15,,Jeopardy,"(3, 2)",VOTE-CABULARY,12,"(400,)",False,"Your support is a real ""vote of"" this belief in oneself or another",confidence,1,0
7655,2017-12-15,,Jeopardy,"(4, 2)",TV NICKNAMES,2,"(400,)",False,"On ""Sex and the City"", Chris Noth played Carrie's elusive flame known as this",Mr. Big,1,0
7655,2017-12-15,,Jeopardy,"(5, 2)",BEFORE THE EURO,8,"(400,)",False,"Also the name of a silver coin in ancient times, this former Greek currency was broken down into lepta",the drachma,1,0
7655,2017-12-15,,Jeopardy,"(6, 2)",MAIN STREAM MEDIA,17,"(400,)",False,"This Strauss waltz, Opus 314, was originally a choral piece","the ""Blue Danube""",1,1
7655,2017-12-15,,Jeopardy,"(1, 3)",COKE SLOGANS THROUGH THE YEARS,23,"(600,)",False,"1979: ""Have a Coke and"" one of these",a smile,1,0
7655,2017-12-15,,Jeopardy,"(2, 3)",TREES,28,"(600,)",False,"The yellow poplar is also known as this flower tree, for obvious tree",the tulip tree,0,3
7655,2017-12-15,,Jeopardy,"(3, 3)",VOTE-CABULARY,13,"(600,)",False,"It's the right to vote; add ""tte"" to describe a woman agitating for that right",suffrage,1,0
7655,2017-12-15,,Jeopardy,"(4, 3)",TV NICKNAMES,3,"(600,)",False,"On ""Bonanza"", Ben Cartwright was father to Adam, Little Joe & this big fella",Hoss,1,0
7655,2017-12-15,,Jeopardy,"(5, 3)",BEFORE THE EURO,9,"(1200,)",True,This former currency of Austria sounds like a coin once used in the United Kingdom,the schilling,1,0
7655,2017-12-15,,Jeopardy,"(6, 3)",MAIN STREAM MEDIA,18,"(600,)",False,Mark Twain talks about his career as a steamboat pilot in this memoir,Life on the Mississippi,0,3
7655,2017-12-15,,Jeopardy,"(1, 4)",COKE SLOGANS THROUGH THE YEARS,24,"(800,)",False,"2009: ""Open"" this",happiness,0,3
7655,2017-12-15,,Jeopardy,"(2, 4)",TREES,29,"(800,)",False,Alaska's state tree is this alliterative spruce that shares its name with an Alaskan city,a Sitka spruce,1,0
7655,2017-12-15,,Jeopardy,"(3, 4)",VOTE-CABULARY,14,"(800,)",False,It's a vote cast on another's behalf at a shareholders' meeting,proxy,1,0
7655,2017-12-15,,Jeopardy,"(4, 4)",TV NICKNAMES,4,"(800,)",False,"In one episode of ""South Park"" this character goes south of the border & is referred to as Mantequilla",Butters,0,3
7655,2017-12-15,,Jeopardy,"(5, 4)",BEFORE THE EURO,10,"(800,)",False,Seen here is an example of the former currency of this European nation,Italy,1,0
7655,2017-12-15,,Jeopardy,"(6, 4)",MAIN STREAM MEDIA,19,"(800,)",False,"Mistakes in this painting of a 1776 event: wrong size boat, wrong flag, wrong time of day & the gen. probably wouldn't stand",Washington Crossing the Delaware,1,0
7655,2017-12-15,,Jeopardy,"(1, 5)",COKE SLOGANS THROUGH THE YEARS,25,"(1000,)",False,"1969: These 4 words, also heard in a jingle","""It\'s the real thing""",0,3
7655,2017-12-15,,Jeopardy,"(2, 5)",TREES,30,"(1000,)",False,The bald type of this flourishes in swamps,cypress trees,0,3
7655,2017-12-15,,Jeopardy,"(3, 5)",VOTE-CABULARY,15,"(1000,)",False,You'll find the common people of ancient Rome at the start of this word for a direct popular vote on an issue,a plebiscite,1,1
7655,2017-12-15,,Jeopardy,"(4, 5)",TV NICKNAMES,5,"(1000,)",False,"On ""WKRP in Cincinnati"", Tim Reid played the DJ with this nickname, also a certain plant",Venus Flytrap,1,0
7655,2017-12-15,,Jeopardy,"(5, 5)",BEFORE THE EURO,11,"(1000,)",False,Pre-Euro purchases in this nation required pesetas,Spain,1,0
7655,2017-12-15,,Jeopardy,"(6, 5)",MAIN STREAM MEDIA,20,"(1000,)",False,This 2001 Dennis LeHane mystery centers on the effects of a killing in a blue-collar Boston neighborhood,Mystic River,1,0
7655,2017-12-15,,Double Jeopardy,"(1, 1)",NON-AMERICAN GODS,10,"(400,)",False,"This Roman god of the forge lived long & prospered but his last words should've been ""I'm smelting! I'm smelting!""",Vulcan,1,0
7655,2017-12-15,,Double Jeopardy,"(3, 1)","ONLY ""U""",1,"(400,)",False,"With varying markings, there are more than 10 species of this mammal, including the hooded one seen here",a skunk,1,0
7655,2017-12-15,,Double Jeopardy,"(4, 1)",ALL MY...,6,"(400,)",False,"In this 1967 film Dustin Hoffman says, ""I think you're the most attractive of all my parents' friends""",The Graduate,1,0
7655,2017-12-15,,Double Jeopardy,"(5, 1)",EXODUS,21,"(400,)",False,Boils are number 6 on this list,the (ten) plagues (of Egypt),1,0
7655,2017-12-15,,Double Jeopardy,"(6, 1)",LIVE IN TEXAS,7,"(400,)",False,"Live in this city & you too will want to ""keep"" it ""weird""; there's even a festival devoted to that goal",Austin,1,0
7655,2017-12-15,,Double Jeopardy,"(1, 2)",NON-AMERICAN GODS,13,"(800,)",False,"Truly a multi-tasker, this Norse trickster god took on the form of a mare & birthed Odin's horse Sleipnir",Loki,1,0
7655,2017-12-15,,Double Jeopardy,"(3, 2)","ONLY ""U""",2,"(800,)",False,"Someone who deserves more fame than he gets is this kind of ""hero""",unsung,1,0
7655,2017-12-15,,Double Jeopardy,"(4, 2)",ALL MY...,17,"(800,)",False,"Paul McCartney said this 1963 song about what ""I will send to you"" was an oddity in that he wrote the lyrics first","""All My Loving""",1,0
7655,2017-12-15,,Double Jeopardy,"(5, 2)",EXODUS,22,"(800,)",False,"In Chapter 12, before the Israelites leave Egypt, they take ""their dough before it was"" this 8-letter word",leavened,1,0
7655,2017-12-15,,Double Jeopardy,"(6, 2)",LIVE IN TEXAS,8,"(800,)",False,In this city near Dallas you can see your Cowboys & Rangers play home games,Arlington,1,1
7655,2017-12-15,,Double Jeopardy,"(1, 3)",NON-AMERICAN GODS,14,"(1200,)",False,"Getting busy literally on day one, as an infant this Greek messenger of the gods stole his bro Apollo's cattle",Hermes,1,0
7655,2017-12-15,,Double Jeopardy,"(2, 3)",HISTORICAL ODD PAIRS,25,"(1200,)",False,"This Oscar winner scored an interview with ""El Chapo"" months after the crime lord escaped from a Mexican jail",(Sean) Penn,1,0
7655,2017-12-15,,Double Jeopardy,"(3, 3)","ONLY ""U""",3,"(1200,)",False,"For toddlers, they're also called training pants",pull-ups,1,0
7655,2017-12-15,,Double Jeopardy,"(4, 3)",ALL MY...,18,"(1200,)",False,This ABC series started in 1970 & ran all the way until 2011,All My Children,1,0
7655,2017-12-15,,Double Jeopardy,"(5, 3)",EXODUS,23,"(1200,)",False,"In Chapter 3 Moses is ""afraid to look upon God"" in the form of this amazing sight",the burning bush,1,0
7655,2017-12-15,,Double Jeopardy,"(6, 3)",LIVE IN TEXAS,9,"(1200,)",False,Baytown & Sugar Land are in the metro area of this big city,Houston,1,0
7655,2017-12-15,,Double Jeopardy,"(1, 4)",NON-AMERICAN GODS,15,"(1600,)",False,In the Bible Elijah got the better of prophets of this Canaanite fertility deity,Baal,0,3
7655,2017-12-15,,Double Jeopardy,"(2, 4)",HISTORICAL ODD PAIRS,26,"(1600,)",False,"The only time he left India after 1915 was to visit London, where Charlie Chaplin found his loin cloth incongruous",Gandhi,1,0
7655,2017-12-15,,Double Jeopardy,"(3, 4)","ONLY ""U""",4,"(1600,)",False,"Introduced from Asia, this vine used to control erosion in the 1930s is now a menace in the southern U.S.",kudzu,1,0
7655,2017-12-15,,Double Jeopardy,"(4, 4)",ALL MY...,19,"(1600,)",False,"He adapted his song ""All My Rowdy Friends Are Coming Over Tonight"" for ""Monday Night Football"" in 1989","Hank Williams, Jr.",1,0
7655,2017-12-15,,Double Jeopardy,"(5, 4)",EXODUS,28,"(1600,)",False,"It was made of shittim wood, 2.5 cubits in length, 1.5 cubits in breadth & height",the Ark,1,0
7655,2017-12-15,,Double Jeopardy,"(6, 4)",LIVE IN TEXAS,11,"(2000,)",True,"You'll fit in with all the friendly people living in this big city named for a man buried in Padua, Italy",San Antonio,0,1
7655,2017-12-15,,Double Jeopardy,"(1, 5)",NON-AMERICAN GODS,16,"(2000,)",False,"The son of Hyperion was this chariot-driving Greek sun god also with an ""H"" name",Helios,1,0
7655,2017-12-15,,Double Jeopardy,"(2, 5)",HISTORICAL ODD PAIRS,27,"(2000,)",False,"At a 1984 party at the Dakota, he taught Andy Warhol how to draw on a brand new Macintosh",Steve Jobs,1,0
7655,2017-12-15,,Double Jeopardy,"(3, 5)","ONLY ""U""",5,"(2000,)",False,Unkulunkulu is the creator god of this people of South Africa,the Zulu,1,0
7655,2017-12-15,,Double Jeopardy,"(4, 5)",ALL MY...,20,"(1000,)",True,"In 1947 Karl Malden & Ed Begley, Sr. stared in this playwright's first success, ""All My Sons""",Arthur Miller,0,1
7655,2017-12-15,,Double Jeopardy,"(5, 5)",EXODUS,24,"(2000,)",False,"The painting showing the celebrations after the crossing from Egypt is titled ""The Song of"" this sister of Moses",Miriam,1,0
7655,2017-12-15,,Double Jeopardy,"(6, 5)",LIVE IN TEXAS,12,"(2000,)",False,"If you like the sound of living near the Trinity River, try this town that began as an Army outpost in 1849",Fort Worth,0,3
7655,2017-12-15,,Final Jeopardy,"(1, 1)",MOVIE SETTINGS,0,"(7999, 6401, 8001)",False,The setting for this 1994 Oscar-winning animated film was inspired by Kenya's Hell's Gate National Park,The Lion King,3,0
