epNum,airDate,extra_info,round_name,coord,category,order,value,daily_double,question,answer,correctAttempts,wrongAttempts
7719,2018-03-15,,Jeopardy,"(1, 1)",BAD ADJECTIVES FOR A DATING PROFILE,12,"(200,)",False,"This adjective for a baseball hit out of play is not good, especially if it's before ""mouthed""",foul,1,0
7719,2018-03-15,,Jeopardy,"(2, 1)",SPORTS TRADITIONS,1,"(200,)",False,"A new tradition in 2017--at the end of the 1st quarter, Hawkeye fans at this U. turn & wave at Children's Hospital patients",the University of Iowa,1,0
7719,2018-03-15,,Jeopardy,"(3, 1)",WEBSITES,5,"(200,)",False,Thinking about retiring? This agency has a retirement estimator you can use at ssa.gov,Social Security Administration,1,0
7719,2018-03-15,,Jeopardy,"(4, 1)",A DOG & PONY & LEMUR SHOW,28,"(200,)",False,The average height of this pony named for an island group is 40 inches--it's so short that it's not measured in hands,a Shetland,1,0
7719,2018-03-15,,Jeopardy,"(5, 1)",STATE HOLIDAYS,4,"(200,)",False,June 17: Bunker Hill Day,Massachusetts,1,0
7719,2018-03-15,,Jeopardy,"(6, 1)","REAL ""D"" LIGHTS",6,"(200,)",False,"Important for metabolizing calcium, it's created by ultraviolet radiation",Vitamin D,1,0
7719,2018-03-15,,Jeopardy,"(1, 2)",BAD ADJECTIVES FOR A DATING PROFILE,15,"(400,)",False,This word for selfish or boastful comes from the psychoanalytic term for the conscious self,egotistical,1,0
7719,2018-03-15,,Jeopardy,"(2, 2)",SPORTS TRADITIONS,2,"(400,)",False,"In 1952, 8 playoff game wins took the Stanley Cup, so Red Wing fans threw this sea creature on the ice for luck",an octopus,1,0
7719,2018-03-15,,Jeopardy,"(3, 2)",WEBSITES,11,"(400,)",False,"This news & entertainment site offers quizzes under headings like ""Can We Guess?"" & ""Would You Rather?""",BuzzFeed,1,0
7719,2018-03-15,,Jeopardy,"(4, 2)",A DOG & PONY & LEMUR SHOW,26,"(400,)",False,This tracking dog has been described as a unique-looking dog in a baggy suit,a bloodhound,1,0
7719,2018-03-15,,Jeopardy,"(5, 2)",STATE HOLIDAYS,25,"(400,)",False,May 8: Truman Day,Missouri,1,0
7719,2018-03-15,,Jeopardy,"(6, 2)","REAL ""D"" LIGHTS",7,"(400,)",False,"One of his early forays into rap was fittingly on the song ""Public Enemy No. 1""",Chuck D,1,0
7719,2018-03-15,,Jeopardy,"(1, 3)",BAD ADJECTIVES FOR A DATING PROFILE,16,"(600,)",False,"It means ""capable of polishing or cleaning a surface by grinding""",abrasive,1,0
7719,2018-03-15,,Jeopardy,"(2, 3)",SPORTS TRADITIONS,3,"(600,)",False,"In a Dec. game, Taylor U. hoops fans don't make a sound until the team hits point 10; later, all sing this appropriate carol","""Silent Night""",0,3
7719,2018-03-15,,Jeopardy,"(3, 3)",WEBSITES,19,"(600,)",False,"Its article on itself says it's ""the largest and most popular general reference work on the internet""",Wikipedia,1,0
7719,2018-03-15,,Jeopardy,"(4, 3)",A DOG & PONY & LEMUR SHOW,24,"(600,)",False,"Some primates have noses; lemurs have one of these with a rhinarium at the tip, the same as dogs & pigs",a snout,1,0
7719,2018-03-15,,Jeopardy,"(5, 3)",STATE HOLIDAYS,27,"(600,)",False,March 31: Cesar Chavez Day;May 22: Harvey Milk Day,California,1,0
7719,2018-03-15,,Jeopardy,"(6, 3)","REAL ""D"" LIGHTS",8,"(600,)",False,"""Open some smiles"" with this fruity drink, perhaps the orange strawberry variety",SunnyD,1,1
7719,2018-03-15,,Jeopardy,"(1, 4)",BAD ADJECTIVES FOR A DATING PROFILE,17,"(800,)",False,"Rising in rebellion, or causing disgust",revolting,1,0
7719,2018-03-15,,Jeopardy,"(2, 4)",SPORTS TRADITIONS,13,"(800,)",False,"Let the beer flow at the Sausage Race with Polish & Italian sausage, brat, hot dog & chorizo at this NL team's games",the (Milwaukee) Brewers,1,0
7719,2018-03-15,,Jeopardy,"(3, 4)",WEBSITES,20,"(800,)",False,"This website that sells more than just shoes takes its name from the Spanish word for ""shoes""",Zappos,1,0
7719,2018-03-15,,Jeopardy,"(4, 4)",A DOG & PONY & LEMUR SHOW,23,"(800,)",False,"This state's Chincoteague Island, off its eastern shore, is known as a playground for wild ponies",Virginia,0,3
7719,2018-03-15,,Jeopardy,"(6, 4)","REAL ""D"" LIGHTS",9,"(800,)",False,"Jack Black moonlights in this ""persistent"" band with partner Kyle Gass",Tenacious D,1,0
7719,2018-03-15,,Jeopardy,"(1, 5)",BAD ADJECTIVES FOR A DATING PROFILE,18,"(1000,)",False,"6-letter synonym for acrid, corresponding to one of the 4 major kinds of taste buds",bitter,1,0
7719,2018-03-15,,Jeopardy,"(2, 5)",SPORTS TRADITIONS,14,"(1000,)",False,"When the horses enter the track to run in the Kentucky Derby, 160,000 fans sing this Stephen Foster song","""My Old Kentucky Home""",1,0
7719,2018-03-15,,Jeopardy,"(3, 5)",WEBSITES,21,"(2000,)",True,In 2008 this former editor of Vanity Fair & the New Yorker launched the Daily Beast,Tina Brown,0,1
7719,2018-03-15,,Jeopardy,"(4, 5)",A DOG & PONY & LEMUR SHOW,22,"(1000,)",False,"The sole living representative of its family, this double-named lemur sounds like a Navy man's ""yes, sir!""",an aye-aye,1,0
7719,2018-03-15,,Jeopardy,"(6, 5)","REAL ""D"" LIGHTS",10,"(1000,)",False,Wizards of the Coast now owns the role-playing game created by Gary Gygax commonly shortened to this,D&D,1,0
7719,2018-03-15,,Double Jeopardy,"(1, 1)",I AM HUSSEIN,21,"(400,)",False,The King Hussein mosque is in the heart of this Jordanian capital,Amman,1,0
7719,2018-03-15,,Double Jeopardy,"(2, 1)",'80s MUSIC,2,"(400,)",False,"On ""The Simpsons"", the ""Planet of the Apes"" musical had a song about Dr. Zaius a la Falco's ""Rock Me"" him",Amadeus,1,0
7719,2018-03-15,,Double Jeopardy,"(3, 1)",SOMEHOW THEY PULLED IT OFF,12,"(400,)",False,"Proverbially, the best way to pull off this Johnson & Johnson product is quickly",a Band-Aid,1,0
7719,2018-03-15,,Double Jeopardy,"(4, 1)",LITERARY STYLES & MOVEMENTS,24,"(400,)",False,"""Howl"" poet Allen Ginsberg was once called ""The Wild Shaman"" of this literary movement",the Beat movement,1,0
7719,2018-03-15,,Double Jeopardy,"(5, 1)",MY TREATY,11,"(400,)",False,The 1895 Treaty of Shimonoseki opened 4 Chinese ports to trade with this country that had defeated China in war,Japan,1,0
7719,2018-03-15,,Double Jeopardy,"(6, 1)","I'LL PICK UP THE ""TAB""",3,"(400,)",False,Launched in 1903 London's Daily Mirror was an early one of these sex & scandal newspapers,a tabloid,1,0
7719,2018-03-15,,Double Jeopardy,"(1, 2)",I AM HUSSEIN,22,"(800,)",False,Nasser Hussain scored thousands of runs in this sport & also captained the English national team for 4 years,cricket,1,0
7719,2018-03-15,,Double Jeopardy,"(2, 2)",'80s MUSIC,1,"(2800,)",True,"Him: ""Well, I knew I was in trouble nowmy hope of winning sank 'cause I got the Daily Double now & then my mind went blank""",Weird Al,1,0
7719,2018-03-15,,Double Jeopardy,"(3, 2)",SOMEHOW THEY PULLED IT OFF,15,"(800,)",False,"This dentist pulled off his boots before he died in bed in 1887, though he'd said he'd die with them on",Doc Holliday,1,0
7719,2018-03-15,,Double Jeopardy,"(4, 2)",LITERARY STYLES & MOVEMENTS,25,"(800,)",False,"Zora Neale Hurston, author of ""Their Eyes Were Watching God"", was part of this NYC movement",the Harlem Renaissance,1,0
7719,2018-03-15,,Double Jeopardy,"(5, 2)",MY TREATY,13,"(800,)",False,"In 1929 Benito Mussolini signed the Lateran Treaty, creating this very, very tiny country",Vatican City,1,1
7719,2018-03-15,,Double Jeopardy,"(6, 2)","I'LL PICK UP THE ""TAB""",7,"(800,)",False,"A striped cat, or a watered silk fabric",a tabby,1,0
7719,2018-03-15,,Double Jeopardy,"(1, 3)",I AM HUSSEIN,23,"(1200,)",False,In December 2003 TV watchers worldwide saw this man's mouth being swabbed for a DNA sample,Saddam Hussein,0,3
7719,2018-03-15,,Double Jeopardy,"(2, 3)",'80s MUSIC,4,"(1200,)",False,"Oh, ""Come On""! She's the title gal in the first & subsequently last Top 40 hit by Dexys Midnight Runners",Eileen,1,0
7719,2018-03-15,,Double Jeopardy,"(3, 3)",SOMEHOW THEY PULLED IT OFF,16,"(1200,)",False,"The tarp is being pulled off the baseball field, so this 2-word annoyance is ending",rain delay,1,0
7719,2018-03-15,,Double Jeopardy,"(4, 3)",LITERARY STYLES & MOVEMENTS,26,"(1200,)",False,Cyberpunk is sci-fi set in the future; this is sci-fi set in the 19th century,steampunk,1,0
7719,2018-03-15,,Double Jeopardy,"(5, 3)",MY TREATY,14,"(1200,)",False,"The American Rev. ended with the Treaty of Paris, returning to Spain part of what would eventually be this state",Florida,1,0
7719,2018-03-15,,Double Jeopardy,"(6, 3)","I'LL PICK UP THE ""TAB""",8,"(1200,)",False,Let's count up the synonyms for this word--1) rank2) classify3) order,tabulate,1,0
7719,2018-03-15,,Double Jeopardy,"(1, 4)",I AM HUSSEIN,29,"(200,)",True,"Formerly the mufti of Tuzla, Husein Kavazovic is the current grand mufti of this one-time Yugoslav republic",Bosnia-Herzegovnia,0,1
7719,2018-03-15,,Double Jeopardy,"(2, 4)",'80s MUSIC,5,"(1600,)",False,"2 songs held the No. 1 spot the longest--6 weeks--in 1980: ""Lady"" by Kenny Rogers & ""Call Me"" by this group",Blondie,1,0
7719,2018-03-15,,Double Jeopardy,"(3, 4)",SOMEHOW THEY PULLED IT OFF,19,"(1600,)",False,"In a novel he puts on his mask to fight Gonzales, leaves, pulls off his mask & comes back to jest with Gonzales",Zorro,1,0
7719,2018-03-15,,Double Jeopardy,"(4, 4)",LITERARY STYLES & MOVEMENTS,27,"(1600,)",False,"Put these 4 letters before ""fiction"" to get this style in which the author refers to the artificiality of the work itself",meta,1,0
7719,2018-03-15,,Double Jeopardy,"(5, 4)",MY TREATY,17,"(1600,)",False,"France got Alsace & Lorraine in the Peace of this, ending the Thirty Years’ War in 1648",Treaty of Westphalia,0,3
7719,2018-03-15,,Double Jeopardy,"(6, 4)","I'LL PICK UP THE ""TAB""",9,"(1600,)",False,"It's Latin for ""cleaned slate""",tabula rasa,1,0
7719,2018-03-15,,Double Jeopardy,"(2, 5)",'80s MUSIC,6,"(2000,)",False,“Paid in Full” was the 1987 platinum debut album of Eric B. and this MC seen here,Rakim,1,0
7719,2018-03-15,,Double Jeopardy,"(3, 5)",SOMEHOW THEY PULLED IT OFF,20,"(2000,)",False,"Sudbury, England unveiled a statue of this ""Blue Boy"" homeboy in 1913 & reenacted the unveiling in 2013",Gainsborough,1,0
7719,2018-03-15,,Double Jeopardy,"(4, 5)",LITERARY STYLES & MOVEMENTS,28,"(2000,)",False,"Ellen Glasgow coined the term ""Southern"" this to describe works by writers like William Faulkner",gothic,1,0
7719,2018-03-15,,Double Jeopardy,"(5, 5)",MY TREATY,18,"(2000,)",False,"Philip V was eventually your big winner in the War of the Spanish Succession, ended by the Treaties of this, ""U"" know",Utrecht,1,0
7719,2018-03-15,,Double Jeopardy,"(6, 5)","I'LL PICK UP THE ""TAB""",10,"(2000,)",False,It was the movable sanctuary of the Israelites in the desert,tabernacle,1,0
7719,2018-03-15,,Final Jeopardy,"(1, 1)",EUROPEAN RIVERS,0,"(11399, 11000, 8201)",False,"Of the 10 countries the Danube touches, this one is alphabetically last & is the only one that doesn't end in ""Y"" or ""A""",Ukraine,1,2
