epNum,airDate,extra_info,round_name,coord,category,order,value,daily_double,question,answer,correctAttempts,wrongAttempts
7780,2018-06-08,,Jeopardy,"(1, 1)",ITALY BEFORE THE ROMANS,1,"(200,)",False,"Prehistoric Villanovans in the 700s B.C. cremated their dead, created geometric art & made use of this alloy",bronze,1,0
7780,2018-06-08,,Jeopardy,"(2, 1)",POP CULTURE SQUIRRELS,9,"(200,)",False,Sandy Cheeks wears  a space suit & helmet underwater so she can hang out with this title guy,SpongeBob SquarePants,1,0
7780,2018-06-08,,Jeopardy,"(3, 1)",THIS CATEGORY WILL BLOW YOU AWAY,16,"(200,)",False,"Don't try it at home, but it's the art form being practiced here",glassblowing,1,0
7780,2018-06-08,,Jeopardy,"(4, 1)",STATE OF THE NEWSPAPER,3,"(200,)",False,The Hartford Courant,Connecticut,1,0
7780,2018-06-08,,Jeopardy,"(5, 1)",SAILING LIT,24,"(200,)",False,"The vessel in Lothar-Gunther Buchheim's claustrophobic World War II novel ""Das Boot"" is one of these",a U-boat,1,0
7780,2018-06-08,,Jeopardy,"(6, 1)",TONGUE-TWISTER PROTAGONISTS,21,"(200,)",False,"A groundhog, under this alias",a woodchuck,1,0
7780,2018-06-08,,Jeopardy,"(1, 2)",ITALY BEFORE THE ROMANS,4,"(400,)",False,"For 1,000 years before the Romans, the Nuragic culture built stone fortresses on this ""fishy"" island",Sardinia,1,0
7780,2018-06-08,,Jeopardy,"(2, 2)",POP CULTURE SQUIRRELS,10,"(400,)",False,"Scrat is the nutty, acorn-obsessed saber-toothed squirrel in this series of movies",Ice Age,1,0
7780,2018-06-08,,Jeopardy,"(3, 2)",THIS CATEGORY WILL BLOW YOU AWAY,17,"(400,)",False,"In this play Oberon tells Puck, ""I know a bank where the wild thyme blows""",A Midsummer Night\'s Dream,1,1
7780,2018-06-08,,Jeopardy,"(4, 2)",STATE OF THE NEWSPAPER,12,"(400,)",False,The Columbus Dispatch,Ohio,1,0
7780,2018-06-08,,Jeopardy,"(5, 2)",SAILING LIT,25,"(400,)",False,"For poet John Masefield, ""All I ask is a tall ship and"" this ""to steer her by""",a star,1,0
7780,2018-06-08,,Jeopardy,"(6, 2)",TONGUE-TWISTER PROTAGONISTS,8,"(400,)",False,A beachside vendor of these,seashells,1,0
7780,2018-06-08,,Jeopardy,"(1, 3)",ITALY BEFORE THE ROMANS,5,"(1000,)",True,"Around 600 B.C. the Insubres, a tribe in northern Italy, founded Mediolanum, today this city",Milan,1,0
7780,2018-06-08,,Jeopardy,"(2, 3)",POP CULTURE SQUIRRELS,11,"(600,)",False,Twiggy the squirrel is a cultural sensation for expertly doing this aquatic activity,water-ski,1,0
7780,2018-06-08,,Jeopardy,"(3, 3)",THIS CATEGORY WILL BLOW YOU AWAY,20,"(600,)",False,"Usually made from a ram's horn, it's traditionally blown during the Jewish high holiday of Rosh Hashanah",a shofar,1,0
7780,2018-06-08,,Jeopardy,"(4, 3)",STATE OF THE NEWSPAPER,13,"(600,)",False,The Rapid City Journal,South Dakota,0,3
7780,2018-06-08,,Jeopardy,"(5, 3)",SAILING LIT,26,"(600,)",False,"""My purpose holds to sail beyond the sunset"", he says in a Tennyson poem that bears his name, set after a Homer epic",Ulysses,0,3
7780,2018-06-08,,Jeopardy,"(6, 3)",TONGUE-TWISTER PROTAGONISTS,2,"(600,)",False,A man with this first name also applied to a male turkey (he threw Tim three thumbtacks),Tom,1,0
7780,2018-06-08,,Jeopardy,"(1, 4)",ITALY BEFORE THE ROMANS,6,"(800,)",False,"According to legend, refugees of this 1200 B.C. conflict first fled to Thrace, then north Africa & finally Italy",the Trojan War,1,0
7780,2018-06-08,,Jeopardy,"(2, 4)",POP CULTURE SQUIRRELS,18,"(800,)",False,June Foray gave voice to this high-flying resident of Frostbite Falls--again!,Rocky (the Flying Squirrel),1,0
7780,2018-06-08,,Jeopardy,"(3, 4)",THIS CATEGORY WILL BLOW YOU AWAY,22,"(800,)",False,In November 1605 he was caught red-handed in a cellar getting ready to blow up England's Parliament,Guy Fawkes,1,0
7780,2018-06-08,,Jeopardy,"(4, 4)",STATE OF THE NEWSPAPER,14,"(800,)",False,The Bainbridge Island Review,Washington,0,3
7780,2018-06-08,,Jeopardy,"(5, 4)",SAILING LIT,27,"(800,)",False,"A strange ship called the Demeter brings this character to England, but its crew is gone & the captain is dead!",Count Dracula,1,0
7780,2018-06-08,,Jeopardy,"(6, 4)",TONGUE-TWISTER PROTAGONISTS,29,"(800,)",False,This boy who selected vine fruits from the brine,Peter Piper,1,0
7780,2018-06-08,,Jeopardy,"(1, 5)",ITALY BEFORE THE ROMANS,7,"(1000,)",False,"The colonies of Magna Graecia included Croton, home of Milo & many other victors in these regular competitions",the Olympics,1,0
7780,2018-06-08,,Jeopardy,"(2, 5)",POP CULTURE SQUIRRELS,19,"(1000,)",False,"Slappy & Skippy Squirrel were characters in this cartoon series that also starred Wakko, Yakko & Dot",the Animaniacs,1,0
7780,2018-06-08,,Jeopardy,"(3, 5)",THIS CATEGORY WILL BLOW YOU AWAY,23,"(1000,)",False,"Sound the trumpets! In 1961 ""Come Blow Your Horn"" was his first comedy produced on Broadway",Neil Simon,1,0
7780,2018-06-08,,Jeopardy,"(4, 5)",STATE OF THE NEWSPAPER,15,"(1000,)",False,The Brattleboro Reformer,Vermont,0,3
7780,2018-06-08,,Jeopardy,"(5, 5)",SAILING LIT,28,"(1000,)",False,"The third Narnia book is ""The Voyage of"" this ship that sails through magic waters to the end of the world",the Dawn Treader,1,0
7780,2018-06-08,,Jeopardy,"(6, 5)",TONGUE-TWISTER PROTAGONISTS,30,"(1000,)",False,This husband of Zipporah in the Old Testament,Moses,1,0
7780,2018-06-08,,Double Jeopardy,"(1, 1)",O YE OF LITTLE FAITH,1,"(400,)",False,"Atheists disavow the existence of a god; these people, from the Greek for ""unknowable"", say they aren't sure",agnostics,1,0
7780,2018-06-08,,Double Jeopardy,"(2, 1)",SCRAMBLED WORLD CAPITALS,11,"(400,)",False,Northern Europe: MOCK SLOTH,Stockholm,1,0
7780,2018-06-08,,Double Jeopardy,"(3, 1)",GOLFER IN CHIEF,26,"(400,)",False,"When this president played, he often invoked ""Billigans"" after misplayed balls",Bill Clinton,1,0
7780,2018-06-08,,Double Jeopardy,"(4, 1)",SONG TIME,16,"(400,)",False,"""It's 9 o'clock on a Saturday, the regular crowd shuffles in"", begins this Billy Joel signature song","""Piano Man""",1,0
7780,2018-06-08,,Double Jeopardy,"(5, 1)",PSYCHOLOGY,25,"(400,)",False,"From the Old English for ""treasure"", this disorder is characterized by the inability to discard things",hoarding,1,0
7780,2018-06-08,,Double Jeopardy,"(6, 1)","""U"" KNOW IT!",10,"(400,)",False,"Wanting to emulate Thomas More, H.G. Wells wrote of a ""modern"" one",utopia,1,0
7780,2018-06-08,,Double Jeopardy,"(1, 2)",O YE OF LITTLE FAITH,2,"(800,)",False,"""Secular"" these follow the teachings of ""the Awakened One"" but reject the supernatural elements",Buddhism,1,0
7780,2018-06-08,,Double Jeopardy,"(2, 2)",SCRAMBLED WORLD CAPITALS,12,"(800,)",False,"Way, way down south in the Pacific:NO GENT WILL",Wellington,1,0
7780,2018-06-08,,Double Jeopardy,"(3, 2)",GOLFER IN CHIEF,27,"(800,)",False,John F. Kennedy played on the freshman golf team at this university,Harvard,1,0
7780,2018-06-08,,Double Jeopardy,"(4, 2)",SONG TIME,17,"(800,)",False,"This one-named hitmaker's raps include ""5 A.M. in Toronto"", ""9 A.M. in Dallas"" & ""6 P.M. in New York""",Drake,1,0
7780,2018-06-08,,Double Jeopardy,"(5, 2)",PSYCHOLOGY,24,"(800,)",False,"Ten images, like the one seen here, are used in this psychological test, first introduced in 1921",a Rorschach,1,0
7780,2018-06-08,,Double Jeopardy,"(6, 2)","""U"" KNOW IT!",7,"(800,)",False,Stretchy uniform for dancers that leaves little to the imagination,a unitard,1,0
7780,2018-06-08,,Double Jeopardy,"(1, 3)",O YE OF LITTLE FAITH,3,"(2000,)",True,"In Nietzsche's ""The Parable of the Madman"", ""and we have killed him"" follows this famous 3-word sentence","""God is dead""",0,1
7780,2018-06-08,,Double Jeopardy,"(2, 3)",SCRAMBLED WORLD CAPITALS,13,"(1200,)",False,South America; SERIOUS BEAN,Buenos Aires,1,0
7780,2018-06-08,,Double Jeopardy,"(3, 3)",GOLFER IN CHIEF,28,"(1200,)",False,"This president who on occasion would clumsily wing a spectator joked, ""People...should stay behind us""",Gerald Ford,1,0
7780,2018-06-08,,Double Jeopardy,"(4, 3)",SONG TIME,18,"(1200,)",False,"A tipsy dial from Lady Antebellum: ""It's a ____ after one, I'm a little drunk and I need you now""",quarter,1,0
7780,2018-06-08,,Double Jeopardy,"(5, 3)",PSYCHOLOGY,21,"(2400,)",True,It's genetics or upbringing in this classic debate of 2 words with the same second syllable,nature versus nurture,1,0
7780,2018-06-08,,Double Jeopardy,"(6, 3)","""U"" KNOW IT!",6,"(1200,)",False,"""Extreme"" final sacrament for a Catholic",unction,1,0
7780,2018-06-08,,Double Jeopardy,"(1, 4)",O YE OF LITTLE FAITH,4,"(1600,)",False,In 2016 Nat Geo reported that this European country once home to the papacy would soon have a secular majority,France,1,0
7780,2018-06-08,,Double Jeopardy,"(2, 4)",SCRAMBLED WORLD CAPITALS,14,"(1600,)",False,The Middle East: A DRY HI,Riyadh,1,0
7780,2018-06-08,,Double Jeopardy,"(3, 4)",GOLFER IN CHIEF,29,"(1600,)",False,"The 45th president enjoys time at Trump National in Bedminster in this state, where he watched the 2017 U.S. Women's Open",New Jersey,1,0
7780,2018-06-08,,Double Jeopardy,"(4, 4)",SONG TIME,19,"(1600,)",False,"The title of this 1970 Chicago hit is a little snappier than ""3:35 or 3:34""","""25 or 6 to 4""",0,3
7780,2018-06-08,,Double Jeopardy,"(5, 4)",PSYCHOLOGY,22,"(1600,)",False,"In 2013 the American Psychiatric Assoc. dropped subtypes including ""paranoid"" for this mental disorder",schizophrenia,1,0
7780,2018-06-08,,Double Jeopardy,"(6, 4)","""U"" KNOW IT!",8,"(1600,)",False,The 1713 treaty of this Dutch city granted large parts of Canada to the Brits from the French,Utrecht,1,0
7780,2018-06-08,,Double Jeopardy,"(1, 5)",O YE OF LITTLE FAITH,5,"(2000,)",False,"This Oxford biologist's 2006 bestseller ""The God Delusion"" argues that ""there almost certainly is no god""",(Richard) Dawkins,1,0
7780,2018-06-08,,Double Jeopardy,"(2, 5)",SCRAMBLED WORLD CAPITALS,15,"(2000,)",False,In Indochina: AN INVITEE,Vientiane,1,0
7780,2018-06-08,,Double Jeopardy,"(3, 5)",GOLFER IN CHIEF,30,"(2000,)",False,"That's avid golfer Ike practicing on this area of the White House grounds called ""the president's backyard""",the South Lawn,0,3
7780,2018-06-08,,Double Jeopardy,"(4, 5)",SONG TIME,20,"(2000,)",False,"Rob Thomas of this group sang, ""Baby, it's 3 A.M., I must be lonely""",Matchbox Twenty,1,0
7780,2018-06-08,,Double Jeopardy,"(5, 5)",PSYCHOLOGY,23,"(2000,)",False,1908s M.I.T. researchers found that carbs must be consumed for this mood-elevating neurotransmitter to be released,serotonin,1,1
7780,2018-06-08,,Double Jeopardy,"(6, 5)","""U"" KNOW IT!",9,"(2000,)",False,Dad to King Arthur,Uther Pendragon,1,0
7780,2018-06-08,,Final Jeopardy,"(1, 1)",LITERARY SETTINGS,0,"(8300, 12000, 14800)",False,Ashdown Forest in Sussex inspired this fictional setting for a 1926 collection of stories for children,the Hundred Acre Wood,2,1
