epNum,airDate,extra_info,round_name,coord,category,order,value,daily_double,question,answer,correctAttempts,wrongAttempts
7833,2018-10-03,,Jeopardy,"(1, 1)",NEW ENGLAND,5,"(200,)",False,"""The Hub of the Universe"", it's the largest city in New England",Boston,1,0
7833,2018-10-03,,Jeopardy,"(2, 1)",BRICK BY BRICK,9,"(200,)",False,Using bricks can keep creepers out of your house in this video game,Minecraft,1,0
7833,2018-10-03,,Jeopardy,"(3, 1)",FROM THE DUTCH,6,"(200,)",False,"The last car on a freight train, from the Dutch for ""ship's kitchen""",caboose,1,0
7833,2018-10-03,,Jeopardy,"(4, 1)",COBRA KAI,23,"(200,)",False,"Ophiophagus hannah, which can reach 18 feet in length & lives on a diet of other snakes, goes by this royal name",king cobra,1,0
7833,2018-10-03,,Jeopardy,"(5, 1)",KARATE,18,"(200,)",False,"A knife-hand strike to the neck is informally called this, like a slice of meat on the bone",chop,1,1
7833,2018-10-03,,Jeopardy,"(6, 1)",KIDS,7,"(200,)",False,"Jan, Cindy, Greg, Bobby & don't forget Oliver",The Brady Bunch,1,0
7833,2018-10-03,,Jeopardy,"(1, 2)",NEW ENGLAND,4,"(400,)",False,Some of Vermont's best farmland is located in this valley that shares its name with a large lake in the region,Champlain,1,0
7833,2018-10-03,,Jeopardy,"(2, 2)",BRICK BY BRICK,19,"(400,)",False,A construction method called hang-tu was used for this landmark partition that's partly made with clay bricks,the Great Wall of China,1,0
7833,2018-10-03,,Jeopardy,"(3, 2)",FROM THE DUTCH,10,"(400,)",False,"Dutch gave us this 4-letter word for a short curl or twist & thus its 5-letter adjective for ""perverse""",kink,1,0
7833,2018-10-03,,Jeopardy,"(4, 2)",COBRA KAI,24,"(400,)",False,"I'm happy to say most of these cobra family members, the most venomous of all snakes, can't crawl on land",sea snakes,1,0
7833,2018-10-03,,Jeopardy,"(5, 2)",KARATE,15,"(400,)",False,This Olympic sport is AKA Korean karate,taekwondo,1,1
7833,2018-10-03,,Jeopardy,"(6, 2)",KIDS,8,"(400,)",False,"Lily, Manny, Alex, Haley, Luke",Modern Family,1,0
7833,2018-10-03,,Jeopardy,"(1, 3)",NEW ENGLAND,3,"(600,)",False,"The Hall of Heroes in New London, Connecticut honors heroic alumni of this service academy",the Coast Guard Academy,1,0
7833,2018-10-03,,Jeopardy,"(2, 3)",BRICK BY BRICK,20,"(600,)",False,"This Lionel Richie group sang, ""She's a brick house, yeah, she's the one, the only one, built like an Amazon""",The Commodores,1,0
7833,2018-10-03,,Jeopardy,"(3, 3)",FROM THE DUTCH,12,"(600,)",False,"A frozen fright for ships, this object is almost the same word in Dutch by with a ""js"" in it",an iceberg,1,0
7833,2018-10-03,,Jeopardy,"(4, 3)",COBRA KAI,25,"(5200,)",True,"Dendroaspis, these deadly African members of the cobra family, come in green & black",mambas,1,0
7833,2018-10-03,,Jeopardy,"(5, 3)",KARATE,28,"(600,)",False,"Karate black belts are awarded degrees of this 3-letter rank, also a man's first name",dan,0,3
7833,2018-10-03,,Jeopardy,"(6, 3)",KIDS,11,"(600,)",False,"Lucas, Dustin, Will, Eleven",Stranger Things,1,0
7833,2018-10-03,,Jeopardy,"(1, 4)",NEW ENGLAND,2,"(800,)",False,"Built in 1763 & still active, Touro Synagogue in this Rhode Island resort city is America's oldest Jewish house of worship",Newport,1,0
7833,2018-10-03,,Jeopardy,"(2, 4)",BRICK BY BRICK,21,"(800,)",False,This state says it has the first brick-paved street in America--on Summers Street near the Kanawha River in Charleston,West Virginia,1,1
7833,2018-10-03,,Jeopardy,"(3, 4)",FROM THE DUTCH,13,"(800,)",False,"This word for an artificial bird used as a lure by a hunter is from the Dutch for ""cage""",a decoy,0,3
7833,2018-10-03,,Jeopardy,"(4, 4)",COBRA KAI,26,"(800,)",False,"A reddish-brown Australian cobra family member is called this, like the American snake AKA the highland moccasin",a copperhead,1,0
7833,2018-10-03,,Jeopardy,"(5, 4)",KARATE,29,"(800,)",False,This island conquered by Japan in the 19th century is often said to be karate's birthplace,Okinawa,1,0
7833,2018-10-03,,Jeopardy,"(6, 4)",KIDS,16,"(800,)",False,"Mika, Lizzie, Sophia, Carl",The Walking Dead,0,3
7833,2018-10-03,,Jeopardy,"(1, 5)",NEW ENGLAND,1,"(1000,)",False,"This state's House of Representatives includes seats for 3 nonvoting members, including 1 representing the Penobscot nation",Maine,1,0
7833,2018-10-03,,Jeopardy,"(2, 5)",BRICK BY BRICK,22,"(1000,)",False,"He wrote, ""It was not long before they reached the road of yellow brick and turned again toward the Emerald City""",(L. Frank) Baum,1,0
7833,2018-10-03,,Jeopardy,"(3, 5)",FROM THE DUTCH,14,"(1000,)",False,"It can mean a stupid person, an opiate drug or information, as in ""the straight...""",dope,1,0
7833,2018-10-03,,Jeopardy,"(4, 5)",COBRA KAI,27,"(1000,)",False,A mark that looks like old-timey glasses on its hood gives the Indian cobra this other name,the spectacled cobra,0,3
7833,2018-10-03,,Jeopardy,"(6, 5)",KIDS,17,"(1000,)",False,"Arnold, Sam, Kimberly, Willis",Diff\'rent Strokes,1,0
7833,2018-10-03,,Double Jeopardy,"(1, 1)",BUSINESS LINGO,22,"(400,)",False,2-4-6-8! What does this? Any asset that loses value over time,depreciate,1,0
7833,2018-10-03,,Double Jeopardy,"(2, 1)",THE COLD WAR,2,"(400,)",False,"This U.S. president declared his ""doctrine"" in 1947 promising to help any country facing a Communist takeover",Truman,1,0
7833,2018-10-03,,Double Jeopardy,"(3, 1)",ENTERTAINMENT RITUALS,12,"(400,)",False,Each summer the Discovery Channel devotes a week to these: in 2017 even Michael Phelps showed up,sharks,1,0
7833,2018-10-03,,Double Jeopardy,"(4, 1)",DENTISTRY,17,"(400,)",False,"When the dentist uses this 10-letter term, your tooth is coming out",extraction,1,0
7833,2018-10-03,,Double Jeopardy,"(5, 1)",AUTHORS' FICTIONAL PLACES,27,"(400,)",False,Who-ville,(Dr.) Seuss,1,0
7833,2018-10-03,,Double Jeopardy,"(6, 1)","ENDS IN ""O""",7,"(400,)",False,What a lovely way to spend an afternoon--relaxing in one of these,a gazebo,1,0
7833,2018-10-03,,Double Jeopardy,"(1, 2)",BUSINESS LINGO,23,"(800,)",False,"A formal document about a stock offering, like the one Valvoline filed with the SEC Sept. 12, 2016",a prospectus,0,3
7833,2018-10-03,,Double Jeopardy,"(2, 2)",THE COLD WAR,3,"(800,)",False,In 1991 the USSR was dissolved & the flag nicknamed this for its 2 symbols was lowered for the last time,the Hammer and Sickle,1,0
7833,2018-10-03,,Double Jeopardy,"(3, 2)",ENTERTAINMENT RITUALS,13,"(800,)",False,"After the 2013 Boston bombing, the Yankees paid tribute by playing this Neil Diamond classic","""Sweet Caroline""",1,0
7833,2018-10-03,,Double Jeopardy,"(4, 2)",DENTISTRY,18,"(800,)",False,"(Jimmy of the Clue Crew shows a model of teeth on the monitor.) When dentists refer to the cheek side of your molar, they call it ""buccal"", from the Latin for ""cheek""; this adjective describes the tongue side & comes from the Latin for ""tongue""",lingual,1,0
7833,2018-10-03,,Double Jeopardy,"(5, 2)",AUTHORS' FICTIONAL PLACES,1,"(800,)",False,Westeros & Valyria,George R.R. Martin,1,0
7833,2018-10-03,,Double Jeopardy,"(6, 2)","ENDS IN ""O""",8,"(800,)",False,"Even before Salk & Sabin, Dr. Hilary Koprowski developed the first live-virus vaccine for this",polio,1,0
7833,2018-10-03,,Double Jeopardy,"(1, 3)",BUSINESS LINGO,24,"(1200,)",False,This Omaha-based super investor calls the space between you & the competition a moat,Warren Buffett,1,0
7833,2018-10-03,,Double Jeopardy,"(2, 3)",THE COLD WAR,4,"(1200,)",False,The Cuban Missile Crisis of 1962 was resolved when this Russian leader blinked in his face-off with the USA,Khrushchev,1,0
7833,2018-10-03,,Double Jeopardy,"(3, 3)",ENTERTAINMENT RITUALS,14,"(2000,)",True,"Penned in 1880, this July 4th symphony staple touts a Russian victory, not an American one",the 1812 Overture,1,0
7833,2018-10-03,,Double Jeopardy,"(4, 3)",DENTISTRY,19,"(1200,)",False,A Maryland this doesn't take you over the Patuxent River; it's a false tooth held in place with metal wings,a bridge,1,0
7833,2018-10-03,,Double Jeopardy,"(5, 3)",AUTHORS' FICTIONAL PLACES,28,"(2000,)",True,"In the South, Maycomb & Finch's Landing",Harper Lee,1,0
7833,2018-10-03,,Double Jeopardy,"(6, 3)","ENDS IN ""O""",9,"(1200,)",False,In 2004 Louisiana named this dish the official state cuisine,gumbo,1,0
7833,2018-10-03,,Double Jeopardy,"(1, 4)",BUSINESS LINGO,25,"(1600,)",False,"When 2 different products are sold as a package deal, ti's called this ""B"" term; software is a good example",bundling,0,3
7833,2018-10-03,,Double Jeopardy,"(2, 4)",THE COLD WAR,5,"(1600,)",False,"Rhyming name for competition over the heavens; the women of ""Hidden Figures"" helped win it, per the book's subtitle",the Space Race,1,0
7833,2018-10-03,,Double Jeopardy,"(3, 4)",ENTERTAINMENT RITUALS,15,"(1600,)",False,Those who frequent this cult film on weekends know to bring rice to throw for Brad & Janet's wedding,The Rocky Horror Picture Show,1,0
7833,2018-10-03,,Double Jeopardy,"(4, 4)",DENTISTRY,20,"(1600,)",False,"The tooth is this, not fully coming out of the gums because of a blockage",impacted,1,0
7833,2018-10-03,,Double Jeopardy,"(5, 4)",AUTHORS' FICTIONAL PLACES,29,"(1600,)",False,Never-Never Land,J.M. Barrie,1,0
7833,2018-10-03,,Double Jeopardy,"(6, 4)","ENDS IN ""O""",10,"(1600,)",False,One of the languages you can learn at duolingo.com is this universal one created in 1887,Esperanto,1,0
7833,2018-10-03,,Double Jeopardy,"(1, 5)",BUSINESS LINGO,26,"(2000,)",False,"A major change in how your business operates is called this type of ""shift"", from the Greek for ""pattern""",a paradigm shift,1,0
7833,2018-10-03,,Double Jeopardy,"(2, 5)",THE COLD WAR,6,"(2000,)",False,"In 1956 Soviet tanks rolled into this European capital city, suppressing a short democratic revolt",Budapest,1,0
7833,2018-10-03,,Double Jeopardy,"(3, 5)",ENTERTAINMENT RITUALS,16,"(2000,)",False,"After the last plane leaves the South Pole each summer, winter-over crews view this 1951 film & the 1982 remake",The Thing from Another World,0,3
7833,2018-10-03,,Double Jeopardy,"(4, 5)",DENTISTRY,21,"(2000,)",False,These are generally wood for furniture & porcelain for teeth; don't let anyone mix that up,veneers,0,3
7833,2018-10-03,,Double Jeopardy,"(5, 5)",AUTHORS' FICTIONAL PLACES,30,"(2000,)",False,"Gopher Prairie, Minnesota",Sinclair Lewis,0,3
7833,2018-10-03,,Double Jeopardy,"(6, 5)","ENDS IN ""O""",11,"(2000,)",False,It's a Japanese martial art & form of fencing using bamboo swords,kendo,0,3
7833,2018-10-03,,Final Jeopardy,"(1, 1)",CITIES IN HISTORY,0,"(666, 2000, 5000)",False,The Cathedral of St. Pierre was the center of the Calvinist Reformation in this lakeside city,Geneva,1,2
