epNum,airDate,extra_info,round_name,coord,category,order,value,daily_double,question,answer,correctAttempts,wrongAttempts
7855,2018-11-02,,Jeopardy,"(1, 1)",ALPHABET CITY,5,"(200,)",False,A: It's considered the birthplace of democracy,Athens,1,0
7855,2018-11-02,,Jeopardy,"(2, 1)",KIDS' BOOKS,6,"(200,)",False,"Jeff Kinney admits that in school, he qualified for this title adjective of his 12-novel series",wimpy,1,0
7855,2018-11-02,,Jeopardy,"(3, 1)",THE GENDER-FREE OPTION,15,"(200,)",False,"How about ""first year"" instead of this term for students entering high school",freshmen,1,0
7855,2018-11-02,,Jeopardy,"(4, 1)",IF YOU CAN'T BEAT 'EM...,28,"(200,)",False,"At the Buick Invitational from 2005 to 2008, many were invited but no one was beating this golfer",Tiger Woods,1,0
7855,2018-11-02,,Jeopardy,"(5, 1)",THE ELEPHANT,16,"(200,)",False,"""Pink Elephants On Parade"" is a song from this 1941 film",Dumbo,1,0
7855,2018-11-02,,Jeopardy,"(6, 1)",IN THE ROOM,30,"(200,)",False,Regular & exclusive use is one requirement for deducting the cost of this on your taxes,the home office,1,0
7855,2018-11-02,,Jeopardy,"(1, 2)",ALPHABET CITY,1,"(400,)",False,I: It's the only major city that straddles 2 continents--Asia & Europe,Istanbul,1,0
7855,2018-11-02,,Jeopardy,"(2, 2)",KIDS' BOOKS,7,"(400,)",False,"In ""Finding Buck McHenry"", a kid thinks a janitor is a baseball great from the time of these segregated leagues",the Negro Leagues,1,0
7855,2018-11-02,,Jeopardy,"(3, 2)",THE GENDER-FREE OPTION,11,"(400,)",False,Longcase clock is another way to refer to this antique,a grandfather clock,1,0
7855,2018-11-02,,Jeopardy,"(4, 2)",IF YOU CAN'T BEAT 'EM...,27,"(400,)",False,Many on our staff were sad to see the Astros invade Chavez Ravine & beat this team in Game 7 of the 2017 World Series,the Dodgers,1,0
7855,2018-11-02,,Jeopardy,"(5, 2)",THE ELEPHANT,17,"(400,)",False,"This Seuss character was in the jungle of Nool, enjoying the jungle's joys, when he heard a small noise",Horton,1,0
7855,2018-11-02,,Jeopardy,"(6, 2)",IN THE ROOM,21,"(400,)",False,"This word for a woman's dressing or sitting room comes from the French for ""a place to sulk in""",boudoir,0,3
7855,2018-11-02,,Jeopardy,"(1, 3)",ALPHABET CITY,2,"(600,)",False,S: It's the gateway to the Yangtze Valley,Shanghai,1,0
7855,2018-11-02,,Jeopardy,"(2, 3)",KIDS' BOOKS,8,"(600,)",False,"In a recent bestseller, ""Dragons Love"" these, but don't put salsa in them or you'll have trouble",tacos,1,0
7855,2018-11-02,,Jeopardy,"(3, 3)",THE GENDER-FREE OPTION,12,"(600,)",False,"These days, Rita prefers to be a parking enforcement officer rather than this antiquated term",a meter maid,1,0
7855,2018-11-02,,Jeopardy,"(4, 3)",IF YOU CAN'T BEAT 'EM...,24,"(600,)",False,"From 2005 to 2008 & again from 2010 to 2014, no man was beating this Spaniard for the French Open men's singles title",(Rafael) Nadal,1,0
7855,2018-11-02,,Jeopardy,"(5, 3)",THE ELEPHANT,18,"(600,)",False,This swinging cartoon guy had an elephant named Shep who acted like a dog,George of the Jungle,1,0
7855,2018-11-02,,Jeopardy,"(6, 3)",IN THE ROOM,22,"(1200,)",True,"This musical includes the song ""The Room Where It Happens""",Hamilton,0,1
7855,2018-11-02,,Jeopardy,"(1, 4)",ALPHABET CITY,3,"(800,)",False,"E: This Mexican city south of San Diego is a regular port-of-call for short cruises out of Long Beach, Ca.",Ensenada,0,3
7855,2018-11-02,,Jeopardy,"(2, 4)",KIDS' BOOKS,9,"(800,)",False,"In ""Alice in Wonderland"", the Red Queen uses live hedgehogs as balls in this game",croquet,1,0
7855,2018-11-02,,Jeopardy,"(3, 4)",THE GENDER-FREE OPTION,13,"(800,)",False,An equal-opportunity archvillain can call his employees lackeys or minions instead of this 8-letter word,henchmen,1,0
7855,2018-11-02,,Jeopardy,"(4, 4)",IF YOU CAN'T BEAT 'EM...,25,"(800,)",False,"This storied franchise was the last north-of-the-border team to win the Stanley Cup, back in 1993",the (Montreal) Canadiens,1,0
7855,2018-11-02,,Jeopardy,"(5, 4)",THE ELEPHANT,19,"(800,)",False,The mascot of Tufts University is this elephant; P.T. Barnum was an early trustee & benefactor,Jumbo,1,0
7855,2018-11-02,,Jeopardy,"(6, 4)",IN THE ROOM,23,"(800,)",False,This name for the main room of an ancient Roman house also refers to a skylit central court,atrium,0,3
7855,2018-11-02,,Jeopardy,"(1, 5)",ALPHABET CITY,4,"(1000,)",False,"Q: This capital sits at an elevation of 9,350 feet",Quito,1,0
7855,2018-11-02,,Jeopardy,"(2, 5)",KIDS' BOOKS,10,"(1000,)",False,"This ""harebrained"" English author also wrote about a rat in ""The Tale of Samuel Whiskers""",Beatrix Potter,1,0
7855,2018-11-02,,Jeopardy,"(3, 5)",THE GENDER-FREE OPTION,14,"(1000,)",False,A ship could embark on its first sailing rather than this traditional term,its maiden voyage,1,0
7855,2018-11-02,,Jeopardy,"(4, 5)",IF YOU CAN'T BEAT 'EM...,26,"(1000,)",False,"Over 4 straight Super Bowls, it was the rest of the NFL 139, this team 73",the Buffalo Bills,1,0
7855,2018-11-02,,Jeopardy,"(5, 5)",THE ELEPHANT,20,"(1000,)",False,"In some parts of India, this elephant-headed god is said to be married to both Buddhi & Siddhi",Ganesh,1,0
7855,2018-11-02,,Jeopardy,"(6, 5)",IN THE ROOM,29,"(1000,)",False,"A 19th century poem begins, ""'Will you walk into'"" this room, ""said the spider to the fly""",my parlor,1,0
7855,2018-11-02,,Double Jeopardy,"(1, 1)",TREASURES OF THE NATIONAL PORTRAIT GALLERY,30,"(400,)",False,The NPG has the complete gallery of presidential portraits outside the White House--here's this chief executive,(Harry) Truman,1,1
7855,2018-11-02,,Double Jeopardy,"(2, 1)","THEY'RE ""GREAT""",7,"(400,)",False,A large pooch originally bred for boar hunting,the Great Dane,1,0
7855,2018-11-02,,Double Jeopardy,"(3, 1)",UNITS OF MEASURE,25,"(400,)",False,"When referring to this temperature unit abbreviated K, just use the name of the unit, no ""degrees""",kelvin,1,0
7855,2018-11-02,,Double Jeopardy,"(4, 1)",ROMAN EMPERORS,1,"(400,)",False,Trajan narrowly escaped death when one of these shook the city of Antioch in 115,an earthquake,1,0
7855,2018-11-02,,Double Jeopardy,"(5, 1)",PATTERN RECOGNITION,27,"(400,)",False,"Yankee fans know the lines on this uniform fabric pattern can be 1/16"" or 3/32"" wide",pinstripes,1,0
7855,2018-11-02,,Double Jeopardy,"(6, 1)",CAST IRONS,28,"(400,)",False,"In 2017's ""Justice League"", Jeremy Irons played this Batman butler",Alfred,1,0
7855,2018-11-02,,Double Jeopardy,"(1, 2)",TREASURES OF THE NATIONAL PORTRAIT GALLERY,8,"(800,)",False,"Changing human communication forever, this inventor phoned it in back in 1876",(Alexander Graham) Bell,1,0
7855,2018-11-02,,Double Jeopardy,"(2, 2)","THEY'RE ""GREAT""",6,"(800,)",False,A nickname for Broadway,the Great White Way,1,0
7855,2018-11-02,,Double Jeopardy,"(3, 2)",UNITS OF MEASURE,22,"(800,)",False,"The EPA standard for carbon monoxide exposure includes 35 of these ""parts""",parts per million,1,0
7855,2018-11-02,,Double Jeopardy,"(4, 2)",ROMAN EMPERORS,11,"(800,)",False,Antoninus Pius ordered the construction of the Antonine this about 100 miles north of Hadrian's,a wall,1,0
7855,2018-11-02,,Double Jeopardy,"(5, 2)",PATTERN RECOGNITION,19,"(800,)",False,"If you like these little solid circles, visit the Tokyo Museum of Yayoi Kusama, the queen of them",polka dots,1,0
7855,2018-11-02,,Double Jeopardy,"(6, 2)",CAST IRONS,12,"(800,)",False,"Jeremy's son Max Irons was Henry in this wolfish 2011 fairy tale with no ""Little"" in its title",Red Riding Hood,1,0
7855,2018-11-02,,Double Jeopardy,"(1, 3)",TREASURES OF THE NATIONAL PORTRAIT GALLERY,9,"(1200,)",False,This St. Louis-born performer's talent & sensuality made her a music hall star in France in the 1920s and '30s,Josephine Baker,1,0
7855,2018-11-02,,Double Jeopardy,"(2, 3)","THEY'RE ""GREAT""",3,"(1200,)",False,"A book about Ronald Reagan's transition from acting to politics is titled ""The Making of"" him",the Great Communicator,0,3
7855,2018-11-02,,Double Jeopardy,"(3, 3)",UNITS OF MEASURE,23,"(1200,)",False,"""Atmos"", divers can endure pressure of about 6 of these units, each 14.7 pounds per square inch",atmospheres,0,3
7855,2018-11-02,,Double Jeopardy,"(4, 3)",ROMAN EMPERORS,18,"(1200,)",False,"Tiberius was the Caesar of the King James Bible line do this ""to Caesar the things that are Caesar's""",render,1,0
7855,2018-11-02,,Double Jeopardy,"(5, 3)",PATTERN RECOGNITION,15,"(1200,)",False,The type of symbol seen here is the Persian boteh; it is repeated in this pattern named for a Scottish town,Paisley,1,0
7855,2018-11-02,,Double Jeopardy,"(6, 3)",CAST IRONS,2,"(1200,)",False,"In 1994's ""The Lion King"", Jeremy Irons voiced this villainous cat",Scar,1,0
7855,2018-11-02,,Double Jeopardy,"(1, 4)",TREASURES OF THE NATIONAL PORTRAIT GALLERY,10,"(2000,)",True,"Before it was a Sam Peckinpah film title, it was a real Western gang, including Butch & Sundance",the Wild Bunch,0,1
7855,2018-11-02,,Double Jeopardy,"(2, 4)","THEY'RE ""GREAT""",4,"(1600,)",False,"This 11,000-sq.-mile Canadian lake is named for native people who were sometimes forced to labor for the Cree",the Great Slave Lake,1,0
7855,2018-11-02,,Double Jeopardy,"(3, 4)",UNITS OF MEASURE,24,"(3000,)",True,"Named for an Englishman, it's the basic unit of force in the International System",a newton,1,0
7855,2018-11-02,,Double Jeopardy,"(4, 4)",ROMAN EMPERORS,21,"(1600,)",False,Despised tyrant Caracalla was obsessed with this better-regarded Macedonian & tried to dress & act like him,Alexander the Great,1,0
7855,2018-11-02,,Double Jeopardy,"(5, 4)",PATTERN RECOGNITION,16,"(1600,)",False,The motifs in quatrefoil designs have 4 of these,leaves,1,0
7855,2018-11-02,,Double Jeopardy,"(6, 4)",CAST IRONS,13,"(1600,)",False,"Jeremy Irons had a breakthrough role in the 1981 miniseries this place ""Revisited""",Brideshead,1,0
7855,2018-11-02,,Double Jeopardy,"(1, 5)",TREASURES OF THE NATIONAL PORTRAIT GALLERY,26,"(2000,)",False,"The ""Glory! Glory!"" of this 3-named hymn writer included writing anthem of the Union army",Julia Ward Howe,0,3
7855,2018-11-02,,Double Jeopardy,"(2, 5)","THEY'RE ""GREAT""",5,"(2000,)",False,Flightless bird of the north Atlantic extinct since the mid-1880s,the great auk,1,0
7855,2018-11-02,,Double Jeopardy,"(3, 5)",UNITS OF MEASURE,29,"(2000,)",False,An 1881 scientific congress in Paris put this Frenchman's name on the unit of electric current,Ampere,0,3
7855,2018-11-02,,Double Jeopardy,"(4, 5)",ROMAN EMPERORS,20,"(2000,)",False,"This brutal heir of Marcus Aurelius wasn't killed by a gladiator, but his advisers did have him strangled by a wrestler",Commodus,1,1
7855,2018-11-02,,Double Jeopardy,"(5, 5)",PATTERN RECOGNITION,17,"(2000,)",False,This word for a white& color checked pattern comes from a Malay word,gingham,1,1
7855,2018-11-02,,Double Jeopardy,"(6, 5)",CAST IRONS,14,"(2000,)",False,"Max Irons stars as a CIA analyst who stumbles on a plot in this show; the '70s film version had ""Three Days of"" this in its title",Condor,1,0
7855,2018-11-02,,Final Jeopardy,"(1, 1)",SURNAMES,0,"(3399, 6799, 13001)",False,"Evoking speed & luxury, this one of the 10 most common Italian surnames goes back to the Latin word for iron",Ferrari,3,0
