epNum,airDate,extra_info,round_name,coord,category,order,value,daily_double,question,answer,correctAttempts,wrongAttempts
7899,2019-01-03,,Jeopardy,"(1, 1)",HOW TO PLAY QUIDDITCH,1,"(200,)",False,A Quidditch team is made up of 7 players who each keep one of these between their legs at all times,a broom,1,0
7899,2019-01-03,,Jeopardy,"(2, 1)",AMERICAN HISTORY,20,"(200,)",False,"John Parker was assigned to guard this man on April 14, 1865, but stepped out at intermission to go to a bar",Abraham Lincoln,1,0
7899,2019-01-03,,Jeopardy,"(3, 1)","CROSSWORD CLUES ""D""",4,"(200,)",False,Doc or Dopey(5),a dwarf,1,0
7899,2019-01-03,,Jeopardy,"(4, 1)",GETTING SQUIRRELLY,22,"(200,)",False,Squirrels are part of this order that includes beavers & marmots,rodents,1,0
7899,2019-01-03,,Jeopardy,"(5, 1)",MONDAY NIGHT NON-FOOTBALL TV,30,"(200,)",False,"This actor moved west & rapped things up as ""The Fresh Prince of Bel-Air""",Will Smith,1,0
7899,2019-01-03,,Jeopardy,"(6, 1)",WHAT'S THAT SMELL?,27,"(200,)",False,It's eau de this striped member of the Mephitidae family that just sprayed its musk,skunk,1,0
7899,2019-01-03,,Jeopardy,"(1, 2)",HOW TO PLAY QUIDDITCH,2,"(400,)",False,"A Snitch runner, who eludes both teams, must dress in this color, like the leader in the Tour de France",yellow,1,0
7899,2019-01-03,,Jeopardy,"(2, 2)",AMERICAN HISTORY,19,"(400,)",False,"Mariana, the first name Charles I picked for this colony, was nixed as Juan de Mariana was an anti-royalist writer",Maryland,1,0
7899,2019-01-03,,Jeopardy,"(3, 2)","CROSSWORD CLUES ""D""",5,"(400,)",False,Run off the tracks (6),derail,1,0
7899,2019-01-03,,Jeopardy,"(4, 2)",GETTING SQUIRRELLY,23,"(400,)",False,Some squirrels are active during winter; others go through this dormancy process,hibernation,1,0
7899,2019-01-03,,Jeopardy,"(5, 2)",MONDAY NIGHT NON-FOOTBALL TV,29,"(400,)",False,Jennifer Love Hewitt takes the emergency calls on this 3-digit Fox drama,9-1-1,1,0
7899,2019-01-03,,Jeopardy,"(6, 2)",WHAT'S THAT SMELL?,8,"(400,)",False,It's air freshener in this fragrance like a just-purchased Ford or Toyota,new car smell,1,0
7899,2019-01-03,,Jeopardy,"(1, 3)",HOW TO PLAY QUIDDITCH,21,"(600,)",False,"Sounding like a drink served with another drink, this player scores points throwing the Quaffle ball",a Chaser,1,1
7899,2019-01-03,,Jeopardy,"(2, 3)",AMERICAN HISTORY,9,"(1000,)",True,Alexander Hamilton Jr. got justice for his dad with Eliza Jumel hired him to handle her divorce from this man,Aaron Burr,1,0
7899,2019-01-03,,Jeopardy,"(3, 3)","CROSSWORD CLUES ""D""",3,"(600,)",False,"____ & confused, in the movies(5)",dazed,1,0
7899,2019-01-03,,Jeopardy,"(4, 3)",GETTING SQUIRRELLY,24,"(600,)",False,Squirrels pretend to bury nuts & these oak tree fruits to foil would-be thieves,acorns,1,0
7899,2019-01-03,,Jeopardy,"(5, 3)",MONDAY NIGHT NON-FOOTBALL TV,16,"(600,)",False,Aunt Bee & Opie were part of the small-town fun on this Monday night show,The Andy Griffith Show,1,0
7899,2019-01-03,,Jeopardy,"(6, 3)",WHAT'S THAT SMELL?,7,"(600,)",False,It's this mixture of decaying plant matter like grass & leaf clippings that's good as a soil fertilizer but bad for my nose,compost,1,0
7899,2019-01-03,,Jeopardy,"(1, 4)",HOW TO PLAY QUIDDITCH,12,"(800,)",False,"For a Bludger, which eliminates other players by contact, you can use this ball; just ask Patches O'Houlihan",a dodgeball,0,3
7899,2019-01-03,,Jeopardy,"(2, 4)",AMERICAN HISTORY,10,"(800,)",False,"JFK declined to change the name, chosen by his predecessor, of this retreat in the Blue Ridge Mountains",Camp David,1,0
7899,2019-01-03,,Jeopardy,"(3, 4)","CROSSWORD CLUES ""D""",6,"(800,)",False,A student's sheepskin (7),diploma,1,0
7899,2019-01-03,,Jeopardy,"(4, 4)",GETTING SQUIRRELLY,25,"(800,)",False,"The Siberian is the only non-North American type of this, a small, striped creature in the squirrel family",a chipmunk,1,0
7899,2019-01-03,,Jeopardy,"(5, 4)",MONDAY NIGHT NON-FOOTBALL TV,17,"(800,)",False,On this game show Howie Mandel asked a simple question that often elicited a difficult answer,Deal or No Deal,0,3
7899,2019-01-03,,Jeopardy,"(6, 4)",WHAT'S THAT SMELL?,15,"(800,)",False,"It's Vanilla Cupcake, Sun & Sand, & Clean Cotton, some of the bestselling scents from this candle company",Yankee candles,1,0
7899,2019-01-03,,Jeopardy,"(1, 5)",HOW TO PLAY QUIDDITCH,13,"(1000,)",False,"A player called this quests after the elusive Snitch ball, whose capture is worth 30 points & ends a game",the Seeker,1,0
7899,2019-01-03,,Jeopardy,"(2, 5)",AMERICAN HISTORY,11,"(1000,)",False,"This Michigan businessman once fired all his accounting staff, leaving others to figure income by weighing invoices",(Henry) Ford,1,0
7899,2019-01-03,,Jeopardy,"(3, 5)","CROSSWORD CLUES ""D""",14,"(1000,)",False,Housebroken(12),domesticated,1,0
7899,2019-01-03,,Jeopardy,"(4, 5)",GETTING SQUIRRELLY,28,"(1000,)",False,"(Sarah of the Clue Crew shows a squirrel and a rattlesnake on the monitor.) Certain ground squirrels fend off rattlesnakes by shaking their tails & creating heat, & since the snakes detect the heat via this type of light, they go defensive & leave their prey be",infrared,1,1
7899,2019-01-03,,Jeopardy,"(5, 5)",MONDAY NIGHT NON-FOOTBALL TV,18,"(1000,)",False,A cat-craving alien from Melmac was adopted by an American family on this sitcom,ALF,1,0
7899,2019-01-03,,Jeopardy,"(6, 5)",WHAT'S THAT SMELL?,26,"(1000,)",False,"It's a freshly brewed cup of Blue Mountain coffee, the beans coming direct from this island nation",Jamaica,1,0
7899,2019-01-03,,Double Jeopardy,"(1, 1)",CITY FLAGS,27,"(400,)",False,Residents of this Italian city can shroud themselves in its flag,Turin,1,0
7899,2019-01-03,,Double Jeopardy,"(2, 1)",THAT BOOK IS MAKING ME SICK,8,"(400,)",False,Retired professor Glen Bateman is one of the survivors of the superflu in this Stephen King novel,The Stand,1,0
7899,2019-01-03,,Double Jeopardy,"(3, 1)",ACRONYMS,12,"(400,)",False,"Medically speaking, we'd like you to I.D. the letters I & D in AIDS",immunodeficiency,1,0
7899,2019-01-03,,Double Jeopardy,"(5, 1)",EXTRAORDINARY RENDITIONS,16,"(400,)",False,"Joe Cocker sang & played air guitar in a memorable rendition of ""With A Little Help From My Friends"" at this 1969 festival",Woodstock,1,0
7899,2019-01-03,,Double Jeopardy,"(6, 1)","BRAND OF ""BROTHERS""",25,"(400,)",False,"Theater owners Harry, Albert, Samuel & Jack decided to make their own movies as this company in 1913",the Warner Brothers,1,0
7899,2019-01-03,,Double Jeopardy,"(1, 2)",CITY FLAGS,26,"(800,)",False,Remember the flag of this U.S. city?,San Antonio,0,3
7899,2019-01-03,,Double Jeopardy,"(2, 2)",THAT BOOK IS MAKING ME SICK,7,"(800,)",False,The title of this nonfiction bestseller about an Ebola outbreak refers to an area with infectious organisms,The Hot Zone,1,0
7899,2019-01-03,,Double Jeopardy,"(3, 2)",ACRONYMS,28,"(800,)",False,They're the YUP in yuppies,young urban professionals,1,0
7899,2019-01-03,,Double Jeopardy,"(5, 2)",EXTRAORDINARY RENDITIONS,17,"(800,)",False,"Israel Kamakawiwo'ole's soaring take on this ""Wizard of Oz"" classic is ubiquitous in Hawaii","""Somewhere Over The Rainbow""",1,0
7899,2019-01-03,,Double Jeopardy,"(6, 2)","BRAND OF ""BROTHERS""",24,"(800,)",False,"In the late 19th century, George invited brothers Charles & Edward to join him in this board game company",Parker Brothers,1,0
7899,2019-01-03,,Double Jeopardy,"(1, 3)",CITY FLAGS,4,"(2000,)",True,The wavy lines symbolize the convergence of the Missouri & Mississippi Rivers on the flag of this large city,St. Louis,1,0
7899,2019-01-03,,Double Jeopardy,"(2, 3)",THAT BOOK IS MAKING ME SICK,1,"(1200,)",False,"""Everything is free...it makes you feel sick...that's"" this, the title of Jean-Paul Sartre's first novel",Nausea,1,0
7899,2019-01-03,,Double Jeopardy,"(3, 3)",ACRONYMS,13,"(1200,)",False,"Oops! Looks like somebody has gone AWOL, which is short for this",absent without leave,1,0
7899,2019-01-03,,Double Jeopardy,"(4, 3)",ARCHITECTURE,9,"(1200,)",False,An example of Byzantine architecture is a museum also called Ayasofya in this city,Istanbul,1,0
7899,2019-01-03,,Double Jeopardy,"(5, 3)",EXTRAORDINARY RENDITIONS,21,"(1200,)",False,Marvin Gaye & John Fogerty both sang this song beautifully; so did the California Raisins,"""I Heard It Through The Grapevine""",1,0
7899,2019-01-03,,Double Jeopardy,"(6, 3)","BRAND OF ""BROTHERS""",20,"(1200,)",False,"Jonathan & Drew Scott, the stars of this HGTV real estate series & its spin-offs, share their story in ""It Takes Two""",the Property Brothers,1,0
7899,2019-01-03,,Double Jeopardy,"(1, 4)",CITY FLAGS,5,"(1600,)",False,"The four stars on this Midwest city's flag represent a fort, a fire & two expositions",Chicago,1,0
7899,2019-01-03,,Double Jeopardy,"(2, 4)",THAT BOOK IS MAKING ME SICK,2,"(1600,)",False,"Daniel Defoe's account of events in 1664-65 was called ""A Journal of the"" this ""Year""",plague,1,0
7899,2019-01-03,,Double Jeopardy,"(3, 4)",ACRONYMS,14,"(3000,)",True,"TED talks began in 1984 at a conference on this, entertainment & design",technology,1,0
7899,2019-01-03,,Double Jeopardy,"(4, 4)",ARCHITECTURE,10,"(1600,)",False,A fanlight isn't a fixture with rotating blades--it's one of these,a window,0,3
7899,2019-01-03,,Double Jeopardy,"(5, 4)",EXTRAORDINARY RENDITIONS,22,"(1600,)",False,"Bob Dylan said singing his own ""All Along The Watchtower"" feels like a tribute to this man who did an amazing cover",(Jimi) Hendrix,1,0
7899,2019-01-03,,Double Jeopardy,"(6, 4)","BRAND OF ""BROTHERS""",18,"(1600,)",False,"In 1878 Austin & R.W. began selling coffee in San Francisco, becoming this brand",Hills Bros.,0,3
7899,2019-01-03,,Double Jeopardy,"(1, 5)",CITY FLAGS,6,"(2000,)",False,"The two City Hall towers combine to make the letter ""T"" on the flag of this metropolis",Toronto,1,0
7899,2019-01-03,,Double Jeopardy,"(2, 5)",THAT BOOK IS MAKING ME SICK,3,"(2000,)",False,The symptoms of infatuation & a water-borne illness overlap in this 1985 novel by Gabriel Garcia Marquez,Love in the Time of Cholera,1,0
7899,2019-01-03,,Double Jeopardy,"(3, 5)",ACRONYMS,15,"(2000,)",False,They're the 3 groups that form the CAP in ASCAP,"composers, authors and publishers",1,1
7899,2019-01-03,,Double Jeopardy,"(4, 5)",ARCHITECTURE,11,"(2000,)",False,"A synonym for ""merciless"" or ""cruel"", followed by ""-ism"", gets you this style that emphasizes austerity",Brutalism,1,0
7899,2019-01-03,,Double Jeopardy,"(5, 5)",EXTRAORDINARY RENDITIONS,23,"(2000,)",False,"""Let freedom ring"", Marian Anderson sang, opening her 1939 concert at the Lincoln Memorial with this patriotic tune","""My Country, \'Tis Of Thee""",1,0
7899,2019-01-03,,Double Jeopardy,"(6, 5)","BRAND OF ""BROTHERS""",19,"(2000,)",False,"In 1868 Henry, Emmanuel & Mayer moved this company to NYC; as a bank, it lost almost $50 billion & closed in 2008",Lehman Brothers,1,0
7899,2019-01-03,,Final Jeopardy,"(1, 1)",1940s HISTORY,0,"(10000, 5000, 801)",False,"Air Force pilot Gail Halvorson earned the nickname ""Candy Bomber"" for his actions during this 1948-49 event",the Berlin airlift (or Berlin air drop),2,1
