epNum,airDate,extra_info,round_name,coord,category,order,value,daily_double,question,answer,correctAttempts,wrongAttempts
7923,2019-02-06,,Jeopardy,"(1, 1)",APPLE PIE ORDER,17,"(200,)",False,"I'll have mine with ice cream--this way, s'il vous plait",à la mode,1,0
7923,2019-02-06,,Jeopardy,"(2, 1)",HISTORIC FAMILIES,6,"(200,)",False,"Considered American royalty, this family would include senators, an attorney general, an ambassador & a president",the Kennedys,1,0
7923,2019-02-06,,Jeopardy,"(3, 1)",MEASURE FOR MEASURE,9,"(200,)",False,"In England a ""long"" one of these is equal to 2,240 pounds",a long ton,1,0
7923,2019-02-06,,Jeopardy,"(4, 1)",MOVIE QUOTES,1,"(200,)",False,"""I was in the Virgin Islands once. I met a girl. We ate lobster, drank pina coladas...why couldn't I get that day over & over?""",Groundhog Day,1,0
7923,2019-02-06,,Jeopardy,"(5, 1)",WHAT WE HAVE HERE,14,"(200,)",False,"Burundi might be a good place to open a mint, as it's rich in this element that gave its name to a U.S. coin",nickel,1,0
7923,2019-02-06,,Jeopardy,"(6, 1)",FAILURE TO COMMUNICATE,22,"(200,)",False,"""Hamlet"" uses this verb meaning to talk nonsense; adding -ish to it makes it a nonsense language",gibber,1,0
7923,2019-02-06,,Jeopardy,"(1, 2)",APPLE PIE ORDER,18,"(400,)",False,"I'll take one from this chain, though as I recall it tasted better before they went from fried to baked in 1992",McDonald\'s,1,0
7923,2019-02-06,,Jeopardy,"(2, 2)",HISTORIC FAMILIES,7,"(400,)",False,"This famous family from Florence included Popes Leo X & Clement VII & Catherine, mother of 3 French kings",the Medicis,1,0
7923,2019-02-06,,Jeopardy,"(3, 2)",MEASURE FOR MEASURE,10,"(1000,)",True,A quadrant is a unit of circular measure equal to this many degrees,90,1,0
7923,2019-02-06,,Jeopardy,"(4, 2)",MOVIE QUOTES,2,"(400,)",False,"""Donny was a good bowler. And a good man""",The Big Lebowski,1,0
7923,2019-02-06,,Jeopardy,"(5, 2)",WHAT WE HAVE HERE,25,"(400,)",False,Ilam is a tea-growing center of this mountainous country between India & Tibet,Nepal,1,0
7923,2019-02-06,,Jeopardy,"(6, 2)",FAILURE TO COMMUNICATE,23,"(400,)",False,"These homophones, 1 from Genesis & 1 not, both mean a confused assortment of sounds",Babel/babble,1,0
7923,2019-02-06,,Jeopardy,"(1, 3)",APPLE PIE ORDER,19,"(600,)",False,"You can have this ""apple"" pie made with Ritz crackers; I'll have the real thing",mock apple pie,0,3
7923,2019-02-06,,Jeopardy,"(2, 3)",HISTORIC FAMILIES,8,"(600,)",False,It's been estimate that one in 200 men are direct descendants of this Mongol ruler & grandfather of Kublai,Genghis Khan,1,0
7923,2019-02-06,,Jeopardy,"(3, 3)",MEASURE FOR MEASURE,11,"(600,)",False,A gallon is equal to 3.785 of these liquid metric units,a liter,1,0
7923,2019-02-06,,Jeopardy,"(4, 3)",MOVIE QUOTES,3,"(600,)",False,"Oscar's Best Picture of 2000: ""At my signal, unleash hell""",Gladiator,1,0
7923,2019-02-06,,Jeopardy,"(5, 3)",WHAT WE HAVE HERE,28,"(600,)",False,Need a good scrubbing? The volcanic islands of American Samoa are rich in this porous rock,pumice,1,0
7923,2019-02-06,,Jeopardy,"(6, 3)",FAILURE TO COMMUNICATE,24,"(600,)",False,This rhyming phrase for meaningless ritual ends with the name of an elephant owned by P.T. Barnum,mumbo-jumbo,1,0
7923,2019-02-06,,Jeopardy,"(1, 4)",APPLE PIE ORDER,20,"(800,)",False,"Gimme this alliterative ""feminine"" dessert, crustless pie with apples & brown sugar",apple brown betty,1,0
7923,2019-02-06,,Jeopardy,"(2, 4)",HISTORIC FAMILIES,15,"(800,)",False,This patriot & founding father was a second cousin of the second president,Sam Adams,1,0
7923,2019-02-06,,Jeopardy,"(3, 4)",MEASURE FOR MEASURE,12,"(800,)",False,"(Sarah of the Clue Crew shows two thermometers on the monitor.) To convert from Celsius to Fahrenheit, multiply the Celsius reading times 1.8 & then add this number",32,1,0
7923,2019-02-06,,Jeopardy,"(4, 4)",MOVIE QUOTES,4,"(800,)",False,"Spoken by Allison Williams in 2017: ""You know I can't give you the keys, right, babe?""",Get Out,1,0
7923,2019-02-06,,Jeopardy,"(5, 4)",WHAT WE HAVE HERE,29,"(800,)",False,"Botswana has some of the world's largest ""pipes"" of these, the country's major economic resource",diamonds,0,3
7923,2019-02-06,,Jeopardy,"(6, 4)",FAILURE TO COMMUNICATE,26,"(800,)",False,"On Pentecost, the apostles received this ability AKA glossolalia that may baffle some onlookers",speaking in tongues,1,0
7923,2019-02-06,,Jeopardy,"(1, 5)",APPLE PIE ORDER,21,"(1000,)",False,"Pasadena's Pie 'n Burger will serve you this ""national"" apple pie with a crumbly streusel topping",Dutch apple pie,1,0
7923,2019-02-06,,Jeopardy,"(2, 5)",HISTORIC FAMILIES,16,"(1000,)",False,"Due to inbreeding, King Charles II of Spain had a prominent jaw, like other members of this European royal family",the Hapsburgs,1,0
7923,2019-02-06,,Jeopardy,"(3, 5)",MEASURE FOR MEASURE,13,"(1000,)",False,"Like the shifting sands of time, there are 437.5 of these weight units to an ounce",grains,1,0
7923,2019-02-06,,Jeopardy,"(4, 5)",MOVIE QUOTES,5,"(1000,)",False,"About a drummer at ""the Isle of Lucy Jazz and Blues Festival...it was tragic, really. He exploded on stage""",This is Spinal Tap,1,0
7923,2019-02-06,,Jeopardy,"(5, 5)",WHAT WE HAVE HERE,30,"(1000,)",False,You'll find plenty of bananas & coffee in this largest Central American country by area,Nicaragua,1,0
7923,2019-02-06,,Jeopardy,"(6, 5)",FAILURE TO COMMUNICATE,27,"(1000,)",False,"Change the first 3 letters in ""jumbled"" to get this word for a message that's so jumbled its meaning is lost",garbled,1,0
7923,2019-02-06,,Double Jeopardy,"(1, 1)",WWF,7,"(400,)",False,The snow leopard is facing the loss of its habitat in this Asian range that includes the highest mountains in the world,the Himalayas,1,0
7923,2019-02-06,,Double Jeopardy,"(2, 1)",INDEPENDENT BOOKSTORES,11,"(400,)",False,"With its main store at Broadway & 12th Street, Strand Books in this city boasts ""18 miles of books""",New York,1,0
7923,2019-02-06,,Double Jeopardy,"(3, 1)",GOOD FELLOWS,1,"(400,)",False,"They're close allies; it's said that ""politics makes strange"" ones",bedfellows,1,0
7923,2019-02-06,,Double Jeopardy,"(4, 1)",WOMEN OF THE BIBLE,27,"(400,)",False,"This queen arrives in Jerusalem packing spices, gold & gems & sets out to test the wisdom of King Solomon",the Queen of Sheba,1,0
7923,2019-02-06,,Double Jeopardy,"(5, 1)",NAME THE COMPOSER,4,"(400,)",False,"With Tim Rice, ""Don't Cry For Me Argentina""",(Andrew Lloyd) Webber,1,0
7923,2019-02-06,,Double Jeopardy,"(6, 1)","""SOCK"" IT TO ME",25,"(400,)",False,In a 1969 video Jim Henson shows kids how to make a simple one of these,a sock puppet,1,0
7923,2019-02-06,,Double Jeopardy,"(1, 2)",WWF,19,"(800,)",False,"A census of 18 countries revealed a 30% drop in the population of these mammals, mostly the result of poaching for the ivory trade",elephants,1,0
7923,2019-02-06,,Double Jeopardy,"(2, 2)",INDEPENDENT BOOKSTORES,12,"(800,)",False,The square in Square Books is in this Mississippi college town where William Faulkner lived,Oxford,1,0
7923,2019-02-06,,Double Jeopardy,"(3, 2)",GOOD FELLOWS,2,"(3000,)",True,"Politicians draw us in with ""my fellow Americans"" to open a speech, like this 1952 one in which Nixon rejected talk of corruption",the Checkers speech,0,1
7923,2019-02-06,,Double Jeopardy,"(4, 2)",WOMEN OF THE BIBLE,26,"(800,)",False,"In Luke 2 Simeon tells her that her ""child is set for the fall and rising again of many in Israel""",Mary,1,0
7923,2019-02-06,,Double Jeopardy,"(5, 2)",NAME THE COMPOSER,5,"(800,)",False,"Of the score for ""Jurassic Park""",(John) Williams,1,0
7923,2019-02-06,,Double Jeopardy,"(6, 2)","""SOCK"" IT TO ME",23,"(6000,)",True,It's the full-length clerical garment seen here,a cassock,1,0
7923,2019-02-06,,Double Jeopardy,"(1, 3)",WWF,14,"(1200,)",False,"Extinct on mainland Australia, this marsupial is now found only on the island in its name",Tasmanian devils,1,0
7923,2019-02-06,,Double Jeopardy,"(2, 3)",INDEPENDENT BOOKSTORES,16,"(1200,)",False,"Co-founded in S.F. by Lawrence Ferlinghetti, this bookstore says it was the first to sell only paperbacks",City Lights,1,0
7923,2019-02-06,,Double Jeopardy,"(3, 3)",GOOD FELLOWS,3,"(1200,)",False,"AKA Poputchiks, fellow travelers were writers Leon Trotsky considered to be neutral about this 1917",the Russian Revolution,1,0
7923,2019-02-06,,Double Jeopardy,"(4, 3)",WOMEN OF THE BIBLE,28,"(1200,)",False,"This festival honors Esther, a Jewish queen of Persia who saved Jews from the plotting of the evil Haman",Purim,1,0
7923,2019-02-06,,Double Jeopardy,"(5, 3)",NAME THE COMPOSER,8,"(1200,)",False,"Of ""Fig Leaf Rag"" & ""The Ragtime Dance""",Scott Joplin,1,0
7923,2019-02-06,,Double Jeopardy,"(6, 3)","""SOCK"" IT TO ME",22,"(1200,)",False,"From 1965, this popular Dr. Seuss work includes the line ""Knox in box""",Fox in Socks,1,1
7923,2019-02-06,,Double Jeopardy,"(1, 4)",WWF,13,"(1600,)",False,The World Wildlife Fund is working to double the number of these endangered cats in the wild by 2022 with a program known as TX2,tigers,1,0
7923,2019-02-06,,Double Jeopardy,"(2, 4)",INDEPENDENT BOOKSTORES,17,"(1600,)",False,The Grolier Poetry Bookshop in this eggheaded city in the Boston metro area dates from 1927,Cambridge,1,0
7923,2019-02-06,,Double Jeopardy,"(3, 4)",GOOD FELLOWS,6,"(1600,)",False,"Someone with ""FRS"" after his name is a fellow of this British science group",the Royal Society,1,0
7923,2019-02-06,,Double Jeopardy,"(4, 4)",WOMEN OF THE BIBLE,29,"(1600,)",False,Hannah was the mother of this judge & prophet with a first & second book to his name,Samuel,1,0
7923,2019-02-06,,Double Jeopardy,"(5, 4)",NAME THE COMPOSER,9,"(1600,)",False,"Of ""If I Could Turn Back Time"" & ""Because You Loved Me"", this woman",Diane Warren,1,0
7923,2019-02-06,,Double Jeopardy,"(6, 4)","""SOCK"" IT TO ME",21,"(1600,)",False,"This red swimmer of the northern Pacific coast can navigate 1,000 miles upriver to spawn",a sockeye,1,0
7923,2019-02-06,,Double Jeopardy,"(1, 5)",WWF,20,"(2000,)",False,"The WWF's ""Living Planet Report 2018"" has dire news--plastic debris in all our oceans, even this deepest ocean trench",the Marianas Trench,1,0
7923,2019-02-06,,Double Jeopardy,"(2, 5)",INDEPENDENT BOOKSTORES,18,"(2000,)",False,"Calling itself ""the world's largest independent bookstore"", this store was once a Portland, Ore. car dealership",Powell\'s,1,0
7923,2019-02-06,,Double Jeopardy,"(3, 5)",GOOD FELLOWS,15,"(2000,)",False,"This slain IRA head known as ""The Big Fellow"" was played on film by big fellow Liam Neeson",Michael Collins,1,0
7923,2019-02-06,,Double Jeopardy,"(4, 5)",WOMEN OF THE BIBLE,30,"(2000,)",False,"In Acts, after Tabitha dies, this early Christian leader brings her back to life",Peter,0,3
7923,2019-02-06,,Double Jeopardy,"(5, 5)",NAME THE COMPOSER,10,"(2000,)",False,"Of the song ""Weird Science"" & the music for the ""Fifty Shades"" movies",Danny Elfman,1,0
7923,2019-02-06,,Double Jeopardy,"(6, 5)","""SOCK"" IT TO ME",24,"(2000,)",False,An industrial city of northern Rhode Island on the Blackstone River,Woonsocket,0,3
7923,2019-02-06,,Final Jeopardy,"(1, 1)",INTERNATIONAL BORDERS,0,"(13200, 13500, 7801)",False,"Germany has land borders with 9 countries & only maritime boundaries with 2 countries, the U.K. & this one across the Baltic",Sweden,1,2
