epNum,airDate,extra_info,round_name,coord,category,order,value,daily_double,question,answer,correctAttempts,wrongAttempts
801,1988-02-15,1988 Teen Tournament semifinal game 1.,Jeopardy,"(1, 1)",ZOOLOGY,24,"(100,)",False,"These, sometimes called ""white ants"", think it's lunchtime if you yell ""Timber!""",termites,0,3
801,1988-02-15,1988 Teen Tournament semifinal game 1.,Jeopardy,"(2, 1)",BASKETBALL,26,"(100,)",False,"In 1936, a team from Universal Studios comprised nearly half of the U.S. basketball squad for these",the Olympic Games,1,0
801,1988-02-15,1988 Teen Tournament semifinal game 1.,Jeopardy,"(3, 1)",TEENS ON TV,25,"(100,)",False,"He looks a lot younger, but this ""Webster"" star is 16 years old",Emmanuel Lewis,1,0
801,1988-02-15,1988 Teen Tournament semifinal game 1.,Jeopardy,"(4, 1)",THE BIBLE,20,"(100,)",False,Harper's Bible Dictionary says this queen probably visited Solomon to set up an alliance & trade zones,Queen of Sheba,1,0
801,1988-02-15,1988 Teen Tournament semifinal game 1.,Jeopardy,"(1, 2)",ZOOLOGY,12,"(200,)",False,"A crossbreeding experiment in Brazil resulted in accidental escape of these ""homicidal"" hive dwellers",killer bees,1,1
801,1988-02-15,1988 Teen Tournament semifinal game 1.,Jeopardy,"(2, 2)",BASKETBALL,15,"(200,)",False,"In a ""bonus situation"", a fouled player shoots these",foul shots (free throws),1,0
801,1988-02-15,1988 Teen Tournament semifinal game 1.,Jeopardy,"(3, 2)",TEENS ON TV,22,"(200,)",False,"When this comedy series premiered in 1984, Denise was supposed to be 16 & Theo was 14",The Cosby Show,1,0
801,1988-02-15,1988 Teen Tournament semifinal game 1.,Jeopardy,"(4, 2)",THE BIBLE,19,"(200,)",False,"The famous tower was built at Babel, Hebrew for this famous city",Babylon,1,0
801,1988-02-15,1988 Teen Tournament semifinal game 1.,Jeopardy,"(6, 2)","""LING"" O",2,"(200,)",False,A baby mallard,duckling,1,1
801,1988-02-15,1988 Teen Tournament semifinal game 1.,Jeopardy,"(1, 3)",ZOOLOGY,11,"(300,)",False,"The banded anteater has some 50 of these, more than any other land mammal, but doesn't use them for eating",teeth,1,1
801,1988-02-15,1988 Teen Tournament semifinal game 1.,Jeopardy,"(2, 3)",BASKETBALL,14,"(300,)",False,"He led Indiana State U. to 1979 NCAA finals, losing to Michigan State, led by Magic Johnson",Larry Bird,1,0
801,1988-02-15,1988 Teen Tournament semifinal game 1.,Jeopardy,"(3, 3)",TEENS ON TV,17,"(300,)",False,"This nighttime soap features Tonya Crowe as Olivia Cunningham, Abby's troubled teenage daughter",Knot\'s Landing,1,0
801,1988-02-15,1988 Teen Tournament semifinal game 1.,Jeopardy,"(4, 3)",THE BIBLE,18,"(300,)",False,Jesus was crucified along with 2 men guilty of this crime,stealing (theft),1,0
801,1988-02-15,1988 Teen Tournament semifinal game 1.,Jeopardy,"(5, 3)",THE GIRL SCOUTS,21,"(300,)",False,"Of Brownies, Juniors or Daisies, the youngest division of Girl Scouts",Daisies,1,1
801,1988-02-15,1988 Teen Tournament semifinal game 1.,Jeopardy,"(6, 3)","""LING"" O",1,"(300,)",True,Word in full title of the following that fits the category:,feeling,0,1
801,1988-02-15,1988 Teen Tournament semifinal game 1.,Jeopardy,"(1, 4)",ZOOLOGY,10,"(400,)",False,"The dibitag, klipspringer & bongo are 3 types of these",antelopes,0,3
801,1988-02-15,1988 Teen Tournament semifinal game 1.,Jeopardy,"(2, 4)",BASKETBALL,13,"(400,)",False,"Area under the basket next to the end line, or a rear entrance",back door,0,3
801,1988-02-15,1988 Teen Tournament semifinal game 1.,Jeopardy,"(3, 4)",TEENS ON TV,16,"(400,)",False,"The 2 sitcoms in which Jason Bateman & his sister Justine star, they share a word in their titles",Valerie\'s Family & Family Ties,1,0
801,1988-02-15,1988 Teen Tournament semifinal game 1.,Jeopardy,"(4, 4)",THE BIBLE,9,"(400,)",False,"He called himself ""The Least of the Apostles"" because he had persecuted the early Christians",Paul,1,0
801,1988-02-15,1988 Teen Tournament semifinal game 1.,Jeopardy,"(5, 4)",THE GIRL SCOUTS,23,"(400,)",False,"The only Supreme Court justice who used to be a Girl Scout, as far as we know",Sandra Day O\'Connor,1,0
801,1988-02-15,1988 Teen Tournament semifinal game 1.,Jeopardy,"(6, 4)","""LING"" O",3,"(400,)",False,British coin worth 12 pence or 5 new pence,shilling,1,0
801,1988-02-15,1988 Teen Tournament semifinal game 1.,Jeopardy,"(1, 5)",ZOOLOGY,7,"(500,)",False,Mollusks who have shells with 2 similar halves are classed as these,bivalves,1,0
801,1988-02-15,1988 Teen Tournament semifinal game 1.,Jeopardy,"(2, 5)",BASKETBALL,5,"(500,)",False,"Teaching a rowdy P.E. class, he tried rugby, soccer & lacrosse, then in desperation invented basketball",(Dr. James) Naismith,1,0
801,1988-02-15,1988 Teen Tournament semifinal game 1.,Jeopardy,"(3, 5)",TEENS ON TV,8,"(500,)",False,"Teenage actor Wil Wheaton plays Wesley Crusher, teenage son of the doctor aboard this huge ship",(U.) S.S. Enterprise,1,0
801,1988-02-15,1988 Teen Tournament semifinal game 1.,Jeopardy,"(4, 5)",THE BIBLE,6,"(500,)",False,"Moses taught the Israelites, ""Love ye therefore the stranger: for ye were strangers in"" this land",Egypt,1,0
801,1988-02-15,1988 Teen Tournament semifinal game 1.,Jeopardy,"(6, 5)","""LING"" O",4,"(500,)",False,"A slight hint, even the faintest one",inkling,1,0
801,1988-02-15,1988 Teen Tournament semifinal game 1.,Double Jeopardy,"(1, 1)",HISTORICAL OPERAS,19,"(200,)",False,"In Verdi's opera about him, this Hun is stabbed to death by his fiancee Odabella",Attila the Hun,1,0
801,1988-02-15,1988 Teen Tournament semifinal game 1.,Double Jeopardy,"(2, 1)",ASIA,27,"(200,)",False,Country partly in Europe which also occupies the peninsula known as Asia Minor,Turkey,1,0
801,1988-02-15,1988 Teen Tournament semifinal game 1.,Double Jeopardy,"(3, 1)",INVENTIONS,24,"(200,)",False,"In the 1780s, Ben Franklin invented these, & what a sight for sore eyes they were",bifocals,1,0
801,1988-02-15,1988 Teen Tournament semifinal game 1.,Double Jeopardy,"(4, 1)",STATE FLAGS,26,"(200,)",False,"Ship accessory pictured on flag of Wisconsin & Rhode Island, it's also found on Popeye's arm",anchor,1,0
801,1988-02-15,1988 Teen Tournament semifinal game 1.,Double Jeopardy,"(5, 1)",ELIZABETHS,29,"(200,)",False,"She also played cousin Serena on ""Bewitched""",Elizabeth Montgomery,1,0
801,1988-02-15,1988 Teen Tournament semifinal game 1.,Double Jeopardy,"(6, 1)",ONLYS,25,"(200,)",False,"1 of only 3 universities in the United States whose name starts with ""Y""",Yeshiva (or Yale or Youngstown State),1,0
801,1988-02-15,1988 Teen Tournament semifinal game 1.,Double Jeopardy,"(1, 2)",HISTORICAL OPERAS,15,"(400,)",False,"""Les Huguenots"", which deals which a 16th century massacre, is set in this country",France,1,0
801,1988-02-15,1988 Teen Tournament semifinal game 1.,Double Jeopardy,"(2, 2)",ASIA,28,"(400,)",False,These 2 Asian countries each have more people than any other continent outside Asia,India & China,1,0
801,1988-02-15,1988 Teen Tournament semifinal game 1.,Double Jeopardy,"(3, 2)",INVENTIONS,23,"(400,)",False,He sent musical notes over the wire months before his famous message to Watson,Alexander Graham Bell,1,1
801,1988-02-15,1988 Teen Tournament semifinal game 1.,Double Jeopardy,"(4, 2)",STATE FLAGS,20,"(400,)",False,This state's flag has the letters D-A-N-E-V-A around a star,Nevada,1,0
801,1988-02-15,1988 Teen Tournament semifinal game 1.,Double Jeopardy,"(5, 2)",ELIZABETHS,30,"(400,)",False,She resigned from the Reagan cabinet in fall of 1987 to help her husband's presidential campaign,Elizabeth Dole,1,0
801,1988-02-15,1988 Teen Tournament semifinal game 1.,Double Jeopardy,"(6, 2)",ONLYS,17,"(400,)",False,"Of the 9 major planets in our solar system, only these are over 1 billion miles away from the sun","Pluto, Neptune & Uranus",1,0
801,1988-02-15,1988 Teen Tournament semifinal game 1.,Double Jeopardy,"(1, 3)",HISTORICAL OPERAS,14,"(600,)",False,"This ""Terrible"" tyrant is a major character in Rimsky-Korsakov's opera ""The Maid of Pskov""",Ivan the Terrible,1,0
801,1988-02-15,1988 Teen Tournament semifinal game 1.,Double Jeopardy,"(2, 3)",ASIA,12,"(3000,)",True,1 of the Asian national capitals that have 2 words in their names,New Delhi (or Ulan Bator or Phnom Penh),1,0
801,1988-02-15,1988 Teen Tournament semifinal game 1.,Double Jeopardy,"(3, 3)",INVENTIONS,16,"(600,)",False,"This scientific instrument's name is from the Greek for ""small look""",microscope,1,0
801,1988-02-15,1988 Teen Tournament semifinal game 1.,Double Jeopardy,"(4, 3)",STATE FLAGS,18,"(600,)",False,"Along with the North Star, this star group appears on the Alaska state flag",the Big Dipper,0,3
801,1988-02-15,1988 Teen Tournament semifinal game 1.,Double Jeopardy,"(5, 3)",ELIZABETHS,22,"(600,)",False,"Elizabeth Bowes-Lyon, beloved widow of British king George VI, is best known by this title",the Queen Mother,0,3
801,1988-02-15,1988 Teen Tournament semifinal game 1.,Double Jeopardy,"(6, 3)",ONLYS,10,"(600,)",False,"If you were born in June, you'll know this is the only birthstone that comes from an animal",pearl,0,3
801,1988-02-15,1988 Teen Tournament semifinal game 1.,Double Jeopardy,"(1, 4)",HISTORICAL OPERAS,1,"(800,)",False,"Rossini's 1829 masterpiece, set in Switzerland, is based on this hero",William Tell,1,1
801,1988-02-15,1988 Teen Tournament semifinal game 1.,Double Jeopardy,"(2, 4)",ASIA,3,"(800,)",False,"Country once known as the ""Switzerland of the Middle East""; nearly 1/2 of its GNP was lost between 1975-77",Lebanon,1,0
801,1988-02-15,1988 Teen Tournament semifinal game 1.,Double Jeopardy,"(3, 4)",INVENTIONS,5,"(800,)",False,Gutenberg's printing press was just a modified version of the device used to press these,grapes or olives,0,3
801,1988-02-15,1988 Teen Tournament semifinal game 1.,Double Jeopardy,"(4, 4)",STATE FLAGS,13,"(800,)",False,"One of the few flags to have a bird other than an eagle on it, this Southern state's has a pelican",Louisiana,1,0
801,1988-02-15,1988 Teen Tournament semifinal game 1.,Double Jeopardy,"(5, 4)",ELIZABETHS,7,"(800,)",False,"Born E. Wallace, this First Lady from Mo. was the childhood sweetheart of the president she married",Bess Truman,1,0
801,1988-02-15,1988 Teen Tournament semifinal game 1.,Double Jeopardy,"(6, 4)",ONLYS,9,"(800,)",False,The only U.S. state with a 1-syllable name,Maine,1,0
801,1988-02-15,1988 Teen Tournament semifinal game 1.,Double Jeopardy,"(1, 5)",HISTORICAL OPERAS,6,"(800,)",True,"In (the) last scene of Donizetti's opera, this 2nd wife of Henry VIII waits to be beheaded",Anne Boleyn,1,0
801,1988-02-15,1988 Teen Tournament semifinal game 1.,Double Jeopardy,"(2, 5)",ASIA,2,"(1000,)",False,"The U.N. considers the deposed ""Khmer Rouge"" the legitimate government of this S.E. Asian country",Cambodia,1,0
801,1988-02-15,1988 Teen Tournament semifinal game 1.,Double Jeopardy,"(3, 5)",INVENTIONS,4,"(1000,)",False,"In 1960, the 1st working laser used a synthetic version of this gem as its amplifier",ruby,1,0
801,1988-02-15,1988 Teen Tournament semifinal game 1.,Double Jeopardy,"(4, 5)",STATE FLAGS,11,"(1000,)",False,It's the reason the flag of Ohio has 17 stars on it,it\'s the 17th state,1,0
801,1988-02-15,1988 Teen Tournament semifinal game 1.,Double Jeopardy,"(5, 5)",ELIZABETHS,21,"(1000,)",False,This London st. became famous because of the romance between Elizabeth Barrett & Robert Browning,Wimpole Street,0,3
801,1988-02-15,1988 Teen Tournament semifinal game 1.,Double Jeopardy,"(6, 5)",ONLYS,8,"(1000,)",False,This novelist was the only one of the Bronte siblings to live past the age of 31,Charlotte,1,0
801,1988-02-15,1988 Teen Tournament semifinal game 1.,Final Jeopardy,"(1, 1)",1987,0,"(3600, 4850, 0)",False,"British Labor Party leader Neil Kinnock became well known in the U.S. after this man ""quoted"" him",Joseph Biden,3,0
