epNum,airDate,extra_info,round_name,coord,category,order,value,daily_double,question,answer,correctAttempts,wrongAttempts
8035,2019-07-12,Sam Kavanaugh game 3.,Jeopardy,"(1, 1)",WHAT'S THAT IN YOUR EAR?,6,"(200,)",False,The website for these hyphenated cottony ear swabbers has a page full of life hacks,Q-tips,1,0
8035,2019-07-12,Sam Kavanaugh game 3.,Jeopardy,"(2, 1)",3-LETTER READING,21,"(200,)",False,"A division of a play: Noel Coward's ""The Better Half"" has just one",an act,1,0
8035,2019-07-12,Sam Kavanaugh game 3.,Jeopardy,"(3, 1)",LET'S MAKE A NEW DEAL,1,"(200,)",False,"In a 1932 speech he introduced ""a New deal""",FDR,1,0
8035,2019-07-12,Sam Kavanaugh game 3.,Jeopardy,"(4, 1)",MEN IN BLACK,19,"(200,)",False,I know the men in black haunted Mulder on this TV show--I played one of them!,The X-Files,1,0
8035,2019-07-12,Sam Kavanaugh game 3.,Jeopardy,"(5, 1)",PITTSBURGH,11,"(200,)",False,"William Pitt the elder, for whom Pittsburgh is named, lived in this century",the 18th century,1,0
8035,2019-07-12,Sam Kavanaugh game 3.,Jeopardy,"(6, 1)",VOWEL FLOP,14,"(200,)",False,A helmsman of the Enterprise has his U's turned into O's & becomes this other space pilot,Solo,0,3
8035,2019-07-12,Sam Kavanaugh game 3.,Jeopardy,"(1, 2)",WHAT'S THAT IN YOUR EAR?,7,"(400,)",False,"Great for nap time, a foam type from Flents is called ""Quiet Please""",an earplug,1,0
8035,2019-07-12,Sam Kavanaugh game 3.,Jeopardy,"(2, 2)",3-LETTER READING,20,"(400,)",False,"The first paragraph of ""Great Expectations"" says, ""So, I called myself"" this",Pip,0,3
8035,2019-07-12,Sam Kavanaugh game 3.,Jeopardy,"(3, 2)",LET'S MAKE A NEW DEAL,2,"(400,)",False,The Federal Theater Project mounted an all-African-American version of this Shakespeare play set in Haiti instead of Scotland,Macbeth,1,0
8035,2019-07-12,Sam Kavanaugh game 3.,Jeopardy,"(4, 2)",MEN IN BLACK,25,"(400,)",False,19th century artist Hokusai is credited with the first image of these stealthy warriors wearing black,a ninja,1,0
8035,2019-07-12,Sam Kavanaugh game 3.,Jeopardy,"(5, 2)",PITTSBURGH,12,"(400,)",False,Jim Delligatti is credited with inventing this iconic sandwich at his Pittsburgh area McDonald's franchise in 1967,a Big Mac,1,0
8035,2019-07-12,Sam Kavanaugh game 3.,Jeopardy,"(6, 2)",VOWEL FLOP,15,"(400,)",False,"The ""Poker Face"" lady swaps her A's for I's & becomes this Oscar-winning movie",Gigi,1,0
8035,2019-07-12,Sam Kavanaugh game 3.,Jeopardy,"(1, 3)",WHAT'S THAT IN YOUR EAR?,8,"(600,)",False,The binaural type of this used by doctors to listen to your innards has 2 earpieces,a stethoscope,1,0
8035,2019-07-12,Sam Kavanaugh game 3.,Jeopardy,"(2, 3)",3-LETTER READING,22,"(600,)",False,Madonna bestseller,Sex,1,0
8035,2019-07-12,Sam Kavanaugh game 3.,Jeopardy,"(3, 3)",LET'S MAKE A NEW DEAL,3,"(600,)",False,"This 2019 resolution calls for renewable energy, healthy food, high-speed rail & help for the poor, elderly & homeless",the Green New Deal,1,0
8035,2019-07-12,Sam Kavanaugh game 3.,Jeopardy,"(4, 3)",MEN IN BLACK,26,"(600,)",False,"Josh Brolin played a younger version of this actor in ""Men in Black 3""",Tommy Lee Jones,1,0
8035,2019-07-12,Sam Kavanaugh game 3.,Jeopardy,"(5, 3)",PITTSBURGH,13,"(600,)",False,"Director George Romero worked for this Pittsburgh kids' TV legend, who came to the ""Night of the Living Dead"" premiere",Mr. Rogers,0,3
8035,2019-07-12,Sam Kavanaugh game 3.,Jeopardy,"(6, 3)",VOWEL FLOP,16,"(600,)",False,Netanyahu's nickname trades its I's for A's to become this rum cake,baba,1,0
8035,2019-07-12,Sam Kavanaugh game 3.,Jeopardy,"(1, 4)",WHAT'S THAT IN YOUR EAR?,9,"(800,)",False,"Styles of these helpers include BTE, behind the ear, & CIC, completely in the canal",hearing aids,1,0
8035,2019-07-12,Sam Kavanaugh game 3.,Jeopardy,"(2, 4)",3-LETTER READING,23,"(800,)",False,Typical poem by ancient Greek poet Pindar,an ode,1,0
8035,2019-07-12,Sam Kavanaugh game 3.,Jeopardy,"(3, 4)",LET'S MAKE A NEW DEAL,4,"(800,)",False,1935's Wagner Act established the National Labor Relations Board & strengthened collective this,bargaining,1,0
8035,2019-07-12,Sam Kavanaugh game 3.,Jeopardy,"(4, 4)",MEN IN BLACK,27,"(800,)",False,"""Go Away White"" is the 2008 reunion album by this Peter Murphy band that wore black & led many gloomy teens to do the same",Bauhaus,1,0
8035,2019-07-12,Sam Kavanaugh game 3.,Jeopardy,"(5, 4)",PITTSBURGH,29,"(800,)",False,"Located where its 3 rivers meet, Pittsburgh's business district is AKA ""The Golden"" this",triangle,1,0
8035,2019-07-12,Sam Kavanaugh game 3.,Jeopardy,"(6, 4)",VOWEL FLOP,17,"(800,)",False,Hawaii's state bird swaps its vowels for A's & turns into this relative,nana,0,3
8035,2019-07-12,Sam Kavanaugh game 3.,Jeopardy,"(1, 5)",WHAT'S THAT IN YOUR EAR?,10,"(1000,)",False,"Of the 3 bones in the ear, the one that sounds like it's best suited for horse riding",a stirrup,1,0
8035,2019-07-12,Sam Kavanaugh game 3.,Jeopardy,"(2, 5)",3-LETTER READING,24,"(1000,)",False,"""The Kitchen God's Wife"" author",Amy Tan,0,3
8035,2019-07-12,Sam Kavanaugh game 3.,Jeopardy,"(3, 5)",LET'S MAKE A NEW DEAL,5,"(1400,)",True,"In the NRA of the 1930s New Deal, the ""R"" stood for this",recovery,0,1
8035,2019-07-12,Sam Kavanaugh game 3.,Jeopardy,"(4, 5)",MEN IN BLACK,28,"(1000,)",False,"This Oscar-winning actor is all sorts of bad as the man in black in ""The Dark Tower"", based on the Stephen King novels",Matthew McConaughey,1,0
8035,2019-07-12,Sam Kavanaugh game 3.,Jeopardy,"(5, 5)",PITTSBURGH,30,"(1000,)",False,The University of Pittsburgh's Cathedral of Learning is in the architectural style known as this revival,Gothic,1,0
8035,2019-07-12,Sam Kavanaugh game 3.,Jeopardy,"(6, 5)",VOWEL FLOP,18,"(1000,)",False,An affectionate name for your mother switches its vowels & becomes this nickname of Mariah Carey,Mimi,1,0
8035,2019-07-12,Sam Kavanaugh game 3.,Double Jeopardy,"(1, 1)",DESERT-POURRI,1,"(400,)",False,"Ernest Giles' journal of crossing Australia's deserts says, ""Oh, would that I had"" these! ""What are horses in such a region?""",camels,1,0
8035,2019-07-12,Sam Kavanaugh game 3.,Double Jeopardy,"(2, 1)",ACRONYMS & ABBREVS.,26,"(400,)",False,"B.C. stands for ""before Christ"", B.C.E. stands for ""before"" this",before common era,1,0
8035,2019-07-12,Sam Kavanaugh game 3.,Double Jeopardy,"(3, 1)",THE OLYMPIC GAMES,27,"(400,)",False,"Before the Olympics went all-metric, the 1904 games had events like the 880 of these units freestyle swim",yards,1,0
8035,2019-07-12,Sam Kavanaugh game 3.,Double Jeopardy,"(4, 1)","SECOND LETTER ""Y""",28,"(400,)",False,Blake Carrington is the patriarch on this 1980s primetime soap rebooted in 2017,Dynasty,1,0
8035,2019-07-12,Sam Kavanaugh game 3.,Double Jeopardy,"(5, 1)",ALIEN INVASION!,29,"(400,)",False,The Asian tiger type of this insect found throughout the U.S. can transmit diseases like the Zika & West Nile viruses,the mosquito,1,0
8035,2019-07-12,Sam Kavanaugh game 3.,Double Jeopardy,"(6, 1)",TAKE ME TO YOUR LIEDER,30,"(400,)",False,"Typically, 19th century lieder, or songs, were arranged for 1 vocalist & 1 accompanist on this instrument",a piano,1,0
8035,2019-07-12,Sam Kavanaugh game 3.,Double Jeopardy,"(1, 2)",DESERT-POURRI,2,"(800,)",False,The nomadic Tuareg people speak a Berber-related dialect & call this desert home,the Sahara,1,0
8035,2019-07-12,Sam Kavanaugh game 3.,Double Jeopardy,"(2, 2)",ACRONYMS & ABBREVS.,14,"(800,)",False,"The slang term PDA is short for this, like smooching at the movies",public displays of affection,1,0
8035,2019-07-12,Sam Kavanaugh game 3.,Double Jeopardy,"(3, 2)",THE OLYMPIC GAMES,10,"(800,)",False,In 1994 Oksana Baiul edged out this famously injured American for figure skating gold,Nancy Kerrigan,1,0
8035,2019-07-12,Sam Kavanaugh game 3.,Double Jeopardy,"(4, 2)","SECOND LETTER ""Y""",20,"(800,)",False,"It describes futuristic novels full of doom & gloom & oppressive societies like ""The Hunger Games"" series",dystopian,1,0
8035,2019-07-12,Sam Kavanaugh game 3.,Double Jeopardy,"(5, 2)",ALIEN INVASION!,7,"(800,)",False,"Able to grow to more than 20 feet in length, the Burmese type of this snake is now widespread in Florida's wetlands",a python,1,0
8035,2019-07-12,Sam Kavanaugh game 3.,Double Jeopardy,"(6, 2)",TAKE ME TO YOUR LIEDER,18,"(800,)",False,Lieder date back to the 12th century but really hit their stride during this emotional musical era that began in the 18th century,the Romantic era,1,0
8035,2019-07-12,Sam Kavanaugh game 3.,Double Jeopardy,"(1, 3)",DESERT-POURRI,3,"(1200,)",False,Dry doesn't mean dull with sites like the rocks of Rainbow Valley in this country's Atacama Desert,Chile,1,0
8035,2019-07-12,Sam Kavanaugh game 3.,Double Jeopardy,"(2, 3)",ACRONYMS & ABBREVS.,15,"(1200,)",False,Take a deep dive & tell us what SCUBA is an acronym for,self-contained underwater breathing apparatus,1,0
8035,2019-07-12,Sam Kavanaugh game 3.,Double Jeopardy,"(3, 3)",THE OLYMPIC GAMES,13,"(1200,)",False,The 1924 Olympics played backdrop to this film about 2 British runners,Chariots of Fire,1,0
8035,2019-07-12,Sam Kavanaugh game 3.,Double Jeopardy,"(4, 3)","SECOND LETTER ""Y""",19,"(1200,)",False,Constantine the Great is considered the first emperor of this empire,Byzantine,1,0
8035,2019-07-12,Sam Kavanaugh game 3.,Double Jeopardy,"(5, 3)",ALIEN INVASION!,6,"(1200,)",False,This variety of fruit fly invaded California in the 1980s & led to U.S. quarantine laws,the Mediterranean fruit fly,0,3
8035,2019-07-12,Sam Kavanaugh game 3.,Double Jeopardy,"(6, 3)",TAKE ME TO YOUR LIEDER,23,"(1200,)",False,"The French followed the Germans' lied with a form called melodie, like Henri Duparc's this French word for song ""Triste""",chanson,0,3
8035,2019-07-12,Sam Kavanaugh game 3.,Double Jeopardy,"(1, 4)",DESERT-POURRI,4,"(1600,)",False,In 1990 protecting Saudi Arabia from Iraqi troops was dubbed Operation this; Desert Storm soon followed,Desert Shield,1,0
8035,2019-07-12,Sam Kavanaugh game 3.,Double Jeopardy,"(2, 4)",ACRONYMS & ABBREVS.,16,"(1600,)",False,"Seen on pay stubs, FICA is short for these 2 words ""Contributions Act""",federal insurance,0,3
8035,2019-07-12,Sam Kavanaugh game 3.,Double Jeopardy,"(3, 4)",THE OLYMPIC GAMES,12,"(1600,)",False,"The 1968 Olympics in Grenoble were dubbed the ""Killympics"" after the exploits of a man in this sport",skier,0,3
8035,2019-07-12,Sam Kavanaugh game 3.,Double Jeopardy,"(4, 4)","SECOND LETTER ""Y""",21,"(1600,)",False,They're the showy blooms seen here,hydrangeas,1,0
8035,2019-07-12,Sam Kavanaugh game 3.,Double Jeopardy,"(5, 4)",ALIEN INVASION!,8,"(1600,)",False,This predator with a feline name has expanded from the Pacific to coastal areas of the Atlantic & Caribbean as well,the lionfish,1,0
8035,2019-07-12,Sam Kavanaugh game 3.,Double Jeopardy,"(6, 4)",TAKE ME TO YOUR LIEDER,24,"(1600,)",False,"Discovered in 2017, ""Lied vom Weissen Käse"", or ""Song of the White Cheese"", is by this composer who often worked with Bertolt Brecht",Kurt Weill,0,3
8035,2019-07-12,Sam Kavanaugh game 3.,Double Jeopardy,"(1, 5)",DESERT-POURRI,5,"(7400,)",True,This sea is the western border of the Arabian Desert,the Red Sea,1,0
8035,2019-07-12,Sam Kavanaugh game 3.,Double Jeopardy,"(2, 5)",ACRONYMS & ABBREVS.,17,"(2000,)",False,"The ""C"" in ASCII, used in computing, stands for this",code,1,0
8035,2019-07-12,Sam Kavanaugh game 3.,Double Jeopardy,"(3, 5)",THE OLYMPIC GAMES,11,"(2000,)",False,"A field event, the long jump favors athletes with track star speed, like this U.S. man who won 4 straight golds in the event",Carl Lewis,1,1
8035,2019-07-12,Sam Kavanaugh game 3.,Double Jeopardy,"(4, 5)","SECOND LETTER ""Y""",22,"(2000,)",False,This jellylike substance that fills the cells of an organism contains mitochondria & ribosomes,cytoplasm,0,3
8035,2019-07-12,Sam Kavanaugh game 3.,Double Jeopardy,"(5, 5)",ALIEN INVASION!,9,"(2000,)",False,Apis mellifera scutellata is best known by this scary name & came from Africa to Brazil to the United States,killer bees,1,0
8035,2019-07-12,Sam Kavanaugh game 3.,Double Jeopardy,"(6, 5)",TAKE ME TO YOUR LIEDER,25,"(2000,)",True,"This Vienna-born composer was only 17 when he wrote ""Gretchen at the Spinning Wheel"" & changed the lieder game in 1814",Franz Schubert,0,1
8035,2019-07-12,Sam Kavanaugh game 3.,Final Jeopardy,"(1, 1)",WORD ORIGINS,0,"(6500, 14700, 12401)",False,"19th c. boots made with India rubber made one quieter, leading to this slang term for one whose job involves surveillance",a gumshoe,2,1
