epNum,airDate,extra_info,round_name,coord,category,order,value,daily_double,question,answer,correctAttempts,wrongAttempts
8069,2019-10-10,,Jeopardy,"(1, 1)",A JOB IN TV,1,"(200,)",False,In 2019 Conan O'Brien cut a half hour from his TBS show but kept this sidekick,(Andy) Richter,1,0
8069,2019-10-10,,Jeopardy,"(2, 1)","DOUBLE ""Z"" WORDS",6,"(200,)",False,"To silence something, like a dog",muzzle,0,3
8069,2019-10-10,,Jeopardy,"(3, 1)",20th CENTURY NOVELS,16,"(200,)",False,A futuristic society revolves around science & efficiency in this 1932 novel by Aldous Huxley,Brave New World,1,0
8069,2019-10-10,,Jeopardy,"(4, 1)",BOLD STRATEGY,30,"(200,)",False,"Starving in this type of standoff, a Portuguese town threw the last of its bread over the walls & asked the foe, ""Need more?""",siege,1,0
8069,2019-10-10,,Jeopardy,"(5, 1)",COTTON,29,"(200,)",False,Here's Gandhi sitting at one of his favorite tools--the charka--one of these,a spinning wheel,1,0
8069,2019-10-10,,Jeopardy,"(6, 1)",LET'S SEE IF IT PAYS OFF FOR 'EM,21,"(200,)",False,"In 1892 baking powder salesman William Wrigley began throwing in 2 packages of this with each can, which worked out okay",chewing gum,1,0
8069,2019-10-10,,Jeopardy,"(1, 2)",A JOB IN TV,2,"(400,)",False,"For years, Petri Hawkins Byrd, working in this job, has handed documents to Judge Judy",bailiff,1,0
8069,2019-10-10,,Jeopardy,"(2, 2)","DOUBLE ""Z"" WORDS",7,"(400,)",False,It can be a low story or balcony between 2 other floors in a building or theater,mezzanine,1,0
8069,2019-10-10,,Jeopardy,"(3, 2)",20th CENTURY NOVELS,17,"(400,)",False,"""A House Divided"" completed Pearl Buck's trilogy that began 4 years earlier with this Pulitzer Prize-winning novel",The Good Earth,1,0
8069,2019-10-10,,Jeopardy,"(4, 2)",BOLD STRATEGY,11,"(400,)",False,"To try to stop the American offensive in the Battle of the Leyte Gulf, the Japanese used this ""divine wind"" tactic",kamikaze,1,0
8069,2019-10-10,,Jeopardy,"(5, 2)",COTTON,28,"(400,)",False,In 1794 he was granted a patent for his cotton gin,Eli Whitney,1,0
8069,2019-10-10,,Jeopardy,"(6, 2)",LET'S SEE IF IT PAYS OFF FOR 'EM,22,"(400,)",False,"In 1927, 4 years after starting a movie company with his brother, he decided to go all-cartoon",Walt Disney,1,0
8069,2019-10-10,,Jeopardy,"(1, 3)",A JOB IN TV,3,"(600,)",False,"The mother of this ""Black-ish"" actor is scorekeeper when he hosts ""To Tell the Truth""",Anthony Anderson,1,0
8069,2019-10-10,,Jeopardy,"(2, 3)","DOUBLE ""Z"" WORDS",8,"(600,)",False,To drink quickly & with great enthusiasm,guzzle,1,0
8069,2019-10-10,,Jeopardy,"(3, 3)",20th CENTURY NOVELS,18,"(600,)",False,"A line from this novel: ""Name's Joad, Tom Joad""",The Grapes of Wrath,1,0
8069,2019-10-10,,Jeopardy,"(4, 3)",BOLD STRATEGY,12,"(600,)",False,"A feigned this move--ooh, you're too strong! We're afraid! Let's run!--helped William the Conqueror to victory at Hastings",a retreat,1,0
8069,2019-10-10,,Jeopardy,"(5, 3)",COTTON,15,"(600,)",False,This title creature from a 1922 tale with cotton fabric in his name also has thread whiskers & ears lined with pink sateen,The Velveteen Rabbit,1,0
8069,2019-10-10,,Jeopardy,"(6, 3)",LET'S SEE IF IT PAYS OFF FOR 'EM,23,"(600,)",False,"In 1996, one year after its founding, AuctionWeb moved more than $7 million in merchandise & in 1997 got this new name",eBay,1,0
8069,2019-10-10,,Jeopardy,"(1, 4)",A JOB IN TV,4,"(800,)",False,"With this French-named front of the house job, Marino Monferrato keeps diners happy at ""Hell's Kitchen""",maître d\',1,0
8069,2019-10-10,,Jeopardy,"(2, 4)","DOUBLE ""Z"" WORDS",9,"(800,)",False,You've got 2 sets of double Z's in this 7-letter word! The exciting quality of an energetic personality,pizzazz,1,0
8069,2019-10-10,,Jeopardy,"(3, 4)",20th CENTURY NOVELS,19,"(800,)",False,This novel by Garcia Marquez tells of the Buendia family in the mythic town of Macondo from the 1820s to the 1920s,One Hundred Years of Solitude,1,0
8069,2019-10-10,,Jeopardy,"(4, 4)",BOLD STRATEGY,13,"(2400,)",True,"An ""and"" is in the middle of this strategy used by the Romans to foster feuds among smaller entities they were trying to rule",divide and conquer,1,0
8069,2019-10-10,,Jeopardy,"(5, 4)",COTTON,26,"(800,)",False,Weevils know that cotton comes from little pods called these,bolls,1,0
8069,2019-10-10,,Jeopardy,"(6, 4)",LET'S SEE IF IT PAYS OFF FOR 'EM,24,"(800,)",False,"Created to show girls they could be anything they wanted to be, this toy debuted--to some skepticism--at a 1959 toy fair",the Barbie doll,1,0
8069,2019-10-10,,Jeopardy,"(1, 5)",A JOB IN TV,5,"(1000,)",False,Guillermo Rodriguez is much more than just a security guard on this late-night talk show,Jimmy Kimmel,1,0
8069,2019-10-10,,Jeopardy,"(2, 5)","DOUBLE ""Z"" WORDS",10,"(1000,)",False,It's stone flooring of marble or granite set in concrete and polished to a smooth surface,terrazzo,0,3
8069,2019-10-10,,Jeopardy,"(3, 5)",20th CENTURY NOVELS,20,"(1000,)",False,"Nadsat, the fictional language in this book, is from the Russian suffix that means ""teen""",A Clockwork Orange,1,1
8069,2019-10-10,,Jeopardy,"(4, 5)",BOLD STRATEGY,14,"(1000,)",False,Gen. von Manstein convinced Hitler to attack France in 1940 through this wooded area also in Belgium & Luxembourg --it worked,the Ardennes,0,3
8069,2019-10-10,,Jeopardy,"(5, 5)",COTTON,27,"(1000,)",False,Edison's patent for his first light bulb mentions testing carbonized cotton threads as a possibility for this component,a filament,1,0
8069,2019-10-10,,Jeopardy,"(6, 5)",LET'S SEE IF IT PAYS OFF FOR 'EM,25,"(1000,)",False,"Last names of William & Arthur, who partnered in 1903, 2 years after William drew a blue-print of an engine on a bicycle",Harley and Davidson,1,0
8069,2019-10-10,,Double Jeopardy,"(1, 1)",THEY SAID NO!,1,"(400,)",False,"Director Danny Boyle was offered a knighthood for his work on the London Olympics held in this year, but said no",2012,1,0
8069,2019-10-10,,Double Jeopardy,"(2, 1)",4-LETTER PLACES,26,"(400,)",False,"This Italian island honors Napoleon with an annual mass on May 5, the anniversary of his death",Elba,1,1
8069,2019-10-10,,Double Jeopardy,"(3, 1)",TECH TALK,25,"(400,)",False,"In engineering the Rockwell test, measuring this, involves pressing a steel ball or diamond point into a surface",hardness,1,0
8069,2019-10-10,,Double Jeopardy,"(4, 1)",OLD PHRASES,6,"(400,)",False,"This Scottish phrase meaning ""old long since"" is used of times remembered with fondness",auld lang syne,1,0
8069,2019-10-10,,Double Jeopardy,"(5, 1)","THE ""NIGHT"" WATCH",11,"(400,)",False,Billy Bob Thornton played coach Gary Gaines in this film; the TV show of the same name had Kyle Chandler as coach Eric Taylor,Friday Night Lights,1,0
8069,2019-10-10,,Double Jeopardy,"(6, 1)",BOOKS GOING BACK IN TIME,16,"(400,)",False,"Garry Wills' 1992 ""Lincoln at"" this place examines an event sixscore & nine years previous",Gettysburg,1,0
8069,2019-10-10,,Double Jeopardy,"(1, 2)",THEY SAID NO!,2,"(800,)",False,"American James Watson took an honorary knighthood, but this British partner turned the real thing down",Francis Crick,1,0
8069,2019-10-10,,Double Jeopardy,"(2, 2)",4-LETTER PLACES,27,"(8000,)",True,This capital of Hyogo Prefecture on Honshu is all the rage in beef,Kobe,1,0
8069,2019-10-10,,Double Jeopardy,"(3, 2)",TECH TALK,24,"(800,)",False,Air traffic controllers know airmets are in-flight advisories about changes in this,weather,1,1
8069,2019-10-10,,Double Jeopardy,"(4, 2)",OLD PHRASES,7,"(800,)",False,"The ""Aeneid"" is the source of the phrase ""Beware of"" these ""bearing gifts""",Greeks,1,0
8069,2019-10-10,,Double Jeopardy,"(5, 2)","THE ""NIGHT"" WATCH",12,"(800,)",False,A group of dropouts are trying to get their G.E.D.s in this film starring Tiffany Haddish & Kevin Hart,Night School,1,0
8069,2019-10-10,,Double Jeopardy,"(6, 2)",BOOKS GOING BACK IN TIME,17,"(800,)",False,"The New Orleans Advocate reported a ""flood of books"" for this event's 10th anniversary, including ""Cooking Up a Storm""",Hurricane Katrina,1,0
8069,2019-10-10,,Double Jeopardy,"(1, 3)",THEY SAID NO!,3,"(1200,)",False,"There would be no Sir Ziggy Stardust after this rocker turned down knighthood, saying, ""I seriously don't know what it's for""",David Bowie,1,0
8069,2019-10-10,,Double Jeopardy,"(2, 3)",4-LETTER PLACES,28,"(1200,)",False,"Founded in the 11th century, this capital lies at the head of a fjord",Oslo,1,0
8069,2019-10-10,,Double Jeopardy,"(3, 3)",TECH TALK,23,"(1200,)",False,"Aerospace experts are familiar with nanometers, these tiny fractions of a meter",billionths of a meter,1,0
8069,2019-10-10,,Double Jeopardy,"(4, 3)",OLD PHRASES,8,"(1200,)",False,"Mercutio says ""a plague o' both your houses"", but often people say this other ""P"" word instead of ""plague""",pox,1,0
8069,2019-10-10,,Double Jeopardy,"(5, 3)","THE ""NIGHT"" WATCH",13,"(2500,)",True,"1967 film in which Sidney Poitier clarifies, ""They call me Mr. Tibbs!""",In the Heat of the Night,0,1
8069,2019-10-10,,Double Jeopardy,"(6, 3)",BOOKS GOING BACK IN TIME,18,"(1200,)",False,It's the title town where 2 former Texas Rangers live in the 1870s in a classic novel by Larry McMurtry,Lonesome Dove,1,0
8069,2019-10-10,,Double Jeopardy,"(1, 4)",THEY SAID NO!,4,"(1600,)",False,"This 2013 Nobelist with a boson named for him didn't want to be a knight, saying the whole system is too political",(Peter) Higgs,1,0
8069,2019-10-10,,Double Jeopardy,"(2, 4)",4-LETTER PLACES,29,"(1600,)",False,Niger is to the west & Sudan to the east of this African country,Chad,1,0
8069,2019-10-10,,Double Jeopardy,"(3, 4)",TECH TALK,22,"(1600,)",False,"The ""data"" type of this activity is looking for patterns; it's also what people do to get bitcoins",mining,1,0
8069,2019-10-10,,Double Jeopardy,"(4, 4)",OLD PHRASES,9,"(1600,)",False,"Modification made tunics practical for work; one tweak allowed mobility & gave us this phrase meaning ""to prepare for action""",to gird your loins,0,3
8069,2019-10-10,,Double Jeopardy,"(5, 4)","THE ""NIGHT"" WATCH",14,"(1600,)",False,Bounty hunter Robert de Niro is escorting bail-jumping accountant Charles Grodin to L.A. in this 1988 comedy,Midnight Run,0,3
8069,2019-10-10,,Double Jeopardy,"(6, 4)",BOOKS GOING BACK IN TIME,19,"(1600,)",False,"""I woke to the sound of a mosquito whining in my left ear"", begins 2000's ""Fever 1793"", about an epidemic of this disease",yellow fever,1,0
8069,2019-10-10,,Double Jeopardy,"(1, 5)",THEY SAID NO!,5,"(2000,)",False,"In 1918 this man refused a knighthood, saying King George V had betrayed the Arabs by not granting independence",Lawrence (of Arabia),1,0
8069,2019-10-10,,Double Jeopardy,"(3, 5)",TECH TALK,21,"(2000,)",False,Your auto mechanic knows the PCV filter provides positive ventilation of this engine housing,the crankcase,0,3
8069,2019-10-10,,Double Jeopardy,"(4, 5)",OLD PHRASES,10,"(2000,)",False,"This biblical prophet ""come to judgment"" is someone who has given some sage advice",Daniel,0,3
8069,2019-10-10,,Double Jeopardy,"(5, 5)","THE ""NIGHT"" WATCH",15,"(2000,)",False,This Clark Gable-Claudette Colbert screwball comedy was the great sleeper film of 1934,It Happened One Night,1,0
8069,2019-10-10,,Double Jeopardy,"(6, 5)",BOOKS GOING BACK IN TIME,20,"(2000,)",False,"His 1815 novel ""Guy Mannering"" begins in the year ""17--"" with Guy visiting some ruins in Dumfries",Walter Scott,1,0
8069,2019-10-10,,Final Jeopardy,"(1, 1)",ENGLISH HISTORY,0,"(5300, 7599, 8599)",False,"In 1600 a royal charter authorized it to set forth to ""parts of Asia and Africa"" in search of ""trade and traffic""",British East India Company,1,2
