epNum,airDate,extra_info,round_name,coord,category,order,value,daily_double,question,answer,correctAttempts,wrongAttempts
8123,2019-12-25,,Jeopardy,"(1, 1)",ASTROLOGICAL TERMS,11,"(200,)",False,"Now a term for any astrological prediction, this term described the position of heavenly bodies in the night sky at any ""hour""",a horoscope,1,0
8123,2019-12-25,,Jeopardy,"(2, 1)",HISTORY,21,"(200,)",False,"While the Crimean War was raging, this mountainous land fought a less well-known war with its neighbor Tibet",Nepal,1,0
8123,2019-12-25,,Jeopardy,"(4, 1)",UNUSUAL CONTESTS & PRIZES,16,"(200,)",False,Warren Buffett offers employees $1 million a year for life for getting the Sweet 16 exactly right in this alliterative event,March Madness,1,0
8123,2019-12-25,,Jeopardy,"(5, 1)",A POWER CALLER,6,"(200,)",False,Give partially decayed plant matter called peat a few million years & it'll form this ignitable rock,coal,0,3
8123,2019-12-25,,Jeopardy,"(6, 1)",THE TV SHOW MUST GO ON,1,"(200,)",False,"Edith was killed off, but the series called this character's ""Place"" endured for a couple more seasons",Archie Bunker\'s Place,1,0
8123,2019-12-25,,Jeopardy,"(1, 2)",ASTROLOGICAL TERMS,12,"(400,)",False,"According to synastry, or relationship astrology, if his Mars is in her 8th this, she'll have the hots for him",house,0,3
8123,2019-12-25,,Jeopardy,"(2, 2)",HISTORY,22,"(400,)",False,"In July 1984 in San Francisco, she accepted the Democratic Party's nomination for vice president",(Geraldine) Ferraro,1,0
8123,2019-12-25,,Jeopardy,"(4, 2)",UNUSUAL CONTESTS & PRIZES,17,"(400,)",False,"It preceded ""Fleece"" in an award mocking silly-sounding federal research; now it precedes ""Goose"" in an award honoring the same",Golden,1,0
8123,2019-12-25,,Jeopardy,"(5, 2)",A POWER CALLER,7,"(400,)",False,"10 years ago, it cost about $50,000 to install a system to power your house using this energy; now, a 6-kw system could go for $14K",solar,1,0
8123,2019-12-25,,Jeopardy,"(6, 2)",THE TV SHOW MUST GO ON,2,"(400,)",False,"When Tom Wopat & John Schneider walked off this show in 1982, cousins Coy & Vance Duke suddenly appeared",The Dukes of Hazzard,1,0
8123,2019-12-25,,Jeopardy,"(1, 3)",ASTROLOGICAL TERMS,13,"(600,)",False,"On a chart, a decan is an arc of this many degrees, a 36th of the celestial circle",10,1,0
8123,2019-12-25,,Jeopardy,"(2, 3)",HISTORY,23,"(600,)",False,"Splitting from Sweden in 1905, this nation got its monarchy restored; Haakon VII became king & reigned until 1957",Norway,1,0
8123,2019-12-25,,Jeopardy,"(4, 3)",UNUSUAL CONTESTS & PRIZES,18,"(600,)",False,"Not something to brag about, The Big Brother Award is given to the biggest offender against this right",privacy,1,0
8123,2019-12-25,,Jeopardy,"(5, 3)",A POWER CALLER,8,"(600,)",False,"The Arizona-Nevada power plant at this 1,244'-long hydroelectric structure has a 2,080-megawatt capacity",the Hoover Dam,1,0
8123,2019-12-25,,Jeopardy,"(6, 3)",THE TV SHOW MUST GO ON,3,"(600,)",False,"In 2019 this cop comedy moved from FOX to NBC & characters were allowed to curse--bleeped out, of course",Brooklyn Nine-Nine,1,0
8123,2019-12-25,,Jeopardy,"(1, 4)",ASTROLOGICAL TERMS,14,"(800,)",False,"The 4 cardinal signs of the zodiac are the signs that begin seasons, like Libra for fall & this one for spring",Aries,1,0
8123,2019-12-25,,Jeopardy,"(2, 4)",HISTORY,24,"(800,)",False,"Not just the title of a Dustin Hoffman western epic, it's the name of Crazy Horse's lieutenant at the Little Bighorn",Little Big Man,0,3
8123,2019-12-25,,Jeopardy,"(3, 4)",9-LETTER WORDS,27,"(800,)",False,It means toward the rear & is also a polite word for the part you sit on,posterior,1,0
8123,2019-12-25,,Jeopardy,"(4, 4)",UNUSUAL CONTESTS & PRIZES,19,"(800,)",False,Kids 5-15 get prizes at the Rotten Sneaker Contest from this brand whose name implies it's trying to help reduce the smell,Odor Eaters,1,0
8123,2019-12-25,,Jeopardy,"(5, 4)",A POWER CALLER,9,"(800,)",False,"At 97, John Goodenough is the oldest Nobel Prize winner, for work on these batteries with a hyphenated name in laptops & phones",lithium-ion,1,0
8123,2019-12-25,,Jeopardy,"(6, 4)",THE TV SHOW MUST GO ON,4,"(800,)",False,"Aka ""AFV"", this longest-running ABC primetime entertainment series had Bob Saget & Tom Bergeron as hosts pre-Alfonso Ribeiro",America\'s Funniest Home Videos,1,0
8123,2019-12-25,,Jeopardy,"(1, 5)",ASTROLOGICAL TERMS,15,"(1000,)",False,"(Sarah of the Clue Crew presents by a display monitor.) Sometimes a planet appears to loop in its path in the sky. The faster orbit of Mercury makes it look like it's changing direction when lapping us.  In astrology, the phenomenon is known as this and is often blamed for misfortune",retrograde,1,0
8123,2019-12-25,,Jeopardy,"(2, 5)",HISTORY,25,"(2000,)",True,"Legend says when Columbus saw the 3 mtn, peaks on this Caribbean island he chose to name it for the Father, Son & Holy Spirit",Trinidad,1,0
8123,2019-12-25,,Jeopardy,"(3, 5)",9-LETTER WORDS,26,"(1000,)",False,"""S"" is for ""soft"" in the name of this easily carved rock. It's basically talc",soapstone,1,0
8123,2019-12-25,,Jeopardy,"(4, 5)",UNUSUAL CONTESTS & PRIZES,20,"(1000,)",False,"The Lanterne Rouge goes to the athlete who finishes last in this long race; in 1931 Richard ""Fatty"" Lamb took the prize",the Tour de France,1,0
8123,2019-12-25,,Jeopardy,"(5, 5)",A POWER CALLER,10,"(1000,)",False,By 1880 the refining of around 90% of all U.S.-produced oil was controlled by this mega-company,Standard Oil,0,3
8123,2019-12-25,,Jeopardy,"(6, 5)",THE TV SHOW MUST GO ON,5,"(1000,)",False,"When William Hartnell's health forced him to leave this show in 1966, viewers discovered that Time Lords could regenerate",Doctor Who,1,0
8123,2019-12-25,,Double Jeopardy,"(1, 1)",FACE THE AUTHOR,23,"(400,)",False,Many of the events of his novels were based on his own experiences as a 19th century sailor and whaler,Melville,1,0
8123,2019-12-25,,Double Jeopardy,"(3, 1)",MAMA & DADA,11,"(400,)",False,"This host of ""The Tonight Show"" wrote the children's book ""Your Baby's First Word Will Be DADA""",(Jimmy) Fallon,1,0
8123,2019-12-25,,Double Jeopardy,"(5, 1)",ON THE MOVIE'S SOUNDTRACK,5,"(400,)",False,"A 2015 biopic: ""Nuthin' But A 'G' Thang"" & ""We Want Eazy""",Straight Outta Compton,1,0
8123,2019-12-25,,Double Jeopardy,"(6, 1)",THE NEXT WORD AFTER,6,"(400,)",False,After Uto-Aztecan: an ideal place,utopia,1,0
8123,2019-12-25,,Double Jeopardy,"(1, 2)",FACE THE AUTHOR,22,"(800,)",False,"""Poems, Chiefly in the Scottish Dialect"" was originally written to raise money for his passage to the New World",(Robert) Burns,1,1
8123,2019-12-25,,Double Jeopardy,"(2, 2)",NORTHERN CALIFORNIA,24,"(800,)",False,"This national park may be near the end of alphabet, but its 1,430-foot upper fall is tops in our book",Yosemite,1,0
8123,2019-12-25,,Double Jeopardy,"(3, 2)",MAMA & DADA,12,"(800,)",False,"David Sedaris, Bette Midler & Blue Man Group did early work at La MaMa, an experimental venue in the East Village in this NYC borough",Manhattan,1,0
8123,2019-12-25,,Double Jeopardy,"(4, 2)",GOING OUT OF BUSINESS,27,"(800,)",False,In early 2001 this Houston energy company had a market cap of $60 billion; by December it had filed for bankruptcy,Enron,1,0
8123,2019-12-25,,Double Jeopardy,"(5, 2)",ON THE MOVIE'S SOUNDTRACK,1,"(800,)",False,"""Dammit Janet"" & ""The Time Warp""",The Rocky Horror Picture Show,1,0
8123,2019-12-25,,Double Jeopardy,"(6, 2)",THE NEXT WORD AFTER,7,"(800,)",False,After quatorze: a very short poem with a fixed amount of lines,a quatrain,0,3
8123,2019-12-25,,Double Jeopardy,"(1, 3)",FACE THE AUTHOR,18,"(1200,)",False,This novelist has sold an estimated 350 million books,Stephen King,1,0
8123,2019-12-25,,Double Jeopardy,"(2, 3)",NORTHERN CALIFORNIA,28,"(1200,)",False,I have found it! --this city about 100 miles south of the Oregon border whose name is also the state motto,Eureka,1,0
8123,2019-12-25,,Double Jeopardy,"(3, 3)",MAMA & DADA,13,"(1200,)",False,In 2002 Queen Latifah belted it out as prison matron Mama Morton in the movie version of this musical,Chicago,1,0
8123,2019-12-25,,Double Jeopardy,"(4, 3)",GOING OUT OF BUSINESS,21,"(1200,)",False,"In 2019 some folks in Humble, Texas wanted to get into a time machine & start making this stainless steel car again",the DeLorean,1,0
8123,2019-12-25,,Double Jeopardy,"(5, 3)",ON THE MOVIE'S SOUNDTRACK,2,"(1200,)",False,"""Let's Hear It Tor The Boy"" & ""Almost Paradise""",Footloose,1,0
8123,2019-12-25,,Double Jeopardy,"(6, 3)",THE NEXT WORD AFTER,8,"(1200,)",False,After kowliang: to show extreme submission,kowtow,1,0
8123,2019-12-25,,Double Jeopardy,"(1, 4)",FACE THE AUTHOR,16,"(6000,)",True,This author based a 1962 novel on personal experience working in a hospital's psychiatric ward,Ken Kesey,1,0
8123,2019-12-25,,Double Jeopardy,"(2, 4)",NORTHERN CALIFORNIA,26,"(1600,)",False,Dragon Gate Arch on Grant Avenue marks the entrance to this iconic San Francisco district,Chinatown,1,0
8123,2019-12-25,,Double Jeopardy,"(3, 4)",MAMA & DADA,14,"(1600,)",False,"When the father of the future leader of this African country converted to Islam, he added the names ""Amin Dada""",Uganda,0,3
8123,2019-12-25,,Double Jeopardy,"(4, 4)",GOING OUT OF BUSINESS,19,"(1600,)",False,"Western Air Express & Transcontinental Air Transport formed what would be this company in 1930, but it got absorbed by Am. Airlines in 2001",TWA (Trans World),0,3
8123,2019-12-25,,Double Jeopardy,"(5, 4)",ON THE MOVIE'S SOUNDTRACK,3,"(1600,)",False,"From 2019: ""Let It Be"" & ""Carry That Weight""",Yesterday,1,0
8123,2019-12-25,,Double Jeopardy,"(6, 4)",THE NEXT WORD AFTER,9,"(1600,)",False,"After picas: petty, or a former Louisiana currency",picayune,0,3
8123,2019-12-25,,Double Jeopardy,"(1, 5)",FACE THE AUTHOR,17,"(2000,)",False,"This regular contributor to ""The New Yorker"" was known for her quips, but her writing is often melancholy",Dorothy Parker,1,0
8123,2019-12-25,,Double Jeopardy,"(2, 5)",NORTHERN CALIFORNIA,25,"(2000,)",False,"This city ""By-the-Sea"" & at the northern edge of Big Sur got its name from the Friars who accompanied early Spanish explorers",Carmel,0,3
8123,2019-12-25,,Double Jeopardy,"(3, 5)",MAMA & DADA,15,"(2000,)",False,The Dada art movement started at Cabaret Voltaire in this central European country,Switzerland,1,0
8123,2019-12-25,,Double Jeopardy,"(4, 5)",GOING OUT OF BUSINESS,20,"(2000,)",True,Sam Mendes directed a theatrical telling of the story of these brothers who built a financial empire that collapsed in 2008,Lehman Brothers,1,0
8123,2019-12-25,,Double Jeopardy,"(5, 5)",ON THE MOVIE'S SOUNDTRACK,4,"(2000,)",False,"2018: ""La Vie En Rose"" & ""I'll Never Love Again""",A Star is Born,1,0
8123,2019-12-25,,Double Jeopardy,"(6, 5)",THE NEXT WORD AFTER,10,"(2000,)",False,After Schachtism: deriving happiness at the expense of another's woes,schadenfreude,1,0
8123,2019-12-25,,Final Jeopardy,"(1, 1)",ORGANIZATIONS,0,"(5000, 4401, 7601)",False,"Founded by students at William & Mary in 1776; its members include 17 U.S. Presidents, 41 Supreme Court Justices & more than 140 Nobel laureates",Phi Beta Kappa,2,1
