epNum,airDate,extra_info,round_name,coord,category,order,value,daily_double,question,answer,correctAttempts,wrongAttempts
814,1988-03-03,,Jeopardy,"(2, 1)",FLOWERS,20,"(100,)",False,"From Old English for ""day's eye"", this flower opens anew each morning & closes again at night",the daisy,0,0
814,1988-03-03,,Jeopardy,"(3, 1)",COLORFUL SONGS,12,"(100,)",False,"Right on the heels of Bobby Vinton's 1963 ""Blue On Blue"" came this hit about something blue","""Blue Velvet""",0,0
814,1988-03-03,,Jeopardy,"(4, 1)",PHYSICS,14,"(100,)",False,"Used in acoustics, it's a 2-pronged metal instrument that emits a tone of fixed pitch when struck",a tuning fork,0,0
814,1988-03-03,,Jeopardy,"(5, 1)",FRENCH COOKING,1,"(100,)",False,"""Arroser"" in French, it's what chefs do to keep a turkey moist while baking it",to baste,0,0
814,1988-03-03,,Jeopardy,"(6, 1)",TRIVIAL TOURISM,3,"(100,)",False,"His grave used to boast a stone raven, but you won't find it now; it's flown the coop",Edgar Allan Poe,0,0
814,1988-03-03,,Jeopardy,"(1, 2)",TOYS & GAMES,27,"(200,)",False,"When you drop coins in the Musical Bogey Bank, it plays this theme from ""Casablanca""","""As Time Goes By""",0,0
814,1988-03-03,,Jeopardy,"(2, 2)",FLOWERS,21,"(200,)",False,"It can precede alyssum, William, or pea",sweet,0,0
814,1988-03-03,,Jeopardy,"(3, 2)",COLORFUL SONGS,13,"(200,)",False,"A #1 hit, it was based on a true story of a man returning home from prison","""Tie A Yellow Ribbon Round The Ole Oak Tree""",0,0
814,1988-03-03,,Jeopardy,"(4, 2)",PHYSICS,15,"(200,)",False,"From Latin for ""twist"", the term for a turning or twisting force",torque,0,0
814,1988-03-03,,Jeopardy,"(5, 2)",FRENCH COOKING,2,"(200,)",False,"Type of wine used in ""sauce bourguignonne""",Burgandy (red wine),0,0
814,1988-03-03,,Jeopardy,"(6, 2)",TRIVIAL TOURISM,4,"(200,)",False,"The folks in Kennebunkport, Maine, celebrated Nat'l Dump Week with dump art made from this",garbage,0,0
814,1988-03-03,,Jeopardy,"(1, 3)",TOYS & GAMES,8,"(300,)",False,"1 of 2 animals which are, appropriately, playing pieces in the game of ""Tigo""",tiger (goat),0,0
814,1988-03-03,,Jeopardy,"(2, 3)",FLOWERS,23,"(300,)",False,"In North America, these birds are the chief bird pollinators of flowers",hummingbirds,0,0
814,1988-03-03,,Jeopardy,"(3, 3)",COLORFUL SONGS,17,"(500,)",True,"Color in title of this 1967 No. 1 hit for The Lemon Pipers:""Drop your silver in my tambourine /Help a poor man build...""","""Green Tambourine""",0,0
814,1988-03-03,,Jeopardy,"(4, 3)",PHYSICS,16,"(300,)",False,"It's the term for the reflected radio wave signal received by a radar unit, unit, unit",an echo,0,0
814,1988-03-03,,Jeopardy,"(5, 3)",FRENCH COOKING,9,"(300,)",False,Carre d'agneau is a loin of this type of meat,lamb,0,0
814,1988-03-03,,Jeopardy,"(6, 3)",TRIVIAL TOURISM,5,"(300,)",False,"Appropriately, Grand Saline, Tex. sports the only house in America made entirely of blocks of this",salt,0,0
814,1988-03-03,,Jeopardy,"(1, 4)",TOYS & GAMES,22,"(400,)",False,Kenner makes Crinklers  Shape Shooters especially for molding this modeling compound,Play-Doh,0,0
814,1988-03-03,,Jeopardy,"(2, 4)",FLOWERS,24,"(400,)",False,"The term ""substance"" refers to the amount of this contained within rose petals",water (moisture),0,0
814,1988-03-03,,Jeopardy,"(3, 4)",COLORFUL SONGS,18,"(400,)",False,This last #1 hit for 3 Dog Night was originally written in honor of Supreme Court desegregation ruling,"""Black And White""",0,0
814,1988-03-03,,Jeopardy,"(4, 4)",PHYSICS,26,"(400,)",False,An ammeter is used to measure this,electric current (amperes),0,0
814,1988-03-03,,Jeopardy,"(5, 4)",FRENCH COOKING,10,"(400,)",False,"What you'd buy in an American grocery store if a recipe calls for ""fromage a la creme""",cream cheese,0,0
814,1988-03-03,,Jeopardy,"(6, 4)",TRIVIAL TOURISM,6,"(400,)",False,"You'll find a statue of this ""star"" outside the Roy Rogers Museum & the star himself inside--stuffed",Trigger,0,0
814,1988-03-03,,Jeopardy,"(1, 5)",TOYS & GAMES,28,"(500,)",False,"This giant 6' inflatable ""King of the Monsters"" doesn't come with a giant inflatable Raymond Burr",Godzilla,0,0
814,1988-03-03,,Jeopardy,"(2, 5)",FLOWERS,25,"(500,)",False,Cereus is a night-blooming variety of this plant,cactus,0,0
814,1988-03-03,,Jeopardy,"(3, 5)",COLORFUL SONGS,19,"(500,)",False,Brother & sister Nino Tempo & April Stevens hit #1 describing a night that was this color,purple,0,0
814,1988-03-03,,Jeopardy,"(4, 5)",PHYSICS,29,"(500,)",False,"Also called a ""linac"", it's an apparatus for accelerating ions to high energies",a linear accelerator,0,0
814,1988-03-03,,Jeopardy,"(5, 5)",FRENCH COOKING,11,"(500,)",False,"French for ""froth"", this smooth fluffy dessert is frequently flavored with chocolate",mousse,0,0
814,1988-03-03,,Jeopardy,"(6, 5)",TRIVIAL TOURISM,7,"(500,)",False,"If you can't go to Cork, Ireland, pop over to Shamrock, Texas & kiss this sham rock",the Blarney Stone,0,0
814,1988-03-03,,Double Jeopardy,"(1, 1)",MASSACHUSETTS,16,"(200,)",False,"In 1957, a replica of this sailed from England & reached Plymouth, Mass.",the Mayflower,0,0
814,1988-03-03,,Double Jeopardy,"(2, 1)",LITERARY ANIMALS,6,"(200,)",False,"Invisible rabbit who Elwood P. Dowd says is 6' 1/2"" tall",Harvey,0,0
814,1988-03-03,,Double Jeopardy,"(3, 1)","STARTS WITH ""E""",5,"(200,)",False,Snails for snobs,escargot,0,0
814,1988-03-03,,Double Jeopardy,"(4, 1)",CANADIAN ACTORS,11,"(200,)",False,"On radio, he was ""The Voice of Doom"", but on TV, he was the papa of the Ponderosa",Lorne Greene,0,0
814,1988-03-03,,Double Jeopardy,"(5, 1)",THE MILITARY,25,"(200,)",False,"In WWII, ocean-racing yachts were pressed into service to patrol for these enemy vessels",submarines,0,0
814,1988-03-03,,Double Jeopardy,"(6, 1)",MORE PROVERBS OF DEATH,26,"(200,)",False,"It's ""another man's poison""",one man's meat,0,0
814,1988-03-03,,Double Jeopardy,"(1, 2)",MASSACHUSETTS,17,"(400,)",False,"Carver, Mass. is the world center for production of this fruit, so give thanks",cranberries,0,0
814,1988-03-03,,Double Jeopardy,"(2, 2)",LITERARY ANIMALS,7,"(400,)",False,"Used to hoax Don Quixote, Clavileno was a horse made of this",wood,0,0
814,1988-03-03,,Double Jeopardy,"(3, 2)","STARTS WITH ""E""",4,"(400,)",False,It's one or the other,either,0,0
814,1988-03-03,,Double Jeopardy,"(4, 2)",CANADIAN ACTORS,14,"(400,)",False,This beauty from Alberta is best known for her date with a beast atop the Empire State Building,Fay Wray,0,0
814,1988-03-03,,Double Jeopardy,"(5, 2)",THE MILITARY,24,"(400,)",False,"In August 1987, Col. Gregorio (Gringo) Honasan led a rebel attack against this country's' government",the Philippines,0,0
814,1988-03-03,,Double Jeopardy,"(6, 2)",MORE PROVERBS OF DEATH,27,"(400,)",False,"""As a man"" does this, ""so shall he die""",lives,0,0
814,1988-03-03,,Double Jeopardy,"(1, 3)",MASSACHUSETTS,18,"(600,)",False,A sea captain named this peninsula after making large catches of fish off it,Cape Cod,0,0
814,1988-03-03,,Double Jeopardy,"(2, 3)",LITERARY ANIMALS,8,"(600,)",False,The Mad Hatter tried to stuff this furry creature into the teapot,the Dormouse,0,0
814,1988-03-03,,Double Jeopardy,"(3, 3)","STARTS WITH ""E""",3,"(600,)",False,Articulation,enunciation,0,0
814,1988-03-03,,Double Jeopardy,"(4, 3)",CANADIAN ACTORS,13,"(600,)",False,"Quebec-born ""Blackboard Jungle"" star whose 1st name was originally spelled ""Gwyllyn""",Glenn Ford,0,0
814,1988-03-03,,Double Jeopardy,"(5, 3)",THE MILITARY,23,"(600,)",False,"In the U.S. Navy, it's the class of enlisted rank just below a petty officer",a seaman,0,0
814,1988-03-03,,Double Jeopardy,"(6, 3)",MORE PROVERBS OF DEATH,28,"(600,)",False,"It's ""death's feast"", & ""there has never been a good"" one",war,0,0
814,1988-03-03,,Double Jeopardy,"(1, 4)",MASSACHUSETTS,19,"(800,)",False,"Logically, this is the state dog",the Boston Terrier,0,0
814,1988-03-03,,Double Jeopardy,"(2, 4)",LITERARY ANIMALS,9,"(800,)",False,"Not entirely bare when found, Paddington Bear was wearing a tag & a large one of these",a hat,0,0
814,1988-03-03,,Double Jeopardy,"(3, 4)","STARTS WITH ""E""",2,"(500,)",True,The Gaelic name for this capital is Dunedin,Edinburgh,0,0
814,1988-03-03,,Double Jeopardy,"(4, 4)",CANADIAN ACTORS,12,"(800,)",False,This ex-ballet dancer from British Columbia has been Mrs. Craig Stevens since 1944,Alexis Smith,0,0
814,1988-03-03,,Double Jeopardy,"(5, 4)",THE MILITARY,22,"(800,)",False,"In 1957, 3 Coast Guard cutters sailed thru the NW Passage & helped establish this ""DEW"" line",distant early warning,0,0
814,1988-03-03,,Double Jeopardy,"(6, 4)",MORE PROVERBS OF DEATH,29,"(800,)",False,"According to Job, ""There the wicked cease from troubling & there the weary be at rest""",the grave,0,0
814,1988-03-03,,Double Jeopardy,"(1, 5)",MASSACHUSETTS,20,"(1000,)",False,"As governor, this future pres, won nat'l exposure in 1919 by dealing with a police strike",Coolidge,0,0
814,1988-03-03,,Double Jeopardy,"(2, 5)",LITERARY ANIMALS,10,"(1000,)",False,Archy & Mehitabel were these 2 types of animals,cockroach & a cat,0,0
814,1988-03-03,,Double Jeopardy,"(3, 5)","STARTS WITH ""E""",1,"(1000,)",False,"Lancelot's less famous lover, also known as Galahad's mother",Elaine,0,0
814,1988-03-03,,Double Jeopardy,"(4, 5)",CANADIAN ACTORS,15,"(1000,)",False,"MGM billed this Montrealer as ""The 1st Lady of the Screen"", perhaps because she was married to Irving Thalberg",Norma Shearer,0,0
814,1988-03-03,,Double Jeopardy,"(5, 5)",THE MILITARY,21,"(2300,)",True,One of only 2 locations at which Marines can go through boot camp,(1 of) Parris Island (San Diego),0,0
814,1988-03-03,,Double Jeopardy,"(6, 5)",MORE PROVERBS OF DEATH,30,"(1000,)",False,"In Greek mythology, he ""waits for all,"" & you won't need your Dramamine",Charon,0,0
814,1988-03-03,,Final Jeopardy,"(1, 1)",WORD ORIGINS,0,(),False,"2 or more governments' joint dominion over a territory, it's come to mean a form of home ownership",condominium,0,0
