epNum,airDate,extra_info,round_name,coord,category,order,value,daily_double,question,answer,correctAttempts,wrongAttempts
8156,2020-02-10,,Jeopardy,"(1, 1)",COUNTRY DROP A LETTER,18,"(200,)",False,"When a big Asian country loses its last vowel, it becomes this body part",chin (from China),1,0
8156,2020-02-10,,Jeopardy,"(2, 1)",THE ILIAD,3,"(200,)",False,"Thought to contain material transmitted orally over centuries, the ""Iliad"" is attributed to this poet",Homer,1,0
8156,2020-02-10,,Jeopardy,"(3, 1)",COUSIN EFFECT,21,"(200,)",False,"In 2011 this weatherman told ""TODAY"" show viewers he & Lenny Kravitz are cousins",Al Roker,1,0
8156,2020-02-10,,Jeopardy,"(4, 1)",THE REST OF THE SAYING,7,"(200,)",False,"Very alert: ""bright-eyed &"" this",bushy-tailed,1,0
8156,2020-02-10,,Jeopardy,"(5, 1)",NO BELL,14,"(200,)",False,"Let me give you a hand with a practical joke using a ""joy"" this",a buzzer,1,0
8156,2020-02-10,,Jeopardy,"(6, 1)",PRIZE,24,"(200,)",False,"midwestliving.com posted a mouth-watering slideshow of 12 foods that won this prize at state fairs--mmm, butterscotch pie",a blue ribbon,1,0
8156,2020-02-10,,Jeopardy,"(1, 2)",COUNTRY DROP A LETTER,4,"(400,)",False,A Nordic country loses its first letter & becomes this area away from the coast,inland (from Finland),0,3
8156,2020-02-10,,Jeopardy,"(2, 2)",THE ILIAD,8,"(400,)",False,"In book 3 Menelaus fights Paris, who ran off with this wife",Helen,1,0
8156,2020-02-10,,Jeopardy,"(3, 2)",COUSIN EFFECT,22,"(400,)",False,"Jenny McCarthy's first cousin is this scene-stealing co-star of ""Bridesmaids""",Melissa McCarthy,1,1
8156,2020-02-10,,Jeopardy,"(4, 2)",THE REST OF THE SAYING,6,"(400,)",False,"Important people: ""movers & "" these",shakers,1,0
8156,2020-02-10,,Jeopardy,"(5, 2)",NO BELL,15,"(400,)",False,The Motorola LS350 is this type of device also called a pager,a beeper,1,1
8156,2020-02-10,,Jeopardy,"(6, 2)",PRIZE,25,"(400,)",False,For 300 years the French government gave young artists the prize of a stay in this city. On winner's work is seen here,Rome,1,0
8156,2020-02-10,,Jeopardy,"(1, 3)",COUNTRY DROP A LETTER,1,"(600,)",False,Drop the fourth letter from an Iberian country & you get this general term for a distance,span (from Spain),1,0
8156,2020-02-10,,Jeopardy,"(2, 3)",THE ILIAD,9,"(600,)",False,"There's quite a bit of graphic violence, as when Patroclus kills a Trojan with this long weapon, then hauls him up on it like a fish",a spear,1,0
8156,2020-02-10,,Jeopardy,"(3, 3)",COUSIN EFFECT,23,"(600,)",False,"In 2011 Gwyneth Paltrow said she'd never met this cousin & Arizona congresswoman, but her prayers were with her",Giffords,1,0
8156,2020-02-10,,Jeopardy,"(4, 3)",THE REST OF THE SAYING,11,"(600,)",False,"Completely settled: ""cut &"" this",dried,1,0
8156,2020-02-10,,Jeopardy,"(5, 3)",NO BELL,19,"(600,)",False,"Types of this attention getter are slide, train & wolf, but it's probably best not to employ the wolf one anymore",whistle,1,0
8156,2020-02-10,,Jeopardy,"(6, 3)",PRIZE,26,"(600,)",False,"Tata Steel of India was a 2008 winner of the Deming Prize in the field of TQM, total this management",quality,1,0
8156,2020-02-10,,Jeopardy,"(1, 4)",COUNTRY DROP A LETTER,2,"(800,)",False,"Subtract a letter from a 4-letter African country & you get this man who behaves badly, especially to women",a cad (from Chad),1,0
8156,2020-02-10,,Jeopardy,"(2, 4)",THE ILIAD,10,"(800,)",False,"The main character & the greatest Greek warrior, he leads the Myrmidons against the Trojans",Achilles,1,0
8156,2020-02-10,,Jeopardy,"(4, 4)",THE REST OF THE SAYING,12,"(800,)",False,"With little hope of success: ""on a wing &"" this",a prayer,1,0
8156,2020-02-10,,Jeopardy,"(5, 4)",NO BELL,17,"(1200,)",True,"In Greek myth, sailors resisted the calls of these sea nymphs by putting wax in their ears",sirens,1,0
8156,2020-02-10,,Jeopardy,"(6, 4)",PRIZE,27,"(800,)",False,"The Abel Prize in this field is named for Niels Abel, famed for his work on the quintic function",math,1,1
8156,2020-02-10,,Jeopardy,"(1, 5)",COUNTRY DROP A LETTER,5,"(1000,)",False,"When a Mediterranean isle loses its last letter, it becomes this soda fountain drink",a malt (from Malta),0,3
8156,2020-02-10,,Jeopardy,"(2, 5)",THE ILIAD,16,"(1000,)",False,"This Trojan warrior is saved by Aphrodite, or there might never have been that epic by Virgil",Aeneas,0,3
8156,2020-02-10,,Jeopardy,"(3, 5)",COUSIN EFFECT,29,"(1000,)",False,"""The Man with the Golden Gun"", Christopher Lee can thank this cousin for creating James Bond",(Ian) Fleming,1,0
8156,2020-02-10,,Jeopardy,"(4, 5)",THE REST OF THE SAYING,13,"(1000,)",False,"""All dressed up &"" this problem",nowhere to go,1,0
8156,2020-02-10,,Jeopardy,"(5, 5)",NO BELL,20,"(1000,)",False,Chicago Blackhawks owner Bill Wirtz liked the sound of this on his yacht & used it when his team scored; the custom spread,a foghorn (a horn),1,0
8156,2020-02-10,,Jeopardy,"(6, 5)",PRIZE,28,"(1000,)",False,Seen at the ceremony of the Breakthrough Prize for scientific discoveries are co-sponsors Mark Zuckerberg and this physician wife,(Priscilla) Chan,1,0
8156,2020-02-10,,Double Jeopardy,"(1, 1)",WINTRY READING,1,"(400,)",False,"In a kids' book, on a snowy day Nicki loses this item of clothing, just like the 3 little kittens",mittens,1,0
8156,2020-02-10,,Double Jeopardy,"(2, 1)",MEET YOUR WATERLOO,23,"(400,)",False,"When the Republic of Texas decided to move the government there in 1839, Waterloo, Texas got this new name",Austin,1,0
8156,2020-02-10,,Double Jeopardy,"(3, 1)",BEFORE & AFTER AT THE MOVIES,16,"(400,)",False,Cameron Diaz sings & dances as the magical British nanny of Ben Stiller's desire,There\'s Something About Mary Poppins,1,0
8156,2020-02-10,,Double Jeopardy,"(4, 1)",SATURN,3,"(400,)",False,"Made up primarily of dust & ice, these of the planet Saturn are divided into 7 groups, A through G",the rings,1,0
8156,2020-02-10,,Double Jeopardy,"(5, 1)",PRESIDENTIAL HOMES,17,"(400,)",False,"(Sarah of the Clue Crew is in Massachusetts.) A national park in Massachusetts preserves the adjacent birthplaces of these two presidents--the first born in 1735, in that cottage, and second, born in 1767 in the other",John Adams & John Quincy Adams,1,0
8156,2020-02-10,,Double Jeopardy,"(6, 1)",A UNIQUE SYNONYM,15,"(400,)",False,It's between the toes & the heel,sole,0,3
8156,2020-02-10,,Double Jeopardy,"(1, 2)",WINTRY READING,7,"(800,)",False,"Dostoyevsky's autobiographical novel ""The House of the Dead"" has been published with the subtitle ""or, Prison Life"" here--brrr!",Siberia,1,0
8156,2020-02-10,,Double Jeopardy,"(2, 2)",MEET YOUR WATERLOO,26,"(800,)",False,"For work on lasers, Donna Strickland of Ontario's University of Waterloo became the first woman Nobel laureate for this in 55 years",physics,1,0
8156,2020-02-10,,Double Jeopardy,"(3, 2)",BEFORE & AFTER AT THE MOVIES,20,"(3000,)",True,A holiday classic where an angel gets his wings & Roberto Benigni gets an Oscar,It\'s a Wonderful Life Is Beautiful,0,1
8156,2020-02-10,,Double Jeopardy,"(4, 2)",SATURN,4,"(800,)",False,"In an epic poem by Keats, Saturn turns for help in regaining his throne to this rather ""hyper"" other titan",Hyperion,1,0
8156,2020-02-10,,Double Jeopardy,"(5, 2)",PRESIDENTIAL HOMES,27,"(800,)",False,"From 1955 until Jerry became president, the Ford family lived in a 4-bedroom Colonial in Alexandria in this state",Virginia,1,0
8156,2020-02-10,,Double Jeopardy,"(6, 2)",A UNIQUE SYNONYM,12,"(800,)",False,Lacking small fire-lighting sticks,matchless,1,0
8156,2020-02-10,,Double Jeopardy,"(1, 3)",WINTRY READING,5,"(1200,)",False,"The 2019 book ""The Enchanted Forest"" is a tie-in with this long-awaited animated sequel",Frozen 2,1,0
8156,2020-02-10,,Double Jeopardy,"(2, 3)",MEET YOUR WATERLOO,24,"(1200,)",False,"In the 1890s a fossil one of these mammoth relatives was unearthed near Waterloo in DeKalb County, Indiana",a mastodon,1,0
8156,2020-02-10,,Double Jeopardy,"(3, 3)",BEFORE & AFTER AT THE MOVIES,21,"(1200,)",False,Edward Norton tries to convince his brother Edward Furlong not to hate or join up with mutants like Wolverine,American History X Men,1,0
8156,2020-02-10,,Double Jeopardy,"(4, 3)",SATURN,10,"(1200,)",False,In 1610 this man was the first to observe Saturn through a telescope,Galileo,1,0
8156,2020-02-10,,Double Jeopardy,"(5, 3)",PRESIDENTIAL HOMES,19,"(1200,)",False,"His hat hangs from an elk antler at Sagamore Hill, his Oyster Bay, New York home",Teddy Roosevelt,1,0
8156,2020-02-10,,Double Jeopardy,"(6, 3)",A UNIQUE SYNONYM,11,"(1200,)",False,Without a member of the House of Lords,peerless,0,3
8156,2020-02-10,,Double Jeopardy,"(1, 4)",WINTRY READING,2,"(1600,)",False,"Set in Iceland, the sixth novel in the Detective Erlendur series is titled not ""Frostbite"" but this condition",hypothermia,1,0
8156,2020-02-10,,Double Jeopardy,"(3, 4)",BEFORE & AFTER AT THE MOVIES,22,"(1600,)",False,"Struggling in Hollywood, Emma Stone & Ryan Gosling time travel with paleontologist Will Ferrell & befriend a primate named Chaka",La La Land of the Lost,1,0
8156,2020-02-10,,Double Jeopardy,"(4, 4)",SATURN,8,"(1600,)",False,"Saturn has more than 60 moons, including this second-largest named for Zeus' mother",Rhea,1,0
8156,2020-02-10,,Double Jeopardy,"(5, 4)",PRESIDENTIAL HOMES,18,"(1600,)",False,"He wrote part of 1809's ""History of New York"" while staying in what would later be Martin Van Buren's home, Lindenwald",Washington Irving,0,3
8156,2020-02-10,,Double Jeopardy,"(6, 4)",A UNIQUE SYNONYM,13,"(1600,)",False,Confinement in a separate prison cell by oneself,solitary,1,0
8156,2020-02-10,,Double Jeopardy,"(1, 5)",WINTRY READING,6,"(2000,)",False,"It's 1954 & tensions are high on an island with a lot of Japanese Americans in David Guterson's novel ""Snow Falling on"" these",Cedars,1,0
8156,2020-02-10,,Double Jeopardy,"(3, 5)",BEFORE & AFTER AT THE MOVIES,25,"(2000,)",False,George Clooney & Will Smith team up & hunt Nazi art thieves & alien bugs,The Monuments Men in Black,0,3
8156,2020-02-10,,Double Jeopardy,"(4, 5)",SATURN,9,"(2000,)",False,Saturn was the Roman equivalent of this Greek father god,Kronos,1,0
8156,2020-02-10,,Double Jeopardy,"(5, 5)",PRESIDENTIAL HOMES,28,"(2000,)",True,"Dead just 3 months after retiring, James K. Polk was buried at Polk Place in this state capital",Nashville,0,1
8156,2020-02-10,,Double Jeopardy,"(6, 5)",A UNIQUE SYNONYM,14,"(2000,)",False,Unhitched,single,1,0
8156,2020-02-10,,Final Jeopardy,"(1, 1)",SPORTS TERMS,0,"(2801, 9801, 12000)",False,A member of the British Amateur Athletic Club wrote this 1867 set of 12 regulations whose name honors nobleman John Sholto Douglas,the 12 rules of Queensbury,0,3
