epNum,airDate,extra_info,round_name,coord,category,order,value,daily_double,question,answer,correctAttempts,wrongAttempts
8175,2020-03-06,Paul Trifiletti game 3.,Jeopardy,"(1, 1)",WORLD PLACE NAMES,4,"(200,)",False,We're bullish on this Spanish city that tradition says was founded by & named for Pompey,Pamplona,1,0
8175,2020-03-06,Paul Trifiletti game 3.,Jeopardy,"(2, 1)",BRITISH POLITICS,1,"(200,)",False,"It's the job of presiding over the House of Commons. From 2009 to 2019, it was the flamboyant John Bercow",the Speaker,1,0
8175,2020-03-06,Paul Trifiletti game 3.,Jeopardy,"(3, 1)",FLAG CREATORS,19,"(200,)",False,"In 1964, George Stanley sketched two suggestions for this country's official flag",Canada,1,0
8175,2020-03-06,Paul Trifiletti game 3.,Jeopardy,"(4, 1)",WANNA BET?,26,"(200,)",False,"If the bettor buys insurance after the dealer shows an ace, he's playing this game",blackjack,1,0
8175,2020-03-06,Paul Trifiletti game 3.,Jeopardy,"(5, 1)",EMMY'S BEST DRAMA,5,"(200,)",False,"2004: When it came to this HBO series, Emmy did not fuhgeddaboud it",The Sopranos,1,0
8175,2020-03-06,Paul Trifiletti game 3.,Jeopardy,"(6, 1)",FRENCH WORDS IN ENGLISH,16,"(200,)",False,"This word for an afternoon show means ""morning"" in French",matinee,1,0
8175,2020-03-06,Paul Trifiletti game 3.,Jeopardy,"(1, 2)",WORLD PLACE NAMES,12,"(400,)",False,"One of Simon Bolivar's last wishes was vengeance for the murder of a ""sweet"" friend for whom this Bolivian city is named",Sucre,1,0
8175,2020-03-06,Paul Trifiletti game 3.,Jeopardy,"(2, 2)",BRITISH POLITICS,2,"(400,)",False,"An English town or district that forms the constituency of a member of parliament is called one of these, like a division of NYC",a borough,1,0
8175,2020-03-06,Paul Trifiletti game 3.,Jeopardy,"(3, 2)",FLAG CREATORS,20,"(400,)",False,"When Gilbert Baker designed the rainbow flag for gay pride in 1978, he added ""hot"" this color to the traditional 7 colors",pink,1,0
8175,2020-03-06,Paul Trifiletti game 3.,Jeopardy,"(4, 2)",WANNA BET?,27,"(400,)",False,"In 2016 a few happy bettors cashed in 5,000-1 tickets after Leicester City won the title in England's top league in this sport",soccer,1,0
8175,2020-03-06,Paul Trifiletti game 3.,Jeopardy,"(5, 2)",EMMY'S BEST DRAMA,6,"(400,)",False,2011: Voters bought Don Draper's pitch,Mad Men,1,0
8175,2020-03-06,Paul Trifiletti game 3.,Jeopardy,"(6, 2)",FRENCH WORDS IN ENGLISH,17,"(400,)",False,"Often seen in our category titles, this word literally means ""rotten pot""",potpourri,1,0
8175,2020-03-06,Paul Trifiletti game 3.,Jeopardy,"(1, 3)",WORLD PLACE NAMES,13,"(600,)",False,These islands that include New Georgia & Guadalcanal were named for a biblical king,the Solomon Islands,1,0
8175,2020-03-06,Paul Trifiletti game 3.,Jeopardy,"(2, 3)",BRITISH POLITICS,3,"(600,)",False,In December 2019 this party won a sweeping election victory on a Brexit-now platform,the Conservatives,1,0
8175,2020-03-06,Paul Trifiletti game 3.,Jeopardy,"(3, 3)",FLAG CREATORS,21,"(600,)",False,"William Todd, designer of this state's 1846 bear flag, was Abraham Lincoln's relative by marriage",California,1,0
8175,2020-03-06,Paul Trifiletti game 3.,Jeopardy,"(4, 3)",WANNA BET?,28,"(600,)",False,"If the bettor puts money on the pass line & the roll is 2, 3 or 12, that's this, the name of the game, & the bettor loses",craps,1,0
8175,2020-03-06,Paul Trifiletti game 3.,Jeopardy,"(5, 3)",EMMY'S BEST DRAMA,7,"(600,)",False,"2002: POTUS, triumphant",The West Wing,1,0
8175,2020-03-06,Paul Trifiletti game 3.,Jeopardy,"(6, 3)",FRENCH WORDS IN ENGLISH,18,"(600,)",False,This French feminine word is a person with brown hair,a brunette,1,0
8175,2020-03-06,Paul Trifiletti game 3.,Jeopardy,"(1, 4)",WORLD PLACE NAMES,14,"(800,)",False,"The name of this national park & wildlife refuge in Tanzania roughly translates to ""great open place""",Serengeti,1,0
8175,2020-03-06,Paul Trifiletti game 3.,Jeopardy,"(2, 4)",BRITISH POLITICS,10,"(3200,)",True,Since 2016 Baroness Evans of Bowes Park has been the leader of this body,the House of Lords,1,0
8175,2020-03-06,Paul Trifiletti game 3.,Jeopardy,"(3, 4)",FLAG CREATORS,22,"(800,)",False,The first of Great Britain's flags began with a 1606 proclamation by this king to merge 2 other flags,James I,1,0
8175,2020-03-06,Paul Trifiletti game 3.,Jeopardy,"(4, 4)",WANNA BET?,29,"(800,)",False,A bettor who correctly picks the order of the first 2 finishers in a horse race wins this precisely named wager,an exacta (*an exactor),1,0
8175,2020-03-06,Paul Trifiletti game 3.,Jeopardy,"(5, 4)",EMMY'S BEST DRAMA,8,"(800,)",False,2012: It's Showtime for a bipolar operative,Homeland,1,0
8175,2020-03-06,Paul Trifiletti game 3.,Jeopardy,"(6, 4)",FRENCH WORDS IN ENGLISH,23,"(800,)",False,"Tellers of anecdotes, or the name of a Jack White band",raconteurs,1,0
8175,2020-03-06,Paul Trifiletti game 3.,Jeopardy,"(1, 5)",WORLD PLACE NAMES,15,"(1000,)",False,These islands in the West Indies are so named because they're sheltered from the trade winds,the Leeward Islands,1,1
8175,2020-03-06,Paul Trifiletti game 3.,Jeopardy,"(2, 5)",BRITISH POLITICS,11,"(1000,)",False,"From 2014 to 2016 Philip Hammond served as this official, the British counterpart of the U.S. Secretary of State",the Foreign Secretary,1,0
8175,2020-03-06,Paul Trifiletti game 3.,Jeopardy,"(3, 5)",FLAG CREATORS,25,"(1000,)",False,"Philosopher Raimundo Teixeira Mendes created this South American country's flag as well as the motto ""Ordem e Progresso""",Brazil,1,0
8175,2020-03-06,Paul Trifiletti game 3.,Jeopardy,"(4, 5)",WANNA BET?,30,"(1000,)",False,In 2018 this NBA commissioner said the league should get a cut of any legalized betting on it,(Adam) Silver,1,0
8175,2020-03-06,Paul Trifiletti game 3.,Jeopardy,"(5, 5)",EMMY'S BEST DRAMA,9,"(1000,)",False,"1984: This ""colorful"" NBC cop show was careful out there",Hill Street Blues,1,0
8175,2020-03-06,Paul Trifiletti game 3.,Jeopardy,"(6, 5)",FRENCH WORDS IN ENGLISH,24,"(1000,)",False,"French for ""carriage entrance"", it's the type of drop-off area seen here",porte cochère,1,0
8175,2020-03-06,Paul Trifiletti game 3.,Double Jeopardy,"(1, 1)",LITERARY AWARDS,2,"(400,)",False,"Like the protagonist in the early part of Dumas' novel, the judges of the newly created Prix Monte-Cristo are these",prisoners,0,3
8175,2020-03-06,Paul Trifiletti game 3.,Double Jeopardy,"(3, 1)",INVENTIONS,24,"(400,)",False,"Often cited as the world's greatest invention, it was designed in ancient times, but probably just for pottery making",the wheel,1,0
8175,2020-03-06,Paul Trifiletti game 3.,Double Jeopardy,"(4, 1)",POSTAL ABBREVIATION WORDS,10,"(400,)",False,A Rocky Mountain state pahks its cah in front of an East Coast state & falls into this long state of unconsciousness,a coma (Colorado & Massachusetts),1,0
8175,2020-03-06,Paul Trifiletti game 3.,Double Jeopardy,"(5, 1)",THE SAINTS,17,"(400,)",False,He first went to the Emerald Isle as a slave in the 5th century; later he returned to convert the country,St. Patrick,1,0
8175,2020-03-06,Paul Trifiletti game 3.,Double Jeopardy,"(1, 2)",LITERARY AWARDS,3,"(800,)",False,No twist necessary in the short stories that since 1919 win the prize named for this short story author,O. Henry,1,0
8175,2020-03-06,Paul Trifiletti game 3.,Double Jeopardy,"(2, 2)",MUSICALS,1,"(800,)",False,"(I'm Iain Armitage.) The Broadway musical ""Hamilton"" runs in my family--my dad, Euan Morton, ptayed King George III & I got to rap as the title character while sitting on this composer's shoulders!",(Lin-Manuel) Miranda,1,0
8175,2020-03-06,Paul Trifiletti game 3.,Double Jeopardy,"(3, 2)",INVENTIONS,23,"(800,)",False,"In 2001 Apple introduced this device that could pack up to 1,000 songs right in your pocket",the iPod,1,0
8175,2020-03-06,Paul Trifiletti game 3.,Double Jeopardy,"(4, 2)",POSTAL ABBREVIATION WORDS,11,"(800,)",False,Combine the home states of Vice Presidents Biden & Cheney to get this word meaning moist,dewy (Delaware & Wyoming),1,0
8175,2020-03-06,Paul Trifiletti game 3.,Double Jeopardy,"(5, 2)",THE SAINTS,13,"(800,)",False,"AKA Padre Pio, St. Pio of Pietrelcina is one of 60+ saints said to have exhibited these signs of the crucified Jesus",the stigmata,1,0
8175,2020-03-06,Paul Trifiletti game 3.,Double Jeopardy,"(1, 3)",LITERARY AWARDS,8,"(1200,)",False,"2019 Nobel Prize winner Peter Handke is perhaps best known for the novel this player's ""Anxiety at the Penalty Kick""",the goalie,0,3
8175,2020-03-06,Paul Trifiletti game 3.,Double Jeopardy,"(2, 3)",MUSICALS,4,"(1200,)",False,"After 3,388 performances & an 8-year run, this musical was no longer ""the word"" when it closed April 13, 1980",Grease,1,0
8175,2020-03-06,Paul Trifiletti game 3.,Double Jeopardy,"(3, 3)",INVENTIONS,22,"(1200,)",False,The robotic hand seen here was created thanks to the invention of this computer-aided process,3-D printing,0,3
8175,2020-03-06,Paul Trifiletti game 3.,Double Jeopardy,"(4, 3)",POSTAL ABBREVIATION WORDS,18,"(1200,)",False,"The home of Independence Hall has a window on the ""Cornhusker State"" to give us this word",pane (Pennsylvania & Nebraska),1,0
8175,2020-03-06,Paul Trifiletti game 3.,Double Jeopardy,"(5, 3)",THE SAINTS,14,"(2000,)",True,Legend says around 300 A.D. this small European republic was founded by a saintly man & his followers & it still bears his name today,San Marino,1,0
8175,2020-03-06,Paul Trifiletti game 3.,Double Jeopardy,"(1, 4)",LITERARY AWARDS,9,"(1600,)",False,In 2019 the name of this prestigious prize became a little shorter when the Man Group stopped sponsoring it,a Booker,1,0
8175,2020-03-06,Paul Trifiletti game 3.,Double Jeopardy,"(2, 4)",MUSICALS,5,"(400,)",True,"The protagonist of this musical writes himself letters, hence the name of the show",Dear Evan Hansen,1,0
8175,2020-03-06,Paul Trifiletti game 3.,Double Jeopardy,"(3, 4)",INVENTIONS,21,"(1600,)",False,"Smile & say cheese if you know that Edwin Land developed this name brand item, first sold in 1948",Polaroid,1,0
8175,2020-03-06,Paul Trifiletti game 3.,Double Jeopardy,"(4, 4)",POSTAL ABBREVIATION WORDS,19,"(1600,)",False,Hoosiers join up with their neighbor directly south to form this newspaper-stained word,inky (Indiana & Kentucky),1,0
8175,2020-03-06,Paul Trifiletti game 3.,Double Jeopardy,"(5, 4)",THE SAINTS,15,"(1600,)",False,The Virgin Mary appeared to St. Bernadette 18 times & revealed to her a healing spring in this city,Lourdes,1,0
8175,2020-03-06,Paul Trifiletti game 3.,Double Jeopardy,"(6, 4)",MARCH-ING IN,26,"(1600,)",False,This Mexican general prevailed at the Alamo in March of 1836,Santa Anna,1,0
8175,2020-03-06,Paul Trifiletti game 3.,Double Jeopardy,"(1, 5)",LITERARY AWARDS,12,"(2000,)",False,The 2017 Women's Prize for Fiction went to Naomi Alderman for this sci-fi novel where women get shocking abilities,The Power,0,3
8175,2020-03-06,Paul Trifiletti game 3.,Double Jeopardy,"(2, 5)",MUSICALS,6,"(2000,)",False,"""Fo' Dolla""' & ""Our Heroine"" were 2 of the ""Tales of"" this author made into the show ""South Pacific""",Michener,1,0
8175,2020-03-06,Paul Trifiletti game 3.,Double Jeopardy,"(3, 5)",INVENTIONS,7,"(2000,)",False,"William Burroughs, grandfather of the famous author William S., invented the first practical one of these office machines",an adding machine,0,3
8175,2020-03-06,Paul Trifiletti game 3.,Double Jeopardy,"(4, 5)",POSTAL ABBREVIATION WORDS,20,"(2000,)",False,2 states on the West Coast bookend North Dakota to form this 6-letter word for frankness,"candor (California, North Dakota & Oregon)",0,3
8175,2020-03-06,Paul Trifiletti game 3.,Double Jeopardy,"(5, 5)",THE SAINTS,16,"(2000,)",False,"St. Adalbert was the apostle of this kingdom later part of Germany, a Bismarck in his career",Prussia,0,3
8175,2020-03-06,Paul Trifiletti game 3.,Double Jeopardy,"(6, 5)",MARCH-ING IN,25,"(2000,)",False,"On March 25, 1851 Major James Savage made the ""Discovery"" of this valley & now national park on the Merced River",Yosemite,1,0
8175,2020-03-06,Paul Trifiletti game 3.,Final Jeopardy,"(1, 1)",21st CENTURY MOVIES,0,"(9399, 801, 10801)",False,"After its initial release in 2016, it became the first major motion picture to be dubbed in Tahitian",Moana,2,1
