epNum,airDate,extra_info,round_name,coord,category,order,value,daily_double,question,answer,correctAttempts,wrongAttempts
8187,2020-03-24,,Jeopardy,"(1, 1)",I WROTE THAT!,1,"(200,)",False,"""In the crook of Bond's arm... she said, not in a gangster's voice... 'Will you write to me in Sing Sing?""'",(Ian) Fleming,1,0
8187,2020-03-24,,Jeopardy,"(2, 1)","CAR ""MA""",30,"(200,)",False,It makes the CX-3,Mazda,1,0
8187,2020-03-24,,Jeopardy,"(3, 1)",FOREIGN GEOGRAPHICAL TERMS,26,"(200,)",False,"Preceding Madre & Nevada, it's Spanish for a jagged mountain chain",Sierra,1,0
8187,2020-03-24,,Jeopardy,"(4, 1)",AFRICAN-AMERICAN PERFORMERS,25,"(200,)",False,"(Hi, I'm Kevin Hart.) My inspirations for standup comedy include Chappelle, Pryor, Rock & this mentor & friend; the ""Ice Creaaaam!"" bit alone in ""Delirious"" in 1983, legendary",Eddie Murphy,1,0
8187,2020-03-24,,Jeopardy,"(5, 1)",WHAT AN IDIOM!,23,"(200,)",False,"It doesn't affect me adversely, so it's ""No skin"" from here",off my nose,1,0
8187,2020-03-24,,Jeopardy,"(6, 1)",SHINY THINGS,29,"(200,)",False,A river in Germany gave its name to this shiny artificial gem that's often cut to look like a diamond,a rhinestone,1,0
8187,2020-03-24,,Jeopardy,"(1, 2)",I WROTE THAT!,2,"(400,)",False,"""'District twelve. where you can starve to death in safety,' I mutter""",(Suzanne) Collins,1,0
8187,2020-03-24,,Jeopardy,"(2, 2)","CAR ""MA""",4,"(400,)",False,It makes the Gran Turismo & the Quattroporte,Maserati,1,1
8187,2020-03-24,,Jeopardy,"(3, 2)",FOREIGN GEOGRAPHICAL TERMS,7,"(400,)",False,Brücke is German for this structure,a bridge,1,0
8187,2020-03-24,,Jeopardy,"(4, 2)",AFRICAN-AMERICAN PERFORMERS,24,"(400,)",False,"In 2002 she won an Oscar for ""Monster's Ball""",Halle Berry,1,0
8187,2020-03-24,,Jeopardy,"(5, 2)",WHAT AN IDIOM!,22,"(400,)",False,To do or say the most fitting thing is to do this construction task with a tool to a fastener,hitting the nail on the head,0,3
8187,2020-03-24,,Jeopardy,"(6, 2)",SHINY THINGS,17,"(400,)",False,Since the 1980s this country has had a shiny gold coin called the nugget; one version shows a wallaby,Australia,1,0
8187,2020-03-24,,Jeopardy,"(1, 3)",I WROTE THAT!,3,"(600,)",False,"""'He bears no letter of infamy wrought into his garment, as thou dost""'",Hawthorne,1,0
8187,2020-03-24,,Jeopardy,"(2, 3)","CAR ""MA""",11,"(600,)",False,In 1914 a brand name was born when he raced cars up Aston Hill,(Lionel) Martin,1,0
8187,2020-03-24,,Jeopardy,"(3, 3)",FOREIGN GEOGRAPHICAL TERMS,8,"(600,)",False,"Before Frio & San Lucas, it means cape",Cabo,1,0
8187,2020-03-24,,Jeopardy,"(4, 3)",AFRICAN-AMERICAN PERFORMERS,14,"(600,)",False,"Tracee Ellis Ross of ""black-ish"" is the daughter of this supreme-ly talented woman",Diana Ross,1,0
8187,2020-03-24,,Jeopardy,"(5, 3)",WHAT AN IDIOM!,19,"(600,)",False,"A wartime idiom & song says, ""Praise the Lord & pass"" this",the ammunition,1,0
8187,2020-03-24,,Jeopardy,"(6, 3)",SHINY THINGS,18,"(600,)",False,This 9-letter adjective can mean both showing great intelligence or shining brightly,brilliant,0,3
8187,2020-03-24,,Jeopardy,"(1, 4)",I WROTE THAT!,5,"(800,)",False,"""He told her how he had listened to the sweet song of the sirens; how he had sailed by the wandering rocks, by dread Charybdis""",Homer,1,0
8187,2020-03-24,,Jeopardy,"(2, 4)","CAR ""MA""",12,"(800,)",False,In 1969 Ford saddled up this Mustang stablemate,Maverick,0,3
8187,2020-03-24,,Jeopardy,"(3, 4)",FOREIGN GEOGRAPHICAL TERMS,9,"(800,)",False,"In Chinese: he, as in Huang He",a river,1,0
8187,2020-03-24,,Jeopardy,"(4, 4)",AFRICAN-AMERICAN PERFORMERS,15,"(800,)",False,"She was hilarious in 2009, headlining the first White House Correspondents' Dinner under President Obama",(Wanda) Sykes,1,0
8187,2020-03-24,,Jeopardy,"(5, 4)",WHAT AN IDIOM!,20,"(800,)",False,I'm going to expose a scandal! So I'll be doing this action involving a device that emits a high-pitched sound,"a whistle blower, blowing a whistle",1,0
8187,2020-03-24,,Jeopardy,"(6, 4)",SHINY THINGS,28,"(800,)",False,"In Reagan's 34th & final speech from the Oval Office, he reflected on a favorite saying about a ""shining city upon"" this",a hill,1,0
8187,2020-03-24,,Jeopardy,"(1, 5)",I WROTE THAT!,6,"(1400,)",True,"""'He had decided to live forever or die in the attempt, and his only mission each time he went up was to come down alive""",Joseph Heller,0,1
8187,2020-03-24,,Jeopardy,"(2, 5)","CAR ""MA""",13,"(1000,)",False,This last name of Mercedes designer Wilhelm follows Mercedes in the name of a very upscale line of cars,Maybach,0,3
8187,2020-03-24,,Jeopardy,"(3, 5)",FOREIGN GEOGRAPHICAL TERMS,10,"(1000,)",False,In Norwegian: regnskog (it's full of life),rain forest,0,3
8187,2020-03-24,,Jeopardy,"(4, 5)",AFRICAN-AMERICAN PERFORMERS,16,"(1000,)",False,"This ""How to Get Away with Murder"" actress graduated from Juilliard in 1993 & is an Emmy, Oscar & Tony award winner",Viola Davis,1,0
8187,2020-03-24,,Jeopardy,"(5, 5)",WHAT AN IDIOM!,21,"(1000,)",False,"19th century British PM Lord John Russell was jeered for writing nonsense when he coined ""Conspicuous by its"" this",absence,1,0
8187,2020-03-24,,Jeopardy,"(6, 5)",SHINY THINGS,27,"(1000,)",False,"Headlights using this noble gas, atomic number 54, are said to shine brighter than those using halogen",xenon,0,3
8187,2020-03-24,,Double Jeopardy,"(1, 1)",GET-TOGETHERS,1,"(400,)",False,In military life one excuse for a party is this career event; a family member may get to do the pinning of the new insignia,a promotion,0,3
8187,2020-03-24,,Double Jeopardy,"(2, 1)",FILM ANALYSIS,9,"(400,)",False,"The high-flying Maverick is on cruise control but Goose gets cooked; oh, & there's some shirtless volleyball",Top Gun,1,0
8187,2020-03-24,,Double Jeopardy,"(3, 1)",BONES,22,"(400,)",False,Its middle section is made up of the thoracic vertebrae,the spine,1,0
8187,2020-03-24,,Double Jeopardy,"(5, 1)",COLONIAL AMERICA,14,"(400,)",False,"1767's Townshend Acts placed duties on imports to the colonies on lead, glass, paint, paper & (uh-oh!) this nonpotent potable",tea,1,0
8187,2020-03-24,,Double Jeopardy,"(6, 1)","""CH"" SQUARED",28,"(400,)",False,In 2009 Dmitry Medvedev said the counterinsurgency against this republic had ended,Chechnya,1,0
8187,2020-03-24,,Double Jeopardy,"(1, 2)",GET-TOGETHERS,2,"(800,)",False,"Chapter 18 of ""Pride and Prejudice"" takes place at this type of dancing party at Netherfield",a ball,1,0
8187,2020-03-24,,Double Jeopardy,"(2, 2)",FILM ANALYSIS,8,"(2000,)",True,A Raquel Welch poster does a lot more than just hang on the wall in Andy Dufresne's prison cell,Shawshank Redemption,1,0
8187,2020-03-24,,Double Jeopardy,"(3, 2)",BONES,21,"(800,)",False,The metacarpal bones of your hands correspond to these bones of your feet,metatarsal,1,1
8187,2020-03-24,,Double Jeopardy,"(4, 2)",COMEDIA DELL'ARTE CHARACTERS,23,"(800,)",False,"The word ""pants"" comes from the name of this villainous character who wore long red trousers",Pantalone,1,0
8187,2020-03-24,,Double Jeopardy,"(5, 2)",COLONIAL AMERICA,13,"(800,)",False,"Of 500 colonists in this first English settlement in N. America in fall 1609, fewer than 1/5 would survive the coming winter",Jamestown,1,0
8187,2020-03-24,,Double Jeopardy,"(6, 2)","""CH"" SQUARED",27,"(800,)",False,"13-letter profession of Ichabod Crane in ""Legend of Sleepy Hollow""",schoolteacher,0,3
8187,2020-03-24,,Double Jeopardy,"(1, 3)",GET-TOGETHERS,3,"(1200,)",False,"In Amish culture, a frolic is an event combining practical and social aspects, like the raising of this structure",a barn,1,0
8187,2020-03-24,,Double Jeopardy,"(2, 3)",FILM ANALYSIS,5,"(1200,)",False,Rosamund Pike disappears from Ben Affleck's life (for a bit),Gone Girl,1,0
8187,2020-03-24,,Double Jeopardy,"(3, 3)",BONES,15,"(1200,)",False,"This word for the shoulder comes from Latin for ""shoulder"" & ""blade""",scapula,1,0
8187,2020-03-24,,Double Jeopardy,"(4, 3)",COMEDIA DELL'ARTE CHARACTERS,24,"(3000,)",True,"This type of physical comedy is named for the bat Arlecchino, AKA Harlequin, used to beat his comic victims",slapstick,0,1
8187,2020-03-24,,Double Jeopardy,"(5, 3)",COLONIAL AMERICA,10,"(1200,)",False,"With the hated ""Intolerable Acts"" on their minds, the first of these government bodies met in Philadelphia in 1774",the Continental Congress,1,0
8187,2020-03-24,,Double Jeopardy,"(6, 3)","""CH"" SQUARED",19,"(1200,)",False,"Alan Moore created this ""Watchmen"" character as a bad version of Batman, & cringed a bit when fans idolized him",Rorschach,0,3
8187,2020-03-24,,Double Jeopardy,"(1, 4)",GET-TOGETHERS,4,"(1600,)",False,In 19th century England you might be invited to an unwrapping party for this item that had been brought from Egypt,a mummy,1,1
8187,2020-03-24,,Double Jeopardy,"(2, 4)",FILM ANALYSIS,6,"(1600,)",False,Clint is hacked off at Hackman & the Old West gets wild,Unforgiven,1,0
8187,2020-03-24,,Double Jeopardy,"(3, 4)",BONES,16,"(1600,)",False,"It sounds like an alternate name of ancient Troy, but anatomically, it's the upper part of the hip bone",the ilium,1,0
8187,2020-03-24,,Double Jeopardy,"(4, 4)",COMEDIA DELL'ARTE CHARACTERS,25,"(1600,)",False,"This braggart appears in ""Bohemian Rhapsody""--could he do the fandango?",Scaramouche,1,0
8187,2020-03-24,,Double Jeopardy,"(5, 4)",COLONIAL AMERICA,11,"(1600,)",False,Hold that tiger! The College of New Jersey was founded in 1746 & would later become this university,Princeton,1,0
8187,2020-03-24,,Double Jeopardy,"(6, 4)","""CH"" SQUARED",20,"(1600,)",False,"A staple in Mexico City, they're crunch pieces of deep-fried pork skin",chicharrones,0,3
8187,2020-03-24,,Double Jeopardy,"(1, 5)",GET-TOGETHERS,18,"(2000,)",False,"It's French for ""evening""; an 1887 book of manners says it's held at an early hour & is more about conversation than dancing",a soiree,1,0
8187,2020-03-24,,Double Jeopardy,"(2, 5)",FILM ANALYSIS,7,"(2000,)",False,In a 2013 film Tom Hanks takes Alabama to sea & must figure out how to deal with unexpected guests,Captain Phillips,1,0
8187,2020-03-24,,Double Jeopardy,"(3, 5)",BONES,17,"(2000,)",False,"Lifesaving chest compressions during CPR can sometimes cause a fracture of this, AKA the breastbone",a sternum,1,0
8187,2020-03-24,,Double Jeopardy,"(4, 5)",COMEDIA DELL'ARTE CHARACTERS,26,"(2000,)",False,Pedrolino often used white makeup instead of a mask & was the inspiration for the tragic clown of this Leoncavallo opera,Pagliacci,1,0
8187,2020-03-24,,Double Jeopardy,"(5, 5)",COLONIAL AMERICA,12,"(2000,)",False,Claims that the authorities had not done enough to protect against Indian attacks encouraged this 1676 rebellion,Bacon\'s Rebellion,0,3
8187,2020-03-24,,Double Jeopardy,"(6, 5)","""CH"" SQUARED",29,"(2000,)",False,"This French phrase means ""seek the woman""",cherchez la femme,1,0
8187,2020-03-24,,Final Jeopardy,"(1, 1)",AMERICAN POETS,0,"(4800, 1801, 7401)",False,"This New York woman died in 1887, the year after the subject of her most famous poem was unveiled",Emma Lazarus,1,2
