epNum,airDate,extra_info,round_name,coord,category,order,value,daily_double,question,answer,correctAttempts,wrongAttempts
8382,2021-04-20,Champion's winnings & consolation amounts matched to Hospital Albert Schweitzer in Haiti.,Jeopardy,"(1, 1)",PLANET SHAMING,13,"(200,)",False,Tried to kill visitor Matt Damon in a 2015 movie,Mars,0,3
8382,2021-04-20,Champion's winnings & consolation amounts matched to Hospital Albert Schweitzer in Haiti.,Jeopardy,"(2, 1)",INTERNATIONAL ORGS.,15,"(200,)",False,"The will of the people is the basis of government, says the CoD, which is a community of these types of nations",democracies,1,0
8382,2021-04-20,Champion's winnings & consolation amounts matched to Hospital Albert Schweitzer in Haiti.,Jeopardy,"(3, 1)",QUOTATION: MARK'S,8,"(200,)",False,"This writer: ""Always do right. This will gratify some people, & astonish the rest""",Mark Twain,1,0
8382,2021-04-20,Champion's winnings & consolation amounts matched to Hospital Albert Schweitzer in Haiti.,Jeopardy,"(4, 1)",RELAX,6,"(200,)",False,"Do this activity that uses abbreviations like yon (yarn over needle), p2tog (purl 2 stitches together) & w&t (wrap & turn)",knitting,1,0
8382,2021-04-20,Champion's winnings & consolation amounts matched to Hospital Albert Schweitzer in Haiti.,Jeopardy,"(5, 1)",MOVIE TO STAGE,1,"(200,)",False,"Songs in this ""ogreish"" musical include ""Donkey Pot Pie"" & ""Freak Flag""",Shrek,1,0
8382,2021-04-20,Champion's winnings & consolation amounts matched to Hospital Albert Schweitzer in Haiti.,Jeopardy,"(6, 1)",IN THE DICTIONARY,16,"(200,)",False,"""Ditch... used for military defense often with the excavated dirt thrown up in front""",a trench,1,0
8382,2021-04-20,Champion's winnings & consolation amounts matched to Hospital Albert Schweitzer in Haiti.,Jeopardy,"(1, 2)",PLANET SHAMING,14,"(400,)",False,"Billed as having a Great Red Spot, recently more like a medium-sized orange pimple",Jupiter,1,0
8382,2021-04-20,Champion's winnings & consolation amounts matched to Hospital Albert Schweitzer in Haiti.,Jeopardy,"(2, 2)",INTERNATIONAL ORGS.,24,"(400,)",False,The ICC is the International this business-promoting organization; your hometown probably has one,a chamber of commerce,1,0
8382,2021-04-20,Champion's winnings & consolation amounts matched to Hospital Albert Schweitzer in Haiti.,Jeopardy,"(3, 2)",QUOTATION: MARK'S,9,"(400,)",False,"This CEO, to Congress: ""We were slow in identifying the Russian information operations in 2016""",Mark Zuckerberg,1,0
8382,2021-04-20,Champion's winnings & consolation amounts matched to Hospital Albert Schweitzer in Haiti.,Jeopardy,"(4, 2)",RELAX,7,"(400,)",False,"Maybe I'll relax by throwing the ball around with this big breed of dog, seen here",a Great Dane,1,0
8382,2021-04-20,Champion's winnings & consolation amounts matched to Hospital Albert Schweitzer in Haiti.,Jeopardy,"(5, 2)",MOVIE TO STAGE,2,"(400,)",False,This film starring Julia Roberts & Richard Gere moved from Beverly Hills to Broadway,Pretty Woman,1,0
8382,2021-04-20,Champion's winnings & consolation amounts matched to Hospital Albert Schweitzer in Haiti.,Jeopardy,"(6, 2)",IN THE DICTIONARY,17,"(400,)",False,"""Dense"", or ""exceeding 90 degrees but being less than 180 degrees""",obtuse,1,0
8382,2021-04-20,Champion's winnings & consolation amounts matched to Hospital Albert Schweitzer in Haiti.,Jeopardy,"(1, 3)",PLANET SHAMING,18,"(600,)",False,"Didn't say goodbye when Pluto left the club, leaving it as the farthest planet from the Sun",Neptune,1,0
8382,2021-04-20,Champion's winnings & consolation amounts matched to Hospital Albert Schweitzer in Haiti.,Jeopardy,"(2, 3)",INTERNATIONAL ORGS.,25,"(1000,)",True,"Bulgaria & Moldova belong to BSEC, the economic cooperation zone named for this body of water",the Black Sea,1,0
8382,2021-04-20,Champion's winnings & consolation amounts matched to Hospital Albert Schweitzer in Haiti.,Jeopardy,"(3, 3)",QUOTATION: MARK'S,10,"(600,)",False,"This singer & guitar whiz: ""We are the sultans of swing""",Mark Knopfler,1,0
8382,2021-04-20,Champion's winnings & consolation amounts matched to Hospital Albert Schweitzer in Haiti.,Jeopardy,"(4, 3)",RELAX,28,"(600,)",False,"Nothing soothes like a cup of tea made from this herb, whether it's the German or the Roman variety",chamomile,1,0
8382,2021-04-20,Champion's winnings & consolation amounts matched to Hospital Albert Schweitzer in Haiti.,Jeopardy,"(5, 3)",MOVIE TO STAGE,3,"(600,)",False,This musical centers on a boy from a family of coal miners who wants to be a ballet dancer,Billy Elliot,1,0
8382,2021-04-20,Champion's winnings & consolation amounts matched to Hospital Albert Schweitzer in Haiti.,Jeopardy,"(6, 3)",IN THE DICTIONARY,21,"(600,)",False,"""To douse with a liquor (such as brandy, rum or cognac) and ignite""",flambé,1,0
8382,2021-04-20,Champion's winnings & consolation amounts matched to Hospital Albert Schweitzer in Haiti.,Jeopardy,"(1, 4)",PLANET SHAMING,19,"(800,)",False,Showed no remorse after the MESSENGER probe crashed into it,Mercury,0,3
8382,2021-04-20,Champion's winnings & consolation amounts matched to Hospital Albert Schweitzer in Haiti.,Jeopardy,"(2, 4)",INTERNATIONAL ORGS.,26,"(800,)",False,"EFTA, the European Free Trade Association, has just 4 members: Iceland, Norway, Switzerland & this tiny Swiss neighbor",Liechtenstein,1,1
8382,2021-04-20,Champion's winnings & consolation amounts matched to Hospital Albert Schweitzer in Haiti.,Jeopardy,"(3, 4)",QUOTATION: MARK'S,11,"(800,)",False,"This TV personality, sports team owner &, apparently, lucky man: ""To be a billionaire, you got to get lucky""",Mark Cuban,1,0
8382,2021-04-20,Champion's winnings & consolation amounts matched to Hospital Albert Schweitzer in Haiti.,Jeopardy,"(4, 4)",RELAX,29,"(800,)",False,This type of massage originated in Japan & uses finger pressure to stimulate the circulatory system,shiatsu,1,0
8382,2021-04-20,Champion's winnings & consolation amounts matched to Hospital Albert Schweitzer in Haiti.,Jeopardy,"(5, 4)",MOVIE TO STAGE,4,"(800,)",False,"This musical says it was ""lovingly ripped off from the motion picture 'Monty Python and the Holy Grail""'",Spamalot,1,0
8382,2021-04-20,Champion's winnings & consolation amounts matched to Hospital Albert Schweitzer in Haiti.,Jeopardy,"(6, 4)",IN THE DICTIONARY,22,"(800,)",False,"This -ism is a ""relapse into criminal behavior""",recidivism,1,0
8382,2021-04-20,Champion's winnings & consolation amounts matched to Hospital Albert Schweitzer in Haiti.,Jeopardy,"(1, 5)",PLANET SHAMING,20,"(1000,)",False,Always covered by clouds of sulfuric acid. No silver linings,Venus,1,0
8382,2021-04-20,Champion's winnings & consolation amounts matched to Hospital Albert Schweitzer in Haiti.,Jeopardy,"(2, 5)",INTERNATIONAL ORGS.,27,"(1000,)",False,"In 2018 Ukraine ended formal participation in the CIS, this organization formed in 1991",the Commonwealth of Independent States,0,3
8382,2021-04-20,Champion's winnings & consolation amounts matched to Hospital Albert Schweitzer in Haiti.,Jeopardy,"(3, 5)",QUOTATION: MARK'S,12,"(1000,)",False,"This retired FBI official: ""I'm the guy they called Deep Throat""",Mark Felt,0,3
8382,2021-04-20,Champion's winnings & consolation amounts matched to Hospital Albert Schweitzer in Haiti.,Jeopardy,"(4, 5)",RELAX,30,"(1000,)",False,"Let's enjoy this composer's Brandenburg Concerto No. 6, 3rd movement",(Johann Sebastian) Bach,1,0
8382,2021-04-20,Champion's winnings & consolation amounts matched to Hospital Albert Schweitzer in Haiti.,Jeopardy,"(5, 5)",MOVIE TO STAGE,5,"(1000,)",False,Tina Fey wrote the book for this musical adaptation about surviving high school cliques,Mean Girls,1,0
8382,2021-04-20,Champion's winnings & consolation amounts matched to Hospital Albert Schweitzer in Haiti.,Jeopardy,"(6, 5)",IN THE DICTIONARY,23,"(1000,)",False,"""Of or relating to a church parish... provincial""",parochial,0,3
8382,2021-04-20,Champion's winnings & consolation amounts matched to Hospital Albert Schweitzer in Haiti.,Double Jeopardy,"(1, 1)",HISTORY,7,"(400,)",False,Toronto was captured by U.S. forces during this war & the symbols of Ontario's government taken away,the War of 1812,1,0
8382,2021-04-20,Champion's winnings & consolation amounts matched to Hospital Albert Schweitzer in Haiti.,Double Jeopardy,"(2, 1)",ASIAN CITIES,5,"(400,)",False,"This capital of Iraq was formerly called Madinat al-Salam, Arabic for ""city of peace""",Baghdad,1,0
8382,2021-04-20,Champion's winnings & consolation amounts matched to Hospital Albert Schweitzer in Haiti.,Double Jeopardy,"(3, 1)",17-LETTER WORDS,12,"(400,)",False,"Legalization differs from this ac-""tion"", by which a drug is still illegal but possession of a limited amount is not prosecuted",decriminalization,1,0
8382,2021-04-20,Champion's winnings & consolation amounts matched to Hospital Albert Schweitzer in Haiti.,Double Jeopardy,"(4, 1)",BOOKS FOR THE WEATHER CHANNEL,6,"(400,)",False,"I was ""struck by"" the plot twists in Dean Koontz' book about Laura Shane with this 1-word title",Lightning,1,0
8382,2021-04-20,Champion's winnings & consolation amounts matched to Hospital Albert Schweitzer in Haiti.,Double Jeopardy,"(5, 1)",LEADING FEMALE TV,17,"(400,)",False,"This actress was never far from ""Scandal"" as Washington, D.C. crisis manager Olivia Pope",Kerry Washington,1,0
8382,2021-04-20,Champion's winnings & consolation amounts matched to Hospital Albert Schweitzer in Haiti.,Double Jeopardy,"(6, 1)","POTPOUR""E""",16,"(400,)",False,A zero-zero test of this airplane seat is done on the ground,an ejector seat,1,0
8382,2021-04-20,Champion's winnings & consolation amounts matched to Hospital Albert Schweitzer in Haiti.,Double Jeopardy,"(1, 2)",HISTORY,8,"(800,)",False,"After taking control of Spain in 1939, this fascist tried to get rid of all his political foes",(Francisco) Franco,1,0
8382,2021-04-20,Champion's winnings & consolation amounts matched to Hospital Albert Schweitzer in Haiti.,Double Jeopardy,"(2, 2)",ASIAN CITIES,4,"(800,)",False,"Some of Kazakhstan's only water ports, Aktau & Kuryk are major shipping centers on this sea",the Caspian Sea,1,0
8382,2021-04-20,Champion's winnings & consolation amounts matched to Hospital Albert Schweitzer in Haiti.,Double Jeopardy,"(3, 2)",17-LETTER WORDS,13,"(800,)",False,Idealistic philosophy of Emerson & Thoreau,transcendentalism,1,0
8382,2021-04-20,Champion's winnings & consolation amounts matched to Hospital Albert Schweitzer in Haiti.,Double Jeopardy,"(4, 2)",BOOKS FOR THE WEATHER CHANNEL,23,"(800,)",False,"The infamous Red Wedding takes place in this author's ""A Storm of Swords""",(George R.R.) Martin,1,0
8382,2021-04-20,Champion's winnings & consolation amounts matched to Hospital Albert Schweitzer in Haiti.,Double Jeopardy,"(5, 2)",LEADING FEMALE TV,19,"(800,)",False,"These 2 words describe ""Xena"" in the full title of the show that starred Lucy Lawless",Warrior Princess,1,0
8382,2021-04-20,Champion's winnings & consolation amounts matched to Hospital Albert Schweitzer in Haiti.,Double Jeopardy,"(6, 2)","POTPOUR""E""",18,"(800,)",False,"In maintaining your car, this should be thin; if it's thick & white, coolant is being vaporized",exhaust,0,3
8382,2021-04-20,Champion's winnings & consolation amounts matched to Hospital Albert Schweitzer in Haiti.,Double Jeopardy,"(1, 3)",HISTORY,9,"(2500,)",True,"""Marching to Pretoria"" was a folk song of this war, & here are British troops doing so in 1900",the Boer War,1,0
8382,2021-04-20,Champion's winnings & consolation amounts matched to Hospital Albert Schweitzer in Haiti.,Double Jeopardy,"(2, 3)",ASIAN CITIES,2,"(1200,)",False,This capital of the Philippines is on Luzon Island,Manila,1,0
8382,2021-04-20,Champion's winnings & consolation amounts matched to Hospital Albert Schweitzer in Haiti.,Double Jeopardy,"(3, 3)",17-LETTER WORDS,14,"(1200,)",False,Reduction of the body's ability to fight infection; it happens with HIV & can be done deliberately before a transplant,immunosuppression,1,0
8382,2021-04-20,Champion's winnings & consolation amounts matched to Hospital Albert Schweitzer in Haiti.,Double Jeopardy,"(4, 3)",BOOKS FOR THE WEATHER CHANNEL,24,"(1200,)",False,"""Smilla's Sense of"" this helps her solve a murder in Copenhagen",the Snow,1,0
8382,2021-04-20,Champion's winnings & consolation amounts matched to Hospital Albert Schweitzer in Haiti.,Double Jeopardy,"(5, 3)",LEADING FEMALE TV,20,"(1200,)",False,On this show Jennifer Garner was a college student recruited to be a spy,Alias,1,0
8382,2021-04-20,Champion's winnings & consolation amounts matched to Hospital Albert Schweitzer in Haiti.,Double Jeopardy,"(6, 3)","POTPOUR""E""",27,"(1200,)",False,It's a highly potent brand of grain alcohol from Luxco,Everclear,1,0
8382,2021-04-20,Champion's winnings & consolation amounts matched to Hospital Albert Schweitzer in Haiti.,Double Jeopardy,"(1, 4)",HISTORY,10,"(1600,)",False,In 480 B.C. the Persian army found out the hard way this mountain pass was about 50 feet wide at its narrowest,Thermopylae,1,1
8382,2021-04-20,Champion's winnings & consolation amounts matched to Hospital Albert Schweitzer in Haiti.,Double Jeopardy,"(2, 4)",ASIAN CITIES,1,"(1600,)",False,Dili is the capital of this nation that broke away from Indonesia in 1999,East Timor,1,0
8382,2021-04-20,Champion's winnings & consolation amounts matched to Hospital Albert Schweitzer in Haiti.,Double Jeopardy,"(3, 4)",17-LETTER WORDS,15,"(2000,)",True,Critic Roger Fry coined this term for the late 19th century art style of Seurat & Gauguin,Postimpressionism,0,1
8382,2021-04-20,Champion's winnings & consolation amounts matched to Hospital Albert Schweitzer in Haiti.,Double Jeopardy,"(4, 4)",BOOKS FOR THE WEATHER CHANNEL,25,"(1600,)",False,"Dennis Lehane's ""Prayers for Rain"" is about a P.I. based in this East Coast city",Boston,1,0
8382,2021-04-20,Champion's winnings & consolation amounts matched to Hospital Albert Schweitzer in Haiti.,Double Jeopardy,"(5, 4)",LEADING FEMALE TV,21,"(1600,)",False,"""Angel of Mercy"" is an episode of the show that tells the origin story of this character from ""One Flew Over the Cuckoo's Nest""",Nurse Ratched,1,0
8382,2021-04-20,Champion's winnings & consolation amounts matched to Hospital Albert Schweitzer in Haiti.,Double Jeopardy,"(6, 4)","POTPOUR""E""",28,"(1600,)",False,It's a 4-letter name for a pitcher with a handle,ewer,1,0
8382,2021-04-20,Champion's winnings & consolation amounts matched to Hospital Albert Schweitzer in Haiti.,Double Jeopardy,"(1, 5)",HISTORY,11,"(2000,)",False,"A 4-term governor of New York, he lost his race in 1928 as the first serious Catholic candidate for president",Al Smith,1,0
8382,2021-04-20,Champion's winnings & consolation amounts matched to Hospital Albert Schweitzer in Haiti.,Double Jeopardy,"(2, 5)",ASIAN CITIES,3,"(2000,)",False,"Israel's third-largest city, it overlooks the Mediterranean from Mount Carmel",Haifa,1,0
8382,2021-04-20,Champion's winnings & consolation amounts matched to Hospital Albert Schweitzer in Haiti.,Double Jeopardy,"(3, 5)",17-LETTER WORDS,30,"(2000,)",False,"Related to a word for that little voice telling you right & wrong, it's the quality of being thorough & scrupulous",conscientiousness,0,3
8382,2021-04-20,Champion's winnings & consolation amounts matched to Hospital Albert Schweitzer in Haiti.,Double Jeopardy,"(4, 5)",BOOKS FOR THE WEATHER CHANNEL,26,"(2000,)",False,"In this tale by Marion Zimmer Bradley, the King Arthur legend is retold through the eyes of women",The Mists of Avalon,1,0
8382,2021-04-20,Champion's winnings & consolation amounts matched to Hospital Albert Schweitzer in Haiti.,Double Jeopardy,"(5, 5)",LEADING FEMALE TV,22,"(2000,)",False,"Seen here, Jennifer Love Hewitt starred on this TV show as a woman who saw the spirits of the newly deceased",the Ghost Whisperer,1,0
8382,2021-04-20,Champion's winnings & consolation amounts matched to Hospital Albert Schweitzer in Haiti.,Double Jeopardy,"(6, 5)","POTPOUR""E""",29,"(2000,)",False,"De Tocqueville is said to have coined ""American"" this, meaning that the U.S. is inherently different from other nations",exceptionalism,1,0
8382,2021-04-20,Champion's winnings & consolation amounts matched to Hospital Albert Schweitzer in Haiti.,Final Jeopardy,"(1, 1)",EUROPEAN TOURIST ATTRACTIONS,0,"(8600, 3200, 12701)",False,"Opened in 1843, it was frequented by Hans Christian Andersen & Walt Disney, who both found inspiration there",Tivoli (Gardens),0,3
