epNum,airDate,extra_info,round_name,coord,category,order,value,daily_double,question,answer,correctAttempts,wrongAttempts
8408,2021-05-26,2021 Tournament of Champions semifinal game 3.,Jeopardy,"(1, 1)",THE CIVIL WAR,4,"(200,)",False,"""High-ranking"" name of the Confederate locomotive hijacked by Union troops in 1862",the General,1,0
8408,2021-05-26,2021 Tournament of Champions semifinal game 3.,Jeopardy,"(2, 1)",TRANSPORTATION,2,"(200,)",False,"One of the highest systems using these alliterative transports takes you from Chamonix up 8,900' almost to the summit of Mount Midi",a cable car,1,0
8408,2021-05-26,2021 Tournament of Champions semifinal game 3.,Jeopardy,"(3, 1)",YOUNG PEOPLE'S LITERATURE,26,"(200,)",False,The name of this quirky alliterative character was inspired by a boomerang toy Roald Dahl had as a boy,Willy Wonka,1,0
8408,2021-05-26,2021 Tournament of Champions semifinal game 3.,Jeopardy,"(4, 1)",ONES & ZEROS,29,"(200,)",False,"The Jaguar I-PACE & the Fiat 500e are both examples of these, ZEVs for short",zero emission vehicles,1,0
8408,2021-05-26,2021 Tournament of Champions semifinal game 3.,Jeopardy,"(5, 1)",OLYMPIC SPORTS EQUIPMENT,30,"(200,)",False,"Goal, swimsuit",water polo,1,0
8408,2021-05-26,2021 Tournament of Champions semifinal game 3.,Jeopardy,"(6, 1)",IN THE DICTIONARY,19,"(200,)",False,"There's a silent ""B"" in this adjective meaning mysterious & faint, like the Mona Lisa's smile",subtle,0,3
8408,2021-05-26,2021 Tournament of Champions semifinal game 3.,Jeopardy,"(1, 2)",THE CIVIL WAR,25,"(400,)",False,"The Dictator, an enormous one of these artillery weapons that fire high-arcing shells, was used in the Siege of Petersburg",a mortar,1,1
8408,2021-05-26,2021 Tournament of Champions semifinal game 3.,Jeopardy,"(2, 2)",TRANSPORTATION,12,"(400,)",False,"First built in 1936, Oscar Mayer's distinctive promotional vehicle has this appropriate name",the Wienermobile,1,0
8408,2021-05-26,2021 Tournament of Champions semifinal game 3.,Jeopardy,"(3, 2)",YOUNG PEOPLE'S LITERATURE,7,"(1000,)",True,"Chapters in this work include ""The Mock Turtle's Story"" & ""The Lobster Quadrille""",Alice\'s Adventures in Wonderland,1,0
8408,2021-05-26,2021 Tournament of Champions semifinal game 3.,Jeopardy,"(4, 2)",ONES & ZEROS,28,"(400,)",False,"This base-2 notation system uses only 2 digits, one & zero",binary,1,0
8408,2021-05-26,2021 Tournament of Champions semifinal game 3.,Jeopardy,"(5, 2)",OLYMPIC SPORTS EQUIPMENT,27,"(400,)",False,"Rocks, brooms",curling,1,0
8408,2021-05-26,2021 Tournament of Champions semifinal game 3.,Jeopardy,"(6, 2)",IN THE DICTIONARY,20,"(400,)",False,"This optical device that uses mirrors & colored glass gets its name partly from the Greek for ""beautiful""",kaleidoscope,1,0
8408,2021-05-26,2021 Tournament of Champions semifinal game 3.,Jeopardy,"(1, 3)",THE CIVIL WAR,24,"(600,)",False,At Gettysburg James Longstreet was actually in command of the disastrous Confederate attack known as this,Pickett\'s Charge,1,0
8408,2021-05-26,2021 Tournament of Champions semifinal game 3.,Jeopardy,"(2, 3)",TRANSPORTATION,18,"(600,)",False,"This 1,900-mile-long interstate travels by Jacksonville, Florida, Washington, D.C. & Portland, Maine",I-95,1,0
8408,2021-05-26,2021 Tournament of Champions semifinal game 3.,Jeopardy,"(3, 3)",YOUNG PEOPLE'S LITERATURE,8,"(600,)",False,"""Last Sacrifice"" was the finale of Richelle Mead's series about special young people attending this school",the Vampire Academy,0,3
8408,2021-05-26,2021 Tournament of Champions semifinal game 3.,Jeopardy,"(4, 3)",ONES & ZEROS,16,"(600,)",False,"0 K, not to be confused with OK, is also known by this phrase",absolute zero,1,1
8408,2021-05-26,2021 Tournament of Champions semifinal game 3.,Jeopardy,"(5, 3)",OLYMPIC SPORTS EQUIPMENT,1,"(600,)",False,"Hoops, ribbons",rhythmic gymnastics,1,0
8408,2021-05-26,2021 Tournament of Champions semifinal game 3.,Jeopardy,"(6, 3)",IN THE DICTIONARY,22,"(600,)",False,This portmanteau word for a women's 2-piece bathing suit that provides more coverage than a bikini dates to 1985,a tankini,1,0
8408,2021-05-26,2021 Tournament of Champions semifinal game 3.,Jeopardy,"(1, 4)",THE CIVIL WAR,15,"(800,)",False,"After this bloody 1862 battle, President Lincoln visited McClellan on the battlefield & urged him to pursue retreating rebels",Antietam,1,0
8408,2021-05-26,2021 Tournament of Champions semifinal game 3.,Jeopardy,"(2, 4)",TRANSPORTATION,3,"(800,)",False,In 1871 this railroad & shipping tycoon built the first depot at what became Grand Central Terminal,(Cornelius) Vanderbilt,1,0
8408,2021-05-26,2021 Tournament of Champions semifinal game 3.,Jeopardy,"(3, 4)",YOUNG PEOPLE'S LITERATURE,13,"(800,)",False,"In a story by Mary Mapes Dodge, the sister of this title boy wins the silver skates",Hans Brinker,1,0
8408,2021-05-26,2021 Tournament of Champions semifinal game 3.,Jeopardy,"(4, 4)",ONES & ZEROS,11,"(800,)",False,"The bran cereal called this ""One"" says it provides 65% of your daily value of it",Fiber One,1,0
8408,2021-05-26,2021 Tournament of Champions semifinal game 3.,Jeopardy,"(5, 4)",OLYMPIC SPORTS EQUIPMENT,6,"(800,)",False,Bindings & a tube with 22-foot-high walls,snowboarding,1,1
8408,2021-05-26,2021 Tournament of Champions semifinal game 3.,Jeopardy,"(6, 4)",IN THE DICTIONARY,23,"(800,)",False,"Tilt, prejudice & diagonal are synonyms of this 4-letter word",bias,1,0
8408,2021-05-26,2021 Tournament of Champions semifinal game 3.,Jeopardy,"(1, 5)",THE CIVIL WAR,9,"(1000,)",False,"U.S. Grant got his ""Unconditional Surrender"" nickname at the 1862 capture of Fort Donelson on the Cumberland River in this state",Tennessee,1,0
8408,2021-05-26,2021 Tournament of Champions semifinal game 3.,Jeopardy,"(2, 5)",TRANSPORTATION,17,"(1000,)",False,"Named for its three tiers of oars, it was the principal warship with which the Greek city-states vied for control of the seas",the trireme,1,0
8408,2021-05-26,2021 Tournament of Champions semifinal game 3.,Jeopardy,"(3, 5)",YOUNG PEOPLE'S LITERATURE,14,"(1000,)",False,"Melinda Sordino is the heroine of this novel by Laurie Halse Anderson; the last name Sordino can mean ""mute""",Speak,0,3
8408,2021-05-26,2021 Tournament of Champions semifinal game 3.,Jeopardy,"(4, 5)",ONES & ZEROS,10,"(1000,)",False,"ZIRP is short for this banking ""policy"" that encourages low-cost credit to companies & individuals",zero interest-rate policy,0,3
8408,2021-05-26,2021 Tournament of Champions semifinal game 3.,Jeopardy,"(5, 5)",OLYMPIC SPORTS EQUIPMENT,5,"(1000,)",False,"Horse, epee",modern pentathlon,1,1
8408,2021-05-26,2021 Tournament of Champions semifinal game 3.,Jeopardy,"(6, 5)",IN THE DICTIONARY,21,"(1000,)",False,Geometry has cool words like rhombus & this one for a quadrilateral with only 2 parallel sides,a trapezoid,1,0
8408,2021-05-26,2021 Tournament of Champions semifinal game 3.,Double Jeopardy,"(1, 1)",SEEING RED,30,"(400,)",False,She's draped in red in a 16th century work by Giorgione,(the Virgin) Mary,1,0
8408,2021-05-26,2021 Tournament of Champions semifinal game 3.,Double Jeopardy,"(2, 1)",IT'S A MIRAGE,29,"(400,)",False,"Mirages are a common sight in Namibia's Etosha pan, a vast, dry plain mainly covered in this mineral",salt,0,3
8408,2021-05-26,2021 Tournament of Champions semifinal game 3.,Double Jeopardy,"(3, 1)","3 ""D""",25,"(400,)",False,A female who's partly divine,a demigoddess,1,0
8408,2021-05-26,2021 Tournament of Champions semifinal game 3.,Double Jeopardy,"(4, 1)",U.K. PLACES,28,"(400,)",False,"Associated with a group of poets, this scenic area gets its name from multiple bodies of water including Derwent Water",Lake District,1,0
8408,2021-05-26,2021 Tournament of Champions semifinal game 3.,Double Jeopardy,"(5, 1)",FICTIONAL GAME SHOWS,27,"(400,)",False,"""How Did I Get Here?"" is an interdimensional game show on the animated series named for this pair",Rick & Morty,1,0
8408,2021-05-26,2021 Tournament of Champions semifinal game 3.,Double Jeopardy,"(6, 1)",THE ANCIENTS SPEAK,26,"(400,)",False,"Anaxagoras pointed out that ""The descent to"" this Greek underworld ""is the same from every place""",Hades,1,0
8408,2021-05-26,2021 Tournament of Champions semifinal game 3.,Double Jeopardy,"(1, 2)",SEEING RED,23,"(800,)",False,The title of this work is Spanish for the man wielding the red cape,matador,1,1
8408,2021-05-26,2021 Tournament of Champions semifinal game 3.,Double Jeopardy,"(2, 2)",IT'S A MIRAGE,24,"(800,)",False,"The French-made Mirage fighter jet is known as Shahak, or ""heavens"", in this country that's used it to great effect",Israel,1,0
8408,2021-05-26,2021 Tournament of Champions semifinal game 3.,Double Jeopardy,"(3, 2)","3 ""D""",19,"(800,)",False,"2-word term for flawed, unsalable merchandise",damaged goods,1,0
8408,2021-05-26,2021 Tournament of Champions semifinal game 3.,Double Jeopardy,"(4, 2)",U.K. PLACES,8,"(800,)",False,Donegall Square is in the heart of this capital city,Belfast,1,2
8408,2021-05-26,2021 Tournament of Champions semifinal game 3.,Double Jeopardy,"(5, 2)",FICTIONAL GAME SHOWS,20,"(800,)",False,"On an episode of the cartoon called ""The Real"" this group, Ray & Winston play ""Race the Devil""; Venkman is in the audience",Ghostbusters,1,0
8408,2021-05-26,2021 Tournament of Champions semifinal game 3.,Double Jeopardy,"(6, 2)",THE ANCIENTS SPEAK,22,"(800,)",False,"From this female poet: ""The Moon has set, and the Pleiades; it is midnight, and time passes, and I sleep alone""",Sappho,1,0
8408,2021-05-26,2021 Tournament of Champions semifinal game 3.,Double Jeopardy,"(1, 3)",SEEING RED,11,"(1200,)",False,A painting by Kazamir Malevich in the Russian State Museum has this appropriate geometric title,Red Square,1,0
8408,2021-05-26,2021 Tournament of Champions semifinal game 3.,Double Jeopardy,"(2, 3)",IT'S A MIRAGE,13,"(1200,)",False,"A mirage in which the Sun appears to have another sun below it is called this type, after the Greek letter it resembles",omega,1,0
8408,2021-05-26,2021 Tournament of Champions semifinal game 3.,Double Jeopardy,"(3, 3)","3 ""D""",18,"(1200,)",False,"If you've interfered in someone else's affairs, you've done this",meddled,1,1
8408,2021-05-26,2021 Tournament of Champions semifinal game 3.,Double Jeopardy,"(4, 3)",U.K. PLACES,7,"(3000,)",True,"Doing something redundant is like ""carrying coals"" to this city, formerly a coal-mining center",Newcastle,0,1
8408,2021-05-26,2021 Tournament of Champions semifinal game 3.,Double Jeopardy,"(5, 3)",FICTIONAL GAME SHOWS,4,"(1200,)",False,"A sequel to this mind-bending 1975 movie musical, ""Shock Treatment"" finds Brad & Janet as contestants on ""Marriage Maze""",The Rocky Horror Picture Show,1,0
8408,2021-05-26,2021 Tournament of Champions semifinal game 3.,Double Jeopardy,"(6, 3)",THE ANCIENTS SPEAK,5,"(1200,)",False,"Lao-tzu said, ""I have just three things to teach"", not ""Love! Valour!"" This! but ""simplicity, patience"" & this",compassion,1,0
8408,2021-05-26,2021 Tournament of Champions semifinal game 3.,Double Jeopardy,"(1, 4)",SEEING RED,9,"(1600,)",False,"""Red Virginia Creeper"" is by this great Scandinavian",Edvard Munch,1,0
8408,2021-05-26,2021 Tournament of Champions semifinal game 3.,Double Jeopardy,"(2, 4)",IT'S A MIRAGE,12,"(1600,)",False,"The name of this city that's home to Western Michigan University may be from a Potawatomi word for ""mirage""",Kalamazoo,1,0
8408,2021-05-26,2021 Tournament of Champions semifinal game 3.,Double Jeopardy,"(3, 4)","3 ""D""",17,"(1600,)",False,"The text of this document begins with ""When"" & ends with ""honor""",the Declaration of Independence,1,0
8408,2021-05-26,2021 Tournament of Champions semifinal game 3.,Double Jeopardy,"(4, 4)",U.K. PLACES,6,"(1600,)",False,In 1910 6 pottery-making towns got together & formed what became Stoke-on-this river,Trent,1,0
8408,2021-05-26,2021 Tournament of Champions semifinal game 3.,Double Jeopardy,"(5, 4)",FICTIONAL GAME SHOWS,3,"(1600,)",False,In this 1987 film Arnold Schwarzenegger tries to survive a public execution game show,The Running Man,1,0
8408,2021-05-26,2021 Tournament of Champions semifinal game 3.,Double Jeopardy,"(6, 4)",THE ANCIENTS SPEAK,21,"(5000,)",True,"Augustus Caesar said he ""found Rome a city of bricks and left it a city of"" this, which was much nicer!",marble,0,1
8408,2021-05-26,2021 Tournament of Champions semifinal game 3.,Double Jeopardy,"(1, 5)",SEEING RED,10,"(2000,)",False,"""Red, Yellow, Red"" is one of this abstract artist's color field paintings",Rothko,1,0
8408,2021-05-26,2021 Tournament of Champions semifinal game 3.,Double Jeopardy,"(2, 5)",IT'S A MIRAGE,15,"(2000,)",False,"This half sister & adversary of Arthur in ""Le Morte d'Arthur"" gave her name to a type of mirage",Morgan le Fay,1,0
8408,2021-05-26,2021 Tournament of Champions semifinal game 3.,Double Jeopardy,"(3, 5)","3 ""D""",14,"(2000,)",False,This breed of terrier was named for a character in a 19th century novel,the Dandie Dinmont Terrier,1,0
8408,2021-05-26,2021 Tournament of Champions semifinal game 3.,Double Jeopardy,"(4, 5)",U.K. PLACES,1,"(2000,)",False,Lewis & Harris is the largest of the Scottish islands known as the Outer these,the Hebrides,1,1
8408,2021-05-26,2021 Tournament of Champions semifinal game 3.,Double Jeopardy,"(5, 5)",FICTIONAL GAME SHOWS,2,"(2000,)",False,"""What Do Kids Know?"" is a game show in this Paul Thomas Anderson film with a tree for a title",Magnolia,1,0
8408,2021-05-26,2021 Tournament of Champions semifinal game 3.,Double Jeopardy,"(6, 5)",THE ANCIENTS SPEAK,16,"(2000,)",False,"In one of his famous comedies, he asked, ""Haven't you sometimes seen a cloud that looked like a Centaur?""",Aristophanes,1,0
8408,2021-05-26,2021 Tournament of Champions semifinal game 3.,Final Jeopardy,"(1, 1)",CLASSICAL COMPOSERS,0,"(2799, 7000, 14999)",False,"Monsieur Crescendo & Signor Vaccarmini (""Mr. Racket"") were derisive nicknames for this composer whose last opera dates from 1829",(Gioachino) Rossini,2,1
