epNum,airDate,extra_info,round_name,coord,category,order,value,daily_double,question,answer,correctAttempts,wrongAttempts
8481,2021-10-04,Matt Amodio game 34.,Jeopardy,"(1, 1)",4-LETTER BOOK TITLES,30,"(200,)",False,This 1981 novel is named for a sick 200-pound St. Bernard in Maine,Cujo,1,0
8481,2021-10-04,Matt Amodio game 34.,Jeopardy,"(2, 1)",BASEBALL HALL OF FAMERS BY INITIALS,27,"(200,)",False,Made the last of 21 straight all-star teams in 1975: H.A.,Hank Aaron,1,0
8481,2021-10-04,Matt Amodio game 34.,Jeopardy,"(3, 1)",INCONCEIVABLE!,28,"(200,)",False,"Crossword, jigsaw, Sudoku... all are a real this",a puzzle,1,0
8481,2021-10-04,Matt Amodio game 34.,Jeopardy,"(4, 1)","IF AT ""FIRST""",15,"(200,)",False,"This covers ""the right of the people... to petition the government for a redress of grievances""",First Amendment,1,0
8481,2021-10-04,Matt Amodio game 34.,Jeopardy,"(5, 1)",YOU DON'T SUCCEED,29,"(200,)",False,"Killing a man was one good reason this vice president did not succeed his boss, Jefferson; later, he got busted for treason",Burr,1,0
8481,2021-10-04,Matt Amodio game 34.,Jeopardy,"(6, 1)",FRY FRY AGAIN,26,"(200,)",False,"Stick with it, this fried favorite made its debut at the 1942 Texas State Fair",corn dog,1,0
8481,2021-10-04,Matt Amodio game 34.,Jeopardy,"(1, 2)",4-LETTER BOOK TITLES,21,"(400,)",False,"In Chapter One of this book, ""a great fish"" severs a woman's femoral artery, the blood now ""a beacon... clear and true""",Jaws,0,3
8481,2021-10-04,Matt Amodio game 34.,Jeopardy,"(2, 2)",BASEBALL HALL OF FAMERS BY INITIALS,22,"(400,)",False,"Look at numbers like 7,356 innings pitched & you'll: C.Y.",(Cy) Young,1,0
8481,2021-10-04,Matt Amodio game 34.,Jeopardy,"(3, 2)",INCONCEIVABLE!,23,"(400,)",False,"Add a ""Y"" to this 4-letter word for gloom or a dark mist & you get a word for hard to understand",murk,0,3
8481,2021-10-04,Matt Amodio game 34.,Jeopardy,"(4, 2)","IF AT ""FIRST""",18,"(400,)",False,"Sounds like bad grammar but ""me"" is an objective singular pronoun of this linguistic form",first person,1,0
8481,2021-10-04,Matt Amodio game 34.,Jeopardy,"(5, 2)",YOU DON'T SUCCEED,24,"(400,)",False,"In a 1998 floor speech, Bob Livingston stunned colleagues by saying he would not succeed Newt Gingrich in this job",Speaker of the House,1,0
8481,2021-10-04,Matt Amodio game 34.,Jeopardy,"(6, 2)",FRY FRY AGAIN,25,"(400,)",False,Shrimp & vegetables are popular fillings for this battered & deep-fried Japanese dish,tempura,1,0
8481,2021-10-04,Matt Amodio game 34.,Jeopardy,"(1, 3)",4-LETTER BOOK TITLES,13,"(600,)",False,"Coming between ""Night"" & ""Day"", it's the middle title in Elie Wiesel's acclaimed trilogy",Dawn,0,3
8481,2021-10-04,Matt Amodio game 34.,Jeopardy,"(2, 3)",BASEBALL HALL OF FAMERS BY INITIALS,14,"(600,)",False,Class of 2020: D.J.,Derek Jeter,1,0
8481,2021-10-04,Matt Amodio game 34.,Jeopardy,"(3, 3)",INCONCEIVABLE!,16,"(600,)",False,"""Bewitched, Bothered & Perplexed"" wasn't quite the right song title, so folks went with this synonym",Bewildered,1,0
8481,2021-10-04,Matt Amodio game 34.,Jeopardy,"(4, 3)","IF AT ""FIRST""",17,"(600,)",False,2-word term describing an E.M.T. who goes to a crisis area to provide immediate assistance,a first responder,1,0
8481,2021-10-04,Matt Amodio game 34.,Jeopardy,"(5, 3)",YOU DON'T SUCCEED,19,"(600,)",False,In 1978 Giovanni Benelli was said to be a favorite--twice--to be the successor in this job but did not have the votes,pope,1,0
8481,2021-10-04,Matt Amodio game 34.,Jeopardy,"(6, 3)",FRY FRY AGAIN,20,"(600,)",False,"Aw Cher, Acadians graced Louisiana with this sugar-covered fried treat whose name comes from French for ""fritter""",beignet,1,0
8481,2021-10-04,Matt Amodio game 34.,Jeopardy,"(1, 4)",4-LETTER BOOK TITLES,7,"(800,)",False,"Named for a music genre, this Toni Morrison novel involves a Harlem love triangle",Jazz,1,0
8481,2021-10-04,Matt Amodio game 34.,Jeopardy,"(2, 4)",BASEBALL HALL OF FAMERS BY INITIALS,8,"(800,)",False,Spectacular southpaw:   S.K.,(Sandy) Koufax,1,0
8481,2021-10-04,Matt Amodio game 34.,Jeopardy,"(3, 4)",INCONCEIVABLE!,10,"(800,)",False,A 6-foot unit of nautical measurement is within this word meaning impossible to understand,unfathomable,1,0
8481,2021-10-04,Matt Amodio game 34.,Jeopardy,"(4, 4)","IF AT ""FIRST""",9,"(6600,)",True,"Primus inter pares is Latin for this, the member of a power-sharing group with a little more juice than the rest",first among equals,1,0
8481,2021-10-04,Matt Amodio game 34.,Jeopardy,"(5, 4)",YOU DON'T SUCCEED,11,"(800,)",False,Joice Mujuru was set to succeed Robert Mugabe as leader of this African nation but got dismissed as vice president in 2014,Zimbabwe,1,0
8481,2021-10-04,Matt Amodio game 34.,Jeopardy,"(6, 4)",FRY FRY AGAIN,12,"(800,)",False,"This long Mexican fritter is deep-fried, cinnamon-coated & all-delicious",churro,1,0
8481,2021-10-04,Matt Amodio game 34.,Jeopardy,"(1, 5)",4-LETTER BOOK TITLES,1,"(1000,)",False,"It's the original title of Sapphire's novel about Claireece ""Precious"" Jones",Push,1,0
8481,2021-10-04,Matt Amodio game 34.,Jeopardy,"(2, 5)",BASEBALL HALL OF FAMERS BY INITIALS,2,"(1000,)",False,He took a big lead & slid into the H.O.F. in 2009: R.H.,Henderson,1,0
8481,2021-10-04,Matt Amodio game 34.,Jeopardy,"(3, 5)",INCONCEIVABLE!,3,"(1000,)",False,Riddle-named Nazi enciphering machine,Enigma,1,0
8481,2021-10-04,Matt Amodio game 34.,Jeopardy,"(4, 5)","IF AT ""FIRST""",5,"(1000,)",False,"As leader of Poland from 1956 to 1970, Wladyslaw Gomulka held this Communist Party title",first secretary,1,1
8481,2021-10-04,Matt Amodio game 34.,Jeopardy,"(5, 5)",YOU DON'T SUCCEED,4,"(1000,)",False,In 2004 the line of succession changed in this country when King Abdullah II dubbed his half-brother Hamzah ex-heir apparent,Jordan,1,0
8481,2021-10-04,Matt Amodio game 34.,Jeopardy,"(6, 5)",FRY FRY AGAIN,6,"(1000,)",False,This ovoid appetizer with a nationality in its name is enclosed in sausage & breadcrumbs,Scotch egg,0,3
8481,2021-10-04,Matt Amodio game 34.,Double Jeopardy,"(1, 1)",RIVERS OF ASIA,30,"(400,)",False,"In this frigid region, Russia's Lena River rises near Lake Baikal & flows over 2,700 miles north to the Laptev Sea",Siberia,1,0
8481,2021-10-04,Matt Amodio game 34.,Double Jeopardy,"(2, 1)",THE ARTS,29,"(400,)",False,"Joseph Haydn told Leopold, dad of this prodigy, ""Your son is the greatest composer known to me in person or by name""",Mozart,1,0
8481,2021-10-04,Matt Amodio game 34.,Double Jeopardy,"(3, 1)",MEDICAL TERMS,28,"(400,)",False,Misophonia is a disorder in which a person is triggered & distressed by these,sound (or noises),1,0
8481,2021-10-04,Matt Amodio game 34.,Double Jeopardy,"(4, 1)",THIS CATEGORY IS FILLER,7,"(400,)",False,"In linguistics, this 4-letter word associated with simile-making is considered a filler word",like,1,0
8481,2021-10-04,Matt Amodio game 34.,Double Jeopardy,"(5, 1)",SCI-FI MOVIE SYNOPSES,19,"(400,)",False,"Rick retires Replicants, Roy (Rutger) ruminates in rain",Blade Runner,1,0
8481,2021-10-04,Matt Amodio game 34.,Double Jeopardy,"(6, 1)",BEFORE & AFTER,26,"(400,)",False,Top equestrian trio of races that are next in line to be the reigning monarch,Triple Crown prince,1,0
8481,2021-10-04,Matt Amodio game 34.,Double Jeopardy,"(1, 2)",RIVERS OF ASIA,22,"(800,)",False,"In some areas, mountains more than one mile high form the banks of this river that runs from Tibet to the East China Sea",Yangtze,1,0
8481,2021-10-04,Matt Amodio game 34.,Double Jeopardy,"(2, 2)",THE ARTS,23,"(800,)",False,"""Your tiny hand is frozen, let me warm it in mine"", sings Rodolfo to Mimi in this opera",La bohème,1,0
8481,2021-10-04,Matt Amodio game 34.,Double Jeopardy,"(3, 2)",MEDICAL TERMS,24,"(800,)",False,By definition keratitis is an inflammation of this part of the eye,cornea,1,0
8481,2021-10-04,Matt Amodio game 34.,Double Jeopardy,"(4, 2)",THIS CATEGORY IS FILLER,25,"(800,)",False,"As a bonus gift, surround that delicate item you mail to a pal with bags of freshly made this... maybe Orville Redenbacher's?",popcorn,1,0
8481,2021-10-04,Matt Amodio game 34.,Double Jeopardy,"(5, 2)",SCI-FI MOVIE SYNOPSES,27,"(800,)",False,Linguistics lass learns lexicon of labyrinthine life forms,Arrival,1,0
8481,2021-10-04,Matt Amodio game 34.,Double Jeopardy,"(6, 2)",BEFORE & AFTER,21,"(800,)",False,Southern state capital confection that's made of crystallized sugar,Little Rock candy,1,0
8481,2021-10-04,Matt Amodio game 34.,Double Jeopardy,"(1, 3)",RIVERS OF ASIA,3,"(1200,)",False,"The Mekong River fluctuates greatly during the year, with its highest levels after the rains of this wind system",monsoon,1,0
8481,2021-10-04,Matt Amodio game 34.,Double Jeopardy,"(2, 3)",THE ARTS,8,"(1200,)",False,"The christening, the spell & the awakening are all part of this fairy tale ballet",Sleeping Beauty,1,0
8481,2021-10-04,Matt Amodio game 34.,Double Jeopardy,"(3, 3)",MEDICAL TERMS,6,"(1200,)",False,Distal means away from the point of origin; this similar-sounding word means pertaining to the back,dorsal,1,0
8481,2021-10-04,Matt Amodio game 34.,Double Jeopardy,"(4, 3)",THIS CATEGORY IS FILLER,13,"(1200,)",False,"If gray is not your favorite color, block filler is used to paint this type of ""block"" made from burned matter",cinderblock,1,0
8481,2021-10-04,Matt Amodio game 34.,Double Jeopardy,"(5, 3)",SCI-FI MOVIE SYNOPSES,20,"(1200,)",False,"Beleaguered botanist bolsters base, buddies bounce back, boost on board",(The) Martian,1,0
8481,2021-10-04,Matt Amodio game 34.,Double Jeopardy,"(6, 3)",BEFORE & AFTER,16,"(1200,)",False,Geographic latitude separating the 2 Koreas that's a gymnastics apparatus,38th parallel bars,1,0
8481,2021-10-04,Matt Amodio game 34.,Double Jeopardy,"(1, 4)",RIVERS OF ASIA,2,"(2000,)",True,This lake of Israel famous for its biblical associations is fed & drained by the Jordan River,the Sea of Galilee,1,0
8481,2021-10-04,Matt Amodio game 34.,Double Jeopardy,"(2, 4)",THE ARTS,5,"(1600,)",False,"Eugene O'Neill described this 4-act family drama as ""old sorrow written in tears & blood""",Long Day\'s Journey into Night,1,0
8481,2021-10-04,Matt Amodio game 34.,Double Jeopardy,"(3, 4)",MEDICAL TERMS,4,"(1600,)",False,"Used to describe a method of taking medication, it means ""below the tongue""",sublingual,1,0
8481,2021-10-04,Matt Amodio game 34.,Double Jeopardy,"(4, 4)",THIS CATEGORY IS FILLER,12,"(1600,)",False,"Used as filling in a defensive wall near Mount Olympus, a 2,200-year-old statue of this queen & goddess was found in 2006",Hera,1,0
8481,2021-10-04,Matt Amodio game 34.,Double Jeopardy,"(5, 4)",SCI-FI MOVIE SYNOPSES,18,"(1600,)",False,"Aging actors assume anterior aspects, Allen aids admiring aliens against annihilation",Galaxy Quest,1,0
8481,2021-10-04,Matt Amodio game 34.,Double Jeopardy,"(6, 4)",BEFORE & AFTER,15,"(1600,)",False,Artistic Left Bank region of Paris that's a meaty McDonald's burger,Latin Quarter Pounder,0,3
8481,2021-10-04,Matt Amodio game 34.,Double Jeopardy,"(1, 5)",RIVERS OF ASIA,1,"(2000,)",False,"Long considered sacred, the Godavari River flows 910 miles west to east across India into this bay",the Bay of Bengal,1,0
8481,2021-10-04,Matt Amodio game 34.,Double Jeopardy,"(2, 5)",THE ARTS,10,"(2000,)",False,"Paul Signac used this technique that he helped pioneer in his painting ""The Red Buoy"" seen here",Pointillism,1,0
8481,2021-10-04,Matt Amodio game 34.,Double Jeopardy,"(3, 5)",MEDICAL TERMS,9,"(5000,)",True,"Often administered through an inhaler, it's the 14-letter term for a medication that opens up the airways",bronchodilator,1,0
8481,2021-10-04,Matt Amodio game 34.,Double Jeopardy,"(4, 5)",THIS CATEGORY IS FILLER,11,"(2000,)",False,This French-named delight seen here in a bowl & as filling is made by whipping up chocolate & heavy cream,ganache,1,0
8481,2021-10-04,Matt Amodio game 34.,Double Jeopardy,"(5, 5)",SCI-FI MOVIE SYNOPSES,17,"(2000,)",False,Cruise & crafty computer collaborate on crimes not yet committed,Minority Report,1,1
8481,2021-10-04,Matt Amodio game 34.,Double Jeopardy,"(6, 5)",BEFORE & AFTER,14,"(2000,)",False,Late summer arts festival in the desert that's a basement hangout with TV & beer,Burning Man cave,1,0
8481,2021-10-04,Matt Amodio game 34.,Final Jeopardy,"(1, 1)",RENAISSANCE MEN,0,"(2000, 201, 37000)",False,"10 years before a more famous work, he wrote in 1503 that the way to deal with rebels is to placate them or eliminate them",(Niccolò) Machiavelli,2,1
