epNum,airDate,extra_info,round_name,coord,category,order,value,daily_double,question,answer,correctAttempts,wrongAttempts
8507,2021-11-09,,Jeopardy,"(1, 1)",THE BEGINNING,28,"(200,)",False,"When the U.N. was founded, Gladwyn Jebb of the U.K. did this job in an acting capacity from October 1945 through January 1946",Secretary-General,1,0
8507,2021-11-09,,Jeopardy,"(2, 1)",MOVIE REWARDS,25,"(200,)",False,Jamal wins 20 million rupees after getting the final question right in this 2008 movie,Slumdog Millionaire,1,0
8507,2021-11-09,,Jeopardy,"(3, 1)",POTPOURRI,29,"(200,)",False,"After his wife had a terrifying jump with an automatically deploying parachute, Floyd Smith invented this manual release",a rip cord,1,0
8507,2021-11-09,,Jeopardy,"(4, 1)",ANOTHER ONE BITES THE CRUST,30,"(200,)",False,"I want some more key lime pie, especially with a crust made using these Honey Maid items",graham crackers,1,0
8507,2021-11-09,,Jeopardy,"(5, 1)","CROSSWORD CLUES ""H""",26,"(200,)",False,Tights & stockings (7 letters),hosiery,1,0
8507,2021-11-09,,Jeopardy,"(6, 1)",THE END,27,"(200,)",False,"""He had won the victory over himself. He loved Big Brother""",1984,1,0
8507,2021-11-09,,Jeopardy,"(1, 2)",THE BEGINNING,24,"(400,)",False,"With about 240 athletes from 14 countries, the modern Olympics began in this year in Athens, Greece",1896,0,3
8507,2021-11-09,,Jeopardy,"(2, 2)",MOVIE REWARDS,16,"(400,)",False,"In ""Brave"", Merida discovers a loophole & ""wins"" her own hand in marriage through a contest in this sport",archery,1,0
8507,2021-11-09,,Jeopardy,"(3, 2)",POTPOURRI,18,"(400,)",False,Many Australians celebrate this holiday in a homegrown way with a chocolate bilby; that's a marsupial,Easter,1,0
8507,2021-11-09,,Jeopardy,"(4, 2)",ANOTHER ONE BITES THE CRUST,23,"(400,)",False,"In 1995 Pizza Hut introduced original stuffed crust pizza, stuffed with ""100% real"" this cheese",mozzarella,1,0
8507,2021-11-09,,Jeopardy,"(5, 2)","CROSSWORD CLUES ""H""",19,"(400,)",False,Songbook for Sunday (6 letters),a hymnal,1,0
8507,2021-11-09,,Jeopardy,"(6, 2)",THE END,22,"(400,)",False,"""God bless us, every one!""",A Christmas Carol,1,0
8507,2021-11-09,,Jeopardy,"(1, 3)",THE BEGINNING,6,"(600,)",False,"This body first assembled Feb. 1, 1790, but John Jay had to postpone actual proceedings a day as not all the members had made it",the Supreme Court,1,0
8507,2021-11-09,,Jeopardy,"(2, 3)",MOVIE REWARDS,3,"(600,)",False,"In a 1994 film this character receives a Medal of Honor from LBJ after being wounded ""in the buttocks""",Forrest Gump,1,0
8507,2021-11-09,,Jeopardy,"(3, 3)",POTPOURRI,17,"(600,)",False,"The 1921 book ""The Witch-Cult in Western Europe"" sets 13 as the number of members in this group",a coven,1,0
8507,2021-11-09,,Jeopardy,"(4, 3)",ANOTHER ONE BITES THE CRUST,21,"(600,)",False,"It's French for ""in crust"" & salmon is one food often prepared comme ça",en croûte,1,0
8507,2021-11-09,,Jeopardy,"(5, 3)","CROSSWORD CLUES ""H""",1,"(600,)",False,God of the underworld (5 letters),Hades,1,0
8507,2021-11-09,,Jeopardy,"(6, 3)",THE END,15,"(600,)",False,"""It was the devious-cruising Rachel, that in her retracing search after her missing children, only found another orphan""",Moby-Dick,0,3
8507,2021-11-09,,Jeopardy,"(1, 4)",THE BEGINNING,7,"(800,)",False,A short film by these brothers of workers leaving a factory is considered the world's first motion picture,the Lumières,1,0
8507,2021-11-09,,Jeopardy,"(2, 4)",MOVIE REWARDS,5,"(800,)",False,"In ""Never Say Never Again"", this Bond actor settles for a dance with Kim Basinger after winning a game vs. the villainous Largo",Sean Connery,0,3
8507,2021-11-09,,Jeopardy,"(3, 4)",POTPOURRI,11,"(800,)",False,"Extremely cold & difficult to store, this gas is prone to shortages, like one in 2019 that made life tough for Party City stores",helium,1,0
8507,2021-11-09,,Jeopardy,"(4, 4)",ANOTHER ONE BITES THE CRUST,12,"(800,)",False,"The Washington Post noted, ""The thinner the wrapper, the flakier the crust"" in this ""seasonal"" Chinese appetizer",spring rolls,1,0
8507,2021-11-09,,Jeopardy,"(5, 4)","CROSSWORD CLUES ""H""",2,"(800,)",False,A daily in Miami (6 letters),Herald,1,0
8507,2021-11-09,,Jeopardy,"(6, 4)",THE END,13,"(800,)",False,"""Aunt Sally she's going to adopt me and sivilize me and I can't stand it. I been there before""",The Adventures of Huckleberry Finn,1,0
8507,2021-11-09,,Jeopardy,"(1, 5)",THE BEGINNING,9,"(1200,)",True,Around 650 B.C.Greek colonists founded a city on the Bosporus that they called this; it would later be the capital of empires,Byzantium,0,1
8507,2021-11-09,,Jeopardy,"(2, 5)",MOVIE REWARDS,4,"(1000,)",False,At the end of a 2009 movie this title guy is offered his dream job but instead continues to protect shoppers at the West Orange Pavilion,Paul Blart: Mall Cop,1,0
8507,2021-11-09,,Jeopardy,"(3, 5)",POTPOURRI,10,"(1000,)",False,"When MLB pitcher Jim Gott faced batter Tim Teufel, in German it was a confrontation of these 2 beings",God & the Devil,1,0
8507,2021-11-09,,Jeopardy,"(4, 5)",ANOTHER ONE BITES THE CRUST,20,"(1000,)",False,A Pillsbury recipe offers up their original crescent rolls for a crisp crust enclosing tenderloin steaks in this dish for 2,Beef Wellington,1,0
8507,2021-11-09,,Jeopardy,"(5, 5)","CROSSWORD CLUES ""H""",8,"(1000,)",False,Shaggy-haired & bewhiskered (7 letters),hirsute,1,0
8507,2021-11-09,,Jeopardy,"(6, 5)",THE END,14,"(1000,)",False,"""Oh, my girls, however long you may live, I never can wish you a greater happiness than this!""",Little Women,1,0
8507,2021-11-09,,Double Jeopardy,"(1, 1)",SOME CREATURES GREAT & SMALL,28,"(400,)",False,Silk from the orb-weaver type of this animal can be packed so densely that it has been used to make violin strings,a spider,1,0
8507,2021-11-09,,Double Jeopardy,"(2, 1)",ART CRITICS,23,"(400,)",False,In a 1435 essay Leon Battista Alberti declared that an art renaissance was occurring in this city of Leonardo,Florence,1,0
8507,2021-11-09,,Double Jeopardy,"(3, 1)",LET'S TALK BUSINESS,29,"(400,)",False,"As the name implies, even for a giant company it can be a single page showing a business' assets & liabilities",the balance sheet,0,3
8507,2021-11-09,,Double Jeopardy,"(4, 1)",FIRST NAMES WITH CHARACTER,17,"(400,)",False,"This sister of Rumer & Tallulah Willis was named for a character in ""To Kill a Mockingbird""",Scout,1,0
8507,2021-11-09,,Double Jeopardy,"(5, 1)",WORLD CITIES,9,"(400,)",False,"An important industrial center, this city is also home to the Welsh central government",Cardiff,1,0
8507,2021-11-09,,Double Jeopardy,"(6, 1)",2-WORD PALINDROMES,30,"(400,)",False,Intelligent streetcars,smart trams,0,3
8507,2021-11-09,,Double Jeopardy,"(1, 2)",SOME CREATURES GREAT & SMALL,24,"(800,)",False,"Heavy poaching of Persian gazelles contributed to the near extinction of the Asiatic cheetah, mainly found in this country",Iran,1,0
8507,2021-11-09,,Double Jeopardy,"(2, 2)",ART CRITICS,22,"(800,)",False,"After seeing a painting by Monet, critic Louis Leroy derisively gave this movement its name",Impressionism,1,0
8507,2021-11-09,,Double Jeopardy,"(3, 2)",LET'S TALK BUSINESS,27,"(800,)",False,"If rate of yield fails to increase in proportion to investment beyond a certain point, you get these declining 2-word profits",diminishing returns,0,3
8507,2021-11-09,,Double Jeopardy,"(4, 2)",FIRST NAMES WITH CHARACTER,16,"(800,)",False,The daughter of Michelle Williams & Heath Ledger is named for this Roald Dahl book,Matilda,1,0
8507,2021-11-09,,Double Jeopardy,"(5, 2)",WORLD CITIES,8,"(800,)",False,Mohammed V Square is the central plaza in this city but you probably won't find any gin joints there,Casablanca,1,1
8507,2021-11-09,,Double Jeopardy,"(6, 2)",2-WORD PALINDROMES,18,"(800,)",False,A guanaco relative's shopping complex,llama mall,1,0
8507,2021-11-09,,Double Jeopardy,"(1, 3)",SOME CREATURES GREAT & SMALL,11,"(1200,)",False,"With feathers that look like quills sticking from its head, a predatory bird of Africa had this office worker name",a secretarybird,0,3
8507,2021-11-09,,Double Jeopardy,"(2, 3)",ART CRITICS,6,"(3000,)",True,"Lawrence Alloway is credited with this 2-word term for work that uses comic strips, soup cans & the like as subject matter",pop art,1,0
8507,2021-11-09,,Double Jeopardy,"(3, 3)",LET'S TALK BUSINESS,26,"(4000,)",True,It's the horticultural term for a largely unregulated private partnership group using speculative investment strategy,a hedge fund,1,0
8507,2021-11-09,,Double Jeopardy,"(4, 3)",FIRST NAMES WITH CHARACTER,13,"(1200,)",False,"In the U.S., this first name from ""Gone with the Wind"" is more often given to girls, but boy band & Broadway star Parker Angel has it",Ashley,1,0
8507,2021-11-09,,Double Jeopardy,"(5, 3)",WORLD CITIES,7,"(1200,)",False,Seen here is the coat of arms of this German city whose name derives from a 10th century stud farm,Stuttgart,1,0
8507,2021-11-09,,Double Jeopardy,"(6, 3)",2-WORD PALINDROMES,19,"(1200,)",False,An eager female opera star,an avid diva,1,0
8507,2021-11-09,,Double Jeopardy,"(1, 4)",SOME CREATURES GREAT & SMALL,10,"(1600,)",False,The black species of this African mammal vulnerable to poaching is recovering from a 98% drop in its numbers,the rhino,1,0
8507,2021-11-09,,Double Jeopardy,"(2, 4)",ART CRITICS,14,"(1600,)",False,"Christopher Knight criticizes museums as shortsighted for funding operations by selling art--in museum-speak, this ""de""-verb",deaccessioning,1,0
8507,2021-11-09,,Double Jeopardy,"(3, 4)",LET'S TALK BUSINESS,25,"(1600,)",False,"As the name suggests, when buying a home it's a deposit paid to the seller to demonstrate a buyer's good faith",earnest money,0,3
8507,2021-11-09,,Double Jeopardy,"(4, 4)",FIRST NAMES WITH CHARACTER,3,"(1600,)",False,"Dwayne Johnson named a daughter this, also the first Black Disney princess",Tiana,1,0
8507,2021-11-09,,Double Jeopardy,"(5, 4)",WORLD CITIES,5,"(1600,)",False,"In 1961 Stalingrad was renamed this, for the river on which it lies",Volgograd,1,0
8507,2021-11-09,,Double Jeopardy,"(6, 4)",2-WORD PALINDROMES,20,"(1600,)",False,A sleepy scimitar,drowsy sword,0,3
8507,2021-11-09,,Double Jeopardy,"(1, 5)",SOME CREATURES GREAT & SMALL,2,"(2000,)",False,This duck seen here sounds like it's named for a Russian place,Muscovy,1,0
8507,2021-11-09,,Double Jeopardy,"(2, 5)",ART CRITICS,15,"(2000,)",False,"Clement Greenberg said the 1943 work ""Mural"" showed this man was the greatest painter the U.S. had produced",Pollock,1,0
8507,2021-11-09,,Double Jeopardy,"(3, 5)",LET'S TALK BUSINESS,12,"(2000,)",False,"Some traders specialize in this, the simultaneous buying & selling of the same asset at different prices in different markets",arbitrage,0,3
8507,2021-11-09,,Double Jeopardy,"(4, 5)",FIRST NAMES WITH CHARACTER,4,"(2000,)",False,"Known for period dramas like George Eliot adaptations, actress Garai has this first name of an Eliot title character",Romola,1,0
8507,2021-11-09,,Double Jeopardy,"(5, 5)",WORLD CITIES,1,"(2000,)",False,Argentina's second-largest city is named for this Spanish city; both are known for their leather,Córdoba,0,3
8507,2021-11-09,,Double Jeopardy,"(6, 5)",2-WORD PALINDROMES,21,"(2000,)",False,A Papeete porkpie,a Tahiti hat,0,3
8507,2021-11-09,,Final Jeopardy,"(1, 1)",1970s SONGS,0,"(0, 9801, 16601)",False,"In 1976 ""Bohemian Rhapsody"" was replaced at No. 1 on the U.K. charts by this Europop song whose title is heard in Queen's lyrics","\""Mamma Mia\""",0,3
