epNum,airDate,extra_info,round_name,coord,category,order,value,daily_double,question,answer,correctAttempts,wrongAttempts
8518,2021-11-24,Amy Schneider game 6.,Jeopardy,"(1, 1)",PRESIDENTIAL THIS & THAT,11,"(200,)",False,"Presidential brother Edgar Eisenhower was called ""Big"" this; Dwight was the ""Little"" version",Ike,1,0
8518,2021-11-24,Amy Schneider game 6.,Jeopardy,"(2, 1)",TV,17,"(200,)",False,"Hannah Waddingham won an Emmy for playing Rebecca Welton, owner of AFC Richmond on this sitcom",Ted Lasso,1,0
8518,2021-11-24,Amy Schneider game 6.,Jeopardy,"(3, 1)",RUFF CROWD,12,"(200,)",False,"A Plano, Texas movie theater with this alphanumeric name is famous for letting you bring your dog to the cinema",K9 (Cinemas),1,0
8518,2021-11-24,Amy Schneider game 6.,Jeopardy,"(4, 1)",PERIODS OF TIME,1,"(200,)",False,"The period in which a monarch rules; a 2020 book about Plantagenet England is ""In"" this ""of King John""",the Reign,1,0
8518,2021-11-24,Amy Schneider game 6.,Jeopardy,"(5, 1)",IN THAT COUNTRY,22,"(200,)",False,It is home to the Valley of the Kings & an ancient mortuary temple in Abydos,Egypt,1,0
8518,2021-11-24,Amy Schneider game 6.,Jeopardy,"(6, 1)",LATIN PHRASES,6,"(200,)",False,"I'm so sorry! It's ""through my own fault""!",mea culpa,1,0
8518,2021-11-24,Amy Schneider game 6.,Jeopardy,"(1, 2)",PRESIDENTIAL THIS & THAT,13,"(400,)",False,"A long-shot compromise candidate in 1844, James Polk is considered the first of these ""equine"" winners",a dark horse,1,0
8518,2021-11-24,Amy Schneider game 6.,Jeopardy,"(2, 2)",TV,18,"(400,)",False,Kristen Bell returned to narrate the 2021 reboot of this soapy series about private school teens in New York City,Gossip Girl,1,0
8518,2021-11-24,Amy Schneider game 6.,Jeopardy,"(3, 2)",RUFF CROWD,30,"(400,)",False,"This NFL team has a proud dog named SJ as a mascot; there are Dawgs in the stands, too",the Cleveland Browns,1,0
8518,2021-11-24,Amy Schneider game 6.,Jeopardy,"(4, 2)",PERIODS OF TIME,2,"(400,)",False,It can be a type of oatmeal or an almost imperceptibly short bit of time,instant,1,0
8518,2021-11-24,Amy Schneider game 6.,Jeopardy,"(5, 2)",IN THAT COUNTRY,23,"(400,)",False,"Angkor Thom, dating back to the 12th century, & Wat Leu temple",Cambodia,1,0
8518,2021-11-24,Amy Schneider game 6.,Jeopardy,"(6, 2)",LATIN PHRASES,7,"(400,)",False,"There's carpe diem, but carpe vinum, meaning this, sounds even better",seize the wine,1,0
8518,2021-11-24,Amy Schneider game 6.,Jeopardy,"(1, 3)",PRESIDENTIAL THIS & THAT,14,"(600,)",False,"He was a brigadier general when he demanded the ""Unconditional Surrender"" of Fort Donelson in February 1862",Grant,1,0
8518,2021-11-24,Amy Schneider game 6.,Jeopardy,"(2, 3)",TV,19,"(600,)",False,"On this series, Brandon Walsh worked at the Peach Pit","Beverly Hills, 90210",0,3
8518,2021-11-24,Amy Schneider game 6.,Jeopardy,"(3, 3)",RUFF CROWD,29,"(600,)",False,"When it was formed in 1884, this club created a constitution & rules for dog shows",the American Kennel Club,1,0
8518,2021-11-24,Amy Schneider game 6.,Jeopardy,"(4, 3)",PERIODS OF TIME,3,"(600,)",False,"Poet Stéphane Mallarmé wrote about one of these time periods ""of a Faun""",The Afternoon,1,0
8518,2021-11-24,Amy Schneider game 6.,Jeopardy,"(5, 3)",IN THAT COUNTRY,24,"(600,)",False,"Villa Trapp, home of ""The Sound of Music"" family from 1923 to 1938, now a hotel",Austria,1,0
8518,2021-11-24,Amy Schneider game 6.,Jeopardy,"(6, 3)",LATIN PHRASES,8,"(600,)",False,"This 2-word phrase means going on endlessly, as the digits of pi do",ad infinitum,1,0
8518,2021-11-24,Amy Schneider game 6.,Jeopardy,"(1, 4)",PRESIDENTIAL THIS & THAT,15,"(800,)",False,"3 recent presidents--Bush I, Clinton & Obama--shared this trait common to only about 10% of Americans",left-handedness,1,0
8518,2021-11-24,Amy Schneider game 6.,Jeopardy,"(2, 4)",TV,20,"(800,)",False,"This show about a vampire with a soul was a spin-off from ""Buffy the Vampire Slayer""",Angel,1,0
8518,2021-11-24,Amy Schneider game 6.,Jeopardy,"(3, 4)",RUFF CROWD,28,"(800,)",False,"This actress who played Sansa on ""Game of Thrones"" adopted the dog who played the direwolf ""Lady"" on the show",Sophie Turner,1,0
8518,2021-11-24,Amy Schneider game 6.,Jeopardy,"(4, 4)",PERIODS OF TIME,4,"(800,)",False,"Usually a 4-hour shift, it's a set period of duty on a ship",the watch,1,0
8518,2021-11-24,Amy Schneider game 6.,Jeopardy,"(5, 4)",IN THAT COUNTRY,25,"(800,)",False,"San Francisco de Guayo & the homeland of the Warao or ""Boat People"" of the Orinoco delta",Venezuela,1,0
8518,2021-11-24,Amy Schneider game 6.,Jeopardy,"(6, 4)",LATIN PHRASES,9,"(1000,)",True,"Caveat venditor, this phrase, is the flip side to caveat emptor",let the seller beware,1,0
8518,2021-11-24,Amy Schneider game 6.,Jeopardy,"(1, 5)",PRESIDENTIAL THIS & THAT,16,"(1000,)",False,"Before becoming president, he helped his wife Lou translate ""De re metallica"", a 1556 text that detailed copper mining",Hoover,1,0
8518,2021-11-24,Amy Schneider game 6.,Jeopardy,"(2, 5)",TV,21,"(1000,)",False,This sitcom centers on a Korean-Canadian family that runs a store that rarely closes,Kim\'s Convenience,1,0
8518,2021-11-24,Amy Schneider game 6.,Jeopardy,"(3, 5)",RUFF CROWD,27,"(1000,)",False,Modern guide dogs were popularized by a school near Berlin that used this breed to help blinded soldiers,German Shepherds,0,3
8518,2021-11-24,Amy Schneider game 6.,Jeopardy,"(4, 5)",PERIODS OF TIME,5,"(1000,)",False,"Thumb-sucking might be part of this, an infant's first stage of development, according to Freud",the oral stage,0,3
8518,2021-11-24,Amy Schneider game 6.,Jeopardy,"(5, 5)",IN THAT COUNTRY,26,"(1000,)",False,"Here is the Château Frontenac, & Peggy's Cove in all its glory",Canada,1,0
8518,2021-11-24,Amy Schneider game 6.,Jeopardy,"(6, 5)",LATIN PHRASES,10,"(1000,)",False,"This legal Latin phrase means ""at first sight""",prima facie,1,0
8518,2021-11-24,Amy Schneider game 6.,Double Jeopardy,"(1, 1)",LET'S GO SEE THE BAND!,26,"(400,)",False,It's the perfect place for a Gallagher concert,Oasis,1,0
8518,2021-11-24,Amy Schneider game 6.,Double Jeopardy,"(2, 1)",THINGS IN LITERARY TITLES,6,"(400,)",False,"At the end of a D.H. Lawrence novel, this title thing ""arched indomitable, making great architecture of light and color""",The Rainbow,0,3
8518,2021-11-24,Amy Schneider game 6.,Double Jeopardy,"(3, 1)",NAMED FOR A PLACE,27,"(400,)",False,"Mmm, I do love this type of pastry, & I don't even have to go to Europe to get one",a danish,1,0
8518,2021-11-24,Amy Schneider game 6.,Double Jeopardy,"(4, 1)",NEWS,13,"(400,)",False,"On Feb. 1, 2021 the Myanmar military took power & a 1-year ""state of"" this was declared--& not surprisingly, soon extended",emergency,1,0
8518,2021-11-24,Amy Schneider game 6.,Double Jeopardy,"(5, 1)",WEATHER,18,"(400,)",False,"Guinness noted that a 15-inch one of these fluttered down at Fort Keogh, Montana in 1887",a snowflake,1,0
8518,2021-11-24,Amy Schneider game 6.,Double Jeopardy,"(6, 1)",SHORTZ,30,"(400,)",False,"Fittingly for a crossword maven, Will presented a wordplay dice game whose name is these 2 prepositions",across & down,1,0
8518,2021-11-24,Amy Schneider game 6.,Double Jeopardy,"(1, 2)",LET'S GO SEE THE BAND!,25,"(800,)",False,They get around,The Beach Boys,1,0
8518,2021-11-24,Amy Schneider game 6.,Double Jeopardy,"(2, 2)",THINGS IN LITERARY TITLES,7,"(800,)",False,"It's an ""impartial selector"" of Triwizard champions",the Goblet of Fire,1,1
8518,2021-11-24,Amy Schneider game 6.,Double Jeopardy,"(3, 2)",NAMED FOR A PLACE,4,"(800,)",False,"Named for an atoll, the site of nuclear testing, this then-daring 2-piece swimsuit exploded onto the scene in Paris in 1946",bikini,1,0
8518,2021-11-24,Amy Schneider game 6.,Double Jeopardy,"(4, 2)",NEWS,14,"(800,)",False,In 2021 one of these in Oregon covered 646 square miles & was causing dangerous pyrocumulus clouds,a fire,1,0
8518,2021-11-24,Amy Schneider game 6.,Double Jeopardy,"(5, 2)",WEATHER,28,"(800,)",False,"A hygrometer measures this, the moisture content in the atmosphere",humidity,1,0
8518,2021-11-24,Amy Schneider game 6.,Double Jeopardy,"(6, 2)",SHORTZ,29,"(800,)",False,"One of Will's favorites from his NPR Sunday puzzle is the fact that this type of pain has the sequence ""A-C-H"" twice in a row",a stomachache,0,3
8518,2021-11-24,Amy Schneider game 6.,Double Jeopardy,"(1, 3)",LET'S GO SEE THE BAND!,24,"(1200,)",False,No way of telling if this recon craft seen here has found what it's looking for,U-2,1,0
8518,2021-11-24,Amy Schneider game 6.,Double Jeopardy,"(2, 3)",THINGS IN LITERARY TITLES,10,"(1200,)",False,A container used to heat metals gave us the name of this 1953 play set in Massachusetts,The Crucible,1,0
8518,2021-11-24,Amy Schneider game 6.,Double Jeopardy,"(3, 3)",NAMED FOR A PLACE,3,"(1200,)",False,"From a city in Morocco, it's the traditional hat seen here",Fez,1,0
8518,2021-11-24,Amy Schneider game 6.,Double Jeopardy,"(4, 3)",NEWS,15,"(1200,)",False,"You may ""recall"" that September 14, 2021 was a good day for this Californian",Newsom,1,0
8518,2021-11-24,Amy Schneider game 6.,Double Jeopardy,"(5, 3)",WEATHER,20,"(1200,)",False,"Pellets of ice have a diameter of less than 5mm; if the ice's diameter is between 5mm & 15cm, it's called this",hail,1,0
8518,2021-11-24,Amy Schneider game 6.,Double Jeopardy,"(6, 3)",SHORTZ,9,"(1200,)",False,In 2019 Will hosted the 10th world championship of this double-talk brainteaser created by Tetsuya Miyamoto,KenKen,1,0
8518,2021-11-24,Amy Schneider game 6.,Double Jeopardy,"(1, 4)",LET'S GO SEE THE BAND!,22,"(1600,)",False,"Great time for a concert here in this city? Saturday, in the park",Chicago,1,0
8518,2021-11-24,Amy Schneider game 6.,Double Jeopardy,"(2, 4)",THINGS IN LITERARY TITLES,11,"(1600,)",False,"Thornton Wilder wrote of one of these that collapses in Peru, killing 5 travelers",a bridge,0,3
8518,2021-11-24,Amy Schneider game 6.,Double Jeopardy,"(3, 4)",NAMED FOR A PLACE,1,"(1600,)",False,"Lyme disease derives its name from the town of Lyme in this state, where cases were first observed in the 1970s",Connecticut,0,3
8518,2021-11-24,Amy Schneider game 6.,Double Jeopardy,"(4, 4)",NEWS,16,"(1600,)",False,A computer chip shortage caused Peugeot to put old-fashioned analog these to tell you your km/h in some models,speedometers,1,0
8518,2021-11-24,Amy Schneider game 6.,Double Jeopardy,"(5, 4)",WEATHER,8,"(1600,)",False,Most weather occurs in this 5-to-9-mile-thick layer of the atmosphere that's closest to Earth,the troposphere,1,0
8518,2021-11-24,Amy Schneider game 6.,Double Jeopardy,"(6, 4)",SHORTZ,23,"(1600,)",False,"Will's New York Times responsibilities include the P&A puzzle feature, short for these 2 types of wordplay",puns & anagrams,1,0
8518,2021-11-24,Amy Schneider game 6.,Double Jeopardy,"(1, 5)",LET'S GO SEE THE BAND!,5,"(2000,)",False,"It's not a wicker man, but an...",Iron Maiden,1,0
8518,2021-11-24,Amy Schneider game 6.,Double Jeopardy,"(2, 5)",THINGS IN LITERARY TITLES,12,"(4000,)",True,"Not an actual accolade, it's received by the hero of an 1895 war tale after being hit on the head by a deserter",the red badge of courage,1,0
8518,2021-11-24,Amy Schneider game 6.,Double Jeopardy,"(3, 5)",NAMED FOR A PLACE,2,"(1000,)",True,In 1898 the Curies discovered this radioactive element & named it for Marie's country of birth,polonium,1,0
8518,2021-11-24,Amy Schneider game 6.,Double Jeopardy,"(4, 5)",NEWS,17,"(2000,)",False,"A 1/16th size ""little sister"" has been unveiled at the Washington, D.C. residence of this person--in 2021 Philippe Étienne",the French ambassador,1,1
8518,2021-11-24,Amy Schneider game 6.,Double Jeopardy,"(5, 5)",WEATHER,19,"(2000,)",False,Flooding in Venice has been aggravated by these Italian-named winds that originate in northern Africa,scirocco,1,0
8518,2021-11-24,Amy Schneider game 6.,Double Jeopardy,"(6, 5)",SHORTZ,21,"(2000,)",False,"""5 little items of an everyday sort; you'll find us all in a tennis court"", wrote Will for the Riddler, aka this in ""Batman Forever""",Edward Nygma (E. Nygma),0,3
8518,2021-11-24,Amy Schneider game 6.,Final Jeopardy,"(1, 1)",AWARDS & HONORS,0,"(2200, 3800, 11000)",False,"First awarded in 1731 to electricity pioneer Stephen Gray, the Copley Medal is awarded annually by this organization",the Royal Society,1,2
