epNum,airDate,extra_info,round_name,coord,category,order,value,daily_double,question,answer,correctAttempts,wrongAttempts
8580,2022-02-18,,Jeopardy,"(1, 1)",NORTH AMERICAN LITERATURE,13,"(200,)",False,In this novel Guy Montag reads aloud from a book to his wife's shocked friends,Fahrenheit 451,1,0
8580,2022-02-18,,Jeopardy,"(2, 1)",FROM S TO S,26,"(200,)",False,More than is necessary,a surplus,1,0
8580,2022-02-18,,Jeopardy,"(3, 1)",STATE QUARTERS,10,"(200,)",False,Louisiana's quarter features a trumpet & one of these birds,a pelican,1,0
8580,2022-02-18,,Jeopardy,"(4, 1)",GYMNASTICS,1,"(200,)",False,In 1976 Nadia Comaneci became the first gymnast to achieve this score in the Olympics,a perfect 10,1,0
8580,2022-02-18,,Jeopardy,"(5, 1)",STICK,30,"(200,)",False,"There's a body part in the name of these wooden sticks that a doctor uses when asking the patient to say ""ahh""",tongue depressor,1,0
8580,2022-02-18,,Jeopardy,"(6, 1)",THE LANDING,24,"(200,)",False,"He hadn't slept in 55 hours when he alit at Le Bourget Aerodrome at 10:22 P.M. on May 21,1927",Lindbergh,1,0
8580,2022-02-18,,Jeopardy,"(1, 2)",NORTH AMERICAN LITERATURE,27,"(400,)",False,"Canadian environmentalist Farley Mowat is best known for bringing sympathy to a predator in ""Never Cry"" this",Wolf,1,0
8580,2022-02-18,,Jeopardy,"(2, 2)",FROM S TO S,25,"(400,)",False,This affliction is a reactivation of the same virus that causes chicken pox,shingles,1,0
8580,2022-02-18,,Jeopardy,"(3, 2)",STATE QUARTERS,11,"(400,)",False,Kansas' quarter features a buffalo & this plant known for its seeds,a sunflower,1,0
8580,2022-02-18,,Jeopardy,"(4, 2)",GYMNASTICS,2,"(400,)",False,"In competition this apparatus is 4 feet off the ground & 16.5 feet long; for home practice, it can be half that length",the balance beam,1,1
8580,2022-02-18,,Jeopardy,"(5, 2)",STICK,20,"(400,)",False,The label of this brand's sticks of Juicy Fruit gum doesn't actually specify what juicy fruit is,Wrigley,1,0
8580,2022-02-18,,Jeopardy,"(6, 2)",THE LANDING,23,"(400,)",False,"His engine out, Corkey Fornof landed his plane on an interstate, took an offramp & pulled into this, tripping the ding-dong hose",a gas station,0,3
8580,2022-02-18,,Jeopardy,"(1, 3)",NORTH AMERICAN LITERATURE,5,"(600,)",False,This 1991 novel by Canadian Douglas Coupland gave a name to a whole cohort born around the same time,Generation X,0,3
8580,2022-02-18,,Jeopardy,"(2, 3)",FROM S TO S,18,"(600,)",False,Seen here is an example of this resting place made for the ancient Egyptian priestess Nitocris,a sarcophagus,1,0
8580,2022-02-18,,Jeopardy,"(3, 3)",STATE QUARTERS,12,"(600,)",False,Its state quarter features Federal Hill & a racehorse,Kentucky,1,0
8580,2022-02-18,,Jeopardy,"(4, 3)",GYMNASTICS,3,"(600,)",False,"Originally a horse riding term, it's used when a gymnast jumps off a piece of equipment, often with a stylish Salto",a dismount,1,0
8580,2022-02-18,,Jeopardy,"(5, 3)",STICK,19,"(600,)",False,Ringo Starr hit Zildjian these with his sticks for crashes & splashes,cymbals,1,0
8580,2022-02-18,,Jeopardy,"(6, 3)",THE LANDING,22,"(600,)",False,"The site where George Washington & 2,400 men landed early on December 26, 1776 is today a park in this state",New Jersey,1,0
8580,2022-02-18,,Jeopardy,"(1, 4)",NORTH AMERICAN LITERATURE,4,"(800,)",False,"His 1947 play ""All My Sons"" is about a businessman whose substandard airplane parts cost young men their lives",(Arthur) Miller,1,0
8580,2022-02-18,,Jeopardy,"(2, 4)",FROM S TO S,16,"(800,)",False,"This liquor takes its name from a German word for ""mouthful""",schnapps,1,0
8580,2022-02-18,,Jeopardy,"(3, 4)",STATE QUARTERS,7,"(800,)",False,Utah's quarter shows a pair of these conveyances meeting in the middle,trains (locomotives),1,0
8580,2022-02-18,,Jeopardy,"(4, 4)",GYMNASTICS,8,"(800,)",False,This apparatus that sends competitors 3 stories high was added to Olympic gymnastics in 2000,the trampoline,1,0
8580,2022-02-18,,Jeopardy,"(5, 4)",STICK,15,"(800,)",False,"A stick figure was the calling card of this fictional hero, real name Simon Templar",The Saint,0,3
8580,2022-02-18,,Jeopardy,"(6, 4)",THE LANDING,21,"(800,)",False,The island of San Salvador in this archipelago is thought to be where Columbus first landed in the Americas,the Bahamas,1,0
8580,2022-02-18,,Jeopardy,"(1, 5)",NORTH AMERICAN LITERATURE,6,"(1000,)",False,The title of this Laura Esquivel bestseller refers to a sweet recipe but also a state of passion or anger,Like Water for Chocolate,0,3
8580,2022-02-18,,Jeopardy,"(2, 5)",FROM S TO S,17,"(1000,)",False,"This type of cloud forms a continuous horizontal sheet, sometimes bringing light drizzle",stratus,1,0
8580,2022-02-18,,Jeopardy,"(3, 5)",STATE QUARTERS,14,"(1000,)",False,Minnesota's quarter displays the years 1858 & 2005 & this other number greater than those 2,"10,000",1,0
8580,2022-02-18,,Jeopardy,"(4, 5)",GYMNASTICS,9,"(1000,)",False,This 2012 Olympic team gold medalist & 2-time world champ in the vault is seen here testifying to Congress in 2021,(McKayla) Maroney,1,0
8580,2022-02-18,,Jeopardy,"(5, 5)",STICK,28,"(1000,)",False,"This sport came from Native American stickball, which the Cherokee call ""little brother of war""",lacrosse,1,0
8580,2022-02-18,,Jeopardy,"(6, 5)",THE LANDING,29,"(2000,)",True,"In 2019 China's Chang'e 4 probe made the first landing here, a place not even glimpsed by humanity until 1959",the dark (far) side of the Moon,1,0
8580,2022-02-18,,Double Jeopardy,"(1, 1)",HISTORIC MEN,23,"(400,)",False,"This ""Junior"" oil heir who gave the U.N. the money to buy land for its HQ will always be a center of attention in New York City",Rockefeller,1,0
8580,2022-02-18,,Double Jeopardy,"(2, 1)","BRING YOUR ""A"" GAME",26,"(400,)",False,There are 441 red cards & 63 green cards in this Mattel game of comparisons,Apples to Apples,1,0
8580,2022-02-18,,Double Jeopardy,"(3, 1)",BOOKS BY FUNNY PEOPLE,25,"(400,)",False,"This comedian, seen here, provided some life lessons in ""I Can't Make This Up""",Hart,1,0
8580,2022-02-18,,Double Jeopardy,"(4, 1)",IN THE CHEMISTRY LAB,27,"(400,)",False,"In 1937 isotopes of this element, Cl, were separated using a vacuum ultracentrifuge",chlorine,1,0
8580,2022-02-18,,Double Jeopardy,"(5, 1)",BODIES OF WATER,1,"(400,)",False,Lake Victoria is the largest source of this African river,the Nile,1,0
8580,2022-02-18,,Double Jeopardy,"(6, 1)",END YOUR  RESPONSE WITH A PREPOSITION,22,"(400,)",False,Polo players who didn't want their collars flapping in the breeze innovated this style,the button-down,0,3
8580,2022-02-18,,Double Jeopardy,"(1, 2)",HISTORIC MEN,6,"(800,)",False,"It was no minor feat that in 1990, he emerged victorious in a 3-person race to succeed Margaret Thatcher as prime minister",John Major,1,0
8580,2022-02-18,,Double Jeopardy,"(2, 2)","BRING YOUR ""A"" GAME",15,"(800,)",False,"""Valhalla"" is a recent entry in this video game series with a killer title",Assassin\'s Creed,1,0
8580,2022-02-18,,Double Jeopardy,"(3, 2)",BOOKS BY FUNNY PEOPLE,14,"(800,)",False,"Mike Birbiglia detailed his somnambulism in do this ""with Me""; one event led to Mike hurling himself out a hotel window",Sleepwalk,1,0
8580,2022-02-18,,Double Jeopardy,"(4, 2)",IN THE CHEMISTRY LAB,17,"(800,)",False,"From the French for ""little tube"" , one of these uses suction to transfer small amounts of liquid",a pipette,1,0
8580,2022-02-18,,Double Jeopardy,"(5, 2)",BODIES OF WATER,11,"(800,)",False,"Built in the early 1960s, the Bridge of the Americas spans this waterway",the Panama Canal,1,0
8580,2022-02-18,,Double Jeopardy,"(6, 2)",END YOUR  RESPONSE WITH A PREPOSITION,20,"(800,)",False,"Saying you look ""like death..."" these 2 words is not a compliment to your appearance",warmed over,0,3
8580,2022-02-18,,Double Jeopardy,"(1, 3)",HISTORIC MEN,5,"(1200,)",False,In the 1970s this future Secretary of State was a spokesman for Vietnam Veterans Against the War,(John) Kerry,1,2
8580,2022-02-18,,Double Jeopardy,"(2, 3)","BRING YOUR ""A"" GAME",7,"(1200,)",False,"Fight the dead in this game named for an ""Evil Dead"" sequel that starred Bruce Campbell",Army of Darkness,0,3
8580,2022-02-18,,Double Jeopardy,"(3, 3)",BOOKS BY FUNNY PEOPLE,8,"(1200,)",False,"The subtitle of ""I Must Say"" by this Canadian & ""SNL"" veteran is ""My Life as a Humble Comedy Legend""",Martin Short,0,3
8580,2022-02-18,,Double Jeopardy,"(4, 3)",IN THE CHEMISTRY LAB,30,"(1200,)",False,"Named for a German chemist, this tool seen here really turns up the heat",a Bunsen burner,1,0
8580,2022-02-18,,Double Jeopardy,"(5, 3)",BODIES OF WATER,3,"(6200,)",True,Formations like the Great Barrier Reef gave this body of water its name,the Coral Sea,1,0
8580,2022-02-18,,Double Jeopardy,"(6, 3)",END YOUR  RESPONSE WITH A PREPOSITION,18,"(1200,)",False,"To look for your best option; ""my mama told me you better"" do it",shop around,1,0
8580,2022-02-18,,Double Jeopardy,"(1, 4)",HISTORIC MEN,4,"(1600,)",False,"Multitasking in 1794, he negotiated a treaty with Britain while also serving as the first Chief Justice of the United States",(John) Jay,1,0
8580,2022-02-18,,Double Jeopardy,"(2, 4)","BRING YOUR ""A"" GAME",10,"(1600,)",False,Save your ship by shooting space rocks in this Atari arcade game introduced in 1979,Asteroids,1,0
8580,2022-02-18,,Double Jeopardy,"(3, 4)",BOOKS BY FUNNY PEOPLE,9,"(1600,)",False,"This co-creator & star of ""Crazy Ex-Girlfriend"" wrote ""I Want to Be Where the Normal People Are""",(Rachel) Bloom,1,0
8580,2022-02-18,,Double Jeopardy,"(4, 4)",IN THE CHEMISTRY LAB,29,"(3200,)",True,"Used to crush & grind, this pair of tools is featured in a permanent display at Philly's University of the Sciences",mortar & pestle,0,1
8580,2022-02-18,,Double Jeopardy,"(5, 4)",BODIES OF WATER,2,"(1600,)",False,Miami is a port on this bay,Biscayne Bay,1,0
8580,2022-02-18,,Double Jeopardy,"(6, 4)",END YOUR  RESPONSE WITH A PREPOSITION,19,"(1600,)",False,"In tennis, this last part of a stroke is important even though the ball is gone after 5 milliseconds against the strings",follow-through,1,0
8580,2022-02-18,,Double Jeopardy,"(1, 5)",HISTORIC MEN,12,"(2000,)",False,"Hey there, Pilgrim! This Plymouth colony cofounder wed the former Priscilla Mullins around 1623 & eventually fathered 11 kids",John Alden,0,3
8580,2022-02-18,,Double Jeopardy,"(2, 5)","BRING YOUR ""A"" GAME",13,"(2000,)",False,"Germany & Japan take on the U.S., U.K. & USSR in this strategy game named for the 2 opposing sides",Axis & Allies,1,0
8580,2022-02-18,,Double Jeopardy,"(3, 5)",BOOKS BY FUNNY PEOPLE,16,"(2000,)",False,"Eric Idle's ""sortabiography"" is titled this, the upbeat, whistling song Eric wrote that ends ""Life of Brian""",Always Look on the Bright Side of Life,1,0
8580,2022-02-18,,Double Jeopardy,"(4, 5)",IN THE CHEMISTRY LAB,28,"(2000,)",False,"This receptacle used for melting metals has a name from the Latin for ""cross""",a crucible,0,3
8580,2022-02-18,,Double Jeopardy,"(5, 5)",BODIES OF WATER,21,"(2000,)",False,Surt is the main port on this Libyan gulf,the Gulf of Sidra,0,3
8580,2022-02-18,,Double Jeopardy,"(6, 5)",END YOUR  RESPONSE WITH A PREPOSITION,24,"(2000,)",False,"When reporting for duty on a U.S. Navy ship, the first thing you'll say is ""Request permission to"" do this phrase",come aboard,1,0
8580,2022-02-18,,Final Jeopardy,"(1, 1)",PLAYS,0,"(0, 3801, 10000)",False,"First published in 1602, its title characters are Margaret & Alice",The Merry Wives of Windsor,2,1
