epNum,airDate,extra_info,round_name,coord,category,order,value,daily_double,question,answer,correctAttempts,wrongAttempts
8585,2022-02-25,Christine Whelchel game 3.,Jeopardy,"(1, 1)",BIG TEN GEOGRAPHY,29,"(200,)",False,The Hawkeyes' home is this 2-word town,Iowa City,0,3
8585,2022-02-25,Christine Whelchel game 3.,Jeopardy,"(2, 1)",COMMON COMMODITIES,26,"(200,)",False,"It hit an all-time high in August 2020, when it was trading at more than $2,000 an ounce",gold,1,0
8585,2022-02-25,Christine Whelchel game 3.,Jeopardy,"(3, 1)",THE DISNEY LADY SINGS,1,"(200,)",False,"""Belle"", performed by Paige O'Hara",Beauty and the Beast,1,0
8585,2022-02-25,Christine Whelchel game 3.,Jeopardy,"(4, 1)",KINDS OF CARE,19,"(200,)",False,In 2021 a staffing shortage at these places led to a wider labor shortfall as parents of babies & toddlers had to stay home,daycare facilities,1,0
8585,2022-02-25,Christine Whelchel game 3.,Jeopardy,"(5, 1)",A FEW COLORFUL WORDS,9,"(200,)",False,"In addition to a shade of red, it can refer to a holy man, a bird or a number",cardinal,1,0
8585,2022-02-25,Christine Whelchel game 3.,Jeopardy,"(6, 1)",LAST LINE OF A SHAKESPEARE ACT,22,"(200,)",False,"Act II of this play ends, ""My Regan counsels well; come out o' the storm""",King Lear,1,0
8585,2022-02-25,Christine Whelchel game 3.,Jeopardy,"(1, 2)",BIG TEN GEOGRAPHY,4,"(400,)",False,"This Illinois city was originally called West Urbana; here's to it, so say we all!",Champaign,1,0
8585,2022-02-25,Christine Whelchel game 3.,Jeopardy,"(2, 2)",COMMON COMMODITIES,25,"(400,)",False,"In 2011 trading ended in these ""bellies"", a symbol in pop culture of Chicago's arcane commodities trading world",pork bellies,1,0
8585,2022-02-25,Christine Whelchel game 3.,Jeopardy,"(3, 2)",THE DISNEY LADY SINGS,5,"(400,)",False,"""Someday My Prince Will Come"", performed by Adriana Caselotti",Snow White (and the Seven Dwarfs),1,1
8585,2022-02-25,Christine Whelchel game 3.,Jeopardy,"(4, 2)",KINDS OF CARE,14,"(400,)",False,"It's when you tend to you; goop.com ran a piece on it ""For the Cubicle-Bound""",self-care,1,0
8585,2022-02-25,Christine Whelchel game 3.,Jeopardy,"(5, 2)",A FEW COLORFUL WORDS,10,"(400,)",False,"This 3-letter word follows ""golden"" in a lustrous type of paper",rod,1,0
8585,2022-02-25,Christine Whelchel game 3.,Jeopardy,"(6, 2)",LAST LINE OF A SHAKESPEARE ACT,18,"(2500,)",True,"This title character declares, ""He shall have every day a several greeting, or I'll unpeople Egypt""",Cleopatra,0,1
8585,2022-02-25,Christine Whelchel game 3.,Jeopardy,"(1, 3)",BIG TEN GEOGRAPHY,2,"(600,)",False,They're the westernmost & the easternmost Big Ten Schools; the westerners are 5-0 in the football rivalry,Nebraska & Rutgers,1,0
8585,2022-02-25,Christine Whelchel game 3.,Jeopardy,"(2, 3)",COMMON COMMODITIES,24,"(600,)",False,"NG on your ticker stands for this, a nonrenewable hydrocarbon",natural gas,1,0
8585,2022-02-25,Christine Whelchel game 3.,Jeopardy,"(3, 3)",THE DISNEY LADY SINGS,6,"(600,)",False,"""How Far I'll Go"", performed by Auli'i Cravalho",Moana,1,0
8585,2022-02-25,Christine Whelchel game 3.,Jeopardy,"(4, 3)",KINDS OF CARE,15,"(600,)",False,"Respite care gives short-term relief to primary these, a word that begins with ""care""",caregivers,1,0
8585,2022-02-25,Christine Whelchel game 3.,Jeopardy,"(5, 3)",A FEW COLORFUL WORDS,11,"(600,)",False,Aubergine means eggplant or something of this color,purple,1,0
8585,2022-02-25,Christine Whelchel game 3.,Jeopardy,"(6, 3)",LAST LINE OF A SHAKESPEARE ACT,16,"(600,)",False,"Act I of this play concludes with, ""The motion's good indeed and be it so, Petruchio, I shall be your Ben Venuto""",The Taming of the Shrew,1,0
8585,2022-02-25,Christine Whelchel game 3.,Jeopardy,"(1, 4)",BIG TEN GEOGRAPHY,3,"(800,)",False,"Named for an explorer, this Big Ten capital city is at the junction of the Olentangy & Scioto rivers",Columbus,0,3
8585,2022-02-25,Christine Whelchel game 3.,Jeopardy,"(2, 4)",COMMON COMMODITIES,27,"(800,)",False,"Brazil is the leading producer of these legumes, a top commodity that's exported to China",soybeans,0,3
8585,2022-02-25,Christine Whelchel game 3.,Jeopardy,"(3, 4)",THE DISNEY LADY SINGS,7,"(800,)",False,"""Once Upon A Dream"", performed by Mary Costa",Sleeping Beauty,1,0
8585,2022-02-25,Christine Whelchel game 3.,Jeopardy,"(4, 4)",KINDS OF CARE,20,"(800,)",False,"Opened by emergency physicians starting in the 1970s, in the U.S. these clinics now number more than 10,000",urgent care clinics,1,0
8585,2022-02-25,Christine Whelchel game 3.,Jeopardy,"(5, 4)",A FEW COLORFUL WORDS,12,"(800,)",False,"Also the name of a big brown potato variety, this 6-letter word refers to a brownish color",russet,1,0
8585,2022-02-25,Christine Whelchel game 3.,Jeopardy,"(6, 4)",LAST LINE OF A SHAKESPEARE ACT,17,"(800,)",False,"Fortinbras ends act V & this play with ""Go, bid the soldiers shoot""",Hamlet,0,3
8585,2022-02-25,Christine Whelchel game 3.,Jeopardy,"(1, 5)",BIG TEN GEOGRAPHY,28,"(1000,)",False,"Home to a Big Ten school, this state capital was named for a president who died in the year of its founding, 1836","Madison, Wisconsin",0,3
8585,2022-02-25,Christine Whelchel game 3.,Jeopardy,"(2, 5)",COMMON COMMODITIES,30,"(1000,)",False,"On the periodic table Hg stands for mercury, but in commodities HG stands for this, a good conductor of electricity",copper,0,3
8585,2022-02-25,Christine Whelchel game 3.,Jeopardy,"(3, 5)",THE DISNEY LADY SINGS,8,"(1000,)",False,"""When Will My Life Begin?"", performed by Mandy Moore",Tangled,1,0
8585,2022-02-25,Christine Whelchel game 3.,Jeopardy,"(4, 5)",KINDS OF CARE,21,"(1000,)",False,"An HMO is a type of MCO, short for this organization concerned with keeping costs down",managed care organizations,0,3
8585,2022-02-25,Christine Whelchel game 3.,Jeopardy,"(5, 5)",A FEW COLORFUL WORDS,13,"(1000,)",False,"In heraldry, this word means ""silver"" or simply ""white"" & is the color of the unicorn here",argent,1,0
8585,2022-02-25,Christine Whelchel game 3.,Jeopardy,"(6, 5)",LAST LINE OF A SHAKESPEARE ACT,23,"(1000,)",False,"Stephano tells him, ""O brave monster! Lead the way""",Caliban,0,3
8585,2022-02-25,Christine Whelchel game 3.,Double Jeopardy,"(1, 1)",AFRICAN EMPIRES,30,"(400,)",False,"From the 200s to the 800s, the Ethiopian kingdom of Aksum dominated the southwest coast of this ""colorful"" sea",the Red Sea,1,0
8585,2022-02-25,Christine Whelchel game 3.,Double Jeopardy,"(2, 1)",THAT INVENTION IS ELECTRIC,28,"(400,)",False,In may 1958 an electronics tinkerer & a doctor kept a dog's heart going with a gizmo they called tiknik & this device was born,a pacemaker,1,0
8585,2022-02-25,Christine Whelchel game 3.,Double Jeopardy,"(3, 1)",BEFORE SHE WAS FIRST LADY,10,"(400,)",False,"She was the first woman to become a partner at the prestigious Rose Law Firm in Little Rock, Arkansas",Hillary Rodham,1,0
8585,2022-02-25,Christine Whelchel game 3.,Double Jeopardy,"(4, 1)",HOW PUNGENT!,8,"(400,)",False,"A ferocious X-Man would be less cool if we knew him as ""Skunk Bear"", this mammal with a nasty odor",wolverine,1,0
8585,2022-02-25,Christine Whelchel game 3.,Double Jeopardy,"(5, 1)",TV CATCHPHRASES,24,"(400,)",False,"Oft spoken on this series: ""The tribe has spoken""",Survivor,1,0
8585,2022-02-25,Christine Whelchel game 3.,Double Jeopardy,"(6, 1)",3-SYLLABLE VERBS,20,"(400,)",False,"To dig beneath, or to subvert via nefarious activity",undermine,1,0
8585,2022-02-25,Christine Whelchel game 3.,Double Jeopardy,"(1, 2)",AFRICAN EMPIRES,29,"(800,)",False,Legend says the Shona capital of Great Zimbabwe was once the home of this biblical queen,the Queen of Sheba,1,0
8585,2022-02-25,Christine Whelchel game 3.,Double Jeopardy,"(2, 2)",THAT INVENTION IS ELECTRIC,11,"(800,)",False,"Jack Cover read about a man who survived walking into an electric fence & as a result, police use these devices",tasers,1,0
8585,2022-02-25,Christine Whelchel game 3.,Double Jeopardy,"(3, 2)",BEFORE SHE WAS FIRST LADY,9,"(2000,)",True,"She appeared on Broadway in ""Lute Song"" with Yul Brynner & Mary Martin",Nancy Davis (Reagan),0,1
8585,2022-02-25,Christine Whelchel game 3.,Double Jeopardy,"(4, 2)",HOW PUNGENT!,5,"(800,)",False,"Indonesians call the titan arum ""bunga bangkai"", meaning this dead body ""flower""; it can grow 6 fragrant inches a day",a corpse,1,0
8585,2022-02-25,Christine Whelchel game 3.,Double Jeopardy,"(5, 2)",TV CATCHPHRASES,16,"(800,)",False,"On ""Game of Thrones"", Ygritte told this character, ""You know nothing""",Jon Snow,1,0
8585,2022-02-25,Christine Whelchel game 3.,Double Jeopardy,"(6, 2)",3-SYLLABLE VERBS,3,"(800,)",False,"""Mission: Impossible"" often said the secretary might do this, deny knowledge of the team's actions",disavow,1,0
8585,2022-02-25,Christine Whelchel game 3.,Double Jeopardy,"(1, 3)",AFRICAN EMPIRES,27,"(1200,)",False,"The Punic Wars were punitive to this North African empire, destroyed in 146 B.C.",Carthage,1,0
8585,2022-02-25,Christine Whelchel game 3.,Double Jeopardy,"(2, 3)",THAT INVENTION IS ELECTRIC,12,"(4000,)",True,"The advocacy of John Counsell, who suffered a spinal injury in the 1942 Dieppe Raid, led to the 1st electric one in the 1950s",a wheelchair,1,0
8585,2022-02-25,Christine Whelchel game 3.,Double Jeopardy,"(3, 3)",BEFORE SHE WAS FIRST LADY,21,"(1200,)",False,"In Missouri, where she grew up, she was an accomplished athlete, excelling in several sports including tennis",Bess Truman,1,0
8585,2022-02-25,Christine Whelchel game 3.,Double Jeopardy,"(4, 3)",HOW PUNGENT!,6,"(1200,)",False,"John Goodman's Sulley gives Mike his choice of odorants--old dumpster, smelly garbage or wet dog--in this film","Monsters, Inc.",1,0
8585,2022-02-25,Christine Whelchel game 3.,Double Jeopardy,"(5, 3)",TV CATCHPHRASES,15,"(1200,)",False,"On ""Star Trek: The Next Generation"", this group warned, ""Resistance is futile""",the Borg,1,0
8585,2022-02-25,Christine Whelchel game 3.,Double Jeopardy,"(6, 3)",3-SYLLABLE VERBS,1,"(1200,)",False,"The Latin for ""speak against"" gives us this verb of refutation",contradict,1,0
8585,2022-02-25,Christine Whelchel game 3.,Double Jeopardy,"(1, 4)",AFRICAN EMPIRES,25,"(1600,)",False,"This fabled trading city of the medieval Malian Empire was home to 25,000 Islamic scholars",Timbuktu,1,0
8585,2022-02-25,Christine Whelchel game 3.,Double Jeopardy,"(2, 4)",THAT INVENTION IS ELECTRIC,13,"(1600,)",False,"In 1859 Gaston Planté  developed ""the accumulator"", a world-changing one of these found in many cars today",a battery,0,3
8585,2022-02-25,Christine Whelchel game 3.,Double Jeopardy,"(3, 4)",BEFORE SHE WAS FIRST LADY,22,"(1600,)",False,Prior to her marriage she was a teacher & school librarian in Texas,Laura Bush,1,0
8585,2022-02-25,Christine Whelchel game 3.,Double Jeopardy,"(4, 4)",HOW PUNGENT!,7,"(1600,)",False,"That rotten egg smell can happen when sulfur, this biblical substance used to torment sinners, combines with hydrogen",brimstone,1,0
8585,2022-02-25,Christine Whelchel game 3.,Double Jeopardy,"(5, 4)",TV CATCHPHRASES,4,"(1600,)",False,"This 3-word catchphrase gives audience members the chance to play on ""The Price Is Right""","""Come on down""",1,0
8585,2022-02-25,Christine Whelchel game 3.,Double Jeopardy,"(6, 4)",3-SYLLABLE VERBS,2,"(1600,)",False,"In electronics, it means to increase the current or voltage of something; it can also mean to make anything stronger",amplify,1,1
8585,2022-02-25,Christine Whelchel game 3.,Double Jeopardy,"(1, 5)",AFRICAN EMPIRES,26,"(2000,)",False,"In ancient times, Nubia had this 4-letter name & it's an easy job to remember it",Kush,0,3
8585,2022-02-25,Christine Whelchel game 3.,Double Jeopardy,"(2, 5)",THAT INVENTION IS ELECTRIC,14,"(2000,)",False,In the 1830s Joseph Henry invented this 5-letter device used in telegraphs; he used it to send lunch orders from his lab to his home,the relay,0,3
8585,2022-02-25,Christine Whelchel game 3.,Double Jeopardy,"(3, 5)",BEFORE SHE WAS FIRST LADY,23,"(2000,)",False,"His wife, the former Lou Henry, was one of the first women in the U.S. to earn a geology degree",Herbert Hoover,0,3
8585,2022-02-25,Christine Whelchel game 3.,Double Jeopardy,"(4, 5)",HOW PUNGENT!,18,"(2000,)",False,"Ig Nobel prize-winning work showed that a malaria mosquito was drawn to the smell of this German cheese & human feet, equally",Limburger,1,0
8585,2022-02-25,Christine Whelchel game 3.,Double Jeopardy,"(5, 5)",TV CATCHPHRASES,17,"(2000,)",False,"Urkel's catchphrase on ""Family Matters"" was this question",Did I do that?,1,0
8585,2022-02-25,Christine Whelchel game 3.,Double Jeopardy,"(6, 5)",3-SYLLABLE VERBS,19,"(2000,)",False,This word that ends with violence means to rid of misguided notions,disabuse,1,0
8585,2022-02-25,Christine Whelchel game 3.,Final Jeopardy,"(1, 1)",AWARDS,0,"(7399, 3501, 8001)",False,"These awards have a retro version & winners include the novel ""The Sword in the Stone"" & ""The War of the Worlds"" radio broadcast",the Hugo Awards,2,1
