epNum,airDate,extra_info,round_name,coord,category,order,value,daily_double,question,answer,correctAttempts,wrongAttempts
8689,2022-07-21,,Jeopardy,"(1, 1)",THE MET: A VERSE,26,"(200,)",False,"Siegfrieds & Salomes had better learn their parts to sing at the Met in this center ""for the Performing Arts""",Lincoln Center,1,1
8689,2022-07-21,,Jeopardy,"(2, 1)",SPORTS VENUES,25,"(200,)",False,"This London stadium, home to England's national soccer team, boasts it has ""more toilets than any other building in the world""",Wembley,1,0
8689,2022-07-21,,Jeopardy,"(3, 1)",ODD NUMBERS,10,"(200,)",False,A diamond jubilee can celebrate a 60th anniversary or this odd number,75,1,0
8689,2022-07-21,,Jeopardy,"(4, 1)",BUILD A BEAR WORKSHOP,8,"(200,)",False,In 2022 the Golden Bears swam & dove to an NCAA title for this Pac-12 school,Cal Berkeley,1,0
8689,2022-07-21,,Jeopardy,"(5, 1)",THE OLD WEST,1,"(200,)",False,"This type of wagon was where food was served; its name referred to grub, & no one eats until cookie calls",a chuck wagon,1,0
8689,2022-07-21,,Jeopardy,"(6, 1)","WHAT'S YOUR ""ANGLE""?",3,"(200,)",False,To suspend an object over something,to dangle,1,0
8689,2022-07-21,,Jeopardy,"(1, 2)",THE MET: A VERSE,27,"(400,)",False,"Some call the museum's Costume Institute insufficiently arty, but it gets millions every year from this glamorous party",the Met Gala,1,0
8689,2022-07-21,,Jeopardy,"(2, 2)",SPORTS VENUES,24,"(400,)",False,"On Christmas Day, 2021 this Los Angeles hoops, hockey & showbiz venue was renamed Crypto.com Arena",the Staples Center,1,0
8689,2022-07-21,,Jeopardy,"(3, 2)",ODD NUMBERS,14,"(400,)",False,"In craps, these are the 2 possible winning numbers on a come out roll",7 & 11,1,0
8689,2022-07-21,,Jeopardy,"(4, 2)",BUILD A BEAR WORKSHOP,9,"(400,)",False,"This ""greater bear"" constellation contains the group known as the Big Dipper",Ursa Major,1,0
8689,2022-07-21,,Jeopardy,"(5, 2)",THE OLD WEST,2,"(400,)",False,Wild Bill Hickok stopped a man from beating this other famous Bill who was 11 at the time & the two became lifelong friends,Buffalo Bill (Cody),1,0
8689,2022-07-21,,Jeopardy,"(6, 2)","WHAT'S YOUR ""ANGLE""?",4,"(400,)",False,To round up cattle,wrangle,1,0
8689,2022-07-21,,Jeopardy,"(1, 3)",THE MET: A VERSE,28,"(600,)",False,"His painting ""The Death of Socrates"" is one of the museum's bigs; he's French, so say his name like that of singing actor Diggs",David,0,3
8689,2022-07-21,,Jeopardy,"(2, 3)",SPORTS VENUES,23,"(600,)",False,"This Triple Crown racetrack that opened in 1875 was named for the landowners, not for a future British prime minister",Churchill Downs,1,0
8689,2022-07-21,,Jeopardy,"(3, 3)",ODD NUMBERS,15,"(600,)",False,"In baseball scorekeeping, 9 denotes this position played by Babe Ruth & Ichiro",right field,1,0
8689,2022-07-21,,Jeopardy,"(4, 3)",BUILD A BEAR WORKSHOP,16,"(600,)",False,"A Haydn symphony nicknamed ""The Bear"" has a passage that sounds like music for bears to do this --perhaps a minuet?",dance,1,0
8689,2022-07-21,,Jeopardy,"(5, 3)",THE OLD WEST,11,"(600,)",False,"Before becoming sheriff of this South Dakota town, Seth Bullock opened a hardware store there with partner Sol Star",Deadwood,1,0
8689,2022-07-21,,Jeopardy,"(6, 3)","WHAT'S YOUR ""ANGLE""?",5,"(600,)",False,You do this to your keys to make a harsh sound,jangle,1,0
8689,2022-07-21,,Jeopardy,"(1, 4)",THE MET: A VERSE,29,"(800,)",False,"The museum has lots from the ancient Near East, this between-rivers region gave us yon beast",Mesopotamia,1,0
8689,2022-07-21,,Jeopardy,"(2, 4)",SPORTS VENUES,22,"(2200,)",True,"In 1879 the first of  several NYC venues to bear this name featured birds,  flowers & fountains, so the name made more sense",Madison Square Garden,0,1
8689,2022-07-21,,Jeopardy,"(3, 4)",ODD NUMBERS,19,"(800,)",False,In the 1930s the .357 became the first of these extra-powerful rounds of ammo,a magnum,1,0
8689,2022-07-21,,Jeopardy,"(4, 4)",BUILD A BEAR WORKSHOP,17,"(800,)",False,"Before he was president, Volodymyr Zelensky voiced this marmalade-loving bear in the Ukrainian dub of 2 recent films",Paddington,1,0
8689,2022-07-21,,Jeopardy,"(5, 4)",THE OLD WEST,12,"(800,)",False,Prospector John Bozeman blazed a trail to gold-rush towns in what is now this state,Montana,1,0
8689,2022-07-21,,Jeopardy,"(6, 4)","WHAT'S YOUR ""ANGLE""?",6,"(800,)",False,An ornamental bracelet,bangle,1,0
8689,2022-07-21,,Jeopardy,"(1, 5)",THE MET: A VERSE,30,"(1000,)",False,"She was Greek, she loved Onassis, she could really sing, her longtime boss around the Met was named Sir Rudolf Bing",(Maria) Callas,1,0
8689,2022-07-21,,Jeopardy,"(2, 5)",SPORTS VENUES,21,"(1000,)",False,"In 1957 this famed soccer club moved into Camp Nou, Catalan for ""New Ground""",FC Barcelona,1,0
8689,2022-07-21,,Jeopardy,"(3, 5)",ODD NUMBERS,20,"(1000,)",False,Start counting in your head! It's the next prime number after 23,29,1,0
8689,2022-07-21,,Jeopardy,"(4, 5)",BUILD A BEAR WORKSHOP,18,"(1000,)",False,"The type of bear named for this Alaskan island tips the scales at 1,700 pounds",Kodiak,1,0
8689,2022-07-21,,Jeopardy,"(5, 5)",THE OLD WEST,13,"(1000,)",False,"When Butch & Sundance & their Wild Bunch gang hid in the Wyoming spot seen here, they were part of this gang named for it",the Hole-in-the-Wall Gang,1,1
8689,2022-07-21,,Jeopardy,"(6, 5)","WHAT'S YOUR ""ANGLE""?",7,"(1000,)",False,"In addition to being a verb meaning to mutilate, it's also a word for an old-timey machine to iron laundry",mangle,1,0
8689,2022-07-21,,Double Jeopardy,"(1, 1)",ASIAN GEOGRAPHY,11,"(400,)",False,"Extending more than 1,500 miles, these mountains separate the Indian subcontinent from the remainder of Asia",Himalayas,1,0
8689,2022-07-21,,Double Jeopardy,"(2, 1)",COMPOUND WORDS,6,"(400,)",False,It's a group of women with a common interest & maybe some traveling pants,a sisterhood,1,0
8689,2022-07-21,,Double Jeopardy,"(3, 1)",BOTTOMS UP!,5,"(400,)",False,"This 2-word term meaning the lowest spot you can ""hit"" originated in mining in the 19th century",rock bottom,1,0
8689,2022-07-21,,Double Jeopardy,"(4, 1)",NAME THAT HITMAKER,15,"(400,)",False,"""In My Feelings"" & ""Nice For What""",Drake,0,3
8689,2022-07-21,,Double Jeopardy,"(5, 1)",HEALTH & MEDICINE,20,"(400,)",False,In 1955 13-year-old Susie asked her dad about an easier way to treat her asthma; dad ran Riker Labs & presto! the metered dose this device,an inhaler,1,0
8689,2022-07-21,,Double Jeopardy,"(6, 1)",CLOSING STATEMENTS,13,"(400,)",False,"""I think of Dean Moriarty, I even think of old Dean Moriarty the father we never found, I think of Dean Moriarty""",On the Road,0,3
8689,2022-07-21,,Double Jeopardy,"(1, 2)",ASIAN GEOGRAPHY,12,"(800,)",False,Lebanon is tucked into what would be the coast of this country & separated from it by the Anti-Lebanon Mountains,Syria,1,0
8689,2022-07-21,,Double Jeopardy,"(2, 2)",COMPOUND WORDS,7,"(800,)",False,"As seen here, it's a fun way to work out",kickboxing,1,0
8689,2022-07-21,,Double Jeopardy,"(3, 2)",BOTTOMS UP!,1,"(800,)",False,"Not a positive term used of people, bottom-feeder works for these, like channel variety seen here",a catfish,1,0
8689,2022-07-21,,Double Jeopardy,"(4, 2)",NAME THAT HITMAKER,16,"(800,)",False,"""Stayin' Alive"" & ""Too Much Heaven""",the Bee Gees,1,0
8689,2022-07-21,,Double Jeopardy,"(5, 2)",HEALTH & MEDICINE,24,"(800,)",False,Type I of this disorder once called manic depression has manic episodes of at least a week & depressive episodes of twice that long,bipolar disorder,1,0
8689,2022-07-21,,Double Jeopardy,"(6, 2)",CLOSING STATEMENTS,14,"(1000,)",True,"""The creatures outside looked from pig to man, and from man to pig... but already it was impossible to say which was which""",Animal Farm,1,0
8689,2022-07-21,,Double Jeopardy,"(1, 3)",ASIAN GEOGRAPHY,21,"(1200,)",False,"About 3/4 of Mongolia is made up of the forest, desert, mountain & grass types of these plains",steppes,1,0
8689,2022-07-21,,Double Jeopardy,"(2, 3)",COMPOUND WORDS,8,"(1200,)",False,The name of this illegally distilled liquor goes back to when it was made under the cover of darkness,moonshine,1,0
8689,2022-07-21,,Double Jeopardy,"(3, 3)",BOTTOMS UP!,2,"(1200,)",False,"A song from ""Annie"" reminds us that ""the sun'll come out tomorrow"" & that you should therefore bet this",your bottom dollar,1,0
8689,2022-07-21,,Double Jeopardy,"(4, 3)",NAME THAT HITMAKER,17,"(1200,)",False,"""Break Up With Your Girlfriend, I'm Bored"" & ""Positions""",Ariana Grande,0,3
8689,2022-07-21,,Double Jeopardy,"(5, 3)",HEALTH & MEDICINE,28,"(1200,)",False,"By age 75, half of white Americans have this eye condition that can feel like looking through a fogged-up window",cataracts,1,0
8689,2022-07-21,,Double Jeopardy,"(6, 3)",CLOSING STATEMENTS,25,"(1200,)",False,"""Max... sailed back... into the night of his very own room where he found his supper waiting for him and it was still hot""",Where the Wild Things Are,1,0
8689,2022-07-21,,Double Jeopardy,"(1, 4)",ASIAN GEOGRAPHY,22,"(1600,)",False,"Long, skinny Lake Balkhash extends over nearly 400 miles of the eastern part of this country",Kazakhstan,1,0
8689,2022-07-21,,Double Jeopardy,"(2, 4)",COMPOUND WORDS,9,"(1600,)",False,"Originally referring to a type of barrier, it's another name for some of the toll roads on the East Coast",a turnpike,1,0
8689,2022-07-21,,Double Jeopardy,"(3, 4)",BOTTOMS UP!,3,"(1600,)",False,This nickname for the area around the U.S. State Department partly comes from industrial smoke once found there,Foggy Bottom,1,0
8689,2022-07-21,,Double Jeopardy,"(4, 4)",NAME THAT HITMAKER,18,"(1600,)",False,"""Eyes Without A Face"" & ""White Wedding""",Billy Idol,1,0
8689,2022-07-21,,Double Jeopardy,"(5, 4)",HEALTH & MEDICINE,29,"(1600,)",False,"The most common form of this ailment is the plaque type, named for the patches it forms on the skin",psoriasis,1,0
8689,2022-07-21,,Double Jeopardy,"(6, 4)",CLOSING STATEMENTS,26,"(1600,)",False,"""'Darling,' replied Valentine, 'Has not the Count just told us that all human wisdom is summed up in two words?--'Wait and hope""'",The Count of Monte Cristo,1,0
8689,2022-07-21,,Double Jeopardy,"(1, 5)",ASIAN GEOGRAPHY,23,"(2000,)",True,The Laccadive Sea separates the Maldives & this other island country from the Asian mainland,Sri Lanka,1,0
8689,2022-07-21,,Double Jeopardy,"(2, 5)",COMPOUND WORDS,10,"(2000,)",False,"Derived from German, it's a strong passion for traveling & seeing the world",wanderlust,1,0
8689,2022-07-21,,Double Jeopardy,"(3, 5)",BOTTOMS UP!,4,"(2000,)",False,Echo is an important type of this device that tells mariners how far down the bottom is,a depth finder (a depth sounder),1,1
8689,2022-07-21,,Double Jeopardy,"(4, 5)",NAME THAT HITMAKER,19,"(2000,)",False,"""Dark Horse"" & ""Wide Awake""",Katy Perry,1,0
8689,2022-07-21,,Double Jeopardy,"(5, 5)",HEALTH & MEDICINE,30,"(2000,)",False,Pregnant women need 600 mcg of this B9 vitamin daily to help prevent birth defects like spina bifida,folic acid,1,0
8689,2022-07-21,,Double Jeopardy,"(6, 5)",CLOSING STATEMENTS,27,"(2000,)",False,"""So we beat on, boats against the current, borne back ceaselessly into the past""",The Great Gatsby,1,0
8689,2022-07-21,,Final Jeopardy,"(1, 1)",CONSTELLATIONS,0,"(5600, 5400, 8201)",False,"The brightest star of this constellation is Deneb Algedi, or ""Kid's Tail""",Capricorn,1,2
