epNum,airDate,extra_info,round_name,coord,category,order,value,daily_double,question,answer,correctAttempts,wrongAttempts
8719,2022-10-13,Cris Pannullo game 10.,Jeopardy,"(1, 1)",WEIRD SCIENCE,16,"(200,)",False,Scientists now believe a species of this flying mammal buzzes like a wasp to deter owls from eating them,a bat,1,1
8719,2022-10-13,Cris Pannullo game 10.,Jeopardy,"(2, 1)",THAT'S THEIR SPORT,12,"(200,)",False,"Briana Scurry, Megan Rapinoe",soccer,1,0
8719,2022-10-13,Cris Pannullo game 10.,Jeopardy,"(3, 1)",LOOKING SHARP!,19,"(200,)",False,"In Proverbs 5 ""her end is bitter as wormwood, sharp as a twoedged"" this",sword,1,0
8719,2022-10-13,Cris Pannullo game 10.,Jeopardy,"(4, 1)",HODGEPOURRIPODGE,24,"(200,)",False,This 102-story structure on New York City's 34th Street is kinda hard to miss,the Empire State Building,1,0
8719,2022-10-13,Cris Pannullo game 10.,Jeopardy,"(5, 1)","THE REST, AS THEY SAY...",21,"(200,)",False,"""It's a poor craftsman"" who does this; how's a hammer going to respond anyway?",blames his tools,1,0
8719,2022-10-13,Cris Pannullo game 10.,Jeopardy,"(6, 1)",IS HISTORY,17,"(200,)",False,"Though some was at first described as ""of a byting tast"", it became Colonial Virginia's No. 1 cash crop",tobacco,1,0
8719,2022-10-13,Cris Pannullo game 10.,Jeopardy,"(1, 2)",WEIRD SCIENCE,9,"(400,)",False,"A fabric that acts as a microphone could one day listen to this, just like an echocardiogram does",your heartbeat,1,0
8719,2022-10-13,Cris Pannullo game 10.,Jeopardy,"(2, 2)",THAT'S THEIR SPORT,10,"(400,)",False,"Naomi Osaka, Martina Hingis",tennis,1,0
8719,2022-10-13,Cris Pannullo game 10.,Jeopardy,"(3, 2)",LOOKING SHARP!,26,"(400,)",False,"Let's face it, the King C. this brand double edge safety razor can smooth things out",Gillette,1,0
8719,2022-10-13,Cris Pannullo game 10.,Jeopardy,"(4, 2)",HODGEPOURRIPODGE,23,"(400,)",False,"This candy urges us to ""Taste the rainbow""",Skittles,1,0
8719,2022-10-13,Cris Pannullo game 10.,Jeopardy,"(5, 2)","THE REST, AS THEY SAY...",25,"(400,)",False,"An old saying goes, ""Guests, like fish begin to"" do this; how you waited 72 hours is beyond us",smell after three days,0,3
8719,2022-10-13,Cris Pannullo game 10.,Jeopardy,"(6, 2)",IS HISTORY,13,"(400,)",False,In 1988 Benazir Bhutto became the first woman elected to lead an Islamic nation--this one,Pakistan,1,0
8719,2022-10-13,Cris Pannullo game 10.,Jeopardy,"(1, 3)",WEIRD SCIENCE,15,"(600,)",False,"Bananas have a tiny amount of radioactivity due to this element, which can emit .01 millirems of radiation",potassium,1,0
8719,2022-10-13,Cris Pannullo game 10.,Jeopardy,"(2, 3)",THAT'S THEIR SPORT,4,"(600,)",False,"Se Ri Pak, Annika Sörenstam",golf,1,0
8719,2022-10-13,Cris Pannullo game 10.,Jeopardy,"(3, 3)",LOOKING SHARP!,27,"(600,)",False,"The fingertips have lots of pain receptors, as you may realize when a page of the May 1996 Redbook gives you one of these",a paper cut,1,0
8719,2022-10-13,Cris Pannullo game 10.,Jeopardy,"(4, 3)",HODGEPOURRIPODGE,8,"(600,)",False,You never escape algebra! It's what x equals in 2x + 3 = 11,4,1,0
8719,2022-10-13,Cris Pannullo game 10.,Jeopardy,"(5, 3)","THE REST, AS THEY SAY...",20,"(600,)",False,"Your friendly neighborhood Spider-Man can help you with the line ""With great power comes"" this",great responsibility,1,0
8719,2022-10-13,Cris Pannullo game 10.,Jeopardy,"(6, 3)",IS HISTORY,6,"(600,)",False,In 1956 this Soviet leader made a secret speech to a party congress denouncing Joseph Stalin,Khrushchev,1,0
8719,2022-10-13,Cris Pannullo game 10.,Jeopardy,"(1, 4)",WEIRD SCIENCE,5,"(1400,)",True,"Some scientists think Uranus' atmosphere may compress carbon atoms into these, putting the ice in ice giant",diamonds,1,0
8719,2022-10-13,Cris Pannullo game 10.,Jeopardy,"(2, 4)",THAT'S THEIR SPORT,2,"(800,)",False,"Mikaela Shiffrin, Picabo Street",skiing,1,0
8719,2022-10-13,Cris Pannullo game 10.,Jeopardy,"(3, 4)",LOOKING SHARP!,22,"(800,)",False,It's the sharp object in Aesop's tale of Androcles,a thorn,0,3
8719,2022-10-13,Cris Pannullo game 10.,Jeopardy,"(4, 4)",HODGEPOURRIPODGE,30,"(800,)",False,"At age 99 this German-born man, Secretary of State in the 1970s, recently published the book ""Leadership""",Henry Kissinger,1,0
8719,2022-10-13,Cris Pannullo game 10.,Jeopardy,"(5, 4)","THE REST, AS THEY SAY...",29,"(800,)",False,"Something's awry in the phrase ""The best-laid plans"" of these 2 creatures",mice & men,1,0
8719,2022-10-13,Cris Pannullo game 10.,Jeopardy,"(6, 4)",IS HISTORY,7,"(800,)",False,This father of Alexander the Great was assassinated in 336 B.C.,Philip of Macedon,1,0
8719,2022-10-13,Cris Pannullo game 10.,Jeopardy,"(1, 5)",WEIRD SCIENCE,18,"(1000,)",False,"Liquids & solids are states of this that sit there; swirlons, such as flocks of birds, are parts of the newer concept of ""active"" this",matter,1,0
8719,2022-10-13,Cris Pannullo game 10.,Jeopardy,"(2, 5)",THAT'S THEIR SPORT,1,"(1000,)",False,"Diana Taurasi, Tamika Catchings",basketball,1,0
8719,2022-10-13,Cris Pannullo game 10.,Jeopardy,"(3, 5)",LOOKING SHARP!,14,"(1000,)",False,"Small incisions are made with this 2-edged surgical instrument, also the name of a weekly medical journal founded in 1823",lancet,1,0
8719,2022-10-13,Cris Pannullo game 10.,Jeopardy,"(4, 5)",HODGEPOURRIPODGE,3,"(1000,)",False,"Attend the tale of this character, Broadway's ""Demon Barber of Fleet Street""",Sweeney Todd,1,0
8719,2022-10-13,Cris Pannullo game 10.,Jeopardy,"(5, 5)","THE REST, AS THEY SAY...",28,"(1000,)",False,"Travelers well know the rest of the rhyming phrase that begins ""East or west...""",home is best,0,3
8719,2022-10-13,Cris Pannullo game 10.,Jeopardy,"(6, 5)",IS HISTORY,11,"(1000,)",False,"The job of emperor of this country was long dominated by the Amhara, who also gave their name to a major language there",Ethiopia,1,0
8719,2022-10-13,Cris Pannullo game 10.,Double Jeopardy,"(1, 1)",WHERE ON EARTH?,14,"(400,)",False,The Coptic Museum & Tahrir Square: this city,Cairo,1,0
8719,2022-10-13,Cris Pannullo game 10.,Double Jeopardy,"(2, 1)",I GOT THE PART!,11,"(400,)",False,Will Smith didn't want the part of Thomas Anderson in this blockbuster; Keanu would make the role Neo-classical,The Matrix,1,0
8719,2022-10-13,Cris Pannullo game 10.,Double Jeopardy,"(3, 1)",TUDOR TIMES,25,"(400,)",False,"These were a Tudor status symbol, as seen in the elaborate  ones on Hampton Court Palace, built by Cardinal Wolsey",chimneys,0,3
8719,2022-10-13,Cris Pannullo game 10.,Double Jeopardy,"(4, 1)",THE AUTOMOTIVE WORLD,30,"(400,)",False,The tail lights of recent MINI Coopers look like this flag,the Union Jack,1,0
8719,2022-10-13,Cris Pannullo game 10.,Double Jeopardy,"(5, 1)",AFTER SCHOOL,28,"(400,)",False,A reporter's exclusive,scoop,1,0
8719,2022-10-13,Cris Pannullo game 10.,Double Jeopardy,"(6, 1)",PONY TALES,26,"(400,)",False,"The title character of this Anna Sewell novel is instructed by his mother Duchess, ""Lift your feet up well when you trot""",Black Beauty,1,0
8719,2022-10-13,Cris Pannullo game 10.,Double Jeopardy,"(1, 2)",WHERE ON EARTH?,13,"(800,)",False,New Hampshire's Mt. Washington & West Virginia's Spruce Knob: this mountain range,the Appalachian Mountains,1,0
8719,2022-10-13,Cris Pannullo game 10.,Double Jeopardy,"(2, 2)",I GOT THE PART!,10,"(800,)",False,"Michael C. Hall embraced that ""unique"" accent when portraying this president on ""The Crown""",John F. Kennedy,1,0
8719,2022-10-13,Cris Pannullo game 10.,Double Jeopardy,"(3, 2)",TUDOR TIMES,24,"(800,)",False,"At the Battle of Flodden in 1513, a Tudor army crushed the invading forces of this realm & killed its King James IV",Scotland,1,0
8719,2022-10-13,Cris Pannullo game 10.,Double Jeopardy,"(4, 2)",THE AUTOMOTIVE WORLD,29,"(800,)",False,The Pony was a 1976 model from this South Korean carmaker,Hyundai,1,2
8719,2022-10-13,Cris Pannullo game 10.,Double Jeopardy,"(5, 2)",AFTER SCHOOL,27,"(800,)",False,Sail the 7 seas of suds in one of these big beer glasses,a schooner,1,1
8719,2022-10-13,Cris Pannullo game 10.,Double Jeopardy,"(6, 2)",PONY TALES,21,"(800,)",False,"In C.S. Lewis' ""The Horse & His Boy"", young Shasta & a talking pony named Bree travel to this magical land",Narnia,1,0
8719,2022-10-13,Cris Pannullo game 10.,Double Jeopardy,"(1, 3)",WHERE ON EARTH?,1,"(1200,)",False,Christmas Island & Reunion Island: this ocean,the Indian Ocean,0,3
8719,2022-10-13,Cris Pannullo game 10.,Double Jeopardy,"(2, 3)",I GOT THE PART!,8,"(1200,)",False,"After a groundbreaking choice to cast her on ""Doctor Who"", she said ""The gender question is now going away""",Jodie Whittaker,0,3
8719,2022-10-13,Cris Pannullo game 10.,Double Jeopardy,"(3, 3)",TUDOR TIMES,23,"(1200,)",False,The theatrical troupe known as the Lord Chamberlain's Men built this performance space in 1599 & were soon packing the place,the Globe Theatre,1,0
8719,2022-10-13,Cris Pannullo game 10.,Double Jeopardy,"(4, 3)",THE AUTOMOTIVE WORLD,12,"(1200,)",False,"In 2019, this company unveiled the stainless steel electric Cybertruck",Tesla,1,0
8719,2022-10-13,Cris Pannullo game 10.,Double Jeopardy,"(5, 3)",AFTER SCHOOL,16,"(1200,)",False,The OED includes this alliterative cartoon-derived term for a bite of food given as a reward,Scooby snacks,0,3
8719,2022-10-13,Cris Pannullo game 10.,Double Jeopardy,"(6, 3)",PONY TALES,19,"(4800,)",True,"Mollie, who misses wearing ribbons in her mane & eating sugar cubes, represents the petite bourgeoisie in this novel",Animal Farm,1,0
8719,2022-10-13,Cris Pannullo game 10.,Double Jeopardy,"(1, 4)",WHERE ON EARTH?,2,"(1600,)",False,The Cannes Film Festival: this glamorous coastal region,the French Riviera,1,0
8719,2022-10-13,Cris Pannullo game 10.,Double Jeopardy,"(2, 4)",I GOT THE PART!,6,"(1600,)",False,"In her Oscar acceptance speech for this movie, Halle Berry mentioned Angela Bassett, who was offered the role",Monster\'s Ball,1,0
8719,2022-10-13,Cris Pannullo game 10.,Double Jeopardy,"(3, 4)",TUDOR TIMES,4,"(5000,)",True,"Alas, my love, it's probably not true that Henry VIII wrote this song, which actually dates from later in the Tudor era","""Greensleeves""",0,1
8719,2022-10-13,Cris Pannullo game 10.,Double Jeopardy,"(4, 4)",THE AUTOMOTIVE WORLD,9,"(1600,)",False,"Still popular, this model was introduced in 1976 as a swankier alternative to the same company's Civic",the Honda Accord,1,0
8719,2022-10-13,Cris Pannullo game 10.,Double Jeopardy,"(5, 4)",AFTER SCHOOL,15,"(1600,)",False,An upside-down lowercase E is used to represent this vowel sound,schwa,1,0
8719,2022-10-13,Cris Pannullo game 10.,Double Jeopardy,"(6, 4)",PONY TALES,18,"(1600,)",False,"Growing up on a Wyoming horse ranch, Kevin is tasked with making a good pony out of ""My Friend"" her",Flicka,1,0
8719,2022-10-13,Cris Pannullo game 10.,Double Jeopardy,"(1, 5)",WHERE ON EARTH?,3,"(2000,)",False,Lake Louise & the city of Medicine Hat: this Canadian province,Alberta,1,0
8719,2022-10-13,Cris Pannullo game 10.,Double Jeopardy,"(2, 5)",I GOT THE PART!,7,"(2000,)",False,Kristen Stewart painfully fell off a horse as a child but got back on for this role & rode around with the Huntsman,Snow White,1,0
8719,2022-10-13,Cris Pannullo game 10.,Double Jeopardy,"(3, 5)",TUDOR TIMES,5,"(2000,)",False,"For possible matrimonial selection, Amalia, the sister of Anne of Cleves, also had her portrait done by this artist",(Hans) Holbein,1,0
8719,2022-10-13,Cris Pannullo game 10.,Double Jeopardy,"(4, 5)",THE AUTOMOTIVE WORLD,22,"(2000,)",False,"Seen here is an iconic model from this French company, making cars since 1919",a Citroën,0,3
8719,2022-10-13,Cris Pannullo game 10.,Double Jeopardy,"(5, 5)",AFTER SCHOOL,17,"(2000,)",False,"This word for a tiny trace, perhaps of doubt or evidence, is Latin for ""spark""",scintilla,1,0
8719,2022-10-13,Cris Pannullo game 10.,Double Jeopardy,"(6, 5)",PONY TALES,20,"(2000,)",False,"You can't do the category without ""The Red Pony"", a book of stories by this American",Steinbeck,1,0
8719,2022-10-13,Cris Pannullo game 10.,Final Jeopardy,"(1, 1)",DOCUMENTARIES,0,"(5400, 801, 0)",False,"In this 1970 film, Max Yasgur says, ""I'm a farmer... I don't know how to speak to 20 people... let alone a crowd like this""",Woodstock,2,1
