epNum,airDate,extra_info,round_name,coord,category,order,value,daily_double,question,answer,correctAttempts,wrongAttempts
8729,2022-10-27,"2022 Second Chance competition week 2, final game 1.",Jeopardy,"(1, 1)",ANOTHER SHOT AT THE TITLE,30,"(200,)",False,"Serena Williams beat Angelique Kerber for the 2016 Ladies' Singles title at this event, but Angelique got her revenge in 2018",Wimbledon,1,0
8729,2022-10-27,"2022 Second Chance competition week 2, final game 1.",Jeopardy,"(2, 1)",THE ANIMAL KINGDOM,24,"(200,)",False,The name of this insectivore has meant a scolding woman since before Shakespeare used it in a play title,shrew,1,0
8729,2022-10-27,"2022 Second Chance competition week 2, final game 1.",Jeopardy,"(3, 1)",BRING ME A SOUVENIR!,26,"(200,)",False,"From Japan, a maneki-neko good luck figurine depicting one of these with upraised paw",a cat,1,0
8729,2022-10-27,"2022 Second Chance competition week 2, final game 1.",Jeopardy,"(4, 1)",WORDS & PHRASES: IMMEDIATELY!,28,"(200,)",False,"Military-speak for getting somewhere extra fast, ""on the"" this sounds like a pace twice as fast as normal for civilians",the double,1,0
8729,2022-10-27,"2022 Second Chance competition week 2, final game 1.",Jeopardy,"(5, 1)",WHICH CABINET DEPARTMENT?,29,"(200,)",False,U.S. Customs & Border Protection,Homeland Security,1,0
8729,2022-10-27,"2022 Second Chance competition week 2, final game 1.",Jeopardy,"(6, 1)",RADCLIFFE COLLEGE,22,"(200,)",False,Radcliffe College for Women merged with this Ivy League school where the Radcliffe Institute for Advanced Study endures,Harvard,1,0
8729,2022-10-27,"2022 Second Chance competition week 2, final game 1.",Jeopardy,"(1, 2)",ANOTHER SHOT AT THE TITLE,27,"(400,)",False,"After losing to the Warriors in the 2015 NBA Finals, in 2016 LeBron & co. beat them to bring this city its first NBA title",Cleveland,0,3
8729,2022-10-27,"2022 Second Chance competition week 2, final game 1.",Jeopardy,"(2, 2)",THE ANIMAL KINGDOM,20,"(400,)",False,"O. vulgaris, a species of this cephalopod, can change its skin color thanks to pigment-bearing cells",octopus,1,0
8729,2022-10-27,"2022 Second Chance competition week 2, final game 1.",Jeopardy,"(3, 2)",BRING ME A SOUVENIR!,25,"(400,)",False,"From Ecuador, one of these straw hats that somehow is named for a country to the north",a Panama hat,1,0
8729,2022-10-27,"2022 Second Chance competition week 2, final game 1.",Jeopardy,"(4, 2)",WORDS & PHRASES: IMMEDIATELY!,23,"(400,)",False,"This French phrase that translates to ""immediately"" sounds like a noise you'd make in a fancy hotel room",tout de suite,1,0
8729,2022-10-27,"2022 Second Chance competition week 2, final game 1.",Jeopardy,"(5, 2)",WHICH CABINET DEPARTMENT?,18,"(400,)",False,The Office of Pest Management Policy,Agriculture,1,0
8729,2022-10-27,"2022 Second Chance competition week 2, final game 1.",Jeopardy,"(6, 2)",RADCLIFFE COLLEGE,21,"(400,)",False,Susan Stockard went from the Madeira Prep School  to Radcliffe to acting fame under this name,Stockard Channing,1,0
8729,2022-10-27,"2022 Second Chance competition week 2, final game 1.",Jeopardy,"(1, 3)",ANOTHER SHOT AT THE TITLE,14,"(600,)",False,"After 5 previous World Series losses to these crosstown rivals, in 1955 the Brooklyn Dodgers finally beat them for the title",the New York Yankees,1,0
8729,2022-10-27,"2022 Second Chance competition week 2, final game 1.",Jeopardy,"(2, 3)",THE ANIMAL KINGDOM,19,"(600,)",False,Seen here it's not an ostrich but this Aussie bird,an emu,1,1
8729,2022-10-27,"2022 Second Chance competition week 2, final game 1.",Jeopardy,"(3, 3)",BRING ME A SOUVENIR!,16,"(600,)",False,"From Kyrgyzstan, a miniature wood-carved one of these nomadic dwellings, ""ger"" in Mongol",a yurt,1,0
8729,2022-10-27,"2022 Second Chance competition week 2, final game 1.",Jeopardy,"(4, 3)",WORDS & PHRASES: IMMEDIATELY!,15,"(600,)",False,"It's this phrase that says if something isn't done immediately, it won't ever happen; in related news, ""my love won't wait""",It\'s now or never,1,0
8729,2022-10-27,"2022 Second Chance competition week 2, final game 1.",Jeopardy,"(5, 3)",WHICH CABINET DEPARTMENT?,17,"(600,)",False,The National Reconnaissance Office,Department of Defense,1,1
8729,2022-10-27,"2022 Second Chance competition week 2, final game 1.",Jeopardy,"(6, 3)",RADCLIFFE COLLEGE,11,"(600,)",False,This woman went to all of Helen Keller's Radcliffe classes with Helen but not to exams,(Anne) Sullivan,1,0
8729,2022-10-27,"2022 Second Chance competition week 2, final game 1.",Jeopardy,"(1, 4)",ANOTHER SHOT AT THE TITLE,13,"(800,)",False,"Stripped of his heavyweight title in 1967, Muhammad Ali won it back with a KO of this champ in 1974's Rumble in the Jungle",George Foreman,1,1
8729,2022-10-27,"2022 Second Chance competition week 2, final game 1.",Jeopardy,"(2, 4)",THE ANIMAL KINGDOM,6,"(3800,)",True,Males of these mammals engage in bouts called necking to establish a social hierarchy,giraffes,1,0
8729,2022-10-27,"2022 Second Chance competition week 2, final game 1.",Jeopardy,"(3, 4)",BRING ME A SOUVENIR!,12,"(800,)",False,"From Greece, a string of komboloi, or these, used not for religious reasons but to relax & counteract stress",worry beads,0,3
8729,2022-10-27,"2022 Second Chance competition week 2, final game 1.",Jeopardy,"(4, 4)",WORDS & PHRASES: IMMEDIATELY!,8,"(800,)",False,"Give us this double-talk term quickly, as it means quickly & in this case, not to cut using 2 blows",chop-chop,1,0
8729,2022-10-27,"2022 Second Chance competition week 2, final game 1.",Jeopardy,"(5, 4)",WHICH CABINET DEPARTMENT?,4,"(800,)",False,The National Nuclear Security Administration,Energy,1,0
8729,2022-10-27,"2022 Second Chance competition week 2, final game 1.",Jeopardy,"(6, 4)",RADCLIFFE COLLEGE,10,"(800,)",False,Radcliffe alumna Helen Taussig is considered the founder of pediatric this -ology,pediatric cardiology,0,3
8729,2022-10-27,"2022 Second Chance competition week 2, final game 1.",Jeopardy,"(1, 5)",ANOTHER SHOT AT THE TITLE,1,"(1000,)",False,"After losing to Toronto in 1918, this team won its first NHL title the next year & has now won more than any other team",the Montreal Canadiens,1,0
8729,2022-10-27,"2022 Second Chance competition week 2, final game 1.",Jeopardy,"(2, 5)",THE ANIMAL KINGDOM,2,"(1000,)",False,A factor in human blood is named for this monkey seen here,Rhesus,1,0
8729,2022-10-27,"2022 Second Chance competition week 2, final game 1.",Jeopardy,"(3, 5)",BRING ME A SOUVENIR!,5,"(1000,)",False,"From Ireland, one of these rings; the crown symbolized loyalty, the heart-love, & the hands--friendship",a Claddagh ring,1,0
8729,2022-10-27,"2022 Second Chance competition week 2, final game 1.",Jeopardy,"(4, 5)",WORDS & PHRASES: IMMEDIATELY!,7,"(1000,)",False,"As an adverb, it means without hesitation, as in ""I'll get it to you"" this way; as a noun, it's a long part of a closed racecourse",straightaway,1,0
8729,2022-10-27,"2022 Second Chance competition week 2, final game 1.",Jeopardy,"(5, 5)",WHICH CABINET DEPARTMENT?,3,"(1000,)",False,The U.S. Fish & Wildlife Service,Department of the Interior,1,0
8729,2022-10-27,"2022 Second Chance competition week 2, final game 1.",Jeopardy,"(6, 5)",RADCLIFFE COLLEGE,9,"(1000,)",False,"A center of women's history studies, the Schlesinger Library opened at Radcliffe in 1943 on the anniversary of this amendment",the 19th,1,0
8729,2022-10-27,"2022 Second Chance competition week 2, final game 1.",Double Jeopardy,"(1, 1)",OCTOBERFEST,28,"(400,)",False,"She joined the Supreme Court as its second female justice October 4, 1993",Ruth Bader Ginsburg,1,1
8729,2022-10-27,"2022 Second Chance competition week 2, final game 1.",Double Jeopardy,"(2, 1)",THE SECOND CHAPTER,29,"(400,)",False,"Holden's history teacher says, ""I flunked you in history because you knew absolutely nothing""",The Catcher in the Rye,1,0
8729,2022-10-27,"2022 Second Chance competition week 2, final game 1.",Double Jeopardy,"(3, 1)",LAKES & RIVERS,27,"(400,)",False,"The oldest settlement in Paris, Ile de la Cite is in this river",the Seine,1,0
8729,2022-10-27,"2022 Second Chance competition week 2, final game 1.",Double Jeopardy,"(4, 1)",3 CONSONANTS IN A ROW,30,"(400,)",False,"Job of the person hired to renovate your house, perhaps after you find an architect",contractor,1,0
8729,2022-10-27,"2022 Second Chance competition week 2, final game 1.",Double Jeopardy,"(5, 1)",LEARNED LEAGUES,25,"(400,)",False,"""Gift of Fire"" is the official publication of the very high IQ society named for this fire-stealing Greek god",Prometheus,1,0
8729,2022-10-27,"2022 Second Chance competition week 2, final game 1.",Double Jeopardy,"(6, 1)",DANIEL RADCLIFFE COLLAGE,26,"(400,)",False,"(Daniel Radcliffe presents the clue.) In what didn't seem like the most obvious choice for me, I was handpicked by this musical parodist to portray him in the 2022 biopic spoof ""Weird""",Yankovic,1,0
8729,2022-10-27,"2022 Second Chance competition week 2, final game 1.",Double Jeopardy,"(1, 2)",OCTOBERFEST,18,"(800,)",False,In October 1936 power from this massive project began turning on lights & radios in the Western United States,the Hoover Dam,1,0
8729,2022-10-27,"2022 Second Chance competition week 2, final game 1.",Double Jeopardy,"(2, 2)",THE SECOND CHAPTER,3,"(8000,)",True,"Ralph says, ""We've been on the mountain top and seen water all around""",Lord of the Flies,0,1
8729,2022-10-27,"2022 Second Chance competition week 2, final game 1.",Double Jeopardy,"(3, 2)",LAKES & RIVERS,14,"(800,)",False,An 830-mile stretch of this river flows from Khartoum to Lake Nasser,the Nile,1,0
8729,2022-10-27,"2022 Second Chance competition week 2, final game 1.",Double Jeopardy,"(4, 2)",3 CONSONANTS IN A ROW,21,"(800,)",False,"If you see Socrates wearing a wristwatch in a play, it's one of these, partly from the Greek for ""time""",an anachronism,1,0
8729,2022-10-27,"2022 Second Chance competition week 2, final game 1.",Double Jeopardy,"(5, 2)",LEARNED LEAGUES,24,"(800,)",False,A national honor society for college seniors is named for this cap seen here,mortarboard,1,0
8729,2022-10-27,"2022 Second Chance competition week 2, final game 1.",Double Jeopardy,"(6, 2)",DANIEL RADCLIFFE COLLAGE,23,"(800,)",False,"(Daniel Radcliffe presents the clue.) I played one of the two title characters who were just bit players in Shakespeare in a 50th anniversary West End production of this Tom Stoppard play that’s set against the backdrop of ""Hamlet""",Rosencrantz and Guildenstern Are Dead,1,0
8729,2022-10-27,"2022 Second Chance competition week 2, final game 1.",Double Jeopardy,"(1, 3)",OCTOBERFEST,9,"(1200,)",False,"On Oct. 13, 1884 this London borough was adopted as the Prime Meridian of longitude for global Universal Time",Greenwich,1,0
8729,2022-10-27,"2022 Second Chance competition week 2, final game 1.",Double Jeopardy,"(2, 3)",THE SECOND CHAPTER,2,"(1200,)",False,"Chapter 2 concludes, ""Mr. Holmes, they were the footprints of a gigantic hound!""",The Hound of the Baskervilles,1,0
8729,2022-10-27,"2022 Second Chance competition week 2, final game 1.",Double Jeopardy,"(3, 3)",LAKES & RIVERS,13,"(1200,)",False,"The Parana & Uruguay Rivers join to form this ""silvery river"" estuary",the Río de la Plata,1,0
8729,2022-10-27,"2022 Second Chance competition week 2, final game 1.",Double Jeopardy,"(4, 3)",3 CONSONANTS IN A ROW,20,"(1200,)",False,This narrow passage connects 2 big bodies of water,a strait,1,0
8729,2022-10-27,"2022 Second Chance competition week 2, final game 1.",Double Jeopardy,"(5, 3)",LEARNED LEAGUES,11,"(1200,)",False,"Taking this ""Preliminary"" test is one step on the road to becoming a National Merit scholar",the PSAT,1,0
8729,2022-10-27,"2022 Second Chance competition week 2, final game 1.",Double Jeopardy,"(6, 3)",DANIEL RADCLIFFE COLLAGE,22,"(1200,)",False,"(Daniel Radcliffe presents the clue.) In the 2013 film “Kill Your Darlings”, I played this poet just starting at Columbia University and meeting Jack Kerouac & William S. Burroughs",Ginsberg,1,0
8729,2022-10-27,"2022 Second Chance competition week 2, final game 1.",Double Jeopardy,"(1, 4)",OCTOBERFEST,7,"(1600,)",False,"In the first united action by the 13 colonies (well, 9 of them), in Oct. 1765 delegates met to work to repeal this British law",the Stamp Act,1,0
8729,2022-10-27,"2022 Second Chance competition week 2, final game 1.",Double Jeopardy,"(2, 4)",THE SECOND CHAPTER,1,"(1600,)",False,"An emperor's soldiers provide ""An Exact Inventory of What We Found About the Body of the Man-Mountain""",Gulliver\'s Travels,0,3
8729,2022-10-27,"2022 Second Chance competition week 2, final game 1.",Double Jeopardy,"(3, 4)",LAKES & RIVERS,12,"(1600,)",False,"Named for a princess, this lake in Banff National Park is the pearl of the Canadian Rockies",Lake Louise,0,3
8729,2022-10-27,"2022 Second Chance competition week 2, final game 1.",Double Jeopardy,"(4, 4)",3 CONSONANTS IN A ROW,19,"(1600,)",False,The test seen here actually has 4 straight consonants but we're pretty sure you're human,CAPTCHA,1,0
8729,2022-10-27,"2022 Second Chance competition week 2, final game 1.",Double Jeopardy,"(5, 4)",LEARNED LEAGUES,10,"(1600,)",False,"Contestants in LearnedLeague, a web-based trivia game, are called these South American animals",llamas,1,0
8729,2022-10-27,"2022 Second Chance competition week 2, final game 1.",Double Jeopardy,"(6, 4)",DANIEL RADCLIFFE COLLAGE,17,"(1600,)",False,(Daniel Radcliffe presents the clue.) I got to sing on Broadway when I played J. Pierrepont Finch who climbs the corporate ladder at the World Wide Wicket Company in a 2011 production of this musical with a really long title,How to Succeed in Business Without Really Trying,1,0
8729,2022-10-27,"2022 Second Chance competition week 2, final game 1.",Double Jeopardy,"(1, 5)",OCTOBERFEST,6,"(2000,)",False,"Led by Orson Welles, the Mercury Theatre panicked the U.S. with a live radio dramatization of this work on October 30, 1938",The War of the Worlds,1,0
8729,2022-10-27,"2022 Second Chance competition week 2, final game 1.",Double Jeopardy,"(2, 5)",THE SECOND CHAPTER,15,"(2000,)",False,Milkman Dead falls in love with Hagar before seeing her face,Song of Solomon,1,0
8729,2022-10-27,"2022 Second Chance competition week 2, final game 1.",Double Jeopardy,"(3, 5)",LAKES & RIVERS,4,"(5000,)",True,"This river that flows 2,300 miles before emptying into the Caspian Sea is Europe's longest",the Volga,1,0
8729,2022-10-27,"2022 Second Chance competition week 2, final game 1.",Double Jeopardy,"(4, 5)",3 CONSONANTS IN A ROW,16,"(2000,)",False,This 6-letter word means to bud or germinate,sprout,1,0
8729,2022-10-27,"2022 Second Chance competition week 2, final game 1.",Double Jeopardy,"(5, 5)",LEARNED LEAGUES,5,"(2000,)",False,"A signature gold key represents this philosophical society founded on Dec. 5, 1776",Phi Beta Kappa,1,0
8729,2022-10-27,"2022 Second Chance competition week 2, final game 1.",Double Jeopardy,"(6, 5)",DANIEL RADCLIFFE COLLAGE,8,"(2000,)",False,"(Daniel Radcliffe presents the clue.) Um, I'd basically only done one small part in a school play when, at age 10, I played the title character, as a boy, in a BBC adaptation of this Dickens novel, the author’s own favorite child; the part really was magical as it led to me being cast as Harry Potter",David Copperfield,1,0
8729,2022-10-27,"2022 Second Chance competition week 2, final game 1.",Final Jeopardy,"(1, 1)",AMERICAN COMPOSERS,0,"(400, 3000, 0)",False,"He turned to opera with the 1903 work ""Guest of Honor"", likely inspired by Booker T. Washington's dinner at the White House",(Scott) Joplin,2,1
