epNum,airDate,extra_info,round_name,coord,category,order,value,daily_double,question,answer,correctAttempts,wrongAttempts
876,1988-05-30,,Jeopardy,"(1, 1)",U.S. STATES,1,"(100,)",False,"Ironically, this little state's official name is the longest of any U.S. state",Rhode Island (and Providence Plantations),1,0
876,1988-05-30,,Jeopardy,"(2, 1)",TV INITIALS,4,"(100,)",False,"In the new series ""T and T"", he's one of the ""T""s",Mr. T,1,0
876,1988-05-30,,Jeopardy,"(3, 1)",THE 1st TIME SINCE...,16,"(100,)",False,"For the 1st time since 1957, the AFL-CIO has some control over this union, having let it back into the fold",the Teamsters,1,0
876,1988-05-30,,Jeopardy,"(4, 1)",NORMAN ROCKWELL,2,"(100,)",False,"He got his 1st commission, before age 16, to paint these holiday greetings",Christmas cards,1,0
876,1988-05-30,,Jeopardy,"(6, 1)","GIVE ME A ""BREAK""",21,"(100,)",False,A wave that dashes into foam,a breaker,1,0
876,1988-05-30,,Jeopardy,"(1, 2)",U.S. STATES,5,"(200,)",False,The biggest earthquake ever to hit the U.S. happened in 1964 in this state,Alaska,1,0
876,1988-05-30,,Jeopardy,"(2, 2)",TV INITIALS,9,"(200,)",False,"It's what the ""A"" & the ""E"" stand for in the A & E cable network",arts & entertainment,1,0
876,1988-05-30,,Jeopardy,"(3, 2)",THE 1st TIME SINCE...,17,"(200,)",False,1987 was the 1st year since this one that the Dow Jones plunged more than 12.8% in one day,1929,1,1
876,1988-05-30,,Jeopardy,"(4, 2)",NORMAN ROCKWELL,3,"(200,)",False,"Around age 17, he made an oath never to do advertising art & signed it in this substance",blood,1,1
876,1988-05-30,,Jeopardy,"(6, 2)","GIVE ME A ""BREAK""",22,"(200,)",False,Someone who wants to transmit on the CB channel you're already on,a breaker,1,0
876,1988-05-30,,Jeopardy,"(1, 3)",U.S. STATES,6,"(500,)",True,2 of the 3 states that have only 4 letters in their name,"(2 of) Ohio, Utah & Iowa",0,1
876,1988-05-30,,Jeopardy,"(2, 3)",TV INITIALS,10,"(300,)",False,"The ""CC"" that flashes on your screen at the beginning of a program indicates the show is this",closed captioned (for the deaf or hearing impaired),1,0
876,1988-05-30,,Jeopardy,"(3, 3)",THE 1st TIME SINCE...,18,"(300,)",False,"It was opened on live TV by Telly Savalas October 28, 1987, the 1st time, they said since April 1912",the vault of the Titanic,1,0
876,1988-05-30,,Jeopardy,"(4, 3)",NORMAN ROCKWELL,13,"(300,)",False,"In 1913, at age 19, he was appointed art director of this scout magazine",Boys\' Life,1,0
876,1988-05-30,,Jeopardy,"(6, 3)","GIVE ME A ""BREAK""",23,"(300,)",False,Dawn,daybreak,1,0
876,1988-05-30,,Jeopardy,"(1, 4)",U.S. STATES,7,"(400,)",False,The almost perfect arc in Delaware's border separates it from this state,Pennsylvania,0,3
876,1988-05-30,,Jeopardy,"(2, 4)",TV INITIALS,11,"(400,)",False,"On ""Simon & Simon"", A.J. was named for this president",Andrew Jackson,1,0
876,1988-05-30,,Jeopardy,"(3, 4)",THE 1st TIME SINCE...,19,"(400,)",False,"For the 1st time since 1980's ""The Mirror Crack'd"", she's starring in a theatrical film, ""The young Toscanini""",Elizabeth Taylor,1,0
876,1988-05-30,,Jeopardy,"(4, 4)",NORMAN ROCKWELL,14,"(400,)",False,"The 1st was dated May 20, 1916",his first Saturday Evening Post cover,1,0
876,1988-05-30,,Jeopardy,"(6, 4)","GIVE ME A ""BREAK""",24,"(400,)",False,"Neal Sedaka's 1962 #1 hit that gave us the immortal phrase ""Comma comma, down-doo-be-doo down down""","""Breaking Up Is Hard to Do""",1,0
876,1988-05-30,,Jeopardy,"(1, 5)",U.S. STATES,8,"(500,)",False,"This state boasts the 1st U.S. National Monument, National Forest, & National Park",Wyoming,0,3
876,1988-05-30,,Jeopardy,"(2, 5)",TV INITIALS,12,"(500,)",False,The lead character in this 1979-81 comedy adventure series was Billie Joe McKay,B.J. and the Bear,1,0
876,1988-05-30,,Jeopardy,"(3, 5)",THE 1st TIME SINCE...,20,"(500,)",False,He played his 1st recital since 1978 at the state dinner the Reagans threw for the Gorbachevs,Van Cliburn,1,1
876,1988-05-30,,Jeopardy,"(4, 5)",NORMAN ROCKWELL,15,"(500,)",False,Rockwell played a minor role in the 1966 remake of this 1939 John Wayne film classic,Stagecoach,1,0
876,1988-05-30,,Jeopardy,"(6, 5)","GIVE ME A ""BREAK""",25,"(500,)",False,At least 3 different movies about prison escapes share this title,Breakout,1,0
876,1988-05-30,,Double Jeopardy,"(1, 1)",MILITARY HISTORY,8,"(200,)",False,"During WWII the ""Spitfire"" was probably the most famous fighter of this military service",the RAF (Royal Air Force),1,1
876,1988-05-30,,Double Jeopardy,"(2, 1)",LITERARY JOHNS,2,"(200,)",False,"John Steinbeck often used this, his native state, as the setting for his novels & stories",California,1,0
876,1988-05-30,,Double Jeopardy,"(3, 1)",SAINTS,11,"(200,)",False,Name of both the Bishop of Hippo & the oldest city in the United States,St. Augustine,1,0
876,1988-05-30,,Double Jeopardy,"(4, 1)",COMPOSERS,1,"(200,)",False,Franz Liszt had at least 2 daughters & a son without ever doing this,getting married,1,0
876,1988-05-30,,Double Jeopardy,"(5, 1)",COLORS,12,"(200,)",False,Levi Strauss began marketing denim jeans in this color in the 1850s,blue,1,0
876,1988-05-30,,Double Jeopardy,"(6, 1)",CLICHES,15,"(200,)",False,"It means a frank conversation, not necessarily between cardiologists",a heart-to-heart talk,1,0
876,1988-05-30,,Double Jeopardy,"(1, 2)",MILITARY HISTORY,9,"(400,)",False,"Trench warfare, famous from WWI, was sued in this U.S. war over 50 years earlier",the Civil War,1,0
876,1988-05-30,,Double Jeopardy,"(2, 2)",LITERARY JOHNS,4,"(400,)",False,"John Bunyon allegory whose complete title includes ""From This World to That Which Is to Come""",The Pilgrim\'s Progress,1,0
876,1988-05-30,,Double Jeopardy,"(3, 2)",SAINTS,28,"(400,)",False,"Yes, they're the sisters of Saint Faith, & they're saints, too",Hope & Charity,1,0
876,1988-05-30,,Double Jeopardy,"(4, 2)",COMPOSERS,3,"(400,)",False,His brother Ira provided the lyrics for many of his songs,George Gershwin,1,0
876,1988-05-30,,Double Jeopardy,"(5, 2)",COLORS,13,"(400,)",False,"According to the song, it's this ""they say, on the far side of the hill""",green green,1,0
876,1988-05-30,,Double Jeopardy,"(6, 2)",CLICHES,20,"(400,)",False,"Meaning ""stay calm"", it probably comes from a man's tendency to remove clothing before a fight",keep your shirt on,0,3
876,1988-05-30,,Double Jeopardy,"(1, 3)",MILITARY HISTORY,10,"(600,)",False,"From Italian for ""large tube"", England's Edward III introduced these pieces in 1346 at Battle of Crecy",cannons,1,0
876,1988-05-30,,Double Jeopardy,"(2, 3)",LITERARY JOHNS,5,"(600,)",False,"His 2nd trilogy was called ""District of Columbia"", but he's more famous for his 1st, ""U.S.A.""",John Dos Passos,1,0
876,1988-05-30,,Double Jeopardy,"(3, 3)",SAINTS,27,"(600,)",False,A tradition that he picks up the souls of the dead may account for the boat rowing song,Saint Michael,1,0
876,1988-05-30,,Double Jeopardy,"(4, 3)",COMPOSERS,22,"(600,)",False,"Jazz composer whose group's name included the year '65, then '66, then '77, then '88",Sérgio Mendes,1,0
876,1988-05-30,,Double Jeopardy,"(5, 3)",COLORS,14,"(600,)",False,Color of the storage root of a sugar beet,white,0,3
876,1988-05-30,,Double Jeopardy,"(6, 3)",CLICHES,21,"(600,)",False,This name comes from an 18th c. tale of a girl who went around showing everyone her new footwear,Goody Two-Shoes,0,3
876,1988-05-30,,Double Jeopardy,"(1, 4)",MILITARY HISTORY,16,"(500,)",True,The 2 methods of warfare which were prohibited by the Geneva Protocol of 1925,chemical warfare & biological warfare,1,0
876,1988-05-30,,Double Jeopardy,"(2, 4)",LITERARY JOHNS,6,"(800,)",False,"""Polly"" was this poet-playwright's sequel to ""The Beggar's Opera""",John Gay,0,3
876,1988-05-30,,Double Jeopardy,"(3, 4)",SAINTS,26,"(800,)",False,A confession: The abbey now at Westminster isn't the one he consecrated in 1065,King Edward the Confessor,0,3
876,1988-05-30,,Double Jeopardy,"(4, 4)",COMPOSERS,29,"(1000,)",True,"18th-century composer on whose composition the following, a 1965 No. 2 hit, is based:""How gentle is the rain /That falls softly on the meadow /Birds high up in the trees /Serenade the flowers with their melodies...""",Johann Sebastian Bach (Minuet in G),0,1
876,1988-05-30,,Double Jeopardy,"(5, 4)",COLORS,18,"(800,)",False,Neiman-Marcus ha stopped selling garbage bags in this color which hospitals use to denote infectious waste,red,1,0
876,1988-05-30,,Double Jeopardy,"(6, 4)",CLICHES,23,"(800,)",False,"Greek for ""the many"" it refers to the common folk or the masses",the hoi polloi,0,3
876,1988-05-30,,Double Jeopardy,"(1, 5)",MILITARY HISTORY,17,"(1000,)",False,"At the Battle of Marathon in 490 B.C., the Athenians defeated them",the Persians,1,0
876,1988-05-30,,Double Jeopardy,"(2, 5)",LITERARY JOHNS,7,"(1000,)",False,"He won a Pulitzer Prize for his short stories 2 years after he wrote ""Falconer""",John Cheever,1,0
876,1988-05-30,,Double Jeopardy,"(3, 5)",SAINTS,25,"(1000,)",False,This man got Jesus' body from Pilate & laid it in his own tomb,Joseph of Arimathea,1,0
876,1988-05-30,,Double Jeopardy,"(5, 5)",COLORS,19,"(1000,)",False,"The 1st postage stamp in England, issues May 1, 1840, is known by this colorful name",the Penny Black,0,3
876,1988-05-30,,Double Jeopardy,"(6, 5)",CLICHES,24,"(1000,)",False,Chairman Mao is said to have coined this phrase which means something ineffective,paper tiger,0,3
876,1988-05-30,,Final Jeopardy,"(1, 1)",1988,0,"(1700, 3850, 3501)",False,"At the opening ceremonies for the 1988 Winter Olympics, ""Happy Birthday"" was played for this country",Australia,2,1
