epNum,airDate,extra_info,round_name,coord,category,order,value,daily_double,question,answer,correctAttempts,wrongAttempts
877,1988-05-31,,Jeopardy,"(1, 1)",AMERICAN RIVERS,1,"(100,)",False,"It's California's ""capital"" waterway",Sacramento River,1,0
877,1988-05-31,,Jeopardy,"(2, 1)",THE '60s,10,"(100,)",False,"In 1964, Congress did not declare war on North Vietnam but did approve a national war on this",poverty,1,0
877,1988-05-31,,Jeopardy,"(3, 1)",SELF-DEFENSE,21,"(100,)",False,"In some states, it's a misdemeanor to use this chemical spray without a permit",mace,1,0
877,1988-05-31,,Jeopardy,"(4, 1)",MOVIE TRIVIA,15,"(100,)",False,"In movie titles, artsy area that followed ""Next Stop"" & ""The Pope of""",Greenwich Village,1,0
877,1988-05-31,,Jeopardy,"(5, 1)",SPORTS,2,"(100,)",False,South African golfer noted for wearing black & assisting black golfers,Gary Player,1,0
877,1988-05-31,,Jeopardy,"(6, 1)",HOMOPHONES,22,"(100,)",False,"A bunch of money to get you out of jail, or a bunch of hay",bail/bale,1,0
877,1988-05-31,,Jeopardy,"(1, 2)",AMERICAN RIVERS,7,"(200,)",False,Lake Powell was created by damming the waters of this river,Colorado,0,3
877,1988-05-31,,Jeopardy,"(2, 2)",THE '60s,11,"(200,)",False,"1963 event at which Dr. Martin Luther King Jr. made his famous ""I Have a Dream"" speech",March on Washington,1,0
877,1988-05-31,,Jeopardy,"(3, 2)",SELF-DEFENSE,24,"(200,)",False,"Of yelling ""help"", ""rape"", or ""fire"", 1 that generally brings help more readily than the other 2",fire,1,0
877,1988-05-31,,Jeopardy,"(4, 2)",MOVIE TRIVIA,16,"(200,)",False,"At the end of this film, the ghosts of Cathy & Heathcliff are united on the moors forever",Wuthering Heights,1,0
877,1988-05-31,,Jeopardy,"(5, 2)",SPORTS,3,"(200,)",False,Only NBA team which currently plays its home games in Maryland,(Washington) Bullets,1,0
877,1988-05-31,,Jeopardy,"(6, 2)",HOMOPHONES,23,"(200,)",False,A moan for Moby,wail/whale,1,0
877,1988-05-31,,Jeopardy,"(1, 3)",AMERICAN RIVERS,8,"(300,)",False,"Hells Canyon, deepest canyon in U.S. has been carved by the Snake River in this state",Idaho,1,0
877,1988-05-31,,Jeopardy,"(2, 3)",THE '60s,12,"(300,)",False,"In 1961, while dealing with the Congo crisis, this U.N. Sec'y-General died in a plane crash",Dag Hammarskjöld,1,0
877,1988-05-31,,Jeopardy,"(3, 3)",SELF-DEFENSE,28,"(300,)",False,"In India circa 400 B.C., monks of this religion used a form of karate",Buddhism,1,2
877,1988-05-31,,Jeopardy,"(4, 3)",MOVIE TRIVIA,17,"(300,)",False,Oscar-winner Jane Darwell's last role was as The Bird Woman in this Julie Andrews film,Mary Poppins,1,0
877,1988-05-31,,Jeopardy,"(5, 3)",SPORTS,4,"(300,)",False,"In last bareknuckle championship bout, Jake Kilrain went 75 rounds against this man",John L. Sullivan,0,3
877,1988-05-31,,Jeopardy,"(6, 3)",HOMOPHONES,25,"(300,)",False,"To stand by, or a measure of heaviness",wait/weight,1,0
877,1988-05-31,,Jeopardy,"(1, 4)",AMERICAN RIVERS,9,"(400,)",False,The research corridor along the upper Rio Grande gives this state one of our country's highest % of Ph.D.s,New Mexico,1,0
877,1988-05-31,,Jeopardy,"(2, 4)",THE '60s,13,"(400,)",False,"Released by the Soviets in '62, this U-2 pilot went on to become a helicopter traffic reporter",Gary Powers,1,0
877,1988-05-31,,Jeopardy,"(3, 4)",SELF-DEFENSE,29,"(400,)",False,"Because it can go in several directions & is hard to block, this joint is the best upper body weapon",elbow,1,0
877,1988-05-31,,Jeopardy,"(4, 4)",MOVIE TRIVIA,18,"(400,)",False,"It's the heavenly body Roddy McDowall fought a ""Battle For"" in 1973",the Planet of the Apes,1,0
877,1988-05-31,,Jeopardy,"(5, 4)",SPORTS,5,"(400,)",False,"Though the 1956 Summer Olympics were held in this city, equestrian events were in Stockholm, about 10,000 miles away",Melbourne,1,0
877,1988-05-31,,Jeopardy,"(6, 4)",HOMOPHONES,26,"(400,)",False,Wander aimlessly to a world capital,roam/Rome,1,0
877,1988-05-31,,Jeopardy,"(1, 5)",AMERICAN RIVERS,20,"(200,)",True,The entire northern boundary of this southern state is formed by the Ohio River,Kentucky,1,0
877,1988-05-31,,Jeopardy,"(2, 5)",THE '60s,14,"(500,)",False,"In 1960, this South American country moved its capital",Brazil,1,0
877,1988-05-31,,Jeopardy,"(3, 5)",SELF-DEFENSE,30,"(500,)",False,Kodokan judo was introduced to the U.S. by this President who studied it,Theodore Roosevelt,1,0
877,1988-05-31,,Jeopardy,"(4, 5)",MOVIE TRIVIA,19,"(500,)",False,"People call him ""Lou Bamba"" since he starred in ""La Bamba""",Lou Diamond Phillips,1,0
877,1988-05-31,,Jeopardy,"(5, 5)",SPORTS,6,"(500,)",False,This Yankee 1st baseman set a Major League record in '87 hitting 6 grand slam home runs,Don Mattingly,1,0
877,1988-05-31,,Jeopardy,"(6, 5)",HOMOPHONES,27,"(500,)",False,"All the gold you gathered up, or a golden group known for marauding",hoard/horde,0,3
877,1988-05-31,,Double Jeopardy,"(1, 1)",FEATHERED FRIENDS,24,"(200,)",False,This bird got its name because its erectile crest looked like the pen behind the ear of a clerk,secretary bird,0,3
877,1988-05-31,,Double Jeopardy,"(2, 1)",DANCE,12,"(200,)",False,"Czechoslovakia, Germany & this country all claim to have originated the polka",Poland,1,0
877,1988-05-31,,Double Jeopardy,"(3, 1)",WRITERS,1,"(200,)",False,"George Kelly, who wrote the play ""Craig's Wife"" was this princess' uncle",Princess Grace Kelly,1,0
877,1988-05-31,,Double Jeopardy,"(4, 1)",THE BIBLE,6,"(200,)",False,"Traditionally, a Gideon Bible is the version ""authorized"" in 1611 by this person",King James,1,0
877,1988-05-31,,Double Jeopardy,"(5, 1)",WORLD POLITICS,19,"(200,)",False,"In 1952, he was the dominant figure in the officer's coup that overthrew King Farouk",General Nasser,1,0
877,1988-05-31,,Double Jeopardy,"(6, 1)","STARTS WITH ""FL""",7,"(200,)",False,"An oddball, or a piece of his cereal",flake,1,0
877,1988-05-31,,Double Jeopardy,"(2, 2)",DANCE,15,"(400,)",False,"Banned in some locales, this dance fad was featured in ""They Shoot Horses, Don't They?""",dance marathon,1,0
877,1988-05-31,,Double Jeopardy,"(3, 2)",WRITERS,2,"(400,)",False,"Queen Victoria made this ""Lord""ly poet the Baron of Aldworth and Farringford",Alfred Lord Tennyson,1,1
877,1988-05-31,,Double Jeopardy,"(4, 2)",THE BIBLE,13,"(400,)",False,"As the Lord dried up the Red Sea for Moses, he dried up this river for Joshua",River Jordan,1,0
877,1988-05-31,,Double Jeopardy,"(5, 2)",WORLD POLITICS,20,"(400,)",False,"This Italian political movement was founded in 1919 under the slogan ""Revolution & Fatherland""",fascism,1,0
877,1988-05-31,,Double Jeopardy,"(6, 2)","STARTS WITH ""FL""",8,"(400,)",False,Term for a sheet of ice adrift on water,floe,1,0
877,1988-05-31,,Double Jeopardy,"(1, 3)",FEATHERED FRIENDS,27,"(1400,)",True,Color of the bird in the title of the following:,yellow,0,1
877,1988-05-31,,Double Jeopardy,"(2, 3)",DANCE,16,"(600,)",False,Time signature used for the modern foxtrot,4/4,0,3
877,1988-05-31,,Double Jeopardy,"(3, 3)",WRITERS,3,"(600,)",True,"In 1807, Chief Justice John Marshall finished his 5-volume biography of this President",George Washington,1,0
877,1988-05-31,,Double Jeopardy,"(4, 3)",THE BIBLE,14,"(600,)",False,"Giuseppe Verdi's opera ""Nabucco"" is based on the biblical story of this king",Nebuchadnezzar,1,0
877,1988-05-31,,Double Jeopardy,"(5, 3)",WORLD POLITICS,21,"(600,)",False,"U.S. Sec'y of State Cordell Hull oversaw the ""Good Neighbor Policy"" aimed at this group of countries",Latin America (Central America & South America accepted),1,0
877,1988-05-31,,Double Jeopardy,"(6, 3)","STARTS WITH ""FL""",9,"(600,)",False,"An iris, as depicted in heraldry",fleur-de-lis,1,0
877,1988-05-31,,Double Jeopardy,"(2, 4)",DANCE,17,"(800,)",False,"Regarded as father of Russian classical ballet, Marius Petipa was actually from this w. European country",France,0,3
877,1988-05-31,,Double Jeopardy,"(3, 4)",WRITERS,4,"(800,)",False,"He won a Pulitzer Prize posthumously for his last novel, ""The Reivers""",William Faulkner,1,0
877,1988-05-31,,Double Jeopardy,"(4, 4)",THE BIBLE,25,"(800,)",False,"Completes the line from Ecclesiastes, ""He that diggeth a pit...""",shall fall into it,0,3
877,1988-05-31,,Double Jeopardy,"(5, 4)",WORLD POLITICS,22,"(800,)",False,"Born in S. Africa, this former British army officer was Israeli Foreign Minister from 1966-74",Abba Eban,0,3
877,1988-05-31,,Double Jeopardy,"(6, 4)","STARTS WITH ""FL""",10,"(800,)",False,A bugle with valves,flugelhorn,1,0
877,1988-05-31,,Double Jeopardy,"(1, 5)",FEATHERED FRIENDS,28,"(1000,)",False,"While secondary feathers act like a plane's wing, primary feathers serve as this plane part",propeller,0,3
877,1988-05-31,,Double Jeopardy,"(2, 5)",DANCE,18,"(1000,)",False,You won't find Jacob's Pillow on Marley's bed; it's a dance festival site in this New England state,Massachusetts,1,0
877,1988-05-31,,Double Jeopardy,"(3, 5)",WRITERS,5,"(1000,)",False,"Nonsense poet who said of himself ""His visage is more or less hideous, his beard it resembles a wig""",Edward Lear,0,3
877,1988-05-31,,Double Jeopardy,"(4, 5)",THE BIBLE,26,"(1000,)",False,"While Peter was a fisherman by trade, this New Testament apostle was a tentmaker",St. Paul,0,3
877,1988-05-31,,Double Jeopardy,"(5, 5)",WORLD POLITICS,23,"(1000,)",False,Economist & chancellor who was to many the symbol of post-WWII West German economic recovery,Ludwig Erhard,0,3
877,1988-05-31,,Double Jeopardy,"(6, 5)","STARTS WITH ""FL""",11,"(1000,)",False,A fleet of small warships,flotilla,1,0
877,1988-05-31,,Final Jeopardy,"(1, 1)",BUSINESS & INDUSTRY,0,"(750, 2300, 3001)",False,More than half the free world's commercial jetliners have been assembled in this U.S. state,Washington,1,2
