epNum,airDate,extra_info,round_name,coord,category,order,value,daily_double,question,answer,correctAttempts,wrongAttempts
890,1988-06-17,,Jeopardy,"(1, 1)",THE CIVIL WAR,8,"(100,)",False,"Once the Union controlled this river, Lincoln said, ""The father of waters again goes unvexed to the sea""",the Mississippi,0,0
890,1988-06-17,,Jeopardy,"(2, 1)",SHIPS,21,"(100,)",False,"15th century admiral Cheng Ho commanded a fleet of 62 of these boats, all over 500 feet long",junks,0,0
890,1988-06-17,,Jeopardy,"(3, 1)",GAME COOKERY,25,"(100,)",False,Remove this carefully from wild game & never use it to grease pans because it gets rancid quickly,the fat,0,0
890,1988-06-17,,Jeopardy,"(4, 1)",CELEBRITY RELATIVES,7,"(100,)",False,He's the nephew of playwright Archibald MacLeish & the grandson of FDR's 1st Sec'y of War. Geo. Dern,Bruce Dern,0,0
890,1988-06-17,,Jeopardy,"(5, 1)",CITY NICKNAMES,1,"(100,)",False,"Nickname popularized in the '70s to show the world that NYC has ""a new & brightly polished image""",The Big Apple,0,0
890,1988-06-17,,Jeopardy,"(6, 1)","""WORLD""LY SONGS",2,"(100,)",False,"She ""picks my ties out, eats my candy, drinks my brandy""","""The Most Beautiful Girl In The World""",0,0
890,1988-06-17,,Jeopardy,"(1, 2)",THE CIVIL WAR,9,"(200,)",False,"Upon the death of Lincoln, Secretary of War Stanton said, ""Now he belongs to"" these",the ages,0,0
890,1988-06-17,,Jeopardy,"(2, 2)",SHIPS,22,"(200,)",False,The U.S. entered WWI some 2 years after this British liner was sunk by a German U-boat,the Lusitania,0,0
890,1988-06-17,,Jeopardy,"(3, 2)",GAME COOKERY,26,"(200,)",False,"Bear meat should be well-cooked, because it, like pork, can carry the parasite that causes this disease",trichinosis,0,0
890,1988-06-17,,Jeopardy,"(4, 2)",CELEBRITY RELATIVES,10,"(200,)",False,"Late bandleader whose father was the mayor of Santiago, Cuba",Desi Arnaz,0,0
890,1988-06-17,,Jeopardy,"(5, 2)",CITY NICKNAMES,17,"(200,)",False,"""Baghdad by the Bay"", according to Herb Caen",San Francisco,0,0
890,1988-06-17,,Jeopardy,"(6, 2)","""WORLD""LY SONGS",3,"(200,)",False,"The Bee Gees' 1st charted hit of 1972, & welcome to it","""My World""",0,0
890,1988-06-17,,Jeopardy,"(1, 3)",THE CIVIL WAR,14,"(300,)",False,"In this northern battle, Union troops on Cemetery Ridge faced Confederates on Seminary Ridge",Gettysburg,0,0
890,1988-06-17,,Jeopardy,"(2, 3)",SHIPS,23,"(300,)",False,"The Susan Constant, the Godspeed & the Discovery carried the 1st Englishmen to this settlement",Jamestown,0,0
890,1988-06-17,,Jeopardy,"(3, 3)",GAME COOKERY,28,"(300,)",False,"If you want to cook these arboreal rodents, the gray ones are preferred for eating",squirrels,0,0
890,1988-06-17,,Jeopardy,"(4, 3)",CELEBRITY RELATIVES,11,"(300,)",False,"Her dad Billy was a clown with Barnum & Bailey Circus, but she was a witch in ""The Wizard of Oz""",Billie Burke,0,0
890,1988-06-17,,Jeopardy,"(5, 3)",CITY NICKNAMES,18,"(300,)",False,"It's been called ""America's most interesting city"", as well as ""Gumbo City""",New Orleans,0,0
890,1988-06-17,,Jeopardy,"(6, 3)","""WORLD""LY SONGS",4,"(300,)",False,"In song, Helen Reddy said sometimes life feels like this","""You And Me Against The World""",0,0
890,1988-06-17,,Jeopardy,"(1, 4)",THE CIVIL WAR,15,"(400,)",False,"Pre-Civil War president who in 1865, wrote the book ""The Administration on the Eve of the Rebellion""",Buchanan,0,0
890,1988-06-17,,Jeopardy,"(2, 4)",SHIPS,24,"(400,)",False,"In 1938, this famous passenger liner crossed the Atlantic in just 3 days, 20 hrs. & 42 mins.",Queen Mary,0,0
890,1988-06-17,,Jeopardy,"(4, 4)",CELEBRITY RELATIVES,12,"(400,)",False,"This ""fair lady"" is the daughter of a Dutch baroness & granddaughter of a governor of Dutch Guiana",Audrey Hepburn,0,0
890,1988-06-17,,Jeopardy,"(5, 4)",CITY NICKNAMES,19,"(400,)",False,"""The Cradle of the Confederacy""",Montgomery,0,0
890,1988-06-17,,Jeopardy,"(6, 4)","""WORLD""LY SONGS",5,"(500,)",True,"Less than 2 months after ""We Are The World"" hit No. 1, this song topped the charts:""Welcome to your life / There's no turning back / Even while we...""","""Everybody Wants To Rule The World""",0,0
890,1988-06-17,,Jeopardy,"(1, 5)",THE CIVIL WAR,16,"(500,)",False,"It's said Lincoln's firing Gen. G. McClellan in 1862 caused McClellan, a Democrat, to do this in 1864",run for president,0,0
890,1988-06-17,,Jeopardy,"(2, 5)",SHIPS,27,"(500,)",False,"Name of the U.S. Navy ship hit in an Iraqi missile attack May 17, 1987",the USS Stark,0,0
890,1988-06-17,,Jeopardy,"(4, 5)",CELEBRITY RELATIVES,13,"(500,)",False,Jayne & Audrey Meadows were born in this country where their parents were missionaries,China,0,0
890,1988-06-17,,Jeopardy,"(5, 5)",CITY NICKNAMES,20,"(500,)",False,"""The Gateway to the West""",St. Louis,0,0
890,1988-06-17,,Jeopardy,"(6, 5)","""WORLD""LY SONGS",6,"(500,)",False,"Though one of the greatest of country artists, Eddy Arnold had only this song break into the Pop Top 10","""Make The World Go Away""",0,0
890,1988-06-17,,Double Jeopardy,"(1, 1)",1962,1,"(200,)",False,"He re-signed with the Yankees for $72,500, almost twice what he got in 1961, when he hit 61 homers",Roger Maris,0,0
890,1988-06-17,,Double Jeopardy,"(2, 1)",ANTIQUES,21,"(200,)",False,"Originally the word ""antique"", meaning old, referred to these 2 classical Mediterranean cultures",Greek & Roman,0,0
890,1988-06-17,,Double Jeopardy,"(3, 1)",BODIES OF WATER,8,"(200,)",False,Oregon's Willamette is one of the few U.S. rivers that flows in this compass direction,north,0,0
890,1988-06-17,,Double Jeopardy,"(4, 1)",PHYSICS,14,"(200,)",False,"If a substance experiences a change of state, it doesn't mean it moved to Texas, but did this","changes from liquid to solid (solid to liquid, solid to gas)",0,0
890,1988-06-17,,Double Jeopardy,"(5, 1)",POETRY,6,"(200,)",False,"In ""Idylls of the King"", Tennyson calls her ""fairest of all flesh on earth""",Guinevere,0,0
890,1988-06-17,,Double Jeopardy,"(6, 1)",PARTS OF SPEECH,13,"(200,)",False,"Of cooks, cooking, or cooked, the form which cannot act as a noun",cooked,0,0
890,1988-06-17,,Double Jeopardy,"(1, 2)",1962,2,"(400,)",False,"He published the memoir ""Six Crises""; if he had waited, he could have added a few more",Richard Nixon,0,0
890,1988-06-17,,Double Jeopardy,"(2, 2)",ANTIQUES,22,"(400,)",False,"It's said the early Chinese drank their tea lukewarm, so early teacups lack these",handles,0,0
890,1988-06-17,,Double Jeopardy,"(3, 2)",BODIES OF WATER,9,"(400,)",False,This Canadian province contains both Lake Winnipeg & Lake Winnipegosis,Manitoba,0,0
890,1988-06-17,,Double Jeopardy,"(4, 2)",PHYSICS,15,"(400,)",False,"In the 2nd cent. B.C., he found the weight of a floating body equals that of the water it displaces",Archimedes,0,0
890,1988-06-17,,Double Jeopardy,"(5, 2)",POETRY,7,"(400,)",False,"Since it was written in the 1st person, he's regarded as the leading character in ""The Divine Comedy""",Dante,0,0
890,1988-06-17,,Double Jeopardy,"(6, 2)",PARTS OF SPEECH,17,"(400,)",False,Type of punctuation generally following an interjection which expresses strong emotion,an exclamation,0,0
890,1988-06-17,,Double Jeopardy,"(1, 3)",1962,3,"(600,)",False,"The theme of the World's Fair was ""Man in the Space Age"" & its symbol was this",the Space Needle,0,0
890,1988-06-17,,Double Jeopardy,"(2, 3)",ANTIQUES,23,"(600,)",False,"Called ""long case"" or ""tall"" clocks by antique dealers, they're popularly known as this",grandfather clocks,0,0
890,1988-06-17,,Double Jeopardy,"(3, 3)",BODIES OF WATER,10,"(600,)",False,Largest U.S. naval recruit training center is not on the ocean but on the shore of this Great Lake,Lake Michigan,0,0
890,1988-06-17,,Double Jeopardy,"(4, 3)",PHYSICS,16,"(600,)",False,The term for the tendency of a material to return to its original shape after being deformed,elasticity,0,0
890,1988-06-17,,Double Jeopardy,"(5, 3)",POETRY,18,"(600,)",False,"Byron based a poem on the true story of a man who spent years as the ""Prisoner of"" this castle",Chillon,0,0
890,1988-06-17,,Double Jeopardy,"(6, 3)",PARTS OF SPEECH,26,"(100,)",True,"This part of speech comes from the Latin ""to add to"", which is its function",an adjective (a conjunction),0,0
890,1988-06-17,,Double Jeopardy,"(1, 4)",1962,4,"(800,)",False,A Senate subcommittee held hearings on the dealings of this Texas financier,Billy Sol Estes,0,0
890,1988-06-17,,Double Jeopardy,"(2, 4)",ANTIQUES,24,"(800,)",False,"In 1968, the Corp. of London sold the McCulloch Oil Co. this, which Guinness calls the largest antique ever sold",the London Bridge,0,0
890,1988-06-17,,Double Jeopardy,"(3, 4)",BODIES OF WATER,11,"(800,)",False,Venezuela's oil production is centered on this lake,Lake Maracaibo,0,0
890,1988-06-17,,Double Jeopardy,"(5, 4)",POETRY,19,"(800,)",False,"Wordsworth wrote, ""My heart leaps up when I behold"" 1 of these ""in the sky""",a rainbow,0,0
890,1988-06-17,,Double Jeopardy,"(1, 5)",1962,5,"(1000,)",False,"Named premier by de Gaulle April 14, he resigned October 6, & was reappointed November 27",Georges Pompidou,0,0
890,1988-06-17,,Double Jeopardy,"(2, 5)",ANTIQUES,25,"(1000,)",False,"The highest price paid for one of these machines was $6,450 for an 1886 Daw & Tait model",a typewriter,0,0
890,1988-06-17,,Double Jeopardy,"(3, 5)",BODIES OF WATER,12,"(1000,)",True,"The 2 countries, 1 coastal, 1 landlocked, that share Lake Titicaca, the world's highest large lake",Peru & Bolivia,0,0
890,1988-06-17,,Double Jeopardy,"(5, 5)",POETRY,20,"(1000,)",False,"Child bride who ended up in ""her tomb by the sounding sea""",Annabel Lee,0,0
890,1988-06-17,,Final Jeopardy,"(1, 1)",CINEMA,0,(),False,"The last film Cecil B. De Mille directed, it was a partial remake of a silent epic he'd directed 33 years before",The Ten Commandments,0,0
