epNum,airDate,extra_info,round_name,coord,category,order,value,daily_double,question,answer,correctAttempts,wrongAttempts
9031,2024-02-05,2024 Champions Wildcard Group 2 quarterfinal game 1.,Jeopardy,"(1, 1)",HISTORICAL AMERICAN CURRENCY,24,"(200,)",False,"It still had ""Bay Colony"" in its name when it issued America's first paper money in 1690 to help fund military expeditions",Massachusetts,0,0
9031,2024-02-05,2024 Champions Wildcard Group 2 quarterfinal game 1.,Jeopardy,"(2, 1)","2 ACTORS, ONE TV SHOW",8,"(200,)",False,Allison Janney & Dulé Hill did some walking & talking in the White House on this NBC drama,The West Wing,0,0
9031,2024-02-05,2024 Champions Wildcard Group 2 quarterfinal game 1.,Jeopardy,"(3, 1)",LAKES & RIVERS,27,"(200,)",False,"More than 12,000 feet up Ecuador's Lake Quilotoa occupies one of these remnants, formed about 800 years ago",a (volcanic) crater,0,0
9031,2024-02-05,2024 Champions Wildcard Group 2 quarterfinal game 1.,Jeopardy,"(4, 1)","THE ""ARE"" YOU BREATHE",23,"(200,)",False,This type of drum is named for the strings often made of coiled wire that stretch across the lower head,snare,0,0
9031,2024-02-05,2024 Champions Wildcard Group 2 quarterfinal game 1.,Jeopardy,"(5, 1)",IT'S GIVING...,28,"(200,)",False,"In 1997 Kofi Annan thanked Ted Turner for the $1 billion given to this org., which was meant to invite other individual donations",the United Nations,0,0
9031,2024-02-05,2024 Champions Wildcard Group 2 quarterfinal game 1.,Jeopardy,"(6, 1)",TOOLS,30,"(200,)",False,"Dewalt's 20v Max XR lithium-ion cordless compact 1/2-inch is a lot of words but bottom line, it's a power type of this",a drill,0,0
9031,2024-02-05,2024 Champions Wildcard Group 2 quarterfinal game 1.,Jeopardy,"(1, 2)",HISTORICAL AMERICAN CURRENCY,25,"(400,)",False,This Native American's depiction on a $20 banknote in the 1860s was the first time a real woman was seen on American currency,Pocahontas,0,0
9031,2024-02-05,2024 Champions Wildcard Group 2 quarterfinal game 1.,Jeopardy,"(2, 2)","2 ACTORS, ONE TV SHOW",6,"(400,)",False,"In a group project, Gillian Jacobs & Yvette Nicole Brown schooled you from 2009 to 2015 on this college-set NBC sitcom",Community,0,0
9031,2024-02-05,2024 Champions Wildcard Group 2 quarterfinal game 1.,Jeopardy,"(3, 2)",LAKES & RIVERS,26,"(400,)",False,Herodotus believed geometry began when farmland had to be remeasured after this river's annual floods,the Nile,0,0
9031,2024-02-05,2024 Champions Wildcard Group 2 quarterfinal game 1.,Jeopardy,"(4, 2)","THE ""ARE"" YOU BREATHE",21,"(400,)",False,High-flying Jeb Corliss is often described as one of these; careful Jeb,a daredevil,0,0
9031,2024-02-05,2024 Champions Wildcard Group 2 quarterfinal game 1.,Jeopardy,"(5, 2)",IT'S GIVING...,2,"(400,)",False,"A New York Times headline read this oil man's ""gifts total $530,853,632"", remarkably specific on the day after his death in 1937",(John D.) Rockefeller,0,0
9031,2024-02-05,2024 Champions Wildcard Group 2 quarterfinal game 1.,Jeopardy,"(6, 2)",TOOLS,29,"(400,)",False,"With steel shot or sand inside, a dead blow type of this won't bounce back after striking",a hammer,0,0
9031,2024-02-05,2024 Champions Wildcard Group 2 quarterfinal game 1.,Jeopardy,"(1, 3)",HISTORICAL AMERICAN CURRENCY,22,"(600,)",False,Between 1837 & 1840 this republic & future state issued a paper currency called star money for the small star on the bill's face,Texas,0,0
9031,2024-02-05,2024 Champions Wildcard Group 2 quarterfinal game 1.,Jeopardy,"(2, 3)","2 ACTORS, ONE TV SHOW",7,"(600,)",False,"In 2001 Jeri Ryan & Tim Russ completed a ""trek"" through the Delta Quadrant on this title starship",Voyager,0,0
9031,2024-02-05,2024 Champions Wildcard Group 2 quarterfinal game 1.,Jeopardy,"(3, 3)",LAKES & RIVERS,19,"(600,)",False,"At about 7,300 square miles in area, it's the smallest of the 5 Great Lakes & also the easternmost",Lake Ontario,0,0
9031,2024-02-05,2024 Champions Wildcard Group 2 quarterfinal game 1.,Jeopardy,"(4, 3)","THE ""ARE"" YOU BREATHE",20,"(600,)",False,A sanctioned & medically supervised promotion founded in 2018 presents this style of boxing--John L. Sullivan would be proud,bare knuckle,0,0
9031,2024-02-05,2024 Champions Wildcard Group 2 quarterfinal game 1.,Jeopardy,"(5, 3)",IT'S GIVING...,1,"(600,)",False,"2022's Red Kettle campaign from this charity brought in more than $100 million, & its name should ring a bell",the Salvation Army,0,0
9031,2024-02-05,2024 Champions Wildcard Group 2 quarterfinal game 1.,Jeopardy,"(6, 3)",TOOLS,18,"(600,)",False,"Used on bolts or screws, metric hex keys are known by this letter, their shape",a letter L,0,0
9031,2024-02-05,2024 Champions Wildcard Group 2 quarterfinal game 1.,Jeopardy,"(1, 4)",HISTORICAL AMERICAN CURRENCY,3,"(800,)",False,"The ""Educational Series"" of silver certificates was issued in 1896; one featured Robert Fulton & this code guy",Morse,0,0
9031,2024-02-05,2024 Champions Wildcard Group 2 quarterfinal game 1.,Jeopardy,"(2, 4)","2 ACTORS, ONE TV SHOW",10,"(800,)",False,Rebecca Wisocky & Brandon Scott Jones are scary good as the dearly departed Hetty & Isaac on this CBS comedy,Ghosts,0,0
9031,2024-02-05,2024 Champions Wildcard Group 2 quarterfinal game 1.,Jeopardy,"(3, 4)",LAKES & RIVERS,12,"(800,)",False,A type of fatal hemorrhagic fever bears the name of this sub-Saharan river,Ebola,0,0
9031,2024-02-05,2024 Champions Wildcard Group 2 quarterfinal game 1.,Jeopardy,"(4, 4)","THE ""ARE"" YOU BREATHE",11,"(800,)",False,"These tenant farmers, about 1/3 of whom were Black, gave their proceeds to the landowners in a post-Civil War system",sharecroppers,0,0
9031,2024-02-05,2024 Champions Wildcard Group 2 quarterfinal game 1.,Jeopardy,"(5, 4)",IT'S GIVING...,17,"(800,)",False,"Apparently really into science, Ross Brown, the founder of Cryogenic Industries, pledged $400 million to this Pasadena college",Caltech,0,0
9031,2024-02-05,2024 Champions Wildcard Group 2 quarterfinal game 1.,Jeopardy,"(6, 4)",TOOLS,4,"(800,)",False,"Let's tighten things up: use the flex-head, standard-head & thumbwheel types to this tool it ""up a notch""",ratchet,0,0
9031,2024-02-05,2024 Champions Wildcard Group 2 quarterfinal game 1.,Jeopardy,"(1, 5)",HISTORICAL AMERICAN CURRENCY,14,"(1000,)",False,"This Treasury Secretary under Lincoln put his own mug on the first $1 dollar bill, seven years before Washington appeared on one",Salmon P. Chase,0,0
9031,2024-02-05,2024 Champions Wildcard Group 2 quarterfinal game 1.,Jeopardy,"(2, 5)","2 ACTORS, ONE TV SHOW",9,"(1000,)",False,We're sanguine you'll recall Michelle Forbes & Tara Buck takin' in life in Loo'siana on this fangs-tastic HBO series,True Blood,0,0
9031,2024-02-05,2024 Champions Wildcard Group 2 quarterfinal game 1.,Jeopardy,"(3, 5)",LAKES & RIVERS,16,"(1000,)",False,"Europe's longest river, the Volga flows more than 2,000 miles south into this large inland body of water",the Caspian Sea,0,0
9031,2024-02-05,2024 Champions Wildcard Group 2 quarterfinal game 1.,Jeopardy,"(4, 5)","THE ""ARE"" YOU BREATHE",13,"(3000,)",True,"""Ruffles And Flourishes"" is one of these short pieces of music played prior to ""Hail To The Chief"" for the president",fanfare,0,0
9031,2024-02-05,2024 Champions Wildcard Group 2 quarterfinal game 1.,Jeopardy,"(5, 5)",IT'S GIVING...,15,"(1000,)",False,"Named for an athlete whose brother was a doctor, this Seattle cancer center has gotten gifts, like $700 million from Jeff Bezo's parents",the Fred Hutchinson Cancer Center,0,0
9031,2024-02-05,2024 Champions Wildcard Group 2 quarterfinal game 1.,Jeopardy,"(6, 5)",TOOLS,5,"(1000,)",False,"It's not a magnetic tool to help you detect a virile man, but rather its namesake item as well as nails hidden within a wall",a stud detector (stud finder),0,0
9031,2024-02-05,2024 Champions Wildcard Group 2 quarterfinal game 1.,Double Jeopardy,"(1, 1)",BRITISH LITERATURE,24,"(400,)",False,"Chapter 43 of this novel explains ""How the Artful Dodger Got into Trouble""",Oliver Twist,0,0
9031,2024-02-05,2024 Champions Wildcard Group 2 quarterfinal game 1.,Double Jeopardy,"(2, 1)",NOTHING BUT MAMMALS,27,"(400,)",False,"It has webbed feet & a bill, lays eggs & is venomous--but yes, it's a mammal!",a platypus,0,0
9031,2024-02-05,2024 Champions Wildcard Group 2 quarterfinal game 1.,Double Jeopardy,"(3, 1)",SOME LAZY WORDS,28,"(400,)",False,There's a shell-less mollusk at the start of this word meaning slow & lazy,sluggish,0,0
9031,2024-02-05,2024 Champions Wildcard Group 2 quarterfinal game 1.,Double Jeopardy,"(4, 1)",TRICKS OF THE SHOW BIZ TRADE,30,"(400,)",False,"For an acting scene where you find out your grandma, dog & dreams are all dead, menthol applied under the eye will help you do this",cry,0,0
9031,2024-02-05,2024 Champions Wildcard Group 2 quarterfinal game 1.,Double Jeopardy,"(5, 1)",SINGLE-NAMED SINGERS,10,"(400,)",False,"That's Mrs. Knowles-Carter, to you",Beyoncé,0,0
9031,2024-02-05,2024 Champions Wildcard Group 2 quarterfinal game 1.,Double Jeopardy,"(6, 1)",FINAL RESTING PLACES,22,"(400,)",False,"After an attempted grave robbery soon after his death, Elvis Presley's body was moved from Forest Hill Cemetery to this estate",Graceland,0,0
9031,2024-02-05,2024 Champions Wildcard Group 2 quarterfinal game 1.,Double Jeopardy,"(1, 2)",BRITISH LITERATURE,23,"(800,)",False,"The unexpected death of a small town council member is a mystery at the heart of ""The Casual Vacancy"" by this author",J.K. Rowling,0,0
9031,2024-02-05,2024 Champions Wildcard Group 2 quarterfinal game 1.,Double Jeopardy,"(2, 2)",NOTHING BUT MAMMALS,26,"(800,)",False,"Popular as pets, most of the golden type of these rodents descend from a single group caught in Syria in the 1930s",hamsters,0,0
9031,2024-02-05,2024 Champions Wildcard Group 2 quarterfinal game 1.,Double Jeopardy,"(3, 2)",SOME LAZY WORDS,25,"(800,)",False,The mid-1800s gave us this hyphenated word for an employee who keeps a close eye on the hour & minute hands,a clockwatcher,0,0
9031,2024-02-05,2024 Champions Wildcard Group 2 quarterfinal game 1.,Double Jeopardy,"(4, 2)",TRICKS OF THE SHOW BIZ TRADE,29,"(800,)",False,"Post-pandemic, these have moved from in person with casting directors to self-tapes; always shoot yourself horizontally",auditions,0,0
9031,2024-02-05,2024 Champions Wildcard Group 2 quarterfinal game 1.,Double Jeopardy,"(5, 2)",SINGLE-NAMED SINGERS,8,"(800,)",False,"""Ben"" is a 2023 solo album by this member of a Grammy-winning duo",Macklemore,0,0
9031,2024-02-05,2024 Champions Wildcard Group 2 quarterfinal game 1.,Double Jeopardy,"(6, 2)",FINAL RESTING PLACES,21,"(800,)",False,"Following her 1997 death, she was buried on a small island in a lake in Althorp Park, the Spencer family estate",Princess Diana,0,0
9031,2024-02-05,2024 Champions Wildcard Group 2 quarterfinal game 1.,Double Jeopardy,"(1, 3)",BRITISH LITERATURE,14,"(1200,)",False,"The 24 Pilgrim storytellers in ""The Canterbury Tales"" include this bawdy woman who tells of her 5 husbands",the Wife of Bath,0,0
9031,2024-02-05,2024 Champions Wildcard Group 2 quarterfinal game 1.,Double Jeopardy,"(2, 3)",NOTHING BUT MAMMALS,12,"(2000,)",True,These Pacific pinnipeds get their name from the roars they emit while defending their harems,sea lions,0,0
9031,2024-02-05,2024 Champions Wildcard Group 2 quarterfinal game 1.,Double Jeopardy,"(3, 3)",SOME LAZY WORDS,19,"(1200,)",False,"Oscitant is an adjective that means doing this--& don't start, because I will too",yawning,0,0
9031,2024-02-05,2024 Champions Wildcard Group 2 quarterfinal game 1.,Double Jeopardy,"(4, 3)",TRICKS OF THE SHOW BIZ TRADE,18,"(1200,)",False,"To learn this basic circus skill, remember: if you start to lose your balance, lifting one leg can actually help",tightrope walking,0,0
9031,2024-02-05,2024 Champions Wildcard Group 2 quarterfinal game 1.,Double Jeopardy,"(5, 3)",SINGLE-NAMED SINGERS,9,"(1200,)",False,"Hope you still know this Belgian-Australian man who had a smash hit in 2012 with ""Somebody That I Used To Know""",Gotye,0,0
9031,2024-02-05,2024 Champions Wildcard Group 2 quarterfinal game 1.,Double Jeopardy,"(6, 3)",FINAL RESTING PLACES,11,"(1200,)",False,"This director's tombstone at Westwood Memorial Park in L.A. reads, ""I'm a writer but then nobody's perfect""",Billy Wilder,0,0
9031,2024-02-05,2024 Champions Wildcard Group 2 quarterfinal game 1.,Double Jeopardy,"(1, 4)",BRITISH LITERATURE,1,"(1600,)",False,A man stopped on his way to a wedding feast is told of tragic events aboard a ship in this 1798 narrative poem,The Rime of the Ancient Mariner,0,0
9031,2024-02-05,2024 Champions Wildcard Group 2 quarterfinal game 1.,Double Jeopardy,"(2, 4)",NOTHING BUT MAMMALS,2,"(1600,)",False,"Check out the big feet on this hare, perfect for what it walks & runs on",a snowshoe hare,0,0
9031,2024-02-05,2024 Champions Wildcard Group 2 quarterfinal game 1.,Double Jeopardy,"(3, 4)",SOME LAZY WORDS,3,"(1800,)",True,"A prefix meaning ""bad"" begins this word for  feigning illness in order to avoid work",malingering,0,0
9031,2024-02-05,2024 Champions Wildcard Group 2 quarterfinal game 1.,Double Jeopardy,"(4, 4)",TRICKS OF THE SHOW BIZ TRADE,16,"(1600,)",False,"Film composers sync their scores using this measurement that's also big in EDM; 60 goes well with a slow scene, 140 is more pumped",BPM (beats per minute),0,0
9031,2024-02-05,2024 Champions Wildcard Group 2 quarterfinal game 1.,Double Jeopardy,"(5, 4)",SINGLE-NAMED SINGERS,5,"(1600,)",False,"In 2022 this ""Pieces Of You"" singer returned with ""Freewheelin' Woman"", her first album in 7 years",Jewel,0,0
9031,2024-02-05,2024 Champions Wildcard Group 2 quarterfinal game 1.,Double Jeopardy,"(6, 4)",FINAL RESTING PLACES,6,"(1600,)",False,"This scientist's sarcophagus at Westminster Abbey shows him leaning on 4 books that include ""Opticks"" & ""Philo. Prin. Math""",Newton,0,0
9031,2024-02-05,2024 Champions Wildcard Group 2 quarterfinal game 1.,Double Jeopardy,"(1, 5)",BRITISH LITERATURE,4,"(2000,)",False,"2020's ""The Mirror & the Light"" completed Hilary Mantel's trilogy about Thomas Cromwell that began with this lupine novel",Wolf Hall,0,0
9031,2024-02-05,2024 Champions Wildcard Group 2 quarterfinal game 1.,Double Jeopardy,"(2, 5)",NOTHING BUT MAMMALS,13,"(2000,)",False,Secretions from the glands of these catlike carnivores are used in perfumes,civet,0,0
9031,2024-02-05,2024 Champions Wildcard Group 2 quarterfinal game 1.,Double Jeopardy,"(3, 5)",SOME LAZY WORDS,15,"(2000,)",False,"Meaning inert or drowsy, it comes from Greek for ""forget"", like the name of a mythological river",lethargic,0,0
9031,2024-02-05,2024 Champions Wildcard Group 2 quarterfinal game 1.,Double Jeopardy,"(4, 5)",TRICKS OF THE SHOW BIZ TRADE,17,"(2000,)",False,The tracks this producer lays down with help from Team Timbo often start with him simply makings sounds with his mouth,Timbaland,0,0
9031,2024-02-05,2024 Champions Wildcard Group 2 quarterfinal game 1.,Double Jeopardy,"(5, 5)",SINGLE-NAMED SINGERS,7,"(2000,)",False,"An icon of '60s cool, this German model & actress rose to musical fame with The Velvet Underground",Nico,0,0
9031,2024-02-05,2024 Champions Wildcard Group 2 quarterfinal game 1.,Double Jeopardy,"(6, 5)",FINAL RESTING PLACES,20,"(2000,)",False,No one knows why the blank scroll in Woodlawn Cemetery in the Bronx on the gravestone of this seafaring novelist,Melville,0,0
9031,2024-02-05,2024 Champions Wildcard Group 2 quarterfinal game 1.,Final Jeopardy,"(1, 1)",WORLD FLAGS,0,(),False,The flag of this Asian nation features part of a World Heritage Site built in the 12th century,Cambodia,0,0
