epNum,airDate,extra_info,round_name,coord,category,order,value,daily_double,question,answer,correctAttempts,wrongAttempts
9110,2024-05-24,Amar Kakirde game 3.,Jeopardy,"(1, 1)",LITERARY SIMILES,18,"(200,)",False,"In this novella John Steinbeck wrote that ""Curley was flopping like a fish on a line""",Of Mice and Men,0,0
9110,2024-05-24,Amar Kakirde game 3.,Jeopardy,"(2, 1)","CROSSWORD CLUES ""2""",24,"(200,)",False,Bono's band (2 squares),U2,0,0
9110,2024-05-24,Amar Kakirde game 3.,Jeopardy,"(3, 1)",I'LL JUST NEED TO VERIFY YOUR IDENTITY,30,"(200,)",False,"It's often noted that you don't need a valid state one to compete in a NASCAR race; officer, here's my Rusty Wallace novelty one",a driver's license,0,0
9110,2024-05-24,Amar Kakirde game 3.,Jeopardy,"(4, 1)",DATE OF BIRTH,2,"(200,)",False,"April 24, 1800: Early on, only the president & vice president had borrowing privileges",the Library of Congress,0,0
9110,2024-05-24,Amar Kakirde game 3.,Jeopardy,"(5, 1)",MOTHER'S MAIDEN NAME,15,"(200,)",False,"Maiden name of Elizabeth, who got her author son James Cooper to add it as a middle name so it would be preserved",Fenimore,0,0
9110,2024-05-24,Amar Kakirde game 3.,Jeopardy,"(6, 1)",YOUR FIRST CONCERT,17,"(200,)",False,I was there in 2007 when this original lead singer for Van Halen reunited with the band for a concert tour,David Lee Roth,0,0
9110,2024-05-24,Amar Kakirde game 3.,Jeopardy,"(1, 2)",LITERARY SIMILES,29,"(400,)",False,"Shakespeare started a sonnet with a simile, ""Like as"" these ""make towards the pebbled shore, so do our minutes hasten to their end""",waves,0,0
9110,2024-05-24,Amar Kakirde game 3.,Jeopardy,"(2, 2)","CROSSWORD CLUES ""2""",23,"(400,)",False,Employer-provided wage & tax statement (2 squares),the W-2,0,0
9110,2024-05-24,Amar Kakirde game 3.,Jeopardy,"(3, 2)",I'LL JUST NEED TO VERIFY YOUR IDENTITY,1,"(400,)",False,"Based on a 1936 decision, the first 3 of its 9 digits dealt with geographical coding",your Social Security number,0,0
9110,2024-05-24,Amar Kakirde game 3.,Jeopardy,"(4, 2)",DATE OF BIRTH,26,"(400,)",False,"Jan. 3, 2009, with the mining of the Genesis block",Bitcoin (Blockchain),0,0
9110,2024-05-24,Amar Kakirde game 3.,Jeopardy,"(5, 2)",MOTHER'S MAIDEN NAME,9,"(400,)",False,"He said he used his mother's maiden name because double S names work for artists--Matisse, Poussin, Rousseau",Picasso,0,0
9110,2024-05-24,Amar Kakirde game 3.,Jeopardy,"(6, 2)",YOUR FIRST CONCERT,12,"(400,)",False,I'll never forget this trio's 1986 Raising Hell tour that saw the Beastie Boys & LL Cool J open,Run-DMC,0,0
9110,2024-05-24,Amar Kakirde game 3.,Jeopardy,"(1, 3)",LITERARY SIMILES,20,"(600,)",False,"""Like Summer Tempests Came His Tears"" is a chapter of this book in which Mr. Toad gets some bad news",The Wind in the Willows,0,0
9110,2024-05-24,Amar Kakirde game 3.,Jeopardy,"(2, 3)","CROSSWORD CLUES ""2""",21,"(600,)",False,"No. 7 on Time's ""Top 10 End-of-the-World Prophecies"" (3 squares)",Y2K,0,0
9110,2024-05-24,Amar Kakirde game 3.,Jeopardy,"(3, 3)",I'LL JUST NEED TO VERIFY YOUR IDENTITY,28,"(600,)",False,"In 2023 Alan Alda auctioned off these identifiers he wore around his neck on ""M*A*S*H""",dog tags,0,0
9110,2024-05-24,Amar Kakirde game 3.,Jeopardy,"(4, 3)",DATE OF BIRTH,6,"(600,)",False,"This force: Nov. 10, 1775, a month after the Navy it rides with",the Marines (Marine Corps),0,0
9110,2024-05-24,Amar Kakirde game 3.,Jeopardy,"(5, 3)",MOTHER'S MAIDEN NAME,10,"(500,)",True,Maiden name of the political mom seen here,Milhous,0,0
9110,2024-05-24,Amar Kakirde game 3.,Jeopardy,"(6, 3)",YOUR FIRST CONCERT,13,"(600,)",False,"I rang in 2000 with this Vermont band as they lit the morning sky, incorporating ""Sunrise"" from ""Also Sprach Zarathustra"" in a jam",Phish,0,0
9110,2024-05-24,Amar Kakirde game 3.,Jeopardy,"(1, 4)",LITERARY SIMILES,19,"(800,)",False,"He jolted critics with a ""Prufrock"" simile: ""The evening is spread out against the sky like a patient etherized upon a table""",T.S. Eliot,0,0
9110,2024-05-24,Amar Kakirde game 3.,Jeopardy,"(2, 4)","CROSSWORD CLUES ""2""",22,"(800,)",False,"Online type of ""authentication"" (7 squares)",2-factor,0,0
9110,2024-05-24,Amar Kakirde game 3.,Jeopardy,"(3, 4)",I'LL JUST NEED TO VERIFY YOUR IDENTITY,27,"(800,)",False,In 1933 a blindfolded kidnap victim deliberately left these all over the cabin where he was held by Machine Gun Kelly,fingerprints,0,0
9110,2024-05-24,Amar Kakirde game 3.,Jeopardy,"(4, 4)",DATE OF BIRTH,7,"(800,)",False,"Sept. 13, 1957: The first group meeting of this organization for those with a problem at the track or the tables",Gamblers Anonymous,0,0
9110,2024-05-24,Amar Kakirde game 3.,Jeopardy,"(5, 4)",MOTHER'S MAIDEN NAME,11,"(800,)",False,"Born in the USSR, he was just a little woodpusher when he adopted a Russified version of his mother's maiden name, Gasparyan",Gary Kasparov,0,0
9110,2024-05-24,Amar Kakirde game 3.,Jeopardy,"(6, 4)",YOUR FIRST CONCERT,14,"(800,)",False,"I survived the legendary deluge at Glastonbury in 1997 & heard an epic version of ""Creep"" by these Brit rockers",Radiohead,0,0
9110,2024-05-24,Amar Kakirde game 3.,Jeopardy,"(1, 5)",LITERARY SIMILES,3,"(1000,)",False,"In his ""Farewell, My Lovely"", a man about 6'5"" in a yellow tie is ""as inconspicuous as a tarantula on a slice of angel food""",(Raymond) Chandler,0,0
9110,2024-05-24,Amar Kakirde game 3.,Jeopardy,"(2, 5)","CROSSWORD CLUES ""2""",4,"(1000,)",False,Enclosed Earth-like research facility in Arizona(10 squares),Biosphere 2,0,0
9110,2024-05-24,Amar Kakirde game 3.,Jeopardy,"(3, 5)",I'LL JUST NEED TO VERIFY YOUR IDENTITY,5,"(1000,)",False,In 1935 a criminologist & an ophthalmologist used the pattern of blood vessels in this eye part as an identifier,the retina,0,0
9110,2024-05-24,Amar Kakirde game 3.,Jeopardy,"(4, 5)",DATE OF BIRTH,8,"(1000,)",False,"July 26, 1848: This university with alumni like Bud Selig & Frank Lloyd Wright",the University of Wisconsin,0,0
9110,2024-05-24,Amar Kakirde game 3.,Jeopardy,"(5, 5)",MOTHER'S MAIDEN NAME,25,"(1000,)",False,This Atlanta Historically Black College for women bears the maiden name of John D. Rockefeller Jr.'s mother,Spelman,0,0
9110,2024-05-24,Amar Kakirde game 3.,Jeopardy,"(6, 5)",YOUR FIRST CONCERT,16,"(1000,)",False,"I didn't sleep after I saw the ""Rust Never Sleeps"" tour by this man and Crazy Horse in 1978",Neil Young,0,0
9110,2024-05-24,Amar Kakirde game 3.,Double Jeopardy,"(1, 1)",UP IN THE AIR,26,"(400,)",False,"Armed forces are eager to get their hands on the Bayraktar TB2 unmanned aerial vehicle, more commonly called this",drone,0,0
9110,2024-05-24,Amar Kakirde game 3.,Double Jeopardy,"(2, 1)",INDIGENOUS ACTORS & ACTRESSES,1,"(400,)",False,"Of Maori heritage, Temuera Morrison, has played both Jango Fett & this cloned son of Jango in the ""Star Wars"" franchise",Boba Fett,0,0
9110,2024-05-24,Amar Kakirde game 3.,Double Jeopardy,"(3, 1)",AMERICAN HISTORY,30,"(400,)",False,"In 1609 Henry Hudson landed on what's now this NYC amusement park island, possibly named for its numerous rabbits",Coney Island,0,0
9110,2024-05-24,Amar Kakirde game 3.,Double Jeopardy,"(4, 1)",GEOGRAPHIC ANAGRAMS OF EACH OTHER,16,"(400,)",False,"Local name for the ""emerald isle"" & one of the Great Lakes",Eire & Erie,0,0
9110,2024-05-24,Amar Kakirde game 3.,Double Jeopardy,"(5, 1)",THE BRITISH PARLIAMENT,18,"(400,)",False,The last non-royal to lie in state in Parliament was this former prime minister who died in January 1965,Churchill,0,0
9110,2024-05-24,Amar Kakirde game 3.,Double Jeopardy,"(6, 1)",RAMBLING WORDS,20,"(400,)",False,A part of speech is in this word for long-winded,verbose,0,0
9110,2024-05-24,Amar Kakirde game 3.,Double Jeopardy,"(1, 2)",UP IN THE AIR,25,"(800,)",False,"Paper wasps are often mistaken for these colorful wasps, but the paper wasps dangle their legs in flight instead of tucking them under",a yellowjacket,0,0
9110,2024-05-24,Amar Kakirde game 3.,Double Jeopardy,"(2, 2)",INDIGENOUS ACTORS & ACTRESSES,29,"(800,)",False,"The 2002 film ""Windtalkers"" starred Adam Beach as a soldier who uses this language as code during World War II",Navajo,0,0
9110,2024-05-24,Amar Kakirde game 3.,Double Jeopardy,"(3, 2)",AMERICAN HISTORY,13,"(800,)",False,In the 1920s the real-life Untouchables frequently busted up these illicit saloons named for quiet conversation,speakeasies,0,0
9110,2024-05-24,Amar Kakirde game 3.,Double Jeopardy,"(4, 2)",GEOGRAPHIC ANAGRAMS OF EACH OTHER,2,"(4400,)",True,A South American capital city founded by Pizarro & a largely desert country of western Africa,Lima & Mali,0,0
9110,2024-05-24,Amar Kakirde game 3.,Double Jeopardy,"(5, 2)",THE BRITISH PARLIAMENT,9,"(800,)",False,This time when ministers get grilled by the opposition would be a good quiz show title,question time,0,0
9110,2024-05-24,Amar Kakirde game 3.,Double Jeopardy,"(6, 2)",RAMBLING WORDS,19,"(800,)",False,"In 1906 this compound word for an incessant talker was considered a disease that ""may stop kissing while on auto trips""",a motormouth,0,0
9110,2024-05-24,Amar Kakirde game 3.,Double Jeopardy,"(1, 3)",UP IN THE AIR,23,"(1200,)",False,"In tennis a drop shot & this lofted shot make a lethal combination, as practiced by Carlos Alcaraz",a lob,0,0
9110,2024-05-24,Amar Kakirde game 3.,Double Jeopardy,"(2, 3)",INDIGENOUS ACTORS & ACTRESSES,24,"(1200,)",False,"When this actress won a Golden Globe for ""Killers of the Flower Moon"" she began her speech in the Blackfeet language",Lily Gladstone,0,0
9110,2024-05-24,Amar Kakirde game 3.,Double Jeopardy,"(3, 3)",AMERICAN HISTORY,10,"(1200,)",False,"After an 1877 surrender, he made repeated pleas to the U.S. government for the return of the Nez Perce to their ancestral home",Chief Joseph,0,0
9110,2024-05-24,Amar Kakirde game 3.,Double Jeopardy,"(4, 3)",GEOGRAPHIC ANAGRAMS OF EACH OTHER,15,"(1200,)",False,"The ""table"" city southeast of Phoenix & the seat of Iowa State University",Mesa & Ames,0,0
9110,2024-05-24,Amar Kakirde game 3.,Double Jeopardy,"(5, 3)",THE BRITISH PARLIAMENT,4,"(1200,)",False,Smoking is prohibited in Parliament but the entrance to the chamber has a box for this smokeless tobacco,snuff,0,0
9110,2024-05-24,Amar Kakirde game 3.,Double Jeopardy,"(6, 3)",RAMBLING WORDS,8,"(1200,)",False,"""Colloquial"", ""eloquent"" & this word that means talkative all derive from Latin for ""to speak""",loquacious,0,0
9110,2024-05-24,Amar Kakirde game 3.,Double Jeopardy,"(1, 4)",UP IN THE AIR,22,"(1600,)",False,The G650 & G650ER are business jets from this manufacturer,Gulfstream,0,0
9110,2024-05-24,Amar Kakirde game 3.,Double Jeopardy,"(2, 4)",INDIGENOUS ACTORS & ACTRESSES,27,"(1600,)",False,Zahn McClarnon played Officer Big on this Hulu show set in rural Oklahoma,Reservation Dogs,0,0
9110,2024-05-24,Amar Kakirde game 3.,Double Jeopardy,"(3, 4)",AMERICAN HISTORY,11,"(1600,)",False,Cesar Chavez & this woman were instrumental in creating the United Farm Workers of America labor union,Dolores Huerta,0,0
9110,2024-05-24,Amar Kakirde game 3.,Double Jeopardy,"(4, 4)",GEOGRAPHIC ANAGRAMS OF EACH OTHER,14,"(1600,)",False,A river that flows through Florence & a Mediterranean port city of Algeria,the Arno & Oran,0,0
9110,2024-05-24,Amar Kakirde game 3.,Double Jeopardy,"(5, 4)",THE BRITISH PARLIAMENT,5,"(1600,)",False,Neither the House of Commons nor the House of Lords can pass laws without the presence of this ornamental club,the mace,0,0
9110,2024-05-24,Amar Kakirde game 3.,Double Jeopardy,"(6, 4)",RAMBLING WORDS,7,"(1600,)",False,"It means rambling nonsense with or without ""skite"" added",blather,0,0
9110,2024-05-24,Amar Kakirde game 3.,Double Jeopardy,"(1, 5)",UP IN THE AIR,21,"(2000,)",False,"Known for stealing food from other birds in midair, this type of bird shares a name with a speedy 3-mast ship of yore",a frigate bird,0,0
9110,2024-05-24,Amar Kakirde game 3.,Double Jeopardy,"(2, 5)",INDIGENOUS ACTORS & ACTRESSES,28,"(2000,)",False,"In ""One Flew Over the Cuckoo's Nest"", Native American actor Will Sampson played this character who escapes an asylum",Chief Bromden,0,0
9110,2024-05-24,Amar Kakirde game 3.,Double Jeopardy,"(3, 5)",AMERICAN HISTORY,12,"(2000,)",False,"In the 1850s Black historian William Cooper Nell wrote this man was ""the first martyr in the Boston Massacre""",(Crispus) Attucks,0,0
9110,2024-05-24,Amar Kakirde game 3.,Double Jeopardy,"(4, 5)",GEOGRAPHIC ANAGRAMS OF EACH OTHER,17,"(2000,)",False,The onetime capital of New Granada & one of the southernmost Caribbean islands,Bogota & Tobago,0,0
9110,2024-05-24,Amar Kakirde game 3.,Double Jeopardy,"(5, 5)",THE BRITISH PARLIAMENT,6,"(2000,)",True,The Houses of Parliament are located in this London borough,Westminster,0,0
9110,2024-05-24,Amar Kakirde game 3.,Double Jeopardy,"(6, 5)",RAMBLING WORDS,3,"(2000,)",False,"""Tristram Shandy"" calls these tangential departures from the main subject ""the sunshine... the life, the soul of reading""",digressions,0,0
9110,2024-05-24,Amar Kakirde game 3.,Final Jeopardy,"(1, 1)",LITERATURE,0,(),False,"Preserved in a single manuscript called Cotton MS Vitellius A XV, this epic begins with the word ""Hwæt"", often translated as listen",Beowulf,0,0
