epNum,airDate,extra_info,round_name,coord,category,order,value,daily_double,question,answer,correctAttempts,wrongAttempts
9144,2024-07-11,Isaac Hirsch game 7.,Jeopardy,"(1, 1)",MORE THAN ONE MEANING,30,"(200,)",False,Having light-colored hair & a county carnival,fair,0,0
9144,2024-07-11,Isaac Hirsch game 7.,Jeopardy,"(2, 1)",LET'S GO TO THE CONCERT HALL,29,"(200,)",False,"It's a rule not to clap at this point during a symphony, but conductor Pierre Monteux called that ""artificial restraint""",between movements,0,0
9144,2024-07-11,Isaac Hirsch game 7.,Jeopardy,"(3, 1)",OCCUPATIONAL POTPOURRI,7,"(200,)",False,"This protective job has given big brains time to think: Edward Snowden (at a research center), Bill James (a pork & beans cannery)",security guards,0,0
9144,2024-07-11,Isaac Hirsch game 7.,Jeopardy,"(4, 1)",WOMEN IN GOVERNMENT,22,"(200,)",False,"Her resume includes governor of Alaska, vice presidential candidate & Bear on ""The Masked Singer""",Palin,0,0
9144,2024-07-11,Isaac Hirsch game 7.,Jeopardy,"(5, 1)",1980s AMATEUR WRESTLING,26,"(200,)",False,"With many Western athletes absent, this country's wrestlers won 12 of 20 Olympic gold medals in 1980",the USSR,0,0
9144,2024-07-11,Isaac Hirsch game 7.,Jeopardy,"(6, 1)",STATES THAT END IN HAMPSHIRE,17,"(200,)",False,In 1765 this future capital got its name to show that a boundary dispute with Massachusetts had ended peacefully,Concord,0,0
9144,2024-07-11,Isaac Hirsch game 7.,Jeopardy,"(1, 2)",MORE THAN ONE MEANING,24,"(400,)",False,Rover's retort & an oak's outer edge,bark,0,0
9144,2024-07-11,Isaac Hirsch game 7.,Jeopardy,"(2, 2)",LET'S GO TO THE CONCERT HALL,23,"(400,)",False,"Don't leave a piano recital too soon--you might miss Prokofiev's showy ""Precipitato"" as one of these, not on the program",an encore,0,0
9144,2024-07-11,Isaac Hirsch game 7.,Jeopardy,"(3, 2)",OCCUPATIONAL POTPOURRI,8,"(400,)",False,"An old line says an unpopular politician ""couldn't get elected"" to this job, now with the upgraded name animal control officer",dog catcher,0,0
9144,2024-07-11,Isaac Hirsch game 7.,Jeopardy,"(4, 2)",WOMEN IN GOVERNMENT,21,"(400,)",False,Japanese-born Mazie Hirono became a naturalized citizen of this state in 1959 & a senator in 2013,Hawaii,0,0
9144,2024-07-11,Isaac Hirsch game 7.,Jeopardy,"(5, 2)",1980s AMATEUR WRESTLING,25,"(400,)",False,"At the 1980 NCAA championships, Oregon State's Howard Harris won all 5 of his matches by ""fall""--doing this to opponents",pinning them (winning by a pin),0,0
9144,2024-07-11,Isaac Hirsch game 7.,Jeopardy,"(6, 2)",STATES THAT END IN HAMPSHIRE,28,"(400,)",False,"Derry, New Hampshire, has a peak named for a longtime resident family, including this first American in space & the fifth to walk on the Moon",Shepard,0,0
9144,2024-07-11,Isaac Hirsch game 7.,Jeopardy,"(1, 3)",MORE THAN ONE MEANING,15,"(600,)",False,A handy kitchen wrap & to prevent the attainment of an end,foil,0,0
9144,2024-07-11,Isaac Hirsch game 7.,Jeopardy,"(2, 3)",LET'S GO TO THE CONCERT HALL,9,"(600,)",False,A popular design for concert halls has sloped terraces & is named after this type of area where a certain fruit is grown,a vineyard,0,0
9144,2024-07-11,Isaac Hirsch game 7.,Jeopardy,"(3, 3)",OCCUPATIONAL POTPOURRI,4,"(600,)",False,"In ""Middlemarch"" wealthy & powerful Mr. Bulstrode has this occupation, also a job in the game Monopoly",banker,0,0
9144,2024-07-11,Isaac Hirsch game 7.,Jeopardy,"(4, 3)",WOMEN IN GOVERNMENT,1,"(600,)",False,"Condoleezza Rice's successor as Secretary of State, she visited more than 100 countries during her tenure",Hillary Clinton,0,0
9144,2024-07-11,Isaac Hirsch game 7.,Jeopardy,"(5, 3)",1980s AMATEUR WRESTLING,12,"(600,)",False,"After having his spleen removed, cancer survivor Jeff Blatnick won 1984 Olympic gold in this heavier-than-heavyweight division",super heavyweight,0,0
9144,2024-07-11,Isaac Hirsch game 7.,Jeopardy,"(6, 3)",STATES THAT END IN HAMPSHIRE,16,"(600,)",False,"The first (& only) U.S. president from New Hampshire, he was also the youngest to serve at the time, age 48 at inauguration",Pierce,0,0
9144,2024-07-11,Isaac Hirsch game 7.,Jeopardy,"(1, 4)",MORE THAN ONE MEANING,20,"(800,)",False,A still area in a stream & a group of journalists who agree to share their coverage of an event,a pool,0,0
9144,2024-07-11,Isaac Hirsch game 7.,Jeopardy,"(2, 4)",LET'S GO TO THE CONCERT HALL,10,"(1200,)",True,"It's a daytime  concert, so the  program will include  accessible stuff for the kids like ""Mars, the Bringer of War""  from this suite",The Planets,0,0
9144,2024-07-11,Isaac Hirsch game 7.,Jeopardy,"(3, 4)",OCCUPATIONAL POTPOURRI,5,"(800,)",False,"Each the main character of their own 2024 TV series, ""Renegade Nell"" & Dick Turpin are these robbers of the road in olde England",highwaymen,0,0
9144,2024-07-11,Isaac Hirsch game 7.,Jeopardy,"(4, 4)",WOMEN IN GOVERNMENT,2,"(800,)",False,"South Carolina's first female governor, she had bigger plans for 2024 but they didn't work out",Haley,0,0
9144,2024-07-11,Isaac Hirsch game 7.,Jeopardy,"(5, 4)",1980s AMATEUR WRESTLING,13,"(800,)",False,"Led by legendary coach Dan Gable, this school's Hawkeyes won the NCAA wrestling title every year from 1980 through 1986",Iowa,0,0
9144,2024-07-11,Isaac Hirsch game 7.,Jeopardy,"(6, 4)",STATES THAT END IN HAMPSHIRE,27,"(800,)",False,"In 1934 it got a bit breezy at this N.H. mountain, the highest peak of the White Mountains, with winds clocking in at 231 mph",Mount Washington,0,0
9144,2024-07-11,Isaac Hirsch game 7.,Jeopardy,"(1, 5)",MORE THAN ONE MEANING,18,"(1000,)",False,To expectorate & to impale,spit,0,0
9144,2024-07-11,Isaac Hirsch game 7.,Jeopardy,"(2, 5)",LET'S GO TO THE CONCERT HALL,11,"(1000,)",False,The first violinist also has this title & gets a handshake from the conductor to show the maestro's respect for the orchestra,the concertmaster,0,0
9144,2024-07-11,Isaac Hirsch game 7.,Jeopardy,"(3, 5)",OCCUPATIONAL POTPOURRI,6,"(1000,)",False,"Smith is the USA's most common occupational surname; second is this, a job that's literally a grind",Miller,0,0
9144,2024-07-11,Isaac Hirsch game 7.,Jeopardy,"(4, 5)",WOMEN IN GOVERNMENT,3,"(1000,)",False,"In 1941 this congresswoman said, ""As a woman I can't go to war, & I refuse to send anyone else""",Jeannette Rankin,0,0
9144,2024-07-11,Isaac Hirsch game 7.,Jeopardy,"(5, 5)",1980s AMATEUR WRESTLING,14,"(1000,)",False,Rick & Scott Steiner were '80s NCAA stars at Michigan before winning 7 WCW titles in this event in which partners touch & take turns,tag team,0,0
9144,2024-07-11,Isaac Hirsch game 7.,Jeopardy,"(6, 5)",STATES THAT END IN HAMPSHIRE,19,"(1000,)",False,"It'll be a notch in your belt if you know this town, as always, voted right after midnight on Election Day 1984; Reagan won, 29-1","Dixville Notch, New Hampshire",0,0
9144,2024-07-11,Isaac Hirsch game 7.,Double Jeopardy,"(1, 1)",19th CENTURY NOVELS,24,"(400,)",False,Not-so-small female Laura Dern played Marmee in the 2019 movie version of this novel,Little Women,0,0
9144,2024-07-11,Isaac Hirsch game 7.,Double Jeopardy,"(2, 1)",ANIMAL SYNERGY,28,"(400,)",False,"In the Kalahari the drongo bird alerts the ""manor"" of this burrowing creature to predators",meerkats,0,0
9144,2024-07-11,Isaac Hirsch game 7.,Double Jeopardy,"(4, 1)",NO. 1 ALBUMS BY PEOPLE WHO AREN'T TAYLOR SWIFT,22,"(400,)",False,"""The Joker And The Queen"", one of several Taylor collaborations with this pal, appeared on his 2021 No. 1 ""=""",Ed Sheeran,0,0
9144,2024-07-11,Isaac Hirsch game 7.,Double Jeopardy,"(5, 1)",HEIR,15,"(400,)",False,"Daughter of Felipe, crown princess Leonor is the heir presumptive of this country",Spain,0,0
9144,2024-07-11,Isaac Hirsch game 7.,Double Jeopardy,"(6, 1)","""B"" & ""B""",21,"(400,)",False,"Whether preceding ""plague"" or not, it refers to inflammatory swelling, especially around your unmentionables",bubonic,0,0
9144,2024-07-11,Isaac Hirsch game 7.,Double Jeopardy,"(1, 2)",19th CENTURY NOVELS,7,"(2000,)",True,Cynical clerk Newman Noggs has the same initials as the hero of this Dickens book he's in,Nicholas Nickleby,0,0
9144,2024-07-11,Isaac Hirsch game 7.,Double Jeopardy,"(2, 2)",ANIMAL SYNERGY,27,"(800,)",False,"A species of this crustacean, Tubicinella major plants itself on southern right whales",barnacles,0,0
9144,2024-07-11,Isaac Hirsch game 7.,Double Jeopardy,"(3, 2)",ALPHABETICALLY LAST,29,"(800,)",False,Of the Pentateuch (the first 5 books of the Old Testament),Numbers,0,0
9144,2024-07-11,Isaac Hirsch game 7.,Double Jeopardy,"(4, 2)",NO. 1 ALBUMS BY PEOPLE WHO AREN'T TAYLOR SWIFT,19,"(800,)",False,"Taylor's first No. 1, 2008's ""Fearless"", was knocked out of the top spot by Beyoncé's third, ""I Am..."" her",Sasha Fierce,0,0
9144,2024-07-11,Isaac Hirsch game 7.,Double Jeopardy,"(5, 2)",HEIR,5,"(800,)",False,"When he was assassinated in 1914, Archduke Franz Ferdinand was the heir to this empire",the Austro-Hungarian Empire,0,0
9144,2024-07-11,Isaac Hirsch game 7.,Double Jeopardy,"(6, 2)","""B"" & ""B""",20,"(800,)",False,Lynx rufus is the scientific name of this North American creature that can leap up to 10 feet,a bobcat,0,0
9144,2024-07-11,Isaac Hirsch game 7.,Double Jeopardy,"(1, 3)",19th CENTURY NOVELS,1,"(1200,)",False,"""Nightmare Alley"" is 2 movies set in a traveling carnival; change the L's to get this 1818 novel set in a crumbling mansion",Nightmare Abbey,0,0
9144,2024-07-11,Isaac Hirsch game 7.,Double Jeopardy,"(2, 3)",ANIMAL SYNERGY,18,"(1200,)",False,"On the Savannah this big bird can see real good & this equine has a keen nose, so the 2, ebony & ivory, live together in harmony",zebras & ostriches,0,0
9144,2024-07-11,Isaac Hirsch game 7.,Double Jeopardy,"(3, 3)",ALPHABETICALLY LAST,23,"(1200,)",False,Of U.S. state capitals (head east),"Trenton, New Jersey",0,0
9144,2024-07-11,Isaac Hirsch game 7.,Double Jeopardy,"(4, 3)",NO. 1 ALBUMS BY PEOPLE WHO AREN'T TAYLOR SWIFT,4,"(1200,)",False,"In 2019 Taylor named this ex-Beatle whose many No. 1s include 1982's ""Tug of War"" as her second biggest influence, after her cats",McCartney,0,0
9144,2024-07-11,Isaac Hirsch game 7.,Double Jeopardy,"(5, 3)",HEIR,6,"(1200,)",False,The prophet Nathan helped convince this aged biblical king to appoint the son of Bathsheba as heir to the throne,David,0,0
9144,2024-07-11,Isaac Hirsch game 7.,Double Jeopardy,"(6, 3)","""B"" & ""B""",10,"(1200,)",False,"A Christmas story set in Russia tells of one of these, ""granny"" in Russian, who meets 3 wise men",babushka,0,0
9144,2024-07-11,Isaac Hirsch game 7.,Double Jeopardy,"(1, 4)",19th CENTURY NOVELS,2,"(1600,)",False,"""I must repair to the roulette-table"", ends chapter 1 of this Dostoyevsky tale about a young man with a compulsion",The Gambler,0,0
9144,2024-07-11,Isaac Hirsch game 7.,Double Jeopardy,"(2, 4)",ANIMAL SYNERGY,26,"(1600,)",False,The cattle species of this bird dines on insects that the water buffalo stirs up while it's grazing,egrets,0,0
9144,2024-07-11,Isaac Hirsch game 7.,Double Jeopardy,"(3, 4)",ALPHABETICALLY LAST,8,"(2000,)",True,Of the 6 U.S. presidents named James,James K. Polk,0,0
9144,2024-07-11,Isaac Hirsch game 7.,Double Jeopardy,"(4, 4)",NO. 1 ALBUMS BY PEOPLE WHO AREN'T TAYLOR SWIFT,16,"(1600,)",False,"Here's a history lesson: Both this Billy Joel song & his ""Storm Front"" album were No. 1 when Taylor was born Dec. 13, 1989","""We Didn't Start The Fire""",0,0
9144,2024-07-11,Isaac Hirsch game 7.,Double Jeopardy,"(5, 4)",HEIR,13,"(1600,)",False,"""Dark"" nickname of the heir apparent of English King Edward III, who beat the French in battle at Poitiers in 1356",the Black Prince,0,0
9144,2024-07-11,Isaac Hirsch game 7.,Double Jeopardy,"(6, 4)","""B"" & ""B""",11,"(1600,)",False,It's a statistical measure of how likely it is that some event will occur,probability,0,0
9144,2024-07-11,Isaac Hirsch game 7.,Double Jeopardy,"(1, 5)",19th CENTURY NOVELS,3,"(2000,)",False,"A love rectangle & some science lessons are part of this German author & thinker's ""Elective Affinities""",Goethe,0,0
9144,2024-07-11,Isaac Hirsch game 7.,Double Jeopardy,"(2, 5)",ANIMAL SYNERGY,25,"(2000,)",False,The Galapagos giant tortoise allows some Darwin's species of this bird to eat parasites off its skin,finches,0,0
9144,2024-07-11,Isaac Hirsch game 7.,Double Jeopardy,"(3, 5)",ALPHABETICALLY LAST,9,"(2000,)",False,Of the body's 206 bones (it makes you cheeky),zygomatic,0,0
9144,2024-07-11,Isaac Hirsch game 7.,Double Jeopardy,"(4, 5)",NO. 1 ALBUMS BY PEOPLE WHO AREN'T TAYLOR SWIFT,17,"(2000,)",False,"These emo titans whose four No. 1 albums include ""American Beauty/American Psycho"", appeared on ""Speak Now (Taylor's Version)""",Fall Out Boy,0,0
9144,2024-07-11,Isaac Hirsch game 7.,Double Jeopardy,"(5, 5)",HEIR,14,"(2000,)",False,"This Byzantine emperor, the 8th to use the name, had no male heir, so he married off his daughter Zoe so she could reign",Constantine VIII,0,0
9144,2024-07-11,Isaac Hirsch game 7.,Double Jeopardy,"(6, 5)","""B"" & ""B""",12,"(2000,)",False,"This Arabic slang word means ""my love"" or ""my darling""",habibi,0,0
9144,2024-07-11,Isaac Hirsch game 7.,Final Jeopardy,"(1, 1)",COUNTRIES OF THE WORLD,0,(),False,"Until 1991 this country named for a river had a capital whose name means ""lakes"" in Portuguese",Nigeria,0,0
