epNum,airDate,extra_info,round_name,coord,category,order,value,daily_double,question,answer,correctAttempts,wrongAttempts
9146,2024-07-15,Isaac Hirsch game 9.,Jeopardy,"(1, 1)","""I"" ON HISTORY",23,"(200,)",False,"This ""Age"" occurred in Europe around 1200 B.C.; it would hit the Far East some 600 years later",the Iron Age,0,0
9146,2024-07-15,Isaac Hirsch game 9.,Jeopardy,"(2, 1)",TV SHOWS BY CHARACTER,26,"(200,)",False,"FBI Assistant Director Walter Skinner,Teena Mulder",The X-Files,0,0
9146,2024-07-15,Isaac Hirsch game 9.,Jeopardy,"(3, 1)",COLLEGE IN NEW ENGLAND,30,"(200,)",False,"Getting into this New Hampshire Ivy? Plausible but difficult, as the acceptance rate for the 2027 class was 6.2%",Dartmouth,0,0
9146,2024-07-15,Isaac Hirsch game 9.,Jeopardy,"(4, 1)",FROM THE DUTCH,27,"(200,)",False,"From the Dutch for ""to sail to & fro"", you'll sail from island to island in the Caribbean on this pleasure trip",a cruise,0,0
9146,2024-07-15,Isaac Hirsch game 9.,Jeopardy,"(5, 1)",GOOD AFTERNOON,28,"(200,)",False,"One of Esquire's ""20 Greatest Day Drinks"" is this 2-ingredient drink; Koval is recommended for part one & Fever-Tree for part 2",a gin & tonic,0,0
9146,2024-07-15,Isaac Hirsch game 9.,Jeopardy,"(6, 1)",EXTREME WEATHER,29,"(200,)",False,"(Glen Powell presents the clue.)  Haboob is an alternate & more fun to say word for this; in 524 B.C. a haboob is said to have buried 50,000 Persian soldiers in the Egyptian desert without leaving a trace",a sandstorm,0,0
9146,2024-07-15,Isaac Hirsch game 9.,Jeopardy,"(1, 2)","""I"" ON HISTORY",22,"(400,)",False,"A 1988 cease-fire ended the war between these nations, both of which fit the category",Iraq & Iran,0,0
9146,2024-07-15,Isaac Hirsch game 9.,Jeopardy,"(2, 2)",TV SHOWS BY CHARACTER,21,"(400,)",False,"Troy Barnes,Señor Chang",Community,0,0
9146,2024-07-15,Isaac Hirsch game 9.,Jeopardy,"(3, 2)",COLLEGE IN NEW ENGLAND,25,"(400,)",False,Perhaps the Dominican Friars who founded this college in the same-named state capital in 1917 were inspired by divine...,Providence,0,0
9146,2024-07-15,Isaac Hirsch game 9.,Jeopardy,"(4, 2)",FROM THE DUTCH,19,"(400,)",False,"The Dutch for ""to boast"" gives us this word for a maneuver at the poker table",bluff,0,0
9146,2024-07-15,Isaac Hirsch game 9.,Jeopardy,"(5, 2)",GOOD AFTERNOON,9,"(400,)",False,"In the song ""Good Afternoon"" from ""Spirited"", this funny guy calls someone a ""wankerous cantankerous buffoon""",Will Ferrell,0,0
9146,2024-07-15,Isaac Hirsch game 9.,Jeopardy,"(6, 2)",EXTREME WEATHER,24,"(400,)",False,"(Daisy Edgar-Jones presents the clue.) A lethal combination of pollution & high pressure, the Great Smog that covered this capital for 5 days in 1952 claimed thousands of lives & led to changes in law",London,0,0
9146,2024-07-15,Isaac Hirsch game 9.,Jeopardy,"(1, 3)","""I"" ON HISTORY",1,"(600,)",False,This type of contract labor in which one worked for a period of time sent skilled crafters & criminals to Jamestown,indentured,0,0
9146,2024-07-15,Isaac Hirsch game 9.,Jeopardy,"(2, 3)",TV SHOWS BY CHARACTER,2,"(600,)",False,"Vault dweller Lucy MacLean,supersoldier Maximus",Fallout,0,0
9146,2024-07-15,Isaac Hirsch game 9.,Jeopardy,"(3, 3)",COLLEGE IN NEW ENGLAND,10,"(600,)",False,"In 1800 7 students enrolled at Middlebury College in this state; in 2024, 2,800 undergrads were roaming around",Vermont,0,0
9146,2024-07-15,Isaac Hirsch game 9.,Jeopardy,"(4, 3)",FROM THE DUTCH,6,"(600,)",False,The Dutch gave us this word for the sound of lips tasting food or a noisy kiss,smack,0,0
9146,2024-07-15,Isaac Hirsch game 9.,Jeopardy,"(5, 3)",GOOD AFTERNOON,8,"(600,)",False,"This afternoon, I'm going to do this portmanteau word that's restful & cold; sometimes, it's followed by ""to the max""",chillax,0,0
9146,2024-07-15,Isaac Hirsch game 9.,Jeopardy,"(6, 3)",EXTREME WEATHER,12,"(600,)",False,(Glen Powell presents the clue.) The hottest air temperature ever recorded on Earth was here in the good old U.S.A.; 134 degrees Fahrenheit in this desolately named spot near the Panamint Mountains,Death Valley,0,0
9146,2024-07-15,Isaac Hirsch game 9.,Jeopardy,"(1, 4)","""I"" ON HISTORY",7,"(800,)",False,"Queen of Castile from 1474 to 1504, she sent Columbus on his way & also helped continue the Inquisition",Isabella,0,0
9146,2024-07-15,Isaac Hirsch game 9.,Jeopardy,"(2, 4)",TV SHOWS BY CHARACTER,3,"(800,)",False,"Jason Mendoza,Tahani Al-Jamil",The Good Place,0,0
9146,2024-07-15,Isaac Hirsch game 9.,Jeopardy,"(3, 4)",COLLEGE IN NEW ENGLAND,11,"(800,)",False,"This college for women in Northampton, Mass. opened in 1875 but didn't get its first female pres. until 100 years later",Smith,0,0
9146,2024-07-15,Isaac Hirsch game 9.,Jeopardy,"(4, 4)",FROM THE DUTCH,5,"(800,)",False,This NHL franchise turning 100 in 2024 gets its name from a Dutch color word,the Boston Bruins,0,0
9146,2024-07-15,Isaac Hirsch game 9.,Jeopardy,"(5, 4)",GOOD AFTERNOON,4,"(800,)",False,"At afternoon tea,  scones might be served with Devonshire cream, also called this, for a lumpy cooking process",clotted cream,0,0
9146,2024-07-15,Isaac Hirsch game 9.,Jeopardy,"(6, 4)",EXTREME WEATHER,14,"(800,)",False,"(Daisy Edgar-Jones presents the clue.) Never mind the usual comparison to golf balls, how about a volleyball? In South Dakota in 2010, the largest of these ever measured, came down at 8 inches across & weighed about 2 pounds",a hailstone,0,0
9146,2024-07-15,Isaac Hirsch game 9.,Jeopardy,"(1, 5)","""I"" ON HISTORY",13,"(1000,)",False,Martin Luther protested against the system of these that could be purchased by church members,indulgences,0,0
9146,2024-07-15,Isaac Hirsch game 9.,Jeopardy,"(2, 5)",TV SHOWS BY CHARACTER,15,"(1000,)",False,"Billy Butcher,Shockwave,Mindstorm",The Boys,0,0
9146,2024-07-15,Isaac Hirsch game 9.,Jeopardy,"(3, 5)",COLLEGE IN NEW ENGLAND,20,"(1400,)",True,"Founded in 1948, this university was named for  this first Jewish justice on the U.S. Supreme Court",Brandeis,0,0
9146,2024-07-15,Isaac Hirsch game 9.,Jeopardy,"(4, 5)",FROM THE DUTCH,18,"(1000,)",False,"Though the French ones are a favorite at Dunkin', this deep-fried, twisted donut is from a Dutch word",a cruller,0,0
9146,2024-07-15,Isaac Hirsch game 9.,Jeopardy,"(5, 5)",GOOD AFTERNOON,17,"(1000,)",False,"Debussy wrote a musical prelude to this pastoral poem whose title includes ""l'après-midi"" in its original French",The Afternoon of a Faun,0,0
9146,2024-07-15,Isaac Hirsch game 9.,Jeopardy,"(6, 5)",EXTREME WEATHER,16,"(1000,)",False,"(Glen Powell presents the clue.) The Saffir-Simpson scale categorizing hurricanes is named in part for Robert Simpson, who was interested in meteorology from age 6 when this alliterative rise in sea level interrupted his dinner in Corpus Christi",a storm surge,0,0
9146,2024-07-15,Isaac Hirsch game 9.,Double Jeopardy,"(1, 1)",THE WORLD IN 1776,25,"(400,)",False,"In a hymn written during the year, this title precedes ""cleft for me, let me hide myself in thee""","""Rock Of Ages""",0,0
9146,2024-07-15,Isaac Hirsch game 9.,Double Jeopardy,"(2, 1)",FRUITS & VEGETABLES,28,"(400,)",False,The state fruit of Texas is the Texas Red this,a grapefruit,0,0
9146,2024-07-15,Isaac Hirsch game 9.,Double Jeopardy,"(3, 1)",ONE-WORD SONG TITLES,8,"(400,)",False,"In this song Miley Cyrus says, ""I can take myself dancing, yeah I can hold my own hand""","""Flowers""",0,0
9146,2024-07-15,Isaac Hirsch game 9.,Double Jeopardy,"(4, 1)",FASHION IN BOOKS,27,"(400,)",False,"This ghost wore a chain ""clasped about his middle"" that was made of ""cash-boxes, keys, padlocks, ledgers, deeds, & heavy purses""",Marley,0,0
9146,2024-07-15,Isaac Hirsch game 9.,Double Jeopardy,"(5, 1)",U.S. GEOGRAPHY,30,"(400,)",False,"This state capital is known as the ""Home of Abraham Lincoln""",Springfield,0,0
9146,2024-07-15,Isaac Hirsch game 9.,Double Jeopardy,"(6, 1)","TO THE ""NTH"" POWER",29,"(400,)",False,This compound obtained from peppermint oil can be used as a topical ointment,menthol,0,0
9146,2024-07-15,Isaac Hirsch game 9.,Double Jeopardy,"(1, 2)",THE WORLD IN 1776,24,"(800,)",False,"The Revolution was struggling when the Brits took Fort Lee in this state, future home of Dr. Joyce Brothers & Mr. Richard Feder",New Jersey,0,0
9146,2024-07-15,Isaac Hirsch game 9.,Double Jeopardy,"(2, 2)",FRUITS & VEGETABLES,23,"(800,)",False,Patate douce is the French name for this,sweet potato,0,0
9146,2024-07-15,Isaac Hirsch game 9.,Double Jeopardy,"(3, 2)",ONE-WORD SONG TITLES,7,"(800,)",False,"Her No. 1 hits include ""Hero"", ""Emotions"" & ""Dreamlover""",Mariah Carey,0,0
9146,2024-07-15,Isaac Hirsch game 9.,Double Jeopardy,"(4, 2)",FASHION IN BOOKS,26,"(3000,)",True,Aunt Alexandra & Atticus Finch get into an argument about this narrator wearing overalls,Scout,0,0
9146,2024-07-15,Isaac Hirsch game 9.,Double Jeopardy,"(5, 2)",U.S. GEOGRAPHY,17,"(800,)",False,The Mystic & the Charles Rivers meet at this harbor whose waters have tasted some history,Boston Harbor,0,0
9146,2024-07-15,Isaac Hirsch game 9.,Double Jeopardy,"(6, 2)","TO THE ""NTH"" POWER",19,"(800,)",False,"On this type of schedule, you usually get paid on the 1st & 15th",bimonthly,0,0
9146,2024-07-15,Isaac Hirsch game 9.,Double Jeopardy,"(1, 3)",THE WORLD IN 1776,5,"(1200,)",False,Pedro de Cevallos was named the first viceroy of this South American region that shares its name with an estuary,the Rio de la Plata region,0,0
9146,2024-07-15,Isaac Hirsch game 9.,Double Jeopardy,"(2, 3)",FRUITS & VEGETABLES,20,"(1200,)",False,Seen here is the white variety of this fruit still on the branches; the leaves are a favorite of silkworms,mulberry,0,0
9146,2024-07-15,Isaac Hirsch game 9.,Double Jeopardy,"(3, 3)",ONE-WORD SONG TITLES,2,"(1200,)",False,"""This is it, the apocalypse... welcome to the New Age"" & this Top 10 hit from Imagine Dragons","""Radioactive""",0,0
9146,2024-07-15,Isaac Hirsch game 9.,Double Jeopardy,"(4, 3)",FASHION IN BOOKS,10,"(1200,)",False,"A ""kilt skirt & a big white hat"" is one outfit that made this ""Little"" title boy a byword for fancy dressing",Little Lord Fauntleroy,0,0
9146,2024-07-15,Isaac Hirsch game 9.,Double Jeopardy,"(5, 3)",U.S. GEOGRAPHY,1,"(1200,)",False,"From Cheyenne, Wyoming, it's less than an hour south on I-25 to Fort Collins & this university, CSU",Colorado State Universtity,0,0
9146,2024-07-15,Isaac Hirsch game 9.,Double Jeopardy,"(6, 3)","TO THE ""NTH"" POWER",14,"(1200,)",False,This structure at Chartres Cathedral once bore an image of Theseus,the labyrinth,0,0
9146,2024-07-15,Isaac Hirsch game 9.,Double Jeopardy,"(1, 4)",THE WORLD IN 1776,6,"(1600,)",False,"November 1, 1776 is observed as the founding date of this 7th mission in California; no word as to exactly when the swallows came",(San Juan) Capistrano,0,0
9146,2024-07-15,Isaac Hirsch game 9.,Double Jeopardy,"(2, 4)",FRUITS & VEGETABLES,21,"(1600,)",False,"From its scientific name, Helianthus tuberosus, the Jerusalem artichoke is also known by this one-word name",a sunchoke,0,0
9146,2024-07-15,Isaac Hirsch game 9.,Double Jeopardy,"(3, 4)",ONE-WORD SONG TITLES,3,"(1600,)",False,It put Cher on top of the charts in 1999 & earned her a Grammy for Best Dance Recording,"""Believe""",0,0
9146,2024-07-15,Isaac Hirsch game 9.,Double Jeopardy,"(4, 4)",FASHION IN BOOKS,11,"(1600,)",False,"We're told this character ""always wears a single white Hermes scarf"" &, we can assume from the title, she also wears Prada",Miranda Priestly,0,0
9146,2024-07-15,Isaac Hirsch game 9.,Double Jeopardy,"(5, 4)",U.S. GEOGRAPHY,9,"(1600,)",False,"This bay, an inlet of Lake Huron, separates Michigan's ""thumb"" from the rest of the mitten-shaped Lower Peninsula",Saginaw Bay,0,0
9146,2024-07-15,Isaac Hirsch game 9.,Double Jeopardy,"(6, 4)","TO THE ""NTH"" POWER",15,"(1600,)",False,It's a square block serving as a base to a sculpture,a plinth,0,0
9146,2024-07-15,Isaac Hirsch game 9.,Double Jeopardy,"(1, 5)",THE WORLD IN 1776,13,"(3000,)",True,Alessandro Volta noted bubbles rising from marshy water & identified this gas,methane,0,0
9146,2024-07-15,Isaac Hirsch game 9.,Double Jeopardy,"(2, 5)",FRUITS & VEGETABLES,22,"(2000,)",False,"There's beauty in nature, even in veggies, like the cauliflower cultivar with this 9-letter Italian name",Romanesco,0,0
9146,2024-07-15,Isaac Hirsch game 9.,Double Jeopardy,"(3, 5)",ONE-WORD SONG TITLES,4,"(2000,)",False,"In a Reba McEntire hit, a mother to her daughter: ""Here's your one chance"", her, ""don't let me down""","""Fancy""",0,0
9146,2024-07-15,Isaac Hirsch game 9.,Double Jeopardy,"(4, 5)",FASHION IN BOOKS,12,"(2000,)",False,"This ""American Psycho"" outlines his morning routine & puts on a suit from Alan Flusser, ""an eighties drape suit""",(Patrick) Bateman,0,0
9146,2024-07-15,Isaac Hirsch game 9.,Double Jeopardy,"(5, 5)",U.S. GEOGRAPHY,16,"(2000,)",False,"During winter, it's possible in theory but a bad idea to walk across the ice from this ""Little"" Alaskan island to a nearby Russian isle",Little Diomede,0,0
9146,2024-07-15,Isaac Hirsch game 9.,Double Jeopardy,"(6, 5)","TO THE ""NTH"" POWER",18,"(2000,)",False,We thought all these fishy fellas were dead until Marjorie Courtenay-Latimer found one by the harbor & took it to her lab by cab,a coelacanth,0,0
9146,2024-07-15,Isaac Hirsch game 9.,Final Jeopardy,"(1, 1)",NEWER WORDS,0,(),False,"Philosophers use it for language that accompanies an action, like ""I dub thee knight""; it also means done for show or signal",performative,0,0
