epNum,airDate,extra_info,round_name,coord,category,order,value,daily_double,question,answer,correctAttempts,wrongAttempts
9149,2024-07-18,,Jeopardy,"(1, 1)",AMERICA ON STAMPS,14,"(200,)",False,"The Wonders of America Superlative Series includes Steamboat, the tallest active one of these",a geyser,0,0
9149,2024-07-18,,Jeopardy,"(2, 1)","THAT'S ""AA""WESOME",27,"(200,)",False,Mr. Judge or Mr. Sorkin,Aaron,0,0
9149,2024-07-18,,Jeopardy,"(3, 1)",GEOLOGY,30,"(200,)",False,18th century German geologist Abraham Werner was called a neptunist because he believed all rocks originated from here,the ocean,0,0
9149,2024-07-18,,Jeopardy,"(4, 1)",AN ASIAN CAPITAL IDEA,11,"(200,)",False,The job of guarding the Ho Chi Minh Mausoleum in this capital is a high honor,Hanoi,0,0
9149,2024-07-18,,Jeopardy,"(5, 1)",THEY MAKE THAT,26,"(200,)",False,The Coppertop battery,Duracell,0,0
9149,2024-07-18,,Jeopardy,"(6, 1)",THE OSCAR & RAZZIE WINNER,17,"(200,)",False,"Let's just say his work was more well-received for ""The Godfather"" than ""The Island of Dr. Moreau""",Brando,0,0
9149,2024-07-18,,Jeopardy,"(1, 2)",AMERICA ON STAMPS,13,"(400,)",False,"The Historic Preservation stamps of the 1970s included Decatur House in Washington, D.C. & a cable car in this city",San Francisco,0,0
9149,2024-07-18,,Jeopardy,"(2, 2)","THAT'S ""AA""WESOME",22,"(400,)",False,"The animated star of his own show on PBS, Arthur Read is just an average 8-year-old one of these insectivores",an aardvark,0,0
9149,2024-07-18,,Jeopardy,"(3, 2)",GEOLOGY,4,"(400,)",False,"This word is followed by ""-ification"" when plants transform into a combustible solid with increased carbon content",coal,0,0
9149,2024-07-18,,Jeopardy,"(4, 2)",AN ASIAN CAPITAL IDEA,10,"(400,)",False,"A Friendship Bridge across the Mekong River connects Nong Khai, Thailand with this capital of Laos",Vientiane,0,0
9149,2024-07-18,,Jeopardy,"(5, 2)",THEY MAKE THAT,15,"(400,)",False,Baseball Nut & Gold Medal Ribbon ice cream,Baskin-Robbins,0,0
9149,2024-07-18,,Jeopardy,"(6, 2)",THE OSCAR & RAZZIE WINNER,18,"(400,)",False,"Some days, you're golden in ""The Revenant""; others, you're just another metal in ""The Man in the Iron Mask""",DiCaprio,0,0
9149,2024-07-18,,Jeopardy,"(1, 3)",AMERICA ON STAMPS,12,"(600,)",False,This tall monument has been featured on its own stamp as well as on the Greetings from Missouri stamp,the St. Louis Arch (the Gateway Arch),0,0
9149,2024-07-18,,Jeopardy,"(2, 3)","THAT'S ""AA""WESOME",21,"(600,)",False,Cape Dutch is another name for this language,Afrikaans,0,0
9149,2024-07-18,,Jeopardy,"(3, 3)",GEOLOGY,3,"(600,)",False,"250 million years ago at the start of this period without a movie ""Park"", all the land masses were basically one supercontinent",Triassic,0,0
9149,2024-07-18,,Jeopardy,"(4, 3)",AN ASIAN CAPITAL IDEA,8,"(600,)",False,"Highlighted here, this city is known as Al-Fayha, ""the fragrant"", perhaps for its orchards",Damascus,0,0
9149,2024-07-18,,Jeopardy,"(5, 3)",THEY MAKE THAT,16,"(600,)",False,The WetJet mop starter kit,Swiffer,0,0
9149,2024-07-18,,Jeopardy,"(6, 3)",THE OSCAR & RAZZIE WINNER,20,"(600,)",False,"Life was an Oscar ""Cabaret"" for her but she also won a Razzie with a Z for ""Arthur 2: On the Rocks""",Minnelli,0,0
9149,2024-07-18,,Jeopardy,"(1, 4)",AMERICA ON STAMPS,1,"(800,)",False,"A 1996 stamp celebrating the 150th anniversary of Iowa's statehood was based on this native son's ""Young Corn"" painting",(Grant) Wood,0,0
9149,2024-07-18,,Jeopardy,"(2, 4)","THAT'S ""AA""WESOME",23,"(800,)",False,You can take your Saab to this transmission service center co-founded by Robert Morgan,AAMCO,0,0
9149,2024-07-18,,Jeopardy,"(3, 4)",GEOLOGY,5,"(1600,)",True,An attraction at Carlsbad Caverns is one of these long formations known as the Sword of Damocles,a stalactite,0,0
9149,2024-07-18,,Jeopardy,"(4, 4)",AN ASIAN CAPITAL IDEA,7,"(800,)",False,"Before containing ""stan"" like its country, this city was known over time as Akmolinsk, Nur-Sultan & also Aqmola",Astana,0,0
9149,2024-07-18,,Jeopardy,"(5, 4)",THEY MAKE THAT,19,"(800,)",False,The trademarked version of Tater Tots: this brand,Ore-Ida,0,0
9149,2024-07-18,,Jeopardy,"(6, 4)",THE OSCAR & RAZZIE WINNER,28,"(800,)",False,"For her, ""The Hours"" was time well-spent but ""Bewitched"" bothered & bewildered people",Kidman,0,0
9149,2024-07-18,,Jeopardy,"(1, 5)",AMERICA ON STAMPS,2,"(1000,)",False,"Inspired by its official bird, the scissor-tailed flycatcher, this state's Skydance Bridge spanned a stamp in 2023",Oklahoma,0,0
9149,2024-07-18,,Jeopardy,"(2, 5)","THAT'S ""AA""WESOME",24,"(1000,)",False,This region is mentioned in Phoenician writings from about 1500 B.C. as a land west of the Jordan River,Canaan,0,0
9149,2024-07-18,,Jeopardy,"(3, 5)",GEOLOGY,6,"(1000,)",False,Aeolian landforms such as dunes & ripple ridges are shaped by the action of this,wind,0,0
9149,2024-07-18,,Jeopardy,"(4, 5)",AN ASIAN CAPITAL IDEA,9,"(1000,)",False,The downtown of the central part of this city on the Mediterranean was destroyed by a civil war that ended in 1990,Beirut,0,0
9149,2024-07-18,,Jeopardy,"(5, 5)",THEY MAKE THAT,25,"(1000,)",False,The Artisan Series 5 Quart Tilt-Head Stand Mixer,KitchenAid,0,0
9149,2024-07-18,,Jeopardy,"(6, 5)",THE OSCAR & RAZZIE WINNER,29,"(1000,)",False,"His producing ""12 Years a Slave"" was a triumph; playing Louis in ""Interview with the Vampire"", a different type of ""win""",Brad Pitt,0,0
9149,2024-07-18,,Double Jeopardy,"(1, 1)","SOME HATS, SOME CATTLE",29,"(400,)",False,"The medieval Latin birretum gives us this word for a soft, round, flat hat, oui?",a beret,0,0
9149,2024-07-18,,Double Jeopardy,"(2, 1)",POP CULTURE GRAB BAG,1,"(400,)",False,A team of 4 created this 2009 physics-based Rovio game in which you adjust the trajectory of a slingshot; how addictive!,Angry Birds,0,0
9149,2024-07-18,,Double Jeopardy,"(3, 1)",HISTORY,8,"(400,)",False,"Based on a concept agreed to at the 1919 Paris Peace Conference, this intl. association was formed to maintain world peace",the League of Nations,0,0
9149,2024-07-18,,Double Jeopardy,"(4, 1)",WORLD HERITAGE SITES,30,"(400,)",False,"6 sites in Colombia make up a ""cultural landscape"" devoted to the growing & processing of this crop",coffee,0,0
9149,2024-07-18,,Double Jeopardy,"(5, 1)",IN THE BOOKSTORE,23,"(400,)",False,"""Moby-Dick"" begins with one of the most famous first lines in literature--these 3 words",Call me Ishmael,0,0
9149,2024-07-18,,Double Jeopardy,"(6, 1)","NUDE,  TO THE OED",24,"(400,)",False,The OED uses both the R-E & E-R spelling for this word referring to a person appearing nude in a magazine,centrefold (centerfold),0,0
9149,2024-07-18,,Double Jeopardy,"(1, 2)","SOME HATS, SOME CATTLE",10,"(800,)",False,"This ""helmet"" popular with explorers & postal workers gets its name from the dried tree substance it's made from",pith,0,0
9149,2024-07-18,,Double Jeopardy,"(2, 2)",POP CULTURE GRAB BAG,11,"(800,)",False,"""Atomic Shakespeare"" & ""Maddie Hayes Got Married"" were episodes of this 1980s TV series",Moonlighting,0,0
9149,2024-07-18,,Double Jeopardy,"(3, 2)",HISTORY,2,"(1000,)",True,"In 1899 in his mid-20s, Winston Churchill was captured & imprisoned during this war, escaping a short time later",the Boer War,0,0
9149,2024-07-18,,Double Jeopardy,"(4, 2)",WORLD HERITAGE SITES,9,"(800,)",False,Armenia's Azat Valley is home to one of these religious retreats cut from rock between the 4th & 13th centuries,a monastery,0,0
9149,2024-07-18,,Double Jeopardy,"(5, 2)",IN THE BOOKSTORE,22,"(800,)",False,"This Stephen King novel about a world blasted by plague was reissued in 1990, restoring some 150,000 deleted words",The Stand,0,0
9149,2024-07-18,,Double Jeopardy,"(6, 2)","NUDE,  TO THE OED",18,"(800,)",False,"When you've stripped down, you're ""wearing"" this festive-sounding outfit (that really means you're nude)",birthday suit,0,0
9149,2024-07-18,,Double Jeopardy,"(1, 3)","SOME HATS, SOME CATTLE",12,"(1200,)",False,Want coverage from the sun? Try this hat named for a beach job,a lifeguard hat,0,0
9149,2024-07-18,,Double Jeopardy,"(2, 3)",POP CULTURE GRAB BAG,25,"(1200,)",False,"This 2020 Switch game from Nintendo was subtitled ""New Horizons""",Animal Crossing,0,0
9149,2024-07-18,,Double Jeopardy,"(3, 3)",HISTORY,3,"(1200,)",False,In August 1947 these 2 Asian nations gained independence from Great Britain,Pakistan & India,0,0
9149,2024-07-18,,Double Jeopardy,"(4, 3)",WORLD HERITAGE SITES,26,"(1200,)",False,"Come with me to this section of Algiers, with palaces & the remains of the Old Citadel",the Casbah,0,0
9149,2024-07-18,,Double Jeopardy,"(5, 3)",IN THE BOOKSTORE,17,"(1200,)",False,"His ""A Knight of the Seven Kingdoms"" takes place nearly a century before the events of ""A Game of Thrones""",Martin,0,0
9149,2024-07-18,,Double Jeopardy,"(6, 3)","NUDE,  TO THE OED",19,"(1200,)",False,"""Death Becomes Her"" used Catherine Bell as one of these, defined by the OED as a stand-in for nude or explicit movie scenes",a body double,0,0
9149,2024-07-18,,Double Jeopardy,"(1, 4)","SOME HATS, SOME CATTLE",13,"(1600,)",False,"The name of this cattle breed prized for its marbled beef literally means ""Japanese cow""",wagyu,0,0
9149,2024-07-18,,Double Jeopardy,"(2, 4)",POP CULTURE GRAB BAG,27,"(1600,)",False,Sam Esmail created this TV drama about a computer programmer by day who's a hacker in his off hours,Mr. Robot,0,0
9149,2024-07-18,,Double Jeopardy,"(3, 4)",HISTORY,4,"(1600,)",False,"Succeeding his grandfather Maximilian in 1519, Charles I of Spain ascended to this more lofty imperial title as Charles V",Holy Roman Emperor,0,0
9149,2024-07-18,,Double Jeopardy,"(4, 4)",WORLD HERITAGE SITES,7,"(3400,)",True,"The great spa towns of Europe  encompass 11 towns in 7 countries, including this French one of World War II infamy",Vichy,0,0
9149,2024-07-18,,Double Jeopardy,"(5, 4)",IN THE BOOKSTORE,15,"(1600,)",False,"The cruel Mrs. Reed loathes this niece, the title character of a Brontë novel, & deprives her of an inheritance",Jane Eyre,0,0
9149,2024-07-18,,Double Jeopardy,"(6, 4)","NUDE,  TO THE OED",20,"(1600,)",False,Naked may be used on its own or be preceded by this 5-letter word that can mean harsh or severe,stark,0,0
9149,2024-07-18,,Double Jeopardy,"(1, 5)","SOME HATS, SOME CATTLE",14,"(2000,)",False,Henry Clay introduced this popular cattle breed to the U.S. from England in 1817,Hereford,0,0
9149,2024-07-18,,Double Jeopardy,"(2, 5)",POP CULTURE GRAB BAG,28,"(2000,)",False,"It was fire on ice when D.B. Sweeney & Moira Kelly paired up in this 1992 film, the ultimate love-skate relationship",The Cutting Edge,0,0
9149,2024-07-18,,Double Jeopardy,"(3, 5)",HISTORY,5,"(2000,)",False,"While searching for treasure, this explorer & conquistador became the first European to document the Mississippi River",de Soto,0,0
9149,2024-07-18,,Double Jeopardy,"(4, 5)",WORLD HERITAGE SITES,6,"(2000,)",False,Australia's Shark Bay is notable not just for sharks but for these Indo-Pacific sea cows with a name from Malay,dugong,0,0
9149,2024-07-18,,Double Jeopardy,"(5, 5)",IN THE BOOKSTORE,16,"(2000,)",False,"In 1993 this African-American sci-fi writer published ""The Parable of the Sower"", about chaos in 2020s California",(Octavia) Butler,0,0
9149,2024-07-18,,Double Jeopardy,"(6, 5)","NUDE,  TO THE OED",21,"(2000,)",False,Turns out this story (& the title outfit) by Hans Christian Andersen leave both too little & too much to the imagination,"""The Emperor's New Clothes""",0,0
9149,2024-07-18,,Final Jeopardy,"(1, 1)",SHOW BIZ MARRIAGES,0,(),False,"Married since 1977, the year of this band's 1st album, 2 members referenced another album with their 2023 ""Remain in Love"" tour",Talking Heads,0,0
