epNum,airDate,extra_info,round_name,coord,category,order,value,daily_double,question,answer,correctAttempts,wrongAttempts
9162,2024-09-17,,Jeopardy,"(1, 1)",HISTORICAL DECISIONS,8,"(200,)",False,"Low visibility at the city of Kokura on August 9, 1945 caused a B-29 bomber to change its course & fly to this city",Nagasaki,0,0
9162,2024-09-17,,Jeopardy,"(2, 1)",PHILADELPHIA,30,"(200,)",False,"The Phillies' old home Baker Bowl had a RF wall just 280' from the plate, helping Chuck Klein set a league record--43 these in 1929",home runs (homers),0,0
9162,2024-09-17,,Jeopardy,"(3, 1)",OUT THERE IN RADIO LAND,29,"(200,)",False,"In 1975 the FCC was a good buddy to users of this radio system, reducing the license fee from $20 to $4",CB,0,0
9162,2024-09-17,,Jeopardy,"(4, 1)",HODGEPODGE,28,"(200,)",False,"In 1884 Dow Jones created its first index consisting of 11 stocks, mainly railroads, but also this telegraph company--STOP.",Western Union,0,0
9162,2024-09-17,,Jeopardy,"(5, 1)",ABOUT THE AUTHOR,1,"(200,)",False,"He was still in Harvard Med School when he sold the movie rights to ""The Andromeda Strain""; yeah, he never did practice",Michael Crichton,0,0
9162,2024-09-17,,Jeopardy,"(6, 1)","""IZE"" & ""EERS""",20,"(200,)",False,To set 2 watches to precisely the same time,synchronize,0,0
9162,2024-09-17,,Jeopardy,"(1, 2)",HISTORICAL DECISIONS,7,"(400,)",False,He decided against a New World empire after his brother-in-law Charles Leclerc died of yellow fever in Haiti in 1802,Napoleon,0,0
9162,2024-09-17,,Jeopardy,"(2, 2)",PHILADELPHIA,26,"(400,)",False,"Mac's Tavern in Old City was co-founded by Kaitlin Olson & Rob McElhenney, who hang out at a different bar on this TV show",It's Always Sunny in Philadelphia,0,0
9162,2024-09-17,,Jeopardy,"(3, 2)",OUT THERE IN RADIO LAND,15,"(400,)",False,Arr!  In the 1960s these unlicensed stations broadcast from ships off the British coast to fans tired of the straitlaced BBC,pirate radio,0,0
9162,2024-09-17,,Jeopardy,"(4, 2)",HODGEPODGE,27,"(400,)",False,"Before moving to the Vatican, Pope Francis was archbishop of this city of his birth",Buenos Aires,0,0
9162,2024-09-17,,Jeopardy,"(5, 2)",ABOUT THE AUTHOR,2,"(400,)",False,"He studied accounting at Mississippi St., law at Ole Miss, then changed careers & wrote 49 straight No. 1 bestsellers",John Grisham,0,0
9162,2024-09-17,,Jeopardy,"(6, 2)","""IZE"" & ""EERS""",21,"(400,)",False,This term for a trio of close associates comes from an 1844 novel,Three Musketeers,0,0
9162,2024-09-17,,Jeopardy,"(1, 3)",HISTORICAL DECISIONS,4,"(600,)",False,"General Lee decided on a charge to take Cemetery Hill on July 3, 1863 during this battle",Gettysburg,0,0
9162,2024-09-17,,Jeopardy,"(2, 3)",PHILADELPHIA,10,"(600,)",False,Architect Julian Abele couldn't have known his steps at the Philadelphia Museum of Art would one day bear this character's name,Rocky,0,0
9162,2024-09-17,,Jeopardy,"(3, 3)",OUT THERE IN RADIO LAND,12,"(600,)",False,"Todd Storz, owner of KOHW in Omaha, is credited with pioneering this numerical hit radio format in the 1950s",Top 40,0,0
9162,2024-09-17,,Jeopardy,"(4, 3)",HODGEPODGE,17,"(600,)",False,Someone who has nephophobia shouldn't have his head in these,the clouds,0,0
9162,2024-09-17,,Jeopardy,"(5, 3)",ABOUT THE AUTHOR,3,"(600,)",False,"Back from Burma in the 1930s, this Brit took his pen name from the reigning king & a local river",George Orwell,0,0
9162,2024-09-17,,Jeopardy,"(6, 3)","""IZE"" & ""EERS""",22,"(600,)",False,"Refined & sophisticated, or at an advanced stage of cultural & social development",civilized,0,0
9162,2024-09-17,,Jeopardy,"(1, 4)",HISTORICAL DECISIONS,5,"(800,)",False,"Before deciding to cross this stream, Julius Caesar apparently saw an apparition with a trumpet",the Rubicon,0,0
9162,2024-09-17,,Jeopardy,"(2, 4)",PHILADELPHIA,11,"(800,)",False,"Philly is not just the City of Brotherly Love, it's the city of this guy from Center City & his band Special Sauce",G. Love,0,0
9162,2024-09-17,,Jeopardy,"(3, 4)",OUT THERE IN RADIO LAND,13,"(3200,)",True,Robert Plant made a pledge to Portland's KBOO after hearing a DJ promise never to play this song if listeners donated,"""Stairway To Heaven""",0,0
9162,2024-09-17,,Jeopardy,"(4, 4)",HODGEPODGE,19,"(800,)",False,"Roy Frowick, who began designing women's wear in the 1960s, dropped his first & last names & went by this middle name",Halston,0,0
9162,2024-09-17,,Jeopardy,"(5, 4)",ABOUT THE AUTHOR,9,"(800,)",False,"She got her M.A. in linguistics, went to China for the first time in 1987, put 3 short stories in novel form & had ""luck"" with that",Amy Tan,0,0
9162,2024-09-17,,Jeopardy,"(6, 4)","""IZE"" & ""EERS""",23,"(800,)",False,"It's a lightweight, puckered fabric of linen or cotton",seersucker,0,0
9162,2024-09-17,,Jeopardy,"(1, 5)",HISTORICAL DECISIONS,6,"(1000,)",False,Around 539 B.C. this ruler permitted the Jewish exiles of Babylon to return to their homeland,Cyrus the Great,0,0
9162,2024-09-17,,Jeopardy,"(2, 5)",PHILADELPHIA,25,"(1000,)",False,"(Jason Kelce presents the clue.) In 2023, my brother Travis & I had our first of what I can only assume will be many Billboard No. 1 hits with ""Fairytale Of Philadelphia"", including the line, ""You promised me"", this famous street ""was waiting for me""",Broad Street,0,0
9162,2024-09-17,,Jeopardy,"(3, 5)",OUT THERE IN RADIO LAND,14,"(1000,)",False,In 2008 the Justice Department approved the merger creating this satellite radio behemoth,SiriusXM,0,0
9162,2024-09-17,,Jeopardy,"(4, 5)",HODGEPODGE,18,"(1000,)",False,"With the exception of Ceres, the 4 other recognized dwarf planets all lie in this ""belt"" beyond Neptune's orbit",the Kuiper belt,0,0
9162,2024-09-17,,Jeopardy,"(5, 5)",ABOUT THE AUTHOR,16,"(1000,)",False,"Him: ""Once I found myself on the other side of the ocean, I see where I came from; I am the grandson of a slave and I am a writer""",Baldwin,0,0
9162,2024-09-17,,Jeopardy,"(6, 5)","""IZE"" & ""EERS""",24,"(1000,)",False,"To form a solid made of atoms in symmetry, like feldspar or quartz",crystallize,0,0
9162,2024-09-17,,Double Jeopardy,"(1, 1)",FIRST LADIES' FIRST NAMES,3,"(400,)",False,"Married to Harry Truman, the former Elizabeth Virginia Wallace went by this",Bess,0,0
9162,2024-09-17,,Double Jeopardy,"(2, 1)",PLACING SOME GEOGRAPHY,19,"(400,)",False,"January temperature averages are in the 70s in this Chilean capital, but bring a coat in July, when the figure is in the 30s",Santiago,0,0
9162,2024-09-17,,Double Jeopardy,"(3, 1)",SHORT-TITLED FILMS,26,"(400,)",False,"Flo's V-8 cafe, which serves the ""finest fuel in 50 states"", is the only gas station in Radiator Springs in this 2006 Pixar film",Cars,0,0
9162,2024-09-17,,Double Jeopardy,"(4, 1)",CONVERSATIONAL VOCABULARY,29,"(400,)",False,"Franklin D. Roosevelt had some 30 ""fireside"" ones with the American people",chats,0,0
9162,2024-09-17,,Double Jeopardy,"(5, 1)",MYTHOLOGICAL BROMANCE,30,"(400,)",False,"In a work by Chrétien de Troyes, this knight is a little too friendly with the wife of his homie King Arthur",Lancelot,0,0
9162,2024-09-17,,Double Jeopardy,"(6, 1)",SUPER HOT FIRE,28,"(400,)",False,Orion sells a 5-minute type of this safety product to signal distress on the side of a highway,a flare,0,0
9162,2024-09-17,,Double Jeopardy,"(1, 2)",FIRST LADIES' FIRST NAMES,4,"(800,)",False,Claudia was the real first name of the 20th century first lady who went by this nickname,Lady Bird Johnson,0,0
9162,2024-09-17,,Double Jeopardy,"(2, 2)",PLACING SOME GEOGRAPHY,18,"(800,)",False,"This desert runs north-south for 100 miles at its longest point, if you ""Botswana"" know",the Kalahari,0,0
9162,2024-09-17,,Double Jeopardy,"(3, 2)",SHORT-TITLED FILMS,20,"(800,)",False,In this 2010 film Angelina Jolie plays a CIA agent accused of being a Russian spy,Salt,0,0
9162,2024-09-17,,Double Jeopardy,"(4, 2)",CONVERSATIONAL VOCABULARY,25,"(800,)",False,"Called ""Mr. Chicago"", Irv Kupcinet was this type of gabby columnist for the Sun-Times for decades",a gossip columnist,0,0
9162,2024-09-17,,Double Jeopardy,"(5, 2)",MYTHOLOGICAL BROMANCE,27,"(800,)",False,"In ""Ivanhoe"" Robin Hood says he is occasionally ""displeased by the freedom of"" this buddy's advice",Little John,0,0
9162,2024-09-17,,Double Jeopardy,"(6, 2)",SUPER HOT FIRE,13,"(800,)",False,The name of this indie band was based on a story Win Butler heard about a conflagration in an amusement hall,Arcade Fire,0,0
9162,2024-09-17,,Double Jeopardy,"(1, 3)",FIRST LADIES' FIRST NAMES,5,"(1200,)",False,The 2 Mrs. Wilsons were Ellen & her,Edith,0,0
9162,2024-09-17,,Double Jeopardy,"(2, 3)",PLACING SOME GEOGRAPHY,15,"(1200,)",False,"Belene, Bulgaria's biggest island, splits this river in 2 on its way to the Black Sea",the Danube,0,0
9162,2024-09-17,,Double Jeopardy,"(3, 3)",SHORT-TITLED FILMS,8,"(1200,)",False,Cameos in this 1991 Dustin Hoffman film included Jimmy Buffett as a shoe-stealing pirate,Hook,0,0
9162,2024-09-17,,Double Jeopardy,"(4, 3)",CONVERSATIONAL VOCABULARY,1,"(1200,)",False,This kind of one-on-one conversation is French for head to head,tête-à-tête,0,0
9162,2024-09-17,,Double Jeopardy,"(5, 3)",MYTHOLOGICAL BROMANCE,12,"(1200,)",False,In one tale this partyin' god gets his boy Hephaestus drunk & has him agree to free Hera from a chair,Dionysus,0,0
9162,2024-09-17,,Double Jeopardy,"(6, 3)",SUPER HOT FIRE,14,"(1200,)",False,"""Tonight's The Night"" was used in ads for this brand of artificial log",Duraflame,0,0
9162,2024-09-17,,Double Jeopardy,"(1, 4)",FIRST LADIES' FIRST NAMES,6,"(1600,)",False,"Mrs. John Quincy Adams, our only English-born first lady had this first name",Louisa (Adams),0,0
9162,2024-09-17,,Double Jeopardy,"(2, 4)",PLACING SOME GEOGRAPHY,16,"(3600,)",True,"""Walking the Length of"" this country ""in a Weekend"" took a journalist along the Rhine to its southern border with Switzerland",Liechtenstein,0,0
9162,2024-09-17,,Double Jeopardy,"(3, 4)",SHORT-TITLED FILMS,10,"(1600,)",False,Walt Disney saw Fess Parker's small role in this 1954 film about giant ants & picked him to play Davy Crockett for his TV series,Them!,0,0
9162,2024-09-17,,Double Jeopardy,"(4, 4)",CONVERSATIONAL VOCABULARY,2,"(1600,)",False,"In competitive debate, it's a speech that refutes the other team's arguments & rebuilds one's own",a rebuttal,0,0
9162,2024-09-17,,Double Jeopardy,"(5, 4)",MYTHOLOGICAL BROMANCE,23,"(3000,)",True,"Our time has Damon & Affleck; Greek legend had Damon & him, whose bond led the tyrant of Syracuse to spare them",Pythias,0,0
9162,2024-09-17,,Double Jeopardy,"(6, 4)",SUPER HOT FIRE,21,"(1600,)",False,"It's the explosive name of the conspiracy foiled in England, now commemorated in November with bonfires",the Gunpowder Plot,0,0
9162,2024-09-17,,Double Jeopardy,"(1, 5)",FIRST LADIES' FIRST NAMES,7,"(2000,)",False,"The first lady with this first name died in Canton, Ohio in 1907",Ida (McKinley),0,0
9162,2024-09-17,,Double Jeopardy,"(2, 5)",PLACING SOME GEOGRAPHY,17,"(2000,)",False,"Named for a world leader & not Harriet, Tubmanburg is a city in the west of this nation that's slightly larger than Ohio",Liberia,0,0
9162,2024-09-17,,Double Jeopardy,"(3, 5)",SHORT-TITLED FILMS,9,"(2000,)",False,"Director Fritz Lang's first talkie, it featured Peter Lorre as a serial child killer",M,0,0
9162,2024-09-17,,Double Jeopardy,"(4, 5)",CONVERSATIONAL VOCABULARY,11,"(2000,)",False,"It means the person with whom you're speaking; add ""Y"" to describe a temporary legal decree",interlocutor,0,0
9162,2024-09-17,,Double Jeopardy,"(5, 5)",MYTHOLOGICAL BROMANCE,24,"(2000,)",False,The Egyptian god Anubis is often depicted as the Johnny-on-the-spot of this lord & judge of the underworld,Osiris,0,0
9162,2024-09-17,,Double Jeopardy,"(6, 5)",SUPER HOT FIRE,22,"(2000,)",False,"Celtic for ""end of summer"", this pagan fire festival was a precursor to All Hallows' Eve",Samhain,0,0
9162,2024-09-17,,Final Jeopardy,"(1, 1)",CHARACTERS IN BOOK SERIES,0,(),False,"This 12-year-old began his first book saying, ""Look, I didn't want to be a half-blood""",Percy Jackson (Perseus Jackson),0,0
