epNum,airDate,extra_info,round_name,coord,category,order,value,daily_double,question,answer,correctAttempts,wrongAttempts
9172,2024-10-01,Ryan Manton game 2.,Jeopardy,"(1, 1)",19th CENTURY CULTURE TRIP,21,"(200,)",False,"Johnny Appleseed gained fame bringing apples to the frontier, most of which were used to make this ""hard"" drink",hard cider,0,0
9172,2024-10-01,Ryan Manton game 2.,Jeopardy,"(2, 1)",LUNAR FEATURES,23,"(200,)",False,"India's Chandrayaan-3 landed near the Moon's South Pole & searched for this resource, hiding in shadowed craters",water,0,0
9172,2024-10-01,Ryan Manton game 2.,Jeopardy,"(3, 1)",TOYS & GAMES,24,"(200,)",False,Players in this board game once navigated the Molasses Swamp & Ice Cream Floats on a rainbow path,Candy Land,0,0
9172,2024-10-01,Ryan Manton game 2.,Jeopardy,"(4, 1)",AIRPORTS,26,"(200,)",False,"It's the main airport serving London, & also the busiest",Heathrow,0,0
9172,2024-10-01,Ryan Manton game 2.,Jeopardy,"(5, 1)",NAME THE CLASSIC BAND: A READING,29,"(200,)",False,"""Young man, there's a place you can go / I said, young man, when you're short on your dough""",the Village People,0,0
9172,2024-10-01,Ryan Manton game 2.,Jeopardy,"(6, 1)",FAMILIAR PHRASES,30,"(200,)",False,No one knows where this exclamation of surprise came from but it probably was not inspired by Mrs. Ross or by Davy Crockett's rifle,heaven's to Betsy,0,0
9172,2024-10-01,Ryan Manton game 2.,Jeopardy,"(1, 2)",19th CENTURY CULTURE TRIP,20,"(400,)",False,In 1801 Alexander Hamilton launched this Big Apple paper that didn't have a Page Six yet,The New York Post,0,0
9172,2024-10-01,Ryan Manton game 2.,Jeopardy,"(2, 2)",LUNAR FEATURES,22,"(400,)",False,"The dividing line between day & night on the Moon is called ""the twilight zone"" or this word, like the title of a 1984 Ahnold film",the terminator,0,0
9172,2024-10-01,Ryan Manton game 2.,Jeopardy,"(3, 2)",TOYS & GAMES,13,"(400,)",False,Undealt playing cards in this game are placed in a pile known as the ocean or the pool,Go Fish,0,0
9172,2024-10-01,Ryan Manton game 2.,Jeopardy,"(4, 2)",AIRPORTS,25,"(400,)",False,Not surprisingly passengers are greeted with live jazz music at the New Orleans airport named for this jazz great,Louis Armstrong,0,0
9172,2024-10-01,Ryan Manton game 2.,Jeopardy,"(5, 2)",NAME THE CLASSIC BAND: A READING,28,"(400,)",False,"""If everybody had an ocean / Across the USA / Then everybody'd be surfin' / Like Californ-eye-ay""",The Beach Boys,0,0
9172,2024-10-01,Ryan Manton game 2.,Jeopardy,"(6, 2)",FAMILIAR PHRASES,16,"(400,)",False,"It's what ""amor vincit omnia"" translates to",love conquers all,0,0
9172,2024-10-01,Ryan Manton game 2.,Jeopardy,"(1, 3)",19th CENTURY CULTURE TRIP,17,"(600,)",False,Charles Willson Peale was in the group that excavated one of these toothy behemoths & painted the scene circa 1806,a mastodon,0,0
9172,2024-10-01,Ryan Manton game 2.,Jeopardy,"(2, 3)",LUNAR FEATURES,6,"(1000,)",True,Nearly 30% of the Moon's near side is made of this igneous rock; its holes were formed by gas bubbles captured as lava cooled,basalt,0,0
9172,2024-10-01,Ryan Manton game 2.,Jeopardy,"(3, 3)",TOYS & GAMES,5,"(600,)",False,"This foam product was advertised as ""the world's first indoor ball""",Nerf,0,0
9172,2024-10-01,Ryan Manton game 2.,Jeopardy,"(4, 3)",AIRPORTS,7,"(600,)",False,In 2023 this Boston airport & gateway to New England celebrated its 100th anniversary,Logan,0,0
9172,2024-10-01,Ryan Manton game 2.,Jeopardy,"(5, 3)",NAME THE CLASSIC BAND: A READING,27,"(600,)",False,"""But your teacher preaches class like you're some kind of jerk / You gotta fight! / For your right! / To paaaaaar-tay!""",the Beastie Boys,0,0
9172,2024-10-01,Ryan Manton game 2.,Jeopardy,"(6, 3)",FAMILIAR PHRASES,10,"(600,)",False,"The Bible tells us, ""For wisdom is better than"" these gems ""and all the things that may be desired are not to be compared to it""",rubies,0,0
9172,2024-10-01,Ryan Manton game 2.,Jeopardy,"(1, 4)",19th CENTURY CULTURE TRIP,19,"(800,)",False,"In 1808 he registered the North River Steamboat of Clermont, & a new age was upon us",Fulton,0,0
9172,2024-10-01,Ryan Manton game 2.,Jeopardy,"(2, 4)",LUNAR FEATURES,14,"(800,)",False,"A mountain on the Moon is named for computer programmer Melba Ray Mouton, & is called this Latin word Mouton",Mons,0,0
9172,2024-10-01,Ryan Manton game 2.,Jeopardy,"(3, 4)",TOYS & GAMES,11,"(800,)",False,"This ""game that ties you up in knots"" became a hit when Johnny Carson played it with Eva Gabor on ""The Tonight Show"" in 1966",Twister,0,0
9172,2024-10-01,Ryan Manton game 2.,Jeopardy,"(4, 4)",AIRPORTS,9,"(800,)",False,"This capital's Schiphol Airport boasts a library, a park & an art museum",Amsterdam,0,0
9172,2024-10-01,Ryan Manton game 2.,Jeopardy,"(5, 4)",NAME THE CLASSIC BAND: A READING,4,"(800,)",False,"""Stop! In the name of love / Before you break my heart / Stop! In the name of love / Before you break my heart / Think it over""",The Supremes,0,0
9172,2024-10-01,Ryan Manton game 2.,Jeopardy,"(6, 4)",FAMILIAR PHRASES,2,"(800,)",False,"Don't draw premature conclusions is the meaning of ""one"" of these birds ""does not make a summer"", attributed to Aristotle",a swallow,0,0
9172,2024-10-01,Ryan Manton game 2.,Jeopardy,"(1, 5)",19th CENTURY CULTURE TRIP,18,"(1000,)",False,"For Easter 1885 Czar Alexander III asked this jeweler to make a gift for the czarina; voilà, an enameled egg with jewels inside",Fabergé,0,0
9172,2024-10-01,Ryan Manton game 2.,Jeopardy,"(2, 5)",LUNAR FEATURES,15,"(1000,)",False,An impressive crater 53 miles in diameter in the Southern Highlands of the Moon is named for this eccentric 16th century Dane,Tycho Brahe,0,0
9172,2024-10-01,Ryan Manton game 2.,Jeopardy,"(3, 5)",TOYS & GAMES,12,"(1000,)",False,This 3-D viewer was introduced at the 1939 World's Fair but hit it big in the 1950s when it acquired the rights to Disney characters,View-Master,0,0
9172,2024-10-01,Ryan Manton game 2.,Jeopardy,"(4, 5)",AIRPORTS,8,"(1000,)",False,The King Abdulaziz Airport in this country has a special hajj terminal & a separate terminal for the royal family,Saudi Arabia,0,0
9172,2024-10-01,Ryan Manton game 2.,Jeopardy,"(5, 5)",NAME THE CLASSIC BAND: A READING,3,"(1000,)",False,"""Drivin' down your freeways / Midnight alleys roam / Cops in cars / The topless bars / Never saw a woman / So alone... L.A. woman""",The Doors,0,0
9172,2024-10-01,Ryan Manton game 2.,Jeopardy,"(6, 5)",FAMILIAR PHRASES,1,"(1000,)",False,"Dating back to Chaucer, it's sort of the canine equivalent of ""don't rock the boat""",let sleeping dogs lie,0,0
9172,2024-10-01,Ryan Manton game 2.,Double Jeopardy,"(1, 1)",SIR WALTER RALEIGH,30,"(400,)",False,"From 1600 to 1603 Raleigh served as governor of this largest of the Channel Islands, improving its defenses",Jersey,0,0
9172,2024-10-01,Ryan Manton game 2.,Double Jeopardy,"(2, 1)",AVIAN POETRY,11,"(400,)",False,"Paul Laurence Dunbar wrote, ""I know why"" this ""sings, ah me, when his wing is bruised and his bosom sore""",the caged bird,0,0
9172,2024-10-01,Ryan Manton game 2.,Double Jeopardy,"(3, 1)",THE NAME GAME,5,"(400,)",False,"Going up to number XXIII, more popes have been of this name than any other",John,0,0
9172,2024-10-01,Ryan Manton game 2.,Double Jeopardy,"(4, 1)",FILM-POURRI,10,"(400,)",False,"David Oyelowo starred as him in the 2014 biopic ""Selma""",Martin Luther King Jr.,0,0
9172,2024-10-01,Ryan Manton game 2.,Double Jeopardy,"(5, 1)",AMERICA THE BEAUTIFUL,22,"(400,)",False,"In spring, California comes alive with these, the state flower",poppies,0,0
9172,2024-10-01,Ryan Manton game 2.,Double Jeopardy,"(6, 1)","""C"" TO SHINING ""C""",17,"(400,)",False,It's a palindromic word meaning relating to cities,civic,0,0
9172,2024-10-01,Ryan Manton game 2.,Double Jeopardy,"(1, 2)",SIR WALTER RALEIGH,29,"(800,)",False,"As a teenager, Raleigh fought with these French Protestants against the Catholics in France",the Huguenots,0,0
9172,2024-10-01,Ryan Manton game 2.,Double Jeopardy,"(2, 2)",AVIAN POETRY,25,"(5600,)",True,"The narrator asks this title bird to ""leave my loneliness unbroken!--quit the bust above my door!""",the raven,0,0
9172,2024-10-01,Ryan Manton game 2.,Double Jeopardy,"(3, 2)",THE NAME GAME,1,"(800,)",False,"Angus Young said this ""Highway To Hell"" rock band took its name from the label on a sewing machine",AC/DC,0,0
9172,2024-10-01,Ryan Manton game 2.,Double Jeopardy,"(4, 2)",FILM-POURRI,9,"(800,)",False,"That's Colin Farrell under layers of silicone as this baddie in ""The Batman""",the Penguin,0,0
9172,2024-10-01,Ryan Manton game 2.,Double Jeopardy,"(5, 2)",AMERICA THE BEAUTIFUL,21,"(800,)",False,"900 feet wide with a 212-foot drop, Shoshone Falls in this state has been called the ""Niagara of the West""",Idaho,0,0
9172,2024-10-01,Ryan Manton game 2.,Double Jeopardy,"(6, 2)","""C"" TO SHINING ""C""",16,"(800,)",False,"Named for a town on the Charente River, it's twice-distilled wine that's been aged in oak",Cognac,0,0
9172,2024-10-01,Ryan Manton game 2.,Double Jeopardy,"(1, 3)",SIR WALTER RALEIGH,28,"(1200,)",False,"In ""I'm So Tired"" The Beatles curse Raleigh for his role in bringing this substance to England",tobacco,0,0
9172,2024-10-01,Ryan Manton game 2.,Double Jeopardy,"(2, 3)",AVIAN POETRY,24,"(1200,)",False,"10 of her 1,800 poems were published in her lifetime; one was ""These Are the Days When Birds Come Back--""",Dickinson,0,0
9172,2024-10-01,Ryan Manton game 2.,Double Jeopardy,"(3, 3)",THE NAME GAME,2,"(1200,)",False,The ancient Greek philosopher Aristocles is better known by this name possibly derived from his broad physique,Plato,0,0
9172,2024-10-01,Ryan Manton game 2.,Double Jeopardy,"(4, 3)",FILM-POURRI,6,"(1200,)",False,"Director Martin Scorsese said that Robert De Niro improvised this 4-word line in ""Taxi Driver""",you talkin' to me,0,0
9172,2024-10-01,Ryan Manton game 2.,Double Jeopardy,"(5, 3)",AMERICA THE BEAUTIFUL,20,"(1200,)",False,"This Vermont town, the ski capital of the East, is also famous for its fall foilage","Stowe, Vermont",0,0
9172,2024-10-01,Ryan Manton game 2.,Double Jeopardy,"(6, 3)","""C"" TO SHINING ""C""",13,"(1200,)",False,"It precedes ""Pride"" in a '90s film where Dan Aykroyd & Daniel Stern kidnap a star Utah Jazz player",Celtic,0,0
9172,2024-10-01,Ryan Manton game 2.,Double Jeopardy,"(1, 4)",SIR WALTER RALEIGH,27,"(1600,)",False,"In 1617, while lying ill aboard ship off South America, Raleigh sent his men up this river in search of a gold mine in Guiana",the Orinoco,0,0
9172,2024-10-01,Ryan Manton game 2.,Double Jeopardy,"(2, 4)",AVIAN POETRY,23,"(1600,)",False,"Like Coleridge, French poet Charles Baudelaire wrote about these birds, calling them ""skyborn kings""",an albatross,0,0
9172,2024-10-01,Ryan Manton game 2.,Double Jeopardy,"(3, 4)",THE NAME GAME,3,"(1600,)",False,This middle name of President Warren Harding was also the name of a first century rabbi mentioned in the Bible,Gamaliel,0,0
9172,2024-10-01,Ryan Manton game 2.,Double Jeopardy,"(4, 4)",FILM-POURRI,7,"(2400,)",True,"A script called ""Night Skies"" about long-fingered aliens led to both ""Poltergeist"" this other 1980s hit",E.T.,0,0
9172,2024-10-01,Ryan Manton game 2.,Double Jeopardy,"(5, 4)",AMERICA THE BEAUTIFUL,19,"(1600,)",False,"You can drive from Yellowstone to the national park named for these ""Grand"" mountains in under 30 minutes",the Tetons,0,0
9172,2024-10-01,Ryan Manton game 2.,Double Jeopardy,"(6, 4)","""C"" TO SHINING ""C""",14,"(1600,)",False,"Being in this ""state"" often involves a lack of movement & communication",catatonic,0,0
9172,2024-10-01,Ryan Manton game 2.,Double Jeopardy,"(1, 5)",SIR WALTER RALEIGH,26,"(2000,)",False,"In this work Edmund Spenser used Raleigh as a model for Timias, a squire who woos the ""heavenly born"" Belphoebe",The Faerie Queene,0,0
9172,2024-10-01,Ryan Manton game 2.,Double Jeopardy,"(2, 5)",AVIAN POETRY,12,"(2000,)",False,"This American poet began his 1943 poem ""Come In"", ""As I came to the edge of the woods, thrush music--hark!""",Frost,0,0
9172,2024-10-01,Ryan Manton game 2.,Double Jeopardy,"(3, 5)",THE NAME GAME,4,"(2000,)",False,"""Rid"" is a Scandinavian root meaning ""beautiful"", as in Ingrid & this name of the Swedish princess seen here",Astrid,0,0
9172,2024-10-01,Ryan Manton game 2.,Double Jeopardy,"(4, 5)",FILM-POURRI,8,"(2000,)",False,"This real-life couple starred as the bickering George & Martha in 1966's ""Who's Afraid of Virginia Woolf?""",Elizabeth Taylor & Richard Burton,0,0
9172,2024-10-01,Ryan Manton game 2.,Double Jeopardy,"(5, 5)",AMERICA THE BEAUTIFUL,18,"(2000,)",False,"Named for a surveyor & flowing from the Juneau Icefield, this 13-mile-long glacier often features ice caves to explore",the Mendenhall Glacier,0,0
9172,2024-10-01,Ryan Manton game 2.,Double Jeopardy,"(6, 5)","""C"" TO SHINING ""C""",15,"(2000,)",False,These jars preserved the viscera of a dead person in Ancient Egypt,canopic jars,0,0
9172,2024-10-01,Ryan Manton game 2.,Final Jeopardy,"(1, 1)",SITCOMS,0,(),False,"The first British sitcom to win a Best Comedy Golden Globe, it was remade in a U.S. version that had almost 15 times as many episodes",The Office,0,0
