epNum,airDate,extra_info,round_name,coord,category,order,value,daily_double,question,answer,correctAttempts,wrongAttempts
9174,2024-10-03,Ryan Manton game 4.,Jeopardy,"(1, 1)",PEOPLE'S SEXIEST MAN ALIVE,30,"(200,)",False,"2016's cover duly reported this part-time pro wrestler was ""sweet, smart--and sculpted!"", if you smelllll... what the Ken... is cookin'",Johnson,0,0
9174,2024-10-03,Ryan Manton game 4.,Jeopardy,"(2, 1)",KIDDY LIT,14,"(200,)",False,"Jamie journals in Jim Benton's alliterative bestselling series ""Dear Dumb"" this",Diary,0,0
9174,2024-10-03,Ryan Manton game 4.,Jeopardy,"(3, 1)",BRAND MASCOTS,22,"(200,)",False,A twin-tailed mermaid is the mascot of this behemoth chain,Starbucks,0,0
9174,2024-10-03,Ryan Manton game 4.,Jeopardy,"(4, 1)",BEASTLY RHYME TIME,6,"(200,)",False,A ceasefire between ganders,a geese peace (a goose truce),0,0
9174,2024-10-03,Ryan Manton game 4.,Jeopardy,"(5, 1)",IT'S TECHNICAL,19,"(200,)",False,"A technique called somatic cell nuclear transfer is used in this process; in 1996, it resulted in a sheep named Dolly",cloning,0,0
9174,2024-10-03,Ryan Manton game 4.,Jeopardy,"(6, 1)",ALSO A PAPAL NAME,25,"(200,)",False,"It follows ""salt"" in the name of a gunpowder component",peter,0,0
9174,2024-10-03,Ryan Manton game 4.,Jeopardy,"(1, 2)",PEOPLE'S SEXIEST MAN ALIVE,29,"(400,)",False,"He's got the EGOT, he's a master musician, he's married to Chrissy Teigen, so why not also be the S.M.A. in 2019?",John Legend,0,0
9174,2024-10-03,Ryan Manton game 4.,Jeopardy,"(2, 2)",KIDDY LIT,13,"(400,)",False,Edward Bear is this character's more formal name,Winnie-the-Pooh,0,0
9174,2024-10-03,Ryan Manton game 4.,Jeopardy,"(3, 2)",BRAND MASCOTS,15,"(400,)",False,The full name of this Planters mascot is Bartholomew Richard Fitzgerald-Smythe,Mr. Peanut,0,0
9174,2024-10-03,Ryan Manton game 4.,Jeopardy,"(4, 2)",BEASTLY RHYME TIME,4,"(400,)",False,A plastered polecat,a drunk skunk,0,0
9174,2024-10-03,Ryan Manton game 4.,Jeopardy,"(5, 2)",IT'S TECHNICAL,18,"(400,)",False,"Einstein patented an innovative refrigerator but couldn't sell it after DuPont came up with this ""Fr""eezing stuff",Freon,0,0
9174,2024-10-03,Ryan Manton game 4.,Jeopardy,"(6, 2)",ALSO A PAPAL NAME,24,"(400,)",False,"It follows ""Presumed"" in the title of a Scott Turow thriller",Innocent,0,0
9174,2024-10-03,Ryan Manton game 4.,Jeopardy,"(1, 3)",PEOPLE'S SEXIEST MAN ALIVE,28,"(600,)",False,"Great Scot! In 1989 this actor was ""older, balder... and better!""; we only wish he'd really played ""Celebrity Jeopardy!""",Sean Connery,0,0
9174,2024-10-03,Ryan Manton game 4.,Jeopardy,"(2, 3)",KIDDY LIT,9,"(600,)",False,"Fast friends Jess & Leslie create their own secret kingdom in the woods, then tragedy strikes, in ""Bridge to"" this place",Terabithia,0,0
9174,2024-10-03,Ryan Manton game 4.,Jeopardy,"(3, 3)",BRAND MASCOTS,12,"(600,)",False,"""Oh, yeah!"" Richard Berg was the original voice of the pitcher-shaped mascot for this drink brand",Kool-Aid,0,0
9174,2024-10-03,Ryan Manton game 4.,Jeopardy,"(4, 3)",BEASTLY RHYME TIME,3,"(600,)",False,"A ""pocket"" burrower's slip-on shoe",a gopher loafer,0,0
9174,2024-10-03,Ryan Manton game 4.,Jeopardy,"(5, 3)",IT'S TECHNICAL,17,"(600,)",False,"William Harvey attempted this process in 1628, but it wasn't safe until the advent of donor compatibility tests in the early 1900s",a blood transfusion,0,0
9174,2024-10-03,Ryan Manton game 4.,Jeopardy,"(6, 3)",ALSO A PAPAL NAME,23,"(600,)",False,"When ""in"" comes before this word meaning ""merciful"", it often describes nasty weather",clement,0,0
9174,2024-10-03,Ryan Manton game 4.,Jeopardy,"(1, 4)",PEOPLE'S SEXIEST MAN ALIVE,27,"(800,)",False,"2 years after ""Creed II"", this actor was sexy man No. 1 in 2020",Michael B. Jordan,0,0
9174,2024-10-03,Ryan Manton game 4.,Jeopardy,"(2, 4)",KIDDY LIT,8,"(800,)",False,Among the characters created by this beloved author were Ramona Quimby & Henry Huggins,Beverly Cleary,0,0
9174,2024-10-03,Ryan Manton game 4.,Jeopardy,"(3, 4)",BRAND MASCOTS,11,"(800,)",False,This big dude is a brand mascot whose name was inspired by a type of large pea,the Jolly Green Giant,0,0
9174,2024-10-03,Ryan Manton game 4.,Jeopardy,"(4, 4)",BEASTLY RHYME TIME,2,"(800,)",False,An equitable Kodiak,a fair bear,0,0
9174,2024-10-03,Ryan Manton game 4.,Jeopardy,"(5, 4)",IT'S TECHNICAL,16,"(1000,)",True,The drum in a clothes dryer is an example of the basket type of this spinning device seen in many a lab,a centrifuge,0,0
9174,2024-10-03,Ryan Manton game 4.,Jeopardy,"(6, 4)",ALSO A PAPAL NAME,21,"(800,)",False,"As far as astrological signs go, this one fits the bill",Leo,0,0
9174,2024-10-03,Ryan Manton game 4.,Jeopardy,"(1, 5)",PEOPLE'S SEXIEST MAN ALIVE,26,"(1000,)",False,"He was hunking up ""L.A. Law"" when chosen in 1987; now he's even sexier on ""In the Kitchen with"" him, am I right?",Harry Hamlin,0,0
9174,2024-10-03,Ryan Manton game 4.,Jeopardy,"(2, 5)",KIDDY LIT,7,"(1000,)",False,In a fairy tale this title bird is brought to the emperor of China but is eventually replaced by a mechanical one,the nightingale,0,0
9174,2024-10-03,Ryan Manton game 4.,Jeopardy,"(3, 5)",BRAND MASCOTS,10,"(1000,)",False,"Is he a sailor or a genie? Unclear, but he's fastidious & he reps the brand that makes Magic Erasers",Mr. Clean,0,0
9174,2024-10-03,Ryan Manton game 4.,Jeopardy,"(4, 5)",BEASTLY RHYME TIME,5,"(1000,)",False,A krait blunder,a snake mistake,0,0
9174,2024-10-03,Ryan Manton game 4.,Jeopardy,"(5, 5)",IT'S TECHNICAL,1,"(1000,)",False,"From Greek for ""beyond"" & ""heavy"", it's a type of chamber used to treat decompression sickness",hyperbaric,0,0
9174,2024-10-03,Ryan Manton game 4.,Jeopardy,"(6, 5)",ALSO A PAPAL NAME,20,"(1000,)",False,"From Latin for ""good"" & ""fate"", it's an old-timey word for any innkeeper",boniface,0,0
9174,2024-10-03,Ryan Manton game 4.,Double Jeopardy,"(1, 1)",A GLIMPSE INTO THE PAST,5,"(400,)",False,"Early baseball star Harry Wright stands with his English-born dad Sam, a star in this sport",cricket,0,0
9174,2024-10-03,Ryan Manton game 4.,Double Jeopardy,"(2, 1)",FILM FROM FICTION,12,"(400,)",False,In 2019 Greta Gerwig directed an adaptation of this Louisa May Alcott novel,Little Women,0,0
9174,2024-10-03,Ryan Manton game 4.,Double Jeopardy,"(3, 1)",ARCHIPELAGOS,1,"(400,)",False,"Just 5 islands but worth a visit, the Tremiti Archipelago is off Italy's ""Heel"", in this sea",the Adriatic,0,0
9174,2024-10-03,Ryan Manton game 4.,Double Jeopardy,"(4, 1)",ANCIENTLY DRAMATIC,21,"(400,)",False,"Though he was born in Africa, the plays of Terence were long considered to be models of this language & were used to teach it",Latin,0,0
9174,2024-10-03,Ryan Manton game 4.,Double Jeopardy,"(5, 1)",POSSESSIVE TERMS,29,"(400,)",False,A Greek myth gives us this anatomical term for a vulnerable point,Achilles' heel,0,0
9174,2024-10-03,Ryan Manton game 4.,Double Jeopardy,"(6, 1)",FLIP THE FIRST & LAST LETTER,23,"(400,)",False,A rental contract &an artist's canvas supporter,lease & easel,0,0
9174,2024-10-03,Ryan Manton game 4.,Double Jeopardy,"(1, 2)",A GLIMPSE INTO THE PAST,4,"(800,)",False,"This great Sioux leader often wore tinted-glass goggles, as in the 1881 portrait seen here",Sitting Bull,0,0
9174,2024-10-03,Ryan Manton game 4.,Double Jeopardy,"(2, 2)",FILM FROM FICTION,11,"(800,)",False,Quincy Jones produced a 2023 movie musical & a 1985 film both based on this novel,The Color Purple,0,0
9174,2024-10-03,Ryan Manton game 4.,Double Jeopardy,"(3, 2)",ARCHIPELAGOS,2,"(2000,)",True,This archipelago about 60 miles off the coast of Morocco is Spain's  southernmost autonomous community,the Canary Islands,0,0
9174,2024-10-03,Ryan Manton game 4.,Double Jeopardy,"(4, 2)",ANCIENTLY DRAMATIC,20,"(800,)",False,"In Euripides' play about this beauty, only her phantom runs off to Troy; the real her waits faithfully for her husband's return",Helen,0,0
9174,2024-10-03,Ryan Manton game 4.,Double Jeopardy,"(5, 2)",POSSESSIVE TERMS,28,"(800,)",False,"The eponymous man's 1889 formulation of this dictum: ""One must never place a loaded rifle on the stage if it isn't going to go off""",Chekhov's gun,0,0
9174,2024-10-03,Ryan Manton game 4.,Double Jeopardy,"(6, 2)",FLIP THE FIRST & LAST LETTER,24,"(800,)",False,A male duck& collected the leaves,drake & raked,0,0
9174,2024-10-03,Ryan Manton game 4.,Double Jeopardy,"(1, 3)",A GLIMPSE INTO THE PAST,3,"(1200,)",False,"To show Columbus wasn't first across the Atlantic, in 1893, a Viking ship replica sailed from Norway to a big party in this city",Chicago,0,0
9174,2024-10-03,Ryan Manton game 4.,Double Jeopardy,"(2, 3)",FILM FROM FICTION,10,"(1200,)",False,"Writer Stephenie Meyer pictured Henry Cavill & Emily Browning in these 2 ""Twilight"" roles",Edward & Bella,0,0
9174,2024-10-03,Ryan Manton game 4.,Double Jeopardy,"(3, 3)",ARCHIPELAGOS,13,"(1200,)",False,The Lucayan Archipelago consists of the Turks & Caicos Islands & this British Commonwealth nation to the northwest,the Bahamas,0,0
9174,2024-10-03,Ryan Manton game 4.,Double Jeopardy,"(4, 3)",ANCIENTLY DRAMATIC,18,"(1200,)",False,"In Sophocles' ""Trachinian Women"", this semi-divine hero sends his mistress to live with his wife, & bad stuff happens",Hercules,0,0
9174,2024-10-03,Ryan Manton game 4.,Double Jeopardy,"(5, 3)",POSSESSIVE TERMS,22,"(6400,)",True,"A structure of ropes & wooden steps for ascending a ship's rigging, or  something that appears in Genesis 28:12",Jacob's ladder,0,0
9174,2024-10-03,Ryan Manton game 4.,Double Jeopardy,"(6, 3)",FLIP THE FIRST & LAST LETTER,25,"(1200,)",False,A Spanish cattle farm& what holds a ship in place,anchor & rancho,0,0
9174,2024-10-03,Ryan Manton game 4.,Double Jeopardy,"(1, 4)",A GLIMPSE INTO THE PAST,6,"(1600,)",False,The Place Vendôme was the site of many street barricades set up during the 1871 revolt known as the Paris this,Commune,0,0
9174,2024-10-03,Ryan Manton game 4.,Double Jeopardy,"(2, 4)",FILM FROM FICTION,9,"(1600,)",False,"Loosely based on a Martin Amis novel, this film set just outside of Auschwitz won the Best Intl. Feature Oscar in 2024",The Zone of Interest,0,0
9174,2024-10-03,Ryan Manton game 4.,Double Jeopardy,"(3, 4)",ARCHIPELAGOS,14,"(1600,)",False,The world's largest number of giant tortoises is found on Aldabra Atoll in this nation N.E. of Madagascar,(the) Seychelle(s),0,0
9174,2024-10-03,Ryan Manton game 4.,Double Jeopardy,"(4, 4)",ANCIENTLY DRAMATIC,17,"(1600,)",False,This word for a tragedian or other actor comes from the name of the man said to be Greek tragedy's first actor,thespian,0,0
9174,2024-10-03,Ryan Manton game 4.,Double Jeopardy,"(5, 4)",POSSESSIVE TERMS,30,"(1600,)",False,"Named for a Frenchman, it's the argument that you should gamble on the belief in God, as the potential upside is so big",Pascal's wager,0,0
9174,2024-10-03,Ryan Manton game 4.,Double Jeopardy,"(6, 4)",FLIP THE FIRST & LAST LETTER,26,"(1600,)",False,One from Earth& word to describe a wandering knight,Terran & errant,0,0
9174,2024-10-03,Ryan Manton game 4.,Double Jeopardy,"(1, 5)",A GLIMPSE INTO THE PAST,7,"(2000,)",False,"In the 1880s, daring New Yorkers rode of these early cycles named for the resemblance of the wheels to two old British coins",a penny-farthing,0,0
9174,2024-10-03,Ryan Manton game 4.,Double Jeopardy,"(2, 5)",FILM FROM FICTION,8,"(2000,)",False,"This Mexican auteur, who won an Oscar for ""Gravity"", directed ""Harry Potter and the Prisoner of Azkaban""",Alfonso Cuarón,0,0
9174,2024-10-03,Ryan Manton game 4.,Double Jeopardy,"(3, 5)",ARCHIPELAGOS,15,"(2000,)",False,"The world's largest archipelago, it contains thousands of islands including those of the Philippines & Indonesia",the Malay Archipelago,0,0
9174,2024-10-03,Ryan Manton game 4.,Double Jeopardy,"(4, 5)",ANCIENTLY DRAMATIC,16,"(2000,)",False,"In a play by Aeschylus, Eteocles defends this city against the forces of Polyneices & 6 other chieftains",Thebes,0,0
9174,2024-10-03,Ryan Manton game 4.,Double Jeopardy,"(5, 5)",POSSESSIVE TERMS,19,"(2000,)",False,A British actor named Simon Prebble gave the motion law-demonstrating science toy seen here this name,Newton's cradle,0,0
9174,2024-10-03,Ryan Manton game 4.,Double Jeopardy,"(6, 5)",FLIP THE FIRST & LAST LETTER,27,"(2000,)",False,Above an intended pitch musically& the instruments that might attempt it,sharp & harps,0,0
9174,2024-10-03,Ryan Manton game 4.,Final Jeopardy,"(1, 1)",19th CENTURY NAMES,0,(),False,Shrunken auditory nerves were seen in his autopsy after his 1827 death in Vienna,(Ludwig van) Beethoven,0,0
