epNum,airDate,extra_info,round_name,coord,category,order,value,daily_double,question,answer,correctAttempts,wrongAttempts
9239,2025-01-02,"2024-2025 Second Chance competition week 1, final game 1.",Jeopardy,"(1, 1)",SO SAYETH THE KING JAMES BIBLE,15,"(200,)",False,"In Genesis, ""God blessed"" humanity, saying ""Make thee be fruitful, and"" do this",multiply,0,0
9239,2025-01-02,"2024-2025 Second Chance competition week 1, final game 1.",Jeopardy,"(2, 1)",SECONDS,24,"(200,)",False,A supporting player might be termed a second banana or a second one of these instruments,a fiddle,0,0
9239,2025-01-02,"2024-2025 Second Chance competition week 1, final game 1.",Jeopardy,"(3, 1)",IDIOT IDIOMS,29,"(200,)",False,Someone may claim that you are one or maybe 2 sandwiches short of this outdoor event; how dare they!,a picnic,0,0
9239,2025-01-02,"2024-2025 Second Chance competition week 1, final game 1.",Jeopardy,"(4, 1)",NAME DROPS KEEP FALLIN' ON MY HEAD,12,"(200,)",False,"When it comes to using two lightsabers at once, it's really all in the wrists, I told this actress when she became Ahsoka in 2022",Rosario Dawson,0,0
9239,2025-01-02,"2024-2025 Second Chance competition week 1, final game 1.",Jeopardy,"(5, 1)",CLASSY CREATURES,11,"(200,)",False,The pangolin &the aye-aye,Mammalia,0,0
9239,2025-01-02,"2024-2025 Second Chance competition week 1, final game 1.",Jeopardy,"(6, 1)","YOU SAY TOBAGO, I SAY TOBAGO",30,"(200,)",False,A beach in Tobago next to Charrrlotteville bearrrs the name of these marrrauders--yo-ho-ho! To Tobago we go!,pirates,0,0
9239,2025-01-02,"2024-2025 Second Chance competition week 1, final game 1.",Jeopardy,"(1, 2)",SO SAYETH THE KING JAMES BIBLE,9,"(400,)",False,"""I am"" these 2 letters, ""the first and the last: and, what thou seest, write in a book""",Alpha & Omega,0,0
9239,2025-01-02,"2024-2025 Second Chance competition week 1, final game 1.",Jeopardy,"(2, 2)",SECONDS,23,"(400,)",False,"The role of a second in one of these ""affairs of honor"" was to try to settle it without violence",a duel,0,0
9239,2025-01-02,"2024-2025 Second Chance competition week 1, final game 1.",Jeopardy,"(3, 2)",IDIOT IDIOMS,28,"(400,)",False,"A sage saying relates that a man who acts as his own this ""has a fool for a client""",lawyer,0,0
9239,2025-01-02,"2024-2025 Second Chance competition week 1, final game 1.",Jeopardy,"(4, 2)",NAME DROPS KEEP FALLIN' ON MY HEAD,13,"(400,)",False,I was at the tennis club working on my backhand; Zendaya had offered me a few tips she got from pro Brad Gilbert for this 2024 film,Challengers,0,0
9239,2025-01-02,"2024-2025 Second Chance competition week 1, final game 1.",Jeopardy,"(5, 2)",CLASSY CREATURES,10,"(400,)",False,The frogmouth &the shoebill,birds,0,0
9239,2025-01-02,"2024-2025 Second Chance competition week 1, final game 1.",Jeopardy,"(6, 2)","YOU SAY TOBAGO, I SAY TOBAGO",27,"(400,)",False,In the 1880s Tobago combined with this island to form a single political entity,Trinidad,0,0
9239,2025-01-02,"2024-2025 Second Chance competition week 1, final game 1.",Jeopardy,"(1, 3)",SO SAYETH THE KING JAMES BIBLE,1,"(600,)",False,"""These are also the generations of Aaron and Moses in the day that the Lord spake with Moses"" at this place",Mount Sinai,0,0
9239,2025-01-02,"2024-2025 Second Chance competition week 1, final game 1.",Jeopardy,"(2, 3)",SECONDS,20,"(600,)",False,"The Second Amendment to the U.S. Constitution mentions ""a well regulated"" one of these",militia,0,0
9239,2025-01-02,"2024-2025 Second Chance competition week 1, final game 1.",Jeopardy,"(3, 3)",IDIOT IDIOMS,4,"(600,)",False,A rabbit relative comes at the start of this term meaning foolish or absurd,harebrained,0,0
9239,2025-01-02,"2024-2025 Second Chance competition week 1, final game 1.",Jeopardy,"(4, 3)",NAME DROPS KEEP FALLIN' ON MY HEAD,14,"(600,)",False,"I told the Duchess that at Heathrow I'd bumped into this man who played the prime minister in ""Love Actually""; naturally he apologized",Hugh Grant,0,0
9239,2025-01-02,"2024-2025 Second Chance competition week 1, final game 1.",Jeopardy,"(5, 3)",CLASSY CREATURES,8,"(600,)",False,The wobbegong & the skate: cartilaginous these,fish,0,0
9239,2025-01-02,"2024-2025 Second Chance competition week 1, final game 1.",Jeopardy,"(6, 3)","YOU SAY TOBAGO, I SAY TOBAGO",25,"(600,)",False,"After being in ""Black Panther"", Tobagonian actor Winston Duke co-starred with Lupita Nyong'o in this horror film",Us,0,0
9239,2025-01-02,"2024-2025 Second Chance competition week 1, final game 1.",Jeopardy,"(1, 4)",SO SAYETH THE KING JAMES BIBLE,2,"(1000,)",True,"""And there was war again: and David went out, and fought with"" this group, ""and slew them with a great slaughter""",the Philistines,0,0
9239,2025-01-02,"2024-2025 Second Chance competition week 1, final game 1.",Jeopardy,"(2, 4)",SECONDS,21,"(800,)",False,"France's Second Republic lasted from 1848 to 1852; its Second this, ruled by Napoleon III, from 1852 to 1870",(Second) Empire,0,0
9239,2025-01-02,"2024-2025 Second Chance competition week 1, final game 1.",Jeopardy,"(3, 4)",IDIOT IDIOMS,5,"(800,)",False,5 words of advice from his mama quoted often by Tom Hanks in a 1994 movie,stupid is as stupid does,0,0
9239,2025-01-02,"2024-2025 Second Chance competition week 1, final game 1.",Jeopardy,"(4, 4)",NAME DROPS KEEP FALLIN' ON MY HEAD,16,"(800,)",False,"...So Anna Sawai asks me, should she play Mariko in this drama? & I say, heck yeah you should, & I bet you'll win a 2024 Emmy, too!",Shōgun,0,0
9239,2025-01-02,"2024-2025 Second Chance competition week 1, final game 1.",Jeopardy,"(5, 4)",CLASSY CREATURES,6,"(800,)",False,The matamata &the basilisk,reptiles,0,0
9239,2025-01-02,"2024-2025 Second Chance competition week 1, final game 1.",Jeopardy,"(6, 4)","YOU SAY TOBAGO, I SAY TOBAGO",18,"(800,)",False,"Performers dressed as Moko Jumbie, a spirit from African traditions, parade during this one-word pre-Ash Wednesday season",Carnival,0,0
9239,2025-01-02,"2024-2025 Second Chance competition week 1, final game 1.",Jeopardy,"(1, 5)",SO SAYETH THE KING JAMES BIBLE,3,"(1000,)",False,"""And Joshua the son of Nun sent out of Shittim two men to spy secretly, saying, go view the land, even"" this city",Jericho,0,0
9239,2025-01-02,"2024-2025 Second Chance competition week 1, final game 1.",Jeopardy,"(2, 5)",SECONDS,22,"(1000,)",False,A second-degree burn may damage not just the outer layer of skin but this skin layer immediately beneath it,the dermis,0,0
9239,2025-01-02,"2024-2025 Second Chance competition week 1, final game 1.",Jeopardy,"(3, 5)",IDIOT IDIOMS,26,"(1000,)",False,"Someone not smart, maybe in the way of computers, is deemed this palindromic number, a webpage error",404,0,0
9239,2025-01-02,"2024-2025 Second Chance competition week 1, final game 1.",Jeopardy,"(4, 5)",NAME DROPS KEEP FALLIN' ON MY HEAD,17,"(1000,)",False,"If you spend that $140,000 a night to rent Necker Island in the British Virgin Islands, say hi to my pal, this owner",Richard Branson,0,0
9239,2025-01-02,"2024-2025 Second Chance competition week 1, final game 1.",Jeopardy,"(5, 5)",CLASSY CREATURES,7,"(1000,)",False,"Giant scallop, Sydney rock oyster",bivalves,0,0
9239,2025-01-02,"2024-2025 Second Chance competition week 1, final game 1.",Jeopardy,"(6, 5)","YOU SAY TOBAGO, I SAY TOBAGO",19,"(1000,)",False,Tobago was used as the filming location for this 1960 movie in which a family from Bern was shipwrecked,Swiss Family Robinson,0,0
9239,2025-01-02,"2024-2025 Second Chance competition week 1, final game 1.",Double Jeopardy,"(1, 1)",THAT'S SOME OPENING ACT,1,"(400,)",False,This singer/rapper/flautist's first big tour was as an opener for Har Mar Superstar in 2013,Lizzo,0,0
9239,2025-01-02,"2024-2025 Second Chance competition week 1, final game 1.",Double Jeopardy,"(2, 1)",NOVEL TITLE DROP A LETTER,27,"(400,)",False,Margaret Atwood's 1985 dystopian novel loses a letter & becomes a story about a malt beverage,A Handmaid's Ale (The Handmaid's Tale),0,0
9239,2025-01-02,"2024-2025 Second Chance competition week 1, final game 1.",Double Jeopardy,"(3, 1)","WHISKEY, & KEEP 'EM COMIN'",22,"(400,)",False,"Jasper was the actual first name of the founder of this Tennessee whiskey brand, & also, the man's last name did not end in S",Jack Daniel's,0,0
9239,2025-01-02,"2024-2025 Second Chance competition week 1, final game 1.",Double Jeopardy,"(4, 1)",ANTONYMS: THE ANTI-SYNONYMS,3,"(400,)",False,"You pronounce the G in malignant, but not in this happier medical antonym",benign,0,0
9239,2025-01-02,"2024-2025 Second Chance competition week 1, final game 1.",Double Jeopardy,"(5, 1)",TRIALS,15,"(400,)",False,"On Nov. 5, 2006 the Iraqi Special Tribunal found this man guilty of a 1982 killing of 148 Shiites",Saddam Hussein,0,0
9239,2025-01-02,"2024-2025 Second Chance competition week 1, final game 1.",Double Jeopardy,"(6, 1)",TRIBUTARIES,11,"(400,)",False,"The Japuá & Juruá, tributaries of this river, are both over 1,000 miles long; its Madeira tributary is over 2,000 miles long!",the Amazon,0,0
9239,2025-01-02,"2024-2025 Second Chance competition week 1, final game 1.",Double Jeopardy,"(1, 2)",THAT'S SOME OPENING ACT,23,"(800,)",False,"She opened for *NSYNC on their 1998 tour, before her first album was released & before she & Justin were she & Justin",Britney Spears,0,0
9239,2025-01-02,"2024-2025 Second Chance competition week 1, final game 1.",Double Jeopardy,"(2, 2)",NOVEL TITLE DROP A LETTER,2,"(800,)",False,Margaret Mitchell's Pulitzer winner drops a letter & is in a peaceful state with a zephyr,One with the Wind (Gone with the Wind),0,0
9239,2025-01-02,"2024-2025 Second Chance competition week 1, final game 1.",Double Jeopardy,"(3, 2)","WHISKEY, & KEEP 'EM COMIN'",21,"(800,)",False,1794's Whiskey Rebellion came from Pennsylvanians singing out against a liquor tax proposed by this treasury secretary,Hamilton,0,0
9239,2025-01-02,"2024-2025 Second Chance competition week 1, final game 1.",Double Jeopardy,"(4, 2)",ANTONYMS: THE ANTI-SYNONYMS,4,"(800,)",False,"To remain or maintain rather than doing this, like King Amadeus of Spain did in 1873",to abdicate,0,0
9239,2025-01-02,"2024-2025 Second Chance competition week 1, final game 1.",Double Jeopardy,"(5, 2)",TRIALS,14,"(800,)",False,In 2009 this American exchange student testified in her own defense during a murder trial in a Perugia court,Amanda Knox,0,0
9239,2025-01-02,"2024-2025 Second Chance competition week 1, final game 1.",Double Jeopardy,"(6, 2)",TRIBUTARIES,10,"(800,)",False,The Han River joins it at Wuhan,the Yangtze,0,0
9239,2025-01-02,"2024-2025 Second Chance competition week 1, final game 1.",Double Jeopardy,"(1, 3)",THAT'S SOME OPENING ACT,24,"(1200,)",False,"The San Francisco venue ""was packed with... real spacy, high white people"", wrote Miles Davis of opening for this band in 1970",the Grateful Dead,0,0
9239,2025-01-02,"2024-2025 Second Chance competition week 1, final game 1.",Double Jeopardy,"(2, 3)",NOVEL TITLE DROP A LETTER,28,"(1200,)",False,Pearl Buck's novel about Wang Lung loses a letter & becomes a squishy planet,The Goo Earth (The Good Earth),0,0
9239,2025-01-02,"2024-2025 Second Chance competition week 1, final game 1.",Double Jeopardy,"(3, 3)","WHISKEY, & KEEP 'EM COMIN'",18,"(1200,)",False,"In the 1930 film ""Anna Christie"", this actress says, ""Gimme a whiskey, ginger ale on the side & don't be stingy, baby""",Greta Garbo,0,0
9239,2025-01-02,"2024-2025 Second Chance competition week 1, final game 1.",Double Jeopardy,"(4, 3)",ANTONYMS: THE ANTI-SYNONYMS,9,"(1200,)",False,Fertile is 180 degrees from this word the King James Bible uses about Rebekah & Elisabeth when childless,barren,0,0
9239,2025-01-02,"2024-2025 Second Chance competition week 1, final game 1.",Double Jeopardy,"(5, 3)",TRIALS,8,"(1200,)",False,This politician & adversary of John Scopes offered to pay Scopes' $100 fine after a 1925 trial,William Jennings Bryan,0,0
9239,2025-01-02,"2024-2025 Second Chance competition week 1, final game 1.",Double Jeopardy,"(6, 3)",TRIBUTARIES,5,"(2500,)",True,"A sheepish response is perhaps best for this, the largest tributary of the Yellowstone",the Bighorn,0,0
9239,2025-01-02,"2024-2025 Second Chance competition week 1, final game 1.",Double Jeopardy,"(1, 4)",THAT'S SOME OPENING ACT,25,"(1600,)",False,"One critic said that newcomer Lady Gaga outsang, outshone & outsexed these headliners, on their 2009 Doll Domination Tour",the Pussycat Dolls,0,0
9239,2025-01-02,"2024-2025 Second Chance competition week 1, final game 1.",Double Jeopardy,"(2, 4)",NOVEL TITLE DROP A LETTER,29,"(1600,)",False,A Huxley novel loses a letter & its 5 castes of people attend a raging dance party,Rave New World (Brave New World),0,0
9239,2025-01-02,"2024-2025 Second Chance competition week 1, final game 1.",Double Jeopardy,"(3, 4)","WHISKEY, & KEEP 'EM COMIN'",19,"(1600,)",False,"During Prohibition, Canada's McLaughlin Buick car was known as the ""Whiskey Six"" from its use in this activity mentioning another liquor",rum-running,0,0
9239,2025-01-02,"2024-2025 Second Chance competition week 1, final game 1.",Double Jeopardy,"(4, 4)",ANTONYMS: THE ANTI-SYNONYMS,16,"(1600,)",False,"To misunderstand is an antonym for this word, which I understand is also a unit of nautical measurement",to fathom,0,0
9239,2025-01-02,"2024-2025 Second Chance competition week 1, final game 1.",Double Jeopardy,"(5, 4)",TRIALS,12,"(1600,)",False,Abbie Hoffman got into a tug of war over a Viet Cong flag during the trial with this numerical name,the Chicago Seven,0,0
9239,2025-01-02,"2024-2025 Second Chance competition week 1, final game 1.",Double Jeopardy,"(6, 4)",TRIBUTARIES,6,"(1600,)",False,"The Morava River joins this big river near Smederevo, Serbia",the Danube,0,0
9239,2025-01-02,"2024-2025 Second Chance competition week 1, final game 1.",Double Jeopardy,"(1, 5)",THAT'S SOME OPENING ACT,26,"(2000,)",False,"Robert Plant recalled that when this band played its first U.S. gig in 1968, the marquee read ""Vanilla Fudge, Taj Mahal & Support""",Led Zeppelin,0,0
9239,2025-01-02,"2024-2025 Second Chance competition week 1, final game 1.",Double Jeopardy,"(2, 5)",NOVEL TITLE DROP A LETTER,30,"(3700,)",True,An Edith Wharton title drops a letter & laughter spews from a tube,The Hose of Mirth (The House of Mirth),0,0
9239,2025-01-02,"2024-2025 Second Chance competition week 1, final game 1.",Double Jeopardy,"(3, 5)","WHISKEY, & KEEP 'EM COMIN'",20,"(2000,)",False,"Veteran L.A.-Vegas drivers know this Primm, Nev. casino opened in 1977 was the longtime home of Bonnie & Clyde's death car",Whiskey Pete's,0,0
9239,2025-01-02,"2024-2025 Second Chance competition week 1, final game 1.",Double Jeopardy,"(4, 5)",ANTONYMS: THE ANTI-SYNONYMS,17,"(2000,)",False,"An ""ant""onym of modern & fresh, it describes the time before the flood in the Bible",antediluvian,0,0
9239,2025-01-02,"2024-2025 Second Chance competition week 1, final game 1.",Double Jeopardy,"(5, 5)",TRIALS,13,"(2000,)",False,"In the 1930s trials of these ""Boys"", 9 Black teenagers were wrongfully accused of crime aboard a freight train",the Scottsboro Boys,0,0
9239,2025-01-02,"2024-2025 Second Chance competition week 1, final game 1.",Double Jeopardy,"(6, 5)",TRIBUTARIES,7,"(2000,)",False,The Ebola is a tributary of the Mongala; the Mongala & the Lualaba are tributaries of this other river,the Congo,0,0
9239,2025-01-02,"2024-2025 Second Chance competition week 1, final game 1.",Final Jeopardy,"(1, 1)",SCIENCE: THE ____ OF ____,0,(),False,4 of these discovered in the early 1600s were given the names of lovers of a mythological deity,the moons of Jupiter,0,0
