epNum,airDate,extra_info,round_name,coord,category,order,value,daily_double,question,answer,correctAttempts,wrongAttempts
9294,2025-03-20,Alex DeFrank game 5.,Jeopardy,"(1, 1)",POETS  & POETRY,16,"(200,)",False,"Haru is this season, the time of sakura, & yuku haru is departing this, a traditional haiku theme",spring,0,0
9294,2025-03-20,Alex DeFrank game 5.,Jeopardy,"(2, 1)",THAT'S A FACT,17,"(200,)",False,"Time to belly up to the bar, & the drink is on me! It's the main potent potable in a Cuba libre",rum,0,0
9294,2025-03-20,Alex DeFrank game 5.,Jeopardy,"(3, 1)","3 MEANINGS, 1 WORD",27,"(200,)",False,"A measuring device,a musical series,a part of a fish",a scale,0,0
9294,2025-03-20,Alex DeFrank game 5.,Jeopardy,"(4, 1)",TV SHOW BY GOOGLE SEARCH,10,"(200,)",False,"""Why was Pete Campbell 'not great?""';""man falling in opening credits, survive?"";""whiskey & cigarettes healthy?""",Mad Men,0,0
9294,2025-03-20,Alex DeFrank game 5.,Jeopardy,"(5, 1)",LET'S ROLL THE DICE,30,"(200,)",False,"Throw doubles 3 times in a row in Monopoly & you're off to this place, & it ain't Marvin Gardens",jail,0,0
9294,2025-03-20,Alex DeFrank game 5.,Jeopardy,"(6, 1)",YANGTZE!,22,"(200,)",False,"The Yangtze runs nearly 4,000 miles to the East China sea from its source in the plateau named for this autonomous region",Tibet,0,0
9294,2025-03-20,Alex DeFrank game 5.,Jeopardy,"(1, 2)",POETS  & POETRY,5,"(400,)",False,"Edgar Allan Poe had these title objects ""tinkle, tinkle, tinkle"", ""clang, and clash, and roar!""",the bells,0,0
9294,2025-03-20,Alex DeFrank game 5.,Jeopardy,"(2, 2)",THAT'S A FACT,23,"(400,)",False,"Established in 1947, this Major League Baseball award has never been won twice by the same player",Rookie of the Year,0,0
9294,2025-03-20,Alex DeFrank game 5.,Jeopardy,"(3, 2)","3 MEANINGS, 1 WORD",28,"(400,)",False,"An angler's toss,an acting ensemble,an orthopedic device",cast,0,0
9294,2025-03-20,Alex DeFrank game 5.,Jeopardy,"(4, 2)",TV SHOW BY GOOGLE SEARCH,29,"(400,)",False,"""East Highland High School dress code"";""Who sings 'Still Don't Know My Name""';""Zendaya last name""",Euphoria,0,0
9294,2025-03-20,Alex DeFrank game 5.,Jeopardy,"(5, 2)",LET'S ROLL THE DICE,13,"(400,)",False,"I used a roll of the d20 to attack in this game created in 1974; my strength isn't great, but my charisma will open doors",Dungeons & Dragons,0,0
9294,2025-03-20,Alex DeFrank game 5.,Jeopardy,"(6, 2)",YANGTZE!,21,"(400,)",False,"Home to 25 million, this city at the mouth of the Yangtze became a word meaning to kidnap a mariner",Shanghai,0,0
9294,2025-03-20,Alex DeFrank game 5.,Jeopardy,"(1, 3)",POETS  & POETRY,4,"(600,)",False,"A Shakespeare sonnet begins, ""Let me not to the marriage of"" these 2 words ""admit impediments""",true minds,0,0
9294,2025-03-20,Alex DeFrank game 5.,Jeopardy,"(2, 3)",THAT'S A FACT,24,"(600,)",False,"Forensic anthropologist Temperance Brennan returned for book 19 in the series, ""A Conspiracy of"" these body parts",bones,0,0
9294,2025-03-20,Alex DeFrank game 5.,Jeopardy,"(3, 3)","3 MEANINGS, 1 WORD",8,"(600,)",False,"A structure,a dental device,a card game",a bridge,0,0
9294,2025-03-20,Alex DeFrank game 5.,Jeopardy,"(4, 3)",TV SHOW BY GOOGLE SEARCH,15,"(600,)",False,"""Shortbread Biscuit recipe"";""offside soccer rule""; ""Is there really a Nelson Road Stadium in London?""",Ted Lasso,0,0
9294,2025-03-20,Alex DeFrank game 5.,Jeopardy,"(5, 3)",LET'S ROLL THE DICE,12,"(600,)",False,"In craps, you're truly playing the this if you bet on the shooter rolling 2, 3, 4, 9, 10, 11 or 12",the field,0,0
9294,2025-03-20,Alex DeFrank game 5.,Jeopardy,"(6, 3)",YANGTZE!,20,"(600,)",False,"Parts of the Yangtze are home to the giant type of this amphibian, which can weigh over 100 pounds & wails like a crying infant",salamander,0,0
9294,2025-03-20,Alex DeFrank game 5.,Jeopardy,"(1, 4)",POETS  & POETRY,3,"(800,)",False,"Now this was a guy big into odes, but if I had to pick, that one on the urn, with ""mad pursuit"" & ""wild ecstasy""? that's a nifty ode!",Keats,0,0
9294,2025-03-20,Alex DeFrank game 5.,Jeopardy,"(2, 4)",THAT'S A FACT,25,"(800,)",False,"Established in 2021, it's the next federal holiday after Memorial Day",Juneteenth,0,0
9294,2025-03-20,Alex DeFrank game 5.,Jeopardy,"(3, 4)","3 MEANINGS, 1 WORD",7,"(2400,)",True,"A set of elevators,a steep slope,a blood-storage depot",a bank,0,0
9294,2025-03-20,Alex DeFrank game 5.,Jeopardy,"(4, 4)",TV SHOW BY GOOGLE SEARCH,14,"(800,)",False,"""Mandalorian but with Princess Leia as baby Yoda"";""Tatooine cave Air BnB"";""How do you properly pronounce Ewan McGregor?""",Obi-Wan Kenobi,0,0
9294,2025-03-20,Alex DeFrank game 5.,Jeopardy,"(5, 4)",LET'S ROLL THE DICE,11,"(800,)",False,Dice rolls will lead you to getting the orange wedge after knowing your sports & leisure in this game,Trivial Pursuit,0,0
9294,2025-03-20,Alex DeFrank game 5.,Jeopardy,"(6, 4)",YANGTZE!,19,"(800,)",False,"Completed in 2006 after displacing 1.3 million people, this structure stretches more than a mile across the Yangtze",the Three Gorges Dam,0,0
9294,2025-03-20,Alex DeFrank game 5.,Jeopardy,"(1, 5)",POETS  & POETRY,2,"(1000,)",False,"""Let the Irish vessel lie / Emptied of its poetry"", says W.H. Auden's 1939 poem ""In Memory of"" him",Yeats,0,0
9294,2025-03-20,Alex DeFrank game 5.,Jeopardy,"(2, 5)",THAT'S A FACT,26,"(1000,)",False,"This school whose Welsh name means ""high hill"" was the first women's college to offer the Ph.D.",Bryn Mawr,0,0
9294,2025-03-20,Alex DeFrank game 5.,Jeopardy,"(3, 5)","3 MEANINGS, 1 WORD",6,"(1000,)",False,"A debit,an electrical accumulation,an attack",a charge,0,0
9294,2025-03-20,Alex DeFrank game 5.,Jeopardy,"(4, 5)",TV SHOW BY GOOGLE SEARCH,9,"(1000,)",False,"""Noir TV show but with aliens"";""forgot Apple account password"";""Colin Farrell joins Blue Man Group?""",Sugar,0,0
9294,2025-03-20,Alex DeFrank game 5.,Jeopardy,"(5, 5)",LET'S ROLL THE DICE,1,"(1000,)",False,"A Chinese game combines with a Vegas one in this 3-word casino game, but the added joker can be an ace & dice are often involved",pai gow poker,0,0
9294,2025-03-20,Alex DeFrank game 5.,Jeopardy,"(6, 5)",YANGTZE!,18,"(1000,)",False,3 Yangtze river cities merged to form this city known for its metallurgy industry & as COVID-19's epicenter,Wuhan,0,0
9294,2025-03-20,Alex DeFrank game 5.,Double Jeopardy,"(1, 1)",ART OF THE STATE,8,"(400,)",False,"Seal skin was one of many media of George Ahgupuk, a famed artist from this state",Alaska,0,0
9294,2025-03-20,Alex DeFrank game 5.,Double Jeopardy,"(2, 1)",THE 1300s,13,"(400,)",False,Culture in China flourished under this dynasty that began ruling in 1368,the Ming,0,0
9294,2025-03-20,Alex DeFrank game 5.,Double Jeopardy,"(3, 1)",ANCIENT GREEK THEATER,18,"(400,)",False,"As well as letting one actor play multiple parts, these projected the voice like a megaphone",the mask,0,0
9294,2025-03-20,Alex DeFrank game 5.,Double Jeopardy,"(4, 1)",THE SONG OF ROLAND DRUM MACHINES,15,"(400,)",False,"This group was joined by their friend Roland on a 2000 No. 1 hit in which they tell a lover to ""Say My Name""",Destiny's Child,0,0
9294,2025-03-20,Alex DeFrank game 5.,Double Jeopardy,"(5, 1)",PLANT LORE,25,"(400,)",False,"Paired with ""jolly"" in the U.S., this plant was called Christmas in parts of England & used as a Christmas tree",holly,0,0
9294,2025-03-20,Alex DeFrank game 5.,Double Jeopardy,"(6, 1)",____ OF THE ____,30,"(400,)",False,"In the rom-com ""Leap Year"", Amy Adams seeks love in Ireland & we get to hear this movie-traditional Irish greeting",top of the morning,0,0
9294,2025-03-20,Alex DeFrank game 5.,Double Jeopardy,"(1, 2)",ART OF THE STATE,7,"(800,)",False,"Who else but this artist would give us the oil-on-canvas ""Bear Lake, New Mexico, 1930""",Georgia O'Keeffe,0,0
9294,2025-03-20,Alex DeFrank game 5.,Double Jeopardy,"(2, 2)",THE 1300s,12,"(800,)",False,In 1314 this king won a great Scottish victory over the English in the Battle of Bannockburn,Robert the Bruce,0,0
9294,2025-03-20,Alex DeFrank game 5.,Double Jeopardy,"(3, 2)",ANCIENT GREEK THEATER,20,"(800,)",False,"In Euripides' drama about this title woman, a phantom version is abducted to Troy while the real one stays in Egypt",Helen,0,0
9294,2025-03-20,Alex DeFrank game 5.,Double Jeopardy,"(4, 2)",THE SONG OF ROLAND DRUM MACHINES,14,"(800,)",False,"A Roland beat is heard on ""One More Night"" by this singer who first gained pop fame as a human drummer",Phil Collins,0,0
9294,2025-03-20,Alex DeFrank game 5.,Double Jeopardy,"(5, 2)",PLANT LORE,28,"(800,)",False,"Popular in wedding bouquets, white lilies are also known as these lilies, another name for the Virgin Mary",Madonna lilies,0,0
9294,2025-03-20,Alex DeFrank game 5.,Double Jeopardy,"(6, 2)",____ OF THE ____,29,"(4000,)",True,"When it comes to certain acts such as arson, there's some truth to the cliché about guilty folks returning to here",the scene of the crime,0,0
9294,2025-03-20,Alex DeFrank game 5.,Double Jeopardy,"(1, 3)",ART OF THE STATE,6,"(1200,)",False,In 2008 this Saturday Evening Post icon became Massachusetts' official state artist,Norman Rockwell,0,0
9294,2025-03-20,Alex DeFrank game 5.,Double Jeopardy,"(2, 3)",THE 1300s,3,"(1200,)",False,"Call her Hedwig or call her Jadwiga, she was only a child when she became queen of this country in 1384",Poland,0,0
9294,2025-03-20,Alex DeFrank game 5.,Double Jeopardy,"(3, 3)",ANCIENT GREEK THEATER,19,"(2500,)",True,"As part of a play, the parodos was the song recited or sung as this group of commentators made its entrance",the chorus,0,0
9294,2025-03-20,Alex DeFrank game 5.,Double Jeopardy,"(4, 3)",THE SONG OF ROLAND DRUM MACHINES,11,"(1200,)",False,"The title of his album ""808s & Heartbreak"" refers to the death of his mother Donda, & to the Roland TR-808 used on the songs",Kanye West,0,0
9294,2025-03-20,Alex DeFrank game 5.,Double Jeopardy,"(5, 3)",PLANT LORE,24,"(1200,)",False,Blow on the seeds of this plant to make a wish; pick its flowers on St. George's Day to make its wine,dandelion,0,0
9294,2025-03-20,Alex DeFrank game 5.,Double Jeopardy,"(6, 3)",____ OF THE ____,23,"(1200,)",False,"From their garb, the minister, priest & rabbi who walk into a bar could each be called this",men of the cloth,0,0
9294,2025-03-20,Alex DeFrank game 5.,Double Jeopardy,"(1, 4)",ART OF THE STATE,5,"(1600,)",False,"""Pennsylvania Landscape"", or ""Lafayette's Headquarters"", is by this artist who passed away in Chadds Ford in 2009",Andrew Wyeth,0,0
9294,2025-03-20,Alex DeFrank game 5.,Double Jeopardy,"(2, 4)",THE 1300s,2,"(1600,)",False,"He wrote more than 300 Italian sonnets to a woman named Laura, though Laura may not have existed",Petrarch,0,0
9294,2025-03-20,Alex DeFrank game 5.,Double Jeopardy,"(3, 4)",ANCIENT GREEK THEATER,17,"(1600,)",False,"The unscrupulous Athenian politician Cleon was satirized as a manipulative slave in ""Knights"" by this comedic playwright",Aristophanes,0,0
9294,2025-03-20,Alex DeFrank game 5.,Double Jeopardy,"(4, 4)",THE SONG OF ROLAND DRUM MACHINES,10,"(1600,)",False,"Echo in this band's name was their drum machine, but Echo was retired in favor of machines including a Roland TR-66",Echo & the Bunnymen,0,0
9294,2025-03-20,Alex DeFrank game 5.,Double Jeopardy,"(5, 4)",PLANT LORE,26,"(1600,)",False,"On Pentecost, rose petals are dropped through the oculus of this storied Roman building",the Pantheon,0,0
9294,2025-03-20,Alex DeFrank game 5.,Double Jeopardy,"(6, 4)",____ OF THE ____,22,"(1600,)",False,Plural phrase for the real mastermind of a plan or action,brains of the operation,0,0
9294,2025-03-20,Alex DeFrank game 5.,Double Jeopardy,"(1, 5)",ART OF THE STATE,4,"(2000,)",False,"Appropriately, Thomas Hart Benton's mural depicting the history of this state can be found in its capitol building",Missouri,0,0
9294,2025-03-20,Alex DeFrank game 5.,Double Jeopardy,"(2, 5)",THE 1300s,1,"(2000,)",False,In 1381 he led a peasants' revolt in England over heavy taxation of the poorer classes,Wat Tyler,0,0
9294,2025-03-20,Alex DeFrank game 5.,Double Jeopardy,"(3, 5)",ANCIENT GREEK THEATER,16,"(2000,)",False,"In ""Eumenides"", the goddess Athena casts the deciding vote for this man's acquittal after he kills his mother",Orestes,0,0
9294,2025-03-20,Alex DeFrank game 5.,Double Jeopardy,"(4, 5)",THE SONG OF ROLAND DRUM MACHINES,9,"(2000,)",False,There's a Roland on this classic LL Cool J track whose album version doesn't include any of the ringing its title suggests,"""Rock The Bells""",0,0
9294,2025-03-20,Alex DeFrank game 5.,Double Jeopardy,"(5, 5)",PLANT LORE,27,"(2000,)",False,"Berries from this tree were once used as medicine by the Greeks & Romans, but we are more familiar with their use in gin",juniper,0,0
9294,2025-03-20,Alex DeFrank game 5.,Double Jeopardy,"(6, 5)",____ OF THE ____,21,"(2000,)",False,"Shown here, it's a song title by The Replacements & shorthand for independent & college radio","""Left Of The Dial""",0,0
9294,2025-03-20,Alex DeFrank game 5.,Final Jeopardy,"(1, 1)",U.S. CITIES,0,(),False,"Named for a 1775 battle, this city contains the graves of John Breckinridge & Henry Clay","Lexington, Kentucky",0,0
