epNum,airDate,extra_info,round_name,coord,category,order,value,daily_double,question,answer,correctAttempts,wrongAttempts
971,1988-11-21,,Jeopardy,"(1, 1)",POETRY,14,"(100,)",False,"Robert Browning ended ""Pippa's Song"" with ""God's in his heaven--all's right with"" this",the world,1,0
971,1988-11-21,,Jeopardy,"(2, 1)",FAMOUS WOMEN,2,"(100,)",False,"She escaped Nazi Germany, fought for Israeli independence & found fame as a therapist on TV",(Dr.) Ruth Westheimer,1,0
971,1988-11-21,,Jeopardy,"(3, 1)",SPORTS,26,"(100,)",False,A Harvard study indicates this alley sport burns more calories than rowing or tennis,bowling,1,0
971,1988-11-21,,Jeopardy,"(4, 1)",DOUBLE LETTERS,17,"(100,)",False,"Surname of singers Dorothy, Judy & Phil",Collins,1,0
971,1988-11-21,,Jeopardy,"(5, 1)",THE FUNNIES,1,"(100,)",False,Last name of American comic strip artist Al or British comic strip character Andy,Capp,1,0
971,1988-11-21,,Jeopardy,"(6, 1)",MARS,7,"(100,)",False,"Though its probe sent back info for only 20 sec., this country achieved the 1st soft landing on Mars",Soviet Union,1,0
971,1988-11-21,,Jeopardy,"(1, 2)",POETRY,15,"(200,)",False,"It's to whom Vachel Lindsay referred in the poem ""Bryan, Bryan, Bryan, Bryan""",William Jennings Bryan,1,0
971,1988-11-21,,Jeopardy,"(2, 2)",FAMOUS WOMEN,9,"(200,)",False,Maria Callas wasn't born in Greece but in this American city where she often came to sing,New York,1,0
971,1988-11-21,,Jeopardy,"(3, 2)",SPORTS,27,"(200,)",False,"""Mr. October"", he said, ""The only reason I don't like playing in the World Series is I can't watch myself play""",Reggie Jackson,1,0
971,1988-11-21,,Jeopardy,"(4, 2)",DOUBLE LETTERS,18,"(200,)",False,"It's the only name of a Zodiac sign with double letters, as any straight arrow will tell you",Sagittarius,1,0
971,1988-11-21,,Jeopardy,"(5, 2)",THE FUNNIES,3,"(200,)",False,"1938's ""Best Actor"" Oscar was mistakenly engraved to this comic strip cop instead of Spencer Tracy",Dick Tracy,1,0
971,1988-11-21,,Jeopardy,"(6, 2)",MARS,8,"(200,)",False,In 1908 astronomer Percival Lowell claimed these were built by an advanced civilization,canals,1,0
971,1988-11-21,,Jeopardy,"(1, 3)",POETRY,20,"(300,)",False,"Completes the title of the work by Thomas Gray, Elegy Written in a Country...""",Churchyard,1,0
971,1988-11-21,,Jeopardy,"(2, 3)",FAMOUS WOMEN,10,"(300,)",False,She played on a championship high school basketball team before becoming a senator from Maine,Margaret Chase Smith,1,0
971,1988-11-21,,Jeopardy,"(3, 3)",SPORTS,28,"(300,)",False,"If a polo game is tied at the end of regulation play, the match is decided this way",sudden death overtime,0,3
971,1988-11-21,,Jeopardy,"(4, 3)",DOUBLE LETTERS,19,"(300,)",False,Legal relationship of a tenant to his landlord,lessee,1,0
971,1988-11-21,,Jeopardy,"(5, 3)",THE FUNNIES,4,"(500,)",True,This strip by Harold R. Foster took place in the days of King Arthur,Prince Valiant,1,0
971,1988-11-21,,Jeopardy,"(6, 3)",MARS,11,"(300,)",False,"One of these on Mars, the Olympus Mons, is 100 times as big as the largest one on Hawaii",volcano,1,0
971,1988-11-21,,Jeopardy,"(1, 4)",POETRY,21,"(400,)",False,"Longfellow peom which begins ""This is the forest primeval""",Evangeline,1,0
971,1988-11-21,,Jeopardy,"(2, 4)",FAMOUS WOMEN,13,"(400,)",False,"She married John Macy, the critic who helped edit Helen Keller's autobiography",Anne Sullivan,1,0
971,1988-11-21,,Jeopardy,"(3, 4)",SPORTS,29,"(400,)",False,The 1st NFL championship game on network TV was between the L.A. Rams & this Ohio team in 1951,Cleveland Browns,1,0
971,1988-11-21,,Jeopardy,"(4, 4)",DOUBLE LETTERS,24,"(400,)",False,"While it's 1 of the 3 primary colors of light, it's not 1 of the 3 primary colors of paint",green,1,1
971,1988-11-21,,Jeopardy,"(5, 4)",THE FUNNIES,5,"(400,)",False,Snuffy Smith used to share title billing with this character,Barney Google,1,0
971,1988-11-21,,Jeopardy,"(6, 4)",MARS,12,"(400,)",False,Mars' satellites Deimos & Phobos are named after the sons of this Greek god of war,Ares,1,0
971,1988-11-21,,Jeopardy,"(1, 5)",POETRY,22,"(500,)",False,"Pope poem with the lines, ""Plague on't! Tis past a jest – nay prithee, pox! Give her the hair""",The Rape of the Lock,1,0
971,1988-11-21,,Jeopardy,"(2, 5)",FAMOUS WOMEN,23,"(500,)",False,Franz Liszt's daughter Cosima married this composer & helped develop the Bayreuth Festival,Richard Wagner,1,0
971,1988-11-21,,Jeopardy,"(3, 5)",SPORTS,30,"(500,)",False,"The defensemen in this popular sport are called the ""backline""",hockey,1,0
971,1988-11-21,,Jeopardy,"(4, 5)",DOUBLE LETTERS,25,"(500,)",False,"Double talk, or a flashy action intended to deceive, it's probably an alteration of razzle dazzle",razzmatazz,1,0
971,1988-11-21,,Jeopardy,"(5, 5)",THE FUNNIES,6,"(500,)",False,Hard-boiled mystery writer who supplied scripts for the Secret Agent X-9 strip,Dashiell Hammett,1,1
971,1988-11-21,,Jeopardy,"(6, 5)",MARS,16,"(500,)",False,It's now believed they're made up of frozen carbon dioxide & water,ice caps,1,0
971,1988-11-21,,Double Jeopardy,"(1, 1)",THE 1940s,16,"(200,)",False,"On Feb. 1, 1941 the Japanese announced this food would be rationed, a major blow to the Diet's diet",rice,1,0
971,1988-11-21,,Double Jeopardy,"(2, 1)",WORLD TRAVEL,1,"(200,)",False,"As a bonus, Delta, United & Continental tripled this for some frequent flyers in 1988",mileage,1,0
971,1988-11-21,,Double Jeopardy,"(3, 1)",PRESIDENTIAL TRIVIA,21,"(200,)",False,"Though Nixon & Hoover were not close friends, they were both ""Friends"" of this religion",Quakers,1,0
971,1988-11-21,,Double Jeopardy,"(4, 1)",BUSINESS & INDUSTRY,26,"(200,)",False,"Though his name was the ""G"" in MGM, he was never part of that company",Goldwyn,1,0
971,1988-11-21,,Double Jeopardy,"(5, 1)",COMPOSERS,5,"(200,)",False,Handel premiered this religious oratorio at a music hall in Dublin in 1742,Messiah,1,0
971,1988-11-21,,Double Jeopardy,"(6, 1)",ANIMALS,3,"(200,)",False,"That hole in your sweater was made by the larvae, not the adult of this insect",moth,1,0
971,1988-11-21,,Double Jeopardy,"(1, 2)",THE 1940s,17,"(400,)",False,"The International War Crimes Tribunal began hearings in this city November 20, 1945",Nuremberg,1,0
971,1988-11-21,,Double Jeopardy,"(2, 2)",WORLD TRAVEL,2,"(400,)",False,The oldest museum in Bombay & one of the largest in London share the name of this royal pair,Victoria and Albert,1,0
971,1988-11-21,,Double Jeopardy,"(3, 2)",PRESIDENTIAL TRIVIA,22,"(2000,)",True,This state passed a law against body snatching after an 1876 attempt to steal Lincoln's,Illinois,1,0
971,1988-11-21,,Double Jeopardy,"(4, 2)",BUSINESS & INDUSTRY,27,"(400,)",False,This type of stock gets priority in receiving dividends but often lacks voting rights,preferred stock,0,3
971,1988-11-21,,Double Jeopardy,"(5, 2)",COMPOSERS,6,"(400,)",False,"He called his own ""Firebird"" an ""audience lollipop""",Stravinsky,1,0
971,1988-11-21,,Double Jeopardy,"(6, 2)",ANIMALS,12,"(400,)",False,"Animal tamers can trust lions & tigers in ways they can't trust this big cat, ""Panthera pardus""",panther (leopard),1,0
971,1988-11-21,,Double Jeopardy,"(1, 3)",THE 1940s,18,"(600,)",False,"On June 14, 1940 German troops entered this foreign capital",Paris,1,0
971,1988-11-21,,Double Jeopardy,"(2, 3)",WORLD TRAVEL,4,"(600,)",False,"Traveling from Norway to the Netherlands, you'll want to exchange your kroner into these",guilders,1,0
971,1988-11-21,,Double Jeopardy,"(3, 3)",PRESIDENTIAL TRIVIA,23,"(600,)",False,"Greatly interested in agriculture, this Virginia president once invented a plow",Thomas Jefferson,1,0
971,1988-11-21,,Double Jeopardy,"(4, 3)",BUSINESS & INDUSTRY,28,"(600,)",False,48 of the 50 states provide unemployment compensation for a maximum duration of this many weeks,26,0,3
971,1988-11-21,,Double Jeopardy,"(5, 3)",COMPOSERS,7,"(600,)",False,"""I shall hear in heaven"", this composer said, but he died in 1827 saying, ""Too bad! Too bad! It's too late!""",Beethoven,1,0
971,1988-11-21,,Double Jeopardy,"(6, 3)",ANIMALS,13,"(600,)",False,These nocturnal animals form the 2nd largest order of mammals,bats,0,3
971,1988-11-21,,Double Jeopardy,"(1, 4)",THE 1940s,19,"(800,)",False,Country in which Leon Trotsky was assassinated,Mexico,1,0
971,1988-11-21,,Double Jeopardy,"(2, 4)",WORLD TRAVEL,10,"(2000,)",True,"Frommer's has no separate ""dollarwise"" guide to Liechtenstein; they combine it with this country",Switzerland,0,1
971,1988-11-21,,Double Jeopardy,"(3, 4)",PRESIDENTIAL TRIVIA,24,"(800,)",False,"1st pres. to use make-up for TV, his actor friend Robert Montgomery survised its application",Dwight David Eisenhower,0,3
971,1988-11-21,,Double Jeopardy,"(5, 4)",COMPOSERS,8,"(800,)",False,"In 1918 Rachmaninoff moved to this country, which became his home for the rest of his life",United States,1,0
971,1988-11-21,,Double Jeopardy,"(6, 4)",ANIMALS,14,"(800,)",False,"Usually nocturnal, these freshwater crustaceans resemble small lobsters",crawdads (crayfish),1,0
971,1988-11-21,,Double Jeopardy,"(1, 5)",THE 1940s,20,"(1000,)",False,In 1949 Siam became Thailand & this country was renamed Jordan,Transjordan,0,3
971,1988-11-21,,Double Jeopardy,"(2, 5)",WORLD TRAVEL,11,"(1000,)",False,"The film ""A Room with a View"" used a view from a room in the Quisisana e Pontevecchio in this city",Florence,1,0
971,1988-11-21,,Double Jeopardy,"(3, 5)",PRESIDENTIAL TRIVIA,25,"(1000,)",False,"Getting no votes on the 1st ballot at the 1844 Democratic convention, he went on to become president",Polk,0,3
971,1988-11-21,,Double Jeopardy,"(5, 5)",COMPOSERS,9,"(1000,)",False,"""While I was writing Boris, I was Boris"", said this composer of ""Boris Godunov""",Modest Mussorgsky,1,0
971,1988-11-21,,Double Jeopardy,"(6, 5)",ANIMALS,15,"(1000,)",False,The 4 kinds of anthropoid apes,"gorillas, chimpanzees, gibbons, orangutans",0,3
971,1988-11-21,,Final Jeopardy,"(1, 1)",MUSICALS OF THE '80s,0,"(799, 4000, 1201)",False,"The hero of this Tony Award-winning ""Best Musical"" is sometimes known by a number, 24601",Les Misérables,0,3
