epNum,airDate,extra_info,round_name,coord,category,order,value,daily_double,question,answer,correctAttempts,wrongAttempts
jm_36,2024-05-20,2024 Jeopardy! Masters semifinal game 4.,Jeopardy,"(1, 1)",SHOOTING MY LITERARY SHOT,25,"(200,)",False,"He tells Buttercup, ""I have made my body strong because I thought you might be pleased""--hey now!",Westley,0,0
jm_36,2024-05-20,2024 Jeopardy! Masters semifinal game 4.,Jeopardy,"(2, 1)",THIRTYSOMETHINGS,27,"(200,)",False,In 2011 Filipino-American Bobby Murphy co-founded this app associated with ephemerality... & doggy filters,SnapChat,0,0
jm_36,2024-05-20,2024 Jeopardy! Masters semifinal game 4.,Jeopardy,"(3, 1)",RECTANGLED,28,"(200,)",False,"Also seen on fabrics, this pattern with a fishy moniker is achieved in brickwork using rectangles",herringbone,0,0
jm_36,2024-05-20,2024 Jeopardy! Masters semifinal game 4.,Jeopardy,"(4, 1)",AMERICAN IDOL ALUMS,24,"(200,)",False,"3 years after winning ""Idol"", in 2008 she was inducted into the Grand Ole Opry at age 25 by Garth Brooks",Underwood,0,0
jm_36,2024-05-20,2024 Jeopardy! Masters semifinal game 4.,Jeopardy,"(5, 1)",NAKED WITHOUT THEIR PREFIXES,30,"(200,)",False,"Sure, with ""in-"" it gets all the ink (permanently), but sans prefix this word from the Latin delere means able to be erased",delible,0,0
jm_36,2024-05-20,2024 Jeopardy! Masters semifinal game 4.,Jeopardy,"(6, 1)","""H"" TOWN",15,"(200,)",False,"Behold the star-shaped Citadel, the fourth in a series of forts on Citadel Hill in this Canadian city on the Atlantic",Halifax,0,0
jm_36,2024-05-20,2024 Jeopardy! Masters semifinal game 4.,Jeopardy,"(1, 2)",SHOOTING MY LITERARY SHOT,23,"(400,)",False,"At the end of this novel by Donna Tartt, Theo hopes to woo Pippa, but she rejects him & his gift of an expensive necklace",The Goldfinch,0,0
jm_36,2024-05-20,2024 Jeopardy! Masters semifinal game 4.,Jeopardy,"(2, 2)",THIRTYSOMETHINGS,26,"(400,)",False,In 2024 Jess Hilarious joined this radio show with Charlamagne tha God & DJ Envy,The Breakfast Club,0,0
jm_36,2024-05-20,2024 Jeopardy! Masters semifinal game 4.,Jeopardy,"(3, 2)",RECTANGLED,10,"(400,)",False,"On a map these 2 neighboring states, the 38th & 44th, look almost like perfect rectangles",Colorado & Wyoming,0,0
jm_36,2024-05-20,2024 Jeopardy! Masters semifinal game 4.,Jeopardy,"(4, 2)",AMERICAN IDOL ALUMS,8,"(400,)",False,"Apparently very into singing contests, this ""Idol"" winner & talk TV fixture began coaching up new hopefuls on ""The Voice"" in 2018",Kelly Clarkson,0,0
jm_36,2024-05-20,2024 Jeopardy! Masters semifinal game 4.,Jeopardy,"(5, 2)",NAKED WITHOUT THEIR PREFIXES,29,"(400,)",False,"More familiar with ""pro-"" or ""anti-"", this type of ""factor"" is a living organism that shapes its environment",a biotic factor,0,0
jm_36,2024-05-20,2024 Jeopardy! Masters semifinal game 4.,Jeopardy,"(6, 2)","""H"" TOWN",14,"(400,)",False,"Take an ""A"" & train it on the name of a NYC neighborhood & you'll arrive at your destination in this city in the Netherlands",Harlem,0,0
jm_36,2024-05-20,2024 Jeopardy! Masters semifinal game 4.,Jeopardy,"(1, 3)",SHOOTING MY LITERARY SHOT,22,"(600,)",False,"In this E.M. Forster work, George shoots his shot with Lucy & goes in for a big old smooch in an Italian field of blue violets",A Room with a View,0,0
jm_36,2024-05-20,2024 Jeopardy! Masters semifinal game 4.,Jeopardy,"(2, 3)",THIRTYSOMETHINGS,21,"(600,)",False,Katie Bouman was instrumental in creating the first-ever picture of this black hole at the center of our galaxy,Sagittarius A*,0,0
jm_36,2024-05-20,2024 Jeopardy! Masters semifinal game 4.,Jeopardy,"(3, 3)",RECTANGLED,9,"(600,)",False,"Using rectangles in works like ""Composition No. 1 with Red and Black"", this artist espoused what he called ""Neoplasticism""",Mondrian,0,0
jm_36,2024-05-20,2024 Jeopardy! Masters semifinal game 4.,Jeopardy,"(4, 3)",AMERICAN IDOL ALUMS,5,"(600,)",False,Adam Lambert had big shoes to fill--like the size of a certain planet--singing lead with this British band in 2012,Queen,0,0
jm_36,2024-05-20,2024 Jeopardy! Masters semifinal game 4.,Jeopardy,"(5, 3)",NAKED WITHOUT THEIR PREFIXES,20,"(600,)",False,"P.G. Wodehouse was one of the first to drop ""dis-"" & form this word meaning satisfied & contented",gruntled,0,0
jm_36,2024-05-20,2024 Jeopardy! Masters semifinal game 4.,Jeopardy,"(6, 3)","""H"" TOWN",13,"(600,)",False,Many a millennial child was sad to learn that Space Camp in this city's U.S. Space & Rocket Center didn't really end with a launch,Huntsville (Alabama),0,0
jm_36,2024-05-20,2024 Jeopardy! Masters semifinal game 4.,Jeopardy,"(1, 4)",SHOOTING MY LITERARY SHOT,3,"(800,)",False,"In this Jane Austen work, Wentworth writes a love letter to Anne Elliot while she sits just a few feet away from him",Persuasion,0,0
jm_36,2024-05-20,2024 Jeopardy! Masters semifinal game 4.,Jeopardy,"(2, 4)",THIRTYSOMETHINGS,18,"(800,)",False,In 2019 this author & chef launched the Eat.Learn.Play. Foundation in Oakland with her baller husband,Ayesha Curry,0,0
jm_36,2024-05-20,2024 Jeopardy! Masters semifinal game 4.,Jeopardy,"(3, 4)",RECTANGLED,2,"(800,)",False,"In a Gothic cathedral, these 2 long rectangles intersect to form the arms of a cross",the nave & the transept,0,0
jm_36,2024-05-20,2024 Jeopardy! Masters semifinal game 4.,Jeopardy,"(4, 4)",AMERICAN IDOL ALUMS,7,"(800,)",False,"This powerhouse singer became the 17th person to claim EGOT status (but inexplicably, can't claim an ""Idol"" win)",Jennifer Hudson,0,0
jm_36,2024-05-20,2024 Jeopardy! Masters semifinal game 4.,Jeopardy,"(5, 4)",NAKED WITHOUT THEIR PREFIXES,19,"(800,)",False,"It may be obsolete, but even without ""re-"", this word with ""qu"" in the middle means to give something up, like a boxer with a title",linquish,0,0
jm_36,2024-05-20,2024 Jeopardy! Masters semifinal game 4.,Jeopardy,"(6, 4)","""H"" TOWN",12,"(800,)",False,Mount Wellington towers over this city in Australia's smallest state,Hobart (Tasmania),0,0
jm_36,2024-05-20,2024 Jeopardy! Masters semifinal game 4.,Jeopardy,"(1, 5)",SHOOTING MY LITERARY SHOT,4,"(1000,)",False,"The Lothario M. Boulanger woos this wife of a country doctor by talking of ""dreams, presentiments, magnetism""",Bovary,0,0
jm_36,2024-05-20,2024 Jeopardy! Masters semifinal game 4.,Jeopardy,"(2, 5)",THIRTYSOMETHINGS,17,"(1000,)",False,"In 2020 a New York Times headline read, ""Democrats' Georgia Hopes Rest on"" this man, age 33",(Jon) Ossoff,0,0
jm_36,2024-05-20,2024 Jeopardy! Masters semifinal game 4.,Jeopardy,"(3, 5)",RECTANGLED,1,"(1000,)",False,"It's the term for a usually rectangular division in the top left corner of a flag, perhaps to hold a group of stars",the canton,0,0
jm_36,2024-05-20,2024 Jeopardy! Masters semifinal game 4.,Jeopardy,"(4, 5)",AMERICAN IDOL ALUMS,6,"(1000,)",False,"Going Van Halen-style & making his last name his band's name, he had hits with ""It's Not Over"" & ""What About Now""",Daughtry,0,0
jm_36,2024-05-20,2024 Jeopardy! Masters semifinal game 4.,Jeopardy,"(5, 5)",NAKED WITHOUT THEIR PREFIXES,16,"(1000,)",False,"Without ""non-"", a synonym for ordinary or dull becomes this archaic word meaning ""said what something looked like""",descript,0,0
jm_36,2024-05-20,2024 Jeopardy! Masters semifinal game 4.,Jeopardy,"(6, 5)","""H"" TOWN",11,"(3200,)",True,An inscription at the Rattenfangerhaus in this town describes a supposed 1284 event that reduced its population,Hamelin,0,0
jm_36,2024-05-20,2024 Jeopardy! Masters semifinal game 4.,Double Jeopardy,"(1, 1)",BIOLOGY,24,"(400,)",False,This composite organism consists of a fungus & an alga living in symbiotic association; caribou rely on them in Arctic lands,a lichen,0,0
jm_36,2024-05-20,2024 Jeopardy! Masters semifinal game 4.,Double Jeopardy,"(2, 1)",MAKE IT FLIRTY,23,"(400,)",False,Pull the last letter off a single Doc Martens to get this flirty term of endearment,boo,0,0
jm_36,2024-05-20,2024 Jeopardy! Masters semifinal game 4.,Double Jeopardy,"(3, 1)",STATUE OF LIMITATIONS,27,"(400,)",False,Some of the wee & intricate 12th century pieces for this game found on the Isle of Lewis live at the British Museum,chess,0,0
jm_36,2024-05-20,2024 Jeopardy! Masters semifinal game 4.,Double Jeopardy,"(4, 1)",BUSINESS,28,"(400,)",False,"Founded in 1859, it offers to digitize your cash management but still runs the armored trucks",Brinks,0,0
jm_36,2024-05-20,2024 Jeopardy! Masters semifinal game 4.,Double Jeopardy,"(5, 1)",PEOPLE IN AMERICAN HISTORY,29,"(400,)",False,The unusual first name of this preacher born in 1639 to the Mathers of Massachusetts was a Puritan virtue/command,Increase,0,0
jm_36,2024-05-20,2024 Jeopardy! Masters semifinal game 4.,Double Jeopardy,"(6, 1)",ACTING TEACHERS,30,"(400,)",False,"(Henry Winkler delivers the clue.)  Often called the creator of improv, Viola Spolin ran workshops for this Chicago troupe that her son co-founded; that led her to write her life's work ""Improvisation for the Theater"", which I actually have on my bookshelf",Second City,0,0
jm_36,2024-05-20,2024 Jeopardy! Masters semifinal game 4.,Double Jeopardy,"(1, 2)",BIOLOGY,14,"(800,)",False,"From Latin for ""footprints"", this adjective refers to parts of the human body that are remnants of evolutionary history",vestigial,0,0
jm_36,2024-05-20,2024 Jeopardy! Masters semifinal game 4.,Double Jeopardy,"(2, 2)",MAKE IT FLIRTY,1,"(800,)",False,"Remove an ""R"" from a deep-fried French finger food & you get this word for a flirty lady",coquette,0,0
jm_36,2024-05-20,2024 Jeopardy! Masters semifinal game 4.,Double Jeopardy,"(3, 2)",STATUE OF LIMITATIONS,25,"(800,)",False,"Tiny figures of this river animal were often buried with ancient Egyptians; the Met has an 8""-long blue one nicknamed William",a hippopotomus,0,0
jm_36,2024-05-20,2024 Jeopardy! Masters semifinal game 4.,Double Jeopardy,"(4, 2)",BUSINESS,19,"(800,)",False,Vitalik Buterin based the name of this blockchain tech on a hypothetical substance once thought to occupy all space,Ethereum,0,0
jm_36,2024-05-20,2024 Jeopardy! Masters semifinal game 4.,Double Jeopardy,"(5, 2)",PEOPLE IN AMERICAN HISTORY,16,"(14000,)",True,In 1805 a tributary of Montana's Musselshell River was named in her honor,Sacagawea,0,0
jm_36,2024-05-20,2024 Jeopardy! Masters semifinal game 4.,Double Jeopardy,"(6, 2)",ACTING TEACHERS,26,"(800,)",False,"(Henry Winkler delivers the clue.)  With students like Dustin Hoffman & Robert De Niro, this American director, actor & coach adapted his method from the legendary system created by Konstantin Stanislavski",Lee Strasberg,0,0
jm_36,2024-05-20,2024 Jeopardy! Masters semifinal game 4.,Double Jeopardy,"(1, 3)",BIOLOGY,13,"(1200,)",False,"Foodies & predators beware pufferfish, whose livers & ovaries contain one of this group of poisons that can paralyze or kill",a neurotoxin,0,0
jm_36,2024-05-20,2024 Jeopardy! Masters semifinal game 4.,Double Jeopardy,"(2, 3)",MAKE IT FLIRTY,22,"(1200,)",False,"Drop the last 2 syllables from a sub-zero number to get this, a put-down meant to pick up",neg,0,0
jm_36,2024-05-20,2024 Jeopardy! Masters semifinal game 4.,Double Jeopardy,"(3, 3)",STATUE OF LIMITATIONS,12,"(1200,)",False,"About 22 inches tall, a whimsical fountain called the Manneken-Pis is in this capital & embodies its rebellious spirit",Brussels,0,0
jm_36,2024-05-20,2024 Jeopardy! Masters semifinal game 4.,Double Jeopardy,"(4, 3)",BUSINESS,15,"(1200,)",False,In 2023 this Hong Kong-based airline offered cheap flights from mainland China to help boost turnout in an election,Cathay Pacific,0,0
jm_36,2024-05-20,2024 Jeopardy! Masters semifinal game 4.,Double Jeopardy,"(5, 3)",PEOPLE IN AMERICAN HISTORY,6,"(1200,)",False,"In 1883 she added the words ""With Key to the Scriptures"" to the title of her book ""Science and Health""",Eddy,0,0
jm_36,2024-05-20,2024 Jeopardy! Masters semifinal game 4.,Double Jeopardy,"(6, 3)",ACTING TEACHERS,21,"(1200,)",False,"(Henry Winkler delivers the clue.)  ""Think before you act"" & ""act before you think"" are integral to the practical aesthetics technique created in the early 1980s by these two men, a playwright & an actor",Mamet & Macy,0,0
jm_36,2024-05-20,2024 Jeopardy! Masters semifinal game 4.,Double Jeopardy,"(1, 4)",BIOLOGY,9,"(1600,)",False,Electroreceptors around the snout of sharks are called ampullae of this Italian name,Lorenzini,0,0
jm_36,2024-05-20,2024 Jeopardy! Masters semifinal game 4.,Double Jeopardy,"(2, 4)",MAKE IT FLIRTY,8,"(12000,)",True,The evolution of English dropped 3 letters from an imaginary creature to get this type of exotic seductress,vamp,0,0
jm_36,2024-05-20,2024 Jeopardy! Masters semifinal game 4.,Double Jeopardy,"(3, 4)",STATUE OF LIMITATIONS,7,"(1600,)",False,"Less than 5 inches tall, the prehistoric ""Venus"" is named for this Austrian place where she was found",Willendorf,0,0
jm_36,2024-05-20,2024 Jeopardy! Masters semifinal game 4.,Double Jeopardy,"(4, 4)",BUSINESS,18,"(1600,)",False,"This company that's banked on GeForce tech in the past flexed its AI muscle in recent years, increasing stock value by over 200%",Nvidia,0,0
jm_36,2024-05-20,2024 Jeopardy! Masters semifinal game 4.,Double Jeopardy,"(5, 4)",PEOPLE IN AMERICAN HISTORY,4,"(1600,)",False,In 1791 he sent Thomas Jefferson a copy of his almanac & a letter asking for better conditions for Black people,Banneker,0,0
jm_36,2024-05-20,2024 Jeopardy! Masters semifinal game 4.,Double Jeopardy,"(6, 4)",ACTING TEACHERS,5,"(1600,)",False,"(Henry Winkler delivers the clue.)  The creators of ""Barry"" base one of Gene Cousineau's acting exercises on one that I did at Yale under this great acting coach, who also instructed her students ""Don't be boring""",(Stella) Adler,0,0
jm_36,2024-05-20,2024 Jeopardy! Masters semifinal game 4.,Double Jeopardy,"(1, 5)",BIOLOGY,10,"(2000,)",False,"cancer.gov says this subunit of DNA consists of ""a nitrogen-containing base... a phosphate group & a sugar molecule""",a nucleotide,0,0
jm_36,2024-05-20,2024 Jeopardy! Masters semifinal game 4.,Double Jeopardy,"(2, 5)",MAKE IT FLIRTY,20,"(2000,)",False,Add 3 letters to the end of a musical art form & get this word for an adept flirter,operator,0,0
jm_36,2024-05-20,2024 Jeopardy! Masters semifinal game 4.,Double Jeopardy,"(3, 5)",STATUE OF LIMITATIONS,11,"(2000,)",False,"Ceramicist Edmund de Waal wrote of inheriting 264 of these tiny intricate Japanese figurines in ""The Hare with the Amber Eyes""",netsuke,0,0
jm_36,2024-05-20,2024 Jeopardy! Masters semifinal game 4.,Double Jeopardy,"(4, 5)",BUSINESS,17,"(2000,)",False,This controversial CIO of ARK Innovation ETF said she was inspired by the Holy Spirit to begin the fund,Cathie Wood,0,0
jm_36,2024-05-20,2024 Jeopardy! Masters semifinal game 4.,Double Jeopardy,"(5, 5)",PEOPLE IN AMERICAN HISTORY,3,"(2000,)",False,"In 1869 this explorer noted that the walls of the Grand Canyon were ""2,500 feet tall"" & of ""vermilion gleams & rosy hues""",Powell,0,0
jm_36,2024-05-20,2024 Jeopardy! Masters semifinal game 4.,Double Jeopardy,"(6, 5)",ACTING TEACHERS,2,"(2000,)",False,"(Henry Winkler delivers the clue.)  Spontaneous repetition was part of the technique of this acting instructor, nicknamed ""Sandy""--& remember, contestants, he said it takes 20 years to be a master",Meisner,0,0
jm_36,2024-05-20,2024 Jeopardy! Masters semifinal game 4.,Final Jeopardy,"(1, 1)",21st CENTURY LITERARY CHARACTERS,0,(),False,"The last name adopted by Damon Fields, the title character of this novel, refers to his red hair",Demon Copperhead,0,0
