epNum,airDate,extra_info,round_name,coord,category,order,value,daily_double,question,answer,correctAttempts,wrongAttempts
ncc_18,2022-02-22,2022 National College Championship final game 2.,Jeopardy,"(1, 1)",HISTORIC POTPOURRI,21,"(200,)",False,"In 1603 the warlord Tokugawa Ieyasu was awarded this title, recognizing him as ""barbarian-quelling generalissimo""",shogun,0,0
ncc_18,2022-02-22,2022 National College Championship final game 2.,Jeopardy,"(2, 1)",NUMB WITH NUMBERS,24,"(200,)",False,One half minus one sixth equals this amount when reduced to its simplest fraction,one third,0,0
ncc_18,2022-02-22,2022 National College Championship final game 2.,Jeopardy,"(3, 1)",FOOD COMBOS,29,"(200,)",False,They're the 3 flavors in Neapolitan ice cream,"vanilla, chocolate & strawberry",0,0
ncc_18,2022-02-22,2022 National College Championship final game 2.,Jeopardy,"(4, 1)","""C"" THE ANIMALS",27,"(200,)",False,The name of this bewhiskered water dweller can also mean a person who uses a fake profile on social media,a catfish,0,0
ncc_18,2022-02-22,2022 National College Championship final game 2.,Jeopardy,"(5, 1)",A DAY OF POP CULTURE,10,"(200,)",False,"From a radio he boasted on ""Industry Baby"" of having ""couple Grammys on him, couple plaques""",Lil Nas X,0,0
ncc_18,2022-02-22,2022 National College Championship final game 2.,Jeopardy,"(6, 1)",ALLITERATIVE PHRASES,30,"(200,)",False,"Ordinal term for Joe, Jill, Ashley & Hunter, though they don't all live in the White House",the First Family,0,0
ncc_18,2022-02-22,2022 National College Championship final game 2.,Jeopardy,"(1, 2)",HISTORIC POTPOURRI,15,"(400,)",False,"Seen here is a depiction of Clovis, King of the Franks, undergoing this initiation in Reims; hundreds of his men would follow suit",baptism,0,0
ncc_18,2022-02-22,2022 National College Championship final game 2.,Jeopardy,"(2, 2)",NUMB WITH NUMBERS,23,"(400,)",False,"If the legs of a right triangle are 6 inches & 8 inches, this is the length of the hypotenuse",10 inches,0,0
ncc_18,2022-02-22,2022 National College Championship final game 2.,Jeopardy,"(3, 2)",FOOD COMBOS,28,"(400,)",False,Lobster & filet mignon are often paired as this rhyming combo,surf & turf,0,0
ncc_18,2022-02-22,2022 National College Championship final game 2.,Jeopardy,"(4, 2)","""C"" THE ANIMALS",25,"(400,)",False,"Seen here, this hybrid dog breed that dates back at least 50 years is a family favorite",a cockapoo,0,0
ncc_18,2022-02-22,2022 National College Championship final game 2.,Jeopardy,"(5, 2)",A DAY OF POP CULTURE,3,"(400,)",False,Mom sent me a clip of this ABC medical drama that premiered in 2005 but is maintaining its practice in the 2021-22 TV season,Grey's Anatomy,0,0
ncc_18,2022-02-22,2022 National College Championship final game 2.,Jeopardy,"(6, 2)",ALLITERATIVE PHRASES,26,"(400,)",False,"After Selection Sunday in 2022, the first four games of this will take place in Dayton",March Madness,0,0
ncc_18,2022-02-22,2022 National College Championship final game 2.,Jeopardy,"(1, 3)",HISTORIC POTPOURRI,11,"(600,)",False,This first permanent English settlement in America was named for a king across the pond,Jamestown,0,0
ncc_18,2022-02-22,2022 National College Championship final game 2.,Jeopardy,"(2, 3)",NUMB WITH NUMBERS,7,"(600,)",False,There are this many spots total on 2 standard dice,42,0,0
ncc_18,2022-02-22,2022 National College Championship final game 2.,Jeopardy,"(3, 3)",FOOD COMBOS,22,"(600,)",False,An iconic Southern pairing is shrimp & this side dish made from ground corn & boiled,grits,0,0
ncc_18,2022-02-22,2022 National College Championship final game 2.,Jeopardy,"(4, 3)","""C"" THE ANIMALS",17,"(600,)",False,The spitting type of this can spray its venom to a distance of 6 1/2 feet,a cobra,0,0
ncc_18,2022-02-22,2022 National College Championship final game 2.,Jeopardy,"(5, 3)",A DAY OF POP CULTURE,2,"(600,)",False,My niece wanted to watch (again) her favorite movie about this superfast animated critter who got a dental makeover,Sonic the Hedgehog,0,0
ncc_18,2022-02-22,2022 National College Championship final game 2.,Jeopardy,"(6, 3)",ALLITERATIVE PHRASES,13,"(600,)",False,This crusty phrase means a meal is about to be shared,break bread,0,0
ncc_18,2022-02-22,2022 National College Championship final game 2.,Jeopardy,"(1, 4)",HISTORIC POTPOURRI,4,"(800,)",False,"His life came to an end in 1805 after being hit by enemy fire on the deck of his flagship, the HMS Victory",Horatio Nelson,0,0
ncc_18,2022-02-22,2022 National College Championship final game 2.,Jeopardy,"(2, 4)",NUMB WITH NUMBERS,6,"(800,)",False,It's the product of a baker's dozen & the classic number of hills of Rome,91 (13 × 7),0,0
ncc_18,2022-02-22,2022 National College Championship final game 2.,Jeopardy,"(3, 4)",FOOD COMBOS,14,"(800,)",False,These 2 ingredients are popularly paired on a bagel in a deli & in a Philadelphia roll at a sushi bar,salmon & cream cheese,0,0
ncc_18,2022-02-22,2022 National College Championship final game 2.,Jeopardy,"(4, 4)","""C"" THE ANIMALS",16,"(800,)",False,"Found in South America & seen here, it's the largest rodent",a capybara,0,0
ncc_18,2022-02-22,2022 National College Championship final game 2.,Jeopardy,"(5, 4)",A DAY OF POP CULTURE,1,"(800,)",False,Season 12 of this show was on at the gym & I watched Gigi Goode sashay on the runway,RuPaul's Drag Race,0,0
ncc_18,2022-02-22,2022 National College Championship final game 2.,Jeopardy,"(6, 4)",ALLITERATIVE PHRASES,12,"(800,)",False,"A songbird begins this phrase, an early warning of peril",a canary in the coalmine,0,0
ncc_18,2022-02-22,2022 National College Championship final game 2.,Jeopardy,"(1, 5)",HISTORIC POTPOURRI,5,"(1000,)",False,"Commemorating the lifting of a siege on this city, a bronze colossus was built in the harbor in the 3rd century B.C.",Rhodes,0,0
ncc_18,2022-02-22,2022 National College Championship final game 2.,Jeopardy,"(2, 5)",NUMB WITH NUMBERS,8,"(1000,)",False,"A pound & a half of coffee costs $480, so it's this much per ounce",$20 ($320/pound ÷ 16),0,0
ncc_18,2022-02-22,2022 National College Championship final game 2.,Jeopardy,"(3, 5)",FOOD COMBOS,19,"(1000,)",False,"In L.A., foodies & locals like to dine at ""Roscoe's House of"" these paired foods",Chicken & Waffles,0,0
ncc_18,2022-02-22,2022 National College Championship final game 2.,Jeopardy,"(4, 5)","""C"" THE ANIMALS",18,"(1000,)",False,This critically endangered bird with an alliterative name is the largest flying land bird of North America,a California condor,0,0
ncc_18,2022-02-22,2022 National College Championship final game 2.,Jeopardy,"(5, 5)",A DAY OF POP CULTURE,9,"(1000,)",False,"It was late but my film major roommate had to watch this Hitchcock ""you kill my dad, I kill your wife"" classic & I got sucked in",Strangers on a Train,0,0
ncc_18,2022-02-22,2022 National College Championship final game 2.,Jeopardy,"(6, 5)",ALLITERATIVE PHRASES,20,"(500,)",True,"This literary character was also known as the ""Galloping Hessian of the Hollow""",the Headless Horseman,0,0
ncc_18,2022-02-22,2022 National College Championship final game 2.,Double Jeopardy,"(1, 1)",A STATE CAPITOL IDEA,16,"(400,)",False,Rhode Island's Capitol has one of these last fired in 1863; until 1962 it was dangerously still loaded with gunpowder,a cannon,0,0
ncc_18,2022-02-22,2022 National College Championship final game 2.,Double Jeopardy,"(2, 1)",SCARY STORIES,23,"(400,)",False,"The title ghost of this Toni Morrison novel gets her name from a headstone that's missing the word ""Dearly""",Beloved,0,0
ncc_18,2022-02-22,2022 National College Championship final game 2.,Double Jeopardy,"(3, 1)",CLASSICAL MUSIC,20,"(400,)",False,In 2021 Yo-Yo Ma & Emanuel Ax released an album of Beethoven's complete works for piano & this instrument,cello,0,0
ncc_18,2022-02-22,2022 National College Championship final game 2.,Double Jeopardy,"(4, 1)",IT'S JUST ABOUT TIME,30,"(400,)",False,Playbill says this period lasts 10 to 15 minutes,intermission,0,0
ncc_18,2022-02-22,2022 National College Championship final game 2.,Double Jeopardy,"(5, 1)",DOCUMENTARY SUBJECTS,29,"(400,)",False,"""Super Size Me""; about a man who eats only at this place",McDonald's,0,0
ncc_18,2022-02-22,2022 National College Championship final game 2.,Double Jeopardy,"(6, 1)",DOUBLE TALK WORDS,28,"(400,)",False,Omnicheer sells these accessories for all your sideline fun,pompoms,0,0
ncc_18,2022-02-22,2022 National College Championship final game 2.,Double Jeopardy,"(1, 2)",A STATE CAPITOL IDEA,14,"(800,)",False,"The Northern Pacific Railroad gifted a mural, seen here in Montana's Capitol, Amédée Joullin's ""Driving"" this object",the Golden Spike,0,0
ncc_18,2022-02-22,2022 National College Championship final game 2.,Double Jeopardy,"(2, 2)",SCARY STORIES,22,"(800,)",False,"Critics have long debated the ""reality"" of the ghosts that visit 2 children in this classic Henry James novella",The Turn of the Screw,0,0
ncc_18,2022-02-22,2022 National College Championship final game 2.,Double Jeopardy,"(3, 2)",CLASSICAL MUSIC,19,"(800,)",False,"It's an arrangement performed in a slow & easy manner, like Samuel Barber's one ""for Strings""",adagio,0,0
ncc_18,2022-02-22,2022 National College Championship final game 2.,Double Jeopardy,"(4, 2)",IT'S JUST ABOUT TIME,25,"(800,)",False,The American College of Obstetrics & Gynecology applies this 2-word phrase starting at exactly 39 weeks of pregnancy,full term,0,0
ncc_18,2022-02-22,2022 National College Championship final game 2.,Double Jeopardy,"(5, 2)",DOCUMENTARY SUBJECTS,13,"(5000,)",True,"This festival comes before ""The Greatest Party That Never Happened"" in a 2019 documentary",Fyre Fest,0,0
ncc_18,2022-02-22,2022 National College Championship final game 2.,Double Jeopardy,"(6, 2)",DOUBLE TALK WORDS,1,"(800,)",False,In this Pixar film young Miguel idolizes movie star/singer Ernesto de la Cruz,Coco,0,0
ncc_18,2022-02-22,2022 National College Championship final game 2.,Double Jeopardy,"(1, 3)",A STATE CAPITOL IDEA,4,"(5000,)",True,"Utah's Capitol is abuzz with 2 large sculptures of these structures, symbolizing the hard work done by the state's citizens",beehives,0,0
ncc_18,2022-02-22,2022 National College Championship final game 2.,Double Jeopardy,"(2, 3)",SCARY STORIES,21,"(1200,)",False,"A dead girl observes her family, friends & killer in this 2002 bestseller by Alice Sebold, later a movie",The Lovely Bones,0,0
ncc_18,2022-02-22,2022 National College Championship final game 2.,Double Jeopardy,"(3, 3)",CLASSICAL MUSIC,18,"(1200,)",False,"Composed in the 1700s, ""The Four Seasons"" concertos by this composer are meant to convey different times of the year",Vivaldi,0,0
ncc_18,2022-02-22,2022 National College Championship final game 2.,Double Jeopardy,"(4, 3)",IT'S JUST ABOUT TIME,24,"(1200,)",False,"Often a dubious purchase, it gives you peace of mind for a longer time & is also called a service contract",an extended warranty,0,0
ncc_18,2022-02-22,2022 National College Championship final game 2.,Double Jeopardy,"(5, 3)",DOCUMENTARY SUBJECTS,11,"(1200,)",False,"""They Shall Not Grow Old""; Peter Jackson documents this early 20th century event",World War I,0,0
ncc_18,2022-02-22,2022 National College Championship final game 2.,Double Jeopardy,"(6, 3)",DOUBLE TALK WORDS,27,"(1200,)",False,A North African dish of semolina,couscous,0,0
ncc_18,2022-02-22,2022 National College Championship final game 2.,Double Jeopardy,"(1, 4)",A STATE CAPITOL IDEA,3,"(1600,)",False,Kansas' Capitol displays the sword of this abolitionist who was executed in 1859,John Brown,0,0
ncc_18,2022-02-22,2022 National College Championship final game 2.,Double Jeopardy,"(2, 4)",SCARY STORIES,5,"(1600,)",False,"In a classic tale by M.R. James, a man is cursed when he's given a slip of paper written with these Old Nordic letters",runes,0,0
ncc_18,2022-02-22,2022 National College Championship final game 2.,Double Jeopardy,"(3, 4)",CLASSICAL MUSIC,17,"(1600,)",False,"The ballet ""The Rite of Spring"" features music by this composer & at its premiere in 1913 had choreography by Nijinsky",Stravinsky,0,0
ncc_18,2022-02-22,2022 National College Championship final game 2.,Double Jeopardy,"(4, 4)",IT'S JUST ABOUT TIME,15,"(1600,)",False,Coal was not a dying industry in this part of the Carboniferous Period that succeeded the Mississippian 323 mil. years ago,the Pennsylvanian,0,0
ncc_18,2022-02-22,2022 National College Championship final game 2.,Double Jeopardy,"(5, 4)",DOCUMENTARY SUBJECTS,12,"(1600,)",False,"""Exit Through the Gift Shop""; directed by & about this enigmatic street artist",Banksy,0,0
ncc_18,2022-02-22,2022 National College Championship final game 2.,Double Jeopardy,"(6, 4)",DOUBLE TALK WORDS,9,"(1600,)",False,This abnormal heart sound is caused by turbulent blood flow within the heart,a murmur,0,0
ncc_18,2022-02-22,2022 National College Championship final game 2.,Double Jeopardy,"(1, 5)",A STATE CAPITOL IDEA,2,"(2000,)",False,"The Capitol in this northern city lacks a dome, big grounds & any road to get there; you can hit the sea & use the marine highway",Juneau,0,0
ncc_18,2022-02-22,2022 National College Championship final game 2.,Double Jeopardy,"(2, 5)",SCARY STORIES,6,"(2000,)",False,"The Winchester Mystery House in California was one of her inspirations for ""The Haunting of Hill House""",Shirley Jackson,0,0
ncc_18,2022-02-22,2022 National College Championship final game 2.,Double Jeopardy,"(3, 5)",CLASSICAL MUSIC,10,"(2000,)",False,"Born in 1833, he's known for an 1860s ""Lullaby""",Brahms,0,0
ncc_18,2022-02-22,2022 National College Championship final game 2.,Double Jeopardy,"(4, 5)",IT'S JUST ABOUT TIME,8,"(2000,)",False,"One reason they eat so late in Spain is they're on Central European time, an hour ahead of the more logical GMT, short for this",Greenwich Mean Time,0,0
ncc_18,2022-02-22,2022 National College Championship final game 2.,Double Jeopardy,"(5, 5)",DOCUMENTARY SUBJECTS,7,"(2000,)",False,"""Citizenfour""; about this infamous whistleblower, now a resident of Russia",(Edward) Snowden,0,0
ncc_18,2022-02-22,2022 National College Championship final game 2.,Double Jeopardy,"(6, 5)",DOUBLE TALK WORDS,26,"(2000,)",False,This type of fly seen here can cause a potentially fatal sleeping sickness,tsetse,0,0
ncc_18,2022-02-22,2022 National College Championship final game 2.,Final Jeopardy,"(1, 1)",THE 19th CENTURY,0,(),False,An 1873 book title gave us this phrase for the period in the late 1800s of growth & prosperity & also greed & corruption,the Gilded Age,0,0
